Topic Number,제목
1,코로나와의 싸움 드디어 시작됐다 각국 앞다퉈 확보한 백신 접종 대상 방법은
1,폭염 대처법 일사병 땐 물 마시고 열사병 땐 물 뿌려라
1,fda 위원회 화이자 부스터샷 반대 부작용 효능 대비 실익 커
1,신규 확진 사흘 연속 500명대 접종 간격 조절해 대상 늘려
1,주스를 약으로 속여 열흘새 노인들 돈 1억 4천만 챙겨
1,뇌졸증 환자 뚱뚱할 수록 재활능력 높아 밝혀진 비만의 역설
1,10월이 적기 독감 주사 3가  4가 무엇을 맞아야 할까
1,코로나19 확진 10대 아동 첫 사망 확진자 5만명 돌파
1,전남서도 독감백신 접종 90대 노인 숨져 총 9명 사망
1,돈 내놔 은행 털다 붙잡힌 78세 할머니 전과 봤더니
2,아들 첩 중매를 사표 수리를  편지 속 조선 사대부들의 생생 토크
2,중국 베이징 이틀 연속 스모그 기승 심각 어린이 노인 외출 줄여야
2,류마티스 관절염 환자의 2040에서 골다공증성 골절 발생 골다공증 치료 필요
2,우크라 전쟁 투입도 않았는데 벌써 8명 죽었다 러 징집병에 무슨일이
2,고령층 부스터샷 6개월4개월 파격 결정 신중 정은경의 달라진 모습뉴스원샷
2,코로나19 백신 대응 추진단 출범 범부처 조직으로 접종 준비
2,일자리 예산 86조로 작년보다 3조 늘려 근로자 45만명 고용유지지원금
2,먹으면 치매 예방된다 미국 노인 10년 추적 해보니
2,인공지능으로 치매 노인 장애인 안전 보행 시스템 개발
2,삼성서울병원 메르스 의사 나와 메르스 구멍 다시 확인
3,아동 독감 유행 718세 외래환자 10명 중 1명꼴 전염 주의 요망
3,원로 평론가 유종호 노인 젊은 세대 대화 되는 건 당연
3,코로나19로 외부활동 감소에 예방접종률 질본 안전한 예방접종 지속 실시 요청
3,계속되는 폭염 온열질환 사망자 16명 질환자 1800명 집계 최다
3,올해 온열질환 사망자 16명 역대 최고치 젊은층 실내에서도 발생
3,상온 노출 독감 접종 후 이상반응 2059건 불안감 영향
3,미국 캐나다도 백신 접종 시작 바이든 맞을지 조율 중
3,초중고 독감 환자 역대 최대 조기 방학 약값 지원
3,스페인 독감과 암 이겨낸  102세 할머니 코로나도 완치
3,8200명 사망한 미국 독감보다 신종 코로나에 긴장하는 이유
4,비서 성폭력 김준기 전 동부 회장 78세 노인 마지막 기회 달라
4,속보 당국 오늘 중 백신 1차 접종자 300만명 넘을 듯
4,최근 4년간 무연고 사망자 57 증가 고독사 대책 마련 시급
4,신체보호대 안전 대책 간호 인력 확보 없이는 탁상공론 우려
4,파우치 델타 확산해도 전면 통제 없다  신규확진 20만명 임박
4,56번 환자 29번 환자와 종로노인복지관서 식사 연관성 확인 중
4,78세 할머니 은행 털다 덜미 겁 먹지 말고 돈내놔
4,서 한국산 팽이버섯 먹고 4명 사망 임산부는 유산까지
4,사설고위험 시설 방역부터 보강해 가을 겨울 대유행 대비하라
4,교회 집회 확진 비중 35  65는 어디서 감염됐을까
5,내 머릿속의 지우개 치매 엽산이 예방에 효과적 단 합성은 부작용 우려
5,지카 환자 첫 발생성관계로 빨리 전염 감염 달 뒤에도 정액에 남아
5,화이자 백신 맞고 노인 33명 사망 노르웨이 직접적 연관 없다
5,29번 환자 들렀던 종로구 노인회관 폐쇄 감염 관련성 조사
5,당분간 오존 농도 높다  오후 3시 바깥 활동 주의
5,성남시 홍반장 달려갑니다 장애 질병 1인 가구 생활지원 서비스
5,백신 점종 앞둔 수도권 요양병원 보건소 긴장 속 점검
5,2월 중순 jj 얀센 3월 아스트라제네카 백신 승인 전망
5,이스라엘서 백신 접종 후 노인 사망 만성적 합병증 앓아
5,망사마스크 금지 안내문에 조국 사진 쓴 병원 누군지 몰랐다
6,서중석의 법의학 이야기침묵 속의 진실을 찾아서14부패 심하면 질병 손상 확인 못해 강진 여고생도 사인 못 밝혀
6,health 호흡기질환 중 사망률 가장 높다는 폐렴합병증땐 치명적 노인 백신접종 필수
6,황사철 행동 요령 노인 어린이 외출 자제 하루 8잔 수분섭취
6,구미서 화이자 접종 노인 2명 이상반응 의심 증상 1명은 의식불명
6,구미서 화이자 백신 접종 노인 2명 이상반응 의심 증세
6,어린이 메르스 감염 위험 적어 무증상 완쾌가 대다수
6,만성 b형간염 c형간염 환자 영구적으로 헌혈 못 한다
6,미 fda 화이자 모더나 추가접종 성인 전체로 확대
6,내일 최소 5266명 az 백신 맞는다 동의율 937
6,백신 맞으면 되는데 사망원인 5위 폐렴 급증
7,아동 독감 유행 외래 환자 10명 중 1명꼴 일주일 전보다 121명 많아
7,메르스 10대 환자 아버지도 확진 판정 보건당국 메르스 10대환자 외부접촉 없었다
7,세계 미국 2년 만에 독감 기승 조짐 어린이 2명 사망
7,고학력 능력 찾기 어려워 출산모 4명 중 1명꼴 동거녀
7,홍콩 대만에 인플루엔자 유행 중 여행 시 마스크 써야
7,작년 농가소득 4000만원 첫 돌파 쌀값 안정ai 선방 덕분
7,눈 통해 뇌질환까지 찾는다 스마트 인공수정체 기술 개발 성공
7,감염자 많으니 2차 유행 극복 스웨덴 집단면역 코로나 출구될까
7,무섭게 번지는 수도권 감염 당국 대구경북 준하는 대책 마련
7,2분기 접종할 30세 미만 64만명 az 대체할 백신이 없다
8,트럼프 미국 대통령 물리적 거리두기 한달 연장 6월 1일쯤 회복기 접어들
8,독감 감기 구분법 독감은 일반 감기와는 원인균과 병의 경과가 달라
8,완치 후 재확진 65명 20대 가장 많다   7명중 1명 재확진
8,안승남 구리시장 트윈데믹 대응 시민 독감예방 접종 검토 지시
8,5일부터 1617세 접종 예약 임신부 접종 이득 커
8,백신 어제 맞고 오늘  80대 치매환자 중복 접종
8,월드 브리핑 필리핀  시노백 백신 의료진은 접종 안해
8,독감과 감기는 질병 독감 감기 구별법 증상으로 확인해보자
8,장기요양기관 내 cctv 설치 의무화 미설치시 300만원 벌금
8,허리디스크 초기에 잡지 못하면 심각한 증상 유발할 있어
9,기차 타고 캐나다 대륙 횡단 쉼없이 펼쳐지는 신의 정원 나흘이 훌쩍 지났다
9,10년 절개 현실판 춘향 황제도 칭송한 효자 사람으로 빛난 천년 홍주
9,정부 새 마스크 없으면 오염 덜 된 마스크 재사용해도 돼
9,질병관리본부 하반기 야생 진드기 감염병 늘 듯 주의 요망
9,약품 금지 쌀은 10포대만 4만 명 우롱한 미얀마 휴전
9,중대재해처벌법 경제계노동계 반발  책임자 범위 모호  과로사 질환 뺐나
9,백신 1차 접종 100만명 눈앞 사망의심 4건 인과성 조사
9,폐렴 환자 계속 증가 가능성 홍콩 의심환자 거리활보
9,대만서 az 백신 접종 7일만에 119명 돌연사 접수
9,봉쇄 푸는 중국에 전문가 치명적 감염 물결 올
10,메르스 3차 유행 비상 138번 환자 감염 의사 격리 대상자서 제외 첫 증상  2주 진료
10,남산 딸깍발이 현직 교도관이 전하는 담장 이야기 교도소에 들어가는 중입니다
10,겨울 오기전 독감 백신 꼭 맞아야 하는 3가지 이유
10,초 중 고 독감 역대 최고 타미플루 보험 적용
10,코로나 완치자 3명 중 1명꼴로 재입원 없던 기저질환이 생겼다
10,미국은 의료진 영국은 노인 세계 각국 백신 접종 순위는
10,전시법까지 동원해 백신 구매 2억명분 확보 주용석의 워싱턴인사이드
10,그리스도 백신 4차 접종 도입이스라엘 전문가 3회면 충분
10,무료 독감 백신 접종 시행 12월까지 맞아야 효과
10,어린이 수두 환자 급증 예방주사 맞았어도 안심 금물
11,청도 대남병원 하루 만에 확진자 15명 대구 신천지 이어 2의 수퍼 전파지 되나
11,속보23월 코로나19 백신 접종계획 내일 발표 고령자 az 백신 접종 가이드도 공개
11,메르스 의심 환자 무조건 병원 격리 한다 자가 격리 허용
11,물이 없어요전 세계 20억 명 대소변 오염 식수 마셔
11,천명선의 인간 동물 병원체10인간도 동물에게 바이러스를 옮긴답니다 지금 순간처럼
11,먼지 덮인 생선 과일 누가 사겠나 영세상인들 미세먼지에 질식
11,화이자 추가 예약 사실상 중단 접종 물량 5일분만 남아
11,백신 1차 접종자 누적 280만8천794명 오늘 300만명 넘을 듯
11,예약 거동 불편한 고령 접종 백신 물량 충분할까
11,화이자 맞은 제주노인 2명 사망신고 국내 누적 56명
12,악 날 갑자기 목덜미 잡을땐 이미 침묵의 살인자 고혈압 당신을 노린다
12,코로나19 환자 치료 의료진 첫 접종 일반인은 5월부터 접종 가능
12,8년간 상습 입원으로 보험금 타낸 환자 대법 보험사에 돌려줘야
12,노출의 계절 여름 작심삼일 다이어트보다 꾸준한 체중 감량 중요
12,주요 인사 이번주 백신 접종 트럼프는 우선순위서 제외될 듯
12,발자취 고아와 장애인의 어머니로 60년 하늘로 떠난 홀트 여사
12,독감 비상 늦은 보건당국 고위험군 백신 무료접종 검토
12,백신 접종 시작 흑인여성 간호사 1호 접종자된 까닭은
12,트럼프 백악관 관료들 백신 접종 나중에우선 접종설 부인
12,헬스 트렌드 파킨슨병 빠른 치료가 환자 고통 줄인다
13,코로나19 강타했던 2020년 저소득 국가 유아 사망자 26만 명 늘었다
13,맞든 백지장에 놀랐나 코로나 방역 조치 확 푸는 중국
13,중대재해처벌법 시행령 발표 화학물질 중독 24개 직업성 질병 포함
13,일본 식인박테리아로 71명 사망  정부 은폐 의혹도 제기
13,강원도 코로나19 확산 지속 철원 15단계 격상 예고
13,일상회복 앞두고 확진자 2천 명대 최종안 내일 발표
13,밀접접촉자 남은 요양시설 돌봄 인력 없어 발 동동
13,싸구려 녹용 만병통치약 둔갑 무료 효도관광 미끼로 강매
13,김현주의 일상 톡톡 사회적 약자들 범죄의 표적이 되다
13,익숙해진 혼밥 낯설어진 관계 코로나가 사회적 고립 키웠다
14,서울백병원 뚫려 응급실 폐쇄 대구 거주 숨긴 78세 환자 확진
14,장경태 풀썩 어지럼증 전문의 비틀 중심 못잡거나 빙빙돌면 병원가야
14,화이자 노인이 맞기엔 벅찰 수도 접종후 진통제 복용 괜찮다
14,온열질환 사망자 16명 역대 최다 환자수 1800명 작년의 17배
14,이기환의 흔적의 역사 노비 재소자 장애인 세종의 혁명적인 인권정책
14,방역당국 코로나19 완치 후 재확진 사례 65건 원인대책 논의중
14,바이든 취임 100일안에 1억명 백신 접종 학교 다시 열겠다
14,코로나19 걸리면 걸리는거지 뭐 멕시코 여행간  대학생 44명 집단감염
14,파우치 부스터샷 맞아야 백신접종 완료 도 추가 접종 독려
14,장애인 시위 4일간 10번 때린 이준석 민주 혐오 정치인
15,여름휴가 올 가이드 캠핑시 밝은색 통풍 되는 옷으로 열 손상 질환 예방
15,65세 노인 100명 중 1명 코로나19 감염 사망전체의 75 압도적
15,6074세 접종거부자 2일 예약 재개 기계적 공정 대신 위험회피 선택
15,일상 회복 최종안 발표한다 이틀째 2천 명대 나올 듯
15,출산 1년 만에 60대 노인 얼굴로 변한 20대 여성
15,내일부터 65세이상 az 접종 당국 혈전불안 해소에 주력
15,한국 실명 준실명 환자 6명 배아줄기세포로 시력 호전
15,메르스 사태 첫 완치환자 나왔다 사망자 5명은 중증질환자
15,사설 oecd 1위 자살률 우울한 한국 사회의 자화상
15,뇌수막염 초기증상 어린 영유아에게 치명적 회복되도 청력 시력손실
16,겉과 속 음과 양이 뒤바뀐 조각으로 상반된 세계의 공존 모색 나의 삶 나의 길
16,30년 빨리 왔다  덮친 당뇨병 대란 성인 환자 600만 명 넘어
16,백신 책임자 터널 끝 빛 보인다  내년 45월 일상 회복
16,뉴스라이브 6일부터 생활속 거리두기 전환교육부 오늘 오후 등교개학 시점 발표
16,24시간 공장 돌려도 약이 없다 중국 뒤늦은 위드 코로나 과부하
16,탈북 한의사 김지은의 고려의학 이야기 39겨울철 소화흡수 돕는 무
16,생각해 봅시다 스위스로 안락사 여행 국제사회 생명 윤리 논란
16,과부하 걸린 질본 확진자 공개 지연 방역 골든타임 놓칠라
16,고혈압 당뇨병 잡아주는 걷기 하루 7000보 걸어야 운동 효과
16,미스터리 폐렴 환자 격리 거부하고 번화가 활보 홍콩 발칵
17,나의 가수 방탄소년단 지민을 위한 초특급 스케일 아름다운 빛의 향연으로 전세계 밤 하늘 수놓다
17,뉴스 브리핑 인권위 외국인 선원 내국인과 차별금지 위한 정책 마련 필요 외
17,11일 만에 2천 명 아래로 임신부 접종 조산 유산 영향 없어
17,세브란스병원 염증성 장질환 센터 개소 생애 전주기 맞춤 치료 지원
17,20대 여성 az백신 맞고 혈전증 국내 접종 전략 되나
17,모더나 계약 백신 5600만명분 확보정세균 국산 백신 내년 첫선
17,코로나 백신 100만회분 접종 완료 일반인은 내년 여름부터
17,아직 1차 유행도 안끝났다  코로나 남서부 중심으로 확산
17,일본 인플루엔자 한국 영향 촉각 백신 접종 당부
17,거동 못하는 70대 치매환자 때린 요양 보호사 집행유예
18,전남서도 독감백신 접종 후 90대 노인 사망 평소 노환있어 인과관계 불확실
18,지카 비상사태 성관계로 감염 첫 사례 확인 온두라스는 비상사태 선포
18,밀크셰이크 먹고 서 3명 사망 기계 청소 제대로 해
18,노인 부녀자 대상 10배 폭리 취한 다단계 회사 덜미
18,펄펄끓는 한반도 폭염 안전지대는 없다 온열질환자 20 실내에서 발생
18,아스트라 맞고 울렁거림 호소한 1호 접종자 15분 후 웃었다
18,노인 상대 떴다방 무더기 적발건강식품 효능 부풀려 판매
18,줄기세포로 실명위기 노인 시력 되살려 5년 내 상용화
18,하루 평균 36명 스스로 목숨 끊는다자살률 oecd 24배
18,고혈압에 효과 노인들 등친 떴다방 홍보관 28개 적발
19,스토리 마블의 수퍼히어로 스탠 리 별세 최고의 초능력은 운
19,완전범죄는 없다 농약 콩나물밥 농약 소주 음독사건들 미제 많아
19,먹는 코로나19 치료제 입원 환자 중증도 사망률 개선 효과
19,확진 80대 급성혈전증 다리 절단 후유증 인정 안돼
19,불붙은 백신 확보전쟁 선진국 쏠림에 부익부 빈익빈 우려
19,영국 코로나19 백신 접종 8일부터 시작 의료진 노인부터
19,식인 박테리아  열도 덮쳐 파먹는 세균 치사율 충격적
19,단독대한민국 검시 리포트 한국 원인불명 사망률 oecd1위
19,약효 낮은 유행성 출혈열 백신 계속 허가
19,헬스뷰티척추관협착증 무조건 수술 악화 전 병원 찾으세요
20,숨 막히는 공포 copd 꾸준한 운동재활 중요홍은심 기자의 긴가민가 질환시그널
20,백악관 고위 당국자 백신 접종 트럼프 계획 없다 반박
20,사회적 거리두기 무시하고 멕시코로 떠난  대학생 44명 무더기 확진
20,938 아스트라제네카 백신 접종 동의 26일부터 34만여명 1차로 맞는다
20,fda 모든 성인 대상 mrna 코로나19 백신 부스터샷 승인
20,집콕 생활에 늘어난 변비 임의로 약 먹다가 화 키울라
20,비타민c 권장량 봤더니비타민 제제보다 야채나 과일 섭취 추천
20,프랑스가 하루 사망자 1355명으로 세계 최고치 기록한 이유는
20,정은경 독감 백신 물량으로 고위험군 대부분 접종 가능
20,아스트라 백신 심사 착수 2월 의료진 요양병원부터 접종
21,지카 팬데믹 국내 확산 성관계 감염 사례 첫 확인 온두라스는 국가비상사태 선포
21,분쟁지역 봉쇄로 아르메니아인 수천 명 아사 위기 인종 학살 의심
21,국내 화이자 접종후 돌파감염 004 20세미만 확진 5만명 사망 0명
21,노인 비만 증가 추세 우리나라 노인 3명 중 1명은 비만
21,생산 끝나 물량 부족 우려 독감 백신 정치에 국민건강 위험
21,지난해 독감 백신 접종 뒤 7일 내 노인 1500명 사망
21,한반도 덮친 북극 한파 외출 자제 실내에서도 방한 철저
21,사물이 휘어져 보이는 황반변성 방치 땐 시력 잃을 수도
21,a형 간염 예방접종 해 말어 전문의 99 자연치유 1는
21,백신 맞으려고 할머니 분장까지 젊은 여성들 엽기 행각 드러나
22,az 혈전 국내 세 번째 발생 11월 집단면역 달성 차질 우려
22,healthbeauty목 허리 디스크 질환 비수술 고주파 치료로 고통 끝 행복 시작
22,너무 무섭다 생각만 해도 아찔한 질환 지레 겁먹을 필요 없다고
22,화이자 1차 접종 22일 재개 인과성 불충분 이상반응도 의료비 지원
22,열사병 치사율 25 치명적 찬물에 몸 담가 체온 내려야
22,백신 책임론 진화 나선 문 대통령 내년 2월부터 접종
22,정 총리 내달부터 백신 접종 국민께 진행상황 소상히 알려라
22,코로나 종식 중국도 재유행 우려 독감 백신 일찍 맞아라
22,꼬인 az 백신 접종 30세 미만 빼고 재개
22,당국 아이들 메르스 걸리지 않아 비말 5분노출에도 감염
23,면역 취약층 추가 접종 본격화장차 모든 사람 부스터 샷 맞아야 할 수도
23,cdc n95 마스크 쓰지 마라 알고 보니 공급 부족 조재길의 지금 뉴욕에선
23,사상 최악의 독감 공습 전역서 어린이 18명 사망 보스턴 비상사태 선포
23,아동 독감 유행 외래 환자 10명 중 1명꼴 공기 통해 전달
23,도 면역 취약층에 부스터 샷 접종 fda 48시간 내 승인
23,유럽 폭설 한파 최소 55명 사망  아일랜드 스위스 공항 폐쇄
23,기존 치료제에 반응 않는 수퍼 박테리아 폐렴구균 국내서 첫 발견
23,26일 오미크론 대응체계 시범 가동  진단 검사체계 확 바뀐다
23,메르스 관리 부실 여전 서울아산 20대 감염직원 택시 이용
23,수도권 열흘 새 2089명 감염 5명 중 1명 깜깜이
24,감염병 철저한 사전예방 관리 위해 면역 약한 영유아 예방지원 강화해야
24,단독 폭염에 쓰러진 영업사원 무직자 노숙자 3대 경제취약층 일상 직격탄
24,서울 9월부터 난자 동결 시술 비용 지원 전국 최초
24,신규 결핵 환자 줄고 있지만 노인 환자는 꾸준한 증가
24,강남 봉이 김선달 지하수를 기적수로 속여 판 일당 붙잡혀
24,입원한 아빠 입에서 구더기 알고보니 과거 비슷한 사례 있었다
24,at와 함께하는 글로벌푸드 리포트 편의점 레스토랑서도 판매  커지는 실버식품
24,피터페터 지니얼로지 관악구 서울대 캠퍼스타운 입주기업 탁월한 성과 내
24,난 즐길래 광란의 비밀 파티 여는 유럽 코로나 급증
24,제로 코로나 포기하나  신규 확진자 2년 만에 1000명 돌파
25,김우섭 기자의 바이오 탐구영역 1 수젠텍 번도 본 적 없는 신제품 출시하겠다
25,신종 코로나 독감 수준 기침 없으면 마스크 쓸 필요 없다
25,일본 식인 박테리아 공포발병자 사상 최대 올해만 71명 사망
25,1만 5천 원짜리를 60만 원에 노인 울린 떴다방 검거
25,요양원에 cctv 설치 의무화 위반시 과태료 최대 300만원
25,경제 위해 젊은층 먼저 인도네시아 백신 접종 역발상
25,콜레라 치명률 05 이하 두려움 느낄 수준 아냐
25,21세기에 자행된 마녀사냥 아마존 마을서 70대 여성 화형
25,ba5 697건 추가 확인 해외유입 더한 검출률 563상보
25,오늘의 경제소사 1918년 토탈 워 1차 세계대전 종결
26,관악구 서울대 지원 날개 달고 캠퍼스 타운 입주기업 성과 훨훨
26,나흘 만에 신규 확진 다시 40명대 도봉구 요양시설 무더기 감염
26,보험료 두배 걷고도 바닥난 장기요양보험 정부 보험료 인상 강진규의 데이터너머
26,마스크 벗고 쇼핑 술집국민 73 항체 현재 영국 상황이슈픽
26,운전면허 보유 치매환자 2541명 98세 90대 치매환자도 66명이나 돼
26,이틀 연속 스모그 덮친  베이징 어린이 노인 실내 머물러야
26,인플루엔자 유행 지속 영유아 노인 고위험군은 의심증상 시 치료해야
26,금융 특집 미래에셋생명 암 뇌출혈 심근경색 병력자도 보험 ok
26,날 깔봐 80대 노인 실명시킨 50대 남성 심신미약 주장하자
26,미국 한국 여행경보 2단계로 격상 한국 여행 주의
27,84세 입 안서 구더기 나왔다 의식없는 환자 노린 충격 증상
27,코로나 하루 확진 8월까지 1명 이하로 못 줄이면 무차별 확산
27,행복한요양원 보호자 만족도 높은 시니어 케어 특화 시스템 선보여
27,군 복무 중 사격으로 청각장애 주장  노인성 질환 가능성
27,확진 환자 3명 추가 구리시 병원 2곳 폐쇄
27,노인 대상 원가 40배에 건강기능식품 판매 일당 덜미
27,암도 치료 억대 가짜 만병통치약 판매 일당 구속
27,아쉽다 83번 환자 찾았다면 5명 확진 없었을 수도
27,김숙 3000만원 기부 코로나19 공포 장애아동 독거노인 돕는다
27,손아귀 힘 빠진 노인 병 신호일 있다헬시타임
28,시민마이크 옛날 일은 생생한데 최근 깜빡깜빡  갑자기 의처 의부증 치매 증상일 수도
28,수도권 확진 23일 만에 100명 아래 거리두기 완화까진 먼 길
28,정명진 의학전문기자의 청진기 전립선비대증 지혈효과 높은 고출력 레이저 수술 추천
28,2분기까지 국민 20 접종 완료 계획 문제는 백신 물량 확보
28,고령 부부 29 30번째 확진자 감염 미스터리 지역전파 가능성
28,8년간 상습 입원해 3억원대 보험금 타낸 노인대법 보험사에 반환
28,암 유병자 200만명 5년 넘는 생존자 10명 중 6명꼴
28,조회수 260만 민간 기업 제치고 pr대상 받은 정부 광고
28,코로나19  사망 100명 돌파확진자 50개주 전역서 6500명 코 앞
28,1800웨더폭염열사병 환자 이틀새 2명 사망 노약자 만성질환자 주의
29,옴부즈맨 칼럼 세대 차이와 갈등 치유의 길나은영 서강대 커뮤니케이션학부 교수
29,마스크 벗고 확진자 격리 폐지한다 미국 유럽 방역규제 해제 속도전
29,내년 예산안시간제 어린이집 3배 확대 저소득 96만가구 난방비 지원
29,미 cdc 한국 여행공지 3단계로 격상 최고 단계 상향
29,fda 항암제 임상 가이던스 3종 발표 고령환자 확대 권고
29,프랑스 백신 부작용만 139명화이자 관련주 엔투텍 에이비프로바이오 파미셀 안트로젠은
29,거창군 요양병원 시설 만 65세 아스트라제네카 접종 확대
29,겨울 독감 유행 조짐 1주일새 환자 30 증가
29,군 복무로 청각장애 유공자 신청한 70대 노인 불허
29,굽지 않은 쿠키 반죽 먹지마  살모넬라균 감염자 속출
30,한림대춘천성심병원 기도로 음식물 넘어가 발생하는 흡인성 폐렴 ai모델 국내 최초 개발
30,fda 화이자 백신 정식 승인 군인 접종 의무화 접종률 높일 듯
30,김병민의 사이언스빌리지 알파 델타 오미크론 우리는 지금 어디로 가나
30,최저임금 차등적용 논쟁 계속 고용 감소 vs 근거 없어
30,무료 관광 미끼로 가짜 만병통치약 판매한 일당 무더기 검거
30,기저귀 갈아주다 뺨 때렸다 70대 환자 폭행한 요양보호사
30,일요일 역대 최다 현 추세면 8월 중순 2300명
30,한국만큼 코로나 검사 못하나 질문에  보건당국 결함 인정
30,조양호 한진회장 별세 사망원인 폐 굳는 폐섬유증에 무게
30,미국서 발견된 적 없는 신종 진드기 공포 확산
31,정부 모더나 얀센 백신 부스터샷 미국 결정 충분히 검토할 예정
31,경찰 백신 수송 안전에 총력 접종 방해 행위 엄정 대응
31,65세 고령층 감염 4명 중 1명꼴 위중 중증 환자 15명
31,health전 세계가 공포에 에볼라 바이러스 소독제가 바이러스 불활성화에 도움
31,26일 오전 9시 코로나19 백신 접종 시작 1호 접종자는
31,미국 백신 접종대상은 경찰과 교도관 식료품점 직원과 75세 노인
31,70대 노인들 10년 추적해보니 먹을 치매 덜 걸렸다
31,헬스talk 코로나19에 장마까지 물과 식품 통한 감염병 주의
31,6074세 접종 거부 127만명 델타유행에 다시 기회 준다
31,정세균 미 유럽 접종 준비 부족 우리는 없어야
32,내전이 만든 죽음의 땅 이제 사람이라곤 없소 노란 피부 걸친 해골뿐
32,전설의 주먹 알리도 병 앞에선 무릎 노인들엔 치매 흔한 파킨슨병
32,대구 경북 밤 사이 추가 확진 오전 중 발표
32,하루 평균 코로나 확진 32명20명 감소 소규모 전파는 계속
32,24시간 화로 돌리는 화장장 밖에는 영구차 150m 줄섰다 르포
