Topic Number,제목
1,웹툰 헬퍼 선정성 논란 아동 성착취 강간 폭력 19금이니 괜찮다
1,이웃집 지붕에 고양이 사체 던진 80대 협박 혐의로 검찰 송치
1,도 넘는 혐오 뉴욕서 83세 한인 할머니 묻지마 폭행에 기절
1,아침 신문 보기 애플도 최신폰 교체 판촉하는데 한국선 가격경쟁 실종
1,밥 줬다며 끔찍하게 훼손된 고양이 사체 던지고 욕설  청원
1,카드뉴스 임신부 배려석은 곰 인형이 찜 대전 지하철의 실험
1,표현의 자유를 막나 vs 연예인 조롱은 막 던져도 되나
1,정유정 조남주 3년 만의 신작6월 소설 열풍 예고
1,강남역 살인사건 3주기에 다시 외친 묻지마 살해는 없다
1,충이란 신조어 급증 약자에 경멸 표출하는 사회병리 현상
2,청춘에 희망을 지원서에 이름 나이 사진 빼고 독일 기업들 실력만 본다
2,영등포 쪽방촌 가보니 밖에서 보기엔 무너질 같지만 서로 지탱하며 살아가
2,여성혐오 네이버 웹툰  미성년 노인 여성 폭력 묘사에도 검열될까 조심
2,91세 노인 뒤에서 밀친 20대 남성 동양인 대상 범죄 급증
2,낸시 어딨어  하원의장 자택 습격범은 불법체류자  처벌 후 추방
2,책생각 부끄럽지 않은 글을 위해 내 삶의 대부분을 소진했다
2,할머니 고문 그리는 5시간 내내 미안했다 헬퍼 사과문전문
2,팬들도 돌린 선정성 웹툰 헬퍼 연재 잠정 중단
2,넌 한남 옹호하는 흉자  대  혐오논쟁 벌이는 까닭
2,군용 칼 같은 걸로  아시아계 노인 대낮 피습
3,10명 중 9명 혐오차별로 사회적 갈등 심화  정치인 혐오표현 자제해야
3,경찰도 집권당도 부스 차리고 응원서울과 사뭇 베를린 성소수자 축제
3,트럼프가 불러낸 벌거벗은 미국 인종주의 소수자 혐오 벌써 기승
3,약자인 아시아계 여성 노인들 표적 혐오 공포 속에 산다
3,아시아 혐오 범죄 급증 길에서 공격당한 80대 남성 숨져
3,이슬람 분리주의 연루 모스크 76곳 단속 테러 육성 기반
3,책꽂이부전나비 관찰기 마취 한밤의 미술관 이순신 여행 인생 조각
3,요정이 전하는 하찮은 삶의 지혜 인생의 요정 출간
3,펠로시 남편 망치 피습에중간선거 앞둔 미국 정치권 발칵
3,내 살은 거 고생 말고 없어예 억울치 억울코말고
4,바이든 겨냥 75세 정치인은 정신감정 하자 주장에  트럼프 난 찬성
4,전장연 한국 정부의 장애인 지하철 행동 진압 un도 심각하게
4,ncck 장애인 이동권 투쟁 현장 방문 생존권 문제로 접근해야
4,레이더l 강남역 살인사건 기소 검찰 여성혐오 아닌 피해망상 결론
4,세대별 갈등 요인 청년  장년 빈부 노인 이념 꼽아
4,중국인은 매춘부 혐오 녹인 건 아이들 손바닥이었다 이제는 이민시대
4,동서 격차 난민 통일 25주년 독일의 또다른 통일 과제
4,전장연 약자 아니다 오세훈 발언 파문 혐오 차별 조장
4,오세훈 지하철 1분 발언에 교통약자들 우린 타지 말란 것이냐
4,서울 20 30 10명 중 7명 혐오표현 경험
5,자꾸 밥 줘 지붕에 이웃집 노인의 끔찍한 행동 cctv에 고스란히
5,웹툰 헬퍼 여성혐오 논란 혐오도 표현의 자유일까 김가연의 시선 비틀기
5,밀착취재 임산부 배려석 도입 5년 지하철 분홍색 갈등 여전
5,연애 못해봐 분노 트럭 돌진해 26명 사상자 낸 모태솔로
5,우리도 지하철서 공공의 적이냐 노인 유아차 부모 오세훈 비판
5,윤미향 폭로 이용수 할머니에 노망 질투 2차 가해 확산
5,앵커 pick 막 내린 광주 세계 수영 대회
5,청소년은 맘충 여성혐오 성인은 홍어 지역혐오 많이 접해
5,신조어의 세계분명 우리말인데 외국어보다 높은 언어 장벽
5,왜냐면 혐오에서 증오로 젊은 세대의 절망에  정지우
6,친절한 쿡기자 생각 다르면 혐오이름 붙여 벌레 취급 상처 뿐인 집단 인격살인 위험수위
6,홍어족 김치녀 정신병자 혐오표현 접한 국민 10명 중 2명 내용에 공감
6,워마드 이번에는 패륜 논란 잠자는 중년 남성에 식칼 들이대고 칼x넣기 좋다
6,성인 3명 중 2명 특정 지역 출신 등이라고 혐오 표현 경험
6,독서는 불법 모든 책을 불태우겠다 마약보다 종이책을 혐오하는 세상 나쁜 책
6,답답하고 무례한 실버세대 편견 깨는 사랑스러운 주인공들 진달래의 웹툰 봄
6,양예원 겨냥 돼지 머리 퍼포먼스 본 진중권 반응 충격과 공포
6,기억전쟁 미래가 된 과거2한 공간 어긋난 기억 정치의 격투장
6,공원서 한국계 노부부 얼굴 가격한  남성 증오범죄 혐의로 체포
6,아주 돋보기 bts 손흥민까지 당했다 코로나 속에서 인종차별 확대
7,선입견 두려움에 배척 정치 성향 관계 없이 분노 표출 한국형 외국인 혐오 보고서
7,로힝야 학살 4년 끝나지 않은 비극2017년 학살이 2021년에 비슷한 상황 우연 아니다
7,운전면허처럼 필수 노인 혐오 75세 정치인 정신감정 논란속 76세 트럼프 반응은
7,깊은 주름 검버섯 다 그린 초상화 긴 수고의 흔적 읽기
7,흑인 남성의 한인 노인 폭행 두고 la 한인사회는 논쟁중
7,인권위 인수위에 차별금지법 제정 노력 포함 10대 인권과제 제시
7,팩트체크 칼 창 휴대금지 중국 동포 동네의 현수막 진실
7,손바닥 외신 대만서 대권 도전의 변 여신 현몽 논란
7,이마트 가전 매니저들 단톡방서 가슴에 줄자 대면 틀딱 놀이터
7,100 인터뷰 여성들의 불안 불편해도 피해자 시선으로 보라
8,한국을 혐오하는 일본 사람들 그들은 이동준의 일본은 지금
8,증오범죄 10대로 번졌다 아시아계 노인 뺨 때리고 강도질
8,홍길용의 화식열전 벚꽃대선과 트럼프에 대한 옛 천재의 조언
8,신년사최영애 사회적 소수자에 대한 혐오차별 문제에 정면 대응해야
8,런던 테러희생자 국적 12개국 세계에 대한 테러
8,이슈 매주 성당 불태우겠다 폭주하는 혐오 미러링
8,도 넘었다 방통심의위 인터넷 혐오표현에 강력 대응
8,중국에도 한국인 차별이 있다구요 빵즈가 뭐길래 관심집
8,무섭다 총까지 사야하나 미 증오범죄에 한인들 떤다
8,캐나다서도 아시아계 겨냥 인종차별 범죄 속출
9,혐오 놀이 앞서 솔직한 내 감정 살펴야 외모로 자기검열 말고 매력을 발견하길
9,75세 정치인 정신감정 하자 헤일리 전 미 유엔대사 발언 논란
9,밀착취재 태극기 집회서 만난 보수 워마드  정권 규탄 어색한 합창
9,여성혐오 논란 웹툰 헬퍼 bts 아이유 팬들까지 분노한 이유
9,전쟁 상처를 그림책 창작의 원천으로67세 괴짜 천재의 자화상
9,월드 브리핑 거대 모래폭풍 피레네 산맥 유럽하늘 덮쳐
9,개신교비개신교인 진보 보수 비슷 동성혼 임신중지 이견 커
9,뉴욕 편의점서 절도 들키자 중국x아시아계 직원 때린 흑인
9,동방예의지국 한국 옛말 노인차별 oecd 15국 중 2위
9,콜로라도 총기난사범 이슬람 혐오자들 내 전화 해킹 멈추길
10,헬퍼2 삭 작가 노인고문 여성혐오 19금 작품 논란 해명 후 휴재 선언
10,한국에도 혐오범죄 있다1강남역 10번 출구 살인 후 법원 판결문 찾아보니
10,여성 혐오 연쇄살인범 유영철 구치소 내 성인물 불법 반입
10,마돈나 외모 논란에 여성과 노인 혐오 사과할 없다 일침
10,우에노 지즈코 교수 강남역 추모는 여성들이 참지않고 일어난 역사적인
10,뉴욕 20대 남성 2주 사이 아시아인 2명 연달아 폭행
10,여자들은 날 만나줘 20대 모태솔로 트럭 돌진 26명 사상
10,인터넷상 차별 혐오 저속 표현 3년간 증가세당국 시정조치
10,xx충 냄져 꼴페미 눈만 뜨면 신조어 조롱사회 우려
10,진중권 조국은 모세 는 여호수아 신흥종교 된 개혁
11,국민 10명중 6명 혐오에서 안전하지 못해 근데 난 혐오표현 안써요
11,치마 속 찰칵 몰카 콘텐츠에 제정신이냐 vs 과몰입 말라 튜브뉴스
11,과도한 몸매 부각 미성년자 성 왜곡 웹툰 체인지도 여혐 논란
11,여성 캐릭터만 성적대상화 게임 속 여성혐오에 누리꾼 의견 분분
11,거리의 만찬 자진 하차하게 만든 김용민 과거 발언 살펴보니
11,퀴어를 비웃는 사회에서 내 몸을 찾기 위한 여정
11,팬데믹 후  혐오범죄 잇달아 캘리포니아주 규탄안 만장일치 통과
11,여성 인격 건드린 남성 성적 사생활 뜨거워진 리얼돌
11,도 넘은 여성 혐오인가 선 넘은 창작 검열인가
11,박지현 유시민 노인폄훼 발언 소환하며 아름다운 퇴장 준비하라
12,유대인 말살 결정했던 별장 한해 12만명 찾아오고 안네 프랑크 교육관에선 첨단 it기술로 당시 재현
12,연중기획작은 배려 대한민국을 바꿉니다 온라인 에티켓 맘충 메갈년 홍어 다문화충 키보드워리어판치는 e세상
12,이미지로 여는 책그 영화는 거짓말투성이다 아파치족의 시선으로 그린 전쟁의 참상
12,할머니의 기억 속에 숨긴 전쟁의 아픔 책담의 다하우에서 온 편지
12,너도 이렇게 되고 싶냐 고양이 사체 던지고 협박한 80대 입건
12,고양이 사체 2구 이웃집 지붕에 던진 80대 cctv에 고스란히 찍혀
12,목없는 고양이 사체 이웃 지붕에 휙 80대 할머니 입건
12,뉴욕에서 76세 아시아 여성 머리에 주먹질 한국인이 싫어
12,혐오표현의 일상화 성인 청소년 3명 중 2명이 경험
12,푸틴에 총부리 겨눈 러시아인들 참을수 없었다 이들 정체는
13,연달아 발견된 길고양이 사체 cctv에 찍힌 이웃집 노인 김유민의 노견일기
13,아이유 닮은 캐릭터 네이버 웹툰 이번엔 여중생 강간 고문
13,인터넷 혐오글 올해 182 증가 방심위 833건 시정요구 조치
13,사진 사랑은 혐오보다 강하다 국내 성소수자 지지 행진
13,소설가 50명이 뽑은 올해의 소설은 김애란 바깥은 여름
13,혐오 표현에 물든 대한민국 유튜브 소셜미디어가 확산 통로
13,사설 일본 집권당이 혐한 인종차별 조장하는 건가
13,55년 연상랑 스타벅스 가고 영화도 보며 살아요
13,노인 26 죽고싶다 생각 가난에 세대 혐오
13,그것이 알고 싶다 원남동 살인사건의 범인은 유영철인가
14,고양이 사체 이웃집에 던진 80대 입건 머리 부위 없어 많이 훼손된 상태
14,세계인권선언 70주년 맞아 인권의 날 기념식고 노회찬 의원 대한민국 인권상 훈장 추서
14,칼이 된 증오 적개심 초래 뒤틀린 표현의 자유 행복사회로 가는 길
14,아시아계 증오 범죄 대처 책자 무료로 배포하는 la 한인 2세
14,산타는 백인으로 태어나지 않았다 흑인 아시아계 트랜스젠더다양성 산타 쏟아진다
14,sk 대학생 봉사단 써니 사회문제 해결 직접 나선다
14,몰카엔 몰카로 남혐 사이트 남성 표적 몰카 확산
14,일베 박카스남에 워마드는 살해 예고 박카스남 죽이고 천국가겠다
14,어설픈 표현은 실례라  뭔가 빠진 헬퍼 작가 사과문
14,오늘의 눈 콜센터 물류센터 중국동포쉼터의 공통점이민영 사회2부 기자
15,쉬며 재정비하겠다 노인 고문성 착취 논란 웹툰 헬퍼 작가 사과 전문
15,중국 바이러스 싫다 흑인에 무차별 폭행 당한 한인 노인
15,뉴욕 차이나타운서 증오 범죄 흑인남성 아시아계 여성에 주먹 날려
15,모스크 방화 시도 후 총격 노트르담 성당 화재 복수하려
15,뉴욕서 유대인 최대 명절 하누카 노린 흉기 난동2명 중태
15,오늘은 임산부의 날말로만 저출산 걱정 맘충 취급에 임산부 눈물
15,황출새 애틀랜타 현지트럼프 이후 아시아 혐오 범죄 크게 늘어
15,아시아 얼굴에 별안간 주먹질  캐나다 코로나 증오범죄 속출
15,최영애 인권위원장 사회적 소수자 혐오 차별 문제에 정면대응
15,용의자 2명 아시아계 노인 서 삶 만족도 최하
16,로힝야 학살 4년 끝나지 않은 비극 3 군부의 칼날 이번엔 미얀마 시민을 향했다
16,조성관의 세계인문여행부산 유치나선  엑스포 참가 파리 엑스포 클림트 그림 대상 받아
16,가공할 친일행각 국민 버린 위정자 목숨던진 아낙까지 교과서에 없는 뒤틀린 현대사
16,겨울왕국2가 불붙인 노키즈존 논란 극장 알바생과 육아맘의 무한 토론 부스의참견
16,20대 여성 폭력범죄 7 남짓인데 이대녀 향한 도넘은 비판
16,쥴리 비방 벽화에 윤희숙 전여옥 맹폭 여가부는 뭐하나
16,인권위 사회적 약자 혐오 차별 막는다 전담조직 출범
16,라노벨 작가 혐한 발언 논란으로 애니메이션 제작 취소
16,이대남 vs 이대녀 갈등 부각 이제 그만해야
16,아시아계 겨냥 혐오 범죄 우려 청문회 추진
17,유인경의 꼰대와 밀레 사이 금쪽같은 선배 경험담 싫존주의싫어하는 것을 존중해주는 앞에선
17,선정성 논란 웹툰 헬퍼 작가 표현 욕심 과했다 연재 중단 전문
17,길고양이 밥 주지마 고양이 사체 던져 협박한 80대 검찰 송치
17,미리 만나는 노벨문학상 유력 후보들이 그린 인류의 초상화
17,2017년을 여는 베스트북  위로의 언어 폭력의 시대 쓰라림에
17,최영애 인권위원장 혐오 차별 바로잡을 위원회 전담팀 꾸릴
17,트럼프 코로나는 쿵후 바이러스 아시아계 혐오 부채질글로벌 포커스
17,미국 내 아시아 혐오 범죄 커지는 불안현지 대응은
17,산책 도중 맞아 숨진 84세  아시아 혐오범죄 심각
17,박종인의 땅의  황제가 말차를 금하니 일본이 도자기로 일어서더라
18,오늘은 임산부의 날 맘충으로 보일까봐 겁나요 눈치 보는 임산부 속앓이
18,웹툰 헬퍼 여성 혐오 논란에 작가 어쩔 없는 선택
18,진중권 이용수 할머니 비난 글 충격적 이게 민주당 수준
18,아시안 증오범죄 149 급증 뉴욕선 한인 할머니 폭행
18,혐오가 쏟아져도 해야만 하는 이야기 여경 23인의 분투기
18,성범죄 44건 70대 노인 코로나 걸려 감옥에서 죽었다
18,마크롱 우세에 39세 대통령 63세 영부인 나오나 입방아
18,아시아계 증오범죄 방지법 바이든 서명만 남았다  하원도 통과
18,선처 없이 강경 대응 악플과의 전쟁 악순환은 계속
18,외교부 아시아 혐오범죄에 재외동포 지원 대응 역량 강화해야
19,뉴스as 목적 잃고 혐오 낳는 일베 워마드 독일처럼 혐오 표현 강력 처벌을
19,사회학을 하는 좌뇌 시 쓰는 우뇌로 바라본 세계냉철하고 따스한 심보선 시인 에세이
19,묻지마 폭행 당한 뒤 눈물 흘리는 아시아계 노인  혐오범죄 현장
19,아시아인들 쉬운 표적 미국 내 아시아계 대상 인종차별 범죄 급증
19,혐오에 빠진 대한민국하 식당서 나가 한국서 나가 징그럽다 삶이 차별받는
19,할머니 알몸 결박 미성년자 강간 네이버 웹툰 헬퍼 여성혐오 논란
19,팬들 먼저 역겹다 할머니 고문까지 나온 네이버 웹툰 헬퍼
19,동경과 북경 달라도 너무 달랐던 팬데믹 올림픽 취재기베이징 다이어리
19,종합우린 여성혐오 사회에 살고있다 강남역 여성 살해사건 3주기 추모제
19,흑인에 폭행당한 한인 노인 손녀는 흑인 한인 혐오 멈추자
