Date,Press,Category,Title,Content,Comment,URL_Origin,URL_Naver
2023-02-12 19:09:35,전자신문,사회,"케이메디허브, 뇌질환 초음파 치료 대동물 비임상 착수","[ 안구건조증눈물 생성 부족·눈물 증발 가속이 주원인특정 시간·눈 집중·낮은 습도에 증상 악화인공눈물로 치료…눈물점폐쇄 사용하기도    [사진=게티이미지뱅크]     고병이 건양대병원 안과 교수안구건조증은 눈물의 부족이나 눈물막의 과도한 증발로 노출된 눈꺼풀 틈새의 안구표면 손상으로 눈의 불쾌감 및 자극증상을 일으키는 눈물막의 질환이다. 찬 바람이 불고 날씨가 건조한 요즘, 눈에 모래가 들어간 것 같고, 뻑뻑하고, 시리며, 따가운 증상을 느껴서 병원을 방문하는 경우가 부쩍 늘고 있다. 가볍게 넘길 수도 있는 병이지만, 치료하지 않고 방치하면 각막염 등의 합병증으로 시력장애를 가져올 수도 있는 질환이다. 고병이 건양대병원 안과 교수의 도움말로 안구건조증에 대해 알아본다. ◇정의 및 원인=우리 눈에는 기능적으로 두 종류의 눈물기관이 있다. 주눈물샘에서는 슬프거나 아플 때 나오는 눈물(반사분비기)을 만들며, 덧눈물샘과 술잔세포, 기름샘에서는 점액과 기름성분이 있는 눈물(기본분비기)을 만든다. 특히 기본분비기에서 만들어진 눈물은 우리가 느끼지 못할 정도로 조금씩 나와서 눈의 표면을 부드럽게 윤활작용을 하며, 각막을 부드러운 표면이 되게 하고 광학적으로 맑게 하므로 눈물이나 눈물층에 이상이 있는 경우에는 좋은 시력을 얻을 수 없다. 기타 유해한 자극을 희석하고 세척하는 역할을 하며, 항균력을 가져 외부의 병원균으로부터의 보호작용을 담당한다. 안구건조증은 여러 가지 원인으로 발생하지만 크게 눈물 생성이 부족한 경우와 눈물층의 이상으로 눈물이 빨리 증발돼 생기는 경우로 생각해 볼 수 있으며, 다음과 같은 이유로 안구건조증이 발생하게 된다. 첫째 눈꺼풀 염증이 생기면 덧눈물샘의 기능저하로 눈물의 증발이 많아진다. 둘째 콘택트렌즈 착용 시 눈물의 증발이 더 많아지고 장기간 사용한 경우에는 각막의 신경이 무뎌져서 반사눈물이 줄어든다. 셋째 건조하거나 바람이 많이 부는 날씨, 히터나 에어컨에 노출되는 경우에는 눈물의 증발이 많아서 건조증을 악화시킨다. 넷째 쇼그렌증후군, 류마티스 관절염, 루프스 같은 자가면역 질환이 있거나 나이가 들면서 눈물 생성량이 줄어들 수 있다. 특히 여성은 폐경기 이후에 증상이 심해진다. 다섯째 알레르기약, 고혈압약, 항부정맥 약물, 항우울제, 파킨슨씨병 치료제 등과 같은 약물 복용 시 눈물의 분비량이 줄어들 수 있다. 마지막으로 텔레비전, 컴퓨터 모니터, 스마트폰 등을 오랜 시간 사용하는 경우 눈을 깜빡이는 횟수가 줄고 화면을 보면서 눈을 크게 떠서 눈물의 증발이 정상보다 많아질 수 있다. ◇증상 및 진단=환자들이 느끼는 증상으로는 눈이 따갑고 타는 느낌, 콕콕 찌르는 아픔, 가려움증, 이물감, 뻑뻑함, 쓰라림, 눈꺼풀이 무거운 느낌, 눈부심, 안구 피로감 등으로 매우 다양하다. 이는 안구표면에 건조함을 느끼는 특이적인 감각기가 없어 환자들이 자신의 증상을 각자 다양하게 표현하게 되는 것이다. 때로는 오히려 눈물이 더 나온다고 호소하기도 하는데 이는 이물감 등의 자극에 대한 반사작용으로 주눈물샘의 눈물이 더 나오는 것이라고 설명할 수 있다. 안구건조증 환자들의 증상에는 두 가지 특징이 있다. 첫째, 증상이 밤에 심해지거나 아침에 일어날 때 악화되는 등 하루 중에 변동이 있다. 둘째, 독서, 텔레비전 시청 등 계속적인 눈의 집중을 필요하는 경우, 에어컨, 연기, 비행기 안의 낮은 습도 등에 의해 증상이 악화된다. 안구건조증은 환자의 증상과 눈물막 파괴시간 측정(BUT검사), 눈물 분비량 검사(Schirmer test), 각막과 결막의 생체염색 등의 검사를 통해 진단할 수 있으며, 치료목적은 환자의 증상을 좋게 하고 객관적인 검사소견을 호전시키는 것이다. 환자와의 상담을 통해 완치는 안되지만 적절한 치료로 악화되지 않고 호전될 수 있음을 이해시킨다. ◇치료=건조증을 치료하는데 기본적인 약제는 인공으로 만들어진 눈물(인공눈물)이다. 인공눈물은 눈에 물기를 더해 표면을 적셔주고 오랫동안 수분을 저장함으로써 환자의 눈이 편하게 한다. 현재 많은 종류의 인공눈물이 제품으로 나와 있으므로 의사와의 상담을 통해 자신에게 가장 적합한 것을 사용하는 것이 중요하다. 일반적인 인공눈물에는 세균감염 방지 목적으로 보존제가 들어 있어서 눈에 독성을 나타내는 경우도 있으므로, 하루 4번 이상으로 자주 사용해야 하는 심한 건조증에서는 보존제가 없는 인공눈물을 사용하는 것이 바람직하다. 아침에 건조해 눈뜨기가 힘든 증상이 있는 경우는 자기 전 인공눈물 성분의 안연고를 사용함으로써 효과를 볼 수 있다. 그러나 이런 연고는 낮에 사용하면 흐려보이는 문제를 일으키므로 밤에 잠자기 전 소량을 사용하는 것이 좋다. 심한 건조증에는 환자 자신의 피를 정제한 자가혈청을 안약으로 만들어서 사용하기도 하며, 혈청 내의 여러 성장인자와 비타민 A 성분이 안구표면을 유지하는 데 도움이 된다. 사이클로스포린A 성분의 안약은 항염증 작용으로 눈물샘의 파괴를 억제하는 효과가 있어서 중등도 이상의 건조증에 효과적으로 사용되고 있다. 최근에는 눈물의 점액성분을 증가시키는 치료약이 도입돼 눈물막 파괴시간이 짧은 형태의 안구건조증 환자들에게 도움이 되고 있다. 건조증이 눈꺼풀의 염증과 관련된 경우 눈꺼풀의 청결을 위해 마사지를 하거나 깨끗이 씻는 것이 좋고, 항생제 안약이나 전신적인 항생제를 사용하기도 한다. 이미 분비된 눈물을 보존하는 방법으로 눈물점 마개를 사용한 눈물점폐쇄를 사용하기도 하며, 눈물점 마개는 콜라겐 성분이나 생체흡수성 재질로 만들어져서 삽입 후 일정시간이 지나면 저절로 녹아서 흡수되는 것과 실리콘 성분으로 반영구적으로 사용되는 것이 있다. 보통은 아래쪽의 눈물점을 막지만, 심하면 상하의 눈물점을 모두 막기도 한다. ◇예방=위의 치료방법들과 더불어 환경을 건조하지 않게 하면 눈물의 증발이 줄어들기 때문에 도움이 된다. 예를 들면 겨울에 난방할 때는 젖은 빨래를 걸어 놓거나 가습기를 사용하여 습도를 올리거나, 실내 온도를 조금 낮춰 주면 좋다. 그밖에 외출 시에는 보호용 안경을 착용하고, 책이나 컴퓨터를 볼 때는 30분 간격으로 휴식을 취하는 것이 좋다. 도움말=고병이 건양대병원 안과 교수   ]","['아놔', '얼굴에 일부분만 보이는대도 이쁨이 묻어난다...']",https://www.etnews.com/20230211000008,https://n.news.naver.com/mnews/article/656/0000042254?sid=102
2023.02.13.,세계일보,,"케이메디허브, 두개골 개방않고 약물주입 대동물 비임상 연구 시작",,,http://www.segye.com/content/html/2023/02/12/20230212508899.html?OutUrl=naver,http://www.segye.com
2023-02-13 01:03:14,한국일보,사회,"미우라 아야코와 박완서, 고통 속의 글쓰기 [삶과 문화]","[    케이메디허브(대구경북첨단의료산업진흥재단)는 집속초음파를 이용해 대동물(비글 견종)의 두개골을 열지 않고 약물을 주입하는 비임상 연구를 시작했다고 12일 밝혔다.         연구원들이 집속초음파를 이용해 연구를 하고 있다. 케이메디허브 제공    케이메디허브는 집속초음파 장치를 활용해 뇌와 혈관 사이의 장벽을 일시적으로 개통한 뒤 원하는 위치에 초음파를 조사할 수 있는 기술을 보유하고 있다.  케이메디허브는 이 장비를 활용해 2021년 소동물 뇌에 약물을 주입하는데 성공한 바 있다.     케이메디허브는 이번에는 집속초음파 기술을 이용해 대동물 뇌에 약물을 주입하는 연구에 착수했으며 치매·파킨슨병 등 뇌질환과 노인성 질환 치료를 위한 기술 개발에도 나설 계획이다.     양진영 케이메디허브 이사장은 ""치매가 극복되지 않는 것은 치료제를 개발해도 뇌혈관장벽 때문에 문제부위에 약물이 도달하지 못했기 때문""이라며 ""집속초음파를 이용해 약물을 전달시키는 기술을 꾸준히 연구개발해 치매 극복의 새역사를 만들어 갈 것""이라고 말했다. ]",[''],https://hankookilbo.com/News/Read/A2023021014380004324?did=NA,https://n.news.naver.com/mnews/article/022/0003782758?sid=102
2023.02.12.,약업신문,,"케이메디허브, '뇌혈관장벽 투과 기술' 가능성 확대",,,http://www.yakup.com/news/index.html?mode=view&cat=12&nid=278535,http://www.hankookilbo.com/
2023-02-12 22:01:01,대전일보언론사 선정,오피니언,"'방치하면 시력장애 가능성'… 사막보다 건조한 내 눈, 촉촉하게 하려면","[     ⓒ게티이미지뱅크존경하는 한 선배 변호사는 자신이 대표인 로펌에서 실무 수습하는 예비법률가들에게 여성 작가의 소설을 많이 읽으라는 조언을 하신다. 직접 여쭤보지 않아 정확한 이유를 알 순 없지만, 좋은 법률가가 되려면 여성 작가의 소설에 나타나는 섬세한 언어 감각, 사회의 허위의식과 모순을 꿰뚫어 보는 세밀한 감수성 같은 것들을 배우라는 뜻이 아닐까 짐작한다. 20년 차에 가까운 '고물' 변호사라 이제 이 조언을 따른들 좋은 법률가가 되기는 기대난망이지만 그래도 이 조언을 떠올릴 때마다 여성 작가의 소설을 찾아 읽어보려 하게 된다. 새해를 맞아 무슨 책을 읽을까 하다 이 조언이 떠올랐고 그래서 고른 것이 미우라 아야코와 박완서의 글이었다. 작년이 탄생 100주년이었던 미우라 아야코 여사는 소설 '빙점'으로 잘 알려진 일본 작가인데, 국내에 가장 많은 문학작품이 번역된 일본 작가라는 점은 그만큼 알려진 것 같지 않다. 146편이 번역·출간되었다는데 2005년 통계이긴 하지만, 그때까지 110편이 번역·출간된 무라카미 하루키를 훌쩍 앞선다. 그리고 박완서 선생은 더 설명이 필요 없는 한국 현대문학의 거목이다. 얼핏 별 관련 없어 보이는 두 분의 소설을 읽고 개인사를 알아가면서 두 분에게 주목할 만한 몇 가지 공통점이 있다는 생각이 들었다. 첫째, 전쟁이 인생의 향방을 바꾸었다는 점이다. 박완서는 1950년 서울대학교 국문과에 입학했으나 그해 일어난 한국전쟁 때문에 학업의 길을 중단했다. 미우라 아야코는 초등학교 교사로 일하다가 일본의 제2차 세계대전 패전을 계기로 군국주의 교육의 허구성을 깨닫고 교사직을 그만두었다. 둘째, 전업주부로 살다가 마흔 언저리에 늦깎이로 언론사 소설 공모에 당선되어 문단에 본격 등장했다는 점이다. 미우라 아야코는 42세인 1964년 아사히신문 소설 공모에 '빙점'이, 박완서는 39세인 1970년 여성동아 소설 공모에 '나목'이 당선되었다. 셋째는 기독교 배경을 가지고 있고 그것이 작품에 깊숙이 반영되었다는 점이다. 미우라 아야코는 투병 중이던 30세 때 세례를 받고 개신교인이 되었고 박완서는 50대에 가톨릭교회에서 영세를 받았다. 넷째, 무엇보다 두 분의 글쓰기가 큰 고통 가운데 이뤄졌다는 점이다. 미우라 아야코는 20대에 당시 불치병이던 폐결핵에 걸렸고 척추 카리에스(결핵성 척수염)까지 함께 발병하여 13년간 병원에서 요양했으며 말년에는 직장암과 파킨슨병에 시달리는 등 평생을 병고와 싸워야 했다. 박완서는 한국전쟁의 와중에서 각별한 사이였던 오빠를 잃었고, 남편과 사별하는 아픔과 장성한 20대 외아들을 여의는 '참척'의 고통을 한 해에 같이 겪기도 했다.박완서는 '한 말씀만 하소서'에서 아들 잃은 고통을 일기 형식으로 풀어내는데 그 참척의 일기 서문에 '제 경우 고통은 극복되지 않았습니다. 그 대신 고통과 더불어 살 수 있게는 되었습니다'라고 고백한다. 미우라 아야코의 유언 중에도 '질병은 나에게서 건강밖에 빼앗아가지 못했습니다'라는 담담한 고백이 있다. '한 말씀만 하소서' 편집자는 책 말미 해설에서 '문학은 상처를 다독거리며 그 상처와 함께 살아가려는 의식적 반응의 산물'이라고 규정하는데 고통 속에서, 고통과 떼려야 뗄 수 없이 쓴 두 분의 글은 이러한 문학의 존재 이유를 다시금 음미하게 한다. 선배 변호사님이 하신 조언의 참뜻은 이렇듯 고통과 관련되는 것인지도 모르겠다.    우재욱 변호사 ]","['고등학교 때   만난 작가의 이름을 들으니 \n반갑고 읽으며 다가왔던 고뇌와 감정들이\n떠오르네요.', '?? : 일본에는 사랑이 없어요']",http://www.daejonilbo.com/news/articleView.html?idxno=2047828,https://n.news.naver.com/mnews/article/469/0000723044?sid=110
2023.02.11.,중도일보,,[한성일이 만난 사람]김윤배 ㈜디자인셀 대표,,,http://www.joongdo.co.kr/web/view.php?key=20230212010007043,http://www.yakup.com
2023.02.11.,시선뉴스,,이번 주 종합 베스트셀러 순위 [인포그래픽],,,http://www.sisunnews.co.kr/news/articleView.html?idxno=178407,http://www.daejonilbo.com/
2023-02-12 19:09:35,전자신문,사회,"케이메디허브, 뇌질환 초음파 치료 대동물 비임상 착수","[ 안구건조증눈물 생성 부족·눈물 증발 가속이 주원인특정 시간·눈 집중·낮은 습도에 증상 악화인공눈물로 치료…눈물점폐쇄 사용하기도    [사진=게티이미지뱅크]     고병이 건양대병원 안과 교수안구건조증은 눈물의 부족이나 눈물막의 과도한 증발로 노출된 눈꺼풀 틈새의 안구표면 손상으로 눈의 불쾌감 및 자극증상을 일으키는 눈물막의 질환이다. 찬 바람이 불고 날씨가 건조한 요즘, 눈에 모래가 들어간 것 같고, 뻑뻑하고, 시리며, 따가운 증상을 느껴서 병원을 방문하는 경우가 부쩍 늘고 있다. 가볍게 넘길 수도 있는 병이지만, 치료하지 않고 방치하면 각막염 등의 합병증으로 시력장애를 가져올 수도 있는 질환이다. 고병이 건양대병원 안과 교수의 도움말로 안구건조증에 대해 알아본다. ◇정의 및 원인=우리 눈에는 기능적으로 두 종류의 눈물기관이 있다. 주눈물샘에서는 슬프거나 아플 때 나오는 눈물(반사분비기)을 만들며, 덧눈물샘과 술잔세포, 기름샘에서는 점액과 기름성분이 있는 눈물(기본분비기)을 만든다. 특히 기본분비기에서 만들어진 눈물은 우리가 느끼지 못할 정도로 조금씩 나와서 눈의 표면을 부드럽게 윤활작용을 하며, 각막을 부드러운 표면이 되게 하고 광학적으로 맑게 하므로 눈물이나 눈물층에 이상이 있는 경우에는 좋은 시력을 얻을 수 없다. 기타 유해한 자극을 희석하고 세척하는 역할을 하며, 항균력을 가져 외부의 병원균으로부터의 보호작용을 담당한다. 안구건조증은 여러 가지 원인으로 발생하지만 크게 눈물 생성이 부족한 경우와 눈물층의 이상으로 눈물이 빨리 증발돼 생기는 경우로 생각해 볼 수 있으며, 다음과 같은 이유로 안구건조증이 발생하게 된다. 첫째 눈꺼풀 염증이 생기면 덧눈물샘의 기능저하로 눈물의 증발이 많아진다. 둘째 콘택트렌즈 착용 시 눈물의 증발이 더 많아지고 장기간 사용한 경우에는 각막의 신경이 무뎌져서 반사눈물이 줄어든다. 셋째 건조하거나 바람이 많이 부는 날씨, 히터나 에어컨에 노출되는 경우에는 눈물의 증발이 많아서 건조증을 악화시킨다. 넷째 쇼그렌증후군, 류마티스 관절염, 루프스 같은 자가면역 질환이 있거나 나이가 들면서 눈물 생성량이 줄어들 수 있다. 특히 여성은 폐경기 이후에 증상이 심해진다. 다섯째 알레르기약, 고혈압약, 항부정맥 약물, 항우울제, 파킨슨씨병 치료제 등과 같은 약물 복용 시 눈물의 분비량이 줄어들 수 있다. 마지막으로 텔레비전, 컴퓨터 모니터, 스마트폰 등을 오랜 시간 사용하는 경우 눈을 깜빡이는 횟수가 줄고 화면을 보면서 눈을 크게 떠서 눈물의 증발이 정상보다 많아질 수 있다. ◇증상 및 진단=환자들이 느끼는 증상으로는 눈이 따갑고 타는 느낌, 콕콕 찌르는 아픔, 가려움증, 이물감, 뻑뻑함, 쓰라림, 눈꺼풀이 무거운 느낌, 눈부심, 안구 피로감 등으로 매우 다양하다. 이는 안구표면에 건조함을 느끼는 특이적인 감각기가 없어 환자들이 자신의 증상을 각자 다양하게 표현하게 되는 것이다. 때로는 오히려 눈물이 더 나온다고 호소하기도 하는데 이는 이물감 등의 자극에 대한 반사작용으로 주눈물샘의 눈물이 더 나오는 것이라고 설명할 수 있다. 안구건조증 환자들의 증상에는 두 가지 특징이 있다. 첫째, 증상이 밤에 심해지거나 아침에 일어날 때 악화되는 등 하루 중에 변동이 있다. 둘째, 독서, 텔레비전 시청 등 계속적인 눈의 집중을 필요하는 경우, 에어컨, 연기, 비행기 안의 낮은 습도 등에 의해 증상이 악화된다. 안구건조증은 환자의 증상과 눈물막 파괴시간 측정(BUT검사), 눈물 분비량 검사(Schirmer test), 각막과 결막의 생체염색 등의 검사를 통해 진단할 수 있으며, 치료목적은 환자의 증상을 좋게 하고 객관적인 검사소견을 호전시키는 것이다. 환자와의 상담을 통해 완치는 안되지만 적절한 치료로 악화되지 않고 호전될 수 있음을 이해시킨다. ◇치료=건조증을 치료하는데 기본적인 약제는 인공으로 만들어진 눈물(인공눈물)이다. 인공눈물은 눈에 물기를 더해 표면을 적셔주고 오랫동안 수분을 저장함으로써 환자의 눈이 편하게 한다. 현재 많은 종류의 인공눈물이 제품으로 나와 있으므로 의사와의 상담을 통해 자신에게 가장 적합한 것을 사용하는 것이 중요하다. 일반적인 인공눈물에는 세균감염 방지 목적으로 보존제가 들어 있어서 눈에 독성을 나타내는 경우도 있으므로, 하루 4번 이상으로 자주 사용해야 하는 심한 건조증에서는 보존제가 없는 인공눈물을 사용하는 것이 바람직하다. 아침에 건조해 눈뜨기가 힘든 증상이 있는 경우는 자기 전 인공눈물 성분의 안연고를 사용함으로써 효과를 볼 수 있다. 그러나 이런 연고는 낮에 사용하면 흐려보이는 문제를 일으키므로 밤에 잠자기 전 소량을 사용하는 것이 좋다. 심한 건조증에는 환자 자신의 피를 정제한 자가혈청을 안약으로 만들어서 사용하기도 하며, 혈청 내의 여러 성장인자와 비타민 A 성분이 안구표면을 유지하는 데 도움이 된다. 사이클로스포린A 성분의 안약은 항염증 작용으로 눈물샘의 파괴를 억제하는 효과가 있어서 중등도 이상의 건조증에 효과적으로 사용되고 있다. 최근에는 눈물의 점액성분을 증가시키는 치료약이 도입돼 눈물막 파괴시간이 짧은 형태의 안구건조증 환자들에게 도움이 되고 있다. 건조증이 눈꺼풀의 염증과 관련된 경우 눈꺼풀의 청결을 위해 마사지를 하거나 깨끗이 씻는 것이 좋고, 항생제 안약이나 전신적인 항생제를 사용하기도 한다. 이미 분비된 눈물을 보존하는 방법으로 눈물점 마개를 사용한 눈물점폐쇄를 사용하기도 하며, 눈물점 마개는 콜라겐 성분이나 생체흡수성 재질로 만들어져서 삽입 후 일정시간이 지나면 저절로 녹아서 흡수되는 것과 실리콘 성분으로 반영구적으로 사용되는 것이 있다. 보통은 아래쪽의 눈물점을 막지만, 심하면 상하의 눈물점을 모두 막기도 한다. ◇예방=위의 치료방법들과 더불어 환경을 건조하지 않게 하면 눈물의 증발이 줄어들기 때문에 도움이 된다. 예를 들면 겨울에 난방할 때는 젖은 빨래를 걸어 놓거나 가습기를 사용하여 습도를 올리거나, 실내 온도를 조금 낮춰 주면 좋다. 그밖에 외출 시에는 보호용 안경을 착용하고, 책이나 컴퓨터를 볼 때는 30분 간격으로 휴식을 취하는 것이 좋다. 도움말=고병이 건양대병원 안과 교수   ]","['아놔', '얼굴에 일부분만 보이는대도 이쁨이 묻어난다...']",https://www.etnews.com/20230211000008,https://n.news.naver.com/mnews/article/656/0000042254?sid=102
2023.02.10.,매경헬스,,[전문의 기고] '제대혈' 기증 알고있나요?,,,http://www.mkhealth.co.kr/news/articleView.html?idxno=62450,http://www.joongdo.co.kr
2023.02.10.,메디컬투데이,,"케이메디허브, 뇌질환 초음파 치료 대동물 연구 개시",,,https://mdtoday.co.kr/news/view/1065580262407431,http://www.sisunnews.co.kr
A18면 1단,한국경제,,[책마을] 위기에 빠진 이들을 위한 7가지 도구,,,https://www.hankyung.com/life/article/2023021095831,http://www.etnews.com
A18면 1단,한국경제,,[책마을]  3~20위 싹쓸이… 후속작은 2위,,,https://www.hankyung.com/life/article/2023021095821,http://www.hankyung.com/
2023-02-10 18:26:02,바이오스펙테이터,생활/문화,"에이비엘, 작년 당기순이익 32억 “첫 흑자전환”",[ 이주의 베스트셀러    ‘슬램덩크’ 열풍이 꺼지지 않고 있다. 영화 ‘더 퍼스트 슬램덩크’ 관람객이 250만 명을 돌파한 가운데 예스24 종합 베스트셀러 3위부터 20위까지를 모두 만화책 &lt;슬램덩크 신장재편판&gt;이 채웠다. &lt;만일 내가 인생을 다시 산다면(20만 부 기념 양장본 에디션)&gt;은 2주 연속 1위를 차지했다. 22년 전 마흔세 살에 파킨슨병에 걸린 정신과 의사가 지은 책이다. 2위는 &lt;김미경의 마흔 인생&gt;이 올랐다. &lt;언니의 독설&gt; 후속작으로 40대를 맞이한 이들에게 전하는 격려를 담았다. ],['나두 가지고 싶당'],http://www.biospectator.com/view/news_view.php?varAtcId=18259,https://n.news.naver.com/mnews/article/015/0004809265?sid=103
2023.02.10.,의학신문,,"케이메디허브, 뇌질환 초음파 치료 대동물 연구 개시",,,http://www.bosa.co.kr/news/articleView.html?idxno=2190842,http://www.biospectator.com
2023.02.10.,약업신문,, 남북전쟁과 모르핀,,,http://www.yakup.com/pharmplus/index.html?mode=view&cat=25&cat2=478&nid=3000132975,http://www.bosa.co.kr
2023.02.10.,이투데이,,사상 최대 매출에도 적자 늘어난 일동제약…이유는?,,,https://www.etoday.co.kr/news/view/2220783,http://www.yakup.com
2023.02.10.,허프포스트코리아,,'90분 저강도 운동 vs 6분 고강도 운동' 노년기까지 뇌를 건강하게 지킬 수 있...,,,https://www.huffingtonpost.kr/news/articleView.html?idxno=206731,http://www.etoday.co.kr
2023.02.10.,약사공론,,"메타센테라퓨틱스, 신경퇴행성 질환용 바이오마커 국내 특허 취득",,,https://www.kpanews.co.kr/article/show.asp?idx=239939&category=B,http://www.huffingtonpost.kr
A20면 1단,한국경제언론사 선정,,눈 돌아가거나 얼굴 씰룩거리면 뇌전증 의심…대다수 약물로 호전 [김정은 기...,,,https://www.hankyung.com/life/article/2023021094911,http://www.kpanews.co.kr
2023.02.10.,이투데이,,에스바이오메딕스. 코스닥 상장 예비심사 통과…상장 절차 본격화,,,https://www.etoday.co.kr/news/view/2220651,http://www.hankyung.com/
