Date,Press,Category,Title,Content,Comment,URL_Origin,URL_Naver
2021-07-27 13:57:09,e의료정보,생활/문화,"대웅제약·한올바이오파마, 미국진출·오픈콜라보레이션 확대 나선다","[     [사진=로빈 윌리엄스 인스타그램]국내에서 '죽은 시인의 사회', '굿 윌 헌팅' 등의 영화로 잘 알려진 할리우드 배우인 로빈 윌리엄스의 아들이 최근 로빈의 사망 배경에 오진(잘못된 진단)이 있었다고 언급했다.  해외는 물론 국내에서도 큰 사랑을 받았던 로빈은 지난 2014년 스스로 생을 마감했다. 그의 부인에 따르면 로빈은 자신의 질병 때문에 우울증을 보였던 것으로 전해진다.  최근 로빈의 아들인 잭 윌리엄스는 '지니어스 라이프'라는 팟캐스트에 출연해 아버지의 우울증과 불안증, 오진 등에 대해 이야기했다.  잭은 로빈이 2년간 루이소체 치매(DLB)를 앓았으며, 이는 가족들에게도 고통스러운 경험이었다고 전했다. 루이소체 치매는 알츠하이머병과 파킨슨병 증상이 둘 다 나타나는 치매로, 전체 치매 사례의 10~15% 정도를 차지하고 있다.  국제알츠하이머협회에 따르면 루이소체 치매를 앓고 있는 사람들은 파킨슨병 증상 때문에 운동기능이 저하되고, 알츠하이머병 증상으로 인지기능도 떨어지게 된다.  그런데 잭에 따르면 로빈은 사망하기 2년 전 루이소체 치매가 아닌 파킨슨병 진단을 받았다. 로빈의 직접적인 사인은 질식사지만, 잭은 로빈이 스스로 목숨을 끊은 근본적인 원인에 오진이 있었을 것으로 보았다. DLB 치료가 아닌 파킨슨병 치료를 받았고, 그 과정에서 사용한 약물과 부작용 등이 로빈을 매우 힘들게 했다는 것이다.  잭은 로빈이 우울증, 불안증 등으로 고통을 겪는 동안 일주일에 몇 차례씩 대화를 나눴다. 그리고 결국에는 매일 대화를 나누는 노력을 했다고 전했다. 루이소체 치매를 앓고 있는 사람은 가족이나 사랑하는 사람과 함께 있어도 고립감을 느낄 수 있기 때문이다.  치매 환자를 둔 가족으로서 힘든 시간을 보냈던 잭은 이후 병원에서 심리적 외상 후 스트레스 장애(PTSD) 진단을 받았다. 또한, 정신건강 문제에 관심이 커졌고, 현재는 정신건강 관련 단체들과 함께 일하고 있다.  잭은 정신건강에 문제를 겪고 있는 사람들이 탈출구를 찾지 못하고 있다는 점에 안타까움을 표했다. 미국자살예방재단에 따르면 남성은 여성보다 스스로 목숨을 끊을 확률이 4배가량 높다. 이는 남성들이 정신적으로 힘든 부분이 있어도 이를 주변에 말하기 쉽지 않기 때문일 것으로 보고 있다. 잭은 이처럼 고립감을 느끼고 치료에 적극적으로 임하지 못하는 사람들을 돕고 싶다고 말했다. 잭은 로빈의 사망 이후 루이소체 치매에 대한 여러 연구들에 투자하고 있으며, 정신 웰니스 관련 기업도 운영 중이다.  ]","['영화를 통해 우리에게 웃음과 감동을 주었던 로빈이 갑자기 떠나 많이 안타까웠던 기억이 나네요.', '저도 로빈 윌리암스 님과 비슷한 힘듬을 겪는 중에 있는데요 그 와중의 전문직업에 속하는 사회복지사를 하시는 한 분의 잘못된 시선으로도 괴로움을 당한 적이 있습니다. 여튼 누가 됐든 본인(전문직업)의 명목화된 기준이 있으셔야할 것 같습니다. 우리나라에는 더욱이 의사 면허 관련해서도 잘못된 사회적 기준이 있는 것으로 알고 있는데요. .. 가족들 고생 많으셨겠네요.', '벌써 7년이나 됐네..저 눈빛을  참 좋아했는데..ㅜㅜ', '마음따뜻한 영화 늘 감사했습니다\n ㅜ ㅜ', '오진짜증나 환자에따라 오진결과대로 믿고 인생을 지포자기하는경우가 많다', '죽은시인의 사회 내 인생 영화... Seize the day', 'Oh captain my captain...ㅠㅠ', '의사놈들  오진많다. 환자를돈으로보지', '약물이 자살확울이 높다', '', '']",http://www.kmedinfo.co.kr/news/articleView.html?idxno=69180,https://n.news.naver.com/mnews/article/296/0000051023?sid=103
2021.07.26.,연합뉴스,,"""피마반세린, 치매 환자 정신병증에 효과""",,,http://yna.kr/AKR20210726032500009?did=1195m,http://www.kmedinfo.co.kr
2021.07.20.,이데일리,,파킨슨병증후군과 이차성 파킨슨증 구별하려면 뇌 영상의학적 검사 필요,,,http://www.edaily.co.kr/news/newspath.asp?newsid=02801126629116488,https://www.yna.co.kr/
2021-07-26 09:14:52,헤럴드경제,사회,파킨슨병 정복·가상 핵융합발전로 구현…과학난제 해결 ‘드림팀’ 뜬다,"[     치매[제작 이태호] 일러스트 (서울=연합뉴스) 한성간 기자 = 파킨슨병 환자의 망상 치료제로 미국 식품의약국(FDA)의 승인을 받은 피마반세린(pimavanserin)이 치매 환자의 환각, 망상 등 정신병증(psychosis) 치료에도 효과가 있다는 새로운 연구 결과가 나왔다.   미국 배너 알츠하이머병 연구소(Banner Alzheimer's Institute) 소장 피에르 타리오 박사 연구팀이 상담심리(counselling) 치료가 듣지 않는 정신병증을 보이는 치매 환자 351명을 대상으로 진행한 임상시험 결과 파마반세린의 효과가 확인됐다고 헬스데이 뉴스가 24일 보도했다.   치매 환자들이 흔히 보이는 여러 형태의 정신병적 증상 가운데 대표적인 것이 망상이다. 누가 자기를 해치려 한다든가, 자기 물건을 훔치려 한다든가 착각하는 것으로 불안, 공격적 행동, 언어폭력으로 이어져 가족이나 보호자를 힘들게 만든다.   알츠하이머 치매 환자는 거의 절반이 정신병증을 보인다. 정신병증은 치매 증상을 더욱 빨리 악화시키는 것으로 알려져 있다.   연구팀은 먼저 환각, 망상 증상을 보이는 치매 환자 약 800명을 대상으로 의료지침에 따라 약물 투여 없이 심리상담 치료를 시행했다. 이를테면 환자를 안심시키거나 음악, 산보 등으로 관심을 다른 데 돌리게 하는 치료법이다.   5주 후 이 중 351명은 정신병증이 여전했다. 그래서 이들 모두에게 피마반세린을 12주 동안 투여했다. 그중 62%가 피마반세린에 꾸준한 반응을 보였다.   이 시점에서 연구팀은 이들을 두 그룹으로 나누어 반은 피마반세린을 계속 투여하고 나머지 반은 위약(placebo)으로 바꾸어 26주 동안 투여했다.   18주 후 두 그룹 사이에 분명한 차이가 나타났다. 피마반세린 그룹에서는 13%, 대조군에서는 이의 두 배가 넘는 28%가 환각 또는 망상이 재발했다.   그러나 피마반세린의 효과를 확인하기 위해서는 더 많은 치매 환자가 참가하는 장기간의 임상시험이 필요하다고 연구팀은 강조했다.   장기간 효과에 관한 자료가 아직 없는 데다 치매 종류에 따라 효과에 차이가 있는지도 불투명하기 때문이라고 연구팀은 지적했다.   이번 임상시험 참가 환자는 반수 이상이 알츠하이머 치매 환자이지만 3분의 1은 파킨슨병 치매, 혈관성 치매 또는 루이소체(Lewy bodies) 치매 환자였다.   발생 빈도가 높은 부작용은 두통, 변비, 요도 감염으로 나타났다.   이 약의 복약안내서에 나와 있는 부작용으로 부정맥의 일종인 'QT 간격 연장 증후군'(long QT syndrome)은 임상시험 참가자 중 3명에게서 나타났다.   피마반세린(제품명: 누플라지드)은 아카디아(Acadia) 제약회사가 개발해 2016년 파킨슨병에 수반되는 망상 치료제로 FDA의 승인을 받았다.   현재 치매 환자의 정신병증을 치료할 수 있는 안전하고 효과적인 약은 승인된 것이 하나도 없다.   상황이 이렇다 보니 조현병, 조울증 등의 치료에 사용되는 일반적인 항정신병 제제(antipsychotics)가 대신 사용되고 있으나 진정(sedation), 운동장애, 현기증, 낙상 등 부작용 위험이 크고 뇌 기능 악화를 가속화시킨다. 여기서 진정이란 약물에 의해 의식 수준이 저하된 반수면 상태를 말한다.   그러나 피마반세린은 망상을 촉발하는 것으로 믿어지는 뇌 신경세포의 특정 수용체(5HT2A)를 차단하기 때문에 이러한 항정신병 제제와는 작용 기전이 다르다. 따라서 항정신병 제제의 부작용들은 나타나지 않는다.   피마반세린은 약값이 상당히 비싸다. 2016년 판매 승인을 받아 시장에 나왔을 때 1년분 가격이 2만4천 달러(한화 약 2천765만 원)였던 것으로 알려졌다.   이 연구 결과는 미국의 의학 전문지 '뉴 잉글랜드 저널 오브 메디신'(New England Journal of Medicine) 최신호에 발표됐다.    skhan@yna.co.kr ]","['2765만..............................................', '나같이 홀로 심각한 망상증상에 병원진료 및 모든 치료의 절차를 전부 거부하는 어머니와 함께 살고있는 사람은 도저히 희망이 없다.너무나 기막히고 슬프고 가혹한 현실.']",http://news.heraldcorp.com/view.php?ud=20210722000806,https://n.news.naver.com/mnews/article/001/0012551333?sid=102
2021.07.27.,메디컬월드뉴스,,"새로운 파킨슨병 세포치료제 개발…안전성, 유효성 극대화 추진",,,http://medicalworldnews.co.kr/news/view.php?idx=1510943738,http://www.edaily.co.kr/
2021-07-20 13:32:02,약업신문,사회,파킨슨병약 ‘이스트라데필린’ 승인 유럽 부정적 견해,"[ - 파킨슨병 평가하는 다양한 영상바이오마커 중, 흑질 영상에 대한 최신 연구 결과 정리한 리뷰 논문 발표[이데일리 이순용 기자]최근 국내 연구진이 파킨슨병 및 파킨슨 증후군에서의 뇌 자기공명영상(MRI)의 최신 지견을 집대성한 리뷰 논문(종설)을 발표해 관심을 모으고 있다. 리뷰 논문은 해당 분야 최고 전문가들이 최신 연구 성과와 결과를 총망라해 동향을 정리하고, 앞으로 해결해야 할 과제와 연구 방향을 제시하는 형태의 논문을 말한다.분당서울대병원 신경과 김종민 교수와 영상의학과 배윤정 교수를 주축으로 한 파킨슨병 연구팀이 작성한 이번 논문은 파킨슨병의 영상 바이오마커에 관한 세계 최고 저널의 종설 논문이라는 점에서 연구 역량을 높게 인정받고 있다.파킨슨병은 치매 다음으로 흔한 대표적인 퇴행성 뇌 질환으로, 중뇌에 위치한 흑질에서 도파민(운동에 꼭 필요한 신경전달물질)을 분비하는 신경세포가 서서히 소실돼 서동증(느린 운동), 근육 떨림과 강직, 자세 불안정 등의 운동장애 증상이 발생하는 병이다.전형적인 파킨슨병의 경우에는 증상과 신경학적 검사만으로도 진단을 내릴 수 있지만, 증상이 유사한 파킨슨 증후군이나 이차성 파킨슨증과 구별하기 위해서는 자기공명영상(MRI)과 같은 뇌의 영상의학적 검사가 필요하다.이에 분당서울대병원 파킨슨병 연구팀은 파킨슨병의 평가에 적용되는 다양한 영상 바이오마커 중, 특히 흑질 영상에 대한 최신 연구 결과를 정리한 리뷰 논문을 발표했다. 중뇌의 도파민 신경경로 양상 중 나이그로좀영상과 뉴로멜라닌영상, 정량적철침착영상, 신경경로에 대한 확산텐서영상이 포함됐고, 파킨슨병 및 파킨슨 증후군의 증상과 연관된 뇌부피측정기법에 대해서도 설명했다.파킨슨병 진단을 위해서는 다양한 MRI 기술을 결합해 흑질 구조의 변화를 시각화하는 것이 중요하다. 과거 MRI로는 흑질 구조를 상세하게 보기 어려웠으나, 최근 보편화 된 3T 및 7T(T(테슬라)는 MRI 촬영에 쓰는 자석 자장 세기로, 숫자가 높을수록 선명한 영상을 얻는다)를 이용한 고해상도 MRI로 보다 자세히 촘촘하게 촬영이 가능해졌다. 파킨슨병의 병소인 나이그로좀(nigrosome) 영역의 음영을 이러한 고해상도 MRI를 통해 가시화하고 손상 부위를 파악함으로써 파킨슨병을 정밀하게 진단하는 것이다.     정상 모양의 흑질(좌), 파킨슨병 환자의 흑질(우) MRI 영상.(흑질(substantia nigra)의 검정 부위 사이에 좌측 그림의 노란색 화살표가 가리키는 밝은 부분이 있으면 정상이고, 우측 그림처럼 검정색으로 메워지면 도파민신경세포가 소실된 환자이다.)파킨슨병을 진단하는데 도움이 되는 또 다른 자기공명기법은 뇌 속의 뉴로멜라닌 분포를 확인하는 방법이다. 뉴로멜라닌은 흑질에서 도파민이 분비될 때 함께 생성되는 신경보호물질로, 뉴로멜라닌만 민감하게 관찰할 수 있는 MRI로 뇌 속 도파민의 변화량을 파악해 파킨슨병 여부를 진단한다.이 뉴로멜라닌은 신경세포 안에 점차 쌓이는데, 만약 파킨슨병처럼 신경세포가 소실되는 경우에는 뉴로멜라닌 또한 함께 사라지게 된다. 따라서 뉴로멜라닌이 과다한지 부족한지를 관찰해 도파민의 분비량을 파악하면 파킨슨병을 조기에 진단하는데 도움이 되고, 치료하는 동안 예후도 객관적으로 판단이 가능하다.이에 더해 MRI를 이용해 뇌 속 철(Fe)의 분포를 분석하는 기법도 파킨슨병을 진단하는데 도움이 된다. 흑질에서 분포되는 뉴로멜라닌이 외부에서 유입된 철 성분을 붙잡는 역할을 하는데, 문제는 뉴로멜라닌이 수용할 수 있는 한계보다 흑질 내 철이 많아 침착되면서 발생한다. 흑질에 침착된 철 성분은 뇌 조직에 스트레스를 유발하고 세포를 괴사시키는 것으로 알려져 있어, 흑질 내 철이 많이 침착되면 파킨슨병의 발병으로 이어질 확률이 높아진다.구조적 MRI는 대뇌피질의 특성 및 부피 감소와 같은 뇌의 구조적 변화도 밝힐 수 있고, 확산텐서영상(DTI) 기법을 통해 뇌 여러 영역의 구조적 차이를 관찰하며 초기 파킨슨병의 잠재적 지표를 확인할 수 있다. 파킨슨 환자의 경우 건강한 사람보다 흑질의 부피가 더 많이 감소하는 경향을 보이므로, 이러한 변화가 확인될 경우 파킨슨병으로 진단하게 된다.영상의학과 배윤정 교수는 “간단하고 부작용 없는 MRI 검사는 파킨슨병 기저의 신경해부학적, 기능적, 병태생리학적 변화를 감지하는 바이오마커로 활용성이 높다”며, “다양한 기법의 영상 접근을 통해 뇌의 구조적 변화와 뇌 속 신경물질의 분포 및 그 정도를 정량적으로 파악하면 파킨슨병을 조기에 진단해 예방하거나 적절한 치료 계획을 세우는데 도움이 될 수 있다”고 언급했다.이어 연구를 주도한 신경과 김종민 교수는 “간과하기 쉬웠던 파킨슨병 및 파킨슨 증후군에서의 MRI 영상이 파킨슨병의 진단 및 치료, 장기적 추적관찰에 중요함을 다시 한 번 강조한 연구로서 의미가 있다”며, “영상의학적 발전에 따라 파킨슨병을 조기에 진단할 수 있게 된 만큼, 손발이 떨리고 몸이 느려지기 시작한다면 단순 노화현상으로 치부하지 말고 병원을 찾는 것이 좋다”고 덧붙였다.한편 이번 리뷰 논문은 영상의학 분야 최고 권위 국제 학술지인 ‘Radiology’ 최신호에 온라인으로 게재됐으며, 파킨슨병 영상바이오마커의 최신 지견을 집대성한 논문으로 주목받고 있다. ]",[],http://www.yakup.com/news/index.html?mode=view&cat=16&nid=259644,https://n.news.naver.com/mnews/article/018/0004989770?sid=102
2021.07.29.,MTN,,"디앤디파마텍, 이르면 10월 '두 번째' 코스닥 상장예비심사 청구",,,https://news.mtn.co.kr/newscenter/news_viewer.mtn?gidx=2021072910523778499,http://www.heraldbiz.com/
2021-07-22 13:55:03,아시아경제,IT/과학,전기자극으로 파킨슨병·뇌졸중 치료 기술 개발,"[ - 과기정통부 3개 융합연구단 선정, 5년간 각각 90억원 투입    우리나라를 포함한 7개국이 공동참해 프랑스 카다라쉬에 건설중인 국제핵융합실험로(ITER).[한국핵융합에너지연구원 제공][헤럴드경제=구본혁 기자] 핵융합발전 시대를 열어줄 가상 핵융합로를 구현하고 우주 암흑에너지의 근원을 찾는 과학난제 해결을 위한 국가대표팀이 출범했다.과학기술정보통신부는 과학난제도전 융합연구개발사업의 2021년도 신규 과제를 선정, 3개의 선도형 융합연구단인 ▷ST핵융합메타웨어 연구단 ▷중력파우주 연구단 ▷표적신경회로재생 연구단이 공식 출범한다고 22일 밝혔다.과학난제사업은 그동안 해결하지 못한 과학난제에 대해 기초과학과 공학의 융합연구를 통한 혁신적인 방법으로 접근하는 도전적인 연구개발을 지원하는 사업으로 세계 최고·최초·유일의 성과 창출을 목표로 한다.ST핵융합메타웨어 연구단은 핵융합 플라즈마 난제를 해결해 2050탄소중립을 위한 인공태양 발전소 구축을 현실화하고자 한다.현재 핵융합연구는 1988년 설계를 시작으로 2025년 완공을 목표로 하는 국제핵융합실험로 ITER를 중심으로 장치 성능 향상 등을 진행하고 있다.이번 연구에서는 장치의 대형화로 인한 개발비용과 물리적 한계를 극복하는 것을 목표로 한다. 차세대 디지털트윈 구현 및 검증(1단계), 고성능 컴퓨팅 기반 가상 핵융합로 구축(2단계)을 통해 단기간·저비용으로 소형 ST 핵융합 발전로 구축 기반을 확보한다.이를 통해 기존 답보상태에 있거나 병목현상이 야기된 핵융합분야에서 혁신을 이끌 수 있는 과학기술적인 성과를 창출할 수 있을 것으로 기대된다.중력파우주 연구단은 다중신호 천문학과 인공지능을 활용하여 허블상수를 정밀하게 측정하고 암흑에너지의 성질을 규명하고자 한다.허블상수는 은하의 속도와 거리 사이의 관계를 나타내는 비례상수로, 암흑에너지와 밀접한 상관관계가 있다. 암흑에너지는 우주의 가속팽창을 설명하는 핵심 개념이며, 아직 정체가 밝혀지지 않은 난제의 영역이다.이번 연구에서는 7차원적 망원경을 개발해 중성자별과 블랙홀 충돌에서 발생하는 중력파와 다양한 파장의 전자기파를 관측하고 통계분석한다.관측데이터를 통해 허블 상수의 정밀도를 높이고, 주요 매개 변수 측정을 통해 암흑에너지 성질 규명에 한 발자국 더 나아가고자 한다.    우주의 진화를 보여주는 도식도(왼쪽)와 다중망원경 시스템(오른쪽).[과기정통부 제공]천문·우주 분야의 경우 선진국과의 격차가 작고 본질적으로 국제 융합 연구가 요구되는 분야인데, 연구단의 국제적 네트워크를 활용하여 우주론 연구의 돌파구를 마련할 것으로 기대된다.표적신경회로재생 연구단은 도파민 신경망 재건 플랫폼을 구축해 신경세포의 소실로 인한 난치성 신경 질환 극복을 목표로 한다.신경장애는 대체 또는 재생을 위한 다양한 치료법 개발이 시도되고 있음에도 불구하고 손상된 신경 및 신경망의 완전한 회복은 여전히 난제로 남아있다.이를 해결하기 위해 뇌 신경망 형성을 위한 줄기세포 등에 자성을 부여하고 제어가 가능한 멀티봇을 개발하여, 실제 신경 조직과 동일한 수준의 도파민 신경회로망 재건(1단계), 전임상시험을 통한 안전성·유효성 검증(2단계)을 하고자 한다.신경망 재건 기술을 통해 파킨슨 운동장애 등의 뇌질환 치료의 새로운 패러다임을 주도할 수 있을 것으로 보이며, 생명과학 및 의료서비스 분야의 성장을 위한 핵심 원천기술이 될 수 있을 것으로 기대된다.선정된 연구단에는 5년 동안 각각 총 90억원을 지원하고, 연구단별 전문위원회 운영을 통해 맞춤 멘토링 실시, 연구내용 점검 및 새로운 아이디어 제안을 위한 공개형 토론회 개최 등 기존에 시도하지 않은 난제도전형 연구수행 방식을 도입한다.이창윤 과기정통부 기초원천연구정책관은 “최근 혁신적인 연구성과는 실패를 두려워하지 않는 과감하고 도전적인 연구에서 창출되고 있다”며 “과학난제사업을 통해 어렵기 때문에 도전할 가치가 있는 과제를 발굴·지원함으로써, 난제 해결을 위한 융·복합 연구가 자연스레 촉발될 수 있는 기반이 조성되었으면 한다”고 밝혔다. ]","['대단하네요', '핵융합 성공하면 원전따위 완전히 대체할 수 있는기술이라 기대가 많이되네요. 안전성 발전비용 전력생산량 모두 압도적이면서 친환경']",https://view.asiae.co.kr/article/2021072009230384119,https://n.news.naver.com/mnews/article/016/0001865110?sid=105
2021.07.20.,아시아경제,,전기자극으로 파킨슨병·뇌졸중 치료 기술 개발,,,https://view.asiae.co.kr/article/2021072009230384119,https://www.asiae.co.kr/
2021-07-20 09:21:53,헬스조선,IT/과학,"분당서울대병원 연구팀, 파킨슨병 진단 영상 바이오마커 리뷰 논문 게재","[ DGIST, 뇌신경 질환 치유 위한 전기 자극 및 모니터링 기술 선보여고위인지기능 향상 시키는 등 잠재적 활용 가능성 풍부    역치이하 자극을 통한 뇌신경 활성화 조절 및 뇌가소성 조절 개요. 그림제공=DGIST전기 자극을 통해 뇌졸중이나 파킨슨병 같은 뇌 신경 질환을 치료할 수 있는 기술이 개발됐다. 대구경북과학기술원(DGIST)은 최지웅 뇌공학융합연구센터장, 장재은 정보통신융합전공 교수, 문제일 뇌·인지과학전공 교수 공동연구팀이 뇌신경 질환 치유를 위한 전기 자극 및 모니터링 기술을 개발했다고 20일 밝혔다. 연구팀은 ""기존의 뇌자극 치료 연구의 기술적 한계를 넘어 미래 뇌신경 관련 기술 개발에 큰 도움을 줄 것으로 기대한다""고 설명했다.최근 평균 수명이 늘어나면서 다양한 뇌신경 질환 발병률 또한 증가하고 있다. 이에 따라 뇌 질환 치료나 뇌 기능 연구를 위한 뇌신경 전기 자극법이 각광받고 있다. 뇌 전기 자극법은 외부에서 가한 전기 자극을 통해 뉴런의 활성화를 조절하는 기술이다.현재 대부분의 뇌 전기 자극 연구는 인위적인 신경 활성화를 불러오는 역치 이상 자극(suprathreshold)이 주로 활용되는데, 이는 복잡한 뇌신경 네트워크 내에 원치 않은 영역까지 자극해 부작용이 발생한다. 지속적인 자극을 요하는 경우 더 많은 배터리 용량이 요구되며 인체 내 배터리 교체를 위한 수술 횟수 증가 등 어려움이 있다.연구팀은 뇌신경 활성화를 역치자극의 30%의 전력으로 자극하는 역치이하 신경 자극 기술(subthreshold electrical stimulation, STES)을 고안했다. 연구팀은 뇌신경 모델링을 기반으로 신경 자극 시뮬레이션과 동물 실험 검증 등 다양한 방법을 통해 안정성을 입증했다. 이를 통해 뇌졸중의 재활에 중요한 역할을 하는 뇌신경 가소성(可塑性)을 유도하는 기술을 최초 개발했다.특히 신경 활성에 필요한 전력보다 더 낮은 세기의 자극을 줌으로써 배터리 사용시간을 늘리고 국소 부위만 자극함으로써 부작용을 최소화할 수 있다는 사실을 확인했다. 연구팀은 신경 활성화를 조절해 뇌 신경회로를 원하는 방향으로 유도할 뿐만 아니라, 학습과 같은 인간의 고위인지기능을 향상시킬 수 있는 잠재력이 풍부한 기술이라고 밝혔다.최지웅 센터장은 “기존의 강제적 신경 활성화가 아닌, 시냅스 전단의 활성화를 증폭시켜 자연스러운 생리적 신경 활성을 유도해 더 적은 부작용과 적은 에너지 소모가 장점”이라며 “전자공학, 뇌과학 분야 전문가들의 융합 연구 결과로 기존 의료기술의 한계를 극복한 뇌신경 자극 기술에 적극 활용할 수 있을 것으로 기대된다”고 말했다.이번 연구 결과는 국제학술지 네이처(Nature)의 자매지인 사이언티픽 리포트(Scientific Reports)에 지난 8일자 온라인 게재됐다. ]",[''],https://health.chosun.com/site/data/html_dir/2021/07/20/2021072000737.html,https://n.news.naver.com/mnews/article/277/0004940138?sid=105
2021.07.29.,팜뉴스,,"대웅제약·한올바이오파마, 미국 진출·오픈콜라보레이션 확대",,,http://www.pharmnews.com/news/articleView.html?idxno=106073,http://health.chosun.com/
