Date,Press,Category,Title,Content,Comment,URL_Origin,URL_Naver
2022-09-18 12:20:01,헬스조선언론사 선정,IT/과학,"햇반, 안 데우고 먹어도 될까? [주방 속 과학]","[ 로완  한승현 대표 인터뷰경도 인지장애 환자 개선 효과 확인“논문 나오자 반응 폭발…UCL·하버드대도 관심”“연내 시리즈B 투자 목표…美 허가 자금”    한승현 로완 대표가 지난 7일 서울 중구 연세세브란스빌딩 자신의 사무실에서 환하게 웃고 있다. /최정석 기자        지난해 2월 한승현 로완 대표의 휴대전화로 국제전화 한 통이 걸려왔다. 영국 유니버시티 칼리지 런던(UCL) 의대 질 리빙스턴 정신과 교수이었다. 리빙스턴 교수는 지난 1998년부터 랜싯 등 주요 국제학술지에 논문 300여편을 실어 온 정신과 분야에서 세계적 연구자로 불린다. 리빙스턴 교수의 논문은 지난 25년간 6만1000번 이상 인용됐다.리빙스턴 교수는 통화에서 “로완이 개발한 인지중재치료용 소프트웨어 ‘슈퍼브레인’을 영국 환자에게 써보겠다”고 말했다. 영국 국립보건연구원(NHIR)의 예산을 지원받아 임상을 진행할 계획인데 이 시험에서 슈퍼브레인 제품을 이름과 함께 쓰겠다는 구체적 계획도 전했다. 인지중재치료란 학습지 풀기, 운동 같은 뇌에 자극을 주는 일상적 방법으로 인지능력을 개선하는 신개념 치료 방법이다.기존에는 인지능력 개선을 위해 제작한 학습지를 치매 환자에게 나눠주고, 의료진이 환자 옆에 붙어 문제풀이를 돕는 식으로 이뤄졌다. 하지만 치매 환자를 모을 공간과 이들을 장시간 돌봐줄 인력이 필요하다보니 병원들에겐 오랜 기간 프로그램을 운영하는 게 어려웠다.한 대표는 병원이 아닌 노인 복지관, 집에서 환자가 의료진 도움 없이 스스로 인지중재치료를 받도록 돕는 소프트웨어를 떠올렸다. 한 대표는 2017년 로완을 설립해 인지중재치료에서 학습지 풀이 과정을 대체할 소프트웨어를 개발했다. 2018년에는 인지중재치료용 프로그램 개발을 지원하는 정부 과제를 따냈다.로완은 치매로 번질 가능성이 높은 고혈압, 당뇨 같은 질환이 있거나 치매 바로 직전 단계인 경도 인지장애를 앓는 고령(60세 이상) 환자 150명을 대상으로 연구를 진행했다. 환자를 기관 치료군(복지관에서 슈퍼브레인 사용하는 그룹)과 재택 치료군(집에서 사용하는 그룹), 대조군(치료를 받지 않은 그룹)에 50명씩 배치해 나눈 뒤 15개월 후 인지능력을 확인했다.그 결과 복지관이나 집에서 사용한 환자들은 15개월 전보다 인지능력이 개선됐다. 같은 기간 인지중재치료를 받지 않은 대조군은 인지능력이 떨어졌다. 슈퍼브레인 효과가 수치로 증명된 것이다. 최혜성 인하대 의대 신경과 교수가 주도한 이 연구는 노화 분야에서 저명한 국제학술지 ‘에이징(Aging·노화)’에 실렸다.리빙스턴 교수도 이때 발표된 논문을 통해 슈퍼브레인을 알게 됐다. 그는 지난해 말 영국 정부에 슈퍼브레인 임상 신청서를 제출해 올해 4월 최종 승인을 받았다. 이에 따라 슈퍼브레인은 영국 정부 지원을 받아 5년간 안정적으로 해외에서 임상을 진행하게 됐다. 다만 슈퍼브레인 브랜드를 그대로 쓸지는 아직 협상 중이다.로완은 현재 미 식품의약국(FDA) 허가 절차에 필요한 자금을 마련하기 위해 시리즈B 투자를 진행 중이다. FDA 승인을 받으려면 현지 대학병원들과 임상을 거쳐야 한다. 로완에 따르면 현재 하버드대 의대에서 슈퍼브레인에 관심을 보이고 있다. 로완은 내년 초쯤 FDA에 슈퍼브레인 허가 신청서를 제출할 계획이다.로완은 보험회사인 흥국생명, 밀키트 제조사 아워홈과 업무협약(MOU)을 맺고 사업의 저변을 확대하고 있다. 그는 “디지털 헬스케어 종사자들이 기술력을 강조하기 전에 먼저 돈을 버는 다양한 아이템을 발굴해야 산업 규모가 커질 수 있다”고 말했다. 한 대표를 지난 7일 서울 중구 연세 세브란스빌딩에서 만났다.    경도 인지장애 환자가 로완의 인지중재치료 프로그램 '슈퍼브레인'을 통해 치료를 진행 중이다. /로완 제공 一 ‘인지중재치료’라는 개념에 대해 설명해달라.“약물을 쓰지 않고 이뤄지는 인지장애 치료 방법이다. 기존에는 학습지가 주된 도구였다. 뇌에 지속적인 자극이 되는 간단한 문제들을 모아 학습지로 만들어 환자가 풀게 하는 식이다. 환자 옆에 의료진이나 복지관 직원이 반드시 붙어서 학습지 푸는 걸 지켜보고 환자 수준에 따라 학습지 난이도를 조정해야 했다.”一 슈퍼브레인은 그 과정을 디지털화한 건데, 학습지를 쓰는 게 문제가 있었던 건가.“학습지를 풀게 하고 환자를 지켜보며 일일이 난이도를 고쳐주는 프로그램은 병원으로선 부담이 크다. 장기간 유지하기 어렵다. 병원에 환자들을 모아둘 공간이 부족하고 학습지 푸는 걸 지켜볼 인력도 충분하지 않다. 병원도 결국 병원이란 공간을 최대한 활용해 수익을 내야 살아남는다. 이미 최대한 효율적으로 병원 공간과 인력이 배정된 상황에서 공간을 차지하고 인력이 필요한 학습지를 푸는 형태의 프로그램이 낄 자리는 없었다.”一 그렇다면 슈퍼브레인은 그 한계를 어떻게 극복한 건가.“슈퍼브레인은 소프트웨어다. 태블릿PC에 앱(애플리케이션)만 깔면 굳이 병원에 올 필요 없이 노인 복지관, 자택에서 환자가 언제든 혼자 치료 프로그램을 진행할 수 있다. 성취도에 따라 커리큘럼이 알아서 맞춤 조정되기 때문에 누가 보고 있을 필요도 없다. 병원에 공간과 인력이 부족하다는 한계를 그렇게 극복할 수 있었다.”一 슈퍼브레인이 인지능력을 개선해주는 건 확실한가.“확실하다. 그렇지 않으면 병원에 팔 수가 없다. 인지능력에 장애가 생긴 환자의 기억력, 시공간구성력, 어휘력, 집중력 등을 평가하는 ‘RBANS(인지 능력 검사) 점수’라는 게 있다. 60세 이상 환자 150명을 대상으로 실험한 결과 15개월동안 꾸준히 슈퍼브레인을 사용한 환자들은 해당 점수가 평균 5점 넘게 올랐다. 반면 같은 기간 슈퍼브레인을 포함해 아무 치료도 받지 않은 환자들은 점수가 평균 1점 남짓 떨어졌다. 이는 굉장히 유의미한 결과다.”一 연구 결과 기반으로 논문은 안 썼나.“연구를 주도한 최성혜 인하대 의대 신경과 교수가 논문을 썼는데, 노화 분야 국제학술지인 ‘에이징(노화)’에 실리기도 했다. 에이징은 과학논문인용색인(SCI)급 학술지로, 논문을 등재하기 위한 조건이 상당히 엄격하고 까다롭다.”一 저명한 학술지에 논문이 실렸다면 파급효과도 있었을 텐데.“상당한 파급효과가 있었다. 영국 UCL 의대 정신과에 질 리빙스턴이라는 교수가 있다. 논문만 300편 넘게 썼고 그중 일부는 란셋과 같은 세계 최고 학술지에 올라가기도 했다. 그 교수가 지난해 2월 먼저 우리 쪽에 전화를 걸었다. 에이징에 올라간 슈퍼브레인 논문을 보고는 자신도 슈퍼브레인을 영국 환자들에게 써보고 싶다고 제안했다. 슈퍼브레인이 국제적 차원에서 인정을 받았다고 확신하게 된 계기였다.一 임상은 진행 중인가.“올해 4월 영국 국립보건연구원(NHIR)으로부터 임상을 진행해도 좋다는 허가를 받았다. 현재 임상에 참여할 환자를 모으고 있다. 앞으로 5년간 UCL 의대가 영국 정부 지원금을 받으며 슈퍼브레인 효과를 검증한다.”    지난 7일 서울 중구 연세세브란스빌딩 사무실에서 만난 한승현 로완 대표. /최정석 기자 一 FDA 허가 신청도 준비 중이라 들었다.“내년 초에 신청을 넣는 걸로 일단은 계획 중이다. FDA 허가 절차에 쓸 자금 마련을 위해 시리즈B 투자를 진행 중이다. 투자는 잘 되고 있다. 이미 투자를 확정한 대형 자금운용사도 있다. 올해 말쯤 투자 유치가 끝날 것으로 예상 중이다.”一 미국 의대 쪽에선 슈퍼브레인에 관심을 안 보이나.“하버드 의대가 관심을 보이고 있다. FDA 허가를 받으려면 현지 임상을 진행해야 하는데 벌써부터 하버드 정도 되는 의료기관이 관심을 보이는 건 매우 고무적이다. 사업이 착실하게 진행되고 있다는 생각이 들어 뿌듯하다.”一 ‘사업’이란 단어가 나와서 하는 말인데, 얼마 전 흥국생명과 MOU를 맺었다.“현재 인구 고령화가 급격하게 진행되고 있다. 그리고 현재 치매를 비롯한 인지장애 관련 보험은 거의 대부분 보장성이다. 쉽게 말해 치매에 걸리면 돈을 주는 방식이란 거다. 이는 지속가능하지 않다. 이런 상태에서 우리 제품이 보험 가입자들에게 제공되면 일석이조의 효과가 나온다. 가입자들은 치매 진행을 늦출 수 있고, 보험사는 보험금 지급이 시작되는 시기를 미룰 수 있다. 가입자가 치매 혹은 경도 인지장애 판정을 받으면 흥국생명이 우리 제품을 사서 가입자에게 제공한다. 보장과 예방을 염두에 두고 진행하는 최초의 프로젝트다.”一 처음 있는 형태의 보험이라면 흥국생명과 협의도 오래 했을 것 같다.“로완이란 회사를 세우고 인지중재치료용 소프트웨어를 만들어야겠다고 결심했을 때부터 보험사와 협력하는 그림을 그렸다. 지난 2~3년간 우리 비전을 소개하면서 사업을 함께 할 보험사를 찾았다. 그 결과 찾은 게 흥국생명이다. 이번 업무협약으로 내놓은 상품은 5개월 정도 회의 끝에 완성됐다. 현재는 두 번째 보험상품도 기획 중이다.”一 사업 수완이 뛰어나다는 생각이 든다.“기업을 이끄는 창업자이기 때문에 어찌 보면 당연한 부분이다. 다른 디지털 헬스케어 기업들을 보면 기술력은 정말 좋은데 거기에 매몰돼있는 경우가 많다. 하지만 이건 사업이고, 디지털 헬스케어는 병원을 상대로 영업한다. 아무리 좋은 기술을 만들어도 병원과 의사가 쓰지 않으면 무용지물이다. 병원이 우리가 내놓은 제품으로 더 많은 환자를 유치할 수 있도록 고민해야 한다. 그 확신을 병원과 의사들에게 줄 수 있어야 기업이 유지되고 산업의 전반적인 규모와 크기가 커질 수 있다고 생각한다.” ]","['광고', '', '이거 진짜 대조군 분명히 하고, 인간의 관여없이 진행했을때, 효과가 있다면 대박이겠네요 ㅎ', '매일하는  학습지  치매효과 있습니다.  무료앱깔아서  어머니 매일하고 있어요', '병원에 사람구경 하러 가는건데..치매가   결국  사람이 그리운거 아니었나']",https://health.chosun.com/site/data/html_dir/2022/09/16/2022091602252.html,https://n.news.naver.com/mnews/article/366/0000841242?sid=105
2022.09.16.,메디컬투데이,,"눈밑지방재배치, 개인별 맞춤 계획 필요",,,https://mdtoday.co.kr/news/view/1065604391338387,http://health.chosun.com/
2022-09-18 12:01:01,메디소비자뉴스,생활/문화,"환절기, 탄력 개선에 도움되는 리프팅 시술은?","[     즉석밥은 처음부터 완전히 조리돼 나오기 때문에 전자레인지에 돌리지 않아도 먹어도 된다./사진=게티이미지뱅크예전부터 밥은 정성을 상징했다. 갓 지은 밥을 먹으려면 반드시 쌀, 물, 밥솥 등 조리 도구 그리고 조리 후 뜸 들이는 시간까지 필요했기 때문이다. 그러나 이제 우리는 그런 재료, 도구 없이도 맛있는 밥을 먹을 수 있는 시대에 살고 있다. 편의점에 가 즉석밥을 사 오면 된다. 전자레인지가 필요하지 않냐고? 출시되고 오랜 시간이 지나지 않은 즉석밥이라면 사실 전자레인지도 필요 없다.즉석밥, 완전히 조리돼 나와많은 사람이 즉석밥은 덜 조리된 채로 나와, 전자레인지에 돌려야 완전히 익는다고 생각한다. 그러나 즉석밥은 완전히, 100% 조리돼 나오므로 전자레인지에 돌리지 않고 그냥 먹어도 된다.그렇다면 왜 그냥 먹었을 땐 설익은 듯 딱딱하고 맛이 떨어지는 걸까? CJ제일제당 관계자는 ""포장 후 시간이 지나면서 전분의 특성 때문에 밥이 딱딱해진다""며 ""전자레인지에 돌리거나, 끓는 물로 조리해 열을 가해주면 재호화돼 갓 지은 밥처럼 다시 부드러워지는 것""이라고 말했다. 쌀 등 전분은 다른 분자가 들어오기 힘들 정도로 치밀하게 얽혀있어 딱딱한데, 적당한 물과 열을 가해주면 입자 구조가 팽창하면서 조직이 연해지고 식감은 쫄깃해진다. 맛도 달아진다. 쌀에서 밥이 되는 것이다. 이를 호화라고 한다. 한번 호화된 전분은 시간이 지날수록 무너진 입자에서 물이 빠져나가 딱딱해지는 노화 과정을 밟는다. 마치 식탁에 그대로 올려둬 차가워진 밥처럼 말이다. 전자레인지에 돌리기 전 즉석밥은 호화된 이후 시간이 지나 살짝 딱딱해진 것이다. 보통 찬밥은 다시 데워도 갓 지은 밥과 달리 딱딱하고 맛이 없다. 한 번 노화되면 다시 재호화될 수 없기 때문이다. 그러나 즉석밥은 다르다. CJ제일제당 관계자는 ""즉석밥은 노화가 매우 서서히 진행되며, 저장 중 수분함량에 변화가 거의 없어, 충분히 재호화된다""고 말했다.냉장 온도에서 밥 더 딱딱해져즉석밥은 냉장고보다 실온에서 보관해야 더 맛있다. 호화부터 노화까지 진행되는 과정이 실온보다 냉장 온도(0~5℃)에서 더 빨라지기 때문이다. 즉석밥을 냉장고에 보관하면 실온에서 보관했을 때보다 전분에서 수분이 더 많이 빠져나가 더 딱딱하고 맛 없어진 상태로 변했을 가능성이 크다. 따라서 냉장고에 보관했다면 전자레인지에 조금 더 오래 돌리는 것이 좋다.완벽한 차단으로 보관기간 늘렸어즉석밥은 집에서 지은 밥과 다르게 어떻게 상온에서 6~9개월까지 보관할 수 있는 걸까? 식품이 부패하는 이유는 산소와 미생물 때문이다. 보통 미생물을 완전히 제거하고, 공기가 통하는 것도 완벽하게 차단할 수 없어서 오랜 기간 보관해야 하는 제품들에는 미생물 성장을 억제하는 보존료가 들어간다. 그러나 즉석밥에는 보존료가 전혀 들어가지 않는다. 완벽하게 미생물과 공기 유입을 차단하는 방식으로 제작된다. 마치 반도체 공장처럼 어떤 균도 들어올 수 없는 클린 룸에서 제조된다. 필름을 몇 겹이나 붙여 산소를 차단할 수 있게 제작된 뚜껑으로 포장한다. 간혹 곰팡이가 생긴 즉석밥은 보통 유통 과정에서 미세한 구멍이 생겼기 때문이다. ]","['햇반 만들사람은 천재!!!!🥇🥇🥇🥇🥇', '햇반 많이사용하는데 용기도 재활용되는걸로 만들었음좋겠어요.플라스틱인줄알고 분리수거했는데 아니라고해서 충격이었어요.세척해서 분리수거 했었는데..', '안 데우고 먹을 수는 있지. 딱딱하고 맛 없어서 그렇게 안 먹지. 참고로 볶음밥 만들 때는 전자렌지에 안 돌리고 그냥 프라이팬에 넣어서 볶으면 좋다. 왠만한 밥솥에서 한 밥보다 잘 만들어짐.', '그냥은 못먹겠던데..라면먹고 국물에넣고 계란넣고 살짝 끓여 먹는정도로 합의보자..난 쌩은 불호', '라면 끓여먹으면서 즉석밥 말아먹을때, 매번 전자레인지 한번 돌리고 말았는데 그냥 바로 말아도 되지 않을까 싶긴 하더라니.. 이젠 그냥 말아도 된다는 걸 확실히 알았네요. 나름 좋은 정보 ㅎ', '햇반 막 도정한 쌀과 막 정수한 물로 쪄내는 믿고 먹을수 있음\n 사람들이 먹을꺼로 장난 많이치니 이상한거 넣을꺼라 하지만 반대로 빠바 나 씨제이 농심등 은 목숨걸고 만듬 한번 잘못걸림 회사가 망하는데 , 아 농심은 더잘알지?  우지 헛 소문파동 으로 1등된거니', '기자님 시중에 나오는 냉동 만두도 완전 조리식품이에요. 녹으면 그냥 드세요~~', '볶음밥 해먹을때 좋음', '햇반은 맛이 없더라. 특유의 방부제 냄새와 적응 안 되는 식감 때문에. 조금 귀찮아도 집에서 밥 지어 먹는 게 제일 맛있지.', '스팸도 날걸로 먹는나로서는 문제되지 않는다', '그래서 유통기한이.길구나 과학이 요리를 레벨업 시켰네 굿!!!!', '안데우고 먹어보고 쓴글인지 의심스럽다 한마디로 못먹는다 설익은생밥느낌난다', '꼭 햇반이라는 명칭을 사용해야 했을까?  즉석밥. 그래도 알텐데', '캠핑갔다가 못데워서 그냥 먹었었는데 식은밥 느낌? 생각보다 괜찮았어요', '먹을 수는 있어... 밥인지 뭔지 모르겠다... 그게 문제다', '', '야외서급하면 컵라면에 말면됨', '', '', '나는  옛날에  번데기통조림하고  데우지않은  즉석밥으로  3년 연명한적있다.', '낚시가서 라면에 햇반, 참치캔넣고 끓이면 비쥬얼이 좀 그래도 맛은 좋아 ㅎ', '이번에 ㅋx에서 시킨 햇반 못먹고 있어요 먹는데 플라스틱 맛과 냄새가 베었더라구요', '햇반 제조공정 알면 햇반 오뚜기밥 같은 즉석밥 못 먹는다. 밥 다 지은 다음에 식혀서 용기에 담는거 같지만 실상은 용기에 생쌀 넣고 그냥 그 상태로 찐 다음에 밀봉하고 유통되는게 바로 즉석밥임. 이거 안 다음부터 즉석밥 절대 안 먹음. 즉석밥 플라스틱 용기가 폴리프로필렌(PP) 소재라고 괜찮다는 놈들 있는데 그건 다 개소리고 거기다 생쌀을 그대로 쪄서 위에는 비닐뚜껑 덮어서 밀봉하는데 환경호르몬이 1도 안 나온다고 할 수 없음. 배달용기들도 폴리프로필렌으로 된 것들이 많지만 그 누구도 환경호르몬으로부터 자유롭다 장담 못 함.', '', '얼마전에 햇반 먹었더니 곰팡이 나서 그뒤로 안먹음', '', '냉장고에 넣어둔것처럼 그래요 꼬두밥같아요', '먹어도 되지만 돌 씹는듯, 맛없음요.', '보존료가 들어가지 않다니 다행이네요~', '', '', '', '🤔🤔🤔😳😳🤢🤢🤢🤢', '', '무슨기사야  \n그냥먹을수없다고', '더운밥 찬밥 가릴 여유가 있으면 좋겠다 ~ㅜ', '즉석밥에 들어가는 물..... 쌀미강추출물이 해외 수입이거든 먹지마세요. 국내 100퍼 쌀미강추출물로 만들어진 즉석밥만 드세요.', '근데..왜 곰팡이가 폇다고 매년기사가날까?\n그렇게 봉합잘한다면서...내돈내산 하는사람이다\n이시국에 햇반띠우기인가 이물가에', '햇반도 곰팡이 핌... 개봉하고 먹다 냅두면 곰팡이 피지... 개봉하고 그냥 둬도 필듯. 걍 제작에서부터 밀봉상태로 하니까 다만들어진 걸 포장만 밀봉으로 한 거랑 차이 나는 거 아닌가ㅡ.', '햇반 흑미밥 밀봉된거 유통기한도 1년 남은거 깠더니 진짜 흑녹색의 곰팡이가 펴있길래\n판매자한테 전화하니 2주 지나도 깜깜무소식 ㅋㅋㅋㅋ', '그냥 쌀을 먹어라 기자야   ggsg네 아우~~~', '', '', '햇반 상하지 않는 부분이 이상해서 겁나서 못 먹겠음', '햇반말고 여자가 밥솥에해주는밥 먹고싶다', '', '']",http://www.medisobizanews.com/news/articleView.html?idxno=90530,https://n.news.naver.com/mnews/article/346/0000054037?sid=103
2022.09.16.,메디컬투데이,,"다양한 망막질환, 망막전문의의 정기적인 검사 필요",,,https://mdtoday.co.kr/news/view/1065601086452323,http://www.mdtoday.co.kr
2022.09.16.,메디컬투데이,,"울써마지 시술, 복합 레이저 리프팅이 필요한 이유는?",,,https://mdtoday.co.kr/news/view/1065578625289141,http://www.medisobizanews.com
2022.09.16.,메디컬투데이,,호전되지 않은 다리통증…하지정맥류 의심해봐야,,,https://mdtoday.co.kr/news/view/1065593525876594,http://www.mdtoday.co.kr
2022.09.16.,메디소비자뉴스,,"환절기, 탄력 개선에 도움되는 리프팅 시술은?",,,http://www.medisobizanews.com/news/articleView.html?idxno=90530,http://www.medisobizanews.com
2022.09.16.,메디컬투데이,,"다양한 망막질환, 망막전문의의 정기적인 검사 필요",,,https://mdtoday.co.kr/news/view/1065601086452323,http://www.mdtoday.co.kr
2022.09.16.,메디컬투데이,,"울써마지 시술, 복합 레이저 리프팅이 필요한 이유는?",,,https://mdtoday.co.kr/news/view/1065578625289141,http://www.mdtoday.co.kr
2022.09.16.,메디컬투데이,,호전되지 않은 다리통증…하지정맥류 의심해봐야,,,https://mdtoday.co.kr/news/view/1065593525876594,http://www.mdtoday.co.kr
2022.09.16.,뉴제주일보,,"""고령장애인 법적 기준 필요…장애인-노인정책 연계 시급""",,,http://www.jejuilbo.net/news/articleView.html?idxno=190633,http://www.jejuilbo.net
2022.09.16.,메디컬투데이,,"'목주름 도움' 쥬베룩 시술, 효과 높이려면",,,https://mdtoday.co.kr/news/view/1065588637987134,http://www.mdtoday.co.kr
2022.09.16.,메디컬투데이,,"중년 눈성형, 상안검과 하안검 고려해야 할 부분은?",,,https://mdtoday.co.kr/news/view/1065578874598751,http://www.mdtoday.co.kr
2022.09.16.,메디컬투데이,,리프팅 시술 전 확인해야 할 사항,,,https://mdtoday.co.kr/news/view/1065606896383393,http://www.mdtoday.co.kr
2022.09.15.,메디컬투데이,,"울쎄라‧써마지FLX 등 리프팅 시술, 정품 여부 확인해야",,,https://mdtoday.co.kr/news/view/1065590568307210,http://www.mdtoday.co.kr
2022.09.14.,메디칼트리뷴,,팔자주름 개선 필요충분조건은 피부탄력,,,http://www.medical-tribune.co.kr/news/articleView.html?idxno=109483,http://www.medical-tribune.co.kr/
2022.09.14.,뉴스퀘스트,,"""불멸의 해파리"" 유전자 코드 공개… 回春 장수의 비밀 담겨 있어",,,http://www.newsquest.co.kr/news/articleView.html?idxno=100564,http://www.newsquest.co.kr
2022.09.14.,메디컬투데이,,"체중 감량해도 사라지지 않는 이중턱, 활경근 개선이 열쇠",,,https://mdtoday.co.kr/news/view/1065579954928745,http://www.mdtoday.co.kr
2022.09.14.,코메디닷컴언론사 선정,,중년 관절에 약이 되는 운동 5가지,,,https://kormedi.com/?p=1419202,https://www.kormedi.com/
