Date,Press,Category,Title,Content,Comment,URL_Origin,URL_Naver
2022.12.14.,메디컬투데이,,"제3의 치아 임플란트, 안전성과 정확도 높이려면",,,https://mdtoday.co.kr/news/view/1065595584208928,http://www.mdtoday.co.kr
2022.12.18.,메디소비자뉴스,,"연세사랑병원, 인공관절 신소재 물질 리뷰 논문 학술지 게재",,,http://www.medisobizanews.com/news/articleView.html?idxno=103018,http://www.medisobizanews.com
2022.12.23.,메디칼트리뷴,,"한랭한 날씨는 피부건조 원인, 항노화 요법이 제격",,,http://www.medical-tribune.co.kr/news/articleView.html?idxno=111642,http://www.medical-tribune.co.kr/
2022.12.12.,아시아경제,,"소안면 이장단, 이철 전남도의원에 감사패 전달",,,https://view.asiae.co.kr/article/2022121219050568646,https://www.asiae.co.kr/
2022-12-12 19:05:06,머니투데이,사회,"완도군, 생활밀착형 12개 사업 추진에 속도낸다",[     이철 전남도의원은 소안면·노화읍·보길면 이장단 한마음 행사에서 감사패를 받았다. 사진=전남도의회 제공이철 전남도의원(더불어민주당·완도1)은 12일 오전 완도 소안항 일 문화창조센터에서 열린 소안면·노화읍·보길면 이장단 한마음 행사’에서 감사패를 받았다.이번 감사패 전달은 소안면 이장단이 지역 발전을 위해 노력한 이철 의원에게 감사의 마음을 전하기 위해 이뤄졌다.이 위원장은 지난 제11대 의원으로 당선된 후 도정질문과 예산결산특별위원회 등에서 연륙·연도교 건설 등 각종 지역주민 숙원사업 해결을 위해 노력했다.지난 10월 도정질문에서 소안도-구도 간 연도교 건설에 대해 전남도로부터 오는 2024년 공사가 착공될 수 있도록 노력한다는 답변을 이끌었다. 이 공사는 전남도와 완도군에서 각 700억원씩 총 1400억 원의 예산이 투입될 예정이다.이 위원장은 “도의원으로 당선된 것은 이장단을 비롯한 지역주민의 성원 덕분”이라며 “앞으로도 주민을 대표해 가뭄 문제를 해결하고 연륙·연도교의 차질 없는 건설 등 지역 현안 해결에 앞장설 것”이라고 말했다. ],[],http://news.mt.co.kr/mtview.php?no=2022120110225067825,https://n.news.naver.com/mnews/article/277/0005190850?sid=102
2022.12.04.,헬스조선언론사 선정,,젊은데 흰머리 수북… 혹시 병 때문?,,,https://health.chosun.com/site/data/html_dir/2022/12/02/2022120201866.html,http://www.mt.co.kr/
2022-12-01 11:23:39,뉴스핌,사회,"[Tech 스토리] ""비싼 기기 필요없다""…코스맥스 '미세전기 화장품' 원리는","[    [도서 지역 식수난 해소·침수 예방·LPG 배관망 확충 추진]    신우철 군수가 지속된 가뭄으로 식수난 겪고 있는 노화, 보길을 방문해 저류지 설치 사업을 설명하고 있다.전남 완도군은 조성 민선 8기 공약 사항으로 생활밀착형 12개 사업 추진에 속도를 내고 있다고 1일 밝혔다.먼저 기후변화로 잦아진 재난·재해 등에 적극 대응한다. 최근 가뭄 상황이 심각해짐에 따라 도서 지역의 식수난을 해소키 위해 노화-보길 광역 상수도 해저 관로 설치 사업과 금일, 군외 고금 지역을 대상으로 식수원 개발 사업, 보길 지하수 저류지 설치 사업 등을 추진한다. 또 태풍과 집중 호우로 상습 침수 피해를 입는 군내리에 총 251억 원을 투입해 빗물받이, 하수관로 및 펌프장을 설치하는 침수 예방 사업을 추진 중이며, 오는 2025년 사업이 완공되면 완도읍은 상습 침수에서 벗어날 수 있을 것으로 기대된다. 각종 생활 밀착형 기반 시설 확충 및 군민 생활 편의 제공을 위한 사업도 추진한다. 현재 완도읍 9개 마을, 4000여 세대에 LPG(액화석유가스)를 공급 중이며, 아직 LPG 배관망이 설치되지 않은 고금, 신지, 군외, 약산 지역에 총 139억 원을 투입해 배관망을 확충할 계획이다. 또, 총사업비 403억 원을 들여 공공 하수도가 운영되지 않는 7개 읍면, 10개 마을의 하수도를 정비한다.  특히 금일 방면만 운행 중이던 여객선 야간 운항을 노화, 소안 방면으로 확대한다. 항로 내 양식 시설물을 철거하고 등(燈) 부표 설치로 시인성을 확보한 후 내년 상반기 중 매일 1회 야간 운항을 실시한다.군민 문화 향유 기회 제공 및 건강 증진을 위한 문화·체육 시설도 건립한다. 보길, 고금, 소안 지역에 생활체육공원을 조성 중으로 보길은 이달 중 완공되고 고금과 소안은 오는 2024년도 준공을 목표로 추진 중이다. 추가적으로 70억원 투입해 금일, 약산 지역도 조성할 예정이다.  완도군은 군민 생활 불편 및 건의 사항 등에 귀 기울이고자 이동 군수실을 지속적으로 운영하고, 주민이 지역 문제를 진단하고 정책을 발굴하는 주민 자치 위원회를 활성화하는 등 군민과 소통·공감하는 행정 서비스도 펼친다.  신우철 완도군수는 ""군민들이 안전하고 쾌적한 환경에서 거주할 수 있도록 생활 밀착형 사업을 적극 추진해 군민 삶의 질을 높이겠다""고 말했다.  ]",[],http://www.newspim.com/news/view/20221216000628,https://n.news.naver.com/mnews/article/008/0004824342?sid=102
2022.12.15.,메디컬투데이,,"헤어라인 모발이식, 밀도·방향 모두 고려해야",,,https://mdtoday.co.kr/news/view/1065601321144853,http://health.chosun.com/
2022-12-04 22:01:01,TV조선언론사 선정,생활/문화,"작년 한 해만 50만 명, 한국인 수술 1위는 백내장","[     사진=게티이미지뱅크흰머리는 노화 과정에서 나타나는 자연스러운 변화다. 나이가 들어 털뿌리 멜라닌 세포가 줄고 기능이 저하되면 흰머리가 생긴다. 대부분 중년기 전후로 나기 시작하며, 20대임에도 새치가 많은 사람도 있다. 새치는 대부분 유전적 요인이나 과도한 스트레스가 원인이지만, 드물게 질환에 의해 생기기도 한다. 단기간 흰머리가 급격히 늘었다면 다음과 같은 질환을 의심할 필요가 있다.갑상선 문제로 인한 멜라닌 색소 분비 감소갑상선이 정상적으로 기능하지 못하면 새치가 날 수 있다. 갑상선은 체온을 유지하고 몸속 대사를 조절하는 기관으로, 기능에 이상이 생길 경우 멜라노사이트 세포 기능이 함께 저하되면서 멜라닌 색소 분비가 줄어든다. 이로 인해 두피가 건조해지고 탈모 증상이 생기거나 흰머리가 부쩍 늘어날 수 있다.피부 하얗게 변하는 백반증, 머리카락도?피부색을 결정하는 멜라닌 색소가 없으면 백반증 증상이 생긴다. 색소가 없는 부위에 흰 반점이 나타나는데, 얼굴, 손등, 발등을 비롯한 신체 모든 부위에 증상이 발생한다. 모근 문제로 인해 모낭 속 멜라닌 세포가 없어지면 머리카락까지 하얗게 변한다. 머리카락이 아닌 눈썹·속눈썹이 하얗게 변하는 경우도 있다. 새치가 한 곳에 밀집되는 양상을 보인다면 백반증일 수 있다.당뇨병 환자, 뇌하수체 이상 생겨 흰 머리 나기도종종 당뇨병 환자에게 흰머리가 많이 생기는 증상이 나타나곤 한다. 당뇨병은 뇌하수체 이상으로 인해 인슐린이 정상 조절되지 않는 것으로, 멜라닌 색소를 만드는 호르몬 역시 뇌하수체의 영향을 받을 수 있다. 뇌하수체에 문제가 생기면 멜라닌 색소 합성이 둔화되고, 이로 인해 흰머리가 난다.콩팥 기능 떨어지면 새치 늘어 날 수 있어콩팥 이상에 의해 새치가 늘어나기도 한다. 콩팥 기능이 저하되면 소변으로 배출되는 단백질 양이 증가하기 때문이다. 단백질은 멜라닌 색소를 만드는 필수 성분 중 하나로, 단백질이 많이 배출되면 멜라닌 합성에도 문제가 생길 수 있다. 이 과정에서 머리카락이 본래 색을 띠지 못하고 갑작스럽게 흰머리가 늘어난다. ]","['스트레스가 주범이다.  가족.친척 중에 아무도  머리   일찍센  사람이  없는데..나만  30살초 에  이미  백발이었다.. 부모님이 매일  싸우고  아빠는  매일  욕하고  소리지르고  화내고 때리고  부수고 .20살때  진학  한다고  집나와  월세방  전전 했다...남들은  유전인가  .가족들은  돌연변이  인가  하는데..나만  안다..', '저런 질환도 원인이 되지만...큰일을 겪던지..슬픔을 겪던지 분노에 찬일을 당하던지 충격을 받던지 자기가 감당 못할 정도 스트레스 같은것 받어면 하루 아침에 검은 머리가 흰머리로 변한다..이태원 같은 사건 당하신   보호자분들  보면 알수 있다', '', '근데 흰머리도 유전이 더라', '주사 한방에 해결되는 날이 오길', '유전. 빈혈. 스트레스 ...단두대 서기 전 마리앙뚜와네트도 밤새  백발 됐다했음', '아무이상없이 유전~~~', '전쟁이라도나서 염색못하면 나를 비롯 주위에갑자기 온통 노인들될거라는 생각이 오늘 염색하다들더라 사십대인데 염색안하면 진짜 할매될듯', '대머리보다 낫다', '문재앙 5년동안 스트레스로 백발이되어버렸다, 돌리도 내청춘 ㅜ', '그나마 있는 게 어디냐', '흰머리는 스트레스가 90프로 이상  주위에 보면 철없는 40대들 제로 스트레스 받는 사람들 흰머리 하나 없다', '흰머리와 당요,콩팥과의 관계는 모르겠고, 갑상선과 백반증은 연관있다.근데 흰머리의 당사자한테 중요한 점은 갑상선이나 백반증이라는 병명이 아니라(이는 의사한테나 중요한 정보임) 두 질병들이 생기는 원인이다.두 질병의 원인은 다양하다. 주된 원인은 스트레스로 보인다. 스트레스의 원인은 개인이라는 그릇에 따라 달라 어떤이에게는 사소한 일이 당사자에겐 큰산으로 다가온다. 그 원인이 욕심, 과욕,거짓, 집착, 비교, 무모한 시도, 야심 등 자신의 역량을 넘어선 행태들에 의해 나타나기 쉽다. 결국 흰머리는 자신과 현실 사이의 괴리에서 생긴다.', '좋다 유익하네', '사진의 분은 두피건강이  안좋은거 같습니다', '', '흰머리 때문에 염색 자주하면 염색약으로 인해 건강에도 안좋고 시간과 금전적인 손실도 꽤 있다고들 한다. 이에 나는 개인적으로 흰머리가 평생동안 아예 안나거나 나더라도 최대한 아주아주 늦게 내가 많이 늙었을 때 하나 둘 나기를 바란다.... ㅜㅜ 이상 내 희망사항이었음... ㅠㅠ', '헙', '난리다', '']",http://news.tvchosun.com/site/data/html_dir/2022/12/01/2022120190031.html,https://n.news.naver.com/mnews/article/346/0000056171?sid=103
2022.12.05.,빅데이터뉴스,,"전남대병원 한국백세인연구단, 노화과학연구소와 심포지엄 개최",,,http://www.thebigdata.co.kr/view.php?ud=202212051611455754e91b94b033_23,http://www.newspim.com
2022.12.05.,미주중앙일보,,펜데믹 이후 청소년 뇌 노화 징후 발견,,,https://news.koreadaily.com/2022/12/04/society/generalsociety/20221204202244533.html,http://koreadaily.com
2022.12.16.,메디소비자뉴스,,"넓게 주름진 이마, 주름 제거 '이마리프팅'으로 관리 가능",,,http://www.medisobizanews.com/news/articleView.html?idxno=103004,http://www.medisobizanews.com
2022.12.07.,메디컬투데이,,안검하수·눈 밑 주름 개선 중년 눈성형 주의할 점은?,,,https://mdtoday.co.kr/news/view/1065580919623239,http://www.mdtoday.co.kr
2022.12.02.,MBN언론사 선정,,"""10대 뇌, 코로나 기간 빨리 늙어…좋은지 나쁜지는 아직 몰라""",,,http://mbn.mk.co.kr/pages/news/newsView.php?category=mbn00008&news_seq_no=4883728,http://www.mbn.co.kr
2022-12-02 13:57:41,데일리팝,세계,[건강Q&A] 부작용 발생한 안면거상술..재수술 위해서 체크해야 할 것은?,"[     외부활동이 급감한 코로나19 대유행기신종 코로나바이러스 감염증 유행기에 방역 규제를 심하게 겪은 청소년들의 두뇌가 급속도로 노화했다는 연구 결과가 나왔습니다.영국 가디언에 따르면 미국 스탠퍼드대 연구진은 미국 캘리포니아주 베이에어리어에 거주하는 10대들을 분석해 얻은 이 같은 결과를 학술지 '생물학적 정신의학: 글로벌 오픈 사이언스'에 게재했습니다.연구진은 코로나19가 발병하기 전인 2016년 11월부터 2019년 11월에 찍은 10대 81명의 두뇌 자기공명영상과 팬데믹 기간이지만 봉쇄령이 해제된 때인 2020년 10월부터 2022년 3월까지 찍은 10대 82명의 두뇌 MRI를 비교했습니다.그 결과 팬데믹 봉쇄령을 겪은 10대들에게서 대뇌피질이 얇아지고 해마와 편도체가 커지는 등 두뇌가 더 빨리 나이가 든 것으로 나타났습니다.연구를 주도한 이언 고틀리브 스탠퍼드대 심리학과 교수는 ""두뇌의 나이 차가 3년 정도였다""며 ""봉쇄가 1년도 되지 않았다는 점을 고려할 때 그렇게 큰 차이가 있을지 예상하지 못했다""고 말했습니다.연구진은 두뇌가 빨리 나이가 든 까닭으로 두 집단의 정신건강의 차이에 일단 주목했습니다.이번 조사에서 방역규제를 겪은 집단은 그렇지 않은 집단보다 걱정과 우울 등 더 심한 정신건강 문제를 호소했습니다.고틀리브 교수는 코로나19 대유행기 청소년 정신건강을 다른 연구와도 맥락이 같다며 ""정신건강 악화가 스트레스 때문에 육체적 변화와 함께 진행된다""고 말했습니다. 그러나 연구진은 이번 조사에서 포착된 정신건강 악화와 두뇌 노화의 뚜렷한 인과관계는 확인되지 않았다고 강조했습니다.연구진은 청소년 두뇌가 빨리 나이를 든다는 게 좋은 것인지 나쁜 것인지도 현재로서는 알 수 없다고 밝혔습니다.다만 고틀리브 교수는 ""더 나이가 든 성인들의 경우 이런 뇌의 변화는 종종 인지기능 감퇴와 연관된다""고 설명했습니다.연구에 참여하지 않은 마이클 토머스 영국 버크벡대 인지신경과학과 교수는 지능이 높아질 수도 있다며 뇌의 변화가 반드시 부정적이지 않을 수도 있다고 지적했습니다.그는 ""(복잡하고 오래 된 도시 구석구석을 잘 알아야 하는) 런던 택시 기사의 해마가 더 크다는 유명한 연구결과도 있다""고 말했습니다.그러면서 ""장기적으로 부정적인 영향이 나타날지, 이들 세대가 뇌의 가소성(손상된 기능을 재생하는 속성) 덕분에 회복할지는 이번 자료만으로는 판단할 수 없다""고 설명했습니다. ]","['백신 부작용이다.어떤 형태로로든지 백신을 맞은 사람이면 언제든 부작용은 나타난다', '', '', '']",http://www.dailypop.kr/news/articleView.html?idxno=65346,https://n.news.naver.com/mnews/article/057/0001706726?sid=104
2022.12.13.,인사이트,,코어 탄력 얼리-안티에이징 케어 '에이지 리바이빙 코어 세럼' 출시한 더마펌,,,https://www.insight.co.kr/news/422457,http://www.dailypop.kr
2022.12.07.,KBS,,"전남도교육청, 제한 급수 완도 학교에 생수 등 지원",,,https://news.kbs.co.kr/news/view.do?ncd=5618363&ref=A,http://www.insight.co.kr
2022.12.23.,광주일보,,백발 현상- 채희종 정치담당 편집국장,,,http://www.kwangju.co.kr/article.php?aid=1671722100746959087,http://news.kbs.co.kr/
2022-12-07 08:01:39,뉴스웍스,사회,[올해 대한민국은?㊥] 매일 늙어가는 코리아…올해도 출생아 '역대 최소',"[               [KBS 광주]전남교육청은 극심한 가뭄을 겪고 있는 완도 지역 학교에 식수와 생활용수 공급을 위한 긴급 예산을 지원한다고 밝혔습니다.이에 따라 제한 급수가 시행되고 있는 완도 노화와 금일, 소안, 보길, 고금, 약산 지역 학교에 2억 원이 투입돼 생수와 생활용수 저장용 물탱크가 지원됩니다.도 교육청은 학교 급식용수까지 부족해지는 상황에 대비해 급식식단 조정도 할 수 있도록 조치했습니다.     https://news.kbs.co.kr/special/danuri/2022/intro.html ]",[],http://www.newsworks.co.kr/news/articleView.html?idxno=619911,https://n.news.naver.com/mnews/article/056/0011388028?sid=102
2022.12.16.,메디컬투데이,,"임플란트, 맞춤 수술이 중요한 이유",,,https://mdtoday.co.kr/news/view/1065595874600354,http://www.kwangju.co.kr/
2022.12.16.,메디컬투데이,,"임플란트, 맞춤 수술이 중요한 이유",,,https://mdtoday.co.kr/news/view/1065595874600354,http://www.mdtoday.co.kr
2022.12.05.,메디컬투데이,,슈링크 유니버스 시술 전 알아야 할 사항은?,,,https://mdtoday.co.kr/news/view/1065606389260303,http://www.mdtoday.co.kr
2022.12.19.,메디컬투데이,,"여성성형, 다양한 신체조건 고려한 맞춤 수‧시술 계획 세워야",,,https://mdtoday.co.kr/news/view/1065581344755217,http://www.mdtoday.co.kr
2022.12.09.,세이프타임즈,,"KAIST, 생체 나이 알려주는 새로운 지표 찾았다",,,http://www.safetimes.co.kr/news/articleView.html?idxno=116628,http://www.safetimes.co.kr/
2022.12.21.,경상일보,,"신대방삼거리 으뜸플러스안경 ""노안 교정용 누진다초점렌즈, 개별적 상태 따라...",,,http://www.ksilbo.co.kr/news/articleView.html?idxno=956543,http://ksilbo.co.kr
2022.12.08.,라포르시안,,"""피부탄력 개선 레이저 리프팅, 개인별 맞춤 상담으로 꼼꼼히 따져봐야""",,,http://www.rapportian.com/news/articleView.html?idxno=155056,http://www.rapportian.com
2022.12.09.,이데일리,,"코드리치, 실내운동 기능성 게임 '헬스 리메디' 내년 1월 출시",,,http://www.edaily.co.kr/news/newspath.asp?newsid=01659686632556880,http://www.edaily.co.kr/
2022-12-09 09:54:01,메디컬투데이,IT/과학,안면거상술‧미니리프팅 주의할 점은?,"[    [이데일리 이윤정 기자] 코드리치는 한국콘텐츠진흥원의 ‘2022년 기능성 게임 콘텐츠 제작 지원 사업’에 선정된 실내운동 기능성 게임 ‘헬스 리메디’를 출시한다고 9일 밝혔다.    (사진=코드리치)내년 1월 출시 예정인 코드리치의 운동 게임 콘텐츠 헬스 리메디는 노화와 운동량 부족으로 인해 근감소증 발병률이 높은 고령층이 메인 타깃이나, 다양한 운동 프로그램을 내장해 운동이 필요한 사람이라면 누구나 쉽고 재미있게 즐길 수 있는 것이 특징이다.기능성 게임 헬스 리메디는 게임 30종, 운동 영상 60종을 탑재했다. 사용자는 화면에 나오는 동작을 그대로 따라 하며 근육을 강화할 수 있다. 게임마다 요구하는 자세가 달라 전신의 다양한 근육을 사용할 수 있다ㅣ.헬스 리메디는 현재 노인층 포커스 그룹 테스트(FGT)를 통한 사용자 검증까지 완료하고 개발 마무리 단계에 돌입했다. 출시 후 노인복지관, 재활치료업체, 특수학교, 어린이집 등 여러 기관에서 운동·재활 프로그램으로 활용할 수 있다. 특히 코드리치 자체 플랫폼을 통해 플레이할 수 있어 별도의 장비 구매 없이 기기에 탑재된 센서를 활용해 게임을 플레이할 수 있다.코드리치 관계자는 “급격한 고령화가 진행 중인 오늘날, 외출이 어려운 시니어들을 위한 실내운동 게임을 만들고자 했다”며 “본 게임이 다양한 프로그램으로 온 가족이 함께 운동을 즐길 동기를 부여하고, 더 나아가 운동으로 예방할 수 있는 질병의 발병률을 낮추는 데에도 일조하길 바란다”고 말했다. ]",[],https://mdtoday.co.kr/news/view/1065603995580569,https://n.news.naver.com/mnews/article/018/0005383860?sid=105
2022.12.08.,메디소비자뉴스,,"자가 진피재생 통한 이마주름시술, 주름상태 고려 중요",,,http://www.medisobizanews.com/news/articleView.html?idxno=102757,http://www.mdtoday.co.kr
2022.12.01.,뉴시스,,"""올겨울, 따끈한 창녕 부곡온천에서 몸과 마음을 녹이세요""",,,http://www.newsis.com/view/?id=NISX20221130_0002106215&cID=10812&pID=10800,http://www.medisobizanews.com
2022.12.13.,컨슈머타임스,,더마펌 '에이지 리바이빙 코어 세럼' 출시,,,https://www.cstimes.com/news/articleView.html?idxno=523041,http://www.cstimes.com
2022.12.09.,메디칼트리뷴,,"지방과 노화 원인 이중턱, 주사시술 안전성은 성분·실력이 좌우",,,http://www.medical-tribune.co.kr/news/articleView.html?idxno=111274,http://www.medical-tribune.co.kr/
2022.12.13.,스포츠경향,,"비타카페, “MZ세대 겨냥 ‘비타세븐틴’ 프로젝트 협의체 구성”",,,http://sports.khan.co.kr/news/sk_index.html?art_id=202212131402003&sec_id=564001&pt=nv,https://sports.khan.co.kr/
2022-12-13 14:03:01,키즈맘,경제,과학적인 장수 방법은?...'이것' 변화 막아라,"[    MZ세대 대상 건강프로젝트, ‘비타세븐틴 프로젝트’가 본 궤도에 올라섰다.푸드테크 기업 비타카페는 ‘비타세븐틴(VITA17)’ 프로젝트를 위한 협의체 구성이 마무리 단계라고 13일 밝혔다.    비타카페 제공비타세븐틴 프로젝트는 건강할 때 건강을 지키자는 대국민 프로젝트. 노화가 진행되기 이전인 17세부터 과학적인 유전자검사를 통해 질병을 미리 예측하고, 개별 맞춤형으로 평소에 꾸준히 필요한 영양을 섭취해 미래건강을 지금부터 준비하자는 취지로 기획됐다.이 프로젝트를 추진하고 있는 비타카페는 알약형태의 영양제가 아닌 원액을 물에 희석해서 마시는 영양 보충 음료을 개발한 푸드테크 기업으로, 특히 가치소비를 중시하는 MZ세대들로부터 높은 호응을 얻고 있다.실제로 비타카페는 커피숍을 비롯해 스크린골프장, 영화관, 경기장 등 MZ세대들이 주로 찾는 지역에서 주로 판매되고 있다. 지난 9월부터는 티웨이항공과 진에어의 기내음료로 공급을 시작했다.비타카페는 앞으로 편의점을 비롯해 커피가 있는 모든 곳에서 ‘비타카페’를 만날 수 있게 한다는 목표다.비타카페 관계자는 “AI기반의 건강관리기술기업으로 유전자검사를 통해 맞춤형으로 건강관리를 대행하며 월간 구독 서비스 1000명을 돌파한한 ‘비타메이트’는 물론 다이어트관련 국내 선두기업과 피부전문 화장품 기업, 엔터테인먼트사, 상장사, 벤처캐피탈등이 참여할 예정”이라고 밝혔다.이충진 기자 hot@kyunghyang.com   ]",[],https://kizmom.hankyung.com/news/view.html?aid=202212082495o,https://n.news.naver.com/mnews/article/144/0000854881?sid=101
2022.12.15.,CNB뉴스,,15일 낮 12시 캐시워크 돈버는 퀴즈 ‘소휘 글루타치온’ 정답은?,,,https://www.cnbnews.com/news/article.html?no=578652,http://kizmom.hankyung.com/
2022.12.06.,코메디닷컴언론사 선정,,"약해진 뼈, 근육 감소…여성 갱년기 극복법",,,https://kormedi.com/?p=1548335,http://www.cnbnews.com
2022.12.15.,메디컬투데이,,"발치 즉시 임플란트, 정교한 계획 필요",,,https://mdtoday.co.kr/news/view/1065605082106315,https://www.kormedi.com/
