Date,Press,Category,Title,Content,Comment,URL_Origin,URL_Naver
2022-12-27 23:46:01,메디컬투데이,생활/문화,"뼈이식 임플란트, 잇몸뼈 상태부터 파악해야","[     변비를 일으키는 원인 중 하나가 운동 부족이다./사진=클립아트코리아연일 계속되는 강추위로 신체 활동량이 줄고 운동하기가 힘들다. 하지만 춥다고 운동을 안 하면 각종 질병에 노출될 위험이 높다. 운동 부족으로 생기는 증상과 실내에서 할 수 있는 운동에 대해 알아본다.변비와 통증 심해▶변비=변비를 일으키는 원인 중 하나가 운동 부족이다. 운동량이 적으면 변을 보기 위해 장이 수축하면서 대변을 밀어내는 연동운동 기능이 떨어지기 때문이다. 하루 15~30분 정도 산책을 하거나, 누운 상태에서 머리와 다리를 들어 올리는 자세를 취하는 것이 변비 예방에 도움이 된다. 윗몸일으키기 또한 장을 자극해 변비를 예방할 수 있다. 하복부의 혈액순환을 원활하게 하는 반신욕과 좌욕도 좋은 방법이다.▶허리와 무릎 통증=운동 부족으로 인해 허리나 무릎 통증이 심해지기도 한다. 허리통증은 보통 노화로 인해 중장년층이나 노년층에 많이 나타난다. 그러나, 운동 부족과 잘못된 자세 등과 같은 이유로 허리와 무릎 통증을 호소하는 20~30대 젊은 층이 많다. 운동 부족으로 인해 근력이 약해지고 뼈 사이의 마찰을 줄여주는 윤활액이 역할을 제대로 하지 못하기 때문이다. 하루에 30분 정도의 가벼운 걷기 운동이나 어깨, 무릎 등에 행하는 간단한 스트레칭은 통증이 발생하는 관절 부위의 온도를 높여 통증을 예방할 수 있으며 근육을 이완시키고 관절 주변 근력을 강화시켜 관절 건강에 도움이 된다.▶뇌 기능 저하=운동 부족은 뇌 기능을 저하시킨다. 운동은 뇌로 가는 혈류량을 늘려 뇌에 긍정적인 자극을 주고 뇌세포를 자극해 치매 위험을 낮춘다. 실제로 국제학술지 ‘뉴로 이미지’에 게재된 연구에 따르면 유산소 운동이 노인의 뇌 건강을 향상시킨다. 신체 활동이 정보 전달을 돕는 뇌의 백질뿐만 아니라 인지 능력과 노화에 취약한 부분에도 긍정적인 영향을 미치기 때문이다.▶입맛 변화=운동 부족으로 인한 호르몬 변화가 단 음식을 당기게 한다. 신체 활동이 활발하거나 낮에 활동적으로 움직이면 에너지가 많아져 행복함을 유발하는 엔도르핀이 분비된다. 엔도르핀이 분비될수록 설탕에 대한 갈망이 크게 줄어든다. 그러나, 신체 활동량이 적어지면 엔도르핀 분비량이 충분하지 않아 단 음식이 당기게 된다.실내 운동 추천날씨가 추워 밖에서 운동하기 어렵다면, 집에서라도 운동을 해야 한다. 집에서 쉽게 따라 할 수 있는 운동은 다음과 같다.▶실내 자전거=자전거는 요추를 지지하는 근육이 발달해 허리 통증을 감소시켜 줄 수 있다. 또, 허리를 약간 숙인 자세로 자전거를 타면 허리 굴곡이 바깥쪽으로 나와 척추관이 넓어지는데, 협착증 환자는 특성상 오래 걸을 수 없고 허리를 굽히는 게 더 편하기 때문에 자전거 운동이 더 효과적일 수 있다. 자전거를 탈 때는 앉은 채로 발을 뻗어 아래쪽 페달에 닿을 때 무릎이 약간 굽혀지는 높이가 적당하다.▶훌라후프=훌라후프는 집에서 간편하게 할 수 있는 운동 중 하나다. 장 기능 향상과 혈액순환, 신진대사를 촉진해 체내 노폐물 배출을 돕는다. 허리 근력 강화에도 도움이 될 수 있다. 단, 너무 오래 돌리면 오히려 척추에 악영향을 끼칠 수 있어 주의가 필요한데, 일주일 4~5회씩 30~40분 정도가 적당하다. 처음 훌라후프를 한다면 10~15분 정도 돌리고 운동 전후로 스트레칭을 해주는 것이 좋다.▶레그리프트=레그리프트는 복부부터 허벅지까지 연결되는 장요근과 복근을 단련시킨다. 방법은 다음과 같다. 천장을 보고 바로 누운 상태로 복부에 힘을 주면서 다리를 90도로 들어 올린다. 호흡을 들이마신 상태에서 다리를 천천히 내린다. 이때 땅에서 15~20cm 떨어진 곳까지만 내린 후 호흡을 뱉으며 다리를 다시 90도로 들어 올린다. 10회씩 3세트 실시한다. 다만, 허리디스크 환자는 이 동작을 하면 증상이 악화될 수 있어 피하는 것이 좋다. ]","['술,담배,스트레스 멀리하세요..내몸은 강철처럼 강했고 매일 소주2병에 담배한갑씩 피워도 다음날 숙취한개 없이 43세를 살아 왔습니다. 이번에 월드컵이 새벽에 하는 경우가 많아서 날새기로 마시기도 여러번..결과는 현재 병원에 입원해 있습니다. 응급실에 3번 실려갈 정도로 몸이 훅 갔네요 ㅠ 이제야 금주하고 스트레스 안받고 살아야겠다고 다짐합니다. 아내와 이혼문제로 스트레스를 많이 받아서 그런지..공황장애 온것 같습니다. 꼭 기억하세요...내가 가진게 얼마 없어도 오늘 당장 내몸이 건강한것 자체가 축복입니다.', '춥다고 운동 안 하면.......따뜻하지 ㅎㅎ', '뭐든지 운동은 하는게 몸에 활력소가 되긴합니다.안움직이면 바로 몸이 퍼지더라.', '아무리 강추위도 1시간씩은 밖에서 운동함, 눈만 나와있을뿐 꽁꽁싸맴.  더울때보단 겨울이 살은 잘빠져요~', '종교를 떠나 108배  후 명상도 아주 좋은 운동이다', '인생 대부분 유전이다\n건강은 병원이 치료해주는게 \n아니라 내 유전자와 생활습관이 9할이다', '', '건강이 최곱니다. 다들 건강관리 잘합시다', '코로나 안 걸려도 제 2의 확찐자 되가는중 ㅠㅠ 새해부터 다시 시작하는 마음으로... 이번주까지만...🤣🤣🤣', '진도하나 데려왔더니 안나갈 수가 없다\n밖에 나가야 쌈\n매일 산책중', '스텝퍼가 굿잡이여', '춥다고 운동안하는 사람은 추워서 운동을 안하는게 아니라 그냥 운동을 안하는 사람임. 운동해오던 사람은 춥든 덥든 무조건 운동함. 왜냐하면 운동하다가 안하면 찝찝하거든. 그리고 운동을 하면 확실히 몸이 다름. 나같은경우엔 하루에 팔굽혀펴기 200개씩 하는데 하루만 안해도 몸이 근질근질함.', '레그리피트는 복근없이 초보긴 잘못하면 허리다침요. 전문가의 조언이나 유튭등 찾아보시고 운동하시길...', 'ㄹㅇ 운동 안하는 날은 단거 ㅈㄴ 땡김. 욷동 하면 단거 안 땡기고 ㄹㅇ', '팔벌려뛰기,스쿼트,페르시안밀만해도 헬스클럽 필요없지.', '가까운 거리는 버스택시안타고 걸어다님 차비도아끼고 일타투피', '강아지 키우면 매일매일 최소 30분은 산책 나가서 걷다보면 운동 저절로 됨... 비가오나 눈이오나...', '딱 요즘 제증상 이네요', '', '아. 딱 내 얘기같군... 훌라후프랑 실내 자전거 열심히 타야겠다. 집에 전부 다 모셔만 놓고는...', '레그리프트 저거 좋아요, 4-5개월전부터 했는데, 뱃살 빠지네요', '해봐야지. . 좋은 정보네요.', '하정우처럼 하루 3만보 하시길', '', '떡 운동이 최고임', '다 핑계고 집에서 푸쉬업 100개씩은 꾸준히 해보자\n확실히 달라지긴 한다', '택배기사는 운동 안해도되나요??', '운동 노력 할게요 .어제 가만히 있는데 무릎이 아파 놀랬음. 운동을 한참 안해서인듯. 젊었을땐 운동 안해도 괜찮더니 지금은 윤활액이 역할을 못하니까 운동을 좀해줘야 하네요.', '추운데 운동하다가 뒤지거나 건강헤칠 위험이더크니. 실내에서 운동하세유', '', '', '변비는 무슨.. 설사만 잘잘 나온다..', '실내에서는 침대에서 레슬링 하는게 최고다.', '의외 ㅇㄷ?', '내년 여름 대회 뛰려면 이제 슬슬 시즌 준비들어가야지 운동을 어케 쉬누', '아~ 미세먼지~', '변비는 어케 걸림?장 문제로 잦은 설사가 지겹.제발 변비 좀 걸려라.', '추운데 운동하고 힘든일 하다 감기 걸렸다. \n병원가야지~', '', '왜 팔굽혀펴기 횟수도 유전탓하지 그래', '', '격한 부부관계 최고다', '좋은 정보 대단히 감사합니다.', '', '', '', '', '미에로화이바', '', '', 'ㆍ', '', '', '땀이 안난다 ㅋㅋ 히터는 틀기싫고', '나는춥다고 왕복6킬로 잡곡밥하루2끼 근력운덩2시간  하루똥2번싼다 조금찍짠음식도자극적으로느껴진다 다이어트에성공했다', '삐쩍곯아 배만나온 ㄱㄷㅈ 극혐이다', '', '겨울스포츠 즐겨라. 컬링. 피겨. 스키점프. 루지', '바닥에 닿지말고 다시\n올라가란뜻인데\n15~20cm 라니,\n거인인가', '', '다 거짓말임. 25살 이후로 오로지 숨쉬기만 하는 나도 살 안 찌고 체중유지하고 있음. 특별히 음식 가리지도 않음. 근데도 매일 일정한 시간에 쾌변하고 소화 잘 됨. 술.담배 안 해서 그런건가?', '', '운동한다 숨쉬기운동 침대에서 떡운동', '매일 7키로 조깅한다 아침마다 죽지않아서 오줌을 못싼다', '조선이네 믿거', '', '', '']",https://mdtoday.co.kr/news/view/1065603724590624,https://n.news.naver.com/mnews/article/346/0000056856?sid=103
2022.12.29.,스포츠동아,,"김장철 허리통증, 지속된다면 허리디스크 의심 [건강 올레길]",,,https://sports.donga.com/article/all/20221229/117206748/2,http://www.tf.co.kr/
2022-12-27 10:42:03,팜뉴스,사회,새해에는 '최대 2살' 어려져...얼굴 나이는?,"[ 1단계 구간 공정률 68%, 2단계 구간 국정 과제 반영 등 추진 박차    광주~완도 간 고속도로 위치도/완도군 제공전남 완도군은 광주~완도 간 고속도로 1단계(광주~강진 구간)의 오는 2023년 사업비를 1780억원을 확보했다고 27일 밝혔다.광주~완도 간 고속도로 사업은 총연장 88.61㎞, 4차선 고속도로를 건설하기 위해 약 3 3837억 원이 소요되는 대형 국책 사업이다. 지난 2014년 타당성 재조사 후 광주 벽진동~강진군 성전 1단계, 강진 성전~해남군 남창을 2단계로 나누는 변경안이 만들어져 1단계 구간이 지난 2017년 8월에 착공되었으며 현재 공정률은 68%이다. 1단계 구간은 오는 2026년 8월 준공을 목표로 추진 중이다.또 2단계 구간은 국가 계획인 「제2차 고속도로 건설 계획」 중점 추진 노선으로 반영되었으며 정부 국정 과제에 반영되어 현재 사전 타당성 조사 중에 있다.신우철 군수는 ""현재 추진 중인 1단계 구간과는 별도로 2단계 구간은 내년 상반기부터 본격 추진될 해양치유산업과 국립 난대수목원 조성, 국립해양수산박물관 유치 등 우리 군의 달라진 여건 등을 반영하여 1단계 준공 전 착공될 수 있도록 중앙정부에 지속 건의하고 있다""라고 밝혔다.    광주~완도 간 고속도로 1단계 구간 공사 현장 전경/완도군 제공또한 전 구간이 개통되면 접근성 획기적으로 개선되어 인적·물적 교류 활성화, 전국 단일 생활권 형성 등으로 전남 중남부 지역, 광주권과의 지역 균형 발전을 이루는 데 기여할 것으로 기대된다.특히 완도에서 광주까지 약 2시간 정도 소요되고 있으나 1시간 이내로 단축될 전망이다.한편 2022년은 군의 도로 행정이 많은 결실을 맺는 한해였다. 지난 1월에는 광주~완도 2단계 구간 중점 추진 노선 반영을 시작으로 노화~소안 연도교 지방도 806호선 지정, 정부 국정 과제에 광주~완도 고속도로, 완도~고흥 해안 관광도로, 노화~소안 연도교, 노화 넙도 연도교 사업이 반영되는 쾌거를 이뤘다.발로 뛰는 더팩트는 24시간 여러분의 제보를 기다립니다.▶카카오톡: '더팩트제보' 검색▶이메일: jebo@tf.co.kr▶뉴스 홈페이지: http://talk.tf.co.kr/bbs/report/write ]",[],http://www.pharmnews.com/news/articleView.html?idxno=216380,https://n.news.naver.com/mnews/article/629/0000192256?sid=102
2022.12.30.,헤럴드경제,,"[김태열의 생생건강S펜] '어깨짱'도 좋지만, 잘못된 운동습관부터 고쳐라",,,http://news.heraldcorp.com/view.php?ud=20221230000316,http://www.mdtoday.co.kr
2022.12.01.,골프타임즈,,"[건강라이프] 당뇨환자, 임플란트 진행 시 충분한 상담 후 필요",,,http://www.thegolftimes.co.kr/news/articleView.html?idxno=56524,http://sports.donga.com/
2022-12-29 14:56:01,빅데이터뉴스,사회,"완도군, 식수난 해소 위해 식수원 개발·지하수 저류지 설치 추진","[     (본격적인 김장철이 다가왔다. 이맘때쯤이면 주부들은 걱정이 앞선다. 이른바 ‘김장 증후군’이라는 신조어가 생길 정도로 고된 작업이 필요하기 때문이다. 그중 허리 통증을 호소하는 분들이 많다. 날씨까지 추워지면 근육과 인대가 경직된 상태에서 무거운 배추를 들고 나르는 일까지 반복되다 보면 허리 통증이 생기기 쉽기 때문이다.특히 허리디스크 등 척추질환이 있는 분들이라면 증상이 악화될 수도 있으니 주의해야 한다. 실제 건강보험심사평가원 통계에 의하면, 지난 2021년 허리디스크 30~50대 여성 환자의 수는 10월 7만 6579명에서 11월 7만 8790명으로 증가했으며, 전체 환자 수도 한달 사이 36만 2286명에서 36만 8507명으로 6000여 명이 늘어난 것으로 나타나고 있다.허리디스크의 정식 병명은 ‘요추 추간판 탈출증’이다. 척추 뼈 사이에 있는 추간판(디스크)이 제 자리를 벗어나거나 섬유륜이 찢어지면서 디스크 수핵이 흘러나오게 되고, 척수신경을 압박하여 허리통증과 다리 저림을 비롯한 일련의 증상을 일으키는 대표적인 척추질환이다. 특히 김장철에 허리디스크 환자가 급증하는 이유는 김치를 담그면서 장시간 취하는 등을 굽혔다 펴는 자세가 허리에 충격을 주기 때문이다. 또한 절인 배추나 무거운 김장통을 옮기면서 허리에 강한 충격이 가해지는데, 이때 척추 주변의 근육이 노화된 상태의 중년 여성이라면 디스크로 이어질 확률이 높다.문제는 많은 여성들이 이를 일시적인 근육통 정도로 여기고, 푹 쉬면 낫겠지 하고 넘기면서 증상을 만성으로 악화시키는 경우가 많다는 점이다. 하지만 방치기간이 길어지면 심한 허리 통증과 함께 하지방사통이 뒤따를 뿐만 아니라 허리를 숙이거나 앉아있을 때 요통이 심해 앉거나 서지도 못하는 고통을 겪게 될 수 있어 조기에 신경외과 등 관련 병원에 내원하여 정확한 진단과 적절한 치료를 받는 것이 바람직하다. 강남초이스병원 김상욱 병원장은 “모든 병이 그렇듯 초기에 발견할수록 예후가 좋다“며 ”만약 허리통증이 지속되는 등 조금이라도 의심스러운 증상이 나타난다면 지체 말고 병원을 찾아 정밀 검사를 받아보는 것이 좋다“고 조언했다. 이어 ”증상이 심하지 않다면 약물치료나 물리치료 등 보존적 치료법이나 돌출된 디스크 수핵을 응축시켜 통한 증상 해소와 호전을 기대할 수 있는 고주파수핵감압술 등  비수술 치료를 고려해볼 수 있다“고 덧붙였다. 무엇보다 김장철에는 허리통증을 줄일 수 올바른 자세를 갖는 것이 중요하다. 먼저 쪼그려 앉기 보다는 의자에 앉은 자세로 하는 것이 좋으며 1시간에 한번은 일어나 규칙적으로 스트레칭을 해주어야 한다. 또한 무거운 재료나 통을 들어올릴 때는 허리만 사용하기 보다는 다리 힘으로 일어나야 한다. 양형모 기자 hmyang0307@donga.com ]",[],http://www.thebigdata.co.kr/view.php?ud=202212011449372965e91b94b033_23,https://n.news.naver.com/mnews/article/382/0001024799?sid=102
2022.12.30.,한국강사신문,,[김은아 에세이] 보톡스의 구원,,,https://www.lecturernews.com/news/articleView.html?idxno=115610,http://www.pharmnews.com/
2022.12.30.,CNB저널(문화경제),,온천·명상·피부 케어... 새해 예뻐지는 여행지 6선,,,https://weekly.cnbnews.com/news/article.html?no=147757,http://weekly.cnbnews.com/
2022.12.28.,스포츠동아,,"호반 스플라스 리솜 리조트, 온천 테마 팝업부스 오픈",,,https://sports.donga.com/article/all/20221228/117190563/2,http://sports.donga.com/
2022-12-28 12:09:02,소년한국일보,경제,'개미'들이 농사도 짖는다고?,"[ 스테이 타워 로비에 온천 러버 위한 팝업 부스 ‘온천몽’ 오픈2월28일까지 포토존, 온천 꿈해몽존, 굿즈존, 게임존 등 운영    호반호텔앤리조트에서 운영하는 충남 예산의 스플라스 리솜 리조트는 온천 러버들을 위한 ‘온천夢(온천의 꿈)’ 팝업 부스를 오픈했다. 따뜻한 물에 몸을 담그면 포근한 기운에 전신이 노곤해지고 마치 기분 좋은 꿈을 꾼 듯한 즐거움을 주는 것에서 착안했다. 스테이 타워 로비에 마련한 팝업 부스는 달과 별, 몽글몽글한 구름으로 꿀잠 분위기를 연출한 포토존, 목욕탕용 캐비닛을 열어 온천 관련 꿈의 해몽을 확인할 수 있는 꿈 해몽존, 물 없는 탕에서 목욕 그림책을 보는 라이브러리존, 스플라스 리솜 15개 노천탕의 그림을 맞추는 스파탕 퍼즐게임존, 때 타올과 키링 등 목욕탕 테마의  굿즈를 전시한 굿즈존 등을 갖추고 있다. 내년 2월28일까지 운영하며 오픈을 기념해 SNS 인증 이벤트도 진행하고 있다. 부스 곳곳의 포토 스팟에서 사진을 찍어 필수 해시태그와 함께 SNS에 업로드하면 추첨을 통해 30명에게 경품을 증정한다.  스플라스 리솜 리조트는 600년 역사의 덕산 온천수를 사용하는 온천워터파크를 갖추고 있으며 야외 스파와 파도풀, 슬라이드 등 모든 물놀이 시설을 사계절 운영한다. 덕산온천수는 중탄산나트륨, 규소, 칼슘, 마그네슘 등 다양한 미네랄 성분을 비롯해 피부미용, 노화방지 등 건강과 미용 증진에 효능이 있다고 알려진 실리카 성분을 다량 함유하고 있다.스포츠동아 김재범 기자 oldfield@donga.com ]",[],http://www.kidshankook.kr/news/articleView.html?idxno=5715,https://n.news.naver.com/mnews/article/382/0001024587?sid=101
15면 TOP,서울신문,,떠나기만 하면 예뻐지는 곳… 올겨울 여기 어때,,,https://www.seoul.co.kr/news/newsView.php?id=20221229015002&wlog_tag3=naver,http://www.kidshankook.kr/
2022.12.03.,메디소비자뉴스,,"[기고문] 상악동거상술 임플란트, 의료진 숙련도가 결과 좌우한다",,,http://www.medisobizanews.com/news/articleView.html?idxno=102573,https://www.seoul.co.kr
2022-12-29 05:03:54,의사신문,생활/문화,"서울성모병원 심뇌혈관병원, TAVI 시술 연간 200례 돌파","[ 한국관광공사 1월 ‘가볼 만한 곳’ 6곳 선정차고 건조한 날씨는 피부를 괴롭힌다. 각질은 늘고 전에 없던 잔주름도 생긴다. 피부 건강에 도움을 주는 여행지가 있다면 이 계절에 딱일 듯하다. 피부 보습과 관련된 전국의 여행지를 추렸다. 온천도 있고 동백기름을 만드는 시골 마을도 있다.#여자들의 취향 저격 놀이터     1.서울 중구 뷰티플레이국내 중소 화장품 기업을 위해 보건복지부가 지원하는 오픈형 체험 공간이다. 우수한 제품을 무료로 마음껏 써 볼 수 있어 더욱 즐겁다. 수십 개 브랜드의 대표 제품이 즐비해 ‘코덕’(코스메틱 덕후)이 아니어도 설레고 흥분된다. 올해만 221개 기업의 1211개 제품을 선보였다. 전시·체험 공간이지만 마음에 드는 제품은 QR코드를 통해 구매도 가능하다. 전문가 메이크업 서비스, 피부 진단과 헤어스타일링 서비스 등도 무료로 이용할 수 있다. 나만의 향수 만들기, 아이 메이크업, 폼클렌저 만들기 등 유료 클래스도 있다.#명상으로 치유하다     2. 충북 충주 깊은산속옹달샘깊은산속옹달샘은 명상을 통한 치유를 지향점으로 내세운 공간이다. 옹달샘 자연명상스테이가 대표 프로그램이다. 자연목과 황토벽으로 마감한 숙소에서 잠들고 좋은 식재료로 만든 음식을 먹는다. 여기에 다양한 명상 프로그램이 더해진다. 스파, 도서관, 산책로도 자유롭게 이용하며 내 몸과 마음을 보듬는 시간을 보낼 수 있다. 스테이 프로그램은 1박 2일부터 있다. 탄산 온천수로 유명한 앙성온천, 전통의 수안보 온천 등이 가까이 있다. 중앙탑사적공원, 비내섬도 가깝다.#홍삼 기운으로 기력 충전     3. 전북 진안 홍삼스파진안홍삼스파는 홍삼을 테마로 꾸민 체험형 스파다. 데스티네이션스파는 홍삼 거품으로 전신을 마사지하는 버블센스테라피, 개별 욕조에서 반신욕을 하는 아로마테라피, 홍삼 가루가 들어간 머드팩을 체험하는 하모니테라피 등 5개 코스로 구성된다. 1인 1회 이용할 수 있고, 체험 시간은 각각 10~20분이다. 퍼블릭스파는 풀타임으로 머물며 스파를 하는 공간이다. 워터젯 등 수(水)치료 기구, 사운드 플로팅을 위한 별도 공간도 마련했다. 옥상 노천탕에서는 마이산(명승)이 한눈에 들어온다.#몸이 행복해지는 해수와 녹차     4. 전남 보성 율포해수녹차센터보성 바닷가에 들어선 율포해수녹차센터는 해수탕과 녹차탕을 갖췄다. 몸이 가뿐해지고 피부가 고와지는 해수와 녹차의 효능을 함께 누릴 수 있다. 해수탕은 혈액순환과 신경통에, 녹차탕은 피부 탄력과 노화 방지에 효과가 있는 것으로 알려졌다. 욕탕은 지하 120m에서 끌어 올린 암반 해수를 쓴다. 3층 노천탕에선 득량만 바다와 솔숲 해변이 펼쳐진다. 해돋이도 볼 수 있다. 3층에는 아쿠아토닉풀, 황토방과 황옥방 등 테마 찜질방이 있다. 오전 6시부터 연중무휴로 운영된다.#건강과 아름다움을 한 번에     5. 경남 거제 해수보양온천정부가 2018년 국민보양온천으로 지정한 시설이다. 미네랄이 풍부한 온천수로 신체 여러 부위를 자극하는 바데풀이 특징이다. 온천 입장료(8800원)엔 실내 수영장과 헬스클럽 등의 이용료가 포함됐다. 실내 수영장도 온천수를 쓴다. 길이 25m의 레인도 갖췄다. 가족탕은 2시간 이상 시간제로 운영된다. 한약재가 포함된 보양식도 판매한다. 인근 맹종죽테마파크의 대숲은 산소 발생량이 많아 피부 보습에 효과적이다. 거제 바다가 한눈에 들어오는 파노라마 케이블카도 ‘핫플’이다.#동백꽃처럼 내 얼굴도 활짝     6. 제주 동백기름 체험동백 씨에서 추출한 동백기름은 예부터 여인들이 머릿결을 가꾸는 데 썼다. 다양한 효능 덕에 지금도 화장품 원료로 쓰인다. 제주 동백마을은 300년이 넘은 신흥동백나무군락을 품은 유서 깊은 마을이다. 해마다 토종 동백 씨앗을 모아 기름을 짠다. 생동백오일은 피부 진정과 보습, 아토피에 효능이 있는 것으로 알려졌다. 비누와 화장품 체험 프로그램은 여성들에게 인기다. 씨앗을 볶아서 짠 식용 동백기름은 올레산(오메가9)이 많아 ‘동양의 올리브유’라고 불린다.사진 한국관광공사   ]",[],http://www.doctorstimes.com/news/articleView.html?idxno=221290,https://n.news.naver.com/mnews/article/081/0003328555?sid=103
2022.12.29.,더스쿠프언론사 선정,,[실험실 창업] 중국산 원료 없는 '한방 보충제'로 승부,,,https://www.thescoop.co.kr/news/articleView.html?idxno=56312,http://www.medisobizanews.com
2022.12.30.,전자신문,,"'초고령사회 웰에이징 공동체, 고령자·치매 환자 진료 네트워크 심포지움' 개...",,,https://www.etnews.com/20221230000015,http://www.doctorstimes.com/
2022.12.30.,동아일보,,"[스케일업] 이노디테크 [2] “타겟에 맞춘 채널에, 신뢰성 있는 콘텐츠로 접근...",,,https://www.donga.com/news/article/all/20221230/117228136/1,https://www.thescoop.co.kr/
