Date,Press,Category,Title,Content,Comment,URL_Origin,URL_Naver
2022.12.30.,헬스조선언론사 선정,,"눈 침침해진 중년, 루테인이 필수품?[이게뭐약]",,,https://health.chosun.com/site/data/html_dir/2022/12/30/2022123001437.html,http://health.chosun.com/
2022-12-30 17:27:01,메디컬투데이,,피부 노화 개선 리프팅 시술 만족도 높이려면?,"[ [이게뭐약] 건강기능식품 루테인 복합제    루테인 복합 건강기능식품은 황반변성이 있는 사람에게만 도움이 된다.  /게티이미지뱅크40대가 넘어가면 하루가 다르게 눈이 침침해지는 걸 느낀다. 현대사회에선 휴대전화, PC 등을 자주 볼 수밖에 없다 보니 20~30대라도 눈이 쉽게 피로해지고 시야가 흐릿해지는 경험을 하는 경우가 많다.눈 건강이 걱정되어서 루테인 함유 건강기능식품 먹는 경우가 많다. '2022 건강기능식품 시장현황 및 소비자실태조사'에 따르면, 루테인지아잔틴복합추출물은 우리나라 40~50대가 가장 많이 복용한 건강기능식품이기도 하다.루테인 함유 건강기능식품은 노화로 인한 눈 건강 문제 개선에 정말 도움이 될까? 젊을 때부터 루테인을 복용하면 눈 노화 속도를 늦출 수 있을까? 전문가의 도움을 받아 루테인의 실제 효능·효과에 대해 정확히 살펴보자.황반변성엔 효과 확실, 일반 노화엔 '글쎄…'수많은 광고가 루테인의 눈 노화 증상 개선, 눈 건강 강화 효과를 얘기하고 있으나, 루테인은 단순 노화로 인해 생긴 시력 저하나 눈 건강에 별다른 도움이 되지 않는다. 노화 과정에서 생긴 황반변성 때문에 시력이 나빠진 이들만 루테인의 효과를 볼 수 있다.노원을지대병원 안과 정은혜 교수는 ""루테인은 노화로 인해 감소할 수 있는 황반색소 밀도를 유지하는데 도움을 주는 건강기능식품""이라며, ""눈 건강을 위한 만병통치약이 아니다""고 말했다. 정 교수는 ""루테인은 노화가 원인인 황반변성 환자 중에서도 병이 중기 이상으로 진행된 사람이 복용했을 때 시력 악화 방지 효과를 얻을 수 있다""며, ""노안 방지나 개선을 위해서는 굳이 복용할 필요가 없는 성분""이라고 했다.루테인 복합제의 황반변성 진행 억제 효과는 과학적 근거가 분명하다. 미국 국립보건원(NIH)에서 올해 7월에 발표한 최신 대규모 연령관련 안질환연구(AREDS)를 보면, 루테인 복합제를 복용한 황반변성 환자는 실제로 병의 진행이 지연됐다.대한약사회 김예지 학술위원(약사)은 ""신뢰도가 높은 국내외 연구를 보면, 루테인은 황반변성을 지연하거나 조절하는 효과가 있다""고 말했다. 김 위원은 ""최신 연구에서 루테인이 포함된 AREDS2 formulation(루테인, 지아잔틴, 비타민 C &amp; E, 아연, 구리)을 추가 복용한 중기 이상 황반변성 환자는 질환 진행이 실제로 지연된 사실이 확인됐다""라며, ""그러나 황반변성이 없는 일반인의 눈 건강에 루테인이 도움을 준다는 분명한 근거는 없다""고 말했다.루테인 결핍자에게도 도움루테인은 황반변성이 아닌 일반인에게 시력 저하 방지 등의 효과가 없다. 다만, 황반변성 환자는 아니라도 평소 황반색소 밀도가 낮을 가능성이 큰 사람에겐 약간의 도움을 줄 수 있다. 식품의약품안전처는 루테인과 루테인/지안잔틴 복합제를 노화로 인해 감소할 수 있는 황반색소 밀도를 유지, 눈 건강에 도움을 줄 수 있는 성분으로 인정하고 있다.김예지 위원은 ""평소에 루테인 섭취가 부족하다고 느낀다면, 루테인 복합제 복용을 권장할 수 있다""고 말했다. ""루테인은 브로콜리, 케일, 시금치 등에 풍부하게 들어있고, 비타민 A, B1, C, E와 구리, 아연, 오메가 3, 빌베리와 함께 복용하면 시너지 효과를 낼 수 있다""고 했다.시력 저하, 사물 변형 나타난다면 병원부터나이가 들며 서서히 시력이 나빠졌다고 느낀다면 루테인 복용보다는 안과를 찾는 게 좋다. 특히 40대 이후 시력저하를 느꼈다면, 최대한 빨리 안과를 방문해야 한다.정은혜 교수는 ""나이가 들수록 백내장, 황반변성 등 눈 질환 유병률이 증가한다""며, ""시력저하, 중심암점(사물의 중심에 암점이 생기거나), 변형시(사물이나 직선이 휘어져서 보이는 증상) 등이 발생하면 반드시 전문의 진찰을 받기를 권한다""고 말했다. 즉시 병원을 찾기 어려운 상황에선 바둑판 모양의 암슬러 격자 검사 또한 도움이 된다.아무런 증상이 없더라도 40세 이상이라면 정기적인 안과 방문이 권고된다. 정은혜 교수는 ""중노년기에 주로 발생하는 황반변성은 초기 증상을 자각하기 어렵고, 치료 시기를 놓치면 실명할 수 있다""며 ""특히 흡연은 황반변성의 위험인자이므로 금연하고, 증상이 없더라도 정기적인 안저검사를 권한다""고 했다. ]","['시력에는 !  블루베리 계란 당근 시금치 결명자....제1은 블루베리 !', '루테인 먹고 눈부심 눈물 나는 중상 호전됐는데', '', '30대가 되어갈때부터 눈이 침침하고 잘안보이고 ㅠ 아 갈수록 늙는구나 ㅠ 슬프다 ㅠ', '다 사기다!!', '', '유뜝.. 유명한 약사가..루테인 먹을 필요없다 함.  댓글대로  블루베리나 이런거 먹는게 좋은 듯', '결명자 먹어라 몸이 찬 사람들은 생강이나 대추 넣고 먹고 여자들은 무조건 생강이나 대추 넣어라', '그럼 노안으로 시력저하가 오면 도움되는 뭔가를 가르처주세요', '오메가3 메가도스가 좋습니다..', '안과의사들도 안 먹는 루테인.', '20BOX 샀는데,\n\n안과 의사왈 : 그돈으로 소고기나 사드세요!', '황반변성 전조기인데 루테인 먹어야겠군요.', '그럼안먹어도된단얘기?', '어쩐지...시력에 하나 도움 안되서 먹다 끊음.  아직 도남아있음', '루테인 약으로먹는건 흡수율과 효과의문 ㅡ계란드세요 눈많이좋아짐  루테인흡수도짱', 'test', 'ㆍ', '', '', '', '눈이 침침해지는건 실내 독소로 인한 염증이다.']",https://mdtoday.co.kr/news/view/1065593416299138,https://n.news.naver.com/mnews/article/346/0000056948?sid=004
2022.12.30.,헤럴드POP,,"'오상진♥' 김소영, CEO의 깊어지는 주름 고민..""신체적으로 노화되고 있어""(...",,,http://biz.heraldcorp.com/view.php?ud=202212302046184317168_1,http://www.mdtoday.co.kr
2022.12.30.,KBS,,"일본, 늙은 쥐를 회춘시킨 노화세포 제거술…인간 적용?",,,https://news.kbs.co.kr/news/view.do?ncd=6324473&ref=A,http://www.heraldpop.com/
2022-12-30 21:44:00,경기신문,,[우리말 하루 한 단어] 안티에이징 → 노화 방지,[],[],https://www.kgnews.co.kr/news/article.html?no=722712,https://n.news.naver.com/mnews/article/112/0003607541?sid=106
2022.12.29.,대한경제,,癌 아닌척 하는 ‘간첩세포’…노화 뗄 수 없는 ‘좀비세포’,,,https://www.dnews.co.kr/uhtml/view.jsp?idxno=202212290805205540708,http://news.kbs.co.kr/
2022-12-30 09:52:04,브레인미디어,세계,"""명상하면 두뇌 노화 속도 감소되고 치매 예방 가능해""","[                [앵커] 일본 연구팀이 늙은 쥐를 회춘시키는데 성공했는데 이 성과가 인간에게 어떻게 접목될 수 있을지  관심이 모아지고 있습니다. [리포트] 일본 도쿄대학 의과학 연구소에서 노화 치료를 연구하는 나카니시 교수. 그는 노화세포를 제거함으로써 늙은 쥐를 회춘시키는데 성공했습니다. 나이가 같은 쥐 40마리를  막대기에 매달리게 했더니 보통의 쥐는 30초 매달린데 반해, 노화 세포를 제거한 쥐는 100초나 매달립니다. 노화 세포는 세포 기능은 못하면서  시간이 가면서 염증 등을 일으키는 물질을 배출해 신체 능력을 떨어뜨리는  역할을 하고 있습니다. [나카니시 마코토/도쿄대학 의과학 연구소 : ""신경세포가 노화되면 알츠하이머에 걸리고, 간에 노화세포가 쌓이면 염증을 일으키죠.""] 나카니시 교수는 노화세포가 스스로를 보호하기 위해 특수 효소를 방출한다는 것을 알게 됐고 약으로 이 효소가 기능하지 못하게 해 다른 건강한 세포를 다치게 하지 않고 노화세포만 파괴하는데 성공한 것입니다. 나카시니 교수는 연구의 최종 목표는  수명 연장에 있는 것이 아니라 사는 동안 최대한 젊고 건강하게 살아갈 수 있는 방법을 찾는 것이라고 말합니다. ]","['박수를 보냅니다. 축하드려요 ~^^', '지구엔 대재앙이네..', '']",http://www.brainmedia.co.kr/BrainTraining/23202,https://n.news.naver.com/mnews/article/056/0011401992?sid=104
2022.12.31.,이데일리,,남성 갱년기 증상 나타나면 건강 주위해야,,,http://www.edaily.co.kr/news/newspath.asp?newsid=01118486632564096,http://www.kgnews.co.kr/
2022.12.30.,코메디닷컴,,새해 만사혈통 하세요! 혈행 개선하는 솔루션은?,,,https://kormedi.com/?p=1554595,http://www.cnews.co.kr
2022.12.29.,한겨레21언론사 선정,,"아이는 한밤중, 할머니는 한낮인 휴일 아침 8시",,,https://h21.hani.co.kr/arti/culture/science/53135.html,http://www.brainmedia.co.kr
2022.12.29.,한겨레21언론사 선정,,"아이는 한밤중, 할머니는 한낮인 휴일 아침 8시",,,https://h21.hani.co.kr/arti/culture/science/53135.html,http://h21.hani.co.kr/
2022-12-29 13:29:02,메디컬투데이,IT/과학,"리프팅 시술, 효과적이면서 안전성 높이려면","[ [늙음의 과학]지구에 사는 생명체면 다 있는 멜라토닌의 비밀    소의 송과선 추출물을 먹인 뒤 투명하게 변한 올챙이.(MacCord &amp; Allen, ‘Evidences Associating Pineal Gland function with Alterations In Pigmentation’, , 1917)부모님과 3대가 모여 살던 우리 집, 휴일 아침 8시의 모습은 참으로 다양했습니다. 일곱 살 막둥이에게는 해님이 일어나 자신도 일어나야 하는 시간이었지만, 유독 아침잠이 없는 조부모에게는 이미 한낮이었고, 사춘기에 들어서면서 밤잠이 없어진 큰아이에게는 한밤중이었습니다. 직장인인 저와 남편에게는 깨어났지만 따뜻한 이불 안에서 나가고 싶지 않은 달콤한 시간이었고요. 왜 같은 집에 살면서 이렇게 다른 시간대를 사는 것일까요? 이를 알아보기 위해 먼저 100년 전 올챙이를 들여다보던 과학자들의 이야기부터 해보려 합니다.투명 올챙이를 만들어낸 사람들지금으로부터 100여 년 전, 두 과학자가 올챙이로 실험하고 있었습니다. 그들은 먹이의 종류에 따라 올챙이에게서 어떤 변화가 일어나는지 측정하기 위해 무려 1만2천 마리의 올챙이를 여러 그룹으로 나누고 대조군에 소에서 추출한 근육, 즉 고기를 먹이고, 실험그룹은 각각 갑상샘, 부갑상샘, 부신, 송과선 추출물을 잘게 갈아 먹였습니다. 이 조직들은 체내에서 호르몬을 생산하는 곳이라 알려져 이들의 역할을 알고 싶었던 거죠. 그런데 뜻밖의 일이 일어났습니다. 실험을 시작한 지 열흘쯤 되자 한 무리의 올챙이들이 집단으로 투명해졌습니다. 이들은 의도치 않게 투명 개구리를 만들어낸 셈이지만, 무엇이 이 올챙이들을 투명하게 변신시켰는지는 알지 못합니다. 이 비밀이 밝혀진 것은 그로부터 수십 년이 지난 1958년이었습니다. 미국 예일대학의 피부과 의사 에런 러너 박사가 송과선에서 올챙이를 투명하게 변신시키는 호르몬을 분리하는 데 성공했습니다. 그는 이 새로운 호르몬에 멜라닌 색소에 영향을 미친다는 뜻으로 멜라토닌(Melatonin)이라는 이름을 붙여줍니다. 지금은 수면-각성 행태를 조절하는 호르몬으로 잘 알려진 멜라토닌은 처음에는 이렇게 투명 올챙이의 발견에서 시작됐고, 그렇기에 피부 색소를 연구하던 피부과 의사가 그 정체를 가장 먼저 밝혀낸 것이죠. 송과선은 척추동물의 뇌 속에 있는 아주 작은 기관입니다. 모양이 솔방울을 닮았다 하여 송과선(松果腺, Pineal Gland)이라는 이름이 붙었으며, 한글로는 솔방울샘이라고 하지요. 얼마나 작냐면, 1.4㎏에 달하는 사람의 뇌에서 송과선이 차지하는 질량은 겨우 0.1g에 불과합니다. 하지만 덩치가 작다고 이름값이 덜한 것만은 아니듯 송과선은 그 크기에 비하면 잘 알려진 편입니다. 사실 송과선이 유명해진 건 과학자들 때문이 아니라 철학자인 르네 데카르트 덕입니다. 심신이원론을 주장한 데카르트는 송과선이 육체와 정신이 만나는 점이라고 주장했거든요.     사람 뇌의 단면도. 송과선(솔방울샘)은 좌우 대뇌반구 사이 뇌실에 있다. https://www.brainmedia.co.kr/Insight/20745빛에 의해 하루와 동기화되는 멜라토닌데카르트가 왜 하필 하고많은 뇌의 다양한 기관 중에서 송과선을 꼬집어 그런 주장을 했는지는 명확하지 않지만 일단 송과선의 위치가 절묘합니다. 송과선은 좌우 대뇌반구 사이 뇌의 중앙 부분 뇌실, 빛이 들어가는 시상하부 뒤쪽에 위치하며, 해부학적으로는 혈액뇌장벽(BBB·Blood Brain Barrier) 바깥쪽에 있습니다. 혈액뇌장벽이란 뇌를 둘러싼 뇌혈관 전체에 분포하는 일종의 선택적 필터입니다. 혈액뇌장벽이 있기에 혈액 속 노폐물과 독소, 약물 등 해로운 물질이 함부로 뇌로 들어오지 못하지요. 물리적으로 뇌의 가장 깊숙한 곳에 있음에도 뇌혈관장벽에서 분리된 곳이라는 절묘한 위치에 놓인지라, 송과선은 뇌와 몸을 잇는 중간 지점이라는 생각이 들기도 합니다. 그러니 송과선에서 분비되는 멜라토닌도 단지 투명 올챙이를 만드는 것을 넘어선 다른 기능이 있지 않을까요? 멜라토닌의 정체가 밝혀지고 4년 뒤인 1962년, 드디어 멜라토닌이 생체주기에 영향을 미친다는 사실이 알려집니다. 지용성 호르몬인 멜라토닌은 사람을 비롯한 척추동물뿐 아니라 자연계에서 곤충과 식물, 심지어 곰팡이와 박테리아에서까지 관찰되는 매우 흔한 호르몬입니다. 그만큼 오래되고 중요한 호르몬이라는 뜻이죠. 그럴 수밖에 없는 것이 하루에 한 번 꼬박꼬박 자전하는 지구에서 살아가는 한, 이 주기적 행태에 적응하지 못한 생명체는 살아남을 수 없을 테니 말입니다. 사람의 경우를 예로 들면, 멜라토닌은 일몰(오후 7~8시)과 함께 서서히 분비량이 늘어 새벽 2~4시에 가장 높은 농도를 유지하다가 일출과 함께 점점 분비량이 줄어 한낮에 가장 적게 분비되지요. 멜라토닌 분비량이 늘어나면 심부체온이 약간 낮아지며 잠이 오고, 멜라토닌이 줄어들면 심부체온이 다시 올라가며 잠에서 깨어나게 됩니다. 이때 빛은 멜라토닌의 분비량을 조절하는 역할을 하지만, 빛이 없다고 멜라토닌이 과다 분비돼 계속 잠만 자는 것은 아닙니다. 원래 인체의 생체시계는 빛이 전혀 없어도 문제없이 돌아갑니다. 그래서 빛이 전혀 들지 않는 지하실이나 무너진 갱도 등에 갇힌 이들도 주기적인 수면-각성 행태를 보이죠. 하지만 빛은 멜라토닌의 분비량을 조절해 생체시계가 주변 환경에 맞게 동조되도록 조절하는 역할을 합니다. 신장은 늘 혈액을 걸러내 소변을 만들어내지만, 날이 더워 땀을 많이 흘리면 소변양을 줄이고 날이 추워 땀이 덜 나면 소변양이 늘어나는 것처럼, 멜라토닌도 주기적으로 분비되지만 빛이 그 양상을 조절해 신체의 수면-각성 행태가 하루의 일출-일몰과 어느 정도 맞게 동기화하죠. 그래서 계절에 따라 밤낮의 길이가 달라지면 멜라토닌의 주기 역시 동기화되므로, 낮이 긴 여름보다 밤이 긴 겨울에 유독 아침에 일어나기가 더 힘들어집니다. 또한 멜라토닌은 수면-각성 외에 다양한 생물에게서 섭식, 면역, 성적 행동, 체온 조절, 뇌 발달과 인지 능력, 노화 과정 등에 다양하게 미치는 복합적 호르몬입니다. 신생아부터 노인에 이르기까지 세상에 잠을 안 자고 살아가는 사람은 없습니다. 그러니 수면을 관장하는 호르몬인 멜라토닌도 연령과 상관없이 모두 분비되지요. 다만 그 행태가 조금 다릅니다.     생애주기에 따른 멜라토닌 분비 행태. 초록색 선이 멜라토닌 분비 곡선이다. 청소년기 멜라토닌 분비 행태가 유년기에 비해 뒤로 밀려난 것이 보인다. ibric.org시도 때도 없이 깨던 아기, ‘백일의 기적’신생아의 경우, 멜라토닌의 주기성이 아직 제대로 잡혀 있지 않습니다. 멜라토닌은 태반을 통과할 수 있어 엄마의 몸에서 만들어진 멜라토닌이 탯줄을 타고 흘러 들어오기 때문에 태중의 아기는 멜라토닌을 조절할 필요가 없습니다. 그러니 출생 뒤 엄마의 몸에서 분리된 아기는 일종의 혼란기를 겪습니다. 멜라토닌을 분비하는 송과선은 갖췄지만 아직은 얼마나 자주, 얼마나 많이 멜라토닌을 분비해야 하는지 파악하지 못한 상태죠. 그러다보니 신생아는 일정한 주기 없이 자다 깨다를 반복하고, 이는 주양육자를 수면 부족으로 힘들게 하는 주된 요인이 됩니다. 세상에 던져진 갓난아이의 송과선이 세상을 파악하고 적절한 멜라토닌 분비 주기를 챙기는 데는 보통 3개월이 넘게 걸립니다. 이즈음이 되면 아기는 밤에 5~6시간 정도 길게 자고, 낮에 1~2시간 정도 짧은 잠을 두세 번 자는 수면 행태가 만들어져 시도 때도 없이 깨는 아기로 인해 정신줄을 반쯤 놓았던 부모의 숨통을 약간 틔워줍니다. 신생아 육아에 지친 엄마들 사이에서 전설처럼 내려오는 ‘백일의 기적’은 바로 낯선 세상에 갑자기 던져진 아기가 세상에 적응한 1차 결과인 셈입니다. (물론 이런 수면 행태가 잡히는 것은 아기마다 차이가 있어, 어떤 아기는 2개월쯤에도 가능하지만 어떤 아기는 2년씩 걸리기도 합니다.) 이렇게 주기가 잡힌 멜라토닌 분비 행태는 유아기를 거쳐 유년기에 들어서면서 서서히 밤으로 집중돼 낮잠이 점점 줄고 대신 밤잠을 길게 자는 것으로 모입니다. 비단 착한 어린이뿐 아니라 대다수 어린이는 가만 놔두면 자연현상에 맞춰 일찍 자고 일찍 일어납니다. 아이들이 늦잠을 자는 건 늦게 잤기 때문이며, 늦게 잠드는 건 그만큼 아이들을 유혹하는 다양한 자극에 노출됐기 때문이죠. 아침을 선호하는 멜라토닌의 ‘착한’ 분비 형태는 초등학생 시절까지 유지되다가, 사춘기에 들어서면서 급격히 바뀝니다. 이전에 비해 멜라토닌의 최대 분비 시간이 2~3시간 정도 뒤로 밀리죠. 이로 인해 청소년기는 밤엔 말똥말똥하고 아침에 일어나기 힘들어하는 올빼미족이 대거 양산됩니다. 왜 이런 현상이 일어나는지는 정확하지 않습니다. 이 시기에 분비되는 성호르몬이 멜라토닌의 분비 주기를 방해하기 때문이라는 연구가 있지만 확실하지는 않습니다. 하지만 시기는 늦더라도 청소년기는 멜라토닌의 양만큼은 최대로 분비되는 시기이므로, 이 나이 때의 아이들은 한번 잠들면 누가 업어가도 모를 정도로 푹 자고, 잠만 자고 일어났을 뿐인데도 다시 기력이 쌩쌩하게 돌아오는 놀라운 회복력을 보여줍니다. 나이 들어 멜라토닌 분비도 줄어드니…이렇게 늦춰졌던 멜라토닌 최대 분비 시기는 성인기가 되면 다시 앞당겨지며, 안정적인 수면 행태가 고정됩니다. 하지만 이 상태가 계속 지속되는 것은 아닙니다. 나이 들수록 깊이 잠들기가 어려워지며, 꾸벅꾸벅 졸다가도 한번 잠이 깨면 다시 잠들 수 없어 이른 새벽에 서성거리는 일이 자주 생기고, 잠자고 나도 몸이 개운치 않습니다. 이건 나이 들수록 송과선의 기능이 떨어져 멜라토닌 분비량이 줄어들기 때문에 일어나는 현상입니다. 멜라토닌이 부족하니 몸은 잠을 원해도 그 잠의 질이 현저히 떨어지죠. 멜라토닌 부족은 노화의 결과일 뿐 아니라, 멜라토닌 자체가 노화 속도에도 영향을 미칩니다. 그렇다면 멜라토닌을 보충해주는 것이 노화 속도를 늦출 수 있을까요? (이 내용은 다음 칼럼에 이어집니다.) 이은희 과학커뮤니케이터*늙음의 과학: 나이 들어가는 당신은 노화하고 있나요, 노쇠하고 있나요. 과학커뮤니케이터 이은희의 나이 드는 것의 과학 이야기. 3주마다 연재. ]","['재밌다 ㅎ ㅎ', '', '너무 잘읽었어요. 지금 저는 새벽 3시에 이걸읽고있네요. ㅜ ㅜ 저처럼 수면장애가 있는 중년이 주변에 많습니다. 다음 기사에서  관련내용이 있기를 기대해봅니다.', '재밌군요^^ 저는 개인적으로 영유아기 아이들이 7~8시 기상ㅡ9시 등원ㅡ12시~3시 낮잠ㅡ7~8시 취침 했을 때 가장 좋은 퍼포먼스가 나온다고 보는데, 멜라토닌 분비 관계해서 근거가 있었군요.', '코티졸 곡선도 설명해주면 좋겠어요', '올~~~재밌다. 다음 얘기가 기대되네.  인체는 신비 그 자체다', '', '유익한 내용을 쉽고 재미있게 풀이해 이해가 잘 되네요 이런 기사 너무 좋아요^^', '갱년기라  수면질도  나쁘고  3~4시간 정도  자고  하루를  시작해야하니\n몸은  늘  피곤하고...\n젊을땐  잠이  쏟아져서  더 자고싶었는데 \n 지금은  자고싶어도 못자는..ㅜㅠ', '낯선 내용인데 금방 읽혀요~ 담 내용이 기대됩니다', '오랜만에 진짜 유익한 기사 재밋어요 ㅎ', '재밌네요\n다음에 어떤것이 나올지 기대가 되는데요', '이런 글 너무 유익하고 좋네요. 다음이 기다려집니다', '좀 길지만~ 간만에 유익하고 즐거운 기사를 읽었네요~~~ 다음편도 기대하겠습니다~^^', '좋은 글 감사합니다.', '재미있고 유익한 기사입니다^^^', '호르몬의 영향이 대단하군요..\n 정말 흥미롭게 읽었습니다!', '너무 재미있게 읽었어요. 공감도 되고요. 예전에 3대가 살때 우리집 분위기인데... ^^ 점점 나이가 든다고 생각되니 조금은 서글퍼집니다.ㅠㅠ', '좋은 글 감사합니다. 몇가지 궁금증이 확 풀렸네요', '흥미롭게 잘 읽었어요 다음에 이어질 내용이 궁금하네요~', '좋은 기사 감사합니다', '😳', '', '내가 잠못드는 이유는 역시 과학이였어.,\n다른 호르몬도 공부해보고 싶네요.', '다음 칼럼 기대됩니다', '대학생도 사춘기때처럼 올빼미족이 많은데', '기사 너무 재밌게 잘 읽었습니다. 건강관련된 신문인줄 알았는데 한겨레였네요. 정말 잘 읽었습니다. 글도 재미나게 잘 쓰시네요. 내용도 좋았습니다.', '재밌네요!', '야이시벌이걸3주마다연재하면어떡해', '글 너무 유익하고 재미있습니다!!!', '', '저는 아직 청소년인가봐요 ... ^^', '그냥 며느리가 아침형이 아니라서 아이들이 따라가는겁니다\n우리도 삼대가 살았지만 아침에 모두 6시면 일어나고 휴일도 늦잠을 못 자는지라 7시면 일어나서 8에 아침 먹어야합니다 모두 직장생활하지만 아침형끼리 살면 그렇습니다 우리가 나가고 오빠네가 들어왔는데 우리부모님 휴일 아침에 몰래 나가서 아침드시고 오셔도 10시에도 그집은 다 잡니다 오빠는 아침형이었는데 바뀌었고 나도 이제 나이먹어 며느리 봤는데 엄청 부지런하지만 쉬는 날은 10시에도 안 일어나는걸 알아서 휴일은 연락 안 합니다 할 일 없어서 안 피곤하고 잠 안오는것은 별개에요']",https://mdtoday.co.kr/news/view/1065604142991154,https://n.news.naver.com/mnews/article/036/0000047552?sid=105
2022.12.30.,매경이코노미언론사 선정,,신체 기능 ‘뚝’…걷는 속도 느려지면 의심을,,,https://www.mk.co.kr/article/10579788,http://www.mdtoday.co.kr
2022.12.29.,YTN사이언스,,[과학의 달인] 샤르코-마리-투스 유전병 치료법 '전자약 기술' 개발,,,https://science.ytn.co.kr/program/view.php?mcd=0082&hcd=0031&key=202212291710431885,http://www.mkeconomy.com/
