Date,Press,Category,Title,Content,Comment,URL_Origin,URL_Naver
2022-06-19 09:10:01,뉴시스,경제,"대우건설, 독립유공자 후손 노후주택 개선활동","[ &lt;차학봉기자의 부동산 봉다방&gt; 리츠 전문가 제이알투자운용 김관영 대표 인터뷰리츠, 올라도 10% 내려도 10% 대박은 없어도 쪽박도 없다금리 인상기에는 임차인 신용도, 임대기간,  대출조건 살펴야전기차 충전소, 요양시설 등 다양한 리츠 출시 기대리츠는 기업의 투자를 늘려 국가 경쟁력 강화에도 기여       “요즘 같은 주가 폭락기에도 리츠 주식은 올라도 10%, 떨어져도 10% 내외로 움직일 정도로 안정적이다. 주가 등락에 일희일비하지 말고 리츠에 투자하세요. 연간 5~6%의 배당을 꾸준히 받을 수 있는 리츠는 노후 대비용으로 최적의 상품이다.”리츠운용사 ‘제이알투자운용’의 김관영 대표는 “리츠야말로 최적의 노후 생활 대비용 투자상품”이라고 강조했다. 리츠는 부동산에 투자해서 임대 수익을 배당하는 상품으로, 한국에는 20개 종목이 증시에 상장돼 일반 주식과 똑같이 거래되고 있다. 2008년 설립한 제이알투자운용은 그동안 공모 사모 리츠와 부동산 펀드 57개, 9조원(누적)의 자산 운용 실적을 자랑한다.한국리츠협회장을 역임한 김 대표는 국내 최초 병원리츠, 국내 최초 호텔리츠, 국내 최초 해외리츠를 출시했다. 국내 리츠 시가총액 4위인 제이알글로벌리츠가 증시에 상장돼 있다. 본지는 16일 을지로 제이알투자운용 사무실에서 김 대표를 만나 리츠 시장 전망과 투자방법에 대해 들어봤다. 서울대 경제학과, 펜실베이니아대 와튼스쿨 출신인 김 대표는 KDI와 한양대 경제학과 교수를 거쳐 2008년 이방주 전 현대산업개발 부회장과 함께 제이알투자운용을 설립했다.  이방주 부회장은 현재 제이알투자운용 회장을 맡고 있다.    리츠운용사 ‘제이알투자운용’의 김관영 대표. 대학교수 출신인 김 대표는 ""안정적 배당을 받을 수 있는 리츠가 최적의 노후대비용 상품""이라고 강조했다.           다음 일문 일답.-외국에서는 리츠를 통해 노후를 준비하는 사람들이 많다. 왜 리츠인가?“리츠는 배당수익을 목표로 하는 주식이다. 아마존, 애플 등 기술주들은 일반적으로 가격상승을 기대하고 투자한다. 리츠는 가격 변동은 크지 않지만, 정기적인 배당을 받을 수 있다. 시가 배당률이 5~6%정도 되는 리츠들이 많다. 제로 금리인 일본에서도 배당률이 3%대인 리츠가 많다. 변동성이 작다고 재테크에 불리한 것도 아니다. 미국에서 10년간 주가를 조사한 결과, 리츠의 평균수익률이 일반 주식보다 높았다. 일반 주식들은 대박도 가능하지만 쪽박을 찰 정도로 변동이 심하다. 리츠는 주가가 안정적이고 배당률이 높기 때문에 평균적으로 보면 일반 주식보다 수익률이 좋다.”-리츠도 상품에 따라 배당률에 차이가 나고 주가가 변동한다. 어떤 리츠를 골라야 하나.“리츠는 얼마나 안정적으로 배당을 할 수 있느냐가 중요하다. 리츠는 수익의 90%를 배당해야 법인세를 면제받는다. 배당의 원천이 임대료이다. 임대료를 내는 임차인의 신용도와 임대 기간이 배당의 안정성을 결정한다. 각 증권사 애널리스트들이 리츠에 대한 세밀한 보고서를 내고 있어 일반인들도 정보 취득이 어렵지 않다.특히 한국 리츠는 정부가 시장 육성을 위해 엄격하게 심사해서 상장시키기 때문에 외국보다 안정적 상품이 많다. 올해 코스피가 폭락했지만, 한국 리츠는 보통 올라도 10%, 내려도 10% 내외 변동에 그쳤다. 요즘 주가가 폭락하면서 리츠 주식도 가격이 떨어지고 있다. 임대료 수익을 내는 보유 부동산이 있기 때문에 장기간 보유하면 원래 가격을 회복할 수 있다. 가격 하락기에 리츠에 투자하면 시세대비 높은 배당률 수익이 가능하다. ”-리츠가 소유한 부동산을 매각할 때 시세 차익도 누릴 수 있는 것 아닌가. 시세차익을 감안한 투자 시점이 있는가?“리츠는 오피스, 상업시설, 물류센터 등을 소유한다. 부동산의 가치변동이 정확하게 주가에 반영되는 것은 아니다. 다만, 전반적인 경기가 좋아지면서 공실률이 낮아지고 임대료 상승이 기대되면 매각 차익도 커질 것으로 예상돼 주가도 오른다. 부동산 가격은 임대료와 연동된다고 보면 된다. 국내 리츠 중에서 유독 가격이 많이 오른 리츠도 있는데, 건물 매각 시점이 임박한 경우라고 보면 된다.”    자료=한국리츠협회 홈페이지-6월 18일 기준* [주가배당률=(최근 배당금/현재 주가) x (12/결산주기 개월수) x 100] 현재 주가를 연환산한 값으로 다음 배당 상황에 따라 일부 차이가 있을 수 있음.-특별배당 포함- 배당지급 현황이 없는 경우, 투자설명서에 기반하여 예상 배당률을 기재,  각 리츠 별로 예상 배당률 산술식이 상이 -금리가 급등하고 있다. 리츠도 대출을 받아 부동산을 사지 않는가?“한국 리츠는 자산을 투자할 때 보통 50~60% 정도가 대출이다. 금리가 오르면 대출이자 상환이 늘어나 배당이 적어질 수 있다. 그러나 리츠마다 사정이 다 다르다. 보통 5년 단위의 고정금리로 대출을 받기 때문에 대출 만기가 얼마 남았느냐. 임대료 상승을 통해 금리인상 충격을 흡수할 수 있느냐를 따져봐야 한다. 임대 계약을 할 때 보통 10년이상 장기계약을 하고 임대료 인상 조건도 포함된다. 대출 만기가 넉넉하고 임대료 상승이 가능하다면 금리인상 충격을 충분히 흡수할 수 있다. 금리 충격으로 주가가 일시적으로 떨어질 수 있지만, 보유 자산이 건전하다면 회복이 가능하다. ”-요즘 해외리츠에 투자하는 개인투자가들도 많다.“해외리츠 투자는 과거 몇 년간 배당실적 등을 살펴 투자하면 된다. 그러나 해외시장은 상품도 워낙 다양하고 지역별로 특성이 다르기 때문에 전문가도 내용을 파악하기 어렵다. 해외리츠는 펀드나 ETF를 통해서 변동성을 줄이는 것이 좋다. 국내 리츠도 변동성을 우려한다면 ETF로 투자하면 된다.”-김 대표가 운용하는 제이알글로벌 리츠의 특징은?“제이알글로벌리츠는 2020년 8월 벨기에 브뤼셀의 오피스를 기초자산으로 상장했다. 지난 2월 미국 맨하튼의 오피스 지분을 추가로 취득했다. 브뤼셀의 중심업무지구에 위치한 파이낸스타워에는 벨기에 정부부처가 입주해 있고 2034년까지 중도해지 옵션 없이 임대차 계약을 체결해 공실위험이 낮다. 임대료 측면에서는 매년 벨기에 헬스지수(소비자 물가지수에서 주류, 담배, 휘발유 등 제외)에 연동되어 인플레이션 헷지가 용이한 구조이다. 벨기에 통계청은 올해말 헬스지수 상승폭을 전년대비 6.64% 추정하고 있다. 공모가(5,000원) 기준 배당률은 7.6%이다. 리츠중 일 평균 거래량이 가장 많은데, 거래량이 많다는 것은 환금성이 높다는 의미이다. 외국인 지분율이 8.16%로, 외국 기관투자가들도 포트폴리오 차원에서 편입한다.”-제이알글로벌리츠가 유상증자를 준비하고 있다. 금리 인상에 대비한 것인가?“뉴욕자산을 편입하면서 1900억원을 차입했다. 유상증자를 통해 일부 차입금을 상환하고 추가적으로 자산을 매입할 계획이다. 벨기에 자산은 2024년 12월말까지 연 1.05%의 고정금리로, 미국 자산은 2027년 4월말까지 3.75%의 고정금리로 차입했다. 차입 만기가 2년 6개월 이상 남아 있고, 물가지수에 연동된 임대료 상승분을 고려하면 금리 인상으로 인한 배당수익률 하락 우려는 크지 않다고 본다.”    제이알글로벌리츠가 소유하고 있는 벨기에 브뤼셀 오피스(왼쪽)와 미국 뉴욕 맨하튼의 오피스(오른쪽)/제이알자산운용 제공 -리츠가 유상증자를 하는 이유는?“리츠는 한 개의 자산만 운영해도 되지만, 위험 관리라는 측면에서 분산투자를 할 필요가 있다. 자산운영 규모를 키워야 장기적으로 안정적인 배당이 가능하다. 그래서 유상증자를 통해 추가적인 자산을 편입한다. 유망 투자물건이 나오면 대출을 받아 일단 매입하고 나중에 유상증자를 통해 상환하기도 한다. 유상증자는 주가의 3~5% 정도 할인율을 적용한다.”    미국의 리츠 벤타스가 운영하는 시니어타운. 미국은 리츠가 전기차 충전소, 시니어타운 등 다양한 분야로 진출하고 있다/ 벤타스 홈페이지 -한국 상장 리츠의 발전 방향은?“한국의 상장리츠는 시가총액이 8조원대이다. 싱가포르(100조원), 일본(175조원), 미국(2000조원) 호주(154조원)와 비교해보면 아직 걸음마 단계이다. 그만큼 성장의 여지가 많다는 의미이다. 외국처럼 임대주택, 데이터센터, 전기충전소, 태양광 시설, 시니어타운 등으로 리츠의 영역이 확대되어야 한다. 리츠가 활성화되면 국민은 안정적인 투자와 배당이 가능하고, 기업들은 리츠 자금으로 오피스, 물류, 공장을 확보할 수 있다. 기업들은 여유자금을 부동산 대신 사업확장과 연구개발에 투자할 수 있다. 리츠의 활성화는 국가 경쟁력을 한단계 끌어 올리는데 기여를 할 것이다. 정부도 다양한 리츠가 상장될 수 있도록 적극적으로 지원해야 한다.” ]","['리츠가 안전자산이라고 구라를 치네 ㅋㅋ 리츠가 변동폭이 낮지. 원금 손실율이 낮은게 아닌게?', '', '어디서  개수작이니?', '조선일보~~ㅋㅋㅋㅋ 늬들은 작년까지도 계속 집사라고 했었지~~ 정권이 망하기를 바랬던 그놈들 이제 다른거 투자하라고?? 이번엔 얼마나 받았니?', '5~6 프로면 조만간 적금이랑 크게 차이 안날텐데 뭐하러 리스크 있는 걸 살까..?', '', '인터뷰까지 나오는걸 보니 불안감이 증폭되네...아 팔아야되나', '', '국가경쟁력이 떨어지는게 무엇이 문제인지 기사나 써라.  경속된 부동산시장에 누구 명줄 끊어먹으려고 이따위 기사를 쓰는가! 구독자 기만하는 조작기사 대신 현실을 알려주는 기사가 필요하다.', '예금할게요…', '돼정숙이 돼지비계 두를 거적대기 쏟아부을 돈으로 리츠를 샀다면 벌써 G4 선진국이겠지']",http://www.newsis.com/view/?id=NISX20220617_0001910886&cID=10401&pID=10400,https://n.news.naver.com/mnews/article/023/0003698365?sid=101
2022.06.17.,뉴스케이프,,"권익위 ""매출 있다면 설비 노후해 영업 어려워도 보상해줘야""",,,http://www.newscape.co.kr/news/articleView.html?idxno=84918,http://news1.kr/
2022-06-01 07:00:00,전북도민일보,사회,"전북동부보훈지청, 국가유공자 노후주택 개선 지원","[ 여수국가산단, 지난 2월 여천NCC 폭발사고 이어 또 '펑'20년 이상 된 노후산단 중대사고 최근 6년간 123건 발생    31일 오전 11시51분쯤 전남 여수국가산단 내 한 공장에서 폭발사고가 발생했다. 이 사고로 공장 관계자 A 씨(46) 등 총 3명이 머리 등에 부상을 입고 병원으로 옮겨졌다. 폭발은 2층 사무실에서 발생했으며, 폭발 충격으로 샌드위치 패널 형태의 사무실 일부가 부서졌다. 경찰은 사무실 관계자 등을 상대로 정확한 사고 경위를 조사하고 있다. 사진은 사고 현장 모습. 2022.5.31/뉴스1 © News1 김동수 기자(세종=뉴스1) 이정현 기자 = 중대재해처벌법 시행 이후에도 노후국가산단에서의 중대재해 사고가 잇따라 터지면서 근본대책을 요구하는 목소리가 높다.특히 지난 2월 폭발사고로 4명의 사망자를 낸 여수국가산단에서 전날(31일) 또 폭발사고가 발생, 3명의 재해자가 나오면서 노후산단에서의 안전사고 예방을 위한 보다 실질적인 대책이 마련돼야한다는 지적이다.◇여수산단 또 폭발사고…최근 6년 중대사고만 17건    11일 오후 전남 여수시 화치동 여수산단 내 YNCC(여천NCC) 3공장 폭발 사고 현장이 분주한 모습을 보이고 있다. 이날 오전 9시26분쯤 이 곳에서 폭발 사고가 발생해 작업 중이던 근로자 4명이 숨지고 4명이 중·경상을 입은 것으로 파악됐다. 2022.2.11/뉴스1 © News1 황희규 기자1일 고용노동부와 경찰 등에 따르면 전날 오전11시51분쯤 전남 여수산단 내 한 공장 2층 사무실에서 폭발사고가 발생했다.갑작스러운 폭발에 사무실에 있던 직원 3명이 팔꿈치 타박상 등 경상을 입고 인근 병원으로 옮겨져 치료를 받았다. 폭발 충격으로 샌드위치패널 형태의 2층 건물 외벽 일부가 무너져 내렸다.여수산단에서 발생한 폭발사고는 올 들어 이번이 두 번째다. 지난 2월11일에는 여천NCC 3공장에서 폭발 사고가 발생, 작업 중이던 근로자 4명이 숨지고 4명이 중경상을 입었다. 중대재해법 시행 이후 발생한 사고로 고용부는 현재도 법 위반 여부를 수사 중이다. 이에 더해 광주지방고용노동청은 지난 4월18일부터 29일까지 원청업체인 여천NCC 여수지역 공장 4곳에 대해 특별감독도 벌였다. 그 결과 모두 1117건의 위반사항을 적발해 619건은 사법조치하고, 461건에 대해서는 과태료 약 9600만원을 부과했다.여수산단에서 발생한 중대재해 사고는 어제오늘 일이 아니다. 한국산업단지공단에 따르면 최근 6년간(2017~2022.2) 여수국가산단에서 발생한 중대사고는 17건으로, 이로 인한 사상자 수만 25명(사망 15명, 부상 10명)이었다.◇노후산단 중대사고 '안전 사각지대'…특별법 제정 등 근본대책 필요    © News1 DB여수산단과 같이 20년 이상 노후화 된 산업단지에서 중대재해 사고가 잇따라 발생하면서 관련법 제정 등 실질적인 대책을 마련해야 한다는 목소리가 나온다.경영책임자에 대한 강력한 처벌을 통해 '안전 의식'을 고취하는 중대재해법에 더해 실질적인 안전확보 의무를 이행하게 하는 입법 작업이 필요하다는 주장이다.김회재 더불어민주당 의원(전남 여수시을)이 한국산업단지공단으로부터 제출받은 '산단 연혁별 중대사고 현황'에 따르면 지난 2017년부터 2022년 2월 현재까지 최근 6년간 한국산업단지공단이 관리 중인 64개 산업단지에서 발생한 산업재해·화재사고,·화학사고·폭발사고 등의 중대사고는 126건이다.이 중 조성된 지 20년 이상된 노후 산업단지에서 발생한 중대사고만 123건으로 나타났다. 전체 사상자 수는 230명인데 이 중 20년 이상 노후산단에서 발생한 중대사고 사상자 수가 226명(사망 99명, 부상 127명)으로, 전체 98.3%를 차지했다.40년 이상 된 노후산단으로 범위를 좁힐 경우 사상자 수는 165명(사망 66, 부상 99명)이나 됐다. 이는 전체 중대사고 사상자의 71.7%에 육박하는 수치다.문제는 실제 집계에 포함되지 않은 사고까지 더하면 그 수는 더 늘 것이라는 게 김회재 의원실 판단이다.집계된 수치는 사망사고, 재산피해 1억원 이상 사고, 유해화학물질누출사고, 언론 중대보고 사고 등의 중대사고 현황만을 포함했다. 이 때문에 실제 노후 산단에서 발생하는 사고는 더 많을 것으로 보인다는 게 의원실의 설명이다.지난달 14일 김 의원실이 주관으로 열린 '노후 국가산단 특별법 제정과 산업재해 방지대책 마련' 토론회에서는 사고근절을 위한 전문가 간 의견이 오갔다. 토론 발제자로 나선 권정락 호서대학교 교수는 '노후 국가산단 산업재해 실태 및 종합 안전진단 필요성'이라는 주제 발표에서 ""인적오류, 위험의 외주화, 시설미비 등으로 인해 노후 국가산단 산업재해가 지속적으로 발생하고 있다""면서 ""노후 국가산단의 주기적·종합적 안전진단을 진행하고, 정비·보수 등의 업무에 대한 충분한 안전예산과 작업기간을 확보해야 한다""라고 강조했다.'노후 국가산단 안전 및 지속가능성 지원을 위한 특별법 제정 방안'을 주제로 발표에 나선 장철순 국토연구원 선임연구위원은 ""노후 산업단지는 기반시설 노후화, 종사자를 위한 지원시설 미비 등으로 안전문제가 지속되고 있어 대책 마련이 필요하다""며 ""국가전략산업의 지속가능한 발전방안을 마련하고, 석유화학단지 주변지역에 대한 지원책을 신속히 추진해야 할 필요가 있다""고 주장했다.   ]",[],http://www.domin.co.kr/news/articleView.html?idxno=1385908,https://n.news.naver.com/mnews/article/421/0006131585?sid=102
2022.06.16.,충청매일,,대전지역 국가유공자 노후주택 무료보수 봉사,,,http://www.ccdn.co.kr/news/articleView.html?idxno=765173,http://www.newsis.com
2022-06-17 09:55:31,전라일보,경제,정읍보건소 9월까지 '활기찬 노후 건강관리 사업'추진,"[ 기사내용 요약백정완 대표와 신입사원들, 리모델링 공사 지원    [서울=뉴시스] 백정완 대우건설 대표이사가 신입사원들과 함께 노후주택 개보수 공사를 진행중이다. (사진=대우건설 제공)[서울=뉴시스] 이예슬 기자 = 대우건설은 한국해비타트와 함께 독립유공자 후손 주거환경 개선을 위한 활동을 했다고 17일 밝혔다.한국해비타트가 주관하는 이 캠페인은 열악한 주거환경에 처한 독립유공자 후손들의 노후주택을 개보수하는 활동이다. 대우건설은 지난 2월 해비타트 측에 2억원을 기부하고, 독립유공자 후손 7가구의 노후주택 개보수를 진행 중이다.지난 16일 백정완 대우건설 대표이사와 올해 상반기 입사한 신입사원들이 서울시 광진구에 위치한 홍설지 씨의 자택에서 내부 단열, 창호, 장판 등 전반적인 리모델링 공사를 지원했다.홍씨의 조부인 독립유공자 고(故) 홍가륵 선생은 중국 방면에서 독립운동을 펼치다 온양에서 체포돼 옥고를 치렀고, 2009년 유공이 인정돼 건국훈장 애족장이 추서됐다.대우건설은 2001년부터 '희망의 집 고치기' 캠페인을 벌여 주택 노후로 어려움을 겪는 가정의 시설 보수공사를 하고 있다. 2018년부터는 한국해비타트와 협업해 활동규모를 넓히고, 독립유공자 후손 주거환경 개선사업과 재한베트남인 주거환경 지원사업 등 다양한 사회공헌활동에 참여하고 있다. ]",[],http://www.jeollailbo.com/news/articleView.html?idxno=659509,https://n.news.naver.com/mnews/article/003/0011252629?sid=101
10면 1단,서울신문,,"오세훈표 ‘모아타운’, 노후 저층주거지에 최고 50층 허용",,,https://www.seoul.co.kr/news/newsView.php?id=20220616010024&wlog_tag3=naver,http://www.newscape.co.kr
2022.06.15.,매일경제,,"금성백조, 국가유공자 노후주택 무료보수 봉사활동 진행",,,http://news.mk.co.kr/newsRead.php?no=525121&year=2022,http://www.domin.co.kr
2022.06.17.,천지일보,,대우건설 '독립유공자 후손' 노후주택 개선 사회공헌활동 진행,,,http://www.newscj.com/news/articleView.html?idxno=992788,http://www.newscj.com
2022.06.17.,뉴스케이프,,"권익위 ""매출 있다면 설비 노후해 영업 어려워도 보상해줘야""",,,http://www.newscape.co.kr/news/articleView.html?idxno=84918,http://www.newscape.co.kr
2022.06.16.,전북도민일보,,"전북동부보훈지청, 국가유공자 노후주택 개선 지원",,,http://www.domin.co.kr/news/articleView.html?idxno=1385908,http://www.domin.co.kr
2022.06.16.,충청매일,,대전지역 국가유공자 노후주택 무료보수 봉사,,,http://www.ccdn.co.kr/news/articleView.html?idxno=765173,http://www.ccdn.co.kr
2022.06.16.,전라일보,,정읍보건소 9월까지 '활기찬 노후 건강관리 사업'추진,,,http://www.jeollailbo.com/news/articleView.html?idxno=659509,http://www.jeollailbo.com
10면 1단,서울신문,,"오세훈표 ‘모아타운’, 노후 저층주거지에 최고 50층 허용",,,https://www.seoul.co.kr/news/newsView.php?id=20220616010024&wlog_tag3=naver,https://www.seoul.co.kr
2022-06-16 05:07:36,매일경제,사회,"금성백조, 국가유공자 노후주택 무료보수 봉사활동 진행","[ 재개발 어려운 2종일반 지역에공공기여로 3종 한도 층수까지이달 하순 20여곳 선정해 발표서울시가 이달 하순 ‘오세훈표 소규모 주택정비사업’인 모아타운 사업지 20여곳을 선정·발표한다. 층수 제한을 현재 15층에서 50층 이하로 완화하는 방안도 추진한다. 4기 오세훈 시정 초반부터 노후주택 정비가 대대적으로 이뤄지는 만큼 향후 재개발·재건축 활성화를 통한 공급 확대 정책이 탄력을 받을 전망이다.15일 서울시에 따르면 시는 최근 마련한 ‘모아주택·모아타운 심의 기준’ 개선안을 통해 올해 하반기부터 2종 일반주거지역에서 여러 개의 모아주택이 합쳐진 모아타운 내에서는 심의 과정을 통해 최고 50층 높이의 아파트까지 지을 수 있도록 허용하기로 했다.모아타운은 신축·노후주택이 뒤섞여 재개발 등이 어려운 10만㎡ 이내 노후 저층 주거지를 하나의 그룹으로 묶어 대단지 아파트 등 주택을 공급하는 서울시의 지역단위 정비 방식이다. 모아주택은 모아타운 내 주택 소유자들이 1500㎡ 이상 블록 단위로 양질의 주택을 공동 개발하는 정비 사업이다.현재는 2종 일반주거지역에서 모아타운 내에 모아주택을 건립하면 15층 층수 제한을 받는다. 그러나 서울시는 앞으로 층수 제한을 삭제하고, 대신 임대주택 등 공공기여가 이뤄지면 층수 등에서 종상향 혜택을 부여하기로 했다. 현재 ‘2040 서울플랜’에서 추진 중인 ‘35층 룰’이 폐지되면 3종 일반주거지역의 경우 최고 50층의 아파트를 지을 수 있다.서울시 고위 관계자는 “35층 룰 폐지 뒤엔 공공기여를 통해 3종 한도인 50층 높이까지 아파트 건립이 가능할 것”이라면서 “다만 주변 경관을 고려해 소규모 주택정비사업 통합심의위원회 심의를 거쳐 허가 여부를 결정할 것”이라고 말했다.이와 함께 서울시는 이달 하순쯤 모아타운 지역 20여곳을 추가 지정해 모아주택 활성화에 속도를 낼 계획이다. 서울시는 지난 1월 모아타운 시범 사업지로 강북구 번동과 중랑구 면목동을 선정했다. 모아타운 1호인 번동에는 5만 5000㎡ 부지에 2025년까지 최고 35층, 1240가구 규모의 아파트 단지가 조성된다.서울시는 이와 함께 자치구를 통해 접수한 30여곳의 후보지를 대상으로 시 선정위원회를 거쳐 20여곳을 추렸다. 시는 매년 20곳씩 5년간 모아타운 총 100곳을 지정하고, 이를 통해 2026년까지 3만 가구의 모아주택을 공급하겠다는 목표다. 서울시 관계자는 “모아타운 활성화로 기존 세입자가 밀려날 수 있다는 우려를 감안해 별도 보호 대책도 마련 중”이라고 덧붙였다.   ]",[],http://news.mk.co.kr/newsRead.php?no=525121&year=2022,https://n.news.naver.com/mnews/article/081/0003280415?sid=102
2022.06.15.,매일안전신문,,"부산소방재난본부, 긴급구조표준시스템 노후장비 교체사업 착수보고회 개최",,,https://idsn.co.kr/news/view/1065602090931535,http://www.mk.co.kr/
