Date,Press,Category,Title,Content,Comment,URL_Origin,URL_Naver
2022-10-19 21:57:04,서울신문,경제,"동대문, 노후 경로당 새달까지 환경 개선","[ ‘재건축 불패’ 심리 자극, 가격 꿈틀 전망“금리 인상 탓 오름폭엔 한계”서울 강남권의 ‘대장주’로 꼽히는 은마아파트의 재건축 정비계획안이 19일 서울시 도시계획위원회 심의를 통과했다. 잠실 주공5단지, 여의도 공작아파트에 이어 은마아파트까지 재건축이 본격화되면서 강남권과 서울 목동 등 주요 재건축단지 밀집지역 등의 사업 추진이 한층 탄력을 받을 것으로 전망된다.1979년 준공된 은마아파트는 노후화가 빠르게 진행되면서 2000년대 초반부터 재건축이 추진됐다. 재건축추진위원회도 2002년에 일찌감치 출범했지만 수차례 고배 끝에 2010년 3월 안전진단을 통과했다. 이후 정비계획 확정 및 조합 설립에 난항을 겪으며 20년간 사업이 표류해왔다.안전진단 통과 후에는 ‘층고 제한’이 문제가 됐다. 서울시가 난개발 등을 이유로 35층으로 층고를 제한한 반면 추진위는 50층의 초고층 아파트를 짓겠다고 맞서 왔다. 오세훈 시장이 당선된 뒤 층고 제한 폐지 방침을 밝히며 재건축이 급물살을 탔다.심의에 통과한 계획안은 현행 규정상 층고를 ‘35층 이하’로 허가받았지만, 추진위 측은 조합설립 인가 후인 내년 중 층고를 최고 49층으로 변경할 방침이다.오 시장 취임 후 장기간 표류하던 주요 재건축단지 중 잠실 주공5단지, 여의도 공작아파트에 이어 은마아파트도 심의를 통과하면서 재건축을 추진 중인 서울시내 주요 단지에도 관심이 쏠리게 됐다. 특히 재건축단지가 몰린 서울 목동의 경우 정부가 검토 중인 안전진단 완화안의 수준에 따라 사업이 본격화될 가능성도 높아지고 있다. 윤석열 정부는 ‘재건축 규제 정상화’를 내걸고 분양가상한제 및 재건축초과이익환수제 완화안을 최근 확정했고, 안전진단 규제의 완화 수준을 검토 중이다.은마아파트가 재건축 심의를 통과하면서 소강 국면에 접어든 강남 재건축 아파트 가격의 상승세가 다시 나타날 수 있다는 전망도 제기된다. 재건축 심의 통과 사실이 알려진 이날 주변 부동산 중개업소에는 매물 가격을 올리겠다는 집주인도 일부 있었던 것으로 전해진다. 용산의 한 공인중개사는 “거래절벽이 계속되면서 아파트 가격의 양극화 현상이 두드러졌는데 은마를 계기로 강남의 ‘재건축 불패’ 심리가 다시 나타날 수 있다”며 “다만 금리 인상 등으로 가격의 오름폭은 한계가 있을 것”이라고 밝혔다.향후 서울 주요 재건축단지들의 사업이 추가로 본궤도에 오를 경우 윤 대통령의 대선공약인 ‘1기 신도시 재정비’ 사업도 한층 속도를 낼 것으로 보인다. 서울 주요 재건축단지들 사이에선 “1기 신도시에 앞서 서울 재건축부터 해결하라”는 요구가 제기돼왔다.   ]","['', '기사에 언급된 목동, 상계 등 재건축들은 뚜렷한 실체도 없이 과도한 유동성에 재건축 이슈라는 이유만으로 폭등한 곳들! 참고로 목동 같은 곳은 투기의 온상지! 투기꾼들의 녹물드립, 소방안전도로 드립 현수막에 속아 정안진을 푸는 과오를 범하지 말것! 요즘같은 하락장에도 12월 지단위 발표되면 천장 뚫고 나갈거라며 다들 꽉~ 쥐고 호가만 나불나불중!', '']",https://www.seoul.co.kr/news/newsView.php?id=20221017012009&wlog_tag3=naver,https://n.news.naver.com/mnews/article/032/0003180621?sid=101
2022.10.25.,서울신문,,"동작구, 서울시 모아타운 대상지 2곳 모두 선정",,,https://www.seoul.co.kr/news/newsView.php?id=20221025500228&wlog_tag3=naver,https://www.yna.co.kr/
12면 1단,서울신문,,"동대문, 노후 경로당 새달까지 환경 개선",,,https://www.seoul.co.kr/news/newsView.php?id=20221017012009&wlog_tag3=naver,https://www.seoul.co.kr
2022-10-17 05:03:35,서울신문,사회,"동작구, 서울시 모아타운 대상지 2곳 모두 선정","[ 여름부터 총 20곳 도배·장판 교체안전사고 방지 등 맞춤 사업 진행    안전 문제 등을 고려해 출입문 앞 국기게양대가 철거된 화목경로당 모습.동대문구 제공서울 동대문구는 어르신들의 행복한 노후 여가생활을 위해 구립 경로당 환경개선사업에 박차를 가하고 있다.16일 구에 따르면 구립 경로당 36곳 중 약 80%에 해당하는 29곳의 경로당이 준공 20년 이상 경과된 노후 건물에 위치해 있다. 이에 구는 경로당을 이용하는 어르신들의 안전 확보와 시설 만족도 향상을 위해 경로당 환경 개선사업을 추진하고 있다.우선 지난여름 잦은 호우로 시설 보수가 시급해진 경로당 5곳에 도배, 장판 교체, 천장 방수 처리 등 보수공사를 진행했다. 9월에는 전농동 소재 화목경로당을 비롯해 구립 경로당 6곳에 대한 시설 보수공사를 완료했다. 현재 구립경로당 3곳을 대상으로 환경 개선 사업이 진행되고 있으며, 경로당 6곳의 공사도 앞두고 있다. 구립 경로당 환경 개선 사업은 오는 11월까지 마무리된다.이번 환경 개선 사업은 맞춤형 개선사업으로 진행하고 있다. 지난 9월 공사가 완료된 화목경로당은 출입구 앞 국기게양대와 통신선이 접촉하고 있어 사고 예방을 위해 국기게양대를 이설하는 등의 추가 공사를 진행했다.구 관계자는 “고령 친화도시라는 이름에 부끄럽지 않도록 경로당 환경 개선 사업을 차질 없이 진행하겠다”고 밝혔다. ]",[],https://www.seoul.co.kr/news/newsView.php?id=20221025500228&wlog_tag3=naver,https://n.news.naver.com/mnews/article/081/0003309062?sid=102
2022.10.27.,헤럴드경제,,"서울 중구, 어린이공원 2곳 새단장 완료",,,http://news.heraldcorp.com/view.php?ud=20221027000118,https://www.seoul.co.kr
2022-10-25 18:00:01,동아일보,사회,한 눈에 보는 맞춤형 보험 서비스,"[     모아타운 선정지역인 동작구 사당동 202-29 일대서울 동작구는 노량진동 221-24, 사당동 202-29 일대가 올해 하반기 서울시 모아타운 공모사업 대상지로 최종 선정됐다고 25일 밝혔다.모아타운은 대규모 재개발이 어려운 10만㎡ 이내 노후 저층 주거지를 하나의 그룹으로 모아 체계적인 주거지 정비를 통해 지하 주차장 등 편의시설을 확충하는 지역 단위 주택정비사업이다.앞서 구는 모아타운과 관련해 주민 의견을 청취하고 반지하 주택, 주차난 심각 정도, 대상지별 노후도 등의 심사요건을 종합적으로 검토해 2곳을 서울시에 제출했으며 시는 대상지에 대한 현장 방문 실사를 시행했다.    모아타운 선정지역인 동작구 노량진동 221-24 일대그 결과 노량진동 221-24 일대와 사당동 202-29 일대 2곳 모두 모아타운 대상지로 선정됐다. 이번에 선정된 모아타운 대상지 2곳은 ▲가로주택정비사업 면적 확대 ▲용도지역 상향 ▲개별사업 노후도 및 층수 완화 ▲개별사업 건축규제 완화 등의 혜택을 받게 될 예정이다. 구는 내년 주민설명회 등을 통해 주민 의견을 청취하고 지역 맞춤형 관리계획을 수립할 계획이다.이번 선정으로 국토교통부 출신 박일하 동작구청장이 주력하고 있는 동작구 도시개발사업에도 한층 힘이 실리게 됐다. 박 구청장은 재건축·재개발 사업을 뛰어넘어 도로, 공원, 문화·복지시설 등 사회기반시설까지 정비한다는 구상이다.박 구청장은 “모아타운으로 선정된 2곳을 중심으로 동작구 도시개발사업이 탄력을 받을 것”이라면서 “앞으로도 저층 주거지의 열악한 주거 환경을 적극적으로 개선해 나가겠다”고 말했다. ]",[''],https://www.donga.com/news/article/all/20221026/116161168/1,https://n.news.naver.com/mnews/article/081/0003311525?sid=102
2022.10.26.,천지일보,,"횡성군, 무인민원발급기 설치 확대... 민원 편의 제공",,,http://www.newscj.com/article/20221026580305,http://www.heraldbiz.com/
2022-10-27 09:14:03,서울경제,사회,부천원종 가로주택정비사업 준공…조합설립 4년만,"[     [헤럴드경제=최정호 기자]서울 중구(구청장 김길성)가 어린이공원 환경개선 공사를 완료했다.중구는 지난 7월부터 10월까지 묵정어린이공원과 쌍림어린이공원 환경개선 공사를 시행했다. 새로운 놀이 시설물을 설치하고 바닥 포장과 노후 시설물을 정비했으며 꽃과 나무도 새로 심었다.이번 공사는 공원을 주로 이용하는 아이들의 연령대에 맞게 놀이시설을 교체해 달라는 시민의 제안으로 시작했다.묵정어린이공원에는 정글짐, 트램펄린, 그네를 설치하고 쌍림어린이공원에는 조합놀이대, 흔들놀이, 짚라인을 설치했다. 공원 내 놀이 공간도 넓혔다. 중앙 화단을 제거하여 놀이기구를 추가로 설치했다.중구는 새롭게 단장한 공원 이용을 활성화하기 위해 놀이프로그램도 운영한다. 전문 놀이 강사가 직접 공원으로 방문, 놀이시설과 놀이도구를 활용해 어린이들과 함께한다.김길성 구청장은 “이번 어린이공원 환경 공사는 주민 건의 사항을 즉시 실행에 옮긴 사례”라며 “앞으로도 중구는 주민들의 의견을 귀담아듣고 실행에 옮기는 적극 행정을 펼치겠다”고 말했다. ]",[],https://www.sedaily.com/NewsView/26CGNPDJWH,https://n.news.naver.com/mnews/article/016/0002057738?sid=102
2022.10.26.,한국경제,,전남 나주시 금남동 휴게쉼터 새단장,,,https://www.hankyung.com/society/article/202210265130h,http://www.donga.com/
2022-10-27 03:04:56,뉴스1,경제,은마아파트 35층으로 재건축,"[ [Money&amp;Life]삼성생명    최근 ‘100세 인생 시대’ 준비에 대한 관심이 높아지는 가운데 삼성생명이 ‘튼튼한 신체, 든든한 보장, 탄탄한 노후’를 응원하기 위해 내놓은 ‘튼든탄 고객케어’ 서비스에 관심이 쏠리고 있다.    ‘튼든탄 고객케어’는 삼성생명이 제공하고 있는 다양한 고객 서비스 콘텐츠를 한눈에 알기 쉽게 체계화한 고객맞춤형 서비스 브랜드다. △유용한 거래 △쉽고 빠른 청구 △특별한 케어 △빈틈없는 보장 △쏠쏠한 혜택 등 5가지 고객 효용을 기준으로 분류한 30여 개 서비스 라인업을 홈페이지에 신설된 메뉴를 통해 한눈에 확인할 수 있도록 한 것이 특징이다.   ‘유용한 거래’에서는 보험료 할인제도와 긴급자금 활용, 고객플라자 방문예약 등 고객 편의에 도움이 되는 서비스를 제안한다. ‘쉽고 빠른 청구’를 통해서는 보험금 청구와 관련된 다양한 서비스를 이용할 수 있다. 특히 지난 8월 론칭한 보험금 찾기 서비스를 통해 예상보험금 및 청구 시 필요한 서류 등을 더욱 쉽고 빠르게 확인할 수 있다. ‘특별한 케어’에서는 삼성생명의 부유층 전문 컨설팅 조직인 FP센터, 패밀리오피스에서 제공하는 자산관리(WM) 컨설팅과 시니어 고객, 장애 고객을 위한 특화 서비스를 만나볼 수 있다.   ‘빈틈없는 보장’에서는 건강자산·보장설계·통합연금 컨설팅을 통해 필요한 보장을 다각도로 점검하고 보험상품도 제안받을 수 있다. ‘쏠쏠한 혜택’을 통해 삼성금융 모니모와 더헬스(The Health)에 간편하게 접속할 수도 있다. 삼성생명 관계자는 “‘튼든탄 고객케어’를 통해 모든 고객이 쉽고 간편하게 유용한 혜택과 보험거래 서비스를 경험할 수 있기를 바란다”고 밝혔다. ]",[],https://www.news1.kr/photos/view/?5638673,https://n.news.naver.com/mnews/article/020/0003458725?sid=101
2022.10.28.,빅데이터뉴스,,"하나금융그룹, 퇴직연금 브랜드 '하나 연금닥터' 론칭…""국민연금 보완""",,,http://www.thebigdata.co.kr/view.php?ud=2022102810221919232d2db879fd_23,http://www.newscj.com
2022.10.28.,충청뉴스,,"세종시, 내달 11일부터 17일까지 조치원과선교 전면통제",,,http://www.ccnnews.co.kr/news/articleView.html?idxno=274049,http://www.sedaily.com
2022.10.29.,영남일보,,경북 영주서 가장 오래된 아파트 '휴천주공' 재건축 추진,,,https://www.yeongnam.com/web/view.php?key=20221029010003643,http://www.yeongnam.com
2022.10.24.,서울신문,,"박영한 서울시의원, 경로당 및 중학교 노후 시설 개선 위한 예산 확보",,,https://www.seoul.co.kr/news/newsView.php?id=20221024500217&wlog_tag3=naver,https://www.seoul.co.kr
2022-10-24 17:01:02,한국보험신문,사회,[RMI경영연구소의 ‘보험이슈 톡톡’]주택연금 지급액 높이기 위한 다양한 상...,"[     박영한 서울시의원서울시의회 도시계획균형위원회 박영한 의원(국민의힘·중구1)은 지역 공공시설물인 경로당 외장재 교체공사 비용 13억 9,300만 원, 중학교 시설개선 비용 2억 원, 총 15억 9,300만 원의 예산을 확보했다고 지난 21일 밝혔다.본 예산은 ‘서울특별시 자치구의 재원 조정에 관한 조례’ 제11조에 근거해 서울시장이 필요성을 인정하는 경우 교부된다.이번 확보한 예산이 사용될 구립 경로당은 총 4개소(공원장충경로당, 장충경로당, 을지경로당, 신당5동경로당)이고, 외장재 교체공사로 화재 안전성이 강화되고, 덕수중학교는 운동장 스탠드·벤치·캐노피가 설치돼 이용자 편의 증진에 도움이 될 것으로 보인다.예산 반영에 대해 박 의원은, “경로당은 지역거점이 되는 중요한 시설로, 화재시 어르신들의 대피가 신속하게 이뤄지지 못하는 특성이 있어 안전에 특히 신경 써야 한다”고 말했다.또한 “중학교의 시설개선을 통해 미래의 주역인 학생들이 안전하고 쾌적한 생활을 하는데 도움이 되길 바란다”고 전했다.마지막으로 박 의원은 “공공시설물의 안전하고 쾌적한 환경 조성을 위해 힘써준 서울시의회 예산결산특별위원회 위원들에게 깊은 감사를 표한다”고 전하고, 앞으로도 지역을 위해 끊임없이 노력할 것을 다짐했다.   ]",[],http://www.insnews.co.kr/design_php/news_view.php?num=71718&firstsec=2&secondsec=21,https://n.news.naver.com/mnews/article/081/0003311147?sid=102
2022.10.26.,이코노미스트,,"디셈버앤컴퍼니, ‘투자일임 연금저축’ 출시 1주년…“1만2000계좌·115억 운...",,,https://economist.co.kr/2022/10/26/stock/stockNormal/20221026084657271.html,http://www.insnews.co.kr/
5면 1단,한국일보언론사 선정,,국민 노후 자금 어쩌나...국민연금 상반기 투자 성적 '-76조',,,https://hankookilbo.com/News/Read/A2022101110290001483?did=NA,https://jmagazine.joins.com/economist?cloc=joongang-home-jmnet
2022-10-26 08:47:01,국제뉴스,경제,"원주시, 자율주택정비사업 추진","[ KB증권과 손잡고 출시한 연금저축, 가입률 3040세대 67%         [사진 핀트]    사회초년생부터 은퇴를 앞둔 중장년층까지 1만2000명의 고객들이 노후준비를 위해 핀트를 선택했다.    자산을 쌓아가는 AI 일임투자 서비스 ‘핀트(fint)’를 운영하는 디셈버앤컴퍼니자산운용은 핀트 연금저축 서비스 런칭 1주년을 앞두고 그 간의 주요 성과를 26일 공개했다.    핀트가 KB증권과 손잡고 지난해 11월 3일 출시한 ‘연금저축 핀트 투자’는 국내 최초로 선보인 비대면 투자일임 연금저축 서비스로, 핀트 앱을 통해 간편하게 연금저축 계좌 개설 및 투자일임이 가능하며, 앱 이탈 없이 기존의 연금저축도 가져와 핀트 투자일임을 이용할 수 있다.    연금저축 핀트 투자는 연금저축을 시작하고 싶어도 어떻게 가입해야 하는지, 어떤 상품을 담아야 하는지, 장기적 투자 전략을 어떻게 가져가야 하는지에 대한 고민과 어려움이 있는 사회초년생은 물론, 일상 생활에 바쁜 현대인들에게 좋은 반응을 얻으며 특별한 홍보 없이도 가입자가 꾸준히 늘어나는 추세를 보였다.    특히, 핀트의 AI 엔진 ‘아이작’이 급변하는 시장 상황을 객관적으로 분석해 운용하면서 연초부터 이어져온 글로벌 증시 불황과 투자 시장 위축 등으로 주요 지표들이 기록적인 하락폭을 나타내는 상황에서도 투자 손실을 최소화했다는 평을 받고 있다    지난 1년 간 핀트를 통해 새롭게 개설된 신규 연금저축 계좌 수는 약 1만2000계좌이며, 총 운용금액(AUM)은 약 115억원에 달한다. 이 중, 연금저축 가져오기를 통해 핀트의 투자일임을 선택한 고객이 전체의 30%를 차지하며 이들의 AUM 총액은 전체의 60%에 달한다. 이를 통해 기존의 연금 가입 고객들의 투자일임에 대한 니즈가 높음을 확인할 수 있다.    가입한 고객들을 연령별로 살펴보면, 40대가 35%로 가장 많았고, 30대가 32%로 그 뒤를 이었으며 20대가 18%, 50대 이상이 15%로 확인돼 비대면 서비스에 친숙한 젊은층 뿐만 아니라 중장년층까지 다양한 연령대에서 고르게 활용중인 것으로 나타났다.    디셈버앤컴퍼니자산운용 정인영 대표는 “국내 최초로 AI 엔진 기반의 비대면 투자일임 서비스를 시작한 핀트는 인공지능 투자에 독보적인 기술력과 오랜 기간 쌓아온 운영 노하우로 업계에서 가장 많은 개인 고객과 계좌 수를 확보하고 있다”며 “미래의 자산인 연금의 경우 장기적으로 안정적이며 꾸준한 투자가 필요하기 때문에 핀트가 가장 좋은 대안이 될 수 있다”고 말했다.    한편, 디셈버앤컴퍼니는 지난 10월 7일 금융위원회가 연금저축의 운용방식과 투자 대상을 확대한다고 공식 발표함에 따라 연금 저축 투자일임 서비스의 편의성을 강화하고자 지속적으로 다양한 금융사와 제휴를 모색할 예정이라고 밝혔다.    ]",[],https://www.gukjenews.com/news/articleView.html?idxno=2579297,https://n.news.naver.com/mnews/article/243/0000032765?sid=101
2022.10.21.,여성소비자신문,,"국민연금공단, 건강 분야 노후준비 지원 확대 나서",,,http://www.wsobi.com/news/articleView.html?idxno=178788,http://www.hankookilbo.com/
2022-10-11 11:13:01,대한경제,경제,노후 어촌체험마을 '이쁘게 바꾸기' 한창,"[ 주식에서만 65조 손실… 수익률 -8%기금운용본부 줄퇴사… 올해만 20명    게티이미지뱅크국민 노후 자금인 국민연금의 투자 수익이 올해 상반기 77조 원에 육박하는 적자를 기록한 것으로 나타났다. 게다가 국민연금공단 기금운용본부에서는 올해만 20명이 퇴사해 기금의 안정적 운용에 대한 불안감도 커지고 있다. 11일 국민연금공단이 백종헌 국민의힘 의원실에 제출한 국정감사 자료에 따르면, 국민연금의 올해 상반기 운용 수익은 마이너스(-) 76조6,600억 원을 기록했다. 국내 코스피를 비롯한 전 세계 증권시장이 흔들리면서 주식 수익금액이 무려 -65조1,700억 원에 달했고, 금리 인상에 따라 채권 수익도 -20조5,800억 원을 기록했다. 그나마 부동산·인프라 투자 등 대체투자에서 9조900억 원 흑자를 올렸다. 국민연금은 전체 자산의 99.9%에 달하는 915조 원을 금융부문에 투자하고 있다. 국민의 안정적 노후 생활을 위해서는 투자 수익이 필수적인데, 상반기 수익률은 -8%에 달했다. 지난해 수익률(10.8%)과 비교하면 수직 하락인 셈이다. 다만 해외 주요 연기금 역시 고전을 면치 못했다. △노르웨이(GPFG) -14.4% △네덜란드(ABP) -12% △미국(CalPERS) -11.3% 등이 국민연금보다 낮은 수익률을 기록했고, △일본(GPIF) -3% △캐나다(CPPIB) -7% 등은 비교적 선방했다. 백 의원은 ""국민연금기금 수익률을 제고할 수 있는 방안들을 강구해 실행할 필요가 있다”고 강조했다.  국민 자산을 관리하는 국민연금 기금운용본부에서 줄퇴사가 이어지고 있다는 점도 우려스럽다. 강선우 더불어민주당 의원에 따르면 올해 8월 말까지 총 20명이 퇴사해, 지난해 같은 기간(13명) 대비 7명이 늘어났다. 특히 퇴사자 중 5명은 팀장·과장급으로 전문인력 이탈이 두드러졌다. 통상 연말에 퇴사자가 몰리는 점을 고려하면 지난해(26명)보다 더 많은 운용 인력이 기금운용본부를 떠날 것으로 전망된다. 강 의원은 “국민 노후 자금 수백조 원에 대한 기금운용 안정성을 높이기 위해 근본적인 인력 이탈 방지 대책을 마련해야 한다”고 지적했다. ]","['상반기 -8%면 문재인은 국민연금도 아작내고 나갔군! 빌어먹을 자식!', '국민연금이야말로 나라라는 깡패가 뜯어가는 삥이지.', '카카오페이 투자 담당한놈 월급 압류해라. 이익율 -60%될껄?', '성과급 받은거 뱉어내고 가야지 ㅆㅃㄷㄹㅇ', '', '여기 탈탈 터어야함 재직 퇴직자들 모두 전수조사해서 자기 배 불린 인간들 싹다 회수하고 감옥 보내야됨', '구상권 청구하고 깜방보내고 처벌해라 무슨 세금이 누구집 개 이름인줄아냐', '', '상반기만-8%면 지금은 더 심하겠네ㅋㅋ', '', '이거 심각한대그냥 돈 뜯어가는건대 날강도\n폭동일어나야  합니다\n국민세금 강제로 삥듣고 나몰라라', '챡임진느 놈이 없으니 저지랄하지.\n지돈이면    묻지마 투자 하긋어?\n\n삼성한테 퍼주겠어?.', '윤석열차 탑승했군', '', '그러길래 국민들 노후 자금으로 주식투자를 하고 그러냐?안정적인 곳에 투자하고 2008년 금융위기 때처럼 코스피 급락할 때나 구원 등판하는 정도로나 할것이지...상시로 주식 투자할 것이 아니라 바로 지금 같은 때 주식에 투자했으면 수익 많이 볼텐데...', '국민연금개혁 폐지해야\n국민들 돈 다 돌려줘라', '제일 내기 싫은 4대보험', '멍청한 윤도리 이런데도 손만놓고 자빠졌지..노는데는 잘도 찾아다니지 ..', '8%면 존나 잘한거같은데.. 서민생각 안하고 다털고 빼면 개미들 다 한강가고 수익낼수있음', '부실 기업이 은행에 돈빌리고 승인해준 은행장에게 뒷돈 주듯이 ...\n국민연금도 한번 갈아업어 조사해라\n76조의 손실금 더조히 이해가 안간다~~', '국민들 피같은 연금으로 먼 헛짓거릴 한거냐.', '그냥 은행에 맡겨라....ㅡㅡ 적더라도 이자는 나오잖아.', '니들돈  아니니까  막 했고만\n무능력한  ㅇㅇㅇㅇ들', '국민연금 뜻 = 나라가 삥뜯어 도박하는것', '내  월급 일부를  누구  맘데로  투기하랬냐  . . .폰지사기', '푸핫ㅋㅋㅋ', '환율방어를 연금으로 한다더니 사실?', '왜 외국주식 늘려서 수익 좋다며  한국주식 줄이고', '', '', '국내주식 폭락.  환율 급등의 주범들이다.  검찰은 검은세력과의 유착관계 즉시 조사해야한다.']",https://www.dnews.co.kr/uhtml/view.jsp?idxno=202210180907572100921,https://n.news.naver.com/mnews/article/469/0000701421?sid=101
2022.10.17.,KBS,,“녹물 나오는 노후 아파트 수도관 교체 비용 지원해야”,,,https://news.kbs.co.kr/news/view.do?ncd=5580330&ref=A,http://www.gukjenews.com/
2022.10.10.,파이낸셜뉴스언론사 선정,,"""퇴직연금마저 -28%..노후 어떡해"" K직장인의 절규",,,http://www.fnnews.com/news/202210061450214399,http://www.wsobi.com
2022.10.25.,뉴시스,,수의계약 체결 부적정 등 광주상수도사업본부 부실 행정(종합),,,http://www.newsis.com/view/?id=NISX20221025_0002060341&cID=10201&pID=10200,http://www.newsis.com
