Date,Press,Category,Title,Content,Comment,URL_Origin,URL_Naver
2023.08.31.,뉴시스언론사 선정,,"서초구, 방배2동 공원·산책로에 '치매 안심마을' 조성",,,http://www.newsis.com/view/?id=NISX20230831_0002433798&cID=10201&pID=10200,http://www.newsis.com
2023-08-31 18:01:30,연합뉴스,사회,"""마음속 얘기도 편하게""…경기 AI노인말벗 두달새 5천900건 상담","[ 치매예방수칙 안내 게시판 등 연말까지 설치    [서울=뉴시스]서울 서초구가 65세 이상 독거노인 비율이 가장 높은 방배2동 공원·산책로 등 3곳에 '치매 안심마을 환경'을 조성한다고 31일 밝혔다. (사진=서초구 제공). 2023.08.31. photo@newsis.com[서울=뉴시스] 조현아 기자 = 서울 서초구가 65세 이상 독거노인 비율이 가장 높은 방배2동 공원·산책로 등 3곳에 '치매 안심마을 환경'을 조성한다고 31일 밝혔다.해당 지역은 방배2동 도구머리 공원·산책로와 어린이 공원 등이다. 지역 주민들이 공원과 산책로를 걸으면서 자연스럽게 치매 예방 정보를 안내받도록 한다는 계획이다.구는 치매예방수칙 안내 게시판, '치매예방 3·3·3 수칙' 등 치매 관련 정보를 송출하는 로고젝터(바닥에 문구를 투영해주는 장치), 센서형 치매 관련 음성안내 보조 장치 등을 연말까지 설치할 예정이다.이후 주민들을 대상으로 치매예방수칙 안내 게시판 등의 인증사진을 제출하면 모바일 상품권을 제공하는 이벤트와 야외 힐링 프로그램 등을 운영할 계획이다.이번 사업은 지난달 보건복지부의 '2023년 치매안심마을 우수 선도사업' 공모에서 선정된 데에 따른 것이다. 이에 구는 국·시비로 사업비 4665만원을 연말까지 지원받는다.구는 지난 2018년 내곡동을 시작으로 2020년 양재1동을 '치매안심마을'로 지정해 운영하고 있다. 지난 3월 내곡동과 양재1동은 보건복지부 지정 '우수 치매안심마을'로 선정된 바 있다.전성수 서초구청장은 ""앞으로도 치매예방 및 치료관리에 꼭 필요한 보건·의료 및 복지서비스를 제공해 치매로부터 안전한 도시, 치매가 있어도 안심할 수 있는 서초를 만들어 나가겠다""고 말했다． ]",[],https://www.yna.co.kr/view/AKR20230829150900061?input=1195m,https://n.news.naver.com/mnews/article/003/0012062703?sid=102
2023.08.31.,의학신문,,"""한의사 필수의료 참여 확대 시급""",,,http://www.bosa.co.kr/news/articleView.html?idxno=2204582,https://www.yna.co.kr/
2023-08-30 08:02:56,데일리한국,IT/과학,"복지부, 유성구 노인 통합지원 사업 현장 간담회 개최","[    (수원=연합뉴스) 김경태 기자 = 경기도와 경기도사회서비스원은 '경기도 인공지능(AI) 노인말벗서비스'를 두 달간 시행한 결과 644명을 대상으로 5천900건의 상담 서비스를 제공했다고 30일 밝혔다.    [경기도 제공]    노인말벗서비스는 대규모 언어 모델(LLM)을 활용한 생성형 인공지능을 복지정책에 접목한 것이다.     네이버와 제휴를 통해 AI 상담원이 주 1회 서비스 대상 노인의 휴대전화로 전화를 걸어 자연스러운 대화를 나누는 서비스를 지난 6월 19일부터 하고 있다.    발신 번호는 지정한 번호로 표시가 되며 전화를 받지 않으면 최대 3회까지 전화를 건다. 3회 모두 전화를 받지 않으면 경기도사회서비스원에서 직접 전화를 시도해 안부를 살피고 읍면동 복지서비스 담당자가 직접 거주지를 방문해 응급상황 발생 여부를 확인한다.     이달 25일까지 진행된 AI 말벗서비스 5천900건 중 전화 미수신 463건에 대해서는 해당 시군을 통해 모두 당일 안부를 확인했다.     확인 결과 위기 징후를 보인 15명은 건강, 돌봄, 경제적 어려움 등을 호소했고 신속한 '경기도 긴급복지 핫라인(☎010-4419-7722)'을 통해 의료비, 식사, 보건소 상담 등을 지원했다.    아울러 시군과 협력해 직접 방문 상담하고 사례관리를 받을 수 있도록 했으며, 경기도사회서비스원 노인맞춤돌봄서비스와 연계해 주기적으로 생활지원사가 방문해 도움을 줬다.    양주시에 거주하는 60대 A씨는 건강 악화로 식사를 제대로 못 해 몸무게가 35㎏에 불과할 정도였으나 AI 상담원에게 이런 내용을 얘기한 후 사례관리 대상자로 등록돼 영양식 등을 지원받고 건강을 회복 중이다.    여주시에 거주하는 70대 B씨는 공황장애·우울증에 최근 허리수술까지 받았다는 고충을 AI 상담원에게 털어놓았다. 이를 접수한 노인맞춤돌봄지원센터가 생활지원사와 응급요원을 보내 건강 상태를 살핀 후 재가노인지원서비스센터에서 일상생활을 지원받도록 했다.    한경수 도 노인복지과장은 ""속 깊은 얘기를 편하게 할 수 있는 등 AI 노인말벗서비스에 장점이 많다""며 ""AI 상담 사업을 확대하면서 더욱 촘촘하고 세밀하게 살필 것""이라고 말했다.    ktkim@yna.co.kr ]",[],https://daily.hankooki.com/news/articleView.html?idxno=994063,https://n.news.naver.com/mnews/article/001/0014159585?sid=105
2023.08.31.,코메디닷컴,,요양병원이 '재활의료기관'으로 전환하려면,,,https://kormedi.com/?p=1618261,http://www.bosa.co.kr
2023.08.30.,천지일보,,"장수군보건의료원, 낙상 예방 교육 실시",,,https://www.newscj.com/news/articleView.html?idxno=3058589,http://daily.hankooki.com
2023.08.29.,파이낸셜뉴스언론사 선정,,[내년예산] 부모급여 100만원으로 인상…노인일자리 역대 최고 수준 확대,,,http://www.fnnews.com/news/202308290945185704,https://www.kormedi.com/
2023-08-31 10:22:01,뉴스1언론사 선정,사회,내년 4인가족 생계급여 21만원↑…노인일자리 100만개 돌파,"[ 한국만성기의료협회, 창원과 부산에서 현장 노하우 전파    [사진=클립아트코리아]한국만성기의료협회(회장 김덕진)가 9월 8일 경남 창원 희연재활병원에서 '재활연구회 출범 기념강좌'를 연다.  다른 병원들처럼 행위별 수가제가 아니라 '일당 정액제'에 묶여 성장의 여지를 잃어버린 요양병원들이 새로운 돌파구로 주목하는 '재활의료기관' 제도에 대한 소개부터 지정을 위한 준비작업, 재활의료기관 전환 전후의 비교 분석 자료 등이 주제다.  최근 노인 의료 패러다임이 요양 의료에서 재활 의료로 바뀌고 있는 흐름을 엿볼 수 있는 자리다.  이에 대한재활의학과의사회 민성기 명예회장이 '재활의료기관 제도 및 지정'을, 한국만성기의료협회가 '요양병원에서 재활의료기관으로의 전환'(최성혜 보험이사)과 '재활의료기관 운영의 실제'(기영진 상임이사)를 다룬다.  협회 산하에 '재활연구회(수석연구원 황찬호)'를 출범시킨 첫 성과이기도 하다.  현재 정부는 창원 희연재활병원, 김해 래봄병원 등 53개 병원을 '재활의료기관'(제2기)으로 지정해 운영하고 있다.  기능 회복기에 접어든 환자가 최대한 집과 가까운 지역에서 집중재활치료를 받도록 하자는 것. 한때 논란이 됐던 '재활 난민(難民)', 즉 자기에게 맞는 재활치료를 받기 위해 전국을 떠돌던 폐단을 막고, 이들이 하루빨리 가정과 사회로 복귀토록 하는 게 목적이다.  특히 노인환자의 체계적 관리를 위해서는 회복기 재활~만성기 요양~재가(在家) 서비스로 이어지는 연계시스템이 중요하다.  이에 김덕진 협회장은 31일 ""그중에서도 회복기 재활은 노인환자 '삶의 질'을 결정짓는 첫 단계""라며 ""정부에서도 그 중요성에 맞춘 정책을 추진하고 있고, 우리도 재활연구회를 통해 요양병원의 경쟁력을 키울 방안을 마련해갈 것""이라 했다.      한국만성기의료협회는 이를 위해 10월 13일엔 부산 벡스코에서 '2023 추계세미나'도 연다.  여기엔 초단기 욕창 치료법으로 주목받고 있는 '습윤 랩 요법(OPWT)' 개발자인 일본 토리야베 슌이치 내과 전문의 특강이 마련된다.  ]",[],https://www.news1.kr/articles/5153792,https://n.news.naver.com/mnews/article/296/0000069234?sid=102
2023.08.30.,의협신문,,"""의사정원 책정, 의료전문가 주도 세계적 추세""",,,http://www.doctorsnews.co.kr/news/articleView.html?idxno=151233,http://www.newscj.com
2023.08.29.,조선비즈언론사 선정,,"노인 1000만 시대, 노인일자리 103만개로 ‘쑥’ 늘리고 수당도 月 4만원 더",,,https://biz.chosun.com/policy/policy_sub/2023/08/29/3EISKACYLZE2JCJFAROTFAHRPY/?utm_source=naver&utm_medium=original&utm_campaign=biz,http://www.fnnews.com/
2023.08.29.,머니투데이언론사 선정,,내년 생계급여 月 최대 21만원 인상…노인일자리 103만명 공급,,,http://news.mt.co.kr/mtview.php?no=2023082909484321596,http://www.mt.co.kr/
2023-08-29 11:00:20,전자신문,경제,"쓰리디코리아, 3DP 기술로 의료시장 패러다임 바꾼다","[ [2024년도 예산안]    내년 기초생활수급자가 받는 생계급여(최저생계비)가 월 21만원(4인가구 기준) 남짓 오른다. 생계급여 수급 대상도 4만가구 확대된다. 노인 일자리는 사상 첫음으로 100만개를 넘는다. 저소득 청년의 생계 지원을 위해 '천원의 아침밥' 사업을 확대하고 대중교통요금을 할인해주는 'K-Pass(패스)'도 도입한다. ━생계급여 역대 최대 13.2% 증가…수급선정기준도 중위소득 32%로 확대━29일 정부가 발표한 '2024년도 예산안'에 따르면 기초생보 급여액 인상 등 수급자의 최저생활 보장 강화를 위해 내년 7조5411억원의 생계급여 예산이 투입된다.우선 생계급여를 올해보다 13.2% 인상한다. 4인 가구 기준 올해 월 162만원에서 내년 월 183만4000원으로 오른다. 인상폭(21만3000원)은 지난 문재인정부 5년간(2017~2022년) 총 인상액(19만6000원)보다 크다.생계급여 수급자를 정하는 잣대인 '기준 중위소득'도 '기준 중위 소득'의 30%에서 32%로 확대한다. 2015년 제도 설계후 처음이다. 3만9000가구가 수급 대상에 새로 편입된다. 또 의료급여 부양의무자 기준을 손본다. 중증장애인 부양의무자 기준을 폐지해 3만5000명이 새로 의료급여 혜택을 받게 된다. 새로 편입된 의료급여 수급자는 연간 34만원의 의료비용 절감 혜택을 보게 된다.━노인일자리 14만7000명 더 늘린다…100만곳 돌파━    내년 노인 일자리 100만명 시대가 열린다. 올해 대비 14만 7000명 늘린 103만명의 노인 일자리를 만든다. 노인 인구 1000만명 시대를 맞아 10%에겐 일자리를 제공한다는 의미다. 2018년 이후 동결됐던 노인일자리 수당도 2만~4만원(7% 수준) 인상한다. △공익형(월 27만원→월 29만원) △사회서비스형(월 59만4000원→월 63만4000원) 등이다.기초연금 지급 인원도 665만명에서 700만6000명으로 확대하고 지급액을 월 32만3000원에서 33만4000원으로 올린다. 거동이 불편한 독거노인 5만7000명을 위한 돌봄서비스도 월 16시간에서 20시간으로 확대한다.━K-패스 도입, 교통비 부담 최대 53% 줄여준다━출퇴근 교통비 부담을 최대 53% 줄여주는 교통카드인 K-Pass를 내년 7월 도입한다. 기존 알뜰교통카드의 불편을 개선했다. 21회 이상 이용시 교통비의 20~53%를 지원해주는데 월 최대 60회까지 할인 혜택을 받을 수 있다. 매 이용 때마다 △일반인 300원 △청년 450원 △저소득층 800원의 할인이 적용된다. 일반인은 연 21만6000원, 청년은 연 32만4000원, 저소득층은 연 57만6000원 한도까지 지원된다.또 국가기술자격시험 응시료를 50% 감면해 청년들의 생활비, 취업 준비료 부담을 완화한다.아울러 노후 산업단지에 청년이 선호하는 복합문화센터 100개소와 아름다운 거리 60개소를 확충하고 기숙사형 오피스텔과 카페 등 편의시설을 조성하는 이른바 '산리단길 프로젝트'도 시행한다. 산단 근무·정주여건을 개선해 청년층의 근무 기피를 막겠다는 복안이다.━최중증 발달장애인 '24시간 1대1 전담 맞춤형 돌봄서비스' 전국 확대 시행━장애인에 대한 국가보호 강화를 위해 관련 예산을 올해 5조8000억원에서 내년 6조3000억원으로 늘린다. 이를 통해 중증장애인에 대한 활동지원 서비스 대상을 12만4000명으로 확대하고 최중증장애인 돌봄에 대한 가산급여 시간을 월 152시간에서 195시간으로 확대한다.특히 자해나 타해 등 도전적 성향으로 가정에서 돌보기 힘든 최중증 발달장애인의 경우 24시간 1대1 전담 맞춤형 돌봄 서비스를 전국적으로 확대 시행한다. 주간돌봄의 경우 그룹형 1대1 사업을 통해 1500명, 개별 1대1 사업으로 500명을 지원한다. 24시간돌봄의 경우 1개소에서 시범 운영되던 사업을 전국 17개소로 확대 시행한다. 이를 위해 총 3567억원의 예산을 투입한다.다문화 가정 지원을 위해선 사회적 격차 완화를 목표로 168억원의 예산을 편성해 저소득 다문화 가정 자녀 6만명에 교육활동비를 신규 지원한다. 부모 및 자녀에 대한 맞춤형 직업훈련도 확대한다.또 저소득 한부모 양육비 지원대상을 기준중위소득 60% 이하에서 63% 이하로 확대하고 고교 재학 자녀까지 확대하는 등 3만 2000명을 추가로 지원한다.취약 소상공인 12만명의 경영 부담도 완화한다. 저리 정책자금 대환대출, 고효율 냉난방기 기기 보급, 고용보험료 지원 등 정책 패키지를 통해 최대 연 500만원 수준의 경영 부담을 덜어준다는 계획이다.아울러 취약계층의 자립 기반 확충을 위해선 저소득 가구 아동의 목돈 마련을 지원하는 '디딤씨앗통장' 가입 연령을 내년부터 0~17세로 확대한다. 지원 대상도 생계·의료급여 수급 가구에서 주거·교육급여까지 포함한 전체 기초수급 가구로 넓힌다. 자립준비청년 자립수당은 2년 연속 10만원 인상해 매월 50만원을 지급한다. ]","['헐~\n노인일자리 \n노인의 나라\n우짜노 \n우리 젊은이들은 결혼도 늦어져 \n출산율 저조해 \n멀쩡한 노인들 집에 가사지원에 물품지원.기초수급까지', '졸라 노인이고 싶다.', '보호자에게 용돈받기 또는수급비받기 수급비받는게더나는데 보호자계속평생줄수도없는데 본인도살아야하는데 사각지대불쌍하고. 수급자 좋은것다', '이건 너무 퍼주네.', '4 격차없는 다문화라니. ,\n    지금도 많이 누린다 다문화는', '할배들 돈 퍼주는거 없애고 그 돈으로 젊은이들 결혼,취업 장려를 해야 국가가 미래가 있지 안그래도 줄어드는 젊은이들 세금 빨아서 할배들 부양만 해서는 멸망뿐임 그리고 할배들 맨날 발갱이 복지 욕하더니 지들 돈 준다고 하면 욕 안하고 조용한거 보소 ㅋㅋㅋ 이렇게 발갱이인 할배들이 맨날 나라 걱정 하는척 하면서 발갱이 욕을하는데 역겹지 않을수가 없잖아???', '백만 노인 일자리.........이젠 하다하다 저딴걸 자랑이라고 써놓았네 이번 정권은 진짜 제정신이 아니다']",https://www.etnews.com/20230831000393,https://n.news.naver.com/mnews/article/008/0004931089?sid=101
27면 1단,강원일보,,"이돈섭 강원적십자사 회장, 대한노인회 중앙회 고문 임명",,,https://www.kwnews.co.kr/page/view/2023083118534431944,http://www.etnews.com
2023-08-31 17:03:03,조선비즈언론사 선정,사회,보건복지예산 12.2%↑ 역대 최고…부모급여 100만원·노인일자리 100만개,"[ CT나 엑스레이 촬영 한번으로 노인성 골절 예방까지...3D프린터 기술이 해결의료용 3차원(3D)프린터 및 소재 전문기업 쓰리디코리아(대표 최문수)가 뼈나 피부 등 인체와 유사한 밀도를 표현하는 3D프린터 토털 솔루션으로 의료분야 시장에 새로운 패러다임을 만들고 있다.쓰리디코리아는 골스펀지 패턴 출력기술, 의료용 연질소재 기술, 기능성 첨가제 기술, 덴탈 등 3D프린터 관련 다양한 원천 기술을 보유하고 있다. 골스펀지 패턴 출력기술은 사람뼈 골스펀지 구조를 3D프린터로 완벽 재현하는 기술이다.    쓰리디코리아 공장 전경(왼쪽)과 최문수 쓰리디코리아 대표사람 뼈와 동일한 모양을 3D프린터로 강도별로 재현하고, 컴퓨터단층(CT)촬영 결과 실제 뼈 부위별 강도 결과 값과 동일한 출력물을 만드는 기술을 확보했다. 동물 실험을 통해 사람 뼈가 어떤 환경에서 골절될 수 있는지 확인하고, 골절을 예방할 수 있는 소재와 재현 뼈를 만드는 원천기술을 보유하고 있다. 의료기관이 이 기술을 도입하면 CT로 촬영한 환자의 뼈를 3D프린터로 재현, 진료 보조수단으로 활용할 수 있다.    쓰리디코리아가 자사가 개발한 3D프린터 및 필라민트 등 핵심 기술을 기반으로 출력한 고객 CT데이터 기반 뼈 출력물(왼쪽). 오른쪽은 3가지 소재를 활용해 3D프린터로 골막과 연골, 골스펀지 등을 하나로 출력한 뼈 단면.덴탈 분야는 FDM(Fused Deposition Modeling) 필라멘트 소재를 활용해 투명교정기를 3D프린터로 제작했다. 치과 치료에 적합한 수준의 출력물이라는 평가를 받고 있다. 그 외 임플란트 교부재는 밀도와 수술 촉감이 사람의 치아와 유사할 정도로 정밀해 의료 실습용으로 활용하기에 충분하다는 것이 업체측의 설명이다. 뼈와 피부, 의료용 컬러 관련 특허도 이미 출원했다.개발 제품은 이미 국내외 다양한 기업에 공급되고 있다. 지난 2020년 8월 코오롱플라스틱과 협력해 3D필라멘트를 독일 기업에 수출한 데 이어 지난 2021년 말에는 한국원자력의학원과 양해각서(MOU)를 맺은 뒤 의료용 3D프린터 재료 및 3D프린팅 맞춤형 팬텀 제작기술 개발에 나서고 있다. 올해부터는 메가젠에 바이오프린터 납품 및 실습용 시뮬레이션 뼈 모델을 공급하고 있다.골막·골스펀지·피부 등을 재현할 수 있는 의료용 3D프린터 필라멘트 기술 보유3D 의료 출력물을 기반으로 국내외 시장 진출에 속도를 붙인다. 현재 국내는 덴탈 임플란트 회사에 교육용 및 수술용으로 재료를 공급하고, 조달청을 통해 교육시장에 친환경 3D 필라멘트를 공급 중이다. 해외에서는 의료용 제조기업과 협력해 치과용 임플란트 시뮬레이터와 소재 시장 확대를 목표로 삼았다.쓰리디코리아는 앞으로 3D프린터와 3D프린터용 필라멘트, 필라멘트 제조용 펠렛, 툴체인지 카트리지 등 3D프린터 부품, 의료 3D모델링 서비스, R&amp;D용 소형 압출기 등 소재부터 완성제품, 서비스를 아우르는 의료용 3D프린터 솔루션 전문기업으로 도약한다는 계획이다.최문수 대표는 “3D프린터로 인간의 뼈를 재현해 보겠다는 신념으로 연구개발을 해왔다”면서 “사람이 자연 발생하는 골절로부터 자유로운 세상을 만드는 데 기여하고 싶다”고 말했다. ]",[],https://biz.chosun.com/topics/topics_social/2023/08/29/HKS7O5AXRJGR5ICS52T7IPXP3Y/?utm_source=naver&utm_medium=original&utm_campaign=biz,https://n.news.naver.com/mnews/article/030/0003131249?sid=102
2023.08.29.,뉴시스,,"KB증권, 안성 노인 대상 '행복뚝딱 농어촌 의료봉사'",,,http://www.newsis.com/view/?id=NISX20230829_0002429525&cID=15001&pID=15000,http://www.kwnews.co.kr/
2023-08-31 18:56:01,경남일보,사회,거제대 휴먼케어·희연의료재단 MOU 체결,"[ “950만 노인 위해 최선 다하겠다”    이돈섭 대한적십자사 강원특별자치도지사 회장이 대한노인회 중앙회 고문으로 임명됐다.이돈섭 대한노인회 신임 고문은 오는 4일 대한노인회 대회의실에서 김호일 대한노인회 중앙회장으로부터 대한노인회 중앙회 고문 임명장을 받는다.이 고문은 2015년부터 대한노인회 중앙회 고문, 선임부회장, 선거대책본부장, 의료나눔재단 이사장 등을 역임했다. 현재 춘천 센트럴타워 푸르지오 경로당 회원으로도 활동하고 있다.이 고문은 “중앙과 지방에서의 노인회 경험을 바탕으로 국내 950만 노인의 지위 향상과 대한노인회의 발전을 위해 최선을 다하겠다”고 포부를 밝혔다. ]",[],http://www.gnnews.co.kr/news/articleView.html?idxno=533847,https://n.news.naver.com/mnews/article/087/0000992341?sid=102
2023.08.29.,뉴데일리,,"KB증권, 두 번째 '행복뚝딱 농어촌 의료봉사' 진행",,,https://biz.newdaily.co.kr/site/data/html/2023/08/29/2023082900111.html,http://biz.chosun.com/
