Date,Press,Category,Title,Content,Comment,URL_Origin,URL_Naver
2022-03-31 13:26:18,기호일보,세계,"셀리턴 김일수 회장, ""이웃에게 사랑을"" 인천노인복지관협회 나눔 실천","[     해당기사 - WSJ 갈무리(서울=뉴스1) 박형기 기자 = 한국이 코로나19로 인한 치명률이 세계에서 가장 낮다며 코로나19가 팬데믹(대유행)에서 '엔데믹'(풍토병) 수준으로 낮아지는 세계 최초의 국가가 될 가능성이 높다고 미국의 월스트리트저널(WSJ)이 30일(현지시간) 보도했다.WSJ은 이날 ‘한국 등 아시아 국가들이 코로나19와 함께 사는 법을 배우고 있다’는 제하의 기사에서 이같이 평가했다. 한국은 높은 백신 접종률, 잘 정비된 의료체계, 효과적인 감염병 예방체계 등을 기반으로 세계에서 가장 먼저 코로나가 엔데믹으로 전환하는 국가가 될 가능성이 높다.캘리포니아대학교 의과대학 전염병 전문의인 모니카 간디 교수는 ""한국이 엔데믹으로 전환하는 첫 번째 국가가 될 수 있다""며 ""높은 백신 접종률, 공중 보건 시스템에 대한 높은 신뢰 등 팬데믹에서 벗어날 수 있는 적절한 수단을 두루 보유하고 있다""고 평가했다.WSJ는 한국이 코로나19를 풍토병으로 전환할 가능성이 높은 이유로 낮은 치명률을 꼽았다. 현재 한국 누적 치명률은 0.12%로 최근 사망자가 급격히 늘어난 점을 감안하더라도 미국(1.22%), 영국(0.79%), 일본(0.44%)보다 현저히 낮다.한동안 한국은 바이러스 억제 노력 측면에서 세계에서 가장 엄격한 국가 중 하나였다. 당국은 통행금지, 마스크 의무화 및 사적 모임 제한 등 여러 가지 조치를 내놓았다.심지어 한국 정부는 밀접 접촉을 추적하기 위해 전화 GPS 데이터를 포함한 디지털 감시도 사용했었다. 이는 인권침해 요소가 있다는 지적도 나왔다.    24일 오후 대전 대덕구 한국철도공사 대전차량사업소에서 직원들이 운행을 앞둔 열차를 소독하고 있다. 정부는 지난 20일부터 다음달 2일까지 설 연휴 특별방역대책을 추진한다. 2022.1.24/뉴스1 © News1 김기태 기자이 같은 한국정부의 방역 노력이 결실을 맺을 시점이 다가오고 있다고 WSJ는 평가했다.3월 한국의 코로나 확진자는 7일 이동 평균을 기준으로 했을 때 미국과 영국 팬데믹 정점보다 3배 더 높았다. 인구가 5000만 정도임에도 일일 확진자가 세계 1위~3위를 다툴 정도였다. 그러나 치명률은 낮았다. 이는 백신 접종률이 세계에서 가장 높은 수준이기 때문이다. 한국에서는 성인의 96%가 두 번 이상 접종을 받았다. 특히 전 인구의 약 63%가 세 번째 접종을 받았다. 미국은 29%에 불과하다. 한국은 노인들에게 부스터 주사를 배포하는 데 특히 관심을 기울였다. 이는 세계 최저의 치명률로 이어졌다. 또 노인들의 사망을 예방할 수 있는 항바이러스제가 널리 보급되기 시작했다. 이제 한국의 보건 당국은 방역 수준 완화를 검토하고 있다.     박향 코로나19 중앙사고수습본부 방역총괄반장이 25일 서울 중구 한국프레스센터에서 열린 단계적 일상회복 이행계획 공청회에서 주제발표를 하고 있다. 2021.10.25/뉴스1 © News1 박정호 기자한국 보건 당국자들은 지난 가을 높은 예방 접종 수준에 도달한 후 정상 생활로의 전환에 대해 처음 이야기하기 시작했다.그러나 오미크론이 등장으로 확진자가 급증하면서 중단됐다. 당국은 사회적 거리두기를 다시 강화하고 모임을 4명으로 제한했다.그러나 한국이 높은 백신 접종률 덕분에 코로나19 발병을 통제할 수 있다는 것이 분명해 지고 있다. 최근 일일 50만 건이 넘는 확진자가 발생하고, 누적 확진자가 1300만을 돌파해 세계 10위의 발병국이 됐음에도 중환자실 병상은 아직 남아있다. 이날 현재 한국의 중환자실은 약 68%가 채워졌다. 아직 32%의 여유가 있는 것이다. 한국에서 지금도 코로나가 창궐하고 있지만 한국은 방역 수준 완화를 검토할 수 있는 여유를 갖게 된 셈이다. 간디 박사는 ""백신 접종률이 매우 높기 때문에 보건 당국이 방역 수준을 낮추는 것을 검토하는 것은 정당하다""며 “한국이 세계에서 처음으로 엔데믹으로 전환하는 국가가 될 것""이라고 말했다.   ]","['부동산은 전세계적인 추세로 어쩔수 없다 해도 방역은 정말 잘했다. 국민들도 협조 잘했고 정부도 잘 이끌어 주었고 의사들과 간호사들도 헌신적으로 해서 이만큼 할수 있었다. 역시 최고 대한민국 자긍심 뿜뿜이다', '외신은 한국 방역체계에 대해서 입이 마르도록 칭찬하는군. 저번엔 영국 가디언에서 한국의 치명률은 경이로운 수준이라며 한국의 의료인프라에 대해서 침이마르도록 칭찬하던데.', '정부가 강하게 방역 정책을 드라이브한 측면은 있지만 이를 잘 따라준 국민들의 노력과 3년간 가정과 개인의 삶을 포기하고 열심히 현장에서 일하신 의료진들의 노고에 항상 감사하며 살고 있습니다. 멋진나라 대한민국', '외국에서 잘한다고 해도 말이 많고 참 답답하네', '댓글들 확진자 수에 대해 난리 떨지만. 정작 사망률에 대해서는 아무말이 없다', '기레기들과 판새, 국짐당의 방해속에서도 정말 방역을 완벽하게 해왔음. 지금의 확진자 증가는 백신접종률 + 치명률을 감안할때 어느정도 느슨하게 조금씩 풀면서 자연면역을 늘리는 과정임. 이를테면 중국이 저렇게 꽁꽁 싸매고 있지만 결국 어느시점에는 느슨하게 풀수밖에 없는 상황이 오고 그때 대량 확산기를 거치지 않을 방법을 없음. 그러니까 지금 확진자 폭증은 고통스럽지만 거쳐갈수밖에 없는 단계라는점 이때까지 이정도 피해로 막아왔다는게 대단한거임', '잘되는 꼴을 못본다. 아니 안본다.', '2년동안 죽을 고생한 방역전문가와 방역담당자분들과 그 책임자들은 정치와는 무관한분들입니다 그런분들을 싸잡아 쌍욕한분들 윤씨 지지자 맞죠? 왜 그랬어요? 그분들이 욕먹어야 하나요?', '기레기와 정부 흠 잡기 바쁜 댓글러들 입 닫을 때가 온 듯.', '알바들 득실허네', '정말 자랑스러운 대한민국 국민들 입니다^^', '조중동문 보면 우리나라 곧 코로나로 멸망할 것 같던데?', '딱딱이들 뭐라고 하려나??', '그래도 국민들이 마스크 잘 쓰고 협조해줘서 지금 잘 버티고 있는거다. 의료진분들이 제일 고생 많으셨고. 치명률 낮은 오미크론으로 올 때까지 중간중간 정부 지침에 불만있었어도 방역수칙 잘 지켰음.', '잘못집었다, 빌게이츠가  윤당선자에게 전화했단다..뭘 의미할까....', '세계에서 인정하는 K방역 !!!!', '오지랖 정신병 수준인 민족성에 성질 급하고, 때론 저질스러워도 뭉칠땐 뭉칠줄 알고, 이타적이며, 비판과 함께 발전을 지향하는 한국인인게 난 매우 자랑스럽다.', '왜 우리는 아직도 정부가 하는말은 잘 안믿으면서 선진국 언론등이 평가하는것에는 그렇게 귀를 기울일까?? 이건 한마디로 설명하기 어려우며, 한국만의 특수상황, 현대사등이 얽혀있어서 그런것 같다.. 그야말로 웃픈현실이다..', '', '한달8000 명이죽었는데 이인구에많은거아니냐', '방역에 지들이 열심히 협조해서 이루어낸 세계적인 과업인데, 조중동에 세뇌되어 지들 손가락으로 내팽게 친 어리석은 국민들 ㅎㅎ 역시 선진국 될려면 아직 멀었다 ㅎㅎ', '개돼지들한테는 언감생심이지', '', '엔데믹 국가가 되면 정말 다같이 고생한거다ㅜㅜ', '', '종말 ? 그게 엔데믹 아냐?', '여기중국분들이 댓글 마니 다셨네', '치명률이 낮아서 지금 사망자 수가 세계 5위 안에 드는건가봐요?', '저 교회안가요', '교회측 아니죠?~~', '윤석열과 안철수가 하라는 대로 하기 시작하니까 코로나가 잡히기 시작하는 거다. 이런 게 바로 능력이자 실력이지', '결국 wsj 에 작업 들어갔다는 거잖아  논란이 현실을 어떻게 감추냐', '', '팬데믹도 엔데믹도 러시아 전쟁도 모두 문재앙 금괴탓이다.', '뭔또 백신거려ㅉㅉ', '저 교회 안가요 싫어요 스토킹이에요', 'K방역 영웅 문재인  대통령님의  역대급  위대한  업적에  전국민이  감동입니다', '백신맞고 수천명 죽었는데 인과성 없다며 발뺌하던 문재인?\nK방역은 국민이 한거지, 저 운동권이 한일이 뭐냐. ㅉㅉㅉ', '원래부터 치명률은 0.1 그이하였고 그냥 자영업자 안죽이고도 지금 누적확진자수 찍을수 있었다', '방역실패라고 정부 욕하던 사람들은 다 어디갔나요?\n외국에서는 인정하는데 자국민들은 언론 선동이나하고..\n정부도~잘 따라준 국민들도~ 모두 모두 고생했어요👍', '응 제대로 검증되지도 않은 백신 열심히맞고 평생 면역력 허벌되서 살어ㅋㅋㅋㅋ', 'ㅋㅋㅋㅋㅋㅋㅋㅋㅋㅋ아주 문재인대단하네~이렇게 신봉자많으면 전과 40범되도 칭찬해줄듯ㅋㅋㅋ', 'WSJ 윤다슬 기자씨... 저딴 쑈질 기사 써주고 얼마받아요?', '', '국민들 죽어나가도 방치하다보니 위독한 사람들 다 죽어나가서 그런 건데 정책 성공 같은게 아니지']",http://www.kihoilbo.co.kr/news/articleView.html?idxno=969679,https://n.news.naver.com/mnews/article/421/0006001328?sid=104
2022.03.24.,국민일보언론사 선정,,“요양보호사 폭행에 할머니 갈비뼈 골절까지”…경찰 수사,,,http://news.kmib.co.kr/article/view.asp?arcid=0016899400&code=61121211&cp=nv,http://biz.chosun.com/
2022-03-30 12:51:01,대한경제,사회,"인천사서원, 복지현장과 함께하는 연구 시작","[            정부가 요양시설·병원에서의 코로나19 사망을 최소화하기 위해 기저질환이 있는 노인은 경증이라도 병상을 우선 배정하고, 확진된 돌봄 종사자는 3일 격리 후 업무에 복귀할 수 있도록 지침을 개정했다.중앙재난안전대책본부(중대본)는 30일 정례 브리핑에서 “고령의 기저질환자가 밀집한 요양병원과 요양시설에서의 코로나19 집단 발생은 3월 첫째주 이후 감소하고 있으나, 여전히 확진·사망자가 많이 나오고 있다”면서 ‘요양병원·시설 관리 강화방안’을 발표했다.    코로나19 신규확진자 수가 40만명을 넘어선 16일 오전 코로나19 호흡기 진료 지정 의료기관으로 지정된 서울 시내의 한 이비인후과에서 관계자가 시민들을 호명하고 있다./연합뉴스        정부는 우선 의료인력이 부족한 요양시설 입소자들이 중증으로 악화하는 것을 방지하기 위해 입원 조치를 강화한다.요양병원에서 확진된 후 중증으로 악화한 환자는 병상배정 핫라인(Hot-line)을 통해 중증전담 병상으로 신속하게 전원시키고, 요양시설에 있는 65세 이상 확진자는 경증이라도 적극적으로 병상을 배정한다.요양병원·시설 확진자는 감염병전담요양병원(41개 기관, 총 3천174개 병상)으로 이송된다. 요양보호사와 간병인, 간호사 등 종사자 및 의료인력이 다수 확진되면서 발생하는 돌봄공백 해소 방안도 마련됐다.정부는 이날 요양병원·시설에서 확진된 직접돌봄 종사자의 격리기간을 3일까지 단축할 수 있도록 BCP(업무연속성계획)를 개정했다. 손영래 중앙사고수습본부 사회전략반장은 “병원은 기존 BCP에 따라 격리기간 단축이 가능했는데, 요양시설도 3차 접종을 완료하고 무증상인 종사자의 경우 격리기간을 3일까지 단축할 수 있도록 지침을 개정했다”고 설명했다.정부는 요양보호사 양성 과정상 현장실습을 4월 1일부터 재개해 실습생을 돌봄 보조 인력으로 활용할 수 있도록 했다. 또 요양병원·시설을 위한 의사와 간호사, 간호조무사, 임상병리사, 요양보호사 등 의료인력 지원도 강화하겠다고 밝혔다.오미크론 변이 확산으로 최근 요양병원·시설에서는 다수의 확진자가 발생하고 있으나, 고위험군에 대한 관리·치료가 적시에 이뤄지지 않으면서 사망 피해가 급증하고 있다. 지난 3월 넷째 주(3.20∼26) 코로나19 사망자 2천516명 중 요양병원과 요양원에서 사망한 인원은 총 973명(38.7%)이다. ]","['3일이면 코로나 감염자가 더이상 감염 안시키나? 뭔 정책을 이따구로 하나? 그냥 코로나 전파하라는 얘기 아닌가?', '요양시설 중증인데 우선 배정 되지 않고\n연명치료 할 경우에만 배정 된다는데요?', '요양시설 노인 경증이라도 병상 우선배정은 \n감사합니다!', '', '경중환자는 전담요양병원 이송되면 더 악화된다. 돌봄도 거의 못받고..경중 환자는 현재 요양병원에서 치료할수 있도록 지원해야 한다.']",https://www.dnews.co.kr/uhtml/view.jsp?idxno=202203291122276090576,https://n.news.naver.com/mnews/article/366/0000803087?sid=102
2022.03.29.,대한경제,,"인천사서원, 복지현장과 함께하는 연구 시작",,,https://www.dnews.co.kr/uhtml/view.jsp?idxno=202203291122276090576,http://www.cnews.co.kr
2022.03.03.,충청매일,,"유재목 옥천군의원, 노인 목욕비 및 이·미용비 지원 조례 발의",,,http://www.ccdn.co.kr/news/articleView.html?idxno=747839,http://www.ccdn.co.kr
2022.03.31.,딜사이트,,"바디프랜드, 강동구 소외·취약 계층에 후원물품 전달",,,https://www.paxnetnews.com/articles/85301,https://dealsite.co.kr/
2022.03.10.,빅데이터뉴스,,"구로노인종합복지관, 네네치킨 신도림점과 함께 선별진료소에 응원 물품 전달",,,http://www.thebigdata.co.kr/view.php?ud=202203101653403110d0a8833aad_23,http://www.thebigdata.co.kr/
2022.03.30.,아시아경제언론사 선정,,요양시설 사망자 증가에…돌봄인력 격리 3일까지 단축,,,https://view.asiae.co.kr/article/2022033013451984724,https://www.asiae.co.kr/
2022-03-30 13:45:19,약사공론,사회,"윤석열 후보 20대 대통령 당선, 보건의료 정책 향방은?","[ 요양시설 BCP 개정3차접종 무증상 돌봄인력, 격리 단축    [이미지출처=연합뉴스]정부가 요양시설·병원에서의 코로나19 사망을 최소화하기 위해 기저질환이 있는 노인은 경증이라도 병상을 우선 배정하고, 확진된 돌봄 종사자는 3일 격리 후 업무에 복귀할 수 있도록 지침을 개정했다.중앙재난안전대책본부(중대본)는 30일 정례 브리핑에서 이같은 내용의 '요양병원·시설 관리 강화방안'을 밝혔다. 오미크론 변이 확산으로 요양병원·시설에서의 사망 피해가 커지고 있어서다. 3월 코로나19 사망자 중 요양병원·시설 비중은 32.7%를 차지했다.  이에 따라 정부는 의료인력이 부족한 요양시설 입소자들이 중증으로 악화하는 것을 방지하기 위해 입원 조치를 강화한다. 요양병원에서 확진된 후 중증으로 악화한 환자는 병상배정 핫라인을 통해 중증전담 병상으로 신속하게 전원시키기로 했다.또 요양시설에 있는 65세 이상 확진자는 경증이라도 적극적으로 병상을 배정한다. 요양병원·시설 확진자는 감염병전담요양병원(41개 기관, 총 3174개 병상)으로 이송된다. 박향 중앙사고수습본부(중수본) 방역총괄반장은 ""증상 악화 시 중증병상 등 좀 더 적극적으로 치료할 수 있는 병상으로 후송돼야 하기 때문에 환자 상태가 안 좋아지면 수도권 병상배정반을 중심으로 우선순위를 정하도록 배정 방식을 더 강화하고 있다""고 설명했다.요양보호사와 간병인, 간호사 등 종사자 및 의료인력이 다수 확진되면서 발생하는 돌봄공백 해소 방안도 마련됐다. 정부는 이날 요양병원·시설에서 확진된 직접돌봄 종사자의 격리기간을 3일까지 단축할 수 있도록 BCP(업무연속성계획)를 개정했다.손영래 중수본 사회전략반장은 ""병원은 기존 BCP에 따라 격리기간 단축이 가능했는데, 요양시설도 3차 접종을 완료하고 무증상인 종사자의 경우 격리기간을 3일까지 단축할 수 있도록 지침을 개정했다""고 설명했다.정부는 요양보호사 양성 과정상 현장실습을 4월 1일부터 재개해 실습생을 돌봄 보조 인력으로 활용할 수 있도록 했다. 박 반장은 ""돌봄 자격을 갖는 사람에게 자격을 주는 날짜를 당겨서 빨리 현장에 투입될 수 있도록 하거나, 자원봉사자들이 돌봄 영역에 함께 참여하는 방안도 논의 중""이라고 말했다.이 밖에도 정부는 요양병원·시설을 위한 의사와 간호사, 간호조무사, 임상병리사, 요양보호사 등 의료인력 지원도 강화할 방침이다. 지난 29일 기준으로 총 4500명이 의료·방역현장에서 지원인력으로 일하고 있다. ]","['격리 기간 단축? 더 빨리 퍼지라고?', '격리기간 단축같은소리하네\n제대로된 대우를 하고 일을 시켜라\n요양병원 종사자들 대부분이 최저시급이다', '', '백신맞아서 저리된것 100%확신함!!', '요양보호사 시급은 최저시급인데  종사자는  3일이상 아프지도 말라는거네... 확진이후로  한달째 기침가래 로 밤에 잠도못자고  또 출근한다.  시급을 올려놓고 일시키자!', '요양병원 영양종사자도 힘들어요!', '머리좋은 님들 높은자리 앉아서 좋은머리로\n꺼내놓은게 바이러스  왕창나오는 시기에\n 나와서  확 퍼뜨려 쓸모없는\n노인네들 싹 다 없애라 이거네~ㅠㅠ', '지들 멋대로네 정말', '']",https://www.kpanews.co.kr/article/show.asp?idx=230691&category=C,https://n.news.naver.com/mnews/article/277/0005066222?sid=102
2022.03.31.,SBS언론사 선정,,32만 명 안팎 전망…확진자 대면진료 참여율은 '글쎄',,,https://news.sbs.co.kr/news/endPage.do?news_id=N1006695913&plink=ORI&cooper=NAVER,http://www.kpanews.co.kr
2022.03.31.,국제뉴스,,"주낙영 경주시장, 2040 미래 비전 담은 청사진 제시",,,https://www.gukjenews.com/news/articleView.html?idxno=2438187,http://news.sbs.co.kr/
2022-03-31 07:10:52,이데일리언론사 선정,사회,"“이불 덮고 갈비뼈 부러지도록” 할머니 폭행, 그날 요양원에선","[    &lt;앵커&gt;오늘(31일) 코로나 신규 확진자 수는 어제보다 줄어 32만 명 안팎이 될 걸로 보입니다. 정점을 지나고 있는 모양새입니다. 정부는 어제부터 격리 중인 확진자도 동네 병원에서 대면 진료를 받을 수 있게 했는데, 문제는 병원들의 참여가 부족하다는 겁니다. 이유가 뭔지 박재현 기자가 취재했습니다.&lt;기자&gt;서울의 한 정형외과 병원.코로나 환자도 일반 환자와 함께 치료할 수 있게 되자 참여하겠다고 신청했습니다.코로나 환자가 다른 질환으로 대면 진료가 가능한 의료기관은 전국에 280곳뿐이었습니다.많이 다치거나 아픈데도 코로나 환자여서 치료받기 힘들었던 겁니다.[김준한/더본병원 병원장 : 실제로 골절 같은 경우는 코로나 전담병원에서 안 받아주면, 환자들 집에서 골절 환자를 어떻게 할 수가 없잖아요. 대면 진료에는 간단히 응급처치라도 하거나….]이곳은 구관은 일반 환자, 신관은 확진 환자로 공간을 분리했고, 시간도 구분해 치료하기로 했습니다.신청 첫날 대면 진료를 신청한 병, 의원은 89곳에 불과합니다.취재진이 별도로 전국 20여 개 병원에 문의했더니, 대부분 신청을 망설였습니다.신청 방법이나 지침을 안내받지 못한 곳이 많았고, 모든 진료 과목을 코로나 환자에게 개방해야 한다는 게 부담이었습니다.[병원 관계자 : 있던 환자들이 안 나오게 되겠죠. 안 오게 되겠죠.]일반 환자들은 감염 우려를 걱정합니다.[동네 의원 통원 환자 : 몸이 약하시니까 노인분들(이 우려됩니다.) 젊은 사람들은 면역력이 있으니까 좀 덜하긴 한데….]정부는 확진자 대면 진료가 활성화하면 현재의 재택 치료 체계 전환을 검토하겠다고 밝혔습니다.   ]","['그 문제 해결하는게 정부 역할이야. 일 좀 하자.', '', '확진자 주는게 아니라 자영업자 일용직 대책없이 격리만시키니 열나거나 아파도 참고하는거에요', '바이러스는 점점더 견고해가는데, 백신및치료제는 급조하면 할수록 부작용이 눈덩이구나...', '확진자받으면 못가지', '이중적인면을 보이는 병원들이 문제다.확진자진료는 보기싫고 검사만하려는병원들 너무많은게문제임', '병원 의사 쓰레기들,..접종이랑 검사비용 먹을때는 좋다가 대면진료하라니안하네?', '', '질병청 니넨 전망이란 단어 쓰지마라 십알', '신속항원으로 코만찔러도 6만원 받는데 돈독오른 의새가 저거 하겠냐', '그게 가능하려면 의료인이 감염되었을  때 정부에서 대체인력을 보장해야 가능합니다.  현실적으로 원장이 아프면 몇일 문 닫으면 된다고 생각하겠지만 , 그러고 싶어도 그럴수 없는  분야가 많아요.  모두  참  어려운 시기 입니다.', '현방역은 코로나 방지가 아니라 다걸려서 감염률 낮추는것인데 왜 격리를 하는지 ㅡㅡ;;역학조사도 없고 가족접촉자도 활동가능하고 가족한명걸리면 온가족 다걸리는건 당연한일 빨리 전국민 다걸리길 기다리는중인데 확진자 격리는 무슨 소용 일까요', '', '', '', '누가 감기라고 했나. 감기나 언제 이렇게아팠나.', '정점 아니라ᆢ귀찮고 도움 안되니 신고안하는거지 ᆢ', '', '자가진단 검사해서 내과들 때돈 벌더니. 확진자  대면은 싫은가보네. 잣같은 놈들']",http://www.edaily.co.kr/news/newspath.asp?newsid=01849926632266272,https://n.news.naver.com/mnews/article/055/0000963626?sid=102
2022.03.11.,약사공론,,팍스로비드 처방 의료기관 아닌데 처방전 나오면…약국은 '반송',,,https://www.kpanews.co.kr/article/show.asp?idx=230745&category=A,http://www.gukjenews.com/
2022.03.31.,위키트리,,2040 경주 미래 도시상 발표 ...경주비전 2040 미래종합발전계획,,,https://www.wikitree.co.kr/articles/743587,http://www.wikitree.co.kr
2022.03.31.,조세일보,,"바디프랜드, 강동구에 행복나눔상자 전달…소외계층 살핀다",,,http://www.joseilbo.com/news/news_read.php?uid=450494&class=17&grp=,http://www.joseilbo.com/
