Date,Press,Category,Title,Content,Comment,URL_Origin,URL_Naver
2023-08-02 09:04:59,스포츠서울,사회,"정읍시 보건소, 무료 노인의치(틀니) 사업 대상자 모집","[ 일산병원 장애인 보건의료센터·명지병원 돌고래 치과 운영    장애 친화 산부인과로 지정된 일산병원 [고양시 제공, 재판매 및 DB 금지](고양=연합뉴스) 황대일 기자 = 경기 고양시는 지역 보건소와 종합병원을 연계한 장애인 의료·건강 통합서비스를 제공한다고 2일 밝혔다.    시는 장애인의 의료 시설 진입 문턱을 낮추고 건강을 증진하기 위해 3개 보건소와 일산병원, 명지병원, 사회단체 등을 통합해 관리한다.    일산병원은 지난 4월 '경기북부 장애인 보건의료센터'를 열어 응급의료, 중증 장애인 방문 진료 및 재활, 특수학교 단체검진, 가족 교육 프로그램을 운영한다.    또한 장애 친화 산부인과로 지정돼 장애인 여성의 임신과 출산, 생애주기별 질환 등을 관리하고 고위험 산모·신생아를 위한 전문 의료서비스도 지원한다.    2023년 5월 명지병원에 신설된 장애인 전용 돌고래 치과[명지병원 제공, 재판매 및 DB 금지]명지병원에는 지난 5월 '돌고래 치과'가 신설돼 중증 장애인 전신 마취를 비롯한 고난도 치료를 하고 보건소와 연계한 구강 의료서비스 거점 역할도 한다.    일산서구보건소는 최근 '유앤아이히어링' 청각 재활센터와 협력해 저소득층 난청 노인에게 보청기를 연간 2대까지 무료로 제공하고 관리해준다.    고양시 장애인체육회와 햇빛촌 장애인자립생활센터는 생활체육지도자를 고용해 장애인 맞춤형 '건강 드림 체조 교실'을 운영한다.    장애인 맞춤형 건강드림체조 교실 모습[고양시 제공, 재판매 및 DB 금지]    hadi@yna.co.kr ]",[],https://www.sportsseoul.com/news/read/1337976?ref=naver,https://n.news.naver.com/mnews/article/001/0014106501?sid=102
2023.08.08.,더팩트,,"거창군-대구 삼일병원, 응급의료 업무협약 체결",,,http://news.tf.co.kr/read/national/2035621.htm,http://www.heraldbiz.com/
2023-08-16 06:55:01,청년의사,사회,팬데믹 동안 사라진 요양병원 '142곳'…흔들리는 노인의료체계,"[     광주시립제1요양병원[헤럴드경제(광주)=황성철 기자] 사회적 약자가 이용하는 광주지역 공공병원인 시립제1요양병원이 약국이나 다른 공공병원보다 최대 5배 비싸게 의약품 값을 책정해 환자들에게 부담을 떠 넘기고 있다.전국보건의료산업노동조합에 따르면 빛고을의료재단은 지난 2월 1일부터 광주시립제1요양병원과 광주시립정신병원을 광주시로부터 위탁받아 운영 중인데, 운영을 시작한 2월부터 6개월 간 비급여 진료비를 대폭 인상했다.보건의료노조가 광주시립제1요양병원의 비급여 진료비와 타 시립병원·공공병원의 비급여 진료비를 비교한 결과 빛고을의료재단이 운영하는 광주시립제1요양병원의 비급여 진료비는 타 지방자치단체가 운영하는 시립병원·공공병원에 비해 적게는 1.2배에서 많게는 5.12배 비쌌다.또, 빛고을의료재단이 수탁 운영하는 광주시립제1요양병원의 비급여 진료비는 전남대학교병원이 수탁 운영하는 광주시립제2요양병원의 비급여 진료비보다도 더 높게 책정됐다.후시딘 연고10g의 경우 일반 약국에서는 6500원이고, 같은 공공병원인 대전제1노인전문병원에서는 5500원이지만 광주 시립제1요양병원은 1만5400원을 받고 있다.백신으로 알려진 조스타박스주는 광주시립제1요양병원 20만원(서울시북부병원 10만4610원), 마데카솔 분말 10g 1만5400원(서울시북부병원 6900원), 암 환자 등 식욕부진 개선을 위한 메게이트현탁액10mℓ 4000원(부산제3요양병원 1780원), 중추신경계약인 트레스탄간셀 150mg 1000원(보라매병원 195원) 등으로 최고 5.12배 더 비싸다.마데카솔 분말의 경우 제1요양병원이 전남대병원이 수탁 운영해온 제2요양병원보다 5400원 높게 가격이 책정됐다.광주시립제1요양병원과 광주시립제2요양병원은 똑같은 시립병원인데도 진료비가 다른 것을 보면, 그만큼 빛고을의료재단이 수익을 올리기 위해 환자들에게 비싼 병원비를 부담하게 하고 있다는 지적이다.보건의료노조는 “빛고을의료재단이 운영을 맡으면서부터 비급여 항목에 해당하는 연고와 예방접종, 영양제, 주사제 등 대부분의 약제비 항목에 대해 비급여 진료비를 변경했다”고 주장했다.이에대해 광주시는 “광주시립제1요양병원은 지원 없이 자율적으로 운영하는 독립채산제를 채택중인 곳이다”며 “광주시 승인을 받아서 가격을 결정하지 않기 때문에 연고 가격을 3배 이상 받는다고 해서 관여할 수 없고, 계약해지를 고려하기도 어렵다”고 밝혔다.최근 빛고을의료재단은 광주시립제1요양병원의 비급여 진료비가 비싸다는 여론을 의식한 듯 비급여 진료비 항목을 조정하여 홈페이지에 게시했다.현재, 광주시립제1요양·정신병원 노조는 빛고을의료재단 측에 고용승계 등을 주장하며 61일째 파업을 진행하고 있다. ]",[],http://www.docdocdoc.co.kr/news/articleView.html?idxno=3008408,https://n.news.naver.com/mnews/article/016/0002183738?sid=102
2023.08.02.,파이낸셜뉴스,,의료 접근성 개선에 건강한 노년 보내는 인구 늘어,,,http://www.fnnews.com/news/202308021515007529,http://www.heraldbiz.com/
2023.08.11.,스마트에프엔,,"전북도, 공공보건의료기관 장애친화 건강검진기관 5개소 운영",,,https://www.smartfn.co.kr/article/view/sfn202308110022,http://www.smartfn.co.kr
2023.08.06.,헤럴드경제,,"이철우 경북지사, 새만금 잼버리 대회장에 의료진 급파",,,http://news.heraldcorp.com/view.php?ud=20230806000115,http://www.heraldbiz.com/
2023-08-06 14:50:01,에너지경제,사회,"연천군 ""AI스피커 깨비가 호흡곤란 독거노인 구명’","[ 3개 의료원 의료인력 24명, 대회장서 의료지원    경북도는 6일 새만금 잼버리 대회장에 행복병원버스를 급파했다.[경북도 제공][헤럴드경제(안동)=김병진 기자]이철우 경북지사는 폭염과 코로나19, 해충 등으로 2023 새만금 세계스카우트 잼버리 현장에서 환자가 속출한다는 소식을 접하고 6일 지역 의료진을 대회장으로 급파했다.이날 경북도에 따르면 도는 온열질환자 등 대회 참가자 진료를 위해 안동·김천·포항의료원의‘행복병원버스’와 함께 의사, 간호사, 의료 보조인력 등 8명으로 구성된 의료진을 새만금 세계 스카우트 잼버리 대회장으로 보냈다.도는 대회장에서 온열질환자, 햇빛 알러지로 인한 두통, 벌레물림 등 환자가 다수 발생하고 탈수 환자들에게 긴급한 수액 투여가 필요한 만큼 현장 상황에 대처가 가능한 의료지원과 함께 부족한 각종 의약품도 지원할 방침이다.이번 대회는 4만여명의 청소년이 참가하는 코로나19 이후의 최대 행사로, 국민 모두의 관심사인 만큼 도에서도 현장에 가장 시급한 의료지원을 하게 됐다.한편 도에서 운영 중인 '행복병원버스'는 오지마을의 장애인, 독거노인, 소년소녀가장, 다문화가정 등 의료취약계층에 대해 매주 순회 진료를 펼치고 있으며 의사, 간호사, 방사선사, 임상병리사 등 8명으로 팀을 구성해 운영하고 있다.이철우 경북지사는 ""청소년들의 안전과 건강이 최우선이다. 행사가 원활히 진행될 수 있도록 힘을 모으겠다""며 ""의료진과 함께 냉방 가능한 의료특화 '행복병원버스'를 통한 진료로 조금이나마 염려를 덜어드리고자 한다. 아무쪼록 남은 기간 건강하게 행사를 마치고 귀국할 수 있기를 바란다""고 말했다. ]","['민주당의 동네 진짜 기가 막힌다', '대회할 돈은 조각조각 젖라도가 조사브러', '통큰 이철우경북도지사님  파이팅!!!  홍준표지사님도 선물좀 보내주세요 ㅎ', '역시 경북 이철우 도지사님\n탁월한 판단 선택으로 국가 국익에\n그리고 이거이 진짜로 국민님 포함한\n윤석열 대통령님 깨서 진정으로 바라고 원하는 상생협력 공정 평등 정의에 부합하는 국가대한민국 공익 공무원의 바람직한 태도이고 이러한 모습은 국민의 힘당 차원으로도 도움되고 타 정치자들 한테도 바른모습으로 탈 정치 국민님이 무엇을 원 하는지 대통령님 깨서 탈 정치에 힘주어 보조 바란스 조율 감삳립니다 \n윤석열 대통령님 이철우 도지사님\n👍 화이팅으로 감사 드립니다', '', '대회가 반도 다 지났는데 이제서야?']",https://www.ekn.kr/web/view.php?key=20230819010004791,https://n.news.naver.com/mnews/article/016/0002179674?sid=102
2023.08.09.,쿠키뉴스,,급여비만 12조인데…“1분에 1명” 졸속 노인장기요양 심사,,,http://www.kukinews.com/newsView/kuk202308020084,http://www.ekn.kr
2023.08.13.,대한경제,,[르포] 치매노인들의 ‘특별한 다방’…“주문 틀려도 이해해주세요”,,,https://www.dnews.co.kr/uhtml/view.jsp?idxno=202308101118201180198,http://www.kukinews.com
2023.08.18.,위클리오늘,,"양평군, 응급의료네트워크 구축 업무협약 체결",,,http://www.weeklytoday.com/news/articleView.html?idxno=584145,http://www.cnews.co.kr
2023.08.03.,동양일보,,"청주자생한방병원·내덕노인복지관, 노인 한방 의료봉사",,,http://www.dynews.co.kr/news/articleView.html?idxno=715781,http://www.weeklytoday.com
2023.08.19.,데일리안,,"양평군, 6개 응급의료기관과 응급의료네트워크 구축 업무협약 체결",,,https://www.dailian.co.kr/news/view/1264649/?sc=Naver,http://www.dynews.co.kr
2023.08.02.,아이뉴스24,,"韓 노인, 10년 사이 만성질환 2배↑ 노쇠 절반↓",,,http://www.inews24.com/view/1618916,http://www.dailian.co.kr/
2023-08-19 00:07:01,아시아경제,사회,"태풍 '카눈' 북상…복지부, 중앙응급의료상황실 24시간 가동","[ 전진선 군수, “양평군민이 최적 응급의료서비스 지원받을 수 있도록 최선 노력 다하겠다”    양평군이 양평소방서, 양평경찰서, 양평병원 외 6개 응급의료기관과 응급환자 이송을 위한 네트워크 구축 업무협약을 맺었다.ⓒ양평군[데일리안 = 이도환 기자] 경기 양평군(군수 전진선)이 18일 양평소방서, 양평경찰서, 양평병원 외 6개 응급의료기관과 응급환자 이송을 위한 네트워크 구축 업무협약을 맺었다고 밝혔다.이번 협약은 응급상황 발생 시 생명을 살리는 일에 상호협력하고 신속한 대처능력 향상을 위한 응급처치 교육 지원 및 자문, 응급의료시스템의 효율적 운영에 대한 정보교환 및 발전방안을 모색해 양평군민에게 최선의 응급의료서비스를 제공하기 위해 이뤄졌다.협약에 참여한 양평병원 외 6개 응급의료기관은 관내 응급환자의 이송이 가장 많은 한양대학교 구리병원과 강동경희대학교병원, 중증외상환자 닥터헬기 이송의료기관인 아주대학교병원, 연세대학교 원주세브란스기독병원, 재난 상황 시 긴급 출동 재난의료지원팀이 있는 권역응급의료센터인 차의과대학교 분당차병원, 국내 최초 뇌혈관 전문병원을 운영하는 이대서울병원이다.앞서 양평군은 노인 인구의 지속적 증가와 보건복지부 지정 응급의료분야 의료취약지로 심뇌혈관계 응급증상, 중독, 외과적 응급증상 및 대량환자 발생상황에 대비한 원활한 응급의료서비스 인프라 구축이 절실히 필요했다.전진선 군수는 “응급환자의 1분 1초는 생명을 결정짓는 소중한 시간으로 이번 협약을 통해 양평군민이 우선적으로 최적의 응급의료서비스를 지원받을 수 있도록 최선의 노력을 다하겠다”고 말했다.   ]",[],https://view.asiae.co.kr/article/2023080915213148295,https://n.news.naver.com/mnews/article/119/0002741120?sid=102
2023.08.06.,위키트리,,"이철우 도지사, 잼버리 대회장에 의료진 급파",,,https://www.wikitree.co.kr/articles/876095,http://www.wikitree.co.kr
2023.08.04.,아시아경제,,"광주 서구, 거동 불편 어르신 ‘방문의료서비스’ 제공",,,https://view.asiae.co.kr/article/2023080414284255713,https://www.asiae.co.kr/
2023-08-04 14:29:01,시민일보,사회,"주안나누리병원, 인천시 미추홀구 주안3‧4‧7동 저소득노인 대상 무료 건강검...","[    광주광역시 서구(구청장 김이강)가 거동이 불편한 고령자가 병원이 아닌 살던 곳에서 건강하게 생활할 수 있도록 ‘방문의료지원센터’를 운영한다.4일 서구에 따르면 방문의료지원센터는 보건복지부 노인 ‘의료-돌봄 통합지원’시범사업의 일환으로 75세 이상 노인 중 거동이 불편해 의료기관 방문이 어려운 분을 대상으로 방문의료서비스를 제공한다.    70세 이상 중 거동이 불편 어르신을 대상으로 방문의료서비스를 제공하고 있다.[사진제공=서구]특히 지역 내 의사와 간호사, 사회복지사가 다학제 팀을 이뤄 주기적으로 의사는 월 1회, 간호사는 월 2회 방문의료를 제공하고, 사회복지사는 돌봄이 필요한 대상자에게 지역 내 돌봄서비스를 연계한다.서구는 방문의료지원센터 운영을 위해 관내 의원 2곳(자모의원, 생기가정의학과)과 의료기관 소속 간호사 3명과 업무협약을 체결했으며, 구청 돌봄지원팀 사회복지사와 협업해 의사,간호사,사회복지사가 원팀이 돼 체계적인 의료서비스를 제공하고 있다. 또 간호직공무원을 의료 전담 코디네이터로 배치해 방문의료지원센터 및 퇴원환자 재가복귀 지원사업 등 통합형 의료-돌봄서비스 연계·관리를 강화할 방침이다.지원대상자는 75세 이상 고령자 중 장기요양 1~4등급 외의 거동이 불편하신 분으로, 신청은 서구청 스마트통합돌봄담당관 또는 거주지 동 행정복지센터에 문의하면 된다. 신청 후 먼저 대상자의 건강상태와 치료에 대한 욕구파악이 이뤄지고 이후 방문의료서비스 범위·주기·횟수, 약물관리 등 서비스 제공계획을 수립, 서비스가 진행된다.김이강 서구청장은 “이번 방문의료지원센터 운영은 그동안 거동이 불편해 병원을 방문하지 못했던 어르신들의 건강관리와 삶의 질을 높이고, 서구만의 의료-돌봄 통합지원의 독자적인 모델을 구축할 것으로 기대한다”고 말했다.한편 서구는 지난해 전국 최초로 서구재택의료센터를 개소해 장기요양 1~4등급 대상자 월 200여 명에 대해 방문진료와 방문간호를 제공하고 있다.아시아경제 호남취재본부 신동호 기자 baekok@asiae.co.kr ]",[],https://www.siminilbo.co.kr/news/newsview.php?ncode=1160281185585967,https://n.news.naver.com/mnews/article/277/0005296018?sid=102
2023.08.03.,스포츠조선,,"부천시립노인전문병원, 치매전문병동 설치 박차…사업비 13억8500만원 확보",,,http://sports.chosun.com/news/ntype.htm?id=202308040100023930002937&servicedate=20230803,http://www.siminilbo.co.kr
2023.08.08.,전남일보,,"담양군, 노인요양시설 입소비 지원",,,http://www.jnilbo.com/71187448857,http://sports.chosun.com
2023-08-03 09:21:02,대경일보,사회,"대구 동구 백세건강주치의, 상반기 434명에 의료서비스 제공","[    부천시립노인전문병원이 전문적인 치매 환자 치료 및 관리를 위한 시설·장비 보강에 박차를 가하고 있다. 3일 부천시립노인전문병원에 따르면 지난해 보건복지부로부터 공립요양병원 기능보강사업 대상자에 선정, 사업비 13억8500만원(국비 50%·지방비 50%)을 확보했다.병원은 이에 따라 건물 3층 일반병동을 111병상 규모의 치매전문병동으로 바꾸는 리모델링 공사를 진행하고 있다. 이곳에는 치매 환자의 재활을 돕는 프로그램실과 가족 상담실, 공용거실(빛의 정원) 등 공간도 마련될 예정이다.아울러 치매전문병동에서 필수 의료장비로 쓰일 노인용 전산화인지재활시스템 등 총 20종 313대 장비를 확보했다.병원은 의사와 간호사 등 의료진 재배치와 추가 의료진을 확보해 다음달부터 본격 치매전문병동 운영에 나설 계획이다.나아가 정부로부터 치매안심병원으로 지정받아 지역 대표 공립요양병원으로서 역할을 강화한다는 방침이다.치매안심병원은 폭력, 배회 등 행동심리증상이 동반돼 가정에서 돌보기 어려운 치매 환자를 전문적으로 집중 치료·관리하는 전문 의료기관으로, 치매전문병동 및 의료진, 장비를 갖춘 공립요양병원을 대상으로 보건복지부가 선정한다.이정권 부천시립노인전문병원장은 ""이번 기능보강 사업으로 치매환자를 보다 전문적으로 치료·관리할 수 있게 됐다""며 ""앞으로 질 높고 맞춤형 의료 서비스 제공은 물론 치매 환자와 가족의 정신적·경제적 부담을 줄여줄 것으로 기대한다""고 말했다.한편, 부천시립노인전문병원은 대한민국 유일의 심장전문병원 부천세종병원과 인천세종병원을 보유한 혜원의료재단이 부천시로부터 위탁운영하고 있다.     부친시립노인전문병원 전경 ]",[],https://www.dkilbo.com/news/articleView.html?idxno=409142,https://n.news.naver.com/mnews/article/076/0004039715?sid=102
2023.08.25.,당진신문,,"당진시노인복지관, 노년기 관절염과 척추질환 건강강좌 진행",,,http://www.idjnews.kr/news/articleView.html?idxno=200420,http://www.jnilbo.com
2023.08.25.,스마트타임스,,"경복대 치위생학과, 봉사동아리 예치랑 지역사회 노인복지센터서 봉사활동",,,http://www.smarttimes.co.kr/news/articleView.html?idxno=11013,http://www.dkilbo.com
2023.08.08.,쿠키뉴스,,"거창군-대구 삼일병원, 응급의료 협약 체결",,,http://www.kukinews.com/newsView/kuk202308080123,http://www.idjnews.kr/
2023.08.04.,한겨레,,장마 뒤 여드레 온열질환 628명…노인일자리 실외 활동 중단,,,https://www.hani.co.kr/arti/society/health/1103043.html,http://www.smarttimes.co.kr
2023.08.08.,쿠키뉴스,,"거창군-대구 삼일병원, 응급의료 협약 체결",,,http://www.kukinews.com/newsView/kuk202308080123,http://www.kukinews.com
2023.08.04.,한겨레,,장마 뒤 여드레 온열질환 628명…노인일자리 실외 활동 중단,,,https://www.hani.co.kr/arti/society/health/1103043.html,http://www.hani.co.kr/
2023-08-04 14:25:04,LG헬로비전,사회,"부천시립 노인전문병원, 다음 달 치매전문병동 운영 시작","[     2일 인천국제공항 제2터미널 제2합동청사 확장 건설현장 쉼터에서 노동자가 동료에게 물을 뿌려주고 있다. 연합뉴스장마가 그친 지난 7월26일 이후 8월2일까지 8일동안 전국에서 온열질환자 628명이 나온 것으로 집계됐다. 질병관리청의 ‘2023년 온열질환 감시체계 운영 결과’를 4일 보면, 7월26일∼8월2일 8일 동안 전국에서 628명이 온열질환으로 응급실을 찾았다. 정부가 응급실이 있는 의료기관 504곳에 대한 표본조사를 시작한 5월20일 이후 파악된 전체 온열질환 환자(1385명)의 45%가 이 기간 발생했다. 장마 이후 낮 최고기온이 섭씨 35도에 달하는 무더위가 이어지면서 온열질환 환자가 급증했다는 게 질병청 설명이다.올해 온열질환으로 사망한 것으로 추정되는 환자는 18명이었다. 이 중 16명(89%)은 폭염 경보(11명)·폭염 주의보(5명) 등 폭염 특보가 내려졌을 때 숨졌다. 연령별로는 70대 이상 고령층이 13명(72%)이다. 60대 1명, 50대 3명, 40대 1명이 온열질환으로 사망한 것으로 추정된다. 사망 장소는 논밭(10명)이 가장 많았으며, 길가(3명), 실외 작업장·산·주거지 주변(각 1명) 등 실외였다. 실내인 비닐하우스와 자택에서도 각각 1명이 사망했다.질병청은 열사병·열탈진·열경련·열실신 등을 온열 질환으로 분류한다. 표본조사에 참여하지 않는 의료기관으로 이송됐거나 병원 밖에서 숨진 경우 등은 이 통계에 포함되지 않는다. 실제 온열질환 환자·사망자는 질병청 집계보다 많을 가능성이 높다.지영미 질병청장은 “더위에 취약한 노약자가 별다른 조처 없이 더위를 참다가 온열질환이 생기거나 사망으로 이어지는 경우가 많다. 무더운 한낮에는 야외작업이나 운동 등 실외 활동을 자제하고, 활동 시간대와 날짜를 조정해야 한다”고 권고했다.한편 보건복지부는 온열질환 위험을 줄이기 위해 재정 지원 노인 일자리 사업 참여자의 실외 활동을 7일부터 11일까지 닷새 동안 전면 중단하기로 했다. 11일 이후에도 무더위가 이어지면 근무 시간을 바꾸거나 야외 활동을 실내 작업으로 전환할 계획이다. ]",[],http://news.lghellovision.net/news/articleView.html?idxno=430152,https://n.news.naver.com/mnews/article/028/0002651036?sid=102
2023.08.19.,시민일보,,"중랑구, 노인 결핵검진 및 예방교육 실시",,,https://www.siminilbo.co.kr/news/newsview.php?ncode=1160301375692286,http://news.lghellovision.net/
2023.08.09.,전북도민일보,,요양병원 '경영난 호소'…흔들리는 노인의료체계,,,http://www.domin.co.kr/news/articleView.html?idxno=1435573,http://www.siminilbo.co.kr
2023.08.06.,파이낸셜뉴스,,'찾아가는 의료서비스' 직접 체험해보세요,,,http://www.fnnews.com/news/202308061921107795,http://www.domin.co.kr
26면 1단,한국일보,,"[기억할 오늘] ""노인-여성은 가장 저평가된 미국의 인적 에너지원""",,,https://www.hankookilbo.com/News/Read/A2023073110070001920?did=NA,http://www.fnnews.com/
2023-08-06 19:22:08,데일리메디,사회,﻿만성질환 2배 증가 - 대한민국 노인 - 노쇠 50% 감소,"[ 장애인대회서 체험공간 운영초음파·X레이 등 검사장비 탑재     찾아가는 건강의료서비스를 통해 운영하는 의료버스 내부에서 한 시민이 의사와 일대일 상담을 하고 있다. 부산시 제공 부산시가 '2023 부산세계장애인대회'가 열리는 해운대 벡스코에서 대회 운영 기간 동안 '찾아가는 건강의료서비스' 체험공간을 운영한다고 6일 밝혔다.   찾아가는 건강의료서비스 사업은 이동형 초음파, X레이 등 전문 검사장비를 탑재한 의료버스를 활용, 전문 의료진이 의료 취약계층을 방문해 건강검진, 상담, 교육 등 지역 밀착형 의료서비스를 제공하는 사업이다.   노인인구의 증가, 코로나19 장기화 등으로 인한 의료 취약계층의 공공의료서비스 수요 증가에 적극 대응하기 위해 지난해 4월 시가 처음으로 도입했다.   이번 체험공간은 2023 부산세계장애인대회에 참가하는 80개국 2000여명의 세계인과 관람객들에게 찾아가는 건강의료서비스 사업의 우수성을 홍보하고 이를 체험할 수 있도록 하기 위해 마련됐다.   이번 홍보 활동은 부산시뿐 아니라 의료버스 운영 유관기관인 해운대부민병원, 메리놀병원, ㈜온택트헬스의 협력으로 진행된다.   체험공간은 많은 시민이 체험해볼 수 있도록 찾아가는 의료서비스 사업에 실제 사용되는 의료버스 2대를 전시장 내 부스 2곳에 각각 분산해 운영할 계획이다. 시민들은 이곳에서 체성분, 혈당, 혈당, 안압, 산소포화도, 콜레스테롤 측정 등 의료버스 내외에서 진행되는 다양한 검진을 체험해볼 수 있다.   ]",[],https://www.dailymedi.com/news/news_view.php?wr_id=900687,https://n.news.naver.com/mnews/article/014/0005053123?sid=102
2023.08.02.,쿠키뉴스,,적자 누적에 의료진 이탈까지…성남시의료원 혼란 장기화,,,http://www.kukinews.com/newsView/kuk202308010221,http://www.hankookilbo.com/
