Date,Press,Category,Title,Content,Comment,URL_Origin,URL_Naver
2022-03-29 17:32:01,아이뉴스24,생활/문화,"[오늘의 단신] 기아, 대고객 소통 플랫폼 론칭 外","[     [사진=게티이미지뱅크]코로나19 대유행(팬데믹)의 진원지였으나 발 빠른 대규모 봉쇄정책으로 확산을 막았던 중국이 다시 28일(이하 현지시간) 경제수도로 불리는 상하이 봉쇄에 나섰다. 빠르게 확산되고 있는 BA.2 오미크론 변이로 31개성에서 6만2000명 이상이 감염되자 또다시 강력한 봉쇄로 맞불을 놓은 것이다. 사회적 거리두기를 완화하면서 코로나19와 공존을 택한 다른 나라와 정반대되는 정책을 취한 것이다.  일당독재 국가인 중국의 이런 통제정책이 다시 효과를 거둘지 전 세계의 시선이 집중되고 있다. 중국은 2020년 초 코로나19 초기 확산 당시 후베이성 우한을 비롯해 지금까지 쓰촨성 청두, 산시성 시안, 광둥성 선전, 랴오닝성 선양 등 여러 도시를 봉쇄했지만 상하이 같은 핵심 도시를 봉쇄한 것은 이번이 처음이다. 특히 26일까지만 해도 ""시민 불편, 경제 악영향 등을 우려해 시를 봉쇄하지 않겠다""고 밝혔지만 하루 만에 결정을 뒤집어 시민들의 반발이 거센 상황이다. 과학전문지 《네이처》는 28일 중국 보건당국은 확진자 숫자를 다시 0으로 떨어뜨리겠다고 벼르고 있지만 80세 이상 노령층의 백신 접종률이 낮기 때문에 중국 본토에서 100만 명까지 사망자가 발생할 수 있다는 경고의 목소리를 전했다.  시진핑(習近平) 중국 국가주석은 이달 초 중국은 감염을 근절하고 지역사회를 통해 바이러스가 확산되는 것을 막는 것을 목표로 하는 '코로나 제로' 정책을 고수할 것이라고 발표했다. 하지만 2020년 봉쇄정책 때에 비하면 많이 완화된 것으로 보인다. 시 주석은 연설에서 관리들이 통제 조치의 경제적 영향을 제한해 줄 것을 요청하면서 보다 실용적인 전략을 주문했다. 이는 무증상 환자를 병원이 아닌 전용 격리 센터로 보내고 격리수용 기간도 더 짧게 하는 것을 의미한다.  ●엇갈리는 전망  전문가들 사이에선 정부가 대비할 시간이 생기기 전에 바이러스가 걷잡을 수 없이 퍼질지에 대해 의견이 분분하다. 홍콩대의 역학자인 벤 카울링은 ""그들은 발병을 통제할 수 있다는 것을 여러 번 증명해 왔다""고 말한다. 중국은 지난 2월 베이징 동계 올림픽 기간 동안 대규모 감염이 발생할 것이라는 우려에도 불구하고 전염성이 매우 높은 오미크론 변이(BA.1)를 성공적으로 통제했다. 그는 앞으로 며칠 동안 적극적 검사를 통해 확진자 수가 계속 증가하겠지만 그 이후에는 다시 0으로 떨어질 것으로 예상했다. 중국 공중보건시스템을 연구하는 미국 예일대의 시 첸 교수(경제학)는 ""만약 발병률이 감소한다면 정부는 내년에 노인들의 낮은 백신 접종률을 높이고 병원에 대한 압력을 완화하기 위해 일차적인 의료 인프라 구축에 집중할 것""이라고 말했다.  다른 전문가들은 중국이 증가하는 유행에 대비할 필요가 있다고 말한다. 새로운 감염이 하루에 확인된 환자 수가 6000명에 육박하고 있다. 미국 미네소타대의 마이클 오스터홀름 교수(전염병학)는 ""감염자 수는 빠르게 늘고 있다. 이제는 통제 불능이라고 생각한다""고 밝혔다. 그는 당분간 확진자 수가 다시 0으로 줄어들지는 않을 것이며 오히려 이를 목표로 강력한 봉쇄정책을 취할 경우 ""중국의 경제를 확실히 무너뜨리게 될 것""이라고 전망했다.  영국의 생명과학 시장분석회사인 에어피너티(Airfinity)의 분석에 따르면 BA.2 파동 중에 중국 본토에서 100만 명 이상이 사망할 수 있다는 것. 80세 이상의 노인 중 백신 접종을 완료한 비율이 50%밖에 되지 않다는 것이 가장 큰 이유다.  이는 최근 사망자가 급증하고 병원마다 입원환자가 넘쳐나는 홍콩의 상황을 연상시킨다. 이달 초에는 홍콩 거주자 10만 명당 900명에 가까운 코로나19 환자가 발생했다. 이는 팬데믹 기간 동안 전 세계 어느 곳에서도 가장 높은 수치였다. 사망자도 이달 초 하루 300명에 육박할 정도로 급증했다. 전문가들은 이 지역의 높은 사망률의 원인으로 노인들의 낮은 백신 접종률을 지목하고 있다. 80세 이상 노인의 약 3분의 1만이 백신 접종을 완료했으며, 사망자의 90%는 백신 접종 미완료자였다.  ●80세 이상 20%만이 부스터 샷 접종 마쳐  중국 본토도 현재의 발생을 통제하지 않으면 비슷한 곤경에 처하게 된다. 중국의 전체 백신 접종률은 85% 이상이다. 이는 공공건물과 작업장에 진입할 때 의무화한 디지털 예방접종-여권 시스템과 누군가가 감염 위험을 제기하는지 여부를 나타내는 색상 구분 '건강 코드'의 도입으로 달성됐다. 하지만 노인들은 예방접종 여권을 필요로 하는 시설을 이용할 가능성이 낮으며 예방접종을 받지 않은 채로 남아있을 수 있다고 카울링 교수는 지적했다.  중국에선 60세 이상 중 5200만 명이 아직 백신 접종을 완료하지 못했다. 가장 취약한 80세 이상 노인에 대한 예방접종이 가장 심각해 그중 부스터 샷(3차 접종)까지 맞은 사람은 20%에 불과하다. 동료검토를 아직 거치지 않은 카울링 교수팀의 연구에 따르면 중국에서 사용되는 2가지 주요 백신 중 하나인 시노박 백신은 중증 환자 및 사망을 줄이는데 효과적이지만 60세 이상의 노인에게 높은 수준의 보호를 제공하기 위해서는 3차 접종이 필요하다.  중국 쑨원대의 루자하이 교수(전염병학)는 BA.2의 확산을 막지 못하면 코로나19로 인한 사망은 에어피니티가 추산한 100만 명보다 훨씬 더 심각할 수 있다고 경고했다. 그는 ""중국정부는 국민의 삶에 책임을 지고 있기 때문에 현재의 예방과 통제 전략을 바꾸거나 완화하지 않을 것""이라고 말했다.  '코로나 제로' 전략이 가능했던 것은 중국의 국내 경제 규모가 워낙 커서 해외경제 의존도가 높은 뉴질랜드와 싱가포르 같은 인구가 적은 지역보다 봉쇄정책을 오랜 기간 지속할 수 있었기 때문이다. 하지만 영원히 지속될 수는 없다. 상하이 봉쇄 발표 이후 중국의 주가지수가 폭락하며 중국경제에 빨간 불이 들어온 상태다. 카울링 교수는 바이러스가 다른 지역에서 자유롭게 돌고 있기 때문에 파괴적인 발병은 더욱 잦아질 것이라고 예측했다.  고령자의 백신 접종률을 높이는 것이 우선이지만 고령자의 다수가 도시가 아닌 농촌지역에 살고 있기 때문에 시간이 걸릴 것이다. 중국 당국은 이들 고연령자에 대한 백신 접종률이 80%에 이를 때까지는 봉쇄를 풀지 않을 것이라고 루 교수는 말했다.  ]","['맨처음 생겼을때 발빠르게 막은게 아니라 대량 감염과 사망자를 속였는데, 기사 양반 정신 나갔는가? 그렇게 속인걸 잘한거 같은면 국민을 속이고 언론 탄압하는 사회주의 국가에 가서 살아라.', '나는 요새 중국이 코로나 대처하는것을 보고 좀 무서운 생각? 예감?같은게 들더라...이제 코로나는 좀 심한감기 같아서 일주일 푹 쉬고 일상복귀하는 나라들이 대부분인데 유독 중국은 전체를 폐쇄해 버린단 말이야...코로나가 시작된 곳이니 다른곳보다 정보가 많을텐데도 수천만 도시를 아예 문을 닫는단 말이지...우리가 모르는 코로나에 대한 비밀이랄까 후유증이랄까 그런게 있는건 아닐까? 그렇지 않다면 왜 다른 유럽선진국은 마스크조차 벗어버리는 지금, 초창기때 처럼 여러가지 피해를 무릅쓰고 폐쇄라는 극단적인 방법을 쓰냐는거지...뭔가 있어.', '', '', '귀화한  조선족  때문에  못살겠다  바로  옆집  사는데  문을  얼마나  세게  닫고  다니는지  심장  온몸이  놀라서  살수가  없다  남자는  중공인이고  문재인이  조선족을  얼마나  잘살게  해놨는지  집도  세채고  땅도  샀다는데  물론  차도  있지  지 손자놈  한국 국적  얻게  하려고  난리더만  젊은  이들이나  보수들  정신  바짝 차려  우리나라  점령  못하게  막아야  나라  산다', '시진핑이 죽었으면 좋겠다 저나쁜놈때문에 내가 내자식이 이런 개고생을한다생각하니 울화가치밀어미치겠다', '중국에서 시작되었으니 중국에서 끝내야지', '사망자 많이 나오고 변이가 일어나겠지..봉쇄로는  막을 수 없는데..시진핑 몰락으로 가나...전세계 공산품 생산기지 중국 몰락으로 세계경제 휘청할 것 같다. 제2의 펜더믹 쓰나미가 몰려 올 것 같다.', '중국은 솔직히 인구 절반은 없어져야지. 쟤네 땜에 지구가 힘들다', '', '', '중국입국 막아야 할것 같은데..백신도 물백신에 무슨 또다른 변종이 나올지모르는데', '니들이 퍼트렸으니 1억명은 가야지', '사망자가 꼴랑 100만명 이라니 !! 중국 인구가 얼만데 꼴랑 100만명이냐...곱하기 100은 해야지.', '', '', '인류대량학살', '다 ㄷ져라', '', '중국이 문제여....', '', '코로나가 종식될 것 같다는 희망을 가졌는데 다시 확산이 될 것 같아 걱정이 됩니다.\n모두 힘내서 이 위기를 잘 극복했으면 좋겠습니다.\n그래서 우리 모두가 바라던 종식의 날을 기대하며 조금만 더 힘을 냈으면 좋겠습니다.\n그것이 우리 모두가 바라는 것일 것입니다.\n조금만 더 힘을 내세요.', '100만명이면 우리나라보다 사망자율이 낮은거임', '비나이다 비나이다', '저긴 죽는사람보다 태어나는 신생아가 더 많은 나라 아니냐', '', '국경 봉쇄해라ㅡㅡㅡ', '100만아니고 정확히 3000만... 3000만이 죽어도 100만으로 발표하겠지..', '중국에서 새로운 변이가 생기거나 제 2의 코로나가 발생할까 두렵다. 중국 인도 같이 위생개념 없는 국가들 좀 어떻게 해보자', '우한바이러스!', '1년  봉쇄해봐라 잡을수있나\n공산당 답다', '우리 집에 오는 웅진 코디 연변족 인데 어떻게 매번 올때마다 떡진 머리냐!! 냄새은 또 어떻고!! 무슨 진짜 세상 그런 역겨운 냄새가 나는지?? 안씻은 냄새+향신료 냄새?? 여튼 너무 구역질 나는 화학적인 냄새임!!! 🤮아 진짜 코디 때문에 웅진 렌탈 그만 할거임..ㅠㅡㅠ', '이제 중국발 공산품 생활필수품 생산공급물량 부족으로 또 가격 올라가고 난맂치겠네. 러시아랑 중국이랑 둘이 참..', '', '', '', '우한폐렴 느그들 둥가둥가하면서 부둥켜안고 살아 ^-^ 너어무 좋겠다ㅏㅏㅏㅏㅏㅏ 세계 어디서도 인정박아버리는 마데인치나 느그들 고유 문화유산 생겨서&gt;_&lt;', '우리가 중국을 강렉하게 막았어도 코로나는 쉽게 넘어갈수 잏엏을건데 문재인이 큰형님나라 때문에 국민만 작살나는 구마', '다른 바이러스 시작인가?', '인간들그마이많은데 좀줄어야하지않나', '나이스! 제발 좀 멸족 되기를! 여전히 시장에선', '곧 자멸.', '접종하고 부작용으로 다 저리된거 아닌지 상당히 의심스러움', '바이러스를 통제하는건 불가능하고 사람들을 통제하는거지. 인간 통제는 독재국가의 주특기', '', '', '중공 망하는건가?', '니네들 위생 수준이나 의료체계로는 도저히 감당 안 되겠지', '', '지들이 만들고 지들이ㅈㄴ걸리누', '위드코로나 해라..', '중국의 노인 인구는 많이 죽으면 안됩니다.........중국의 노인 인구가 많이 살아 남아야 미래에 사회문제가 됩니다.', '자업자득', '', '100만명은 성에 안찬다 한 1억명 정도 죽어줘야 음 좋아 좋아', '사망자 100만명 나올수도라고?  짱깨 니들때문에 전세계에 죽은 사람만 몇백만명이다.', '', '이번에는  중국을  막아야한다\n무역도 좋치만   국민의생명도  중요하도\n더러운 중국    코로나바이러스를   우리나라가\n옴긴다고   떠넘기려한  중국이다\n중국을 막아야한다\n전중국이 감염되서   중국이 망해야한다', '', '', '3차 맞아도 돌파 감염으로 다 걸리는데 중국백신은 더 좋은가??', '', '', '', '', '', '다 디져라', '그래봐야  티도 안남', '', '짱개 입국 금지해라ㅋㅋㅋ', '지구에서 사라져라 제~~발...... ㅋㅋㅋ', '100만? 더 더더더더더ㅓㄷ더ㅓㅏ더더ㅓ더더ㅓ더더ㅓ', '우리나라도 백신사망 보상 못받는데 중국은 얼마나 은폐할까', '진짜 코메디 ㅋㅋ', '', '짱개', '저쉐끼들이 다뒤져야돼 \n제일의심스럽게 만든 나라', '엄청 퍼트려라 아직도 반성 안하냐', '', '인간이 자연을 이길수 있을까?? 자연의 법칙 인간은 절대 못깬다', '코로나 19의 발원지인 중국에서도 또 오미크론이 급속히 번져 심각한 수준에 달한 모양이다. 사망자가 100만명이 될 수 있다는 전망 때문에 중국의 대도시인 상하이를 봉쇄한다고 한다. 분명히 인구가 많은 중국에서 오미크론의 확산이 심각해 질 것 같다. 걱정이다.', '', '', '인구 십억이  넘는데  6만?  장난하나?  한국은  오천만에도 하루확진 50만넘게 갔는데   ㅎㅎ 뭐든 개구라,  중국이  오미크론  확산된다면   한국에서  맞힌  백신 일부가  중국산일  가능성이  아주  높아지는 거지  그리고 기자야 외국은  코로나랑 공존이 아니라  백신 2차접종으로도  코로나가  잡힌 거다  뭘 알고 기사써라', '중국=한국\n이 저 미개한 마인드를 한국이 닮아가는거만 남았네', '갱상도 민폐 꼰대아재것들도 필요없으니 데려가라', '여러분, 고난의 바다를 항해하시느라 많이 힘드시죠? 예수를 모르시는 분들은 더이상 인생방황하지 마시고 하나님과 예수님을 믿으시고 영접하시어 새인생을 사실 수 있으시기를 바랍니다. 사람이 예수님을 믿지 않는 것은 죄입니다. 부디 악한 어둠의 길을 택하지 마시고 하나님의 자녀가 되셔서 참 빛의 길을 걸으시기를 권해드리며 축복합니다. 예수를 믿지 않는 사람은 악인이고 하나님의 자녀로써 하나님을 믿는 사람은 의인입니다. 하나님은 세상을 창조하셨고 항상 다스리십니다. 하나님 외에 다른 참된 선한 신은 아무도 없습니다. 무한 축복합니다! 🌈']",http://www.inews24.com/view/1465507,https://n.news.naver.com/mnews/article/296/0000055100?sid=103
2022.03.24.,뉴시스언론사 선정,,'관절염 싹 없애준다'…소비자 기만 식품 광고 29건 적발,,,http://www.newsis.com/view/?id=NISX20220324_0001805441&cID=10434&pID=13100,http://www.newsis.com
2022-03-24 10:30:00,대전시티저널,사회,남진근 '동구 대전환' 위해 6·1 지선 동구청장 출마,"[ 기사내용 요약고령층 상대로 '항염·항암 효과' 등 허위·과대 전화 광고'무릎·관절 통증 해결' 등 질병 예방·치료 효과 내세우기도""건강기능식품은 질병 예방·치료 위한 의약품과 달라""    식품의약품안전처는 온라인 상에서 식품 등을 '관절 건강' 등으로 광고해 '식품 등의 표시‧광고에 관한 법률'을 위반한 29건을 적발했다고 24일 밝혔다. 사진은 식약처가 공개한 온라인 부당광고 사례.(사진 : 식약처 제공) *재판매 및 DB 금지[서울=뉴시스] 안호균 기자 = 고령층 소비자 등을 상대로 관절 염증 치료·예방 효과가 있는 것처럼 허위·과대 표현을 사용해 건강기능식품 등을 광고한 온라인 사이트 29곳이 적발됐다.식품의약품안전처는 온라인 상에서 식품 등을 '관절 건강' 등으로 광고해 판매한 사이트 172건에 대한 부당광고 여부를 점검해 '식품 등의 표시·광고에 관한 법률'을 위반한 29건을 적발했다고 24일 밝혔다. 식약처는 적발된 업체들에 대해 방송통신심의위원회 등에 게시물 차단을, 관할 행정기관에는 행정처분을 각각 요청했다.주요 위반 내용은 ▲건강기능식품임에도 사전에 자율심의 받은 내용과 다른 광고 17건 ▲질병 예방·치료에 대한 효능 광고 7건 ▲건강기능식품을 의약품으로 오인·혼동시키는 광고 등 5건 등이다.조사 결과 적발된 업체들은 고령층을 대상으로 고가의 관절건강 제품을 전화로 홍보하면서 '항염·항암 효과가 굉장히 뛰어나다', '무릎 속에 있는 염증과 시커멓게 변해 있는 세포를 꺼내준다', '연골이 전혀 없더라도 수술을 안 하셔도 되는 이유는' 등 허위·과대 표현을 사용해 구매를 유발한 것으로 드러났다.온라인 부당 광고의 경우에는 '무릎·관절 통증 이것으로 해결한다' 등의 문구로 질병 예방·치료 효과를 내세우거나 '관절을 튼튼하게 지켜낸 관절약' 등 의약품으로 오인·혼동할 수 있는 표현을 사용했다. 또 자율심의기구에서 심의를 받은 내용과 다르게 광고한 경우도 적발됐다.식약처는 의료계·소비자단체·학계 등으로 구성된 '민간광고검증단'에 이번에 적발된 부당 광고에 대해 자문했다. 검증단은 ""건강기능식품은 인체의 기능이나 생리학적 작용 등 '유용한 효과'를 얻기 위해 섭취하는 것으로 질병의 예방·치료를 위한 의약품과 다르다는 것을 유의하고 섭취해야 한다""면서 ""관절 통증·변형 등 질병 치료를 위해서는 식품·건강기능식품을 섭취하기보다 증상 초기부터 전문의와 상담하고, 정확한 진찰과 검사 후 그에 따른 치료를 진행하는 것이 필요하다""고 조언했다.식약처는 ""대한노인회 등 관계기관과 협력해 고령층을 대상으로 '건강기능식품 등의 제품구매 시 주의사항' 등을 안내·홍보하는 등 소비자 피해 예방을 위해 노력하겠다""고 밝혔다． ]","['효능도 없으면서 비싸기는 왜그리 비싼지\n노인들 아픈것도 서러운데  가격 까지\n엄청나서  더 맘 쓰리게 한다.\n과대광고  펼친 회사 이름도 밝혀줌\n안될까~~ㅠ', '이런기사만 보고는 나이드신분들은 대처가 힘들다.  확실한 업체명과 상표명ㅈ을 노출시켜도 되는거 아닌가?\n아님 그걸 노출시키지않는대가를 받고서 봐주는 차원인가?']",http://www.gocj.net/news/articleView.html?idxno=120423,https://n.news.naver.com/mnews/article/003/0011080327?sid=102
2022.03.25.,경상일보,,[사설]젊은도시에서 고령사회로…구체적·심층적 정책 수립해야,,,http://www.ksilbo.co.kr/news/articleView.html?idxno=930397,http://www.gocj.net/
2022.03.10.,국민일보언론사 선정,,"집단 매장된 시신, 피흘린 임산부…러 “불가피한 공격”",,,http://news.kmib.co.kr/article/view.asp?arcid=0016855594&code=61131111&cp=nv,http://ksilbo.co.kr
2022.03.30.,더밸류뉴스,,"한국토요타, 취약계층 도시락 지원에 ‘안나의 집’ 1억 기부",,,http://www.thevaluenews.co.kr/news/view.php?idx=168299,http://www.kmib.co.kr/
