Date,Press,Category,Title,Content,Comment,URL_Origin,URL_Naver
2023-08-17 16:40:47,불교공뉴스,사회,"의료 사각지대에 노인 우울증… 고양시, 어르신 정신건강 치료비 지원","[       이기일 보건복지부 1차관이 17일 오후 서울 종로구 세종대로 정부서울청사에서 제3차 장기요양기본계획 발표를 하고 있다. 뉴스1       노인장기요양보험 수급자 가운데 집에서 돌봄 받는 재가 수급자도 시설에 입소한 수급자 수준으로 지원받을 수 있도록 월 이용 한도액이 인상된다. 현재 치매 환자를 돌보는 가족만 대상으로 하는 ‘가족휴가제’도 모든 중증(1·2등급) 수급자 가족에게 확대될 예정이다.      보건복지부는 17일 이같은 내용이 담긴 ‘제3차 장기요양 기본계획’을 발표했다. 장기요양 기본계획은 노인장기요양보험법에 따라 정부가 5년마다 수립한다. 이번 계획은 올해부터 2027년까지 추진할 중장기 과제를 담고 있다. ▶장기요양서비스 강화 ▶맞춤형 서비스 이용체계 구축 ▶장기요양기관 품질관리 ▶제도의 지속가능성 제고 등 4가지 주요 과제를 추진해 초고령사회에 대비한다는 게 정부의 목표다.      이기일 복지부 제1차관은 이날 정부서울청사에서 가진 브리핑에서 “장기요양보험 제도 시행 초기에 비해 수급자와 인프라가 큰 폭으로 증가했으나, 노인 인구 1000만 시대와 초고령 사회가 2025년도에 예정돼있다”며 “서비스 확대와 품질관리 등 다양한 과제가 우리 앞에 놓여 있다”고 말했다.      이번 계획에서 정부가 가장 방점을 찍은 부분은 재가 서비스 확충이다. 장기요양급여는 크게 가정에 머물면서 서비스를 받는 재가 급여와, 요양기관 등에 입소해 받는 시설 급여로 나뉜다. 전체 수급자 중 78.4%가 재가 급여 이용자다. 이런 현실을 고려해 재가 서비스의 양과 질을 높이겠다는 것이 정부의 구상이다. 이를 위해 돌봄 필요도가 높은 중증(1·2등급) 재가 수급자의 월 한도액을 시설 입소자 수준으로 올리는 단계적 인상이 추진된다. 현재 1등급 수급자 기준 재가급여는 188만5000원, 시설급여는 245만2500원 한도 내에서 이용할 수 있다.        또한 현재 방문요양 서비스만 중점적으로 제공하는 기관을 방문 목욕 및 간호, 주·야간 보호 등 여러 서비스를 복합적으로 제공하는 통합기관으로 재편해 다양한 재가 서비스 수요에 발맞춘다. 이런 통합재가기관은 전국에 50개소 있는데, 이를 5년 내에 1400개소까지 확대한다는 계획이다. 거동이 불편한 수급자의 의료 서비스를 위해서 전국 28개소 운영 중인 재택의료센터도 시군구당 1개소 이상으로 늘린다.      재가수급자의 가족을 위한 지원도 확대된다. 치매 환자를 모시는 가족이 휴가 등으로 집을 비울 경우, 정부 지정 시설에서 일시적으로 환자를 돌봐주는 ‘치매가족휴가제’를 모든 중증(1·2등급) 수급자로 대상자를 넓혀 ‘장기요양 가족휴가제’로 확대한다. 기간도 현재 연간 최대 9일까지 가능하던 것을 12일로, 종일 방문요양 이용 가능 횟수는 18회에 24회로 늘린다.          복지부가 17일 발표한 '제3차 장기요양 기본계획'에 담긴 '치매가족휴가제' 확대 계획. 사진 복지부       이밖에도 장기요양 대상자가 맞춤형 서비스를 받을 수 있도록 건강보험공단-지방자치단체-장기요양기관 등이 참여하는 사례관리 협업체계를 구축하고, 노인의 신체·인지 기능을 종합적으로 평가할 수 있도록 장기요양 등급체계의 개편도 추진된다.        장기요양기관 품질관리 체계 강화 차원에서 요양보호사 지원을 확대하는 방안도 담겼다. 요양보호사 1인이 돌보는 수급자 수를 현행 2.3명에서 2025년에 2.1명이 되도록 하고, 5년 이상 근무한 요양보호사에 선임 역할을 부여하고 수당을 지급하는 ‘요양보호사 승급제’를 마련해 숙련된 서비스 제공을 유도한다. 장기요양기관의 운영실적을 바탕으로 지정 후 6년마다 갱신심사를 실시해 기준 미충족 기관은 2025년 12월부터 퇴출하는 등 관리도 강화된다.      제도의 지속가능성 제고를 위한 방안으로는 적정 수준의 보험료율을 결정하겠다는 계획이 언급됐다. 올해 장기요양보험료율(소득 대비)은 전년 대비 0.05%포인트 인상된 0.91%로, 2018년 이후 최저 수준 인상이었다. 복지부에 따르면 일본은 1.5%, 독일은 3% 수준의 보험료를 부과한다.      이 차관은 “나가는 양만큼 보험료를 걷는 것이 원칙”이라며 “9월쯤 사회적 합의기구에서 고령화 속도, 재정 여건 등을 종합적으로 고려해 보험료율 논의를 진행하겠다”고 말했다.          제3차 장기요양 기본계획. 사진 복지부     ]","['그냥 편안하게 마감할 수 있도록 안락사 허용해주세요 초고령화사회 재앙입니다 자식도 국가도 아픈부모도 모두가 비극', '요양보호사 나이 좀 제한해라... 노인이 노인을 케어한다는것은 그만큼 질이 떨어진다는거다..  요양원에 가보면 화장 덕지덕지...70세 된 요양보호사가 퇴기처럼 입만 나불거리고 있다... 아무것도 모르는 치매환자에게 나이많은 요양보호사는 학대다.\n재가 서비스시간을 늘려주기를..', '보호자가 지원금액 다 혜택 받도록 제발 신경 써주세요 집에서 모시면 정말 돈도 많이 듭니다 그나마 의료복지용품이 비교적 제대로 혜택을 받는거 같습니다 의료품에 기저귀가 없는것이 못내 안탑깝습니다 겉기저귀 속기저귀 값이 상당하거든요 글구 시중보다 약간 보조용품  금액이 높게 책정되어있단건 아시는지요? 보호자는 일부만 부담하니 그래도 엄청싸게 이용합니다만 원금액은 우리 세금 아닌가요? 그래도 보조용품 이용에 감사합니다 요양사 급여 문제는 진짜 심각한 센터들 많습니다 제발 탁상행정 마시고 현장소리 들으시고 창구 열어주세요 신고도 못합니다', '주간보호센터 요양보호사는 노인이 더 많습니다. 팔 아프고, 허리 아파서 도움을 받기 민망합니다. 어르신들 부축하다 같이 쓰러질 거 같아요. 처우 개선해서 젊은 사람들이 많이 지원할 수 있게 바뀌어야 합니다.', '정말 도움을 필요로 하는 사람이 많습니다 저 같은 경우도 집사람 장애등급은 2급인데 노인요양은 3급으로 큰 도움도 없습니다 휠체어도 혼자 못타고 화장실 모든것 옆에 누가 없음 아무것도 할수 없는데 지금 나온 시책도 1ㅡ2급만 해당되는것 같네요 환자옆 한 사람 붙어 있는건 같은데ㅡ사각지대도 살펴봐줬음 합니다', '보험료 인상에 반대.  지금도 과다하다.', '말뿐임 제도임..이용하려하먄 되는게 없다…', '', '현장 관리감독 철저히 하세요 이용 어렵고 신고하라 되어있으나 신고 받지도 않습니다 요양사에게 센터 연결해주고 다달이 소개비를 지속적으로 받고 소개비 안받는  센터로 요양사를 옮기게하니 보호자인 제게 전화해서 소개비 내놓으라 협박하더라구요 ㆍ치매휴가제는 지정된 센터를 지속이용해야만 가능하고 타센터 이용시 불가해서 단 하루도 이용 못하고있습니다  정책은 좋으나 관리감독이 엄청 허술합니다', '등급 산정이 너무 중구난방입니다 정확한 기준도 없고 소견서 써주는 의사의 성향에  따라 등급이 좌우 됩니다', '', '', '요양보호사 교육은 제대로 받고 현장 나오는거 맞나요? 치매가 어떤 행동을 하는지 파킨슨은 어떤 증상이 있고 대처 하는지도 모르던데... 갑갑하다', '단기요양  하는 곳도 찾기 어렵네요\n지방으로 아니면 근교까지 어찌 모시나요?\n서울 시내쪽으로 더 늘려주세요\n날짜만 늘려도 이용이 어렵습니다\n치매 부모님 때문에 여행도 못갑니다\n가족요양지원비도 엄청 줄여서 기저귀\n사대기도 바쁩니다\n왜 갑자기 줄였는지 너무 하신거 같네요', '', '치매가 아닌이상, 자녀와 사는 노인의 경우는 아예 수족을 쓸수없이 누워만있어야 등급이 가능하다고 한다.그 이외의 보행장애 노인은 보행보조기 구입비나 목욕의자구입비 등 의료기기 지원도 불가능하고 요양원 입소도 전액 본인부담이라 자식들이 너무 부담스럽다.', '', '솔직히 장기요양등급 1ㆍ2등급이면 요양병원에 모셔야 맞는거지...가정돌봄이나 요양원은 그냥 죽으라는 거야', '치매노인은 정신이나 육체가 생활하기 힘들고 불편해서 등급상관없이 항시 옆에 사람이 붙어 있어야 하는데 가족요양을 하고 있는 입장에선  모든 일상이 힘든 상황이다  법을 악용하는 사람들 때문에 가족요양하시는  분들이 피해보는 부분이 많다 철저한 단속으로 개선이 많이 필요 하다고 생각한다', '요양보호사 시급이 진짜오르던지\n아님 자격증난이도가 높아지던지\n꼭 대책이 있어야합니다.', '자기 부모 모시는데 돈 더달란다...ㅋㅋㅌ', '단기보호기관은 거의 없는데.....어디서 이용할수 잇다는건지...', '하여간 돌대가리들. 정책 펼치는거 보면 토 나온다. 어떻게 저 데가리로 일류대 나왔을까', '', '가족요양은 진짜 반성하자~ 돈만 챙겼지 지부모 방임 상태가 대부분임!! 그리고 욕창 생기면 제발 좀 빨리 병원으로 모셔라~ 가정방문 요양보호사들이 가장 형편없는것 같음..얘기해보면 어르신들에 대한 이해도가 전혀 없음']",http://www.bzeronews.com/news/articleView.html?idxno=622173,https://n.news.naver.com/mnews/article/025/0003301309?sid=102
2023.08.28.,천지일보,,"수원시의회, 디지털 헬스케어 활용 노인복지 시스템 구축 연구활동 중간보고회...",,,https://www.newscj.com/news/articleView.html?idxno=3057927,http://www.m-i.kr
2023.08.23.,한국경제TV,,"경희대의료원, '시니어 주택 의료서비스' 제공한다",,,http://www.wowtv.co.kr/NewsCenter/News/Read?articleId=A202308230182&t=NN,http://www.bzeronews.com
2023.08.29.,뉴스토마토,,(2024 예산안)4인 가구 생계급여 21만3000원↑…노인일자리 확대,,,http://www.newstomato.com/ReadNews.aspx?no=1199304&inflow=N,http://www.newscj.com
2023.08.25.,뉴스프리존,,"충남 아산시, 노인 의료복지시설 32개소 CCTV 설치 완료",,,https://www.newsfreezone.co.kr/news/articleView.html?idxno=507634,http://www.wowtv.co.kr/
2023-08-23 17:33:49,스포츠서울,생활/문화,"화천군, 폭염·집중호우 취약노인 538명 방문 안전확인","[ 태원씨아이앤디와 업무협약 체결    경희대학교의료원은 23일 후마니타스암병원 6층 국제회의실에서 시니어 주택 전문 분양 마케팅사인 태원씨아이앤디와 ‘시니어 레지던스 활성화와 차별화된 의료서비스 개발에 관한 업무협약’을 체결했다고 밝혔다.시니어 주택은 노후생활을 위한 종합 부대시설을 갖춘 주거단지다. 주거와 의료, 식사, 건강관리, 문화활동, 커뮤니티센터 등 종합적인 서비스를 제공한다.이번 협약에 따라 경희대학교의료원은 향후 태원씨아이앤디와의 사업에 참여해 공급 준비 중인 10여 개의 '시니어 레지던스' 입주자를 대상으로 전문의 진료, 건강 모니터링을 통한 의료상담, 건강검진 등 특화 의료서비스 개발과 운영에 나설 예정이다.김성완 경희대학교의료원장 겸 의무부총장은 “고령화의 가속화로 건강관리 요구가 증가하는 상황에서, 국내 유일의 의학·치의학·한의학 협력 체계를 통한 종합건강검진 서비스를 제공하는 의료기관의 강점을 활용해 차별화된 의료서비스 개발을 추진하고자 한다”며 “홍릉 바이오 클러스터를 중심으로 진행 중인 재생의학, 건강노화, 노인성 질환 등에 대한 연구를 기반으로 시니어타운에 최적의 치료, 예방 및 관리를 제공할 것”이라고 밝혔다.이정석 태원씨아이앤디 대표는 “경희대학교의료원은 고령화 사회 진입과 더불어 증가하는 장년 및 노년층에 대한 양질의 의료 제공은 물론 메타버스 및 IT플랫폼을 활용한 스마트한 의료서비스까지 제공하고자 최선을 다하고 있다”며 “경희대학교의료원과의 협력을 통해 앞으로 당사에서 제공할 프로젝트들은 시니어 주택의 미래에 새로운 지평을 열 것으로 기대한다”고 말했다. ]",[],https://www.sportsseoul.com/news/read/1342120?ref=naver,https://n.news.naver.com/mnews/article/215/0001120912?sid=103
2023.08.24.,스포츠서울,,"화천군, 폭염·집중호우 취약노인 538명 방문 안전확인",,,https://www.sportsseoul.com/news/read/1342120?ref=naver,http://www.sportsseoul.com/
2023-08-24 09:44:04,부산일보,사회,의료 등 사회적현물이전 연 847만 원…교육·보육 이전 첫 감소,"[ 화천지역 경로당 전수 안전점검, 폭염 취약노인도 전수 안전확인28일부터 10월말까지, 92개 경로당 전기와 가스, 안전점검    최문순 화천군수가 지난 14일 상서면 산양1리 경로당 이전 신축부지를 방문해 진행상황을 점검하고 있다.  제공=화천군청[스포츠서울ㅣ김기원 기자] 화천군이 고령 주민들의 안전과 복지를 위해 현장에서 발로 뛰고 있다.화천군은 올해 들어 폭염과 집중호우 발생 시 도움이 필요한 모든 고령주민들을 일일이 방문해 생활상과 건강을 점검하고 있다. 방문 대상은 기초생활수급자, 차상위, 기타 몸이 불편한 노인 등 노인맞춤돌봄서비스 대상자 538명이다.방문에는 전담인력과 생활지원사 등 20명이 투입돼 노인들의 건강상태, 냉방 여부 등을 가족처럼 돌보고 있다. 필요할 경우 의료기관과 연계해 주거나 군청 담당부서에 알리는 것도 이들의 몫이다.이와 함께 화천군은 92개소에 이르는 5개 읍․면 경로당 전수 안전점검을 오는 28일부터 실시한다.오는 10월말까지 이어지는 경로당 안전점검은 전기, 가스, 소방 등 3개 분야에 걸쳐 현장에서 실시된다.  전기시설 점검에는 한국전기안전공사 강원지역본부가 참여해 누전여부와 누전 차단기 점검, 배선 상태 등을 확인한다.가스시설 점검에는 한국가스안전공사 강원지역본부가 참여해 저장 및 시설안전, 배관관리, 가스누설 경보, 차단장치, 밸브류 등을 살펴보고, 가스사고 예방을 위한 안전교육까지 진행한다.소방시설 점검에는 소방점검 전문업체가 참여해 소화기구 작동 기능점검, 경보설비와 피난장치, 피난통로 등을 면밀히 들여다본다. 화천군은 각 분야 점검에서 부족한 부분이 발견될 경우, 즉시 시설 보수공사에 착수한다는 계획이다.최문순 화천군수는 “스스로 몸을 돌보기조차 힘든 어르신들이 지역 곳곳에 많이 계신다”며 “이분들을 먼저 찾아뵙고, 불편한 점이 무엇인지, 필요한 것이 무엇인지 파악해 보다 편안하게 생활하실 수 있도록 최선을 다하고 있다”고 했다.acdcok@hanmail.net ]",[],https://www.busan.com/view/busan/view.php?code=2023082312053617037,https://n.news.naver.com/mnews/article/468/0000973542?sid=102
15면 TOP,매일신문,,주요 사건으로 되돌아본 경북의대 100년…선진 의료체계기틀 마련,,,https://news.imaeil.com/page/view/2023082210434115313,http://www.busan.com/
2023-08-23 12:13:01,연합뉴스언론사 선정,경제,노인장기요양보험 재정 3년 연속 흑자…누적 준비금 2조8천억원,"[     통계청 제공정부와 지방자치단체 등이 제공하는 의료·교육서비스 등의 사회적현물이전 소득이 연평균 847만 원으로 집계돼 가구소득의 13%를 차지했다. 저출생 등으로 교육·보육 부문의 현물이전은 통계 작성 이후 처음으로 감소했다. 통계청은 이런 내용의 '사회적현물이전을 반영한 소득통계 결과'(사진)를 23일 발표했다.2021년 사회적현물이전소득은 가구당 평균 847만 원으로 1년 전보다 1.5% 늘었다. 사회적현물이전은 국가 또는 민간 비영리단체 등이 가구 또는 개인에게 제공하는 상품·서비스를 말한다. 건강보험 등의 의료 서비스, 국가장학금·무상급식 등의 교육 서비스, 보육 서비스 등이 해당한다.2021년 사회적현물이전 소득은 가구 평균 소득(6414만 원)의 13.2% 수준이다. 가구소득의 13%가량에 해당하는 비용을 정부가 대신 지불했다는 의미다. 1년 전과 비교해 비중은 0.4%포인트(p) 줄었다.부문별로 보면 의료 부문이 평균 422만 원, 교육 부문이 374만 원으로 전체 사회적현물이전의 94%를 차지했다. 1년 전과 비교해보면 의료 부문은 4.8% 늘었지만, 교육 부문은 1.0% 감소했다. 저출생·고령화 등으로 의료 부문의 현물 이전은 가파르게 늘고 교육 부문의 증가세는 둔화하는 가운데, 전체 가구 수는 늘어난 결과다. 보육 부문도 35만 원으로 1년 전보다 8.4% 감소했다. 교육·보육 부문의 지출이 줄어든 것은 관련 통계 작성이 시작된 2016년 이후 처음이다.소득별로 보면 사회적현물이전 소득은 소득 1분위가 평균 640만 원, 소득 5분위가 1064만 원으로 소득이 높을수록 많았다. 가구소득 대비 비중으로 보면 소득 1분위가 48.3%, 소득 5분위가 7.1%로 소득이 낮을수록 비중이 커졌다.부문별로는 소득 1·2분위의 경우 의료 부문이 전체 사회적현물이전 소득에서 차지하는 비중이 각각 87.8%, 61.2%로 높게 나타났다. 소득 4·5분위는 교육 부문이 각각 55.3%, 59.1%로 높았다. 소득이 낮을수록 노인 가구가 많고 소득이 높을수록 자녀를 둔 가구가 많은 결과다.사회적 현물이전은 소득 불평등도를 개선한 효과가 있는 것으로 나타났다. 2021년 사회적 현물이전을 반영한 균등화 조정처분가능소득 기준 지니계수는 0.284로 현물이전을 반영하기 전(0.333)보다 0.049 감소했다. 지니계수는 소득불평등도를 나타내는 지표로 수치가 1에 가까울수록 불평등하다는 의미다. 소득 5분위 배율은 5.96배에서 4.33배, 상대적 빈곤율은 15.1%에서 10.1%로 각각 1.63배p, 5.0%p 각각 개선됐다.연령대별로 보면 소득개선 효과는 은퇴 연령층에서 크게 나타났다. 66세 이상 은퇴 연령층의 경우 지니계수가 사회적 현물이전을 반영하기 전 0.379에서 0.292로 0.087 감소했다. 근로 연령층(18∼65세)은 0.036, 아동층(17세 이하)은 0.062 각각 감소했다. 고령층에서 받은 의료 부문 현물이전이 다른 연령층보다 많은 결과라는 게 통계청의 설명이다. ]",[],https://www.yna.co.kr/view/AKR20230808068900518?input=1195m,https://n.news.naver.com/mnews/article/082/0001228532?sid=101
2023.08.29.,아시아타임즈,,[눈에 띄는 지방자치] 수원시의회 '디지털 헬스케어 활용 노인복지 시스템 구...,,,https://www.asiatime.co.kr/article/20230829500072,http://www.imaeil.com/
