Date,Press,Category,Title,Content,Comment,URL_Origin,URL_Naver
2021-03-05 10:33:39,위키트리,사회,광주시 동구 ‘신중년 일자리지원 사업’ 본격 추진,"[ 전국 96개소 중 22개소 23% 차지 국비 355억 확보[전남CBS 최창민 기자]    전라남도는 국가균형발전위원회의 '취약지역 생활여건 개조사업' 공모에서 전국 96개소 중 22개소가 선정돼 3년 연속 전국 최다를 기록했다고 밝혔다.이번 사업은 농어촌 오지마을, 도시 달동네 등을 대상으로 안전한 주거환경을 확보해 주민의 기본적 삶의 질을 개선하는 사업이다. 올해 공모에서 전남지역에서는 18개 시군 33개 마을(도시 3․농어촌 30)이 공모사업에 지원해 도시 3개 마을, 농어촌 19개 마을이 선정됐다.이들 마을에서는 주민 생활과 밀접도가 높은 생활·위생인프라 개선, 노인 돌봄과 건강관리 등 휴먼케어 사업, 노후 불량 주택 정비, 주민공동체 활성화 등 주민 역량강화 사업이 추진된다.개소당 도시지역 30억 원, 농어촌지역 15억 원 내외로 4년간 국비가 지원된다.전남도 명창환 기획조정실장은 ""3년 연속 최다 선정은 시군의 공모 계획 수립부터 발표 준비까지 전 과정에 참여해 전문가 자문, 사전평가 등을 통해 내실있게 사업계획을 세웠기 때문""이라며 ""취약지역 생활여건 개조사업을 통해 전남의 도시와 농어촌지역 정주 여건을 편리하게 개선함으로써 살기 좋은 지역, 사람이 모여드는 지역으로 만들겠다""고 말했다.▶ 확 달라진 노컷뉴스▶ 클릭 한 번이면 노컷뉴스 구독!▶ 보다 나은 세상, 노컷브이와 함께ccmin@cbs.co.kr저작권자 © CBS 노컷뉴스 무단전재 및 재배포 금지   ]",[],https://www.wikitree.co.kr/articles/627493,https://n.news.naver.com/mnews/article/079/0003475538?sid=102
2021.03.03.,뉴스1,,올해 전국 빈집·노후주택 정비 대상 96곳 선정…1500억 투입,,,https://www.news1.kr/articles/?4228640,http://www.wikitree.co.kr
2021.03.03.,이데일리,,"취약지역 생활여건 개조사업, 올해 96개 신규대상지 선정",,,http://www.edaily.co.kr/news/newspath.asp?newsid=02870006628979712,http://news1.kr/
2021-03-03 11:00:00,뉴스1,경제,구례 이사마을 '농어촌 취약지역 생활여건 개조사업' 공모 선정,"[ 국가균형발전위원회, 16개 도시·80개 농어촌 지역 선정    © 뉴스1(서울=뉴스1) 이훈철 기자 = 대통령 직속 국가균형발전위원회(균형위)는 2021년 취약지역 생활여건 개조사업 신규 사업대상지 96곳을 선정했다고 3일 밝혔다.이번 선정된 96곳은 16개 도시, 80개 농어촌 지역이다. 시·도별로는 전남 22곳, 경북 20곳, 경남 16곳, 전북 11곳 등 총 11개 시·도가 포함됐다. 사업대상지에 대해서는 올해 약 150억원을 시작으로 향후 총 1500억원 규모의 국비(도시 약 450억원, 농어촌 약 1050억원)가 지원될 계획이다.취약지역 생활여건 개조사업은 취약지역의 주민들이 최소한의 삶의 질(National Minimum)을 보장받을 수 있도록 생활여건을 개선하는 사업으로, 2015년부터 취약지역을 선정하여 지원하고 있다. 주요 사업 내용을 보면, 슬레이트 지붕 개량, 노후주택 정비 등 주택정비, 담장·축대 정비, 소방도로 확충 등 안전시설 정비, 재래식 화장실 개선, 상·하수도 정비 등 생활 인프라 확충과 더불어, 노인 돌봄, 건강관리 프로그램 등 주민공동체 활성화를 위한 휴먼케어(human care) 및 역량강화사업 등 소프트웨어 사업도 포함된다. 이번에 선정된 사업지역에는 4년 도시지역은 약 30억원(도시 쪽방촌 주거환경 개선을 위한 임대주택 조성시는 최대 70억원까지 지원), 농어촌 지역은 약 15억원의 국비를 지원한다. 선정된 사업 중 도시지역은 국토교통부, 농어촌 지역은 농림축산식품부에서 추진하게 되며, 해당 부처별로 4~5월 중에 신규 사업대상지 지자체를 대상으로 최종 사업계획을 마련하기 위한 합동 워크숍을 개최하고, 균형위는 지자체가 사업을 원활하게 추진할 수 있도록 관련 분야 전문가를 중심으로 지역별 맞춤형 컨설팅을 제공할 계획이다. 균형위 관계자는 ""정부는 국토의 균형발전의 일환으로 성장 혜택으로부터 소외된 취약 지역을 대상으로 기본적인 삶의 질 충족을 위한 지원 정책을 지속적으로 펼쳐나갈 예정""이라고 말했다.boazhoon@news1.kr▶ 네이버 메인에서 [뉴스1] 구독하기!▶  뉴스1&amp;BBC 한글 뉴스 ▶  터닝포인트 2021 © 뉴스1코리아(news1.kr), 무단 전재 및 재배포 금지   ]",[],https://www.news1.kr/articles/?4230737,https://n.news.naver.com/mnews/article/421/0005198600?sid=101
2021.03.15.,스마트에프엔,,"화순군, 아동·여성·고령 친화도시 조성 본격화",,,http://www.smartfn.co.kr/view.php?ud=202103151013473257cbdd385abe_46,http://www.edaily.co.kr/
2021-03-03 11:00:36,뉴스락,경제,"국민건강보험공단, 대규모 상반기 청년인턴 채용","[ 도시 16개소·농어촌 80개소 선정도시 450억·농어촌 1050억원총 1500억 규모 국비 지원[이데일리 김나리 기자] 대통령 직속 국가균형발전위원회는 올해 취약지역 주민의 생활여건을 개선하는 ‘취약지역 생활여건 개조사업’ 신규 사업대상지 96개소를 선정했다고 3일 밝혔다.이번 선정된 96개소는 도시 16개소, 농어촌 80개소로, 시·도별로는 전남 22개소, 경북 20개소, 경남 16개소, 전북 11개소 등 총 11개 시·도가 포함된다. 선정된 사업대상지에 대해서는 올해 약 150억원을 시작으로 향후 총 1500억원 규모의 국비(도시 약 450억원, 농어촌 약 1050억원)를 지원한다. 이번에 선정된 사업지역의 경우 4년 도시지역은 약 30억원(도시 쪽방촌 주거환경 개선을 위한 임대주택 조성시는 최대 70억원까지 지원), 농어촌 지역은 약 15억원의 국비를 투입한다.주요 사업으로는 슬레이트 지붕 개량, 노후주택 정비 등 주택정비, 담장·축대 정비, 소방도로 확충 등 안전시설 정비, 재래식 화장실 개선, 상·하수도 정비 등 생활 인프라 확충이 추진된다. 노인 돌봄, 건강관리 프로그램 등 주민공동체 활성화를 위한 휴먼케어(human care) 및 역량강화사업 등 소프트웨어 사업도 진행된다.선정된 사업지 중 도시지역은 국토교통부, 농어촌 지역은 농림축산식품부가 맡는다. 해당 부처별로 4~5월 중 신규 사업대상지 지자체를 대상으로 최종 사업계획을 마련하기 위한 합동 워크숍도 개최한다. 균형위는 지자체가 사업을 원활하게 추진할 수 있도록 관련 분야 전문가를 중심으로 지역별 맞춤형 컨설팅을 제공한다. 균형위 관계자는 “정부는 국토의 균형발전의 일환으로 성장 혜택으로부터 소외된 취약 지역을 대상으로 기본적인 삶의 질 충족을 위한 지원 정책을 지속적으로 펼쳐나갈 예정”이라고 말했다.    (자료=국토부)김나리 (lord@edaily.co.kr)▶ #24시간 빠른 #미리보는 뉴스 #eNews+▶ 네이버에서 '이데일리 뉴스'를 만나보세요▶ 빡침해소, 청춘뉘우스 '스냅타임'＜ⓒ종합 경제정보 미디어 이데일리 - 무단전재 &amp; 재배포 금지＞ ]",[],http://www.newslock.co.kr/news/articleView.html?idxno=37278,https://n.news.naver.com/mnews/article/018/0004866170?sid=101
2021.03.15.,열린뉴스통신,,"광주시, 노후 공공체육시설 11곳 개보수 사업 실시",,,http://www.onews.tv/news/articleView.html?idxno=61470,http://news1.kr/
2021-03-04 16:59:21,뉴스1,사회,군산시 삼학동 '새뜰마을사업' 선정…38억 확보,"[ 4년간 15억 투입    구례군 산동면 이사마을이 2021년 농어촌 취약지역 생활여건 개조사업 공모'에 선정됐다.(구례군 제공)2021.3.4/© 뉴스1(구례=뉴스1) 서순규 기자 = 전남 구례군은 산동면 이사마을이 국가균형발전위원회 주관 '2021년 농어촌 취약지역 생활여건 개조사업 공모'에 최종 선정됐다고 4일 밝혔다.이 사업은 취약지역 주민들이 최소한의 삶의 질을 보장받을 수 있도록 생활여건을 개선하기 위해 추진되고 주택 정비, 안전시설 정비, 생활 인프라 확충, 노인 돌봄, 건강관리 프로그램 등 휴먼케어와 역량강화 사업을 지원한다. 이사마을은 좁은 골목길이 많은 경사지형에 위치하고 있으며 노령인구 및 취약계층의 비율이 높다. 30년 이상 노후주택은 76%, 슬레이트 주택은 70%로 주거환경이 매우 열악한 환경이다.군은 올해부터 4년간 15억원(국·도비 지원 12억원)을 투입해 축대 및 배수로 정비, 슬레이트 지붕 개량, 담장 정비 등 마을의 전반적인 생활환경을 개선한다. 노인 돌봄, 한방주치의, 마을가꾸기, 선진지 견학 등 주민역량이 강화될 수 있는 프로그램도 운영할 계획이다.김순호 구례군수는 ""산동면 둔사리 이사마을의 취약지역 생활여건 개조사업 선정으로 주거 및 생활환경이 대폭 개선될 것으로 기대된다""며 ""앞으로도 이와 같은 사업을 지속적으로 추진하여 주민이 행복한 농촌 마을을 만들어 가겠다""고 말했다.sk@news1.kr▶ 네이버 메인에서 [뉴스1] 구독하기!▶  뉴스1&amp;BBC 한글 뉴스 ▶  터닝포인트 2021 © 뉴스1코리아(news1.kr), 무단 전재 및 재배포 금지   ]",[],https://www.news1.kr/articles/?4230528,https://n.news.naver.com/mnews/article/421/0005202932?sid=102
2021.03.04.,뉴스1,,군산시 삼학동 '새뜰마을사업' 선정…38억 확보,,,https://www.news1.kr/articles/?4230528,http://news1.kr/
2021-03-04 15:27:11,스포츠서울,사회,"화순군, 2021년 취약지역 생활여건 개조 사업 선정","[ 2024년까지 주민주도형 마을만들기 본격 추진    전북 군산시 삼학동 금광공원 인근 새뜰마을사업 대상지.© 뉴스1(군산=뉴스1) 김재수 기자 = 전북 군산시는 국가균형발전위원회가 주관한 '취약지역 생활여건 개선사업(새뜰마을사업)'에 선정됐다고 4일 밝혔다.이번에 선정된 사업대상지는 삼학동 금광공원 인근으로 지난 2015년 완료된 금광지구 주거환경개선사업에서 제외된 지역으로 노후주택과 취약계층 비율이 높아 생활여건 개선 필요성이 제기돼 왔다.시는 올해부터 4년간 국비 24억원을 포함한 38억원의 사업비를 들여 슬레이트 지붕개량과 노후주택 정비, 담장‧축대 정비, 재래식 화장실 개선, 상‧하수도 정비 등 생활 인프라 확충에 나설 예정이다.아울러 주민 공동체 활성화를 위해 노인 돌봄과 건강관리 프로그램 운영 등 역량강화사업도 지원한다.이기만 도시재생과장은 ""이번 공모사업 선정을 통해 노후화된 주거환경과 낙후된 생활 인프라로 어렵게 지내온 취약지역 주민들의 삶의 질 개선에 기여할 수 있는 계기가 될 것""이라며 ""주민 주도형 사업인 만큼 주민들과 협력해 마을공동체 복원에 노력을 기울이겠다""고 밝혔다.한편, 군산시는 지난 2016년 산북동 개원·미창마을과 2020년 구암동 장둑·외산마을이 새뜰마을사업에 선정됐었다.kjs67@news1.kr▶ 네이버 메인에서 [뉴스1] 구독하기!▶  뉴스1&amp;BBC 한글 뉴스 ▶  터닝포인트 2021 © 뉴스1코리아(news1.kr), 무단 전재 및 재배포 금지   ]",[],http://www.sportsseoul.com/news/read/1019660?ref=naver,https://n.news.naver.com/mnews/article/421/0005202531?sid=102
2021.03.17.,신아일보,,"양구군, 어르신 봉양수당 인상으로 신청자도 대폭 증가",,,http://www.shinailbo.co.kr/news/articleView.html?idxno=1388876,http://www.sportsseoul.com/
2021-03-05 12:50:08,데일리메디,사회,"건보공단, 올 상반기 700명 체험형 청년인턴 채용","[     동면 복림마을 항공뷰.(제공=화순군)[화순=스포츠서울 이정진 기자] 전남 화순군은 대통령 직속 국가균형발전위원회(이하 균형위) 주관 ‘2021년 취약지역 생활여건 개조 사업’ 공모에 동면 복림마을이 선정됐다.취약지역 생활여건 개조 사업은 4년 간 추진하는 사업으로 취약지역 주민의 기본적인 생활수준을 보장하기 위한 ▲슬레이트 지붕 개량 ▲노후주택 정비 ▲담장·축대정비 ▲마을안길 확장 ▲재래식 화장실 정비 등 생활 기반을 확충을 지원한다.노인 돌봄, 건강관리 프로그램 등 주민 공동체 활성화를 위한 휴먼 케어와 역량강화사업 등도 지원한다.복림마을은 읍·면 소재지와 거리가 멀어 소외 지역이었지만, 이번 사업을 통해 마을 발전뿐 아니라 주민의 삶의 질 향상에 크게 이바지할 것으로 기대된다.공모 사업에는 전국적으로 96곳(농촌 80, 도시 16)이 선정됐다. 전남 지역에서는 22곳 중 화순군 1개 마을 최종 선정됐다.화순군 관계자는 “지역 주민의 적극적인 추진 의지와 노고에 깊이 감사드린다”며 “앞으로도 아직 기회를 얻지 못한 마을을 지속적으로 발굴해 취약지역 생활 여건  개선이 필요한 마을들이 혜택을 받도록 노력하겠다”고 말했다.이정진기자 leejj0537@sportsseoul.com[기사제보 news@sportsseoul.com]  Copyright ⓒ 스포츠서울&amp;sportsseoul.com ]",[],http://www.dailymedi.com/detail.php?number=867219&thread=22r01,https://n.news.naver.com/mnews/article/468/0000748251?sid=102
2021.03.15.,중부매일,,"영동군, 충남대학교병원과 치매 극복 '맞손'",,,http://www.jbnews.com/news/articleView.html?idxno=1330832,http://www.shinailbo.co.kr/
2021.03.15.,프라임경제,,"광주광역시, 노후 공공체육시설 개보수 실시",,,http://www.newsprime.co.kr/news/article.html?no=536764,http://www.dailymedi.com/
2021.03.23.,NBNTV,,"한국장학진흥원, 요양보호사&사회복지사 관련 노인교육자격증 8종 무료수강 이...",,,http://www.nbntv.kr/news/articleView.html?idxno=46122,http://www.jbnews.com
2021.03.09.,한국경제TV,,"美 CDC ""백신 접종 완료시 사적공간 마스크 안 써도 돼""",,,http://www.wowtv.co.kr/NewsCenter/News/Read?articleId=A202103090043&t=NN,http://www.newsprime.co.kr
2021.03.03.,파이낸셜뉴스,,"퇴계원, 봉화 등 취약지역 개조사업 신규 대상지 96개소 선정",,,http://www.fnnews.com/news/202103031001168518,https://www.nbntv.kr/
2021.03.18.,신아일보,,"고양시체육회, 고령층 위한 건강스트레칭 포스터 제작",,,http://www.shinailbo.co.kr/news/articleView.html?idxno=1389492,http://www.wowtv.co.kr/
2021.03.18.,신아일보,,"고양시체육회, 고령층 위한 건강스트레칭 포스터 제작",,,http://www.shinailbo.co.kr/news/articleView.html?idxno=1389492,http://www.shinailbo.co.kr/
2021.03.17.,전국매일신문,,"양구군, 노부모 봉양수당 신청 급증",,,http://www.jeonmae.co.kr/news/articleView.html?idxno=834331,http://www.jeonmae.co.kr/
2021.03.23.,테크월드,,"레독스생명공학㈜, 나노버블 알칼워터 개발",,,http://www.epnc.co.kr/news/articleView.html?idxno=203987,http://www.epnc.co.kr
2021.03.09.,대한경제,,"서울 용산구, WHO 고령친화도시 인증 획득",,,https://www.dnews.co.kr/uhtml/view.jsp?idxno=202103091006208860577,http://www.cnews.co.kr
2021.03.03.,머니투데이,,"이성희 농협회장 ""뒷다리살 등 비선호부위 돼지고기 소비 늘려야""",,,http://news.mt.co.kr/mtview.php?no=2021030314155260147,http://www.mt.co.kr/
2021-03-03 14:32:44,스포츠서울,경제,"광주광역시 동구, ‘신중년 일자리지원 사업’ 본격 추진","[    [머니투데이 세종=정혁수 기자]     3일 농협중앙회 본관에서 진행된 '새봄맞이 꽃과 함께 돼지고기 나눔행사'에서는 장철훈 농업경제대표이사, 김용식 조합감사위원장, 김동혁 중앙회노조위원장, 김태환 축산경제대표이사, 이성희 농협중앙회장, 김용택 금융노조위원장, 이규삼 감사위원장, 이재식 상호금융대표이사 등 임직원이 자리를 함께 했다. / 사진제공=농협이성희 농협중앙회장은 3일 ""소비위축으로 어려움을 겪고있는 양돈농가를 위해 돼지고기 소비확대에 최선을 다 하겠다""고 말했다.이성희 회장은 이날 삼겹살데이를 맞아 농협중앙회 본관에서 열린 '새봄맞이 꽃과 함께하는 돼지고기 나눔행사'에 참석한 자리에서 ""비선호부위 돼지고기 소비 활성화를 위한 다양한 대책을 마련중""이라며 이같이 밝혔다.행사에는 이 회장을 포함해 장철훈 농업경제대표이사, 김용식 조합감사위원장, 김동혁 중앙회노조위원장, 김태환 축산경제대표이사, 김용택 금융노조위원장, 이규삼 감사위원장, 이재식 상호금융대표이사 등 임직원이 자리를 함께 했다.이성희 회장은 직원들에게 한돈 뒷다리살을 원료육으로 한 목우촌 뚝심햄(6000개)과 꽃(2000송이)을 나눠 주며 우리 돼지고기 소비촉진과 홍보에 동참해 줄 것을 부탁했다.코로나19 상황으로 인한 소비위축이 계속되면서 돼지고기 뒷다리살 재고량(지난 해 말 기준)은 4만1000톤으로 국내산 돼지고기 전체 재고량 7만5000톤의 54.6%를 넘어섰다. 이 규모는 작년 같은기간 대비 134% 증가한 수치다.농협은 이같은 비선호부위 돼지고기 소비를 활성화하기 위해 △직장인 대상 한돈 웰빙부위 알리기 캠페인 △비선호부위(뒷다리살 등) 소비방안 마련 등 다양한 노력을 기울이고 있다.한편 김태환 축산경제대표는 이날 서울시립 서부노인전문요양센터를 찾아 돼지고기(500인분)를 전달하고 코로나19 상황속에서 어려움을 겪고있는 노인분들의 건강을 당부했다.    김태환 축산경제대표이사(왼쪽에서 2번째)가 3일 서울시립 서부노인전문요양센터 최미경 사무국장(왼쪽에서 3번째)에게 돼지고기 500인분을 전달하고 있다. / 사진제공=농협세종=정혁수 기자 hyeoksooj@mt.co.kr▶부동산 투자는 [부릿지]▶조 변호사의 가정상담소▶줄리아 투자노트 &lt;저작권자 ⓒ '돈이 보이는 리얼타임 뉴스' 머니투데이, 무단전재 및 재배포 금지&gt;   ]","['백종원 뒷다리살 주구장창 말해서. 뒷다리살 오르.  쥐뿔 활성화는 지 라 ㄹ', '', '싸면 팔림', '하나로마트 정육코너 뒷다리살 달라고 하면 안주던대 진열해 놓은 부위만 팔지 찾으면 절대 안줌']",http://www.sportsseoul.com/news/read/1021666?ref=naver,https://n.news.naver.com/mnews/article/008/0004551481?sid=101
2021.03.03.,머니투데이,,취약지역 96곳 생활여건 개선에 국비 1500억원 지원,,,http://news.mt.co.kr/mtview.php?no=2021030309231175882,http://www.sportsseoul.com/
2021-03-11 16:45:29,약사공론,사회,"건민건강보험공단, 상반기 700명 체험형 청년인턴 채용","[ 광주광역시 동구는 2021년 고용노동부와 광주시의 신중년 일자리 사업에 공모해 5억2천만원을 확보하고, 구 예산을 포함 총 8억 원에 달하는 ‘신중년 일자리’를 본격 추진한다.  ‘신중년 일자리’사업은 만50세부터 만70세 이하 신중년들의 경력을 활용해 각종 사회서비스 등 사회봉사활동과 일자리를 제공하는 사업으로, 올해는 고용노동부 경력형 일자리 사업에 처음으로 응모해 그 폭을 더욱 확대했다.이번 사업은 ‘신중년 사회공헌 활동지원’ 및 ‘경력형 일자리’로 구분된다. 사회공헌 활동지원은 비영리적 사회서비스와 봉사적 성격의 활동을 지원하는 사업으로 오는 26일까지 121명을 모집 중이다. 경력형 일자리 사업은 일정 수준의 경력, 자격을 가진 직접일자리를 제공하기 위해 61명을 선발, 노인여가 및 건강 지원사업과 자원순환해설사 운영사업을 위해 준비하고 있다.또한 빛고을50+ 일자리지원 사업으로 미취업 중장년층들의 경력 유지 및 재취업 설계에 도움을 주기 위해 만45~64세 34명을 선발해 ▲우리동네돌봄단 ▲찾아가는 놀이마차 ▲화장실 안심지킴이 ▲건강도시활동단 등 4개 프로그램을 운영할 예정이다.임택 동구청장은 “사회적으로 늘어가는 신중년의 사회활동과 코로나19로 인해 경력이 단절된 중장년층들의 인생 재설계 기회를 지원하는 계기가 될 것으로 기대한다”면서 “앞으로도 다양한 사업을 지속적으로 발굴해 신중년을 통한 지역경제 활성화를 위해 노력하겠다”고 말했다.이정진기자 leejj0537@sportsseoul.com[기사제보 news@sportsseoul.com]  Copyright ⓒ 스포츠서울&amp;sportsseoul.com ]",[],https://www.kpanews.co.kr/article/show.asp?idx=220735&category=C,https://n.news.naver.com/mnews/article/468/0000750146?sid=102
2021.03.19.,베타뉴스,,"인천시의회, 임시회 제3차 본회의…‘인천형 공립 노(老)치원’ 시범운영 제안",,,http://www.betanews.net:8080/article/1258471.html,http://www.mt.co.kr/
2021-03-03 11:00:00,의학신문,경제,"KMDIA, 정부와 정책 파트너십 확대하겠다","[    [머니투데이 이소은 기자]      대통령 직속 국가균형발전위원회(이하 균형위)가 올해 취약지역 생활여건 개조사업 신규 사업대상지 96개소를 선정했다고 3일 밝혔다.이번 선정된 96개소는 도시 16개소, 농어촌 80개소로, 시·도별로는 전남 22개소, 경북 20개소, 경남 16개소, 전북 11개소 등 총 11개 시·도가 포함됐다. 사업대상지에 대해서는 올해 약 150억원을 시작으로 향후 총 1500억원 규모의 국비(도시 약 450억원, 농어촌 약 1050억원)가 지원될 계획이다.취약지역 생활여건 개조사업은 취약지역의 주민들이 최소한의 삶의 질(National Minimum)을 보장받을 수 있도록 생활여건을 개선하는 사업으로, 2015년부터 취약지역을 선정해 지원하고 있다. 주요 사업 내용을 보면, 슬레이트 지붕 개량, 노후주택 정비 등 주택정비, 담장·축대 정비, 소방도로 확충 등 안전시설 정비, 재래식 화장실 개선, 상·하수도 정비 등 생활 인프라 확충과 더불어, 노인 돌봄, 건강관리 프로그램 등 주민공동체 활성화를 위한 휴먼케어(human care) 및 역량강화사업 등 소프트웨어 사업도 포함된다. 이번에 선정된 사업지역에는 4년 간 도시지역은 약 30억원(도시 쪽방촌 주거환경 개선을 위한 임대주택 조성시는 최대 70억원까지 지원), 농어촌 지역은 약 15억원의 국비를 지원한다. 선정된 사업 중 도시지역은 국토교통부, 농어촌 지역은 농림축산식품부에서 추진하게 된다. 해당 부처별로 오는 4~5월 중 신규 사업대상지 지자체를 대상으로 합동 워크숍을 개최하고 관련 분야 전문가 중심의 맞춤형 컨설팅을 제공할 계획이다. 균형위 관계자는 “정부는 국토의 균형발전의 일환으로 성장 혜택으로부터 소외된 취약 지역을 대상으로 기본적인 삶의 질 충족을 위한 지원 정책을 지속적으로 펼쳐나갈 예정”이라고 말했다. 이소은 기자 luckysso@mt.co.kr▶부동산 투자는 [부릿지]▶조 변호사의 가정상담소▶줄리아 투자노트 &lt;저작권자 ⓒ '돈이 보이는 리얼타임 뉴스' 머니투데이, 무단전재 및 재배포 금지&gt;   ]",[],http://www.bosa.co.kr/news/articleView.html?idxno=2146215,https://n.news.naver.com/mnews/article/008/0004551329?sid=101
2021.03.11.,뉴스프리존,,"광주 남구, 고농도 미세먼지 4대 관리방안 추진",,,http://www.newsfreezone.co.kr/news/articleView.html?idxno=303725,http://www.newsfreezone.co.kr/
2021.03.09.,시민일보,,"용산구, 고령친화도시 국제네트워크 가입",,,http://www.siminilbo.co.kr/news/newsview.php?ncode=1065593015260441,http://www.siminilbo.co.kr
2021.03.26.,미주중앙일보,,"한인 전용 실버타운 가동, 가오픈 평가 '만족'",,,http://www.koreadaily.com/news/read.asp?art_id=9203838,http://koreadaily.com
2021.03.07.,의협신문,,"""이번 의협 회장은 ○○○""…이유는?",,,http://www.doctorsnews.co.kr/news/articleView.html?idxno=138520,http://www.kmatimes.com
2021.03.16.,아시아투데이,,고령화 시대 '실버푸드' 키우고 푸드테크 전문가 양성,,,https://www.asiatoday.co.kr/view.php?key=20210315010009191,http://www.asiatoday.co.kr
2021.03.15.,충북일보,,"영동군, 충남대학교병원과 치매 극복 '맞손'",,,https://www.inews365.com/news/article.html?no=658753,http://www.inews365.com
2021.03.07.,국민일보,,"초고령사회 화천군, 실버 인프라 구축 사업 결실",,,http://news.kmib.co.kr/article/view.asp?arcid=0015605414&code=61121111&cp=nv,http://www.kmib.co.kr/
