Date,Press,Category,Title,Content,Comment,URL_Origin,URL_Naver
2021-03-19 15:49:14,헤럴드경제,사회,건보공단 올 상반기 700명 청년인턴 공개모집,"[     [아시아경제 호남취재본부 이관우 기자] 호남대학교 물리치료학과는 오는 4월부터 11월까지 뇌 병변, 운동발달 장애를 겪고 있는 광주 광산구 관내 장애아동들의 재활을 돕기 위해 ‘우리 성장했어요’ 프로그램을 운영한다고 19일 밝혔다.호남대 ‘SLC블루존’에서 물리치료학과 이동률 교수와 수완건강센터가 함께 진행할 이 프로그램은 장애아동의 정상발달 촉진을 통한 운동성 회복을 목적으로 ‘움직임 평가(동작분석, 보행분석 등)’와 ‘재활훈련(보행훈련, 로봇재활승마훈련, 상지강화훈련 등)’은 물론 가정에서 훈련을 지속할 수 있도록 ‘부모교육’도 함께 실시한다.이동률 교수는 “이번 광산구와 협업을 통해 지역사회에서 대학의 역할 뿐만 아니라 관련학과 학생들의 봉사 참여로 교과-비교과 연계의 확대된 학습환경 마련 효과를 기대한다”고 말했다.한편 호남대 SLC블루존은 대학특성화사업을 통해 만들어진 노인건강관리학(융합전공) 실습공간으로도 활용돼 교내 학생 및 교직원, 지역사회 노인을 대상으로 건강관련 평가 및 코칭 프로그램을 지속해 오고 있다.호남취재본부 이관우 기자 kwlee719@asiae.co.kr▶ 2021년 신축년(辛丑年) 신년운세와 토정비결은?▶ 발 빠른 최신 뉴스, 네이버 메인에서 바로 보기▶ 투자 성공의 핵심은 기업분석! 'CORE' 바로가기&lt;ⓒ경제를 보는 눈, 세계를 보는 창 아시아경제 무단전재 배포금지&gt;   ]",[],http://news.heraldcorp.com/view.php?ud=20210312000555,https://n.news.naver.com/mnews/article/277/0004868719?sid=102
2021.03.16.,의학신문,,전남대병원 노년내과 진료 시작,,,http://www.bosa.co.kr/news/articleView.html?idxno=2146312,http://www.heraldbiz.com/
2021-03-12 11:53:34,경상일보,사회,"박태완 중구청장, 울산 최초로 공립경로당 초미세먼지 방진망 설치 현장 점검","[ 공공기관 ‘블라인드 채용’ 방식 진행    국민건강보험공단(이사장 김용익·사진)은 청년층의 취업난 해소 및 취업역량 강화에 기여하고자 상반기 700명의 청년인턴을 공개모집한다고 12일 밝혔다.이번 채용은 사회적 가치 실현을 위해 700명 중 70명은 장애인 전형으로 선발하고, 기초생활수급자·한부모가족·다문화가족·북한이탈 주민 등 사회형평 대상자는 채용과정에서 우대한다.일반전형 630명의 지역별 채용인원은 서울 강원 176명, 인천 경기 156명, 부산 경남 87명, 호남 제주 78명, 대구 경북 65명, 대전 충청 68명 등이다.자격조건은 만 15세 이상 만 34세 이하 청년으로, 오는 19일부터 26일 오전 10시까지 채용사이트를 통해 온라인으로만 지원서 접수가 가능하며, 서류 및 면접심사를 거쳐 최종합격자를 발표한다. 합격자발표 등 안내사항은 ‘공단 홈페이지(www.nhis.or.kr)’를 통해 공지한다.이번 채용은 ‘공공기관 블라인드 채용 가이드라인’에 따라 진행된다. 따라서 지원서에 사진, 학교명, 연령, 성별, 가족관계, 출신지를 기입하는 칸이 없으며, 편견을 줄 수 있는 개인정보는 심사위원에게 제공하지 않는다.합격자는 5월 17일부터 공단 본부 및 지역본부, 지사(출장소 포함)에 배치돼 3개월 간 건강보험과 노인장기요양보험 관련 행정업무 지원 등의 업무를 수행하게 된다. 이들 체험형 청년인턴은 공단 신규직원 채용시 근무기간별로 가점이 부여될 예정이다.건보공단 관계자는 “코로나19 상황을 감안해 전년보다 채용규모를 확대하고 조기채용을 추진해 위축된 취업시장에 조금이나마 활력을 불어넣을 수 있기를 바란다”고 말했다. 김대우 기자▶환경적 대화기구 '헤럴드에코'▶밀리터리 전문 콘텐츠 ‘헤밀’▶헤럴드경제 네이버 채널 구독- Copyrights ⓒ 헤럴드경제 &amp; heraldbiz.com, 무단 전재 및 재배포 금지 -   ]","['하이고 700명 인턴;;; 얘네들은 항상 이런식이더라 그냥 지들이 나라 망쳐서 전부 기관들이랑 공무원들이\n일 몇배 힘들게 하게 만드는거 지들 똥싼거 치우는거, 정책이 얼마나 중요한지 깨달음']",http://www.ksilbo.co.kr/news/articleView.html?idxno=792574,https://n.news.naver.com/mnews/article/016/0001805898?sid=102
2021.03.12.,뉴시스,,"DGB사회공헌재단, 지역 아동·미혼모 복지시설 방역 지원",,,http://www.newsis.com/view/?id=NISX20210312_0001368322&cID=10810&pID=10800,http://www.bosa.co.kr
2021.03.23.,뉴스웍스,,"영천시, 2021년 1분기 노인맞춤형돌봄사업 실무협의회",,,http://www.newsworks.co.kr/news/articleView.html?idxno=536349,http://ksilbo.co.kr
2021.03.24.,매일일보,,[기고] 치매어르신을 위한 '배회감지기'를 아시나요?,,,http://www.m-i.kr/news/articleView.html?idxno=810561,http://www.newsis.com
2021-03-12 11:02:37,경상매일신문,사회,최재림 제10대 대한노인회 경산시지회장 선출,"[     DGB사회공헌재단, 지역 아동·미혼모 복지시설 방역 지원 *재판매 및 DB 금지[대구=뉴시스] 박준 기자 = DGB사회공헌재단은 지역아동센터대구지원단에서 대구시 소재 지역아동센터와 미혼모 복지시설을 대상으로 긴급 방역지원에 대한 전달식을 가졌다고 12일 밝혔다.  이번 방역사업은 지역 노인 일자리 창출 사업과 연계되며 DGB사회공헌재단과 대구달서시니어클럽 협력 운영 중인 백세GREEN방역사업단을 통해 선발된 노인들이 방역업무를 실시하는 방식이다. 코로나19 예방 및 쾌적한 환경 조성을 위해 사업단 노인들이 시설을 방문해 방역업무를 수행하면 DGB사회공헌재단에서 급여를 지원한다. DGB사회공헌재단은 대구달서시니어클럽과 협력해 올해부터 파랑새시니어행복한일터를 지원, 2017년 백세GREEN방역사업단 운영 후원을 통해 지역 노년층 일자리를 창출하고 있는데 이를 사회복지시설 사회공헌사업으로 연계해 나눔의 선순환을 통한 시너지를 내고 있다. 김태오 이사장은 ""전년 대비 방역 지원이 감소해 우려가 커진 지역 복지시설에 DGB사회공헌재단의 백세GREEN방역사업단 활동이 도움이 되길 바란다""며 ""DGB금융그룹은 앞으로도 지역 노인의 건강한 일자리 창출지원과 연계한 사회공헌활동 강화로 ESG경영 실천에 힘쓰겠다""고 밝혔다.☞공감언론 뉴시스 june@newsis.com▶ 네이버에서 뉴시스 구독하기▶ K-Artprice, 유명 미술작품 가격 공개▶ 뉴시스 빅데이터 MSI 주가시세표 바로가기&lt;ⓒ 공감언론 뉴시스통신사. 무단전재-재배포 금지&gt;   ]",[],http://www.ksmnews.co.kr/default/index_view_page.php?idx=328150&part_idx=335,https://n.news.naver.com/mnews/article/003/0010389304?sid=102
2021.03.17.,전남매일,,"'노인복지 증진' 광주시, 복지기금 지원 공모",,,http://www.jndn.com/article.php?aid=1615972841313444003,http://www.jndn.com
2021.03.22.,시민일보,,"성북구, 소규모 다중이용시설 실내 공기질 관리",,,http://www.siminilbo.co.kr/news/newsview.php?ncode=1065593883436468,http://www.siminilbo.co.kr
2021.03.19.,아주경제,,제10대 대한노인회 경산시지회장 최재림 후보 당선,,,http://www.ajunews.com/view/20210319114603721,http://www.ajunews.com
2021.03.11.,뉴시스,,"[광주소식]동구, 신중년 일자리 지원 추진 등",,,http://www.newsis.com/view/?id=NISX20210311_0001367680&cID=10899&pID=10800,http://www.newsis.com
2021-03-11 18:04:25,파이낸셜뉴스,사회,"건보공단, '통합재가 서비스'로 안정적인 노후생활 돕는다","[     [광주=뉴시스]김혜인 기자 = 광주 동구는 사업비 총 8억 원을 들여 '신중년 일자리' 참여자 121명을 오는 26일까지 모집한다고 11일 밝혔다.'신중년 일자리'는 만 50세부터 만 70세 이하 신중년들의 경력을 활용해 일자리를 제공하는 사업이다.동구는 '경력형 일자리 사업'에 경력자 61명을 채용, 노인 여가 사업·건강 지원 사업·자원 순환 해설사 프로그램을 진행한다.이 밖에도 취업을 하지 않은 만 45~64세 주민 34명을 선발해 ▲우리동네돌봄단 ▲찾아가는 놀이마차 ▲화장실 안심지킴이 ▲건강도시활동단 등 4개 프로그램을 운영한다.    [광주=뉴시스] 변재훈 기자 = 광주 동구는 충장로 5가 내 옛 식품공장 건물을 문화예술인 공동작업·거주공간으로 새단장한 '충장22'이 오는 22일 문을 연다고 20일 밝혔다. (사진=광주 동구 제공) 2020.05.20.photo@newsis.com◇ 동구, 충장22 공식 누리집 개설광주 동구는 문화 예술인들의 창작 공간을 소개하는 '충장22' 누리집을 열었다고 11일 밝혔다.충장22 누리집에선 지역 예술가의 문화 행사 안내·창작공간 객실 운영 현황·예술 작품 게시판 등을 한 눈에 볼 수 있다.충장22는 국립아시아문화전당·광주문화재단 등과 연계해 문화예술 프로그램을 운영, '문화 거점 센터' 역할을 해오고 있다.또 충장로 4·5가에 터를 잡은 각 분야 명장과 연계한 레지던시 프로그램을 개발하는 거점으로 쓰인다.☞공감언론 뉴시스 hyein0342@newsis.com▶ 네이버에서 뉴시스 구독하기▶ K-Artprice, 유명 미술작품 가격 공개▶ 뉴시스 빅데이터 MSI 주가시세표 바로가기&lt;ⓒ 공감언론 뉴시스통신사. 무단전재-재배포 금지&gt;   ]",[],http://www.fnnews.com/news/202103171005387805,https://n.news.naver.com/mnews/article/003/0010388510?sid=102
2021.03.12.,프레시안,,건보공단 상반기 700명 체험형 청년인턴 채용,,,https://www.pressian.com/pages/articles/2021031218492892198?utm_source=naver&utm_medium=search,http://www.fnnews.com/
2021-03-17 10:08:02,아시아투데이,생활/문화,"옹진군, 군민 맞춤형 '복지 안전망' 구축...노인복합요양시설 순차적 '건립'","[      [파이낸셜뉴스] 국민건강보험공단은 노인들의 건강한 노후생활을 지원하기 위해 '통합재가급여 예비사업'을 실시해 이용자 중심의 맞춤형 서비스를 제공하고 있다고 밝혔다.2019년 8월부터 시행된 통합재가급여 예비사업은 현재 전국 142곳의 서비스 제공기관을 확보하여 운영 중이다. 통합재가 서비스는 하나의 장기요양기관에서 간호사·사회복지사·요양보호사가 함께 이용자의 개별적 상태와 수요를 파악해 두 가지 이상의 재가 서비스를 제공하는 것이다.   주야간보호통합형[주·야간보호+방문요양(목욕)]과 가정방문통합형[방문간호+방문요양(목욕)] 중 하나를 선택해 이용 가능하며, 방문요양의 경우 유형에 관계없이 1일 2회 이상 제공받을 수 있다.   2021년에는 기존 통합재가 예비사업에 참여했던 기관들의 목소리를 적극 반영해 행정 지침 일부를 개선해, 다횟수 방문요양 가산금 지급 지침을 신설하여 통합재가 서비스 제공 기관만의 차별성을 높였다.   장기요양기관센터장의 권유로 처음 통합재가 서비스를 접하게 되었다는 한 수급자는 ""위급 상황 시 간호사가 수급자의 상태를 바로 인지하고 전문 의료 처치를 수행한다는 점에 신뢰를 느낀다""며 지속적인 서비스 이용 의사를 밝혔다.   건보공단 관계자는 ""재가 서비스에 대한 다양한 수요가 발생하고 있는 만큼, 여러 서비스를 복합적으로 제공하는 시스템이 필요하고, 이런 흐름을 반영한 통합재가 서비스를 통해 안정적인 노후생활이 가능해질 것""이라며 기대감을 보였다.    hsk@fnnews.com 홍석근 기자   ▶ 헉! 소리나는 스!토리 뉴스 [헉스]▶ '아는 척'하고 싶은 당신을 위한 [두유노우]▶ 날로먹고 구워먹는 금융이슈 [파인애플]  ※ 저작권자 ⓒ 파이낸셜뉴스. 무단 전재-재배포 금지   ]",[],https://www.asiatoday.co.kr/view.php?key=20210323010014950,https://n.news.naver.com/mnews/article/014/0004602605?sid=103
2021.03.15.,위키트리,,‘세대연대 1번지 화순’ 실현~따뜻한 복지공동체 조성,,,https://www.wikitree.co.kr/articles/628367,http://www.pressian.com/
2021-03-12 18:52:43,경북신문,사회,제10대 대한노인회 경산시지회장 최재림 후보 당선,"[    [전형준 기자(jhj2529@pressian.com)]국민건강보험공단은 청년층의 취업난 해소 및 취업역량 강화에 기여하고자 상반기 700명의 청년인턴을 공개모집한다고 12일 밝혔다. 700명 중 70명은 장애인전형으로 선발한다. 기초생활수급자‧한부모가족‧다문화가족 등 사회형평대상자는 채용과정에서 우대한다.     ⓒ국민건강보험공단 자격조건은 만15세 이상 만34세 이하 청년으로, 19~26일 오전 10까지 채용사이트를 통해 온라인으로만 지원서 접수가 가능하다. 서류 및 면접심사를 거쳐 최종합격자를 발표한다. 합격자는 5월 17일부터 공단 본부 및 지역본부, 지사(출장소 포함)에 배치돼 3개월간 건강보험과 노인장기요양보험 관련 행정업무 지원 등의 업무를 수행하게 된다. 공단 신규직원 채용시 근무기간별로 가점이 부여될 예정이다. 공단 관계자는 “코로나19 상황을 감안해 전년보다 채용규모를 확대하고 조기채용을 추진하여 위축된 취업시장에 조금이나마 활력을 불어넣을 수 있기를 바란다”고 말했다.[전형준 기자(jhj2529@pressian.com)]▶프레시안 CMS 정기후원▶네이버 프레시안 채널 구독 ▶프레시안 기사제보Copyrightsⓒ PRESSian.com 무단전재 및 재배포금지 ]","['고객센터파업중이라 체험형 인턴 이용해 먹으려고 하나보네 공공기간이 별의별꼼수를 다 쓰는구나 좋은 의도로했다 하더라고 지금 이시기에 체험형 인턴700명은 꼼수로밖에 보이지않음 김용익이사장도 이제 자리에서 물러날때 다됐네 진즉 갔어야했는데 체험하고 정규직 지원에 유리하게적용 이라 공치사부리겠지 그냥 고객센터파업시 부족인력 충원이라\n솔직하게 말들하지 눈에보이는 거짓말을 이따구로 하다니 니네도 힘들긴힘들구나 그러니까괜히 재정낭비하지말고 직영화나 해라', '머리 잘쓴다', '']",http://www.kbsm.net/default/index_view_page.php?idx=305867&part_idx=196,https://n.news.naver.com/mnews/article/002/0002177821?sid=102
2021.03.18.,국제뉴스,,"한울본부, 울진군 주민 종합건강검진 지원 협약 체결",,,http://www.gukjenews.com/news/articleView.html?idxno=2184241,http://www.asiatoday.co.kr
2021.03.18.,국제뉴스,,"한울본부, 울진군 주민 종합건강검진 지원 협약 체결",,,http://www.gukjenews.com/news/articleView.html?idxno=2184241,http://www.gukjenews.com/
2021.03.15.,뉴스핌,,화순군 3대 친화도시 인증...세부 시책 본격 추진,,,http://www.newspim.com/news/view/20210315000410,http://www.newspim.com
2021.03.16.,메디칼업저버,,"전남대병원, 노년내과 진료 시작",,,http://www.monews.co.kr/news/articleView.html?idxno=302312,http://www.monews.co.kr
2021.03.17.,머니S,,"하남시의회, 2020회계연도 결산검사위원 5명 선임",,,http://moneys.mt.co.kr/news/mwView.php?no=2021031713438066571,https://www.moneys.co.kr/
2021-03-17 13:59:09,스포츠서울,사회,"부안군, 맞춤형 방문건강관리 프로그램 운영","[     하남시의회(의장 방미숙)는 17일부터 22일까지 6일간 제301회 임시회를 열고 조례안과 동의안 등 안건을 심의한다. / 사진제공=하남시의회하남시의회(의장 방미숙)는 17일부터 22일까지 6일간 제301회 임시회를 열고 조례안과 동의안 등 안건을 심의한다.의회는 임시회 첫날인 17일 제1차 본회의를 열어 2020회계연도 결산검사위원 5명을 선임하고 위촉장을 수여했다.결산검사위원에는 대표위원인 오지훈 의원을 비롯해 박노수 서울시립대 교수, 신동민 회계사, 송윤정 나라살림연구소 전략기획팀장, 황경선 전 농협중앙회 지부장이 선임됐으며, 이들은 오는 4월 30일부터 5월 19일까지 20일간 전년도 세입・세출에 대한 결산검사를 실시하게 된다.이어 17일~19일에는 조례안 등 심사 특별위원회를 열어 '하남시 저소득 노인가구 건강보험료 및 노인장기요양보험료 지원 조례안' 등 16건의 조례안과 2건의 동의안을 심사할 예정이다.방미숙 의장은 개회사에서 “2020회계연도 결산검사는 지난 한 해 동안 예산 집행에 대한 법령의 준수 및 회계절차 이행여부 등을 검사하기 위한 절차”라며  “결산검사 위원님들께서는 집행부의 재정집행 실태 감독을 통해 재정집행의 신뢰성과 적정성, 책임성 확보에 만전을 기해 주시기를 당부드린다”고 말했다. 하남=김동우 기자 bosun1997@mt.co.kr▶뜨거운 증시, 오늘의 특징주는?  ▶여론확인 '머니S설문' ▶머니S, 네이버 메인에서 보세요 &lt;저작권자 ⓒ '성공을 꿈꾸는 사람들의 경제 뉴스' 머니S, 무단전재 및 재배포 금지&gt; ]",[],http://www.sportsseoul.com/news/read/1023320?ref=naver,https://n.news.naver.com/mnews/article/417/0000670167?sid=102
2021.03.20.,메트로신문,,"올해도 울진군 주민 건강 지킴이, 한울본부",,,http://www.metroseoul.co.kr/article/20210319500128,http://www.sportsseoul.com/
2021-03-16 17:23:04,헤럴드경제,사회,"건강보험공단, 올 상반기 700명 체험형 청년인턴 채용","[     65세 이상 독거노인 등 350명을 선정해 ‘건강 꿀 팁! 배달 서비스’ 프로그램을 추진한 모습.(제공=부안군)[부안=스포츠서울 이정진 기자] 전북 부안군은 코로나 19 감염병 확산·예방을 위한 사회적 거리두기의 장기화로 건강 취약 방문대상자의 우울 및 건강관리를 돕기 위해 65세 이상 독거노인 등 350명을 선정하여 3월 ~ 12월까지 대상자 2~3명의 소그룹 중심으로 맞춤형 건강관리서비스, 밴드체조, 그림 퍼즐놀이 등의 ‘건강 꿀 팁! 배달 서비스’ 프로그램을 추진한다. 프로그램 운영은 방문간호사가 가정을 방문하여, 대상자 100명은 2~3명을 50조로 나누어 1조당 6차시 혈압·혈당 기초검사, 밴드체조, 동화책 읽어주기, 그림 퍼즐 놀이, 고른 영양 섭취하기, 그림일기 그리기 등 프로그램을 운영하고, 250명은 운동, 인지 도구를 이용하여 스스로 수행 할 수 있도록 지원하여 대상자의 정서적 지지 및 자가 건강관리를 돕기로 하였다. 부안군은 현재 보건소 방문간호사가 건강취약 대상 독거노인 등 9,782가구를 등록, 방문하여 재가암 관리, 건강 스크리닝 등 건강관리 의료서비스를 제공하여 지역주민의 의료서비스 불평등 해소 및 삶의 질 향상을 위해 노력하고 있다.부안군은 코로나 19 감염병 관련 사회적 거리두기 등의 영향으로 자칫 소외되기 쉬운 건강취약 대상자의 건강관리 공백이 없도록 지속적인 관심과, 맞춤형 방문 건강서비스를 제공하겠다고 밝혔다. 이정진기자 leejj0537@sportsseoul.com[기사제보 news@sportsseoul.com]  Copyright ⓒ 스포츠서울&amp;sportsseoul.com ]",[],http://news.heraldcorp.com/view.php?ud=20210312000085,https://n.news.naver.com/mnews/article/468/0000751715?sid=102
2021.03.17.,MTN,,"양구군, 노부모 봉양수당 인상하자 신청자 대폭 증가",,,https://news.mtn.co.kr/newscenter/news_viewer.mtn?gidx=2021031716012729779,http://www.metroseoul.co.kr
2021.03.23.,목포MBC,,폐지수거 노인 25%가 등록 장애인..복지 강화,,,https://mpmbc.co.kr/article/0tFKlcgazJ,http://www.heraldbiz.com/
2021-03-12 09:02:26,제주의소리,사회,"제주대병원-사랑의열매, 취약계층 관절 수술 지원 '맞손'","[ 청년 일자리창출ㆍ사회형평대상자 채용 확대[헤럴드경제=김대우 기자] 국민건강보험공단(이사장 김용익)은 청년층의 취업난 해소 및 취업역량 강화에 기여하고자 상반기 700명의 청년인턴을 공개모집한다고 12일 밝혔다.    김용익 국민건강보험공단 이사장 [헤럴드DB]이번 채용은 사회적 가치 실현을 위해 700명 중 70명은 장애인 전형으로 선발하고, 기초생활수급자·한부모가족·다문화가족·북한이탈 주민 등 사회형평 대상자는 채용과정에서 우대한다.일반전형 630명의 지역별 채용인원은 서울 강원 176명, 인천 경기 156명, 부산 경남 87명, 호남 제주 78명, 대구 경북 65명, 대전 충청 68명 등이다.자격조건은 만 15세 이상 만 34세 이하 청년으로, 오는 19일부터 26일 오전 10시까지 채용사이트를 통해 온라인으로만 지원서 접수가 가능하며, 서류 및 면접심사를 거쳐 최종합격자를 발표한다. 합격자발표 등 안내사항은 ‘공단 홈페이지(www.nhis.or.kr)’를 통해 공지한다.이번 채용은 ‘공공기관 블라인드 채용 가이드라인’에 따라 진행된다. 따라서 지원서에 사진, 학교명, 연령, 성별, 가족관계, 출신지를 기입하는 칸이 없으며, 편견을 줄 수 있는 개인정보는 심사위원에게 제공하지 않는다.합격자는 5월 17일부터 공단 본부 및 지역본부, 지사(출장소 포함)에 배치돼 3개월 간 건강보험과 노인장기요양보험 관련 행정업무 지원 등의 업무를 수행하게 된다. 이들 체험형 청년인턴은 공단 신규직원 채용시 근무기간별로 가점이 부여될 예정이다.건보공단 관계자는 “코로나19 상황을 감안해 전년보다 채용규모를 확대하고 조기채용을 추진해 위축된 취업시장에 조금이나마 활력을 불어넣을 수 있기를 바란다”고 말했다.dewkim@heraldcorp.com▶환경적 대화기구 '헤럴드에코'▶밀리터리 전문 콘텐츠 ‘헤밀’▶헤럴드경제 네이버 채널 구독- Copyrights ⓒ 헤럴드경제 &amp; heraldbiz.com, 무단 전재 및 재배포 금지 -   ]",[],http://www.jejusori.net/news/articleView.html?idxno=327392,https://n.news.naver.com/mnews/article/016/0001805613?sid=102
2021.03.17.,MTN,,"양구군, 노부모 봉양수당 인상하자 신청자 대폭 증가",,,https://news.mtn.co.kr/newscenter/news_viewer.mtn?gidx=2021031716012729779,http://mtn.mt.co.kr
2021.03.23.,목포MBC,,폐지수거 노인 25%가 등록 장애인..복지 강화,,,https://mpmbc.co.kr/article/0tFKlcgazJ,http://www.mpmbc.co.kr
2021.03.12.,서울경제,,"건보공단, 700명 청년인턴 공채···장애인·취업지원대상자 우대",,,https://www.sedaily.com/NewsView/22JS2CT8H0,http://www.sedaily.com
