Date,Press,Category,Title,Content,Comment,URL_Origin,URL_Naver
2021.03.31.,헬스조선언론사 선정,,'이 주스' 노인 뇌‧혈관 건강에 좋아,,,https://health.chosun.com/site/data/html_dir/2021/03/31/2021033101732.html,http://health.chosun.com/
2021-03-31 20:31:23,한국경제언론사 선정,생활/문화,"하이디어솔루션즈 ""수면·활동량 분석…노인 맞춤형 건강 관리""","[     비트 주스는 노인의 뇌‧혈관 기능에 도움이 될 수 있다./사진=클립아트코리아비트 주스를 마신 노인은 뇌‧혈관 건강이 좋아진다는 연구 결과가 나왔다.영국 엑서터대학 연구팀은 70~80세 노인 26명을 대상으로 비트 주스 섭취가 뇌‧혈관 기능에 미치는 영향을 연구했다. 노인들은 10일 동안 질산염이 풍부한 비트 주스를 하루 두 번 마셨고 그 이후 10일 동안은 질산염이 없는 위약 주스(가짜 약)를 하루 두 번 마셨다. 그 결과, 비트 주스를 마셨을 때 뇌‧혈관 기능을 돕는 체내 박테리아가 더 높은 수준으로 나타났고 염증‧질환을 유발하는 박테리아는 더 낮은 수준으로 나타났다. 또한 비트 주스를 마신 후 수축기 혈압은 평균 5mmHg 떨어졌는데, 수축기혈압을 5mmHg 낮추면 주요 심혈관 질환 발생 위험이 10% 감소한다. 연구팀은 구강 박테리아가 비트의 질산염을 산화질소로 바꾸는 역할을 하면서 신경전달과 혈관 기능에 도움을 준다고 설명했다. 연구팀은 질산염이 풍부한 음식에는 비트뿐 아니라 양상추, 시금치, 셀러리 등이 있다고 덧붙였다.연구를 진행한 엑서터대학 연구팀 아니 반하탈로 교수는 “이번 연구가 질산염이 풍부한 식품은 노화와 관련된 뇌‧혈관 기능 저하를 늦추는 데 도움이 될 수 있음을 시사한다”며 “다만, 다른 연령대에서도 유사한 효과가 있는지 확인하려면 더 많은 연구가 필요하다”고 말했다.이번 연구는 국제저명학술지인 ‘리독스 바이올로지(Redox Biology)’에 최근 게재됐다./ 류지현 헬스조선 인턴기자 ▶헬스조선에만 있다 1: 전 국민 당뇨 솔루션! ▶헬스조선에만 있다 2: 국내 명의 600명 누구? ▶헬스조선에만 있다 3: 세상의 모든 건강 정보!        - Copyrights 헬스조선 &amp; HEALTHCHOSUN.COM, 무단 전재 및 재배포 금지 -   ]","['평소에 비트를 좋아하는 편은 아닌데 뇌, 혈관에 좋다는 것을 새롭게 알게 되어서 주변 노인분들께 비트 주스를 추천해 줘야겠어요.', '이 주스?? 제목에 비트좀 붙여다오 낚시꾼님', '솔직히 비트는 그냥 봐보기만 하였지 주스로 먹어볼생각은 안했는데 오늘 이 기사를 보고 비트주스가 뇌, 혈관에 좋다는 것을 알게되었네요. 비트주스를 만들어서 할머니, 할아버지께 드리고싶어요.', '', '', '비트 주스가 노인 뇌, 혈관에 좋다는 것을 처음 알았네요. 할머니, 할아버지, 지인분들께 알려드려야겠네요. 저도 나중을 위해 정보를 기억하고,나중에 꼭 먹도록 하겠습니다. 좋은 기사감사합니다', '질산염이 풍부한 식품은 노화와 관련된 뇌‧혈관 기능 저하를 늦추는 데 도움이 될 수 있다는 연구결과인데 비트주스가 좋다고 하니 어른들에게 비트주스 자주 드려야겠어요', '비트 주스☞ 뇌•혈관 건강에 좋아요.', '비트를 한 번 먹어본 이후로 입맛에 안 맞아서 지나쳤는데 이제라도 구해서 할머님,할아버님 드려야겠네요. 좋은 정보 감사합니다..!!!!', '오 비트가 이렇게 좋은지 몰랐어요 마트갈때마다 무심코 지나쳤는데 이젠 지나치지 않고 사서 할머니께 드려야 겠어요', '좋은 정보 감사합니다 저희 할머니께도 만들어 드려야 겠어요 비트라는 야채는 몰랐는데 정말 신기해요 코로나 화이팅']",https://www.hankyung.com/economy/article/2021033145781,https://n.news.naver.com/mnews/article/346/0000039218?sid=103
2021.03.31.,노컷뉴스,,빛고을노인건강타운 사회공헌캠프단 발대식 갖고 본격 활동,,,https://www.nocutnews.co.kr/news/5526742,http://www.hankyung.com/
2021-03-31 17:15:47,인천일보,경제,"구리시, 60세 이상 노인 우울증 치료비 지원","[ 강소기업 탐구'시니어 스마트케어' 국내 1위 집안 곳곳 24시간 감지 센서위급시 자동으로 119 등 통보특정 질병 등 빅데이터 활용대형병원·해외대학과 임상도헬스케어·보안 서비스도 진출    이승엽 하이디어솔루션즈 대표가 자사가 개발한 노인 스마트케어 장비를 소개하고 있다.  /김동현 기자고령화 시대에 접어들면서 노인 맞춤형 건강 관리 서비스산업이 주목받고 있다. 특히 독거노인 가구의 증가로 장기간 가정에서 요양이 필요하거나 수면 관리 등 규칙적인 건강 관리를 원하는 수요가 급증하는 추세다. 하이디어솔루션즈는 사물인터넷(IoT)과 빅데이터 기술을 활용해 이 같은 시니어(노인) 스마트케어 서비스를 제공하는 업체다. 시니어케어 서비스 시장을 국내에서 처음 개척해 독보적인 1위를 유지하고 있다. “수면 효율을 백분율로 표시”    하이디어의 ‘리본 스마트케어’ 구독 서비스를 신청하면 집 안 곳곳에 도어 센서, 레이더 센서, IoT 조명 등을 설치해 준다. 센서로부터 개인 활동량, 수면상태, 외출 패턴 등이 감지되고 관련 데이터는 실시간으로 전용 앱을 통해 보호자에게 전송된다. 만약 침실 센서에서 움직임 감지 반응이 계속 없다면 자동으로 응급 상태로 판단해 보호자나 119에 연락하는 등 고령자의 위급 상황을 미리 파악할 수 있도록 설계된 게 특징이다. 회사 모토도 ‘사전 돌봄(care in advance)’이다.이승엽 하이디어 대표는 “밤에 화장실을 자주 간다든지, 잠을 뒤척이는 것까지 모두 파악해 수면 효율을 백분율(%)로 표시해 준다”며 “이런 빅데이터를 바탕으로 사전에 노인이 긴급 상황에 빠지기 전 미리 대처 방안을 제시하는 게 목표”라고 설명했다.정보기술(IT)을 활용해 노인 건강을 챙기는 서비스를 먼저 시작했던 영국 툰스톨, 미국 ADT 등은 아직 신체에 센서 기기를 부착해 이상 징후를 파악하는 수준에 그치고 있다. 하이디어는 신체에 어떤 것도 부착하지 않고 예방·관리까지 할 수 있어 보다 진보된 케어 서비스로 평가받는다.회원의 빅데이터를 통해 국내외 유수 병원들과 특정 질병을 앓는 노인의 특이 증상을 밝히는 임상도 진행하고 있다. 삼성서울병원과 근골격계 환자 임상을, 스위스 로잔대와 파킨슨병 임상을 진행 중이다. 경희의료원에선 노인 우울증 환자를 대상으로 임상을 하고 있다. 이 대표는 “노인 우울증이 심해지면 주위가 추워도 난방을 하지 않는 등 특이 행동이 나타난다”며 “임상 연구를 통해 미리 패턴을 이해하면 증세가 본격적으로 나타나기 전에 위험을 예측할 수 있다”고 설명했다. “헬스케어 및 보안 서비스도 출시”고려대에서 기계공학을 전공한 이 대표는 박사 과정 중이던 2001년 창업 동아리 활동을 하면서 하이디어를 창업했다. 사업 초기에 무선 센서기술을 이용한 네트워크 장비를 만들다 2007년 본격 시니어 스마트케어산업에 진출했다.리본 스마트케어 서비스는 지난해 보건복지부가 선정한 독거노인 및 장애인을 위한 응급안전안심서비스 사업 대상자로 선정됐다. 전국 220여 개 지방자치단체에서 약 10만 가구가 구독자로 가입돼 서비스를 제공 중이다. 민간 구독 회원이 늘면서 매출도 점차 증가할 전망이다. 회사 측은 지난해 167억원이던 매출 규모가 올해 500억원, 내년 700억원까지 가능할 것으로 보고 있다.하이디어는 고령층 스마트케어 사업 외에도 헬스케어, 안전, 스마트홈 서비스까지 아우르는 기술을 개발하고 있다. 헬스케어 사업은 체온계, 혈압계, 혈당계 등의 기기로 측정된 데이터를 인공지능(AI) 알고리즘과 빅데이터 시스템을 통해 분석, 건강 관리 서비스를 제공하는 것이다.김동현 기자 3code@hankyung.com▶ 경제지 네이버 구독 첫 400만, 한국경제 받아보세요▶ 한경 고품격 뉴스레터, 원클릭으로 구독하세요▶ 한국경제신문과 WSJ, 모바일한경으로 보세요 ⓒ 한국경제 &amp; hankyung.com, 무단전재 및 재배포 금지   ]","['이런 서비스가 있었구나. 세상 좋아졌네요 !', '광고 기사 패스~ 기존에 있던 기술이고, 수입 많이 되어서 빅테이터 가지고 있는 회사들도 있고~']",http://www.incheonilbo.com/news/articleView.html?idxno=1086655,https://n.news.naver.com/mnews/article/015/0004522536?sid=101
2021.03.31.,신아일보,,"구리, 노인 우울증 치료비 최대 20만원 지원",,,http://www.shinailbo.co.kr/news/articleView.html?idxno=1394464,http://www.nocutnews.co.kr
2021-03-31 14:37:19,장애인신문,사회,"하당노복-안국건강, 취약계층 노인 '건강식품' 지원","[ [광주CBS 이승훈 기자]    광주복지연구원 제공빛고을노인건강타운 회원들이 적극적인 사회공헌활동에 나선다.62세부터 86세까지 남녀 31명으로 이뤄진 '빛고을사회공헌캠프단'은 31일 오전 10시 빛고을노인건강타운에서 발대식을 갖고 본격적인 사회공헌활동을 시작했다.이들은 빛고을노인건강타운이 최근 새롭게 설정한 '사회공헌형타운 운영'의 목표에 맞춰 그 기초자료로 쓰기 위해 실시한 일반 회원 대상의 '사회공헌에 관한 인식조사' 과정에서 자발적으로 구성돼 그 의미를 더해주고 있다.빛고을타운은 인식조사 문항 가운데 '사회공헌활동에 적극적인 참여를 원한다'고 답하고 이 활동을 위해 자신의 연락처까지 손수 남긴 응답자들을 대상으로 캠프단을 꾸리게 된 것이다.이들은 앞으로 광주천과 무등산 등 환경보호활동을 비롯해 문화예술공연활동, 스마트폰 도우미 활동, 시설 연계 봉사활동, 도시재생사업 활동 등 다양한 무료 봉사 활동을 펼치게 된다.▶ 확 달라진 노컷뉴스▶ 클릭 한 번이면 노컷뉴스 구독!▶ 보다 나은 세상, 노컷브이와 함께yycub@hanmail.net저작권자 © CBS 노컷뉴스 무단전재 및 재배포 금지   ]",[],http://www.welfarenews.net/news/articleView.html?idxno=77109,https://n.news.naver.com/mnews/article/079/0003486486?sid=102
2021.03.31.,백세시대,,"대한노인회 제주 서귀포시지회, 산림조합과 '노인사회참여 증진' 업무협약",,,http://www.100ssd.co.kr/news/articleView.html?idxno=75821,http://news.itimes.co.kr
2021.03.25.,스포츠서울,,"염태영 ""노인놀이터 도입 어르신 건강 도움 될 것""",,,http://www.sportsseoul.com/news/read/1026752?ref=naver,http://www.shinailbo.co.kr/
2021.03.22.,연합뉴스,,"폐지수거 노인, 대부분 70세 이상 고령에 건강 나빠",,,http://yna.kr/AKR20210322110800054?did=1195m,http://www.welfarenews.net
2021.03.26.,아시아경제,,"염태영 ""노인 건강한 삶 위해 노인놀이터 만들자""",,,https://view.asiae.co.kr/article/2021032607335957777,http://www.100ssd.co.kr
2021.03.23.,뉴시스,,"부산 남구, 어르신 건강·경제 안정 ‘노인일자리’ 본격 추진",,,http://www.newsis.com/view/?id=NISX20210323_0001380420&cID=10811&pID=10800,http://www.newsis.com
2021-03-23 16:19:48,부산일보,사회,"김해시, 노인맞춤돌봄서비스 수행기관과","[      [부산=뉴시스] 허상천 기자 = 부산 남구는 어르신들의 건강한 노후생활과 경제적 안정을 도모하기 위해 올해 노인일자리 및 사회활동지원사업을 본격 추진한다고 23일 밝혔다. 2021.03.23. (사진 = 부산남구 제공) photo@newsis.com *재판매 및 DB 금지 [부산=뉴시스] 허상천 기자 = 부산 남구는 어르신들의 건강한 노후생활과 경제적 안정을 도모하기 위해 올해 노인일자리 및 사회활동지원사업을 본격 추진한다고 23일 밝혔다.올해는 단순 노무에서 벗어나 노동의 가치를 높일 수 있는 생산성 있는 일자리와 남구의 특화된 사업을 시행하는 등 지역사회 차별화된 노인일자리 발굴에 힘을 쏟고 있다. 남구시니어클럽 등 6개 일자리수행기관이 다양하고 특화된 프로그램을 발굴·운영한다.남구는 지난 12월 말 기준 65세 이상 노인인구가 5만3898명으로 전체 인구대비 20.13%를 차지해 고령사회에 접어들었다. 이에 노인일자리 창출은 노인의 건강과 경제적 자립을 위해 중요한 사업으로 자리잡고 있다.  남구의 노인일자리 및 사회활동지원사업은 46개 사업단에 4200여명의 어르신이 참여하고 있으며 작년 대비 9.7% 증가했다.노인일자리사업은 공익형·사회서비스형·시장형·취업알선형 4가지 유형으로 추진된다.‘공익형’은 만 65세 이상 기초연금 수급 취약계층을 대상으로 노노케어 등 31개 사업에 3169명이 참여하고, ‘사회서비스형’에는 시니어마을안전지킴이 등 7개 사업에 389명의 노인이 활동 중이다. ‘시장형’은 실버택배사업·깔끄미지원사업·Cafe-In사업·사랑채공방작업장 운영 등 7개 사업에 250명이 참여하고 있으며, 실버인력뱅크인 ‘취업알선형’은 남구의 자랑사업으로 기업의 요청에 따라 수시로 채용하는 유형으로 올해 400명의 노인에게 취업을 알선한다.아울러 올해는 남구만의 특색있는 다양한 사업을 운영한다. 시니어컨설턴트·경로당환경개선·장애인주차구역계도·스쿨존안전지킴이 등 코로나19 속에서도 지속가능한 노인일자리 창출에 노력하고 있다.특히 남구시니어클럽과 협약을 통해 작년 시범사업을 거쳐 본격 시행한 ‘장애인주차구역 질서계도사업단’은 장애인전용주차구역 주정차위반 과태료 처분대상 건수를 60%이상 감소시키며 괄목할 성과를 보여주고 있다. 박재범 남구청장은 “노인일자리사업을 선심성 퍼주기 식으로 보는 곱지 않은 시선도 있지만, 근로와 복지를 연계한 노인복지 정책으로 단순 소득 증대에만 그치는 것이 아니라 지속적인 사회활동으로 건강과 고용, 삶의 질 향상이라는 일석 삼조의 효과를 거두는 긍정적인 측면이 많다”며 “모두가 내 부모님이라 생각하고 좋은 시선으로 봐 주었으면 좋겠다”고 말했다.☞공감언론 뉴시스 heraid@newsis.com▶ 네이버에서 뉴시스 구독하기▶ K-Artprice, 유명 미술작품 가격 공개▶ 뉴시스 빅데이터 MSI 주가시세표 바로가기&lt;ⓒ 공감언론 뉴시스통신사. 무단전재-재배포 금지&gt;   ]",[],http://www.busan.com/view/busan/view.php?code=2021032509383286477,https://n.news.naver.com/mnews/article/003/0010407602?sid=102
2021.03.24.,쿠키뉴스,,"고성군 보건소, 노인건강증진 업무 협약 체결",,,http://www.kukinews.com/newsView/kuk202103240068,http://www.busan.com/
2021-03-25 09:42:50,경남일보,사회,고성군보건소 노인건강증진 업무협약,"[ 노인자살 예방을 위한 업무협약 체결    김해시정신건강복지센터는 지난 24일 지역내 4개 노인맞춤돌봄서비스 수행기관과 노인들의 정신건강증진 및 복지증진을 위한 업무협약 및 간담회를 진행했다고 밝혔다.이번 협약식은 김해시정신건강복지센터, 경상남도사회서비스원 김해시종합재가센터, 보현행원 노인통합지원센터, 생명의전화 노인통합지원센터, 효능원 노인통합지원센터 관계자 10여명이 참석한 가운데 진행됐으며,각 기관은 상호협력과 지원관계를 기반으로 노인 자살예방을 위한 대외 홍보활동을 수행하고 노인 자살고위험군 및 자살시도자 발견 시 심리상담, 치료연계, 자살예방교육 및 프로그램 제공, 노인대상 전문생명지킴이 양성 등 다차원적인 서비스를 제공하기로 했다.이지웅 김해시정신건강복지센터장은 “이번 협약을 통해 지역사회 정신건강 안전망을 구축하고 노년층 자살률을 감소하는데 좋은 발판이 됐으면 한다”며 “앞으로도 노인 정신건강 증진과 삶의 질 향상을 위해 최선을 다해 노력하겠다”고 말했다.한편, 불안, 우울감 등 심리적 어려움과 관련하여 상담이 필요한 시민은 24시간 정신건강 위기상담전화(☎1577-0199), 주간/평일에는 김해시정신건강복지센터(☎329-6323~5)로 연락하면 된다.이상윤 기자 nurumi@busan.com▶ 네이버에서 부산일보 구독하기 클릭!▶ 부산닷컴 회원가입. 회원 전환하면 부산일보 지면보기 무료이벤트▶ 부산일보 홈 바로가기 ]",[],http://www.gnnews.co.kr/news/articleView.html?idxno=471112,https://n.news.naver.com/mnews/article/082/0001077620?sid=102
2021.03.25.,동양일보,,"홍성군, 노인복지 53개 사업에 816억 투입",,,http://www.dynews.co.kr/news/articleView.html?idxno=623368,http://www.kukinews.com
14면 1단,강원일보,,[포토뉴스](주)태백산 태백시노인회에 건강음료 전달,,,http://www.kwnews.co.kr/nview.asp?aid=221032800063,http://gnnews.co.kr
2021.03.26.,경남도민신문,,"고성군 보건소, 노인건강증진 업무협약 체결",,,http://www.gndomin.com/news/articleView.html?idxno=271935,http://www.dynews.co.kr
2021.03.23.,파이낸셜뉴스,,방미숙 하남시의장 노인복지 패러다임 바꾸다,,,http://www.fnnews.com/news/202103222359133896,http://www.kwnews.co.kr/
2021-03-29 00:35:01,노컷뉴스,사회,"日 코로나19 외출자제, 노인 건강 '악영향'",[     태백 철암농공단지에 위치한 농업회사법인 (주)태백산(대표:김인길)은 지난 26일 태백시노인회(회장:이성택)에 가시오갈피 건강음료 100상자를 전달했다.▶ 네이버에서 강원일보 구독하기▶ 강원일보 네이버TV 바로가기ⓒ 강원일보 - www.kwnews.co.kr ],[],https://www.nocutnews.co.kr/news/5521245,https://n.news.naver.com/mnews/article/087/0000837948?sid=102
2021.03.24.,남도일보,,전남 폐지 수거 노인 '지원 길' 열리나,,,http://www.namdonews.com/news/articleView.html?idxno=602063,http://www.gndomin.com/
2021.03.24.,국제뉴스,,"충주시노인복지관, 노인일자리참여자 및 수혜자 마스크 전달",,,http://www.gukjenews.com/news/articleView.html?idxno=2187583,http://www.gukjenews.com/
2021.03.25.,광주드림,,"""사회공헌 참여"" 설문 응답 노인 40% 핸펀 번호 남겨",,,http://www.gjdream.com/news/articleView.html?idxno=606734,http://www.gjdream.com
2021.03.22.,머니S,,"하남시, 저소득 노인복지 대폭 확대된다…개정조례 의회 통과",,,http://moneys.mt.co.kr/news/mwView.php?no=2021032218458054462,https://www.moneys.co.kr/
2021-03-22 19:30:48,강원도민일보,사회,"[태백]태백시, 철암·구문소동 노인 대상 '마음건강' 검진","[     방미숙 하남시의회 의장. / 사진제공=하남시의회하남시 지역 저소득 노인가구와 경로당을 이용하는 어르신들의 복지가 대폭 확대될 전망이다. 방미숙 의원에 따르면 6일간 일정으로 개회된 제301회 임시회에서 방미숙 의장이 발의한 '하남시 저소득 노인가구 건강보험료 및 노인장기요양보험료 지원 조례안'과 '하남시 경로당 지원에 관한 조례 전부개정조례안'이 22일 본회의에서 최종 통과했다.  우선 방 의장이 대표발의한 '하남시 저소득 노인가구 건강보험료 및 노인장기요양보험료 지원 조례안'은 고령과 저소득 등의 이유로 건강보험료와 장기요양보험료 납부에 어려움을 겪는 저소득 노인가구의 건강보험료와 장기요양보험료를 지원함으로써 시민의 건강보호와 복지향상에 기여하는데 목적이 있다. '하남시 경로당 지원에 관한 조례 전부개정조례안'은 하남시 각 경로당의 효율적 운영을 위해 노인복지법에 따른 경로당 지원 및 지역봉사지도원에 관한 사항을 규정함으로써 노인들의 자율적인 친목도모, 정보교환 및 여가활동 등의 활성화에 기여한다.이처럼 방미숙 의장이 노인문제를 좀 더 유익하게 풀어나가기 위해 발의한 관련 조례가 잇따라 제정되자 노인복지 패러다임을 확 바꿨다는 평가가 이어지고 있다.  방미숙 의장은 “고령화 시대와 함께 노인 삶의 질은 그 중요성이 더해지고 있다”며 “이번 조례를 계기로 우리 하남시 지역 저소득 노인가구의 복지향상과 함께 어르신들이 돌봄의 대상이 아니라 여가활동에 적극적으로 참여할 수 있는 계기가 되기를 바란다”고 말했다.하남=김동우 기자 bosun1997@mt.co.kr▶뜨거운 증시, 오늘의 특징주는?  ▶여론확인 '머니S설문' ▶머니S, 네이버 메인에서 보세요 &lt;저작권자 ⓒ '성공을 꿈꾸는 사람들의 경제 뉴스' 머니S, 무단전재 및 재배포 금지&gt; ]",[],http://www.kado.net/news/articleView.html?idxno=1065907,https://n.news.naver.com/mnews/article/417/0000672236?sid=102
2021.03.24.,대전일보,,"음성군정신건강복지센터, 음성시니어클럽과 '노인자살예방 업무협약' 체결",,,http://www.daejonilbo.com/news/newsitem.asp?pk_no=1463912,http://www.kado.net/
2021.03.16.,국민일보,,中 ‘태반’ 밀거래 여전… “건강에 좋다” 노인들 찾아,,,http://news.kmib.co.kr/article/view.asp?arcid=0015638684&code=61131811&cp=nv,http://www.daejonilbo.com/
2021.03.15.,연합뉴스,,"전주시, 간호사 등 은퇴 전문인력 노인 돌봄서비스에 투입",,,http://yna.kr/AKR20210315105500055?did=1195m,http://www.kmib.co.kr/
