Date,Press,Category,Title,Content,Comment,URL_Origin,URL_Naver
2022.05.20.,베리타스알파,,[신간산책] 아버지와 자식,,,http://www.veritas-a.com/news/articleView.html?idxno=415507,http://h21.hani.co.kr/
2022-05-17 10:41:04,세계일보언론사 선정,정치,오세훈 “난 준비된 민생 시장… 빈부격차 해소 주력” [6·1 지방선거-수도권...,"[ [신진욱X이세영의 정치크로스]문재인 정부 때 자산격차·계급문제 커져, 노동정치 실현에서 해법 찾을 가능성은    일러스트레이션 장광석이세영의 질문 우리 사회의 경제적 격차와 불안정성이 심각함에도 불구하고 지난 대선 때나 선거 이후에나 이 문제는 이슈가 되지 않고 있다. 한국에는 계급정치의 사회적 토대가 전혀 없는 것인가?(제1410호)평등, 공정, 정의를 표방한 문재인 정부 5년 동안 불행히도 이 가치들은 위선과 허식이라는 수치스러운 오명을 얻었다. 문재인 정부가 진보 정권이 아니었다고 규정하기는 쉬운 일이다. 하지만 대중의 마음속에 새겨진 ‘진보’에 대한 불신과 환멸을 지우기는 쉽지 않을 것이다. 민중을 말하는 정치세력이 민중의 혐오 대상이 됐다는 사실, 그리고 그들을 비난하며 힘을 얻은 자들이 바로 이 사회의 진정한 거대 권력이라는 사실에서 우리는 아득한 절망을 느낀다.물론 문재인 정부가 모든 것을 악화시키기만 했다는 평가는 전혀 타당하지 않다. 가처분소득의 불평등, 공공복지의 재분배 효과 등 여러 지표가 개선됐고 박근혜 정부 후반 10%에 육박하던 청년실업률은 코로나19 위기 속에 있던 2021~2022년 7%까지 내려갔다. 하지만 일자리·주택·자산 등 많은 면에서 격차가 심해졌고, 그것이 정권 후반기 민심 이반에 결정적 역할을 했음을 부인할 수 없다. 계급 문제가 정권교체의 중대한 배경이었음을 놓친다면 현 시국의 심층을 볼 수 없다.세계의 악이 공기처럼 떠다니는 시대집값 폭등과 자산격차 확대는 치명적이었다. 순자산 지니계수는 2017년 0.584에서 2020년엔 0.602로 급등했다. 청년층 내 순자산 상위 20%는 2017년에 하위 20%의 27.9배를 갖고 있었으나 2020년엔 33.2배를 갖게 됐다. 코로나19 위기가 장기화하면서 많은 소상공인이 쓰러졌다. 비정규직 비율은 2017년 32.9%에서 2021년 38.4%로 올랐고, 특히 20대는 33.1%에서 40.0%로 뛰었다. 탄핵, 촛불, 코로나19, 총선 압승 등 여러 예외 상황에서 열린 기회의 창이 그냥 닫혔다.윤석열 대통령과 국민의힘은 바로 이런 현실에 대한 대중의 실망과 분노를 증폭시켜 정권교체를 이뤘다. 그런데 이상하다. 계급·불평등·노동 이슈는 대선 기간에도, 대선 이후에도 전혀 부상하지 않았다. 유권자의 투표도 계급계층에 따라 갈리지 않았고 양대 정당에 대한 대안으로 정의당이 부상하지도 않았다. 제도정치에 도전하는 아래로부터의 대중투쟁도 일어나지 않았다. 계급은 모든 곳에서 감지되지만, 어디서도 보이지 않는다. 이 상황을 어떻게 이해해야 할까? 이 문제는 한국 정치에서 민주화 이후 반복되고 있다. 특히 2000년대 들어 악화하는 불평등과 이를 대변하지 못하는 정치의 간극은 점점 더 커졌다. 지난 20년 동안 모든 인식조사에서 대다수 사람은 교육, 일자리, 소득, 부동산 등의 계층격차가 한국 사회의 가장 심각한 문제이자 최우선의 국정과제라고 답했다. 이런 문제로 정권이 흔들리긴 했어도 그다음에 오는 정권이 달랐던 적은 없다. 정치 양극화는 심해졌지만 계급 양극화를 반영하지 않는다. 시인 박노해는 2010년 발표한 ‘시대고독’이라는 시에서 이렇게 시대를 진단했다. “한 시대의 악이/ 한 인물에 집중되어 있던 시절의 저항은/ 얼마나 괴롭고 행복한 시대였던가// 고통의 뿌리가 환히 보여/ 선과 악이 자명하던 시절의 자기결단은/ 얼마나 슬프고 충만한 시대였던가” 그러나 지금 우리는 “세계의 악이 공기처럼 떠다니는 시대”를 산다. 이익과 이익, 신념과 신념이 곳곳에서 부딪히지만 그것은 권력층의 다툼이거나 을들의 전쟁이지, 계급투쟁이 아니다. 독재를 경험한 많은 나라에서 이런 경험은 보편적이다. 국가폭력과 시민사회의 대결이 압도하던 시대에는 그 고통의 깊이만큼이나 높은 도덕적 숭고함이 있었다. 하지만 민주화 이후 사회는 수많은 갈등이 교차하고 얽히는 혼돈의 세계로 변했다. 체코 민주화운동을 이끈 시인이자 이후 대통령이 된 바츨라프 하벨은 1992년 출간한 &lt;여름날의 명상&gt;에서 “절대선을 위한 인륜성의 실천”이 사라지고 집단이익들의 갈등과 정치투쟁만이 남은 시대를 탄식했다.혁명은 일어나지 않았지만하지만 현대정치의 큰 기둥 중 하나인 노동정치는 바로 그 이익갈등과 정치투쟁의 한가운데서 ‘인륜성’을 구현하려 했다. 독일 노동자의 정치지도자였던 페르디난트 라살은 1862년 ‘현재의 역사 시대와 노동계급 이념의 특별한 연관성’이라는 명연설에서 이렇게 말했다. “노동계급의 원칙을 국가와 사회의 지배적 원칙으로 삼는다는 사상”이야말로 “세계사가 지금까지 알지 못했던 최상의 진보이자 인륜성의 승리를 표현한다”. 이 웅장한 선언은 인류 역사에 계급정치의 개막을 알렸다.자본주의 사회의 계급갈등을 제도정치의 장으로 반영해 해법을 모색하는 것은 현대정치의 가장 중요한 과제 중 하나였다. 산업사회의 태동과 더불어 유럽 여러 나라에서는 자본과 노동 간의 계급균열이 핵심적인 정치사회적 균열로 자리잡았다. 이들 양대 계급은 농민과 중간계급 등 기타 계급들과 연대해 선거에서 승리하기 위해 경쟁했다. 대의정치의 장에서는 주요 계급들의 이익과 세계관을 대변하는 좌우 정당 간의 경쟁구도가 구축됐다. 비록 어느 발전된 자본주의 나라에서도 라살이 소망한 것처럼 “노동계급의 원칙이 곧 국가의 목적이 되게끔” 하는 혁명은 일어나지 않았지만, 노동자들은 정치를 통해 자신들의 존엄과 자부심, 단결된 힘을 과시할 수 있었다. 덴마크의 세계적인 사회학자 에스핑-안데르센이 강조했듯이, 사회민주주의 이념의 핵심은 자본주의 사회에서 노동계급의 경제적 열세를 상쇄할 무기를 국가와 정치에서 얻을 수 있으며, 따라서 사회주의와 민주주의가 불가분의 가치임을 통찰하는 데 있다.저소득·무주택자의 계급인식 싹트고그러나 한국에서는 일제강점기부터 군사독재까지 수십 년간 정치적 자유와 노동자의 기본권이 억압됐기 때문에 민주적 계급정치가 발전할 기회가 없었다. 그런 역사적 배경 위에서 민주화 이후 정치적 대립 구도는 지역, 세대, 북한 문제 등 비계급적 차원에서 날카롭게 형성됐다. 경상도 출신과 전라도 출신, 젊은 세대와 노인 세대, 북풍과 역풍, 이런 것들이 친구와 적을 가르는 기준이 됐고, 정치인은 이를 영리하게 고무하며 즐겁게 활용했다.그럼에도 경제적 격차와 불안이 심해짐에 따라 불평등, 복지, 노동권익 같은 계급적 의제가 정치에서도 중요해졌다. 특히 2010년대 이후 소득·주거·자산 등 측면에서 사람들의 경제적 지위에 따라 정부정책과 정당들에 대한 인식과 태도가 차이를 보이기 시작했다. 즉 하층에 속하는 사람들이 좀더 진보적인 정치를 바라고, 상류층일수록 보수 성향을 보였다는 것이다. 노인층에선 여전히 이념보수가 다수라면, 특히 청장년층에서 이런 계급균열이 두드러졌다.여러 지표에서 의미심장한 변화가 관찰됐다. 노년층을 제외하면 저소득층일수록 더불어민주당이나 진보정당에 투표하는 경향이 나타났고, 복지 태도에서도 소득이 낮을수록 복지정책을 더 지지하는 경향이 있었다. 특히 자가 보유 여부와 자산 규모는 정치적 선호나 투표 성향과 강한 상관성을 보였다. 물론 이를 두고 한국에서 계급의식과 계급정치가 무르익었다고 해석하는 것은 속단이고 과장이다. 하지만 때론 어떤 미약한 신호가 큰 변화의 맹아가 싹텄음을 암시한다. 그 신호가 왔다.그러한 역사적 흐름을 타고 탄생한 것이 문재인 정부였다. 문재인 정부는 평등·공정·정의라는 가치의 삼위일체, 소득주도성장·포용복지국가·노동존중사회라는 비전의 삼위일체 안에 시대정신을 관념적으로 응축했다. 하지만 현실은 반대였다. 바로 그 문재인 정부 동안에 계급정치의 토대가 다시금 해체됐다. 가난한 자, 집 없는 자, 일자리 없는 자가 민주당에 더 호감을 갖지 않을 뿐 아니라 정의당도 대중적 신뢰를 상실했다. 복지 태도, 이념성향도 계급과 멀어졌다.사회에서도 진보 세력은 급격히 힘을 잃었다. 이명박·박근혜 정권 동안 수많은 촛불시민의 공동체가 생겼고, 청년들의 새로운 사회운동과 참여 네트워크가 형성됐으며, 평등과 복지가 더는 공산당·빨갱이의 낙인이 아니라 한국 사회 주류 담론의 위상을 갖게 됐다. 하지만 지난 몇 년 사이 진보운동과 시민사회는 신뢰를 잃고, 활력을 잃었으며, 자부심을 잃었다. 보수우익이 불평등과 불공정을 외치고, 대기업이 진보운동의 젊은 리더들을 지원하는 시대가 됐다. 변화의 방향은 예정돼 있지 않아이 폐허에서 진보정치와 진보운동은 다시 일어나야 한다. 어디서 시작할 것인가? 무엇을 할 것인가? 누가 할 것인가? 어쩌면 이 엄청난 질문 앞에 우리는 지금 무력하기만 한지 모른다. 다만 분명히 해야 할 것은, 우리 사회는 이럴 수밖에 없는 것이 아니었으며 달라질 가능성의 공간이 열린 적이 없지 않았다는 사실이다. 정치와 사회의 변화는 진보를 향해서도, 몰락을 향해서도 예정돼 있지 않으며 단선적으로 나아가지 않는다. 불규칙하게 출렁이는 파도의 어느 지점에 지금 우리는 놓여 있다. 바닥을 차고 비상하는 힘은 이미 어디선가 생겨나고 있는지 모른다.신진욱 중앙대 사회학과 교수신진욱의 질문 윤석열 대통령 취임사의 키워드는 ‘자유’였다. 진보의 가치였던 ‘자유’가 보수의 전유물이 돼버린, 이 한국적 상황을 어떻게 타개해야 할까 (제1415호로 이어집니다.)*신진욱X이세영의 정치크로스: 정치사회학자인 신진욱과 정치부 기자 출신인 이세영이 한국 정치에 대해 서로 묻고 답하는 형식의 정치칼럼입니다. ]","['현대사회는 돈있으면 양반 돈없으면 노비 아니었나? 전세계적인거 아닌가 윤석렬정부가 더 심해질텐데 검찰들로 쉴드치고 불법저질러도 쉴드치고 그예로 주변인들만봐도 정상인이 없는듯 다들 범법자들만 앉히던데 심히걱정임', '', '', ""사회현상으로서 불평등과 양극화를 계급 갈등으로 구분해서, 갈등을 주장하고 계급간 무한 투쟁을 요구하는 것이 소위  '진보'인 거야?"", '이런 글을 읽은 것도 오랜만이네. 참 역설적이다. 이런 정권에서 이런 글을 읽을 수 있다니.', '', '', '진보가 뭐, 어쩌라고 진보는 개똥같은 것들이. 니들이 얘기하는 노동자는 노조고 니들이 얘기하는 서민은 민주당 지지자잖아. 선택적인 정의와 공정이 진보야? 여성을 위해서 우쭈주 해주는게 성평등이고 서민을 위해서 라면값 던져주고 주거비로 다뜬어가는게 서민 정책이야? 진보는 개똥. 진보는 포장된 공산당이고 공산당만 잘사는 공산국가처럼 지지자만 편하게해주는게 진보잖아. 꺼져, 꺼지라고, 보수를 지지하는게 아니고 그냥 니네는 꺼지라고. 충분히 봤어 그냥 꺼져. 아파트 폭락시키는 자가 대통령이고 구세주야. 꺼져 니들은.', '말은 바로 합시다. 자유는 원래 보수의 상징이죠.. 진보는 규제고..']",http://www.segye.com/content/html/2022/05/16/20220516519356.html?OutUrl=naver,https://n.news.naver.com/mnews/article/036/0000046474?sid=100
2022.05.17.,오마이뉴스,,"""인간은 평등한데, 인류가 언제 구현해 봤나요?""",,,http://www.ohmynews.com/NWS_Web/View/at_pg.aspx?CNTN_CD=A0002828788&CMPT_CD=P0010&utm_source=naver&utm_medium=newsearch&utm_campaign=naver_news,http://www.ohmynews.com/
2022-05-17 09:36:01,투데이신문,정치,"[존폐 기로에 선 여가부③] 정치하는엄마들 박민아, ""여가부 폐지되면 '돌봄 ...","[ [인터뷰] 기본소득당 박은영 광주시의원 비례대표 후보            ▲  박은영 기본소득당 광주시의원 비례대표 후보            ⓒ 김동규  15일, 박은영 기본소득당 광주광역시의원 비례대표(1번) 후보를 인터뷰했다. 박 후보는 지난 2018년 노동당 광주시의원 비례대표(1번) 후보로 지방선거에 출마한 후 이번 선거에서 두 번째 도전을 하게 됐다. 박 후보는 학벌없는 사회를 위한 시민모임 창립 멤버, 광주시 인권증진시민위원, 교육공간 오름 교사 등으로 시민사회 활동을 해왔다. - 정치를 시작하시게 된 계기가 있다면 무엇일까요?""지난 2008년에 무상교육, 무상의료 정책이 와닿아 진보신당에 입당하면서 활동을 시작했어요. 이후 당원들을 통해 알게 된 교육공간 오름, 학벌없는 사회를 위한 시민모임 등에서 활동했어요. 모든 게 열악한 상황이었고 함께 할 사람이 많지 않았어요. 그래서 버티는 의미로 시민사회 현장을 지켜왔던 거 같아요. 하지만 이번에 기본소득당을 창당하고 후보로 나서는 과정에는 저의 판단과 결의가 있었어요.기본소득당은 용혜인, 신지혜 같은 젊은 대표단이 노동당에서 기본소득당 당명 개정안을 대의원 대회에 올렸다가 불발된 후 새롭게 창당한 정당이에요. 기적처럼 창당할 수 있었고, 선거 국면이 되면서 오준호 대통령 후보도 낼 수 있었어요. 이번 지방선거에는 제가 10년간 봐왔던 문현철이라는 사람이 결의해 주어서 광주시장 선거까지 치르게 됐어요."" - 이번 선거 출마를 결심하신 직접적인 계기가 있다면요?""당연히 선거 투표용지에 저희 당 이름을 적어야 한다고 생각했어요. 전국적으로 광역의원 비례대표 후보는 다 내야 한다는 생각이 있었어요. 정당은 5개 광역시도당이 있어야 창당될 수 있어요. 서울, 경기, 인천, 광주, 대구에 시도당을 창당한 후 당원들과 함께 최대한 많은 광역단체장 및 광역의원 비례대표 후보를 내기로 결의했어요. 함께 정당을 창당한 사람으로서의 책임감이 컸던 거 같아요. 그래서 책임감을 가지고 시당위원장으로서 광역의원 비례대표 후보로 나서게 됐어요.제가 광주에서 제일 길게 한 일은 교육공간 오름에서의 활동이에요. 그래서 학교 밖 청소년들을 가장 많이 보아왔고, 지금도 대안학교에서 요청이 오면 수업하러 나가요. 광주대안교육협의회 간사로도 활동하고 있어요. 본업으로는 광주인권지기 활짝에서 일하고 있어요. 인권교육 활동도 하는데, 저에게는 어린이·청소년 관련 교육을 하는 게 가장 즐거운 일인 거 같아요.이분들의 주체적인 삶이 지속 가능하도록, 기성세대 구성원들이 이분들을 단순히 미숙한 존재가 아닌 현재의 시민이자 역사의 주체로 볼 수 있도록 계속 노력하고 싶어요. 이 과정에서 만나게 된 문현철 시장 후보가 창당 과정에서 기본소득 학습모임, 당원 모집 등의 활동을 하다가 시장 선거에 나서게 되는 과정을 보면서 많이 놀랐던 거 같아요. 함께 최선을 다해 선거를 치러보고 싶어요."" - 왜 기본소득당이었나요?""대의원대회가 끝난 후부터 다른 방법이 없다고 생각했어요. 기본소득을 이름으로, 선명한 대안 정당으로서 새로운 길을 모색하기 위해 선택한 길이에요. 그래서 할 수 있는 모든 방법을 다해 창당을 위해 노력했죠.특히 당시에는 인터넷을 통해 정당에 가입할 수 없었는데, 중앙당에서 선관위와 협의해 인터넷으로 정당 가입을 받을 수 있는 최초의 사례를 만들었어요. 기본소득당이라는 당명은, 이 위기의 시대에 저희들이 기본소득당의 지지자들을 모으고 호명할 수 있는 유일한 당명이었다고 생각해요.""""기본소득은 몇 푼의 돈을 나눠주는 것에서 끝나지 않아""                  ▲  기본소득당 박은영 광주시의원 비례대표 후보.            ⓒ 박은영 후보 제공  - 이번 선거에서 당선되신다면 광주시의회에서 어떤 일을 하고 싶으세요?""당연히 기본소득이죠. 이번에 문현철 기본소득당 광주시장 후보가 어린이, 청소년, 청년, 농민, 노인을 대상으로 하는 광주형 기본소득 모델을 제시했어요. 월 10만 원씩 1년에 120만 원을 서른 살까지 준다는 정책이에요. 노인이 되었을 때에는 노인연금과 별도로 지급할 계획이에요. 이후 어느 정도 기본소득이 자리 잡히면, 이번 임기 내에 전 시민에게 기본소득이 지급될 수 있도록 추진할 생각이에요.현재 저희가 내놓은 정책은 광주시 전체 예산의 5% 정도만 사용하면 실현할 수 있어요. 서울과 경기도에서는 전 시민 기본소득이 이야기되고 있어요. 광주도 장기적으로는 그렇게 가야 할 거 같아요."" - 기본소득당 광주시당의 또 다른 공약으로는 어떤 게 있을까요?""예술인 창작 수당 공약이 있어요. 현재 대부분의 예술인들이 예술만으로는 먹고 살기 어려운 상황이에요. 그래서 이 도시를 문화적으로 풍요롭게 해주는 예술인들에게 창작 수당을 지원하려고 해요. 또 차별금지법이 아직 제정되지 않았기 때문에 차별금지 조례를 만들고 싶어요. 말로는 광주가 민주인권도시라고 하지만, 여전히 광주는 평등하지 않은 거 같아요.그리고 기후위기를 극복하기 위한 탄소세 정책도 검토하고 있어요. 탄소를 많이 배출하는 분들보다, 덜 배출하는 분들께 혜택이 갈 수 있도록 정책적으로 유도할 생각이에요. 현재 도시철도 2호선을 뚫고 있는데, 대중교통이 매우 불편한 상황이에요. 자동차를 사라고 유도하는 거 같아요. 시민들이 자발적으로 탄소중립을 위해 노력할 수 있는 정책이 필요해요.""- 마지막으로 하고 싶으신 말씀이 있다면요?""기본소득이 불러올 새로운 사회를 상상하며 당원들과 항상 이야기해 온 게 있어요. 기본소득은 새로운 사회계약이 될 거예요. 우리 사회에 난무하는 차별과 혐오를 끊어내기 위해서도 꼭 필요한 정책이에요. 인간은 평등한데, 인간의 평등을 인류가 언제 구현해 봤나요?기본소득은 몇 푼의 돈을 나눠주는 것에서 끝나지 않아요. 토지 불평등, 소득 불평등, 기후위기를 해결하기 위해 토지세, 소득세, 탄소세를 신설해 인류가 직면한 과제를 해결하고 모든 사람을 존중하고 응원하는 수단이 될 거예요. 어떠한 기준도, 선별도 없이 모든 인간은 존엄하고 모두가 평등하다는 걸 증명하는 정책이 될 거예요. 한 번 안착시키면, 거스를 수 없는 흐름이 될 거예요."" ]",[''],http://www.ntoday.co.kr/news/articleView.html?idxno=92038,https://n.news.naver.com/mnews/article/047/0002353281?sid=100
2022.05.26.,전남일보,,차노휘의 길 위의 인생 77> 이민자들 강한 생명력 그 힘은 어디서 나올까,,,https://www.jnilbo.com/view/media/view?code=2022052611213212884,http://www.ntoday.co.kr
2022.05.17.,VOA,,"뉴욕주 슈퍼마켓 총격범, 추가 공격 계획...미 '분유 부족 사태' 애보트 ""생산...",,,https://www.voakorea.com/a/buffalo-shooter-planned-more-killings-police-commissioner-says/6576976.html,http://www.jnilbo.com
2022.05.09.,한겨레21언론사 선정,,"소득주도성장기 ②, 잊혀진 첫마음",,,https://h21.hani.co.kr/arti/society/society_general/51974.html,http://www.voanews.com/korean
2022.05.21.,굿모닝충청,,"유승광 서천군수 후보 ""인구 문제 교육환경 개선해 극복""",,,http://www.goodmorningcc.com/news/articleView.html?idxno=269921,http://h21.hani.co.kr/
