Date,Press,Category,Title,Content,Comment,URL_Origin,URL_Naver
2022-12-12 08:11:07,LG헬로비전,사회,"정읍시, 내년 노인·장애인 관련 예산 천8백억 편성","[ 분당서울대병원 김기웅 교수 연구팀정서적 지지 받는 노인치매 발병률 1000명당 9명    김기웅 분당서울대병원 정신건강의학과 교수.주변 사람들로부터 공감과 이해, 보살핌 같은 정서적인 지지를 충분히 받지 못하는 노인들은 치매에 걸릴 위험이 높아진다는 연구 결과가 나왔다. 초고령사회 진입과 치매 환자의 폭발적 증가가 현실화하면서 독거노인 등 사회적으로 고립된 노인들을 대상으로 적절한 정서적 지지를 제공하고, 정기적 인지기능 평가 지원이 필요함을 시사한다.분당서울대병원 정신건강의학과 김기웅 교수, 강북삼성병원 기업정신건강연구소 오대종 교수 연구팀은 국내 60세 이상 노인 5852명을 8년 동안 추적 관찰하며 정서적 지지와 물질적 지지가 각각 치매 발병 위험을 높이는지 분석했다고 12일 밝혔다. 연구 결과, 물질적 지지는 치매 발병률에 유의미한 차이를 가져오지 않았지만, 정서적 지지는 차이를 낳았다. 충분한 정서적 지지를 받는 노인의 치매 발병률은 매년 1000명당 9명에 그쳤다. 반대로 정서적 지지를 받지 못한 노인의 경우 발병률이 연 1000명당 15.1명으로 높게 나타났다. 특히 정서적 지지와 치매 발병 위험의 연관성은 여성에게서 두드러졌다. 정서적 지지를 받지 못하는 여성은 치매 발병 위험이 61% 높았고, 치매 중 가장 흔하다고 알려진 알츠하이머병 발병 위험도 66% 높게 확인됐다.그간 노인들의 사회적 고립이 치매 위험요인이 될 수 있다는 보고는 꾸준히 있었으나, 이를 해소하기 위해 어떤 사회적 지지를 제공해야 하는지에 대한 연구는 부족했다. 이번 연구는 물질적 형태의 도움보다 정서적인 공감과 이해가 치매 발병 위험과 연관성이 있음을 밝힌 최초의 연구로, 치매 예방에 있어 겉으로 드러나는 사회적 활동의 양보다 사회적 활동의 질이 중요할 수 있음을 나타낸다.김 교수는 ""이번 연구에서 그 중요성이 밝혀진 정서적 지지를 높이기 위해 다양한 프로그램을 개발할 필요가 있다. 특히 정서적 공감을 바탕으로 개입할 수 있도록 하는 교육 프로그램의 개발과 표준화, 효과 검증이 필요하다""며 ""지역사회 및 국가 단위의 치매 예방 전략 수립 시에는 사회적으로 고립된 고위험 노인을 대상으로 가족이나 혹은 유관기관에 종사하는 이른바 사회적 가족들이 정서적 지지를 체계적으로 제공할 수 있게 하는 노력이 중요하다""고 강조했다.이번 연구 결과는 국제학술지 'JAMA Network Open' 최신 호에 게재됐다. ]",[],http://news.lghellovision.net/news/newsView.do?soCode=SCP0000000&idx=351930,https://n.news.naver.com/mnews/article/277/0005190325?sid=102
2022.12.14.,KBS,,‘모니터링’으로 ‘방문’으로…독거노인을 지켜라!,,,https://news.kbs.co.kr/news/view.do?ncd=5625628&ref=A,http://www.inews365.com
2022.12.14.,KBS,,‘모니터링’으로 ‘방문’으로…독거노인을 지켜라!,,,https://news.kbs.co.kr/news/view.do?ncd=5625628&ref=A,http://news.kbs.co.kr/
2022-12-14 07:38:17,동아일보,사회,"‘무자식 상팔자’ 부부끼리 사는 노인, 자녀동거 노인보다 삶 만족도 높아","[                [앵커] 겨울이 되면 노인 분들의  건강이 더욱 염려가 되죠. 홀로 사는 노인들의 경우 고독사의 우려도 커지는데요. 각 자치단체들이 노인들의 고독사를 막기 위해 다양한 노력을 펴고 있습니다. 김건우 기자가 보도합니다. [리포트] 독거노인 가구의 수도 사용 상황이 실시간으로 파악됩니다. 이상 징후 시 관할 동에 즉시 통보되는데 모두 스마트 검침기 덕분, 고양시는 올해 3천여 가구에 설치했고, 내년에 확대할 계획입니다. [정금영/경기 고양시 수도정보팀장 : ""통화가 안 되면 현장 가서 직접 확인하고 현장 이력 방문 결과를 우리 시스템에 올리게 돼 있습니다.""] 한 동은 독거노인 19가구를 대상으로 전력 사용과 조도 변화 등을 모니터링해 즉각 대응하는 시스템을 갖췄습니다. 모든 게 자동화된 셈이지만 모니터링 대상자 선정은  직접 방문 조사 없이는 불가능했습니다. [""안녕하세요. 행신4동 똑똑돌봄단입니다.""] 관내 통장 21명이 모여  '돌봄단'을 결성한 뒤 7백여 가구를 일일이 방문해 생활 상황을 조사했고, 조사 결과에 따라 전기 사용을 파악할 수 있는 스마트플러그를 설치한 겁니다. 돌봄단은 독거노인들을 수시로 찾아 고립감 해소에 힘쓰고 있습니다. [김수정/'똑똑 돌봄단'  : ""사람이 고프다, 이런 표현들을 쓰시더라고요. 사람이 가서 그분들과 말벗도 해 드리고 그런 가운데서 어려움도 직접 듣고, 기계가 할 수 없는 인적 네트워크를 형성하는 게...""] 고양시의 독거노인은 5년 사이 41% 증가해 이제 4만 명에 육박합니다. [이동환/경기 고양시장 : ""고양시는 복지 사각지대의 빈틈을 메워 가는 다양한 정책을 추진하고 있습니다. 앞으로도 독거노인들의 사회적 고립을 방지하고 공동체 회복에 앞장서기 위해 최선을 다하겠습니다.""] 증가하는 독거노인 가구, 자치단체들의 고독사 방지책도 갈수록 촘촘해지고 있습니다. KBS 뉴스 김건우입니다.■ 제보하기▷ 카카오톡 : 'KBS제보' 검색▷ 전화 : 02-781-1234▷ 이메일 : kbs1234@kbs.co.kr▷ 뉴스홈페이지 : https://goo.gl/4bWbkG ]",['행신 4동에서 좋은 일 하고 있습니다. 고맙습니다'],https://www.donga.com/news/article/all/20221213/116975499/2,https://n.news.naver.com/mnews/article/056/0011392105?sid=102
2022.12.07.,뉴시스,,"한덕수 국무총리, 한파 대비 취약계층 독거노인 가구 방문 [뉴시스Pic]",,,http://www.newsis.com/view/?id=NISX20221207_0002115271&cID=10301&pID=10300,http://www.donga.com/
2022-12-13 13:51:01,뉴스1,사회,"hy, 사회공헌 캠페인 '홀몸노인 돌봄활동' 확대","[     부부끼리 사는 노인가구가 자녀와 함께 사는 노인가구나 혼자 사는 노인가구에 비해 삶의 만족도가 높다는 조사 결과가 나왔다.통계청이 13일 발표한 ‘한국의 사회동향 2022’에 따르면 노인 단독가구(노인독거가구+노인부부가구)가 노인 전체가구의 70% 이상으로 높았다. 그 중 노인 부부가구는 2000년 대비 소폭 증가(33.1%→34.9%)했고 노인 독거가구와 자녀 동거가구보다 삶의 질이 높은 것으로 나타났다.전반적인 삶에 대해 ‘만족한다’고 응답한 비중은 노인 부부가구가 52.9%, 자녀 동거가구가 47.3%, 노인 독거가구가 42.6%였다.노인 부부가구 중 노후 생활비 마련을 자녀에게 의지하겠다는 응답 비중은 2011년 10.2%에서 4.2%로 줄었다. 자녀 동거가구(18.8→5.3%), 노인 독거가구(18.2→5.4%)도 마찬가지였다. ‘본인 스스로’ 마련하거나 ‘본인과 사회보장제도’ 도움을 받겠다는 응답은 늘었다.한국의 행복지수는 최근 3년 평균 5.94점(10점 만점)으로 세계 59위였다. 미국(16위), 일본(54위)보다 낮은 순위다.연령대별 삶의 만족도는 30대가 가장 높고 50∼60대는 낮았다. 한국인의 삶의 만족도 평균 점수(10점 만점)는 2013년 5.7점, 2018년 6.1점, 2021년 6.3점으로 완만히 높아지고 있다.아동·청소년 만족도는 6.6점으로 경제협력개발기구(OECD) 국가 가운데 꼴찌였다. 한국을 제외한 OECD 주요국 평균은 7.6점이다. ]","['자녀가 대책없이 욜로하다 짝 못찾아 대깨하며 부모 등골 빼먹고 있으니 그 삶이 행복할 리가 ㅋㅋ 자식은 부모 탓 부모는 자식 탓 총체적 난국 시대가 온다. 가진 놈들은 성곽 쌓고, 없는 놈들은 투쟁하고 각자도생합시다']",https://www.news1.kr/articles/4886157,https://n.news.naver.com/mnews/article/020/0003467713?sid=102
2022.12.08.,뉴시스,,"김건희 여사, 부산서 노인 생필품 전달 봉사…자립청년 격려",,,http://www.newsis.com/view/?id=NISX20221208_0002116952&cID=10301&pID=10300,http://www.newsis.com
2022-12-07 17:02:10,매일경제,정치,"정서적 지지 받지 못하는 노인, 치매 발병 위험 높다","[     [서울=뉴시스] 배훈식 기자 = 겨울철 대비 취약계층 가구 방문에 나선 한덕수 국무총리가 7일 오후 서울 중구의 다세대주택 밀집지역 노인세대를 찾아 위로하고 있다. (사진=국무총리실 제공) 2022.12.07. photo@newsis.com *재판매 및 DB 금지[서울=뉴시스]박지현 인턴 기자 = 한덕수 국무총리가 7일 겨울철에 대비해 취약계층인 독거노인 가구를 방문해 한파 대응 상황을 점검했다. 한 총리는 이날 서울 중구 다산동의 다세대주택 밀집지역인 노인세대를 찾아 생활에 불편한 점이 없는지 살피고 방한용품을 선물하며 직접 설치에 나섰다. 한 총리는 ""최근 경제상황도 어렵고 본격적인 추위도 찾아오는 만큼 어렵게 생활하시는 분들이 더욱 힘들 수 있다""고 우려하며 ""힘들고 어려운 분들을 위해 애쓰는 시설 관계자들의 노고에 감사드리며, 앞으로도 독거노인 분들의 불편을 덜어드릴 수 있도록 노력해 줄 것을 부탁드린다""고 말했다. 이에 더해 ""취약계층이 한파를 이겨내고 더욱 힘을 내어 살아갈 수 있도록 우리 사회의 많은 관심을 희망한다""고 밝혔다.    [서울=뉴시스] 배훈식 기자 = 겨울철 대비 취약계층 가구 방문에 나선 한덕수 국무총리가 7일 오후 서울 중구의 다세대주택 밀집지역 노인세대를 찾아 위로하고 있다. (사진=국무총리실 제공) 2022.12.07. photo@newsis.com *재판매 및 DB 금지     [서울=뉴시스] 배훈식 기자 = 겨울철 대비 취약계층 가구 방문에 나선 한덕수 국무총리가 7일 오후 서울 중구의 다세대주택 밀집지역 노인세대를 찾아 방한용품을 선물하고 있다. (사진=국무총리실 제공) 2022.12.07. photo@newsis.com *재판매 및 DB 금지    [서울=뉴시스] 배훈식 기자 = 겨울철 대비 취약계층 가구 방문에 나선 한덕수 국무총리가 7일 오후 서울 중구의 다세대주택 밀집지역 노인세대를 찾아 방한용품을 선물하고 있다. (사진=국무총리실 제공) 2022.12.07. photo@newsis.com *재판매 및 DB 금지    [서울=뉴시스] 배훈식 기자 = 겨울철 대비 취약계층 가구 방문에 나선 한덕수 국무총리가 7일 오후 서울 중구의 다세대주택 밀집지역 노인세대를 찾아 위로하고 있다. (사진=국무총리실 제공) 2022.12.07. photo@newsis.com *재판매 및 DB 금지     [서울=뉴시스] 배훈식 기자 = 겨울철 대비 취약계층 가구 방문에 나선 한덕수 국무총리가 7일 오후 서울 중구의 다세대주택 밀집지역 노인세대를 찾아 추위를 막아줄 에어캡을 설치하고 있다. (사진=국무총리실 제공) 2022.12.07. photo@newsis.com *재판매 및 DB 금지 ]","['', '쓰레기', '제발 정치인들..좋은일 하고 사진좀 그만 찍어라..좋은일은 숨어서 하는거다', '예산 다 깍고 쑈를 하네', '사진이력 고고', '쇼쇼쇼', '근데 진정성이 하나도 안느껴지니 어쩌냐. 추운데 애만썼네. 덕수옹. 잘했어 고마해']",https://www.mk.co.kr/article/10564690,https://n.news.naver.com/mnews/article/003/0011580824?sid=100
2022.12.29.,중도일보,,독거노인에게 효 상자 전달,,,http://www.joongdo.co.kr/web/view.php?key=20221229010008264,http://news1.kr/
2022-12-06 09:45:59,위키트리,경제,"전남 영암군,‘독거노인 1,400여명 우울증 선별검사’","[     (hy 제공)(서울=뉴스1) 이상학 기자 = hy는 대표 사회공헌 캠페인 '홀몸노인 돌봄활동'을 확대한다고 6일 밝혔다. 해당 사업은 프레시 매니저가 건강음료를 수혜 대상에게 전달하며 안부를 묻는 활동이다. 비대면 전달일 경우라도 문 앞에 제품이 쌓여 있다면 사고를 의심해 관련 기관에 신고한다. 실제 사업을 통해 다수의 위기 상황을 발견해 조치했다.가장 최근인 지난 8월에는 서울 성북구 자택에 쓰러진 82세 고령자를 프레시 매니저가 발견해 119에 신고했다. 경제적으로 심각한 어려움을 겪는 이웃의 상황을 주민센터에 알려 기초수급 지원 대상이 된 사례도 있다.홀몸노인 돌봄활동은 1994년 광진구청과의 협약으로 시작해 올해로 28년째 진행 중이다. 전체 43%인 4700명의 프레시 매니저가 참여 중이다.hy는 보다 체계적 사업 추진을 위해 2017년 사회복지재단을 설립했다. 사업 예산은 매년 늘어나 현재 연간 30억원에 이른다. 누적 사업비는 130억원을 넘어섰다. 사업 초창기 1100명이었던 수혜 대상은 현재 3만명으로 크게 증가했다.hy는 독거노인뿐만 아니라 사회적 관심이 필요한 결식 우려 아동, 장애인 등으로 수혜 대상을 확대했다. 건강음료 중심의 전달 품목도 목적에 맞춰 간편식, 밀키트 등으로 다양화했다.복지기관과 협업도 적극 추진 중이다. 올해만 총 51개 기관과 협약을 맺었다. 접근이 편리한 온라인 기부 플랫폼을 통해 지역별 취약계층 후원 비용을 모금하고 최종 금액의 최대 30%를 hy가 추가 지원하는 방식이다. 내년까지 협업 복지기관 수를 100개 이상으로 늘린다는 계획이다.김준걸 hy 고객중심팀장은 ""홀몸노인 돌봄활동은 지역사회 이해도가 높은 프레시 매니저와 함께했기에 그 효과성이 높다""며 ""복지 사각지대 해소를 위해 지자체 협업, 기부플랫폼 활용 등 다양한 방식의 사회공헌활동을 고민하고 실천해 가겠다""고 말했다.   ]",[],https://www.wikitree.co.kr/articles/815822,https://n.news.naver.com/mnews/article/421/0006502749?sid=101
2022.12.13.,KBS,,‘모니터링’으로 ‘방문’으로…독거노인을 지켜라!,,,https://news.kbs.co.kr/news/view.do?ncd=5625389&ref=A,http://www.newsis.com
2022-12-08 17:42:33,전북도민일보,정치,"전라북도평생교육장학진흥원, 독거노인세대 연탄배달 봉사활동 펼쳐","[ 기사내용 요약새마을운동중앙회 초청 봉사활동 참여양육시설 자립청년 창업 카페도 방문자립준비청년에 대한 책임·지원 언급     [서울=뉴시스] 윤석열 대통령 부인 김건희 여사가 8일 부산 부전동 부산진구새마을지회에서 쪽방촌 독거노인 등에 전달할 생필품 포장 봉사를 하고 있다. (사진=대통령실 제공) 2022.12.08. photo@newsis.com *재판매 및 DB 금지[서울=뉴시스]김지훈 기자 = 윤석열 대통령 부인 김건희 여사는 8일 부산에서 자원봉사에 참여하고, 아동양육시설에서 성장해 자립한 청년들을 찾아가 격려했다고 이재명 부대변인이 서면 브리핑으로 밝혔다.김 여사는 이날 오후 새마을운동중앙회 초청을 받아 MZ세대들과 함께 부산에서 봉사활동을 진행했다. 자원봉사자들과 함께 생필품을 포장해 독거노인 등 어르신들 댁에 전달하는 봉사였다.    [서울=뉴시스] 윤석열 대통령 부인 김건희 여사가 8일 부산 부전동 부산진구새마을지회에서 쪽방촌 독거노인 등에 전달할 생필품 포장 봉사에 앞서 봉사자들과 인사하고 있다. (사진=대통령실 제공) 2022.12.08. photo@newsis.com *재판매 및 DB 금지김 여사는 ""새마을운동은 대한민국 경제발전의 기적을 만들어낸 운동""이라며 ""이 운동을 MZ 세대와 함께 계승 발전시키고 있는 새마을운동중앙회의 변화에 기대가 크다. 그런 점에서 이번 봉사활동에 참여하게 됐다""고 말했다.김 여사는 독거노인 문제가 심각한 상황에서 쪽방촌에 대한 관심이 줄어드는 데 안타까움을 나타내면서 ""열악한 환경에 있는 우리 이웃들이 소외되지 않도록 MZ세대가 새마을지도자들과 함께 나눔과 봉사를 실천하고 있어 무척 감사하다""고 했다.    [서울=뉴시스] 윤석열 대통령 부인 김건희 여사가 8일 부산 부전동 부산진구새마을지회에서 생필품 포장을 마친 후 대학생 봉사자들과 함께 어르신들에게 생필품을 직접 전달하고 있다. (사진=대통령실 제공) 2022.12.08. photo@newsis.com *재판매 및 DB 금지김 여사는 봉사에 앞서 아동양육시설에서 성장한 청년들이 창업한 한 카페를 방문했다. 이 청년들은 다른 자립준비청년들도 돕고 있다고 한다. 김 여사는 윤 대통령이 자립준비청년에 대한 국가의 책임과 지원을 강조했음을 언급한 뒤 ""아직 많은 것이 서툴기 때문에 서로에게 의지하는 것은 너무나 당연하다”며 “자립준비청년들이 혼자 힘들어하지 않도록 국가와 사회의 지원을 잘 안내해주는 좋은 멘토가 되어 달라""고 당부했다. 이어 ""이 공간이 단순히 커피를 파는 곳이 아니라 외롭고 지친 마음을 달래는 공간으로 활용되기를 기대한다""고 격려했다.    [서울=뉴시스] 윤석열 대통령 부인 김건희 여사가 8일 부산 금정구 사회적 기업 형태 카페인 몽실커피를 방문해 카페 운영 청년들과 대화하고 있다. (사진=대통령실 제공) 2022.12.08. photo@newsis.com *재판매 및 DB 금지 ]","['주가조작 수사는 ?', '많이도 나대고 돌아 다녔네 그런 다고 주가 조작 논문 표절이 감춰 질꺼 같나?😤😤😤', '범죄자가 어디다니노 ㅡㅡ 그런다고 니죄가 사라지지않는다', '봉사활동 좋다. 그러나 악수하러 간것이 아니라면 악수할때 마스크는 왜 쓰지않았는가? 다른 사람들은 다 착용했는데 혼자 안쓴 이유가 뭔가? 이러니 좋은 일을 하고도 칭찬을 받지 못하는 것이다. 그자리에 있다면 솔선수범을 보여야 하는데 솔선수범은 커녕 되레 역행하고 있으니 되겠는가? 어디 괜히 트집잡는다고 게거품을 무는 사람이 있다면 어디 말을 해봐라. 남들 다 썼는데 혼자 마스크를 안쓴 이유가 뭔가? 악수할때만 벗었다고 할텐가? 할말 없으면 그 입 다물고 잠자코 앉아있어라.', '기자없이 혼자가라 조용히', '노인 일자리 지원금 예산 7천억 깍아놓고 쇼하고 앉았다. 이런 위선이 어딨냐?  지ㅣ용산 이전 비용 자기 살 집에 1조 투자... 진짜  어이가 없네~~~', '남편은 노인들예산, 경로당 예산 싹다없앴는데 봉사활동ㅋㅋㅋㅋㅋㅋㅋㅋㅋㅋ 진짜 쌍으로 어이가없네', '', '', '베트남 정상이랑 외교 하기도 힘들었을텐데 새마을운동 봉사활동이라니 그대로 힘들어서 쓰러져서 안일어 났으면 좋겟네', '쑈~~  끝은 없는ㄱㅓ니? 지겹다.....그만좀', '도대체.. 통제가 안되는듯..', '', '기본사이즈가 되니 개딸밭에 굴러도 빛이나! 5년동안 돼지그튼거때문에 내 두눈 혹사당한거 생각하믄. . .흑흑', '', '범죄자는 수사 받고 들어가라!   얼굴 갈아 엎고 신분 세탁해  O부인이 됐다한들 니 죄가 사멸되지 않는다!  이 더러운 O부인아!', '한달만 거기서 살며 하면 인정 사진찍어대지 말고', '도이치모터스 주가조작 공소시효 만료 기념 봉사쇼인가보군요.', '천공의 오더!!', '', '똥을싸고자빠졋다', 'ㅎㅎㅎ머리스타일 뭐야 ㅎ 열심히 사네', '어휴 노인 복지 교육 미숙아 예산 다 삭감하고 뭐하는 거냐?? 니 남편이 하는 행동이나 말려라. 윤석열은 거기다 전기 가스 요금 다 올려놓고 독거노인 잘 살피라고??! 진짜 노망도 아니고 뭐하는 건지. ㅡㅡ', '그늘진곳 찾아  디니는  여사님  최고입니다 ㆍ', '저녁  축구팀 만찬에  참석하려면\n부산  와서도  바쁘게  사진만  찍고  쇼하다가  갔네\n범죄  이력이 있으니  뭘 해도  좋게  안보임', '사진 졸라 많이 찍었네', '주가조작 허위경력 논문표절  와!   사기꾼이네\n인생이 사기  창피하지도 않니 맹신아 ㅎ', '개미피빨아 기부천사 . 기자는 헐어요', '이건  양면성도   아니고   일면  사진은  그럴싸  연출  이면  생활은  참  그렇더라   일반인이면   환자  취급이라도  하지  이룬', '', '', '니.가.뮌.데', '재수없으니깐 나데지마라', '천공이 말하면 실행하네', '', '주가조작수사는 안받고..\n무슨지랄염병이냐', '', '범죄 수사나 좀 받지…', '즈그들이 복지예산 삭감해놓고 위하는 척은..', '', '이미지 포장하지마라. 쓰레기', '', '개딸들 부러워 죽네ㅋㅋㅋ 쇼라도 이런쇼는 얼마든지 하십시요 ^^', '', '', '일하러간것이아니야.복장불량.', '올해 농사는 풍년이다 지릴까지 풍년', '', '오른손이 한일을 왼손이 모르게하라', '기도안차네 매일매일 영부인 기사가 나오고', '주가조작 허위경력 범죄자야,  염치도없냐', '가짜인생 건히쑈쑈쑈!!!!!!!', '니가 왜 거기서 나와~~', '', '아이고 두야', '봉사는 좋은데 조용히 숨어서 봉사는 못하나보네', '쫌 그마해', '궁금한 사람 손', '뭐하자는 거니', '🥰 추운 겨울 훈훈합니다.', '부산저축은행대출비리 수사대상에서 제외시켜 부산시민들눈에 피눈물나게 만들고 봉사활동??? 병주고 약주냐??약도 쓸', '', '썩은 대한민국 언론  누가  주가조작 부동산투기 허위이력  술집작부  화보를  국민이  알고싶냐?  기레기는 젊은것부터  늙은 능구렁까지 싺다  썩었구나', '화보촬영 하느라 바쁘시네~', '1970년대 육영수 코스프레  ?\n미덕 시그널 ?\n관종 ?\n이게 모두 과거를 숨기고푼 쥴리의묙망 ?\n지 인생 자체가 쪽팔린줄은 아나봐 ?\nㅋㅎㅎㅎㅎ', '', '실내 마스크 착용. 안하고 봉사?보여주기식 관종 정말 징글징글합니다 마이스 미착용 조사해서 처벌하라~~', '', '저 천박함은 뭐로도 가려지지가 않는다 ㅉ', '진작좀 그러고좀살지...\n왜 이제와서 조작녀... 관종', '', '', '', '또 무슨 트집을 잡을런지?\n이제 그만 나둬라', '', '', '끝이 없는 쑈 쑈!!', 'ㅋㅋㅋ 쑈라고 하는 애들 특징  1도 봉사활동 기부 해본적없음     걍 존나 머저리임', '', '뱃대기  내밀고 천박하고 경박한 정수기   미술관 박물관 음악회만 처디니던거 비교해봐라', '사진찍기 놀이에 빠진 김건희씨 ... 작작해라\n국민들 짜증나서 뉴스 안 보고싶다', '뉴시스는 석열이에 충성하네? 같은 뉴스를 두번쓰고 사진촬영 화보 올려주냐?ㅋㅋ 기레기들ㅋㅋ', '모든영부인한봉사활동 어느누구도이런식으로 뉴스에 내지않아~~아이고짜증나네', '천박하고 경박한 날라리푼수같은 말춤 뇨자 정수기 랑 비교불가네\n육영수 여사 이후  처음보는 장면이다\n고상한척 음악회  미술관 박물관 광광지만 골라 처다니던정수기\n돼지같은 몸에 처바르고 걸친 국민혈세 폼도 안나고\n국민 밉상였지\n생쥐소굴서 뭐하나    하마되것네', '수사도 안하고 사회봉사명령 받은거야? ㅎㅎㅎ 너누 가증스럽군.', '이게 욕할일인가? 여기 나쁜 댓글 다는들중에 기부라도 하는 사람있나?', '', '', '', '정숙이 생각하고 욕해라', '', '와꾸가 좋으니 그냥찍어도 화보네. 돼멜다 정숙이는 하루1억짜리 세금황제관광가서 관광객 다 내쫒고 사진찍어도 돼지던데 ㅋㅋㅋㅋㅋ']",http://www.domin.co.kr/news/articleView.html?idxno=1407632,https://n.news.naver.com/mnews/article/003/0011583068?sid=100
2022.12.19.,경남도민신문,,창녕군 인공지능 스피커·사물인터넷 독거노인 돌봐,,,http://www.gndomin.com/news/articleView.html?idxno=337237,http://www.gndomin.com/
2022.12.06.,뉴시스,,"hy, '홀몸노인 돌봄활동' 확대... 복지 사각지대 해소 앞장",,,http://www.newsis.com/view/?id=NISX20221206_0002112624&cID=13001&pID=13000,http://www.newsis.com
