Date,Press,Category,Title,Content,Comment,URL_Origin,URL_Naver
2021-05-03 21:32:04,충남일보,,"한국농어촌 부여지사, 가정의 달 맞아 독거노인 위문","[    [뉴스리뷰][앵커] 5월은 어린이날, 어버이날 등 주변 가족을 생각하고 챙기는 날이 많은데요. 그런데 독거노인들의 경우 가족들의 보살핌을 받지 못하는 경우가 대부분입니다. 여기에 코로나19 장기화로 삶이 더욱 팍팍해져 이들에 대한 관심이 필요하다는 지적입니다. 고휘훈 기자가 취재했습니다. [기자]수십 년째 혼자 사는 배만덕 씨.폐지줍기로 생계를 이어가던 그는 1년 넘게 이어지고 있는 코로나19 탓에 삶이 더욱 힘들어졌다고 말합니다.&lt;배만덕 / 부산 해운대구 반송동&gt; ""폐지가 (㎏당) 140원씩 했거든. 요새는 50원 하더라고. 고물값이 폐지뿐만 아니라 다 내려갔어. 복지관에서 도와줘요. 요새는 코로나19 때문에 자주 안 와. 옛날에는 일찍 왔지. 왔다갔다 대화도 했거든. 마음이 좀 그렇지.""3년째 홀로 생활하는 조남순 씨는 코로나19의 여파로 노인정이 문을 닫으면서 교류할 사람들이 줄었습니다.&lt;조남순 / 부산 해운대구 반송동&gt; ""그냥 있어도 긴장이 되는 거야. 내 마음이 정상이 아닌 거야. 내가 맑게 하려고 애를 써. 아프면 안 되거든.""1년 넘게 이어지고 있는 코로나19 사태는 이들의 삶을 물질뿐만 아니라 정신적으로 취약하게 하고 있습니다.&lt;이종원 / 독거노인복지재단 이사장&gt; ""지금은 경로당도 안 되고 같이 모여서 대면하는 교류 관계가 단절되다 보니까 혼자 집에서 고독하게 지내는 분이 굉장히 많아졌습니다. 정서적으로 불안정한 상태에 있는 게 사실입니다.""어버이날을 앞두고 이들에게 작은 도움이 되고자 부산지역 한 공기업 임직원들이 발 벗고 나섰습니다.상자를 준비해 카네이션과 직접 만든 반찬을 담았고 손편지도 썼습니다. &lt;배광효 / 부산환경공단 이사장&gt; ""독거노인들의 지원이 많이 준 것으로 알고 있습니다. 그런분들에게 작은 위안이 되고 위로가 되기 위해서 이런 행사를 준비했습니다.""통계청에 따르면 지난해 우리나라 전체 독거노인 인구는 158만9천 명에 달했습니다.65세 이상 노인(812만5천 명) 5명 중 한 명 꼴입니다.연합뉴스TV 고휘훈입니다. (take5@yna.co.kr)연합뉴스TV 기사문의 및 제보 : 카톡/라인 jebo23 ▶ 네이버에서 연합뉴스TV를 구독하세요 ▶ 연합뉴스TV 생방송 만나보기  ▶ 균형있는 뉴스, 연합뉴스TV 앱 다운받기 ]",[],http://www.chungnamilbo.co.kr/news/articleView.html?idxno=600955,https://n.news.naver.com/mnews/article/422/0000483529?sid=161
2021.05.06.,포인트데일리,,"무안군, 독거노인 가정 대상 '뚝딱뚝딱 주거환경 개선사업' 실시",,,http://www.thekpm.com/view.php?ud=20210506100748989242ef4e12e4_17,http://www.thekpm.com/
2021.05.09.,기호일보,,"강화노인 안성맞춤 선물 꾸러미 전달 블랙야크강태선나눔재단, 郡에 기탁",,,http://www.kihoilbo.co.kr/news/articleView.html?idxno=926051,http://www.kihoilbo.co.kr/
2021.05.02.,시민일보,,"시흥시 대야동, 저소득 독거노인 가정 방문 후원품 전달",,,https://www.siminilbo.co.kr/news/newsview.php?ncode=1065569604755302,http://www.siminilbo.co.kr
2021.05.07.,프레시안,,"김제시 성덕면, 어버이날 독거어르신 여름 이불 전달 위로 방문",,,https://www.pressian.com/pages/articles/2021050711102207096?utm_source=naver&utm_medium=search,http://www.pressian.com/
2021-05-07 13:41:04,국제뉴스,사회,"양산시삼성동,지역사회보장협의체 독거노인 카네이션 달아드리기 활동","[    [유청 기자(=김제)(yc7822@hanmail.net)]    ⓒ김제시전북 김제시 성덕면(면장 강기수)은 가정의 달 5월을 맞이해 지역내 독거어르신 등 소외계층 40세대에게 이불세트(400만원 상당)와 카네이션 꽃바구니를 전달했다. 이번 사업은 2013년부터 매해 1,000만원 이상 기부하고 있는 성덕면 나시마을 출신 익명의 기부자가 전북사회복지공동모금회를 통해 후원한 기부금을 배분받아 진행됐으며, 성덕면은 2020년 한해 동안 출향 인사의 기탁금으로‘독거노인 희망나눔 싱크대지원사업’등 총 7개의 사업을 실시한 바 있다. 이날 성덕면장과 직원 및 지역사회보장협의체 위원 등은 어르신 가정을 직접 방문해 점점 더워지는 날씨에 대비해 하절기용 이불세트와 카네이션 꽃바구니를 전달해드렸으며, 일상 생활에 불편사항이 없는지 확인하고 애로사항을 청취하는 시간을 가졌다. 이불을 전달 받은 김모 어르신은“가볍고 시원한 새이불을 받으니 앞으로는 잠을 잘 잘 것 같다”며 감사한 마음을 전했다. 강기수 성덕면장은“가정의 달을 맞이해 홀로 계신 어르신들의 외로움과 소외감을 위로하는 따뜻한 시간이 되길 바란다”며“위원들과 함께 복지사각지대 발굴 등 소외된 이웃을 살펴 행복한 성덕면 만들기에 최선을 다하겠다”고 말했다.  [유청 기자(=김제)(yc7822@hanmail.net)]▶프레시안 CMS 정기후원▶네이버 프레시안 채널 구독 ▶프레시안 기사제보Copyrightsⓒ PRESSian.com 무단전재 및 재배포금지 ]",[],http://www.gukjenews.com/news/articleView.html?idxno=2217097,https://n.news.naver.com/mnews/article/002/0002187742?sid=102
2021.05.11.,대전일보,,"대한노인회 충주시지회, 충주댐 주변 수자원 보호 추진",,,http://www.daejonilbo.com/news/newsitem.asp?pk_no=1470889,http://www.gukjenews.com/
2021.05.07.,EBN,,"서금원·신복위, 어버이날 맞아 홀몸노인에 선물 전달",,,https://www.ebn.co.kr/news/view/1482766/?sc=Naver,http://www.daejonilbo.com/
2021.05.07.,전민일보,,'올해도 혼자'... 어버이날이 더 쓸쓸한 독거노인,,,http://www.jeonmin.co.kr/news/articleView.html?idxno=331161,http://www.ebn.co.kr
2021.05.07.,메트로신문,,"광주 동구, 저소득 독거 노인가구를 대상으로 '카네이션 달아드리기' 행사를 ...",,,http://www.metroseoul.co.kr/article/20210507500148,http://www.jeonmin.co.kr
2021.05.05.,충청매일,,당진3동 독거노인 방문상담 실시,,,http://www.ccdn.co.kr/news/articleView.html?idxno=702162,http://www.metroseoul.co.kr
2021.05.10.,경인매일,,"강화군 길상면 지역사회보장협의체, 독거어르신 카네이션 화분 및 보리쌀 전달",,,http://www.kmaeil.com/news/articleView.html?idxno=280182,http://www.kmaeil.com/
2021.05.13.,아시아에이,,"기부단체 위브릿지, 독거노인 대상 서예 교실 프로그램 운영 ""사회적 관계 향...",,,http://www.asiaa.co.kr/news/articleView.html?idxno=37871,http://www.asiaarts.net
2021.05.09.,울산매일신문,,"북구노인복지관, 가정의 달 맞아 '노래로 마음잇기 캠페인'",,,http://www.iusm.co.kr/news/articleView.html?idxno=909901,http://www.iusm.co.kr
19면 1단,강원일보,,[포토뉴스]고성 간성읍새마을부녀회 독거노인 떡·과일 전달,,,http://www.kwnews.co.kr/nview.asp?aid=221050600031,http://www.kwnews.co.kr/
2021-05-07 00:33:36,백세시대,사회,"대한노인회 충북 충주시지회, K-Water지원 '충주댐 수자원 보호' 노인일자리사...",[      고성 간성읍새마을부녀회(회장:고양옥)는 6일 어버이날을 앞두고 지역 내 독거노인 150가구에 떡과 과일을 전달했다.▶ 네이버에서 강원일보 구독하기▶ 강원일보 네이버TV 바로가기ⓒ 강원일보 - www.kwnews.co.kr ],[],http://www.100ssd.co.kr/news/articleView.html?idxno=76995,https://n.news.naver.com/mnews/article/087/0000843082?sid=102
2021.05.10.,인천일보,,"한국장학진흥원, 무료수강 가능한 '사회복지사 관련 노인교육자격증 8종' 이벤...",,,http://www.incheonilbo.com/news/articleView.html?idxno=1093961,http://www.100ssd.co.kr
2021.05.06.,스포츠조선,,"롯데홈쇼핑, 어버이날 맞아 지역 독거노인에게 '건강백세꾸러미' 선물",,,http://sports.chosun.com/news/ntype.htm?id=202105070100041760002512&servicedate=20210506,http://news.itimes.co.kr
2021.05.09.,울산매일신문,,"선암호수노인복지관, 독거어르신께 카네이션 선물박스 전달",,,http://www.iusm.co.kr/news/articleView.html?idxno=909925,http://sports.chosun.com
2021-05-06 15:00:05,데일리안,경제,"백신접종 후 방치되고 있는 노인들…속도전에 급급한 정부, 사후 관리는 미흡","[    롯데홈쇼핑이 어버이날을 맞아 영등포 지역 독거노인 140가구에 '건강백세꾸러미'를 전달했다.지난 4일 열린 행사는 롯데홈쇼핑 본사가 위치한 영등포 지역 사회공헌활동인 '희망수라간' 활동의 일환으로 진행됐다. 서울 영등포구청 별관 내 희망수라간에서 진행된 전달식에는 롯데홈쇼핑 윤지환 마케팅부문장, 영등포구사회복지협의회 박화선 사무국장을 비롯한 관계자들이 참석했다. 어버이날을 맞아 지역 어르신들의 정서적 안정과 건강한 노후를 기원하며 카네이션과 갈비탕, 잡곡 등 식료품이 담긴 '건강백세꾸러미'를 '영등포 희망수라간 서포터즈'가 직접 방문해 집 앞에 걸어놓는 비대면 방식으로 전달했다.롯데홈쇼핑은 지난 2015년 영등포구청 별관 내에 조리시설 '희망수라간'을 건립하고, 매월 반찬을 정기적으로 만들어 전달하고 있다. 현재까지 총 266회, 4만 5천여 개의 반찬을 지원했다. 지난해부터는 코로나19로 인해 비대면 방식으로 음식을 전달하고 있다. 또한 지난해 3월 감염 예방이 시급한 취약계층에 '생활용품 키트'를 시작으로, 원격 수업에 어려움을 겪는 아동·청소년들에게 '학습지원꾸러미'를 지원하고, 마스크 기부 캠페인을 통해 모아진 1만 개의 마스크를 취약아동들에게 전달하는 등 지역 소외계층을 위한 다양한 언택트 상생 활동을 전개하고 있다.윤지환 롯데홈쇼핑 마케팅부문장은 ""어버이날을 맞아 지역 내 외로운 독거 어르신들의 건강을 기원하고 따뜻한 마음을 전하기 위해 카네이션과 식료품 등 '건강백세꾸러미'를 전달하게 됐다.""며, ""앞으로도 우리 사회의 소외된 이웃을 위해 뜻깊은 상생 활동을 지속적으로 전개해 나갈 것""이라고 말했다.이정혁 기자 jjangga@sportschosun.com▶재테크 잘하려면? 무료로 보는 금전 사주- Copyrightsⓒ 스포츠조선(http://sports.chosun.com/), 무단 전재 및 재배포 금지   ]",[],https://www.dailian.co.kr/news/view/987584/?sc=Naver,https://n.news.naver.com/mnews/article/076/0003725652?sid=101
2021.05.07.,헤드라인제주,,"서귀포시홀로사는노인센터, 홀로사는 어르신에 후원물품 전달",,,http://www.headlinejeju.co.kr/news/articleView.html?idxno=449461,http://www.iusm.co.kr
2021.05.09.,충청매일,,"옥천군노인장애인복지관, 노인맞춤 돌봄서비스사업로 나만의 카네이션 심기 실...",,,http://www.ccdn.co.kr/news/articleView.html?idxno=702570,http://www.ccdn.co.kr
2021.05.06.,경상일보,,'무료강의' 노년기 우울증과 치매·파킨슨병초기증상에 대한 치유 돕는 노인심...,,,http://www.ksilbo.co.kr/news/articleView.html?idxno=796565,http://ksilbo.co.kr
2021.05.09.,아시아에이,,"흙침대 전문 현대의료기, 독거노인 140가구 돌침대 무상지원",,,http://www.asiaa.co.kr/news/articleView.html?idxno=37027,http://www.asiaarts.net
2021.05.02.,경상매일신문,,"울진군노인복지관, 노인맞춤돌봄대상자 봄맞이 문화활동",,,http://www.ksmnews.co.kr/default/index_view_page.php?idx=333470&part_idx=170,http://www.ksmnews.co.kr
2021.05.06.,포인트데일리,,"무안군, 독거노인 60가정 방문...카네이션 브로치 및후원물품 전달",,,http://www.thekpm.com/view.php?ud=2021050610483620342ef4e12e4_17,http://www.thekpm.com/
16면 1단,강원일보,,[포토뉴스]화천 정재은 목사 홀몸노인 위한 손전등 기탁,,,http://www.kwnews.co.kr/nview.asp?aid=221051000075,http://www.kwnews.co.kr/
2021-05-11 00:33:01,미주중앙일보,사회,진미식품 노인회에 김치 60병 전달,"[     화천 사내면 복음중앙교회 정재은(사회복지법인 정우 대표) 목사는 11일 사내면사무소를 방문, 독거노인에게 전달해 달라며 180만원 상당의 손전등을 기탁했다.▶ 네이버에서 강원일보 구독하기▶ 강원일보 네이버TV 바로가기ⓒ 강원일보 - www.kwnews.co.kr ]",[],http://www.koreadaily.com/news/read.asp?art_id=9348885,https://n.news.naver.com/mnews/article/087/0000843421?sid=102
2021.05.03.,경인매일,,"강화군 불은면 새마을 부녀회, 75세 이상 독거노인에 밑반찬 나눔 전달",,,http://www.kmaeil.com/news/articleView.html?idxno=279108,http://koreadaily.com
2021.05.10.,백세시대,,"대한노인회 충북 보은군지회, 보은사우회봉사클럽 장수사진 촬영 봉사",,,http://www.100ssd.co.kr/news/articleView.html?idxno=76868,http://www.kmaeil.com/
2021.05.09.,백세시대,,"대한노인회 충남연합회, 충남도시개발공사 어버이날 맞이 500만원 후원",,,http://www.100ssd.co.kr/news/articleView.html?idxno=76941,http://www.100ssd.co.kr
2021.05.09.,백세시대,,"대한노인회 충남연합회, 충남도시개발공사 어버이날 맞이 500만원 후원",,,http://www.100ssd.co.kr/news/articleView.html?idxno=76941,http://www.100ssd.co.kr
2021.05.06.,브레이크뉴스,,"생거진천노인복지센터, 보험공단 장기요양기관평가 최우수기관 선정",,,http://www.breaknews.com/804430,http://www.breaknews.com
2021.05.06.,동양일보,,"한내여중 동아리 '한내비추리', 어버이날 독거노인 8가구에 생필품 전달",,,http://www.dynews.co.kr/news/articleView.html?idxno=628665,http://www.dynews.co.kr
2021.05.07.,불교공뉴스,,"옥천노인장애인복지관, 어버이날 맞이 생활교육""나만의 카네이션 심기"" 실시",,,http://www.bzeronews.com/news/articleView.html?idxno=476674,http://www.bzeronews.com
2021.05.10.,헤드라인제주,,"김녕119센터-김녕의용소방대, 독거노인 돌보미 날 운영",,,http://www.headlinejeju.co.kr/news/articleView.html?idxno=449692,http://www.headlinejeju.co.kr
2021.05.12.,백세시대,,"대한노인회 충남 서산시지회, 현대건설(주)로부터 경로당 환경개선 위한 후원...",,,http://www.100ssd.co.kr/news/articleView.html?idxno=77007,http://www.100ssd.co.kr
2021.05.13.,잡포스트,,"요양보호사, 사회복지사 관련 무료수강 과정 노인교육자격증 8종 이벤트 개시",,,http://www.job-post.co.kr/news/articleView.html?idxno=22668,http://www.job-post.co.kr/
2021.05.31.,이데일리,,"ADT캡스, 보건복지부 `응급 안전 안심서비스` 구축사업 참여",,,http://www.edaily.co.kr/news/newspath.asp?newsid=02043446629054496,http://www.edaily.co.kr/
2021-05-31 11:03:01,뉴스메이커,IT/과학,"청도군, 노인맞춤돌봄서비스 수행인력 힐링 워크숍 개최","[ 독거노인·장애인 ‘IoT 돌봄 서비스’ 구축… 오파스넷과 공동 수주9월부터 독거노인 10만명 대상 시스템 보급 예정    [이데일리 이후섭 기자] ADT캡스는 독거노인 가구를 대상으로 한 `응급 안전 안심서비스` 구축을 위해 보건복지부와 사업 계약을 체결했다고 31일 밝혔다.ADT캡스는 IT솔루션 전문업체 오파스넷과 컨소시엄을 구성해 향후 5년간 `응급 안전 안심서비스` 사업을 공동으로 추진하게 됐다. 이번 사업을 통해 ADT캡스는 응급상황 발생 시 신속하게 대응할 수 있는 사물인터넷(IoT) 돌봄 서비스 시스템을 구축하고, 오는 9월부터 독거노인 및 장애인 10만명을 대상으로 본격 보급에 나설 계획이다. 이후 2022년까지 서비스 대상을 총 20만명까지 확대할 계획이다.이번 사업은 코로나19로 인해 축소된 사회 연결망으로 독거노인의 우울 및 고독감으로 인한 사회 문제가 증가하는 데 따른 대응책으로 마련됐다. 보안 사각지대에 놓인 노인과 장애인을 효과적으로 보호하는 것은 물론이고, 방문 및 대면이 어려운 상황에서도 체계적인 비대면 돌봄이 가능해질 전망이다.ADT캡스가 참여하는 `응급 안전 안심서비스`는 고독사, 화재 등 많은 위험에 노출돼 있는 독거노인과 장애인의 응급상황에 신속한 대응을 할 수 있도록 IoT 단말을 활용해 지원하는 시스템이다. 다양한 센서를 통해 화재 및 출입 감지는 물론, 대상자의 심박, 호흡, 수면 등 활동량을 확인하고 이상 여부를 자동으로 모니터링하며 119 자동신고 기능으로 신속하게 대처할 수 있다. 응급호출버튼도 지원해 위급 시 대상자가 119와 즉시 연결할 수도 있다. 이용환 ADT캡스 사업총괄은 “ADT캡스가 그간 쌓아온 보안 인프라와 ICT 기술력을 바탕으로 케어가 필요한 사회적 약자를 위한 위기대응 시스템 구축 사업에 참여하게 됐다”며 “앞으로도 ADT캡스는 안전과 돌봄을 아우르는 기업으로서 정부기관 및 다양한 산업군과 협력해 사회 안전망 강화에 기여하며, 기업의 환경·사회·지배구조(ESG) 가치 제고에도 앞장서 나갈 것”이라고 말했다.이후섭 (dlgntjq@edaily.co.kr)▶ #24시간 빠른 #미리보는 뉴스 #eNews+▶ 네이버에서 '이데일리 뉴스'를 만나보세요▶ 빡침해소, 청춘뉘우스 '스냅타임'＜ⓒ종합 경제정보 미디어 이데일리 - 무단전재 &amp; 재배포 금지＞ ]",['9평가게를 오픈하려합니다\nCCTV월사용료는  얼마인지\n처음가입비는 얼마인지 궁금합니다'],http://www.newsmaker.or.kr/news/articleView.html?idxno=115342,https://n.news.naver.com/mnews/article/018/0004943532?sid=105
2021.05.04.,경인매일,,"강화군 양사면 자원봉사상담, 독거노인 및 소외계층 위한 계절 김치나눔 봉사...",,,http://www.kmaeil.com/news/articleView.html?idxno=279425,http://www.newsmaker.or.kr
2021.05.06.,전라일보,,"김제노인복지센터, 반려식물 다육이 전달",,,http://www.jeollailbo.com/news/articleView.html?idxno=626602,http://www.jeollailbo.com
2021.05.08.,백세시대,,"대한노인회 충북 증평군지회, 결혼이주여성들이 손수 뜬 카네이션 전달",,,http://www.100ssd.co.kr/news/articleView.html?idxno=76894,http://www.100ssd.co.kr
2021.05.31.,아시아경제,,"ADT캡스, 보건복지부 '응급 안전 안심서비스' 구축 사업 참여",,,https://view.asiae.co.kr/article/2021053110181679971,https://www.asiae.co.kr/
2021-05-31 10:17:33,뉴스프리존,경제,"대전 동구 주민사랑네트워크, 어버이 날 맞아 '독거 어르신'께 따뜻한 마음 전...","[ 9월부터 독거노인 10만명 대상 시스템 보급 예정    [아시아경제 김철현 기자] ADT캡스(대표 박진효)는 보건복지부와 독거노인 가구를 대상으로 '응급 안전 안심서비스' 구축을 위한 사업 계약을 체결했다고 31일 밝혔다.ADT캡스는 IT솔루션 전문업체 오파스넷과 컨소시엄을 구성해 향후 5년간 응급 안전 안심서비스 사업을 공동으로 추진하게 됐다. 이번 사업을 통해 ADT캡스는 응급상황 발생 시 신속하게 대응할 수 있는 사물인터넷(IoT) 돌봄 서비스 시스템을 구축하고, 오는 9월부터 독거노인 및 장애인 10만명을 대상으로 본격 보급에 나설 계획이다. 이후 2022년까지 서비스 대상을 총 20만명까지 확대할 예정이다.이번 응급 안전 안심서비스 구축 사업은 코로나19로 인해 축소된 사회 연결망으로 독거노인의 우울 및 고독감으로 인한 사회 문제가 증가하는 데 따른 대응책으로 마련됐다. 보안 사각지대에 놓인 노인과 장애인을 효과적으로 보호하는 것은 물론이고, 방문 및 대면이 어려운 상황에서도 체계적인 비대면 돌봄이 가능해질 전망이다.ADT캡스가 참여하는 응급 안전 안심서비스는 고독사, 화재 등 많은 위험에 노출돼 있는 독거노인과 장애인의 응급상황에 신속한 대응을 할 수 있도록 IoT 단말을 활용해 지원하는 시스템이다. 다양한 센서를 통해 화재 및 출입 감지는 물론, 대상자의 심박, 호흡, 수면 등 활동량을 확인하고 이상 여부를 자동으로 모니터링하며 119 자동신고 기능으로 신속하게 대처할 수 있다. 응급호출버튼도 지원해 위급 시 대상자가 119와 즉시 연결할 수도 있다.이용환 ADT캡스 사업총괄은 ""ADT캡스가 그간 쌓아온 보안 인프라와 ICT 기술력을 바탕으로 케어가 필요한 사회적 약자를 위한 위기대응 시스템 구축 사업에 참여하게 됐다""며 ""앞으로도 ADT캡스는 안전과 돌봄을 아우르는 기업으로서 정부기관 및 다양한 산업군과 협력해 사회 안전망 강화에 기여하며 기업의 ESG 가치 제고에도 앞장서 나갈 것""이라고 했다.김철현 기자 kch@asiae.co.kr▶ 속 시원한 풀이! 2021년 정통사주·운세·토정비결▶ 내가 몰랐던 당신들의 이야기 [나돌] 네이버TV▶ 투자 성공의 핵심은 기업분석! 'CORE' 바로가기&lt;ⓒ경제를 보는 눈, 세계를 보는 창 아시아경제 무단전재 배포금지&gt;   ]",[],http://www.newsfreezone.co.kr/news/articleView.html?idxno=314273,https://n.news.naver.com/mnews/article/277/0004911522?sid=101
2021.05.10.,백세시대,,"대한노인회 경북 예천군지회, 예천군종합자원봉사센터에서 카네이션 400개 전...",,,http://www.100ssd.co.kr/news/articleView.html?idxno=76877,http://www.newsfreezone.co.kr/
2021.05.06.,인천일보,,"한국장학진흥원, 무료수강 교육과정 사회복지사 관련 노인교육자격증 8종 이벤...",,,http://www.incheonilbo.com/news/articleView.html?idxno=1093091,http://www.100ssd.co.kr
2021.05.31.,프레시안,,"홍천군, 폭염피해 최소화 위한 ‘폭염 종합대책’ 추진",,,https://www.pressian.com/pages/articles/2021053113351881367?utm_source=naver&utm_medium=search,http://news.itimes.co.kr
2021.05.11.,잡포스트,,"대구 중구노인복지관, 홀몸어르신 초청 어버이날 기념행사 '사랑해_효' 개최",,,http://www.job-post.co.kr/news/articleView.html?idxno=22353,http://www.pressian.com/
2021-05-31 15:22:22,울산제일일보,사회,울산 울주재가노인지원서비스센터 효박스 전달,"[    [신상훈 기자(=홍천)(mic1080@naver.com)]홍천군이 다가오는 폭염으로부터 취약계층을 보호하고 각종 안전사고에 대비하기 위한 ‘2021년 폭염 종합대책’을 수립, 오는 9월말까지 추진한다. 군은 폭염대책 T/F팀을 구성하고 실시간 폭염 상황 모니터링을 진행하는 등 폭염 피해 최소화를 위한 선제적 대응에 나선다고 31일 밝혔다.     ⓒ홍천군 우선, 폭염특보 발령시 재해문자전광판, 경보방송, 마을방송시스템 등을 통해 주민행동요령을 전파하고 재난문자 서비스를 제공할 예정이다. 특히 올해부터는 드론조종 자격증을 보유한 자율방재단원을 중심으로 드론을 활용한 폭염 예찰활동도 전개할 계획이다. 폭염특보 발령시 드론을 띄워 논·밭, 비닐하우스 등 야외에서 일하고 있는 어르신 등이 확인되면 경보방송 및 마을방송을 통해 휴식을 취할 수 있도록 안내방송을 실시하는 한편 이장에게 연락을 취해 온열질환 발생 등 인명피해 예방에 만전을 기할 방침이다. 또 홀몸 어르신, 거동불편자 등 폭염취약계층을 위해 방문건강관리사, 독거노인생활관리사, 자율방재단 등으로 구성된 재난도우미를 통해 방문 및 전화로 안전을 확인하고 보냉병 등 무더위를 식힐 수 있는 폭염 대처 용품도 전달할 예정이다. 이밖에 폭염으로부터 보행자를 보호하기 위해 횡단보도 등 10곳에 설치된 그늘막 및 스마트그늘막을 운영하고, 코로나19 방역수칙에 따라 시원한 그늘이 만들어지는 곳을 야외무더위쉼터로 지정해 운영할 계획이다. 허필홍 홍천군수는 “앞으로도 주민들이 안전하고 시원한 여름을 보낼 수 있도록 폭염 저감 대책과 예방활동에 최선을 다하겠다”고 말했다.[신상훈 기자(=홍천)(mic1080@naver.com)]▶프레시안 CMS 정기후원▶네이버 프레시안 채널 구독 ▶프레시안 기사제보Copyrightsⓒ PRESSian.com 무단전재 및 재배포금지 ]",[],http://www.ujeil.com/news/articleView.html?idxno=275332,https://n.news.naver.com/mnews/article/002/0002191752?sid=102
2021.05.31.,노컷뉴스언론사 선정,,[그래?픽!]무엇이 청년들의 고독한 죽음 부르나,,,https://www.nocutnews.co.kr/news/5561221,http://www.job-post.co.kr/
2021.05.31.,노컷뉴스언론사 선정,,[그래?픽!]무엇이 청년들의 고독한 죽음 부르나,,,https://www.nocutnews.co.kr/news/5561221,http://www.nocutnews.co.kr
