Date,Press,Category,Title,Content,Comment,URL_Origin,URL_Naver
2022.12.31.,동아일보,,"황희찬, 독거노인·아동센터에 패딩 200벌 기부 “따뜻함 나누고 싶어”",,,https://www.donga.com/news/article/all/20221231/117233477/2,http://www.donga.com/
None,뉴시스,,"미래에셋생명, 독거노인 '찾아가는 치과 서비스' 실시",[],[],http://www.newsis.com/view/?id=NISX20221229_0002141089&cID=15001&pID=15000,https://sports.news.naver.com/news.nhn?oid=020&aid=0003471253
2022.12.29.,연합뉴스,,"[게시판] 현대퓨처넷, 저소득층 한부모 가정·독거노인 지원금 2천만원",,,https://www.yna.co.kr/view/AKR20221229059200003?input=1195m,http://www.newsis.com
2022-12-29 13:53:59,스타데일리뉴스,경제,"아이유, 올 연말에도 꾸준한 선행 → 아동∙독거노인∙난방 취약층 등 지원","[     [서울=뉴시스] 남정현 기자 = 미래에셋생명이 구로노인종합복지관에서 '찾아가는 치과 서비스'를 실시했다고 29일 밝혔다. '찾아가는 치과 서비스'는 독거노인들의 치아 건강을 위해 미래에셋생명이 서울대치과병원, 독거노인종합지원센터와 협약을 체결해 2017년부터 진행해 왔다. 경제적 어려움으로 치과진료를 받기 힘든 독거노인을 위해 서울대치과병원 의료진이 직접 현장을 찾아 충치 치료부터 틀니 수리, 스케일링 등 다양한 진료를 수행하고 생활 속 구강관리 교육도 함께 진행한다. 즉각적인 치료가 어려운 환자들은 서울대치과병원에서 심화치료를 이어갈 수 있도록 돕는다. 미래에셋생명은 '배려가 있는 따뜻한 자본주의의 실천'이라는 구호 아래 미래에셋박현주재단과 연계해 사회공헌 활동을 펼치고 있다. 코로나19 대유행 시기엔 임직원들이 직접 방역마스크·북커버 등 필수품을 만들어 사회경제적 취약계층에게 전달하는 참여형 봉사활동을 진행한 바 있다. 황병욱 미래에셋생명 홍보실장은 ""미래에셋생명은 상부상조와 사랑 실천이라는 생명보험업의 본질에 입각해 다양한 사회공헌 프로그램을 진행하고 있다""며 ""앞으로도 우리 주변에 소외된 이웃들과 상생할 수 있는 활동을 통해 ESG경영을 실천하겠다""고 밝혔다. ]",[],http://www.stardailynews.co.kr/news/articleView.html?idxno=405750,https://n.news.naver.com/mnews/article/003/0011617034?sid=101
2022.12.31.,UPI뉴스,,[창녕군 소식] 독거노인 월동용품 지원-아동급식 단가 8000원으로,,,http://www.upinews.kr/newsView/upi202212300061,https://www.yna.co.kr/
2022-12-29 10:38:11,연합뉴스,사회,"[동정] 조규홍 장관, 독거노인·장애인 응급안전안심서비스 현장 방문",[    ▲ 현대백화점그룹 계열 정보통신기술(ICT) 기업 현대퓨처넷은 29일 서울 사회복지공동모금회에 지역 소외계층을 위한 생활지원금 2천만원과 생필품을 지원했다. 이날 전달된 지원금과 생필품은 서울 서초구에 거주하는 저소득층 한부모 가정과 독거노인 20여 가구에 전달될 예정이다. (서울=연합뉴스)    현대퓨처넷 로고[현대백화점그룹 제공. 재판매 및 DB 금지] ],[],https://www.yna.co.kr/view/AKR20221229115100530?input=1195m,https://n.news.naver.com/mnews/article/001/0013669854?sid=102
2022.12.30.,서울와이어,,"한국자유총연맹 운남면분회, 쌀50포 독거노인 후원",,,http://www.seoulwire.com/news/articleView.html?idxno=490705,http://www.stardailynews.co.kr
2022.12.27.,뉴스1,,윤 정부 노인일자리 축소에 김동연 “공동체 희망 만드는 역할 충실”(종합),,,https://www.news1.kr/articles/4907480,http://upinews.kr
2022.12.28.,아주경제,,"NH농협손보, 구세군에 독거노인 겨울나기 후원물품 기부",,,https://www.ajunews.com/view/20221228091301816,https://www.yna.co.kr/
2022-12-29 15:20:42,천지일보,사회,"미래에셋생명, 독거노인 위한 찾아가는 치과 서비스 실시","[    ▲ 조규홍 보건복지부 장관은 겨울철을 맞아 29일 세종시 소재 독거노인 댁을 방문해 안부를 살피고 '독거노인·장애인 응급안전안심서비스' 사업 현황을 확인했다. 이 서비스는 독거노인과 장애인 가정 내에 정보통신기술(ICT) 기반 장비를 설치해 화재, 낙상 등 응급상황 발생시 119에 신속한 연결을 도와 구급·구조를 지원하는 사업이다. 이 사업으로 올해 11월 말 기준 전국 17만8천여가구에 장비를 보급했으며, 내년까지 누적 30만가구로 대상을 확대할 계획이다. (서울=연합뉴스)    독거노인·장애인 응급안전안심서비스 현장 방문한 조규홍 장관(서울=연합뉴스) 조규홍 보건복지부 장관이 29일 세종시에 거주하는 '독거노인·장애인 응급안전안심서비스' 사업 대상자댁을 방문, 응급관리요원에게 응급안심서비스에 대한 설명을 듣고 있다. 2022.12.29 [보건복지부 제공. 재판매 및 DB 금지] photo@yna.co.kr ]",[],http://www.newscj.com/article/20221229580724,https://n.news.naver.com/mnews/article/001/0013670915?sid=102
2022.12.30.,미주한국일보,,"해외동포들, 한국 독거노인들에 쌀 100포대·연탄 2만장 전달",,,http://www.koreatimes.com/article/1446900,http://www.koreatimes.com
2022.12.30.,뉴스프리존,,"창녕군, 홀몸노인 월동용품 지원",,,http://www.newsfreezone.co.kr/news/articleView.html?idxno=434777,http://www.newsfreezone.co.kr/
2022.12.31.,아시아에이,,"현대퓨처넷, 한부모 가정·독거노인에 생활지원금 2000만원 기부",,,http://www.asiaa.co.kr/news/articleView.html?idxno=110317,http://www.asiaarts.net
2022.12.30.,디트뉴스24,,"'고령친화도시' 공주시, 빅데이터로 노인복지 활성화",,,http://www.dtnews24.com/news/articleView.html?idxno=738089,http://www.dtnews24.com/
2022.12.28.,KTV국민방송,,쪽방촌·독거노인 등 취약계층 난방비 긴급지원,,,https://www.ktv.go.kr/content/view?content_id=665979,http://www.ktv.go.kr
2022.12.30.,경기신문,,"[특집] 용인특례시, 노인을 위한 '아름다운 공간' 만든다",,,https://www.kgnews.co.kr/news/article.html?no=731025,http://www.kgnews.co.kr/
2022.12.29.,브레이크뉴스,,"미래에셋생명, 독거노인 위한 찾아가는 치과 서비스 진행",,,http://www.breaknews.com/941007,http://www.breaknews.com
2022.12.28.,새전북신문,,무주군 독거노인 방문 영양관리,,,http://sjbnews.com/news/news.php?number=766774,http://www.sjbnews.com/
2022.12.26.,뉴시스,,"서귀포시, 독거노인 냉·난방비 지원금 상향",,,http://www.newsis.com/view/?id=NISX20221226_0002136576&cID=10813&pID=10800,http://www.newsis.com
2022-12-26 14:56:56,이뉴스투데이,사회,"백령면지사체, 독거노인 등 주거개선 특화사업 마무리","[ 기사내용 요약연 8만5000원→10만원…내년 2847명 지원 계획    [서귀포=뉴시스] 서귀포시 청사 전경. (사진=서귀포시 제공)  *재판매 및 DB 금지[제주=뉴시스] 양영전 기자 = 제주 서귀포시는 내년부터 '홀로 사는 노인 에너지드림' 지원금을 기존 연 8만5000원에서 10만원으로 인상해 지원한다고 26일 밝혔다.이 사업은 경제적 부담 등으로 에너지 이용에 어려움을 겪는 독거노인에게 전기, 가스, 등유, 연탄 구입 등에 필요한 에너지 이용 비용을 지원하는 내용을 담고 있다.지원 대상은 노인 맞춤 돌봄서비스 대상자 중 기초주거급여, 차상위계층 및 기초연금 자격을 가진 실제 홀로 사는 노인이다. 시는 내년에 2847명을 대상으로 2억8470만원을 지원할 계획이다. 단, 에너지바우처, 긴급지원 사업 등 유사 중복 사업 지원자는 제외된다.시 관계자는 ""취약계층이 동·하절기 충분한 에너지 혜택을 누릴 수 있도록 내년 사업 추진 시기를 앞당겨 서비스 이용 어르신이 쾌적한 한 해를 보낼 수 있도록 최선을 다하겠다""고 말했다. ]",[],http://www.enewstoday.co.kr/news/articleView.html?idxno=1626380,https://n.news.naver.com/mnews/article/003/0011610688?sid=102
2022.12.23.,뉴시스,,"KDB나눔재단, 독거노인가정에 4000만원 기부물품 전달",,,http://www.newsis.com/view/?id=NISX20221223_0002134082&cID=15001&pID=15000,http://www.newsis.com
2022-12-23 11:34:45,아주경제,경제,"김동연 지사, '노인일자리는 희망' 이다","[     [서울=뉴시스]23일 독거 노인 가정 기부물품 전달식을 가진 이은우 KDB나눔재단 사무총장(왼쪽)과 김현미 독거노인종합지원센터 센터장. (사진=산업은행 제공) *재판매 및 DB 금지[서울=뉴시스] 김형섭 기자 = 한국산업은행의 KDB나눔재단은 독거노인종합지원센터를 통해 기부물품 전달식을 진행했다고 23일 밝혔다.기부물품은 4000만원 상당의 겨울침구세트로 한파 지역 독거 노인 가정에 전달된다. 서울·경기·강원 지역 15개 노인돌봄서비스 수행기관의 생활지원사가 직접 참여해 나눔이 이뤄질 예정이다.KDB나눔재단은 ""앞으로도 산업은행과 함께 사회적 책임을 다하기 위해 소외계층, 복지 사각지대 발굴에 적극 지원할 계획""이라고 전했다. ]",[],https://www.ajunews.com/view/20221228100558908,https://n.news.naver.com/mnews/article/003/0011607054?sid=101
2022.12.28.,충북일보,,참사랑봉사회 화산동 독거노인 집수리봉사,,,https://www.inews365.com/news/article.html?no=745992,http://www.ajunews.com
B5면 1단,매일경제,,"에쓰오일, 독거노인·장애인 805가구에 난방유 후원",,,https://www.mk.co.kr/article/10583864,http://www.inews365.com
2022.12.29.,뉴스워커,,"무안읍 독거노인생활관리사, 훈훈한 이웃의 정 전해",,,http://www.newsworker.co.kr/news/articleView.html?idxno=187121,http://www.mk.co.kr/
2022-12-27 15:59:03,뉴스1,경제,김태흠 지사 “신속한 제설…쪽방촌‧독거노인 돌볼 것”,"[     류열 에쓰오일 사장(왼쪽)이 14일 서울 중구 사회복지공동모금회에서 조흥식 사회복지공동모금회 회장과 성금 전달식 후 기념 촬영을 하고 있다. 【사진 제공=에쓰오일】에쓰오일이 연말을 맞아 도움의 손길이 필요한 이웃을 위해 사회복지공동모금회 사랑의 열매에 이웃사랑성금 30억원을 기탁했다. 에쓰오일은 2005년부터 사회복지공동모금회 희망 나눔 캠페인에 참여하고 있으며, 누적 기부액 기준으로 올해 '200억 클럽'에 가입했다.이와 별도로 에쓰오일은 올 한 해 고객 6300여 명의 '에쓰오일 보너스포인트' 기부금과 에쓰오일 성금으로 조성한 2268만원을 사랑의 열매에 전달했다. 이 기부금은 만 18세가 돼 보육시설에서 나와야 하는 청소년의 홀로서기를 돕는 데 쓰일 예정이다.에쓰오일은 지난달 16일에도 에너지 빈곤층에 난방유를 지원하는 '호프 투 유, Hope to You(油)' 캠페인 기부금 3억원을 한국사회복지협의회에 전달했다. 이 기부금은 전국 사회복지기관을 통해 선정된 조손가정·독거노인·장애인·다문화가정 등 총 805가구에 난방유를 제공하는 데 사용된다. 에쓰오일은 겨울철에 보일러를 사용하지 못하는 에너지 빈곤층에 2015년부터 난방유를 지원하고 있으며, 올해까지 8년 동안 총 3691가구에 16억5000만원을 후원했다. ]",[],https://www.news1.kr/articles/4903672,https://n.news.naver.com/mnews/article/009/0005066225?sid=101
2022.12.27.,경남매일신문,,창녕군， 독거노인ㆍ취약계층 땔감나누기 행사,,,http://www.gnmaeil.com/news/articleView.html?idxno=510429,http://www.newsworker.co.kr
2022.12.29.,머니S,,"김동연 ""노인일자리는 희망...공동체희망 만드는 역할 충실히하겠다",,,http://moneys.mt.co.kr/news/mwView.php?no=2022122908412245389,http://news1.kr/
2022-12-23 12:54:44,부산일보언론사 선정,사회,"초고령 사회 부산, 노인 맞춤형 복지 정책 펼쳐야","[ 도-시군 한파·강설 긴급 점검회의    23일 김태흠 지사가 도-시군 한파·폭설 긴급 점검회의를 주재하고 있다. (충남도 제공)(대전ㆍ충남=뉴스1) 이찬선 기자 = 23일 충남 서해안 지역을 중심으로 강설과 한파가 이어지고 있는 가운데 충남도는 시·군은 긴급 점검회의를 열고 대응 방안을 논의했다.이날 영상회의에서 김태흠 지사는 “24일 아침까지 도내에서 최대 25㎝의 강설이 예상되고, 한파도 절정에 이를 것으로 보인다”며 “축사와 비닐하우스, 양식장 피해 예방에 철저히 대비해 줄 것”을 당부했다.김 지사는 “도로 관리 부서에서는 발빠른 제설 작업을 통해 도민 불편을 최소화하고, 농어업 및 축산 담당 부서에서는 비닐하우스나 축사 붕괴, 양식장 피해가 없도록 각별히 대응하라”고 강조했다.이어 “쪽방촌 거주자, 독거노인 등이 한파로 어려움을 겪지 않도록 세밀하게 살피고, 필요 시 즉각 대응할 것”을 주문했다.김 지사는 “성탄절과 연말연시를 맞아 모임과 이동이 증가하며 안전사고 위험이 커질 수 있는 만큼, 인파가 모이는 지역에 대한 관리에도 철저를 기해달라”고 말했다.22일부터 23일 오전 5시까지 내린 도내 적설량은 평균 6.9㎝, 최고는 서천 39.1㎝로 나타났다. 서천군에는 대설경보가, 나머지 시‧군에는 대설 주의보가 발령됐다. 한파주의보는 천안, 공주 등 10개 시‧군에, 강풍 경보는 보령, 서산 등 6개 시‧군에, 서해 중부 앞바다는 풍랑주의보가 내려졌다.강설 및 한파로 인해 한랭질환자는 총 9명이 발생해 1명이 사망했으며, 도로 3곳과 여객선 항로 7개소가 통제됐다. 도는 22일 오후 7시 30분부터 비상 2단계를 가동하고, 도와 시‧군 공무원 등 346명이 비상근무에 돌입했다. 충남도는 시장비가림 등 취약 구조물 83동, 농업용 비닐하우스 3366동, 인삼재배시설 192동, 축사 519동 등을 대상으로 예찰을 실시했다.수산증양식시설 84개소는 결박했으며, 선박 374척이 대피중이다.충남도는 제설 작업에 인력 2255명과 장비 1813대, 염화칼슘 등 자재 2680톤을 투입했다.   ]",['왜 천안은 제설안하는겨'],https://www.busan.com/view/busan/view.php?code=2022122518115445538,https://n.news.naver.com/mnews/article/421/0006536670?sid=102
2022.12.30.,여성소비자신문,,"현대백화점그룹 현대퓨처넷, 저소득층 한부모 가정-독거노인 생활지원금 2000...",,,http://www.wsobi.com/news/articleView.html?idxno=186977,http://www.gnmaeil.com
2022.12.28.,충청타임즈,,김영환 지사 충북노인종합복지관 위문,,,http://www.cctimes.kr/news/articleView.html?idxno=733793,http://www.cctimes.kr
2022.12.26.,한국경제,,"경기도사회서비스원, '경기도 노인맞춤돌봄서비스 우수 수행기관' 11곳 선정",,,https://www.hankyung.com/society/article/202212261320h,http://www.hankyung.com/
2022-12-26 14:54:01,충청일보,사회,"청주시 강서1동지사협, 독거노인 연말선물 지원 사업 추진","[     경기도사회서비스원은 행정 및 운영관리 분야 우수기관으로 '성남시독거노인종합지원센터' 등 우수 수행기관 11곳을 선정했다.경기도사회서비스원 제공경기도사회서비스원 소속 경기도노인맞춤돌봄‧응급안전안심서비스광역기관(이하 경기도노인맞춤돌봄지원센터)이 2022년 경기도 노인맞춤돌봄서비스 우수 수행기관 11곳을 선정했다고 26일 밝혔다.경기도노인맞춤돌봄지원센터는 도 노인맞춤돌봄서비스 수행기관 중 3차례의 내외부 심사를 거쳐 기준 이상의 서비스 품질을 갖춘 기관을 발표했다.선정 기준은 행정 및 운영관리, 우수프로그램, 종사자 체계관리, 특화서비스 등 4개 분야에서 진행했다.우수기관으로는 △행정 및 운영관리 분야(팔달노인복지관, 성남시독거노인종합지원센터, 화성시서부노인복지관, 안양시율목종합사회복지관, 광명시립소하노인종합복지관) △우수프로그램 분야(용인대학교사회봉사센터, 평택북부노인복지관), △특화서비스 분야(부천시오정노인복지관, 단원구노인복지관, 고양시대화노인종합복지관) △종사자 체계관리 분야(파주시노인복지관)이 선정됐다.센터는 오는 30일까지 우수기관에 직접 방문해 인증서를 전달하고 현판식을 진행할 예정이다.정임정 경기도노인맞춤돌봄지원센터장은 “코로나19로 인한 사회적 여건과 서비스 방식 변경 등의 어려움 속에서 수행기관 종사자의 노력 덕분에 우수한 돌봄서비스를 제공하게 됐다”며 “우수 수행기관 모델을 도내 확산을 통해 경기도 노인맞춤돌봄서비스 역할 강화와 선도적인 역할을 해나갈 수 있도록 지원하겠다”라고 말했다.한편, 경기도노인맞춤돌봄센터광역기관은 경기도사회서비스원 산하 광역 공공센터로 노인맞춤돌봄서비스·응급안전안심서비스 수행기관 139개소의 서비스 품질 향상과 안정적인 운영지원을 위해 지난 4월 28일 개소해 운영 중이다.수원=윤상연 기자 ]",[],https://www.ccdailynews.com/news/articleView.html?idxno=2177013,https://n.news.naver.com/mnews/article/015/0004791943?sid=102
2022.12.22.,데일리한국,,HDC현대산업개발 '관악구 노인회에 쌀 1000kg' 기부,,,https://daily.hankooki.com/news/articleView.html?idxno=907006,http://ccdailynews.com
2022.12.28.,천지일보,,"서정대 HiVE사업 센터, 독거노인가구에 생활지원 가능한 AI 돌봄로봇 전달",,,http://www.newscj.com/article/20221228580385,http://daily.hankooki.com
11면 1단,부산일보언론사 선정,,고성 노인 40% ‘나 혼자 산다’,,,https://www.busan.com/view/busan/view.php?code=2022122116562275356,http://www.newscj.com
2022.12.28.,이데일리,,"협동조합 '라떼는 집밥', 요리학교 통해 노인 일자리 창출 및 정규직 채용",,,http://www.edaily.co.kr/news/newspath.asp?newsid=02712566632563112,http://www.busan.com/
2022-12-22 13:43:04,신아일보,사회,"군위군 바른삶청년연합회, 독거노인에 따듯한 보금자리 선물","[ 고성군, 2022년 노인실태조사 결과 발표관내 거주 노인 10명 중 4명은 나홀로 생활    부산일보DB경남 고성에 사는 노인 10명 중 4명은 홀로 생활하고 있고, 이 기간이 10년을 넘기면 삶의 만족도가 크게 떨어지는 것으로 조사됐다.고성군은 21일 관내 만 65세 이상 노인가구 1000명을 대상으로 실시한 ‘2022년 노인실태조사 결과’를 발표했다.이번 조사는 효율적인 노인 복지 정책 수립 기초자료를 확보하기 위한 과정이다. 고성군과 동남지방통계청, 전문가로 구성된 협의체가 제시한 조사표를 토대로 8월 8일부터 8월 23일까지 방문 면접 방식으로 진행했다. 2019년 실시한 1차 조사를 바탕으로 통계청의 기초 통계분석에 경남연구원의 심층분석을 더해 결과를 도출했다.분석 결과, 고성군의 노인 비율은 31.2%로 이 중 41.0%가 독거노인이었다. 혼자 거주한 기간은 10년 이상이 61.5%로 가장 많았다. 5년 이상 10년 미만(17.6%), 3년 이상 5년 미만(10.2%), 1년 이상 3년 미만(7.9%), 1년 미만(2.7%) 순이었다.삶의 만족도는 10년 이상 혼자 거주한 노인의 73.5%가 불만족스럽다고 응답했다. 반면 혼자 산 기간이 1년 미만인 노인은 대부분 만족한다고 답했다.조사 대상의 1년간 월평균 소득은 50만 원 이상 100만 원 미만이 38.8%로 가장 많았다.특히 배우자 유무의 차이도 컸다. 배우자가 있는 노인은 50∼100만 원이 36.5%로 가장 많았고 독거노인은 45.0%가 50만 원 미만이었다.가장 선호하는 일자리는 환경미화·학교 도우미가 30.8%로 가장 많았다.군은 이번 조사 결과를 바탕으로 노인 문제 해결 방안을 마련할 계획이다.11월 말 기준 고성군 노인 인구는 1만 6944명으로 전체(4만 9871명)의 33.9%다. 이미 고령화를 넘어 초고령화사회에 진입한 상태다.이기봉 부군수는 “이번 조사를 통해 노인들이 진정으로 원하는 것이 무엇인지 알 수 있었다”면서 “군민을 위한 맞춤형 정책을 수립하는 데 적극적으로 활용하겠다”고 말했다. ]","['노인을 위한 나라는 없다', '노년엔 자식도다필요없다 돈이쵝오', '노인 분들중 여성분들은 괜찮을것같은데....', '남녀랑 아무 상관없다. 독거노인 여성도 마찬가지다. 외로움. 내가 잘 안다.', '']",http://www.shinailbo.co.kr/news/articleView.html?idxno=1641618,https://n.news.naver.com/mnews/article/082/0001189996?sid=102
2022.12.27.,중부매일,,"남일초등학교, 지역 내 독거노인 위한 사랑나눔상자 전달",,,http://www.jbnews.com/news/articleView.html?idxno=1380343,http://www.edaily.co.kr/
2022-12-28 16:15:01,경북도민일보,사회,"칠곡 약목면 청협, 독거노인 위한 사랑의 도시락 배달","[    [이데일리 이윤정 기자] 협동조합 라떼는 집밥은 연계 운영 중인 요리학교 교육과정을 수료한 노인 수강생을 위하여 지속적인 일자리 창출과 정규직 채용을 진행한다고 28일 밝혔다.    (사진=협동조합 라떼는 집밥)이는 노인인구가 20%를 넘어선 강북구의 노인 복지 사업의 일환으로 저소득, 독거노인을 대상으로 요리학교를 진행하며 사회에서 소외된 노인층에게 장기적이고 지속적인 지원을 제공한다.특히 교육과정을 수료한 노인 수강생을 강북구 지역 공유공간인 협동조합 라떼는 집밥에 정규채용해 요리연구와 식당 매니저, 바리스타 등으로 활동할 수 있도록 지원하며 노인 인력의 전문성을 더했다. 또한 강북구 희망일자리 플랫폼 ‘푸드 팩토리 도시락’ 사업을 통해 지역 취약계층 100명에게 매일 도시락 배달을 진행하며 노인 일자리 창출과 지역사회 소통의 장을 단단히 하고 있다.    (사진=협동조합 라떼는 집밥)라떼는 집밥 관계자는 “사회에서 소외된 노인층들이 다시 사회에서 일하고, 도전하고, 새로운 꿈을 찾을 수 있도록 다양한 방법을 동원해 지속적이고 실질적인 지원을 진행하고 있다”고 전했다.현재 라떼는 집밥의 채용기준은 65세부터 88세까지로 2022년 10명의 노인 직원을 추가 고용하며 지역사회와 활발히 소통하고 있다. ]",[],http://www.hidomin.com/news/articleView.html?idxno=503257,https://n.news.naver.com/mnews/article/018/0005395757?sid=102
2022.12.25.,경인일보,,"곤지암농협, 독거노인 사랑의 크리스마스 꾸러미 전달",,,http://www.kyeongin.com/main/view.php?key=20221223010004455,http://www.kyeongin.com
2022.12.26.,농민신문,,"전남 나주 남평농협, 독거노인에 동지팥죽 전달",,,https://www.nongmin.com/article/20221226500285,https://www.nongmin.com/
2022-12-26 18:41:01,대구일보,사회,"군위 바른삶청년연합회, 독거노인에 새 보금자리 선물","[       전남 나주 남평농협(조합장 최공섭)이 최근 ‘사랑의 동지팥죽 나눔 행사’를 가졌다(사진). 동지를 맞아 겨울을 따뜻하게 보내시라고 격려하는 취지에서 마련된 이번 행사에는 남평농협 부녀회장들이 참여해 300여명의 지역 독거노인들에게 동지팥죽과 김 한톳씩을 전달했다.최공섭 조합장은 “동지팥죽을 나눠 먹음으로써 코로나19로 인해 힘들었던 한해를 떨쳐내고, 내년 계묘년에는 모두들 건강하고 좋은 일만 가득하기를 기원한다”고 말했다. 나주=이상희 기자 ]",[],http://www.idaegu.com/newsView/idg202212260081,https://n.news.naver.com/mnews/article/662/0000011987?sid=102
2022.12.28.,목포MBC,,서울 쪽방촌과 독거노인에 무안고구마 전달,,,https://mpmbc.co.kr/article/P9aDqCrAHZda,http://www.idaegu.com
2022.12.21.,연합뉴스,,"경남 고성군 10년 이상 혼자 산 노인 73% ""삶 불만족""",,,https://www.yna.co.kr/view/AKR20221221125900052?input=1195m,http://www.mpmbc.co.kr
2022.12.27.,충북일보,,"청주서원노인복지관, 보건복지부장관상 등 잇단 수상",,,https://www.inews365.com/news/article.html?no=745867,https://www.yna.co.kr/
