Date,Press,Category,Title,Content,Comment,URL_Origin,URL_Naver
2022-12-29 11:00:00,불교공뉴스,경제,[2022 송년사] 송인헌 괴산군수,"[ 기사내용 요약국토부, 2023년 신규 지원사업 대상지역 선정6개 광역 지자체 13곳 선정…총 109억원 지원헬스케어·이동약자 모빌리티·안전기술 등 체감    국토교통부는 경상남도 산청군 재생사업지 내 건축물 157동(전체 87%)에 화재감지 및 긴급출동 서비스, 독거노인 40호에 AI기반 안심케어 서비스 및 안전 스마트폴 서비스를 구축하여 사업지 전반에 촘촘한 안전·복지망을 강화할 예정이다.  (사진 제공=국토부) *재판매 및 DB 금지[서울=뉴시스] 고가혜 기자 = 국토교통부가 2023년에 추진할 '생활밀착형 도시재생 스마트기술 지원사업' 대상지 13곳을 최종 선정했다.국토부는 내년도 '생활밀착형 도시재생 스마트기술 지원사업' 대상지로 ▲강원(강릉, 원주) ▲경남(밀양, 산청, 함안) ▲경북(영주) ▲광주(동구) ▲전남(목포, 무안, 순천, 함평) ▲전북(남원, 무주)을 선정했다고 29일 밝혔다.생활밀착형 도시재생 스마트기술 지원사업은 이미 선정돼 시행 중인 도시재생사업의 세부기능과 연계한 스마트서비스를 구축해 안전·소방, 교통, 생활·복지 등 주민생활과 밀접한 분야의 지역문제를 개선하고 재생사업 효과를 제고하기 위한 사업으로, 2020년부터 매년 15곳 내·외를 선정해 사업을 추진하고 있다. 이번 공모에서는 지난 16일 도시재생·스마트시티 전문가로 구성된 평가위원회에서 '도시재생사업 연계성'과 '서비스 지속가능성' 등을 중점으로 평가해 최종 선정된 사업지에 총 사업비 109억원(국비 62억원, 지방비 47억원)을 지원한다.먼저 강원 원주시는 2019년 선정된 주거지원형 사업으로 모심과 돌봄사업으로 실버케어센터를 구축하고, 풍요로운 마을조성을 위해 소공원 및 열린 도심텃밭 조성사업 등을 진행 중이다. 국토부는 이 시설 잉여공간에 헬스케어 플랫폼을 구축해 데이터 기반의 맞춤형 프로그램 및 코칭활동 서비스를 제공하고, 재생에너지를 활용한 스마트팜서비스 등을 구축해 도시재생기능 강화형 서비스를 제공할 예정이다.또 전라북도 무주군은 지난 2021년 일반근린형 사업에 선정돼 고령자 맞춤형 거점시설 조성 등을 통해 '행복한 100세 건강도시, 무주'를 조성 중인데, 국토부는 재생사업 테마와 연계해 사업지내 이동약자 모빌리티를 대상으로  통합관제플랫폼을 구축하고, 시범사업을 통해 단계별로 지자체 전체로 확산을 위한 거점역할을 수행할 예정이다.아울러 경상남도 산청군은 2018년 선정된 우리동네살리기 사업으로 집수리 사업, 주차장 조성 및 가로정비 등을 통해 주거환경 개선을 위한 재생사업을 추진 중인 가운데, 국토부는 재생사업지 내 건축물 157동(전체 87%)에 화재감지 및 긴급출동 서비스, 독거노인 40호에 AI기반 안심케어 서비스 및 안전 스마트폴 서비스를 구축해 사업지 전반에 촘촘한 안전·복지망을 강화할 예정이다.  김상석 국토부 도시재생사업기획단장은 ""스마트기술은 안전한 지역환경 조성과 주민 편의 증진 등을 위해 다양한 방식으로 진화·활용되고 있다""며 ""앞으로도 도시재생사업과 연계해 지역주민이 체감할 수 있는 지속 가능한 스마트서비스를 적극 추진할 계획""이라고 밝혔다. ]",[],http://www.bzeronews.com/news/articleView.html?idxno=541634,https://n.news.naver.com/mnews/article/003/0011616514?sid=101
2022.12.30.,뉴스핌,,"카카오게임즈, '우마무스메' 이용자들과 장애 환아 치료비 기부",,,http://www.newspim.com/news/view/20221230000359,http://www.bzeronews.com
2022.12.29.,부산일보,,"GS칼텍스, 점자 구급함 제작해 시각장애인 지원",,,https://www.busan.com/view/busan/view.php?code=2022122908354323148,http://www.newspim.com
2022.12.29.,데일리한국,,"DL이앤씨, 희망의 집고치기 행복나눔 활동",,,https://daily.hankooki.com/news/articleView.html?idxno=909460,http://www.busan.com/
2022-12-29 08:43:01,더팩트,경제,"계룡건설, 충남도에 이웃돕기 성금 1억 원 기탁","[     GS칼텍스 이상훈(오른쪽) 홍보부문장과 백혜련 노원시각장애인복지관 관장이 28일 시각장애인 구급함 지원 기념식을 가진뒤 포즈를 취하고 있다.GS칼텍스 제공GS칼텍스 임직원과 가족 160여 명은 올 연말 봉사활동으로 노원시각장애인복지관과 함께 점자 구급함 350세트를 만들어 시각장애인에게 기부하는 봉사활동을 진행했으며, 28일 시각장애인 구급함 지원 기념식을 진행했다고 29일 밝혔다.시각장애인은 긴급한 상황에서 구급약품을 사용할 때 혼란을 일으킬 위험성이 크다. 점자 구급함은 시각장애인이 사용하기 편리하도록 평면형 구급상자에 상처연고, 화상연고, 소독제, 해열진통제, 의료용 핀셋 등을 넣고 각 약품마다 점자 스티커를 붙여 신속히 사용할 수 있게 만든 것이다. 가정에서 상비약으로 구비하는 각종 연고, 소독제 등은 비슷한 크기와 형태의 종이케이스에 담긴 경우가 많기 때문에 구급함 내 약품 상자와 약품 본체에 각각 점자 스티커를 붙이는 등 시각장애인이 혼동하지 않도록 제작했다.이렇게 만들어진 점자 구급함 키트는 GS칼텍스 임직원과 가족들이 가정에서 정성껏 조립하고 점자 스티커를 붙여 만들었으며, 노원시각장애인복지관을 통해 시각장애인에게 순차적으로 보급될 예정이다.노원시각장애인복지관 백혜련 관장은 “GS칼텍스의 따뜻한 사회공헌으로 시각장애인들이 의약품을 오남용하지 않고 안전하게 사용하는데 큰 도움이 될 것”이라며 “이번 점자 구급함 제작과 보급을 통해 우리가 생활하며 접하는 많은 용품들에도 점자 표기가 활성화되기를 기대한다”고 전했다.이번 봉사활동은 GS칼텍스가 2005년 이후 18년째 진행 중인 연말 릴레이 봉사활동의 일환으로 진행된 것으로 연말 봉사활동에는 12월 한 달간 서울, 여수, 대전, 부산 등 전국적으로 15개 프로그램을 통해 400여 명이 참여했다. 유달리 강추위와 폭설이 잦은 올해 독거노인 가정에 연탄과 겨울철 생필품 세트를 임직원들이 직접 전달했고, 임직원과 가족들이 참여해 GS타워 구내식당에서 과자와 반찬을 만들고 포장해 취약계층 어르신과 한부모가정 등에 전달하기도 했다.지역 물류센터 등 지방 각 사업장에서도 봉사활동의 열기가 뜨거웠다. 김장 봉사활동, 겨울철 생필품 지원, 취약계층 아동 거주 주택 개보수를 하는 등 따듯한 마음을 함께 했다. GS칼텍스는 앞으로도 지역사회에서 소외계층을 위한 봉사활동을 지속해 나갈 계획이다. ]",[],http://news.tf.co.kr/read/national/1989259.htm,https://n.news.naver.com/mnews/article/082/0001191052?sid=101
2022.12.30.,브릿지경제,,"계룡건설, 충남도에 이웃돕기 성금 1억원 전달",,,https://www.viva100.com/main/view.php?key=20221230010009426,http://daily.hankooki.com
2022.12.28.,뉴시스언론사 선정,,월급날 끝전 기부로 티끌 모아 태산…저소득층 환자 돕기 '벌써 10년',,,http://www.newsis.com/view/?id=NISX20221228_0002139094&cID=10201&pID=10200,http://www.tf.co.kr/
2022-12-29 19:20:04,연합뉴스,사회,'봉쇄' 견딘 민중에 보낸 헌사…中매체 올해 결산영상 반향,"[ 이승찬 사장 ""어려운 이웃들이 희망을 얻고 어려운 상황 속에서도 용기 내길 바래""    계룡건설 이승찬 사장(오른쪽)이 김태흠 충남지사(가운데), 성우종 충남사회복지공동모금회장(왼쪽)과 전달식 행사를 진행하고 있다. / 계룡건설 제공계룡건설 이승찬 사장은 29일 충남도청을 찾아 김태흠 충청남도 도지사, 성우종 충남 사회복지공동모금회장 등이 참석한 가운데 ‘희망 2023 나눔캠페인’ 성금 1억 원을 기탁했다.이번 성금은 저소득 가구, 독거노인, 위탁 가정아동 등 지역의 어려운 이웃들을 지원하는데 사용될 예정이다.계룡건설 이승찬 사장은 ""주변의 어려운 이웃들이 조금이나마 희망을 얻고 어려운 상황 속에서도 용기를 내기 바란다""며 ""계룡건설은 앞으로도 따뜻한 사회분위기 조성과 나눔 문화 확산을 위해 더욱 앞장서겠다""고 말했다.앞서 계룡건설은 지난 1일 대전시청 남문광장에서 열린 ‘희망 2023 나눔캠페인’ 출범식에서 성금 3억 원, 20일에는 어려운 환경에 있는 6·25 및 월남전 참전 유공자들의 주거 환경 개선을 위해 ‘나라사랑 보금자리 사업’ 후원금 1억 원을 각각 기탁했다.발로 뛰는 더팩트는 24시간 여러분의 제보를 기다립니다.▶카카오톡: '더팩트제보' 검색▶이메일: jebo@tf.co.kr▶뉴스 홈페이지: http://talk.tf.co.kr/bbs/report/write ]",[],https://www.yna.co.kr/view/AKR20221230094400083?input=1195m,https://n.news.naver.com/mnews/article/629/0000192893?sid=102
2022.12.31.,허프포스트코리아,,"""앞으로 더…!!"" 연말을 맞아 3000만원 상당 특별한 선물을 '이곳'에 전한 황...",,,https://www.huffingtonpost.kr/news/articleView.html?idxno=205764,http://www.viva100.com
2022.12.28.,뉴시스언론사 선정,,월급날 끝전 기부로 티끌 모아 태산…저소득층 환자 돕기 '벌써 10년',,,http://www.newsis.com/view/?id=NISX20221228_0002139094&cID=10201&pID=10200,http://www.newsis.com
2022-12-28 10:31:33,연합뉴스,사회,'봉쇄' 견딘 민중에 보낸 헌사…中매체 올해 결산영상 반향,"[ 기사내용 요약서울아산병원 임직원, 10년간 급여 끝전 모아저소득층 환자 의료비 등 총 8억여원 지원보호종료 청소년·발달장애 아동 후원도 시작    [서울=뉴시스]서울아산병원이 올해 모아사랑 기금 10주년을 맞아 복지 사각지대에 놓인 보호종료아동을 후원하기 위해 지난 12일 강동구청 희망디딤돌기금 사업에 지원금을 전달했다. (사진= 서울아산병원 제공) 2022.12.28[서울=뉴시스] 백영미 기자 = “인사 한 번 나눈 적 없는 제게 피땀 흘려 번 급여의 일부를 떼어주시다니…앞으로 척추병 치료도 잘 받고 하나뿐인 손녀도 밝고 건강하게 키우겠습니다.”“발달장애 아이 둘과 백혈병으로 항암치료를 하는 아내를 돌보느라 버거운 일상을 보내던 와중에 직원들의 따뜻한 도움을 받아 열심히 살아갈 힘을 얻었습니다.”서울아산병원 임직원들이 지난 10년간 십시일반으로 급여의 일부를 모아 저소득층 환자에게 의료비, 생계비 등 총 8억4천여만 원을 지원하는 등 따뜻한 나눔을 실천해오고 있다. 서울아산병원은 임직원들의 급여 끝전 후원으로 조성된 ‘모아사랑’ 기금이 올해 10주년을 맞이했다고 28일 밝혔다.지금까지 모여진 13억 7천여만 원 가운데 ▲저소득층 환자의 의료·생계비 지원에 3억 4천여만 원 ▲갑작스러운 투병으로 경제적 어려움을 겪는 협력업체 직원 등의 의료·생계비 지원에 2억 8천여만 원 ▲사회공헌활동 지원에 1억 3천여만 원 ▲소아환자 퇴원 축하 물품 및 치료보조기구 지원에 3천여만 원 등 총 8억 4천여만 원을 썼다.서울아산병원 모아사랑 기금은 2012년 겨울 ‘끝전을 모아 사랑을 나눈다’는 가치에 많은 직원들이 공감대를 이루면서 처음으로 조성됐다.이 기금을 통해 갑작스러운 투병으로 경제적 어려움에 처한 저소득층 환자 및 협력업체 직원 등 149명이 의료비와 생계비를 지원받았다. 출생 직후부터 골반암과 뇌성마비, 신부전을 동시에 앓고 있는 소아 환자부터 모친의 급성 골수모구성 백혈병 투병으로 힘든 협력업체 직원 등 도움이 필요한 많은 이들이 모아사랑 기금으로 안정과 희망을 되찾았다.또 서울아산병원 직원들이 시행하는 사회공헌활동인 독거노인 대상 김장김치 배달과 겨울용품 지원, 연탄 나눔, 지역아동센터 급식 지원, 노숙인 지원 등도 모아사랑 기금으로 이뤄졌다. 이번 달에는 거동이 불편한 노인들에게 지팡이, 워커, 실버보행차 같은 보조기구가 지원됐다.모아사랑 기금은 어린이 환자들을 위한 퇴원 축하 가방 제작에도 쓰이고 있다. 서울아산병원 어린이병원은 중환자실에서 치료를 받고 퇴원하는 환아와 보호자에게 축하의 마음을 전하고 개인 물품들을 잘 담아갈 수 있게 직접 가방을 만들어 전달하고 있다.서울아산병원은 올해 모아사랑 기금 10주년을 맞아 복지 사각지대에 놓인 보호종료 청소년에 대한 후원을 새롭게 시작했다. 강동구청 희망디딤돌기금 사업을 통해 강동구 내 사회복지시설에서 퇴소해 사회에 첫 발을 내딛는 청소년 16명에게 자립지원금 3천 2백만 원을 전달했다.내년부터는 풍납종합사회복지관의 장애아동지원사업과 연계해 발달지연 및 장애 아동 28명에게 놀이치료, 심리치료, 체육활동 등을 제공하며 해당 아동이 지역사회에 잘 적응할 수 있도록 지원할 계획이다.처음 모아사랑 기금의 명칭을 짓고 10년간 후원을 이어온 정주희 서울아산병원 외과간호팀 간호사는 “누군가에게 작은 보탬이 되고자 후원을 시작했는데 10년이 흘러 이렇게나 많은 사람들이 위로와 희망을 얻었다니 감사하고 보람된다”고 말했다.박승일 서울아산병원장은 “직원 한 사람 한 사람의 선한 마음이 모여 도움이 절실한 이들에게 새 삶을 선사할 수 있었다""면서 ""주변에 소외된 이웃이 없는지 꼼꼼히 살피며 지역사회 저변에 나눔을 확대해나갈 수 있게 노력하겠다”고 밝혔다.서울아산병원을 운영하는 아산사회복지재단은 ‘우리 사회의 가장 어려운 이웃을 돕는다’는 이념으로 1977년 설립된 이래 2022년까지 의료복지사업에 1110억 원을 지원했다． ]",[],https://www.yna.co.kr/view/AKR20221230094400083?input=1195m,https://n.news.naver.com/mnews/article/003/0011614104?sid=102
2022.12.29.,이투데이,,"계룡건설, 충청남도에 이웃돕기 성금 1억 원 기탁",,,https://www.etoday.co.kr/news/view/2207799,https://www.yna.co.kr/
2022-12-30 15:26:41,허프포스트코리아,세계,"""앞으로 더…!!"" 연말을 맞아 3000만원 상당 특별한 선물을 '이곳'에 전한 황...","[ 온라인매체 왕이신문 6분 영상에 네티즌 공감…결국 삭제당해    왕이신문의 2022년 결산 동영상에 담긴 배달 근로자의 모습[왕이신문 동영상 캡처.재판매 및 DB금지]    (베이징=연합뉴스) 조준형 특파원 = 중국의 한 온라인 매체가 이달 초까지 봉쇄 중심의 제로 코로나 정책이 집행되는 동안 중국 서민들이 겪은 민생고의 현장을 담은 2022년 결산 동영상을 올려 반향을 불렀다.     온라인 매체 왕이(網易)신문은 29일 '왕이신문의 2022년도 결산: 삶을 짊어진 평범한 한사람 한사람에게 경의를 표한다'는 제목을 붙인 6분여 분량 영상을 인터넷에 공개했다.     지난 7일 이후 중국이 '위드 코로나'로 급전환하면서 지금은 봉쇄보다 '개방'에 따른 감염 확산이 문제이지만, 이 영상에는 엄격한 제로 코로나 정책하에서 중국인들이 겪은 고생담이 생생하게 담겼다.     아기 해열제를 구하기 위해 울며 이웃집 문을 두드리는 여인, 식료품 온라인 구입도 못하게 되자 울음을 터트리는 독거노인, 만두를 사기 위해 집을 나섰다가 방역요원들에게 구타를 당한 사람 등 봉쇄 지역 주민들의 고통이 영상을 채웠다.    또 봉쇄 당시 상하이 시민이 방역 요원에게 집안의 노인을 살려야 한다며 자동 심장충격기(AED)를 달라고 호소하는 모습, 모친이 위독한데도 봉쇄 때문에 고향에 돌아갈 수 없다며 울부짖는 화물차 운전사, 업무량이 폭증한 배달 기사가 터널 안에서 오토바이 안장에 앉은 채로 쪽잠을 자는 모습 등도 영상에 담겼다.     그리고 제로 코로나에 반대하는 전국적 '백지시위'의 도화선이 된 11월 신장 우루무치 고층 아파트 화재(10명 사망·9명 부상)도 2022년의 중요 사건으로 소개됐다.     신화통신을 포함한 관영매체들이 시진핑 국가주석 3연임을 확정한 10월 공산당 전국대표대회(당 대회)와 8월 대만 포위 군사훈련, 2월 베이징동계올림픽 등으로 10대 뉴스를 발표한 것이 주로 '관(官)'의 시선을 투영했다면 왕이신문의 2022년 결산 영상은 서민의 편에서 2022년을 회고한 셈이었다.     중국 온라인상에서는 30일 현재 해당 영상이 삭제됐지만 트위터나 유튜브 등 중국에서는 방화벽을 우회하는 가상사설망(VPN)이 있어야 접속할 수 있는 플랫폼을 통해 영상은 퍼져나갔다.     이 영상을 접한 중국 네티즌들은 영상이 진실을 담고 있다고 공감을 표했다.     웨이보 등 소셜미디어에는 ""이것은 일반 서민들이 겪은 가장 진실한 2022년인데, 왜 굳이 삭제했는가"", ""인민의 진실한 고난을 담은 동영상이 삭제되는 것을 도저히 이해할 수 없다""는 등의 글이 올라왔다.     한 네티즌은 ""왕이신문은 조심스럽게 봉쇄 때 이야기만 올렸는데도 삭제됐는데 만약 개방(제로 코로나 폐지) 이후 사망자 폭증 상황을 포함했다면 그 제작진은 숙청당했을 것""이라고 썼다.     2세 아기를 데리고 감염자 격리시설로 가는 부모[왕이신문 2022결산 동영상 캡처.재판매 및 DB금지]    jhcho@yna.co.kr ]","['그어떤 사상이나 정치체제도 사람이 살수있는 최소한의 권리이자 본능은 건드릴수 없습니다.....', '아직도 죽의 장막에 살고 있는 중국인민들은 정부에 감사해야합니다. 지금까지 중국인민들이 이만큼 잘살고 있는것은 시진핑  은혜 덕택인줄 알아야됩니다.  그런만큼 시진핑이 죽을때까지 집권을 도와야합니다. 그래서 중국내부의 문제들은 외부로 새어나가서는 안되기에 감추고 또 감추어야됩니다', '중궈는 공산권 버리고 민주주의가 뿌리 내릴 때 까지 쓰레기 짓만 할 듯', '한국은 언제까지 반중 할거니\n그러다 물건너간다']",https://www.huffingtonpost.kr/news/articleView.html?idxno=205764,https://n.news.naver.com/mnews/article/001/0013672963?sid=104
13면 1단,아시아경제,,"GS칼텍스 임직원, 점자 구급함 제작해 시각장애인 후원",,,https://view.asiae.co.kr/article/2022122908443560171,http://www.etoday.co.kr
2022.12.28.,뉴시스,,"bhc 슈퍼두퍼, 연말 맞아 생필품 기부",,,http://www.newsis.com/view/?id=NISX20221228_0002138914&cID=13001&pID=13000,http://www.huffingtonpost.kr
2022.12.29.,매일경제,,"DL이앤씨, 저소득 가정 주거환경 개선 구슬땀",,,https://www.mk.co.kr/article/10586266,https://www.asiae.co.kr/
2022-12-29 08:44:33,뉴스1,경제,도시재생사업에 생활형 스마트기술 선보인다…전국 13곳 선정,"[ 연말 릴레이 봉사 활동시각장애인 의약품 오용 예방    지난 28일 시각장애인 구급함 지원 기념식에서 이상훈 부문장(오른쪽)이 기념촬영을 하고 있다. 사진=GS칼텍스 제공GS칼텍스는 임직원과 이들 가족 160여명이 노원시각장애인복지관과 함께 점자 구급함 350세트를 만들어 시각장애인에게 기부했다고 29일 밝혔다. 점자 구급함은 시각장애인이 사용하기 편리하도록 평면형 구급상자에 상처연고, 화상연고, 소독제, 해열진통제, 의료용 핀셋 등을 넣고 약품마다 점자 스티커를 붙여 신속히 사용할 수 있게 만든 것이다. 가정에서 상비약으로 구비하는 각종 연고, 소독제 등은 비슷한 크기와 형태의 종이 케이스에 담긴 경우가 많다. 구급함 내 약품 상자 및 약품 본체에 각각 점자 스티커를 붙여 시각장애인이 혼동하지 않도록 배려했다. GS칼텍스 임직원 및 가족들이 가정에서 일일이 조립하고 점자 스티커를 붙여 만들었다. 노원시각장애인복지관을 통해 시각장애인에게 순차적으로 보급될 예정이다.백혜련 노원시각장애인복지관 관장은 “GS칼텍스의 따뜻한 사회공헌으로 시각장애인들이 의약품을 오남용하지 않고 안전하게 사용하는 데 큰 도움이 될 것”이라며 “이번 점자 구급함 제작과 보급을 통해 우리가 생활하며 접하는 많은 용품에도 점자 표기가 활성화되기를 기대한다”고 말했다.    점자구급함. 사진=GS칼텍스 제공이번 봉사활동은 GS칼텍스가 2005년 이후 18년째 진행 중인 연말 릴레이 봉사활동의 일환이다. 연말 봉사활동에는 12월 한 달간 서울, 여수, 대전, 부산 등 전국적으로 15개 프로그램을 통해 400여명이 참여했다. 강추위와 폭설이 잦은 올해 독거노인 가정에 연탄과 겨울철 생필품 세트를 임직원들이 직접 전달했고, 임직원과 가족들이 참여해 GS타워 구내식당에서 과자와 반찬을 만들고 포장해 취약계층 어르신과 한부모가정 등에 전달하기도 했다.여수공장에서는 인근 지역주민들과 김장 김치를 담가 홀몸 어르신 등 소외이웃에게 전달했다. 봉사활동에 참여한 GS칼텍스 여수공장 임직원 봉사자들은 양념, 포장 등의 작업을 도와 정성이 가득 담긴 김장 김치를 완성했다. 마을 경로당에는 난방유와 쌀을 전달하기도 했다. 지역 물류센터 등 지방 각 사업장에서도 김장 봉사활동, 겨울철 생필품 지원, 취약계층 아동 거주 주택 개보수를 하는 등의 봉사활동을 펼쳤다.GS칼텍스는 앞으로도 지역사회에서 소외계층을 위한 봉사활동을 지속해 나갈 계획이다. ]",[],https://www.news1.kr/articles/4909009,https://n.news.naver.com/mnews/article/277/0005198335?sid=101
2022.12.30.,스포츠경향,,"카카오게임즈, ‘우마무스메’ 이용자들과 뇌병변 장애 환아 치료비 기부",,,http://sports.khan.co.kr/news/sk_index.html?art_id=202212301014003&sec_id=564001&pt=nv,http://www.newsis.com
2022-12-28 09:21:06,연합뉴스,경제,한파에 연탄·등유 난방비 54억9천만원 추가 지원,"[ 기사내용 요약광진구 사회복지관에 200세트 전달    (사진=bhc그룹 제공) *재판매 및 DB 금지[서울=뉴시스]주동일 기자 = bhc그룹의 수제버거 브랜드 슈퍼두퍼가 연말을 맞아 생필품을 기부했다.bhc 슈퍼두퍼는 지난 27일 서울시 광진구에 위치한 중곡종합사회복지관에 겨울나기 생필품 200세트를 전달했다고 28일 밝혔다.이번 기부는 지난 11월 국내 론칭한 슈퍼두퍼가 처음 진행하는 나눔 활동이다. 물품 전달식엔 전혜숙 더불어민주당 의원, 한은경 중곡종합사회복지관 관장, 이현우 슈퍼두퍼 강남점 점장 등이 참석했다.기부 물품은 생활용품 총 200세트다. 연말까지 복지관을 통해 독거노인, 한부모 가정, 소년 소녀 가장 등 관내 저소득층 200가정에게 순차 제공할 계획이다.슈퍼두퍼 관계자는 ""복지 사각지대에 놓인 분들이 보다 따뜻한 연말을 보내실 수 있게 물품 후원을 결정하게 됐다""며 ""이번 기회를 기점으로 슈퍼두퍼도 다양한 사회공헌 활동을 고안하면서 나눔 문화 확산에 지속 동참할 계획""이라고 말했다. ]",[],https://www.yna.co.kr/view/AKR20221228042900530?input=1195m,https://n.news.naver.com/mnews/article/003/0011613858?sid=101
2022.12.28.,연합뉴스,,한파에 연탄·등유 난방비 54억9천만원 추가 지원,,,https://www.yna.co.kr/view/AKR20221228042900530?input=1195m,https://www.yna.co.kr/
