Date,Press,Category,Title,Content,Comment,URL_Origin,URL_Naver
2022.03.31.,뉴스1,,"에이비엘바이오, '1.3조 기술이전' 파킨슨 치료물질 9월 임상 신청",,,https://www.news1.kr/articles/?4633333,http://news1.kr/
2022-03-31 10:45:13,일요신문,사회,"하루 석 잔, 파킨슨병 위험 낮춘다! 해외 연구로 본 ‘커피예찬론’","[ [15회 바이오리더스클럽]이상훈 에이비엘바이오 대표 발표올해 사노피 마일스톤 수령 등 현금 2110억 확보    이상훈 에이비엘바이오 대표가 31일 오전 서울 중구 롯데호텔에서 열린 '제15회 뉴스1 바이오리더스클럽 조찬'에서 기조연설을 하고 있다. 2022.3.31/뉴스1 © News1 성동훈 기자(서울=뉴스1) 성재준 바이오전문기자,이영성 기자,김태환 기자,강승지 기자 = 에이비엘바이오가 오는 9월 파킨슨병 등 퇴행성뇌질환 치료 이중항체 후보물질 'ABL301'에 대한 임상시험승인계획(IND)을 신청할 예정이다. ABL301은 지난 1월 에이비엘바이오가 다국적제약사 사노피와 1조3000억 규모 공동개발 및 기술이전 계약을 체결한 물질이다.이상훈 에이비엘바이오 대표는 31일 뉴스1 주최로 서울 소공동 롯데호텔에서 열린 '제15회 바이오리더스클럽'에서 ""오는 9월 미국 식품의약국(FDA)에 임상1상 IND를 신청할 예정이다. 에이비엘바이오가 주도하고 사노피와 공동으로 진행할 예정""이라며 ""12월까지는 임상1상에 들어갈 계획""이라고 말했다.에이비엘바이오는 지난 1월 11일(현지시간) 사노피와 10억6000만달러(약 1조2836억원) 규모 ABL301 공동개발 및 기술이전 계약을 체결했다. 계약금 7500만달러(약 907억원)와 임상, 허가, 상업화 등 단계별 성공에 따라 단기 기술료(마일스톤) 4500만달러(약 544억원)를 포함해 최대 9억8500만달러(약 1조1914억원)까지 받을 수 있다. 또 향후 제품 상용화 시 순매출액에 따른 경상기술료(로열티)는 별도다. 사노피는 ABL301의 개발과 상업화에 대한 전 세계 독점권을 갖는다. ABL301의 남은 전임상 연구와 임상1상은 에이비엘바이오가 주도한다.에이비엘바이오는 최근 사노피로부터 계약금 약 910억을 받았다. 기존에 보유하던 현금 570억원에 향후 임상1상에 들어가면 수령 예정인 ABL301 마일스톤 540억원, 그리고 이전 시스톤파마슈티컬즈에 기술이전한 항체약물접합체(ADC)의 마일스톤 거래로 확보한 100억원을 받으면 2022년 한 해 동안 약 2110억원이 넘는 현금을 확보할 예상이다.ABL301은 혈액뇌장벽(BBB) 통과해 약물을 전달할 수 있는 에이비엘바이오의 '그랩바디-B' 플랫폼 기술을 적용한 이중항체 물질이다. 파킨슨병 발병 원인인 알파-시뉴클레인(α-synuclein)을 제거하는 항체를 뇌 안에 효과적으로 전달할 수 있다. 서로 다른 표적에 작용하는 이중항체 물질로 일반 단일클론항체에 비해 뛰어난 효과가 뛰어나다.특히 그랩바디-B 플랫폼 기술은 인슐린 유사성장 인자1수용체(IGF1R)를 표적으로 기존 약물 침투가 어려운 BBB 침투를 극대화한다는 게 회사의 설명이다. 파킨슨병 등 중추신경계(CNS) 치료를 위해서는 BBB를 투과해야 하는데 일반적으로 약물 투과율이 현저히 낮다.BBB는 혈액에서 뇌로 들어가는 물질을 선택적으로 투과시키는 장벽이다. 산소나 물 등은 투과시키지만 일반적으로 세균이나 항암제 등이 뇌로 이동하는 것을 막아 암이 전이됐을 때 치료가 힘들다.이상훈 대표는 그랩바디-B가 앞서 진행한 동물실험에서 Δ높은 BBB 투과율과 Δ긴 반감기 그리고 Δ안전성을 확인했다며 ""검증된 그랩바디-B 플랫폼에 다른 파트너사의 표적 물질을 조합해 기술이전이 가능하다""고 말했다. 현재 에이비엘바이오는 글로벌제약사 두 곳과 그랩바디-B 기술과 관련 기술이전을 협의 중이다.이상훈 대표는 ""향후 그랩바디-B에 항체뿐 아니라 단백질이나 효소, 그리고 RNA를 접목하는 등 관련 플랫폼을 확장할 예정""이라고 말했다.   ]",[],https://ilyo.co.kr/?ac=article_view&entry_id=425569,https://n.news.naver.com/mnews/article/421/0006000695?sid=102
2022.03.30.,머니투데이,,"카이노스메드, 세계에서 가장 앞선 파킨슨병 신약후보물질 보유",,,http://news.mt.co.kr/mtview.php?no=2022033009464074306,http://www.ilyo.co.kr
2022.03.31.,메디컬투데이,,파킨슨병 특이적 면역세포 유전자 발견,,,https://mdtoday.co.kr/news/view/1065576189704390,http://www.mt.co.kr/
2022-03-30 09:54:05,헬스조선,경제,파킨슨병 vs 파킨슨증후군… 차이 아세요?,"[    한양증권은 30일 카이노스메드가 세계에서 가장 앞선 파킨슨병 신약후보물질을 보유하고 있다며 경쟁 뇌질환 기업들 대비 저평가돼 있다고 밝혔다. 오병용 한양증권 연구원은 ""카이노스메드의 메인 신약후보물질은 파킨슨병 치료제 'KM-819'로 수년간의 준비 끝에 지난해 11월 미국 FDA로부터 임상 2상 IND를 승인받고 올해 4월부터 2상을 시작할 예정""이라며 ""많은 경쟁사들이 파킨슨 치료제로 개발중인 'LRRK2'나 'a-Syunclein'이 아니라 자체 개발한 'FAF1'를 타겟하는 새로운 신약""이라고 설명했다. 이 분야에서는 KM-819가 퍼스트 인 클래스(First in class)이며 이번에 진행되는 임상 2상은 무려 288명 환자 대상의 임상시험이라 파킨슨병 임상으로는 전 세계에서 규모가 가장 큰 임상에 속한다는 설명도 이어졌다. 오 연구원은 ""현재 글로벌 진행되는 파킨슨병 치료제 신약의 임상 3상은 거의 없는 것으로 보이며, 지난해에 실패했지만 굉장한 기대를 받던 사노피의 파킨슨 치료제 'venglustat' 임상 2상도 273명 규모였다""며 ""따라서 카이노스메드의 미국 임상 2상은 세계에서 개발 속도가 가장 앞선 수준에 있고, 가장 큰 규모의 파킨슨병 임상시험 중 하나로 볼 수 있다""고 덧붙였다. 그는 이어 'KM-819'와 같은 후기단계 파이프라인의 가치가 앞으로 주목받을 가능성이 높은 반면, 카이노스메드의 주가는 지나치게 낮다고 분석했다. 오 연구원은 ""파킨슨 후보물질 외에도 카이노스메드는 에이즈 치료제 'KM-023'도 보유하고 있는데 중국 장쑤아이디로 기술수출돼 임상 3상을 끝내고 중국에서 작년 허가까지 받았다""며 ""앞으로 매출이 시작되면 일정 부분을 로열티로 수령하게 되는 등 신약 후보물질들이 앞으로 큰 주목을 받을 가능성이 있음에도 불구하고 회사 시가총액은 2800억원 수준에 불과하다""고 평가했다. 국내 뇌질환 치료제 개발 기업들 대비 상대적으로 저렴하며, 2020년 6월 코스닥 상장시 시가총액이 5000억원에 달했다는 점을 고려하면 지금은 좋은 저자매수 기회라는 것이다.  ]",['ㅡㅡ 뭔 소리야'],https://health.chosun.com/site/data/html_dir/2022/03/30/2022033001557.html,https://n.news.naver.com/mnews/article/008/0004726274?sid=101
2022.03.31.,약사공론,,파킨슨병 치료제 '잭팟' 주인공은 누구?…국내사도 매진,,,https://www.kpanews.co.kr/article/show.asp?idx=231397&category=D,http://www.mdtoday.co.kr
2022.03.30.,충청투데이,,손 떨리면 파킨슨병?… '비정형성 파킨슨증후군' 일수도,,,https://www.cctoday.co.kr/news/articleView.html?idxno=2159149,http://health.chosun.com/
2022-03-30 13:17:01,뉴시스언론사 선정,생활/문화,"코로나19 감염 후 머리가 '멍'…""치매와 비슷한 뇌 변화 발견""","[     파킨슨병, 파킨슨증후군, 루게릭병은 병의 양상이 비슷하게 나타난다./사진=게티이미지뱅크손이 의도치 않게 떨리거나 근육이 자신도 모르게 움찔대면 바로 파킨슨병을 떠올리는 경우가 많다. 하지만, 파킨슨병과 양상이 비슷한 질환 2가지가 있다. 바로 파킨슨증후군과 루게릭병이다. 세 질환은 모두 근육 이상으로 동작이 느리고, 발음이 어눌해지는 등의 증상이 나타난다. 신경학적 검사, 뇌 MRI 검사 등으로 정확한 진단이 가능하다. 각 질환의 특징에 대해 알아본다.▷파킨슨병=몸 동작에 관여하는 뇌의 신경전달물질(도파민) 부족으로 생긴다. 몸이 떨리며 근육이 굳고, 동작이 느려지고, 걸음새가 이상해진다. 근력 감소와는 상관 없다. 뇌 MRI(자기공명영상) 검사에서도 정상으로 나온다. 환자의 75% 이상에게서 움직일 때보다 가만히 있을 때 떨림이 더 강하게 나타난다. 도파민 성분 약을 먹으면 일상생활이 가능할 정도로 증상이 회복된다.▷파킨슨증후군=파킨슨병처럼 도파민이 부족한 데다 도파민이 작동하는 신경세포까지 죽는 병이다. 소뇌·중뇌·기저핵 중 하나가 위축돼 파킨슨병의 4가지 증상 외의 증상들이 더 나타난다. 70%는 소뇌 위축을 보이는데, 이때는 어지럼증, 요실금, 기립성저혈압이 생긴다. 중뇌가 위축되면 눈동자 움직임 마비가, 기저핵이 위축되면 치매가 조기에 찾아온다. MRI로 이상 부위가 확인되며, 파킨슨병과 달리 주로 움직일 때 몸이 떨린다. 초기에는 도파민 약이 일부 효과가 있지만, 결국 9~10년 이내에 사망할 확률이 크다.▷루게릭병=뇌와 척수의 운동신경 세포가 파괴되는 병이다. 몸 전체의 운동 기능이 떨어지면서 근육이 위축·마비되며, 증상이 주로 손에서 시작돼 팔다리로 퍼진다. 팔다리 자체가 떨리는 파킨슨병·파킨슨증후군과 달리 근육만 움찔한다. 시간이 지나면 힘이 달려 걷지도 못한다. MRI로 이상 소견이 발견되지 않고, 근육에 바늘을 찔러 근육 활성도를 검사하는 신경근전도 검사로 이상 여부를 확인한다. 치료법이 없으며, 일반적으로 진단 3~4년 이내에 호흡근이 마비돼 사망하는 경우가 많다. ]",['그럼 세가지중에 그나마 파킨슨병이 예후가 가장 좋네요.'],http://www.newsis.com/view/?id=NISX20220329_0001811746&cID=13101&pID=13100,https://n.news.naver.com/mnews/article/346/0000049475?sid=103
2022.03.31.,더구루,,"소프트뱅크, 파킨슨병 치료제 개발업체 '뉴런23' 투자",,,https://www.theguru.co.kr/news/article.html?no=33236,http://www.kpanews.co.kr
2022.03.31.,더구루,,"프로테나, 파킨슨병 치료제 PRX012 임상 1상 연내 착수",,,https://www.theguru.co.kr/news/article.html?no=33225,http://www.cctoday.co.kr
2022.03.31.,약사공론,,파킨슨병을 유발하는 약이 있다?!,,,https://www.kpanews.co.kr/article/show.asp?idx=231383&category=H,http://www.kpanews.co.kr
2022.03.30.,세계일보,,코로나 감염 후 머리가 ‘멍’…부작용일까?,,,http://www.segye.com/content/html/2022/03/29/20220329511951.html?OutUrl=naver,http://www.segye.com
2022-03-30 07:03:04,이데일리,세계,[피플바이오 대해부]①알츠하이머 혈액 진단키트 세계최초 상용화,"[ ""치매와 비슷한 뇌 변화 발견""        뉴시스    코로나19 감염 후 머리가 멍하게 느껴지는 '브레인 포그(brain fog)' 후유증을 호소하는 환자들이 늘고 있다. 이같은 현상을 경험한 사람들의 뇌에서 화학 치료를 받은 암환자나 알츠하이머 환자와 비슷한 변화가 나타난다는 결과가 나와 주목된다.   29일 워싱턴포스트와 뉴시스 등에 따르면 최근 미국 스탠포드대의 신경과학자 미셸 몬제는 코로나19 확진 이후 브레인 포그를 경험한 사람들과 '케모 브레인(chemo brain)'을 가진 사람들의 유사성을 관찰했다. 케모 브레인은 항암제와 같은 독성이 강한 약물이나 방사능에 노출된 사람에게서 나타나는 인지기능 저하 현상을 말한다.   연구팀은 두 그룹의 환자군을 관찰한 결과 뇌의 면역 기능과 관련이 있는'미세아교세포(microglia)'에서 비슷한 변화가 나타났다고 전했다. 항암치료를 받은 암환자의 경우 이 세포가 오작동을 일으켜 인지기능이 떨어지는 것으로 알려져 있다. 또 학자들은 알츠하이머의 경우에도 이런 세포들이 노화로 인한 세포 손상에 제대로 대응하지 못해 발생한다는 가설을 세워두고 있다.   몬제의 연구는 코로나19 감염 후 나타나는 인기 기능 저하와 케모 브레인, 알츠하이머 등 다른 뇌 질환 메커니즘의 유사성을 찾는 시도의 일부분이다. 미국 국립보건원 신경 장애 임상 책임자인 아빈드라 나스는 ""(코로나19 후유증과 다른 뇌손상 사이에)커다란 유사성이 있다""고 전했다.   코로나19의 감염이 뇌에 미치는 영향에 대해서는 이전에도 많은 연구들이 이뤄졌다. 코로나19 감염과 퇴행성 뇌 질환인 파킨슨병 사이의 연관성에 대한 보고도 잇따르고 있다.   미국 밴 엔델 연구소(Van Andel Research Institute)는 지난 2020년 코로나19에 감염된 뒤 파킨슨병과 유사한 신경퇴행성 증상을 보인 세 명의 사례를 분석했다. 세 명 모두 감염 전에는 파킨슨병과 관련된 초기 증상이 발견되지 않았고 가족력도 없었다. 또 세 명 중 두 명은 파킨슨병 치료제를 사용한 뒤 증상이 개선됐다. 코로나19 환자들에게서 파킨슨병의 대표적인 증상인 후각 상실이 흔하게 관찰된다는 점도 주목할만한 부분이다.   전문가들은 코로나19 감염이 파킨슨병과 같은 신경퇴행을 유발하거나 악화시킬 수 있는 것으로 보고 있다. 최근 코로나19 확진자 뇌 이미지에 대한 몇몇 연구에서는 도파민의 흑질선조체 경로(nigrostriatal pathway)에 눈에 띄는 손상이 관찰됐다. 이 경로에 있는 신경세포들은 신체 움직임을 조정하기 위해 신경전달물질인 도파민을 방출하는데 파킨슨병과 같은 신경퇴행 질환이 발생하면 이런 신경세포들이 퇴화하거나 손상된다.   코로나19 바이러스가 뇌에 어떻게 영향을 미치는지에 대해서는 아직 명확하게 규명된 것이 없다. 연구자들은 면역물질인 '염증성 사이토카인'의 역할에 주목한다.   사이토카인은 우리 면역체계가 바이러스 등 외부 항원에 대응하는 과정에서 신호 전달 등을 위해 방출하는 물질이지만 과도하게 발현되면 우리 몸을 해치는 면역 반응을 일으킬 수 있다. 사이토카인은 혈류를 통해 이동하고 혈액뇌장벽(blood-brain barrier)도 넘을 수 있는 것으로 알려져 있다. 코로나19 바이러스에 노출되면 이런 사이토카인의 작용으로 인해 바이러스에 직접 감염되지 않더라도 정상 세포가 손상될 수 있다는 것이다.   코로나19 감염이 뇌의 특정 구조를 수축시킬 수 있다는 연구 결과도 있다.   최근 영국 옥스포드대 그웨넬 두오드 교수 연구팀은 코로나19 감염자 401명과 비감염자 384명 등 785명의 뇌 MRI 이미지를 분석한 결과를 발표했다. 연구진은 코로나19 감염자의 감염 전후 이미지와 비슷한 건강·신체 상태를 가진 비감염자의 이미지를 비교 분석했다.   그 결과 감염자는 기억·후각과 관련된 뇌의 회백질 양이 비감염자보다 많이 감소한 것으로 나타났다. 건강한 사람의 경우 나이가 들면서 회백질이 해마다 0.2~0.3% 가량 감소하는 것이 정상이다. 하지만 코로나19 감염자들은 0.7% 가량 감소한 것으로 나타났다. 가장 주목할만한 점은 코로나19 증상이 경미한 경우에도 이같은 회백질의 손상이 관찰됐다는 점이다.   두오드 교수는 이처럼 뇌에서 관찰된 비정상적 변화들이 대체로 후각 상실과 관련된 것으로 보인다고 분석했다. 다만 그는 ""시간이 지나면 감염의 해로운 영향이 완화될 수 있다""고 추정했다. ]",[],http://www.edaily.co.kr/news/newspath.asp?newsid=01082406632268568,https://n.news.naver.com/mnews/article/022/0003681060?sid=104
2022.03.22.,연합뉴스,,"ABL바이오, 파킨슨병 신약 기술수출 계약금 910억원 수령",,,http://yna.kr/AKR20220322069000017?did=1195m,http://www.edaily.co.kr/
2022-03-30 09:31:02,뉴시스,경제,"압타머사이언스·뉴라메디, BBB 셔틀 파킨슨병 치료제 공동연구","[ 모든 변형단백질질환 진단에 적용 가능한 플랫폼올리고머 선택적으로 구별해 검출알츠하이머, 파킨슨병, 당뇨 조기진단 시장 공략이 기사는 2022년03월27일 09시30분에 팜이데일리 프리미엄 콘텐츠로 선공개 되었습니다.[이데일리 김명선 기자] 코로나19가 세계를 강타하면서 제약·바이오 산업의 중요도가 커지고 있다. 급성장세를 거듭하는 제약·바이오 산업은 자동차, 반도체 등에 이어 한국의 차세대 미래성장동력으로 자리매김할 것이 확실시된다. 이데일리의 제약·바이오 프리미엄 뉴스 서비스 ‘팜이데일리’에서는 한국을 이끌어 갈 K-제약·바이오 대표주자들을 만나봤다. 알츠하이머 혈액진단키트를 세계 최초로 상용화한 피플바이오가 이번 주인공이다.“처음 창업하게 된 건 2002년이었어요. 당시 광우병이 세계적으로 이슈였어요. 광우병 유발 단백질인 프리온을 혈액으로 검출하는 키트를 만들어야겠다고 생각했죠. 항원항체반응을 이용해 프리온 진단 제품을 개발했지만 완전한 실패라는 점을 깨달았어요. 프리온이 기본적으로 우리 몸에 다 존재하는 물질이라, 병에 걸린 사람과 걸리지 않은 사람 모두 ‘양성’이 나왔거든요. 개발하는 사이 광우병이 잠잠해지기도 했고요.”강성민 피플바이오(304840) 대표의 말이다. 사업 포기의 갈림길에 섰던 그는, 프리온 검출 기술을 살리기로 했다. 사람 혈액 속에는 질병을 유발하지 않는 단량체(모노머)와, 질병을 일으키는 수십 개의 단량체가 연결된 분자인 멀티머(올리고머)가 있다. 당초 피플바이오가 개발한 프리온 진단기술은 올리고머를 검출하는 방식이었다. 그는 “올리고머가 유발하는 질환이 있다는 걸 알게 됐다. 모노머와 올리고머와 차이를 이용해 진단하는 방법을 모색해보기로 했다”고 밝혔다.    피플바이오는 변형단백질질환을 진단할 수 있는 원천기술을 보유한 기업이다. (사진=피플바이오 ir 자료)그렇게 개발하게 된 게 현재 피플바이오의 근간이 된 MDS(Multimer Detection System) 플랫폼이다. 항원을 겹치게 설계해 변형단백질 질환에서 특징적으로 나타나는 올리고머를 선택적으로 구별해 검출한다. 변형단백질 질환은 단백질의 비정상적인 접힘으로 인한 응집과 올리고머화로부터 시작되는 질병군을 말한다.강 대표는 “변형단백질 질환은 알츠하이머병과 파킨슨병, 백내장 등 고령층에서 문제가 되는 질병이 대다수였고 환자도 많았다. 플랫폼으로 확장 가능한 영역이 많았기에, 소위 ‘운이 좋다’고 생각했다”고 말했다.피플바이오는 MDS 플랫폼 기술을 가장 먼저 환자가 많은 알츠하이머 진단에 활용했다. 알츠하이머병의 주요 바이오마커인 아밀로이드 베타 올리고머화 정도를 측정해 알츠하이머를 진단할 수 있게 했다. 목표는 조기 진단이었다.그는 “알츠하이머가 계속 진행되다 마지막 단계에서 나타나는 게 치매다. 치매에 걸리면 치매 환자 본인과 가족은 물론, 사회적 비용도 만만찮다. 혈액을 통해 쉽고 간편하게 알츠하이머를 발견할 수 있도록 하는 데 의미를 뒀다”고 했다.그렇게 알츠하이머 혈액진단키트 ‘inBlood OAβ test’는 2009년부터 개발을 시작한 이후 2018년 국내 식품의약품안전처 허가를 획득했다. 2019년엔 수출용 허가를 받았다. 2020년엔 유럽 통합규격인증(CE)을, 2021년엔 신의료기술 인증을 받았다. 알츠하이머 혈액 진단키트를 상용화한 건 세계 최초다.    피플바이오는 알츠하이머 바이오마커인 아밀로이드 베타 올리고머화 정도를 측정해 치매 전 단계인 알츠하이머를 진단하는 기술을 개발했다. (사진=피플바이오 ir 자료)피플바이오는 MDS 플랫폼을 활용해 파킨슨병 혈액진단키트도 개발 중이다. 파킨슨병은 알츠하이머병에 이어 두 번째로 흔한 신경성 퇴행성 뇌질환이다. 원인 변형단백질인 알파 시누클레인을 MDS 플랫폼으로 분석한다. 강 대표는 “지난해 성능평가를 진행했고, 현재 진단키트의 민감도를 높이는 작업을 하고 있다”고 밝혔다. 내년 상용화가 목표다.또 다른 변형단백질 질환인 당뇨병 진단키트 개발에도 박차를 가하고 있다. 혈당 수치를 통해 측정하는 기존 진단 단계에 앞서, 혈액 내 아밀린 올리고머를 검출해 당뇨병을 조기 진단하는 방법을 개발 중이다. 현재 시제품을 개발 중인 상황으로, 2024년 상용화가 예상된다.똘똘한 원천기술은 피플바이오의 경쟁력이 됐다는 게 강 대표 말이다. 그는 “여러 질환으로 확장할 수 있는 플랫폼이 있고, 그 기술이 타깃하는 퇴행성 뇌질환 등 변형단백질질환은 고령화 사회에서 계속 문제시되는 질환”이라며 “질병 증후가 나타날 때까지 기다렸다가 치료를 하는 게 아니라, 진행되기 전 질병을 예방하는 게 앞으로의 의학 방향이다. 그런 점에서 우리의 플랫폼이 중요한 역할을 할 것”이라고 강조했다. ]","['ㅋㅋ 돈도못버는 기술은\n필요없다', '요즘 돈쓰면서 기사 부탁하는건 아닌지 하는 의심이 든다']",http://www.newsis.com/view/?id=NISX20220322_0001802185&cID=10434&pID=13100,https://n.news.naver.com/mnews/article/018/0005177777?sid=101
2022.03.30.,이데일리,,[피플바이오 대해부]③“내년 실적 턴어라운드 기대”…신약 등 신사업도 박차,,,http://www.edaily.co.kr/news/newspath.asp?newsid=01085686632268568,https://www.yna.co.kr/
2022-03-22 11:02:10,뉴스1,경제,"카이노스메드, 파킨슨병 치료제 국제학술지 논문 게재","[     에이비엘바이오[에이비엘바이오 제공. 재판매 및 DB 금지]    (서울=연합뉴스) 계승현 기자 = 에이비엘바이오는 파킨슨병 등 퇴행성 뇌질환 치료 이중항체 후보물질 'ABL301'의 기술수출 계약금 7천500만달러(약 910억원)를 다국적 제약사 사노피에서 수령했다고 22일 밝혔다.    에이비엘바이오는 올해 1월 사노피와 계약금 7천500만달러 및 단기 기술료(마일스톤) 4천500만달러를 포함한 총 10억6천만달러 규모의 공동개발 및 기술이전 계약을 맺었다.    ABL301에는 중추신경계 질병에 대한 치료제의 혈액뇌관문(Blood Brain Barrier·BBB) 침투를 극대화하는 에이비엘바이오의 '그랩바디-B'(Grabody-B) 플랫폼 기술이 적용됐다. 이를 통해 파킨슨병 발병 원인 물질의 축적을 억제하는 항체를 뇌 안으로 효과적으로 전달한다.     이상훈 에이비엘바이오 대표는 ""혁신 신약 개발을 위한 양사의 협력이 본격적으로 시작됐다""며 ""ABL301의 미국 임상 진입을 위한 전임상 연구도 순항 중""이라고 말했다.     key@yna.co.kr ]",[],https://www.news1.kr/articles/?4623971,https://n.news.naver.com/mnews/article/001/0013064630?sid=101
2022.03.21.,헬스조선언론사 선정,,"손 '이렇게' 떨리는 사람, '파킨슨병' 의심해야",,,https://health.chosun.com/site/data/html_dir/2022/03/21/2022032101942.html,http://www.newsis.com
