Date,Press,Category,Title,Content,Comment,URL_Origin,URL_Naver
2023-06-13 15:57:12,한국대학신문,IT/과학,"원광대 김성철 교수, 개발단계 희귀의약품 '메카신' 루게릭병 임상시험 성공","[ 생명硏 리포트김장환 줄기세포융합연구센터 책임연구원어류·파충류 전유물이던 '재생'포유류서 관련 유전자 첫 발견손상된 조직·장기에 세포 이식건강한 상태로 되돌리게 하는세포치료제 개발·대중화 목표    줄기세포융합연구센터 연구팀이  세포치료제 관련 연구를 진행하고 있다.  한국생명공학연구원 제공인간의 생명과 건강을 위협하는 다양한 질병에 인류는 늘 의약품과 치료제 개발을 통해 적극적으로 대응해왔다. 과거엔 아스피린 같이 적은 분자량의 화합물이 전통적인 치료제 역할을 해왔다면, 최근엔 바이오의약품의 비중이 커지고 있다. 그중에서도 세포치료제와 유전자치료제, 조직공학치료제, 융복합치료제는 첨단바이오의약품으로 분류돼 전 세계적으로 활발한 연구개발이 이뤄지고 있다. 국내에서도 2020년부터 ‘첨단재생의료 및 첨단바이오의약품 안전 및 지원에 관한 법률(첨단재생바이오법)’이 시행되면서 새로운 패러다임의 치료제에 대한 연구개발이 탄력을 받고 있다. 본 연구팀은 파충류나 어류처럼 손상된 신체조직을 복구할 수 있는 세포치료제 기술을 연구하고 있다. ○아직은 갈 길 먼 세포치료제세포치료제는 첨단바이오의약품 중에서도 대중에게 가장 널리 알려져 있다. 세포치료제의 목적은 저분자화합물이 아닌 살아있는 세포를 손상된 조직이나 장기에 이식해 건강한 상태로 되돌리고자 하는 것이다. 화학적으로 합성해 만드는 기존 저분자화합물 의약품과 달리 세포치료제를 만들기 위해선 원하는 세포로 분화시키는 기술과 함께 세포 숫자를 불리기 위한 증식 기술이 필요하다. 따라서 증식능력과 분화능력을 모두 가진 ‘줄기세포’가 세포치료제의 핵심이 된다.조직이나 장기에서 손상된 세포를 되살리는 것을 우리는 ‘재생’이라고 부른다. 줄기세포는 건강한 우리 몸 안에서 정상적으로 존재하며, 이 줄기세포가 재생을 통해 세포를 공급해줌으로써 우리는 건강한 상태를 유지할 수 있다. 하지만, 안타깝게도 인간의 재생능력은 파충류나 어류에 비해 매우 제한적이다. 이를 극복하기 위해 인류는 줄기세포를 이용해 필요한 세포를 공급하는 ‘재생의학’과 ‘재생의학적 치료제’ 기술을 발전시키고 있다. 하지만 저분자화합물에 비해 상대적으로 커다란 세포를 의약품으로 만들기 위해서는 고려해야 할 요소가 많고, 비용 부담도 크다.면역거부반응이 일어나지 않도록 환자 맞춤형의 줄기세포를 확보하는 것도 중요하다. 다행히 핵치환 배아줄기세포 기술이나, 노벨상을 수상한 유도만능줄기세포(iPSC) 기술, 직접교차분화기술 같은 리프로그래밍 기술을 통해 면역거부반응이 없는 환자 맞춤형 줄기세포를 만들 수 있게 됐다. 이를 바탕으로 높은 순도로 치료세포를 만드는 기술도 빠르게 발전하고 있다. 하지만 여전히 유도만능줄기세포를 이용해 파킨슨병의 세포치료제를 만드는 데는 약 10억원 정도가 드는 수준이어서 재생의학적 치료제가 대중에게 널리 쓰이기 위해서는 아직 시간이 더 필요하다. ○도마뱀 꼬리처럼 재생할 수 있을까이렇게 재생의학적 기술을 연구하는 근본적인 이유는 인간을 포함한 포유류의 재생능력이 떨어지기 때문이다. 만약 포유류 이하 동물의 재생에 핵심적인 역할을 하는 ‘아체 세포(blastema cell)’가 포유류에도 존재한다면 손상된 조직을 재생시키는 과정은 지금보다는 매우 쉬워질 수 있다. 하지만, 그동안 수많은 연구에도 불구하고 현재까지 포유류에서는 아체 세포를 확인할 수 없었고 진화적으로 고등동물인 포유류에서 재생능력이 감퇴한 이유를 밝혀내지 못하고 있다.본 연구팀은 직접교차분화기술을 개선하기 위한 연구 도중 생쥐 세포의 리프로그래밍 과정에서 지금까지 볼 수 없었던 새로운 세포를 발견했다. 이어 이 세포에서 발견된 ‘데스모플라킨’이라는 유전자가 이 세포의 형성에 중요한 역할을 한다는 것을 확인했다. 흥미롭게도 제브라피시라는 모델 물고기에서 이 유전자를 억제시켰더니, 지느러미의 재생이 제대로 이뤄지지 않고 조직재생을 담당하는 아체세포의 형성도 저해됐다. 연구팀이 찾은 이 유전자의 발현 패턴을 분석해 보니, 파충류, 어류의 아체세포와 매우 유사함을 알 수 있었다. 즉, 포유류에서 최초로 아체 유사세포를 유도할 수 있음을 확인했다.    이 아체 유사세포가 도마뱀의 아체세포처럼 잘린 팔을 재생시킬 수 있는지는 아직 알 수 없다. 하지만, 특정한 조직 및 장기의 치료를 위해 각각의 세포를 제작하지 않고 아체세포를 이식하거나 유도함으로써 다양한 질병에 적용 가능한 경제적인 치료제가 가능할 것으로 기대하고 있다. 본 연구팀은 인공적으로 유도된 아체세포를 활용해 혁신적 치료제를 개발해 보다 많은 사람이 재생의학의 혜택을 누리는 세상을 꿈꾸며 새로운 도전을 시작했다. ]","['제발 성공해 주시길', '이런 기사 공통점. 혁신적인 기술인데 꼭 암만 시간 지나도 소식 없고 실용화가 안됨.', '이거 성공하면 불의의 사고로 팔 다리가 절단된 사람들은 다시금 새로운 삶을 꿈꾸며 살수 있겠네 치료비가 많이 들기는 하겠지만', '훌륭한 업적이셔요.. 대단하셔요 꼭 이뤄내시길 바랍니다', '손가락 한마디 절단된 남자가 돼지방광분말을 절단부위에 계속 뿌려서 손톱까지 재생시켰다던데. 핵심은 상처가 아물면 안됨 아물면 딱지 겉어내서 뿌리고 또 뿌리고 해서 손가락 완성시켰데요.', '짤린 팔 다리도 붙이는 세상인데 머리털 나는약은 없냐고..ㅠㅠ', '', '', '몇년전에 외국글에서 손가락 절단된 사람이 동물에 사용하은 재생크림(?) 같은 거를 계속 바르고 잘 관리 했더니 재생되었단 글을 본것 같은데.. 팩트인지는 모르겠지만\n성공 하면 정말 필요한 사람들에게는 기쁨이겠네요', '그럼 전부 데드풀 되는건가? ㅋ', 'ㅎㅎ세포 치료가 아니라 유전자를 조작 해야 하는데 그게 가능하냐 도마뱀 하고는 유전자 자체가 틀린데 어디서 말도 안되는 소리를 하네']",https://news.unn.net/news/articleView.html?idxno=548157,https://n.news.naver.com/mnews/article/015/0004855530?sid=105
2023.06.13.,코메디닷컴언론사 선정,,"헤딩 잦은 축구선수, 이 질환 위험 3.5배",,,https://kormedi.com/?p=1596330,http://news.unn.net
2023.06.13.,시장경제신문,,"""연구개발에 진심""... 부광약품, 제2의 도약 위한 발돋움",,,http://www.meconomynews.com/news/articleView.html?idxno=78531,https://www.kormedi.com/
2023-06-13 15:11:01,바이오타임즈,생활/문화,"퓨쳐켐헬스케어, 경북대병원 생산시설에 GMP 인증 완료","[ 英 노팅엄대 조사 결과 은퇴 후 2.8%가 진단    경기 중 반복적으로 단단한 공을 머리에 부딪히는 축구선수들은 은퇴 후 치매 진단을 받을 확률이 일반인보다 높다. [사진=뉴스1]축구 선수는 은퇴 후 치매에 걸릴 위험이 일반인보다 3.5배 높다는 연구 결과가 나왔다. 경기 중 헤더(헤딩)를 통해 반복적으로 단단한 공을 머리에 맞추는 행위가 선수의 신경 인지 체계에 영향이 있을 것이라는 기존의 예측을 뒷받침하는 결과다.  노팅엄대 연구팀이 은퇴한 프로 축구 선수와 일반인을 비교 조사했다. 연구팀은 참여자들에게 치매나 기타 신경퇴행성 질환의 증상과 위험 요인과 관련해 설문했다. 치매 확인을 위해 언어 학습 및 유창성 테스트, 기억력 테스트, 전화 인터뷰 등 다양한 지표를 사용했으며 이 점수를 연령, 체질량, 혈액 순환 정도 등의 건강 데이터와 함께 분석했다.  그 결과 전직 축구 선수 468명 중 13명(약 2.8%)이 치매 증상을 겪고 있었다. 일반인 그룹(619명 중 2명, 0.3%)에 비해 크게 높은 비율이다. 파킨슨병 등 치매를 제외한 신경퇴행성 질환 환자의 비율도 축구 선수 그룹(2.8%)이 일반인(0.9%)보다 높았다. 조사에 참여한 축구 선수 중 머리 부상이나 뇌진탕을 앓고 있는 사람이 각각 47.8%, 53.1%임을 고려할 때 헤더 행위가 충분히 위험하다는 것이 입증된 것이다.  잉글랜드 축구협회(FA)와 프로축구 선수협회(PFA)는 성명서를 발표해 ""이 분야에 대한 지속적인 연구와 함께 게임 내에서 잠재적인 위험 요소를 줄이기 위해 앞장설 것""이라며 ""뇌진탕 가이드라인을 설정하고 12세 이하 유소년 수준의 축구 경기에서 헤더를 금지하는 규정을 검토하고 있다""고 말했다.  실제 FA와 PFA는 2018년부터 노팅엄대와 함께 선수들의 장기적 뇌 건강에 대한 연구를 수행하고 있다. 선수들이 은퇴 후 신경인지 장애를 겪는다는 사실이 심심치 않게 보고된 탓이다.  전직 축구 선수 고든 맥퀸의 사례가 대표적이다. 고든은 1978년부터 1985년까지 맨체스터 유나이티드에서 180경기 넘게 출전하는 등 화려한 전성기를 보냈지만, 2021년 혈관성 치매 진단을 받았다. 영국 스포츠 중계 채널 '스카이스포츠'에서 아나운서로 활동하는 고든의 딸 헤일리 맥퀸은 ""아버지가 선수 생활 내내 무거운 공을 반복적으로 머리에 맞추는 훈련을 했다""고 말했다. 이를 계기로 훈련 중 머리 사용을 금지할 것을 촉구하는 활동에 참여하기도 했다.  축구 외에 다른 스포츠에서도 관련 문제가 제기된 적이 있다. 미국 프로풋볼리그(NFL)은 오랜 소송 끝에 지난 2016년 은퇴한 미식 축구 선수 약 2만 명에게 총 10억 달러가 넘는 '뇌진탕 보상금'을 지급하기로 했다. 우리 돈으로 1조2800억 원이 넘는 금액이다.  이때도 일부 은퇴 선수들이 ""NFL 사무국이 경기 중 뇌 손상 가능성을 선수들에게 제대로 알리지 않았으며 부상 방지를 위한 노력도 다하지 않았다""고 주장한 바 있다.  머리를 격하게 사용하는 스포츠 선수들의 장기적인 뇌 건강을 보호할 방안이 필요한 가운데, 노팅엄대의 이번 연구 결과는 국제축구연맹(FIFA)와 유럽축구연맹(UEFA) 등에 전달돼 규정 재정비의 근거 자료로 활용될 예정이다.  ]",[],http://www.biotimes.co.kr/news/articleView.html?idxno=11070,https://n.news.naver.com/mnews/article/296/0000066671?sid=103
2023.06.13.,뉴스1,,"지엔티파마, 제다큐어 주성분 '크리스데살라진' 제조법 등 특허출원",,,https://www.news1.kr/articles/5075854,http://www.meconomynews.com
2023.06.12.,NSP통신,,"경북잠사곤충사업장, 세원생명공학과 업무협약 체결... 경북 양잠산업 고도화...",,,https://www.nspna.com/news/?mode=view&newsid=642152,http://www.biotimes.co.kr/
2023.06.12.,로이슈,,"[IT이슈] 잡코리아·병무청, '청년장병 일자리 지원' 업무협약 체결 外",,,http://www.lawissue.co.kr/view.php?ud=202306122027072566204ead0791_12,http://news1.kr/
2023-06-13 18:03:53,코메디닷컴언론사 선정,경제,크레아틴은 정말 탈모의 원인일까?,"[ 인지장애, 루게릭병 등 뇌질환 치료제 개발 중    지엔티파마 사옥 전경(지엔티파마 제공)(서울=뉴스1) 최서윤 동물문화전문기자 = 신약 개발 기업 지엔티파마(대표 곽병주)는 제다큐어의 주성분인 '크리스데살라진'의 제조방법과 결정형 특허를 미국, 일본, 캐나다, 브라질, 이스라엘 등 5개국에 각각 출원했다고 밝혔다. 제다큐어는 반려견 인지기능장애증후군(치매)을 치료하는 신약으로 유한양행에서 유통하고 있다. 업체에서는 제다큐어에 이어 크리스데살라진을 활용한 알츠하이머 치매, 루게릭병 등 퇴행성 뇌질환 치료제를 개발 중이다. 13일 지엔티파마에 따르면 크리스데살라진은 알츠하이머 치매, 루게릭병, 파킨슨병 동물모델에서 뇌신경기능의 장애를 줄여준 것으로 나타났다. 특히 알츠하이머 치매와 유사한 인지기능장애증후군을 앓는 반려견(강아지)이 크리스데살라진을 주성분으로 한 제다큐어를 4주 이상 복용하면 인지기능과 사회활동이 개선되는 모습을 보였다. 제다큐어는 지난 2021년 2월 국내 최초로 농림축산검역본부로부터 동물용의약품 합성신약 품목허가를 받았다. 현재 1500여개 동물병원에서 판매되고 있다. 곽병주 지엔티파마 대표는 ""노인을 포함한 건강한 성인 72명을 대상으로 한 크리스데살라진 임상 1상이 성공적으로 완료됐다""며 ""알츠하이머 치매와 루게릭병 환자에서 예상되는 최대 약효 용량의 6배를 투약해도 안전했다""고 밝혔다.이어 ""크리스데살라진이 미국, 유럽, 한국에서 루게릭병 희귀의약품으로 선정됐을 뿐 아니라 비교약물들보다 동물모델에서 약효가 월등하고 사람에서의 충분한 안전성이 확보됐다""며 ""루게릭병 임상 2상 역시 조속히 진행할 계획""이라고 말했다.[해피펫]   ]",['오호 ~~'],https://kormedi.com/?p=1596056,https://n.news.naver.com/mnews/article/421/0006863719?sid=101
2023.06.13.,약업신문,,"퓨쳐켐, 경북대병원 생산시설 GMP 인증 완료",,,http://www.yakup.com/news/index.html?mode=view&cat=12&nid=282612,http://www.yakup.com
2023.06.13.,전민일보,,"원광대 김성철 교수, 개발단계 희귀의약품 '메카신'의 루게릭병 임상2상a 임상...",,,http://www.jeonmin.co.kr/news/articleView.html?idxno=379764,http://www.jeonmin.co.kr
2023.06.13.,뉴스1,,"지엔티파마, 제다큐어 주성분 '크리스데살라진' 제조법 등 특허출원",,,https://www.news1.kr/articles/5075854,http://news1.kr/
2023-06-13 18:03:53,NSP통신,경제,"경북잠사곤충사업장, 세원생명공학과 업무협약 체결... 경북 양잠산업 고도화...","[ 인지장애, 루게릭병 등 뇌질환 치료제 개발 중    지엔티파마 사옥 전경(지엔티파마 제공)(서울=뉴스1) 최서윤 동물문화전문기자 = 신약 개발 기업 지엔티파마(대표 곽병주)는 제다큐어의 주성분인 '크리스데살라진'의 제조방법과 결정형 특허를 미국, 일본, 캐나다, 브라질, 이스라엘 등 5개국에 각각 출원했다고 밝혔다. 제다큐어는 반려견 인지기능장애증후군(치매)을 치료하는 신약으로 유한양행에서 유통하고 있다. 업체에서는 제다큐어에 이어 크리스데살라진을 활용한 알츠하이머 치매, 루게릭병 등 퇴행성 뇌질환 치료제를 개발 중이다. 13일 지엔티파마에 따르면 크리스데살라진은 알츠하이머 치매, 루게릭병, 파킨슨병 동물모델에서 뇌신경기능의 장애를 줄여준 것으로 나타났다. 특히 알츠하이머 치매와 유사한 인지기능장애증후군을 앓는 반려견(강아지)이 크리스데살라진을 주성분으로 한 제다큐어를 4주 이상 복용하면 인지기능과 사회활동이 개선되는 모습을 보였다. 제다큐어는 지난 2021년 2월 국내 최초로 농림축산검역본부로부터 동물용의약품 합성신약 품목허가를 받았다. 현재 1500여개 동물병원에서 판매되고 있다. 곽병주 지엔티파마 대표는 ""노인을 포함한 건강한 성인 72명을 대상으로 한 크리스데살라진 임상 1상이 성공적으로 완료됐다""며 ""알츠하이머 치매와 루게릭병 환자에서 예상되는 최대 약효 용량의 6배를 투약해도 안전했다""고 밝혔다.이어 ""크리스데살라진이 미국, 유럽, 한국에서 루게릭병 희귀의약품으로 선정됐을 뿐 아니라 비교약물들보다 동물모델에서 약효가 월등하고 사람에서의 충분한 안전성이 확보됐다""며 ""루게릭병 임상 2상 역시 조속히 진행할 계획""이라고 말했다.[해피펫]   ]",['오호 ~~'],https://www.nspna.com/news/?mode=view&newsid=642152,https://n.news.naver.com/mnews/article/421/0006863719?sid=101
2023.06.12.,로이슈,,"[IT이슈] 잡코리아·병무청, '청년장병 일자리 지원' 업무협약 체결 外",,,http://www.lawissue.co.kr/view.php?ud=202306122027072566204ead0791_12,http://www.nspna.com/
2023.06.12.,코메디닷컴언론사 선정,,크레아틴은 정말 탈모의 원인일까?,,,https://kormedi.com/?p=1596056,http://www.lawissue.co.kr
25면 1단,한겨레,,호국보훈의 달…전쟁이 남긴 후유증은 사라지지 않는다,,,https://www.hani.co.kr/arti/opinion/because/1095629.html,https://www.kormedi.com/
2023-06-12 19:39:01,이데일리,생활/문화,"퓨쳐켐, 경북대병원 생산시설 식약처 GMP 인증 획득","[ 탈모나 대머리 유발한다는 확증 없어    크레아틴은 대표적인 근육강화보충제다. 인기가 높은 만큼 그 효과와 부작용에 대한 연구도 많다. 미국 노바사우스이스턴대 운동생리학자 호세 안토니오 박사는 ""크레아틴은 500건 이상 과학적 연구의 주제""라면서 ""어떤 식품보조제나 식이보충제도 지원 데이터를 이렇게 가지고 있지 않다""고 말했다.  반면, 크레아틴에는 탈모를 일으킨다는 소문이 끈질기게 따라다닌다. 최근 미국 남성 잡지 멘즈헬스 닷컴에서 이 소문이 진실인지 다뤘다. 탈모는 거의 70%의 남성에게 위협이 되므로 머리카락 손실을 걱정하는 것은 당연하다. 클리블랜드 클리닉에 따르면 머리카락을 유지하는데 가장 큰 위협은 대부분 유전자이다. 탈모증, 스트레스, 암 치료와 같은 질병과 함께 유전이 머리카락이 가늘어지는 주요 원인이라는 것. 이 목록에 크레아틴 보충제는 들어있지 않다.  크레아틴이 탈모 원인이라는 소문이 생긴 것은 초기의 한 연구에서 비롯됐다. 안토니오 박사는 ""연구들이 계속 진행 중이지만 현재의 증거는 크레아틴이 탈모나 대머리를 유발한다는 것을 나타내지 않는다""고 말했다.  소문은 2009년 남아프리카 공화국에서 대학생 연령대 럭비 선수 그룹이 3주 동안 매일 크레아틴을 복용한 연구에서 시작됐다. 이 연구는 참여자들의 머리카락에서 테스토스테론 부산물(dihydrotestosterone, DHT)이 '통계적으로 유의미한' 증가를 보였다고 발표했다. DHT는 고농도에서 모낭을 수축시키고, 머리카락 성장 주기를 단축하며, 머리카락을 가늘게 만들 수 있다.  국제적 연구팀과 함께 이를 검토한 안토니오 박사에 따르면 당시 연구에서 보충제를 복용한 럭비 선수들 중 누구도 실제로 탈모를 경험하지 않았다. 또한 크레아틴 복용 그룹은 위약 그룹보다 DHT 수치가 23% 낮은 기준에서 시작했고, DHT 증가도 정상적 한계 내에서 유지됐다. 즉, 선수들의 DHT 기준수치가 낮았고 낮은 상태로 유지됐다는 의미다. 안토니오 박사는 '통계적으로 유의미하다'는 것이 '생리적으로 의미가 있다'는 결론과 동일하지 않다고 말했다.  이후 다른 임상 실험들이 테스토스테론에 대한 크레아틴 보충제의 효과를 조사했지만 지금까지 남아프리카 연구팀의 결과가 되풀이된 사례는 없었다. 그럼에도, 당시 연구가 소셜 미디어를 통해 확산되면서 '크레아틴 탈모설'이 생겼다.  ▶크레아틴은 무엇인가?  크레아틴은 아미노산 유도체다. 이는 근육이 짧은 지속 시간, 고강도 운동을 위해 에너지를 생성하기 위해 사용하는 포스포크레아틴(PCR) 분자를 만들고 저장하도록 돕는다.  안토니오 박사는 크레아틴이 기억력과 뇌 기능을 향상시키고 신경근 질환, 제2형 당뇨병, 파킨슨병, 알츠하이머병, 외상성 뇌손상 환자들에게 이로울 수 있다는 연구 결과를 소개했다. 크레아틴은 운동과 더불어 노화에 관련된 근육 손실을 늦추거나 되돌리는 작용을 할 수 있다.  ▶모두에게 효과가 있는 것은 아니다  미 식품의약국(FDA)은 크레아틴을 약으로 승인하지 않았으나, '일반적으로 안전하다고 인증'(GRAS, General Recognized as Safe)했다. 올바르게 사용하면 크레아틴은 근육량의 형태로 체중이 약간 증가하는 것 외에 부작용이 크지 않다.  하지만 영양학자 레슬리 본시는 ""크레아틴이 모든 사람에게 효과가 있는 것은 아닐 수 있다""고 말한다. 본시에 따르면 크레아틴은 대부분의 고기와 생선에서 자연적으로 발생하는 유기화합물이기 때문에, '일상 식단의 일부로 크레아틴을 섭취하지 않는' 채식주의자들에게 보충제가 더 이로울 수 있다.  또한 근본적인 신장 질환이 있는 남성은 보충제 사용 전에 의사와 상담하는 것이 좋다. 핵심은 권장량을 지키는 것이다. 일반적으로 하루에 3~5g 정도가 적당하다. 한 번에 20g을 먹는다고 헐크가 되는 것은 아니다. 크레아틴은 수용성으로 너무 많이 섭취하면 그만큼 배설되기 때문이다.  ]","['크레아틴 먹으면 머리(두피)에 열나고 잠 안오고 심장 혈압 높아지는건 흔한 증상.\n특히 두피열은 탈모에 쥐약인 건 팩트.', '두타스테리드(아보다트) 복용중인데 크레아틴 1년 가까이 먹고있지만 아무 문제 없습니다.', '민주당 찢찢이 대머리인데 측근들 자살시켜서 사람두피 이식할거같음', '독이야 독', '헬스 트레이너들이 많이 복용하는 물에 타먹는 보충제이다.. 몸좋은 트래이너 놈처놓고 이것 안먹는놈들이 없지요..']",http://www.edaily.co.kr/news/newspath.asp?newsid=02574806635641064,https://n.news.naver.com/mnews/article/296/0000066649?sid=103
2023.06.12.,바이오타임즈,,"지엔티파마, '크리스데살라진' 특허출원…치매·루게릭병 치료제 개발 박차",,,http://www.biotimes.co.kr/news/articleView.html?idxno=11062,http://www.hani.co.kr/
