Date,Press,Category,Title,Content,Comment,URL_Origin,URL_Naver
A20면 TOP,경향신문,,시간 지난다고 절로 낫지 않는 파킨슨병…방치는 금물,,,https://www.khan.co.kr/life/health/article/202306302039015,http://www.khan.co.kr/
2023-06-30 20:40:15,약업신문,생활/문화,바이엘 파킨슨병 세포치료제 임상 1상 고무적,"[ 60대 이상 환자가 93% 달해퇴행성 질환이라 전조증상 없어정상적 노화현상과 혼동 쉬워초기에는 약물치료로 호전 가능떨림 계속 땐 뇌심부자극술 고려    파킨슨병을 앓고 있는 박모씨(62)는 길에서 택시를 잡을 때 어려움을 겪는다. 택시를 발견하고 손을 드는 동작이 너무 느려 택시가 지나가버릴 때도 많다. 온몸이 경직되는 증상도 심해져 항상 무거운 옷을 겹쳐 입고 있는 것처럼 느껴지니 단순한 행동 하나하나에 곱절의 노력이 필요하다.파킨슨병은 주로 60대 이상에서 발병하는 퇴행성 신경질환이다. 중뇌에 있는 흑질의 도파민 신경세포가 파괴되면서 신경전달물질이 점차 줄어들어 행동장애가 나타난다. 건강보험심사평가원 통계를 보면 국내 파킨슨병 환자 수는 지난해 12만547명으로, 2018년(10만5882명)보다 14% 증가했다. 지난해 기준 남성이 5만1345명(43%), 여성이 6만9202명(57%)으로 여성 환자 비율이 더 높았다. 연령별로는 60대 이상이 전체 환자의 93%를 차지했다.파킨슨병의 주요 증상은 손 떨림과 몸이 굳어지는 경직, 행동이 느려지는 운동완서, 보행장애 등으로 정상적인 노화현상과 혼동하기 쉽다. 김영수 한림대동탄성심병원 신경외과 교수는 “파킨슨병 증상 중 떨림과 경직은 정상적인 노화 과정에서는 드문 현상”이라면서 “고령의 파킨슨병 환자들은 신경퇴행이 빠르게 진행되며, 이 경우 약으로 조절하기 곤란하고 보행장애로 화장실 가는 것, 손 떨림과 경직으로 식사하는 것도 어려워지기 때문에 조기에 치료를 받아야 한다”고 설명했다.파킨슨병은 퇴행성질환이기 때문에 전조증상 없이 천천히 나타난다. 중뇌 흑질의 도파민 세포 중 약 80%가 없어졌을 때 증상이 시작되며 시간이 갈수록 조금씩 병이 악화한다. 초기에는 주로 몸의 한쪽 좌·우측에서 떨림이나 경직 증상이 생겼다가 점차 전신증상으로 넘어가고, 이후 보행장애까지 보인다. 몸의 한쪽에서 증상이 나타나는 점 때문에 뇌졸중과도 혼동하기 쉽다. 하지만 뇌졸중은 어느 날 갑자기 발병하며 언어장애가 동반되는 반면, 파킨슨병은 증상이 천천히 나타나고 동반 증상 역시 차이를 보인다. 신경과 전문의의 정밀한 진찰과 핵의학과의 양전자방출단층촬영(PET) 검사를 통해 진단을 내린다.병의 진행 정도에 따라 치료 방법은 달라진다. 초기에는 약물치료로 증상이 호전될 수 있지만, 2~3년 이상 약물치료를 하면 약효가 발현되는 시간이 줄고 효과도 떨어지는 경우가 있다. 또 몸이나 얼굴이 흔들리는 등의 이상운동증이 나타날 수 있어 이 시점부터는 수술적 치료를 생각해볼 수 있다. 또 약물치료를 받아도 떨림 증상이 감소하지 않아 어려움을 겪는 환자들 역시 발병 초기라도 수술을 고려할 필요가 있다.가장 널리 시행되고 있는 수술은 뇌심부자극술이다. 전 세계적으로 매년 1만건이 넘는 뇌심부자극술이 시행되고 있으며, 국내에서도 300건 이상 시행되고 있다. 뇌심부자극술은 뇌심부에 전극을 집어넣어 신경전달물질이 오가는 경로가 제 역할을 하도록 되돌리는 방식이다. 전기 자극은 가슴의 피부 밑에 설치하는 자극 생성기에서 전선과 전극을 통해 전달된다. 5~6㎜ 정도의 아주 작은 신경핵에 전극을 집어넣기 때문에 매우 정교한 수술이 요구된다. 완치까지는 아니지만 환자 스스로 일상생활을 할 수 있게 해주는 것이 목적이다.뇌심부자극술은 파킨슨병이 이미 심하게 진행된 환자에게는 권고하지 않는다. 진행 정도를 초기 1등급에서 말기 4등급까지로 분류할 때, 2등급 말에서 3등급 초에는 수술 효과가 좋지만 3등급 말이나 4등급이 되면 효과를 보기 어렵다. 또 비운동증상을 보이는 환자도 수술 효과가 떨어진다. 비운동증상은 우울, 불안, 인지기능 저하, 변비, 소화불량, 수면장애, 다한증 등인데 주로 운동증상이 먼저 나타난 뒤에 발현된다. 신경전달물질인 도파민이 운동신경계뿐 아니라 자율신경계에도 작용하기 때문에 이러한 증상이 나타나는 것이어서, 뇌심부자극술로는 전신에 퍼져 있는 자율신경계를 치료하기 어렵다. 대신 약물치료 및 재활치료를 받는다.    김영수 신경외과 교수가 파킨슨병에 대해 설명하고 있다. 한림대동탄성심병원 제공김영수 교수는 “파킨슨병은 신경 노화로 인해 발생하는 질환으로 ‘시간이 지나면 좋아지겠지’라는 생각으로 방치하면 병이 악화하고 치료도 어려워진다”며 “뇌심부자극술을 받으면 병 이전 상태로 돌아가 정상적인 일상생활이 가능해지는 만큼 전문의와 상의해 치료방법과 수술 여부를 결정하는 것이 중요하다”고 말했다.   ]","['파킨슨 약조절 운동 잘해야 합니다 그런데 그게 너무 어렵습니다 ㅠㅠ 울엄마 발가락 변형까지오고 식욕저하, 걷지도못하십니다 악화가 순식간입니다.. 얼른 치료제 개발해주세요 모든 파킨슨환우분들 그리고 보호자들 화이팅입니다!!', '어르신들 드시는 심장약,우울증약에도 파킨슨병 증세 유발하는 성분 있습니다.\n대학병원 진료 후 약물 중단하니\n증세도 없어졌습니다\n웃기는건 심장내과에 소견서 떼가니 두말 않고 약 빼줌(꼭 안 먹어도 될 약이었는지~)', '전세계 학문파들은 무얼 지금까지 연구하셨죠? 어찌 단한명조차도 인간신체비밀 정확히  못밝히고 한국 초딩중퇴 논문조차없는이가 인간 신체비밀 다 밝힌듯 싶네요.. 부끄러워 좀 해주세요..날로 먹는 논문이 사실인냥 학벌인냥 과대포장되고 당신들도 학문이라는 상당 가짜정보에 속은것도 많을껄요..그 인체비밀들 절대 풀수 없을테니 극소수장수위해 전세계인들과 동물 임상 이젠 그만하세요.. 모든이는 다 소중하기에 공평하게 사시든 자발적 변화하시든 여러분의 선택일듯..세계가 대변화하지않는다면  인간유전자복원 비밀은 지구에선 절대 오픈되진않을겁니닺', '파킨슨병', '우울증약.성형과다.전자파과다.인공빛 과다..각종 식풍에노  파킨스병노출 유발군 많으니  자신몸 자신이  지키시길요. 사실 죽기전까지 치매안걸려야  인간 유전자정상인데도.전세계 전산업이  수십만년 산업이라는 문화라는 거짓포장들로 전세계인들 뇌 부분 기형오게했는데도 누적이라 본인들 스스로 체감못하는건 슬픈 지구 비극이네요.']",http://www.yakup.com/news/index.html?mode=view&cat=16&nid=283130,https://n.news.naver.com/mnews/article/032/0003233280?sid=103
2023.06.28.,메디컬월드뉴스,,"뇌 글림프 체계 손상된 렘수면장애 환자, 파킨슨병 위험 높아… ‘글림프 체계...",,,https://medicalworldnews.co.kr/news/view.php?idx=1510956200,http://www.yakup.com
2023.06.27.,중부일보,,"뇌 글림프 체계 손상된 렘수면장애 환자, 파킨슨병 위험 높아",,,http://www.joongboo.com/news/articleView.html?idxno=363598850,http://www.medicalworldnews.co.kr
2023.06.27.,AI타임스,,"[AI&빅데이터쇼] 에이트스튜디오, 파킨슨병 자가진단하는 AI 앱 소개",,,https://www.aitimes.com/news/articleView.html?idxno=152026,http://www.joongboo.com
2023.06.27.,메디게이트뉴스,,"편두통, 파킨슨 발병 리스크 증가·비만 상호영향 ""적극적 치료 필요""",,,https://www.medigatenews.com/news/1433644348,http://aitimes.co.kr
2023.06.26.,충청투데이,,'파킨슨병' 꾸준한 치료가 삶의 질 높인다,,,https://www.cctoday.co.kr/news/articleView.html?idxno=2180189,http://www.medigatenews.com
18면 TOP,디지털타임스,,"K-제약바이오, 미래 먹거리 `파킨슨병 신약` 잇단 도전장",,,https://www.dt.co.kr/contents.html?article_no=2023062602109931027007&ref=naver,http://www.cctoday.co.kr
2023.06.26.,팜뉴스,,한 번의 검사로는 발견 어려운 '파킨슨병' …정확한 진단 위해서는,,,http://www.pharmnews.com/news/articleView.html?idxno=226048,http://www.dt.co.kr/
2023-06-26 17:09:07,한국일보,IT/과학,60대 이상 손 떨고 행동 느려지면 파킨슨병 의심…방치하면 치료 어려워져,"[ 임상 성공률 낮아 실패 빈번에이비엘바이오 가장 돋보여    파킨슨병(Parkinson's disease)의 증상. &lt;자료: 서울아산병원&gt;    국내 제약·바이오 기업들이 파킨슨병 치료제 개발에 도전하고 있다. 파킨슨병은 뇌의 도파민 신경세포가 손상돼 발병하는 질환으로 아직까지 진행을 막거나 느리게 하는 치료제가 없다. 또한 파킨슨병의 발병 원인이 명확하지 않고 임상 과정이 어려워 임상 성공 확률도 낮다 보니 글로벌 기업들조차도 임상 실패가 빈번하다. 국내 기업들은 이중항체를 적용하거나 마이크로바이옴(미생물 체계) 치료제 영역을 파킨슨병으로 확장하는 방법 등 다양한 연구를 진행하고 있다.  26일 제약바이오 업계에 따르면 파킨슨병 치료제 개발에 앞선 곳은 이중항체 전문기업 에이비엘바이오다. 에이비엘바이오는 지난해 1월 퇴행성 뇌질환 치료 이중항체 후보물질 'ABL301'을 글로벌 제약사 사노피에 기술 수출해 주목받았다. 에이비엘바이오 관계자는 ""ABL301은 뇌안의 알파시뉴클레인(alpha-synuclein)의 단백질 축적을 억제하는 동시에 혈액 뇌관문에 발현된 IGF1R을 표적해 뇌 전달율을 향상시킨 이중항체""라고 설명했다. 알파 시뉴클레인은 뇌안의 나쁜 단백질을 의미한다. 에이비엘바이오는 약물을 전달하는 플랫폼 기술 '그랩바디-B'(Grabody-B)의 확장성을 기반으로 퇴행성 뇌질환 관련 연구개발을 하고 있다. 에이비엘바이오 관계자는 ""미국에서 임상 1상은 에이비엘바이오가, 임상 2상부터 상업화까지는 사노피가 진행한다""고 밝혔다. 셀트리온은 올 초 국내 마이크로바이옴 신약 개발사인 리스큐어바이오사이언시스와 마이크로바이옴 기반 파킨슨병 치료제를 공동 연구·개발하는 계약을 했다. 양사는 경구 제형의 마이크로바이옴 기반 파킨슨병 치료제를 개발하고 있다. 리스큐어가 초기 개발을 마치면 셀트리온이 임상과 허가를 맡는 구조다. 대웅제약과 한올바이오파마는 최근 미국 파킨슨병 신약 개발사 '빈시어 바이오사이언스'(Vincere Biosciences)에 공동 투자키로 했다. 빈시어는 AI(인공지능) 플랫폼을 활용해 파킨슨병, 알츠하이머 치매 등 노화로 인한 퇴행성 질환 치료제를 개발하는 회사다. 이 회사는 체내 미토파지(Mitophagy) 활동을 강화시켜 건강한 미토콘트리아의 비율을 높이고, 파킨슨병의 진행을 저해하는 것을 목표로 치료제를 개발하고 있다. 세포 내 에너지를 공급하는 미토콘드리아가 손상되거나 수명이 다하면 세포가 이를 제거하는 '미토파지' 현상이 일어나는데, 이 기능이 원활히 이뤄지지 못하면 신경퇴화, 근육약화는 물론 파킨슨병 등의 퇴행성 질환을 유발할 수 있다. 한올바이오파마 측은 ""파킨슨병 치료제 개발을 위한 협력은 물론 임상시험 설계, 환자 후보군 선정 등 빈시어의 AI 플랫폼을 활용한 협력을 모색할 예정""이라고 말했다. 또한 바이오벤처 가운데 에스바이오메딕스는 베아줄기세포 기반 파킨슨병 치료제를 개발하고 있으며 현재 임상 1·2a상 중이다. 카이노스메드는 파킨슨병 치료제 후보물질인 'KM-819'에 대한 미국 임상 2상 첫 환자 투여를 시작했다. 제약·바이오업계 한 관계자는 ""뇌에 모든 장기가 연결돼 있다 보니 파킨슨병 치료제는 장, 간, 중추신경까지 다양한 형태로 임상이 진행되고 있다""며 ""어떤 방법이 효과적일지에 대해서는 아직 명확하지 않고, 결국은 구체적인 임상적인 데이터가 나와야 뚜렷해질 것""이라고 말했다. ]","['제약업계 종사자가 볼때 가장 앞서 있는 바이오 기업은 미국임상 2상 진행중인 카이노스메드란 기업이 기술적으로 가장 앞서 있는거 같네요.', '주가는 반토막임 가장 앞서 있는데 주가는??', '제발 하루빨리 치료제가 나오기를~~~', '미국회사에 투자.하는게 맞음 #~한국 기업들중에 가장.앞서 있는데 주가는 반토막 대주주외8인 주식담보대출 받았네~~  흑전에 기술수출 해도 주가는 반토막 한국시장에 투자하면 거시기 됨\'""""~~', '']",https://www.hankookilbo.com/News/Read/A2023062218200003823?did=NA,https://n.news.naver.com/mnews/article/029/0002809348?sid=105
2023.06.23.,MBC,,파킨슨병 진단받은 33살 LED 노동자‥6년 만에 산재 인정,,,https://imnews.imbc.com/news/2023/society/article/6496579_36126.html,http://imnews.imbc.com/
2023-06-23 18:55:43,머니투데이,사회,"""카이노스메드, 난치질환 최강자…파킨슨병 치료제로 기업가치↑""","[     자료사진LED 제조 공장에서 일한 뒤 33살 나이에 파킨슨 병을 얻은 근로자가 6년 만에야 법원 판결로 산업재해를 인정받았습니다.서울행정법원 행정11단독은 전 LED 공장 노동자인 47살 신 모 씨가 자신의 파킨슨병을 산업재해로 인정해 달라며 근로복지공단을 상대로 제기한 소송에서 ""산업재해가 맞다""고 판결했습니다.신 씨는 지난 2002년 3월부터 2년 9개월간 LED 제조업체 두 곳에서 유해화학물질 등을 다루는 작업을 한 뒤 퇴직했는데, 지난 2007년부터 왼쪽 팔의 움직임이 줄어드는 증상이 나타났고, 결국 33살이던 지난 2009년 파킨슨병 진단을 받았습니다.신 씨는 지난 2017년 LED 제조업체에서 일할 때 노출된 유해인자 때문에 파킨슨병이 생겼다며 근로복지공단에 산업재해 신청을 했지만, 공단 측은 2년 간의 심사 끝에 ""업무와 파킨슨병 사이의 상당한 인과관계가 없다""며 불승인했습니다.당시 공단은 ""파킨슨병은 현대의학상 발병 원인을 찾지 못하고 있고, 유전 요인 또는 유해인자로 인해 발병할 수 있다""며 ""신 씨가 근무하며 파킨슨병 유해인자를 사용했는지 여부가 명확하지 않고, 사용했더라도 노출 수준이 높지 않다""고 불승인 이유를 밝혔습니다.이에 대해 재판부는 ""신 씨가 하루 평균 11시간에서 12시간씩 일하고, 휴일은 1년에 5일 이내에 불과할 정도로 과중한 업무를 수행했다""며 ""당시 열악한 근무환경과 과다한 근로 시간 등을 종합하면 신 씨가 사업장에서 노출된 유기화합물과 유기용제 종류는 더 다양하고 노출 정도가 훨씬 중하다고 추론하는 게 합리적""이라고 판단했습니다.그러면서 재판부는 ""비록 파킨슨병의 명확한 원인이 규명되지 않았다고 하더라도, 법적·규범적 관점에서 이 병은 신 씨가 사업장에서 근무할 때 다수의 유기용제와 유기화합물에 노출된 것이 원인됐다고 보는 게 합리적""이라고 밝혔습니다.이번 결정에 대해 '반도체 노동자의 건강과 인권지킴이 반올림'은 ""근로복지공단이 업무와 질병간 상당인과관계를 판단할 때 의학적 관점으로 협소하게 판정하고 있다""며 ""법적·규범적 관점에서 여러 제반 사정을 고려하라는 대법원 판례 기준에 따라 공단의 위법 부당한 불승인 판정 관행을 시정해야 한다""고 촉구했습니다. ]",[],http://news.mt.co.kr/mtview.php?no=2023062310484310643,https://n.news.naver.com/mnews/article/214/0001281229?sid=102
2023.06.22.,컨슈머타임스,,60대 이상 손 떨고 행동 느려지면 '파킨슨병' 의심…방치하면 치료 어려워져,,,https://www.cstimes.com/news/articleView.html?idxno=548903,http://www.mt.co.kr/
2023-06-23 10:49:55,한국경제,경제,"“에스바이오메딕스, 파킨슨병 치료제 개발 잠재력 보유”","[    한국IR협의회 기업리서치센터는 23일 카이노스메드에 대한 '난치병 질환 분야의 최강자'란 보고서를 통해 파킨슨병 치료제가 기업가치 상승을 이끌 수 있다고 분석했다.이달미 한국IR협의회 기업리서치센터 연구원은 카이노스메드가 난치병의 근본적 치료를 위한 혁신적 신약을 연구하고 기술이전을 추진해 수익을 창출하는 사업 모델을 갖고 있다고 소개했다.이 연구원은 카이노스메드의 주요 파이프라인으로 파킨슨병·다계통위축증 치료제(KM-819), 에이즈 치료제(KM-023), 항암제(KM-1004)를 꼽았다. 특히 ""가장 주목되는 후보물질은 파킨슨병 치료제인데 현재 미국에서 임상2상 진행 중""이라며 ""향후 유효성 데이터 발표 시 기업가치 상승에 긍정적일 전망""이라고 평가했다.또 ""에이즈 치료제는 중국 파트너를 통해 현지 시장에서 판매하고 있어 로열티(기술사용료) 매출이 인식되고, 향후 유럽 시장으로 진출도 계획 중""이라며 ""올해부터 본격적으로 에이즈 치료제 관련 매출 발생이 예상된다""고 조언했다. 이어 ""항암제는 개발 초기 단계에 있는 엑소좀 치료제로 아직 후보물질 도출 단계지만 우수한 동물실험 데이터 발표 시 기술수출이 가능할 전망""이라며 ""카이노스메드는 경쟁 업체 대비 시가총액이 낮아 향후 파킨슨병 치료제의 긍정적인 임상2상 유효성 데이터 발표 시 기업가치 상승이 가능할 것""이라고 덧붙였다. ]",['이것도 이제 휴지될때가 오나보내~ ㅋㅋㅋ'],https://www.hankyung.com/it/article/202306226033i,https://n.news.naver.com/mnews/article/008/0004903145?sid=101
2023.06.21.,헬스인뉴스,,"환갑 이후 '손' 떨린다면, 방치하지 마세요 '파킨슨병'",,,http://www.healthinnews.co.kr/news/articleView.html?idxno=38476,http://www.cstimes.com
2023.06.21.,브레인미디어,,파킨슨 유발하는 독성 단백질 형성원리 규명 '조기 진단' 가능해져,,,http://www.brainmedia.co.kr/BrainScience/23514,http://www.hankyung.com/
2023-06-22 08:39:06,세계일보언론사 선정,IT/과학,파킨슨병 장모 치료하려고… ‘1병 300만원’ 식초 사기당한 사위,"[ 한양증권 분석한양증권은 22일 에스바이오메딕스에 대해 배아줄기세포 기반의 치료제를 개발하고 있어 압도적인 잠재력을 보유하고 있다고 판단했다. 투자의견과 목표주가는 제시하지 않았다. 오병용 연구원은 “국내 대부분의 줄기세포 기업들이 지방 제대혈 등 성체줄기세포로 치료제를 만드는 데 반해, 에스바이오메딕스는 배아줄기세포 기반의 치료제를 만든다”며 “배아줄기세포는 난자와 정자가 합쳐진 수정란에서 체취한 세포로, 인체의 어떠한 세포로도 분화가 가능해 몸의 어떤 손상 부위라도 재생시킬 수 있는 잠재력을 가진다”고 설명했다. 에스바이오메딕스는 배아줄기세포를 고순도의 신경전구세포로 분화시키는 기술을 보유하고 있다. 신경전구세포를 이용해 파킨슨병 치료제 임상 1·2a상), 척수손상 치료제 임상 1·2a상을 진행하고 있다. 또 지방유래 중간엽줄기세포를 이용해 중증하지허혈 치료제 임상 1·2a상도 개발 중이다. 핵심 후보물질(파이프라인)인 파킨슨병 치료제는 파킨슨병의 완치를 목적으로 하는 임상으로 잠재력이 크다고 판단했다. 파킨슨병 임상 1·2a상은 총 12명을 대상으로 지난달 환자 투약을 시작해 현재까지 3명이 투약했다. 배아줄기세포로 도파민 신경세포를 직접 만들어 뇌에 투여하는 방식이다. 파킨슨병의 근본적인 치료를 목표로 한다. 원숭이 실험을 통해 치료제를 투여한 세 마리의 파킨슨병 원숭이가 정상 수준까지 회복된 것을 확인했다. 또 양전자방출 단층촬영(PET-CT)에서 투여한 세포가 장시간동안 도파민을 분비하는 것을 확인했다. 오 연구원은 “사람 대상 임상은 이제 시작 단계지만 파킨슨병의 완치를 목적으로 하는 임상으로 잠재력이 크다”며 “1~2명 투약 환자의 치료 효과가 알려지면 주가에도 영향이 있을 것”이라고 말했다.그는 “에스바이오메딕스는 지난달 4일 상장해, 지난 5일 1개월 보호예수 물량 453만주(주식 수의 약 41%)가 풀렸다”며 “1개월 오버행이 풀린 이후 2주 이상 지난 현재 상당수의 물량이 소화된 것으로 추정된다”고 했다.     ]","['', '웃음만 나오네', '', '최악의 사기회사\n상장의 문제점을 여실히 들어내고 아무것도 안하는 회상임', '파킨슨은 펩트론']",http://www.segye.com/content/html/2023/06/19/20230619508444.html?OutUrl=naver,https://n.news.naver.com/mnews/article/015/0004859151?sid=105
18면 1단,대전일보,,[생활속 과학이야기] 한의치료에서의 파킨슨병,,,http://www.daejonilbo.com/news/articleView.html?idxno=2069779,http://www.healthinnews.co.kr
2023.06.27.,뉴스핌,,"""카이노스메드, 파킨슨병치료제 임상2상 본격화...올 4분기 결과발표 예상""-하...",,,http://www.newspim.com/news/view/20230627000156,http://www.brainmedia.co.kr
2023.06.17.,더구루,,"바이오젠, 파킨슨병 치료제 임상3상 연구 중단",,,https://www.theguru.co.kr/news/article.html?no=55245,http://www.segye.com
2023.06.27.,의학신문,,파킨슨병 환자 뇌 전기자극으로 보행 개선,,,http://www.bosa.co.kr/news/articleView.html?idxno=2200065,http://www.bosa.co.kr
2023.06.15.,코메디닷컴,,"""파킨슨병 유발 단백질 생성 원리 찾았다"" … 조기 진단에 새 지평",,,https://kormedi.com/?p=1596824,https://www.kormedi.com/
