Date,Press,Category,Title,Content,Comment,URL_Origin,URL_Naver
2023-04-25 15:01:13,이데일리,경제,"‘노벨상 수상’ 크레이머 ""韓저출산 문제 해법은 '이민 정책'""","[ 한은 ‘노동시장 세미나’ 개최  美와 달리 노동시장 덜 타이트한 韓  은퇴한 베이비부머 취업 등 영향  ‘고용의 질’은 낮아…경제 영향 제한적  “노동시장 경직도 낮아지면 물가 하락”         한국은행은 올해 노동시장에서 일자리를 구하려는 사람이 늘면서 노동시장 긴장도(tightness)가 낮아질 것라고 전망했다. 노동시장 긴장도는 실업자 1명당 빈 일자리 수를 나타내는 지표로, 시장 내 노동 수급 상황을 나타낸다. 긴장도가 높다는 것은 일자리를 찾는 사람보다 현재 비어 있거나 1개월 안에 새로 채용될 수 있는 일자리보다 많다는 의미다. 반대의 경우에는 노동시장 긴장도가 낮다(덜 타이트하다)고 표현한다.우리나라의 경우 고령층과 여성 중심으로 노동 공급이 늘면서 노동시장 긴장도가 완화되고 있는 것으로 풀이된다. 그 결과 물가 상승 압력도 낮아질 것이라고 한국은행은 내다봤다.    이창용 한국은행 총재가 25일 오전 서울 한국은행 통합별관에서 열린 2023년 한국은행 노동시장 세미나에서 환영사를 하고 있다. / 연합뉴스  고령층·여성 취업 증가에 韓 노동시장 긴장도, 팬데믹 이전과 동일        서영경 한국은행 금융통화위원회(금통위) 위원은 25일 서울 중국 한은 본부에서 열린 ‘노동시장 세미나’에서 이같이 밝혔다. ‘노동시장 상황과 인플레이션 압력’을 주제로 열린 이번 세미나에서 한은과 경제학자들은 국내외 노동시장의 변화를 다각도로 살펴보는 시간을 가졌다.서 위원은 “최근 주요국의 통화정책 차별화는 노동시장 상황 차이와 이에 따른 물가압력 차별화에도 일부 기인하는 것으로 판단된다”면서 “올해 중 고용시장에서는 수요 둔화와 공급 확대가 맞물리면서 긴장도가 완화되고, 이는 물가 압력을 낮추는 요인으로 작용할 전망”이라고 말했다.한국은행에 따르면 우리나라 노동시장 긴장도는 코로나 팬데믹(세계적 대유행) 이전과 같은 수준인 0.34를 기록 중이다. 팬데믹 이후 일자리가 급격히 늘어나 노동시장 과열이 나타난 미국과는 대조되는 흐름이다. 미국의 노동 긴장도는 팬데믹 이전(2014~2019년) 0.86에서 팬데믹 이후(2021년~지난 2월) 1.57로 높아졌다.우리나라의 경우 취업자 수, 고용률, 경제활동참가율, 실업률 등 노동시장 양적 지표는 팬데믹 이전 수준을 크게 웃돌았음에도 불구하고 노동시장 긴장도가 낮게 유지됐다. 한국은행은 그 이유로 고령층과 여성을 중심으로 일하려는 사람이 많아진 점을 꼽았다. 베이비부머 세대(1946~1959년)의 은퇴로 고령층 고용이 증가한 가운데 만혼·저출산에 가사노동의 시장화로 여성 고용이 늘었기 때문이다.고령층과 여성 노동 공급이 비정규직 등 ‘불완전 고용’을 위주로 증가하면서 총 근로시간이 감소한 점도 노동시장 긴장도 완화에 기여하고 있다고 서 위원은 평가했다.다만 서 위원은 고용의 양적 증가에 불구하고 고용의 질이 개선되지 않은 탓에 이런 노동시장의 변화에 성장률 등 거시경제에 미치는 영향은 크지 않다고 봤다. 서 위원은 “우리나라는 미국과 비교하여 성장과 취업자간 상관관계가 낮고, 미국과 달리 팬데믹 이후 노동생산성이 하락했다”고 했다.실제 국내총생산(GDP)과 취업자간 상관계수는 지난 2010~2022년 기준 한국이 0.52로 미국(0.9)과 유럽연합(0.7%)에 비해 낮았다. GDP 대비 취업자수로 나타내는 노동생산성도 한국은 2011~2019년 기준 2.5%에서 2020~2022년 1.7%로 낮아진 반면, 미국은 같은 기간 0.4%에서 1.3%로 높아졌다.서 위원은 “고용의 전통적인 양적 지표와 물가간 직접적인 관계는 높지 않지만, 고용시장 긴장도와 근원물가는 밀접한 관계가 있는 것으로 추정된다”고 했다. 물가의 기조적 흐름을 보여주는 근원물가 상승률이 높게 유지되면 인플레이션 둔화 속도가 더뎌지기 때문에 한국은행에서는 근원물가 흐름을 예의주시하고 있다.그러면서 노동시장 경직도가 지속적으로 낮아지면 물가를 낮추는 요인으로 작용할 수 있다고 봤다. 우리나라 노동시장 경직도와 근원물가 상승률은 지난해 10월을 기점으로 동반 하락 중이다.나아가 서 위원은 “노동생산성 하락이 지속될 경우 저성장·저물가 체제로 회귀가 불가피하고 통화정책적 부담도 증가할 수 있기 때문에 적극적인 대응이 필요하다”고 했다.다만 서 위원은 연내 피벗(pivot·통화정책 전환) 가능성엔 선을 그었다. 그는 “고용 측면에서 물가 압력은 완화됐지만 기대인플레이션이나 수입물가, 환율 등이 다른 요인이 영향을 미치고 있어 추이를 더 지켜볼 필요가 있다”고 했다.    서영경 한국은행 금융통화위원이 25일 오전 서울 한국은행 통합별관에서 열린 2023년 한국은행 노동시장 세미나에서 노동시장 변화와 통화정책적 함의를 주제로 연설하고 있다. / 연합뉴스  이 총재 “노동시장-인플레 관계 확인해야 의미있는 통화정책 수립”        ‘물가 안정’이 최우선 정책 목표인 한국은행이 노동시장에 중점을 둔 세미나를 개최한 것은 이례적이라는 평가다. 국내에서 코로나 전후 노동시장의 변화와 통화정책적 의미를 다룬 것은 이번이 처음이다.지난해 공격적으로 기준금리를 인상한 미국이 견조한 노동시장을 근거로 추가 긴축을 시사하는 등의 행보를 이어가자, 한국은행도 노동시장이 인플레이션과 통화정책에 미치는 영향을 분석하기로 한 것으로 보인다.이창용 한국은행 총재는 이날 환영사에서 “세계 각국에서 노동시장과 인플레이션의 관계에 대한 연구가 활발하게 이뤄지고 있기 때문에 우리나라도 이런 관계를 확인하는 게 매우 중요한 과제가 됐다”고 말했다.이 총재는 “팬데믹 이후 국내외 노동시장에 많은 변화가 일어나고 있는데, 글로벌 공통적인 요인도 있지만 각국의 상이한 노동시장 여건으로 인한 노동시장 변화와 물가에 대한 영향이 국가별로 다르게 나타나고 있고 (이런 변화가) 일시적인 구조적인지 여부도 불확실한 상황”이라고 했다.그는 “노동시장은 고용과 성장, 물가 등 거시경제 전반에 광범위한 영향을 미칠 뿐만 아니라 소득분배와 인적자본 형성 등을 통해 개인의 삶과도 직결되는 중요한 주제”라며 “특히 우리나라는 급속한 고령화에 따른 노동시장의 구조변화에 대해 더욱 관심을 가질 필요가 있다”고 강조했다.나아가 고령화 등 노동시장 구조가 경제정책에 미치는 영향, 단기적으로 인플레이션에 미치는 영향을 점검하지 않으면 의미 있는 거시경제적 통화정책을 수립하는데 한계가 있다고 덧붙였다. ]","['긴장도가 높다는 것은 일자리를 찾는 사람보다 현재 비어 있거나 1개월 안에 새로 채용될 수 있는 일자리보다 많다는 의미다. &gt; 비문인것 같은데 수정 부탁드려요', '']",http://www.edaily.co.kr/news/newspath.asp?newsid=03148806635579728,https://n.news.naver.com/mnews/article/366/0000896466?sid=101
2023.04.25.,뉴시스,,"강기정 광주시장 ""외국인 전담부서 신속 설치 검토""",,,http://www.newsis.com/view/?id=NISX20230425_0002280122&cID=10201&pID=10200,http://www.heraldbiz.com/
2023-04-25 18:18:03,전라일보,사회,"정읍시, 올해 하반기 외국인 계절근로자 프로그램 추진","[     [헤럴드경제=정경수 기자] (사)대한건축학회는 오는 27일 ‘인구 구조 변화에 따른 지방소멸위기 대응 방안’ 세미나를 개최한다고 25일 밝혔다.행사는 부산 벡스코 제2전시장 1층 회의실에서 개최된다. 교육원 AAL 총원우회와 ㈜피오랜이 주관하며 롯데건설, 한화건설, 계룡건설 등이 후원한다. 김종욱 ㈜피오랜 회장이 세미나 좌장을 맡고, 임동근 한국교원대 교육박물관 연구원이 주제 발제를 진행한다. 임 연구원은 ‘기초지방자치단체의 인구변화를 통해서 본 저출산 고령화의 도시별 특징’을 주제로 발표할 예정이다. 주제 발제에 이어 ▶유선종 건국대 부동산대학원 원장 〈노인복지주택 현황 및 활성화 방안〉 ▶김진욱 서울과기대 교수 〈저출산시대의 공동주택 단위세대 평면유형변화 예측〉 ▶김태현 연세대 보건대학원 의료경영학과 교수 〈인구고령화시대, 건강증진을 위한 노인복지주택〉 ▶박진경 전 이화여대 초빙교수 〈고령사회 주거복지정책 현황과 과제〉 등 토론이 이어진다. 김 회장은 “현 시점을 인구감소 문제 해결의 골든타임으로 본다”며 “인구 급감으로 인한 지방소멸 위기 대처 및 새로운 생애주기 맞춤형 주거복지 주택과 지방 활성화 대책 마련을 위해 함께 고민할 것”이라고 했다. ]",[],http://www.jeollailbo.com/news/articleView.html?idxno=690684,https://n.news.naver.com/mnews/article/016/0002135122?sid=102
29면 TOP,헤럴드경제언론사 선정,,[홍길용의 Money Story] 국민연금 ‘대재앙’과 ‘연금지옥’까지 불과 18년,,,http://news.heraldcorp.com/view.php?ud=20230412000301,http://www.edaily.co.kr/
2023-04-25 16:01:09,대한경제,경제,금통위원ㆍ한은 직원ㆍ경제 석학…‘韓 노동시장’ 머리 맞댔다,"[ 내달 인천 송도 'ADB 총회' 참석 앞두고 인터뷰""외국인 근로자로 인력 확충 및 세수 확대""""정부, '선구매"" 정책으로 기술 혁신 이끌어야""[세종=이데일리 김은비 기자] 빈곤퇴치 연구로 2019년 노벨경제학상을 수상한 마이클 크레이머(Michael Kremer) 미국 시카고 대학교 교수가 한국의 저출산, 고령화 문제 해법으로 ‘이민정책’을 제시했다. 이민 정책을 통해 경제활동인구를 확충은 물론 성장 잠재력을 높일 수 있다는 것이다.    마이클 크레이머(Michael Kremer) 시카고 대학교 교수(사진=기획재정부)크레이머 교수는 한국개발연구원(KDI)·대외경제정책연구원·산업연구원·조세재정연구원 등과 가진 인터뷰에서 25일 이같이 밝혔다. 이번 인터뷰는 내달 인천 송도에서 개최되는 ‘2023 아시아개발은행(ADB) 연차총회’ 참석에 앞서 진행됐다. 교수는 ADB총회에서 ‘아시아의 재도약을 위한 한국의 역할’에 대해 논의할 예정이다. 지난해 한국의 합계출산율은 0.78명으로 경제협력개발기구(OECD) 회원국 꼴찌 수준이다. 크레이머 교수는 “저출산은 생산연령 인구 1인당 부양해야 할 고령인구 수가 늘어나는 부양비 증가로 이어진다”고 우려했다. 그러면서 “출산율 제고 정책이 실효성 있는 성과를 거두지 못하면서 저출산 문제를 겪는 선진국들은이미 정책을 통해 경제활동인구 확충을 진행하고 있다”고 말했다.  그 예로 홍콩과 싱가포르의 ‘외국인 가사도우미 대상 특별 비자 프로그램’을 들었다. 이들 국가는 저렴한 외국인 가사근로자를 고용해 아이나 노인들의 돌봄업무와 가사업무를 전담시킴으로써 여성의 고용참가율을 높이고 저출산 고령화에 따른 부족한 일손을 해결하고 있다. 싱가포르의 경우 맞벌이 가정은 가사도우미의 고용부담금은 전액 환불해준다. 크레이머 교수는 “경력이 단절된 고숙련 국내 여성의 노동시장 참여를 촉진함으로써 세수 확대, 내국인 저숙련 노동자의 임금 인상 등의 파급 효과를 통해 긍정적 효과를 수반할 수 있다”고 했다.크레이머 교수는 최근 챗-GPT 등 인공지능(AI) 기술 발전이 생산성을 끌어올려 줄 수도 있지 않냐는 질문에는 “엄청난 잠재력을 가진 기술”이면서도 “그 효과가 실현되는 데는 상당한 시간이 걸릴 것”이라고 전망했다. 기업들이 AI를 사업 분야와 경영 환경에 적용하는데 시간이 걸리기 때문이다. 또 AI로 인해 일자리를 잃거나 다른 산업 분야·직종으로 쉽게 전직할 수 없는 사람들에 대한 재취업 및 교육 대책도 마련해야 한다. 다만 그는 “장기적으로 AI발달은 새로운 일자리 창출로 이어질것”이라고 했다.최근 글로벌 경제 위기를 극복하고 기술 혁신을 주도할 수 있는 방안으로 크레이머 교수는 ‘선구매약속’(Advance market commitments)활용을 언급했다. 이는 정부가 새로운 기술이 개발됐을 때 구매를 우선 약속하는 방식이다. 크레이머 교수는 “2009년 폐렴구균에 대한 백신 개발을 위해 amc를 통해 12억달러 규모의 재원을 마련했다”며 “덕분에 단시간에 두 가지 폐렴구균 백신이 개발, 승인돼 약 70만 명의 목숨을 구할 수 있었다”고 했다. ]","['언발에 오줌누기 정책이지 근본적인 해결방안은 아님요.', '들만낳아 잘 기르자!\n   라는 표어를 듣고 자란 세대인데\n세월이 무상하게 출산 저하울을 심각하게 \n고민하는 시대이다.\n걱정없이 낳고 기를수\n있는 환경을 위해 모두 고심해야\n할 것이다', '정말 인구정채은 절실한 마음으로  대책을 세워야 함  세계최대  저출산  국가로 심각한 상황인데.,,.']",https://www.dnews.co.kr/uhtml/view.jsp?idxno=202304251203391780461,https://n.news.naver.com/mnews/article/018/0005471807?sid=101
2023.04.25.,농축유통신문,,"무주군, 무주 농업의 활력 찾을 청사진 그린다",,,http://www.amnews.co.kr/news/articleView.html?idxno=53413,http://www.newsis.com
2023.04.25.,뉴스핌,,"노벨 경제학상 수상자 크레이머 교수 ""한국 저출산 대응에 이민정책 활용해야...",,,http://www.newspim.com/news/view/20230425000785,http://www.newspim.com
2023.04.25.,농축유통신문,,"무주군, 무주 농업의 활력 찾을 청사진 그린다",,,http://www.amnews.co.kr/news/articleView.html?idxno=53413,http://www.amnews.co.kr
2023.04.25.,공감신문,,"권태엽 노인복지중앙회장 ""임금인상 반대 일삼아 온 장기요양위원회부터 개혁...",,,https://www.gokorea.kr/news/articleView.html?idxno=740802,http://gokorea.kr
2023.04.25.,스포츠Q,,"신협, 사회적금융 워크숍 열어",,,http://www.sportsq.co.kr/news/articleView.html?idxno=451722,http://www.sportsq.co.kr
2023.04.25.,라온신문,,신경치료 제때해야 자연치아 보존할 수 있어,,,https://www.raonnews.com/news/article.html?no=11553,https://www.raonnews.com/
2023.04.03.,메디게이트뉴스,,초고령사회 대비 재택의료의 방향성...장기요양보험 재정 통합·일차의료기관...,,,https://www.medigatenews.com/news/1736510710,http://www.medigatenews.com
2023.04.03.,여성경제신문,,불황 없는 직업 '장례지도사'···자격증 취득 절반이 MZ세대,,,https://www.womaneconomy.co.kr/news/articleView.html?idxno=216319,http://www.womaneconomy.co.kr/
2023.04.25.,한국강사신문,,"고려대학교 김진호 교수팀, '노인의 사회적 고립, 치매 발생 위험 높인다' 노...",,,https://www.lecturernews.com/news/articleView.html?idxno=124653,http://www.lecturernews.com
2023.04.25.,메디칼타임즈,,윤곽 나온 한국형 주치의제…4가지 형태로 나누고 역할 부여,,,https://www.medicaltimes.com/Main/News/NewsView.html?ID=1153300&ref=naverpc,http://www.medicaltimes.com
2023.04.12.,매일경제언론사 선정,,"여보, 우리도 못받아요?...기초연금 대상 줄이고 증액 하자는데",,,https://www.mk.co.kr/article/10711133,http://www.mk.co.kr/
2023.04.03.,여성경제신문,,불황 없는 직업 '장례지도사'···자격증 취득 절반이 MZ세대,,,https://www.womaneconomy.co.kr/news/articleView.html?idxno=216319,http://www.womaneconomy.co.kr/
2023.04.25.,한국강사신문,,"고려대학교 김진호 교수팀, '노인의 사회적 고립, 치매 발생 위험 높인다' 노...",,,https://www.lecturernews.com/news/articleView.html?idxno=124653,http://www.lecturernews.com
2023.04.25.,메디칼타임즈,,윤곽 나온 한국형 주치의제…4가지 형태로 나누고 역할 부여,,,https://www.medicaltimes.com/Main/News/NewsView.html?ID=1153300&ref=naverpc,http://www.medicaltimes.com
2023.04.12.,매일경제언론사 선정,,"여보, 우리도 못받아요?...기초연금 대상 줄이고 증액 하자는데",,,https://www.mk.co.kr/article/10711133,http://www.mk.co.kr/
