Date,Press,Category,Title,Content,Comment,URL_Origin,URL_Naver
2017.10.26.,중부매일,,"문 대통령 '지방분권공화국' 강조, 개헌절차 속도내야",,,http://www.jbnews.com/news/articleView.html?idxno=815598,http://www.mt.co.kr/
2017-10-24 11:15:00,파이낸셜뉴스,사회,"""부산, 사회적경제 생태계 구축해 사회문제 해결해야""","[    [머니투데이 김경환 기자] [13개 시립병원 맞춤 컨설팅… ‘의료비 부담 줄이고 건강형평성 높이는’ 혁신 추진]서울시가 전국 최초로 ‘공공보건의료재단’을 설립하고, 보건의료 정책 연구 강화와 시립병원과 보건소를 연계하는 의료체계 혁신을 추진한다. 시는 재단 출범으로 시민의 예방 중심 건강관리서비스와 건강형평성을 높이는 보건의료서비스를 강화할 계획이다.13개 시립병원은 연간 5700억원(보조금 1200억원) 예산으로 인프라를 확충했으나 재정자립도는 평균 66.3%(전체 공공병원 평균 80%) 수준에 그치며, 시민 만족도도 낮다. 시는 공공보건의료재단을 통해 공공의료 핵심 축인 시립병원의 공공성을 강화한다는 계획이다.시는 고령화 사회 진입에 따라 의료서비스를 치료 중심에서 예방적 건강관리체계로 전환하고 전국에서 가장 많은 시립병원(13개), 보건소(25개) 등 보건인프라 운영에 전문성을 확보해 시민 체감도를 높이기 위해 공공보건의료재단을 운영한다고 24일 밝혔다.시는 재단을 통해 ①서울시 공공보건의료 구현을 위한 씽크탱크 ②지역사회 거버넌스 플랫폼 구축 ③공공보건의료 역량 지원 기능에 주력할 방침이다.우선 재단은 정책 싱크탱크로 서울시 보건의료 빅 데이터를 구축, 정책개발에 힘쓴다. 시민 의료이용 데이터, 시립병원·보건소 통계 등을 분석해 계층간, 지역간, 건강격차를 분석하고 방안을 모색할 예정이다. 빅데이터 분석 결과를 바탕으로 공공보건의료계획, 지역보건의료계획 등 중장기 종합계획을 수립하고 실행을 지원한다.둘째, 시는 재단을 보건의료 거버넌스 플랫폼으로 운영해 공공보건의료서비스 직접 제공·기관 간 연계, 지역사회 중심 서비스 분야간 연계·협력을 강화할 예정이다. 병원, 보건소, 복지기관, 사회복귀시설 등을 연계, 시민의 만성질환 등에 대해 예방·검진부터 재활·관리까지 가능한 연속적인 건강관리 시스템을 가동한다.거버넌스 협력을 위해 재단은 병원장·보건소장협의회, 대사증후군관리사업지원단, 통합건강증진사업지원단, 감염병관리본부, 응급의료지원단, 정신건강증진센터 등 서울시 각종 사업단, 시립병원, 보건소 관계자 협의체를 운영할 계획이다.  셋째, 재단은 예방적 건강관리체계와 감염, 재난, 응급 등 민간에서 기피하는 필수 의료서비스도 다뤄 민간의 한계를 극복, 보건의료서비스의 공공성 강화를 지원한다. 서울시는 지난해 9월 ‘서울시 공공보건의료재단 설립 및 운영에 관한 조례’를 제정하고, 올해 6월 보건복지부 설립허가를 받아 7월 24일 서울시 공공보건의료재단을 발족시켰다. 이영문 전 국립공주병원장이 재단의 초대 대표이사를 맡았다.서울시 공공보건의료재단은 이날 상암동 에스플렉스센터 2층 다목적공개홀에서 개관식을 열고 공식 출범한다. 박원순 시장, 권덕철 보건복지부 차관, 서울시 시립병원·보건소, 유관기관 등 관계자 300여 명이 참석한 가운데 재단 현판식, 건강 토크쇼 등으로 진행된다.박 시장은 “메르스 극복과 환자안심병원으로 공공의료를 선도해 온 서울시가 이번 재단 출범으로 100세 시대의 의료체계 추진 기반을 마련했다”며 “앞으로 시는 재단을 시민 건강수명 연장의 출발점으로 공공보건의료 혁신의 허브로 지속적으로 확대하겠다”고 말했다.▶옆사람이 지금 보는 기사들▶무료만화 즐기고~선물타자! ▶치어리더 vs 레이싱걸 김경환 기자 kennyb@&lt;저작권자 ⓒ '돈이 보이는 리얼타임 뉴스' 머니투데이, 무단전재 및 재배포 금지&gt;   ]",[],http://www.fnnews.com/news/201710260930077802,https://n.news.naver.com/mnews/article/008/0003952430?sid=102
A15면 4단,이데일리,,[Build-Up보험]④늙어서 자식 눈치 안본다…집·땅 담보로 매달 연금,,,http://www.edaily.co.kr/news/newspath.asp?newsid=01489126616097184,http://news1.kr/
2017-10-19 10:50:15,뉴시스,사회,"최교일 ""저출산 컨트롤타워 필요""","[     (서울=뉴스1) 유승관 기자 = 박능후 보건복지부 장관(왼쪽)과 마츠야마 마사지 일본 1억총활약담당상이 19일 서울 중구 롯데호텔에서 열린 2017 국제인구컨퍼런스 개회식에서 손가락하트를 그리며 기념촬영을 하고 있다. 이날 컨퍼런스에는 박능후 복지부 장관과 마츠야마 마사지 일본 1억총활약담당상(저출산 대응을 위한 특임장관급), 김상희 저출산·고령사회위원회 부위원장 등 한일 정부 당국자와 국제기구 관계자가 참석해 저출산, 고령화 문제에 대한 대응 방안을 논의한다. 2017.10.19/뉴스1fotogyoo@▶ 뉴스1 [Book] 오픈! 실천 핀테크!▶ 여러분의 제보를 기다립니다.제보하기![© 뉴스1코리아(news1.kr), 무단 전재 및 재배포 금지] ]",[],http://www.newsis.com/view/?id=NISX20171023_0000125275&cID=10810&pID=10800,https://n.news.naver.com/mnews/article/421/0002998744?sid=102
C3면 TOP,동아일보,,[헬스동아]급성 심장마비 환자 생과 사를 가르는 4분,,,http://news.donga.com/3/all/20171024/86919220/1,http://www.jbnews.com
2017.10.24.,아이뉴스24,,"文 대통령과 노동계 첫 만남, 주의제는 사회적 대화 복원",,,http://www.inews24.com/php/news_view.php?g_serial=1055812&g_menu=050210&rrf=nv,http://www.inews24.com/
2017-10-24 22:15:41,동아일보,정치,[헬스동아]급성 심장마비 환자 생과 사를 가르는 4분,"[    &lt;아이뉴스24&gt;[아이뉴스24 채송무기자] 문재인 대통령이 한국노총 등 노동계 대표단을 초청해 노사정위원회 복원 등 노정 관계와 관련해 폭넓은 대화의 시간을 가졌다. 문 대통령은 24일 오후 5시 30분부터 6시 15분까지 한국노총 대표단과 본관 접견실에서 비공개 환담한 것에 이어 오후 6시 30분부터 7시 55분까지 본관 충무실에서 만찬을 가졌다. 첫 만남인 만큼 사회적 대화 복원 등 여러 노동 현안에 대한 논의가 이뤄졌다. 문 대통령은 한국노총의 노사정위원회 복귀를 요청했고, 한국노총은 그동안 제안한 대통령과 양대 노총·대한상공회의소·한국경총·고용노동부·기획재정부·경제사회발전노사정위원회를 대표하는 8인 주체가 모여 대화를 하는 8자회의를 다시 제안했다.     청와대 관계자에 따르면 이날 문 대통령과 노동계는 다소 의견을 접근했으나 8자 회의나 노사정위원회 복귀 등에서 명시적인 합의를 이루지는 못했다. 문 대통령은 한국노총이 제안한 8자회의에 ""할 수만 있다면 여러 틀을 동원해 볼 수 있다""고 원론적 공감을 했다. 문 대통령은 그러나 8자회의가 노사정위원회를 대체해서는 안된다는 뜻을 분명히 했다. 김주형 한국노총위원장은 ""본인이 제안한 8자회의가 마치 '대통령 나와라' 등의 오해로 된 것을 바로잡는다""며 ""노사정위원회를 대체하자거나 이런 것은 아니고 노사정위원회가 출범을 못하고 있으니 이를 위해 여러 대표자 회의도 있을 수 있지 않느냐는 것""이라고 설명했다. 이와 함께 김 위원장은 노사정위원회가 열린다면 대통령이 1차 회의를 주재해달라고 요청했다. 김 위원장은 ""노사정위원회의 문을 여는데 대통령이 힘을 실어주면 문도 잘 열릴 것이고 끝도 잘 마무리하게 해달라""고 말했다.     문 대통령은 ""노사정위원회가 출범해서 잘 진행되면 대통령이 당연히 필요한 때 참석하겠다""고 원론적으로 동의했다. 청와대 관계자는 이날 한국노총의 제안과 관련해 ""첫 노사정위원회 만큼은 대통령이 참석해달라는 제안으로 전체를 대통령이 주재하라는 것은 아니었다""고 설명했다. 노동현안인 노동시간 단축에 대해서도 대화가 오갔다. 김주형 위원장은 ""휴일 근로를 연장 근로에 산입하고 특례 법조항을 줄여 노동시간을 단축해야 하며 이를 위해 국회가 앞장서야 한다""고 했고, 문 대통령은 ""국회의 입법을 통한 노동시간 단축이 가장 바람직하지만 여의치 않을 경우 대법원 판결이나 행정해석을 바로잡는 등 여러 대안이 있다""고 답했다. 이와 함께 문 대통령은 ""노동시간 단축이 일가정 양립과 저출산 고령사회 해결로 이어질 수 있다""고 긍정적인 입장을 표했다. 한편, 문 대통령은 이날 불참한 민주노총에 대해 아쉬움을 표했다. 문 대통령은 ""다음 기회에는 같이 할 수 있는 자리를 가질 수 있기를 기대한다""고 말했다. 이날 만찬에서도 청와대와 노동계의 참석자들이 민주노총이 상황이 될 때 다시 대통령과 민주노총과의 만남을 제안했고 문 대통령은 ""상황이 돼서 민주노총도 함께 하기를 바란다""고 에둘러 말했다. /채송무기자 dedanhi@inews24.com▶프리미엄 뉴스서비스 아이뉴스24▶연예스포츠 조이뉴스24, 생생한 라이브캐스트[ⓒ 아이뉴스24 무단전재 및 재배포 금지] ]",[],http://news.donga.com/3/all/20171024/86919220/1,https://n.news.naver.com/mnews/article/031/0000427615?sid=100
2017.10.26.,MBN,,[경기] '성인학습의 힘'…제6차 세계성인교육회의 중간회의 개최,,,http://mbn.mk.co.kr/pages/news/newsView.php?category=mbn00009&news_seq_no=3370740,http://www.donga.com/
2017-10-25 03:09:26,뉴스1,IT/과학,박능후 장관 '저출산 문제 대응책은?',"[    [동아일보]홈 자동심장충격기 시스템심장마비 시 초기 응급처치 중요국내 심폐소생술 시행 비율 낮아‘씨유 홈 AED 시스템’으로가정에서 실시간 케어 가능해    심장질환이 의심되는 사람이 ‘씨유 홈 AED 시스템’의 심박 측정 기기를 가슴에 부착하고 있으면 잠잘 때나 가정 내에서 일상생활을 할 때 심장박동 수를 본인이나 가족들이실시간 스마트폰으로 확인할 수 있다.씨유메디칼시스템 제공“이봐요! 정신 차리세요!” 버스 안에서 갑자기 한 여자가 쓰러졌다. 동공이 풀려가고 있는 여자를 손으로 흔들었지만 여자의 반응은 점점 느려지고 거칠게 헐떡이던 호흡도 서서히 멎어갔다. “아저씨, 빨리 119에 전화해 주세요!” 앞에서 걱정스러운 듯 보고 있는 남자에게 휴대전화를 맡기고 그는 능숙한 손놀림으로 여자를 바닥에 눕힌다. 고개를 뒤로 젖힌 뒤 입을 열어 입안을 살펴봤다. 원활한 인공호흡을 위해 고개를 뒤로 젖히고 턱은 앞으로 잡아 뺀다. 막힌 기도에 산소가 비집고 들어갈 공간을 만들기 위해서다. 정확히 두 번 호흡을 불어넣고 명치에서 3cm 위 지점에 두 손을 겹쳐 올려 체중을 싣는다. 분당 100회 이상의 속도로 강하고 빠르게 30회 정도 심장압박을 실시했다. 심장압박과 인공호흡을 반복하자 겨우 여자의 정신이 서서히 돌아왔다. 여자가 쓰러지고 불과 3분 남짓한 시간 안에 모두 이뤄진 일이다.     얼마 전 소셜네트워크서비스(SNS)을 통해 알려졌던 버스 안 응급상황이다. 심폐소생술을 시행했던 사람은 간호사였다. 다행히 빠른 응급처치로 여자는 무사했다. 응급환자의 심폐소생술에서 가장 중요한 것은 시간이다. 심장과 폐는 멎은 후라도 4분 이내에 응급처치를 시행하면 대부분 회복된다. 생명 살리는 4분의 골든타임 심장마비가 온 뒤 심폐소생술의 골든타임은 4분이다. 우리 몸 속의 폐와 혈관 내에는 여분의 산소가 있어서 몇 분 정도까지는 새로운 산소의 유입이 없어도 생명을 유지할 수 있다. 숨을 쉬지 않아도 얼마 동안은 심장이 뛸 수 있어 폐 속의 산소를 이용한다. 하지만 4분이 지나고 심장이 멈추면 폐와 혈관 속 여분의 산소는 더 이상 순환을 할 수가 없다. 이때부터 4분 이내에 심장의 기능을 원래대로 돌려놓지 않으면 결국 뇌 손상으로 이어져 목숨을 잃고 만다.  국내 심장마비 환자는 가파르게 증가하고 있다. 심혈관 질환은 중년 이후에 조심해야 할 질환으로 생각하는 사람이 많지만 젊은층에게도 적지 않게 발생한다. 질병관리본부는 2016년 급성 심정지로 병원에 이송된 환자는 2만9832명이라고 발표했다. 이 가운데 일상생활이 가능할 정도로 뇌 기능을 회복한 비율은 4.4%에 불과했다. 미국과 유럽 등 선진국의 회생 비율은 7∼11%다. 2016년 건강보험심사평가원 자료에도 ‘허혈성 심장질환’ 환자는 4년 새 10만 명이나 늘어나 2015년 85만9909명이 병원을 찾은 것으로 나타났다. 2011년에 비해 10만5000명, 약 14%가 증가한 규모다.  119에 전화만 하면 될까 10일 한국 축구에 비보가 전해졌다. 부산 아이파크를 이끌던 조진호 감독이 별세했다는 소식이었다. 조 감독은 출근길에 지인과 통화하던 도중 쓰러졌다. 원인은 급성 심장 마비.  2010년 2월 7일 생을 달리한 프로야구 롯데자이언츠 임수혁 선수의 죽음도 사고 현장에서 응급조치가 제대로 이뤄지지 않은 상태로 병원으로 옮겨진 것이 문제였다. 심장과 호흡은 살려냈으나 뇌에 산소 공급이 끊겨 뇌사 상태에 빠져 의식을 찾지 못하고 10년 가까이 병상에 누워 있다가 세상을 떠났다.  심장정지는 병원에 도착하기 전까지 환자를 목격한 사람이 얼마나 신속하고 적극적으로 응급처치를 하느냐에 따라 환자의 생사가 갈린다. 촌각을 다투는 심장마비 환자에게 119구급차가 올 때까지 기다리는 것은 너무 늦을 수 있다.  지난해 질병관리본부 질병예방센터에 따르면 우리나라 일반인의 심폐소생술 시행률과 심장정지생존율이 각각 미국의 3분의 1 수준에 그치는 것으로 나타났다. 일반인 심폐소생술 시행률은 2010년 3.3%, 2012년 6.5%, 2013년 8.7%, 2014년 12.1%로 매 2년간 약 2배씩 향상됐지만 여전히 스웨덴(55%), 미국(30.8%), 일본(27%)에 비해 크게 낮았다. 심장정지 생존율에서도 미국 시애틀(11.7%), 스웨덴(7.8%), 일본(6.2%)에 비해 크게 낮은 4.8%를 기록했다.     ‘씨유 홈 AED 시스템’으로 실시간 관리 심장정지 환자의 발생비율을 살펴보면 가정 내 발생이 57% 정도다. 일단 가정에서 발생한 심장정지는 배우자 등 가족에 의해 초기 응급처치가 시행되는데 대부분 환자가 고령이고 비슷한 연령대의 배우자인 경우가 많아 심폐소생술 등 정확한 초기 대응이 시행되기 어렵다.  나학록 씨유메디칼시스템 대표는 “우리 사회의 고령화와 1인 가구 증가는 심장마비에서 생명을 구할 수 있는 소중한 기회를 놓쳐버릴 수 있다”고 말한다. 유엔 기준에 따르면 우리나라의 현재 노인 인구 비율이 14%를 넘어서면서 고령사회에 진입했다. 전문가들은 2026년에는 전체 인구 중 65세 이상의 노인 인구 비율이 20% 이상이 되는 초고령사회가 될 것이라고 예측한다.  1인 가구 증가도 가파르다. 통계청에 따르면 지난해 국내 1인 가구는 530만 명을 넘어섰다. 1인 가구의 구성비는 27.8%에 달하며 2010년보다 약 100만 가구가 늘었다. 최근 15년 사이 1인 가구는 무려 2배 이상 증가했다.   나 대표가 개발한 ‘씨유 홈 AED 시스템’은 이러한 사회 변화에 발맞춰 개발됐다. 심장 상태를 확인할 수 있는 심박측정 기기와 AED(자동심장충격기) 시스템을 연계해 사전 징후를 파악하고 즉각적인 대응이 가능하게 했다.  심장질환이 의심되는 사람이 씨유 홈 AED 시스템의 심박측정 기기를 가슴에 부착하고 있으면 잠잘 때나 가정 내에서 일상생활을 할 때 심장박동 수를 본인이나 가족이 실시간 스마트폰으로 확인할 수 있다. 만약 심장박동이 설정해둔 정상 범위를 벗어나면 홈 AED 기기가 자동으로 켜지고 알람 시스템이 작동한다. 앱에 연락처가 등록돼 있는 가족이나 지인에게는 문자메시지와 긴급전화가 간다. 골든타임 4분 내에 응급처치를 할 수 있다. 나 대표는 “심장마비 응급처치는 혼자서 할 수 없는데 가족에게 자신의 상태를 알려 사망에 이르는 것을 막는 것이 씨유 홈 AED 시스템의 목적”이라고 말했다. 씨유메디칼시스템은 효과적인 시스템 운영을 위해 자체적으로 24시간 모니터링 서비스를 준비하고 있다. 씨유 홈 AED 시스템 케어 서비스에 등록한 사람들에게 문제가 발생하면 지인들뿐만 아니라 119구급센터 등에 직접 신고전화를 하는 모니터링 역할을 해준다.홍은심 기자 hongeunsim@donga.com▶ 동아일보 단독 / 동아일보 공식 페이스북▶ 핫한 경제 이슈와 재테크 방법 총집결ⓒ 동아일보 &amp; donga.com, 무단 전재 및 재배포 금지   ]",[''],http://news1.kr/photos/view/?2779723,https://n.news.naver.com/mnews/article/020/0003103305?sid=105
2017.10.19.,연합뉴스,,"文대통령, OECD 사무총장과 포용성장·일자리 등 논의",,,http://app.yonhapnews.co.kr/YNA/Basic/SNS/r.aspx?c=AKR20171019130900001&did=1195m,http://www.mbn.co.kr
2017-10-26 10:31:35,약사공론,사회,"'노인이 노인 부양' 20만가구...""정부의 맞춤형 정책 필요""","[    【 앵커멘트 】  고령사회 진입과 4차 산업 혁명시대를 맞으면서 그 어느 때보다 평생교육의 중요성이 커지고 있습니다.  이런 평생교육의 발전 방향을 모색하는 '유네스코 제6차 세계성인교육회의 중간회의'가 사흘간의 일정으로 개막했습니다.  이재호 기자가 다녀왔습니다.【 기자 】  세계 유네스코 84개국 회원국 대표와 성인학습 전문가 등 500여 명이 한자리에 모였습니다.  세계 평생교육이 나아갈 방향을 논의하는 '유네스코 제6차 세계성인교육회의 중간회의'가 열렸습니다.  1949년에 시작된 세계성인교육회의는 12년에 한 번씩 열리고 있습니다.  지역 풀뿌리 평생학습이 활성화되도록 전 세계 각국의 교육 전문가들이 머리를 맞대는 겁니다.  이번 회의는 성인교육 강화를 위해 지난 2009년 브라질 벨렘에서 채택한 벨렘 선언문이 제대로 시행되는지 등을 점검하기 위해 열렸습니다.▶ 인터뷰 : 바비르 샤이 / 유네스코 평생학습연구소 임시 소장- ""세계성인교육회의가 2030년에는 어떤 비전을 가지고 어떤 식으로 새롭게 목표를 설정해야 할지를 이번 중간 점검을 통해서 알아보도록 하겠습니다.""  참가자들은 세계 각국의 평생교육 상황을 공유하고 성인 평생교육에 대한 아이디어를 나누게 됩니다.  평생교육에 대한 비전을 공유하는 수원과 오산이 함께 이번 행사를 주최하면서 국제도시로서의 위상도 높이고 있습니다.▶ 인터뷰 : 염태영 / 경기 수원시장- ""이런 국제회의를 유치함으로써 글로벌 학습도시로서의 위상을 높이는데 큰 기여를 했다고 생각합니다. 앞으로도 우리시는 지속적으로 평생학습과 성인 교육에 대한 투자와….""▶ 인터뷰 : 곽상욱 / 경기 오산시장- ""평생학습을 시민과 함께하고 시민이 주인 되는 그런 평생학습의 장은 바로 도시의 발전과 정주성과 직결되기 때문에 평생학습의 발전은 꼭 필요한 요소라고 생각합니다.""  내일까지 이어지는 이번 회의에서 다뤄진 주요 안건들은 선언문 형태로 담길 예정입니다.  MBN뉴스 이재호입니다. [ jay8166@mbn.co.kr ]  영상취재 : 김정훈 기자  영상편집 : 이유진&lt; Copyright ⓒ MBN(www.mbn.co.kr) 무단전재 및 재배포 금지 &gt;   ]",[],http://www.kpanews.co.kr/article/show.asp?idx=188457&table=article&category=C,https://n.news.naver.com/mnews/article/057/0001188309?sid=102
2017.10.31.,아주경제,,금융지주 사상 최대 실적…내실도 좋아졌다,,,http://www.ajunews.com/view/20171031103916413,http://news1.kr/
2017-10-19 10:50:11,전북도민일보,사회,도로교통공단 전북지부 어르신 교통사고 제로 캠페인 실시,"[     (서울=뉴스1) 유승관 기자 = 박능후 보건복지부 장관이 19일 서울 중구 롯데호텔에서 열린 2017 국제인구컨퍼런스 개회식에서 축사를 하고 있다. 이날 컨퍼런스에는 박능후 복지부 장관과 마츠야마 마사지 일본 1억총활약담당상(저출산 대응을 위한 특임장관급), 김상희 저출산·고령사회위원회 부위원장 등 한일 정부 당국자와 국제기구 관계자가 참석해 저출산, 고령화 문제에 대한 대응 방안을 논의한다. 2017.10.19/뉴스1fotogyoo@▶ 뉴스1 [Book] 오픈! 실천 핀테크!▶ 여러분의 제보를 기다립니다.제보하기![© 뉴스1코리아(news1.kr), 무단 전재 및 재배포 금지] ]",[],http://www.domin.co.kr/news/articleView.html?idxno=1172023,https://n.news.naver.com/mnews/article/421/0002998740?sid=102
2017.10.27.,정책브리핑,,老? NO! 실버택배 나가신다,,,http://www.korea.kr/policy/societyView.do?newsId=148844095&call_from=naver_news,https://www.yna.co.kr/
2017-10-19 15:30:01,전자신문언론사 선정,정치,출생아 年 40만명대 벽마저 15년만에 '붕괴'됐다,"[     앙헬 구리아 OECD 사무총장 환영사(서울=연합뉴스) 박동주 기자 = 19일 서울 여의도 콘래드호텔에서 열린 '제3차 OECD 포용적 성장을 위한 챔피언 시장 회의'에서 앙헬 구리아 OECD 사무총장이 환영사하고 있다. 2017.10.19    pdj6635@yna.co.kr(서울=연합뉴스) 박경준 기자 = 문재인 대통령이 19일 앙헬 구리아 경제협력개발기구(OECD) 사무총장을 만나 포용적 성장 등과 관련한 의견을 나눈다.    문 대통령은 이날 청와대 본관에서 구리아 사무총장을 만나 포용적 성장 외에도 한국의 일자리 정책과 고령화 사회를 놓고 의견을 교환할 예정이라고 청와대가 전했다.    구리아 사무총장은 이날부터 20일까지 열리는 '제3차 OECD 포용적 성장을 위한 챔피언 시장 회의'와 '2017 기후변화 대응 세계도시 시장포럼' 등에 참석하고자 방한 중이다.    구리아 사무총장은 전날 포용적 성장과 기후변화 대응을 주제로 박원순 서울시장과 공동 기자회견을 열기도 했다.    접견에는 장하성 청와대 정책실장, 남관표 국가안보실 2차장과 OECD 사무총장실 관계자들이 배석한다.    kjpark@yna.co.kr기자가 기다려요. 기사 문의 및 제보는 여기로(클릭!)최신 유행 트렌드 총집결(클릭!) ]",['문재인씨는 뭔가 누구나 다 아는 착각을 하니듯.'],http://www.etnews.com/20171025000336,https://n.news.naver.com/mnews/article/001/0009619088?sid=100
2017.10.27.,정책브리핑,,老? NO! 실버택배 나가신다,,,http://www.korea.kr/policy/societyView.do?newsId=148844095&call_from=naver_news,http://Korea.kr/
