Date,Press,Category,Title,Content,Comment,URL_Origin,URL_Naver
2017.10.31.,뉴시스,,"부산·경남·울산, 고령사회로 진입",,,http://www.newsis.com/view/?id=NISX20171031_0000133971&cID=10811&pID=10800,http://www.newsis.com
2017-10-31 15:48:13,연합뉴스,사회,"노벨상 수상자 '고령사회'를 논하다…""과학기술 기여해야""(종합2보)","[     【부산=뉴시스】제갈수만 기자 = 올해 들어 동남권(부산·경남·울산)은 만65세 이상의 고령인구가 차지하는 비중이 14%를 넘어서며 고령사회로 처음 진입한 것으로 나타났다. 31일 BNK금융경영연구소 '인구구조 변화와 동남권의 과제' 연구보고서에 따르면 올 들어 동남권은 만65세 이상의 고령인구가 차지하는 비중이 14%를 넘어서며 고령사회로 처음 진입한 것으로 조사돼 저출산·인구유출 현상이 심화되면서 생산가능인구가 2026년에는 정점대비 약 10%, 2040년에는 약 30%까지 줄어드는 것으로 조사됐다. 동남권의 경우 전국보다 고령화 속도가 빠르게 진행되고 있어 경제성장의 하방 리스크가 더욱 큰 상황으로 보고 있다. 이에 따라 2012년 이후 1%대의 저성장을 이어가고 있는 경제 성장세가 2019~2025년에는 연평균 0%대로 낮아지는 성장절벽 가능성도 제기하고 있다. 이처럼 고령화는 노동공급 부족 등에 따른 생산 위축현상을 야기할 것으로 예상하고 있다. 특히 2017~2040년 중 은퇴시기에 접어든 장년층(50~64세)은 전국보다 4배 높은 12.4%가 줄어들어 장년층의 고용비중이 높은 사업지원서비스업, 부동산 및 임대업, 운수업, 숙박·음식점업 등을 중심으로 인력부족 충격이 클 것으로 내다봤다. 뿐만 아니라 고령인구의 증가는 소비둔화로 이어지면서 교육, 주택 등 경제사회 전반의 활력을 둔화시키는 요인으로 작용할 가능성이 높은 것으로 보고 있다. 상대적으로 소득과 지출이 줄어드는 60대 이상 인구는 늘어나고 경제활동이 왕성한 40대, 50대 인구는 감소하기 때문으로 분석됐다.  그러나 고령층의 총 소비 규모는 늘어날 것으로 전망했다. 고령층의 적은 지출규모에도 불구하고 고령인구의 절대규모가 증가하면서 전체 소비시장에서 차지하는 비중이 확대될 것으로 예상되기 때문이다. 또한 과거와 달리 적극적인 소비활동을 하는 액티브 시니어가 부상하는 점은 새로운 기회요인이다. 액티브 시니어는 노후준비, 자신을 위한 지출성향 등 이전과는 다른 소비패턴의 특징을 보이기 때문이다.  이에 따라 액티브 시니어 맞춤형 문화, 관광 콘텐츠를 적극 발굴하고 관련 인프라를 체계적으로 구축해 시니어 비즈니스 생태계를 조성하는 것이 필요한 때이라고 강조했다. BNK금융경영연구소 백충기 수석연구위원은 ""고령화가 과거에 비해 더욱 빠르게 진행되는 점을 감안할 때 경제성장세 둔화압력도 한층 높아질 것으로 예상된다""며 ""개별기업들은 기술혁신과 고령인력의 재배치로 경쟁력을 높이고 지자체는 고령친화산업을 기존 산업 인프라와 연계하기 위한 중장기적 계획수립이 필요하다""고 밝혔다. jgsm@newsis.com▶ 뉴시스 빅데이터 MSI 주가시세표 바로가기 ▶ 뉴시스 SNS [페이스북] [트위터]&lt;저작권자ⓒ 공감언론 뉴시스통신사. 무단전재-재배포 금지.&gt; ]",[],http://app.yonhapnews.co.kr/YNA/Basic/SNS/r.aspx?c=AKR20171030051852017&did=1195m,https://n.news.naver.com/mnews/article/003/0008258950?sid=102
15면 TOP,문화일보,,노벨상 5명 訪韓…‘고령사회’ 논하다,,,http://www.munhwa.com/news/view.html?no=2017103001031503009001,https://www.yna.co.kr/
2017-10-30 20:11:57,헤럴드경제,정치,과학기술 통해 노화를 더디게…노벨상 수상자 ‘고령사회’를 논하다,"[    과학기술한림원·스웨덴 노벨미디어 주관…노벨상 수상자 5명 방한 (서울=연합뉴스) 신선미 기자 = ""과학기술을 통해 '노화'를 더디게 하는 방법이 나올 것이다.""(로버트 후버·1988년 노벨화학상 수상)    ""고령화로 인한 재정문제에는 '젊은 이민자 수용'이 해법일 수 있다.""(핀 쉬들란·2004년 노벨경제학상 수상)        한국과학기술한림원과 스웨덴 노벨미디어는 30일 강남구 코엑스에서 노벨상 수상자들에게 '고령화'에 대한 강연을 들을 수 있는 '2017 노벨프라이즈 다이얼로그 서울' 행사를 열었다.     이 행사는 노벨상 시상식 주간에 스웨덴에서 개최되는 문화·학술행사 '노벨위크 다이얼로그'의 해외 특별행사로, 한국에서 열리는 것은 이번이 처음이다.    1988년 노벨화학상 수상자 로버트 후버(왼쪽)와 2004년 노벨경제학상 수상자 핀 쉬들란. [한국과학기술한림원 제공]마티아스 피레니어스 노벨미디어 CEO는 ""고령화는 세계 각국뿐 아니라 한국 사회에서도 중요한 문제가 됐다""라며 ""100세 이상을 살아야 하는 장수 시대에 과학의 역할을 과학계 및 비지니스 리더들의 관점에서 살펴봤으면 한다""고 밝혔다.    이명철 과학기술한림원장은 ""우리나라에서 과학기술은 경제 발전에 많은 역할을 해 왔지만, 이제 유전자 치료 등 삶의 질을 높이는 데 있어 역할이 중요할 것으로 본다""고 말했다.     과학분야 노벨상 수상자들은 고령사회에서 과학기술의 역할에 대해 강연했다.    단백질 연구의 대가인 로버트 후버 교수는 '생명과학 기술'을 이용해 노화를 더디게 할 가능성을 제시했다. 한의학 등에서 수천년 간 써온 천연물 중 질병의 진행을 억제하는 물질을 탐색하는 연구도 중요하다고도 언급했다.    1993년 노벨생리의학상 수상자인 리처드 로버츠 박사는 노화 원인을 규명하는데 장내 세균 등 '미생물 연구'가 특히 중요하다고 강조했으며, 리보솜 연구의 선구자인 아다 요나트(2009년 노벨화학상 수상) 박사 역시 생명과학 연구를 통해 노화 현상을 이해할 필요가 있다고 말했다.    '양자컴퓨터의 아버지'라고 불리는 2012년 노벨물리학상 수상자인 세르주 아로슈 박사는 생명과학뿐 아니라 양자 기술 등이 신약 및 인공 장기 개발 등에 기여할 수도 있다고 밝혔다.    아다 요나트 박사 [한국과학기술한림원]한편 2004년 노벨 경제학상 수상자인 핀 쉬들란 샌타바버라 캘리포니아대(UCSB) 교수는 ""미국의 경우 고령화 사회를 대비하기 위해 세금을 낼 수 있는 젊은 나이의 이민자 수를 늘리는 등의 정책을 고려할 수 있을 것""이라며 ""한국 역시 이 같은 방안을 적용할 수 있으리라 본다""고 조언했다.    노벨상 수상자는 아니지만, 노인학의 창시자로 불리는 톰 커크우드 영국 뉴캐슬대 교수, 프랑스의 인구통계 및 노인학 전문가 장 마리 로빈 등의 석학들도 강연을 통해 인류 기대 수명이 110세가 되는 날이 머지않았다며, 고령화 사회에 대한 대비가 필요하다고 강조했다.    2017 노벨프라이즈 다이얼로그 서울 개막식 [한국과학기술한림원 제공]sun@yna.co.kr기사 문의(기사 제목을 꼭 알려주세요) 및 제보는 여기로(클릭!)최신 유행 트렌드 총집결(클릭!) ]","['노벨상 시즌 되니 어김없이 쏟아지는 노벨상 관련 기사들..\n이번 세기 내로 나올 일 없으니 신경 끕시다~~', '', '이런거 볼 때마다 한국 노벨상 운운하시는 분들 스위스처럼 5조 들여서 대형 입자가속기 세우는거 어떰?', '허공에 떠있는 물체는 질량과 상관없이 힘이 작용하면 운동해야 한다. 지구에 작용하는 만유인력은 똑같이 태양에도 작용하는데 태양은 공전하지 않는다는 것은 모순이므로 기존의 우주 이론을 의심해봐야 한다. 중력과 전자기력을 하나로 융합한 통일장이론으로 우주와 생명을 새롭게 설명하는 책(제목; 과학의 재발견)이 나왔는데 노벨 물리학상 후보에 오른 과학자들(김정욱, 김진의, 임지순, 김필립)도 반론을 못한다. 그 이유가 궁금하면 그들에게 물어보거나 이 책을 보라! 이 책은 과학으로 철학을 증명하고 철학으로 과학을 완성한 통일장이론서다.']",http://news.heraldcorp.com/view.php?ud=20171031000511,https://n.news.naver.com/mnews/article/001/0009646994?sid=100
2017.10.31.,청년의사,,"고령사회 원년, 한국 병원이 나아가야 할 길은?",,,http://www.docdocdoc.co.kr/news/articleView.html?idxno=1048262,http://www.munhwa.com/
2017-10-30 11:46:08,KBS,경제,"日, 지방소비세 교부기준 ‘고령자·청소년 인구’로 변경 추진","[     오늘부터 ‘시상식 주간’ 재연  석학들, 일반 참가자와 토론 ‘젊은과학자들과 대화’행사도‘한국의 노벨상 수상을 앞당기자!’국내 과학계가 역대 노벨상 수상자 5명을 초청, 노벨상 시상식 뒤풀이를 서울에서 재연하며 ‘과학 큰 잔치’를 벌였다.과학 석학들의 모임인 한국과학기술한림원은 30일 서울 강남구 삼성동 코엑스에서 ‘미래 고령사회(The Age to Come)’를 주제로 한국·스웨덴 공동 주최로 ‘노벨시상식 주간’을 서울에서 재연했다. ‘서울 노벨상 대화(Nobel Prize Dialogue Seoul 2017)’로 명명된 이 행사는 ‘노벨시상식 주간 대화(Nobel Week Dialogue)’의 해외 특별행사로, 스웨덴 현지와 동일한 형태와 프로그램으로 진행한다. 이번에 한국을 처음 찾은 노벨상 수상자들은 세르주 아르슈(2012년 노벨 물리학상), 로버트 후버(1988년, 노벨 화학상), 핀 쉬들란(2004년, 노벨경제학상), 리처드 로버츠(1993년, 노벨생리·의학상), 아나 요나트(2009년, 노벨화학상) 등 5명이다. 서울에서 처음 재연되는 노벨시상식 주간은 노벨재단이 노벨상에 관심을 높이고 수상자들을 널리 알리기 위해 2012년부터 매년 10월 노벨상 발표 직후인 12월 초순 스웨덴에서 개최하는 ‘노벨시상식 주간 대화’의 해외 사전행사다. 노벨상 시상식 주간에는 5~7인의 노벨상 수상자를 포함, 30여 명의 세계적 석학이 연사로 참여해 일반 참가자들과 토론하고 글로벌 이슈를 함께 고민하며, 노벨재단 산하 노벨미디어가 운영하는 디지털채널(1일 접속자100만 명)을 통해 전 세계에 생중계한다. 일본의 경우 2015년과 올해 도쿄(東京)에서 ‘도쿄 노벨상 대화’를 개최한 바 있다. 특히 일본은 도쿄 노벨상 대화가 스웨덴을 비롯한 세계과학계에 일본 과학자들을 홍보하는데 큰 효과가 있다고 판단, 매번 왕실가족이 직접 참석하는 등 과학에 큰 관심을 표명하고 있다. 한국과학기술한림원은 이 밖에도 30~11월 1일을 ‘한국과학주간(Korea Science Week 2017)’으로 명명해 2개의 행사를 추가로 진행한다. 이틀간 서울 시청 프라자호텔에서 ‘세계과학한림원서울포럼(IASSF)’을, 1일 같은 장소에서 ‘젊은 과학자들의 대화’ 행사를 열 예정이다. IASSF는 전 세계 과학한림원들의 총회 격이고, 젊은 과학자 대화는 전 세계 과학한림원 소장 학자들의 모임이다.노성열 기자 nosr@munhwa.com[ 문화닷컴 바로가기 | 소설 서유기 | 모바일 웹 ][Copyrightⓒmunhwa.com '대한민국 오후를 여는 유일석간 문화일보' 무단 전재 및 재배포 금지(구독신청:02)3701-5555)]   ]",[],http://news.kbs.co.kr/news/view.do?ncd=3565025&ref=A,https://n.news.naver.com/mnews/article/021/0002331656?sid=101
2017.10.31.,서울파이낸스,,"에릭슨엘지, '고령화 사회를 위한 혁신' 주제 세미나 개최",,,http://www.seoulfn.com/news/articleView.html?idxno=291547,http://www.heraldbiz.com/
2017-10-31 11:24:15,충청투데이,사회,청주시 공직자 저출산·고령화 대응 인구교육 실시,"[ 노벨프라이즈 다이얼로그 서울’“재정문제 젊은 이민자가 해법”“장내 세균등 ‘미생물 연구’ 중요”“과학기술을 통해 ‘노화’를 더디게 하는 방법이나올 것이다.”(로버트 후버·1988년 노벨화학상 수상)“고령화로 인한 재정문제에는 ‘젊은 이민자 수용’이 해법일 수 있다.”(핀 쉬들란·2004년 노벨경제학상 수상) 한국과학기술한림원과 스웨덴 노벨미디어는 30일 강남구 코엑스에서 노벨상 수상자들에게 ‘고령화’에 대한 강연을 들을 수 있는 ‘2017 노벨프라이즈 다이얼로그 서울’ 행사를 열었다.     1988년 노벨화학상 수상자 로버트 후버(왼쪽)와 2004년 노벨경제학상 수상자 핀 쉬들란.이 행사는 노벨상 시상식 주간에 스웨덴에서 개최되는 문화·학술행사 ‘노벨위크 다이얼로그’의 해외 특별행사로, 한국에서 열리는 것은 이번이 처음이다.마티아스 피레니어스 노벨미디어 CEO는 “고령화는 세계 각국뿐 아니라 한국 사회에서도 중요한 문제가 됐다”라며 “100세 이상을 살아야 하는 장수 시대에 과학의 역할을 과학계 및 비지니스 리더들의 관점에서 살펴봤으면 한다”고 밝혔다.이명철 과학기술한림원장은 “우리나라에서 과학기술은 경제 발전에 많은 역할을해 왔지만, 이제 유전자 치료 등 삶의 질을 높이는 데 있어 역할이 중요할 것으로 본다”고 말했다.과학분야 노벨상 수상자들은 고령사회에서 과학기술의 역할에 대해 강연했다.단백질 연구의 대가인 로버트 후버 교수는 ‘생명과학 기술’을 이용해 노화를 더디게 할 가능성을 제시했다. 한의학 등에서 수천년 간 써온 천연물 중 질병의 진행을 억제하는 물질을 탐색하는 연구도 중요하다고도 언급했다.1993년 노벨생리의학상 수상자인 리처드 로버츠 박사는 노화 원인을 규명하는데 장내 세균 등 ‘미생물 연구’가 특히 중요하다고 강조했으며, 리보솜 연구의 선구자인 아다 요나트(2009년 노벨화학상 수상) 박사 역시 생명과학 연구를 통해 노화 현상을 이해할 필요가 있다고 말했다.‘양자컴퓨터의 아버지’라고 불리는 2012년 노벨물리학상 수상자인 세르주 아로슈 박사는 생명과학뿐 아니라 양자 기술 등이 신약 및 인공 장기 개발 등에 기여할 수도 있다고 밝혔다.한편 2004년 노벨 경제학상 수상자인 핀 쉬들란 샌타바버라 캘리포니아대(UCSB)교수는 “미국의 경우 고령화 사회를 대비하기 위해 세금을 낼 수 있는 젊은 나이의 이민자 수를 늘리는 등의 정책을 고려할 수 있을 것”이라며 “한국 역시 이 같은 방안을 적용할 수 있으리라 본다”고 조언했다.노벨상 수상자는 아니지만, 노인학의 창시자로 불리는 톰 커크우드 영국 뉴캐슬대 교수, 프랑스의 인구통계 및 노인학 전문가 장 마리 로빈 등의 석학들도 강연을 통해 인류 기대 수명이 110세가 되는 날이 머지않았다며, 고령화 사회에 대한 대비가 필요하다고 강조했다.최상현 기자/bonsang@heraldcorp.com▶ 생활용품 알뜰하게 사는 법 럭비(LUCK BE)▶앞서가는 젊은 경제신문 친구맺기 ▶오늘의 운세 날씨 - Copyrights ⓒ 헤럴드경제 &amp; heraldbiz.com, 무단 전재 및 재배포 금지 -   ]",[],http://www.cctoday.co.kr/?mod=news&act=articleView&idxno=1095067,https://n.news.naver.com/mnews/article/016/0001309050?sid=102
2017.10.31.,메디파나뉴스,,고령사회 원년 한국이 나아갈 길?‥'통합진료+케어',,,http://medipana.com/news/news_viewer.asp?NewsNum=208879&MainKind=A&NewsKind=5&vCount=12&vKind=1,http://www.docdocdoc.co.kr
A24면 1단,이데일리,,"""고령화시대, 정부 재정위기..정년 높이고 예산 조정해야""",,,http://www.edaily.co.kr/news/newspath.asp?newsid=03545686616098168,http://news.kbs.co.kr/
2017.10.30.,매경이코노미,,[BOOK] 초고령사회 일본에서 길을 찾다 | 일본은 어떻게 고령화에 대처할까,,,http://news.mk.co.kr/v2/economy/view.php?year=2017&no=717309,http://www.mkeconomy.com/
2017-10-30 15:01:42,서울경제,오피니언,"[발언대]고령화 사회, 노인 교통사고 줄이려면","[     김웅철 지음/ 페이퍼로드/ 1만6800원 일본은 우리보다 길게는 30년, 가깝게는 10년 정도 먼저 고령화가 진행됐다. 이 책은 매일경제신문 도쿄 특파원과 국제부장을 지낸 일본통인 저자가 지난 6년간 일본의 고령화 트렌드와 정부, 기업의 대응 방안을 추적한 기록이다. 일본은 전 사회가 함께 고령화에 대처하고 있다. 일부 기특한 초등학생은 등굣길에 몸이 불편한 고령자 집을 방문해 쓰레기를 수거해준다. 시골 빈집에 예술가를 초빙해 마을에 활력을 불어넣는 열혈 촌장, 노인시설의 치매 할머니들을 찾아다니며 예쁘게 화장해주는 화장품 회사도 있다. 고령화 신풍경을 잘 들여다보면 꽤 괜찮은 비즈니스 기회를 잡을 수도 있다. 고독사가 늘자 ‘고독사 보험’이 생기고, 빈집을 전문으로 관리하는 회사가 등장하는 식이다. 저출산·고령화라는 미증유의 사태에 해법을 찾고자 한다면 이 책이 좋은 참고서가 될 듯하다. [노승욱 기자] [본 기사는 매경이코노미 제1931호 (2017.11.01~11.07일자) 기사입니다] ▶뉴스 이상의 무궁무진한 프리미엄 읽을거리 ▶아나운서가 직접 읽어주는 오늘의 주요 뉴스[ⓒ 매일경제 &amp; mk.co.kr, 무단전재 및 재배포 금지]   ]",[],http://www.sedaily.com/NewsView/1OMHQEWQ5C,https://n.news.naver.com/mnews/article/024/0000057659?sid=110
2017.10.28.,서울신문언론사 선정,,[카드뉴스] 당신도 결국 고령운전자가 됩니다,,,http://www.seoul.co.kr/news/newsView.php?id=20171028500009&wlog_tag3=naver,http://www.sedaily.com
2017-10-29 16:42:10,헤드라인제주,오피니언,나이 듦이 불편하지 않는 고령친화도시,"[    차광회 일산동부경찰서 경위    [서울경제] 행정안전부에 의하면 우리나라는 올 8월 말 노인(65세 이상) 인구가 전체의 14%를 차지하게 되면서 고령사회에 진입했다. 오는 2026년에는 전체인구 20% 이상의 초고령 사회가 도래할 전망으로 노인의 교통사고가 사회적 이슈로 크게 부각되고 있다. 최근 5년간(2012∼2016)의 교통사고로 인한 사망자 2만4,159명 중 노인은 9,058명으로 37.5%를 차지한다. 전체 사고 대비 증가 추세로 노인 교통사망사고를 줄이기 위한 대책이 절실한 실정이다. 신체적 열세인 노인은 시력과 청력 등 인지능력 저하로 교통사고 발생빈도가 높은 편이다.노인 교통사고를 예방하기 위해서는 노인보호구역 확대와 보행신호 시간조정, 보도 정비 등 보행환경 개선과 에스컬레이터 확충 등 시설개선도 필요하지만 어렸을 적에 교통안전교육을 받지 못한 노인들에 대한 체계적인 교통안전교육이 요구된다. 현재 노인들의 유소년시절에는 차량이 많이 다니지 않던 신작로에서 아무렇게나 길을 건너도 위험할 것이 거의 없었다. 도로에 위험요소가 많이 없어 교통안전교육이 필요치 않았고 따라서 교통안전교육을 거의 받지 못한 노인들을 상대로 하는 주기적 교통안전교육은 그래서 더욱 필요하다.그러나 노인 교통안전교육을 실시하기 위해 노인들을 경찰관서로 모이도록 하는 것은 신체적 불편과 교통 문제 등 이동성 제한으로 사실상 어렵다. 따라서 노인들을 상대로 하는 교통안전교육은 수요자를 찾아가는 교육이어야 한다.교통 수요자와의 직접적인 의사소통을 통해 수요자가 겪는 교통 불편사항을 직접 듣고 시설개선 등을 통해 단시일 내에 고충을 해결해주는 쌍방향 소통은 노인들을 공동체 치안의 일원으로 자연스럽게 참여시킬 수 있다. 뿐만 아니라 가족 또는 지인들에게 교통사고의 위험성과 안전의식을 확산시키게 된다. 특히 노인대학 교수나 각 동·리별 노인회장 등 대표성을 띤 분들을 상대로 하는 교통안전교육은 이들을 통한 교육의 나비효과로 노인 교통사고의 획기적 감소 효과를 기대할 수 있을 것이다.경기북부 일산동부경찰서의 경우 지난 2016년 교통사망사고 11건 중 노인 교통사망사고가 6건에 달했다. 그러나 올해에는 관내 148개 노인정을 각 2회 이상씩 찾아가 교통안전교육을 실시한 결과 10월 말 현재 교통사망사고 3건 중 노인 교통사망사고 1건으로 노인교통사망사고가 83.3% 줄어 ‘찾아가는 노인 교통안전교육’의 실효성이 입증되고 있다.아울러 일선 현장에서 교통업무를 담당하고 있는 경찰관으로서 노인 교통사고 예방을 위해서는 지역주민과 유관기관·지역경찰의 적극적인 협력과 동참이 필요하다고 생각된다.[서울경제 바로가기]1997년 이래 대한민국 최고의 과학자 DB [바로가기]서울경제의 모든 연재물!... 서경Cube [바로가기▶]저작권자 ⓒ 서울경제, 무단 전재 및 재배포 금지   ]",[],http://www.headlinejeju.co.kr/?mod=news&act=articleView&idxno=318965,https://n.news.naver.com/mnews/article/011/0003140817?sid=110
2017.10.31.,어린이동아,,"‘고령화 사회’ 일본, 로봇으로 부족한 일손 채워",,,http://kids.donga.com/news/vv.php?id=90201710272261,https://www.seoul.co.kr
2017-10-28 13:01:15,더벨,사회,"[더벨]고령화 시대의 상속분쟁, 미리 대비해야","[    [서울신문]    한국은 올해 8월 ‘고령사회’에 접어들었습니다. 고령운전자 관련 교통사고도 가파르게 늘고 있는 추세인데요. 최근에는 고령운전자들의 교통사고가 크게 보도되면서 대책 마련을 요구하는 목소리도 높아졌습니다. ‘고령사회’를 넘어 2026년 ‘초고령사회’로 진입이 예상되는 대한민국이 시급하게 해결해야 할 또 하나의 문제 ‘노인 운전’에 대해 알아봤습니다.기획·제작 김민지 기자 mingk@seoul.co.kr                                                ▶  재미있는 세상[나우뉴스] ▶ [인기 무료만화] [페이스북]ⓒ 서울신문(www.seoul.co.kr), 무단전재 및 재배포금지   ]","['길 위의 양보도 가끔 필요해요 ^^ 화나더라도 고령 운전자 보면 참아지더라구요~', '괜찮아요 자율주행차가 곧 옵니다', '우리는 대중교통이 그냥 무료인데 ㅋㅋ', '인터넷 수입차 차주들은 고령운전자 안됩니다.영원히 뚜벅이라', '다른건 몰라도 너무 위험하게 운전하셔....', '', '', '나이드는건 누구나 마찬가지임\n국가에서 규제와\n서로의 이해도 필요한듯 합니다\n우리도 나중에 노인이 됩니다', '지난달 첫 고령운전갱신했는데...75살 되려면 두번 더 받겠네...그안에 상자속에 들어가겠지...', '', '서로 서로\n배려하고..구체적인 방법이 필요한듯', '누구나 닥친다고 하게 놔둬야 하는건 아니다. 운전은 나자신만이 아닌 타인을 위험으로 몰아갈수도 있기 때문이다.70세 이상은 2 년마다, 75세 이상은 1 년마다 정밀 적성검사 시행해야 한다.', '', '', '그러니 말입니다....', '', '신규면허나 주지마라...', '', '달리는 시한폭탄이죠.', '70대이상이면 알아서 운전대말고 옆좌석을 이용하는게 좋을것같은데', '']",http://www.thebell.co.kr/front/free/contents/news/article_view.asp?key=201710270100033010001971,https://n.news.naver.com/mnews/article/081/0002864395?sid=102
2017.10.30.,헬스경향,,[이나영의 '고령사회 리포트']㉝이번 달부터 가능해진 인간다운 죽음 '존엄사...,,,http://www.k-health.com/news/articleView.html?idxno=32233,http://www.headlinejeju.co.kr
2017.10.23.,연합뉴스,,"통계청, 유엔인구기금과 고령화 사회 대비 국제심포지엄",,,http://app.yonhapnews.co.kr/YNA/Basic/SNS/r.aspx?c=AKR20171023056700002&did=1195m,http://kids.donga.com
2017.10.31.,영남일보,,"[사설] 다가온 고령사회, 노인 문제 해법 빨리 찾아야",,,http://www.yeongnam.com/mnews/newsview.do?mode=newsView&newskey=20171031.010310817370001,http://www.thebell.co.kr
2017.10.28.,세계일보,,"[눈앞에 둔 고령화시대]""노인 일자리 창출, 결국 해답은 시장형 일자리""",,,http://www.segye.com/content/html/2017/10/28/20171028001076.html?OutUrl=naver,http://www.k-health.com/
2017.10.30.,데일리메디,,초스피드 고령사회 진입 한국에 없는 '국립노화연구소',,,http://www.dailymedi.com/detail.php?number=823780&thread=22r03,http://www.dailymedi.com/
2017.10.26.,노컷뉴스,,고령화사회 대응위한 ‘고령친화산업 네트워크’ 발족,,,http://www.nocutnews.co.kr/news/4866809,https://www.nocutnews.co.kr
