Date,Press,Category,Title,Content,Comment,URL_Origin,URL_Naver
2021-07-08 00:09:07,뉴스프리존,사회,"안산시, 다함께돌봄센터 7호점 무료임대 협약식 가져","[ 경제사회노동위원회 여성위원회7일 '코로나19 시대 돌봄노동의 가치와 사회적 대화' 토론회 개최    문성현 경제사회노동위원회 위원장이 7일 서울 중구 프레스센터에서 열린 경제사회노동위원회 여성위원회 토론회 '코로나19 시대 돌봄노동의 가치와 사회적 대화'에 참석해 개회사를 하고 있다. ⓒ뉴시스‧여성신문코로나19 대유행 속 '돌봄 공백'이 심각하다. 학교와 병원이 문을 닫자, 돌봄은 가족의 몫, 정확히는 가족 내 여성의 책임이 되고 있다. 여성 돌봄 노동자의 생계도 위험에 처했다. 여성 노동 전문가들은 이제 '나쁜 일자리'로 평가절하된 돌봄노동의 위상을 높이고, 합리적 보상을 제공해야 한다고 촉구했다.경제사회노동위원회 여성위원회는 7일 서울 중구 프레스센터에서 '코로나19 시대 돌봄노동의 가치와 사회적 대화' 토론회를 열었다.돌봄의 경제적 생산가치는 GDP 대비 약 3% 정도로 추산된다. 그러나 돌봄노동은 대표적인 '고강도·불안정·저임금' 일자리로 꼽힌다. 마경희 한국여성정책연구원 연구위원은 ""돌봄노동은 규범적, 사회적 가치 평가가 중요한데, 그 성과를 객관적으로 측정하기 어렵다는 이유로 전문성을 인정받기 어렵다. 또 애초에 '중고령 여성 일자리'로 도입돼 성별화되면서 '나쁜 일자리'로 평가절하됐다""고 설명했다.국내 어린이집의 79.4%, 지역아동센터 69.9%, 노인장기요양시설 70~80%는 개인 영리법인이 설립한 시설이다(2019년 기준). 민간 부문에 쏠려 있다. 국가가 재원을 투입하고, 민간위탁 기관이 서비스를 제공하는 게 우리나라 돌봄서비스 체계다.돌봄서비스의 공공성을 강화해야 한다고 전문가들은 입을 모았다. 현 체계로는 이용자의 서비스 선택권도, 돌봄 노동자의 노동권도 보장하기 어렵다고 봤다.윤정향 한국노동사회연구소 연구위원은 ""민간 기관은 국가 재정에 의존하면서도 기본적으로 이윤을 추구하므로 질 좋은 서비스 제공보다 비용 절감에 집중하는 경향이 있다""며 ""공공 돌봄서비스 인프라를 늘려야 한다""고 주장했다.또 ""돌봄노동자의 임금, 근로시간, 휴게 시간과 휴게 보장 등 기본 노동 조건의 획기적 개선을 위해서는 과감한 재정 투자가 필수적""이라며 ""정부나 공공기관이 민간위탁을 직접 수행해 비정규직을 정규직으로 전환하고, 민간위탁의 공공성과 책임성을 강화해야 한다""고 말했다.돌봄노동자를 학대와 인권침해로부터 보호하기 위한 장치도 마련해야 한다고 강조했다. 최근 보육시설 내 아동학대가 사회적 문제로 떠오르면서 CCTV 설치, 노동자에 대한 징계·처벌이 강화됐다. 반면 이용자의 돌발적, 과격한 언행으로부터 돌봄노동자를 보호하기 위한 대응 매뉴얼 등은 미비하다는 지적이다.윤 연구위원은 △사업장 내 노동조합 활동 보장 등 합리적 노사관계 구축 △돌봄 사업장에 대한 체계적인 근로감독 방안 마련 △돌봄 노동자의 전문성과 자질 강화 등도 정책 과제로 제시했다.    노인장기요양공공성강화를위한공동대책위원회가 요양보호사의 날을 맞아 1일 서울 종로구 정부서울청사 앞에서 '요양보호사는 필수노동자로서 보호받고 있나' 기자회견을 열었다. ⓒ홍수형 기자돌봄의 본질을 다시 고민해야 한다는 지적도 나왔다. 마 연구위원은 ""우리는 태어나 성인에 이르기까지 타인의 돌봄을 필요로 하는 절대적 의존 시기를 거치고, 나이 들면 다시 새로운 돌봄 욕구를 경험한다""며 ""돌봄을 주고 받는 활동은 인간 사회의 유지·재생산 과정에서 필수적인 것이다. 경제성장만큼 돌봄이 중요한 공적 이슈로 다뤄져야 한다""고 강조했다.이어 김지희 서울시 동부권직장맘지원센터 센터장(경사노위 여성위원회 위원장), 윤자영 충남대 경제학과 교수, 정흥준 서울과학기술대 경영학과 교수, 최영미 한국가사노동자협회 대표가 토론을 펼쳤다. 이번 토론회는 경사노위 여성위원회, 대한민국공무원노동조합총연맹, 한국노동조합총연맹, 서울특별시 동부권직장맘지원센터, 성평등노동사회연구소가 공동 주관했다.  ]","['여초직장이 평가절하되어 있는 건 사실이지 처우개선해달라고 해도 듣질 않고 여기서도 발악하네 ㅋㅋㅋ', '애 보는게 보통 일이 아닌데 그거에 비해 처우가 너무 안 좋은건 사실이지. 맞벌이 부부가 많아지니 그나마 낮은 출산율 좀 높이려면 돌봄 노동 인력이 더 필요하기도 하고', '', '""보육의 가치는 GDP 대비 약 3%이므로 합리적 보상이 필요하다""인데 GDP 대비 약 3%라는 수치에 대한 논거가 부족하네요 다시 써오세요.', '2018년 통계발표에 따르면 산업별 명목 GDP 비중에서 제조업이 26.64% 도소매 숙박업이 9.51% 저작권 산업에서 8.91% 부동산 임대업에서 7.28% 등이고 보건 및 사화복지는 4.27%입니다. 기사의 논지에 따르면 제조업 노동자의 근무처우는 전체 산업 임금의 26.64%만큼 대우를 받아야한다는 말인데요.', '']",http://www.newsfreezone.co.kr/news/articleView.html?idxno=326362,https://n.news.naver.com/mnews/article/310/0000088903?sid=102
2021.07.19.,부산일보,,금정구 다함께돌봄센터 3호 ‘수림아이꿈마당’ 문 열었다,,,http://www.busan.com/view/busan/view.php?code=2021071914122856513,http://www.enewstoday.co.kr/
2021.07.21.,포인트데일리,,"곡성군, 아이키우기 친화도시 약진...아이돌봄 본인부담금 최대 100% 지원",,,http://www.thekpm.com/view.php?ud=2021072120300776848c6567be4c_17,http://www.nbntv.co.kr
2021.07.19.,국제뉴스,,"전주시, 공공 · 민간 복지서비스 '통합시스템' 구축",,,http://www.gukjenews.com/news/articleView.html?idxno=2269732,http://www.gukjenews.com/
2021.07.16.,중부일보,,"'초등 돌봄 사각지대 해소'… 안산시, 다함께돌봄센터 7호점 10월 개소",,,http://www.joongboo.com/news/articleView.html?idxno=363494928,http://www.joongboo.com
2021.07.18.,전북도민일보,,"고산농협, 농번기 주말 아이돌봄방 운영",,,http://www.domin.co.kr/news/articleView.html?idxno=1347615,http://www.domin.co.kr
2021.07.23.,브릿지경제,,"오산시,'대원동! 구해줘 홈즈' 취약계층 이사지원 서비스",,,http://www.viva100.com/main/view.php?key=20210723010005791,http://www.viva100.com
2021.07.27.,정보통신신문,,"아이앤나, 산후도우미 예약서비스에 아이보리 홈캠 무상지원",,,http://www.koit.co.kr/news/articleView.html?idxno=87174,http://www.koit.co.kr/
2021.07.27.,울산매일신문,,"양산시, '위기환경가정 가사지원서비스' 사업 큰 '호응'",,,http://www.iusm.co.kr/news/articleView.html?idxno=918356,http://www.iusm.co.kr
2021.07.23.,빅데이터뉴스,,"인천동구청소년수련관 청소년방과후아카데미 해찬나래, 긴급돌봄지원 실시",,,http://www.thebigdata.co.kr/view.php?ud=202107231810101899f98d71351e_23,http://www.thebigdata.co.kr/
2021.07.20.,충북일보,,"음성군, 지역사회서비스 투자사업 본격 추진",,,https://www.inews365.com/news/article.html?no=675117,http://www.inews365.com
2021.07.19.,헤드라인제주,,"공무원연금공단, 사옥에 서귀포 첫 '다함께 돌봄 센터' 개원",,,http://www.headlinejeju.co.kr/news/articleView.html?idxno=456909,http://www.headlinejeju.co.kr
2021.07.13.,뉴스1,,"‘보육부터 요양까지’ 전북 사회서비스원, 전주에 둥지 튼다",,,https://www.news1.kr/articles/?4370392,http://news1.kr/
2021.07.13.,뉴스1,,"‘보육부터 요양까지’ 전북 사회서비스원, 전주에 둥지 튼다",,,https://www.news1.kr/articles/?4370392,http://news1.kr/
2021-07-13 16:32:33,천지일보,사회,"경남도 '인공지능 돌봄사업' 최종 선정, 30억원 확보","[     전주시청 전경/뉴스1 DB(전주=뉴스1) 임충식 기자 = 보육부터 요양까지 돌봄 통합서비스를 제공하는 ‘전라북도사회서비스원’이 전주에 둥지를 튼다.13일 시에 따르면 (재)전라북도 사회서비스원 입지결정위원회는 최근 심사를 통해 ‘전라북도사회서비스원’ 유치지로 전주시를 최종 확정했다.‘사회서비스원’은 정부가 요양보호사와 장애인활동보조인 등 사회서비스 근로자들을 직접 고용하기 위해 설립하는 공익 법인이다. 사회서비스 공공성 강화 및 품질 향상, 근로자들의 처우개선이 주 목적이다. 지난 2019년 서울, 경기 지역을 시작으로 전국 11개 광역지자체에 설치돼 운영되고 있다.전주시는 이번 심사에서 유치를 원한 전북지역 다른 시·군에 비해 접근성과 편의성, 인적자원, 지자체 추진의지 등에서 높은 점수를 받은 것으로 알려졌다.전라북도사회서비스원이 들어서게 될 장소는 우아동 덕진보건소 인근 건물이다. 전북도는 임대차 계약 및 리모델링을 한 뒤 올 연말까지 사회서비스원을 설립할 계획이다.전북도는 사회서비스원을 통해 질 높은 서비스를 하고 종사자를 직접 고용해 일자리 안정성도 보장할 예정이다. 또 가사간병, 방문요양, 장애인 활동지원 등 돌봄서비스를 제공하는 종합재가센터도 가동할 계획이다. 재무·회계·법무·노무 등 상담 및 컨설팅도 지원한다.김승수 전주시장은 “국공립시설 위탁 추진 등 전라북도사회서비스원의 원활한 운영을 위한 사전 준비에 최선을 다할 것”이라고 말했다.   ]",[],http://www.newscj.com/news/articleView.html?idxno=881452,https://n.news.naver.com/mnews/article/421/0005475534?sid=102
2021.07.15.,뉴스토마토,,"금융위, 보험사 요양서비스사업 진출 지원",,,http://www.newstomato.com/ReadNews.aspx?no=1059772&inflow=N,http://www.newscj.com
2021.07.26.,브레이크뉴스,,"동두천시 무한돌봄센터, 동두천경찰서와 복지사각지대 연중 발굴 계획",,,http://www.breaknews.com/823041,http://news.etomato.com/
2021.07.22.,더퍼블릭,,"강선우 의원, 학대피해아동을 위한 다양한 돌봄서비스 제공 의무화 법안 발의",,,http://thepublic.kr/news/newsview.php?ncode=1065572250209006,http://www.breaknews.com
2021.07.23.,부산일보,,"용호1동 마을계획단, 주민주도형 '통합돌봄 복지메뉴판 발굴'을 위한 주민욕구...",,,http://www.busan.com/view/busan/view.php?code=2021072316280001466,http://www.thepublic.kr/
2021.07.23.,뉴시스,,"롯데건설, 임직원 심리상담 서비스 '마음이 프로그램' 운영",,,http://www.newsis.com/view/?id=NISX20210722_0001522086&cID=10401&pID=10400,http://www.busan.com/
2021-07-23 16:32:06,뷰어스,사회,"전남 고흥군, 폭염 속 건강 취약계층 돌봄...43개팀 구성","[     부산 남구 용호1동행정복지센터(동장 오창송)에서 주민이 자발적으로 구성한 마을계획단 회의가 열렸다.앞서 6월24일부터 7월20일까지 관내 노인(기초수급자, 차상위)을 대상으로 통장이 각 가정을 방문하여 어르신의 건강상태와 생활여건에 관한 조사를 실시하였고, 이 날 돌봄이 필요한 노인세대에게 지원할「통합돌봄 복지메뉴판 발굴」을 위한 조사·분석 작업에 돌입하였다. 추가로 경로당 어르신들을 대상으로「속풀이 토크」를 통해 파악된 돌봄 서비스 욕구도 반영하였다.용호1동 마을계획단은 몸이 불편한 어르신들이 지역에서 생활하는데 적합한 서비스를 발굴하기 위해서 노력 중이며, 주민총회를 통한 몇 차례 과정을 더 거친 후에 양질의 복지메뉴판을 출시할 계획이다. ]",[],http://theviewers.co.kr/View.aspx?No=1982761,https://n.news.naver.com/mnews/article/082/0001108992?sid=102
2021.07.23.,대한경제,,"인천시, 전국 최초 ‘치매환자 인간존중 돌봄기법’ 도입",,,https://www.dnews.co.kr/uhtml/view.jsp?idxno=202107230911170900449,http://www.newsis.com
2021-07-23 00:22:00,메디파나뉴스,경제,"""약국 약료서비스·건강 증진 참여 바탕 기술 활용 추진돼야""","[ 임직원 배우자·자녀 신청 가능    [서울=뉴시스] 롯데건설 임직원 심리상담 프로그램 이미지.[서울=뉴시스] 박성환 기자 = 롯데건설이 임직원의 마음 충전 시간 및 전문 심리상담 서비스를 받을 수 있는 '마음이 프로그램'을 운영한다고 23일 밝혔다.이번 프로그램은 롯데건설 임직원 본인을 비롯해 배우자와 자녀까지 대상자의 폭을 넓혀 운영한다. 상담 희망자가 원하는 날짜에 마음이 프로그램을 통해 예약하면 대면 및 비대면 상담 중 선택해 심리상담을 받을 수 있다.마음이 프로그램은 심리상담 전문 서비스 기업 '허그유'의 근로자 지원 프로그램을 통해 진행된다. 허그유는 임직원이 느낄 수 있는 다양한 고민에 대해 전문가의 상담과 코칭 등으로 문제 해결을 지원할 예정이다.상담 분야는 ▲코로나 블루 ▲직무 스트레스 ▲조직 내 갈등 ▲건강관리 ▲정서·성격 ▲자녀 양육 ▲재무관리 ▲법률 관계 등 다양하다.롯데건설 관계자는 ""코로나 블루로 지친 임직원의 마음 돌봄을 위해 사내 복지의 일환으로 기획하게 됐다""며 ""임직원의 심리적 안정과 정신 건강에 도움이 돼 지속되는 코로나로 인한 위기를 극복하길 바라며, 서로 소통하며 웃을 수 있는 근무환경을 조성하기 위해 최선을 다할 것""이라고 말했다. ]",[],http://medipana.com/news/news_viewer.asp?NewsNum=281926&MainKind=A&NewsKind=5&vCount=12&vKind=1,https://n.news.naver.com/mnews/article/003/0010623573?sid=101
2021.07.14.,KBS,,"전주시, 전북도 산하 돌봄 제공 ‘사회서비스원’ 유치",,,https://news.kbs.co.kr/news/view.do?ncd=5232652&ref=A,http://news.kbs.co.kr/
2021-07-14 07:37:34,파이낸셜뉴스,사회,"CJ프레시웨이, 케어푸드 구독 서비스 '헬씨누리 건강식단' 선봬","[               [KBS 전주]전주시가 가사와 간병, 방문 요양과 노무 컨설팅 등 전 생애 맞춤형 통합 돌봄서비스를 제공할 전라북도 사회서비스원을 유치했습니다.전주시 우아동 덕진보건소 인근 건물 2개 층을 임대한 뒤 올 연말까지 새로 고쳐 개원할 계획인 사회서비스원은 전라북도가 7억 원을 기본재산으로 출연해 직접 운영합니다.사회서비스원은 국공립 어린이집이나 공립 요양시설 등 돌봄 서비스 제공 기관을 위탁받아 직접 운영하는 역할을 맡습니다.   ]",[],http://www.fnnews.com/news/202107200832302578,https://n.news.naver.com/mnews/article/056/0011082423?sid=102
2021.07.16.,지디넷코리아,,"자란다, ‘긴급 돌봄 패키지’ 출시...""돌봄 지원금 제공”",,,https://zdnet.co.kr/view/?no=20210716092604,http://www.fnnews.com/
2021-07-20 08:34:03,새전북신문,경제,"고산농협, 농번기 주말 아이돌봄방 운영","[     헬씨누리 건강식단 메뉴 [파이낸셜뉴스] CJ프레시웨이는 재가어르신을 대상으로 케어푸드 구독 서비스 '헬씨누리 건강식단'을 선보인다고 20일 밝혔다. 케어푸드는 상대적으로 저작력이 약한 어르신, 환자 등을 위해 쉽게 씹고 삼킬 수 있도록 가공된 상품을 말한다.   CJ프레시웨이의 케어푸드 브랜드 헬씨누리는 노인식, 치료식 등 운영 노하우를 기반으로 어르신들에게 필수적인 영양소를 갖춘 건강식단을 제공한다는 계획이다.   헬씨누리 건강식단은 시니어 케어 전문기업 비지팅엔젤스의 '엔젤스밀'을 통해 판매된다. 엔젤스밀은 5일치 식단으로 구성돼 있으며, 비지팅엔젤스의 돌봄을 받고 있는 재가 어르신 가정에 주 1회 배송된다. 엔젤스밀을 시작으로 CJ프레시웨이는 헬씨누리 건강식단의 유통망을 점차 확대해나갈 계획이다.   헬씨누리 건강식단은 표준 레시피에 따라 경기도 이천에 위치한 센트럴키친(중앙 집중식 조리시설)을 통해 반조리 또는 완조리 상품으로 생산된다. 식자재 전처리부터 조리, 검수, 포장까지 센트럴키친의 일원화된 시스템으로 위생안전과 품질 수준을 높였다.   CJ프레시웨이 강연중 전략사업본부장은 ""연화식, 저염식 등 고령친화식품 개발을 통해 헬씨누리 건강식단의 시니어 맞춤형 케어푸드품목을 확대할 계획""이라며 ""헬씨누리 전문점을 통한 요양시설 맞춤형 서비스 '급식토탈솔루션'을 제공하는 등 실버 시장에 최적화된 푸드서비스 사업을 강화해나갈 것""이라고 말했다.   ]",[],http://sjbnews.com/news/news.php?number=718830,https://n.news.naver.com/mnews/article/014/0004677598?sid=101
2021.07.16.,위클리오늘,,성남시 다함께돌봄센터 13곳에 '아침 틈새 돌봄' 도입,,,http://www.weeklytoday.com/news/articleView.html?idxno=386432,https://zdnet.co.kr/
2021-07-16 09:27:05,프레시안,IT/과학,"광주 서구, 통합돌봄 ‘정신대상자 사회기술지원’ 프로그램 호응","[ 초등 원격수업·어린이집 휴원 4~13세 아동 둔 가정 대상유아동 교육·돌봄 매칭 플랫폼 자란다(대표 장서정)는 코로나19 확산으로 4~13세 아동 돌봄에 어려움을 겪는 가정을 위한 '긴급 돌봄 패키지'를 출시하고, 이달 31일까지 돌봄 지원금을 함께 제공한다.먼저 긴급 돌봄 패키지에는 ▲아이 혼자 원격수업에 참여하는 가정을 위한 '온라인 수업 보조 프로그램' ▲장시간 돌봄이 필요한 가정을 위한 '긴시간 돌봄배움' ▲예측하지 못한 돌봄이 필요한 가정을 위한 '당일 긴급돌봄' 등 총 세 가지 프로그램이 포함됐다. 각 가정에서 발생하는 돌봄 상황에 맞춰, 필요한 돌봄 프로그램을 신청할 수 있다.돌봄 서비스 이용 시 가정에 도움이 될 상황별 지원금도 함께 준비됐다.    긴급 돌봄 패키지 이미지돌봄 서비스 첫 이용의 부담을 낮추기 위해, 자란다 앱을 첫 방문한 모든 가정에는 2만원의 돌봄 지원 포인트가 자동 제공된다.또 긴급한 돌봄 사유 발생으로 4~24시간 이내 즉시 방문이 필요한 가정을 위한 긴급돌봄이 추가비용 없이 운영될 예정이다. 긴급돌봄 시 선생님에게 지급되는 추가비용을 지원 기간 동안에는 자란다가 부담해, 일반 돌봄과 같은 비용으로 최우선 순위 매칭이 보장되는 긴급돌봄을 이용할 수 있다.특히 어린이집, 유치원에 가지 못해 집에 머무는 아이를 위한 종일 돌봄 또는 매일 돌봄이 필요한 경우에 금전적인 부담을 덜 수 있도록, 자란머니 충전 시 최대 10만원의 추가 포인트를 지급한다.장서정 자란다 대표는 ""갑작스런 원격수업 전환 및 휴원 조치로 고민이 많을 가정에 미약하나마 도움이 되고자 지원을 결정했다""며 ""걱정없이 돌봄 문제를 해결하실 수 있도록 자란다 선생님들의 방역지침 준수 및 방문 전 자가진단 여부 상시 모니터링에 만전을 기하겠다""고 말했다. ]",[],https://www.pressian.com/pages/articles/2021071912135362932?utm_source=naver&utm_medium=search,https://n.news.naver.com/mnews/article/092/0002227922?sid=105
2021.07.23.,경인매일,,"""대원동! 구해줘~ 홈즈"" 취약계층 이사지원 서비스",,,http://www.kmaeil.com/news/articleView.html?idxno=294410,http://www.sjbnews.com/
2021.07.28.,브레이크뉴스,,"고흥군, 연이은 폭염 속, 건강취약계층 적극 돌봄 나서",,,http://www.breaknews.com/823465,http://www.weeklytoday.com
2021.07.15.,조세일보,,금융당국 “보험사 요양서비스 사업 진출 지원”…제도개선 추진,,,http://www.joseilbo.com/news/news_read.php?uid=428357&class=18&grp=,http://www.pressian.com/
2021-07-19 13:40:01,충청매일,사회,"음성군, 지역사회서비스 투자사업 본격 추진","[    광주광역시 서구(구청장 서대석)가 ‘평소 살던 곳에서 편안한 삶’을 슬로건으로 노인, 장애인, 정신질환 대상자가 가족, 이웃과 함께 평범한 일상의 행복을 누릴 수 있는 융합형 지역사회 통합돌봄 사업을 시행하고 있다. 특히 정신질환자의 경우 급성 증상 치료 후 퇴원해 지역사회에서 함께 거주하기를 원하지만 사회기술이나 일상생활 기능이 저하되어 사회에 적응하지 못하는 경우가 많다.     ▲광주시 서구에 거주하는 정신대상자가 통합돌봄 ‘사회기술지원’ 프로그램에 참여하는 모습ⓒ광주시 서구 이에 서구에서는 통합돌봄 사업의 일환으로 정신질환으로 인해 일상생활 및 사회생활에 어려움을 겪고 있는 대상자들을 위해 ‘일상으로 한걸음, 정신대상자 사회기술지원’ 프로그램을 운영하고 있어 큰 관심과 호응을 얻고 있다. 이 프로그램은 정신대상자가 지역사회의 구성원으로 잘 생활할 수 있도록 개인별 욕구와 특성에 맞는 사회기술 훈련을 통해 스스로 약물과 증상 관리를 실천해 질병 재발을 방지하고 만성화되는 것을 저감하기 위해 추진되었다. 주요 내용으로는 ▲질병관리 훈련(신체건강관리, 약물복용관리, 심리지원, 외래진료, 영양관리) ▲일상생활기술 훈련(식사/빨래훈련, 금전관리, 주변시설 이용) ▲위생관리 훈련(개인위생, 청소훈련) ▲여가활용 훈련 등이며 정신사례관리사와 자원봉사자가 1:1로 매칭되어 가정방문을 통해 진행된다. 이 서비스를 지원받은 김순정(가명) 씨는 “소통할 사람이 없어 외로움과 우울감이 너무 심해 도움의 손길이 너무 절실했는데 사회기술지원에 참여하면서 앞으로 직업도 갖고 정상적인 생활이 가능하다는 희망이 생겼다”며 밝게 웃었다. 서대석 서구청장은 “일상생활에 어려움을 겪고 있는 정신대상자들을 적극 발굴해 통합돌봄서비스 지원을 통해 삶의 질이 향상될 수 있도록 최선을 다하겠다”고 말했다.  ]",[],http://www.ccdn.co.kr/news/articleView.html?idxno=714457,https://n.news.naver.com/mnews/article/002/0002200463?sid=102
2021.07.20.,충청매일,,"음성군, 지역사회서비스 투자사업 본격 추진",,,http://www.ccdn.co.kr/news/articleView.html?idxno=714457,http://www.ccdn.co.kr
2021.07.16.,열린뉴스통신,,"돌봄 복지 선도하는 관악구 ,'돌봄지원팀' 신설!",,,http://www.onews.tv/news/articleView.html?idxno=81578,http://www.onews.tv
2021.07.12.,경향신문언론사 선정,,"원격수업 시작됐는데…학부모 ‘돌봄 공백 발동동’, 교육현장 ‘학력격차 더...",,,https://www.khan.co.kr/national/education/article/202107121600001,http://www.khan.co.kr/
