Date,Press,Category,Title,Content,Comment,URL_Origin,URL_Naver
2021-07-26 18:58:04,농촌여성신문,사회,저소득층 아이돌봄서비스 정부지원 5%p 상향,"[ 주금공, 청소·방역 등 제공  부산시가 사회적 취약계층의 주거환경을 개선하기 위해 종합 청소 서비스 'HF 클린하우스' 사업을 진행한다.   HF 클린하우스는 노인, 장애인 등 사회적 취약계층에게 청소 및 세탁, 방역, 소독을 원스톱으로 제공하는 사업이다. 한국주택금융공사(HF)가 사회공헌 사업의 일환으로 부산지역자활센터협회가 주관한다.   26일 부산시에 따르면 이번 사업에는 관내 12개 지역자활센터에서 22개 자활사업단과 자활기업이 수행기관으로 참여한다. 시는 16개 구군별 노인복지관과 장애인복지관에서 추천받아 대상 가구로 240가구를 선정했으며 오는 9월까지 지속해서 서비스를 제공할 계획이다.   지난해에도 시는 한국주택금융공사, 부산지역자활센터협회와 함께 취약계층 165가구에 청소 서비스를 제공해 호평을 받은 바 있다. 대상자들의 만족도가 높은 만큼 올해는 대상자와 참여 인력 등을 대폭 확대해 사업을 추진하기로 했다.   시는 이번 사업이 취약계층의 주거환경을 개선할 뿐만 아니라 코로나19로 집에 머무는 시간이 많은 노인과 장애인 세대의 건강도 돌보는 계기가 될 것으로 내다보고 있다. 아울러 코로나19 장기화로 어려움을 겪었던 자활사업단과 자활기업에는 보람 있는 일자리를 제공할 수 있게 될 전망이다.   박형준 부산시장은 ""더 많은 주거 취약계층이 쾌적한 환경에서 거주할 수 있도록 앞으로도 지속해서 사업을 추진해 나가겠다""면서 ""코로나19로 돌봄이 더욱 절실한 취약계층에게 두루 도움이 될 수 있는 유익한 복지 서비스를 계속 발굴하고 추진하는 데 힘쓰겠다""고 전했다.   ]",[],http://www.rwn.co.kr/news/articleView.html?idxno=61259,https://n.news.naver.com/mnews/article/014/0004681610?sid=102
2021.07.29.,이뉴스투데이,,"인천 서구, 어르신 전담 치매안심돌봄터 인지재활 공백 없다",,,http://www.enewstoday.co.kr/news/articleView.html?idxno=1500269,http://www.breaknews.com
A16면 1단,동아일보,,폭염 속 ‘찾아가는 재활서비스’,,,https://www.donga.com/news/article/all/20210726/108174971/1,http://www.rwn.co.kr
2021.07.16.,헤럴드경제,,"관악구, ‘돌봄지원팀’ 신설",,,http://news.heraldcorp.com/view.php?ud=20210716000094,http://www.heraldbiz.com/
2021-07-16 08:00:03,뉴스웨이,사회,"고흥군, 연이은 폭염 속 건강취약계층 적극 돌봄 실시","[ 코로나19 장기화로 늘어난 복지 수요 대응‘돌봄SOS센터’사업 확대로 맞춤형 서비스 제공    [헤럴드경제=김유진 기자] 서울 관악구(구청장 박준희)가 복지정책과 내 돌봄지원팀을 신설하는 조직개편을 단행했다고 16일 밝혔다.구는 지난 1일 코로나19 장기화로 인한 돌봄 수요 증가와 다양한 복지 욕구에 대응하기 위해 기존 희망복지팀에 속해있던 돌봄 업무를 팀 단위 업무로 확대개편했다. 이번 개편을 통해 돌봄사각지대 해소 역할을 톡톡히 해내고 있는 ‘돌봄SOS센터’ 사업을 확대하고, 다양한 맞춤형 서비스 제공을 통한 지역사회 통합 돌봄 기반 마련에 힘을 싣기 위해서다.코로나19 상황에 발맞춰 조기 출범한 관악구 ‘돌봄SOS센터’는 ▷일시재가 ▷식사 제공 ▷동행지원 ▷주거 편의 ▷건강지원 ▷안부확인 ▷단기시설 이용 ▷정보상담 등 맞춤형 서비스를 지원, 6월까지 돌봄이 필요한 주민에게 총 5700여건의 서비스를 제공했다.특히, 코로나19 백신예방접종 비상상황에 발맞춰 동행지원 서비스를 적극 제공하고, 코로나블루에 빠진 구민들의 우울감 해소와 체력증진을 위해 건강체조를 보급하는 등 관악구만의 특색 있는 건강돌봄서비스도 제공 중이다.돌봄지원팀은 앞으로도 의료기관 협력 퇴원환자 돌봄연계, 우수 서비스 제공기관 발굴, 돌봄매니저 현장모니터링 등 ‘돌봄SOS사업’ 운영 내실화를 통해 지역사회 통합 돌봄 기반 마련과 돌봄 창구 역할을 수행하며 사업 추진에 박차를 가할 계획이다.돌봄이 필요한 어르신, 장애인, 중장년(50세 이상) 주민은 동 주민센터 ‘돌봄SOS센터‘를 통해 서비스를 신청할 수 있으며, 서비스 비용은 소득수준이 중위소득 85% 이하(한시적으로 12월 31일까지 100%이하)면 전액 무료로 지원된다. ]",[],http://www.newsway.co.kr/news/view?tp=1&ud=2021072716574945524,https://n.news.naver.com/mnews/article/016/0001862245?sid=102
2021.07.27.,디트뉴스24,,"대전시사회서비스원, 사회복지시설 대체인력 역량 강화 교육",,,http://www.dtnews24.com/news/articleView.html?idxno=709276,http://www.newsway.kr
2021.07.25.,금강일보,,대전사회서비스원 지역사회통합돌봄 교육과정 운영,,,http://www.ggilbo.com/news/articleView.html?idxno=860214,http://www.dtnews24.com/
2021.07.27.,이뉴스투데이,,"아이앤나, 산후도우미 예약서비스에 아이보리 홈캠 무상지원",,,http://www.enewstoday.co.kr/news/articleView.html?idxno=1499362,http://www.ggilbo.com
2021.07.21.,뉴스티앤티,,"서산시, 초등자녀 방과 후 돌봄 서비스 호응",,,http://www.newstnt.com/news/articleView.html?idxno=90596,http://www.enewstoday.co.kr/
2021.07.29.,기호일보,,"동두천시 무한돌봄센터, 카카오톡 채널서 복지상담 받으세요",,,http://www.kihoilbo.co.kr/news/articleView.html?idxno=939492,http://www.newstnt.com
2021.07.22.,블로터언론사 선정,,"'디지털 뉴딜' 1주년, 데이터·서비스·경제…세 마리 토끼 잡았다",,,http://www.bloter.net/newsView/blt202107210032,http://www.kihoilbo.co.kr/
2021.07.26.,충청타임즈,,청양군 아이돌봄서비스 부모 부담 완화,,,http://www.cctimes.kr/news/articleView.html?idxno=666811,http://www.bloter.net/
2021-07-22 14:22:36,충청매일,IT/과학,"보령시, 치매어르신 대상 맞춤형 사례관리 서비스","[    정부가 지난해 야심차게 시작한 '디지털 뉴딜' 사업이 1주년을 맞아 준수한 성적표를 받아 들었다. 핵심 사업인 데이터 댐 구축과 일자리 창출, 대국민 서비스 개선 등에서 가시적인 성과를 얻었다는 평가다. 과학기술정보통신부(이하 과기정통부)는 이에 그치지 않고 디지털 인프라의 활용·확산 및 인재와 신산업 육성에 중점을 둔 '디지털 뉴딜 2.0'에 2025년까지 49조원을 투자한다는 방침이다.  과기정통부는 지난 21일 온라인 브리핑을 통해 디지털 뉴딜 1주년 주요 성과를 공유했다. 먼저 재정 투자 측면에서 지난해 국내 디지털 뉴딜 사업에는 총 10조1000억원의 예산이 데이터 댐 등 인프라 구축에 투입됐다.     디지털 뉴딜 1.0 성과를 발표하는 강도현 과학기술정보통신부 정보통신정책관 (사진=과기정통부)데이터 댐, 관련 기업 양성 및 일자리 창출에 효과 '톡톡'데이터 댐은 디지털 뉴딜 1.0의 핵심 사업 중 하나다. 인공지능(AI) 기반 4차산업혁명 시대를 맞아 사회 각 분야와 국민들이 AI를 더 잘 활용할 수 있도록 다량의 학습 데이터를 정부 차원에서 구축하는 프로젝트다. 기존 소프트웨어(SW)·시스템통합(SI) 기업들이 데이터 댐 사업에 적극 참여하면서 데이터 공급 기업은 2019년 대비 3배(393개→1126개) 가까이 늘었으며 같은 기간 AI 공급 기업도 4.5배(220개→991개)로 증가했다. 데이터 댐 사업을 통해 만들어진 데이터셋은 금융·교통·문화·의료 등 4300여종에 이르며 10억건 이상의 분야별 데이터가 개방되기 시작하면서 국내 데이터 시장 규모는 전년 대비 14.3% 성장했다. 이 과정에서 적잖은 일자리 창출 효과도 발생했다. 디지털 뉴딜 주요 사업들을 통해 총 9만여명의 일자리가 생겨났으며 데이터 댐에만 5만명이 참여했다. 공공데이터 청년 인턴(1만5000명)까지 더하면 과반 이상이 데이터 관련 사업 일자리였던 셈이다.국민 체감 서비스 대거 증가하고 디지털 격차 줄어디지털 산업 육성과 사회 전반의 디지털화를 목표로 한 디지털 뉴딜 사업은 ""국민 누구나 디지털 혜택을 향유하게 하겠다""는 목표에 대해서도 눈에 띄는 성과를 거뒀다. 지난 1년간 국민비서(19종), 보조금24(300여종) 등 424개의 대국민 공공 서비스가 제공됐으며 한국형 온라인 공개강좌(K-MOOK, 80만명), 여행예보 서비스(13만명), VR 스포츠실(10만명), 모바일 건강관리 서비스(3.5만명) 등 약 220만명 이상의 국민들에게 다양한 디지털 서비스 혜택이 돌아갔다. 또 전국 1000여개 디지털배움터에서 진행된 취약계층 디지털 역량 강화 교육과 농어촌 통신망 고도화 등을 통해 60만명 이상의 국민들을 대상으로 한 디지털 격차 해소 노력도 이어졌다.  기업 투자 확대, 정부 인공지능 지수 19계단 '점프'규제 개선과 기술 개발 촉진, 기업 투자 독려 등을 통한 경제 성장도 이뤄냈다. 지난 1년 동안 규제샌드박스를 활용해 총 73건의 규제 특례가 부여됐고 디지털 전문계약제도를 도입해 1100억원 규모의 대규모 계약이 체결됐다. 디지털 뉴딜의 주요 R&amp;D 사업을 통해서는 AI, 지능형반도체, 실감콘텐츠 등 미래 선도기술 787개가 개발됐으며 기술이전 167건, 특허출원 407건 등 다방면에서 기술 개발 성과가 나타났다. 과기정통부에 따르면 그중 177개 기술은 실제 자율주행자동차, 혼합현실(XR) 등 산업현장에서 실증이 이뤄졌고 AI 정밀 의료 SW 21종, 돌봄로봇 등 89개 디지털 서비스에도 이용되고 있다.디지털 인프라 투자 측면에선 최근 디지털 뉴딜에 호응해 네이버, LG전자, SKT, KT 등 주요 기업들이 '초거대 AI' 개발에 나서며 대단위 투자를 진행하고 있다. 이동통신사들은 5G 구축에 3년간 총 25조원 규모의 투자 계획을 발표했으며 기업 간 연대와 협력 강화에 방점을 둔 '미래차 뉴딜펀드(현대차, 2000억원)', '민간 데이터 댐' 구축 움직임 등도 활발하다. 정부는 계속된 기술 투자와 규제개선, 세액 공제 등을 통해 이를 더욱 촉진한다는 계획이다. 이 같은 노력이 어우러져 한국은 국가별 AI 활용 수준과 준비 정도를 나타내는 정부 인공지능 지수는 2019년 대비 19계단 상승한 7위를 기록했다.디지털 뉴딜 1.0 성과 구체화하는 '디지털 뉴딜 2.0' 온다한편, 정부는 14일 제4차 한국판 뉴딜 전략회의를 개최하고 한국판 뉴딜 2.0을 발표한 바 있다. 이는 크게 세 가지 방향으로 추진된다. D.N.A(데이터, 네트워크, 인공지능) 생태계 강화, 비대면 인프라 고도화, 초연결 신산업 육성 등이다. 이는 디지털 뉴딜 1.0의 성과들을 고도화, 구체화하는데 목표가 있다.먼저 데이터 댐 구축 단계에서 가명정보 결합 등을 강화한 '데이터 댐 전주기 활용'을 강화하고 산업 전 영역에서 5G 특화망을 중점 활용할 수 있도록 이에 대한 조기 적용을 지원한다. AI는 권역별 강점과 특성을 반영해 지역 거점 중심의 대형 선도 사업을 기획·추진할 계획이다.비대면 인프라 강화 측면에서는 최근 주목받고 있는 메타버스(현실과 비슷한 가상세계) 기업들이 더 많은 데이터를 활용하고 새로운 콘텐츠를 개발할 수 있도록 개방형 메타버스 플랫폼 구축을 지원하는 한편, 콘텐츠 제작과 핵심 기술 개발도 종합 지원할 예정이다. 초연결 사회 구현을 위한 디지털 트윈, 블록체인, 클라우드 사업 전반에 대한 기술 지원과 공공 프로젝트 발굴에도 박차를 가한다. 임혜숙 과기정통부 장관은 ""앞서 대통령이 말씀하신 것과 같이 관계부처와 함께 지속 발전하는 디지털 뉴딜 2.0'을 만들어갈 계획""이라며 ""여러 채널을 통한 협업과 소통으로 국민이 체감할 수 있는 혁신적 변화를 보여줄 것""이라고 말했다.     디지털 뉴딜 2.0 계획 (자료=과기정통부) ]","['무엇이 나아졌는지 ? 피부로 느끼는 것은 그냥 그게 그거다. 일자리 창출?', '?????????????????????????????????????????????????']",http://www.ccdn.co.kr/news/articleView.html?idxno=715942,https://n.news.naver.com/mnews/article/293/0000035668?sid=105
2021.07.29.,충청매일,,"보령시, 치매어르신 대상 맞춤형 사례관리 서비스",,,http://www.ccdn.co.kr/news/articleView.html?idxno=715942,http://www.ccdn.co.kr
2021.07.21.,OBS,,"용인시, '다함께돌봄센터' 8호점 개소",,,http://www.obsnews.co.kr/news/articleView.html?idxno=1319335,http://www.obs.co.kr/
2021.07.22.,중부일보,,[살맛나는 인천] 코로나19 긴급돌봄 지원한 간호조무사들,,,http://www.joongboo.com/news/articleView.html?idxno=363495775,http://www.joongboo.com
2021.07.24.,글로벌경제,,"여가부, 저소득 청소년부모 아이돌봄 정부지원 비율 5%p 올린다",,,http://www.getnews.co.kr/news/articleView.html?idxno=541699,http://www.getnews.co.kr
2021.07.21.,굿모닝충청,,[성광진의 교육읽기] 경로당만큼 아이돌봄시설을 만들자,,,http://www.goodmorningcc.com/news/articleView.html?idxno=254832,http://www.goodmorningcc.com
A25면 1단,경향신문,,[기고]사회서비스원을 양치기 소년으로 만들 셈인가,,,https://www.khan.co.kr/opinion/contribution/article/202107260300015,http://www.khan.co.kr/
2021-07-26 03:02:05,위키트리,오피니언,"전남 무안군, 다함께돌봄센터 1호점 무상임대 협약 체결","[    [경향신문] 시작은 나쁘지 않았다. 공공부문 일자리 81만개 창출, 그 가운데 사회서비스 분야 양질의 일자리 34만개를 만들겠다는 선언부터 일견 담대해 보였고, 시민들은 이 시작에 지지율 70%의 응원을 보냈다.    김진석 | 참여연대 사회복지위원장서울여대 교수 돌봄은 값싼 것이라는 인식이 뿌리깊은 사회의 분위기로 인해 돌봄노동은 우리 사회에 기여하는 정도에 걸맞은 인정과 보상을 누리지 못했다. 돌봄노동은 기껏해야 ‘남는’ 시간에 하는 조각 노동에 불과했고, 돌봄노동의 전문성과 돌봄의 질을 개선하는 데 필요한 경험의 축적은 이루어지기 힘들었다. 돌봄의 질이 열악한 채 정체된 공간에서 돌봄과 일상생활 지원을 필요로 하는 아동, 노인, 장애인 등 주민의 삶이 무너지고 있다.사회서비스원은 문재인 정부가 주민에게 약속한 사회서비스 분야 양질의 일자리 창출과 ‘내 삶을 책임지는 국가’를 실현하는 데 핵심고리의 역할을 할 것으로 기대되었다. 대통령과 정부, 여당이 나서서 “사회서비스원을 통해 공공 사회서비스 일자리 창출 및 사회서비스 제공 인력 처우 개선”과 “국민이 체감하는 사회서비스 품질 향상”을 실현하겠노라고 약속했다. 주민은 그 약속을 아직 믿고 있다.민간 공급자들끼리 마냥 평온하게 운영해오던 시장에 어쩌면 공룡이 될지도 모르는 공공이 진입한다니 기존의 공급자들은 날카로운 경계심을 보였고, 극렬히 반대했다. 온갖 어려움을 뚫고 서울 등 몇몇 지자체에서 사회서비스원을 설립하는 데까지 이르렀지만 거기까지였다. 사회서비스원 근거법 제정이 3년 넘게 국회에서 지지부진한 것이 결정적인 문제였다. 민간이 주도해온 사회서비스 공급 구조 변화와 제도 혁신의 계기로 기대받던 사회서비스원은 근거법 부재와 제한적인 정부 지원 속에 외로운 싸움을 하고 있다. 사회서비스원 설립과 운영을 책임져야 할 지자체들은 벌써부터 발을 뺄 구실을 찾기에 바쁘다. 사회서비스원에 대한 주민과 돌봄노동자들의 관심도 시들해지고 있고, 반대의 목소리를 높이던 민간 공급자들은 이미 표정관리에 들어간 모양새다. 이대로라면 사회서비스원은 거대한 헛소동이 될 위기에 처해 있다.시간이 얼마 남지 않았다. 약속을 지키려 한다면 사회서비스원법의 제정이 출발점이 되어야 한다. 법의 제정을 통해 정부와 지자체가 사회서비스원의 설립과 운영에 예산과 인력을 투여할 수 있는 근거를 마련함으로써 현장에 명확한 신호를 주어야 한다. 근거법조차 제정되지 않은 상황에서 사회서비스원 설립은 동력을 현저히 잃을 것이 자명하며, 이미 설립된 사회서비스원의 경우 결과적으로 운영 책임자인 지자체에 부담을 떠넘기는 안 좋은 선례를 남기게 될 것이다.사회서비스원의 설립과 운영에 적절한 정책 환경의 마련은 현 정부와 주민의 약속 이행이라는 차원을 넘어서는 이야기다. 돌봄과 일상생활 지원 등 다양한 사회서비스를 필요로 하는 주민에게 ‘내 삶을 책임지는 양질의 서비스’를 제공하기 위한 제도적 퍼즐을 완성하는 데 사회서비스원은 핵심적인 조각이다. 한국적 상황에서 이 조각이 빠진 채 복지국가의 그림을 완성하기는 더욱 난망이다.다가오는 거대한 정치적 이벤트에 내놓을 새로운 약속의 꾸러미들을 준비하는 데 너나없이 바쁜 것으로 알고 있다. 지난 4년 동안 지키지 못한 약속이 산적해 있는 판에 새로운 약속의 꾸러미를 준비한들 무슨 소용이 있을까? 주문한 상품이 도착은커녕 이렇다 할 소식조차 없는데 누가 또 거래를 한단 말인가?   ]",[],https://www.wikitree.co.kr/articles/672131,https://n.news.naver.com/mnews/article/032/0003087782?sid=110
2021.07.20.,기호일보,,"용인시, 다함께돌봄센터 8호점 개소",,,http://www.kihoilbo.co.kr/news/articleView.html?idxno=938107,http://www.wikitree.co.kr
2021.07.21.,CNB뉴스,,"곡성군, 아이돌봄 본인부담금 최대 100% 지원",,,http://www.cnbnews.com/news/article.html?no=502943,http://www.kihoilbo.co.kr/
2021.07.19.,노컷뉴스언론사 선정,,"""전 파출부가 아닙니다"" 돌봄 노동자들의 '눈물의 호소'",,,https://www.nocutnews.co.kr/news/5590711,http://www.cnbnews.com
2021.07.21.,NSP통신,,"곡성군, 아이돌봄 본인 부담금 최대 100% 지원",,,http://www.nspna.com/news/?mode=view&newsid=516058,http://www.nspna.com/
2021.07.20.,여성신문,,"양천구, 긴급한 돌봄을 넘어 지역사회 돌봄으로",,,http://www.womennews.co.kr/news/articleView.html?idxno=214034,http://www.womennews.co.kr/
2021-07-20 18:41:09,전자신문언론사 선정,생활/문화,"자란다, 어린이집 휴원·원격수업 대응 '긴급 돌봄 패키지' 출시","[ 촘촘히 복지공백을 메워가는 '양천형 돌봄SOS센터'주거환경 개선, 도시락배달 등 돌봄서비스 제공양천구(구청장 김수영)가 촘촘한 돌봄SOS 서비스 제공을 통해 복지공백을 해소하기 위해 총력을 다하는 가운데, 자칫하면 아무도 모르게 생을 마감할 수 있었던 고독사를 적극 예방하는 사례들이 늘어나고 있다.신정7동에 거주하는 90대 어르신 A씨는 기초생활수급을 받는 독거노인으로, 전립선암 말기 투병을 하던 중 건강이 급속도로 악화하여 거동조차 불가능한 위기상황이었다. 평소 왕래하던 이웃주민이 이를 알고 바로 주민센터 돌봄매니저에게 지원을 요청하였다.돌봄SOS센터는 보건소와 협력하여 먼저 어르신의 코로나검사를 신속히 진행하였고 음성판정을 받아 자택 돌봄의 안전성을 확보하였다. 이어 돌봄매니저, 복지플래너, 구청 통합사례관리사, 통·반장 등으로 구성된 돌봄전담팀을 구성하여 A씨를 집중적으로 관리했다. 주거편의(청소‧방역), 식사지원 서비스 등의 돌봄서비스을 제공하였고, 여느 날과 다름없이 주기적으로 댁을 방문하던 도중 어르신이 편히 돌아가신 것을 확인하였다.A씨의 사례를 제보한 이웃주민은 ""오랜 시간을 홀로 외롭게 살아왔지만, 마지막 가시는 길 만큼은 구의 돌봄서비스를 받으며 삶을 마칠 수 있어 외롭지 않으셨을 것 같다""며 연신 고맙다는 인사를 건네주었다.목2동 40대 독거남 B씨는 뇌병변 심한 장애와 알콜중독을 앓았는데, 최근 동네에서 모습을 보이지 않는 것을 이상하게 여긴 이웃주민의 신고로 돌봄SOS센터와 연결되었다. 신고를 받은 주민센터 돌봄매니저, 복지플래너, 구청 사례관리사가 가정을 방문하였을 때 소파에 쓰러져 있는 B씨를 발견하였다. 상담 결과 B씨는 신체적‧심리적으로 매우 취약해져 있었고 집안 역시 오물과 쓰레기로 가득해 악취가 매우 심한 상황이었다.이에 돌봄SOS센터는 B씨에게 주거편의(청소‧방역), 식사지원 서비스를 제공하였을 뿐만 아니라 서울주택도시공사와 연계하여 화장실 수리 및 도배, 장판 공사까지 시행하였다. 또한 알콜중독 문제가 심각하다고 판단, 정신건강복지센터와 연계하여 상담을 통해 병원 입소를 권유하였고 이에 응한 B씨는 치료를 통해 빠른 회복을 하여 곧 퇴원을 앞두고 있다.    독거 어르신 가정에 도시락을 배달하는 모습 ⓒ양천구청구·동 돌봄매니저 38명으로 구성된 돌봄SOS센터는 이처럼 주기적 방문을 통한 식사 및 주거편의 서비스 지원 등 선제적인 돌봄서비스 제공과정에서 고독사를 방지하는 해결사 역할을 톡톡히 하고 있다.또한 양천구는 지역사회에 더욱 질 높은 돌봄서비스를 제공하기 위해 관내 사회적 기업과 지속해서 소통과 협업을 하고 있다. 돌봄SOS센터 사업에 참여하는 사회적 기업과의 정기회의를 통해 청소·방역업체로부터 심하게 오염된 낡은 이불을 사용하고 있는 한 사례가 공유되자, 도시락 제공업체에서 이불 10채를 후원하는 등 돌봄서비스에 자발적인 기부가 더해져 훈훈함을 자아냈다.김수영 양천구청장은 ""1인 가구 증가로 홀로 쓸쓸히 생을 마감하는 고독사가 늘어나고 있는 상황에서 긴급한 개별 돌봄을 넘어 지역사회 돌봄 주체로서 '양천형 돌봄SOS센터'의 역할이 필요한 때""라며 ""촘촘한 복지 그물망을 통해 '고독사 없는 양천'을 만들기 위해 전력을 다하겠다""고 말했다. ]",[],http://www.etnews.com/20210716000077,https://n.news.naver.com/mnews/article/310/0000089263?sid=103
2021.07.21.,뉴스프리존,,"충남도, 중증장애인 긴급돌봄 '만족'",,,http://www.newsfreezone.co.kr/news/articleView.html?idxno=327025,http://www.etnews.com
