Date,Press,Category,Title,Content,Comment,URL_Origin,URL_Naver
A21면 TOP,동아일보언론사 선정,,엄마 대신 놀아주고 학원서 식사까지… 돌봄의 진화,,,https://www.donga.com/news/article/all/20210730/108273875/1,http://www.donga.com/
2021-07-31 03:02:03,뉴시스,사회,"고양시, 여성친화도시 8년...일자리·안전·돌봄 혜택 눈길","[ 코로나 2년 차 여름방학… ‘슬기로운 돌봄 생활’ 이렇게    27일 오후 서울 양천구에 사는 이채원 양(위쪽 사진·오른쪽)과 오빠 이주원 군(위쪽 사진·왼쪽)이 집에 방문한 돌봄 교사와 함께 수학 공부를 하고 있다. 주원 채원 남매는 일주일에 2번 2시간씩 돌봄 교사와 시간을 보낸다. 27일 오전 경기 고양시에 있는 돌봄 전문 키즈카페에서 아이들이 교사의 지도에 따라 아크릴 벽에 물감으로 그림을 그리고 있다. 4개 특화 수업 교실과 놀이터를 마련한 이 키즈카페에는 돌봄 교사가 상주한다. 원대연 기자 yeon72@donga.com《방학은 전쟁이다. 맞벌이든 아니든 마찬가지다. 신종 코로나바이러스 감염증(코로나19)으로 2년째 아이들과 집에서 씨름하느라 지친 부모들은 방학이 두렵고, 일하는 부모들은 아이들이 집에서 방치될까 봐 걱정이다. 아이들의 ‘학원 뺑뺑이’마저 여의치 않은 시기, 가정 방문 돌봄, 돌봄 결합형 학원, 농촌 유학 등 새로운 돌봄 문화가 주목받고 있다.》“친정어머니께 부탁드리기엔 연세가 너무 많으시고, 집에서 보자니 일을 해야 하고….” 무역회사에 다니는 ‘워킹맘’ 이혜정 씨(40)는 7세 딸이 다니는 유치원의 여름방학이 시작되면서 고민이 깊어졌다. 하루 종일 아이를 맡길 곳이 마땅치 않았기 때문이다. 이 씨만의 걱정이 아니다. 신종 코로나바이러스 감염증(코로나19) 상황이 1년 6개월을 넘어서면서 많은 엄마들이 돌봄 문제로 골머리를 앓고 있다. 특히 아이들이 학교에 가지 않는 방학이 가장 큰 고비다. 학교에 ‘방학 중 돌봄’ 프로그램이 있지만 대부분 선착순 신청이라 기회를 잡기가 쉽지 않다. 이렇게 애태우는 엄마들을 위해 조금씩 선택의 폭이 넓어지고 있다. ‘가정 방문 돌봄’과 ‘종일 돌봄 학원’ ‘농촌 유학’ 등 다양한 민간 서비스와 프로그램이 등장하고 있는 것이다.○ 가정 방문에서 돌봄 카페까지…돌봄의 진화 “얘들아, 우리 여기에 적은 속상한 마음, 슬픈 마음은 세탁기에 넣고 빨자∼.” 27일 오전 11시 경기 고양시의 한 돌봄 전문 키즈카페. 4, 5세 아동 4명은 ‘악어 선생님’이라 불리는 돌봄 교사의 지도에 따라 흰색 특수 천에 물감으로 자신의 속상한 마음을 그렸다. 교사는 그림이 그려진 천을 ‘마음 세탁기’라 불리는 작은 세탁기에 넣었다. 세탁기가 속상한 마음을 깨끗하게 빨아주는 동안 아이들은 상주 돌봄 교사와 함께 비눗방울 놀이를 했다. 이곳에는 4개의 특화 수업 교실과 놀이터가 마련돼 있다. 특화 수업은 채소와 곤충에 대해 배울 수 있는 ‘도시농부’, 스펀지로 꾸며진 바닷속 공간인 ‘오감’, 과학교육 등으로 구성된다. 놀이터에는 종이 터널, 각종 인형과 종이 만들기 키트가 있다. 기존 키즈카페는 장소만 제공할 뿐 부모가 아이와 직접 놀아줘야 했다. 그러나 돌봄 전문 키즈카페는 놀이교사가 상주하며 아이들을 돌본다. 이 ‘돌봄 카페’에는 학부모들이 쉴 수 있는 휴게공간도 20석 정도 마련돼 있다. 이날 오전에도 카페처럼 생긴 휴게공간에 학부모 6명이 앉아 아이들을 지켜봤다. 이웃 엄마의 소개로 이곳을 찾은 이 씨도 노트북을 챙겨와서 회사 업무를 처리했다. 해외 거래처와 일하는 이 씨의 업무 특성상 새벽에도 자주 회의가 열린다. 재택근무를 할 경우 이 씨는 업무에 집중하기 어렵고, 아이는 집에만 있어야 해 지루했다. 하지만 돌봄 카페를 찾으며 달라졌다. 이 씨는 “아이가 이곳에 있는 시간 동안 잠시 쉴 수 있어 큰 도움이 된다”며 “아이에게 많은 것을 해주지 못하는 엄마라는 죄책감을 덜었다”고 말했다. 27일 오후 4시 서울 양천구에 사는 이채원 양(9) 집에는 돌봄 교사가 수학 교재를 들고 방문했다. 채원 양은 돌봄 교사를 보자마자 자연스럽게 껴안으며 무릎에 앉았다. 오빠 이주원 군(10)도 교사 오른쪽에 딱 붙어 앉았다. 주원·채원 남매는 매주 화, 목요일 오후 2시간씩 방문하는 돌봄 교사와 함께 국영수를 공부한다. 만화, 동화 등 아이들이 흥미를 가질 수 있는 형식으로 제작된 교재는 2주에 1권씩 제공돼 따로 문제집을 구입하지 않아도 된다. 지병을 치료 중인 어머니 노시윤 씨(40)는 돌봄 교사가 집으로 찾아온 이후로 마음 편히 병원을 다닐 수 있게 됐다. 그는 “방학 때는 하루 종일 아이들과 놀아주고 공부를 봐 줘야 하는데 몸이 안 좋은 날에는 그러지 못해서 너무 미안했다”며 “돌봄 교사가 오는 날은 피로감이 크게 줄어든다”고 말했다. 놀이 방식에 대한 엄마의 고민도 줄었다. 몸으로 하는 활동을 좋아하는 주원 군은 체육 전문 돌봄 교사와 함께 집 밖에서 체육이나 농구를 함께 하기도 하고 실내에서 할 수 있는 간단한 운동을 배웠다. 방문 돌봄 프로그램을 운영하는 이 업체는 코로나19로 신체활동이 적어진 아이들을 위해 인라인 스케이트, 자전거 등 체육 활동을 여름방학 프로그램으로 제공하고 있다.○식사까지 제공하는 ‘돌봄 학원’까지 27일 오전 9시경 초등학교 1학년 지훈이(가명)는 벨을 누르고 서울 송파구의 한 학원에 들어섰다. 지훈이는 학원에 들어서자마자 익숙한 듯 책 한 권을 뽑아 들었다. 이어 1학년 유민(가명), 3학년 석민(가명), 2학년 미진·가은·서윤(가명)이가 차례로 도착했다. 아이들은 금세 우당탕탕 소리를 내며 뛰어놀고 이야기를 나눴다. 이 학원의 아이들 23명은 부모님이 데리러 오는 오후 7시 반까지 종일 함께 시간을 보낸다.  지난해 생긴 이 학원은 교육과 돌봄을 동시에 제공한다. 인근의 3개 초등학교 1∼3학년 학생들을 모아 오전 8시 40분부터 오후 7시 반까지 돌본다. 학원에서 아이들은 국어 영어 수학 미술 수업을 듣는다. 방학에는 과학실험, 독서 같은 특강이 추가된다. 맞벌이 부모의 큰 과제는 방학 중 아이들의 학원 일정을 매일 완벽하게 짜는 것이다. 한 학원 끝나는 시간에 맞춰 또 다른 학원을 바로 연결하고, 셔틀이 없으면 등·하원 도우미까지 챙겨야 한다. 또 다른 걱정은 아이들의 끼니다. 하지만 돌봄 학원에서는 점심 식사와 간식까지 챙겨준다. 서울 강서구의 한 피아노 학원도 전담 교사를 채용해 학원과 학원 사이 빈 시간 동안 돌봄을 제공한다. 피아노 학원이 낮 12시에 마치는데 태권도 학원이 오후 3시에 시작한다면 중간에 비는 3시간 동안 아이들은 피아노 학원에 머물며 간식을 먹고, 돌봄 전담 교사의 지도하에 학습지를 풀기도 한다. 이 학원 한아름 원장은 “학원 중간중간 아이들을 데리러 올 보호자가 없는 아이들이 주로 이용한다”고 전했다.○“복잡한 서울 떠나 시골로 가요” “방학 중 프로그램이 서울보다 잘돼 있어요.” 이서율 군(10)은 동생 도하 군(8), 어머니 서지연 씨와 함께 여름방학 기간 동안 전남 곡성군에서 머무르기로 했다. 이 군 가족은 1학기 때 서울시교육청에서 진행하는 농촌 유학 프로그램을 통해 곡성으로 내려왔다. 이 가족은 한 학기를 보내고 기간을 연장해 방학 때도 곡성에 머무르기로 결정했다. 농촌유학 프로그램은 서울 학생들이 농촌 학교에 다니면서 자연을 체험하고 생태 감수성을 기르기 위해 올해 1학기부터 시행됐다.  서율 군은 방학 중 학교에서 오전에 코딩 수업을 듣고 오후에 친구들과 밴드 연습을 한다. 약 10일간 진행되는 코딩 수업이 끝나면 역시 학교에서 진행하는 기초 영어 수업과 영어 캠프에 참여할 예정이다. 도하 군도 형과 같은 주제로 저학년 대상으로 재구성된 수업을 듣는다. 이렇게 학교에서 진행하는 프로그램이 끝나면 오후 3시 반이다. 학교 프로그램이 끝나면 서율 군은 곡성 미래교육재단에서 진행하는 연극 수업에 참여한다. 30일에는 아이들이 쓴 대본으로 무대에 연극을 올리고 부모님들을 초대하는 시간을 가졌다. 어머니 서 씨는 “서울에서는 돌봄 신청 자체가 너무 힘든데 곡성에서는 모두가 방학 중 돌봄 혜택을 받을 수 있다”며 “미래교육재단에서 진행하는 방학 중 프로그램이 곡성에 남게 된 큰 이유 중 하나”라고 덧붙였다. 서울에서 잠시 머물다가 다시 지방으로 내려가는 아이들도 있다. 전남 해남군에서 1학기를 보낸 초등학교 5학년 박수빈 양은 14일부터 다시 해남으로 내려간다. 박 양은 ‘홈스테이 이모’와 함께 바나나 농장과 해수욕장에 가고 텃밭에 심어놓은 옥수수를 딸 계획이다. 홈스테이 집에서 기르는 강아지도 산책시키려면 하루가 짧다.  학교 프로그램을 이용하지 않아도 지방 친척 집으로 아이를 보내기도 한다. 경기 용인에 사는 이모 씨(45)는 초등 5학년 아들을 제주에 있는 시댁에 맡겼다. 이 씨의 아들은 방학 동안 풀 문제집과 읽을 책들을 가져갔다. 이 씨는 “서울에 있으면 코로나19 때문에 밖에서 뛰어 놀기도 어렵다”며 “제주에 가면 할머니 할아버지 따라 밭에 가기도 한다. 코로나 시대 방학 때는 시골에서 할 수 있는 게 더 많다”고 전했다.2030 시터 “대학전공 살려 학습 지도”… 50대 이상은 “자녀 키운 경험이 경쟁력”돌봄 수요 늘자 지원자 몰려… 중개업체 “회원 절반이 젊은층”수도권 시급 1만∼1만1000원… 일부는 월 400만원 이상 수입신종 코로나바이러스 감염증(코로나19) 상황이 장기화하면서 아이들의 학습과 등·하원, 생활 등을 관리해 주는 시터(도우미) 수요가 늘고 있다. 자연스럽게 인력도 몰리고 있다. 기존에 시터로 활동해 온 4050세대뿐 아니라 취업 한파를 겪는 2030세대도 돌봄 시장에 뛰어들고 있다. 12일부터 수도권에 사회적 거리 두기 4단계가 시행된 이후 시터 소개 애플리케이션(앱) 가입자 수는 눈에 띄게 증가했다. 돌봄 교사 중개업체 ‘자란다’에 따르면 거리 두기 첫날이었던 12일 부모의 신규 가입이 전주 대비 90% 상승했다고 밝혔다. 교사 가입은 거리 두기 시행 후 9일 동안 시행 전 대비 25% 증가했다. 55만 명의 가입자를 둔 시터 중개업체 ‘맘시터’에 따르면 시터 회원 중 30%가 대학생, 20%가 취업준비생 등이다. 경기 지역 한 대학의 유아교육과에 재학 중인 민모 씨(21)는 “먼저 시터 일을 시작한 학교 동기가 추천했다”며 “전공 관련 경력도 쌓을 수 있고 시급도 높은 편”이라고 말했다. 청년들은 자신의 대학 전공을 적극적으로 활용한다. 피아노 전공이라면 음악 교육을, 수학과 학생이라면 기초 수학 지도를 내세운다. 코로나19 유행으로 일시 귀국한 중국, 미국, 뉴질랜드 등 해외 유학파 대학생은 ‘원어민급’ 외국어 실력을 강조한다. 제대 이후 유아 대상 수영 강사로 활동했던 경험을 살려 체육 전문 강사로 활동하고 있는 김모 씨(24)는 “사회체육학과 전공을 살릴 수 있어서 서빙 아르바이트를 하는 것보다 보람이 있었다”고 말했다. 시터의 시급은 업체마다 조금씩 다르지만 보통 최저시급 이상으로 책정된다. 맘시터의 전국 평균 시터 시급은 9500원, 2021년 최저임금인 시간당 8720원보다 800원가량 높다. 수도권은 1만∼1만1000원인데, 서울 강남·서초·송파구에서는 대부분 1만1000원 이상이다. 풀타임으로 일하는 일부 시터 중에선 월 400만 원 이상의 수입을 올리는 사람도 있는 것으로 알려졌다. 젊은 시터들이 시장에 대거 유입되자 기존 50대 이상의 시터들은 장성한 자녀를 길러낸 경력을 경쟁력으로 내세운다. 가족 관계 소개란에 “두 자녀를 모두 ‘SKY대’에 입학시키고 봉사하고 있는 엄마”라고 적거나 면접 과정에서 “딸들을 모두 명문대 졸업시키고 대기업에 무사히 취직시켰다”고 말하는 식이다. 정지예 맘시터 대표는 “고등학생, 대학생 이상 자녀를 둔 시터는 육아 경력이 입증됐고, 여유 시간이 많아 인기가 높다”고 말했다. ]","['', '아이들 교육은 매우 중요....무자격자가 아닌 정식 자격을 갖춘 사람들이 해야...... 지적인 수준도 중요하지만 인성과 소명감이 매우 중요......전교조 교육으로 피해를 본 세대를 생각하면....ㅜ', '저런세상을 자꾸 만들어가니 자식이 부모를 돈으로만보는거구\n또 부모랑 정도애정도 없는거다 불가피 한부분들도 있지만 지나치게 자기 자식을 다른사람 손을 빌리면 결국 애들은 부모를\n돈으로만 본다는사실 잊지마라', '', '이로써 엄빠는 돈벌오는 기계에 불과하고 돌봄  아주마니가 정서적 지지자로 정서적으로  밀착되면서 가정은 요지경 된다. 내 자식과 내 배우자는 나만 지킬 수 있다는거 잊지 말아야 한다. 가족 이라는 정서적 유대감 마저 없다면 건강한 가족이라 볼수 없다. 60~70년대만 해도 극빈  속에서도 훌륭하게 성장 할수 있었던것은 끈끈한 가족애가 원동력이 되었기 때문이다.확실히 물질의 풍요가 삶의 질을  높였지만 가족애는 약해졌고 이로인한 사회문제로 이어지는범죄가 늘었음을 확연히 알수있다', '돌봄은 좋지만 교육을 강화해야', '초 3학년까지는 부모와 시간을 가능한 만들어 줘야 한다.\n부모중 수입이 적은 부모에게 경제적으로 보상(돌봄수당)해주고  집에서 아이와 함께 가사와 휴식을 하게 제도적으로 만들어 주면 좋겠다. \n아이들이  정서가  서서히  망가지고  있다.\n미래에는 자식들로 부터 버려질 차례이다.', '지자체에서 돌봄센터 건물을 꼭 지어야 합니다. 아이들 없는 오전시간에는 성인문화센터하고 하교하는 시간부터는 아이들을 위한 공간으로 활용하고요.', '미래를 볼때 정말 위험한 돌봄이다...부모 자식간에 정은 사라지고 함께 하는시간이 길어야 정도 들고 사랑도 받고 이다음  자라 부모가 되면 다시 사랑을 줄터인데..뭐 그런 부모자식간의 사랑을 모르니 아이는 낳겠나...', '굳이 방학 필요있나?\n교사들 공으로 노는데 월급 주는거 아깝다 \n이럴바에 방학없애고 그냥 학교 나가게 해주라\n방학은 선생들만 편한 만들어놓은 제도인거 같다', '세상이 요지경이라 어쩔수 없다지만 저러면 저게 부모인가… 낳아놓기만 하면 부모인가…부모도 저러고싶어 저러는 사람 없겠다만 이럴수밖에 없게 만들어놓고 나라 돌아가는 꼴때문에 다 너무 안타깝다…ㅠ 이러니 애들이 정상적으로 크겠냐고.. 가족의 소중함은 알겠냐고.. 그냥 학원비만 잘내주고 돌봄교사만 잘구해주면 되는 부모는 걍 돈이나 잘주면 되는 사람이 되어버렸는데.', '교사들 월급주는거 돈아깝다 \n온라인 교육 그따위로 만들어 놓고 무슨 월급을 받아가냐\n얼마냐 가르치는게 없음 애들이 학원으로 도나\n팔자편한 대한민국 교사들이다\n내세금이 아깝다', '내자식은 내가 돌보자 제발. 이러니 정서적 결핍으로 이상한 애들이 많은거다.', '', '엄마대신 놀아줘 ??  1분이던 1시간이던 주모가 사랑을 주고. 놀아주는게 남이 돌보는 것보다 훨신 아이한테는 더 좋을텐데.  \n\n부모사랑 받지 않고 자란 아이가 제대로된 인성이나 사고방식이  있을거라고 생각하냐??', '학교 방학 없애면 됨. 주5일이면 됐지...3개월 교사 방학은 유급으로 왜주는지. 세금 낭비 지대로다', '시급 만원 이상인 시터를 쓰려면 부모 연봉은 당최 얼마란거냐?\n이런 고급 시터  기사말구 진짜  시터가 필요한\n꼭 시터가 필요한 그런 기사는 없냐?\n이건 그냥 시터 광고구만', '', '', '맞벌이해서 저런곳에 돈갔다주고 회사갔다와서 해먹기힘들어서 가끔씩 시켜먹고 함 남는것도 없겠다 그럼 맞벌이의 의미가 없을듯', '엄마 역할은 못하고 엄마 역할할 사람을 돈으로 구하네 안타깝다', '아빠엄마는 돈벌오는 기계가 되고 정서적 유대감을 가진 실질적 엄마는 돌봄교실 선생님이 되는 아이러니... 그나마 돌봄선생님이 좋은선생님이면 다행인데 오로지 호구지책일뿐인 돌봄은 애정도 없고 관심도 없고.. 애는 수업끝나면 돌봄교실에서 스마트폰가지고 놀고 돌봄이 틀어주는 TV보고 놀다가 집에가면 PC하고.. 정붙일데가 없으니 남자애들은 주목끌라고 사고치고 여자애들은 지극히 의존적이 되거나 지극히 냉소적이 되거나 둘중 하나가 됨... 그럴거면 애는 뭐하러 낳나... 다 행복하자고 하는건데 돈이 먼저인지 애가 먼저인지 잊어버린 현실.', '', '아이들  인성교육도 병행되는 그런 돌봄셴터를 운영해 주세요', '집에 있으면 마스크라도 벗고 있지요\n아침부터 저녁까지\n또는 집에서도 마스크쓰고 너무 불쌍해보이네요ㅠㅠ', '돔봄이 비용은 문재앙이주냐~\n꽁짜로 해주냐~\n문제는 돈이지~\n그럴 능력없는사람은 어떡해^', '그래서 어디서 어케 신청하고 비용이 얼마인데요?', '', '이런거 보면 또 나라에서 이런거 공짜로 해달라고 보채겠지… 제발 애들 좀 그냥 놀게 둬라', '', '코로나 때문에 기숙학원이나 식당을 갖춘 학원을 제외하고는 음식섭취가 금지되어있는데 학원에서 식사제공이라...', '부모와 아이가 떨어져 지내는 시간이 많아서 그런지 \n가족애라는걸 요즘 찾아볼수가 없다 \n부모를 죽이니 자식을 버리니… 이게 맞나 싶다', '부모님과 같이 보내는 시간이 줄어들 거 같아서 걱정이긴 한데 이것도 나쁘진 않은듯', '어렸을때   부모의 사랑을  많이 못 받고자라면  범죄자가 될 확률이  높지.....돈이 아무리 궁해도 엄마는 자식하고 놀아주고 하세요....', '벌써 국영수 뺑뺑이 싹이 노랗다', '', '문제는 돈이죠....', '', '코로나시대 애들은 학교안가고 학원 다간다', 'ㅉㅉ  어린이집까지 못가게 만들고  힘들다', '아이들을 키우는데 어려움이 있는 가정, 맞벌이 부부의 자녀들의 큰 도움이 되는 일이네요! 우리나라를 항상 더 살기 좋은 나라로 만들어 주시는 분들 다들 힘내세요 응원합니다!', '애들은니들이알아서해 왜세금빼가 나질말든가', '이제 더 이상 공교육이 필요한건가?', '', '지자  식 지가 자발적으로 낳아 기르는데 죽는다고 하네.. ㅉㅉ 처 낳질 말든가. 조온 나 이기적인 하등생물들임.', '다 돈…', '옛날에는 못살았어도 가장 혼자 나가서 벌면 식구들을 건사했는데 지금은 무조건 둘이 벌어야 먹고사는 세상', '', '식사제공? 식당은. 장사. 규제하는데 학원에서 식사까지??', '', '', '지방 일자리도 거의 없더만.... 가입비 아까워..', '', '', '부모대신...', '', '', '', '', '인간들이 살데가 못되는 서울 수도권보단 청정지역인 시골이 백배 낫다', '정부가 해주면 너무 좋겠다.악어샘은 시간당 금액 높아요.ㅜㅜ', '아이들이 미래입니다 자기 자식이다 생각하고 돌보면 보람도 훨씬 크고 버는 돈의 가치도 높을 것입니다 이런 상부상조하는 직업이 잘 뿌리내려 원윈하길 기원합니다', '결국 공교육 역할이 부족한것', '요즘 여편네들 팔자 참 좋아! 애는 남들이 봐줘 까페에서 노닥거려 그렇다고 직장 다니는 여성 비율은 oecd 중 최하위고', '', '', '학교는  있으냣 마냣ᆢ이러고도 학교 선생들은 월급 꼬박꼬박 다 받아가죠ᆢ 세금은  죽으랴고  뜯어 가면서  이게  무슨  꼴이냣ㆍᆢ정부 도 민영화 를 하는것이  나을듯ᆢ']",http://www.newsis.com/view/?id=NISX20210730_0001532908&cID=10817&pID=14000,https://n.news.naver.com/mnews/article/020/0003373615?sid=102
2021.07.29.,이데일리,,"놀이의발견, 아이들 여행 위한 '숙소예약서비스' 운영",,,http://www.edaily.co.kr/news/newspath.asp?newsid=02151686629119440,http://www.newsis.com
