Date,Press,Category,Title,Content,Comment,URL_Origin,URL_Naver
2023-08-22 18:24:01,단비뉴스,사회,자원봉사 의존하는 취약계층 미용 서비스,[     부산 서구종합사회복지관과 동아대병원 교직원이 지역 어르신들의 건강한 여름나기를 위해 삼계탕 제공 봉사를 지난 9일 제공했다. 서구종합사회복지관 제공부산 서구의 한 대학 병원이 무더운 날씨에 지친 지역 어르신들을 돕고자 점심 봉사 활동에 나섰다.22일 서구종합사회복지관에 따르면 지난 9일 안희배 동아대병원 병원장을 비롯한 동아대병원 교직원들이 지역 어르신들의 건강한 여름나기를 위해 서구종합사회복지관을 방문해 삼계탕을 직접 조리하고 배식했다.서구종합사회복지관 조휴정 관장은 “코로나19 이후 4년 만에 동아대 병원과 함께 어르신 봉사 활동에 나서 의미가 남다르다”며 “이런 행복함을 전해드릴 수 있도록 더욱 노력하겠다”고 감사의 마음을 전했다.안희배 병원장은 “더위에 지친 어르신들이 건강하게 여름을 보내시길 바란다”고 하면서 “계속해서 지역사회를 위한 다양한 사회공헌활동에 앞장 서겠다”고 강조하였다. ],[],http://www.danbinews.com/news/articleView.html?idxno=24229,https://n.news.naver.com/mnews/article/082/0001228418?sid=102
2023.08.29.,부안독립신문,,"보안면, 노인사회활동지원사업 참여자 대상 교육 마련",,,https://www.ibuan.com/news/articleView.html?idxno=40965,http://www.enewstoday.co.kr/
2023.08.21.,데일리한국,,"신한라이프, 임직원 봉사 캠페인 '바빠도DAY' 전개",,,https://daily.hankooki.com/news/articleView.html?idxno=990705,http://www.danbinews.com
2023.08.25.,글로벌경제,,"금호석유화학 본사 직원, 평택 소재 '야곱의집' 보호 아동 돌봄 봉사활동",,,http://www.getnews.co.kr/news/articleView.html?idxno=639005,http://www.getnews.co.kr
2023.08.28.,경상매일신문,,"재대구군위군향우회, 독거노인 가구 환경정비 나서",,,http://www.ksmnews.co.kr/default/index_view_page.php?idx=441787&part_idx=266,http://www.ksmnews.co.kr
2023.08.28.,경남도민신문,,진주 하대동 지사협 주거환경개선 봉사,,,http://www.gndomin.com/news/articleView.html?idxno=363897,http://www.gndomin.com/
2023.08.28.,동양일보,,"공주시 특수임무 고마봉사단, 수해 가구 주거환경 개선 봉사",,,http://www.dynews.co.kr/news/articleView.html?idxno=718481,http://www.dynews.co.kr
2023.08.22.,충북일보,,"충주 금가면, 홀몸노인 70여 가구 반찬 지원",,,https://www.inews365.com/news/article.html?no=777668,http://www.inews365.com
2023.08.27.,충북일보,,"충주 수안보면, 홀몸노인 등 반찬 나눔",,,https://www.inews365.com/news/article.html?no=778126,http://www.inews365.com
2023.08.21.,연합뉴스,,"서울시 청년정책 참여 청년들, 영등포쪽방촌 자원봉사",,,https://www.yna.co.kr/view/AKR20230820010900004?input=1195m,https://www.yna.co.kr/
2023-08-21 06:00:07,장애인신문,사회,"복지TV, 대한노인회와 '노인복지 증진' 앞장선다","[     서울청년정책네트워크, 영등포쪽방촌에서 자원봉사[서울시 제공. 재판매 및 DB 금지]    (서울=연합뉴스) 김준태 기자 = 서울시는 청년참여기구 서울청년정책네트워크(서울청정넷) 소속 30여명이 19일 영등포쪽방촌에서 봉사활동을 했다고 21일 밝혔다.    이들은 일대 거리를 청소하고 쪽방촌 주민에게 하루 한 끼를 무료로 제공하는 서울시 지정 민간 식당인 '동행식당'에서 도시락을 포장해 배달했다.     거동이 불편한 홀몸노인 가구를 대상으로 도시락 배달과 함께 방 청소를 돕고 노인과 말벗이 돼주기도 했다.    향후 서울청정넷은 봉사 등 청년의 사회 기여 활동을 확대하고 정례화하는 방안을 검토 중이다. 청년이 직접 제안하고 편성하는 청년 자율예산을 활용한 청년봉사단 운영, 청년 나눔문화 조성 등의 사업을 제안해 서울시 관련 부서와 협의하고 있다.    서울청정넷은 '청년의 문제는 청년이 잘 안다'는 취지에서 2013년부터 운영된 서울시 청년참여기구로, 올해는 531명이 참여 중이다. 지난 10년간 청년수당, 청년 월세 지원, 청년 마음건강 지원 등 청년의 필요와 욕구를 반영한 다양한 정책을 제안해왔다.     김철희 서울시 미래청년기획단장은 ""정책의 수혜자이자 사회를 견인해나갈 주역으로서 사회공동체에 기여하고 봉사한다는 것은 의미가 크다""며 ""서울시 청년정책에 참여하는 청년들이 자신의 변화와 성장을 토대로 사회에 이바지할 기회를 만들기 위해 노력하겠다""고 말했다.    readiness@yna.co.kr ]",[],http://www.welfarenews.net/news/articleView.html?idxno=94190,https://n.news.naver.com/mnews/article/001/0014141385?sid=102
2023.08.24.,브라보마이라이프,,일본의 노인과 함께 사는 마을 만들기 ‘지역포괄케어’,,,https://bravo.etoday.co.kr/view/atc_view/14738,http://www.welfarenews.net
2023.08.21.,헤럴드경제,,"신한라이프, 임직원 봉사 캠페인 ‘바빠도DAY’ 시작",,,http://news.heraldcorp.com/view.php?ud=20230821000247,http://bravo.etoday.co.kr
2023.08.21.,연합뉴스,,"서울시 청년정책 참여 청년들, 영등포쪽방촌 자원봉사",,,https://www.yna.co.kr/view/AKR20230820010900004?input=1195m,https://www.yna.co.kr/
2023-08-21 06:00:07,장애인신문,사회,"복지TV, 대한노인회와 '노인복지 증진' 앞장선다","[     서울청년정책네트워크, 영등포쪽방촌에서 자원봉사[서울시 제공. 재판매 및 DB 금지]    (서울=연합뉴스) 김준태 기자 = 서울시는 청년참여기구 서울청년정책네트워크(서울청정넷) 소속 30여명이 19일 영등포쪽방촌에서 봉사활동을 했다고 21일 밝혔다.    이들은 일대 거리를 청소하고 쪽방촌 주민에게 하루 한 끼를 무료로 제공하는 서울시 지정 민간 식당인 '동행식당'에서 도시락을 포장해 배달했다.     거동이 불편한 홀몸노인 가구를 대상으로 도시락 배달과 함께 방 청소를 돕고 노인과 말벗이 돼주기도 했다.    향후 서울청정넷은 봉사 등 청년의 사회 기여 활동을 확대하고 정례화하는 방안을 검토 중이다. 청년이 직접 제안하고 편성하는 청년 자율예산을 활용한 청년봉사단 운영, 청년 나눔문화 조성 등의 사업을 제안해 서울시 관련 부서와 협의하고 있다.    서울청정넷은 '청년의 문제는 청년이 잘 안다'는 취지에서 2013년부터 운영된 서울시 청년참여기구로, 올해는 531명이 참여 중이다. 지난 10년간 청년수당, 청년 월세 지원, 청년 마음건강 지원 등 청년의 필요와 욕구를 반영한 다양한 정책을 제안해왔다.     김철희 서울시 미래청년기획단장은 ""정책의 수혜자이자 사회를 견인해나갈 주역으로서 사회공동체에 기여하고 봉사한다는 것은 의미가 크다""며 ""서울시 청년정책에 참여하는 청년들이 자신의 변화와 성장을 토대로 사회에 이바지할 기회를 만들기 위해 노력하겠다""고 말했다.    readiness@yna.co.kr ]",[],http://www.welfarenews.net/news/articleView.html?idxno=94190,https://n.news.naver.com/mnews/article/001/0014141385?sid=102
2023.08.24.,브라보마이라이프,,일본의 노인과 함께 사는 마을 만들기 ‘지역포괄케어’,,,https://bravo.etoday.co.kr/view/atc_view/14738,http://www.welfarenews.net
2023.08.21.,헤럴드경제,,"신한라이프, 임직원 봉사 캠페인 ‘바빠도DAY’ 시작",,,http://news.heraldcorp.com/view.php?ud=20230821000247,http://bravo.etoday.co.kr
2023.08.25.,이코노미톡뉴스,,"금호석유화학, 아동 돌봄 봉사 전개",,,http://www.economytalk.kr/news/articleView.html?idxno=241136,http://www.heraldbiz.com/
2023-08-21 10:30:01,뉴스1,경제,"IBK證, 말복 맞아 독거노인 대상 '보양식 나눔봉사' 실시","[     신한라이프 임직원이 18일 경기도 고양시에 소재한 홀트일산복지타운에서 봉사활동을 마친 후 기념 촬영을 하고 있다. [신한라이프 제공][헤럴드경제=강승연 기자] 신한라이프(대표이사 사장 이영종)는 기업의 사회적 책임을 실천하기 위해 이달부터 임직원 봉사의 날 ‘바빠도DAY’ 캠페인을 매월 운영한다고 21일 밝혔다.‘바빠도DAY’는 임직원들의 바쁜 일정 중에도 특정일에는 자발적으로 봉사활동에 참여하자는 의미에서 시작된 캠페인으로, 매월 2·3주차 금요일마다 장애인·아동·노인 등 복지 사각지대에 있는 지역사회 소외계층을 위한 다양한 봉사활동을 전개할 예정이다.신한라이프는 ‘바빠도DAY’의 첫 번째 활동으로 18일 경기도 고양시 중증장애인생활시설 홀트일산복지타운에서 봉사활동을 진행했다. 이날 참여한 30여명의 임직원 봉사단은 쇼핑백 제작 등 장애인 근로자의 직업재활 활동을 돕고, 제작한 물품 판매수익금 전액을 장애인 근로자의 급여지원금으로 후원했다. ]",[],https://www.news1.kr/articles/5138004,https://n.news.naver.com/mnews/article/016/0002185918?sid=101
2023.08.25.,아주경제,,"금호석화, 아동 돌봄 봉사 동참···""사회공헌 범위 확대""",,,https://www.ajunews.com/view/20230825103314732,http://www.economytalk.kr/
2023.08.27.,경남도민일보,,양산 웅상노인복지관 사랑나눔키트 제작,,,http://www.idomin.com/news/articleView.html?idxno=833236,http://news1.kr/
2023-08-11 10:24:19,충청매일,경제,"충남 계룡시 노인복지관, 응원 캠페인 실시","[     IBK투자증권 나눔봉사단이 10일 서울 시립마포노인종합복지관 경로식당에서 배식봉사를 하고 있다. (IBK투자증권 제공)(서울=뉴스1) 임윤지 기자 = IBK투자증권은 지난 10일 말복을 맞아 서울 시립 마포노인종합복지관에서 '보양식 나눔봉사'를 실시했다고 11일 밝혔다.IBK투자증권 나눔봉사단 10여명은 시립 마포노인종합복지관 경로식당을 방문해 해당 지역에 거주하는 독거노인 등 취약계층에 전복해신탕 600인분을 제공했다.또한 IBK투자증권은 지역 내 독거노인들을 위해 올 연말까지 매월 500만원씩 총 2500만원을 경로식당에 후원할 예정이다.IBK투자증권 관계자는 ""기록적인 폭염으로 기력이 쇠해진 독거노인들의 건강을 생각해 여름철 보양식으로 전복해신탕을 준비했다""며 ""앞으로도 지역 소외계층을 위한 봉사활동을 지속적으로 이어가겠다""고 말했다.IBK투자증권 나눔봉사단은 올해 하반기부터 유기아동 돌봄지원, 자립준비청년 지원, 청각 장애인 재활치료지원, 초등학교 경제교실 등 사회공헌활동을 추진할 계획이다.   ]",[],https://www.ccdn.co.kr/news/articleView.html?idxno=931465,https://n.news.naver.com/mnews/article/421/0006985409?sid=101
2023.08.29.,경상일보,,"롯데케미칼 울산공장, 지역사회 독거노인 후원금 400만원 전달",,,https://www.ksilbo.co.kr/news/articleView.html?idxno=978501,http://www.ajunews.com
2023.08.29.,경상일보,,"롯데케미칼 울산공장, 지역사회 독거노인 후원금 400만원 전달",,,https://www.ksilbo.co.kr/news/articleView.html?idxno=978501,http://ksilbo.co.kr
2023.08.28.,충남일보,,"공주시 특수임무 고마봉사단, 수해 가구 주거환경 개선 봉사",,,http://www.chungnamilbo.co.kr/news/articleView.html?idxno=731554,http://www.chungnamilbo.co.kr
2023.08.21.,뉴스핌,,'함께하는 자원봉사 하나되는 광양시' 구현 봉사활동 전개,,,http://www.newspim.com/news/view/20230821000554,http://www.newspim.com
2023.08.22.,아주경제,,"한화파워시스템, 밀양시 노인세대에 직접 만든 공기청정기 나눔",,,https://www.ajunews.com/view/20230822155117783,http://www.ajunews.com
2023.08.28.,새전북신문,,"완주 삼례읍-두배나눔봉사단, 정리정돈 재능봉사",,,http://sjbnews.com/news/news.php?number=790625,http://www.sjbnews.com/
2023.08.21.,MTN,,"신한라이프, 임직원 봉사 캠페인 '바빠도DAY' 전개",,,https://news.mtn.co.kr/news-detail/2023082110110016847,http://mtn.mt.co.kr
2023.08.28.,NSP통신,,"광양 중마노인복지관, ‘독거노인 마음이음’ 사업비 전달식 개최",,,https://www.nspna.com/news/?mode=view&newsid=655160,http://www.nspna.com/
2023.08.25.,브릿지경제,,"광양제철소, 독거노인 지원 프로그램 ‘마음이음’ 사업에 4000만원 전달",,,https://www.viva100.com/main/view.php?key=20230825010007346,http://www.viva100.com
2023.08.29.,CNB뉴스,,"파주도시관광공사, 노인복지관과 MOU...""행복하고 건강한 노년 협력""",,,https://www.cnbnews.com/news/article.html?no=616819,http://www.cnbnews.com
2023.08.27.,전북일보,,"장수군노인장애인복지관, 산서면 ‘찾아가는 마을 복지관’ 운영",,,https://www.jjan.kr/article/20230827580010,http://www.jjan.kr
2023.08.27.,전북일보,,"한국농어촌공사 무진장지사, 찾아가는 사회복지시설 봉사활동 전개",,,https://www.jjan.kr/article/20230827580007,http://www.jjan.kr
2023.08.25.,라이센스뉴스,,"금호석유화학, 아동 돌봄 봉사 진행...사회와 공생하는 가치 실천",,,https://www.lcnews.co.kr/news/articleView.html?idxno=58789,http://www.lcnews.co.kr
2023.08.28.,충청일보,,"[포토]강서1동, 신전경로당 찾아 이미용 봉사",,,https://www.ccdailynews.com/news/articleView.html?idxno=2224659,http://ccdailynews.com
2023.08.25.,시민일보,,"평택시 송탄보건소, 북부노인복지관 한빛봉사단 「노인 생명다리 서포터즈」 ...",,,https://www.siminilbo.co.kr/news/newsview.php?ncode=1160287922203040,http://www.siminilbo.co.kr
2023.08.22.,LG헬로비전,,"노인자원봉사단 '포돌이 극단', 이달부터 인형극 재능기부",,,http://news.lghellovision.net/news/articleView.html?idxno=432324,http://news.lghellovision.net/
2023.08.25.,신아일보,,"금호석화, 아동 돌봄봉사…""사회공헌 범위 확대""",,,http://www.shinailbo.co.kr/news/articleView.html?idxno=1750345,http://www.shinailbo.co.kr/
2023.08.21.,마이데일리,,"신한라이프, 임직원 봉사의 날 ‘바빠도데이’ 캠페인 실시",,,https://mydaily.co.kr/page/view/2023082109435365983,http://www.mydaily.co.kr/
2023-08-21 09:46:01,위키트리,생활/문화,"[포토]김이강 광주시 서구청장, 서구노인종합복지관 배식봉사","[     /신한라이프[마이데일리 = 구현주 기자] 신한라이프가 기업 사회적책임을 실천하고자 임직원 봉사의 날 ‘바빠도데이’ 캠페인을 매월 운영한다고 21일 밝혔다.매월 2·3주차 금요일마다 장애인, 아동, 노인 등 복지 사각지대에 있는 지역사회 소외계층을 위한 봉사활동을 전개할 예정이다.신한라이프는 ‘바빠도데이’ 첫번째 활동으로 지난 18일 경기도 고양시 중증장애인생활시설 홀트일산복지타운에서 봉사활동을 진행했다. 30여명 임직원 봉사단은 쇼핑백 제작 등 장애인 근로자 직업재활 활동을 돕고, 제작한 물품 판매수익금 전액을 장애인 근로자 급여지원금으로 후원했다.봉사에 참여한 한 임직원은 “사회문제 해결 출발점은 도움이 필요한 사회적 약자에 대한 꾸준한 관심이라고 생각한다”며 “앞으로도 사회 구성원 모두가 신한라이프와 함께 성장할 수 있는 건강한 기반을 다지는 데 일조하고 싶다”고 말했다. ]",[],https://www.wikitree.co.kr/articles/879973,https://n.news.naver.com/mnews/article/117/0003762556?sid=103
2023.08.28.,충청뉴스,,"공주시 특수임무 고마봉사단, 수해 가구 주거환경 개선 봉사",,,http://www.ccnnews.co.kr/news/articleView.html?idxno=306008,http://www.wikitree.co.kr
2023.08.28.,시민일보,,"성동구 왕십리도선동, 이미용 봉사 서비스 운영",,,https://www.siminilbo.co.kr/news/newsview.php?ncode=1160284388288450,http://www.ccnnews.co.kr/
2023.08.22.,위키트리,,"[포토]김이강 광주시 서구청장, 서구노인종합복지관 배식봉사",,,https://www.wikitree.co.kr/articles/879973,http://www.wikitree.co.kr
2023.08.28.,충청뉴스,,"공주시 특수임무 고마봉사단, 수해 가구 주거환경 개선 봉사",,,http://www.ccnnews.co.kr/news/articleView.html?idxno=306008,http://www.ccnnews.co.kr/
2023.08.25.,리버티코리아포스트,,"금호석유화학, 아동 돌봄 봉사 활동 진행...사회공헌 범위 확대",,,http://www.lkp.news/news/articleView.html?idxno=35232,http://lkp.news
2023.08.28.,시민일보,,"성동구 왕십리도선동, 이미용 봉사 서비스 운영",,,https://www.siminilbo.co.kr/news/newsview.php?ncode=1160284388288450,http://www.siminilbo.co.kr
2023.08.27.,전국매일신문,,"[전매포토] 평택시 송탄보건소, 한빛봉사단 '노인 생명 다리 서포터즈' 위촉",,,https://www.jeonmae.co.kr/news/articleView.html?idxno=977537,http://www.jeonmae.co.kr/
2023.08.17.,스포츠서울,,"강진군, 이,미용 전문 자원봉사자 양성교육 수료",,,https://www.sportsseoul.com/news/read/1340149?ref=naver,http://www.sportsseoul.com/
2023-08-17 10:51:06,데일리안,사회,"신한라이프, 임직원 봉사 캠페인 ‘바빠도DAY’ 전개","[     이,미용 전문 교육을 받은 자원봉사자 수료식을 마치고 기념사진을 촬영하고 있다 = 강진군 제공[스포츠서울|조광태기자] 전남 강진군은 지난 16일 강진군여성회관에서 이·미용 전문 교육을 받은 자원봉사자 10명을 대상으로 수료식을 개최했다고 17일 밝혔다.이번 전문자원봉사자 양성교육은 지난 6월 16일 시작해 주 2회, 50시간의 이·미용에 전문 교육을 통해 자원봉사 서비스의 질을 한층 향상할 수 있는 계기가 됐다.군은 ‘강진군 찾아가는 이․미용 봉사’ 프로그램을 노인생활시설과 이용시설의 어르신 40여명을 대상으로 시행해 주위를 훈훈하게 했다.교육과정 틈틈이 군민희망나눔지원사업, 광주 요양시설에 직접 찾아가 이·미용봉사를 펼쳐, 배우고 나누는 자원봉사의 참 의미를 실천했다.기본커트 과정 등의 교육을 수료한 자원봉사자들은 앞으로 ‘희망손 봉사단’을 결성해 정기적으로 이·미용 분야 전문 봉사를 펼칠 예정이다.양성교육에 참석한 한 예비 자원봉사자는 “다양한 분야에서 자원봉사자로 활동할 수 있지만 어르신들에게 꼭 필요한 봉사로 미소를 선물해주고 싶어 지원했다”며 “선한 영향력을 전하는 봉사자로서의 삶을 살겠다”고 말했다.강진군 주민복지과 서수진 주무관은 “이번 교육을 통해 양성된 이·미용 전문자원봉사자들은 기존에 활동하고 있는 강진군희망복지지원단에 합류해 지속적인 봉사활동을 벌일 것”이라며 “이러한 전문적인 기술을 갖춘 봉사활동으로 수혜자의 만족도를 높이고, 특히 급증하는 노인층을 위한 복지서비스 제공에 최선을 다하겠다”고 밝혔다강진군은 ‘최고의 자원봉사단체 육성 및 활성화’를 민선 8기 60대 프로젝트로 선정하고, 전문 자원봉사자 양성을 비롯해 자원봉사대학 운영, 직능별 기능별 전문자원봉사단 지원, 우수 자원봉사자 인센티브 제도 등을 추진해 능동적인 자원봉사 문화를 정착해간다는 방침이다. ]",[],https://www.dailian.co.kr/news/view/1264986/?sc=Naver,https://n.news.naver.com/mnews/article/468/0000971575?sid=102
2023.08.25.,아시아경제,,"[포토]오승록 노원구청장, 어르신 경로식당 사랑의 배식봉사",,,https://view.asiae.co.kr/article/2023082517334306150,http://www.dailian.co.kr/
2023-08-21 09:47:01,신아일보,경제,"진주시 집현면지역사회보장협, 주거환경개선 봉사 펼쳐","[     지난 18일 신한라이프 임직원이 경기도 고양시에 소재한 홀트일산복지타운에서 봉사활동을 마친 후 기념 촬영을 하고 있다.ⓒ신한라이프[데일리안 = 김재은 기자] 신한라이프는 기업의 사회적 책임을 실천하기 위해 이달부터 임직원 봉사의 날 ‘바빠도DAY’ 캠페인을 매월 운영한다고 21일 밝혔다.이 캠페인은 임직원들의 바쁜 일정 중에도 특정일에는 자발적으로 봉사활동에 참여하자는 의미에서 시작된 캠페인으로, 매월 2·3주 차 금요일마다 장애인, 아동, 노인뿐만 아니라 복지 사각지대에 있는 지역사회 소외계층을 위한 다양한 봉사활동을 전개할 예정이다.신한라이프는 첫 번째 활동으로 지난 18일 경기도 고양시 중증장애인생활시설 홀트일산복지타운에서 봉사활동을 진행했다. 이날 참여한 30여 명의 임직원 봉사단은 쇼핑백 제작 등 장애인 근로자의 직업재활 활동을 돕고, 제작한 물품 판매수익금 전액을 장애인 근로자의 급여지원금으로 후원했다.봉사에 참여한 한 임직원은 “사회문제 해결의 출발점은 도움이 필요한 사회적 약자에 대한 꾸준한 관심이라고 생각한다”며, “앞으로도 사회 구성원 모두가 신한라이프와 함께 성장할 수 있는 건강한 기반을 다지는 데 일조하고 싶다”고 말했다.   ]",[],http://www.shinailbo.co.kr/news/articleView.html?idxno=1751543,https://n.news.naver.com/mnews/article/119/0002741460?sid=101
2023.08.29.,대경일보,,대구 중구자원봉사대학 12기·대학원 5기 입학식 가져···자원봉사자 전문성...,,,https://www.dkilbo.com/news/articleView.html?idxno=412103,https://www.asiae.co.kr/
2023.08.25.,핀포인트뉴스,,"금호석유화학, 아동 돌봄 봉사활동 펼쳐…""사회공헌 범위 확대""",,,https://www.pinpointnews.co.kr/news/articleView.html?idxno=213871,http://www.pinpointnews.co.kr
2023.08.28.,신아일보,,"진주시 집현면지역사회보장협, 주거환경개선 봉사 펼쳐",,,http://www.shinailbo.co.kr/news/articleView.html?idxno=1751543,http://www.shinailbo.co.kr/
2023.08.29.,대경일보,,대구 중구자원봉사대학 12기·대학원 5기 입학식 가져···자원봉사자 전문성...,,,https://www.dkilbo.com/news/articleView.html?idxno=412103,http://www.dkilbo.com
15면 2단,경기일보,,"건강관리협회 경기도지부, SK청솔노인복지관서 배식 봉사활동 펼쳐",,,https://www.kyeonggi.com/article/20230821580133,http://www.kyeonggi.com/
2023-08-21 15:21:01,새전북신문,사회,"임실 신평 행복나눔협의체, 빨래 봉사","[          한국건강관리협회 경기도지부가 지난 18일 수원 SK청솔노인복지관을 찾아 건협사랑어머니봉사단과 함께 배식 봉사활동을 한 후 기념촬영을 하고 있다. 건강관리협회 제공      한국건강관리협회 경기도지부(본부장 김계환, 이하 건협 경기도지부)는 최근 수원 SK청솔노인복지관을 찾아 건협사랑어머니봉사단과 함께 배식 봉사활동을 펼쳤다고 21일 밝혔다.   지난 18일 열린 행사에서 건협 경기도지부 임직원과 건협사랑어머니봉사단은 어르신들의 편안한 식사를 위해 직접 배식을 하고 건강과 안부를 물으며 소통하는 시간을 가졌다.   한편 건협 경기도지부는 ‘국민 모두가 건강한 사회’를 실현하고자 지역사회 여러 기관과 연계해 정기적인 봉사활동 외에도 의료 소외계층을 위한 무료 건강검진, 물품 및 성금 기탁 등 다양한 사회공헌사업을 펼치고 있다. ]",[],http://sjbnews.com/news/news.php?number=790465,https://n.news.naver.com/mnews/article/666/0000019267?sid=102
2023.08.29.,KTV국민방송,,노인일자리 100만 개 돌파···청년 일경험 확대,,,https://www.ktv.go.kr/content/view?content_id=684358,http://www.sjbnews.com/
2023.08.22.,전남매일,,광양 약 보관함 만들기 자원봉사,,,http://www.jndn.com/article.php?aid=1692677658367882107,http://www.ktv.go.kr
2023.08.21.,뉴스핌,,"신한라이프, 임직원 봉사 캠페인 '바빠도데이' 열어",,,http://www.newspim.com/news/view/20230821000128,http://www.jndn.com
2023.08.24.,강원일보,,묵호노인종합복지관 주거환경 개선 봉사,,,https://www.kwnews.co.kr/page/view/2023082410521035502,http://www.newspim.com
2023.08.11.,뉴데일리,,"IBK證, 독거노인에 보양식 나눔봉사",,,https://biz.newdaily.co.kr/site/data/html/2023/08/11/2023081100059.html,http://www.kwnews.co.kr/
2023.08.11.,뉴데일리,,"IBK證, 독거노인에 보양식 나눔봉사",,,https://biz.newdaily.co.kr/site/data/html/2023/08/11/2023081100059.html,http://www.newdaily.co.kr/
2023.08.22.,경남매일신문,,"""환한 미소 짓는 노인 보며 봉사활동 행복해요""",,,http://www.gnmaeil.com/news/articleView.html?idxno=524928,http://www.gnmaeil.com
2023.08.25.,에너지경제,,"금호석화, 사회공헌 범위 확대…평택서 아동 돌봄 봉사",,,https://www.ekn.kr/web/view.php?key=20230825010006589,http://www.ekn.kr
