Date,Press,Category,Title,Content,Comment,URL_Origin,URL_Naver
2023-08-11 11:29:01,가톨릭평화방송·평화신문,경제,"30여년 몸에 밴 봉사, 행복한 ‘원주의 슈바이처’","[     ◆…IBK투자증권 제공IBK투자증권은 말복을 맞아 서울 시립마포노인종합복지관에서 '보양식 나눔봉사'를 실시했다고 11일 밝혔다.   IBK투자증권 나눔봉사단 10여명이 시립마포노인종합복지관 경로식당을 방문해 마포구에 거주하는 독거노인 등 취약계층에게 전복해신탕 600인분을 후원하고 배식과 배달 봉사에 참여했다.   또 지역 내 독거노인들을 위해 연말까지 월 500만원씩 총 2500만원을 경로식당에 후원하기로 했다.   IBK투자증권 관계자는 ""기록적인 폭염으로 기력이 쇠해진 독거노인들의 건강을 생각해 여름철 보양식으로 전복해신탕을 준비했다""며 ""앞으로도 지역 소외계층을 위한 봉사활동을 지속적으로 이어가며 나눔 문화를 확산하겠다""고 말했다.   IBK투자증권 나눔봉사단은 올해 하반기부터 ▲유기아동 돌봄 지원 ▲자립준비청년 지원 ▲청각 장애인 재활치료 지원 ▲초등학교 경제교실 등 전 계층을 아우르는 다양한 사회공헌활동을 추진할 계획이다.    ]",[],https://news.cpbc.co.kr/article/1111299?division=NAVER,https://n.news.naver.com/mnews/article/123/0002312992?sid=101
2023.08.17.,울산매일신문,,"서울주소방서 여성의용소방대, 서부노인복지관 배식 봉사",,,https://www.iusm.co.kr/news/articleView.html?idxno=1021690,http://web.pbc.co.kr
2023.08.17.,에너지경제,,"기업은행, 제1회 찾아가는 재능나눔 이미용 봉사 실시",,,https://www.ekn.kr/web/view.php?key=20230817010004468,http://www.ekn.kr
2023.08.21.,UPI뉴스,,[밀양 소식] 농업기금 85억 융자–한화파워시스템 노인세대 공기청정기,,,http://www.upinews.kr/newsView/upi202308210106,http://upinews.kr
2023.08.19.,중앙일보,,초고령사회에서 '노인'이 아니라 '좋은 어른'이 되는 법,,,https://www.joongang.co.kr/article/25185838,https://www.joongang.co.kr
2023-08-19 15:08:31,컨슈머타임스,사회,"공무원연금공단, 지역사회 여름나기 '배식봉사 전국 실시'","[ 우디클럽, 31일 좋은어른 아카데미 개최       좋은어른아카데미       사단법인 미래포럼(이사장 이혜경)에 참여한 전문가들이 만든 프로젝트 그룹인 우디클럽의 '좋은어른 아카데미' 첫 행사가 8월 31일 오후 3시 서울 광화문 라이나타워 지하 1층 라이나홀에서 열린다.       뇌과학자 류인균 이화여대 교수가 ‘노인기에 변화하는 뇌의 모습과 그에 적응하는 생활방식’을 주제로 강의한다. 윤현숙 한림대 사회복지학부 교수와 양선희 서울대 언론정보학과 객원교수가 늘봄밥상과 낭독극 사례를 발표한다.      현재 2호점까지 오픈한 늘봄밥상은 지역의 소외된 이웃이나 이웃을 위해 헌신하는 고마운 분들에게 지역의 봉사자들이 십시일반으로 식사를 대접하는 시민운동이다. 함께 하는 참여형 독서인 낭독 활동은 고령기의 뇌가 요구하는 ‘사회적 연결, 지적인 활동, 즐거운 대화’의 3요소를 한꺼번에 실현할 수 있는 문화 활동으로 우디클럽이 적극 추진 하는 프로그램이다. 이날 은퇴한 대기업 임원, 교육자, 예술가, 언론인 등이 함께 낭독으로 고전과 문학을 완독하는 낭독 동아리에서 준비하고 있는 오렌지낭독극단이 '이대 나온 여자'를 공연한다.      우디클럽은 ▶좋은 어른 소양 교육을 위한 ‘좋은어른 아카데미’ 개최 ▶고령인에게 유익한 각종 정보와 활동 개발 ▶여가·문화·봉사 및 사회 기여 활동 개발 ▶활동을 원하는 고령인이 쉽게 찾을 수 있는 공간 마련 ▶각종 사회활동을 연계하는 실천 운동을 추진 중이다. 31일 열리는 좋은어른 아카데미 참가 신청은 미래포럼 홈페이지(http://meerae.org)에서 할 수 있다.   ]",['개할미 깨시민만 아니면 된다'],https://www.cstimes.com/news/articleView.html?idxno=557328,https://n.news.naver.com/mnews/article/025/0003301679?sid=102
2023.08.16.,뉴스프리존,,"서울 잠실중앙교회 봉사단, 함양 수동 내백마을서 '봉사'",,,https://www.newsfreezone.co.kr/news/articleView.html?idxno=505202,http://www.cstimes.com
2023.08.18.,한국일보,,"한가빈, 연예인 봉사단 합류…어르신 위한 보양식 지원 나눔 동참",,,https://www.hankookilbo.com/News/Read/A2023081809000005202?did=NA,http://www.newsfreezone.co.kr/
2023.08.21.,경북신문,,"대한미용사회 상주시지부 미용봉사단, 장학금 기탁",,,http://www.kbsm.net/news/view.php?idx=402617,http://www.hankookilbo.com/
2023-08-18 09:17:00,경북신문,,"포항시 장량동 지사협, 취약계층에 반찬지원 봉사",[],[],http://www.kbsm.net/news/view.php?idx=402999,https://n.news.naver.com/mnews/article/469/0000755701?sid=106
2023.08.21.,백세시대,,"인천 계양구지회 소속 아름다운선율봉사단 ""연주에 맞춰 춤추는 어르신들… 보...",,,http://www.100ssd.co.kr/news/articleView.html?idxno=101656,http://www.kbsm.net
2023.08.15.,충청매일,,"충북 영동 추풍령적십자회, 홀몸노인 반찬나눔 봉사",,,https://www.ccdn.co.kr/news/articleView.html?idxno=930433,http://www.kbsm.net
2023.08.22.,동양일보,,"충주 금가면, 홀몸노인가구 70여곳 반찬",,,http://www.dynews.co.kr/news/articleView.html?idxno=717745,http://www.dynews.co.kr
2023.08.17.,미디어펜,,"기업은행, 제1회 찾아가는 재능나눔 이미용 봉사 실시",,,https://www.mediapen.com/news/view/846785,http://www.mediapen.com
2023.08.18.,장애인신문,,"전남도, 섬 지역 활력 주는 자원봉사 주목",,,http://www.welfarenews.net/news/articleView.html?idxno=93959,http://www.welfarenews.net
2023.08.25.,잡포스트,,"임실군 신평면 행복나눔협의체, 사랑의 이동 빨래 봉사",,,https://www.job-post.co.kr/news/articleView.html?idxno=83871,http://www.job-post.co.kr/
2023.08.22.,이로운넷,,"공무원연금공단, 지역사회 여름나기 배식봉사 전국 실시",,,https://www.eroun.net/news/articleView.html?idxno=36412,http://www.eroun.net
2023.08.17.,백세시대,,"대한노인회 전북 전주시지회, 곤지봉사단 '꽃밭가꾸기' 봉사활동",,,http://www.100ssd.co.kr/news/articleView.html?idxno=100388,http://www.100ssd.co.kr
2023.08.20.,쿠키뉴스,,"KB국민은행 정자동지역본부 ‘행복나눔봉사단’, JL한꿈예술단 찾아 봉사활동",,,http://www.kukinews.com/newsView/kuk202308200043,http://www.kukinews.com
2023.08.16.,기호일보,,홀몸노인 병원동행 '의원'도 OK,,,http://www.kihoilbo.co.kr/news/articleView.html?idxno=1045129,http://www.kihoilbo.co.kr/
2023.08.11.,파이낸셜뉴스,,"""보양식 드세요""...IBK證, 말복 맞이 보양식 나눔봉사 진행",,,http://www.fnnews.com/news/202308111007192289,http://www.fnnews.com/
2023-08-11 10:19:01,이코리아,경제,"신한라이프, 임직원 봉사 캠페인 '바빠도데이' 진행",[ IBK투자증권 나눔봉사단 임직원 10여명 봉사 참여     IBK투자증권 나눔봉사단이 서울 시립마포노인종합복지관 경로식당에서 배식봉사를 하고 있다. IBK투자증권 제공 [파이낸셜뉴스] IBK투자증권이 말복을 맞아 ‘보양식 나눔봉사’를 실시했다.   IBK투자증권은 지난 10일 시립마포노인종합복지관 경로식당을 방문해 독거노인 등 취약계층에게 전복해신탕 600인분을 후원하고 배식과 배달 봉사를 진행했다고 11일 밝혔다. 이번 봉사에는 IBK투자증권 나눔봉사단 10여명이 참여했다.   뿐만 아니라 지역 내 독거노인들을 위해 올 연말까지 매월 500만원씩 총 2500만원을 경로식당에 후원하기로 했다.   IBK투자증권 측은 “기록적인 폭염으로 기력이 쇠해진 독거노인들의 건강을 생각해 여름철 보양식으로 전복해신탕을 준비했다”며 “앞으로도 지역 소외계층을 위한 봉사활동을 지속적으로 이어가며 나눔 문화를 확산하겠다”고 밝혔다.   한편 IBK투자증권 나눔봉사단은 올해 하반기부터 △유기아동 돌봄 지원 △자립준비청년 지원 △청각 장애인 재활치료 지원 △초등학교 경제교실 등 다양한 사회공헌활동을 추진할 계획이다.   ],[],https://www.ekoreanews.co.kr/news/articleView.html?idxno=68697,https://n.news.naver.com/mnews/article/014/0005055937?sid=101
2023.08.11.,토큰포스트,,"IBK證, 나눔봉사단 임직원 말복 맞이 독거노인 보양식 나눔봉사 실시",,,https://www.tokenpost.kr/article-142342,https://www.tokenpost.kr
2023.08.17.,뉴스브라이트,,"IBK기업, '찾아가는 재능나눔 이미용 봉사' 실시",,,http://www.newsbrite.net/news/articleView.html?idxno=175437,http://www.newsbrite.net
2023.08.15.,경북신문,,"영천 임고면 행복학습센터, 독거노인 주거환경개선 봉사",,,http://www.kbsm.net/news/view.php?idx=401990,http://www.kbsm.net
2023.08.16.,대한경제,,김해시노인종합복지관-(주)대흥리사이클링 자원 선순환 활성화를 위한 업무협...,,,https://www.dnews.co.kr/uhtml/view.jsp?idxno=202308161706204280402,http://www.cnews.co.kr
2023.08.19.,UPI뉴스,,[밀양시 소식] 새마을회 장학금 500만원–단장면 밑반찬 자원봉사,,,http://www.upinews.kr/newsView/upi202308180067,http://upinews.kr
2023.08.08.,뉴시스,,"광주은행, 말복 맞이 전복삼계탕 1600분 무료 배식 봉사",,,http://www.newsis.com/view/?id=NISX20230808_0002406588&cID=10809&pID=10800,http://www.newsis.com
2023-08-08 14:40:09,뉴시스,사회,"한국증권금융, 말복 맞아 취약계층 노인 삼계탕 나눔 행사","[     [광주=뉴시스] 고병일 광주은행장 등 임원들이 8일 광주 남구 노대동에 위치한 빛고을노인건강타운 구내식당에서 무료배식 봉사활동을 펼쳤다.[광주=뉴시스] 배상현 기자 = 광주은행(은행장 고병일)은 8일 광주 남구 노대동에 위치한 빛고을노인건강타운 구내식당에서 무료배식 봉사활동을 펼쳤다고 밝혔다.광주은행은 최근 역대급 폭염으로 인해 온열질환자가 폭증하고 있는 가운데 노인복지시설 어르신들의 건강과 기력 회복을 위해 말복맞이 전복삼계탕 1600인분을 정성스럽게 대접했다.이날 봉사활동에는 고병일 광주은행장과 임직원 30여명이 함께했으며, 이귀순 광주시의회 부의장을 비롯한 15명의 시의원들이 동참하며 뜻깊은 봉사의 의미를 나눴다.삼계탕 배식 후에는 부채를 전달하며 무더위를 잘 이겨내시라는 인사와 함께 어르신들의 건강한 여름나기를 응원했다.고병일 광주은행장은 “무더위에 취약한 지역 어르신들이 건강한 여름을 보내시길 바라며 정성스럽게 준비한 이번 배식 봉사활동이 어르신들에게 큰 위로와 힘이 되길 바란다”며 “앞으로도 광주·전남 대표은행으로서 지역의 소외계층을 위한 봉사활동을 지속적으로 이어나가 나눔 봉사의 기업문화를 지역사회에 전파하겠다”고 말했다. ]",[],http://www.newsis.com/view/?id=NISX20230810_0002410042&cID=15001&pID=15000,https://n.news.naver.com/mnews/article/003/0012019886?sid=102
2023.08.14.,아시아투데이,,"충북교육청사랑나눔봉사단, 여름나기 갈비탕 나눔 행사 펼쳐",,,https://www.asiatoday.co.kr/view.php?key=20230814010006868,http://www.newsis.com
2023-08-10 16:12:08,약업신문,경제,"동국제약 인사돌플러스 사랑봉사단, 폐지 수집 노인위한 페이퍼 캔버스 제작","[     [서울=뉴시스] 강수윤 기자 = 한국증권금융 꿈나눔재단은 말복을 맞아 사회복지법인 안나의 집에 한마음 봉사단과 함께 홀몸 어르신, 노숙인 등 취약계층 500여명에게 삼계탕 나눔 행사를 열었다고 10일 밝혔다.이번 행사는 말복을 맞아 노인들의 건강한 여름나기를 응원하기 위해 마련됐다. 윤창호 이사장과 한마음 봉사단은 안나의 집 무료급식소에서 삼계탕과 여름제철과일, 떡 등을 직접 배식했다. 한국증권금융 꿈나눔재단은 매년 소외된 이웃과 취약계층을 위해 삼계탕 등 건강먹거리를 지속적으로 후원하고 있다.윤 이사장은 ""연일 지속되는 폭염에 지치신 어르신들이 삼계탕을 드시고 무더운 여름을 건강하게 이겨내실 수 있기를 바란다""며 ""앞으로도 나눔이 필요한 사회 곳곳에 세심한 관심과 지원을 지속적으로 이어갈 계획""이라고 말했다. ]",[],http://www.yakup.com/news/index.html?mode=view&cat=12&nid=284245,https://n.news.naver.com/mnews/article/003/0012025436?sid=101
2023.08.15.,뉴시스,,"호산대, 우즈벡 타슈켄트서 전공 연계 봉사활동 전개",,,http://www.newsis.com/view/?id=NISX20230814_0002412810&cID=10810&pID=10800,http://www.asiatoday.co.kr
2023.08.16.,무등일보,,더힐링예술봉사단 광복절기념 문화예술공연 펼쳐,,,http://www.mdilbo.com/detail/PvZvQf/700997,http://www.mdilbo.com
2023.08.16.,데일리한국,,"김순호 구례군수, 여름철 취약가구에 봉사활동 펼쳐",,,https://daily.hankooki.com/news/articleView.html?idxno=989291,http://daily.hankooki.com
2023.08.14.,경상일보,,남목노인복지관 '말복데이'행사,,,https://www.ksilbo.co.kr/news/articleView.html?idxno=977330,http://ksilbo.co.kr
2023.08.20.,동양일보,,청주시 4개구 행정·봉사 각양각색,,,http://www.dynews.co.kr/news/articleView.html?idxno=717514,http://www.dynews.co.kr
2023.08.17.,CEO스코어데일리,,"IBK기업은행, 장애인·고령층 이미용 봉사 후원",,,https://www.ceoscoredaily.com/page/view/2023081716042484819,http://www.ceoscoredaily.com
2023.08.14.,대한급식신문,,"충북교육청봉사단, 갈비탕 나눔 행사",,,http://www.fsnews.co.kr/news/articleView.html?idxno=49803,http://www.fsnews.co.kr
2023.08.24.,경상매일신문,,"영천시의회, 노인 생명 구한 집배원에 표창패",,,http://www.ksmnews.co.kr/default/index_view_page.php?idx=441035&part_idx=7,http://www.ksmnews.co.kr
2023.08.16.,불교공뉴스,,대한노인회 속초시지회 소속 은손봉사단 양말목매트 190개 전달,,,http://www.bzeronews.com/news/articleView.html?idxno=620753,http://www.bzeronews.com
2023.08.18.,OSEN,,"한가빈, '오케이 좋아 연예인 봉사단' 합류..곰탕 600 그릇 나눔 봉사 참여",,,http://www.osen.co.kr/article/G1112165624,http://www.osen.co.kr
2023-08-18 10:18:00,위키트리,,"김동근 의정부시장, 흥선노인복지관 효나눔 급식봉사 동참",[],[],https://www.wikitree.co.kr/articles/877615,https://n.news.naver.com/mnews/article/109/0004910055?sid=106
2023.08.21.,더퍼블릭,,"신한라이프, 임직원 봉사의 날 ‘바빠도DAY’ 캠페인 매월 운영...기업의 사회...",,,https://thepublic.kr/news/view/1065581089270165,http://www.thepublic.kr/
2023.08.25.,전국매일신문,,무더위에 방호복 입고 봉사활동 나선 통장 화제,,,https://www.jeonmae.co.kr/news/articleView.html?idxno=977297,http://www.jeonmae.co.kr/
2023.08.22.,국제뉴스,,"김재윤 금정구청장, 재능기부 자원봉사자들과 '소통간담회' 마련",,,https://www.gukjenews.com/news/articleView.html?idxno=2792293,http://www.gukjenews.com/
2023.08.18.,디지털타임스,,"유타대 아시아캠퍼스, 송도 노인복지관과 업무협약 체결",,,https://www.dt.co.kr/contents.html?article_no=2023081802109954083001&ref=naver,http://www.dt.co.kr/
2023-08-18 10:08:06,인천일보,사회,의정부시발전협의회 등 흥선노인복지관에서 급식 봉사,"[ ""지역사회 공헌 및 봉사 프로그램 지원""    그레고리 힐(왼쪽) 유타대 아시아캠퍼스 대표와 조병혁 송도노인복지관 관장이 업무협약식을 맺고 기념촬영을 하고 있다.     유타대학교 아시아캠퍼스(대표 그레고리 힐)는 송도 노인복지관과 업무협약을 체결했다고 18일 밝혔다.지난 17일 인천 송도노인복지관에서 진행된 이번 행사에는 그레고리 힐 유타대 아시아캠퍼스 대표와 조병혁 송도노인복지관 관장, 박민협 인천 연수구 의원 등 양 기관 관계자 10여 명이 참석했다.두 기관은 이번 협약으로 지역사회 공헌 및 봉사 프로그램 지원을 위한 다양한 프로그램을 공동 운영하기로 했다.그레고리 힐 유타대 아시아캠퍼스 대표는 ""이번 업무협약으로 송도노인복지관과 함께 할 기회를 갖게 되어 영광""이라며 ""학생들에게 송도와 연수구 지역사회에 보답할 수 있는 좋은 기회와 유익한 협력관계를 기대한다""고 밝혔다. 유타대학교 아시아캠퍼스는 173년 이상의 역사를 지닌 세계 100위권(글로벌 대학 평가기관 QS 선정) 연구 중심의 미국 유타대의 확장형 캠퍼스로 지난 2014년 인천 송도국제도시에 개교해 운영 중이다. ]",[],https://www.incheonilbo.com/news/articleView.html?idxno=1206856,https://n.news.naver.com/mnews/article/029/0002819993?sid=102
2023.08.16.,UPI뉴스,,[함양군 소식] 영유아 부모교육–수동면 내백마을서 잠실중앙교회 봉사,,,http://www.upinews.kr/newsView/upi202308160047,http://news.itimes.co.kr
2023.08.08.,한국경제,,"광주은행, 말복맞이 무료배식 봉사활동 펼쳐",,,https://www.hankyung.com/society/article/202308084458h,http://upinews.kr
2023.08.21.,충청일보,,"예산군 광시면새마을남녀지도자협의회, 사랑의 집 고치기 봉사 진행",,,https://www.ccdailynews.com/news/articleView.html?idxno=2223135,http://www.hankyung.com/
2023-08-08 16:22:01,중도일보,사회,"아산시, 나눔터봉사단과 '취약계층 냉.난방기 클리닝 서비스' 업무 협약","[ 광주 빛고을노인건강타운서 전복삼계탕 1600인분 봉사    광주은행 임직원이 8일 광주 빛고을노인건강타운에서 삼계탕 배식 봉사활동을 펼친 뒤 기념사진을 찍고 있다. 광주은행 제공광주은행은 말복을 앞두고 광주 빛고을노인건강타운에서 무료 배식 봉사활동을 펼쳤다고 8일 밝혔다.광주은행 임직원은 이날 노인복지시설을 방문한 이들을 위해 전복삼계탕 1600인분을 준비해 배식했다.봉사활동에는 고병일 광주은행장 및 임직원 30여 명과 함께 이귀순 광주시의회 부의장 등 시의원 15명이 동참했다.광주은행은 매년 여름 광주·전남 지역의 노인복지시설을 방문해 지역 고연령자를 대상으로 보양식을 접대하는 배식 봉사활동을 진행하고 있다.지난 초복과 중복에도 전남 순천시의 조곡무료급식소와 광주 동구노인종합복지관에서 전복삼계탕 배식 봉사활동을 펼쳤다.고 은행장은 ""정성스럽게 준비한 배식 봉사활동이 어르신들에게 큰 위로와 힘이 되길 바란다""며 ""광주·전남 대표은행으로서 지역의 소외계층을 위한 봉사활동을 지속해서 이어 나가겠다""고 말했다.광주=임동률 기자 ]",[],http://www.joongdo.co.kr/web/view.php?key=20230831010009221,https://n.news.naver.com/mnews/article/015/0004877480?sid=102
2023.08.13.,충청타임즈,,김문근 단양군수 노인복지관 배식봉사,,,http://www.cctimes.kr/news/articleView.html?idxno=763543,http://ccdailynews.com
2023.08.03.,대한경제,,"신한銀, 독거 노인들에게 ‘무더위 극복’ 키트 전달",,,https://www.dnews.co.kr/uhtml/view.jsp?idxno=202308031428434800531,http://www.cnews.co.kr
2023.08.16.,백세시대,,"대한노인회 제주 서귀포시지회, 여성봉사단 급식 봉사활동 펼쳐",,,http://www.100ssd.co.kr/news/articleView.html?idxno=101467,http://www.100ssd.co.kr
2023.08.21.,충남일보,,"공주시 금학동 새마을회, 밑반찬 나눔 봉사 실천",,,http://www.chungnamilbo.co.kr/news/articleView.html?idxno=730518,http://www.chungnamilbo.co.kr
2023.08.22.,인천일보,,"안산시 일동, OLG국제로타리클럽과 장애인·홀몸노인 집 LED 교체, 안전봉 설...",,,https://www.incheonilbo.com/news/articleView.html?idxno=1208019,http://news.itimes.co.kr
2023.08.21.,신아일보,,"대한적십자사 태백지구협, '뽀송뽀송 이동세탁' 봉사활동 진행",,,http://www.shinailbo.co.kr/news/articleView.html?idxno=1748248,http://www.shinailbo.co.kr/
2023.08.16.,동양일보,,"청주노인복지센터, '무더위 쉼터' 운영하며 정서지원 프로그램 지원",,,http://www.dynews.co.kr/news/articleView.html?idxno=717140,http://www.dynews.co.kr
2023.08.23.,백세시대,,"대한노인회 충남 서산시지회 송송랜드봉사단, 요양원서 공연봉사 활동",,,http://www.100ssd.co.kr/news/articleView.html?idxno=101224,http://www.100ssd.co.kr
2023.08.22.,더퍼스트,,"[단신] 공무원연금공단, 지역사회 여름나기 배식봉사 전국 실시 外 2건",,,http://www.thefirstmedia.net/news/articleView.html?idxno=125176,http://www.thefirstmedia.net
2023.08.14.,뉴시스,,"남부발전 신세종빛드림건설본부, 노인 일자리 창출 지원",,,http://www.newsis.com/view/?id=NISX20230814_0002413138&cID=10401&pID=10400,http://www.newsis.com
2023-08-14 11:34:07,경기신문,경제,"[창간특집] 기부와 봉사로 지역사회를 받쳐주는 기둥, '경희대학교 테크노경영...","[ 유관기관과 취약계층 생활복지 서비스 지원 업무협약    [세종=뉴시스]한국남부발전 신세종빛드림건설본부가 취약계층 지원 노인 일자리 창출 업무협약 체결했다.(사진=한국남부발전 제공) *재판매 및 DB 금지[세종=뉴시스]손차민 기자 = 한국남부발전 신세종빛드림건설본부가 공공 세탁방을 운영하여 노인 일자리 창출에 나선다.14일 남부발전에 따르면 신세종빛드림건설본부는 지난 10일 세종시 연기면사무소에서 연기면사무소, 한국노인인력개발원 세종충북지사, 세종시니어클럽과 함께 '취약계층 생활복지서비스 지원 노인일자리 창출 사업 업무협약'을 체결했다.이번 사업을 통해 연기면 복지회관 내 세탁방이 설치된다.연기면 7개리의 독거노인을 포함한 취약계층을 대상으로 무료로 세탁물 수거부터 세탁, 배송을 하게 된다.배송 시 자원봉사자들이 수혜 가정을 방문해 건강을 살펴보는 통합 서비스도 제공한다.윤상옥 남부발전 신세종빛드림건설본부장은 ""이번 협약으로 지역사회의 일원으로서 책임감을 가지고 지역 상생에 도움이 되는 부분은 적극 협력해 나가겠다""며 ""앞으로도 지역사회의 현안들을 함께 소통, 해결해 나감으로써 국민에게 신뢰받는 대표 공기업으로 사회적 책무를 다하겠다""고 말했다. ]",[],https://www.kgnews.co.kr/news/article.html?no=759441,https://n.news.naver.com/mnews/article/003/0012030053?sid=101
2023.08.24.,경기신문,,"[창간특집] 기부와 봉사로 지역사회를 받쳐주는 기둥, '경희대학교 테크노경영...",,,https://www.kgnews.co.kr/news/article.html?no=759441,http://www.kgnews.co.kr/
2023.08.14.,매일경제,,"한국남부발전 신세종빛드림건설본부, 취약계층 지원 노인 일자리 창출 업무협...",,,https://www.mk.co.kr/article/10807378,http://www.mk.co.kr/
2023-08-14 10:54:01,스마트경제,경제,"기업은행, 제1회 찾아가는 재능나눔 이미용 봉사 실시","[      세종특별자치시 연기면사무소 대회의실에서 관계기관들과 함께 업무협약을 체결하고 있다. [사진 = 한국남부발전]한국남부발전 신세종빛드림건설본부는 지난 10일 세종특별자치시 연기면사무소 대회의실에서 연기면사무소, 한국노인인력개발원 세종충북지사, 세종시니어클럽과 ‘취약계층 생활복지서비스 지원 노인일자리 창출 사업 업무협약’을 체결했다고 14일 밝혔다.이날 협약식은 4개 기관이 협력체계를 구축해 지역 인구감소와 고령화로 인해 발생되는 사회적 문제를 함께 해결하고 복지 사각지대에 놓인 노인들의 복지 향상을 위해 마련됐다.이들 기관은 협약에 따라 연기면 복지회관 내 세탁방을 설치해 거동이 불편한 연기면 7개 리의 독거노인을 포함한 취약계층을 대상으로 무료로 세탁물 수거에서 세탁, 배송은 물론 배송 시 자원봉사자와 함께 수혜 가정을 방문, 건강 등을 살펴보는 통합 서비스를 제공할 예정이다.윤상옥 신세종빛드림건설본부장은 “이번 협약으로 지역사회의 일원으로서 책임감을 가지고 지역 상생에 도움이 되는 부분은 적극 협력해 나가겠다”라며 “앞으로도 지역사회의 현안들을 함께 소통, 해결해 나감으로써 국민에게 신뢰받는 대표 공기업으로 사회적 책무를 다하겠다”고 말했다. ]",[],https://www.dailysmart.co.kr/news/articleView.html?idxno=76378,https://n.news.naver.com/mnews/article/009/0005172388?sid=101
2023.08.25.,전라일보,,"익산시북부노인종합복지관, 무더위 대응 시원한 음료 제공",,,http://www.jeollailbo.com/news/articleView.html?idxno=703021,http://www.dailysmart.co.kr
