Date,Press,Category,Title,Content,Comment,URL_Origin,URL_Naver
2023-08-06 12:11:00,민주신문,정치,"마포구, 효도밥상 전 동으로 확대... ""초고령화시대 보편적 노인복지 필요""","[ 김은경 “정치 언어 몰랐다”에장예찬 “모르는 분이 뭔 혁신”70대 민주당 지지도 6%p ↓     3일 용산 대한노인회 중앙회에서 김호일 회장이 노인폄하 발언 사과를 위해 방문한 더불어민주당 김은경 혁신위원장과 면담 중 위원장의 뺨 대신 사진을 때리고 있다. [사진 = 국회사진기자단]더불어민주당이 김은경 민주당 혁신위원장의 ‘노인폄하’ 발언으로 진땀을 빼고 있다. 내년 총선을 앞두고 노년층 표심이 이탈할 우려가 나오는 가운데, 김 위원장의 사과에도 논란이 사그라지지 않는 모습이다. 이런 가운데 국민의힘과 정부는 전국 경로당에 냉방비 지원을 약속하는 등 ‘어르신 표심’ 잡기에 나서며 민주당과 차별화를 두고 있다.4일 정치권에 따르면 김은경 위원장의 ‘노인폄하’ 발언으로 민주당이 후폭풍을 맞는 분위기다. 김 위원장은 대한노인회를 찾아 부랴부랴 사과했으나 이마저도 ‘진정성이 없다’는 지적이 나오고 있다.김 위원장은 지난 3일 서울 용산구에 있는 대한노인회를 방문해 자신의 발언에 대해 사과하고 고개를 숙였다.그는 “이게 이렇게까지 비화할 것이라고는 예상 못했다”며 “부족함이 분명히 있었던 것 같다. 어르신들에 대해서 공경하지 않는 마음을 갖고 산 적은 없다”고 사과했다.김호일 대한노인회 회장은 김 위원장의 사과를 받긴 했지만, 그 과정에서 김 위원장 사진을 손바닥으로 내려쳤다. 이른바 ‘사진 따귀’였다.김 회장은 “우리나라 천만 노인을 대표해서 내가 볼때기라도 때려야 노인들 분이 풀릴 것 같은데 손찌검하면 안 되니 사진이라도 때리겠다”며 이같은 행동을 했다.     더불어민주당 김은경 혁신위원장이 3일 용산 대한노인회 중앙회에서 김호일 회장 면담 후 노인폄하 발언을 사과하고 있다. [사진 = 국회사진기자단]당초 김 위원장은 자신의 발언에 문제가 없다고 주장했다. 노인 폄하 의도가 없었다는 점을 강조하면서 사과를 미뤄왔다.민주당 혁신위 역시 김 위원장의 발언에 대해 “사과할 일이 아니다”고 해명했다. 김 위원장의 발언이 ‘노인 폄하’라는 지적이 나오는 데 대해 “여명(남은 수명) 비례투표에 대해서 이런 일은 있을 수 없다고 선을 그은 것”이라며 두둔에 나선 것이다.김기현 국민의힘 대표는 김 위원장이 노인 비하 발언 논란에 대해 사과한 것과 관련 “마지못해 사과하는 시늉을 한들 단지 말뿐인데, 그게 무슨 의미가 있나”라고 비판했다.장예찬 국민의힘 최고위원 역시 “교수라서 정치언어를 잘 모르고 깊게 숙고하지 못한 어리석음이 있었다. 어르신들이 노여움을 푸셨으면 한다”고 사과한 김 위원장을 향해 “정치언어도 잘 모르는 분이 왜 정당에서 정치 혁신하는 역할을 하냐”며 지적하기도 했다.민주당의 ‘노인 폄하’ 논란에 70대 유권자의 지지율이 떨어졌다는 여론조사 결과도 나왔다.엠브레인퍼블릭, 케이스탯리서치, 코리아리서치, 한국리서치가 진행한 전국지표조사(NBS)에 따르면 70세 이상 연령층의 민주당 지지도는 2주 전 17%에서 6%p 하락한 11%로 급감했다.반면 국민의힘은 민주당의 실책을 지렛대 삼아 ‘어르신 표심’ 공략에 나섰다.     국민의힘 윤재옥 원내대표가 폭염 대비 무더위심터 현장 점검을 위해 3일 오전 서울 종로구 동원경로당을 방문해 인사말을 하고 있다. [사진 = 공동취재]국민의힘은 폭염 대책을 위한 전국 6만8000여개 경로당에 10만원씩 냉방비를 특별 지급하기로 했다. 연일 무더위가 계속되는 가운데 취약계층에 냉방비를 지급하겠다는 취지다.윤재옥 원내대표는 서울 종로구 동원경로당 무더위 쉼터를 찾아 노인들과 소통했다. 윤 원내대표는 지역 어르신들과 대한노인회, 종로 노인회 관계자들과 잇달아 간담회를 했다.그는 “날이 하도 덥고 어르신들이 경로당에 이렇게 와 계시는 데 불편한 건 없는지 걱정도 되고 해서 오늘 찾아뵙고 인사드리러 왔다”고 말했다.그러면서 “어르신들 희생과 노력이 지금의 대한민국을 만들었다는 생각을 늘 염두에 두고 최선을 다해 잘 모시도록, 또 불편함 없도록 잘 챙기겠다”고 약속했다.이날 함께 자리한 오세훈 서울시장도 “더워서 밤잠 못 주무시면 여기서 편하게 냉방비 아끼지 말고 에어컨 빵빵하게 트시라”며 “부족하면 저희가 하겠다. 여름을 잘 나셔야 겨울도 잘 나니 건강 잘 지키시라”고 했다.박대출 정책위의장은 진주시 종합사회복지관에서 어르신 점심 배식봉사에 참여하고, 지역 경로당을 곳곳을 찾아 무더위에 취약한 어르신들의 안부를 살폈다.또한 자신의 페이스북에 “국민의힘은 경로당에서 무더운 여름 시원하게 나시라고, 냉방비 단가를 1만원 올렸다”며 “사회복지시설인 경로당에 대해서는 전기요금 ‘복지할인’을 적용해 사용요금의 30%가 자동 할인되기도 한다”고 설명했다. ]","['김은경을 보면 \'민주당스럽다\'는 말이 절로 떠오른다. \n처음에는 \'사과할 일 아냐\', 다음에는 \'유감 표명\', 이후에는 \'죄송하다\', 그리고 엊그제는 \'농담이었다\'.. 버티다, 사태 안 좋으니 미안한 척, 표 깎일 것 같으니 죄송한 척, 그리고 끝으론 오리발.. 누구보다 정치를 잘 아는 능구렁이.. 게다가 자리에, 3억 다 누리고, 이제 와서 ""치욕스러웠다""며, 자신이 몸 담은 곳 욕하고.. 참, \'민주당스럽다\'.. 그러면서 누가 누굴 개혁하겠다니ㅉㅉ.. 이게 민생법안 통과율 7% 민주당의 현주소다.. #No민주당', '김은경 시누이님 글 방금 읽었는데 진짜 놀람 왜 저렇게 미련하게 버틸까 의아했는데 글 읽으니 이해감 ㅋㅋㅋㅋㅋ', '사진 따귀   때렸다고     열받았다는\n      더민당     당원들..\n     김은경 시누이    폭로 글      읽어보니\n        사진따귀 가    아니라 \n      당장이라도     능지처참   시켜야 할\n       미물  이더군...    악녀가     따로  없다\n      김은경 은     그냥      악녀!!!', '', '', '인터넷에 김은경  자살한 남편의 여동생이  폭로한 편지글  며칠전부터 올라오는데, 그것보니, 김은경이는  인간이 아니던데, 무슨 혁신을해! 그녀의 가정사를 통해 김은경의 인성 이 놀라울뿐. 다들 인터넷에  올라온 글 읽어보세요', '', '김은경 폐륜 시누이가 폭로한 2006년 남편 사망후 18년 동안 시부모에게 한짓거리는, 이재명이 친형, 형수한테 한짓거리와 대동소이함.', '남편 자살시키고  시부모 화병으로 죽게 만들고 재산까지 꿀꺽, 죄명이 눈엔 롤 모델로 보였나보다~', '그래도 전라도 노인들은 모른척 또 찢가 찍겠지.', '', '', '', '', '김은경을 임명한 이재명이 모든 책임을 지고 정치판을 떠남이 마땅하다. 찌질하게 숨지말아라.', '사진 맞았다고 명예훠손 고소해야지. 안그래? 민주당?', '절라도가 라도를 개혁한다고???. 개웃기고 있네', '미국의 시누이글에 따르면 이여자는 근본이 의심스런 짝퉁일거 같은데....  자기시부모한테 했다는거 읽어보니 모든것이 누구처럼 거짓투성이 아닌가? 서방잡고 시아버지까지 아들과 같은방식으로 돌아가시게 했다고 까논거보니 역시나 ㅂ찢 추행당 스럽다.', '2년이거 인간도 아닙니다! 시누이 글이 참! 경악스럽다', '민주당 총선 앞두고 계속 악수만 두고 있네. 말은 한번 나가면 돌이킬 수가 없다.', '시부모에게 악담.행폐?...남편자살?', '은경이는 원래부터 못된 며느리였습니다.', '', '민주당이야 원래 정신 못차리고 수권능력도 없다만 민주당 깐다고 국힘이 잘함다는건 일도 없고 국힘은 논할 가치가 없는 친일 매국. 집단에 무능력 무뇌 무대뽀 반민주 반민족 집단인거 아니라 말할수 있나', '평소에 해라', '악마의 화신.', 'ㅋㅋㅋㅋㅋ 죽어야될것들이아직도어른입네꼴깝떠는이나라는저것들다뒈지기전엔희망이없다', '', '참 얄팍하군...그나저나 국힘이 저런 사과라도 하는 걸 보고싶다.', '', '', '위원장실수를 국민혈세로 무마하지말고 책임자사비로해결하라.국민혈세 제돈처럼 생색래고있어.사퇴하라', '역시     인상은     속일수없다', '', '민주당 DNA가 원래 그런걸 어쩌나.    자기들만의 인권과 자기들만의 패거리정치.  국민은 오로지 선전선동 대상.  권력유지의 필요성으로서만 존재하는게 국민이라 생각하는  이념주의자들.   대한민국을 썩게 만드는 정치인들 사라져야한다.', '노인네들 국힘이지', '더부러 폐륜당 코인당 돈봉투당 공산당 투기당  왜이리 민주당은 별명이 많냐?', '틀딱들 표 받을라고 애쓴다 ㅋㅋ 이러니 나라 수준이 밑바닥이지 쯧쯧', '하는 방식이 조라 얍삽하다.고무신 막걸리 사고방식 어디 안갔네', '국민의힘은 노인들 없으면 끝이지. .', '', '청년들 미래는 청년이 결정하는 것이 맞다', '꼰대들 세상 주~~~욱 가즈아!', '어르신이고 다좋은데 사과하러간 안전에서 무슨 사진따귀 연륜인지 맘 가다가도 짜증확나네  노인회 회장인지 나이먹고도 저러는데 무슨존경심이고 공경심이 ....저러니 재수없음 나이먹고 더러운꼴 당하지  가만있어도 덥고 짜증나는데 씰데없는 소리하는 시누나 그걸 제대로 받아서 나이답게훈계도 제대로 못하며 이상한 제잘난맛 코스프레 하는할배나..', '', '국짐당\n국짐당\n지지하는 인간들\n부디 열사병 걸리기를', '본인들이 세금 2배로 올리고 냉바으비 30프로 할인 쏜다고??? 70대 이상 노인들이 냉난방비 감당할정도로 직장 다니는 분들이냐??', '국힘 세금이 니들 쌈지돈이야?????\n노인 잘모셔라!!! 폐륜당!! 아우ㅛ', '냉방비? 그거 내가 낸 세금인데, 왜 니들 맘대로 써? 우리 피 같은 세금이 니네 표 얻으려고 선심 쓰는데 쓰이는 거 절대 반대한다. 철회해라~']",http://www.iminju.net/news/articleView.html?idxno=90652,https://n.news.naver.com/mnews/article/009/0005168761?sid=100
2023.08.23.,인천in,,"인천미림극장, 아이다움봉사단과 업무협약",,,http://www.incheonin.com/news/articleView.html?idxno=97035,http://www.iminju.net/
2023.08.14.,시민일보,,"노원구, 노인들 위한 연희마당놀이 '마들·뻉파' 무료 공연 선보여",,,https://www.siminilbo.co.kr/news/newsview.php?ncode=1160280433265960,http://www.incheonin.com
2023.08.16.,퍼블릭뉴스,,"[장성군 소식] 장성군 북일나눔회, 복숭아 44박스 기탁…경로당, 노인시설에 ...",,,https://www.psnews.co.kr/news/articleView.html?idxno=2030465,http://www.siminilbo.co.kr
2023.08.22.,전국매일신문,,"인천중구자원봉사센터 사나래봉사단, LED등 교체 활동 진행",,,https://www.jeonmae.co.kr/news/articleView.html?idxno=976706,http://www.psnews.co.kr
2023.08.17.,경북신문,,"울진 후포면 지사협, 사랑의 집수리 후원 봉사",,,http://www.kbsm.net/news/view.php?idx=402307,http://www.jeonmae.co.kr/
2023.08.20.,조세금융신문,,"금감원, 11기 대학생 금융교육봉사단 출범…2년간 활동",,,https://www.tfmedia.co.kr/news/article.html?no=148903,http://www.kbsm.net
2023.08.02.,베리타스알파,,부산보건대 사하사랑채노인복지관의 '열무김치에 반하다'로 지역사회 봉사활동...,,,http://www.veritas-a.com/news/articleView.html?idxno=467417,http://www.veritas-a.com
2023.08.09.,백세시대,,"대한노인회 충남 예산군지회 신태양봉사단, 생필품 꾸러미 전달",,,http://www.100ssd.co.kr/news/articleView.html?idxno=101098,http://www.100ssd.co.kr
2023.08.16.,신아일보,,당진경찰서 청소년 정책자문단 직업체험·봉사활동 실시,,,http://www.shinailbo.co.kr/news/articleView.html?idxno=1746376,http://www.shinailbo.co.kr/
2023.08.02.,울산제일일보,,"""연주실력 쌓아 공연 자원봉사 꾸준히 할 예정""",,,http://www.ujeil.com/news/articleView.html?idxno=331381,http://www.ujeil.com/
2023.08.08.,뉴스워커,,"광주은행, '말복 맞이 배식 봉사활동' 펼쳐",,,http://www.newsworker.co.kr/news/articleView.html?idxno=215916,http://www.newsworker.co.kr
2023.08.20.,충청매일,,"충남적십자사, 마을 맞춤형 지원 봉사활동'태안을 태안(泰安)하게'진행",,,https://www.ccdn.co.kr/news/articleView.html?idxno=931214,http://www.ccdn.co.kr
2023.08.17.,아시아투데이,,"김철수 제 31대 대한적십자사 신임회장 ""봉사자 소명의식으로 인도주의 활동에...",,,https://www.asiatoday.co.kr/view.php?key=20230817010008556,http://www.asiatoday.co.kr
2023.08.11.,스마트투데이,,"IBK투자증권, 독거노인에 말복 맞이 보양식 나눔봉사",,,https://www.smarttoday.co.kr/news/articleView.html?idxno=33551,https://www.smarttoday.co.kr/
2023.08.18.,경상일보,,"울산 서울주소방서 의용소방대, 급식 봉사 활동 실시",,,https://www.ksilbo.co.kr/news/articleView.html?idxno=977700,http://ksilbo.co.kr
2023.08.17.,울산신문,,현대차 신입사원 봉사활동 나서,,,https://www.ulsanpress.net/news/articleView.html?idxno=510543,https://www.ulsanpress.net/
2023.08.17.,울산신문,,현대차 신입사원 봉사활동 나서,,,https://www.ulsanpress.net/news/articleView.html?idxno=510543,https://www.ulsanpress.net/
2023.08.17.,경상매일신문,,"울진 후포면 지사협, 사랑의 집수리 후원 봉사",,,http://www.ksmnews.co.kr/default/index_view_page.php?idx=440318&part_idx=266,http://www.ksmnews.co.kr
11면 1단,강원일보,,"[포토뉴스] 횡성서원부녀회, 취약계층 반찬봉사",,,https://www.kwnews.co.kr/page/view/2023081609041337497,http://www.kwnews.co.kr/
2023-08-16 17:06:01,뉴스프리존,사회,"대구보건대 사회복지학과, 지역사회 노인과 성인 대상 'My Life Jump-up' 과정...",[     횡성 서원면부녀회(회장:김남희) 회원들이 16일 홀로 사는 지역 취약계층 노인 75가구에 정성껏 마련한 삼계탕 도시락을 준비해 전달하고 위로했다. ],[],https://www.newsfreezone.co.kr/news/articleView.html?idxno=505518,https://n.news.naver.com/mnews/article/087/0000989131?sid=102
2023.08.14.,에너지데일리,,"남부발전 신세종빛드림건설본부, 취약계층 지원 노인 일자리 창출 협력",,,http://www.energydaily.co.kr/news/articleView.html?idxno=139288,http://www.newsfreezone.co.kr/
2023.08.02.,베타뉴스,,"부산보건대, 사하사랑채노인복지관의 ‘열무김치에 반하다’로 지역사회 봉사",,,http://www.betanews.net:8080/article/1429178.html,http://www.energydaily.co.kr
2023.08.08.,헤럴드경제,,광양제철소 직원들 불볕더위 속 사회봉사활동 구슬땀,,,http://news.heraldcorp.com/view.php?ud=20230808000082,http://www.betanews.co.kr
2023.08.16.,전기신문,,세종지역 노인 일자리 창출 '힘 보태',,,https://www.electimes.com/news/articleView.html?idxno=324465,http://www.heraldbiz.com/
2023-08-08 08:47:03,뉴스락,사회,"[함께가자 우리ESG] IBK투자증권, 독거노인에 말복 맞이 보양식 나눔봉사 실시",[ 다채롭고 꼭 필요한 봉사 이웃사랑 실천    광양제철소 촛불사랑봉사단원들이 지난 주말 옥곡노인요양원을 찾아 잡초 제거 작업에 구슬땀을 흘리고 있다.[헤럴드경제(광양)=신건호 기자] 포스코 광양제철소(소장 이진수) 직원들이 연일 계속되는 폭염에 지쳐 있는 소외된 이웃들을 위해 사회봉사 활동에 구슬땀을 흘리고 있다.8일 광양제철소에 따르면 ‘봉사와 나눔’이라는 포스코 고유의 나눔문화를 적극 실천하자는 취지에서 광양제철소는 2004년부터 매월 셋째주 토요일을 ‘나눔의 토요일’(이하 나눔토)로 정하고 정기적인 봉사활동을 실시해 오고 있다.'나눔토' 회원들은 낮 최고 기온이 36도에 달하며 더위가 기승을 부린 지난 토요일에도 중마사랑주간보건센터 요양원을 방문해 △발 마사지 △족욕 △아로마 오일 및 로션 바르기 △말동무 돼 드리기 등의 활동을 펼치며 어르신들과 따뜻함을 나눴다.광양제철소 촛불사랑 봉사단은 광양시 옥곡노인요양원에 모여 직접 준비한 예초기를 짊어지고 한 여름 무성해진 잡초 제거 작업에 구슬땀을 흘려 칭송을 받았다. 요양원 뿐 아니라 광양시 중동공원 일대에서는 제철소 전래놀이 문화 재능봉사단원들이 나서 집게와 쓰레기 봉투를 들고 광양시 중동공원에서 플로깅 봉사활동을 펼쳤다.광양제철소 심규호 과장은 “우리가 움직일수록 광양시가 더 살기 좋은 도시로 거듭난다는 생각으로 활동을 이어가고 있다”고 전했다.봉사단체들은 봉사대원에 참여하는 인원이 점차 점차 늘어남에 따라 월 1회 봉사활동 주기를 매주 토요일로 확대하며 봉사와 나눔의 정신을 이어오고 있다.  ],[],http://www.newslock.co.kr/news/articleView.html?idxno=78252,https://n.news.naver.com/mnews/article/016/0002180435?sid=102
2023.08.09.,브릿지경제,,"HDC현대산업개발, 릴레이 봉사활동···‘심포니 작은 도서관’ 개보수",,,https://www.viva100.com/main/view.php?key=20230809010002746,http://www.electimes.com
2023.08.17.,스카이데일리,,"당진경찰서 청소년정책자문단, 직업체험·봉사활동 실시",,,http://www.skyedaily.com/news/news_view.html?ID=202573,http://www.skyedaily.com
2023.08.14.,이뉴스투데이,,"제16기 창녕군가족봉사단, 8월 자원봉사 활동 실시",,,http://www.enewstoday.co.kr/news/articleView.html?idxno=2028384,http://www.enewstoday.co.kr/
2023.08.09.,시민일보,,"인천도시공사, 저소득 어르신 배식 봉사 펼쳐",,,https://www.siminilbo.co.kr/news/newsview.php?ncode=1160274879806122,http://www.siminilbo.co.kr
2023.08.02.,새전북신문,,"국제와이즈멘 전주백제클럽, 노인복지관서 배식봉사",,,http://sjbnews.com/news/news.php?number=788413,http://www.sjbnews.com/
2023.08.18.,국제뉴스,,"대구보건대학교, 노인과 성인 대상 기초 생활 능력 향상과 사회참여 기회 확대...",,,https://www.gukjenews.com/news/articleView.html?idxno=2789569,http://www.gukjenews.com/
7면 TOP,대전일보,,'더 어려운 이웃 위해' 집수리 봉사로 21년째 참사랑 실천,,,http://www.daejonilbo.com/news/articleView.html?idxno=2079787,http://www.daejonilbo.com/
