Date,Press,Category,Title,Content,Comment,URL_Origin,URL_Naver
2017.01.10.,충청투데이,,서천군 복지사각지대 특별 조사,,,http://www.cctoday.co.kr/?mod=news&act=articleView&idxno=1031135,http://www.ksmnews.co.kr
2017.01.08.,충북일보,,"괴산군보건소, 겨울철 건강프로그램 운영",,,http://www.inews365.com/news/article.html?no=478218,http://www.cctoday.co.kr
2017.01.12.,국제뉴스,,"합천군, 2017년 건강증진사업 업무협약 체결",,,http://www.gukjenews.com/news/articleView.html?idxno=630257,http://www.gukjenews.com/
2017.01.08.,대전일보,,"괴산군보건소, 겨울철 건강관리로 한해 농사 무난히",,,http://www.daejonilbo.com/news/newsitem.asp?pk_no=1246831,http://www.daejonilbo.com/
A14면 1단,동아일보,,독감유행 주춤… 환자수 1주새 25% 줄어,,,http://news.donga.com/3/all/20170104/82168152/1,http://www.donga.com/
2017-01-04 03:05:03,신아일보,사회,"봉화군, 동절기 복지사각w지대 집중 발굴","[    [동아일보]초중고 방학 시작하며 전염 감소… 2, 3월 다시 유행 ‘M자’ 그릴수도    　지난해 12월 학교를 휩쓴 인플루엔자(독감) 유행이 한풀 꺾였다. 질병관리본부는 12월 25∼31일 외래환자 1000명당 독감 의심환자가 64.2명으로, 역대 최고치를 기록했던 전주(86.2명)보다 25.5% 감소했다고 3일 밝혔다. 　이에 따라 독감 유행이 정점은 지난 것으로 보건당국은 보고 있다. 초중고교가 방학을 시작하면서 집단생활을 통한 전염이 줄어든 덕분이다. 실제로 학령기(7∼18세) 환자 비율은 한 주 만에 195명에서 144.2명으로 줄었다. 같은 기간 영유아(0∼6세) 환자는 86.5명에서 70.4명으로, 노인(65세 이상)은 17.5명에서 14명으로 줄어 감소세가 모든 연령대에서 공통적으로 나타났다.　보건당국은 현재 유행하는 A형 독감은 더 이상 크게 확산되지 않을 것으로 보고 있다. 다만 1, 2월부터 B형 독감이 추가로 유행할 경우 다시 환자가 늘어날 수 있다고 주의를 당부했다. 2010, 2011년 겨울 이전엔 독감이 12월경 유행했다가 주춤한 뒤 2, 3월경 다시 유행하는 ‘M자’ 곡선을 그리는 게 보통이었기 때문이다. 올겨울엔 독감 유행이 해를 넘기기 전에 시작돼 이 같은 ‘M자’ 곡선이 재등장할 가능성이 있다는 게 역학 전문가들의 예측이다. 　한편 보건당국은 내년 겨울부터는 유행주의보 발령 기준을 세분해 특정 지역·연령에서 환자가 갑자기 늘어날 경우 조기에 경보하겠다고 밝혔다. 올겨울엔 학령기 독감 환자가 유행 기준을 초과한 지 3주 만에 늑장주의보를 발표했다는 지적에 따른 것이다. 이동한 질병관리본부 감염병감시과장은 “타미플루 등 독감 치료제 유통 상황을 지속적으로 점검하는 등 현장에서 품귀 현상이 발생하지 않도록 관리하고 있다”고 말했다. 조건희　기자 becom@donga.com▶ 동아일보 단독 / 동아일보 공식 페이스북▶ 어제 못본 TV 명장면이 궁금하다면 'VODA'ⓒ 동아일보 &amp; donga.com, 무단 전재 및 재배포 금지   ]",[],http://www.shinailbo.co.kr/news/articleView.html?idxno=552128,https://n.news.naver.com/mnews/article/020/0003032218?sid=102
2017.01.10.,경인일보,,"하남시, 동절기 생활고 겪는 복지사각지대 발굴 보호 종합대책 수립·시행",,,http://www.kyeongin.com/main/view.php?key=20170110010003106,http://www.shinailbo.co.kr/
2017.01.10.,코메디닷컴,,추위 이기고 건강에도 좋은 옷차림,,,http://www.kormedi.com/news/article/1221469_2892.html,http://www.kyeongin.com
2017.01.10.,대전일보,,"서천군, 동절기 복지사각지대 특별조사",,,http://www.daejonilbo.com/news/newsitem.asp?pk_no=1247140,https://www.kormedi.com/
2017-01-10 09:25:02,농촌여성신문,생활/문화,불법 의료기기 체험방 52곳 적발,"[     본격적인 추위가 시작됐다. 앞으로 춥고 건조한 날씨가 이어질 전망이다. 이럴 때 외출할 때 옷은 물론 신발, 모자 등도 잘 챙기고 나서야 몸의 이상을 예방할 수 있다.겨울에는 날씨 탓에 건조성피부염, 주부습진, 아토피피부병 등 각종 피부병부터 뇌졸중 등에 이르기까지 각종 질병이 발생할 수 있다. 따라서 옷차림에도 각별한 신경을 써야 한다.우선 겨울에는 따뜻하게 입어야 혈액순환에 도움이 된다. 그러나 너무 두껍거나 몸에 딱 붙어 조이는 옷을 입으면 뇌졸중이나 심근경색 등이 오기 쉽다. 여러 건강정보 사이트 자료를 토대로 건강한 겨울을 보내기 위한 복장 선택에 대해 알아봤다.◆모자=모자를 쓰면 뇌졸중 예방에 확실한 효과가 있다. 최근 뇌졸중 발병 연령대가 3, 40대로 낮아지고 있다. 나이가 젊더라도 평소 피로하고 뒷목이 뻐근하다면 모자를 써야한다.연구에 따르면 우리 몸에 있는 열의 절반은 머리로부터 빠져나간다고 한다. 따라서 추운 날씨에 야외활동을 할 경우에는 반드시 모자를 쓰는 것이 좋다. 노인들은 모자를 쓸 때 귀를 덮지 않도록 해야 한다. 주위 소리를 듣지 못해 사고가 날 수 있기 때문이다.◆상의=면 소재의 부드러운 옷은 피부병 예방 효과가 있다. 어린이는 지나치게 두꺼운 옷 때문에 땀을 많이 흘리면 탈수증이 올 수 있으니 춥지 않을 정도로만 입힌다.또 노인은 신체활동이 불편할 정도로 두꺼운 옷을 입으면 넘어져 뼈가 부러지기 쉬우므로 내의를 입고 움직이기 편한 옷을 입는 것이 좋다.◆하의=바지는 스키복이나 누비옷 등 푹신한 것이 좋다. 쫄바지나 스키니, 꽉 조이는 팬티스타킹 등은 피한다. 너무 붙는 옷을 입으면 남성은 정자 수가 줄어들고 여성은 음부에 염증이 생길 수 있다는 보고가 있다.◆신발, 양말=노인들은 헐거운 신발을 신으면 발목을 삐거나 발목뼈가 부러질 위험이 크기 때문에 발목을 덮는 신발을 신도록 한다. 당뇨환자는 동상에 특히 주의해야 한다.신발은 두 켤레를 준비해 번갈아 신고 양말은 면 소재의 두꺼운 것을 신는다. 양말은 습기가 찰 때마다 갈아 신어야 한다.◆넥타이와 허리띠=넥타이를 너무 꽉 매면 경동맥(목동맥) 압박으로 뇌졸중 위험이 높아진다. 손가락 한 개가 들어갈 정도로 여유 있게 매고 되도록 와이셔츠 맨 위 단추는 풀어 놓는 것이 좋다. 또 허리띠를 너무 조이면 배의 압력이 높아져 혈압이 올라가고 천식, 폐질환을 악화시킬 수 있다.권순일 기자  (kstt77@kormedi.com)코메디닷컴 페이스북 바로가기  저작권ⓒ  '건강을 위한 정직한 지식' 코메디닷컴(kormedi.com) / 무단전재-재배포 금지   ]",['좋은 글 감사합니다!\n\n글을 읽다가 궁금한 것이 생겨서 질문드립니다.\n\n우리 몸의 있는 열의 절반이 머리로 부터 빠져나간다고 하셨는데 \n\n어느 부분인지가 궁금합니다.'],http://www.rwn.co.kr/news/articleView.html?idxno=38076,https://n.news.naver.com/mnews/article/296/0000029941?sid=103
2017.01.13.,MBN,,허위·과대광고에 속지말자. 똑똑한 소비자는 어떻게?,,,http://mbn.mk.co.kr/pages/news/newsView.php?category=mbn00013&news_seq_no=3116570,http://www.daejonilbo.com/
2017.01.16.,대구일보,,설 밑 한파 불우이웃 다시 되돌아 볼 때다,,,http://www.idaegu.com?c=8&uid=356143,http://www.rwn.co.kr
2017.01.05.,의학신문,,"허위 과대광고 떴다방, 의료기기 체험방 등 52곳 적발",,,http://www.bosa.co.kr/news/articleView.html?idxno=2052129,http://www.bosa.co.kr
2017.01.19.,일요서울,,"해남군, 각종 국가 지원서 제외된 저소득층 생계비 등 지원...군비 4000만 원...",,,http://www.ilyoseoul.co.kr/news/articleView.html?idxno=164319,https://www.ilyoseoul.co.kr/
2017.01.03.,뉴스1,,독감 '정점' 찍었나…환자수 지난주보다 25% 줄어,,,http://news1.kr/articles/?2875667,http://news1.kr/
2017-01-03 14:37:05,전북도민일보,사회,전북도 인사,"[     © News1학교 방학 때문인 듯…예년 비해선 여전히 높아당국 ""안심 일러…지금이라도 백신 접종해야""(서울=뉴스1) 민정혜 기자 = 연일 역대 최고치를 기록하며 고공행진을 이어가던 독감 환자수가 주간 기준으로 25% 줄어들며 이번 겨울 처음으로 하락세를 그렸다. 보건당국은 이번 독감이 집단생활을 하는 소아·청소년을 중심으로 유행한 것으로 미뤄볼 때 12월 말 학교들이 방학에 들어간 것을 환자 감소의 주된 이유로 보고 있다. 3일 질병관리본부에 따르면 12월 25~31일 독감 의심환자 수는 외래환자 1000명당 64.2명(잠정치)으로 집계됐다. 2013년 표본감시 체계가 정비된 이후 최고치를 찍었던 이전 주 86.2명보다 25.5% 줄었다. 독감이 학기 중 유행해 유독 많았던 7~19세 소아·청소년 환자 역시 비슷한 수준으로 감소했다. 7~19세 독감 의심환자 수는 12월 25~31일 144.2명(잠정)으로, 역대 최고치였던 지난주 195.0명보다 26.0% 낮아졌다. 질본은 독감 환자가 올겨울 들어 첫 감소세를 보였지만 예년에 비해서는 높은 수준이라며 임신부, 만성질환자 등 우선접종 권장대상자 가운데 아직 백신 접종을 하지 않은 사람은 지금이라도 예방접종을 받을 것을 당부했다. 현재 유행하는 A형 독감은 백신접종으로 예방 가능하고 더불어 이듬해 봄 유행이 예상되는 B형 독감 감염도 막을 수 있다. B형 독감은 A형 독감보다 증상이 가볍지만 이듬해 4∼5월까지 유행이 길게 지속되는 특징이 있다. 더불어 신생아를 포함한 9세 이하 소아, 10~18세 이하, 임신부, 65세 이상 노인 등 고위험군은 독감 바이러스에 감염되면 폐렴 등 합병증이 발생하기 쉽고 기존에 앓고 있는 질환이 악화될 수 있다. 38도 이상의 갑작스러운 열과 기침 또는 인후통 등 의심증상이 있으면 신속하게 진료 받아야 한다. 감염병 예방과 확산 방지를 위해서는 30초 이상 비누로 손씻기와 기침예절 지키기, 사람 많은 곳을 피하기 등 개인위생을 실천해야 한다. 또 영유아와 어린이가 건강한 생활습관이 형성될 수 있도록 가정과 보육시설 등에서 세심한 주의가 필요하다.mjh@▶ 놓치면 후회! 최신 무료만화 보기 / 2017년 나의 운세 보기[© 뉴스1코리아(news1.kr), 무단 전재 및 재배포 금지] ]","['백신? ㅋㅋ\nA형 b형 둘다 예방된다는 백신 맞았는데 독감 걸렸고 검사해보니 a형 나오더라 ㅋㅋㅋㅋ 와이프는 입원중이고 첫째도 a형 어머니도 a형 예방이 되는건지 의문이다', '방학햇으니 그렇겟지.. 독감걸려도 학교보내는 부모들이 많아서 더 퍼졌음', '독감걸리면 되도록 사람많은곳은 자제하고 마스크 좀 하고 다니면좋겠다 마스크를 안쓰고들 다녀서 난 내가쓰고다님 ㅋ 손소독제들고다니고....', '백신회사 상술도 한몫, 백신 다 소진했나보네', '애기가독감 병원에서 옮아걸림 마스크안끼고 기침하길래 불안했더니 아니나다를까 ...엄마랑딸이 ..엄마가 책열심히읽어주며 기침하고 딸도기침하고 ㅡ ㅡ소아과에서 인간적으로 감기나독감걸렸음 마스크를쓰고있어야지', '아니 나라가 국민을 위해하는일이 전혀없음을\n이번 ai 하고 독감사태를 보며 뼈저리게 느낀다\n이건 뭐 예방도 못해 그렇다고 방역도못해\n모두다 그냥 자동소멸되기만을 기다리는 이런나라가 어딨나요?? 세월호랑 사태랑 뭐가 틀린가요?\n침몰하는배 자동적으로 물아래로 가라앉기만을 기다린거랑??? 정말 이런나라에 살고있다는게 매자신이 한심하기그지없네요', '쟈철이나 버스나 지상철에서 마스크 안끼고 기침하는거 정말 싫어요', '국가에 대한 불신이 얼마나 크면 독감\nAI일부러 퍼트린거 아니냐는 의심의 소리가 나오냐??\n정말 우리나라 이정도로 바닥이었나..', '그렇군 근데 이번겨울 엄청 춥다고 생각되지 않는데 좀있으면 개나리 필듯....', '방학이 큰 몫을 했죠. 그러니 조기방학을 했으면 확산을 많이 막았을텐데 왜..', '독감맞아봤자 소용없다~ 사람에따라 약하게 온다는데 개소리~ 10월말 독감접종 18 정초1월1일 독감판정~ 거의죽다 살아남~ 독감주사 아무효과없다고함~ 4가니 3가니로  약장사 좋은일만 시켰네18~', '약한사람 이미 다걸리고 면역력 강한사람은 안걸린거야 무능정부야ㅋㅋ 조류도 다죽어서 안퍼지는거고ㅋㅋ', '그 다음것 또 나오겠찌..\n우왕좌앙 어리버리 정부!!!', '방학했으니까 그렇지..', '지난주에 뒤지는줄 알았네', '독감주사 맞았어도 걸리더라.쳇.저번주 타미플루먹었음.독검주사비는 돈대로나가고 타미플루값은 돈대로나가고 어이없음', '방학했다', '걸리면 아픔 콜록콜록', '지금이라도 백신 구매해달라', 'ㅋㅋ 맞습니다 예방이란 없고 그냥 있으면 흐지부지 되면서 자동소멸이 모두 답인듯...', '대기오염 때문이 아니고 유치원 때문에???', '비쌎 예방주사 맞았는데 걸렸고 격리치료 해얀다며 1인실 5일 입원.. 입원중 심평원서 병실료 급여 된다길래 맘놓고 있었더니 퇴원날 급여 안된다고 호텔급 병실료를 물래요 ㅠㅠ', '이번 독감 증상이 어떤가요?', '독감 예방주사 권고만 하지말고 맞출거면 차라리 전국민대상으로 의무접종 해주던가 백신이라도 제대로 구비해 주던가!!!', '지금이라도 맞춰야하나..작년에  독감주사 맞추고 바로 주사로 독감걸려서ㅜ', '그래서 아픈데 학교 회사 보낼거냐?!', '아무 대책도 없는 정부~~ 우린 나라없는 국민.  국민 주머니만 훔치는 강도정부. 이게 현실이지']",http://www.domin.co.kr/news/articleView.html?idxno=1137845,https://n.news.naver.com/mnews/article/421/0002488182?sid=102
A23면 TOP,한겨레,,“매일 출근하는 즐거운 100살…잘 살아야 잘 죽는다”,,,http://www.hani.co.kr/arti/society/society_general/777383.html,http://www.domin.co.kr
2017.01.15.,뉴스메이커,,"고흥군, 매주 수요일 마을순회 의료서비스 실시",,,http://www.newsmaker.or.kr/news/articleView.html?idxno=37645,http://www.hani.co.kr/
2017-01-04 18:56:06,뉴시스,사회,"[신년인터뷰]김수영 양천구청장 ""50대男 고독·빈곤 주목…전수조사 통해 대안...","[     [한겨레] [짬] 창립 30년 각당복지재단, 김옥라 명예이사장    김옥라 각당복지재단 명예이사장.  자판을 두드리는 손길이 경쾌하다. 마치 10대 소녀 피아니스트의 소나타 연주를 떠올리게 한다. 좀 특이한 점이 있다면 컴퓨터 화면 앞에 이동식 대형 돋보기가 있다는 점이다. 필요할 때 이 돋보기의 높이를 조절하면서 화면 속 자세한 숫자나 사진을 관찰한다. 지난해 이 자판을 두드려 책을 한 권 썼다. 올해도 쓰고 있다. 1918년생. 한국 나이로는 100살이다.  이제 살아 있는 친구들도 거의 없다. 다른 노인들이 이 나이까지 살아 있다면 지난 세월을 반추하며 불편한 몸을 원망하고, 시간을 무료하게 보내고 있기 마련이다. 그런데 그는 아직도 사무실에 출근해 하루 7시간씩 근무한다. 보청기는 3년 전에 꼈다. 몸은 무릎이 조금 불편하다. 하루 1시간 정도 산책하며 생각을 정리한다. 늘 남보다 몇 발 앞서 살았다. 그래서 힘들었지만, 그것이 바로 삶을 충만하게 만드는 에너지였다.  자원봉사 개념 생소하던 시절 재단 세워 봉사자 1만2천명 배출 ‘걸스카우트’ 만들어 간사장 15년26년전 남편 잃고 웰다잉 모색 죽음준비 전문교육가도 배출 “사람은 살아온 것처럼 죽어”김옥라 각당복지재단 명예이사장이 이 땅에서 처음 시작한 것이 많다. 걸스카우트를 처음 조직했다. 일제강점기와 전쟁의 폐허로 황폐했던 1950~60년대에 ‘대한소녀단 걸스카우트’를 창단해 간사장을 15년간 맡았다. 한국 여성 가운데 처음 국제기구(세계감리교여성연합회) 수장으로 유엔에서 공식 활동한 여성 엔지오 활동가이다. 자원봉사라는 개념을 처음 도입해 자원봉사자를 키웠고 잘 죽는 방법(웰다잉)을 공개적으로 처음 모색했다. 호스피스 봉사를 처음 시작했고, 다문화가정을 위한 다양한 봉사를 시작했다.   지난 2일 서울 종로의 각당복지재단 사무실에서 만난 그는 한복을 입고 컴퓨터를 다루고 있었다. 새해 첫날이라 한복을 입었다고 했다. 곱다. 아무리 ‘백세시대’라고 하지만 주변에서 한 세기를 살아온 이를 만나기 쉽지 않다. 출근해 일하는 이를 보기는 더욱 어렵다. 지난해 한국의 100살 이상 인구는 3000명을 조금 웃돈다. 그가 1986년에 만든 각당복지재단은 한국 최초의 전문자원봉사자 양성기관으로 그동안 1만2천여명의 전문자원봉사자를 배출했다. 지난해 12월 창립 30주년을 맞았다.  당시의 숨기고픈 이야기이다. “자원봉사라는 용어를 공무원에게 설명하며 어렵게 ‘자원봉사능력개발연구회’를 만들고, 처음 생각한 대상자가 퇴직한 교수들이었어요. 고학력자 자원봉사자로 제격이었어요. 전국 주요 대학에 지난 3년간 은퇴한 교수 명단을 부탁했어요. 200여명의 은퇴 교수에게 장문의 편지를 썼어요. ‘이제 자원봉사자가 돼 사회에 기여하자고….’ 그런데 답변이 딱 한명에게만 왔어요. 그마저 정중한 거절이었어요. 낙향해서 참여가 어렵다는 것이었어요. 실망을 넘어서 충격이었어요. 최고의 지식인들이 그리 자원봉사에 대해 무지하고 관심이 없는지.”  죽음을 본격적으로 다루는 ‘삶과 죽음을 생각하는 회’를 만든 인연도 각별하다. 평생을 함께했던 남편이 간경화로 26년 전 갑자기 세상을 떠났다. 그는 반년 이상 눈물로 지샜다고 한다. 그리고 죽음이 무엇이길래 이리 슬프고 애달파야 하는지 생각하게 됐다고 한다. “어느 날 눈을 감고 상념에 빠져들고 있을 때 마음속 깊은 곳에서 소리가 들렸어요. ‘죽음을 탁상 위에 올려놓고 공론에 부치라’는 소리였어요.”  그는 배우자를 잃고 아파하던 지인들과 91년 4월 ‘삶과 죽음을 생각하는 회’를 출범시켰다. 죽음을 맞이할 준비를 하고 슬픔을 치유하자는 목적이었다. 죽음준비교육 전문가도 배출했다. “잘 살아야 잘 죽을 수 있어요. 사람은 살아온 것처럼 죽어가요. 삶과 죽음 사이에 돌연변이는 없어요. 아름다운 삶을 살아야 아름답게 죽을 수 있죠.”  건강 비결이 궁금했다. 하루 7시간 자고, 세끼 챙겨 먹는다. 간식은 안 한다. 40대와 50대에 심한 위궤양과 십이지장궤양으로 고생했다. 업무 스트레스 탓이었다. 80대 초반 신장암에 걸렸다. 한쪽 콩팥을 떼어냈다. 그 후 특별한 질병에 시달리지 않았다. 그는 자신의 긍정적인 사고와 모든 것에 감사하는 마음이 건강의 비결이라고 했다.  “암에 걸렸을 때 남들은 슬퍼하고 울지만 저는 오히려 감사했어요. 암환자들의 고충을 깊이 이해할 기회가 왔다고 생각한 거죠. 수술 뒤 일주일 만에 퇴원했어요. 저보다 수술한 의사가 더 기뻐했어요.”  그의 긍정적인 사고는 일상에 묻어난다. “공기와 물 얼마나 고마워요. 지금까지 나를 있게 만든 부모와 가족, 친구들이 얼마나 고마워요. 마당에 핀 꽃이 얼마나 아름다워요. 마치 어머니 자궁에 있을 때 바깥세상을 모르고 살았듯이, 죽어서도 지금은 모르는 그런 아름다운 세상이 있을 겁니다. 그러니 감사할 수밖에요.”  글·사진 이길우 선임기자 nihao@hani.co.kr ▶ 한겨레 절친이 되어 주세요! [신문구독] [주주신청]▶ [페이스북] [카카오톡] [사설·칼럼][ⓒ한겨레신문 : 무단전재 및 재배포 금지] ]","['정말 감사드립니다. 좋은 귀감을 주셧습니다.', '요즘들어 웰빙보다 웰다잉에 관심이 더 갑니다', '나도 이렇게 늙고싶다', '허구헌날 양반이나 찾고 아픈게 유세인양 아이고 아이고거리다 결국엔 진짜 아파 못일어나는 늙은 노인들에게 귀감이 되겠네요.', '보이는 게 다가 아니랍니다.', '대단하신 분이네요. 존경스럽습니다.', '100세도이렇게또렷하고\n오히려70세보다더건강해보여요', '김옥라 장로님', '이갈우 기자님,\n좋은 기사 늘 즐겨 읽습니다.\n감사합니다.', '지금까지 나를 있게 만든 부모와 가족, 친구들이 얼마나 고마워요. ..근데 부모는맞는데 가족친구들은아닙니다', '멋진 분이시네요. 저도 본 받아야겠어요.']",http://www.newsis.com/view/?id=NISX20170105_0014621678&cID=10905&pID=16000,https://n.news.naver.com/mnews/article/028/0002348511?sid=102
2017.01.03.,오마이뉴스,,"경총 회장님, 이런 글 쓰면 세계적 웃음거리 됩니다",,,http://www.ohmynews.com/NWS_Web/View/at_pg.aspx?CNTN_CD=A0002276204,http://www.newsmaker.or.kr
2017.01.13.,정책브리핑,,[4차 산업혁명의 주역들] ② 응용기술 분야,,,http://www.korea.kr/policy/economyView.do?newsId=148827519&call_from=naver_news,http://www.newsis.com
