Date,Press,Category,Title,Content,Comment,URL_Origin,URL_Naver
2022-11-20 15:22:01,뉴스1,,도박자금 때문에 회사 장비 팔아넘긴 30대 '징역 2년6월',"[ 평생교육 활성화·행사 지원 등 성인학습 입학 시 장학 혜택박승호 총장 ""문화의 힘과 시니어의 힘 합쳐지길""    시니어매일과 계명문화대학교는 18일 성인학습자 교육 협력을 위한 업무협약을 체결했다. 시니어매일 제공""배움을 원하는 중장년 교육에 힘을 모아요.""시니어매일(대표 최병고)과 계명문화대학교(총장 박승호)는 지난 18일 성인학습자 대상 평생교육 활성화에 공동 노력하는 내용의 업무협약을 체결했다.계명문화대 동산관 시청각실에서 열린 이날 업무협약식에는 시니어매일 기자 50여 명을 비롯해 계명문화대 박승호 총장, 예춘정 입학처장, 전공 교수 등 70여 명이 참석했다.이날 행사는 대학의 지역사회 평생교육 역할이 갈수록 강조되는 가운데 평생교육 수요자인 시니어들과 대학이 손을 잡았다는 점에서 눈길을 끌었다.성인학습자는 고교 졸업후 바로 대학에 진학한 어린 학생들보다 늦은 나이에 학교에 다니는 일명 만학도를 뜻한다. 최근 성인학습자의 직업 전환 교육과 재취업 교육 수요가 증가하는 추세이다.양 기관은 ▷성인학습자 교육에 대한 상호 이해 협력체계 구축 ▷성인학습자 교육과정 및 프로그램 개발 지원 ▷성인학습자 관련 행사 지원 및 홍보 ▷지역 평생교육 활성화를 위한 협력 강화 ▷기타 상생 발전을 위한 인적 물적 및 정보 교류 등을 약속했다.박승호 총장은 ""계명문화대는 시니어매일과 함께 열정적이고 활동적인 시니어들을 위해 새로운 역할을 담당하고자 한다. 계명문화대의 '문화'와 시니어매일의 '시니어' 힘이 합쳐진다면 큰 영향력을 발휘할 수 있을 것""이라고 기대했다.업무협약식에 이어 계명문화대 2023학년도 성인학습자 입학설명회가 진행됐다. 시니어 기자들은 금융부동산과, 공연음악학부, 사회복지상담과, 골프·피트니스과, 패션디자인·쇼핑몰과, 플라워·가드닝과 등 15개 전공에 대한 설명을 듣고, 대학 도서관과 골프 연습장 등 교내 교육시설도 둘러봤다.계명문화대에 따르면 성인학습자 정시모집은 다음 달 29일부터 내년 1월 2일까지. 첫 학기 등록금 전액 무료에 남은 학기 등록금 50% 이상 장학 혜택 등이 제공된다.시니어매일 강효금 본부장은 ""이날 성인학습자 과정에 지원서를 내거나, 따로 교육 내용을 문의하는 등 시니어매일 기자들의 관심이 높았다. 앞으로 계명문화대와 윈윈하는 모델을 만들고 싶다""고 했다. ]",[],https://www.news1.kr/articles/4869805,https://n.news.naver.com/mnews/article/088/0000785018?sid=004
2022.11.18.,월간조선,,"문재인 국정원의 대북심리전단 와해 전말 | “댓글 사건, 좌파 세력의 국정원...",,,http://monthly.chosun.com/client/news/viw.asp?ctcd=A&nNewsNumb=202212100014,http://news1.kr/
2022-11-20 10:00:00,에듀동아,사회,"이젠아카데미컴퓨터학원, '전산회계, 전산세무, ERP, 재경관리사' 연말정산 및...","[     수원법원종합청사. 2019.5.24/뉴스1 ⓒ News1 조태형 기자(수원=뉴스1) 유재규 기자 = 도박자금 때문에 자신이 직원으로 재직해있던 회사 내 고가장비 등을 훔쳐 임의로 판매해 7억여원을 가로챈 30대 남성이 실형을 선고 받았다. 수원지법 형사제4단독 박현이 판사는 절도, 사기, 횡령, 사문서위조 등 혐의로 A씨(31)에 대해 징역 2년6월을 선고 했다고 20일 밝혔다.A씨는 도박자금을 마련하고자 2019년 8월4일~2020년 3월7일 경기 화성시 남양읍 소재 자신이 다니는 자동차 관련 부품제조 회사에서 2000여만원 상당 고가장비를 고철업체에 팔아 7억여원 상당 거둬들인 혐의로 기소됐다. 그는 또 2020년 7월16일~8월30일 경기 화성시 남양읍 소재 재취업한 직장인 건설회사에서도 9700여만원 상당 가치가 있는 건설장비 및 공구들을 훔쳐 이를 중고 매매상에게 임의로 판매해 횡령한 혐의도 있다. 이뿐만 아니라 해당 건설회사를 다니면서 인건비를 가로챌 목적으로 인력사무소에 작업확인서를 위조해 제출, 38차례 걸쳐 550여만원 상당 거둬들인 범죄사실도 있다.또 당시 건설회사의 대표가 음주운전으로 구속된 상태였는데 대표의 부인이 영치금 전달을 부탁하면서 A씨에게 계좌 비밀번호 등을 알렸다. 하지만 A씨는 이를 악용해 자신이 이용하는 도박사이트 운영자 계좌로 1300만원 이체하기도 했다. 박 판사는 ""A씨는 회사의 신뢰를 배신하고 상당기간 회사가 생산한 제품을 고철로 판매했다""며 ""또다른 회사에서도 대표가 구속돼 부재 중인 사이, 공구 및 건설기계 등을 절취해 판매하고 문서를 위조해 인건비 등을 청구하는 등 죄질이 매우 좋지 않다""고 말했다.이어 ""이같이 얻은 돈을 도박에 탕진하고 피해자들에 대한 피해회복도 전혀 안됐다""면서도 """"다만, 일부 부품이 회수된 점과 벌금을 초과하는 전력 등이 없는 점을 유리한 정상으로 참작했다""고 판시했다.   ]",[''],http://edu.donga.com/?p=article&ps=view&at_no=20221118170130671677,https://n.news.naver.com/mnews/article/421/0006469030?sid=102
2022.11.18.,굿모닝충청,,"대전폴리텍대, 신중년특화과정 수료식 개최",,,http://www.goodmorningcc.com/news/articleView.html?idxno=279834,http://monthly.chosun.com/
A20면 TOP,경향신문,,"은퇴 후 공허한 삶, 작은 도전들로 채워요[박상희의 구해줘! 내 맘]",,,https://www.khan.co.kr/life/health/article/202211181600005,http://edu.donga.com
2022.11.18.,대한경제,,중부고용노동청 실업급여 부정수급 기획조사 실시,,,https://www.dnews.co.kr/uhtml/view.jsp?idxno=202211181001596360228,http://www.goodmorningcc.com
2022.11.18.,노컷뉴스,,"[인천 주요 뉴스]인천시, 경제자유구역에 '유럽한인문화타운' 건립 계획",,,https://www.nocutnews.co.kr/news/5851546,http://www.khan.co.kr/
2022-11-18 16:06:01,프레시안,생활/문화,"군산시의회, 2022 행정사무감사…날선 지적과 대안 제시 눈길","[ (24) 남은 인생 어떻게 살아갈까?    2030년에는 60세 이상 고령세대가 전체 인구의 30%에 도달한다고 한다. 은퇴 이후 의미 있는 노년을 보내기 위해서는 경제적 어려움을 해결할  사회복지정책과 정신적 고독을 해소할 교육·심리 프로그램의 마련이 매우 중요하다. 활기찬 100세시대를 열어가는 것은 이제 정부는 물론 시민사회의 과제일 것이다. 샤론정신건강연구소 제공&lt;상담 신청&gt;전자 관련 대기업을 다닐 때에는 나름 좋았어요. 분주한 나날들이었고, 급여도 넉넉했어요. 아내 역시 일하고 있어서 경제적 어려움은 전혀 없었어요. 맞벌이라서 아파트도 일찍 샀고, 저축도 제법 해놓았어요.5년 전에 두 살 어린 아내가 저보다 한 해 일찍 퇴직을 했고, 제가 이어서 은퇴를 했어요. 은퇴 이후의 삶을 미리미리 생각해 놓아야 했는데, 돌아보면 아무런 준비 없이 은퇴하게 된 게 가장 아쉬워요. 은퇴 이후 첫 1년은 좋았어요. 느긋하게 하루를 즐기고 해외여행도 아내와 함께 떠나니 참 좋더라고요.은퇴하고 두 해가 지난 다음 아내가 갑자기 세상을 떠났어요. 하늘이 무너진다는 느낌이었어요. 우리 부부는 아이가 없어서 서로 무척 각별했었어요. 아내 장례를 치루고 정신을 차려보니 상당히 당황스럽더라고요. 아침에 일어나도 주위에 아무도 없고, 약속이 없는 날은 혼자 점심을 먹어야 하고, 저녁 또한 주로 혼자 먹으려니 참 쓸쓸했어요.이러면 안되겠다고 생각해서 친구들과 산에 다니기 시작했어요. 북한산도 가고 관악산도 가고 서울 인근 산은 모두 다 간 것 같아요. 그런데 산행을 마친 후 점심을 먹는데 술을 함께 마시다 보니 나중에는 산행을 하러 가는 건지 술을 먹으러 가는 건지 모르겠더라고요. 그래서 혼자 산에 다니기 시작했어요. 나홀로 산행은 구속을 받지 않아서 좋지만, 아무래도 쓸쓸한 건 피할 수 없지요.시간이 많다 보니 유튜브를 자주 보게 돼요. 처음에는 다양하게 시청했는데, 시간이 흐를수록 정치 분야에 집중하게 됐어요. 친구들 가운데 어떤 이들은 유튜브를 보고 집회에도 참여하던데 저는 그러하진 않았어요. 저 역시 기성 정치권이 마음에 들지 않지만, 그래도 정치는 정치권에 맡겨야 하지 않나 생각되거든요. 요즘은 정치 관련 분야보다는 흘러간 노래들을 모아 놓은 채널에 들어가서 음악을 많이 듣고 있어요. 건강 관련 채널도 자주 방문하는 편이에요.책은 많이 읽지 못해요. 젊은 시절에는 공부도 열심히 했지만, 중년 이후 책하고는 담을 쌓고 살아왔기 때문이지요. 그래도 재미있게 읽은 책이 김형석 교수님의 &lt;백년을 살아보니&gt;였어요. 공부를 하고 봉사를 하라는 말씀이 참 와닿았어요. 그런데 막상 공부를 하려다보니 무슨 공부를 해야 할까 하는지 잘 모르겠고, 봉사 활동도 어디서 어떤 일을 해야 할 지 찾기가 쉽지는 않았어요.혼자 저녁을 차려서 먹은 후 TV를 좀 보다가 생각해 보면 마음이 한없이 차분해져요. 그런데 다시 생각해보면 차분한 게 아니라 울적한 것 같기도 해요. 즐겁게 지내려고 하지만, 사실 즐거운 일들이 거의 없는 셈이지요. 직계가족이 없다 보니 이젠 형제들을 만나도, 조카들을 만나도 짐이 되고 싶지 않다는 생각이 앞서게 돼요. 요즈음 이렇게 의미 없이 나이만 먹느니 차라리 빨리 아내 곁으로 가고 싶을 때도 있어요. 이거 우울증인가요?선생님을 찾은 까닭도 여기에 있어요. 우리 세대가 상담에 익숙한 세대는 아니지만, 우연히 유튜브에서 상담 관련 이야기를 들어보니 저 역시 한 번 받아보고 싶다는 생각이 들더라고요. 마침 가까운 후배가 선생님을 추천해줘서 용기 내어 연락을 드렸어요. 저처럼 나이 많은 사람에게 요청을 받으시면 부담스러운 것은 아니신지 모르겠습니다.울적한 나날들이 계속되는데, 우울증 초기 증상인가요? 건강에 나름 신경을 쓰고 있지만, 사는데 갈수록 흥미가 없어져 가요. 인생이 ‘공수래 공수거’라고 말하지만, 그래도 뭔가를 하고는 싶어요. 남아 있는 인생 의미 있는 일을 해야 할 터인데, 그게 잘 보이지 않아요. 젊은 분에게 드리기 민망한 질문이지만, 남은 인생 어떻게 살아가야 합니까?&lt;상담 내용&gt;박승환님(가명). 마음 속 이야기를 누군가에게 터놓고 한다는 게 쉬운 일이 아닌데 이렇게 편안하게 말씀해주시니 감사합니다. 제가 나이도 더 어리고 인생 경험도 한참 미치지 못하지만, 상담사로서 느끼고 생각한 것들을 조심스럽게 말씀 드리겠습니다.우울증은 ‘2주 이상 거의 매일 우울한 기분, 흥미상실, 식욕, 수면 변화, 피로, 자살 생각 등으로 일상 생활이나 직업상 곤란을 겪는 경우’에 진단을 내립니다. 그런데 박 선생님은 운동도 잘 하시고 식사도 잘 드시고 잠도 잘 주무시니, 우울증은 아니실 듯합니다. 우울증이 걱정되신다면 정식검사를 받아보시길 권해 드립니다. 우울증의 평생 유병률은 15~20%로 누구에게나 찾아올 수 있는 흔한 질병입니다. 치료를 잘 받으시면 충분히 이겨내실 수 있습니다.제가 보기에 선생님의 주요 문제는 우울증이라기보다 상실감인 것 같아 보입니다. 준비를 잘한 채 은퇴를 맞으신 분들도 사회적·개인적 의미가 상실한 것에 대해 많이 힘들어 하십니다. 가장 큰 변화는 일이 없어진 것입니다. 그리고 남자들의 경우는 사회적 관계가 일과 연결되어 있는 사례가 많아서 만나는 사람들이 줄어드는 것도 문제입니다. 일과 사람이 없어진다면 누구나 깊은 상실감으로 슬픔과 무기력감을 느끼게 됩니다.그런데다 선생님은 특수한 상황을 겪으셨습니다. 은퇴하신 지 얼마 안돼서 사랑하는 아내를 잃으셨습니다. 배우자를 잃는 것은 스트레스 지수 가운데 1위를 차지하는 요인입니다. 우리 인간에게 가장 큰 상실감을 안겨주는 일입니다. 게다가 자녀가 없이 두 분이 알콩달콩 살던 사이셨으니 다른 분들보다 두 배 이상으로 힘들 수밖에 없으셨을 것입니다.김형석 교수님 책은 저도 읽어 보았습니다. 어르신들에게 용기와 희망을 안겨주는 책이라고 생각됐습니다. 제게 인상적인 것은 늙는다는 게 누구의 잘못이 아니라는 김 교수님의 발언입니다. 김 교수님은 늙어서도 행복하게 살 권리가, 젊은 세대에겐 존경받아야 할 의무가 있다고 하셨고, 공부와 취미와 봉사는 이 권리와 의무를 다하기 위한 좋은 방법이라고 말하셨습니다. 참 적절한 충고이자 지혜인 것 같았습니다.제가 공부하는 상담학에서 요즘은 노화를 노쇠해가는 것이 아니라 발달과 성장의 과정으로 보는 견해가 강합니다. 저는 삶의 발전을 멈추면 노인이고, 계속 발전하고 있다면 청년이라고 생각하고 있습니다.현대 노인상담 이론은 노년기에 삶의 질을 향상시키기 위한 조건으로 다음과 같은 것들을 제시합니다. 먼저 개인은 의지를 가지고 건강을 유지하면서 친구관계 등 사회적 관계를 꾸준히 지속해야 한다고 봅니다. 또한 교육에 지속적으로 참여하면서 자기 개발을 하고 자신의 능력을 성장시켜야 한다고 제안합니다. 건강하기만 하다면 재취업과 자원봉사도 적극적으로 생각해 보고 실행할 필요가 있습니다.    경향신문 자료사진박 선생님, 이제 산행 이외에 다양한 취미활동을 해보면 어떠하실까요? 스포츠, 문화, 글쓰기, 요리 등 요즘은 취미활동이 매우 다양해지는 추세입니다. 저 역시 취미활동을 하는데 나이는 별로 중요하지 않은 것으로 보입니다. 제가 알고 있는 커뮤니티에 ‘실버 바리스타’ 모임이 있는데, 60~70대 회원들이 한 달에 2회씩 멋진 카페에서 커피에 대해서 배우고, 바리스타 자격증을 따는 공부를 함께 하고 있습니다. 보기에도 근사하고 커피 맛도 좋습니다.봉사 활동의 경우는 다른 사람들에게 대단한 것을 제공해야 한다고 생각하실 필요는 없는 것 같습니다. 선생님만이 갖고 있는 노하우나 경험을 젊은이들에게 나누어주시는 것만으로도 큰 봉사활동입니다. 찾아보시면 자원봉사를 주관하는 시민단체들이 주변에 많이 있습니다.가족들과 거리감을 느끼시는 것도 다시 한 번 생각해보시길 바랍니다. 많은 경우 자신의 상황이 어렵고 마음이 힘들어지면 ‘별 도움이 안되는 나를 사람들이 귀찮아 할 거야’ 라고 미리 판단하고 스스로 고립되기 쉽습니다. 하지만 그것은 자존감의 하락에서 오는 잘못된 판단일 경우가 많습니다. 함께 있어 주는 것만으로도 가족들에게는 힘이 될 수 있기도 합니다.박 선생님은 이제 노년의 입구에 서 계신 것 같습니다. 그 누구도, 그 무엇도 선생님이 느끼실 상실감을 채우기 어렵겠지만, 아직은 새로운 도전을 해보실 수 있습니다. 하루하루 취미와 봉사 등에서 작지만 새로운 도전의 목표를 세워보시라고 말씀 드리고 싶습니다. 이것은 선생님에게만 드리는 말씀이 아니고, 나이를 먹어가는 제 자신에게도 하고 싶은 말이랍니다.&lt;상담 후기&gt;우리나라에서 고령사회가 시작되면서 100세 시대가 관심을 끌어 왔다. 100세 시대를 맞이하여 고령세대의 경제적 궁핍은 물론 정신적 고독이 매우 중요한 사회문제로 부상해 왔다. 누구에게나 먹고 사는 문제가 가장 중요하다. 하지만 정신과 마음의 건강 또한 이 못지않게 중요하다.곧 다가올 2030년에는 60세 이상 고령세대가 전체 인구의 30%에 도달한다고 한다. 은퇴 이후의 삶을 미리 준비하기 위한, 설령 준비하지 않았더라도 의미 있는 노년을 보내기 위한 사회복지정책과 교육·심리 프로그램의 마련은 매우 중요한 국가적 의제다. 활기찬 100세 시대를 열어가는 것은 정부는 물론 시민사회의 과제일 것이다.▶박상희 소장은    이화여대에서 상담학으로 박사학위를 받았다. 2005년 이화여대 출신 30여 명의 상담학 석·박사들과 함께 전문적 심리상담과 코칭에 주력하는 샤론정신건강연구소를 창립해 18년째 소장을 맡고 있다. 2014년 스탠포드 대학에서 방문학자로 다양한 연구에 참여했다. 한국열린사이버대 상담심리학과 겸임교수로도 일하고 있다. ]",[],https://www.pressian.com/pages/articles/2022111807191700059?utm_source=naver&utm_medium=search,https://n.news.naver.com/mnews/article/032/0003187199?sid=103
2022.11.18.,노컷뉴스,,"[인천 주요 뉴스]인천시, 경제자유구역에 '유럽한인문화타운' 건립 계획",,,https://www.nocutnews.co.kr/news/5851546,http://www.nocutnews.co.kr
2022-11-18 15:02:02,프레시안,사회,"군산시의회, 2022 행정사무감사…날선 지적과 대안 제시 눈길","[     인천시, 경제자유구역에 '유럽한인문화타운' 건립 계획인천시는 인천경제자유구역 안에 재외동포들의 귀환 거주를 돕는 '유럽한인문화타운'을 만들겠다고 밝혔습니다.인천시는 독일 프랑크푸르트에서 설명회를 열고 지상 3~4층 규모의 상가주택을 개조해 건물 1층은 상가로, 2~4층은 주거·숙박시설 형태인 유럽한인문화타운 만들겠다고 밝혔습니다.또 타운 안에 유럽이민역사박물관 등 문화시설 등도 함께 건립할 방침입니다.앞차 피하려다 인도 위 노인들 덮친 80대 운전자앞서가던 택시를 피하려고 방향을 틀었다가 인도에 있던 노인 4명을 치어 다치게 한 80대 운전자가 경찰에 붙잡혔습니다.인천 삼산경찰서는 어제 오전 11시쯤 인천시 부평구 한 도로에서 앞서가던 택시를 피해 방향을 틀 었다가 인도에 있던 70~80대 남녀 4명을 치어 다치게 한 80대 A씨를 입건해 조사하고 있다고 밝혔습니다.이 사고로 한 명은 타이어에 발등이 깔렸으며, 나머지 세 명은 사이드미러 등에 부딪혀 인근 병원으로 옮겨졌습니다.중부고용청, 실업급여 부정수급 62명 입건재취업한 사실을 숨기거나 유령회사로 고용보험에 가입해 실업급여를 부정하게 타낸 수급자들이 무더기로 적발됐습니다.중부지방고용노동청은 고용보험법 위반 혐의로 A씨 등 62명을 입건하고 11억 천만 원을 반환하도록 명령했다고 밝혔습니다.이들은 다니던 회사에서 정년퇴직한 이후 파견업체로 소속만 바꿔 계속 일을 하면서도 실업상태인 것처럼 허위신청을 하는 방식 등으로 실업급여를 타 낸 것으로 조사됐습니다.※CBS노컷뉴스는 여러분의 제보로 함께 세상을 바꿉니다. 각종 비리와 부당대우, 사건사고와 미담 등 모든 얘깃거리를 알려주세요.이메일 : jebo@cbs.co.kr카카오톡 : @노컷뉴스사이트 : https://url.kr/b71afn ]",[],https://www.pressian.com/pages/articles/2022111807191700059?utm_source=naver&utm_medium=search,https://n.news.naver.com/mnews/article/079/0003708638?sid=102
2022.11.18.,뉴스웨이,,"정읍새일센터, '여성 인턴 연계 기업' 3차 네트워크 간담회",,,https://www.newsway.co.kr/news/view?tp=1&ud=2022111722430866691,http://www.pressian.com/
2022-11-18 08:56:01,뉴스1,사회,[욜로은퇴 시즌2] 인생 오후의 네 가지 변화,"[     ▲경제건설위원회 행정사무감사ⓒ군산시의회전북 군산시의회가 지난 16일부터 오는 24일까지 9일간의 일정으로 2022년 군산시 행정사무감사를 실시한다. 시의회에 따르면 군산시정 전반에 대한 2022년 행정사무 감사에 들어간 가운데 경제건설위원회와 행정복지위원회 두 상임위는 집행부가 추진하고 있는 업무에 대한 날카로운 지적과 함께 대안 제시를 통해 행정의 변화를 주문했다. 행정사무감사 첫날 경제건설위원회는 소상공인지원과, 산업혁신과, 일자리정책과에 대한 감사를 진행했다. 먼저 나종대 위원장은 일자리 사업에 있어 경기 불황의 영향도 있지만 시민들의 기대치에 못 미치고 있다며 위기를 기회로 만들기 위해 일자리정책과의 노력이 더욱 필요하다고 강조했다. 한경봉 의원은 동백로 스마트상점화 사업 선정대상이 대부분 주류를 판매하는 상점으로 사업의 목적 및 특성에 부합하지 않은 부분을 지적하고 지원사업의 특성상 주로 음식을 판매하는 상점을 지원하는 것이 타당하다며 향후 사업 지원대상 시 신중하게 선정할 것을 주문했다. 김경구 의원도 상권 르네상스 사업 중 세느강 국밥 상가 지원사업과 공설시장 현대화 사업이 전반적으로 통일성 없는 인테리어로 인해 상가가 흉물처럼 방치되어 있다며 이에 대한 철저한 관리와 시정을 요구했다. 다음으로 서동수 의원은 상권활성화재단의 사업 진행 과정을 꼼꼼하고 정확하게 검토함은 물론 부실하고 부족한 부분을 보완해 소상공인들에게 더 적극적이고 과감하게 지원할 필요성이 있다며 집행부가 재단의 관리와 감독을 철저히 할 뿐 아니라 의회와의 소통과 협력을 강화하기 위해 적극적인 노력이 필요하다고 대안을 제시했다. 이한세 의원은 통계의 중요성에도 불구하고 현재 집행부의 통계조사 및 통계자료 활용·관리 미비함을 문제로 지적하고 상권활성화재단의 상권정보시스템의 통계자료와 군산시 통계자료를 연계하여 적극적으로 활용할 것을 주문했다. 이어 설경민 의원은 공공배달앱 배달의 명수 운영 부분에 대해 지적하며 장기적 투자가 어려운 현실을 고려해 이 사업의 미래를 진지하게 고민해야 한다고 성토했다. 또한 설 의원은 군산조선소 재가동팀이 5년 동안 있었지만 복직 지원이 원활히 이뤄지지 않았을 뿐 아니라 재가동협약 전에 교육비 등 예산을 시비로라도 확보해 더 많은 시민이 고용과 재취업이 될 수 있도록 노력했어야 했는데 부족했다며 앞으로 시민 취업에 도움이 될 수 있도록 업무를 추진할 것을 당부했다. ]",[],https://www.news1.kr/articles/4867988,https://n.news.naver.com/mnews/article/002/0002266625?sid=102
2022.11.18.,조선일보,,“제일 오래 걸린 거요? 겨우 5년. 하하” 그렇게 받아낸 자격증 103개,,,https://www.chosun.com/economy/startup_story/2022/11/18/6TA3RIOTYJA7RGLZHHQBEAUOVI/?utm_source=naver&utm_medium=referral&utm_campaign=naver-news,http://www.newsway.kr
2022.11.17.,아주경제,,"[정읍소식]전북 정읍새일센터, 여성 인턴 연계 기업 3차 네트워크 간담회 가져...",,,https://www.ajunews.com/view/20221117145131756,http://news1.kr/
