Date,Press,Category,Title,Content,Comment,URL_Origin,URL_Naver
2022.05.31.,뉴시스,,경단녀 정책 패러다임 바꾼다…'재취업→예방'으로 확대,,,http://www.newsis.com/view/?id=NISX20220531_0001891594&cID=10201&pID=10200,http://www.newsis.com
2022-05-31 11:00:00,경향신문,사회,“미 고령층 재취업 앞으로도 어려워…물가상승 압력 될 것”,"[ 기사내용 요약여성경제활동법 개정안 국무회의 통과경력단절 사유에 '근로조건' 새로 추가    [서울=뉴시스] 김명원 기자 = 한덕수 국무총리가 지난 30일 오전 서울 종로구 정부서울청사에서 열린 임시국무회의를 주재하며 발언하고 있다. 2022.05.30. kmx1105@newsis.com[서울=뉴시스] 김남희 기자 = 정부가 경력단절여성에 대한 정책 패러다임을 '재취업 지원'에서 '경력단절 예방'으로 확대한다.여성가족부는 31일 국무회의를 통과한 '여성의 경제활동 촉진과 경력단절 예방법 시행령' 전부개정안이 내달 8일부터 본격 시행된다고 밝혔다. 개정안은 정책 대상과 범위를 기존 '경력단절여성등의 경제활동 촉진'에서 '여성의 경제활동 촉진과 경력단절 예방'으로 대폭 확장했다. 또 경력단절이 주로 혼인·임신·출산·육아 등에서 비롯되는 것으로 보았던 이전과 달리, 성별임금격차 등 노동시장 구조 역시 주요 요인으로 작용하는 점을 고려해 경력단절사유에 '근로조건'을 추가했다.개정 방향에 맞춰 '경력단절여성등의 경제활동 촉진에 관한 기본계획'과 '경력단절여성지원센터(여성새로일하기센터)'의 명칭을 각각 '여성의 경제활동 촉진과 경력단절 예방에 관한 기본계획'과 '여성경제활동지원센터'로 정비한다. 여가부는 지난 2008년 경단법 제정 이후 경력단절여성에 대한 맞춤형 취업지원 등으로 경력단절여성 비율과 경력단절 유무에 따른 임금 격차가 감소했다고 밝혔다. 경력단절여성은 2014년 22.2%에서 2021년 17.4%로 감소했고 임금 격차는 2013년 66만원에서 2019년 35만6000원으로 줄었다. 여가부는 법 개정 취지에 맞춰 향후 경력단절예방에 관한 선제적 지원을 보다 강화해 나갈 계획이다. ]",[],https://www.khan.co.kr/economy/finance/article/202205301551001,https://n.news.naver.com/mnews/article/003/0011219928?sid=102
2022.05.31.,경남신문,,"경남경총, 재취업지원 프로그램 마무리",,,http://www.knnews.co.kr/news/articleView.php?idxno=1377900,http://www.khan.co.kr/
2022-05-30 15:52:01,울산제일일보,경제,"울산폴리텍대, 도배·실내 인테리어 신중년 단기과정·女재취업훈련 수료식","[     2019~2022년 미국 연령대별 노동시장 참가율.   오태희 한국은행 과장 제공코로나19 대유행(팬데믹) 기간 미국 고령층이 대규모로 노동시장을 이탈한 뒤 다시 진입하지 않는 이유는 직장연금과 건강보험 혜택 등이 축소됐기 때문이라는 분석이 나왔다. 이런 근로여건이 지속된다면 노동 수급의 차질 현상이 앞으로도 지속돼 물가상승 압력으로 작용할 것이라는 전망이 제기된다.한국은행 조사국 모형연구팀 오태희 과장과 이솔빈 조사역은 30일 공개한 보고서 ‘코로나19가 미국 고령층의 노동선택에 미친 영향’에서 “미국 55세 이상 고령층의 경제활동참가율이 여전히 코로나19 위기 이전 수준을 밑돌고 있다”고 밝혔다.연구진은 미국 고령자 패널자료(2006~2020년)를 이용해 코로나19 확산 과정에서 주요 인구사회학 및 경제적 변수들이 고령자(55~74세)의 노동 선택에 미치는 영향을 분석했다. 그 결과 팬데믹으로 인한 근로 여건 변화가 고령자의 노동시장 이탈 및 재진입 지연의 주요 원인으로 나타났다. 연금과 건강보험 혜택 등을 제공하는 양질의 일자리가 줄어든 게 고령자의 조기 은퇴에 가장 큰 영향을 미쳤다는 것이다.세부 내용을 보면, 직장연금 혜택을 제공받는 근로자는 비경제활동인구로 편입될 확률이 약 25.8~33.4%포인트 감소했다. 또 현재 고용주나 본인의 사업체에서 건강보험 혜택을 제공받으면 해당 근로자가 비경제활동인구로 편입될 확률이 각각 9.6%포인트, 8.2%포인트 줄어드는 것으로 분석됐다. 연구진은 “기존 연구에서 (고령자 대규모 은퇴의) 주요 요인으로 언급했던 정부로부터의 이전소득(재난지원금·실업수당 등), 학력, 인종 등이 은퇴에 미친 영향은 제한적이었다”고 덧붙였다.연구진은 양질의 일자리가 팬데믹 이전 수준으로 회복되면 고령자의 고용이 상당폭 회복될 수 있을 것으로 내다봤다. 직장에서 연금을 제공하면 은퇴자가 다시 취업할 확률이 37.8%포인트 늘고, 건강보험 혜택을 제공하면 이 확률이 6.1%포인트 증가했다. 자영업을 해서 연금을 납입할 수 있을 경우엔 자영업을 시작할 확률이 8.4%포인트 높아지는 것으로 나타났다.그러나 연구진은 현실적으로 고령층의 노동시장 재진입을 촉진할 만한 양질의 일자리가 창출되는 게 쉽지 않다고 봤다. 연구팀은 “이런 점을 고려했을 때 전반적인 노동 수급의 차질 현상이 앞으로도 지속되면서 물가 상승 압력으로 작용할 가능성이 있다”고 말했다.   ]",[],http://www.ujeil.com/news/articleView.html?idxno=305042,https://n.news.naver.com/mnews/article/032/0003150133?sid=101
2022.05.31.,비즈니스포스트,,[Who Is ?] 김정렬 한국국토정보공사 사장,,,https://www.businesspost.co.kr/BP?command=article_view&num=282528,http://www.knnews.co.kr
2022.05.30.,오마이뉴스,,"김경희 이천시장 후보 ""위기의 중년 지원 플렛폼 추진"" [6.1지방선거]",,,http://www.ohmynews.com/NWS_Web/View/at_pg.aspx?CNTN_CD=A0002839451&CMPT_CD=P0010&utm_source=naver&utm_medium=newsearch&utm_campaign=naver_news,http://www.ujeil.com/
11면 -1단,서울경제,,"금감원 퇴직자, 무더기 로펌행…금융사 '방패막이' 역할 우려",,,https://www.sedaily.com/NewsView/26667DPIX6,http://www.businesspost.co.kr/
2022.05.25.,헤럴드경제,,"노사발전재단, '2022년 재취업지원서비스 콘퍼런스' 개최",,,http://news.heraldcorp.com/view.php?ud=20220525000709,http://www.ohmynews.com/
2022-05-30 18:02:02,뉴스1,정치,"코오롱, 첨단소재 등 6개분야 5년간 4조 투자…취약계층 고용 확대","[ 재취업 교육과 새로운 일자리 알선 정책 구성                  ▲  김경희 국민의힘 이천시장 후보는 29일 중년 실직자를 위한 ‘위기의 중년 지원 플렛폼’ 공약을 발표했다.            ⓒ 김경희   김경희 국민의힘 이천시장 후보가 29일 중년 실직자를 위한 '위기의 중년 지원 플렛폼' 공약을 발표했다.김 후보는 ""백세 시대, 불확실한 미래를 제대로 준비하기 위해선 재테크는 물론 재취업은 필수""라며 ""물질적 필요성 외에도 일하면서 느끼는 보람과 긍지 등을 느낄 수 있고, 활동력 있는 중년을 위해 재취업 교육과 새로운 일자리 알선 정책을 플렛폼으로 구성해 적극 추진하겠다""고 말했다.김 후보는 ""저를 포함해 대다수 후보자의 선거 공약이 은퇴자와 여성, 청년에 국한됐다""면서 ""상대적으로 중년의 실직이나 건강 등으로 인한 불가피한 실업 문제에 소홀했던 면이 있었다""고 강조했다. 그러면서 ""중년의 실직은 한 사람의 문제를 넘어 가정의 위기로 이어질 수 있다""며 ""한 번 일자리를 잃게 되면 재취업이 쉽지 않은 현실에서 중년 한 사람에게 모든 짐을 지우는 것은 매우 가혹하다""고 말했다. 김 후보는 ""중년의 위기 극복을 지자체에서 재취업 교육과 일자리 알선 등 적극적으로 개입해 위기로부터 새로운 활력을 불어 넣어야 한다""며 ""다양한 자격증 교육을 무상으로 교육받을 수 있게 하고, 일자리 기업 연계와 경력 일자리 찾기 방안 등을 인터넷 플렛폼으로 만들어야 한다""고 덧붙였다.  ]",[],https://www.news1.kr/articles/?4696315,https://n.news.naver.com/mnews/article/047/0002355085?sid=100
2022.05.24.,한국경제TV언론사 선정,,"[단독] 금감원 국장급, 보험사로 우르르…우회 재취업 `논란`",,,https://www.wowtv.co.kr/NewsCenter/News/Read?articleId=A202205240148&t=NNv,http://www.sedaily.com
2022.05.24.,오마이뉴스언론사 선정,,"아이 첫 돌 전에 재취업, 기뻐했던 순간은 단 5초",,,http://www.ohmynews.com/NWS_Web/View/at_pg.aspx?CNTN_CD=A0002836479&CMPT_CD=P0010&utm_source=naver&utm_medium=newsearch&utm_campaign=naver_news,http://www.ohmynews.com/
2022-05-24 06:02:01,연합인포맥스,생활/문화," 美언론도 주목…""코스트코 주력 소비층은 아시아계 미국인...","[ 워킹맘 선배가 복직을 앞둔 세상 모든 워킹맘에게 보내는 편지【오마이뉴스의 모토는 '모든 시민은 기자다'입니다. 시민 개인의 일상을 소재로 한 '사는 이야기'도 뉴스로 싣고 있습니다. 당신의 살아가는 이야기가 오마이뉴스에 오면 뉴스가 됩니다. 당신의 이야기를 들려주세요.】2년 전 출산 해 1년 동안의 육아휴직을 마치고 곧 복직을 앞둔 아는 동생에게 전화가 왔다. ""언니 육아만 하는 것도 이렇게나 힘든데 어떻게 일하면서 아이도 봐? 언니는 어떻게 해? 몸무게와 체력은 돌아오지 않았는데 일만 돌아왔어. 나는 어떻게 돌아가야 하는지 막막하고 두려워. 8년 경력이 1년 휴직 앞에 다 무너진 것 같아."" 워킹맘 선배인 나는 동생의 걱정 앞에 많은 생각이 들었다. 몇 분의 통화와 한 끼의 몸보신과 몇 마디 응원의 말로는 다 안 될 것 같아서 긴 편지를 적어보기로 했다. 다 쓰고 보니 받는 사람의 이름에 아는 동생의 이름과 함께 세상 모든 워킹맘이 될 엄마들의 이름을 적고 싶어졌다. 오마이뉴스 시민기자의 이름으로 이 편지를 부쳐본다. 워킹맘이 된, 워킹맘이 될 너에게                  ▲  네가 회사에 출근한 이후부터는 일도 끝냈고 분명 퇴근도 했는데 또 출근한 것 같은 느낌이 자꾸만 들 거야.            ⓒ envato elements   어린 아이를 두고 복직할 생각에 걱정이 많지? 맞아. 이제 너는 엄마가 되어 생활도 삶도 예전으로 돌아갈 수 없는 상태가 됐는데, 회사는 예전처럼 돌아와 일하라고 하잖아. 아이는 너무 어리고 그렇다고 일을 안 할 수도 없고, 반가우면서도 불안할 거야. 너의 성장과 아이의 성장 중에 뭘 우선시 해야 할지. 네 몸은 하나인데 몸이 두 개여도 모자랄 일과 육아를 병행해야 하는 삶이 낯설고 어려울 거야. 자, 우선 옷장 속 슬랙스와 재킷을 꺼내 걸쳐보자. 들어가는지, 단추만 옮겨 달면 될지, 아니면 아예 새로 사야 하는지 생각해 보자. 설령 어딘가 끼어서 안 들어간다 해도 슬퍼하지 말고 절대 버리지 마. 몇 달이 지나면 다시 입게 될 거야. 단기 속성 다이어트의 끝판왕은 퇴근 없는 삶이거든.네가 회사에 출근한 이후부터는 일도 끝냈고 분명 퇴근도 했는데 또 출근한 것 같은 느낌이 자꾸만 들 거야. 워킹맘들의 진정한 퇴근은 '육퇴'인데 이게 야근에 특근까지 언제 끝날지 모르거든. 한다 해도 퇴근하자마자 또 출근해야 하는, 눕자마자 알람이 울리는 경험을 반복해야 하거든. 회사와 집. 출근해야 할 곳이 두 곳이니까. 회사에서 일하고 집에서도 일하고. 우리의 소원은 통일이 아닌 종일 아무도 없는 곳에서 잠만 자보는 게 될 거야. 미안. 시작부터 용기와 격려를 해주지 못해서. 하지만 큰 기대를 하지 않으면 큰 실망도 없을 거야. 난 너에게 '잘할 거야' 대신, '못할 테니 다 하려고 하지 말라'고 더 많이 얘기해 줄 거야. 네가 낙심하지 않고 결심하길 바라. 예전과 다를 거라는 결심. 그걸 받아들일 결심. 그 결심이 너와 고된 삶 사이의 완충이 될 거야. 아이를 낳고 찾아온 내 우울의 원인은 산후통과 세상과의 단절 때문이었어. 출산 후 망가져 버린 몸으로 돌봄을 받아야 하는데 돌봄을 하기만 해야 했지. 아이를 낳고 엄마가 아니라 할머니가 된 것 같았어. 너무 아파서 아파하기만 했어. 하루라도 빨리 건강해질 방법을 찾는 시도와 생각조차 못 했지. 그게 제일 후회돼.너는 무조건 너의 체력을 위해 돈을 아끼지 말고 투자해야 해. 각종 영양제와 건강기능식품을 넉넉히 주문해. 아이 비타민 젤리 주문하면서 네 종합비타민도 같이. 홍삼 주문하면서 1+1으로. 각종 밀키트와 맥주도 비상식량처럼 구비해 놓고. 시간을 쪼개서 운동도 꼭 하고. 왜냐면 넌 이제 생애 엄청난 노동을 해내야 하거든. 이 노동은 네가 지금까지 살아오면서 해온 각종 아르바이트와 직장 생활과는 차원이 다른 수준이야. 각오해야 해. 여기서 각오는 아까 말했듯이 '다 잘 해내야지'가 절대 아니라 '다 잘하려고 하지 말아야지'라는 각오야. 세상 거의 모든 워킹맘은 가사와 육아, 일까지 그 어느 때보다 가장 많은 일을 해내고 있는데, 항상 아이에게 미안하고 매번 직장에서도 죄송하거든. 중요한 건 총합으로 보는 마인드야. 아이를 낳기 전엔 네 일만 잘하면 됐어. 아이를 낳은 후엔 네 일만 할 수 없지. 출근 준비 전에 등원 준비, 퇴근 후엔 육아 출근. 그러니 너의 힘을 나누고 분산시킬 수밖에 없어. 그전엔 일하는데 10을 썼다면, 이젠 일에 5 육아에 5 이렇게 나눗셈해야 하는 거야. 그러니 각자의 기준으로 보면 일도 5가 모자라고 육아도 5가 모자란 게 돼. 둘을 덧셈해서 10. 총합으로 생각해야 해.설령 일4 육아3 가사1을 해서 2가 부족한 것 같아도 그렇게 생각하면 안 돼. 넌 이미 그 전에 12를 했던 거야. 과거를 존중하고 현재를 받아들여. 나도 그걸 못해서 과거를 그리워하고 현재를 부정하기만 했어. 엄마가 된 내가 제일 힘들었던 건 엄마가 된 나를 받아들이는 일이었어. 우리, 슈퍼우먼이 되지 말자                  ▲  적당한 엄마, 유연한 직장인, 나를 소모하지 않는 내가, 일도 잘 하고 아이도 잘 볼 수 있는 진짜 슈퍼우먼이야.            ⓒ envato elements   내 이야기를 더 자세히 해줄게. 나는 일이 중요하고, 일을 안 하면 못 살고, 주부와 엄마로만 살길 원하지 않아서 독박육아를 할 때 우울증이 왔다고 생각했어. 그래서 다시 일을 시작하면 바로 괜찮아질 줄 알았지. 그래서 아이가 10개월 때 취업 준비를 했고 감사하게도 내가 하고 싶은 일을 다시 시작하게 됐지. 그런데 최종 합격 전화를 받았을 때 내가 기뻐했던 순간은 5초에 불과했어.회사에서는 당장 그다음 주부터 바로 출근하길 원했거든. 당장 아이를 어디에 맡겨야 하나, 어린이집에 자리가 있을까, 합격이라는 기쁨 대신 엄마라는 슬픔이 몰려왔지. 날 대견해 하고 축배를 들어야 할 시간에 집 근처 어린이집에 전화를 돌리고 남편과 상의를 해야 했어. 물론 아이가 있으니 어쩔 수 없는 거였지만, 눈물이 나는 것도 어쩔 수 없는 거였지. 출근 후엔 매일 매일이 '멘붕'의 연속이었어. 아이 어린이집 등원 전쟁 치르고, 출근 전 장보고, 아이 반찬 만들어 놓고, 저녁에 먹을 국 끓여놓고, 빨래와 청소 집안일을 하고, 시간에 쫓겨 내 일 준비는 제대로 못 하고, 옷만 바꿔 입고 운전대를 잡았지.퇴근 후엔 아이를 꼭 껴안아 주고, 저녁을 먹고, 잠깐 놀아준 후 목욕시키고, 재우고, 밤 10시 '육퇴'를 하고 나면 해야 할 일들이 또 남아 있었어. 뜨거운 물 샤워를 하고 머리카락에 물이 똑똑 떨어지는 채로 깜깜한 식탁에 앉아 챙기고 주문하고 해야 할 일들의 목록을 적어가며 깜빡깜빡 졸았지.온종일 정신없고 피곤하고 졸리고. 시계를 얼마나 자주 들여다봐야 하는지. 가만히 앉아 따뜻한 커피 한 잔을 마시는 것도 책장을 넘기며 글을 읽는 것도 사치더라. 시간도 없고 체력도 없는데 시간과 체력이 제일 많이 드는 때였지. 출산 전 일만 했었고, 아이를 낳은 후 육아만 하다가, 이제 그 둘을 똑같이 갑자기 한꺼번에 다 잘 하려고 하니 붕괴되는 건 멘탈만이 아니었어. 일할 때는 어땠냐면 10년 넘게 아나운서로 일하면서 뉴스 진행은 내가 제일 잘 하는 일이었는데 자꾸만 오독을 하는 거야. 스튜디오에 앉아 녹화를 하고 있으면 손가락이 점점 붓고 어깨와 허리 통증이 심해지더라고. 내 경력과 실력으로 뽑힌 자리인데 실수를 반복하니 능력이 부족해 보이고 회사에는 면목도 없고, 자책하게 되고. 집에 와서도 너무 힘들고 피곤하니까 아이도 제대로 보지 못하게 되고 말이야.의지로 되는 건 체력과 여건이 받쳐줄 때 가능하더라. 그러니까 너는 힘과 환경을 꼭 만들어야 해. 복직을 앞두고 엄마가 해야 할 우선순위의 준비지. 그런데 처음엔 일도 잘하고 싶고 아이도 잘 보고 싶은 의욕에 슈퍼우먼이 되어야 할 것 같은 마음이 들거든. 혹시 너도 그런 마음이 올라오거든 이 문장을 읽어봐 내가 한 칼럼에서 보고 밑줄 친 문장이야. '슈퍼우먼이 돼보려고 돈도 벌고 애도 보다가 평범한 인간임을 깨닫고 결국 사표를 낸다.' 우린 그만두지 말자. 슈퍼우먼 되지 말자. 아이도 일도 나도 소중하니까. 이제 우린 무한한 발전과 성장보다 유지와 지탱이 더 중요한 생의 시기가 됐잖아. 사실 엄마가 평범한 인간이라 사표를 낸다기보다 여성이 돌봄과 일 모두를 떠안아야 하는 구조와 워킹맘에게 더 유연하지 못한 근무환경과 인식, 더 넓은 보육 지원 등 많은 원인이 있지.우리가 당장 바꿀 수는 없지만 경험한 우리가 말할 수는 있잖아. 엄마의 말은 귀해. 수다부터 토론까지 많이 말하자. 나도 없는 체력을 끌어모아 말하고 쓸 거야. 내가 아끼는 동생이, 직장 후배가, 수많은 워킹맘들이 더 수월하게 일하고 아이 키울 수 있길 진심으로 바라거든. 나의 멘붕이 조금씩 돌아오기 시작했던 건 운동을 시작하고, 아이 반찬은 사 먹이고, 피곤하거나 해야 할 일이 많은 날에는 배달 음식 시켜 먹고, 주말에 남편에게 아이 맡기고 혼자 카페에 가서 두세 시간 커피 마시면서 책 보고 글 쓰면서였어. 포기가 괜찮아지게 하더라고. 무질서 뒤엔 질서가, 혼돈 뒤엔 안정이 오더라. 노력과 견딤과 시간이 만들어 낸 거지. 그 과정에서 아주 힘들었지만, 다시 일을 시작한 지 1년이 다 되어가는 지금에야 합격의 축배를 제대로 들 수 있을 것 같아. 대단하고 자랑스러운 건 슈퍼우먼이 아니라 평범한 인간이라고 생각해. 너와 나, 세상 모든 엄마들이라고 생각해. 멘붕이 올 때마다 네 주변의 선배 워킹맘들에게 전화해. 누구보다 너의 고생과 힘겨움을 이해해주고 짜증과 한탄을 받아 줄 준비가 되어 있는 사람들이야. 같은 경험은 상대방을 이해하는 폭을 넓혀줘. 그것이 육아라면 더 하지. 진짜 지치는 날엔 아이를 누군가와 어딘가에 맡기고 주말에 호캉스를 하자. 거기서 잠만 자는 거야. 격하게 쉬는 거야.출산 후 우리의 몸으로 할 수 있는 일의 양은 예전과 달라졌어. 이제는 일 하면 일을 안 하는 시간이 반드시 필요해. 일보다 쉼의 양이 조금 더 많아야 유지가 돼. 쉽지 않겠지만 노력하자. 기억해! 적당한 엄마, 유연한 직장인, 나를 소모하지 않는 내가, 일도 잘 하고 아이도 잘 볼 수 있는 진짜 슈퍼우먼이야. ]","['일하면서 독박육아 할바에야 임신하지마시길.. 자멸의 길이니.\n맞벌이 하며 육아는 둘이서 계획적이고 전투적으로 역할분담 확실히 해야한다\n둘중 한명이 육아에 무관심하고 이기적으로 생활하기 시작하면 아이는 아이대로 문제가 생기고 가정의 평화는 더이상 없다.', '공감 100배', '30년전에는 30년후엔 이런걱정을 안하는 세상이 되어 있을줄 알았다. 여자들이 더 많이 취업하는것만 바뀌었을 뿐. 나아진게 없구나 ㅠ', '청소도우미나 베이비씨터, 양가 부모님의 도움을 받고, 그 비용에 아이의 정서까지 돈으로  환산해 내 월급과 손익 계산 해 보며 차라리 전업 주부가 나은게 아닐까라는 자괴감도 버려야  합니다. 당장은 너무 힘들어도 나중에 돌아보면  그 때 일을 놓지 않기를 잘 했다는 생각이 들 날이 반드시  와요. 적당히  쉬엄쉬엄 해야 합니다.', '나는 소모품이 아니었지, 나를 더 귀하게 대접하고, 나를 더 사랑해주자♡ 좋은 글 고맙습니다', '건강하게 잘 놀던 아이가 출근만 한다하면 딱 아프다ㅠ 신기하다...오전업무를 마치고 점심시간에 한술뜨려는 순간 전화가 울린다. 아이가 열이 나니 데려가란다..이런 일들이 비일비재, 초등학교저학년까지 이어지는 워킹맘의 아픔. 겪어보지않으면 절대 모름.', '결혼을 하지마는걸로...해봐야 여자만 손해...', '너무너무너무너무 공감가는, 모든이가 필독했음 하는 글이네요!!! (이 모든것을 출산 전에 알았더라면 좋았을걸ㅠㅠ)', '온전한  직장인도 온전한 엄마도 아닌 삶에 자괴감과 번아웃에  빠져요. 유지와 지탱이라는 생의주기라는 말에 무릎을 칩니다. 나를 갈아서 완벽한 누군가가 되기보다 내 안의 목소리와 건강에 관심을 갖는 삶이 되길.', '이론 글에 댓글이 10개가 안 된다니... ㅠ', 't이런 사안은, 사주(社主) 또는 사풍(社風)의 수준에서 잡아가는 것이다. 예전의 000사~~~~~육아휴가가 끝나고 출근하는 여직원에게는 일보다 먼저 ""푸근함""을 준다. 상사들은 그 여직원이 오히려 귀찮아할 정도로 육아에 관해서 이런저런 걸 물어보면서 농담을 한다. 거의 6 개월 정도를 느긋함을 주는 것이다. 그 이후에도 일상적이고 힘들지 않은 업무로 배려한다. ""일보다 육아가 더 귀한 업무""라는 걸 깨닫도록 배려하는 것~. 그래서 퇴직한 이후에도 다녔던 회사를 자랑스럽게 말하는 것이다. 사주/사풍의 수준이다.', '제목 쓰레기 그럼 그냥 디지시던가 평온하게', '좀 포기해야 한다는걸 아이가 10살 넘어서\n알았네요. 허리 다 망가지고 건강 나빠진 상태로 ㅜㅜ\n엄마가 집에 있는 아이는 엄마들이 엄청 잘해줄거라는 \n일종의 피해의식에 사로잡혀 날 채찍질했죠\n\n해본 사람만 아는 공감되는 글이네요', '슈퍼우먼은 됐고 평균만 되기도 벅차다. 조금만 바빠도 눈 돌려보면 애가 꾀죄죄하게 다니기 십상.', '윤석렬대통령 부부는 아이 없이도 잘 살고 있잖냐 ?....대한민국의 롤모델 부부....', '', '아기가 돌인데 저는 자신이 없어서 육아만 하고있네요..육아만으로도 벅찬데 워킹맘님 존경스럽습니다ㅠ 쉬엄쉬엄 하며 육팅입니다!!', '이상하내 나도 그렇지만 주변 친구들도 그러고 집안일 열심히 하는대 빨래는 전담으로 하고 식사도 일찍 집에 오는 사람이 준비하고 주말엔 모든일 다 같이하고 얼마나 서로들 열심히 사는대 요즘은 대부분이 이렇지 않나?', '']",http://news.einfomax.co.kr/news/articleView.html?idxno=4216286,https://n.news.naver.com/mnews/article/047/0002354144?sid=103
2022.05.26.,천지일보,,"의정부일자리센터, 재취업할 경력단절 여성 15명 모집",,,http://www.newscj.com/news/articleView.html?idxno=985297,http://www.einfomax.com
2022.05.26.,매일노동뉴스,,기업담당자 위한 재취업지원서비스 콘퍼런스,,,http://www.labortoday.co.kr/news/articleView.html?idxno=209118,http://www.newscj.com
2022.05.31.,에듀동아,,"프리미엄 복합문화공간 공급, 스터디카페 작심",,,http://edu.donga.com/?p=article&ps=view&at_no=20220531085102280036,http://www.labortoday.co.kr/
2022.05.30.,뉴스1,,"尹정부 국정과제 '부산 이전' 산은, 인재 엑소더스 시작되나",,,https://www.news1.kr/articles/?4694681,http://edu.donga.com
2022.05.24.,뉴스1,,"오세훈 ""청년·중장년·경단녀·장애인 취업 돕겠다""",,,https://www.news1.kr/articles/?4690027,http://news1.kr/
