Date,Press,Category,Title,Content,Comment,URL_Origin,URL_Naver
2017.01.04.,경남신문,,인구와 주택- 조윤제 경제부 부장대우,,,http://www.knnews.co.kr/news/articleView.php?idxno=1202056,http://www.knnews.co.kr
2017.01.19.,내일신문,,"가계부채 압박, 저소득층 훨씬 심각",,,http://www.naeil.com/news_view/?id_art=224815,http://www.naeil.com
2017.01.08.,연합뉴스,,"""나혼자 산다""…2050년엔 10가구중 4가구 '1인'",,,http://app.yonhapnews.co.kr/YNA/Basic/SNS/r.aspx?c=AKR20170107045800003&did=1195m,https://www.yna.co.kr/
