Date,Press,Category,Title,Content,Comment,URL_Origin,URL_Naver
2023-01-11 07:07:00,정신의학신문,사회,겨울철 낙상사고 '3세대 맞춤형 인공관절'로 개선,"[ [사건의 재구성] 보험금 노려 고의사고 내고 ""못봤다""법원 ""반성 기미 안보여…엄하게 처벌해야"" 징역 20년    ⓒ News1 최수아 디자이너(군산=뉴스1) 김혜지 기자 = ""아, 엄마 나 (음료수) 흘렸어.""지난 2020년 9월11일 오후 2시24분께 전북 군산의 한 도로에서 운전 중이던 A씨(43·여)는 차로 변경 직후 들고 있던 음료수를 바닥에 떨어뜨렸다. 조수석 뒷자리에는 전 시어머니 B씨가 타고 있었다. 몇 초 뒤 A씨의 승용차는 무언가에 부딪힌듯 ""쾅"" 소리를 내고 멈췄다. A씨와 B씨는 ""이거 뭐야"" ""기다려봐""라며 상황을 살폈다.차에서 내린 A씨는 트렁크 쪽으로 갔다. 70대 여성 C씨가 쓰러져 있었다. A씨는 곧바로 119에 신고했고 C씨는 병원으로 이송됐다. C씨는 치료를 받았지만 다발성 골절로 끝내 숨졌다.A씨는 이 사고로 형사 입건됐다. 하지만 유족과 원만히 합의해 중벌을 피할 수 있었다. A씨가 가입한 보험회사는 그해 11월13일 교통사고 처리 지원금 명목으로 유족에게 1억원을 지급했다. A씨가 가입한 또 다른 보험사도 합의금 명목으로 총 7606만2400원을 유족에게 줬다.가해자인 A씨도 억대 보험금을 받았다. A씨는 공소장을 첨부해 보험사에 제출했고 형사합의지원금 명목으로 1억2000만원을 받았다.사망사고는 이렇게 마무리되는 것처럼 보였다. 하지만 얼마 후 A씨는 법정에 서는 신세가 됐다. 적용된 혐의는 살인 및 보험사기방지 특별법 위반이었다.진실은 수사를 통해 드러났다. 이혼 후 경제적 어려움에 시달렸던 A씨는 전 남편과 과실로 교통사고가 발생한 것처럼 꾸며 보험금을 받았던 것으로 조사됐다. A씨의 전 남편은 2015년부터 여러 차례 고의로 교통사고를 낸 전력이 있었다. 이 같은 범행으로 전 남편은 약 8개월간 보험금 9600여만원을 받았다. 그가 얻은 근로소득의 2배가 넘는 금액이었다. A씨는 전 남편의 범행을 모방했다.A씨는 사고 당시 70대 노인 C씨가 길을 건너는 모습을 보고도 속도를 줄이지 않은 것으로 확인됐다. 오히려 A씨는 C씨가 도로 가장자리에 다다른 순간 핸들을 살짝 꺾어 들이받았다. 당시 속도는 시속 42㎞였다.하지만 A씨는 수사기관에서부터 줄곧 혐의를 부인했다. A씨는 ""사고 당시 음료수를 (마시려다) 흘려 고개를 숙이고 닦는 사이에 사고가 났다""며 ""충돌이 이뤄지고 나서야 C씨가 부딪힌 사실을 알았다""고 진술했다.하지만 동승했던 전 시어머니의 진술은 달랐다. B씨는 ""(사고 당시) '충격이 발생한 것과 동시에' A씨가 음료수를 쏟았다""고 말했다. 엇갈린 진술은 유죄 판단의 근거로 작용했다. 법원은 ""사고 당시 차 안에 함께 있던 두 사람의 진술이 엇갈려 A씨의 진술을 믿을 수 없다""고 판단했다. 또 ""A씨의 진술대로 진로 변경과 동시에 음료수를 마시려 했더라도 전방을 주시하며 정차하거나 감속이라도 하는 게 정상인데 계속 가속했다는 것은 납득하기 어렵다""고 봤다.1심 재판을 맡은 전주지법 군산지원 제1형사부(부장판사 정성민)는 지난달 8일 ""피고인이 교통사고를 가장해 일면식도 없는 피해자를 살해하는 방법으로 보험금을 취득했다""며 ""기대여명이 얼마 남지 않아 유족들과 쉽게 합의에 이를 것으로 기대되는 고령인 피해자를 골라 범행해 죄질이 매우 좋지 않다""고 지적했다.그러면서 ""피고인이 시종일관 범행을 부인하며 반성하는 태도를 보이지 않고 있어 엄히 처벌할 필요가 있다""면서 ""다만 피고인이 금고형의 집행유예 이상의 형사 처벌을 받은 전력이 없는 점 등을 종합해 형을 정했다""면서 징역 20년을 선고했다.그러자 A씨는 무죄를 주장하며 항소장을 냈다.   ]","['세금이 아깝다 쳐죽여도 션찮을것을 ㅠ', '70대 아주머니가 너무 불쌍하게 돌아 가셨다 .ㅠㅠ', '층간소음으로 사람 찔러죽여도 22년, 계획적으로 사람치어 죽였는데 20년!  마약 사기범은 집유나 길어야 삼년!!!! 한국 법은  기준이 오직 돈이구나!\n유전무죄 무전유죄!', '그런데 사고 내면 유족뿐만아니라 사고낸 사람에게도 치료비 말고도 보험금을 주나요??', '악마네', '전인하다 누구에게는 엄마얏을 할머니이고 소중한 가족을 \n살인이다 평생 감빵에서 기어나오지 못하게 해야한다', '가해자가 돈받는 보험 ㅋㅋㅋㅋㅋㅋ 이러니 나라가 개판되지', '', '가해자인 A씨도 억대 보험금을 받았다. A씨는 공소장을 첨부해 보험사에 제출했고 형사합의지원금 명목으로 1억2000만원을 받았다. ==&gt; 이렇게 돈을 받을 수 있으니 저런 짓을 하지. 도대체 피해자에게 주는 돈을 제외하고 왜 가해자에게 별도로 돈을 지급하나? 이해가 안 되네. 저런 범죄를 언제든 유발할 수 있는 보험 규정이라고 본다.', '', '보험사에서 합의금 명목으로 1억+7600=1억7600만원 피해자에게 합의금 주고, 가해자 형사합의금 명목으로 보험사로부터 1억2000만원 받고. 고의든 자의든 운전자 과실로 길가던 사람이 치여 죽었는데, 결국 가해자가 1억 2000만원을 벌었네? 보험사가 일처리를 이따위로 한다고?', '', '', '이렇게도 살인 저질러서 일억을 타먹는구나..  보험은 있어야하는건가? 길가다 저렇게 죽을수있다니 무섭구먼', '역시 보험사기하면 전라도네', '보험이  잘못됨 사고냈는데  보험이 피해자 한테 안가고 사고낸 사람에게 들어가니 저런짓 하지', '사람 목숨을 너무 우습게 생각하는거 같네요. 20년도 가볍다 생각합니다.', '보험 사기꾼은 사람이 죽든 안죽든 그냥 기본 20년 하자.  사회 전체를 병들게 하는 암덩이 같은 존재들이다.  이게 보험 사기를 당한 사람들만 고통 받는게 아니고 결국 사회 전체의 보험 부담이 올라가게 되는 결과를 낳는다.  그리고 보험 사기의 상당수가 다른 사람을 해하거나 죽여서 돈을 받을때가 많아 형량을 대폭 늘려서 그런 놈들을 겁에 떨게 해 줘야 할 필요가 있음.', '그렇게 해서 노인 들을 수 테 죽였는데 아주 죄질이 나쁜데도  사형 때려야지 처벌이 그거 밖에 안되나 노인은 아예 사람 취급도 안 하는 건가.', '무슨 보험을 저딴걸 만들어놓으니 이런일이 생기고 보험료만 오르잖아. 저런 살인을부르는 보험은 없애라', '...그 아주머니는 무슨죄인가.....\n그냥 사형도 아깝다. 죽을만큼 고통을 죽을때까지 느끼다가 죽게만들어야 한다.', '전 시어머니를 뒤에 태운다???\n위장이혼에도 사연있을 거다..', '보험사들이 가해자에게 보험금을 무차별적으로 지급해주니 범죄를 조장했다고 밖에 볼수없다. 가해자는 보험금 혜택을 최대한 줄여 지급해야 저런 고의사고로 보험금을 수령하려 범죄를 저지르지 않는데 어떻게 보험금만 계속 올리고 가해자 피해자에게 주는 보험금 살펴보지도 않냐', '당대표 호위하며 쫒아다니지 말고 허술한 법 좀 개정하고 일 좀해라 이 국개의원들아!!!!', '진짜 악마같은 범죄네', '', '전라도에선 일상생활 밥상머리교육의 결과', '', '보험사기범은 엄벌이 필요합니다.  거기다 사망사고에 이르렀다면 살해협의로 무기징역 가야죠', '', '가해자한테 보험금이 왜 가죠?', '역시 보험사기 압도적 1위 지역답네 ㅋㅋㅋ 통수의 통수는 기본인 동네 ㄷㄷㄷ 속는 사람이 바보취급당하는 동네 ㅠㅠ', '사고를 내도...돈을 버는 구조는 대체 뭔가', '존라도', '', '그 지역...', '역시 라도는 지들만의 신석기시대에 살고 있네', '기대수명이 짧으면 같은 사람이 아닌건가? 그렇다고 어린아이 관련 사건에서 양형 더주는건 본적이 없는데? 갖다붙이는 아무 의미 없는 말들이 너무 많다', '', '두 집 송두리째 파탄 냄.. 악마다', '사형시켜라', '참 무식하게도 범행을 저지른다\n그 어깨위에 달고있는.대가리로.생각한게 \n고작 고정도인지.', '뻔뻔한 살인자. 싸패가 따로없네.', '전라도 라는곳은 40대 아줌마도  무서운곳이네...', '전라도군산', '저것들 세워놓고 똑같이 해줘라', '저런생각을 하고 또 실행한다는게 너무 소름끼치네\n악녀 사형제도 다시부활해야된다', '근데 왜 가해자한테 보험금을 왜 주는겨??', '전라도것들은 상도덕이 없ㅇ', '전주지법 군산지원 제1형사부', '악마냐?', '이젠 자신의 이득을 보기 위해 여자들도 거침없이 시민들 살해 하는 세상이네!', '무서운 세상...  끔찍하고 더러운~~~  세상 말세 로세~~~', '', '', '전라도는 뭔가 있나봐 족속들이 신안도 그렇고', '', '전 시어머니와 전처가 입을 맞추지 않아서 생긴 일 아냐?', '제발 사형시켜라', '', '고의로  살인햇는데   전과가없고   반성하면  무조건   감형이되네요   모두에게  적용되면    살인이밥먹듯이  일어나겟네', '살인했는데 고개 숙이고 사과한다고 실수?뭐 친구들끼리 교실에서 때리는 놈 막는 실랑이 하냐?자전거로 사람 받아도 대인사고.차로 걸어가는 사람들 치고는 숨길 생각하는 것 많아.', '저렇게 사람 차로 죽이면 답이 없네 실수다 몰랐다', '', '보험금 때운에 사람을 죽이고 거짓말로 일관하고 죄의식이 없다는 건 ...  심각하네요', '보험 사기 아~무나 해먹나. ~ 보험 사기 구속 이란다.~~~~', '', '동쪽은 다단계 사기가 많고 서쪽은 보험사기가 기본이고 . 수도권은 나라를 상대로 사기치고 에라이~ 사기공화국~ 선량한 보험가입자만 엘롱되는 세상~ 보험사기가 기하급수적으로늘고 있다. 국가적인 차원에서 관리 감독 할 필요가 있고 터무니 없는 사망보험상품은 법으로 근절해야 한다. 금액을 살인으로 몰고갈 수준에서 내리든지~', '그런데 조수석 뒤에 타고 있던 사람은 전 시어머니 아닌가요? \n왜 이혼했다면서 전 시어머니가 타고 있고, 시어머니한테 왜 엄마 라고 하나?', '', '', '저런건 무기징역을 떄려야지 범죄자가 고통받는데 드는 돈은 아깝지 않으니까 그걸로 세금 올려도 뭐라할 사람 많지 않다 제발 범죄형량좀 올려라!', '아쓰바리  돈만있으믄 걍 살이해도 20년정도 살고나오면 땡이구마  이게 법이냐  고의성 살인이면 강력하게  무기징역이나 사형으로 판결해야지  이렇게 처벌이 약하니 여기저기 10대부터 한탕주으로 강력범죄가\n여기저기  터지는거다', '', '무서운 세상이다.', '정치인들이 부정부패를 죄의식없이 저지르고도 뻔뻔하니 사회가 점점 닮아가는 듯..', '범행을 하는데,,,,초범?이 시어머니를 태우고, 음료수를 마셔가며 범행을 한다는건 좀 의아하다.', '무서운 여편네일쎄..보험사기를 지들끼리 치던가 왜 애꿋은 남을 해치면서까지 사기질이냐? 형사합의금도 나중 보험금으로 청구할수 있으니깐 그것까지 노린 신종 범죄인데, 대체 어디서 저런 천인공노할 짓을? 응? 전라...국에서 발생한 사건였구만..', '', '법은관대하네 살인을20년 밖에', '보험은 진짜 모르겠다 왜 사고낸 가해자도 무슨 보험 이득이 있나여?', '중국스럽네. 다른 사람을 사람으로 안보고 돈으로 보이는\n저 마인드.', '헐..보험 보완하지 않으면 이런 미친짓은 계속 발생하겠어요.ㅜㅜ', '저거 tv에서 봤는데.. 합의금이 나이든 분들은 상한선이 낮아서 일부러 사고내는 놈 있던데', '돈 1억때문에 사람을 차로 치여죽이나 미쳤다 진짜', '사고낸 가해자한테 합의지원금이 웬말이냐. 사기꾼과 가해자 천국인 대한민국', '사람이 아니다 실수로 동물을 쳐도 몇달을 잠을 못자는데 고의로 어르신을 죽이다니!! 정말 돈에 영혼을 팔았네~', '', '시부모 쌍으로 보험사기 자지르고\n다니는데 구속도 안되고 신기하다.\n입원하는 개인 정형외과도 따로\n있고.....\n돈받고나면 여행 등산 다님..\n\n대학병원 외상센터.보고나면\n그런짓 못한다\n나이롱도 그런 나이롱이 없다', '전 남편이 그런짓 했음 신고를해야지 그딴걸 따라하냐', '전북이가?먹고살기 힘드나? 땀흘리고 사는것이 기본이다', '이런건 기사내지마라 남의 생을 담보로 이런사고칠수있다는게 소름끼친다 모방범죄 겁난다', '찢어버리고  징역70년', '판사님  판결 잘하셨어요 👍   가해자는 벌받아야함', '증거가.....심증......내가 고의로죽였는지. 실수인지.......', '방법이  너무  ""야비  하다   차라리  지나가는  ""멧돼지나  \n황소를  받아서  죽여라  그러면  여럿이서  ""회식이나  하게...', '전라도  호남 전주에서  젊은 전롸디언 여자가 사기를\n위해  차로 살인  여순반란사건 처럼 몰살해야할\n인간들아', '전라도', '한국여자.', '이게 보험사기가 아닌 보험회사에서 돈 주기싫어서 법적처벌한거 같은 느낌인데?? 보험들고 보험금 받으면, 사기꾼으로 몰아서 법적으로 처벌하는 나라가 된건가', '', '어휴ㅠㅠ 삼가 고인의 명복을 빕니다.', '졸라도는 과학이여', '사람 죽이고도 뻔뻔하고 흉악한 것이 문재앙 찢죄명 같은 넘일세', '돈있는 승리는 마약유통에 성매매알선, 성폭행을 저질러도 집유가 나오는데 ㅋㅋ 세상 참', '결론은 자기 보험금 타려고 남 죽인거네?', '', 'ㅊㅊㅊㅊㅊ.ㅡ10번 사고내면.ㅡ10억 이상 받을수 있는거네요.ㅡ?ㅡ모방범죄 많이 일어날꺼임 ㅡ', '', '살인자 세상에 뒤에 어머니 태우고 그런짓을\n하고 싶을까', '나같이 무사고30년은  되레보험 올리드만   돈이  줄줄샌다이런대로', '판사 꼴리는대로 할수있구만 근데 권력 OOO은 솜방이 때리고 그러냐? 아 딸랑이라서 그런건가?', '뻔뻔한 개호로싸양련이네 ㅉㅉ 그냥 단두대에 올려라', '오히려 A씨는 C씨가 도로 가장자리에 다다른 순간 핸들을 살짝 꺾어 들이받았다./기대여명이 얼마 남지 않아 유족들과 쉽게 합의에 이를 것으로 기대되는 고령인 피해자를 골라 범행/그러자 A씨는 무죄를 주장하며 항소장을 냈다.//소름돋는다.. 유족도 보험사기에 가담했다는 줄 알았네.', '솜방망이 처벌이 지금처럼 계속되는 한 이 나라의 미래는없다!!!!!!! 다 들고 일어나야한다.언제까지 국민정서와는 정 반대인 판결만 해대고 있을거냐~ 사형제도 집행이 절실한 나라 대한민국.', '아 인류애 개박살', '자동차 보험 말고도 사회에 각종 사기가 만연하다 정상적 일 해서 돈버는것 보다 보상금, 합의금  받아 챙기는게 훨씬 낫다는 사고방식이다!.. 다 문씨가 피해자 약자 지상주의로 해서 때문이지만.. 이제 정부는 비 합리적 보상이나 합의금 입원 등등은 냉정하게 인정 해주지 마라!.', '', '대장동 관련 증인이 자살? 당한것도 혹시...', '구라도 손발이 맞아야 치지 ㅋㅋㅋㅋ', '고령자들 길거리 무서워서 다니겠나?ㄷㄷ', '', '재징역맛없재 기대여명이 길지않은유족과 쉽게합의하는 기대할고령인피해자를 골라 범행 다발골절형사입건 피고인이교통사고를 가장 길건너는모습보고 조수석뒷자리에 시어머님 형사합의금명목돈받고 집행유예 형사처벌', '', 'ㅣ', '', '죄질이 매우 나쁜 케이스다 가중처벌해서 5년더 얹어드려야할 듯', '돈에 미친 살인마네', '', '', '살발', '와.진짜 미친 또라이들  왜 이케 많음. 말이되냐! 세상에 어떻케  그런생각으로  사람을  그케  만드냐! 진짜   감옥에  보내는것도  호사다.  OOO  따로 수감하는데  잇음 조켓다. 맹수의  밥이 되게', '모방범죄가 또 생기겠네요', '누구는 마약14회에 소지에 봐주고ㅋㅋ 누구는 20년 ㅋㅋ', '세상은 악마 소굴이네요ㅜㅜ', '가해자가 이기는세상 썩열 법', '짭짤하네', '인생 말종. 마누라에게도 그럴거냐? 요즘 정신나간 놈들 많다.  사형제도 붓놜시켜라. 이런 놈들 세금으로 밥먹이지 말자.', '', '', '', '십팍 시어머니도 콩국물이라도 줘야지 혼자 홀라당 먹으려니까 열 받아서 찌른겨', '', '고인의 명복을 빕니다.. ㅜㅜ', '', '시어머니랑 입도 안 맞췄네 단순한건가 멍청한건가', '5년도 아니고 20년과 1억은ㅋㅋㅋ피해봤네 ㅉ', '싸이코패스인가? ㅡ.ㅡ;', '', '이세상에 있어서는 안될 인간이다.이사회에서 영원히 격리시켜야한다.', '와 소름 사람이길포기하네 아무리힘들어도 그러면안돼', '시애미가 씨레기네ㅉㅉ별잘못안한거같은데~풀어줘라 돈도주고', '이런 사람들이야말로 정신병원에 가야하지 않을까?내 안위를 위해 한 사람의 고귀한 인생을 파리목숨으로 취급하는!!', '여자 보험사기범은 끈질기게 잡아낸다. 남자 보험 살인마들은 잡을 의지도 없어서 여자친구 강제로 낙지먹여 살해하고 20억 보험금 챙겨 방탕하게 살고 있는 X끼나 아내 교통사고로 위장하여 살해하고 95억 보험금 챙겨 호의호식 하느 새X는 다 무죄판결 내리고. 법의 정의란 여성에게만 해당한다.', '꼬솜타', '운전자 보험 가입하면 사고냈을 때 합의금 지원된다. 몇년 전부터는 민식이법 영향으로 보험금도 조금 오르고 지원금도 3,000만원 수준으로 올라갔지. 어쩌겠냐? 법이나 제도가 바뀌면 그걸 악용하는 놈들이 생기는 것을.....', '가해자도 돈받는구나...이상한 시스템이 살인자들에게 명분투척', '', '중립', '', '뉴스가 방법을 알려주네...그런데 차마 실천을 하는 이가 몇 있으랴..세상이 참 무섭게 돌아간다ㅜㅜ', '', '그래도 20년이면 생각보다 많이 나왔네요? 사람 죽여도 전과 없으면 7년씩 떄리더니', '완젼 스 1958벌 럼이네', '', '문죄인이가 만든 미친 사회!   미쳐 날뛰는 미친 인간들. 저런 범죄를 저지른 인간이나 20년 밖에 안때린 판사나 다 쓰레기들.', '사고내서 사람죽인 사람한테도 보험회사에서 돈을 주는 것 자체가 말이 안 되는거 아닌가? \n그러니 그걸 이용해 먹는 OOO들이 생기지', '거시기의 타고난 품행불량성을 다시한번 확인하는 사건이군', '', 'OOO이네 살인죄로 기소해라', '', '똑같이 해주고싶다. 나는 5000에 해줄게 반값', '', '', '총살ㄱ ㄱ', '이런  사기꾼  때문에  보험료만  올라간다!  지지배야!', '', '', '', '길 건너는 노인 보고 액셀 밟은 40대…통장에 1억 입금됐다', '', '아...라도....납득이되네', '', '건희 친구?', '전라도....끄덕끄덕', '', '실수였더라도 사망사고는 과실치사죄...', 'ㅋㅋㅋㅋㅋㅋㅋ 절라더 군산이랍니다. 해외소식 노관심입니다. ㅋㅋㅋㅋㅋ', '', '', '아따 당한놈이 문제랑께 뭔 호들갑이다냐', '인간말종 악마! 멀쩡한 한사람의 생명을 앗아간 저런 살인마들은 한구덩이에 쳐넣어 사형을 시켜야 하는데 우리나라법은 너무 관대해!', '', '전남편 물귀신 작전?', '아따 우덜지역에서는 민속놀이랑께~우리의 놀이를 왜 막는것이여?그래서 우리가 검수완박햇당께~ 근데도 여전히 검찰공화국인기라~우리 슨상님 계실적에 이란적 없었는디ㅣ큰일 나부렸당께', '한국여자들의 무서움...이나라가 어찌될려고 이러는지 모르겠다 여자가 운전을하질 않나 살림은 안하고 카페에서 수다나 떨고 있지 않나...ㅉㅉ', '저런 여자 독종 석렬이 막먹네', '보통 가족이라면 사실이라도 저런증언을 하지 않을텐데~~ 시어머니란분의 증언이 유일한 증거라면 좀 더 신중하게 봐야 할 필요도 있어 보이는듯.................................전 시어머니가 더 무서운건 나만 그런가??', '', '보험금 사기 라고   보기에는   증거 불충분\n그리고  이것은   교통 치상인데   .     살인으로 처벌  이네\n 판사님도  욱하는 성격있어 보이시네', '보통 가족이라면 사실이라도 저런증언을 하지 않을텐데~~ 시어머니란분의 증언이 유일한 증거라면 좀 더 신중하게 봐야 할 필요도 있어 보이는듯.................................전 시어머니가 더 무서운건 나만 그런가??', '', '보험금 사기 라고   보기에는   증거 불충분\n그리고  이것은   교통 치상인데   .     살인으로 처벌  이네\n 판사님도  욱하는 성격있어 보이시네']",http://www.psychiatricnews.net/news/articleView.html?idxno=34071,https://n.news.naver.com/mnews/article/421/0006569521?sid=102
2023.01.11.,SBS,,"미국 아파트, 찜통더위로 숨진 노인 3명 유족에 200억 원 보상",,,https://news.sbs.co.kr/news/endPage.do?news_id=N1007039793&plink=ORI&cooper=NAVER,http://gnnews.co.kr
2023.01.25.,충남일보,,"대전동부서, 지역 노인 대상 교통안전교육 실시",,,http://www.chungnamilbo.co.kr/news/articleView.html?idxno=699393,http://daily.hankooki.com
2023.01.19.,브릿지경제,,"전남지방우정청, 설명절 남구노인복지관에 '200만원 사랑나눔 기탁'",,,https://www.viva100.com/main/view.php?key=20230119010005964,http://www.psychiatricnews.net
2023.01.25.,이뉴스투데이,,"양산시 서창동, 노인일자리사업 발대식 및 안전교육 실시",,,http://www.enewstoday.co.kr/news/articleView.html?idxno=1632935,http://news.sbs.co.kr/
2023.01.25.,이뉴스투데이,,"양산시 서창동, 노인일자리사업 발대식 및 안전교육 실시",,,http://www.enewstoday.co.kr/news/articleView.html?idxno=1632935,http://www.enewstoday.co.kr/
2023.01.29.,바이오타임즈,,겨울철 낙상사고가 퇴행성 관절염으로... 3세대 맞춤형 인공관절 등장,,,http://www.biotimes.co.kr/news/articleView.html?idxno=9640,http://www.biotimes.co.kr/
2023.01.25.,아시아타임즈,,[25일 울진군 소식] 온정면 '노인 일자리 사업 안전교육' 실시 등,,,https://www.asiatime.co.kr/article/20230125500291,http://www.asiatime.co.kr/
2023.01.11.,아주경제,,충남도 교통사고 사망자 역대 최저 기록,,,https://www.ajunews.com/view/20230111095521520,http://www.ajunews.com
2023.01.16.,뉴시스언론사 선정,,세차장서 가속 페달 잘못 눌러…차 뒤집혀 갇힌 美노인,,,http://www.newsis.com/view/?id=NISX20230116_0002159813&cID=10101&pID=10100,http://www.newsis.com
