Date,Press,Category,Title,Content,Comment,URL_Origin,URL_Naver
2023-01-26 10:19:06,쿠키뉴스,사회,"재료연 연구소기업 트윈위즈, 누적투자 22억원 확보 [경남소식]","[ 독거노인 1인당 20만원 지역 상품권 지급 전남 신안군(군수 박우량)이 노인 맞춤 돌봄서비스 대상자 중 독거노인 1300여명에게 동절기 한파에 따른 긴급 난방비를 지원했다.    신안군 청사 전경 [사진제공=신안군]26일 군에 따르면 이번 난방비 긴급 지원은 최근 에너지 가격 급등과 경제 위기, 한파로 생활에 어려움을 겪는 저소득 독거노인이 안전하고 따뜻한 겨울을 보낼 수 있도록 했다.군은 저소득 독거노인 1300여명에게 1인당 20만원씩, 총 2억 5000만원의 지역 상품권을 지급해 따뜻한 설 명절을 보낼 수 있도록 안부도 확인했다.박우량 군수는 “저소득 어르신들이 겨울철 안전사고 예방과 따뜻한 겨울을 보낼 수 있도록 난방비 지원을 아끼지 않겠다”며 “어르신들의 건강한 신안을 만들어 가겠다”고 말했다. ]",[],http://www.kukinews.com/newsView/kuk202301110166,https://n.news.naver.com/mnews/article/277/0005209440?sid=102
2023.01.29.,제주의소리,,"제주시, 취약계층 대상 가스시설 개선사업 신청 접수",,,http://www.jejusori.net/news/articleView.html?idxno=411578,http://www.ccdn.co.kr
2023.01.31.,충청뉴스,,"이진호 세종시 소방행정과장, ""시민의 생명과 안전 보호 최선""",,,http://www.ccnnews.co.kr/news/articleView.html?idxno=283750,http://www.hani.co.kr/
2023.01.30.,스카이데일리,,"김제시, 빈집 리모델링 지원사업 추진",,,http://www.skyedaily.com/news/news_view.html?ID=180753,http://www.skyedaily.com
2023.01.30.,뉴스티앤티,,"세종시, 내년 주택용 소방시설 100% 설치 추진",,,http://www.newstnt.com/news/articleView.html?idxno=251147,http://www.newstnt.com
2023.01.30.,베리타스알파,,한림대 LINC 3.0사업단 '스마트돌봄 케어매니지먼트 교육 및 교류회' 개최,,,http://www.veritas-a.com/news/articleView.html?idxno=445313,http://www.veritas-a.com
2023.01.21.,시민일보,,"양산 경찰서, 양산 시니어 클럽 일자리 참여 대상자 교통 안전 교육 진행",,,https://www.siminilbo.co.kr/news/newsview.php?ncode=1160265137671564,http://www.siminilbo.co.kr
2023.01.23.,세계일보언론사 선정,,"행안부, 중대본 1단계 가동…“대설·한파 유의”",,,http://www.segye.com/content/html/2023/01/23/20230123506076.html?OutUrl=naver,http://www.segye.com
2023-01-23 22:02:03,메트로신문,사회,"서울시-자치구, 한파대응 민생안전 대책에 742억 투입","[    행정안전부가 한파 경보에 23일 오후 7시부로 중앙재난안전대책본부(중대본) 1단계를 가동했다.     행안부는 이날 저녁 전국 대부분에 한파 특보가 발표되고, 24일 서해안 지역을 중심으로 대설 예비특보가 발표돼 중대본 1단계를 가동했다고 밝혔다. 총괄조정관 주재로 대설·한파 대비 관계기관 긴급 점검회의도 열었다.         폭설과 한파가 제주를 덮칠 것으로 예상되는 가운데 23일 제주공항 내 대한항공 대기 카운터에 탑승권을 구하려는 승객들이 줄을 서 있다. 연합뉴스    눈은 23일 늦은 밤 제주 산지에서 시작해 24일 새벽 제주·호남·충남서해안으로 확대될 것으로 보인다. 24일 밤 대부분 그치겠으나 충남서해안은 24일 새벽, 전라서해안은 25일 오전, 제주는 25일 낮까지 이어질 것으로 예보됐다. 충남북부내륙에도 24일 오전과 밤 한때 눈이 오겠다.     24일부터 25일까지 예상 적설·강수량은 전북서부, 전남권, 제주도 5∼20㎝ 적설 및 5∼30㎜ 강수, 충남서해안, 전북동부, 전남동부남해안 1∼5㎝ 적설 및 5㎜ 미만 강수, 충남권북부내륙 1㎝ 내외 적설 및 5㎜ 미만 강수다.     전국 예상 아침 기온은 24일 영하 23도에서 영하 6도 사이이고 바람도 거세 체감온도는 기온보다 10도나 낮겠다. 서울은 아침 최저기온이 영하 17도이고 체감온도는 영하 26도일 전망이다. 25일 아침 최저기온은 영하 25도에서 영하 9도이고 낮 최고기온은 영하 8도에서영상 1도 사이다. 아침에는 24일보다 춥고 낮에는 덜 추울 것으로 보인다.      행안부는 밤사이 내린 눈으로 도로가 얼지 않도록 터널 입·출구에 제설제를 미리 살포하고, 제설이 안 된 도로는 반드시 사전 통제를 할 것을 관계기관에 지시했다. 주요 도로 제설뿐 아니라 이면도로, 골목길, 인도 등의 후속 제설을 철저히 하고 버스 정류장 주변 등에 제설제 비치도 지시했다.         지난 22일 강원 화천군 화천읍 화천천 일원에서 진행 중인 '2023 얼음나라 화천 산천어축제' 장소 입구에 빙벽이 형성돼 있다. 연합뉴스    많은 눈이 올 것으로 예상하는 지역에서 비닐하우스, 축사, 조립식 주택, 노후건축물 등 적설 취약구조물에 대해 지붕 제설 홍보도 강화했다. 취약구조물 거주자는 붕괴 우려가 있으면 즉시 사전대피시킬 것을 강조했다.     행안부는 관계기관에 노숙인, 홀몸노인, 쪽방촌 주민 등 취약계층의 안부를 방문 또는 전화로 확인하고, 난방이 어려운 세대는 한파 쉼터에 임시 거주할 수 있도록 안내하라고 당부했다. 한파로 인한 수도관·계량기 동파 등 시설피해 예방을 위한 홍보를 하고, 피해가 생기면 신속히 조치하라고도 했다.     이날 한덕수 국무총리는 관련 부처에 “귀경길 교통안전에 만전을 기할 것”을 지시했다. 한 총리는 행안부 장관과 국토교통부 장관에게 귀경길 교통안전을 위해 철도 등 기반 시설과 공사 구간 등 사고 취약 지점을 사전 점검하는 동시에 도로 결빙에 대비해 교량, 고가도로, 터널 출입구 등 위험지역 제설제 살포 등 예방 조치에 최선을 다하라고 했다. ]","['', '이상민....다신 나오기힘든 ㅂㅅ장관', '이상민아 진작 이태원 때도 이랫으면 됬지 ᆢ ᆢ', '믿어야하나ᆢ뮐 제대로할지ᆢ', '중대본 가동이 되는거였군..', '행안부가 왜 필요한거야? 기상청이 발표하면 동사무소.도로공사. 등등이 다 알아서 대비하는데 명령만하는 부서가 뭣때문에 필요하냐고', '난방비를 이렇게 올려야 했냐?  작년보다 저번달보다 춥게 지냈는데도 난방비 40퍼가까운 인상에 10 만원이 더 나왔다. 추운데도 무서워서 난방을 못틀겠다. 서민들 이젠 얼어 죽을 판이다. 윤석렬은 새로지은  으리으리한 집에서  따뜻하게 지내지?\n일반 국민만 죽어나지...']",http://www.metroseoul.co.kr/article/20230127500016,https://n.news.naver.com/mnews/article/022/0003776731?sid=102
2023.01.25.,뉴시스,,"청주시, 교통 인프라 확대…3순환로 국동~효촌 12월 개통",,,http://www.newsis.com/view/?id=NISX20230125_0002169187&cID=10899&pID=10800,http://www.metroseoul.co.kr
2023.01.26.,노컷뉴스언론사 선정,,"역대급 '난방비 폭탄'…""한파 속 서민은 더 춥다""",,,https://www.nocutnews.co.kr/news/5885281,http://www.newsis.com
2023-01-25 15:53:25,경향신문언론사 선정,사회,"사이비 종교, 다단계, 피트니스 클럽…세뇌 없는 ‘광신’[책과 삶]","[ 기사내용 요약남일면 송암리 등 농어촌도로 확장중부고속 흥덕 하이패스 12월 준공    [청주=뉴시스] 충북 청주시 국도대체우회도로 4단계 구간 공사 현장. (사진=청주시 제공) photo@newsis.com *재판매 및 DB 금지[청주=뉴시스] 임선우 기자 = 충북 청주시가 100만 광역도시 초석을 다지기 위한 교통 인프라 구축에 나선다.시는 도로와 하천 등 주요 SOC 사업에 전년 대비 23% 증액된 641억원을 투입, 시민 생활환경을 개선한다고 25일 밝혔다.우선 도심 교통난을 해소하기 위한 도로 확장과 25분 교통망 구축을 지속 추진한다.교통체증이 심한 대성로 옛 법원사거리~우암산 순환로 확장 공사는 오는 4월 완료하고, 영운로~옛 법원사거리 구간을 착공한다.중부고속도로 청주흥덕 하이패스 전용 나들목은 올해 상반기 중 진입도로 구간을 준공한다. 오는 12월 나들목 연결로 등을 개통하면 중부고속도로 접근성이 향상될 것으로 기대된다.청주 외곽을 두르는 국도대체 우회도로(3순환로)는 오는 12월 내수 국동~남일 효촌 구간을 준공한다. 이 구간이 개통되면 2001년 공사 시작 후 20여년 만에 41.8㎞ 전 구간이 연결돼 25분 생활권을 완성한다.농촌지역 생활환경 개선과 지역 균형발전을 위한 농어촌도로 확충 사업도 활발히 이뤄진다.기존에 진행 중인 15개 사업을 비롯해 남일면 송암리(3공구) 등 9개 도로 확장·포장 공사가 새롭게 추진된다.시는 또 어린이·노인·장애인 보호구역 62곳의 시설물을 정비·교체하고, 교통사고가 잦은 곳 개선과 차선도색 정비를 통해 도로 구조를 안전하게 바꾼다.도심 속 휴식공간 마련 사업도 속도를 낸다.우암산 둘레길 조성사업이 오는 4월 공사에 돌입하고, 지난해 12월 환경부 지역맞춤형 통합하천사업 공모에 선정된 친수공간 조성사업도 본격 추진된다.친수시설과 치수, 수질, 이수사업을 위한 사업 기본구상안을 마련하고 꽃길 조성, 수목 정비 등도 연계한다.도심하천 수량 확보를 위한 물길조성사업은 올해 실시설계용역을 추진한다.시 관계자는 ""사람 중심의 도로환경 개선으로 시민 안전을 확보하고, 하천은 친수공간으로 바꿀 것""이라며 ""지역업체 우선으로 공사를 추진해 지역 경제도 견인하겠다""고 말했다. ]","['청주시의 교통인프라는 80만대 도시라고 볼 수 없을 정도로 열악함. 도로 넓이가 좁아서 교통체증은 말할 것도 없고, 60만대 도시인 전주나 천안도 12차선 대로를 가지고 있는데 청주에는 12차선은 고사하고 10차선도 없다. 철도교통의 열악함은 말할것도 없고....청주는 일단 구도심의 도로들을 인근 건물을 밀어버리고 도로를 10차선 이상으로 확장한 뒤에 더 높고 현대적인 건물로 새로 지어야 하고, 오송역과 북청주역 인근의 역세권 개발 면적과 스케일을 더 늘려야 됨.']",https://www.khan.co.kr/culture/culture-general/article/202301271447001,https://n.news.naver.com/mnews/article/003/0011658065?sid=102
2023.01.25.,조선일보언론사 선정,,“밤 11시 신고 출동하자 고교생이 ‘집 데려다 달라’”…경찰의 분노 글,,,https://www.chosun.com/national/national_general/2023/01/25/FPMZZCQ3ANCS5JKYWJ7KBSFOLY/?utm_source=naver&utm_medium=referral&utm_campaign=naver-news,http://www.nocutnews.co.kr
2023.01.30.,위클리오늘,,[카드뉴스] 고양시 주요뉴스 (1월 30일),,,http://www.weeklytoday.com/news/articleView.html?idxno=555147,http://www.weeklytoday.com
2023.01.26.,노컷뉴스,,대구 금호강변 파크골프장 108홀 조성…36홀 규모 공인 구장도 신설,,,https://www.nocutnews.co.kr/news/5884852,http://www.nocutnews.co.kr
2023-01-26 11:23:02,뉴스1,사회,"청주시, 651억 투입해 '100만 광역도시' 기틀 만든다","[     파크골프장 위치도. 대구시 제공노령인구를 중심으로 파크골프 인구가 폭발적으로 늘고 있는 가운데 대구시가 금호강변에 파크골프장을 추가로 조성하기로 했다.대구시는 파크골프 수요 증가에 따라 내년까지 금호강변 유휴공간에 108홀 규모의 파크골프장을 추가로 조성한다고 26일 밝혔다.이번에 만들어지는 파크골프장은 동구와 달서구, 서구, 북구, 달성군 등 모두 6개 지역에 들어선다.동구 지역은 기존 27홀 규모의 봉무 파크골프장에 9홀을 추가로 조성하게 된다.서구 지역에는 비산동 매천대교 상단에 신규로 9홀을 만들기 위해 올해 실시 설계용역을 마치고 곧바로 공사에 들어가 내년 7월 개장할 계획이다.북구 지역에는 노곡동과 사수동 2곳에 각각 36홀과 27홀 규모의 새로운 골프장을 짓게 된다.특히 36홀 규모의 사수 파크골프장은 대한파크골프협회에서 인증하는 공인 구장으로 만들어 전국 대회 유치도 할 수 있도록 할 예정이다.달서구 지역에는 기존 18홀 규모의 달서 강창 파크골프장을 9홀 더 확장하고 달성군 지역에는 방천리 해랑교 인근에 18홀을 새롭게 만들어 내년 7월 개장한다.파크골프장 추가 조성을 위해 시비 61억 5천만원과 시 특별교부금 21억원 등 모두 82억5천만원의 예산이 투입된다.이번 사업이 완료되면 대구의 파크골프장 수는 기존 25곳 513홀에서 29곳 621홀로 큰 폭으로 늘어나게 된다.홍준표 대구시장은 ""파크골프는 어르신들에게 새로운 생활체육으로 각광받는 스포츠이자 노인복지시설로 노인질환과 성인병 예방에 도움이 된다""며 ""앞으로도 대구시는 구·군과 함께 파크골프장을 노인복지 시설 기능을 강화하는 방향으로 추진해 나가겠다""고 말했다.※CBS노컷뉴스는 여러분의 제보로 함께 세상을 바꿉니다. 각종 비리와 부당대우, 사건사고와 미담 등 모든 얘깃거리를 알려주세요.이메일 : jebo@cbs.co.kr카카오톡 : @노컷뉴스사이트 : https://url.kr/b71afn ]",[],https://www.news1.kr/articles/4933235,https://n.news.naver.com/mnews/article/079/0003730885?sid=102
2023.01.11.,중도일보,,충남 1977년 통계 시작 이후 교통사고 사망자 역대 최저 기록,,,http://www.joongdo.co.kr/web/view.php?key=20230111010003172,http://news1.kr/
2023-01-25 11:27:29,스트레이트뉴스,사회,[이번 주 국회에서는] 국회 본회의 및 4개 상임위 개최,"[ SOC사업 전년비 23% 증액…도로·교통·생활환경 개선 추진    충북 청주시 전경./뉴스1(청주=뉴스1) 강준식 기자 = 충북 청주시가 100만 광역도시의 기틀을 만들기 위해 교통 인프라 구축에 나선다.시는 도로와 하천 등 주요 SOC 사업에 전년 대비 23% 증액한 651억원을 투입해 시민 생활환경을 대폭 개선한다고 25일 밝혔다.먼저, 도심 교통난 해소를 위해 도로 확장과 25분 교통망 구축을 지속해서 추진한다.교통체증이 심한 대성로 옛 법원사거리~우암산 순환로 확장공사를 4월 마무리한 뒤 영운로~옛 법원사거리 구간 공사를 시작한다.올해 상반기 중 중부고속도로 청주흥덕 하이패스 전용 나들목 진입도로 구간을 준공한다.연말 전 구간이 개통하면 중부고속도로 접근성이 좋아질 것으로 보인다.청주 외곽 국도대체 우회도로(3순환로)는 12월 내수 국동~남일 효촌 구간이 완성된다. 이 구간을 개통하면 2001년 공사 시작 후 20여년 만에 41.8㎞ 전 구간이 연결돼 25분 생활권이 구축된다.기존 15곳을 비롯해 남일면 송암리(3공구) 등 농어촌도로 9곳에 대한 확장 포장공사도 추진한다.어린이·노인·장애인 보호구역 62곳의 시설물 정비·교체 등을 통해 교통약자 중심의 교통체계를 구축할 계획이다.교통사고가 잦은 곳 개선과 차선도색 정비를 통해 도로 구조를 개선하고, 지역 대표 관광지인 수암골 보행환경 개선사업도 본격 착공한다.4월부터 우암산 둘레길 조성사업 공사에 돌입하고, 친수공간 조성사업도 추진할 예정이다.도심하천 수량 확보를 위한 물길조성사업은 올해 기본 및 실시설계용역을 추진해 열섬화 방지 및 대기·수질 환경 개선에 나설 방침이다.시 관계자는 ""사람 중심의 도로환경 개선으로 교통사고를 예방하고, 시민 안전을 확보할 것""이라며 ""지역업체 우선으로 공사를 추진해 지역 경제도 견인하겠다""라고 말했다.   ]","['굳. 다만 저넘의 좌-  zom 선 동 몰 이 사람중심 타령 ㅋㅋㅋㅋㅋ 도로가 자동차 중심여야지 사람중이면 어떻게 하자는 거냐? ㅋㅋㅋㅋㅋ 자동차 자가용이 곧 나, 가족, 친인척, 동료들과 이동하는 이동의 자유 대표적인 개인사유재산인데 그러한 도로망에 왜 자꾸 사람중심 타령으로 통제, 규제, 간섭을 ㅊ 할라그러냐고 ㅋㅋㅋㅋㅋㅋ 좌-  zom들 도로에 트램타령도 같은 원리로 도로에 과부하를 주기위한 x 수작인데 정신들좀 차리세요 ㅎㅎ 전에도 말했지만 범서기형 가끔 정체성이 의심스럽다니깐 ㅋㅋ', '댓글을 웬만하면 안다는데….\n제목은 100만 굉역도시 기틀을 다진다면서 기사내용은 전부 기존에 진행 중인거 말고는 딱해 안보이네. \n\n이게 도대체 기사를 쓴건지 아니면 베낀건지…답답!!', '']",https://www.straightnews.co.kr/news/articleView.html?idxno=224573,https://n.news.naver.com/mnews/article/421/0006593326?sid=102
2023.01.30.,JTBC,,"대만, 북극발 한파에 사망자 속출…146명 숨져｜월드클라스",,,https://news.jtbc.co.kr/article/article.aspx?news_id=NB12112745,http://www.joongdo.co.kr
2023.01.26.,뉴시스,,"청주시, 장애인 전동보조기기 배상책임보험 시행…도내 최초",,,http://www.newsis.com/view/?id=NISX20230126_0002170340&cID=10806&pID=10800,http://www.straightnews.co.kr
2023.01.26.,JTBC언론사 선정,,새벽부터 쌓인 눈에 험난한 출근길…빙판길까지 '비상',,,https://news.jtbc.co.kr/article/article.aspx?news_id=NB12112418,https://news.jtbc.co.kr
