Date,Press,Category,Title,Content,Comment,URL_Origin,URL_Naver
2023.01.31.,KBS언론사 선정,,"치매 노인, 손가락 모두 훼손…경찰은 “동상” 이라는데",,,https://news.kbs.co.kr/news/view.do?ncd=7593782&ref=A,http://news.kbs.co.kr/
