Topic Number,제목
1,단독삼척 전복 승합차 17년 간 최소 7번 사고 베이퍼 록에 의한 브레이크 결함 가능성도
1,독일 여객기 추락 탑승객 150명 전원 사망 외신 외신 급감압과 기술적 결함 가능성
1,양담소 재혼으로 20년 산 남편 사망하자 연락없던 전 처 자녀들이 상속을 요구해요
1,독일 여객기 추락 탑승자 150명 전원 사망 순항고도 도달한 1분 만에 급강하
1,전국 공동주택 10곳 중 4곳 내진설계 안돼 세종시 100 서울은 37 그쳐
1,초단시간 노동자들 절규 올 설도 버림받나요 학교에 편의점에 초단기 노동자 한숨이 숨어있다
1,안정원의 디자인 칼럼 베이징 전통가옥 지구의 낡은 가옥이 티 하우스로 변모해
1,신성식의 레츠 고 9988 196874년생 은퇴 후 국민연금 81만원 연령별 최고
1,세상에서 제일 넓은 1평 욕실 11m 창문 안으로 알프스가 들어왔다
1,주말 인사이드 시간제 계약직 공무원 새내기 주무관 4명에 들어본 그들의 얘기
2,카라 암사자 사순이는 국제멸종위기종 2급 20년 갇혀있다 풀숲서 짧은 휴식 끝 사살 당해
2,용산 붕괴 상가같은 건물 많다 서울시 정비구역 내 건물 309곳 긴급 안전점검
2,대법원 자식연금 첫 인정 증여 아닌 매매에 해당 시 증여세 부가 불가
2,주경철의 히스토리아 노바 26   넘나들며 왕들을 뒤흔든 정열의 여인 백년전쟁을 잉태하다
2,한국 한국인에묻다 30대 10명 중 8명 노후 불안 응답자 748 불안 호소
2,대법원 자식연금 첫 인정 아파트 물려받고 부모 생활비 송금 증여세 취소
2,문재인 정부 연금공약 설계한 김연명 국민연금 덜 내고 받자에 무게 실릴 듯
2,구간 단속카메라 추가 설치 최대 38곳 추가 설치 과속 예방 확대시켜
2,시설 노후 설계 오류 사이버 해킹 아르헨 우루과이 마비시킨 정전 원인은
2,대법원 자식연금 첫 인정 아파트 물려받고 생활비 보내면 증여 아닌 매매
3,역경의 열매 김상훈 윤정희 부부 5 엄마 기도 흉내 내는 하선이 온가족 웃다가 울다가
3,눈앞에 닥친 원전 폐로10년 연장 고리1호기 3년 뒤 수명 끝나 폐로 대책 발등의 불
3,산업재해 사망사고 절반으로 줄이자 산업재해 예방 패러다임 변화 필요 선택과 집중으로 악성 사망사고 줄인다
3,해고 통지서 받아든 조선소 여성 용접공의 절규  하청 노동자는 쓰면 뱉는 껌이 아냐
3,자산운용업 판을 바꿔라인터뷰  세계 4위 연기금 국민연금공단 최광 이사장 자산운용업계와 상생 위해 머리 맞댈
3,탄소제로   유럽 원전 확대 선회 개도국도 41기 추진 동일본지진 10년 원전의 현주소
3,이민주 ihs 버핏연구소장  지금까지 없던 세상 정진기 언론문화상 수상 ceo는 최고의 유망 직업입니다
3,고시원 화재 참사새벽 5시 출입구 앞방 발화 좁은 복도 끝엔 탈출구 없어
3,중국 18기 3중전회 고강도 개혁 추진 개혁개방 없으면 죽는 길 밖에 없다
3,서울 9호선 증편 올해 연말로 앞당겨 2 4 7호선 증편도 추진
4,cover story계절의 여왕 5월 서울 수도권 둘레길이 좋아요 나홀로 걸어도 만족 큰 행복이 따로 없네
4,7인의 석학에게 미래를 묻다장하준 코로나 효율성 위해 약자에 위험부담 지운 신자유주의 약점 드러내
4,조지 h w 부시 94세 일기로 타계 걸프전 승리했으나 클린턴에 패해 재선 실패
4,비노조원 채용 열어주니 인건비 덤핑 불법하도급 부작용도건설현장 부당행위 근절대책 세부조율 절실
4,서러운 고령층 퇴직후엔 음식 숙박업 몰려 생계 유지 위해 저부가가치 산업으로 이직
4,양상훈 칼럼 400억달러 uae 원전 수주도 거저 된 걸로 보일 것이다
4,인터뷰박준희 관악구청장 지역 의류봉제 소공인 자생력과 경쟁력 강화 위해 총력 기울여
4,벽지 장판 갈아도 곰팡이 악취 못 떨쳐낸 침수 악몽은 심신 괴롭혀
4,직장인 10명 중 7명이 54세 이전 퇴직 평균 125년 소득 절벽
4,박근헤 정부 국정목표 확정 사회 안전경찰관 5년간 2만명 증원 4대 사회악 척결
