Topic Number,제목
1,복지 사각지대 해소방안 내년 10월 주거급여 부양의무자 기준 단계적 폐지 빈곤층에 최소 1개 급여 지원
1,태국 남성 생후 11개월 된 딸 살해 페이스북 생중계 잔혹범죄 방송 플랫폼 된 페이스북 라이브
1,2016년 5월 대한민국 가정가정의 달에 바라본 1인 가구 가족기능 상실로 건강 수준 낮고 빈곤율 높아
1,분단 70년을 넘어 평화통일을 향해1부 일제 탄압 강제 이주 고향 잃었던 이스라엘 백성과 비슷
1,하반기 달라지는 여성 교육 보건 복지 02세 어린이집 맞춤형 보육 종일반 오후 7시30분까지 이용
1,가족행전 지붕 장모 사위 불편하지 않냐고 방귀 트고 살아요 가족이 된 백년손님 아이작 더스트
1,파주시노인복지관 운정행복센터 손자녀 양육 프로그램 진행4월 6일부터 똑 소리나게 내 손주 양육하기 수업 시작
1,성장 보는 눈 바꿔야 국가경제 산다 똑같은 기회 공정한 분배 포용적 성장 전제조건
1,기분이 좋아지는 인터뷰제주 할망 할방만 찾아다니는 유랑작가 정신지 걸으멍 보면 들으멍 제주를 알다
1,현대문학상 진심 안보윤 닫힌 문 진심이 가엾고 쓸쓸해 견디기 어려웠다 김용출의 문학삼매경
2,투데이 키워드 새정치연합 대표에 문재인 1박2일 김빛이라 기자 진짜사나이 여군특집2 런닝맨 소진 속사정쌀롱 박지윤 동전 크기 양배추 헝거 마케팅 뜻 허미영 결혼 주민번호 무단수집 단속 비둘기
2,여행은 시시하고 뻔한 것에서 텅 빈 하늘을 향해 날아오르는 순간 가슴속 차오르던 위안 벗어나는 느낌이다
2,3단계 격상없이 확산세 꺾겠다 17일까지 방역조치 연장 4일부터 전국 5인 모임 금지
2,여성친화도시로 도약 위한 서포터즈단 결과보고 대회 열려불편 불안 불쾌 없는 도시 만들어요
2,발달장애인은 범죄 인식 없는데  지원도 훈련도 없는 격리는 사회적 학대 치료감호의 눈물
2,2016 경향신문 선정 올해의 책음울한 시대의 빛이 되고 새로운 시간의 디딤돌이 되다
2,과학기술 시대의 기회를 소녀들에게 알려줘야 한다 62세 여성 공학자가 건네는 당부플랫
2,이용범의 행복심리학 일하지 않는 것이 아니라 하고픈 일을 하는 것이 행복
2,알림 농가 소득 올리고 소외 이웃 돕고 2016 사랑의 김장 나누기
2,여경 미담 사진 연출 논란에 삭제 목격자의 반박 내가 본 것은
3,땅의 희망지기김동운 쓰러뜨린 것도 일으키신 것도 모두가 하나님 노인 어린이 행복이 내 소명
3,대법관 압박해 송기복씨 일가 간첩단 만들고 동백림 사건 재판까지 개입그 시대 유죄추정의 원칙
3,전두환 일가 연희동 사저 비자금과 관련 없어구십 노인 나가라는 건 생존권 위협
3,드론 동원해 찾았지만 80대 치매 노인 실종 이틀 만에 숨진 채 발견
3,음료수 싫다는 80대 할머니 폭행해 갈비뼈 쇄골 골절 경찰 이천 요양원 수사
3,창간기획  노인이 행복한 시대 만들자만성질환관리 확대 노인 주치의 도입해 만성질환 예방 관리해야
3,서의동의 사람 사이구수정한국군의 베트남 민간인 학살 사죄 배상 우리는 일본처럼 하면 안돼
3,기획 점점이 홀로 살던 노인들 절절한 절친 생기다 노인이 노인 돌보는 밀알공동체
3,손자 봐주는 부모님 관절염 요통 체크 자녀가 자주 눈 찡그리면 시력 검사를
3,격자 물길에 섬이 72개 어디가 실제이고 어디가 반영인지 최종명의 차이나는 발품기행
4,명의가 본 기적 9회 풀영상 간질환 치료 획기적 발전 복수 황달 와도 정상 회복 가능
4,신년 기획  사회적 경제인가내 건강부터 챙기려 찾았던 의료 생협 서로 위로받을 있다는 것에 감동
4,단독 누가 김노인을 죽였나  도시살이 40년 빚더미 장남 잃고 집 잃은 남편 삶을 놓았다
4,출판사가 추천하는 오늘의 책 나는 형제를 모른 척 할 있을까 형제도 부모처럼 부양할 있을까
4,나이들수록 끼니 거르면 인지 기능 뚝 고른 영양 섭취가 치매 예방 치료에 도움
4,묻지마 약 복용 콩팥 망가지는 줄 모른다 대한신장학회 급성 콩팥 손상 멈춥시다 캠페인
4,신년 기획  사회적 경제인가내 건강부터 챙기려 찾았던 의료생협 서로 위로받을 있다는 것에 감동
4,한경과 맛있는 만남 유중근 한적 총재 절망의 벽 넘는 담쟁이처럼 희망 50만 길러낼
4,추석부모님 건강 체크포인트 뇌건강  얼굴이나 손에 감각 떨어지거나 물체가 2개로 보이면 뇌졸중 의심을
4,강제입원 줄이는 법 두고 기대와 우려법 절차 비효율적 의사도 부족 vs 지나친 우려
