Topic Number,제목
1,job 대학생 취업 디딤돌 윤여훈 효성 인사관리팀 차장 연령 어학점수 제한 없고 인문계 출신 30 채용
1,도봉구 아이들이 행복한 도봉구 드림스타트 사업 start 도봉구 2016년도 드림스타트 사업 추진계획 수립
1,우리나라 암 발생 1위 위암 암 환자 절반 진단 후 5년 넘게 생존
1,대통령 한동훈에 기업활동 위축 과도한 형벌규정 개선 지시 민생 경기 해법 고민하는 정부
1,대륙별 비즈니스 스쿨과 복수 학위 협정 12개국 20개 해외 대학과 교환학생 가능
1,비례대표 경선 대리투표 사건 통진당 관련 선거사건 줄줄이 유죄확정통진당 해산심판에도 영향 미칠듯
1,재테크 특집 한화생명 가장 은퇴 전 사망 땐 유가족에게 매달 급여금 지급
1,단독 온라인 마권 베팅 75만원 제한 구입 허용 연령 21세 상향 조정
1,통합교육 일반학교 장애학생 367 학교폭력 경험 차별 배우는 교실 되지 않으려면
1,정명진 의학전문기자의 청진기 자궁근종 치료 장비 mri하이푸 고온 초음파로 종양만 괴사
2,성장 잠재력 큰 세계 4위 인구 대국 한류 앞세워 적극 공략 필요 아세안을 기회의 땅으로
2,아세안 50년 변방에서 중심으로 상점 열기만 하면 대박 중국 인도 이은 세계 3위 시장
2,신세계그룹 정년 60세 연장 3월 조기 도입 마트 초급관리자도 점장으로 승진 직급 임금체계 손질
2,서방파 양은이파 ob파 그들의 끈질긴 생존법 쇠락하던 3세대 조폭 돈냄새 맡고 바다 건넜다
2,침묵과 소리의 경계 소리 없이 빛나는 코다coda 심층기획말뿐인 공용어 설 곳 없는 한국수어
2,소년중앙 휠체어 탄 친구 유모차 탄 동생도 평탄하게 자연과 만나고 신나게 놀아요
2,김규환 기자의 차이나 스코프 시진핑과 밤샘 우정 왕치산 49년 흘렀어도 시자쥔 핵심
2,정 총리 공무원연금 개혁의 과감한 결단 내려야 할 때다 긴급 담화문 발표
2,김홍희의 페미니즘 미술 읽기3괴물의 모습으로 표현된 신체 인간을 억압하는 모든 경계를 파괴하다
2,중1부터 자궁경부암 백신 맞아요 입학 전 체크할 필수예방접종 서지혜 기자의 건강한 육아
3,세월 아닌 잃을 늙는다 jp 청춘 번역해 양김 퇴출론 잠재워  소년 독서광 jp 일야일권 독파주의 나폴레옹 전기가 5 16 상상력 자극
3,성매매 아닌 성착취로 보는 국제적 움직임 커지지만 대상 청소년 조항 삭제 개정안은 1년째 국회에서 잠자
3,장애인 건강관리 해야 하는가 장애인 사망률 전체 인구의 5배 넘어  장애유형별 맞춤형 관리 절실
3,취업에 강한 신문 한경 job 미국인턴십 일본스펙보다 일본어 능력 호주it 기술직이 취업에 유리
3,위기의 보험 돌파구는 없나 구글 텐센트 인슈어테크 적극투자 it보험 산업 경계 허물며 급성장
3,러 병사 부족하나 러 여당 계약제 40세 연령 제한 폐지법 발의 나우어스
3,올 15월 출생 미신고 아동도 144명 중 7명 사망 15명은 수사 중
3,박근혜 정부 비판한 더네이션 논쟁 2라운드 한국 정부의 반박 팀 셔록의 재반박
3,어린아이 상대 지속적 폭행은 성인과 달리 판단해야 정인이 사건 재판 핵심 쟁점은
3,연봉 30 반납 3대 금융지주 회장의 선언 임원들도 연봉 반납 잇따를 듯
4,정부 창업지원 온라인 통합 창구k스타트업 홈페이지개통  지원정책 일관성 확보를 위해 신규 로고 제작 내년초 통합 설명회 개최
4,롤러코스터 탄 브라질 증시 정부 출범 호재될까 원자재 값 상승에 기대 쑥 변동성 커 분산투자 필수
4,취업에 강한 신문 한경 job 금융권 하반기 채용 큰 장 은행 보험 증권사 60곳 4117명 뽑는다
4,대법원장 피고인석에 서다26회 기억 난다는 유해용 전 재판연구관 재판 지연 두고 검 변 설전
4,국회 통과 법안 요약 여야 공방에 가려져 빛 못 본 50개 법안 꼼꼼히 살펴보세요
4,국회 통과 법안 요약 여야 공방에 가려져 빛 못 본 50개 법안 꼼꼼히 따져보세요
4,울화통 터지는 보육어린이집 유치원 비용과 내년 결정 2016년까지 교육 복지 부처 통합 완료
4,참여 중장년 10명 중 6명은 경력 활용 재취업 서울시 굿잡5060 5주년 성과 공유
4,아침에 손 무릎 관절 굳고 뻣뻣 2030대 그냥 참다간 관절 변형 부른다
4,이시한의 공기업 ncs 취업 불패노트 리턴즈 49  국민연금공단 2018 하반기 ncs채용 분석노트
