Date,Press,Category,Title,Content,Comment,URL_Origin,URL_Naver
2022.03.31.,뉴스1,,"바디프랜드, 강동구 복지시설에 500만원 상당 행복나눔상자 전달",,,https://www.news1.kr/articles/?4633497,http://news1.kr/
2022-03-31 13:48:03,코메디닷컴,경제,"동국제약, 장애인 복지시설에 구강위생용품 지원","[ 농협중앙회 서울지역본부와 8번째 공동 사회공헌    이종은 바디프랜드 경영지원실장, 박상현 바디프랜드 대표이사, 이정훈 강동구청장, 임순혁 서울영업본부 본부장, 김남진 서울경영기획단 단장이 24일 강동구청에서 기념 촬영을 하고 있다.(바디프랜드 제공)© 뉴스1(서울=뉴스1) 신윤하 기자 = 바디프랜드는 농협중앙회 서울지역본부와 함께 지난 24일 오후 3시 강동구청에서 소외 취약계층을 위한 후원 물품 전달식을 가졌다고 31일 밝혔다.전달식에는 박상현 바디프랜드 대표이사와 이정훈 강동구청장, 임순혁 농협은행 서울영업본부장 등이 참석했다.후원 활동을 통해 사회적 가치를 실현하고자 마련된 이번 전달식에서 양사는 500만원 상당의 행복나눔상자 150박스를 기부했다. 행복나눔상자는 양사가 일정 금액을 출연해 마련한 생필품 상자다. 농축산물, 식품 등으로 구성된 후원 물품은 강동구청을 통해 소외 취약 계층에게 전달될 예정이다.전달식은 바디프랜드와 농협중앙회 서울지역본부가 사회공헌 업무협약 체결 후 여덟 번째로 마련한 행사다. 앞서 영등포구청, 송파구청, 관악구청, 중랑구청, 성모자애복지관, 우면종합사회복지관 등에 후원물품을 전달했다.특히 강동구에서 진행하는 두번째 전달식이다. 지난해 5월 강동구청을 통해 상일동 구립경로당, 성가정 노인종합복지관 등 강동구 관내 경로당 및 복지관에 안마의자 2대와 행복나눔상자 50박스를 전달했다.양사는 지난해 3월 협약을 맺고 Δ소외 취약계층 지원, 농촌 일손 돕기 참여 등 사회공헌 활동 Δ도시민과 농업인을 연계한 도·농 교류 Δ농축산물 판로 확대 등 지역경제 활성화를 위한 사업 Δ기관·소속 임직원에 대한 금융서비스 확대 등 다양한 분야에서의 협력을 약속한 바 있다.박상현 바디프랜드 대표이사는 ""양사가 마련한 후원 물품이 소외된 이웃들에게 큰 힘이 되기를 바란다""며 ""앞으로도 대한민국 대표 기업으로서 사회적 책임을 다하고 다양한 사회공헌으로 건강한 사회를 만들기 위해 노력하겠다""고 말했다.   ]",[],https://kormedi.com/?p=1389325,https://n.news.naver.com/mnews/article/421/0006001382?sid=101
2022.03.31.,메트로신문,,"낙동강환경청, 사회복지시설 무료 수질검사 시행",,,http://www.metroseoul.co.kr/article/20220331500382,https://www.kormedi.com/
2022-03-31 11:17:01,시장경제신문,경제,"BBQ, 23년간 매년 복지시설에 치킨 120만마리 기부","[     동국제약(대표이사 송준호)은 30일 경기도 광주시에 위치한 성분도복지관에서 '제14회 잇몸의 날'을 맞아 새로 설치한 장애인 '구강보건실' 운영을 위한 구강위생용품 지원사업 업무협약식를 가졌다.  협약으로 동국제약은 장애인 잇몸 건강 향상을 위해 '구강보건실'에서 교육 목적으로 사용될 치약과 칫솔 세트를 지원할 예정이다.  동국제약 박혁 실장은 ""장애인은 스스로 구강위생 관리가 어려워 비장애인에 비해 취약할 뿐만 아니라 관련 설비나 기반 시설도 부족한 것으로 알려져 있다""며 ""국민들의 잇몸 건강 증진을 위해 대한치주과학회와 함께 진행하는 '잇몸의 날' 캠페인 연장선상에서, 장애인을 위한 '구강보건실' 지원사업에도 참여하게 됐다""고 말했다.  성분도복지관은 지적·자폐성 성인장애인들이 독립된 삶을 살 수 있도록 심리·정서적 안정, 일상생활에 필요한 기능과 공동체 생활에 필요한 기술, 직업적 역량을 키우는 활동과 문화, 스포츠 및 여가활동 등 성인기 삶에 필요한 모든 영역에 걸친 다양한 교육프로그램을 운영하고 있는 지역사회재활시설이다.  이날 개소식을 갖고 문을 연 성분도복지관 구강보건실은 대한치주과학회 회원들의 성금을 바탕으로 기업들의 후원이 더해져 마련된 공간이다.  대한치주과학회는 10년동안 '잇몸의 날, 사랑의 스케일링' 등을 통해 성분도복지관 장애인 구강건강을 위한 재능기부활동을 진행해 왔으며, 동국제약도 참가자들의 식사 지원 및 '인사돌플러스 사랑봉사단'의 현장 봉사활동으로 동참하며 성분도복지관과 인연을 맺어오고 있다.  ]",['동국제약은 장애인 잇몸 건강 향상을 위해 구강보건실에서 교육 목적으로 사용될 치약과 칫솔 세트를 지원한다네요 응원하겠습니다'],http://www.meconomynews.com/news/articleView.html?idxno=64840,https://n.news.naver.com/mnews/article/296/0000055139?sid=101
2022.03.28.,뉴시스언론사 선정,,"서울시, 아동복지시설 학대 뿌리뽑는다…신고 즉시 업무배제",,,http://www.newsis.com/view/?id=NISX20220328_0001809688&cID=10201&pID=10200,http://www.metroseoul.co.kr
2022.03.30.,뉴스1,,"고창군사회복지시설, 고창북고·흥덕문화복지관과 공동체 사업 협약",,,https://www.news1.kr/articles/?4631790,http://www.meconomynews.com
2022.03.30.,위키트리,,"포항 농촌지역, 도시 못지않은 복지 시설로 살기좋은 농촌으로",,,https://www.wikitree.co.kr/articles/743364,http://www.newsis.com
2022-03-28 11:15:00,데일리한국,사회,"의성군, 일자리·주거·복지 갖춘 복합시설 들어선다...내년 6, 12월 각각 준...","[ 기사내용 요약'아동복지시설 내 아동학대 근절대책' 마련사전 예방, 조기 발견, 사후 조치 등 강화    [서울=뉴시스] (그래픽=뉴시스 DB). 2022.03.28.  *재판매 및 DB 금지[서울=뉴시스] 조현아 기자 = 서울시가 앞으로 양육시설에서 아동학대가 발생하면 피해 아동과 학대 의심자를 즉각 분리조치한다. 아동학대 행위자는 신고 시 업무에서 배제하고 1심 판결만으로도 즉시 퇴출한다. 서울시는 28일 아동복지시설 내 아동학대가 발생하지 않도록 하기 위해 이 같은 아동학대 근절대책을 마련했다고 밝혔다. 사전 예방부터 조기 발견, 사후 조치까지 전반적인 대응체계를 강화한다는 방침이다. 시설 내 아동학대 신고 건수는 2019년 93건에서 지난해 6건으로 감소했지만, 신고되지 않은 피해 사각지대가 존재할 수 있다는 판단이다. 단 한 건의 학대도 발생해선 안 되는 만큼 아동학대 근절에 총력을 기울인다는 계획이다.  아동학대가 발생하는 즉시 아동과 학대 의심자를 분리한 뒤 즉시 업무에서 배제한다. 아동학대 행위자에 대해서는 학대로 판단되면 최소 정직 이상 처분을 내리고, 1심 판결이 나오면 대법원 확정 판결 없이도 해고 처분한다. 신고의무를 위반할 경우에도 정직 이상, 학대예방 교육 미이행 시에도 감봉 이상의 처분을 받도록 한다. 3년간 아동학대가 발생한 시설에 대해서는 민간위탁업체 선정 시 페널티를 부과한다. 그동안 학대가 발생해도 시설 페쇄가 어려워 별도의 불이익 조치가 없었다. 시설 내 학대 사각지대가 없도록 CCTV 설치도 확대한다. 아동복지시설도 어린이집처럼 60일까지 영상을 보관할 수 있도록 아동복지법 개정도 건의할 예정이다. 현재 9개 자치구에서 활동 중인 인권 보호관이 각 시설별로 1명 이상 활동할 수 있도록 25개 모든 자치구에 109명으로 확대한다.상시 점검과 신고체계도 강화한다. 피해 아동이 불이익 당할까봐 신고를 꺼리는 일이 없도록 공유 오피스, 유휴시설 등을 활용해 시설 밖에 1대 1 상담공간을 마련한다.피해 아동에 대해서는 전문적인 심리 상담과 치료를 연계한다. 경계선 지능장애, 주의력결핍과잉행동장애(ADHD) 등 집중보호가 필요한 아동을 위해 3단계 심리상담치료 지원시스템을 마련한다. 기존 그룹홈에 특수치료전문가와 보육사를 추가 배치한 '마음치유 그룹홈' 3개소를 시범 운영해 집중보호가 필요한 아동에 대한 심리치료도 지원한다. 매년 평가를 거쳐 연차별로 확대 추진한다는 계획이다. 김선순 서울시 여성가족정책실장은 ""양육시설에서 아동학대가 발생할 경우 아동보호를 최우선으로 할 계획""이라며 ""이번 대책을 통해 학대에 대한 인식, 학대 예방적 환경 등을 근본적으로 개선해 아동들을 안전하게 보호하고 건강한 사회 구성원으로 성장할 수 있도록 할 것""이라고 말했다． ]","['후원금 에 목매는 시설도 조사하시죠 후원금 못 받으면 생일못 챙겨 준다하는 시설...\n그곳은 횡령 전과있던곳 입니다', '학대 예방적 환경 등을 근본적으로 개선해 아동들을 안전하게 보호하고 건강한 사회 구성원으로 성장할 수 있도록 해주셔서 감사합니다']",http://daily.hankooki.com/news/articleView.html?idxno=806336,https://n.news.naver.com/mnews/article/003/0011086915?sid=102
2022.03.31.,경남신문,,"진주시, 영유아·아동복지시설 등 8곳에 위탁계약증서",,,http://www.knnews.co.kr/news/articleView.php?idxno=1373344,http://news1.kr/
2022-03-30 09:54:19,불교신문,사회,고창군사회복지시설 고창북고 흥덕문화복지관 간 업무협약,"[     전북 고창군사회복지시설(시설장 대원스님)은 29일 고창북고등학교(교장 정종석)와 흥덕문화복지관(이사장 유영만) 등 2개 기관과 지역사회 공동체 마련을 위한 업무협약을 맺었다.© 뉴스1(고창=뉴스1) 박제철 기자 = 전북 고창군사회복지시설(시설장 대원스님)은 지난 29일 오후 고창북고등학교(교장 정종석)· 흥덕문화복지관(이사장 유영만)과 지역사회 공동체 활성화를 위한 업무협약을 맺었다.3개 기관은 이번 협약을 통해 Δ어르신의 고립 문제 완화 및 정서적 사회참여 지원 Δ청소년과 어르신이 참여하는 주민프로그램과 기부활동 등을 함께한다.  고창사회복지시설은 대한불교 조계종 선운사 복지재단이 ‘사랑과 즐거움이 있는 다시 찾고 싶은 복지관’이라는 슬로건으로 고창종합사회복지관·노인복지관·노인복지센터 등 3개 시설을 위탁 운영하며 지역사회와 함께하는 노인 복지 사업을 활발히 추진하고 있다.이에 따라 4월부터 진행되는 마을공동체 사업에는 독거노인과 소외계층 어르신 15명과 고창북고등학교 학생 87명이 참여해 소통 프로그램 ‘천연수세미 만들기’를 진행한다.    천연수세미는 지역 나눔 바자회를 통해 후원금 모금과 나눔활동으로 이어질 계획이다.     고창군사회복지시설장 대원스님은 “어르신과 청소년이 함께 참여하는 소통 프로그램이 많은 분들이 지역사회에 관심을 갖는 계기가 됐으면 좋겠다”며 “앞으로도 주민조직사업을 통해 아동부터 어르신까지 모든 농어촌 주민의 복지증진을 위해 최선을 다하겠다”고 말했다.    한편, 고창군사회복지시설은 이번 사업에 참여하는 고창북고등학교 학생들을 대상으로 마을공동체사업 로고와 명칭 공모전을 4월22일까지 진행한다. 공모전에서 최종 선정된 로고와 명칭은 소통 프로그램을 통해 만들어지는 천연수세미 상품화에 활용될 계획이다.   ]",[],http://www.ibulgyo.com/news/articleView.html?idxno=217179,https://n.news.naver.com/mnews/article/421/0005997856?sid=102
2022.03.31.,경남신문,,"경남경찰청, 여성복지상담소·시설협의회와 간담회",,,http://www.knnews.co.kr/news/articleView.php?idxno=1373294,http://www.knnews.co.kr
14면 1단,국민일보,,"아동복지시설 내 아동학대 행위자… 서울시, 1심 판결만으로 즉시 퇴출",,,http://news.kmib.co.kr/article/view.asp?arcid=0924238038&code=11131400&cp=nv,http://www.kmib.co.kr/
2022-03-29 04:10:10,불교신문,사회,고창군사회복지시설 고창북고 흥덕문화복지관 간 업무협약,"[     앞으로 서울시 아동복지시설 내 아동학대 행위자는 대법원 최종 판결 없이 1심 유죄 판결만으로도 즉시 퇴출된다.서울시는 28일 이런 내용을 담은 아동복지시설 내 아동학대 근절대책을 발표했다. 우선 양육시설에서 아동학대가 신고되는 즉시 가해 의심자는 즉시 피해 아동과 분리되고 업무에서도 배제된다. 피해 아동에게는 심리상담 및 치료서비스 전문기관을 연계하고, 원 가정 복귀나 다른 양육시설 및 학대 아동 쉼터 전원 조치 등이 취해진다.복지시설 자체 운영 규정을 개정해 학대 행위자는 1심 판결만으로 해고가 가능토록 했다. 학대 신고 의무를 위반한 직원엔 정직, 학대 예방 교육을 이행하지 않은 직원엔 감봉 이상 처분이 내려진다. 학대 피해아동은 물론 경계선 지능장애, 주의력결핍과잉행동장애(ADHD) 등 집중 보호가 필요한 아동을 위해 시설 내 임상 심리상담원의 수시 상담, 특수치료전문가 치료, 거점의료기관(서울대병원) 심리치료의 3단계 상담과정도 신설했다. 최근 3년간 아동학대가 발생한 시설에는 민간위탁업체 선정 시 페널티(평가점수 감점)를 부과한다. 같은 법인 산하에서 아동학대가 반복된 경우에도 해당 법인이 새로 설치한 아동복지시설에 인건비·운영비를 지원하지 않는다.   ]",['넘 잘한거네요  오세훈시장님'],http://www.ibulgyo.com/news/articleView.html?idxno=217179,https://n.news.naver.com/mnews/article/005/0001515120?sid=102
2022.03.31.,브릿지경제,,"[액티브 시니어] 성동구, 용답동 노인복지시설 첫 삽… 8월 준공 예정",,,https://www.viva100.com/main/view.php?key=20220401010007950,http://www.ibulgyo.com
2022.03.29.,데일리한국,,"진주시, 영유아·아동복지시설 등 8개소 위탁계약증서 전달",,,http://daily.hankooki.com/news/articleView.html?idxno=805748,http://www.viva100.com
2022.03.29.,서울경제,,"부산시, 아동복지시설 내 아동 안전 사건·사고 막는다",,,https://www.sedaily.com/NewsView/263LSHUUAJ,http://daily.hankooki.com
2022.03.29.,서울신문,,“체육·문화·복지시설 한 곳에”…삼척 어울림플라자 착공,,,https://www.seoul.co.kr/news/newsView.php?id=20220329500144&wlog_tag3=naver,http://www.sedaily.com
2022-03-29 08:29:01,디트뉴스24,사회,"한국산림복지진흥원, '시설 공유 시범사업' 참여 업체 모집","[     부산시청 전경./사진제공=부산시[서울경제] 부산시가 아동복지시설 내 아동의 안전 사건·사고를 예방하기 위해 세이브더칠드런, 부산광역시아동복지협회와 함께 힘을 모은다.부산시는 29일 오후 2시 양정동에 소재한 부산광역시 보호아동자립지원센터에서 세이브더칠드런 남부지역본부, 부산광역시아동복지협회와 ‘아동에게 안전한 기관 만들기’ 사업 추진을 위한 업무협약을 체결한다고 밝혔다.협약에 따라 부산시는 사업의 행정적인 지원을, 부산광역시아동복지협회는 사업 참여 및 진행 협력과 아동안전보호정책 이행을, 세이브더칠드런은 사업 운영과 예산지원을 한다.이번 사업으로 세이브더칠드런은 3월부터 12월까지 지역 내 아동복지시설 18곳을 대상으로 종사자 교육과 컨설팅을 제공한다. 아울러 행동강령 수립, 안전한 채용, 아동에게 안전한 프로그램 운영, 아동참여 활동 위험요인 평가, 협력기관 교육 등 기관별 아동안전보호정책의 수립·운영을 돕는다.특히 보호정책에 기반한 지속적인 점검을 통해 아동 사고 위험 발생을 최소화하고 위험 발생 시에도 즉각적인 대처가 가능해 지역사회 내 아동안전 보호 체계가 마련될 것으로 기대된다.부산시 관계자는 “이번 사업을 통해 아동학대 징후를 초기에 발견하는 등 아동의 안전 사건·사고를 예방해 지역사회 내 아동을 돌보고 교육하는 모든 기관이 아동에게 안전한 기관이 될 수 있길 바란다”고 말했다. ]",[],http://www.dtnews24.com/news/articleView.html?idxno=722023,https://n.news.naver.com/mnews/article/011/0004035242?sid=102
2022.03.30.,이뉴스투데이,,"진주시, 영유아·아동복지시설 등 8개소 위탁계약증서 전달",,,http://www.enewstoday.co.kr/news/articleView.html?idxno=1558871,https://www.seoul.co.kr
2022-03-29 15:42:01,KBS,,"복지부, ‘화장시설 적체 해소’ 단기인력·인센티브 지원","[     강원 삼척 어울림플라자 조감도. 삼척시 제공강원 삼척 도심에 체육·문화·복지시설이 결합한 ‘어울림플라자’가 들어선다.삼척시는 국비 36억원, 도비 7억원, 시비 130억원 등 총 173억원을 들여 남양동에 어울림플라자를 짓는다고 29일 밝혔다. 어울림플라자는 지하 1층·지상 4층 연면적 3541㎡ 규모이고, 국민체육센터와 가족센터, 생활문화센터로 이뤄진다. 국립체육센터에는 체육관, 다목적실, 건강증진실, 가족센터에는 육아나눔터, 교육실, 상담실, 생활문화센터에는 다목적홀, 주민자율공간 등이 각각 설치된다. 완공 목표 시기는 2023년 9월이다.삼척시 관계자는 “어울림플라자가 조성되면 시민들의 삶의질이 향상될 뿐아니라 중앙시장 활성화에도 도움을 줄 것”이라고 말했다. 한편 어울림플라자 기공식은 30일 남양동 현지에서 열린다. ]",[],https://news.kbs.co.kr/news/view.do?ncd=5425757&ref=A,https://n.news.naver.com/mnews/article/081/0003261655?sid=004
2022.03.31.,경남도민신문,,김해시 사회복지시설 종사자에 상해·신원보증보험 전액 지원,,,http://www.gndomin.com/news/articleView.html?idxno=310361,http://www.gndomin.com/
2022.03.28.,부산일보,,"경남경찰청, 여성복지상담소·시설협의회 관계자 간담회 개최했다",,,http://www.busan.com/view/busan/view.php?code=2022032810014982578,http://www.busan.com/
2022-03-28 15:06:01,뉴스1,사회,"시흥시, 아동복지시설 51곳에 자가진단키트 지원","[     경남경찰청은 28일 오후 2시 정병관 대회의실에서 성폭력 피해자 보호·지원을 위해 여성복지상담소·시설협의회 관계자를 초청한 가운데 간담회를 개최했다. 경남경찰청 제공경남경찰청은 28일 오후 2시 경남경찰청 신관(정병관) 대회의실에서 성폭력 피해자 보호·지원을 위해 여성복지상담소·시설협의회 관계자를 초청한 가운데 간담회를 개최했다.이날 간담회에는 여성범죄 수사와 범죄피해자 안전조치를 담당하는 경찰관들과 경남도내 여성복지상담소·시설협의회 15개 기관 대표들이 참석했다. 또 성폭력 피해자 상담 등 피해자 보호·지원을 담당하는 여성복지상담소·시설협의회에 대해 경남경찰청장의 감사장을 전달했다.간담회는 △19세 미만 아동 성폭력 피해자 영상촬영물 증거능력에 대한 위헌결정으로 피해자가 법원에 출석해 피의자 측의 반대신문에 대한 피해자 보호 방안 △미성년자 성폭력 사건 조사시 신뢰관계자 동석에 전문기관인 성폭력 상담소 연계 확대 방안 △스토킹범죄·데이트폭력에 대한 대응방안 등을 논의했다.이날 참석한 기관 대표들은 경찰이 수사 전 단계에서부터 2차 피해 예방 등 세심한 배려를 요청하고, “경찰과 민간기관이 힘을 합쳐 성폭력 범죄를 예방하고, 사건 발생 시 신속한 피해회복으로 시민들이 안심할 수 있는 경남을 만들어 달라”고 요청했다.이에대해 정병원 경남경찰청 여성청소년과장은 “성폭력 피해자들이 수사과정에 수사관의 부주의한 언행 등 세심하지 못한 사건처리로 인해 2차 피해를 입지 않도록 내부교육을 강화하고 여성복지상담소와 같은 전문기관과 연계를 통해 피해자 보호에 힘쓰겠다”고 밝혔다.    경남경찰청은 28일 오후 2시 정병관 대회의실에서 성폭력 피해자 보호·지원을 위해 여성복지상담소·시설협의회 관계자를 초청한 가운데 간담회를 개최했다. 경남경찰청 제공경남경찰청은 이번 간담회 논의내용을 분석해 도민들이 성범죄로부터 안전한 사회를 만들 수 있도록 민간과 경찰간 협력을 강화한다는 방침이다.이상률 경남경찰청장은 “성폭력범죄가 전통적인 성폭력 범죄에서 통신매체이용범죄, 카메라이용촬영 범죄, 디지털 성범죄, 가족·연인간 스토킹 및 데이트 폭력 등으로 변하는 흐름에 있다”면서 “피해 여성들의 정서적 안정과 2차 피해 예방을 위해 여성복지상담소·시설협의회 역할이 중요해 지고 있어 경찰과 협력을 통해 피해자 보호와 지원에 최선을 다하겠다”고 강조했다. ]",[],https://www.news1.kr/articles/?4627573,https://n.news.naver.com/mnews/article/082/0001148017?sid=102
2022.03.30.,경기일보,,김포시 옛 경찰서 부지 자치센터+복지시설 공공청사 건립,,,https://www.kyeonggi.com/article/20220330580104,http://news1.kr/
2022-03-25 14:29:31,스포츠서울,사회,"임실군, 삼계면 농촌중심지 활성화사업 핵심 시설 박사골 문화복지마당 준공","[     경기 시흥시청 전경.(시흥시 제공)© 뉴스1(시흥=뉴스1) 유재규 기자 = 경기 시흥시가 신종 코로나바이러스 감염증(코로나19) 자가진단키트를 감염 취약계층인 아동을 위해 지원한다고 25일 밝혔다. 시에 따르면 일일 확진자 폭증에 따라 지역 내 아동복지시설 51곳에 신속항원검사 자가진단키트 2400개를 배부한다. 자가진단키트는 아동복지시설 이용자와 종사자만 사용한다.시 관계자는 ""집단감염 확산 방지 및 취약계층 보호 강화를 위해 앞으로도 더 지원할 것이며 상시적인 모니터링을 통해 코로나19 피해 상황 관리에 만전을 기할 것""이라고 말했다.   ]",[],http://www.sportsseoul.com/news/read/1109219?ref=naver,https://n.news.naver.com/mnews/article/421/0005990163?sid=102
2022.03.25.,뉴시스,,"용인시, 장애인 복지시설에 반려식물 522개 전달",,,http://www.newsis.com/view/?id=NISX20220325_0001808106&cID=14001&pID=14000,http://www.kyeonggi.com/
2022.03.28.,메디컬투데이,,"복지부, 전국 화장시설 단기인력 및 초과운영 인센티브 제공",,,https://mdtoday.co.kr/news/view/1065599476148872,http://www.sportsseoul.com/
2022-03-28 16:10:24,뉴스토마토,사회,"한양, 인천 복지관에 태양광시설 지원","[     임실군의 박사골 문화복지마당 준식에서 심민 군수가 축사를 하고 있다.[스포츠서울 l 임실=고봉석 기자] 전북 임실군이 지난 24일 삼계면 농촌중심지 활성화사업의 핵심 시설인 삼계면 복지회관, 일명 박사골 문화복지마당 준공식을 가졌다. 삼계면 농촌중심지 활성화사업은 2017년 10월 농식품부 공모사업에 선정되어 2018년부터 2021년까지 4년간 59억원의 사업비가 투입됐다.작은목욕탕이 있는 복지회관 신축, 민속전수관 리모델링, 야외 공연을 즐길 수 있는 달빛마당 조성, 마을방송시스템, 충효로 정비, 주민역량강화 사업 등 최근 코로나 위기 상황에서도 주민들의 적극적인 호응으로 추진됐다.이날 준공된 복지회관은 삼계면사무소 건너편에 위치하며 사업비 38억원이 투입됐다. 2020년 10월 착공해 지상 2층 연면적 962㎡(292평) 규모로 1층은 작은목욕탕, 북카페, 어르신 쉼터, 2층은 다목적실, 청년회 사무실 등 주민 생활밀착형 공간으로 구성됐다. 군은 영농으로 지친 주민들에게 다소나마 문화생활과 건강증진에 기여할 것이며, 오랜 숙원사업인 작은목욕탕은 동네 어른신들의 사랑방 공간으로써의 역할을 톡톡히 해낼 것으로 기대하고 있다.심 민 군수는“그동안 삼계면에는 복지회관이 없어 항상 주민들에게 미안한 마음이 있었는데, 복지회관 준공으로 누구보다 기쁘게 생각한다”며“앞으로도 주민들의 행복과 삶의 질 향상을 위해 다양하고 적극적인 정책을 마련하겠다”고 말했다. ]",[],http://www.newstomato.com/ReadNews.aspx?no=1113179&inflow=N,https://n.news.naver.com/mnews/article/468/0000833346?sid=102
21면 1단,부산일보,,"[포토뉴스] 곤명농협·곤명딸기영농조합법인,아동복지시설 이웃돕기 성품 전달",,,http://www.busan.com/view/busan/view.php?code=2022032811373714546,http://www.newsis.com
