Date,Press,Category,Title,Content,Comment,URL_Origin,URL_Naver
2023.06.30.,중부매일,,"한국농어촌공사 충북지역본부, 독거노인 위한 도시락 배달 실시",,,http://www.jbnews.com/news/articleView.html?idxno=1399067,http://www.jbnews.com
2023.06.30.,조선비즈언론사 선정,,"“윗집서 넘어지는 소리가?”… LH, 층간소음 활용해 독거노인 위급상황 잡는...",,,https://biz.chosun.com/real_estate/real_estate_general/2023/06/30/UKVPOMQJYJAT5HUJY6R46H4M7E/?utm_source=naver&utm_medium=original&utm_campaign=biz,http://biz.chosun.com/
2023-06-30 17:11:03,브릿지경제,경제,"남창진 부의장, 서울시 독거노인 지원사업 본격적으로 추진","[ 평상시 진동과 다른 충격 느껴지면 관리사무소 등에 알람 층간소음 발생 세대가 피해 상황 인지할 수 있는 기술도 개발 ”층간소음 활용해 사회적 문제 해결… 통합주거서비스 시스템 형태로 개발”         한국토지주택공사(LH)가 층간소음과 진동을 활용해 독거노인이 위급한 상황에 처했을 때 관리실 등에 긴급 알림을 보내는 시스템을 구현한다. 또한 층간소음 가해자가 자신이 어느 수준의 소음을 발생시키고 있는지 인식할 수 있도록 월패드 등을 통해 ‘층간소음 알람’을 제공하는 기술 연구에도 나섰다.30일 LH에 따르면 최근 LH는 ‘층간소음 모니터링 알고리즘 구현화 및 현장 검증’ 연구에 착수했다. LH는 바닥 충격음 예측 알고리즘을 구현하고, 모니터링 시스템 시제품 제작 및 실증 실험에 대한 연구용역도 발주했다.    그래픽=이은현        우선 LH는 공동주택 바닥 슬래브(철근콘크리트구조의 바닥) 진동을 통해 거주자의 생활패턴을 분석할 계획이다. 평상시 진동이나 소음을 측정한 뒤, 독거노인이 바닥에 쓰러지거나 벽 등에 부딪혔을 때 특정 진동 신호나 충격음이 발생하면 위급상황임을 인지하고 이를 관리사무소 등에 알려주는 시스템이다. 알림은 벽면 등에 부착된 월패드 등을 통해 전달할 계획이다.또 평상시와는 다른 특수한 충격음이 발생하는 것과 반대로 가구 내 보행 진동 등이 일정 시간 이상 감지되지 않거나, 줄어든 상황도 분석해 알림 시스템을 제공할 계획이다.우리나라의 65세 이상 고령인구는 현재 947만여명이다. 전체 인구에서 차지하는 비율은 지난 2014년 12.4%에서 2023년 5월 18.4%까지 치솟았다. 이 중 혼자 거주하는 독거노인의 비율은 지난 2021년 20.8%를 기록했다.LH 관계자는 “현재 독거노인 고독사 문제를 해결하기 위해 가구 내 모션감지, 전기량 모니터링 등을 도입했지만, 일정 시간 이상 모니터링을 진행해야 하기 때문에 즉각적 대응이 어렵다는 단점이 있다”며 “반면 층간소음이나 진동을 모니터링하면 위급 상황에서 즉시 대응할 수 있기 때문에, 초고령 사회로 진입을 앞두고 있는 우리나라에서 반드시 개발돼야 할 기술이다”고 설명했다.이와 더불어 LH는 층간소음 가해자가 자신이 발생시키는 소음의 수준을 인지할 수 있도록 알람을 보내는 시스템도 개발할 예정이다.층간소음 문제가 사회적으로 이슈가 되면서 건설업계에서는 다양한 바닥충격음 저감 기술들을 개발해왔다. 그러나 고성능 바닥구조를 적용하더라도 일반적인 생활충격 이상의 충격이 발생할 가능성이 있으며, 소음 발생 세대가 피해 상황을 인지하지 못할 수 있다.이번에 LH가 개발하는 층간소음 모니터링 시스템은 층간소음 기준 이상의 소음을 발생시킬 수 있는 진동이 감지되면 월패드 또는 휴대전화 애플리케이션(앱) 등으로 알림메시지를 전달하는 기술이다.LH는 센서를 소음 발생 가구의 벽에 센서를 매립하는 형태로 설계할 예정이다. 또 외부 해킹 등을 방지하기 위해 진동 신호 정보를 가구 내 분석기에서 처리하도록 할 방침이다.LH 관계자는 “층간소음을 사회적 문제 해결을 위해 활용하는 방안을 연구하고 있다”며 “층간소음 모니터링은 층간소음 및 독거노인 고독사 등의 문제를 동시에 예방할 수 있는 통합주거서비스 시스템으로 개발될 계획”이라고 밝혔다. ]","['이건 또 먼 개솔이야? ㅋㅋㅋㅋ 창조경제냐?', '흥, 층간소음 합리화 시키는거지 머', '골때리네..', '우리 윗집 할머니 할아버지 사시는데, 손주들이나 와야 사람사는구나~ 하지 그외엔 너무 조용하신데 진동같은 소리 하고있다...', '잠실엘스,리센츠 위층 똥떨어지는 소리도 들린다', '발 헛디디거나 물건 떨어뜨려서 쿵 하면 밑에집에 실수라고 해명해야하나', '', '', '층간 소음 없는 주거 문화와 아파트 시공을 해야지 ㅡ 대단하다. 건설 쟁이 카르텔', '그걸 하는거보다 층간에 소음마감을\n더하면 많이~~~잘한다는 소리들을텐데']",https://www.viva100.com/main/view.php?key=20230629010008541,https://n.news.naver.com/mnews/article/366/0000913408?sid=101
2023.06.26.,경인매일,,"경기도의회 이호동 의원, ""독거노인과 장애인을 위한 응급안전안심서비스 안심...",,,https://www.kmaeil.com/news/articleView.html?idxno=404667,http://www.viva100.com
2023.06.26.,국제뉴스,,"건보공단 부울경본부, 독거노인 건강음료 배달사업 후원금 전달",,,https://www.gukjenews.com/news/articleView.html?idxno=2750467,http://www.kmaeil.com/
2023.06.26.,헬스인뉴스,,"서울대치과병원, 독거노인 대상 찾아가는 치과서비스 진행",,,http://www.healthinnews.co.kr/news/articleView.html?idxno=38598,http://www.gukjenews.com/
2023.06.25.,경남매일신문,,독거노인ㆍ중증장애인 응급안전 대처 힘써,,,http://www.gnmaeil.com/news/articleView.html?idxno=521270,http://www.healthinnews.co.kr
2023.06.25.,경상매일신문,,"봉화군 법전면, 독거 노인생활관리사 대상 양수발전소유치 홍보",,,http://www.ksmnews.co.kr/default/index_view_page.php?idx=432362&part_idx=7,http://www.gnmaeil.com
2023.06.27.,헬스경향,,"건강한 여름 위해…은퇴한 시니어들, 독거노인들의 '벗 자청'",,,http://www.k-health.com/news/articleView.html?idxno=66098,http://www.ksmnews.co.kr
2023.06.23.,굿모닝충청,,대전지역 독거노인 6만1527명…전체 인구의 4.2%,,,http://www.goodmorningcc.com/news/articleView.html?idxno=291269,http://www.k-health.com/
2023.06.29.,뉴스핌,,"애큐온캐피탈·저축은행, 독거노인 100가구 밥솥 교체 지원",,,http://www.newspim.com/news/view/20230629000790,http://www.newspim.com
2023.06.26.,뉴스웍스,,"이천시, 방문건강관리에 착수…취약환경 독거노인 우선 서비스",,,http://www.newsworks.co.kr/news/articleView.html?idxno=719037,http://www.newsworks.co.kr/
2023.06.22.,국제뉴스,,"법전면, 독거노인생활관리사 대상 양수발전소 유치 홍보",,,https://www.gukjenews.com/news/articleView.html?idxno=2748328,http://www.gukjenews.com/
2023.06.22.,뉴스핌,,"건보공단 대전세종충청본부, 독거노인 생활지원사 역량강화",,,http://www.newspim.com/news/view/20230622000354,http://www.newspim.com
2023.06.21.,라이센스뉴스,,"신한금융, 에너지 취약계층에 희망 전달…독거노인 돕기 자원봉사 실시",,,https://www.lcnews.co.kr/news/articleView.html?idxno=54261,http://www.lcnews.co.kr
2023.06.21.,뉴스포스트,,"신한금융, '자원봉사대축제' 실시...독거노인 여름나기 키트 제작",,,http://www.newspost.kr/news/articleView.html?idxno=109041,http://www.newspost.kr/
2023.06.27.,헤드라인제주,,"연동연합청년회, 저소득층 독거노인 사랑의 이불세탁 실시",,,http://www.headlinejeju.co.kr/news/articleView.html?idxno=518410,http://www.headlinejeju.co.kr
2023.06.23.,당진신문,,"당진시남부노인복지관, 독거남성어르신 프로그램 '어쩌다 살림왕!' 개강",,,http://www.idjnews.kr/news/articleView.html?idxno=139700,http://www.idjnews.kr/
2023.06.29.,충청일보,,"예산군 신암면지역사회보장협의체, 독거노인 '반려식물' 나눔행사 개최",,,https://www.ccdailynews.com/news/articleView.html?idxno=2213446,http://ccdailynews.com
2023.06.26.,에너지경제,,"한국마사회 부산연제지사, 독거노인 식생활 자립 위한 기부금 전달",,,https://www.ekn.kr/web/view.php?key=20230626010006289,http://www.ekn.kr
2023.06.22.,마이데일리,,"신한금융, 독거노인 위한 보양식품·생활용품 키트 제작",,,http://www.mydaily.co.kr/new_yk/html/read.php?newsid=202306220814851929&ext=na&utm_campaign=naver_news&utm_source=naver&utm_medium=related_news,http://www.mydaily.co.kr/
2023-06-22 08:15:02,이뉴스투데이,생활/문화,"경남사회서비스원, '독거노인 우울 예방 프로그램' 실시","[     [마이데일리 = 구현주 기자] 신한금융그룹이 ‘폭염 대비 독거 어르신을 위한 착한 바람’ 봉사활동을 실시했다고 22일 밝혔다. 진옥동 신한금융 회장과 임직원 50여명은 전날 서울 중구 본사에서 독거노인을 위한 여름철 보양식품과 휴대용 선풍기, 인견이불, 냉파스 등 생활용품을 담은 키트를 직접 제작했다. 신한금융은 독거노인종합지원센터에 2억원 규모 여름나기 물품을 전국 2000여명 독거노인을 위해 전달할 예정이다.또한 키트 제작 행사에 앞서 신한금융 봉사단 이름을 ‘솔선수범’으로 새롭게 정하고, 이를 기념하기 위해 폐플라스틱 병뚜껑을 활용한 아트월 제작 행사를 가졌다.신한금융은 지난 2008년부터 ‘글로벌 원 신한 자원봉사대축제’를 실시하며 공존(복지), 공감(문화), 공생(환경)을 중점 분야로 지역사회 문제 해결에 기여하고 있다.진옥동 회장은 “오늘 제작한 여름나기 키트가 어르신들께 잘 전달돼 건강하게 올여름을 보낼 수 있는 ‘착한 바람’이 되길 바란다”고 말했다. [사진 = 신한금융그룹](구현주 기자 winter@mydaily.co.kr) ]",[],http://www.enewstoday.co.kr/news/articleView.html?idxno=2013926,https://n.news.naver.com/mnews/article/117/0003742613?sid=103
2023.06.30.,헤럴드경제,,"HDC현대산업개발, 쪽방촌 독거노인·소외계층에 냉장고 지원",,,http://news.heraldcorp.com/view.php?ud=20230630000136,http://www.enewstoday.co.kr/
2023.06.29.,매경이코노미,,"HDC현대산업개발, 쪽방촌 독거노인·소외계층에 냉장고 기부",,,https://www.mk.co.kr/article/10772521,http://www.heraldbiz.com/
2023-06-30 09:41:04,파이낸셜뉴스,경제,"""8년째 6억5000만원 기부"" 메트라이프생명 사회공헌재단, 독거노인 위한 '워크...","[ 냉장고 50대 구매해 전달    HDC현대산업개발은 28일 김성철 용산구의회 의원, 박희영 용산구청장, 신왕섭 HDC현대산업개발 실장, 이경직 용산복지재단 사무국장 등이 참석한 가운데 용산복지재단에 홀로 사시는 어르신들과 폭염 취약계층이 시원하게 여름을 날 수 있도록 냉장고 기부 전달식을 진행했다. 왼쪽부터 김성철용산구의회 의원, 신왕섭 HDC현대산업개발 실장, 박희영 용산구청장, 이경직 용산복지재단 사무국장.[헤럴드경제=박자연 기자]HDC현대산업개발이 서울시 용산구 동자동 쪽방촌 독거노인과 소외계층에게 냉장고를 지원했다.30일 HDC현대산업개발에 따르면 이 회사는 지난 28일 서울 용산구청에서 김성철 용산구의회 의원, 박희영 용산구청장, 신왕섭 HDC현대산업개발 실장, 이경직 용산복지재단 사무국장 등이 참석한 가운데 독거노인과 소외계층에 냉장고 50대를 전달하는 전달식을 진행했다.박희영 용산구청장은 “본사가 속한 용산 지역사회와의 상생을 위해 다양한 사회공헌 활동을 진행해주시는 HDC현대산업개발에 진심으로 감사드린다”라며 “이번에 전달받은 냉장고는 용산구에서 다가올 혹서기를 걱정하고 계신 폭염 취약계층분들의 생활에 큰 보탬이 될 것”이라고 말했다.HDC현대산업개발 관계자는 “올해 여름은 이른 폭염이 예상되는데 이번 지원을 통해 지역사회인 용산에 거주하시는 어르신들과 소외계층 가정에 냉장고가 전달되어 생활에 도움이 되시길 바란다”며 “HDC현대산업개발은 하반기에도 사회적 책임을 다하고 지역공동체와 상생하기 위해 다양한 ESG 활동을 펼쳐나갈 것”이라고 말했다.HDC현대산업개발은 올해 본사가 있는 용산에서 지역 식재 봉사, 용산복지재단 장애인 물품 지원, 지역 일자리 사업 참여 어르신 대상 쌀 기부, 대한노인회 쌀 지원, 용산 드래곤즈 청년 직무 멘토링, 취약계층 장애아동 생활지원금 기부, 해오름빌 벽화봉사, 이촌 한강공원 가꾸기 봉사활동 등 지역사회와의 동반 성장을 위한 사회공헌 활동을 진행한 바 있다. ]",[],http://www.fnnews.com/news/202306160940184027,https://n.news.naver.com/mnews/article/016/0002163188?sid=101
2023.06.25.,서울경제,,"용인시, 폭염대응 종합대책 가동…독거 노인 등 보호",,,https://www.sedaily.com/NewsView/29QZPH96JG,http://www.mkeconomy.com/
2023-06-29 17:17:01,브릿지경제,경제,"동서발전, 독거노인 100가구에 여름침구세트 지원","[      (왼쪽부터) 김성철 용산구의회 의원, 신왕섭 HDC현대산업개발 실장, 박희영 용산구청장, 이경직 용산복지재단 사무국장. (HDC현대산업개발 제공)HDC현대산업개발이 쪽방촌 독거노인과 소외계층에게 냉장고 50대를 기부했다. 사회적 책임을 다하는 ESG 활동의 일종으로 폭염 취약계층 생활에 보탬이 될 것으로 보인다.HDC현대산업개발은 서울시 용산구 동자동 쪽방촌에 거주하는 독거노인과 취약계층에게 냉장고 50대를 전달했다고 밝혔다. 지난 6월 28일 용산구청에서 진행된 전달식에는 김성철 용산구의회 의원, 박희영 용산구청장, 신왕섭 HDC현대산업개발 실장, 이경직 용산복지재단 사무국장 등이 참석했다.박희영 용산구청장은 “전달받은 냉장고는 용산구에서 다가올 혹서기를 걱정하는 폭염 취약계층 생활에 큰 보탬이 될 것”이라며 감사 인사를 전했다.HDC현대산업개발 관계자는 “올해 여름은 이른 폭염이 예상되는데 이번 지원이 생활에 도움이 되길 바란다”며 “HDC현대산업개발은 하반기에도 사회적 책임을 다하고 지역공동체와 상생하기 위해 다양한 ESG 활동을 펼쳐나갈 것”이라고 밝혔다.한편 HDC현대산업개발은 올해 용산구에서 지역 식재 봉사, 용신복지재단 장애인 물품 지원, 역 일자리 사업 참여 어르신 대상 쌀 기부, 대한노인회 쌀 지원 등 지역사회를 위한 활동을 이어왔다. 이외에도 강남구 구룡마을 화재 이재민 지원 성금 및 생필품 기부, 강릉 산불 피해 긴급 구호 등 전국적으로 사회공헌 활동을 펼쳐나가고 있다. ]",[],https://www.viva100.com/main/view.php?key=20230619010005310,https://n.news.naver.com/mnews/article/024/0000082965?sid=101
2023.06.15.,엑스포츠뉴스,,"임영웅 팬클럽, 부산 독거노인 위해 정기 봉사 진행…500만 원 기부",,,https://www.xportsnews.com/article/1736003,http://www.fnnews.com/
2023-06-16 10:07:01,1코노미뉴스,경제,[백세인생] 역대급 더위 온다…독거노인 폭염대책은?,"[ 한 걸음당 1원씩 매칭하는 구조기부금, 독거노인 정서적 지원에 사용     메트라이프생명 사회공헌재단 '워크 투 헬프' 캠페인 참여 우수지점인 마린지점에서 남구장애인복지관에 발달장애인 심리안정 조끼 '허기(HUGgy)'를 전달했다. 사진=메트라이프생명 제공 [파이낸셜뉴스] 메트라이프생명 사회공헌재단은 지난 5월 10일부터 6월 1일까지 걸으면서 기부하는 ‘워크 투 헬프 (Walk To Help)’ 캠페인을 진행했다고 16일 밝혔다.   해당 캠페인에는 메트라이프생명 임직원, 재무설계사, 고객, 주한미국상공회의소(AMCHAM) 회원사 등 약 5000명이 참여했다. 메트라이프생명 사회공헌재단에서 한 걸음 당 1원씩 매칭해 총 5000만원을 모금했다.   기부금은 독거노인을 위한 정서적 지원에 사용된다. 임직원 및 재무설계사 자원봉사자들은 독거노인 복지관을 방문, 노인들과 원예활동을 함께할 예정이다.   메트라이프생명 사회공헌재단은 ""올해로 8년째 진행되고 있는 ‘워크 투 헬프’ 캠페인을 통해 총 6억5000만원의 기부금을 모아 4079명의 독거 어르신들을 지원했다""고 밝혔다.   한편, 발달장애인 정서 지원을 위한 심리 안정 조끼 ‘허기(HUGgy)’ 30개를 전국 장애인 관련 기관에 지원하는 미션도 진행됐다. '허기'는 공기 주입으로 신체에 적절한 압력을 가해 착용자에게 안정감을 주는 역할을 하며, 재단의 사회혁신기업 육성 프로그램 ‘인클루전 플러스 5.0’에 참여한 소셜벤쳐 ‘돌봄드림’이 개발했다.   ]",[],http://www.1conomynews.co.kr/news/articleView.html?idxno=23847,https://n.news.naver.com/mnews/article/014/0005028189?sid=101
2023.06.14.,1코노미뉴스,,응급안전안심서비스 3차 사업 가동…독거노인 수 대비 태부족,,,http://www.1conomynews.co.kr/news/articleView.html?idxno=23852,http://www.sedaily.com
2023.06.30.,충남일보,,"예산군 신암면 지역사회보장협의체, 독거노인 '반려식물' 나눔행사 개최",,,http://www.chungnamilbo.co.kr/news/articleView.html?idxno=722894,http://www.chungnamilbo.co.kr
2023.06.14.,당진신문,,"당진시 정미면, 독거노인 찾아가는 맞춤형 복지 서비스 제공",,,http://www.idjnews.kr/news/articleView.html?idxno=139581,http://www.idjnews.kr/
2023.06.13.,전북도민일보,,"김제 두꺼비회관, 청하면 독거노인에 음식 꾸러미 후원",,,http://www.domin.co.kr/news/articleView.html?idxno=1428517,http://www.domin.co.kr
2023.06.13.,경기신문,,"한세대학교 학생들, 관내 독거노인 대상으로 돌봄 봉사활동 실시",,,https://www.kgnews.co.kr/news/article.html?no=751676,http://www.kgnews.co.kr/
2023.06.28.,경남매일신문,,창원 마산합포구， 독거노인 미숫가루 전달,,,http://www.gnmaeil.com/news/articleView.html?idxno=521530,http://www.gnmaeil.com
2023.06.28.,새전북신문,,"전주청년회의소, “사랑의 손잡기” 독거노인 식사 제공",,,http://sjbnews.com/news/news.php?number=784820,http://www.sjbnews.com/
2023.06.11.,전북일보,,"장수군노인장애인복지관, 독거노인 대상 문화체험 진행",,,https://www.jjan.kr/article/20230611580133,http://www.jjan.kr
2023.06.22.,아시아투데이,,"부산항만공사, 커피 찌꺼기 활용 '다육식물 화분' 독거노인에 나눔",,,https://www.asiatoday.co.kr/view.php?key=20230622010011600,http://www.asiatoday.co.kr
2023.06.26.,불교공뉴스,,'같이가치 가족봉사단 ' 정신질환 독거노인 주거환경개선 봉사 추진,,,http://www.bzeronews.com/news/articleView.html?idxno=613430,http://www.bzeronews.com
2023.06.20.,경상일보,,"한국동서발전, 울산지역 독거노인 100가구에 친환경 여름이불 전달",,,https://www.ksilbo.co.kr/news/articleView.html?idxno=972726,http://ksilbo.co.kr
2023.06.27.,CNB뉴스,,"마사회 부산연제지사, 독거노인 식생활 자립 위한 기부금 전달",,,https://www.cnbnews.com/news/article.html?no=607741,http://www.cnbnews.com
2023.06.09.,에너지경제,,의왕시 독거노인 전수조사 돌입…안심의왕↑,,,https://www.ekn.kr/web/view.php?key=20230609010002274,http://www.ekn.kr
2023.06.25.,전북도민일보,,"전주시여성자원활동센터, 독거노인 가구에 주거환경개선 봉사",,,http://www.domin.co.kr/news/articleView.html?idxno=1429837,http://www.domin.co.kr
2023.06.16.,유교신문,,"울진군 북면 지역사회보장협의체, 6월 독거노인 김치 반찬 나눔 시행",,,http://www.cfnews.kr/news.aspx/77537,http://www.cfnews.kr
2023.06.13.,한국경제,,위본그룹-독거노인종합지원센터 '취약노인 사랑잇기 전화' MOU,,,https://www.hankyung.com/economy/article/2023061354347,http://www.hankyung.com/
2023-06-13 10:36:01,충청매일,경제,"충남 공주시 웅진동, 기초생활수급 독거노인가구 주거환경개선 실시","[ 5월 30일 위본그룹 분당 사옥서 업무 협약 맺어취약노인 고독사 방지 및 보호강화 위한 자원봉사 사업    위본그룹은 취약계층인 독거노인의 고독사 방지 및 보호강화를 위한 MOU를 체결했다. (사진 왼쪽부터) 김현미 센터장, 기민영 총괄사장. / 사진=위본그룹 제공위본그룹은 독거노인종합지원센터와 '취약노인 사랑잇기 전화 사업 업무협약(MOU)'을 체결했다고 13일 밝혔다. 위본그룹 계열사인 위본모터스㈜·위본건설㈜·도양기업㈜과 보건복지부 산하기관인 독거노인종합지원센터는 지난달 30일 위본그룹 분당 사옥에서 자원봉사 사업 관련 MOU를 맺었다.취약노인 사랑잇기 전화 사업은 취약노인 고독사 방지 및 취약노인 보호강화를 위해 공공기관과 민간기업 자원봉사자가 서로 연계·협력하는 자원봉사 사업이다. MOU에 따라 도양기업 위본건설 위본모터스 소속 자원봉사자가 독거 어르신들에게 정기적 안부전화 서비스를 통해 고독사를 예방하고 심리적 안정감을 제공하기로 했다.위본그룹은 ESG(환경·사회·지배구조) 경영 본격화를 위해 기민영 총괄사장을 위원장으로 하는 ESG위원회를 꾸려 기업의 사회적 책임을 다해나갈 계획이다.위본그룹은 1994년 창업한 토목전문회사인 도양기업을 모태로 자동차사업부는 아우디 공식딜러인 위본모터스가 수도권 5곳(서초,분당,판교,동탄,안양)에 전시장과 서비스센터를 운영하고 있다. 랜드로버 공식딜러인 위본오토모티브㈜는 호남 2곳(광주,전주)에 전시장과 서비스센터를 운영 중이다.건설사업부는 전국 50여 곳에 건설 현장이 있으며 개발사업부는 고양덕은지구와 시흥은계지구 오피스텔 분양 등 다양한 부동산 개발사업을 전개하고 있다. ]",[],https://www.ccdn.co.kr/news/articleView.html?idxno=921301,https://n.news.naver.com/mnews/article/015/0004855358?sid=101
2023.06.08.,국제뉴스,,"의왕시, 독거노인 전수조사 본격 추진",,,https://www.gukjenews.com/news/articleView.html?idxno=2736839,http://www.ccdn.co.kr
2023.06.08.,헤럴드경제언론사 선정,,"[단독]주말 숨진 독거노인, ‘움직임 센서’ 이용했지만…‘휴무’ 공무원에 ...",,,http://news.heraldcorp.com/view.php?ud=20230608000713,http://www.gukjenews.com/
2023.06.14.,천지일보,,"무주군, 독거노인 주거환경 개선 사업 전개",,,https://www.newscj.com/news/articleView.html?idxno=3036118,http://www.heraldbiz.com/
