Date,Press,Category,Title,Content,Comment,URL_Origin,URL_Naver
2017.09.27.,조세일보,,히어로 데이에 한가위 봉사...유통가 사회공헌 '구슬땀',,,http://www.joseilbo.com/news/news_read.php?uid=336470&class=17&grp=,http://www.chungnamilbo.co.kr
2017.09.27.,아시아경제,,관악구 전 직원 추석 맞아 자원봉사 나서,,,http://www.asiae.co.kr/news/view.htm?idxno=2017092706432647576,http://www.joseilbo.com/
2017-09-27 15:36:59,국민일보,경제,중증장애인 ‘야간순회 방문서비스’ 확대 운영 ‘120경기도 콜센터’ 민원접...,"[    식음료 등 유통업계가 추석과 국군의 날을 앞두고 기업의 사회적 책임 수행을 위한 다양한 사회공헌 활동에 구슬땀을 흘리고 있다. 27일 유통가에서 전해온 관련 소식들을 모아봤다.CJ제일제당, 전사 헌혈 봉사활동으로 생명나눔 동참    ◆…출처 : CJ제일제당CJ제일제당(대표 김철하 부회장)은 지난 14일, 서울 중구에 소재한 본사에서 전 임직원을 대상으로 자발적 헌혈 봉사활동을 진행했다. 이번 생명나눔 활동을 통해 모인 혈액과 헌혈증은 도움이 절실한 이웃에 전달될 예정이다. CJ제일제당은 본사를 비롯한 전국 사업장에서 연간 15회에 걸쳐 헌혈 봉사를 실시하고 있으며 특히, 올해부터는 임직원이 언제든 헌혈증을 기부할 수 있도록 헌혈기부은행을 운영, 헌혈 참여 문화 조성에도 힘쓰고 있다.CJ프레시웨이, 안양시수리장애인복지관과 '함께 떠나는 밥상' 캠프 진행CJ그룹의 식자재 유통 및 단체급식 전문 기업 CJ프레시웨이(대표 문종석)는 경기도 안양시수리장애인복지관과 손잡고 '혼밥 아닌 함밥: 함께 떠나는 밥상' 캠프를 지난 8~9일 양일에 걸쳐 남이섬에서 진행했다. '혼밥 아닌 함밥'은 '혼자 먹는 밥이 아닌 함께 먹는 밥'이라는 뜻으로 지역사회 소외계층이나 중증장애인이 CJ프레시웨이 전문 셰프의 지도로 직접 요리를 만들고 이웃과 나눠 먹으며 서로 간의 관계를 형성하는 사회공헌 프로그램이다.이번 캠프는 '혼밥 아닌 함밥'을 통해 인연을 맺은 장애인 8명, 이웃 주민 8명이 참가했다. 이들은 캠프 1일 차 저녁, CJ프레시웨이 셰프와 함께 목살구이, 김치전골, 닭꼬치 등 다양한 요리를 조리하고 함께 식사하는 등 서로 간 관계를 더욱 돈독히 다지는 시간을 가졌다. 본죽·본사랑, 전국발달장애인 댄스경연대회 6년 간 후원     ◆…출처 : 본죽본죽, 본도시락을 운영하고 있는 본아이에프의 사회공헌단체 (사)본사랑(이사장 최복이)은 장애인 인식 개선을 위해 6년째 참여 중인 전국발달장애인 댄스경연대회를 공식 후원했다.지난 20일 서울 노원구에 위치한 노원문화예술회관 대공연장에서 '제12회 전국발달장애인 댄스경연대회'가 개최된 가운데 본죽과 본사랑은 이번 행사의 준비 지원금과 상금 1천만원, 행사 당일 참가자들을 위한 도시락 550개를 지원하며 따뜻한 나눔 활동을 이어갔다.본아이에프, 한가위 설렁탕 나눔 행사 진행이뿐만이 아니다. 본아이에프(대표 김인호)는 추석을 앞두고 독거 어르신들의 안정적인 식생활을 위해 '한가위 설렁탕 나눔 행사'를 지난 26일 진행했다.이날 본아이에프는 임직원 월 정기봉사 후원처인 서울시립성북노인복지관에서 지역 내 저소득층 및 독거 어르신을 초청하고 본설렁탕 500인분을 대접했다. 이날 행사에 참여한 본아이에프 임직원들은 직접 설렁탕을 조리하고 배식하는 것은 물론 점심식사 이후 설거지까지 동참하며 어르신들과 뜻 깊은 시간을 가졌다.CJ푸드빌, 지역아동센터 어린이 N서울타워 초청 행복나눔데이 진행CJ푸드빌(대표 구창근)도 지난 20일 CJ도너스캠프가 후원하는 지역아동센터 어린이들을 서울 남산에 위치한 N서울타워로 초청해 행복나눔데이를 펼쳤다. 이날 어린이들은 서울 전체를 한 눈에 바라볼 수 있는 전망대를 관람하고, 타워 내 센토이뮤지엄을 둘러보는 시간을 가졌으며, 타워 2층 캐주얼 이탈리안 레스토랑 더 플레이스 다이닝에서 이탈리아 만두 '라비올리'를 직접 만드는 오감체험 활동도 했다.  또한 봉사활동에 참여한 CJ푸드빌 임직원들은 어린이들과 N서울타워 곳곳을 돌아보고, N포토 스튜디오에서 촬영한 사진과 N서울타워 기념품을 선물 했다. SPC그룹, 추석 맞아 사회공헌활동SPC그룹(회장 허영인)은 추석 명절을 맞아 전국 사업장 임직원이 참여하는 사회공헌활동을 진행했다. 이번 행사는 지역사회 상생과 나눔에 동참하기 위해 전국 13개 사업장과 인근 복지기관이 공동으로 진행했다. SPC그룹 임직원 130여 명이 독거노인 등에게 간식과 후원금을 전달하고, 송편 만들기, 무료급식 등의 봉사활동에 참여했다. SPC그룹은 2003년부터 매년 설과 추석에 지역사회 복지기관에 명절행사를 후원하고 있으며, 올해까지 약 9억 3천만원 상당의 제품과 성금을 전달했다.롯데그룹 황각규 경영혁신실장, 군부대 방문 장병들 격려    ◆…출처 : 롯데그룹롯데그룹은 국군의 날을 앞두고 나라를 지키기 위해 헌신하고 있는 국군 장병들 격려에 나섰다. 지난 26일 경기도 연천 6군단에 '청춘책방' 12호점을 오픈했다. 이날 개소식에는 롯데그룹 황각규 경영혁신실장(사장), 롯데그룹 오성엽 커뮤니케이션팀장(부사장), 김성진 육군 제6군단장(중장), 박정택 육군 6포병여단장(준장), 전성대 육군본부 인사기획과장(대령), 한국구세군 박희범 사회복지부장 등이 참석했다. 청춘책방은 최전방 GOP, 해안 소초 등에 컨테이너를 개조해 만든 현장 도서관으로, 국군 장병들이 책을 통해 인성을 함양하고 미래를 준비할 수 있는 공간이다. 이를 위해 롯데는 지난해 6월 육군본부와 '전방부대 문화환경 조성을 위한 MOU'를 체결했으며, 지난해 11월 강원도 양구 21사단에 1호점을 오픈 한 이후 이번에 12호점을 오픈했다.  롯데는 지금까지 청춘책방에 도서 1만 1천 권을 기부했으며, 최전방 1,500여 명의 장병들이 청춘책방을 이용했다. 청춘책방을 이용하는 장병들은 틈틈이 시간을 내 월 1권 이상의 책을 완독하며 자기 계발을 하고 있다. 롯데는 올해 말까지 청춘책방을 22호점까지 늘릴 계획이다. 롯데그룹 황각규 경영혁신실장은 “국군의 날부터 시작되는 추석 연휴에 마음 놓고 가족들과 함께 즐거운 시간을 보낼 수 있는 것은 여러분들 덕분”이라며 “청춘책방이 장병 여러분들에게 감사의 마음을 전할 수 있는 작은 선물이 되기를 바란다”고 말했다.도미노피자, 국군·경찰·소방관 응원하는 '히어로즈 데이' 실시피자배달 전문 기업 도미노피자(대표 오광현)는 대한민국을 지키는 영웅들을 응원하기 위한 '히어로즈 데이(Hero's Day)' 프로모션을 실시한다. 이 프로모션은 오는 국군의 날(10월 1일)을 시작으로 경찰의 날(10월 21일), 소방의 날(11월 9일)에 해당 직업군 종사자에게 따뜻한 응원의 마음을 전달하기 위해 모든 피자를 40% 할인된 가격에 제공하는 나눔 이벤트다.프로모션 대상은 현역 군인, 공익근무요원, 경찰관, 소방관, 교도관으로 각각 해당 기념일에 오프라인(전화 및 매장방문 주문) 방문 포장 시 신분 확인 후 모든 피자에 40% 할인 혜택을 제공한다.  ▶ [HOT]당신의 10분 몸 만들기...황현정기자의 쭉쭉빵빵▶ [HOT]세무·회계 실무, 맞춤형 교육 '조세일보 재무교육원'..민경종(kj-min@joseilbo.com)저작권자 ⓒ 조세일보(http://www.joseilbo.com). 무단전재 및 재배포 금지   ]",[],http://news.kmib.co.kr/article/view.asp?arcid=0923822483&code=11131400&cp=nv,https://n.news.naver.com/mnews/article/123/0002170419?sid=101
2017.09.21.,금강일보,,진천군 초평면 지역사회보장協 홀몸어르신 세탁지원 서비스 실시,,,http://www.ggilbo.com/news/articleView.html?idxno=406960,https://www.asiae.co.kr/
2017-09-27 06:48:27,부산일보,사회,"부산진구 부암1동, 고독사 예방사업 운영","[ 1400여 전직원이 명절을 맞아 자원봉사에 나서는 전통 올해도 이어져 [아시아경제 박종일 기자]  “남의 발을 씻겨주면 내 손이 깨끗해지고, 남을 안아주면 내 가슴도 따뜻해진다. 내 손발을 움직여 어려운 이웃을 도우면 남도 행복해지고 나 자신도 행복해지는 것이 자원봉사의 원리다”유종필 관악구청장의 자원봉사에 대한 모토다.관악구(관악구청장 유종필) 직원 1400여 명이 추석 명절을 맞아 지역 내 소외되기 쉬운 어려운 이웃을 위해 따뜻한 가족의 정을 나눈다.구는 추석을 맞아 이달 23일부터 29일까지 집중자원봉사 주간으로 정하고 전 직원이 봉사활동을 펼치고 있다며 명절 때 직원들의 자원봉사활동은 매년 이어지고 있는 관악구만의 전통이라고 설명했다.우선 동주민센터는 물론 21개동과 연계된 각 부서에서 독거노인이나 저소득 가정, 경로당 등을 방문해 말벗이 돼주거나 청소, 급식, 시설물 안전 점검 등을 진행한다.또 기부받은 음식을 나눠주고 거동이 불편한 주민들 가정에 배달하는 것도 직원들의 몫이다.    자원봉사 현장 유종필 관악구청장도 봉사활동에 직접 참여했다. 유 구청장은 26일 관중회(관악구 중화요리 봉사회)와 함께 저소득 취약 계층과 독거 어르신 등을 위해 짜장면을 만들어 함께 나눴다.특히 관악구 공무원들은 직접 뜨개질한 털목도리를 지역 주민에게 전달하는 ‘따스미 봉사단(따뜻한 마음이 스며 든 아름다운(美) 공무원들의 모임)’을 운영하고 있다.이 봉사단은 관악구 공무원이면 누구나 참여해 직접 털목도리를 뜨는 활동을 한다. 이들이 만든 털목도리는 연말에 독거노인과 저소득층에 골고루 전달된다.‘따스미 봉사단’은 내달 13일부터 연말 어르신들을 위해 본격적인 털목도리 뜨게 봉사활동에 나설 계획이다.2015년 7월 관악구는 서울시 최초로 '365자원봉사도시’를 선포한 뒤 2017년 6월말 기준 활동건수는 2만2981건으로 선포 전 대비 두 배 가까이(193%) 늘었으며, 활동봉사자수는 12만4389명으로 170%, 1년간 총 봉사시간은 40만9801시간으로 169% 증가했다.유종필 구청장은 “따뜻한 가슴으로 어려운 이웃을 도와주는 자원봉사자야말로 이 시대의 진정한 영웅”이라며 “구민 모두가 봉사활동으로 서로 응원하며 더불어 살아가는 행복한 추석 명절을 보내기를 바란다”고 말했다.박종일 기자 dream@asiae.co.kr▶ 양낙규의 [군사이야기]▶ #오늘의 특징주! ▶ #오늘의 많이 본 (클릭!)&lt;ⓒ세계를 보는 창 경제를 보는 눈, 아시아경제 무단전재 배포금지&gt; ]",[],http://news20.busan.com/controller/newsController.jsp?newsId=20170921000243,https://n.news.naver.com/mnews/article/277/0004084580?sid=102
2017.09.18.,광주드림,,"[어른들이 다시 보는 그림책] `사노라면 언젠가는, 100만 번 산 고양이’ (사...",,,http://www.gjdream.com/v2/week/view.html?news_type=404&uid=482524,http://www.kmib.co.kr/
2017-09-24 23:03:13,중도일보,사회,"영덕읍 촘촘이·나눔지기단, 복지사각지대 다양한 지원","[    서울시와 경기도 등 지자체가 시민들이 추석 연휴를 안전하게 보낼 수 있도록 돕는 종합대책을 내놨다. 서울시는 오는 27일부터 다음 달 10일까지 ‘5대 추석 종합대책’을 시행한다고 24일 밝혔다. 종합대책에 따르면 시는 기초생활수급가구 15만5000여 가구에 총 46억5000만원의 위문품비를 지원하고 취약계층 독거어르신을 위한 안부전화와 서비스를 제공한다. 중증장애인을 위한 ‘야간순회 방문서비스’도 연휴기간인 다음달 2일부터 9일까지 확대 운영된다. 활동보조인력이 퇴근하는 야간 시간대에 중증장애인을 돌보는 ‘야간순회 방문서비스’를 활동보조인력들이 휴가를 떠나는 연휴 기간에 한해 주간에도 운영키로 했다. 시 관계자는 “평상시 야간 순회서비스를 이용하는 인력은 30명 정도”라며 “추석 연휴 기간에는 200명에게 주·야간 서비스를 지원할 계획”이라고 말했다.  추석 밥상 관리에도 나섰다. 살충제 부적합 농가 계란 유통실태를 조사해 회수하고 ‘안심계란 검사 신청제’ ‘유통계란 살충제 검사’ 등을 통해 안전관리를 강화하기로 했다. 오는 29일까지 자치구와 함께 농수산물 안정성검사와 축산물취급업소 위생 점검에도 나선다. 이밖에 안전사고를 막기 위해 575개소 도로시설물을 사전 점검하고, 명절 교통난을 해소하기 위해 고속·시외버스 운행횟수를 20% 늘리는 등 종합적인 대책을 준비 중이다.  경기도도 ‘추석 연휴 종합 대책’을 세워 오는 30일부터 다음 달 9일까지 운영한다. 도청의 ‘언제나 민원실’에서는 여권접수와 자격증 재발급, 생활·고충민원 상담 서비스를 이용할 수 있고 ‘수원역·의정부역 민원센터’에서는 오전 8시부터 오후 6시까지 민원상담 및 제증명 발급이 가능하다. ‘120경기도 콜센터’에서는 연휴 중에도 각종 민원접수는 물론 교통정보, 응급의료기관 안내, 외국어 및 수화 상담을 받을 수 있다. 도는 노숙인·독거노인 등 사회 취약계층을 위해 민간급식단체와 연계해 연휴기간에도 수원과 성남, 부천, 안산, 안양, 의정부 등 6개 시에 11개 무료 급식소를 운영한다. 3만1000여명에 달하는 독거노인은 1361명의 생활관리사가 주 3회 방문이나 전화로 안전여부를 확인하게 된다. 결식아동에겐 다음 달 2일부터 9일까지 도시락과 부식 및 밑반찬 배달, 식품권 제공 등의 방법으로 급식을 제공한다. 이택현 기자, 수원=강희청 기자 alley@kmib.co.kr[국민일보 홈페이지] [페이스북][취재대행소 왱!(클릭)]GoodNews paper ⓒ 국민일보(www.kmib.co.kr), 무단전재 및 재배포금지   ]",[],http://www.joongdo.co.kr/jsp/article/article_view.jsp?pq=201709072544,https://n.news.naver.com/mnews/article/005/0001030408?sid=102
2017.09.30.,국제뉴스,,"괴산군, 추석명절 맞아 따뜻한 후원의 손길 잇달아",,,http://www.gukjenews.com/news/articleView.html?idxno=794556,http://www.ggilbo.com
2017.09.30.,국제뉴스,,"괴산군, 추석명절 맞아 따뜻한 후원의 손길 잇달아",,,http://www.gukjenews.com/news/articleView.html?idxno=794556,http://www.gukjenews.com/
2017.09.30.,아시아경제,,"목포우체국, 추석 명절 맞아 '행복나눔 이웃사랑' 실천",,,http://www.asiae.co.kr/news/view.htm?idxno=2017093010252850726,https://www.asiae.co.kr/
2017-09-30 10:28:51,백세시대,사회,10일 간의 최장 추석 황금연휴… 소외 이웃들에게도 온정의 손길을,"[     [아시아경제 문승용 기자] 전남지방우정청 목포우체국(국장 유완근) 우정사회 봉사단원은 추석 명절을 맞아 지역 내 사회복지시설을 방문해 위문품을 전달하고, 어려운 독거노인에게 ‘사랑의 도시락’ 배달 봉사활동을 펼쳤다.  목포우체국 우정사회봉사단은 29일 소외이웃과 독거노인을 대상으로 ‘명절음식 도시락’을 50가구에 직접 배달했으며, 지난 22일에는 목포시 용해동에 위치한 목포아동원과 연동에 위치한 목포시노인복지관을 방문해 김, 멸치 등 200만 원 상당의 지역특산물을 전달했다.봉사 활동에 참가한 직원은 “직접 도시락 배달을 해 보니 우리 주변에 혼자 어렵게 생활하시는 분들이 많다는 걸 느꼈다”며 “추석 연휴가 다가오는 만큼 어르신들이 따뜻하고 건강하게 지내셨으면 좋겠다”고 말했다.유완근 목포우체국장은 “앞으로 우리 지역의 소외계층에 더 많은 관심을 가지고, 소년 ·소녀가장을 대상으로 집 고쳐주기 봉사활동 및 복지사각지대의 어려운 이웃에게 김장김치 배달 등 다양한 사회공헌활동을 추진해 지역 주민과 함께하는 따뜻한 우체국상 정립에 최선을 다하겠다”고 밝혔다. 문승용 기자 ▶ 양낙규의 [군사이야기]▶ #오늘의 특징주! ▶ #오늘의 많이 본 (클릭!)&lt;ⓒ세계를 보는 창 경제를 보는 눈, 아시아경제 무단전재 배포금지&gt; ]",[],http://www.100ssd.co.kr/news/articleView.html?idxno=40857,https://n.news.naver.com/mnews/article/277/0004087370?sid=102
2017.09.29.,불교공뉴스,,"괴산군, 추석명절 맞아 따뜻한 후원의 손길 잇달아",,,http://www.bzeronews.com/news/articleView.html?idxno=323180,http://www.100ssd.co.kr
2017.09.28.,디트뉴스24,,LG전자와 함께 하는 '추석 맞이 재능기부 및 식품키트 나눔',,,http://www.dtnews24.com/news/article.html?no=435822,http://www.bzeronews.com
2017.09.27.,중도일보,,어르신 한가위잔치 한마당,,,http://www.joongdo.co.kr/main/view.php?key=20170927010008930,http://www.dtnews24.com/
2017.09.27.,전자신문,,"중견련, 지역 소외계층에 '추석 맞이 온정' 나눠",,,http://www.etnews.com/20170927000357,http://www.joongdo.co.kr
2017.09.27.,세계일보,,"‘맛있는 제주만들기’ 식당 주인들, 추석명절 앞두고 소외이웃돕기 앞장",,,http://www.segye.com/content/html/2017/09/26/20170926004340.html?OutUrl=naver,http://www.etnews.com
2017-09-27 15:59:55,경북일보,경제,포항철강공단·기업·사회단체 ‘추석 상생’,"[     김현미 독거노인종합지원센터 부센터장(왼쪽)과 김규태 중견련 전무.한국중견기업연합회가 추석을 맞아 서울 마포 지역 내 홀로 사는 노인가정 100곳에 '사랑의 식료품 꾸러미'를 전달했다.중견련은 27일 '중견련과 함께 하는 추석 맞이 온정나눔 전달식'을 열고 보건복지부 산하 '독거노인종합지원센터'에 식료품을 전달했다. '꾸러미'에는 추석연휴 기간 동안 홀로 지낼 어르신들을 위해 잡곡, 김, 곰탕, 반찬류 등 손쉽게 조리할 수 있는 11종 식료품을 담았다.중견련은 2014년 법정단체 출범 이후 지역사회와의 상생을 위한 다양한 사회공헌활동을 적극적으로 펼쳐왔다.반원익 중견련 상근부회장은 “소박한 정성이지만 홀로 사는 어르신의 사회적 고립감과 소외감 완화에 조금이나마 도움이 되길 바란다”며 “앞으로도 사회적 약자와 소외계층을 위한 의미있는 사회공헌활동을 통해 지역사회에 온기를 더하는 데 앞장설 것”이라고 말했다.정영일기자 jung01@etnews.com▶ 전자신문 인기 포스트▶ 전자신문 공식 페이스북▶ 전자신문 바로가기 [Copyright ⓒ 전자신문 &amp; 전자신문인터넷, 무단전재 및 재배포 금지] ]",[],http://www.kyongbuk.co.kr/?mod=news&act=articleView&idxno=1005390,https://n.news.naver.com/mnews/article/030/0002644810?sid=101
2017.09.26.,경인일보,,"양평 서종면 행복돌봄단, 집수리 봉사",,,http://www.kyeongin.com/main/view.php?key=20170926010008261,http://www.segye.com
2017.09.26.,경인일보,,"양평 서종면 행복돌봄단, 집수리 봉사",,,http://www.kyeongin.com/main/view.php?key=20170926010008261,http://www.kyeongin.com
2017.09.26.,아시아경제,,"안유수 에이스경암 이사장, 1억원 상당 백미 기증",,,http://www.asiae.co.kr/news/view.htm?idxno=2017092613121384442,https://www.asiae.co.kr/
2017-09-26 13:15:25,매일경제,경제,"안유수 에이스침대 회장, 19년째 추석 맞아 소외계층에 쌀 기증","[     [아시아경제 김유리 기자] 안유수 에이스경암 이사장(에이스침대 회장)이 추석을 맞아 독거노인 및 소년소녀 가장들의 따뜻한 명절 위해 백미 10kg 5873포(약 1억원)를 경기도 성남시와 이천시에 전달했다고 26일 밝혔다.기증한 백미는 성남시 관내 총 4513세대와 이천시 1360세대 등 총 5873 세대 독거노인과 소년소녀 가장들에게 고루 전달될 예정이다.이재명 성남시장은 ""매년 명절 때마다 변함없이 지역사랑 나눔을 실천하고 있는 안유수 이사장과 재단에 깊은 감사의 마음을 전한다""며 ""뜻을 이어받아 복지 사각지대가 없도록 더욱 신경 쓰겠다""고 말했다.안 이사장은 ""경제가 발전했지만 기본적인 의식주를 걱정하는 사람들이 있다는 것은 같은 국민의 입장에서 안타까운 일""이라며 ""명절만큼이라도 따뜻한 시간을 보낼 수 있길 바라는 마음에서 백미를 기증하고 있다""고 전했다.19년간 설과 추석 명절에 백미를 기증해 온 안 이사장은 지난 24년간 불우노인들을 위한 무료급식소 및 경로당도 운영해오고 있다.소방관 처우 개선에도 관심을 갖고 소방관 치료비, 사기진작, 순직자녀 장학금 지원을 위해 2010년, 2014년, 2016년 각각 3억원을 기부했다. 최근 강릉 석란정 화재 때는 순직 소방관을 위해 성금 3억원을 전달하기도 했다. 김유리 기자 yr61@asiae.co.kr▶ 양낙규의 [군사이야기]▶ #오늘의 특징주! ▶ #오늘의 많이 본 (클릭!)&lt;ⓒ세계를 보는 창 경제를 보는 눈, 아시아경제 무단전재 배포금지&gt; ]",[],http://news.mk.co.kr/newsRead.php?year=2017&no=645466,https://n.news.naver.com/mnews/article/277/0004084124?sid=101
2017.09.26.,경인일보,,"[성남]에이스경암 재단, 시에 쌀 7천200만원 상당 기증",,,http://www.kyeongin.com/main/view.php?key=20170926010008533,http://www.mk.co.kr/
2017-09-26 14:01:37,금강일보,경제,"진천우체국, 추석명절 맞아 소외계층 나눔봉사 실시","[ 성남·이천 지역 독거노인, 소년소녀 가장 위해 1억원 상당 백미 제공    안유수 에이스침대 회장, 재단법인 에이스경암 이사장 안유수 에이스침대 회장이 추석을 맞아 19년째 소외계층을 위해 묵묵히 선행을 이어가고 있다. 에이스침대는 재단법인 에이스경암 이사장을 겸하고 있는 안유수 회장이 경기 성남시와 이천시의 독거노인과 소년소녀 가장을 위해 약 1억원 상당의 쌀을 기부했다고 26일 밝혔다. 안 회장이 기증한 쌀은 총 5873세대의 지역 소외계층에 전달될 예정이다. 지난 19년간 매년 설과 추석마다 쌀을 기부해 온 안 회장은 24년 동안 불우노인을 위한 무료급식소와 경로당을 운영해 오고 있는 것으로도 유명하다. 안 회장은 ""여전히 기본적인 의식주를 걱정하는 사람들이 주변에 있어 안타깝다""며 ""명절만큼이라도 따뜻한 시간을 보낼 수 있길 바라는 마음에서 백미를 기부하고 있다""고 전했다.이재명 성남시장은 ""매년 명절 때마다 지역사랑 나눔을 실천하는 안 회장과 재단에 감사의 마음을 전하며 복지 사각지대가 없도록 신경 쓰겠다""고 화답했다. 안 회장은 소방관의 처우 개선에도 지원에 앞장서고 있다. 2010년, 2014년, 지난해 각각 3억원을 소방관 치료비, 사기진작, 순직자녀 장학금 지원 등을 위해 기부했고 이달 초 강릉 석란정 화재로 순직한 소방관 2명의 유가족을 위해 성금 3억원을 전달하기도 했다.[안갑성 기자][매일경제 공식 페이스북] [오늘의 인기뉴스] [매경 프리미엄][ⓒ 매일경제 &amp; mk.co.kr, 무단전재 및 재배포 금지]   ]",[],http://www.ggilbo.com/news/articleView.html?idxno=408058,https://n.news.naver.com/mnews/article/009/0004021307?sid=101
28면 3단,한국일보,,“우리가 받았던 도움을 제주의 소외이웃에 돌려줘야죠”,,,http://www.hankookilbo.com/v/30f04ac7a55b419ab966a24919ebc8e6,http://www.kyeongin.com
2017.09.26.,뉴스핌,,빠르게 늙는 한국…홀로 사는 80세 이상 가구 어쩌나,,,http://www.newspim.com/news/view/20170926000114,http://www.ggilbo.com
2017.09.25.,쿠키뉴스,,"창성건설, 서대문서 '풍성한 한가위 드림 ' 봉사활동",,,http://www.kukinews.com/news/article.html?no=487546,http://www.hankookilbo.com/
