Date,Press,Category,Title,Content,Comment,URL_Origin,URL_Naver
2022.07.20.,뉴스워커,,"죽곡면 복지기동대, 어려운 이웃 위해 '집안 정리 봉사' 나서",,,http://www.newsworker.co.kr/news/articleView.html?idxno=166027,http://www.newsworker.co.kr
2022.07.24.,충청타임즈,,"한국타이어, 독거노인을 위한 폭염 극복 지원",,,http://www.cctimes.kr/news/articleView.html?idxno=713482,http://www.cctimes.kr
2022.07.25.,중부일보,,"인천 동구, 독거노인 가구 대청소 실시…""어르신들에게 건강한 환경 제공 노력...",,,http://www.joongboo.com/news/articleView.html?idxno=363551634,http://www.joongboo.com
2022.07.12.,뉴시스,,"[진천소식] 송기섭 진천군수, 어르신 배식 봉사 등",,,http://www.newsis.com/view/?id=NISX20220712_0001940416&cID=10806&pID=10800,http://www.newsis.com
2022-07-12 16:27:21,백세시대,사회,"대한노인회 서울 강동구지회, 노인사회활동지원사업 참여자 소양교육 개최","[     [진천=뉴시스] 강신욱 기자 = 송기섭(오른쪽) 충북 진천군수가 12일 생거진천종합사회복지관 내 경로식당에서 점심 배식 봉사를 하고 있다. (사진=진천군 제공) 2022.07.12. photo@newsis.com *재판매 및 DB 금지[진천=뉴시스] 강신욱 기자 = 송기섭 충북 진천군수는 12일 지역 어르신들에게 든든한 한끼를 제공하는 봉사활동에 나섰다.송 군수는 이날 생거진천종합사회복지관 내 경로식당을 찾아 배식봉사를 하며 어르신들의 안부를 살폈다.송 군수는 지난 1일 취임식에서 ‘모두가 행복한 으뜸도시 생거진천’을 민선 8기 진천군 비전으로 밝혔다.송 군수는 배식봉사 후 노인복지관 관계자들과 함께 식사하며 격려했다.◇진천군이장단연합회 한마음 체육대회충북 진천군이장단연합회(회장 유재윤)는 12일 진천읍 화랑관에서 한마음 체육대회를 열었다.이장의 사기 진작과 자긍심 고취를 위해 연합회 주관으로 열린 체육대회는 격년제로 열리지만, 그동안 코로나19로 4년 만에 펼쳐졌다.체육대회는 식전 공연행사를 시작으로 개회식, 체육대회, 노래자랑, 경품 추첨 등으로 진행됐다.◇진천상공회의소, 수출기업협의회 열어충북 진천상공회의소(회장 왕용래)는 12일 진천상의 대회의실에서 진천군수출기업협의회를 열었다.이날 회의에서는 진천군과 진천상의가 수출기업 경쟁력 강화 지원사업으로 추진하는 ‘2022 자카르타 국제 프리미엄 소비재전’ 설명과 충북도가 지원하는 무역사절단·전시회에 진천군 기업 참여 확대 방안을 논의했다.진천상의는 수출기업 경쟁력 강화를 도모하고자 이번 국제 프리미엄 소비재전 참가기업을 대상으로 부스 임차료, 바이어 상담, 홍보 브로셔와 영상 제작, 물류비 등을 지원할 계획이다.신청 기업 중 6곳을 선정해 500만원까지 지원한다. 진천상의는 관련 공고문을 홈페이지에 게재했다. ]",[],http://www.100ssd.co.kr/news/articleView.html?idxno=89493,https://n.news.naver.com/mnews/article/003/0011300196?sid=102
2022.07.14.,아시아경제,,광주은행 “건강한 여름 나세요” 초복 맞이 배식 봉사활동 펼쳐,,,https://view.asiae.co.kr/article/2022071411224552016,http://www.100ssd.co.kr
2022.07.26.,경남매일신문,,남해 삼동면 새마을지도자협의회， 밑반찬 나눔 봉사,,,http://www.gnmaeil.com/news/articleView.html?idxno=500683,https://www.asiae.co.kr/
2022-07-14 11:22:45,시민일보,생활/문화,"자생한방병원, 전국 각지서 릴레이 한방 의료 봉사","[     광주은행은 지난 13일, 광주 광산구 운남동에 위치한 광산구더불어락노인복지관에서 배식 봉사활동을 펼쳤다고 14일 밝혔다.무더위 속 장마가 연일 이어지는 가운데 광주은행은 초복을 앞두고 노인복지시설을 찾아 어르신들에게 전복삼계탕 200인분을 대접했다.이날 배식 봉사활동에는 송종욱 광주은행장을 비롯한 광주은행 임직원 및 대학생홍보대사 30여명이 함께했으며, 박병규 광주광역시 광산구청장과 이용빈 국회의원이 동참했다.삼계탕 배식 후에는 마스크와 기정떡 등 건강간식을 전달하며 어르신들의 건강한 여름나기를 응원했다.직접 배식 봉사활동에 나선 송종욱 광주은행장은 “무더위에 취약한 지역 어르신들이 건강한 여름을 보내시길 바라며 정성스럽게 준비한 이번 배식 봉사활동이 어르신들에게 큰 위로와 힘이 되길 바란다”며 “앞으로도 광주·전남 대표은행으로서 지역의 소외계층을 위한 봉사활동을 지속적으로 이어나가 나눔 봉사의 기업문화를 지역사회에 전파하겠다”고 말했다. ]",['쇼든아니든 이런 선행 응원해요'],https://www.siminilbo.co.kr/news/newsview.php?ncode=1160276944149156,https://n.news.naver.com/mnews/article/277/0005117718?sid=103
2022.07.27.,신아일보,,"경기도 광주시 우전께 주민협의체, ‘돌봄 꾸러미 배달’ 봉사 실시",,,http://www.shinailbo.co.kr/news/articleView.html?idxno=1580507,http://www.gnmaeil.com
2022.07.20.,프레시안,,"김동연 경기지사 ""봉사·기부는 중독성…주변까지 전염""",,,https://www.pressian.com/pages/articles/2022072011322409945?utm_source=naver&utm_medium=search,http://www.siminilbo.co.kr
2022.07.21.,전북도민일보,,진흥봉사단 산성천 둘레길 환경정화 봉사활동에 구슬땀,,,http://www.domin.co.kr/news/articleView.html?idxno=1389952,http://www.domin.co.kr
2022.07.26.,뉴스경남,,남해군 ‘상주 행복나눔터 봉사활동 DAY’ 가져,,,http://www.newsgn.com/332770,http://www.newsgn.com
2022.07.19.,뉴스핌,,"홈플러스,""지역 밀착형 릴레이 나눔 봉사활동""",,,http://www.newspim.com/news/view/20220719000164,http://www.newspim.com
2022.07.21.,충청매일,,안전바 설치 등 치매노인 가정환경 개선,,,http://www.ccdn.co.kr/news/articleView.html?idxno=771377,http://www.ccdn.co.kr
2022.07.26.,신아일보,,"춘천시나눔봉사단, 저소득층 어르신 위한 중복행사 지원",,,http://www.shinailbo.co.kr/news/articleView.html?idxno=1580171,http://www.shinailbo.co.kr/
2022.07.22.,이투데이,,"자생한방병원, 인천서 제주까지 릴레이 의료봉사로 나눔 실천",,,https://www.etoday.co.kr/news/view/2156337,http://www.etoday.co.kr
2022.07.19.,경남매일신문,,무학 좋은데이나눔재단， 도시락 나눔ㆍ봉사활동,,,http://www.gnmaeil.com/news/articleView.html?idxno=500227,http://www.gnmaeil.com
2022.07.19.,헤럴드경제,,"광명시, ‘100세 시대’ 노인복지 로드맵 발표",,,http://news.heraldcorp.com/view.php?ud=20220719000519,http://www.heraldbiz.com/
2022-07-19 12:14:01,뉴스1,정치,"코레일네트웍스, 성남시 중원노인종합복지관에 후원금 전달","[    [헤럴드경제(광명)=박정규 기자]초저출산과 초고령사회의 변화 속도가 매우 빠르게 진행되는 가운데 사회·인구 구조적 변화에 적극적인 대응 방안이 시급한 상황이다. 2022년 6월 기준 광명시 65세이상 노인인구는 4만3690명으로 전체 인구의 15%로 조사 됐다. 2026년도에는 노인인구가 20%를 넘는 초고령사회로 진입할 것으로 예상하고 있다.광명시(시장 박승원)는 이처럼 초고령사회가 도래하는 상황을 맞아 ‘100세 시대, 행복한 도시’로 도약하기 위해 어르신일자리, 건강, 여가 그리고 복지로 완성되는 짜임새 있는 노인종합대책을 펼치고 있어 주목을 받고 있다.■신노년층의 등장에 발맞춘 다양한 노인정책 마련=베이비붐세대가 노인인구에 진입하기 시작하면서 이른바 신노년층의 등장으로 활동적이고 주도적인 노년에 대한 관심이 증가하고 있다. 시는 이들의 질 높고 다양한 복지 욕구에 발맞춰 올해 처음으로 어르신 문화·체육 오락(Oh!樂)사업, 웰다잉 문화 조성 사업을 추진하고 있다.어르신 문화·체육 오락(Oh!樂)사업은 어르신들이 건강하고 활기찬 노후를 보낼 수 있도록 민간 문화·체육 시설을 활용해 다양하고 전문적인 여가 활동의 기회를 제공하는 데 목적이 있다. 소하노인종합복지관, 광명·철산·하안 종합사회복지관 등 권역별 복지관과 거점 수행기관과 협약을 맺어 민간 문화·체육 시설을 어르신에게 여가·문화의 장소로 제공하고 있다. 탁구, 볼링, 도예, 당구 등 기존의 복지관과 차별화된 프로그램으로 신노년층을 겨냥한 어르신 여가 복지의 새로운 모델로 자리매김하고 있다. 웰다잉(Well-Dying) 문화 조성은 스스로 결정하는 존엄한 삶의 마무리 문화가 중요해짐에 따라 추진되는 사업이다. 시는 웰다잉(Well-Dying) 문화 조성을 제도적·정책적으로 반영하고자 지난해 웰다잉(Well-Dying) 문화 정책제안 및 인식 개선방안 연구용역을 진행한 바 있으며, ‘광명시 웰다잉(Well-Dying) 문화 조성에 관한 조례’를 제정하는 한편, 어르신 인생노트 사업 추진, 소하·하안노인종합복지관 사전연명의료의향서 등록기관 지정 등 시민의 좋은 죽음에 대한 인식 개선을 위해 노력하고 있다. 이와 같은 신노년층의 다양한 복지 욕구에 대응하기 위해 시는 2020년 11월부터 ‘광명시 노인위원회’를 운영해 활발한 노인 정책 제안 활동을 펼치고 있다. 어르신 문화·체육 오락(Oh!樂)사업과 웰다잉 문화조성 사업 외에도 작년에 제안된 31건 중 치매 예방을 위한 VR기기 도입, 홀몸 어르신 AI 돌봄로봇 ‘광명이’지원 등 총 23건을 올해 어르신 정책에 반영하여 추진 중이다.    광명시청.■질 높은 어르신 일자리 확대로 활기찬 노년의 삶 기대=광명시는 작년 8월에 어르신 일자리 전문기관인 ‘광명시니어클럽’을 설치해 어르신 일자리를 확대하는 한편, 올해는 다양한 일자리 제공과 소득 창출로 어르신의 사회참여를 유도하고자 ‘2022년 노인 일자리 및 사업 활동 지원 사업’에 예산 87억 원을 투입했다. 현재 31개 사업단에 2,270명의 어르신이 참여 중이다. 공익·봉사 활동 등 광명시에 특화된 일자리를 창출하여 일할 기회를 마련함으로써 저소득층 노인 위주의 일자리 사각지대를 해소할 뿐만 아니라, 재활용 분리수거 계도 활동으로 지역 환경개선 및 기후에너지 활동에도 기여하고 있다.■어르신 돌봄 공백 해소 총력=시는 초고령사회 어르신들의 편안한 노후 생활을 위해 취약계층 어르신에 대한 지원도 강화한다. 노인 맞춤 돌봄서비스를 통해 생활지원사가 어르신들의 사회참여, 생활 교육, 안전 등 일상생활 지원과 건강 증진, 사회관계 형성을 위한 각종 프로그램을 무료로 제공한다. 현재 1,130명의 어르신이 98명의 생활지원사에게 서비스를 받고 있다. 또한 AI 돌봄로봇 ‘광명이’를 어르신 50명에게 제공하고, 노인위원회 위원·동 유관단체 위원들과 1:1 매칭을 통해 인공지능 인형의 활용을 돕고 어르신과 위원들 간의 인적 교류를 이어가고 있다. 여름철 폭염에 대비해 사회적 취약계층인 독거노인들의 안전을 확인하고자 생활지원사가 노인 맞춤 돌봄서비스 대상자 어르신 1130명의 안부 확인을 적극 시행하고 있다. 또한, 언제든 방문하여 더위를 식힐 수 있게 동 행정복지센터, 경로당, 노인 맞춤 돌봄서비스 수행기관 2개소 및 도서관 등 149개의 무더위쉼터를 운영하고 있다.■어르신들의 일상 회복을 위해 쾌적한 경로당 환경 조성 및 신규 개소=시는 코로나19로 힘든 시기를 보내신 어르신들의 일상 회복을 돕기 위해 경로당의 노후된 물품 교체와 시설 개보수 사업을 지원해 활성화를 도모하고 있다. 상반기에 28개소의 노후 물품 교체와 37개소의 시설 개보수에 총 1억2천만 원을 투입했다. 하반기에도 사업을 지속 추진하여 어르신들이 쾌적하고 안전하게 경로당을 이용할 수 있도록 적극 지원할 방침이다. 오는 10월에는 철산3동 7통에 신규 경로당 개소를 준비하고 있다. 현재 신축 건물 일부를 임차하여 면적 297㎡인 규모를 리모델링 중에 있으며, 일부는 시니어클럽의 공동작업장으로 조성하고, 나머지는 경로당을 설치하여 그동안 경로당의 부재로 불편했던 지역 어르신들의 여가 공간을 마련할 예정이다.■어르신 복지 증진을 위한 다양한 노력=광명시는 4차 산업혁명 시대의 도래 등 사회 패러다임 변화에 발맞춰 어르신들의 디지털 적응 및 치매 예방을 위해 복지관에 VR 치매 체험존을 설치한다. VR은 가상현실 공간에서 장비를 조작해 게임을 하는 방식으로 기억력과 집중력 개선에 효과적이다. 또한, 신체 기능 강화 프로그램을 통해 체성분 분석에 의한 맞춤형 운동법을 처방하고 자세나 방법을 코칭해줘 균형감각 향상과 근력 강화에 도움을 준다. 어르신과 등록장애인을 위해 작년부터 시행된 전동보장구 보험가입 지원 사업은 올해 광명시에 주민등록을 둔 만 65세 이상 어르신과 등록장애인이라면 누구나 자동 가입되어 더욱 폭넓은 복지혜택을 제공할 예정이다. 시민들에게 빠르고 안정적인 장사 서비스를 제공하기 위해 6개 지자체가 공동 건립한 화성 함백산 추모공원이 작년 7월에 개원되어 광명에서 30여 분 정도의 근거리에서 화장에서 봉안까지 원스톱 장례서비스를 이용할 수 있게 되었다. 시는 이 외에도 선진 장례문화 선도를 위해 민선8기 공약 사항으로 제시한 어르신 무료 상조 서비스를 추진할 예정이다.■민선8기 광명시 어르신 복지를 위한 미래 청사진=민선8기 광명시는 ‘요람에서 무덤까지’ 돌봄 도시를 구축하기 위해 온종일 돌봄 체계를 확대한다. 기존 노인 맞춤 돌봄서비스, 응급 안전 안심 서비스, 노인 장기요양보험 서비스 및 AI 로봇 활용 노인돌봄 서비스를 강화하고 장기 요양기관 종사자의 서비스 질 향상을 도모하며, 비대면 돌봄서비스 강화를 위해 터치케어 서비스를 신규로 운영할 계획이다. 또한, 노인복지 공공서비스의 질을 높이기 위해 소하동 1344 일대에 지하 1층~지상 5층의 연면적 4380㎡ 규모로 노인 건강케어센터를 건립한다. 노인회지회, 건강생활지원센터, 광명시 고혈압당뇨센터, 치매안심센터, 아동보호 전문기관, 유림회사무실, 체력 단련장, 다목적 강당 등이 들어서 노인의 사회참여 활동에 필요한 공공장소를 제공할 예정이다.박승원 광명시장은 박승원 광명시장은 “100세 시대에 맞춤형 복지로 어르신을 섬기고 돌보겠다”며, “광명시에 거주하시는 어르신들께 더 많은 복지혜택이 돌아갈 수 있도록 노력하겠다”고 말했다. ]",[],https://www.news1.kr/articles/?4746823,https://n.news.naver.com/mnews/article/016/0002017650?sid=100
2022.07.14.,로이슈,,"광주은행, 초복 맞이 배식 봉사활동 펼쳐",,,http://www.lawissue.co.kr/view.php?ud=202207141317437195204ead0791_12,http://news1.kr/
2022.07.22.,헤럴드경제,,노인일자리 근무 중 사망…법원 “업무상 재해 아냐”,,,http://news.heraldcorp.com/view.php?ud=20220722000068,http://www.heraldbiz.com/
2022-07-22 08:43:02,광주드림,사회,"공무원연금공단-상록자원봉사단, 혹서기 대비 예방활동","[ 공공형 노인일자리 근무 중 익사불참, 지각에도 제재 가하지 않아 법원, “근로종속관계 없다” 결론    법원[연합][헤럴드경제=유동현 기자] 공공형 노인일자리 사업 참여자는 근로자가 아니므로 산업재해를 인정할 수 없다는 판결이 나왔다.대구지법 행정 단독 신헌석 부장판사는 공공형 일자리 사업에 근무하다 숨진 A씨 유족이 근로복지공단을 상대로 낸 유족급여 및 장의비 부지급 처분 취소 소송에서 원고 패소 판결했다고 22일 밝혔다.신 부장판사는 A씨가 근로자가 아니기 때문에 업무상 재해가 아니라고 판단했다. 근로기준법상 근로자는 임금을 목적으로 종속 관계가 형성돼야 하는데, 공공형 노인일자리는 저소득 계층의 사회활동을 돕고 활기찬 노후를 위한 봉사활동 성격이라고 봤다. 불참, 지각, 태만 등 사유가 있더라도 실제 제재를 가한 것이 아니고, 활동일지를 작성하고 수시 현장을 방문하지만 통제 목적은 아니라고 봤다. 오히려 교통비, 간식비 등 추가적 활동비를 지급하기 위한 자료 성격이 짙다고 설명했다. 신 부장판사는 “종속관계에서 임금을 목적으로 근로를 제공하는 근로자에 해당한다고 보기 어렵고, 달리 이를 인정할 증거가 없다”고 말했다.A씨는 대안노인회 성주군지회가 위탁수행하는 정부 공공형 일자리 사업에 근무하다 지난해 5월 사망했다. 경북 성주의 한 하천에서 쓰레기 수거작업을 하다 물에 빠 뒤 응급호송 됐으나 익사했다. A씨는 1월부터 12월 말일까지 근린시설관리 참여자로 선발된 상태였다. 유족들은 A씨가 업무상 재해에 해당된다며 유족급여 및 장의비를 신청했다. A씨가 업무계약을 맺었고, 업무규칙이나 복무규정 등을 준수하지 않을 시 제재를 내리는 점 등을 근거로 들었다. 그러나 근로복지공단이 지급을 거부하자 소송을 냈다. ]",[],http://www.gjdream.com/news/articleView.html?idxno=616510,https://n.news.naver.com/mnews/article/016/0002019104?sid=102
2022.07.21.,후생신보,,"자생한방병원, 전국 의료봉사 재개",,,http://www.whosaeng.com/137653,http://www.gjdream.com
2022.07.29.,매일안전신문,,"신협사회공헌재단, 장수군 지역민 위한 무료 한방의료봉사 진행",,,https://idsn.co.kr/news/view/1065579735441830,http://www.whosaeng.com
2022.07.20.,부산일보,,"부산경상대 반려동물보건/산업과, 반려동물 전문봉사단 돌봄 프로그램 진행",,,http://www.busan.com/view/busan/view.php?code=2022072014593596118,http://peoplesafe.kr
2022.07.26.,경북신문,,"임영웅 팬과 함께하는 위시 카페, 적십자사와 사랑의 빵나눔 봉사활동",,,http://www.kbsm.net/news/view.php?idx=358118,http://www.busan.com/
2022-07-20 15:00:01,뉴스1,사회,대구 중구노인복지관 '초복 건강데이',[     부산경상대학교 반려동물보건/산업과(학과장 김병석)가 부산시 거주 성인 14명을 대상으로 최근 BSKS 반려동물교육문화센터에서 반려동물 돌봄 프로그램을 진행했다.이는 부산 동래구의 요청으로 반려동물과 생활하는 부산시 동래구 노인을 위한 반려동물 케어 봉사자를 위한 반려동물 돌봄 교육을 진행한 것이다.프로그램은 총 4주에 걸쳐 △반려견과 반려묘의 일반적 생리 및 특성 △반려견 위생관리 방법 및 산책 시 지켜야 할 펫티켓 △실내에서의 반려견 훈련법 △실외에서의 반려견 훈련법 등을 교육했다.봉사자들은 향후 반려동물 돌봄을 어려워하는 하는 노인들을 위해 찾아다니며 반려동물 관리 방법을 알려주는 등 봉사를 진행할 예정이다. ],[],https://www.news1.kr/photos/view/?5476799,https://n.news.naver.com/mnews/article/082/0001165825?sid=102
2022.07.18.,연합뉴스,,"[경남소식] 자원봉사센터-공동모금회, 취약계층 여름나기 물품 지원",,,https://www.yna.co.kr/view/AKR20220718113900052?input=1195m,http://www.kbsm.net
2022.07.13.,뉴시스,,"김홍규 강릉시장, 변치 않는 봉사정신",,,http://www.newsis.com/view/?id=NISI20220713_0001041230,http://news1.kr/
2022-07-14 13:22:21,충청일보,사회,"음성군새마을회, 홍복양로원에서 봉사활동 전개","[     (대구=뉴스1) 공정식 기자 = 초복을 이틀 앞둔 14일 오전 대구 중구노인복지관에서 열린 '초복 건강데이' 행사에서 어르신들이 복달임으로 제공된 삼계탕을 맛보고 있다.500인분의 삼계탕과 수박이 마련된 이날 초복맞이 행사에는 대구시 중구청공무원봉사단, 중구노인복지관 자치운영위원회, 중구자원봉사대학7기봉사단 등 자원봉사자들이 배식 봉사에 참여했다. 2022.7.14/뉴스1   ]",[],https://www.ccdailynews.com/news/articleView.html?idxno=2142626,https://n.news.naver.com/mnews/article/421/0006217591?sid=102
2022.07.13.,뉴시스,,"김홍규 강릉시장, 변치 않는 봉사정신",,,http://www.newsis.com/view/?id=NISI20220713_0001041230,http://www.newsis.com
2022-07-13 20:54:23,충청일보,사회,"음성군새마을회, 홍복양로원에서 봉사활동 전개",[     [강릉=뉴시스] 김경목 기자 = 김홍규 강릉시장이 13일 강원 강릉시 연곡면 북부노인종합복지관에서 배식 봉사를 하고 있다. 김 시장은 당선 전까지 강릉시자원봉사센터 이사장으로 센터를 이끌며 지역사회 봉사활동에 앞장서 왔다. (사진=강릉시청 제공) 2022.07.13. photo@newsis.com *재판매 및 DB 금지[사진 영상 제보받습니다] 공감언론 뉴시스가 독자 여러분의 소중한 제보를 기다립니다. 뉴스 가치나 화제성이 있다고 판단되는 사진 또는 영상을 뉴시스 사진영상부(n-photo@newsis.com)로 보내주시면 적극 반영하겠습니다. ],"['조폭 폴더 인사 좋아하시는 시장 ㅋㅋ\n지방은 저래서 망하는거야.', '']",https://www.ccdailynews.com/news/articleView.html?idxno=2142626,https://n.news.naver.com/mnews/article/003/0011303265?sid=102
2022.07.21.,아시아경제,,"자생한방병원, 인천에서 제주까지 릴레이 의료봉사…근골격계 고령환자 300명...",,,https://view.asiae.co.kr/article/2022072109210562891,http://ccdailynews.com
2022.07.25.,경남도민일보,,기도 막힌 노인 구한 부부 소방관,,,http://www.idomin.com/news/articleView.html?idxno=800087,https://www.asiae.co.kr/
2022-07-21 09:21:05,브레이크뉴스,사회,"양평군 지평면지역사회보장협의체, 7월 월례회의 및 청소년 간식 봉사","[     분당자생한방병원 의료진이 고령 근골격계 환자에게 침 치료를 실시하고 있다.자생한방병원은 13~20일 일주일간 전국 각지에서 한방 의료봉사를 진행했다고 21일 밝혔다.강남·부천·분당·잠실자생한방병원이 참여한 이번 봉사활동에는 총 40여명의 의료진과 임직원이 300명이 넘는 고령 근골격계 질환자들의 건강을 돌봤다.지난 13일 부천자생한방병원의 인천 계양구 노인복지관 방문을 시작으로 20일에는 강남자생한방병원과 잠실자생한방병원, 부천자생한방병원이 함께 제주 서귀포시 표선농협을 찾았다. 같은 날 분당자생한방병원은 경기 성남시 분당구 한솔종합사회복지관에서 고령 주민과 독거노인들의 건강을 챙겼다.각 지역 자생한방병원 의료진들은 환자의 증상에 따른 맞춤형 건강 상담과 함께 침 치료를 실시했다. 또 환자 스스로 여름철 척추·관절 건강을 돌볼 수 있도록 한약, 한방 파스를 처방했다.박병모 자생의료재단 이사장은 “습하고 저기압이 이어지는 요즘은 척추·관절 건강관리가 어려운 시기인 만큼 전국 자생한방병원이 직접 고령 근골격계 질환자들을 찾아 최대한 많은 분들이 치료받을 수 있게끔 노력하겠다”며 “자생한방병원은 코로나19, 물가상승 등 모두가 어려운 상황일수록 국민들의 곁에서 힘든 일들을 함께 극복해 나가는 의료기관이 될 것”이라고 말했다. ]",[],http://www.breaknews.com/910996,https://n.news.naver.com/mnews/article/277/0005121008?sid=102
2022.07.26.,뉴스경남,,남해 창선면지사협 주거환경 개선 봉사,,,http://www.newsgn.com/332709,http://www.idomin.com
2022.07.11.,뉴스1,,독거노인 반려식물로 거듭나는 '정관가 축하 화분',,,https://www.news1.kr/articles/?4738634,http://www.breaknews.com
2022.07.20.,머니투데이,,"서울사이버대, 플로깅 환경정리 봉사활동 펼쳐",,,http://news.mt.co.kr/mtview.php?no=2022072018207415653,http://www.newsgn.com
2022.07.27.,브레이크뉴스,,"남양주풍양보건소, 지역사회 봉사단과 함께 치매안심마을 환경정화 나서",,,http://www.breaknews.com/911896,http://news1.kr/
