Date,Press,Category,Title,Content,Comment,URL_Origin,URL_Naver
2022-07-27 09:02:04,브릿지경제,생활/문화,"광주은행, 목포 어르신들 대상 ""삼계탕 배식봉사""","[ 삼계탕, 건강음료 등 ‘보양식 키트’ 전달[헤럴드경제=함영훈 기자] 공기업인 그랜드코리아레저(GKL)는 26일 중복(中伏)을 맞아 서울시 강남구 수서동 관내의 독거어르신 100여 가구를 대상으로 삼계탕 나눔 봉사활동을 가졌다고 27일 밝혔다.GKL 임직원으로 구성된 ‘GKL 꿈·희망 봉사단’은 삼계탕, 건강음료 등으로 꾸린 ‘복 맞이 보양식 키트’를 거동이 불편한 독거어르신 가정에 직접 전달했다.    독거노인들을 찾아 여름 보양식 키트를 전달하고 있는 랜드코리아레저(GKL) 직원들특히, 이번 봉사에는 수서종합사회복지관 다함께키움센터 아동봉사단(GKL 방과 후 활동 교육 지원 어린이)도 함께해 어르신의 안부를 확인하고 생활 불편 사항 등을 청취했다.앞서 지난 22일에는, GKL 부산사업본부에서 초복을 맞아 부산진구종합사회복지관을 이용하는 어르신들께 삼계탕 170인분을 제공했다. GKL 식·음료 담당 직원들의 재능기부로 삼계탕을 직접 조리해 어르신들께 대접하기도 했다.GKL 김영산 사장은 “전년보다 무더운 날씨와 긴 장마로 지친 어르신들께 작으나마 위로를 드리고, 건강하게 여름을 나도록 마련했다.”며, ”앞으로도 GKL은 공기업으로서 소외된 이웃을 보듬고 사회적 가치를 실현하기 위해 최선을 다하겠다.”고 말했다. ]",[],https://www.viva100.com/main/view.php?key=20220727010006808,https://n.news.naver.com/mnews/article/016/0002020926?sid=103
2022.07.27.,스타뉴스,,임영웅 팬들 '사랑의 빵나눔' 봉사 활동..선한 영향력 실천,,,http://star.mt.co.kr/stview.php?no=2022072605273319659,http://www.viva100.com
2022.07.27.,동양일보,,청주 수암·중앙로타리 점심봉사,,,http://www.dynews.co.kr/news/articleView.html?idxno=667447,http://star.moneytoday.co.kr
2022-07-27 06:00:00,대경일보,,"봉화로타리, 물야면 노인쉼터서 봉사활동",[],[],http://www.dkilbo.com/news/articleView.html?idxno=371681,https://n.news.naver.com/mnews/article/108/0003074262?sid=106
2022.07.26.,의학신문,,"서울대병원, 폭염 속 취약계층 구급함 나눔 · 배식봉사",,,http://www.bosa.co.kr/news/articleView.html?idxno=2178033,http://www.dynews.co.kr
2022.07.27.,EBN,,"KT, 종로구 어르신에 여름 보양식 나눔 봉사",,,https://www.ebn.co.kr/news/view/1540181/?sc=Naver,http://www.dkilbo.com
2022.07.31.,백세시대,,"대한노인회 대구 달성군지회, 윤영현 지회장 사비로 '노인회 배지 달아주기'",,,http://www.100ssd.co.kr/news/articleView.html?idxno=89684,http://www.bosa.co.kr
2022.07.27.,뉴스1,,봉사활동 나선 KT직원들,,,https://www.news1.kr/photos/view/?5498739,http://www.ebn.co.kr
2022.07.27.,브릿지경제,,"에어부산 임직원, 지역 복지관 찾아 나눔 봉사활동 진행",,,https://www.viva100.com/main/view.php?key=20220727010006727,http://www.100ssd.co.kr
2022.07.27.,브릿지경제,,"에어부산 임직원, 지역 복지관 찾아 나눔 봉사활동 진행",,,https://www.viva100.com/main/view.php?key=20220727010006727,http://www.viva100.com
2022.07.27.,무등일보,,"광주은행, 중복 맞아 전복삼계탕 봉사활동",,,http://www.mdilbo.com/detail/7gJo8W/674888,http://www.mdilbo.com
2022.07.25.,국제뉴스,,"대구시 달서구노인종합복지관, '달서 선배시민 봉사단' 발대식 개최",,,https://www.gukjenews.com/news/articleView.html?idxno=2515315,http://www.gukjenews.com/
2022.07.26.,세정신문,,"국세동우회 자원봉사단, 독거노인 100명에 삼계탕 밀키트 전달",,,http://www.taxtimes.co.kr/news/article.html?no=255740,http://www.taxtimes.co.kr/
2022.07.27.,충청일보,,"음성 생극면적십자봉사회, 홀몸노인 집수리 봉사 실시",,,https://www.ccdailynews.com/news/articleView.html?idxno=2144977,http://ccdailynews.com
2022.07.30.,BTN불교TV,,"BTN광주불교순례단, 쌀 나눔·어르신 급식봉사",,,http://www.btnnews.tv/news/articleView.html?idxno=72520,http://btnnews.tv
15면 1단,국민일보,,"[포토] KT, 복지관 어르신에 여름 보양식 배식 봉사",,,https://news.kmib.co.kr/article/view.asp?arcid=0924256992&code=11151700&cp=nv,http://www.kmib.co.kr/
2022-07-27 21:41:02,연합뉴스,경제,'계단을 오르지 못하는 노인들을 위해',"[     KT 임직원들로 구성된 사랑의 봉사단이 27일 서울 종로노인종합복지관에서 여름 보양식을 배식하고 있다. 전복삼계탕, 계절과일 화채 등을 제공했다.서영희 기자   ]",[],https://www.yna.co.kr/view/PYH20220726108900013?input=1196m,https://n.news.naver.com/mnews/article/005/0001542720?sid=101
2022.07.27.,더팩트,,임영웅 팬클럽 꾸준한 기부 및 봉사활동 '선한 영향력' 전파,,,http://news.tf.co.kr/read/entertain/1954462.htm,https://www.yna.co.kr/
2022-07-26 13:03:11,헤럴드경제,사회,"삼육대 사회복지학과 학생들, 독거노인에 ‘사랑의 죽’ 나눔",[         (서울=연합뉴스) 김주성 기자 = 중복(中伏)인 26일 서울 종로구 탑골공원 원각사 노인 무료급식소에서 한 자원봉사자가 거동이 불편해 계단을 오르지 못하는 노인들에게 삼계탕을 직접 가져다주고 있다. 2022.7.26    utzza@yna.co.kr ],[],http://news.heraldcorp.com/view.php?ud=20220728000722,https://n.news.naver.com/mnews/article/001/0013334754?sid=102
2022.07.26.,연합뉴스,,'계단을 오르지 못하는 노인들을 위해',,,https://www.yna.co.kr/view/PYH20220726109100013?input=1196m,https://www.yna.co.kr/
2022-07-26 13:03:12,CNB뉴스,사회,"광주은행, 중복 맞아 삼계탕 배식 봉사활동 펼쳐",[         (서울=연합뉴스) 김주성 기자 = 중복(中伏)인 26일 서울 종로구 탑골공원 원각사 노인 무료급식소에서 한 자원봉사자가 거동이 불편해 계단을 오르지 못하는 노인들에게 삼계탕을 직접 가져다주고 있다. 2022.7.26    utzza@yna.co.kr ],[],https://www.cnbnews.com/news/article.html?no=557444,https://n.news.naver.com/mnews/article/001/0013334756?sid=102
2022.07.27.,더팩트,,임영웅 팬클럽 꾸준한 기부 및 봉사활동 '선한 영향력' 전파,,,http://news.tf.co.kr/read/entertain/1954462.htm,http://www.cnbnews.com
2022.07.28.,헤럴드경제,,"삼육대 사회복지학과 학생들, 독거노인에 ‘사랑의 죽’ 나눔",,,http://news.heraldcorp.com/view.php?ud=20220728000722,http://www.tf.co.kr/
2022-07-27 09:19:00,부산일보,,"김해시, 6월 우수봉사왕에 오세웅씨 선정…안전캠페인, 축제행사 등 다양한 활...",[],[],http://www.busan.com/view/busan/view.php?code=2022072910480670697,https://n.news.naver.com/mnews/article/629/0000163235?sid=106
2022.07.27.,이데일리,,[포토] 배식 봉사,,,http://www.edaily.co.kr/news/newspath.asp?newsid=02551846632398784,http://www.heraldbiz.com/
2022-07-28 16:51:02,뉴스토마토,사회,"에어부산 임직원, 배식 지원 등 나눔 봉사활동","[ 삼육대 사회복지학과 학생들 선행모금액으로 어르신 500명분 ‘죽 나눔’“20년째 진행중, 배움 실천하는 일”    삼육대 사회복지학과 학생들이 서울 노원구의 한 독거노인을 방문해 ‘죽 나눔’을 하고 있는 모습 [삼육대 제공][헤럴드경제=김희량 기자] 삼육대 사회복지학과 학생들이 수업에서 배운 공동모금을 몸소 실천하고 지역 사회 독거노인 100명에게 ‘사랑의 죽’을 전달했다.28일 헤럴드경제 취재에 따르면 최근 삼육대 사회복지학과 학생들은 공동모금액을 어르신돌봄지원센터에 전달하고 지역 사회 어르신 100명에게 죽을 배달했다.해당 활동은 사회복지학과 전공의 지역사회복지론 수업의 일환이다. 지역사회복지론 수업에서는 지역사회복지의 이론과 실무 학습은 물론 공동모금의 개념, 마케팅 전략, 후원자 개발 등도 함께 배운다.학생들은 지난 한 학기 동안 사회복지학과의 전공과목인 지역사회복지론을 수강하며 공동모금을 직접 기획하고 실천했다. 특히 삼육대가 있는 서울 노원구 지역 어르신을 돕기 위한 가두모금, 온라인 모금, 캠페인 모금을 통해 약 231만원의 후원금을 모았다.학생들은 지난달 말 모금액 전부를 노원구 어르신돌봄지원센터에 기부했다. 이 모금액을 이용해 치아가 없어 식사를 잘하지 못하는 독거노인을 위한 ‘사랑의 죽’ 100인분을 1차로 전달했다. 앞으로도 매달 정기 봉사를 통해 400명의 어르신에게 추가로 죽을 전달할 계획이다.    삼육대 사회복지학과 학생들이 서울 노원구의 독거노인을 방문해 죽을 나누는 모습. [삼육대 제공]죽 나눔 봉사에 참여하는 박제이 학생(사회복지학과 3학년)은 “홀로 지내시는 어르신들에게 작은 선물과 기쁨을 전달할 수 있어 사회복지학 전공 학생으로서 보람이 크다”며 “ 배운 내용을 직접 실천하기에 의미가 깊다”고 말했다.해당 수업을 지도하는 정종화 교수는 “지역사회복지론을 이론으로만 배우는 것이 아니라 지역사회자원 연계와 확보를 위해 20년째 해 온 봉사활동”이라며 “앞으로 전공 학생뿐만 아니라, 타 학과 학생들까지 참여하는 활동으로 확대할 계획”이라고 말했다. ]",['20년째하기 쉽지 않은데 대단합니다. 사회에 나와서도 따뜻한마음 변치않았으면 싶네요 ^^'],http://www.newstomato.com/ReadNews.aspx?no=1137320&inflow=N,https://n.news.naver.com/mnews/article/016/0002021865?sid=102
2022.07.24.,아시아경제,,"광주신세계, 노인복지관서 '배식봉사활동' 전개",,,https://view.asiae.co.kr/article/2022072416431888602,http://www.busan.com/
2022-07-29 11:07:02,메디소비자뉴스,사회,"서울대병원, 원각사 노인무료급식소 등에 구급함 전달","[    김해시(시장 홍태용)는 6월의 우수 자원봉사왕으로 오세웅 자원봉사자(23회, 74시간)를 선정했다고 29일 밝혔다.김해시는 매달 1365자원봉사포털 기준 전년도 200시간 이상 봉사한 자원봉사자 중 한 달간 활동 시간이 가장 많은 시민을 우수 자원봉사왕으로 선정해시상하고 있다.오씨는 6월동안 가장 많은 시간을 자원봉사에 힘썼는데, 김해시동부노인복지관 급식봉사와 신어산 등 거주지인 삼안동 환경정화활동에 적극 참여해 어르신과 주민들이 건강하고 쾌적한 삶을 살아가는데 기여하고 있으며 안전캠페인과 화재점검, 기후위기대응 챌린지 참여, 축제행사 지원 등 다양한 활동에 참여하고 있다.그는 “저보다 훨씬 오랜 기간 봉사하고 헌신하신 분들도 많은데 상을 받게 되어 몸 둘 바를 모르겠다”며 “앞으로 더 열심히 봉사하라는 뜻으로 여기고 이 상이 부끄럽지 않도록 최선을 다 하겠다”고 밝혔다.임주택 시민복지국장은 “김해시가 꿈꾸는 따뜻한 행복도시는 지역과 이웃 사랑을 실천하는 자원봉사자분들이 계시기에 가능하다고 생각한다”며 “6월 우수 봉사왕뿐 아니라 모든 자원봉사자분들께 감사와 존경을 보내며 자원봉사자가 행복한 도시가 되도록 적극 지원하겠다”고 말했다. ]",[],http://www.medisobizanews.com/news/articleView.html?idxno=89281,https://n.news.naver.com/mnews/article/082/0001167319?sid=102
2022.07.28.,경상매일신문,,포항 오천읍 자원봉사거점센터 이ㆍ미용 봉사,,,http://www.ksmnews.co.kr/default/index_view_page.php?idx=388570&part_idx=266,http://www.edaily.co.kr/
2022.07.27.,뉴스워커,,"광주은행, 중복 맞아 삼계탕 배식 봉사활동 펼쳐",,,http://www.newsworker.co.kr/news/articleView.html?idxno=167117,http://www.newsworker.co.kr
2022.07.26.,메디소비자뉴스,,"서울대병원, 원각사 노인무료급식소 등에 구급함 전달",,,http://www.medisobizanews.com/news/articleView.html?idxno=89281,http://www.medisobizanews.com
2022.07.28.,경상매일신문,,포항 오천읍 자원봉사거점센터 이ㆍ미용 봉사,,,http://www.ksmnews.co.kr/default/index_view_page.php?idx=388570&part_idx=266,http://www.ksmnews.co.kr
2022.07.27.,뉴스1,,배식 봉사활동 나선 최재형 의원,,,https://www.news1.kr/photos/view/?5498738,http://news1.kr/
2022-07-27 13:23:14,여성조선,사회,"""임영웅, 빵 안 먹어도 배부르겠네""…위시카페, '사랑의 빵나눔' 봉사",[     (서울=뉴스1) 이광호 기자 = 최재형 국민의힘 의원이 27일 서울 종로구 종로노인종합복지관에서 열린 KT삼계탕 나눔 행사에서 어르신들에게 여름 보양식을 배식하고 있다.이날 KT는 연이은 비와 폭염에 지친 종로구 거주 어르신 300명을 초청해 전복삼계탕 등 보양식을 제공했다. (공동취재) 2022.7.27/뉴스1   ],[],http://woman.chosun.com/news/articleView.html?idxno=100984,https://n.news.naver.com/mnews/article/421/0006243682?sid=102
2022.07.18.,연합뉴스,,"[게시판] BBQ 대학생 봉사단, 서울 성동구 취약계층 가구에 삼계탕 전달",,,https://www.yna.co.kr/view/AKR20220718063000003?input=1195m,http://woman.chosun.com
2022.07.26.,연합뉴스,,거동 불편한 노인들에게 대접하는 중복 삼계탕,,,https://www.yna.co.kr/view/PYH20220726108700013?input=1196m,https://www.yna.co.kr/
2022-07-18 10:47:13,충북일보,생활/문화,"이화여대 배꽃나눔실천단, 봉사활동","[     제너시스BBQ 그룹 대학생 봉사단, 서울 성동구 취약계층 가구에 삼계탕 전달[제너시스BBQ 그룹 제공. 재판매 및 DB 금지]    ▲ 제너시스BBQ 그룹은 자사 대학생 봉사단 올리버스가 지난 16일 초복을 맞아 서울 성동구 내 취약계층 가구에 삼계탕 100인분을 전달했다고 18일 밝혔다. 봉사단은 홀몸 노인 가정과 기초생활 수급 가정 등 50가구를 방문해 물품을 전달했다. (서울=연합뉴스) ]",[],https://www.inews365.com/news/article.html?no=725010,https://n.news.naver.com/mnews/article/001/0013317635?sid=103
2022.07.29.,경남신문,,"함안군새마을부녀회, 법수면서 이미용·수지침 봉사",,,http://www.knnews.co.kr/news/articleView.php?idxno=1382292,https://www.yna.co.kr/
2022-07-26 13:03:10,경남도민신문,사회,합천군노인회 노인자원봉사클럽 경로당 사랑의 봉사활동,[         (서울=연합뉴스) 김주성 기자 = 중복(中伏)인 26일 서울 종로구 탑골공원 원각사 노인 무료급식소에서 한 자원봉사자가 거동이 불편해 계단을 오르지 못하는 노인들에게 삼계탕을 직접 가져다주고 있다. 2022.7.26    utzza@yna.co.kr ],[],http://www.gndomin.com/news/articleView.html?idxno=322272,https://n.news.naver.com/mnews/article/001/0013334752?sid=102
2022.07.26.,연합뉴스,,거동 불편한 노인들에게 대접하는 중복 삼계탕,,,https://www.yna.co.kr/view/PYH20220726108700013?input=1196m,https://www.yna.co.kr/
2022-07-26 13:03:10,디지털타임스,사회,"임영웅 팬들, 못말리는 이웃사랑…릴레이 봉사활동, 왜?",[         (서울=연합뉴스) 김주성 기자 = 중복(中伏)인 26일 서울 종로구 탑골공원 원각사 노인 무료급식소에서 한 자원봉사자가 거동이 불편해 계단을 오르지 못하는 노인들에게 삼계탕을 직접 가져다주고 있다. 2022.7.26    utzza@yna.co.kr ],[],http://www.dt.co.kr/contents.html?article_no=2022072702109919036005&ref=naver,https://n.news.naver.com/mnews/article/001/0013334752?sid=102
2022.07.27.,충북일보,,"이화여대 배꽃나눔실천단, 봉사활동",,,https://www.inews365.com/news/article.html?no=725010,http://www.dt.co.kr/
