Date,Press,Category,Title,Content,Comment,URL_Origin,URL_Naver
2023-09-16 08:16:01,의약뉴스,생활/문화,모더나 업데이트 코로나19 백신 '스바이크박스 엑스' 긴급사용승인 外,"[ 맨발 걷기의 건강 효과와 주의할 점    맨발 걷기 열풍에 맨발로 걸으며 운동을 하는 이들을 지칭하는 ‘어싱족'이라는 신조어까지 생겨났다. [사진= 게티이미지뱅크]맨발로 땅의 기운을 느끼며 걷는 '맨발 걷기' 열풍이 전국 각지로 확산되고 있다. 서울을 비롯해 화성시, 전주시, 세종시, 포항시 등의 지자체들은 맨발 걷기 활성화 조례를 발의하거나 통과시켰고 지난달 문경새재 일원에서 열린 '오감만足 2023 문경새재 맨발페스티벌'에는 3000명의 인파가 몰렸다.  최근에는 가까운 공원이나 산에서도 모래나 황토 등으로 조성된 맨발 걷기 길을 쉽게 찾아 볼 수 있다. 맨발로 걸으며 운동을 하는 이들을 지칭하는 '어싱족(접지를 뜻하는 earthing과 집단을 뜻하는 족의 합성어)'이라는 신조어까지 생겨난 가운데, 맨발 걷기가 건강에 불러오는 효과와 주의할 점을 알아본다.  운동 효과 높여 뱃살이 '쏙'  신발을 신고 걸을 때 보다 맨발로 걸을 때 더 큰 체중감량 효과를 얻을 수 있다. 경북대 연구팀은 남자 중학생들을 맨발 그룹과 운동화 그룹으로 나눠 주 4회, 회당 40분간, 총 12주 동안 걷기 운동을 하게 했다. 이후 체지방량, 골격근량, 복부둘레 등에 변화가 있는지 알아봤다.  그 결과 모든 지표가 긍정적으로 변화했으며 가장 두드러지게 개선된 부분은 복부둘레였다. 맨발 그룹의 운동 전 평균 복부둘레는 84.8cm지만 운동 후 80.377cm로 평균 4cm 이상 줄어들었다. 운동화 그룹의 운동 전 평균 복부둘레는 90.508cm, 운동 후 89.815cm로 유의미한 차이가 발생하지 않았다.  맨발이 걷기 운동에 효과를 더하는 이유에 대해 연구팀은 ""신체 하중이 발바닥에 분포한 신경반사구, 림프체계, 신경말단을 자극하고 혈액순환을 활성화시키며 운동 효과가 더 커진 것으로 본다""고 분석했다. 더불어 맨발로 걸을 때 발과 발목의 근육을 더 많이 사용하게 되는 것도 운동 효과가 증대되는 이유 중 하나다.  스트레스 줄이고 심리적 안정감 줘  맨발 걷기는 우울증을 완화하는 효과도 있다. 맑은 공기를 마시고 햇볕을 쬐며 걷는 것 자체가 행복 호르몬이라고 불리는 세로토닌 분비를 촉진하지만 흙과 작은 자갈 위를 맨발로 걸으면 더 다양한 감각을 자극할 수 있다.  특히 흙의 독특한 향취를 자아내는 지오스민(Geosmin)이라는 물질은 초조함과 불안감을 완화하고 심리적 안정을 취하는 데 도움을 줘 우울증 개선에 도움이 된다. 관련 연구를 보면 지오스민 흡입 전·후 뇌파를 분석 결과, 델타파와 알파파가 증가해 심신이 안정된 것으로 나타났다. 또 뇌의 이완도와 집중도는 높아지지만 스트레스는 감소하는 경향을 보였다.  당뇨병·족저근막염 환자는 자제해야  한편, 맨발 걷기에 나서기로 결심했다면 주의해야 할 점도 있다. 지면 온도가 너무 높은 곳은 화상을 입을 수 있으므로 피하고, 부상 위험이 있는 시멘트, 아스팔트, 우레탄 길이 아닌 숲이나 공원에 조성된 흙길을 걷도록 한다. 파상풍에 대비해 미리 예방 주사를 맞는 것도 좋은 방법이다.  맨발 걷기를 피해야 하는 사람도 있다. 당뇨병과 족저근막염, 관절염 환자 등이다. 혈액 순환이 원활하지 않은 당뇨병 환자는 발에 난 작은 상처도 쉽게 회복되지 않고 염증과 궤양으로 이어질 수 있으므로 주의해야 한다.  족저근막염과 관절염이 있다면 발과 관절을 보호할 수 있는 운동화를 신고 걷는 것이 증상 악화를 막을 수 있다. 이외에도 발바닥 지방층이 얇아진 노인이나 발에 무좀, 습진 등 피부병이 있는 사람도 맨발 걷기를 자제하는 것이 좋다.  ]","['황토길 개좀 끌고오지마라.\n개대소변은 똥이 아니고 오줌이 아니더냐?\n여기저기 영역표시 하는 개는  끌고 오는지 무식한인간들', '산책로에 애완견 델고 오는사람들 보거라! 배변봉투 수풀 또는 나무밑에 버리고 가는자들은 개만도 못하다. 제발 집빢에서 나오지 말기를~~', '제발 맨발걷기 하는 흙길에 강아지 델고 걷는 것은 좀 하지마라. 강아지들 길가다 찍 오줌싸는거 많이 봤다.   똥싸는  것만 치우면 된다고 생각하나보다.', '아...생각만해도...가시,깨진유리병,벌레..너무 아프고...개똥,오줌,가래,침...너무 더러워...', '산에 가면 맨발로 산책하는 사람 너무 많음.근데 난 못하겠던데..가시 찔리면 그거 빼내는것도 일이라서.그냥 걸어도 충분히 좋다.', '', '개들이 오줌을 얼마나 싸면서 다니는데\n똥도 제대로 안치워서 오줌똥 다묻어있는 길을\n안보인다고 없는게 아니에요', '맨날로 운동해보니 발바닥이 직접 자극되니 말초까지 혈액이 돌아 수족냉증에 매우 도움이 되었음.   산은 겁나서 못걷지만 해변을 걷는것은 꽤 괜찮을 것 같음', '왠지는 모르겠는데 다른 운동 땀흘리고 근력하고 다 해도 생리에 문제가 있었는데 맨발걷기 꾸준히 했더니 그냥 나았음. 믿거나 말거나 ~ 좋다는 걸 몸이 확 느낀 사람들은 계속 하는거고 싫은 사람들은 다른 운동 하면 되는거고 ~ 맨발걷기는 사실 빨리 안걸어도 됨 지압효과인지 지구 접지효과인지는 모르지만 몸이 분명 치유됨', '20일째, 매일 50분정도 했는데 혈압이 조금 낮아졌고 꽉끼어 밀어논 옷들 입습니다. 기분도 좋고 잠도 얕은잠이 깊게 잡니다', ""생각만큼  맨발걷기 장소가 많이 없다 공기도 좋은 4대강주변에 걷기 장소를'만들면 사람들 많이이용할거다"", '""맨발 그룹의 운동 전 평균 복부둘레는 84.8cm지만 운동 후 80.377cm로 평균 4cm 이상 줄어들었다. 운동화 그룹의 운동 전 평균 복부둘레는 90.508cm, 운동 후 89.815cm로 유의미한 차이가 발생하지 않았다."" -&gt; 초기 평균 복부 둘레가 이만큼 차이가 난다는건 표본이 잘못되었거나 실험하고 나서 입맛에 맞는 데이터만 골라서 결론에 끼워맞췄다는 얘기. 신발벗는다고 운동 효과가 한 10배쯤 늘어난다는 헛소리를 이렇게 당당하게 하나 ㅋㅋㅋㅋㅋ', '맨발 걷기 두 달 하고 생리주기가 정상으로 돌아옴...맨발걷기 이전에도 등산, 걷기, 댄스 등 운동 열심히 했었음 그냥 운동도 당연히 몸에 좋긴 하지만 맨발걷기만의 효과는 분명 있음!!', '뉴질랜드사는데 여긴 맨발의 민족임. 바닷가는 물론이고 마트나 도서관에도 맨발로 돌아다녀도 아무렇지 않음. 우리 애들도 신발신겨서 학교보내도 맨발로 집에 돌아옴. 동물 배설물 밟아도 물에 씻으면 그만이고 바닷가 조개바닥, 돌밭, 놀이터에 있는 나무로 된 바크칩, 심지어 풀밭에 가시풀도 많은데 발바닥이 두꺼워져서 타격이 없음. 그래서 그나마 서양인들중에서 집안에서 신발 잘 안신는 나라임. 한국은 외출후 ‘손씻으세요~’ 할때 여긴 ‘손이랑 발씻으세요~’ 하니까 시부모님 문화쇼크 받으심 ㅎㅎ', '학교 운동장마다 밤이면 동네 아줌마들로 난리다', '오염된 토양..즉 개와 야생동물들이 많이 다니는 곳은 주의..', '확실히 스트레스에 좋아요 맨발로 걸으면 자유로워요  그런데 살은 안 빠져요  안 먹어야 빠지지 않을까요 ??', '유행이라고 우루루 따라하고 ㅋ 사이비종교가 왜 흥하는지 알겠더라 어디서 좀 좋다그러면 안하면 큰일이라도 나는냥  모두가 맨발걷기 따라하는 거 보니 좀 무섭더라', '동네 산 타면서 등산로에서 까치살모사 두번을 목격함..가을되서 밤 가시도 많음..그래도 맨발로 다니는 사람 많던데..위험하면서까지 건강을 생각하는게 맞는걸까 생각됨..안전한 장소에서 하셨음 좋겠다는 생각..', '소식하고 움직여라.신발벗고 운동  안해도 된다', '신발 신고 열심히 하는게 더 나을지도', '', '아무리 좋은 것도 나랑 맞아야지', '맨발이든 러닝화든 쳐걷든 쳐뛰든 좀 하기나 해라. 맨날 유튜브, 네이버 댓글, tv 쳐보면서 콧구멍 후비다 복부 살만 디룩디룩 찌고 건강 관련 글 나오면 불평불만 비꼬는 글 남기는 패배자들 수두룩빽빽', '무릎관절에 좋다고  생로병사에 나옴 글구 당뇨에도 좋고 무돔습진에도  다 좋다  당뇨병 실제로 완치된 사람들 있으니 ㆍ조심해서 잘걸으면된다', '남산서 맨발걷기하고 식수대서 양말빨고 발씻더라\n더러운', '맨발걷기 확실히 불면증 ,다이어트에 좋은 운동인 거확실한 거 같다! 주위에 불면증 고친분들 계시니! 하지만 위 실험군은 선발기준 자체가 잘못됐다! 모든 비교실험은 비교대상 기본 수치가 동일해야함에도 위실험의 경우 맨발군 기존 평균84.8키로 황토길걷기 후 80.3키로 운동화군 걷기전  90.5키로 걷기후 89.8키로 운동화군은 본래 비만 살빠지기 어려운 체질일 수도 있다! 꿰어 맞춘 실험이라는 의심간다! 그래도 맨발걷기는 유익하다!', '무좀은 신발신자', '유익한 기사 입니다.\n퇴행성관절염 환자가 맨발로 걷다가\n무릎 통증 때문에 고생했어요.\n모두에게 좋은건 아닌가봐요~', '겨울에도 맨발 가능한가요??\n쿄ㆍ쿄', '그냥 걷는것도  충분히 좋다', '맨발걷기도 좋은땅에서 해야지, 동네 뒷산에 개오줌도 싸는 길에서 걷고있더만. 게다가 발아프다고 천천히 걸어다닐거면 신발신고 빠르게좀 가라. 좁은길 앞지르려니 불편해', '기사 취재 좀 하고 좀 써라. 기본적으로 맨발걷기 사례자  하나 인터뷰하고 쓰던지. 왜 맨발인지 접지를 왜 해야 하는지 안 쓰고 뭐 그냥 뭐보고 취재했니?', '내가 아는 지인은  맨발걷기 6개월 하고나니 발톱무좀이  없어지더라던데!  사람마다 효과가 다르다', '우리아파트화단에서  맨발로   운동하는사람이   있는데   옳은건가요??????', '처음으로  맨발로 집앞에 산에  갔는데  갔다오구  꿀잠을  잤고  혈액순환이 된건지 손이 자다가 뻣뻣 증상이  없었음요  당일만요 ~  매일매일 꾸준히 하면  혈액순환에 좋을거같아요  근데 강아지들을 데리고 산에오시니 좀 찝찝~  집앞이 바다라면 모래에서  걷기하면 좋을텐데 ~~', '발바닥에 자극이 많이 간다지만 맨발로 걷는 사람들 대부분 병조각이나 발에 찔릴만한것 있을까봐 땅바닥을 보면서 아주 천천히 걷던데 그래도 그렇게 운동이 효과적인지 정말 궁금하네요!', '하여튼 우리나라사람들 몸에 좀 좋다면 우르르..', '맨발걷기 좋으면 아프리카에 사는 사람들은 환자들이 없겠네요~~', '맨발로 자니다가 개똥 밟으면 정말 난감해', '32명 보다는 조금 더 표본이 많아야되는거 아닌가.. 심지어 대조군(운동화)은 실험군보다 허리둘레 평균값이 2인치나 더 두꺼운데 제대로된 실험도 아닌거 아닌가', '자주가는산에 갑자기 맨발로 걷는 사람들이 보이길래\n이 산이 맨발로 바뀌었나? 하고 살짝 당황해서 가야되나 말아야되나 했는데\n그랬구나..ㅋ', '요새 많던데.. 맨발 산책하는 사람들', '맨발걷기로 당뇨.혈압약 끊었어요.\n체력도 좋아지고요.\n파상풍주사 필수 입니다\n테니스.한강공원 매일 걷고 했는데도\n효과 없었던게 맨발걷기로 약 💊 끈고\n건강해 졌어요', '어??!!! 나도 오늘부터!!! 맨발걷기 하는데 이런 기사가 나오네??? ㅋㅋㅋㅋㅋ 타이밍 참 신기하다 ㅋㅋㅋㅋ 난 몇주전부터 다이소에서 지압슬리퍼하고 바닥에 놓는 지압바?? 이런거 샀어 ㅋㅋ 난 층간소음 떄문에 또 발이 차서 슬리퍼를 신었었는데 그냥 푹신한 스폰지같은 슬리퍼를 신었었지. 그런데 이게 건강에는 아주 안좋은거였더라고. 그래서 몇주전부터 지압슬리퍼에다 지압바 이런거 활용하다 유튜브 보고 맨발로 숲을 걷는게 접지효과가 있다는거야. 띠용~~ 그래서 오늘부터 맨발걷기 해봤어 ㅋㅋㅋ 앞으로 매일 할거야. 다행히 집에서', '', '', '오늘도 산책 및 맨발걷기 미션 완료!!!! ㅋㅋㅋㅋㅋㅋ 나는 조그만 배낭에다 슬리퍼를 담은 비닐봉지를 넣어서 배낭메고 산책 나가. 그냥 아파트 단지 산책인데 맨발걷기 하면서부터 따로 배낭을 챙겨서 나와. 처음엔 일단 운동화로 한 3천보 걷고 그리고 맨발 흙길 코스를 또 왕복으로 왔다갔다해. 맨발 흙길 코스는 몇십미터 안돼. 그런데 빨리 걸을수가 없으닌깐 아파서 말야 ㅋㅋㅋ 엄청 긴거리야 ㅋㅋㅋ 그리고 맨발걷기가 완벽한 운동은 아냐. 맨발걷기나 병이나 기타 몸에 어딘가 이상이 있거나 달리기가 안되는 만성피로증을 달고 살거나 하는', '더러웟...도심지 놀이터나 그런 데에서 맨발로 다니는 분 봤는데...도시가 얼마나 더러운데요. 생쥐 비둘기, 개똥, 개오줌, 침, 가래 등등 게다가 모래 속에 유비도 섞여있다구요...하려면 인위적으로 오물 없이 잘 갖춰진 길에서 해야할 듯', '3일걷고 나니 허리통증이 심하였음\n뒤꿈치 갈라짐도 심해졌음\n다이어트 효과는 있는듯', '맨발이던 신발이든 남 피해안주면 신경꺼라 제발  이러쿵 저러쿵 오지랍은 ㅉㅉ', '맨발 걷기용 양말정도는 신어야 하지 않을까.\n바닥이 얼마나 더러운데...', '맨발로 다니면 무좀 사마귀 티눈 난리남…', '', '', '뭔 걷기랑 달리기를 비교하고 웨이트를 하라하고. 평소에는 숨만쉬는 것들이. 새벽에 달리고 평소에 가볍게 운동하고 저녁에 걸어라. 그럼 편하게 먹어도 살은 빠진다.', '얻는것보다 잃는게 더 많을것 같기도 함 따라하고 싶진 않아요', '당뇨병 환자도 운동해야지 무슨 가만히  있다  악화되  빨리 죽으라고 고사 지내셔', '피부약한사람도 피해야 되요~~ 안그럼 조금만 맨발로 걷고도 발바닥 마찰로 물집 잡힘 . 그리고 쿠션감 있는 진흙이나 흙에서 해야지 모레처럼 건조하고 단단한 바닥에서 했다가 오히려 발바닥 치료해야함', '신발을 왜 만들었는지. 생각해봐라.어이쿠', '', '그냥 걷기는 되나요??', '드럽노..', '저런 곳에 설마 개데리고 오는 정신 나간 것들은 없겠지??? 제발 개오줌도 물로 좀 씻어내라. 산책로에 냄새 진짜.. 토나온다.', '', '어휴 몸에좋다면 똥물도쳐마시는 인간들. 출퇴근시간에는 왜 안하냐?ㅂ ㅋㅋ', '무좀 ... 아', '음식조절을해라~엄한짓말고', '태어날때 맨몸으로 태어난다 그러므로 맨발로 걷는게 얻을것이 더 많을듯', '살인진드기 있는 나라에서 왠 맨발걷기를 하라그럼?', '발사진은 왜찍냐', '괜히 발바닥 못 찔려서 병원 가는일 없길', '돌이나 파편ㅇㆍ니 반ㅂ으면 뒤진다 뭔 맨발 같은 ㄱㅏㅣ솔', '', '황토런닝머신 나오겠네', '뉴스보면 그 어느 것도 하지 말아야 함.', '', '건선에 효과있음', 'https://youtu.be/Yf6xRwJGflU?si=GLqPLkjcxdk1luzJ', '건선도', '런닝머신에서 맨발로 걷기는 괜찮을까요?', '맨발걷기 좋다 이거에요 근데 더러운 발을 왜 음용하는 식수대에서 닦고 지랄들이세요? 제발 기본을 좀 지키자구요 거긴 니네들 더러운 발 씻는 곳이 아니랍니다', '맨발에 청춘!', 'ㅋㅋ 지럴을하네 ㅋㅋㅋ 맨발로 걸어서 빠지는 게 아니라 걸어서 빠지는거다 ㅋㅋㅋ', '', '저러다가 면역력 딱 떨어지면 맨발로 걷다가 감염된 바이러스가 활성화 되고 발이 썩어들어가면서 발을 짤라야하지', '살을 빼고 싶으면 운동 강도를 높여...맨발로 40분 시속 4키로로 걷는 것보다....운동화 신고 30분 시속 8~10키로 정도로 조깅하는게 두 배는 더 빠질껄??', '댓글보니 놀랍네 진짜 흙이 사람에게 좋긴한가보다 그딴거 효과 있겠냐했는데 효과가 있나보네 돈 안들이고 격한 운동도 아니고 남녀노소 모두 하기 좋을거 같음 다만 개똥 개오줌 이게 문제네 밟는다는 상상만으로도 끔찍하다 ㅡㅡ', '', '지간신경종에도 맨발걷기 안 좋았어요', '누가 나 발바닥 좀 긁어줘..', '성분도 모르는 백신은 3방4방씩 턱턱 맞는 조선인들이 건방지게 무슨 어씽이냐, 어씽 법으로 금지시켜라, 한국남자 푼돈으로 2년 군대끌고가서 노동력 착취하는걸 당연하게 만들었듯이,  다 법으로 강제로 어씽 금지시켜라, 안되는게 어딨어 조선땅에,', '발이 한번이라도 골절되셨던 분들은 골절이 나았더라도 맨발산책 하시면 안됩니다. 낫지 않는 염증이 생겨요. 운동화 챙기세요!', '맨발로 밥먹고 하루 두번  30분 정도 걸었는데 3주 동안 2키로 정도 빠진 것 같아요', '저러다 뱀에 물려서 개고생해봐야 정신차리지', '', '그래도 운동이란 숨도차고 근육도 땡겨가며 하는게 운동유', '저러다 상처나서 감염돼봐야 왜 신발 신고 다니는줄 알겠지..', '', '', '족저근막염체외충격파 세군데  병원하고 안  낮아서  한약  누가 지어 먹으래서 먹고겨우 고쳐짐  참고해 보세요', '', '나는 신발 신고 오래전부터 아파트 단지를 오전 산책해왔지. 그런데 산책로 흙길에 얼마전부터 맨발로 걷는 여성들이 있었는데 어제는 남성도 한명 있었어. 집에 와서는 유튜브에서 알고리즘이 추천해준 맨발 걷기 영상을 봤는데 확실히 해볼만하더라고. 그런데 내가 성격이 남 따라하는거 별로 안좋아하거든 ㅋㅋㅋㅋㅋ 가만 생각해봤는데 다른 산책로가 마땅치 않더라고. 그래서 모양새가 아파트 주민들 흉내내는거 같아도 걔들이 창안한것도 아닌데 ㅋㅋㅋ 나도 오늘부터 흙길산책로 맨발로 왕복산책했어 ㅋㅋ 지병 고쳐지면 정말 좋겠어 ㅋㅋㅋ', '', '중학생 스치기도 전에 자지가 서야 되는데 안서 이게 기사지 자라나는 애들한테 뭔 복부 둘레', '요즘 땅바닥에 독성물질이 얼마나 많은데  이런 아날로그식\n낭만은 2000년대 로 끝났어', '시흥시 신천동 구도심에 맨발로 걷을수 있게 신천공원 황토로 바꿔 주세요.\n 공원 가운데 물놀이장 말고 하남시처럼 수영장 만들어 주세요.\n 수영선수급 관리자들 많이 배치시켜 일자리도 창출해 주시고요.', '단식쇼쟁이는 피해야것지', '그래서 옛부터 \n맨발로 걷거나 고무신을 신은거다... 새삼스럽게 난리넹...\n\n신발은 얇을수록 발바닦을 더 자극하기에 바닦이 얇은 신발이 젛은겁니다..\n\n지금은 온 나라를 포장해버려서 신발이 얇으면 발바닦이 아파서 두꺼운 신발을 찾는거고..\n\n스스로 비교해 보세요.\n산길 2시간과 포장도로 1시간을 걸을때의 피로도를..', '실제로 맨발로 터덜터덜 걸어오는 사람을 보니 정신이 올바르지 않아 보입디다', '맨발로 걷는 사람들보면 조선통신사 그림에 나오는 빤스만 입은 왜구같음. 대체 왜 그뤠? 이 좋은 세상 천대만대 오래 살려고 그러나? 정말 특이해. 우리나라에는 이 좋같은 세상 죽고 싶어하는 사람들 반, 이 좋은 이승 기를 쓰고 오래 살려는 사람 반. 중간이 없는 나라.', '개짓 그만하고 방에서 헬스자전거로 운동해라', '', '']",http://www.newsmp.com/news/articleView.html?idxno=236468,https://n.news.naver.com/mnews/article/296/0000069668?sid=103
2023.09.25.,충청매일,,"충남 당진3동, 당신을 위한 진심 하우스 사업 벤치마킹 잇따라",,,https://www.ccdn.co.kr/news/articleView.html?idxno=937907,http://www.mkhealth.co.kr/
2023.09.24.,국민일보,,“‘베르테르 효과’ 염려” 백종우 전 심리부검센터장 일문일답 [이슈&탐사],,,https://news.kmib.co.kr/article/view.asp?arcid=0018700951&code=61121111&cp=nv,http://www.newsmp.com/
2023.09.20.,메디컬투데이,,"치매, 예방이 최선의 치료법…매일 30분 이상 운동 하면 치매 확률 80% ↓",,,https://mdtoday.co.kr/news/view/1065568425219830,http://www.ccdn.co.kr
2023.09.24.,동양일보,,청양군 자살예방 노력 성과 빛났다,,,http://www.dynews.co.kr/news/articleView.html?idxno=722085,http://www.dynews.co.kr
2023.09.24.,스카이데일리,,'HAPPY700사랑나눔' 지역연계 사업 추진,,,http://www.skyedaily.com/news/news_view.html?ID=206850,http://www.skyedaily.com
2023.09.19.,의사신문,,[제약업계 소식] 9월 19일,,,http://www.doctorstimes.com/news/articleView.html?idxno=224234,http://www.doctorstimes.com/
2023.09.13.,의학신문,,"지씨씨엘, 치매 등 임상시험 서비스 강화 위한 4자간 MOU",,,http://www.bosa.co.kr/news/articleView.html?idxno=2205485,http://www.bosa.co.kr
2023.09.22.,문화일보,,"동대문구, 반려식물 활용한 어르신 힐링 프로그램 추진",,,https://www.munhwa.com/news/view.html?no=2023092201039927099001,http://www.munhwa.com/
None,충남일보,,"당진시 당진3동, '당신을 위한 진심 하우스 사업' 벤치마킹 잇따라",[],[],http://www.chungnamilbo.co.kr/news/articleView.html?idxno=736327,https://n.news.naver.com/mnews/article/021/0002595604?sid=102
2023.09.26.,메디컬투데이,,시야에 검은 점 나타나거나 사물 휘어져 보이면 ‘이 질환’ 의심해야,,,https://mdtoday.co.kr/news/view/1065596025236075,http://www.chungnamilbo.co.kr
2023.09.16.,파이낸셜뉴스,,[척추·관절 100세 설계]늘어나는 고령의 인공관절수술,,,http://www.fnnews.com/news/202309150813049021,http://www.mdtoday.co.kr
2023.09.18.,중앙일보 헬스미디어,,"[제약 단신] 한국노바티스, 소중한 일상 응원하는 치유 시즌7 진행 外",,,https://jhealthmedia.joins.com/article/article_view.asp?pno=27157,http://www.fnnews.com/
