Date,Press,Category,Title,Content,Comment,URL_Origin,URL_Naver
2023-09-18 15:42:09,아이뉴스24,사회,"‘초고령사회 부산’ 부산시, 노쇠예방 프로젝트 추진","[ 만 65세 미만 ‘초로기’ 치매 연간 2만명 진단사회적 무지 속 고립…“7개월 간 방에 숨어”이른 나이 갑작스러운 실직… 생활고도노인성 치매 위주 정책에 지원도 사각지대    [헤럴드DB][헤럴드경제=박혜원·박지영 기자] “받아들이기 힘들었습니다…. 나는 멀쩡한데 무슨 치매냐고 집사람에게 박박 우기고 싸웠어요. 죽으려고 칼을 머리 맡에 놓고 몇 달 살기도 했어요. 7개월을 문 닫고 방에서 나오지도 않았습니다.” 유진철(64·가명) 씨는 치매 진단을 받은 2020년, 61세이던 당시를 이같이 회상했다. 치매는 노인이 앓는 질환으로만 여겼던 유씨에겐 쉽사리 받아들이기 어려운 현실이었다.유씨가 치매검사를 받게 된 건 유씨의 건망증 증세를 주의 깊게 지켜보던 아내를 따라서였다. 유씨는 “‘병원에 한 번 가자’는 말에 뭔지도 모르고 갔다가 갑자기 치매 진단을 받았다”고 했다. 유씨는 절망했다. 치매 사실을 부정하며 1년 가까이 가족도 멀리했다. 유씨는 “한동안은 약을 먹기도 거부하면서 3년 동안은 외출도 하지 않았다”고 털어놨다.61세, 58세, 57세, 55세. 헤럴드경제가 직접 만난 치매 환자들이 공식적으로 치매 진단을 받은 나이다. 대부분 증상이 발현된 지 3~4년이 지난 후에야 병원을 찾았다는 사실을 고려하면 실제로 치매에 걸린 나이는 50대 초반에서 중후반이다. 치매가 주로 70세 이상 고령층에게 찾아온다는 상식을 거스르는 이들은 ‘젊은’ 치매라고도 불리는 ‘초로기(初老期)’ 환자들이다.치매는 대표적인 노인성 질환이다. 하지만 65세 미만에 발병하는 이들도 적지 않다. 18일 보건복지부가 김민석 더불어민주당 의원에 제출한 자료에 따르면 해마다 2만명이 넘는 사람이 초로기 치매 관련 진료를 받는다. 연도별로 보면 ▷2018년 2만1837명 ▷2019년 2만1364명 ▷2020년 2만112명 ▷2022년 2만405명이다. 올해 7월까지도 1만6332명이 진료를 받았다.    55세 나이로 치매 진단을 받은 박모(61) 씨가 헤럴드경제와 인터뷰하고 있다. 박혜원 기자건망증, 우울증 착각…‘골든 타임’ 놓쳐 악화초로기 치매 환자의 첫 난관은 바로 진단 그 자체다. 이른 나이에 증상이 시작되니 건망증처럼 사소한 문제로 여기거나 우울증 등 다른 질병으로 인한 것으로 착각한다. 치매 진단을 받고 치료를 거부하는 일도 빈번하다.치매는 아직 치료제가 개발되지 않은 질병이다. 치매 바로 직전 단계인 경도인지장애 단계에 적극 개입을 통한 예방이 현실적으로 가능한 최선의 해법이다. 하지만 초로기 치매에 대한 ‘사회적 무지’ 탓에 골든타임을 놓치고 만다. 박모(61) 씨 사례가 대표적이다. 박씨가 인지능력 저하 증상을 보이기 시작한 것은 2017년이었다. 당시 나이 55세였다. 술을 마시고 귀가하면서 집을 찾지 못하거나 본인이 있는 장소를 설명하기 어려워하는 일이 반복됐다. 돌이켜보면 치매 초기 증상이었다. 2019년 딸이 처음으로 병원 진단을 권유했지만 박씨는 완강하게 거부했다. 박씨의 배우자인 한모(61) 씨는 “치매는 여전히 사회적으로 ‘끔찍한 것’이다. 자신의 부정적인 면을 받아들일 수 없었던 것 같다”고 했다. 한씨는 결국 2020년 치매안심센터를 찾아 초로기 치매 진단을 받았다.이모(56) 씨도 마찬가지였다. 이씨는 서울 4년제 대학을 졸업했고 15년 동안 대기업에 다녔다. 회사를 나오고 나서는 자격증을 따 부동산 공인중개사로 일했다. 완벽주의에 가까운 꼼꼼한 성격이었기에 더욱 치매를 예상하지 못했다. 증상은 이씨가 51세였던 2018년 시작됐다. 얼마 전 다녀간 손님을 기억하지 못하고, 집주인과 잡아둔 약속을 까먹기 일쑤였다. 이를 단순 건망증으로만 여긴 이씨와 배우자 강모(55) 씨는 알림과 메모를 더욱 꼼꼼히 하는 데에만 집중했다.우울증 의심도 했다. 강씨는 “우울증이 심하면 건망증도 같이 온다. 남편이 우울증 때문에 기억력이 나빠진 것이라고만 생각해 우울증 약을 8개월 정도 먹었다”며 “2020년부터 야간 경비일까지 투잡을 뛰었는데 밤낮으로 잠을 못 자니 그때 더욱 증상이 심해졌던 것 같다”고 했다. 결국 이씨는 지난해 10월 치매 진단을 받았고 현재는 모든 일을 그만둔 채 쉬고 있다. 이씨는 당시의 감정을 두 마디로 표현했다. “황당했죠. 내가 치매라니.”김선희(64) 씨는 56세 당시 지인 권유로 치매검사를 받았으나 건망증으로만 진단을 받았다. 김씨 배우자 박동휘(63) 씨는 “1년 뒤 증상이 갑자기 심각해지면서 길을 잃어버리는 일이 반복돼 검사를 받으니 그제야 경도인지장애 진단이 나왔다”고 말했다.    [헤럴드DB]“주변에 말을 못하겠어요”…사회·경제적 고립진단 이후 이들을 덮치는 건 사회·경제적 고립이다. 진단 사실을 알리고 싶지 않다는 이유로 인간관계를 단절하고 사회와의 소통을 끊는 이들이 많다. 증세 악화로 일자리를 잃은 후 배우자나 자녀가 오롯이 그 부담을 짊어지기도 한다.유씨 형제와 지인들은 여전히 유씨의 치매 사실을 모른다. 유씨는 “옛말로 ‘노망’이 난 건데 자랑거리도 아니지 않느냐”며 “치료센터를 다니면서 많이 받아들이긴 했지만 아직 주변에 상태가 안 좋다는 얘기는 못하겠다”고 털어놨다.경제적 활동이 왕성할 시기에 맞닥트리는 ‘실직’ 문제도 있다. 전기산업기사로 10여년간 일해온 박씨는 치매 진단 직후인 2020년 11월 일을 그만뒀다. 월 200만원씩이던 고정수입이 사라진 뒤 그간 프리랜서로 지내왔던 한씨가 갑작스레 가장이 됐다. 한씨는 “요양보호사 자격증을 따기도 해봤지만 일을 하면 결국 남편을 내내 방치해야 해 직업으로 삼지는 못했다”며 “생활비 문제가 정말 심각한데 방법을 모르겠다”고 토로했다. 그런 한씨 곁에서 박씨는 “내가 항상 미안하다”며 짧게 탄식했다. 한씨는 “남편이 단순 노동인 청소 정도는 충분히 가능하다. 지금도 집에서 재활용, 청소를 도맡아서 하고 있다”며 “일본에서는 기관이나 단체가 일자리 마련도 추진한다고 들었다. 치매인 가족으로서 정말 부러운 부분”이라고 덧붙였다.치매 정책서도 사각지대    초로기 치매 환자 김선희(64·오른쪽) 씨와 남편이자 보호자인 박동휘(63) 씨. 박혜원 기자초로기 치매는 각종 지원 체계에서도 소외돼 있다. 연간 36만원 이내에서 약값·진료비를 지원하는 보건복지부 치매치료 관리비 지원사업은 60세 이상 치매 진단 환자만 대상으로 한다. 60세 미만 환자가 지원을 받기 위해선 ▷의료기관 진단 ▷치매안심센터 등록 ▷치매 치료약 복용 ▷기준 중위소득 120% 이하라는 조건을 충족시켜야 한다.이씨 부부는 초로기 치매 환자가 이용할 만한 프로그램이 없다는 점을 문제로 꼽았다. 이씨는 “(치매안심센터는) 나보다 나이가 한참 많고 치매가 심한 사람들만 있어 어울리고 싶지 않다. 종이 접고 춤 추는 게 도움이 되는지 모르겠다”고 전했다. 강씨는 “담당의사는 계속 일을 하고 활동을 하라고 강조하는데 막상 센터에 물어보면 그런 프로그램은 없다고 한다. 답답해서 제가 요양사 자격을 직접 딸 생각”이라며 “센터는 케어에 초점이 맞춰져 있어 초로기 치매 환자가 이용하기에는 부적절하다”고 말했다. 강씨는 지난 15일 요양보호사 자격증시험에 응시했다.박씨는 가족이 초로기 환자를 책임질 수 있는 체계 마련이 필요하다고 강조했다. 가족이자 보호자로서 아내의 곁을 끝까지 지키는 것이 박씨의 바람이다. 박씨는 “치매는 가족에게 지원을 잘해줘야 한다고 본다. 내 가족을 나만큼 잘 케어해줄 수 있는 사람은 없다”고 했다.치매 환자 대상 인지활동형 방문요양 서비스의 경우, 요양보호사 방문 시 1회 120~180분 서비스에 4만280~4만6970원의 비용을 지원받는다. 그러나 가족이 요양보호사를 맡을 경우 2만3480원까지밖에 지원을 받을 수 없다. 휴일·야간 서비스 이용 시 추가로 지급되는 30% 가산 급여도 가족 요양보호사는 적용 예외 대상이다.그는 “아내가 어느 순간 내 존재까지 잊어버릴 수 있다는 생각을 하면 가슴이 미어진다. 40년을 함께 살았는데 옆에 누울 때 손이라도 잡고 따뜻하게 온기를 느껴야 마음이 안정되지 않을까”라고 말하며 손을 꽉 잡았다.김민석 의원은 “치매에 대한 인식개선과 적극적인 검사 및 지원이 이루어져야 한다”며 “젊을수록 치매는 충격으로 다가오는데 여전히 우리사회는 치매를 노인성 질환으로 치부하고 있다”고 말했다. 이어 “지난 보건복지위 국정감사에서 전국 치매안심센터가 대부분 만기발병 치매환자 중심으로 운영되고 있고, 초로기 치매환자와 가족을 대상으로 한 맞춤형 지원이 미흡한 것을 지적하며 대책을 요구했다”며 “초로기 치매, 경도인지장애로 진단받는 사람이 갈수록 늘고 있고 그 연령또한 낮아지고 있어 국가가 선제적으로 치매를 예방하기 위한 적극적인 정책을 개발하는 것이 중요하다”고 주장했다. 김 의원은 마지막으로 “한창 경제활동을 할 나이에 치매 진단을 받은 환자와 가족에게 닥치는 사회·경제적 어려움은 더욱 치명적이다. 환자 뿐만 아니라 가족들이 함께 국가의 도움을 받을 수 있도록 보다 섬세한 정책이 마련되어야 할 것”이라고 강조했다. ]","['기사 내용 중 꼼꼼한 성격이기에 치매가 올 줄 ㅁ몰랐다라는 내용,  사소한 일에 신경을 많이 쓰면 도파민의 소모로 뇌의 기능은 현저히 떨어집니다. 이는 집중력과 기억력의 저하로 이어지며 도파민 저하에 따른 우울감이 많아지고 행복감은 떨어지게 됩니다.', '초기진단 필요  건강검진 때 치매포함 해야됨', '초기 단계에서 받아들이지 못해 아까운 시간을 몇 년씩 헛보내면, 나중에 쓰디쓴 후회를 하게 됩니다. 본인이던 가족이던 간에, 초기일 때 약 잘 먹고 걷기 등의 운동을 하고 영양가 있게 먹으면 더 심해지지 않게 관리할 수 있어요. 인정하지 못하고 부정하거나 안절부절하는 사이에 나도 모르게 치매중기로 진행되면 수백 배 어려워집니다. 초기일 때 적극적으로 대처하세요.', '지저분한 정치 기사만 보다가 간만에 의미있는 사회기사 보네요. 아직도 대한민국은 국민들을 위해서 할일이 많은 나라입니다', '기사에도 나왔지만 치매 예방하려면 잠을 잘 자야 한답니다. 나이들어서 투잡 뛰면서 잡 설치면서 일하면 안되요. 돈이고 뭐고 내가 치매 걸리고 죽으면 다 무슨 소용인가요? 나이 들면  어렵지만 욕심을 버리고 비우는 삶을 실천해야 할것 같아요.', '근데 웃긴게 맥락에서 벗어난 얘기지만 의사 한사람 말한마디 ""당신은 암이요"" ""당신은 치매요"" 이말에 인생 반 포기한 상태로 산다면 그냥 안사는게 낫지 않냐? 의사도 사람이다 실수할 수있고 잘못 진단 내릴 경우도 있으니 여러병원 돌아다녀봤으면 좋겠다.', '안타깝고...슬픈 이야기.. 울 엄마 현재 80...허리및 다리수술후 장애등급 빋으시고...이젠 인지장애등급.. .맘이 너무 아파 늦게라도 직접 케어하고픈데...가족들이 이상한 생각을 한다..지금껏 가만히 있다가 이제와서 왜 그러냐고.ㅜ...내가 막내이고 지난 몇년 누구에게도 말 못하고 혼자 힘든 시간을 지내다보니...그리고 다른 형제자매들이 잘 케어해드리겠지..그러다 작년에 엄마상태보고 눈돌아가더라...내가 어떻게든 케어해야겠다는 생각뿐...참...눈물난다..울엄마는 곱디고운 분이신데...', '우리동네에도 치매가 확실해보이는 노인이 있지만 가족보호자가 관심갖고 검사받으러 병원에가야되는데, 연락끊고 방치해두는 노인이 꽤있다. 이런경우 국가에서 더 적극적으로 검사해줘야 할것같다.', '스마트 폰의 과도한 사용이 뇌에 부작용을 유발하여 치매 연령이 낮아지는게 아닐까?', '유난스러운 인간들', '정부는빨리미리미리대책을마련해야할듯..혹시나조기치매가오더라도그냥자연스럽게받아들이는자세도필요하겠네요..', '', '모든 병의 치료는 자신이 병이 있음을 인지하는 것에서부터 시작함. 자신은 병이 없다 믿으면 누가 뭐래도 병원 안감.', '치매 자기가 좋아 하는것에 몰입하면\n자연히 없어진다ㅎ', '좋은 정보 입니다.', '개버린 문모씨가 떠오르네']",http://www.inews24.com/view/1637503,https://n.news.naver.com/mnews/article/016/0002199403?sid=102
2023.09.04.,코메디닷컴,,"온종합병원, 부산권 최초로 '노년내과클리닉' 개설",,,https://kormedi.com/?p=1619097,https://www.kormedi.com/
2023-09-04 11:08:01,파이낸셜뉴스,사회,온종합병원 '노년내과클리닉' 개설..부산 종합병원 최초,"[ 은명 소장 ""노화 과정에 맞춤 진료하겠다""""다른 큰 병은 없는데도 최근 들어 밥맛이 영 없고, 몸무게도 자꾸 줄어드는 것 같습니다."" ""여기저기 아프다 보니 끼니마다 먹는 약이 밥보다 양이 더 많네요. 약만 먹어도 배부르다니까요."" ""기억력이 예전 같지 않은데, 혹시 치매일까 싶어 자식들에게 말도 못 꺼내고 있죠.""  인구 고령화가 가속화되면서 이처럼 막연한 증상들을 호소하는 노인들이 늘고 있다.  우리나라는 현재 60대 인구가 80대 이상 인구보다 월등히 많다. 향후 '노인 의료'는 심각한 양상으로 치달을 가능성이 크지만, '노인의학'과 '노년내과'는 의료계에서조차 생소한 분야다.  서울아산과 세브란스. 전남대병원, 강원대병원, 분당서울대병원 등이 최근 잇따라 '노년내과'를 개설하는 것도 그 때문이다. 일반 성인들 질환과 나이든 노인들 질환을 다르게 접근해보려는 시도다.  그런 가운데, 온종합병원(병원장 김동헌·전 부산대병원장)이 부산권 종합병원으로서는 처음으로, '노년내과클리닉'을 개설했다.     [사진=온종합병원]앞으로 65세 이상 노인들을 대상으로 △고혈압·당뇨·심장질환 등 만성 진환 관리 △거동, 일생생활 등 신체 기능 유지 관리 △치매, 노인 우울증 등 인지 능력과 정신 건강 관리 △다양하고 다량의 약물 복용에 따른 부작용 관리 △각종 예방 접종 및 건강 검진 등을 맡게 된다.  노년내과클리닉 은명 소장(소화기내시경센터)은 4일 ""노년내과(Geriatric Medicine)는 노인 인구가 갖는 독특하고 복잡한 의료 요구에 전문적으로 대응하는 진료 분야""라며, ""노인들의 복합적인 신체 상태를 점검하는 것은 물론 질환의 진단~예방~치료는 물론 이들의 다양한 병리적 상황까지 전문적으로 관리할 것""이라 했다.  ]",[],http://www.fnnews.com/news/202309031817401626,https://n.news.naver.com/mnews/article/296/0000069325?sid=102
2023.09.04.,노컷뉴스,,"대전 대덕구, 제22회 보건교육경연대회 보건교육 프로그램 부문 금상",,,https://www.nocutnews.co.kr/news/6005736,http://www.fnnews.com/
2023-09-03 18:20:05,헤럴드경제언론사 선정,생활/문화,"“61살, 내가 무슨 치매…7개월을 방에 숨었어요”[‘젊은 치매’를 말하다]","[ 노화 과정 이해 바탕으로 '동반적인 치료' 추구     부산에 있는 온종합병원이 인구 고령화 시대 노인 맞춤형 진료를 위해 '노년내과클리닉'을 개설해 운영에 들어갔다. 온종합병원 제공  [파이낸셜뉴스] ""밥맛이 너무 없고 몸무게도 자꾸 줄어드는 것 같아 큰 병 아닌지 걱정됩니다."" ""여기저기 아프다보니 매 끼니마다 먹는 약이 밥보다 더 양이 많아요. 약만 먹어도 배부르다니까요."" ""요새 기억력이 예전 같지 않은데, 혹시 치매일까 싶어 자식들에게 말도 꺼내지 못하고 있어요.""   인구의 고령화가 가속화되면서 노인 의료와 돌봄 서비스가 급증하는 가운데 이처럼 막연한 노년 증상들을 호소하는 이들을 효율적으로 진료하는 노년내과클리닉이 개설돼 관심을 끌고 있다.   부산 온종합병원(병원장 김동헌·전 부산대병원장)은 ""부산지역 종합병원으로서는 처음으로 소화기내시경센터 은명 과장을 소장으로 하는 '노년내과클리닉'을 개설했다""고 3일 밝혔다.   온종합병원 '노년내과클리닉'은 앞으로 65세 이상 노인들을 대상으로 △고혈압·당뇨·심장질환 등 만성진환 관리 △거동, 일생생활 등 신체 기능 유지관리 △치매, 노인우울증 등 인지능력과 정신건강 관리 △다양하고 다량의 약물 복용에 따른 부작용 관리 △각종 예방접종·건강검진 등을 맡게 된다.   노년내과클리닉 은명 소장은 ""노년내과(Geriatric Medicine)는 노인 인구가 갖는 독특하고 복잡한 의료 요구에 전문적으로 대응하는 진료 분야""라며 ""앞으로 노년내과클리닉에서는 65세 이상의 노인을 대상으로 복합적인 신체 상태와 질환의 진단, 예방, 치료는 물론 노인들의 다양한 병리적 상황까지 관리할 것""이라고 말했다.   1909년 오스트리아 태생의 의사 이그나츠 레오 나셔(Ignatz Leo Nascher) 박사가 처음으로 '노인의학'이라는 용어를 사용했다. 당시는 제1, 2차 세계대전을 거치면서, 노인 인구가 증가하면서 노인 특화 의료 서비스의 필요성이 대두됐지만 '노인'을 '일반 성인'과 구분하여 치료해야 한다는 나셔 박사의 주장은 혁신적인 아이디어였다.   우리나라에서는 최근 급격한 노령 인구 증가와 더불어 늘어난 돌봄 부담이 점점 더 심각한 사회 문제로 떠오르고 있다. 현재 60대 인구가 80대 이상 인구보다 월등히 많은 것을 고려하면 향후 노인 의료는 더욱 심각한 양상으로 치달을 가능성이 크지만 노인의학과 노년내과는 여전히 생소한 진료 분야로 알려져 있다.   온종합병원 노년내과클리닉은 복잡한 인체상황들을 갖고 있는 고령 환자의 내시경 검사나 수술 등에 대비해 다른 진료과목 전문의들과 협력하는 다학제 진료시스템을 통해 도움을 주고 건강한 여명을 누릴 수 있게 예방조치와 조기 진단에 진료의 중점을 두게 된다.   노인들은 신체 노화로 인해 다양한 약물들을 복용하는 데 따른 여러 약물간 상호 작용에 따른 부작용에 시달리고 있는 실정이다. 이에 노년내과클리닉은 노인환자들의 각종 약물 조절관리에도 중점을 두기로 했다.   인구의 급속한 고령화에 따라 수도권 대형 의료기관들을 중심으로 노년내과를 잇따라 개설하고 있다.   서울아산병원과 세브란스병원은 각각 5명의 의료진이 노년내과 진료를 하고 있고 전남대병원·강원대병원, 분당서울대병원도 1명씩 의료진을 노년내과에 배치했다.   온종합병원 노년내과클리닉 은명 소장은 ""노년내과는 단순히 노인을 대상으로 치료하는 것이 아니라 그들이 가지는 복합적인 질병과 증상을 포괄적으로 관리하고 더 나은 삶의 질을 위한 전반적인 건강 상태를 유지하도록 돕는 게 목적""이라고 설명하고 ""노년내과 의사는 자연스런 노화 과정을 잘 이해시키고, 그에 따라 적절한 치료와 관리를 제공하는 동반적인 치료를 추구한다""고 강조했다.   ]",[''],http://news.heraldcorp.com/view.php?ud=20230918000695,https://n.news.naver.com/mnews/article/014/0005066452?sid=103
2023.09.01.,헬스조선언론사 선정,,"""변 새는 '변실금' 증가하는데… 의료 수가 낮아 치료 제공 어려워""",,,https://health.chosun.com/site/data/html_dir/2023/09/01/2023090101943.html,http://www.nocutnews.co.kr
2023-09-04 11:43:01,아시아타임즈,사회,[1일 인천 연수구 소식] 100일간 수산물 원산지표시 특별점검 추진 등,"[     대덕구보건소 제 22회 보건교육경연대회 금상 수상. 대덕구 제공대전 대덕구(구청장 최충규)는 대덕구보건소가 지난 30일 대한간호협회와 보건간호사회가 주최한 '제22회 보건교육경연대회'에서 보건교육 프로그램 부문 금상을 수상했다고 밝혔다.대덕구보건소는 이번 대회에서 지역 사회복지관 소속으로 홀몸 어르신을 위한 안부 인사 및 자원 의뢰연계에 중추적인 역할을 수행하고 있는 독거노인 생활지원사를 대상으로 올바른 수면습관에 대한 교육을 시연해 보건복지부장관상을 받았다.'전국 보건교육 경연대회'는 보건교육과 우수사례 각 부문 발표를 통해 지역 간 교류를 활성화하고 우수사례 프로그램 공유를 통해 보건 간호사의 전문성을 향상 시키기위해 해마다 열리고 있다.한편, 대덕구보건소는 수면장애 외에도 생활지원사의 의뢰를 통한 대상자 연계 노인 우울증 관리 프로그램을 운영하고 있다.김주연 대덕구보건소장은 ""이번 수상을 통해 보건교육에 대한 전문성을 인정받아 매우 기쁘다""라며 ""앞으로도 홀몸 어르신들의 요구에 맞는 보건교육 프로그램의 개발과 운영으로 노인의 정신건강 증진에 앞장서도록 하겠다""고 말했다.※CBS노컷뉴스는 여러분의 제보로 함께 세상을 바꿉니다. 각종 비리와 부당대우, 사건사고와 미담 등 모든 얘깃거리를 알려주세요.이메일 : jebo@cbs.co.kr카카오톡 : @노컷뉴스사이트 : https://url.kr/b71afn ]",[],https://www.asiatime.co.kr/article/20230901500061,https://n.news.naver.com/mnews/article/079/0003808667?sid=102
2023.09.27.,아이뉴스24,,"‘초고령사회 부산’ 부산시, 노쇠예방 프로젝트 추진",,,http://www.inews24.com/view/1637503,http://www.heraldbiz.com/
