Date,Press,Category,Title,Content,Comment,URL_Origin,URL_Naver
2017.10.29.,뉴시스,,'성범죄자 취업제한 위헌이라는데'…여가부는 고심중,,,http://www.newsis.com/view/?id=NISX20171029_0000131577&cID=10201&pID=10200,http://www.newsis.com
2017-10-29 12:00:08,동아일보,사회,"분유 훔치려던 여대생, 이젠 1억 기부자","[     【서울=뉴시스】손대선 기자 = 성범죄자 취업제한은 합당한 조치인가, 아니면 개인의 직업선택 자유를 과도하게 침해하는 것인가.  성범죄 이력이 있는 모든 이를 잠재적 범죄자로 보고 유치원이나 학교 등 기관 취업을 제한하는 아동·청소년의 성보호에 관한 법률'(아청법) 제56조가 위헌이라는 헌법재판소(헌재)의 판결이 지난해 난 이래 아청법을 실효성을 둘러싼 논란이 이어지고 있다.   아청법은 성범죄로 형 또는 치료감호를 선고받아 확정된 자는 형이나 치료감호의 집행을 종료하거나 집행이 유예·면제된 날부터 10년간 일부 기관에 취업할 수 없도록 했다. 여기서 일부 기관이란 아동·청소년 관련 기관(유치원과 학교, 아동복지시설 등), 의료기관, 체육시설, 아파트 관리사무소 등을 말한다.   성범죄로 낙인이 찍힌다면 범죄 경중과 관련없이 공공성을 가진 일체 기관에 10년 동안 발을 들여놓을 수 없었다.   헌재는 지난해 4월 28일 ""아동·청소년 대상 성범죄자에게 일정 기간 관련 기관 등에 취업할 수 없게 한 조항이 직업 선택의 자유를 과도하게 제한한다""고 밝혔다.  범행 정도가 가볍거나 재범 가능성이 적은 가해자에게도 10년간 취업을 제한하는 것은 과하다는 것이 헌재의 판단이다. 헌재는 3월 31일에도 성인 대상 성범죄자의 의료기관 취업을 10년간 금지하는 것은 위헌이라고 결정한 바 있다.   위헌 판결로 관련 법개정이 현실화됐지만 성범죄자의 취업 제한 기간이 완전히 풀리지는 않을 전망이다. 헌재는 위헌판결에도 불구하고 '10년의 제한 기간을 상한으로 두고 범죄 경중에 따라 제한 기간을 차등화하자'는 대안을 제시하는 등 성범죄자 취업에 일종의 '브레이크'는 있어야 한다는 입장을 내놓기도 했다.  아청법 등 성범죄자 취업제한제도를 소관하는 여성가족부는 취업 제한 기간을 차등화 등을 고심해왔다.   취업제한제도 위헌 결정 이후 공청회, 전문가 자문회의 등 각계 의견을 수렴해 청소년성보호법 개정안을 마련하고 지난해 11월 이를 국회에 제출했다.   개정안의 주요내용은 법원이 성범죄로 형 또는 치료감호를 선고하면서 동시에 취업제한 명령을 선고하되, 그 기간을 차등해 정하도록 했다.   취업제한기간을 10년으로 일률 적용하던 것을 법원이 죄의 경중 및 재범위험성을 고려해 30년 상한으로 취업제한 기간을 차등 선고하도록 한 것이다.  가령, 3년 초과 징역·금고형은 30년 이하, 3년 이하 징역·금고형은 15년 이하, 벌금형은 6년 이하로 차등하는 것이다.   종전 규정에 따라 성범죄 확정판결을 받은 사람에게도 형량에 따라 취업제한 기간에 차등을 두어 부과하도록 했다.   예를 들어 3년 초과 징역·금고형은 10년, 3년 이하 징역·금고형은 5년, 벌금형은 2년으로 했다.   하지만 개정안은 여성가족위원회에서 올해 2월 의결된 이래 10개월 넘게 국회 법제사법위원회를 통과하지 못한 채 아직까지 법제사법위원회 2소위에 계류 중이다.그만큼 논란의 여지가 많다는 얘기다.  여가부는 이같은 논란의 일단락 짓기 위해 오는 30일 오전 10시30분 세종문화회관에서 '성범죄자 취업제한제도 개선  방안'을 주제로 토론회를 개최한다.  이번 토론회에서 참석자들은 성범죄자 취업제한제도의 입법공백에 따른 문제점, 취업제한 기간을 포함한 개선 방안 등에 대해 2시간 가량 이야기를 나눈다.   원혜욱 인하대 법학전문대학원 교수가 좌장을 맡았으며, 여가부 법률자문관 안성희 검사가 기조 발제를 한다.  이어 탁틴내일 이현숙대표, 한국법제연구원 양태건 부연구위원, 법무법인 소헌 천정아변호사, 의사협회 자문 유현정변호사, 국회 입법조사처 조주은 입법조사관이 참석해, 성범죄자의 취업제한제도의 실효적인 운영 방안을 제시할 것으로 예상된다.  박난숙 여가부 권익증진국장은 ""헌법재판소 위헌 결정 이후 청소년성보호법 개정이 늦어지면서 학원·학교 등 아동·청소년 관련 기관에 성범죄자의 취업이 가능한 상황""이라며 ""아동·청소년이 성범죄에 노출될 수 있는 위험성이 높아진 만큼 빠른 시일 내에 국회에서 청소년성보호법이 통과되길 바란다""고 밝혔다.  sds1105@newsis.com▶ 뉴시스 빅데이터 MSI 주가시세표 바로가기 ▶ 뉴시스 SNS [페이스북] [트위터]&lt;저작권자ⓒ 공감언론 뉴시스통신사. 무단전재-재배포 금지.&gt; ]","['당연히 취업제한 해야지. 개인사업자인 의사도 진료관련 성범죄 저지르면 10년 면허 제한인데 하다못해 공공기관은 당연하지. 취업제한 당하기 싫으면 성범죄를 안하면 되잖아', '존나 시발 위헌이 이상한거 아니냐??? 개헌을 해서라도 낙인을 찍어야지. 지워지지 않게 뼈속까지 지져버려야지, 그래야지 범죄 안 저지르지', '', '', '성범죄자라고 알린다음 취직하는것 추천', '여성부는 그만 좀 나대라. 뉴스 좀 봐라. 여자가 남자 성추행으로 고소했다가 겨우겨우 남자가 사실 잘 증명해서 오히려 여자가 무고죄로 3년 징역받았다. 여성부의 압력땜에 여성의 일방적 주장만으로도 억울하게 남자가 옥살이 하게 만들어 놓고는.. 양심이 있으면 그만 좀 해라. 성폭행은 몰라도 성추행은 오해 및 논란의 여지가 있는게 사실이다. 개정안에 성추행은 빼라. 한국에 꽃뱀들이 얼마나 드들데는지 아나?', '헌재판사넘들 정치판결은 잘하더니만 꼭 저런 성범죄, 강력범죄는 참 이상하게 판결하더라. 피해자들은 얼마나 고통받는지 생각도 안하는듯. 성범죄자들이 유치원 학교에 득실득실 하길바라는거냐?', '여가부가 빠져야 모든 사안에서 공정성이 의심받지 않음.', '이참에 엿성부를 폐지하고 2조5호라는 미친법을 없애는게 답인가 봅니가 성인이 마음것 2d성인물을 못보게하는  헬조선......', '', '경중을 따져서 해야된다. 경미한것까지 밥줄이 끊기면 오히려 더 극단적 범죄로 치닫는다.', '애새끼보호법이나 폐지해라', '', '공공기관은몰라도  사기업은마음대로하게해라 잘못하면기업   이미지버린다', '', '', '', '난리네.... ██████████████████████████████████', '', '', '여가부가 하는것응 일단 난 반대', '', '', '', '여가부도같이해체되면 인정', '성범죄자 취업제한이 위헌이면 취업은 하되 직장내 성범죄사실 공고를 원칙으로 해라..범죄자 인권만 뭐같이 지켜주는 나라..', '가해자가 먼저 남의 인생 제한 걸어놨으니 취업제한 걸어놓는 대가를 얻는것이 당연한 논리 아니냐', '성범죄자를 아동들이 있는데 취업시키는건 안되지... 녀상가조옺부 새 대가리들이 뭘 안다고 여기다 끼워넣는거냐..??', '그럼 성범죄자인것 좀 알려주던가 .. 아니면 성범죄자사 재범 못하게 성범죄 형량을 높이던가 ..', '로리는 범죄 쇼타는 취향이니까', '꽃뱀 무고죄나 강화하길', '근데 이게 엄청 문제긴 해. 성범죄 뿐만 아니라 범죄자들은 물론 당연히 핸디를 빋아야 하는데, 일단 생계 유지가 안 되니까 갱생의 여지가 있는 애들도 재범하는 부분도 분명 있거든. 죄다 죽여버리거나 완전 격리된 별도 사회를 만들어 살게 할 거 아니면, 강력범죄자 사회복귀 시에 교정 여부 지속 확인 및 재범 방지를 위한 어떤 방법이 필요하긴 해. 뭐가 좋은지는 잘 모르겠지만 말이지...', '뉴시스는 유독 이런 페미니즘선동기사나 중국정보에 빠릅니다.', '범법행위같지도 않은 내용으로 전과자 딱지 붙이지 그렇지 꼴페미들 ㅉㅉ', '취업  이라....\n과연 몇명이나  정신차리고   사고를  안칠지', '', '성범죄자는 취업제한이 아니라 사회적 사형을 시켜야지', '여성부는 초등생 성폭행한 여교사 재취업시켜야해서 결정하기 힘들다.', '위헌? 법이 잘못했겠지?', '하여튼 이나라는 애를 안심하고 키울수없는 x같은 나라야. 이참에 쓸데없는짓한 헌법재판소 없애자.', '웃기네 뭘보고 재발위험이 없다는걸 판단하나. 모든직업을 제한하는게 아니고 몇군데 제한하는건데. 그런게 싫으면 성범죄를 안저지르면 되는거지. 정신줄 놓지마', '아예 헌법을 바꿔서 강혁범죄, 성범죄자들 취업제한 시켜버리면 위헌이라고 헛소리 못할듯...', '', '', '저러니까 성범죄자가 더 늘어나지... 출소후에 범행을 또 저지를 텐데...', '아니... 본질 자체를 이해 못하는거냐?? 성폭력사건의 가해자가 되면 취업도 못하고 신상도 공개되어 삶이 힘들어진다 고로 성폭행을 안하면된다 이거자나 왜 시x 개x77l들이 사고친뒤 뒷일까지 걱정해 그거 걱정할 시간있으면 오늘 저녁은 뭘해주면 애들이 좋아할지, 외식하면 뭐 먹을지나 고민해라 등x센드위치들아', '어떻게 이놈의 세상은 남이 자기 뺨을 때리면 반대쪽 뺨까지 내밀라는 말을 실천하는 사람은 하나도 없고 때리면 때렸다고 뭐라하고 만지면 만졌다고 뭐라하는 사람들 뿐이냐.다 자신에게 문제가 있으니까 일어나는 일이다. 그러니 꼭 가해자 처벌을 강화할 필요는 없다', '이런법 전부 화교들이 만든법입니다.동북공정중화사상을 가진 중국화교스파이들 자국토착민들이 멸족한 뉴질랜드와 똑같은 페미니즘으로 남녀갈등을 부추겨 저출산으로 한국민말살과 노예화를 하려는 것입니다.한족출신화교중국빨갱이들이 집단적으로 한국민남녀갈등 부추기다 적발된사실도 있습니다.심지어 한국페미니즘의 선봉에선여자가 인천차이나타운출신의 화교입니다.화교댓글부대를 활용 화교창간언론사이용 선동입법질해 광범위한기준으로 성범죄전과자들을 늘렸고 군가산점제폐지,군복무단축,간통죄폐지 등 예비장관후보인 국회의원이며 연고도 없는 서울화교밀집구에서 당선됐습니다.', '가해자보단 피해자를 생각해줘야지, 토론회다운 토론회를 해라.', '국회 일해라', '취업제한하되 제한된 기관에 취업하면 5년 이하의 징역 또는 2천 만원 이하의 벌금에 처하도록 하고 대전교도소 논산지소를 논산교도소로 승격 시키고 거기 수용해야 된다', '', '', '', '', '', ""성범죄하면 이마에다가 인두로 지져라 '아동성범죄'라고"", '나도여성이라 성범죄는 싹을 잘라야한다고본다\n하지만 꽃뱀도 있었다 여자본인이 남자와의 원나잇에 호응해놓고 직접성행위도 없었으면서 유사성행위로 고소하고 합의금청구한 사람도 봤다 이럴경우 가해자로 낙인찍힌 사람의 인생은..과연 범법자로 보기 타당한걸까..라는 생각도 든다', '', '조치가 너무늦어지네요 당신들 딸이그렇게 당햇는데도 이렇게 하구싶습니까  물어보구싶네요', '', '계집년과 북어는 3일에 한번찍 패야된다는 우리의 지혜로운 옛 조상님들 말씀이 있는데 아시죠?', '한남들 뒤져라', '저게 왜 위헌이냐????', '범죄자는 그럼 죽으라는 말이냐 그럴거면 걍 무기징역 때려라']",http://news.donga.com/3/all/20171030/87013058/1,https://n.news.naver.com/mnews/article/003/0008253591?sid=102
2017.10.31.,데일리팜,,"화성시약, 자선다과회 열고 이웃사랑 전해",,,http://www.dailypharm.com/News/232851,http://www.donga.com/
2017-10-30 03:05:44,대한급식신문,사회,"CJ프레시웨이, 복지사각지대 위기가정 기금마련 동참","[    [동아일보][저소득 아이들 ‘영웅’을 찾아]&lt;3&gt; 매달 160만원 후원 남미화 씨    틈틈이 복지시설을 찾아 기타 연주 봉사활동을 하는 남미화 씨. 그는 “주위의 도움이 없었다면 지금과 전혀 다른 인생을 살고 있을 것”이라며 매달 저소득층 아이들을 위해 160만 원을 후원하고 있다. 초록우산 어린이재단 제공슈퍼마켓 진열대에서 분유를 들었다 놓기를 여러 번, 주머니는 텅 비어 있었지만 굶고 있는 아기를 생각하면 돌아설 수가 없었다. ‘몰래 가방에 넣어 가면 모르지 않을까….’ 스물두 살 대학생이던 남미화 씨(36·여)가 잘못된 선택을 하기 직전, 가게 주인이 말을 건넸다. “연우(첫째 딸 이름) 엄마, 그냥 가져가고 (분윳값은) 다음 달에 줘.” 남 씨는 그날 분유를 아이에게 먹이면서 ‘살림이 피면 꼭 어려운 아이들을 돕겠다’고 다짐했다. 남 씨는 고등학교 2학년 때 자퇴했다. 뇌출혈로 지체장애가 생긴 어머니를 보살펴야 했다. 섬유공장에 취직해 생활비를 벌면서 작가의 꿈을 키워갔다. 뒤늦게 고졸 검정고시를 거쳐 한 대학 국문학과에 입학했지만 이듬해에 아버지까지 교통사고로 세상을 떠나면서 형편은 더 어려워졌다.당시 대학원생이던 지금의 남편을 만나 결혼했다. 아르바이트로 번 생활비 70만 원은 방세를 내고 교통비를 쓰고 나면 감쪽같이 사라졌다. 지역 유지의 자서전을 대필해주는 일을 하면서 그나마 형편이 차츰 나아졌다. 글 솜씨를 인정받아 퇴임 연설을 다듬어 달라고 요청하는 공직자나 단체장이 생겼다. 하지만 4년 전 또 한 번 고비가 찾아왔다. 우울증을 앓던 둘째 언니가 조카와 함께 숨을 끊었다. 그들의 시신을 발견한 게 남 씨였다. 시도 때도 없이 그들의 마지막 모습이 떠올랐다. 그때 남편이 “항상 낮은 곳을 보며 살자는 초심을 잊지 말자”고 얘기했다. 남 씨는 그 순간 깨달음을 얻었다. 다른 이의 인생을 글로 옮기다 보면 ‘나도 이렇게 베풀며 살아야지’라고 생각할 때가 많았는데, 더 미룰 이유가 없었다. 남 씨는 지난해 2월부터 초록우산 어린이재단을 통해 저소득층 아이들에게 160만 원을 후원하기 시작했다. 앞으로 5년간 총 1억 원을 기부할 예정이다. 세 아이를 키우는 동시에 대필 작업을 하다가도 짬이 나면 복지시설을 찾아가 기타 연주 봉사활동을 한다. 그의 모습을 보고 자란 열 살배기 둘째 아들은 최근 돼지저금통을 인근 복지센터에 가져다줬다. 남 씨가 후원하는 중학교 3학년 여자아이가 어느 날 보내온 100점짜리 성적표를 보고 내 아이의 일처럼 기뻐하는 순간, 그를 괴롭히던 환각이 사라졌다. “주위의 도움이 없었다면 저는 지금 전혀 다른 인생을 살고 있을지도 몰라요. 그렇게 생각하면 후원도 봉사도 전혀 힘들지 않아요.” 남 씨의 얼굴엔 웃음이 가득했다. 초록우산 어린이재단의 고액후원자 모임 ‘그린노블클럽’ 참여를 희망하는 후원자는 재단 상담센터(1588-1940, www.childfund.or.kr)로 문의하면 된다.조건희 기자 becom@donga.com▶ 동아일보 단독 / 동아일보 공식 페이스북▶ 핫한 경제 이슈와 재테크 방법 총집결ⓒ 동아일보 &amp; donga.com, 무단 전재 및 재배포 금지   ]","['슈퍼 아주머니도 마음 정말 좋으시다', '그동안 고생이 많으셨군요 ㅠㅠ\n전 저 혼자 힘들다고만 생각 하며\n살았는데 반성하게 됩니다\n쉽게 누굴 돕는다고 생각하기 힘든데\n어려움 속에서도 그런 생각을 하셨다는게\n대단하다고 생각해요\n전 생각만 가지고 있지 실천이 어려웠거든요\n당신과 같은 사람이 있어\n세상은 아직 살만한거 같아요\n항상 응원드립니다\n행운이 가득하길 바래요', '', '세상을 밝히는 좋은일이네요~\n아침에 듣는 기분좋은 소식입니다\n늘 행운이 깃드시길  바랍니다~', '이처럼 따뜻한 사람들이 있어\n살맛나는 세상이지 않을까요!\n험악하고 냄새나는 기사들사이에 \n가을아침 같은  기분좋은 내용입니다.', '대단하신 분이네요.존경합니다.', '베풀며 살아가는 모습이 아름답습니다.\n삶을 불평하고 탓하며 살아가는 지금의 모습에 다시 힘을 불어넣는 기사인 것 같습니다.', '세 아이키우면서도 행복하게 사는모습. 요즘 징징대는 맘들에게 귀감이되네요', '오늘 병원에 가야하는데 너무 두렵다. 내 주머니에 있는 돈은 4천원...그나마 2만원은 어제 밤 해드폰 꺼내면서 잃어버린듯 없다. 병원비는 4천이 넘을텐데...약값도 비쌀텐데...혹시 치료가 커지면 몇십만원일텐데...오늘 큰얘가 친구를 만난다면 용돈을 줘야하는데...이번주 그나마 알바비는 다음주말에 준다는데...비참하네...이제 저분처럼 분유를 훔지면 주인은 과연 어떻게 나올까? 아침부터 그냥 눈물이 나온다. 죽고싶다.', '목에 칼이 들어와도 기부는 안해. 기부해서 그 돈들이 뒷 호주머니로 들어가는지 어쩐지 알 수가 없으니.', '저렇게 남편과 함께 부부가 좋은 목표를 바라보며 서로 힘을 줄 수 있다는 게 참 멋지고 아름답네요!', '아름다운 동화같은 삶을 사시네요^^', '역시 사람은 아무리힘들어도 남을 도우면서 사는게 맞는거같아', '존경합니다..', '이런사람들이있어 아직은 살만한 세상이라생각된다', '', '후원자 모집? 자기돈으로 후원해야지. 남의돈으로 한다는거잔아. 이영학사건과 별개로 이런건 없어졌으면 좋겠다. 검증이 안되잔아. 후원하려면 후원자가 힘들더라도 직접 하는게 좋지않을까?', '앞으로 승승장구 하시길 빕니다!!', '초록우산 광고같은데..? 맨마지막줄 고액후원자모임 가입하라고 써있네', '👍🏻', '', '기부 절대 안한다..\n기부금이 어떻게 쓰여지는지 알 방법이 없기 때문...', '', '많이 그리워했고... 많이 보고싶었는데  이제서야 만나는구나...  처음에는 정말 너무 충격이어서 뛰는 심장을 주체할수 없었어... 그때 왜 사실대로 이야기 하지 않았을까? 내가 너에게 믿음을 주지 못했었다는 반증일까? 늦었지만 이제야 진실을 알게 됐네.... 후... 차라리 모르는 편이 더 아름다운 결말이었을까....아님 이제 나에게도 일말의 마음에 안식을 가질수 있는 면죄부가 주어진 걸까......\n\n암쪼록 화목한 가정도 꾸리고 좋은 일도 많이 하고 사는 모습 보기 좋다...\n\n행복하고 건강하게 잘 살기를 바랄께.... ...', '', '오랫만에 가슴따뜻한 이야기입니다.', '', '', '', '', '인간이냐 천샤냐? 진정훈훈한부부네~~건강히잘들사세요!', '수상해..음..잘기억해둬야 겠어', '닭,순실뇬들아 보고있냐?? 니들이런기사보면 무슨생각안드냐??', '기부재단에말고직접주변에어려운이에게\n그리고해외기부왜하는지도대체', '', '', '']",http://www.fsnews.co.kr/news/articleView.html?idxno=22969,https://n.news.naver.com/mnews/article/020/0003104339?sid=102
2017.10.30.,뉴데일리,,"서울시, 장애인 위한 법률 핸드북 ‘장애와 복지’ 발행",,,http://www.newdaily.co.kr/news/article.html?no=359615,http://www.dailypharm.com
2017.10.30.,뉴스토마토,,서울 은평구 진관동 313-11번지 일대 집단취락지구 지정,,,http://www.newstomato.com/ReadNews.aspx?no=785022,http://www.fsnews.co.kr
2017.10.30.,경남일보,,"베트남 총리, 태광실업 현지 공장 방문",,,http://www.gnnews.co.kr/news/articleView.html?idxno=311518,http://www.newdaily.co.kr/
2017.10.27.,뉴시스,,"한국지엠한마음재단, 패럴림픽 국가대표 차량 지원",,,http://www.newsis.com/view/?id=NISX20171027_0000130173&cID=13001&pID=13000,http://news.etomato.com/
2017.10.30.,매일일보,,"[대한민국이 좋다] 스카이라이프, 울릉도·독도에 위성방송 후원",,,http://www.m-i.kr/news/articleView.html?idxno=354670,http://gnnews.co.kr
2017.10.30.,충청타임즈,,복지서비스 기관·지역 주민 소통,,,http://www.cctimes.kr/news/articleView.html?idxno=508418,http://www.newsis.com
2017.10.22.,중도일보,,"세종시 사회복지공무원, 복지시설 자원봉사",,,http://www.joongdo.co.kr/main/view.php?key=20171022010006242,http://www.joongdo.co.kr
2017.10.31.,전북일보,,민혜경 여사와 오경진 여사,,,http://www.jjan.kr/news/articleView.html?idxno=1141231,http://www.jjan.kr
2017.10.30.,중부매일,,"국회 보건복지위, 대우꿈동산 현장방문",,,http://www.jbnews.com/news/articleView.html?idxno=815996,http://www.jbnews.com
2017.10.30.,신아일보,,"한돈협회 영주지부, 한돈 600kg 기증",,,http://www.shinailbo.co.kr/news/articleView.html?idxno=1009875,http://www.shinailbo.co.kr/
2017.10.30.,약사공론,,"""노인환자 안전 위한 신체억제대, 노인학대용 사용""",,,http://www.kpanews.co.kr/article/show.asp?idx=188506&table=article&category=C,http://www.kpanews.co.kr
2017.10.30.,부산일보,,"베트남 총리 최근 '태광비나' 방문, 박연차 회장에 전폭적 지원 약속",,,http://news20.busan.com/controller/newsController.jsp?newsId=20171030000259,http://www.busan.com/
2017-10-30 23:01:25,불교공뉴스,사회,"청주시시설公, 『1사 1경로당 자매결연』협약 체결","[         응우옌쑤언푹(왼쪽) 총리가 박연차 태광실업그룹 회장과 의견을 나누고 있다.  태광실업 제공      김해에 본사를 둔 태광실업이 베트남 현지에서 모범적 투자기업으로 인정 받아 베트남 정부의 전폭적 지원을 받을 전망이다.베트남 응우옌쑤언푹 총리는 최근 호찌민 인근에 있는 태광실업 현지 신발공장인 '태광비나'를 방문해 박연차 태광실업그룹 회장과 양국 간 사업 등에 대한 의견을 나눴다.태광비나는 현지인의 관리자 및 임원을 육성하고 유치원, 사내병원, 직원 전용마트 등의 대형 복지시설을 운영해 베트남 정부로부터 노사관계 대표 우수기업으로 선정됐다. 또 태광실업그룹은 1000만 달러(113억 원)를 기부해 베트남 끼엔장성 푸꾸옥 섬에 '태광 푸꾸옥 기술전문대학'을 건립, 지난 27일 베트남 정부에 기증했다. 응우옌쑤언푹 총리는 이 자리에서 남딘 발전사업 등 태광실업이 현지에서 추진 중인 다양한 신규사업에 대한 전폭적 지원을 약속했다. 응우옌쑤언푹 총리는 ""태광비나는 고용창출과 훌륭한 노사관계를 정립한 가장 모범적인 베트남 투자기업""이라며 ""앞으로 베트남 국민 기업으로 성장시켜 달라""고 말했다. 정태백 기자 jeong12@       ]",[],http://www.bzeronews.com/news/articleView.html?idxno=327254,https://n.news.naver.com/mnews/article/082/0000750320?sid=102
2017.10.31.,대구신문,,금복복지재단 사랑나눔봉사단,,,http://www.idaegu.co.kr/news.php?code=pe03&mode=view&num=235303,http://www.bzeronews.com
2017.10.30.,문화뉴스,,"서울시, 알기 쉬운 복지 법률 시리즈 '장애인 복지 매뉴얼' 발간",,,http://www.munhwanews.com/news/articleView.html?idxno=84935,http://www.idaegu.co.kr
2017.10.31.,불교공뉴스,,"유성구, 온천수 노노케어 건강관리 사업 더 안전하게",,,http://www.bzeronews.com/news/articleView.html?idxno=327347,http://www.munhwanews.com
2017.10.30.,국제뉴스,,한돈협회 영주시지부 한돈 600kg 기증,,,http://www.gukjenews.com/news/articleView.html?idxno=811594,http://www.gukjenews.com/
2017.10.31.,불교공뉴스,,"유성구, 온천수 노노케어 건강관리 사업 더 안전하게",,,http://www.bzeronews.com/news/articleView.html?idxno=327347,http://www.bzeronews.com
2017.10.26.,국민일보언론사 선정,,"트럼프, 한국 와서 뭘 하려고… ""당신들 놀라게 될 것""",,,http://news.kmib.co.kr/article/view.asp?arcid=0011851890&code=61111111&cp=nv,http://www.kmib.co.kr/
