Date,Press,Category,Title,Content,Comment,URL_Origin,URL_Naver
2017.10.30.,한국경제,,[2017 올해의 공감경영 대상] 2만5000여명 대상 항공안전체험교육,,,http://news.hankyung.com/article/2017103054261,http://news.sbs.co.kr/
2017-10-26 16:15:19,시사저널,사회,[Today] 공지영 “봉침 목사 사건 배후에 유력 정치인 있다”,"[     자유한국당이 오늘(26일) 방송통신위원회의 방송문화진흥회(방문진) 보궐이사 선임에 반발해 국회 국정감사에 전면 불참하면서 국정감사가 줄줄이 파행했습니다.한국당은 오늘 오전 방통위의 방문진 보궐이사 선임을 저지하기 위해 정부과천청사에 있는 방통위를 항의 방문했다가 뜻을 이루지 못하자 국정감사 중단을 전격 선언해 국감이 중지되거나 반쪽으로 진행됐습니다.특히 KBS와 EBS를 대상으로 진행될 예정이었던 과학기술정보방송통신위원회의 국감은 한국당 과방위원들이 방통위 항의 방문으로 국감장에 나타나지 않으면서 오전에는 회의가 아예 열리지 않았습니다.과방위는 오후 2시 겨우 개회했으나 시작과 동시에 1시간 가량 여야 간에 거친 공방을 벌이다 감사는 결국 중지됐습니다.한국당 의원들은 긴급 의원총회 등을 이유로 정회를 요청했고, 이에 다른 당이 반대하면서 대립이 계속됐습니다.한국당 김성태 의원은 방통위의 방문진 보궐이사 선임에 대해 ""반민주적인, 반헌법적인 과정이다. 그 결과는 원천무효가 돼야 한다""면서 ""과방위의 한국당 위원들도 긴급한 논의가 필요한 시기이기 때문에 정회를 요청한다""고 말했습니다.이에 대해 민주당 박홍근 의원은 ""오늘 국감은 간사 간의 합의를 통해 위원회의 의결로 정해진 일정""이라며 ""그런데도 한국당이 일방적으로 (합의를) 파기했으면 최소한의 유감이나 사과를 하는 게 도리인데 한마디도 없이 오자마자 정회를 신청하는 것은 납득이 안 된다""고 지적했습니다.국민의당 신용현 의원은 민주당과 한국당을 싸잡아 비판했습니다.그는 ""모든 사태가 충분히 예견됐음에도 꼭 오늘 아침에 몰아서 갑작스럽게 방문진 이사를 임명해야 했는가에 대해선 정부·여당에도 일말의 책임이 있다""면서 ""(아울러) 국감은 1년에 한 번 행정부를 견제할 수 있는 기간으로 정회한다는 것은 국민의당 입장에서는 말이 안 된다""고 밝혔습니다.대전고등검찰청 등에 대한 법제사법위원회의 국정감사는 한국당이 빠진 상태에서 민주당, 국민의당, 바른정당 등이 참여한 상태에서 그대로 진행됐습니다.국감 사회는 한국당 소속 권성동 법사위원장 대신 민주당 간사인 금태섭 의원이 맡았습니다.행정안전위원회는 오늘 오전 국회에서 민주화운동기념사업회·일제 강제동원피해자지원재단·한국자유총연맹 등 10개 기관에 대한 국정감사를 진행했으나 오후에는 한국당 불참으로 파행됐습니다.산업통상자원중소벤처기업위원회는 한국당이 불참한 가운데 국정감사를 진행했습니다.앞서 한국당 간사인 이채익 의원은 오전 국감에서 ""한국당은 방문진의 일방적인 이사 선임에 대처하기 위해 지금부터 전원 국감을 중단하기로 했다""고 밝혔으며, 곧이어 소속 의원 11명은 국감장을 떠났습니다.정무위원회도 한국당이 불참한 가운데 오후 2시 50분 정부 출연연구원(출연연) 23곳에 대한 국정감사를 속개했습니다.한국당 의원들은 오전 국감 도중 당 원내 지도부의 '국감 중단 결정'에 줄줄이 퇴장했습니다.농림축산식품해양수산위원회도 한국당 없이 국정감사가 진행됐습니다.한국당 의원들은 국정감사 일환으로 진행된 현장시찰에도 불참했습니다.부산지방국세청(지방1반)과 대전지방국세청(지방2반)으로 각각 나눠서 진행한 기획재정위원회의 오후 국감은 한국당 불참 속에 이뤄졌습니다.특히 지방1반 국감에선 국민의당 간사인 김성식 의원이 한국당 조경태 위원장으로부터 사회권을 넘겨받기도 했습니다.보건복지위원회는 충북 청주시 오송첨단의료복합단지와 충남 천안시의 장애인복지시설에서 현장시찰을 진행했습니다.하지만 복지위 소속 한국당 의원들의 경우 국감 보이콧 논의를 위한 의총 소식이 전해지자 오후 일정에는 불참한 채 서울로 복귀했습니다.환경노동위는 한국당 의원들이 불참한 가운데 민주당, 국민의당, 바른정당, 정의당 의원들만 참석한 채 울산 한국산업안전공단에서 국정감사를 속개했습니다.교육문화체육관광위원회는 평창동계올림픽 준비상황 점검을 위해 진천 선수촌과 평창 올림픽 경기장 현장시찰을 진행했습니다.그러나 한국당이 오후 의원총회를 열기로 하면서 한국당 소속 의원들은 진천까지만 동행하고 국회로 복귀했습니다.다만 한국당 간사인 염동열 의원의 경우 지역구인 평창까지 동행한 후에 국회로 바로 복귀키로 했습니다.한편 외교통일위 아주반은 일본에서 주일 한국대사관을 대상으로 국정감사를 진행했고 국감에는 한국당 서청원 의원 등도 참석했습니다. 유영규 기자(ykyou@sbs.co.kr)☞ [나도펀딩] 병원 어린이 환아복 후원하기☞ [취재파일 스페셜] 5.18 헬기 사격, 조종사의 증언※ © SBS &amp; SBS I&amp;M. : 무단복제 및 재배포 금지   ]",[],http://www.sisapress.com/article/171938,https://n.news.naver.com/mnews/article/055/0000580096?sid=102
2017.10.30.,부산일보,,감천1동 감내골씨앗나눔봉사단 식사 봉사,,,http://news20.busan.com/controller/newsController.jsp?newsId=20171030000142,http://www.bzeronews.com
2017.10.24.,노컷뉴스언론사 선정,,취미활동 블로그? 알고보니 軍 '댓글 부대' 위장 작전,,,http://www.nocutnews.co.kr/news/4865459,http://www.nocutnews.co.kr
2017-10-24 15:11:27,에이빙뉴스,정치,"한국지엠한마음재단, 패럴림픽 국가 대표 차량 지원","[ 김해영 의원 ""사이버사 대원들, '블로그' 만들어 정치공작…월 25만원 챙겨""[CBS노컷뉴스 윤홍집 기자]    군 사이버사령부 '2013년 1월 자가 대외활동 예산집행 증빙서류' 일부. (자료=김해영 의원실 제공)국군 사이버사령부 심리전단 요원들이 2012년 대선 직후 네이버에 개인 블로그까지 개설해 정치공작을 벌였고, 대외활동비 명목으로 총 2875만원을 지급받은 것으로 알려졌다.24일 더불어민주당 김해영 의원이 공개한 '2013년 1월 자가 대외활동 예산집행 증빙서류(특별취급 문건)'에 따르면 공작에 개입한 사이버사 심리전달 요원 115명은 계급과 성명, 사이트명, 블로그명과 함께 작전지역을 기입하고 매달 25만원씩 수당을 받았다. 해당 비용은 국방부 정보예산에서 집행됐고 요원들은 돈을 받으며 서류에 자필 서명까지 한 것으로 드러났다.'현금 수령 확인내역'을 보면 심리전단 지휘부에 25만 원(1명), 1과(부대 지원업무)에 375만 원(15명), 1대(국내정보 수집)에 625만 원(25명), 2대(댓글작전 수행)에 1225만 원(49명), 3대(동영상 등 매체제작)에 275만 원(11명), 4대(해외정보 수집)에 350만 원(14명) 등 총 2875만 원이 대외활동비 명목으로 요원들에게 지급됐다.작전지역은 자가(자택) 78곳, 관사 21곳, 레스텔(군복지시설) 등 16곳으로 나타났다. 주간이나 근무일에는 사무실에서 댓글 공작을 수행하고, 야간이나 휴일에는 주거지에서 블로그를 이용해 정치 공작을 벌였다.    사이버사 심리전단 요원이 만든 것으로 추정되는 정치공작 블로그. 현재 '삭제 또는 비공개' 상태로 전환돼있다. (사진=온라인 캡처)사이버사 요원들은 정치공작을 개인의 취미활동으로 위장해 블로그를 만들었다. '사는 이야기(7급·금모씨)' '영화와 팝콘(6급·차모씨)', '아이러브EPL(8급·한모씨)' 등 문화·체육 분야를 다루거나, '우린 중국어(8급·장모씨)', '음악도 듣고 일어도 배우고(7급·유모씨)' 등 외국어 분야를 다루는 것처럼 포장하기도 했다.댓글 공작을 지휘한 이태하 전 심리전단장은 네이버에 'Albatross'라는 블로그를, 댓글작전을 수행한 심리전단 2대 책임자인 박모 서기관은 네이버에 '마키아벨리군주론'이라는 블로그를 개설했다.현재 해당 블로그들은 대부분 활동이 중단된 상태다. 이 중 일부는 군이나 북한 관련 글이 남아있지만 개인정보는 담겨 있지 않은 것으로 알려져 있다.김해영 의원은 24일 보도자료를 통해  ""사이버사는 2013년 국방부로부터 블로그 활동에 사용할 대외활동비 명목으로 정보예산 6억8100만원을 배정받았다""며 ""첫 번째 댓글 수사 당시 국방부 조사본부와 검찰단 수사에서 불법적인 SNS활동의 실상이 제대로 드러나지 않은 만큼 이번에는 제대로 진상을 밝혀 일벌백계 해야 한다""고 밝혔다.banaffle@cbs.co.kr저작권자 © CBS 노컷뉴스(www.nocutnews.co.kr) 무단전재 및 재배포 금지   ]",['털어서 먼지밖에 안 나오니 논두렁시계와\n털면 털수록 쏟아져 나오는 쥐닥들은  언제나 나오는것들은 빙산의 일각이더라'],http://kr.aving.net/news/view.php?articleId=1381351&Branch_ID=kr&rssid=naver&mn_name=news,https://n.news.naver.com/mnews/article/079/0003025201?sid=100
2017.10.30.,충청일보,,국회 보건복지위원회 국정감사 현장시찰,,,http://www.ccdailynews.com/news/articleView.html?idxno=943160,http://kr.aving.net/
2017.10.30.,쿠키뉴스,,"고성군, 2018년 녹색자금지원 공모사업 선정…1억3000만원 확보",,,http://www.kukinews.com/news/article.html?no=496353,http://ccdailynews.com
19면 1단,헤럴드경제,,"롯데손보, 아동시설 남산원 증축 2000만원 후원",,,http://news.heraldcorp.com/view.php?ud=20171027000401,http://www.kukinews.com
2017.10.30.,G밸리뉴스,,"'공공의 적' 화제 급부상, 끔찍한 가족간의 범죄에 경종",,,http://www.gvalley.co.kr/543912,http://www.heraldbiz.com/
2017-10-27 11:22:00,경향신문,경제,"해병대 ""뚝배기 집게로 혀뽑기 가혹행위 부사관 구속영장""","[    롯데손해보험(대표 김현수ㆍ사진 오른쪽)은 26일 서울 중구 본사에서 롯데손해보험 김현수 대표, 남산원 박흥식 원장이 참석한 가운데 아동복지시설 남산원에 후원금을 전달하는 기념식을 가졌다.이날 행사에서 남산원 아동이 더욱 쾌적하고 좋은 환경에서 생활할 수 있도록 남산원 본관 증축비 2000만원을 후원했다.    또한 후원금 전달식 후 롯데손해보험 샤롯데봉사단은 남산원을 방문해, 아동 돌봄 및 환경봉사를 통해 그 의미를 더했다. 샤롯데봉사단은 월 2회 남산원을 방문, 지속적으로 돌봄 및 환경봉사를 수행하고 있다.문호진 기자/mhj@heraldcorp.com▶ 생활용품 알뜰하게 사는 법 럭비(LUCK BE)▶앞서가는 젊은 경제신문 친구맺기 ▶오늘의 운세 날씨 - Copyrights ⓒ 헤럴드경제 &amp; heraldbiz.com, 무단 전재 및 재배포 금지 -   ]",[],http://news.khan.co.kr/kh_news/khan_art_view.html?artid=201710261549001&code=910302,https://n.news.naver.com/mnews/article/016/0001307641?sid=101
2017.10.31.,이뉴스투데이,,"[평창올림픽 G-100일] 최명희 강릉시장 ""평창올림픽 성공개최 국민들의 동참과...",,,http://www.enewstoday.co.kr/news/articleView.html?idxno=1122852,http://www.gvalley.co.kr/
2017.10.27.,뉴시스,,김동연 부총리 “전통시장 혁신과 상생에 지혜 모으겠다”,,,http://www.newsis.com/view/?id=NISX20171027_0000130785&cID=10805&pID=10800,http://www.khan.co.kr/
2017-10-26 16:02:20,남도일보,정치,경찰서 배관공사 건설업체 협박 갈취한 50대 입건,"[    해병대는 복지관 시설에 근무하는 병사들에게 구타 및 갖가지 가혹 행위를 한 부사관 1명에 대해 구속영장을 신청했다고 26일 밝혔다. 해병대는 비위 혐의를 묵살한 간부 4명 전원도 보직해임해 조사 중이다.     해병대는 이날 “지난 21일 가혹 행위를 최초 인지해 해병대사령부 차원에서 직접 헌병을 투입해 수사를 진행하고 있다”며 “구타 및 가혹 행위 부분이 사실인 것으로 확인되어 어제 비위 행위 부사관인 ㄱ 중사에 대해 구속영장을 신청했다”고 설명했다. 피해 병사는 6명인 것으로 알려졌다.구속영장이 신청된 ㄱ 중사는 ‘말을 듣지 않고 장난을 쳤다’는 이유 등을 내세워 병사들에게 뚝배기 집게로 혀 잡아당기기와 같은 가혹행위를 저지른 것으로 조사됐다. 또 점심을 같이 먹지 않고 먼저 먹었다는 이유로 주방용 가위를 병사 입과 귀에 대고 자른다고 위협하는가 하면, ㄱ 중사가 웃으며 노래를 부르는 동안 병따개를 손가락에 끼워 꺾기를 한 것으로 확인됐다. 해병대 관계자는 “병사들은 ㄱ 중사가 야구 방망이로 팔다리를 때렸고, 벽에 포스터를 붙일 때 사용하는 목공용 공구인 ‘타카’로 자신들을 향해 총을 쏘듯 쐈다고 진술했다”고 말했다.해병대는 “해당 복지관 시설의 가혹 행위를 묵살한 관리관 등 간부 4명 전원을 보직에서 해임해 조사하고 있다”며 “조사 중에 200만원 상당의 주류를 사적으로 사용하는 등 일부 편법 행위가 포착되어 전면적인 수사를 추가로 진행하고 있다”고 밝혔다. 이 복지관은 해병대사령부 본부대 본부중대가 직접 관리하는 군 복지시설이다.해병대는 해당 사건이 지난 8월에 발생했고, 피해 병사들의 제보가 있었음에도 상부에 보고되지 않은 이유에 대해서도 조사중이다. 이 시기는 박찬주 육군 대장의 ‘공관병 갑질’과 관련한 전군의 전수조사가 진행됐던 때였다.해병대는 “장병들의 최초 제보가 있었음에도 이를 상부에 보고하지 않은 감찰실 소령을 확인했다”며 “보고 누락 경위 등을 소상히 파악해 적법하게 처벌할 예정”이라고 설명했다. 당시 사령부 감찰팀은 병사들에게 “우리가 다 해결해줄테니 문제 되는 것들 다 써 내라”고 했으나 병사들이 간부들의 가혹행위와 근무태만 등을 적은 설문조사지를 받아간후 군 수사기관이 나서기 전까지 두달동안 이를 묵살한 것으로 전해졌다.해병대는 이번 사건과 관련해 지난 24일부터 모든 복지시설을 포함한 전 부대 동시 정밀 부대진단을 실시하고 있다. 해병대는 “11월 1일에는 해병대 인권자문위원회를 개최해 위원회에서 제기하는 권고사항을 추가 조치할 예정”이라고 밝혔다.&lt;박성진 기자 longriver@kyunghyang.com&gt;▶ 경향신문 SNS [트위터] [페이스북] ▶ [인기 무료만화 보기]©경향신문(www.khan.co.kr), 무단전재 및 재배포 금지 ]","['부사관 좀 잘 뽑아라, 저런 짓하면 구속된다는 사실도 모르고 시대가 어떻게 바뀌는 지도 모르는 사람을 뽑으니까 저렇게 되는 거다.']",http://www.namdonews.com/news/articleView.html?idxno=450425,https://n.news.naver.com/mnews/article/032/0002827693?sid=100
2017.10.27.,뉴시스,,[울산소식]공무원가족봉사단 농촌일손돕기 등,,,http://www.newsis.com/view/?id=NISX20171027_0000130351&cID=10814&pID=10800,http://www.newsis.com
2017-10-27 10:37:20,KBS,사회,‘뚝배기 집게로 혀를’…해병대 가혹행위 부사관 영장,"[     【울산=뉴시스】조현철 기자 = 울산시는 27일 울산시공무원가족봉사단 40여명이 28일 울주군 삼남면 단감농장 농가에서 농촌일손돕기 자원봉사활동을 한다고 밝혔다. 지난 2008년부터 실시된 행복브랜드 자원봉사 BEST ULSAN 사업의 하나인 공무원 가족 정기 자원봉사는 울산시청 공무원과 가족이 모여 분기 1회 이상 봉사활동하고 있다. 올해 4번째이다. 농촌일손돕기 자원봉사는 고령화로 일손이 부족한 농가에 조금이나마 실질적인 도움을 줄 수 있어 보람을 느낄 수 있어 인기다. 울산시 공무원 가족봉사단은 2010년부터 사회복지시설 및 일손이 부족한 농가를 방문해 자원봉사활동을 펼치고 있다. ◇건축상 대상 '매곡도서관' 선정올해 울산시 건축상 대상에 '매곡도서관'이 선정됐다.심사위원회(9명)는 지난 6월 1일부터 8월 1일까지 접수된 44개의 작품에 대해 9월 27일 서류 심사에 이어 9월 28일 현장심사를 거쳐 최종 7개 작품을 선정했다. 평가 항목은 디자인의 독창성과 상징적 이미지, 주변 경관과 조화 여부, 기능별 공간구성의 효율성 등이다. 대상을 받은 매곡도서관은 (주)아이디알건축사사무소(건축사 전보림)가 설계한 북구 매곡로 138-19 일원에 위치하고 있다. 장변인 지형을 정확히 활용해 입체적 설계방식이 탁월하고 마을 공공도서관의 기능에 충실하다는 평가를 받았다. 최우수상은 주거부문과 일반부문으로 나눠 선정했다. 주거부문 최우수상은 (주)온건축사사무소(대표 정웅식)가 설계한 중구 유곡동 '민휘정'(하늘이 빛나는 뜰)이 뽑혔다. 프라이버시와 생태적 환경, 경관요소의 입체적 반영과 공간의 가변성이 우수하며 재미있는 공간을 연출했다는 심사평을 받았다. 일반부분 최우수상은 울주군 간절곶에 위치한 '팬타곤'이 결정됐다. (주)온건축사사무소(대표 정웅식)가 설계한 근린생활시설로서 비어있는 공간을 만들어 외부와 소통하도록 구성한 것이 호평 받았다. 우수상은 공공부문 북구 '쇠부리체육센터', 일반부문 동구 오피스텔 'VERTICAL OCEAN', 주거부분 울주군 'CLIFF house'와 '어쩌다이웃@두동'이 선정됐다. 오는 11월 2일 제1회 건축문화제 개막식에서 시상한다. 선정된 건축물에는 동판 부착과 건축주 및 설계자에겐 상패를 수여한다.울산시 건축상은 시민이 삶 속에서 향유할 수 있는 건축문화의 기반을 마련하고 도시브랜드 가치를 높이기 위해 1996년부터 도시 품격을 높인 우수 건축물에 대해 시상한다.◇화합의 장 '2017 자활한마당' 개최한국지역자활센터협회 울산지부(지부장 이영덕)는 27일 오전 10시 30분 근로자종합복지회관에서 울산지역 5개 지역자활센터 자활근로 참여자 및 자활기관 종사자 등 400여명이 함께한 가운데 '2017 자활한마당' 행사를 개최한다.행사는 제1부 기념식(시상 등)과 제2부 지역 문화 및 역사유적지 탐방으로 진행된다.  올해 자활사업 유공자로 북구지역자활센터 배소영 팀장(울산시장상) 등 4명의 자활사업 실무자와 자활근로 참여자가 수상한다.2부에선 울산대교 전망대, 대왕암공원, 언양읍성, 외고산 옹기마을 등 문화 및 역사유적지 등을 탐방한다.  한편 기초생활수급자 및 차상위계층 등 저소득층의 자활사업을 지원하는 지역자활센터 5곳이 운영되고 있다. 올해 448명이 자활사업에 참여했다.   jhc@newsis.com▶ 뉴시스 빅데이터 MSI 주가시세표 바로가기 ▶ 뉴시스 SNS [페이스북] [트위터]&lt;저작권자ⓒ 공감언론 뉴시스통신사. 무단전재-재배포 금지.&gt; ]",[],http://news.kbs.co.kr/news/view.do?ncd=3564081&ref=A,https://n.news.naver.com/mnews/article/003/0008250629?sid=102
2017.10.27.,KBS,,“뚝배기 집게로 혀를”…해병대 가혹행위 부사관 영장,,,http://news.kbs.co.kr/news/view.do?ncd=3563904&ref=A,http://news.kbs.co.kr/
2017-10-27 12:19:44,매일경제,정치,"SPC그룹, 지역아동센터와 쉐이크쉑서 `생일파티`","[                &lt;앵커 멘트&gt; 군부대 가혹행위가 또 적발됐습니다. 이번엔 병들에게 집게와 야구방망이 등으로 가혹행위를 한 해병대 부사관에게 구속영장이 신청됐습니다. 김성진 기자의 보도입니다. &lt;리포트&gt; 가혹행위가 이뤄진 곳은 경기도 화성 해병대사령부 인근 복지시설입니다. 올해 초  이 복지시설에 부임한 모 중사는  병사 6병에게 집게와 가위, 야구 방망이 등으로 가혹행위를 한 혐의를 받고 있습니다. 병사들은 조사에서 이 중사가 뚝배기를 집을 때 쓰는 집게로 혀를 집었고, 야구 방망이로  머리와 팔꿈치 등을 쳤다고 진술했습니다. 군 당국은  구속영장을 신청했습니다. 이 복지시설 식당과 객실, 목욕탕 등엔 간부와 병사 등 20여명이 근무하고 있습니다. 해병대사령부 감찰실은 지난 8월 이미 문제점을 파악한 것으로 조사됐습니다. 당시  전 부대를 대상으로 특별 부대 진단을 했는데 일부 가혹행위가 있었다는 설문조사 결과가 나왔는데도 감찰을 하지 않았다는 겁니다. 군 수사당국은 보고 누락 감찰담당관, 또 복지시설 간부 4명을 보직해임했습니다. 해병대는  피해 장병들을 보호하지 못해 매우 유감스럽다며, 가해자를 법과 규정에 따라 엄정 처리하고 병영 문화를 혁신하기 위한 특단의 대책을 시행하겠다고 말했습니다. KBS 뉴스 김성진입니다.김성진기자 (sjkim9kbs@gmail.com)▶ KBS뉴스와 친구가 돼 주세요▶ 리얼한 영상, 생생한 뉴스 현장 보기[저작권자ⓒ KBS 무단복제-재배포 금지]   ]",[],http://news.mk.co.kr/newsRead.php?year=2017&no=708192,https://n.news.naver.com/mnews/article/056/0010515548?sid=100
2017.10.27.,뉴시스,,"[익산소식]시, 2017 재난대응 안전한국훈련 실시 등",,,http://www.newsis.com/view/?id=NISX20171027_0000130578&cID=10808&pID=10800,http://news.kbs.co.kr/
2017-10-27 06:29:38,NSP통신,정치,"대구 북구, 2018년 ‘녹색자금 지원사업’ 선정","[                &lt;앵커 멘트&gt; 군부대 가혹행위가 또 적발됐습니다. 이번엔 병사들에게 집게와 야구방망이 등으로 가혹행위를 한 해병대 부사관에게 구속영장이 신청됐습니다. 김성진 기자의 보도입니다. &lt;리포트&gt; 가혹행위가 이뤄진 곳은 경기도 화성 해병대사령부 인근 복지시설입니다. 올해 초  이 복지시설에 부임한 모 중사는  병사 6병에게 집게와 가위, 야구 방망이 등으로 가혹행위를 한 혐의를 받고 있습니다. 병사들은 조사에서 이 중사가 뚝배기를 집을 때 쓰는 집게로 혀를 집었고, 야구 방망이로  머리와 팔꿈치 등을 쳤다고 진술했습니다. 군 당국은  구속영장을 신청했습니다. 이 복지시설 식당과 객실, 목욕탕 등엔 간부와 병사 등 20여명이 근무하고 있습니다. 해병대사령부 감찰실은 지난 8월 이미 문제점을 파악한 것으로 조사됐습니다. 당시  전 부대를 대상으로 특별 부대 진단을 했는데 일부 가혹행위가 있었다는 설문조사 결과가 나왔는데도 감찰을 하지 않았다는 겁니다. 군 수사당국은 보고 누락 감찰담당관, 또 복지시설 간부 4명을 보직해임했습니다. 해병대는  피해 장병들을 보호하지 못해 매우 유감스럽다며, 가해자를 법과 규정에 따라 엄정 처리하고 병영 문화를 혁신하기 위한 특단의 대책을 시행하겠다고 말했습니다. KBS 뉴스 김성진입니다.김성진기자 (sjkim9kbs@gmail.com)▶ KBS뉴스와 친구가 돼 주세요▶ 리얼한 영상, 생생한 뉴스 현장 보기[저작권자ⓒ KBS 무단복제-재배포 금지]   ]","['해병대 얼굴에 똥칠하는 새끼 저런 새끼가 면접 보고 적성 검사에서 합격했다니 당장 사형시켜라..나라를 지키라고 보냈더니 죄없는 후임들만 잡고 앉아있네 붕 신 쉐 끼', '그어느위치에 있는 병사가혹행위는 있어서는\n않됩니다\n선임들에 아리송한 가혹행위들이 많이난무하고\n있습니다\n정말제대로 좀 잡었으면합니다', '', '십장생들 문재인대통렁의 지시을 다무시하는이유 군부대 실세가 박정희 전두완이다 그래서 문재인 말을 듣지않는다\n전두완을 사헝할때 난사가 조그은 안정이된다 살인마 전두완을 처단하라 처단하라', '', '요즘 젊은놈들 인권타령만하지 그 편한 공관병 사라지게 만든게 니네다. 그래놓고 군대가기 무섭다고? 가서 ㅈ빠지게 훈련받고 강한군이이 되거라. 가보면다 안다 저건 아무것도아니다. 공관병처럼 살게해달라고 빌것이니 그때 느낄껏이다. 맘충이들이 안갓다와본 군대를 아는척 저런 댓글만 다는 이유를']",http://www.nspna.com/news/?mode=view&newsid=247812,https://n.news.naver.com/mnews/article/056/0010515424?sid=100
