Date,Press,Category,Title,Content,Comment,URL_Origin,URL_Naver
2017.10.30.,연합뉴스,,"경기도, 미등록 복지시설 종사자에도 월 5만원 처우개선비",,,http://app.yonhapnews.co.kr/YNA/Basic/SNS/r.aspx?c=AKR20171030028600061&did=1195m,https://www.yna.co.kr/
2017-10-30 08:44:06,중부매일,사회,"음성한우협회, 복지시설 소고기 기탁","[    월 5만원 지급…269개 복지시설 1천431명 혜택 전망(수원=연합뉴스) 김광호 기자 = 경기도가 내년부터 미등록 사회복지시설 종사자에게도 월 5만원의 처우개선비를 지급할 계획이다.    경기도 청사 전경[경기도청 제공=연합뉴스]도는 30일 ""사회복지시설 종사자 처우개선비 지급대상을 경기도 건강가정지원센터 등 미등록 사회복지시설 종사자까지 확대하는 내용의 내년 사회복지시설 종사자 처우개선비 지원 계획안을 마련했다""고 밝혔다.    도는 이를 위해 올해 97억6천700여만원이던 관련 예산을 내년 8억6천여만원 늘릴 계획이다.    이 계획안이 도의회 심의를 거쳐 시행되면 도내 269개 미등록 사회복지시설 종사자 1천431명에게도 월 5만원의 처우개선비가 지급된다.    도는 올해 2천69개 등록 사회복지시설 종사자 1만6천300명에게만 같은 금액의 처우개선비를 지급 중이다.    도는 남경필 지사의 공약에 따라 지난해 당초 노인·장애인·사회복지관 등 세종류 사회복지시설 종사자 2천800명을 대상으로 월 10만원의 처우개선비를 지급했다.     그러나 열악한 시설종사자를 중심으로 형평성 문제가 제기돼 처우개선비를 월 5만원으로 줄이는 대신 지급대상을 등록 사회복지시설 종사자 전원으로 확대한 바 있다.     도 관계자는 ""미등록 사회복지시설은 기존 사회복지시설과 유사한 사회복지 업무를 하고 있지만, 장애인복지법 등 관련 법상 사회복지시설에 해당하지 않는다는 이유로 그동안 지원을 받지 못했다""며 ""도 사회복지 정책을 대행하는 민간기관이란 점에서 동등한 처우개선비를 지급하는 것이 옳다고 생각해 이번에 지원을 추진하게 됐다""고 말했다.    kwang@yna.co.kr기사 문의(기사 제목을 꼭 알려주세요) 및 제보는 여기로(클릭!)최신 유행 트렌드 총집결(클릭!) ]",[],http://www.jbnews.com/news/articleView.html?idxno=816132,https://n.news.naver.com/mnews/article/001/0009644430?sid=102
2017.10.31.,전북도민일보,,"봉침 사건 연루된 목사, 복지시설에 5억 지원",,,http://www.domin.co.kr/news/articleView.html?idxno=1172536,http://www.jbnews.com
2017.10.31.,에너지경제,,"부산롯데호텔, 아동복지시설과 ‘보석함 만들기’ 사회공헌…""풍요로운 사회 ...",,,http://www.ekn.kr/news/article.html?no=321240,http://www.domin.co.kr
2017.10.31.,연합뉴스,,공지영 엄벌 촉구 '봉침 여목사' 운영 복지시설에 5억여원 지원,,,http://app.yonhapnews.co.kr/YNA/Basic/SNS/r.aspx?c=AKR20171031133400055&did=1195m,http://www.ekn.kr
2017.10.30.,뉴시스,,"경기도, 미등록 사회복지시설 종사자에도 처우개선비 지원…1431명 혜택",,,http://www.newsis.com/view/?id=NISX20171029_0000131857&cID=10803&pID=10800,https://www.yna.co.kr/
2017-10-31 15:01:11,경향신문,정치,"정춘숙 의원 “노인의료복지시설, 신체억제대 오남용 심각”","[    (전주=연합뉴스) 김동철 기자 = 공지영 작가가 엄벌을 촉구한 이른바 '봉침 여목사'가 운영 중인 복지시설에 5억원 가까이 지원된 것으로 나타났다.    탄원서 내는 공지영 작가 [연합뉴스 자료사진]    국회 보건복지위원회 국민의당 김광수(전주 갑) 의원이 31일 보건복지부로부터 받은 자료에 따르면 이모(43·여) 목사가 대표자로 있는 주간보호센터에 국비 5천500만원을 비롯해 지방비 4억1천500만원 등 총 4억7천여만원이 지원됐다.    2012년 7천여만원을 시작으로 2013년 6천300만원, 2014년 1억원, 지난해 2016년 1억3천100만원 등 지원액은 해마다 늘었다.    올해에도 3분기까지 1억300만원이 지원됐다.    또 사회복지공동모금회는 이 시설에 490만원을 지원했고, 이 목사가 대표로 활동 중인 장애인협회에도 711만원 등 1천200여만원을 배분했다.    김 의원은 ""이 목사가 현재 사기와 의료법 위반 혐의로 재판을 받고 있다""며 ""입양아동들을 이용해 받은 기부금을 사적 치부의 수단으로 활용했다는 보도 이후 지역에서 많은 혼란과 우려가 존재하고 있다""고 말했다.    그러면서 ""관리·감독의 일차적 책임이 있는 전주시는 즉각 보조금 환수에 나서야 한다""며 ""복지시설을 화수분으로 생각하는 파렴치한 사건에 대해 복지부도 적극적인 조처를 해야 한다""고 강조했다.    이 목사와 전직 신부 김모씨는 지난 6월 허위 경력증명서로 장애인 복지시설을 설립해 기부금·후원금 명목으로 3억여원을 가로챈 혐의(사기·기부금품 모집 및 사용에 관한 법률 위반)로 불구속 기소돼 현재 1심 재판 중이다.    이 목사는 의료인 면허 없이 2012년 자신이 운영하는 장애인 복지시설에서 직원의 배에 봉침(벌침)을 시술한 혐의(의료법 위반)도 받고 있다.    공지영 작가와 지역 시민·사회단체들은 이번 사건을 사회적 약자를 이용한 범죄로 규정, 지난 30일 이들의 엄벌을 촉구하는 탄원서를 전주지법에 제출했다.    sollenso@yna.co.kr기사 문의(기사 제목을 꼭 알려주세요) 및 제보는 여기로(클릭!)최신 유행 트렌드 총집결(클릭!) ]",[],http://news.khan.co.kr/kh_news/khan_art_view.html?artid=201710301801002&code=900303,https://n.news.naver.com/mnews/article/001/0009649496?sid=100
2017.10.30.,뉴스1,,'전주 장애인복지시설 비리사건 엄벌해주세요',,,http://news1.kr/photos/view/?2799036,http://www.newsis.com
2017-10-30 16:01:42,뉴시스,사회,"국회 보건복지위, 청주 복지시설 현지시찰","[     경기도청 전경. 【수원=뉴시스】 김동식 기자 = 내년부터 경기지역 미등록 사회복지시설 종사자에게도 처우개선비가 지원된다.  경기도는 이런 내용의 2018년 경기도 사회복지시설 종사자 처우개선비 지원계획안을 마련했다고 30일 밝혔다.  지원대상은 도내 미등록 사회복지시설 269곳에서 일하는 1431명이다. 도는 이들에게 8억6000만원을 들여 매달 5만원의 처우개선비를 지급할 예정이다. 도는 올해 97억6700만원을 들여 도내 2069개 사회복지시설 종사자 1만6300명에 월 5만원의 처우개선비를 지급하고 있다.  도는 지난해 노인·장애인·사회복지관 등 사회복지시설 종사자 2800명에게 월 10만원의 처우개선비를 지급했다. 하지만 시설종사자끼리 형평성 논란이 일자 처우개선비를 10만원에서 5만원으로 줄이면서 지급 대상자를 사회복지시설 종사자 전원인 1만6300명으로 늘렸다.    도는 지원이 확대되면 처우개선비 지원대상자가 1만7731명으로 늘어난다고 설명했다. 처우개선비를 지원받을 수 있는 미등록 사회복지시설은 ▲관계 법령이나 조례에 설립근거가 있고 ▲지방재정법상 운영비 지원이 가능하며 ▲사회복지 업무를 직접수행하기 위해 설립된 기관이다. 경기도무한돌봄센터나 지역아동센터지원단, 건강가정지원센터 등이다.  그러나 요양시설 종사자는 이번 처우개선비 확대 계획안에서 제외됐다. 요양시설 종사자의 처우개선 주체는 건강보험공단이고 이달부터 월 4~7만원의 장기근속 장려금이 지급되기 시작했기 때문이다.   라호익 경기도 복지정책과장은 ""처우개선비 지원을 추진 중인 미등록 사회복지시설은 기존 사회복지시설과 유사한 사회복지 업무를 하고 있지만 장애인복지법, 아동복지법 등 관련법 사회복지시설에 해당하지 않는다는 이유로 차별을 받고 있다""면서 ""경기도 사회복지 정책을 대행하는 민간기관이란 점에서 동등한 처우개선비를 지급해야 한다고 판단했다""고 말했다.  dsk@newsis.com▶ 뉴시스 빅데이터 MSI 주가시세표 바로가기 ▶ 뉴시스 SNS [페이스북] [트위터]&lt;저작권자ⓒ 공감언론 뉴시스통신사. 무단전재-재배포 금지.&gt; ]",[],http://www.newsis.com/view/?id=NISX20171030_0000132657&cID=10806&pID=10800,https://n.news.naver.com/mnews/article/003/0008256056?sid=102
2017.10.31.,금강일보,,"당진시, 복지시설 나눔숲 조성 마무리",,,http://www.ggilbo.com/news/articleView.html?idxno=416766,http://www.khan.co.kr/
2017.10.31.,전북도민일보,,"완주군, 사회복지시설 종사자 전문교육 실시",,,http://www.domin.co.kr/news/articleView.html?idxno=1172446,http://www.domin.co.kr
2017.10.31.,이뉴스투데이,,"포천시, 노인복지시설 종사자 대상 역량강화 교육 실시",,,http://www.enewstoday.co.kr/news/articleView.html?idxno=1123259,http://www.enewstoday.co.kr/
2017.10.30.,연합뉴스,,아동복지시설 간담회하는 복지위,,,http://app.yonhapnews.co.kr/YNA/Basic/SNS/r.aspx?c=PYH20171030196500064&did=1196m,https://www.yna.co.kr/
2017-10-30 12:01:34,연합뉴스,정치,아동복지시설 간담회하는 복지위,[         (청주=연합뉴스) 이승민 기자 = 30일 오전 청주시 흥덕구 대우꿈동산에서 열린 국회 보건복지위원회 현장 시찰 간담회가 이뤄지고 있다. 2017.10.30    logos@yna.co.kr기사 문의(기사 제목을 꼭 알려주세요) 및 제보는 여기로(클릭!)최신 유행 트렌드 총집결(클릭!) ],[],http://app.yonhapnews.co.kr/YNA/Basic/SNS/r.aspx?c=PYH20171030196600064&did=1196m,https://n.news.naver.com/mnews/article/001/0009645180?sid=100
2017.10.30.,디트뉴스24,,"부여군, 부여밀알의집 복지시설나눔숲 공모사업 선정",,,http://www.dtnews24.com/news/article.html?no=438407,https://www.yna.co.kr/
2017-10-30 12:01:52,경향신문,정치,‘봉침 목사 사기사건’ 복지시설에 국비 등 4억7000만원 지원,[         (청주=연합뉴스) 이승민 기자 = 30일 오전 청주시 흥덕구 대우꿈동산에서 열린 국회 보건복지위원회 현장 시찰 간담회가 이뤄지고 있다. 2017.10.30    logos@yna.co.kr기사 문의(기사 제목을 꼭 알려주세요) 및 제보는 여기로(클릭!)최신 유행 트렌드 총집결(클릭!) ],[],http://news.khan.co.kr/kh_news/khan_art_view.html?artid=201710311316001&code=940100,https://n.news.naver.com/mnews/article/001/0009645181?sid=100
2017.10.31.,전북도민일보,,"봉침 사건 연루된 목사, 복지시설에 5억 지원",,,http://www.domin.co.kr/news/articleView.html?idxno=1172536,http://www.dtnews24.com/
11면 1단,문화일보,,진관동 ‘집단취락지구’ 선정… 주택 보수·복지시설 짓는다,,,http://www.munhwa.com/news/view.html?no=2017103001071121076002,http://www.khan.co.kr/
2017-10-31 13:17:50,에너지경제,사회,"부산롯데호텔, 아동복지시설과 ‘보석함 만들기’ 사회공헌…""풍요로운 사회 ...","[    공지영 작가와 시민사회단체들이 엄정한 수사를 촉구하고 있는‘봉침 목사 사기사건’과 관련된 해당 복지시설에 국비를 포함해 4억7000여만원이 지원된 것으로 나타났다. 31일 국회 보건복지위원회 국민의당 김광수 의원(전주 갑)이 보건복지부로부터 전달받은 자료에 따르면 이모 목사가 대표자로 있는 ㄱ보호센터에 국비 5500만원을 비롯, 지방비 4억1500만원 등 모두 4억7000여만원이 지원됐다. 2012년 7000만원을 시작으로 2013년 6300만원, 2014년 1억원. 2016년 1억 3100만원 등 지원금액도 해마다 늘어난 것으로 나타났다.올해의 경우 3분기까지 1억 300만원이 지원된 것으로 나타나 이번 사태가 불거지지 않았다면 예년에 비해 예산 지원액도 더 많이 증가했을 것이라는 분석이 나온다.사회복지공동모금회도 ㄱ보호센터에 490만원을 지원했다. 같이 기소된 김 모 전 신부가 대표로 있는 ㄴ재활협회에는 711만원 등 모두 1201만원을 지원했다. 김 의원은 “해당 시설의 대표자로 있는 이 목사와 김 전 신부는 현재 사기, 의료법 위반으로 재판이 진행중”이라면서 “검찰은 진술조서 서명 누락 등 그동안 봐주기식 수사에 대한 비판이 제기되었던 만큼 더욱 철저한 조사를 통해 ‘침묵의 카르텔’이라는 의혹을 말끔히 해소해야 한다”고 말했다.김 의원은 “그동안 관리감독의 일차적 책임이 있는 전주시가 이 문제를 방관해왔다는 지적이 있는 만큼 즉각 보조금 환수조치에 나서야 한다”며 “복지시설을 화수분으로 생각하는 파렴치한 사건에 대해 복지부도 적극적인 조치를 해야 한다”고 덧붙였다.&lt;박용근 기자 yk21@kyunghyang.com&gt;▶ 경향신문 SNS [트위터] [페이스북] ▶ [인기 무료만화 보기]©경향신문(www.khan.co.kr), 무단전재 및 재배포 금지 ]",[],http://www.ekn.kr/news/article.html?no=321240,https://n.news.naver.com/mnews/article/032/0002828788?sid=102
2017.10.30.,충청매일,,"부여군, 복지시설 나눔숲 지원사업 선정",,,http://www.ccdn.co.kr/news/articleView.html?idxno=483995,http://www.domin.co.kr
2017.10.30.,SK브로드밴드,,[티브로드뉴스][전주]전북 3개 사회복지시설 등에 숲·쉼터 조성,,,http://ch1.tbroad.com/content/view?parent_no=24&content_no=64&p_no=42673,http://ch1.skbroadband.com/
2017.10.30.,뉴시스,,'전주 장애인복지시설 비리사건 엄벌 촉구',,,http://www.newsis.com/view/?id=NISI20171030_0000061098,http://www.newsis.com
2017-10-30 16:17:47,연합뉴스,사회,전북 3개 사회복지시설에 숲·쉼터 조성,"[     【전주=뉴시스】윤난슬 기자 = 평화주민사랑방 문태성 대표와 공지영 작가 등은 30일 전북 전주지방법원 앞에서 기자회견을 열고 ""현재 재판을 받고 있는 이 목사와 김 전 신부의 범죄 행위에 대해 엄벌을 내려달라""고 촉구하고 있다. 2017.10.30. yns4656@newsis.com [사진 영상 제보받습니다] 공감언론 뉴시스가 독자 여러분의 소중한 제보를 기다립니다. 뉴스 가치나 화제성이 있다고 판단되는 사진 또는 영상을 뉴시스 사진영상부(n-photo@newsis.com, 02-721-7470)로 보내주시면 적극 반영하겠습니다.&lt;저작권자ⓒ 공감언론 뉴시스통신사. 무단전재-재배포 금지.&gt; ]",[],http://app.yonhapnews.co.kr/YNA/Basic/SNS/r.aspx?c=AKR20171027076400055&did=1195m,https://n.news.naver.com/mnews/article/003/0008256123?sid=102
2017.10.30.,매일신문,,혐오시설→편의시설로 바꾼 '복지 구미',,,http://www.imaeil.com/sub_news/sub_news_view.php?news_id=48765&yy=2017,https://www.yna.co.kr/
2017-10-27 11:12:24,머니투데이,사회,"롯데손보, 아동복지시설 남산원 후원금 전달","[    (전주=연합뉴스) 홍인철 기자 = 전북도는 산림청 산하 한국 산림복지진흥원이 공모한 녹색사업에 3곳이 선정돼 내년에 총 7억1천만원을 지원받는다고 27일 밝혔다.    [연합뉴스 자료사진]이에 따라 전주시는 1억5천만을 들여 사회복지시설인 우리요양원에 숲과 쉼터 등을 조성한다.    완주군청과 고창 선운산 도립공원도 5억6천만원을 투입해 노약자, 장애인, 임산부 등 교통약자들이 안전하고 편리하게 숲을 거닐 수 있도록 목재 데크 등 산림체험 시설을 설치한다.    복권 및 복권기금법에 따라 복권 수익금을 배분받아 조성된 이 자금은 산림을 보호하고 산림의 기능 활성화를 지원하기 위한 것이다.    ichong@yna.co.kr기사 문의(기사 제목을 꼭 알려주세요) 및 제보는 여기로(클릭!)최신 유행 트렌드 총집결(클릭!) ]",[],http://www.mt.co.kr/view/mtview.php?type=1&no=2017102715493915396&outlink=1,https://n.news.naver.com/mnews/article/001/0009639678?sid=102
2017.10.30.,NSP통신,,"염동식 경기도부의장, 장애인복지시설 위문금 전달",,,http://www.nspna.com/news/?mode=view&newsid=247625,http://www.imaeil.com/
2017-10-30 00:11:25,연합뉴스,사회,"SPC그룹, 분당 쉐이크쉑에서 복지시설 아동들과 생일파티","[     최첨단 시립추모공원 화장 수요 100% 충족[구미 정창구 기자 jungcg@msnet.co.kr] 구미시가 쓰레기매립장, 소각장, 화장시설 등 3대 주민기피시설을 단기간에 조성한 뒤 모범적으로 운영해 인근 지방자치단체들의 부러움을 사고 있다. 특히 반대 주민들을 끈기있게 설득해 주민 동의를 이끌어냈다는 점에서 주목된다.지난해 문을 연 구미시립추모공원(화장장)은 건립부터 준공까지 전국에서 가장 짧은 4년 만에 완공된 친환경 시설이다. 구미시 옥성면 농소리에 지하 1층, 지상 3층 규모로 건립된 화장장은 3차 연소 공해방지시스템을 도입한 무색`무연`무취의 최첨단 화장로 5기(8기 규모)가 설치됐으며, 녹색건축인증 심사를 통과한 친환경 건축물이다. 태양광 설비로 자체 전력수급체계를 구축한데다 주변 자연경관과도 잘 어우러져 조화를 이룬다. 하루 평균 22건씩 처리 가능하며, 개원 후 1년간 하루 평균 9건, 모두 3천여 건을 처리해 시민들의 화장 수요 100%를 충족시켜주고 있다. 그동안 시민들은 구미지역에 화장시설이 없어 김천과 대구 등 인근 지역의 화장시설을 이용하면서 높은 사용료를 지불하는 등 경제적 손실과 불편을 겪어왔다. 시는 이를 해소하기 위해 2012년 화장시설 건립에 나섰다. 하지만 해당 지역 주민들의 반발로 건립 초기부터 벽에 부딪혔다. 입지 선정 방식을 공개모집으로 정한 후 선정된 마을에 개발지원금을 지원해 마을 발전을 도모할 수 있게 했다. 전국 최초로 페어 플레이협약식을 체결해 성공한 사례로 남았다.지난 2011년 산동면 백현리에 준공된 '구미시 환경자원화시설'은 39만3천㎡ 부지에 사업비 1천736억원을 들여 숲속 미술관을 연상케하는 아름다운 외관에 친환경 첨단시설로 건립됐다. 매립면적 11만4천㎡, 매립용량 241만7천㎥로 일일 200t의 소각시설과 일일 50t의 재활용선별시설을 갖추고 있다. 구미시 전역에서 발생하는 폐기물을 이곳에서 안정적으로 처리해 쾌적한 도시환경을 유지한다. 기피시설이라기보다 시민의 휴식공간으로 자리매김하고 있다.이곳도 사업 초기 주민들의 ""혐오시설인 폐기물 매립장 설치 절대 불가""를 외치는 반대의 벽에 부딪혔다. 시는 '주민 결사 반대'를 '주민 직접 유치' 방법으로 전략을 수정했다. 시는 ""80% 이상 주민동의를 받은 지역에 한해 공개모집 신청을 받아 선정된 마을에는 100억원의 주민숙원`편익사업비 지원과 함께 시설 사용이 종료될 때까지 연간 4억원의 주민지원기금을 지원하겠다""고 밝혔다. 이 같은 지원책에 따라 산동면 백현리 등 3개 마을이 주민 85% 이상의 동의를 얻어 신청했고, 최종 입지로 산동면 백현리로 선정됐다.환경자원화센터를 유치하고 지원금 100억원을 받은 산동면발전협의회는 이 가운데 70억원으로 산비탈의 노는 땅 5만여㎡에 태양광 전지판 4천389장을 설치한 태양광발전소를 건립했다. 하루 평균 3천800㎾의 전기를 생산해 연간 6억원의 소득을 올리고 있다. 산동면은 해마다 받는 4억원의 주민지원기금으로 매년 마을별로 배분해 문화행사를 열고, 비료 공동구매 등 농가소득 증대 사업과 주방 환경개선 등을 펴고 있다. 현재 6억원 이상 기금도 적립돼 있다.남유진 구미시장은 ""구미시는 지난해까지 11년 연속 복지우수기관으로 선정됐다. 지난해 구미시추모공원의 개원으로 실질적으로 요람에서 무덤까지 복지를 제공할 수 있게 됐다. 성장에만 급급한 시대를 벗어나 시민들이 만족할 수 있는 서비스를 제공할 수 있는 구미시가 될 수 있도록 최선을 다하겠다""고 했다.ⓒ매일신문 - www.imaeil.com   ]",['혐오스러운 닭까기 마사오 동상부터 철거해라 닭까기 사업 중단하고 왜 혐오스러운 사업을 추진하는거냐'],http://app.yonhapnews.co.kr/YNA/Basic/SNS/r.aspx?c=AKR20171026089900030&did=1195m,https://n.news.naver.com/mnews/article/088/0000512098?sid=102
2017.10.29.,중부매일,,"중구의회, 아동복지시설 시설장 초청 2차 간담회",,,http://www.jbnews.com/news/articleView.html?idxno=815681,http://www.mt.co.kr/
2017-10-27 15:59:25,서울신문,경제,해병대 복지시설 관리병에 간부가 집게로 혀뽑기 등 가혹행위,"[    [머니투데이 전혜영 기자]     (사진 좌측부터)박흥식 남산원 원장, 김현수 롯데손해보험 대표이사가 후원금 전달식 후 기념사진을 촬영하고 있다./사진=롯데손해보험롯데손해보험은 지난 26일 서울 중구 소재 본사에서 아동복지시설 남산원에 후원금을 전달하는 기념식을 가졌다고 17일 밝혔다.이날 행사에서 김현수 롯데손보 대표이사는 박흥식 남산원 원장에게 본관 증축비로 2000만원의 후원금을 전달했다. 후원금 전달식 후에는 롯데손보 샤롯데봉사단이 남산원을 방문해 아동 돌봄 및 환경봉사를 실시했다. 샤롯데봉사단은 소외된 이웃을 돌아보며 나눔 경영을 실천하기 위해 월 2회 남산원을 방문해 지속적인 돌봄 및 환경봉사를 수행하고 있다.▶옆사람이 지금 보는 기사들▶무료만화 즐기고~선물타자! ▶치어리더 vs 레이싱걸 전혜영 기자 mfuture@mt.co.kr&lt;저작권자 ⓒ '돈이 보이는 리얼타임 뉴스' 머니투데이, 무단전재 및 재배포 금지&gt;   ]",[],http://www.seoul.co.kr/news/newsView.php?id=20171026500172&wlog_tag3=naver,https://n.news.naver.com/mnews/article/008/0003954642?sid=101
2017.10.29.,전북도민일보,,장애인 폭행한 사회복지시설 직원 적발,,,http://www.domin.co.kr/news/articleView.html?idxno=1172106,http://www.nspna.com/
2017.10.29.,부산일보,,거제시 복지시설 수탁자 선정 또 '잡음',,,http://news20.busan.com/controller/newsController.jsp?newsId=20171029000137,http://www.busan.com/
