Date,Press,Category,Title,Content,Comment,URL_Origin,URL_Naver
2022-01-13 08:54:01,메디소비자뉴스,사회,"바이오젠, 제약사 인수설… 삼바에 지분 매각설 여진도 계속","[    국립광주과학관(관장 김선옥)은 광주과학기술원(GIST)과 공동으로 19일 오후 7시 국립광주과학관 상상홀에서 2022년 첫 과학스쿨을 개최한다.이번 강연은 '전자디지털 약도 약인가요?'를 주제로 김재관 GIST 의생명공학과 교수가 비약물적인 방법으로 알츠하이머병의 진행을 늦추거나 예방하고자 하는 연구사례와 디지털 의료 및 치매 치료를 위한 전자약 연구 등에 대해서 소개한다.    1월 과학스쿨 웹 포스터.김 교수는 한양대 금속공학과 학·석사, 미국 텍사스 주립대 알링턴, 사우스웨스턴 의대 달라스에서 박사학위를 취득하고 미국 캘리포니아 주립대 얼바인, 베크만 레이저 연구소에서 박사 후 연구원을 거쳐 GIST 의생명공학과에서 교수로 재직 중이다.주요 연구 분야는 비침습 다중센서를 이용한 알츠하이머병 조기 선별, 알츠하이머병 치료를 위한 전자약 개발이다.    김재관 GIST 의생명공학과 교수.과학스쿨은 정부의 단계적 일상회복 지속을 위한 방역강화 조치에 따른 방역수칙을 준수해 9명 선착순 온라인 사전예약 후 현장 입장이 가능하다. 어린이부터 성인에 이르기까지 누구나 무료로 참여할 수 있다. 다만 과학관이 방역패스 의무적용시설에 포함됨에 따라 19세 이상 성인(2002년 12월 31일 이전 출생자)은 백신접종을 완료했거나 코로나 감염검사(PCR) 후 음성결과 통보시점으로부터 48시간이 되는 날의 자정까지 유효한 음성증명서 소지자, 의학적 사유로 인한 미접종자의 경우 예외증명서가 있어야만 입장이 가능하다.국립광주과학관과 GIST는 매월 셋째 주 수요일 저녁에 '과학스쿨'을 개최해오고 있으며, 어려운 과학을 쉽게 이해할 수 있도록 다양한 과학지식을 전달하는 정기 강연으로 큰 호응을 얻고 있다. ]",[],http://www.medisobizanews.com/news/articleView.html?idxno=84850,https://n.news.naver.com/mnews/article/030/0002993438?sid=102
2022.01.24.,파이낸셜뉴스,,요양원서 넘어져 사망한 환자..요양원장·보호사는 '집유',,,http://www.fnnews.com/news/202201241213086975,http://www.monews.co.kr
2022.01.11.,매일경제,,'블록버스터' 신약 기대주는? 변이암 표적치료·황반변성 치료제 등,,,http://news.mk.co.kr/newsRead.php?no=31438&year=2022,http://www.newspim.com
A22면 TOP,동아일보언론사 선정,,“매일 1시간 운동-1시간 독서땐 치매 발병 확률 40% 낮아져요”,,,https://www.donga.com/news/article/all/20220107/111147201/1,http://www.medisobizanews.com
2022.01.06.,보건뉴스,,저선량 방사선 이용 '알츠하이머병' 치료 성과 기대,,,http://www.bokuennews.com/news/article.html?no=212063,http://www.fnnews.com/
2022.01.03.,연합뉴스,,치매 위험 진단 비디오 게임 개발,,,http://yna.kr/AKR20220103027800009?did=1195m,https://www.yna.co.kr/
2022-01-03 09:05:09,전남일보,사회,"""전자디지털 약도 약인가요?""","[     치매[제작 이태호] 일러스트(서울=연합뉴스) 한성간 기자 = 알츠하이머 치매의 전 단계인 경도 인지 장애(MCI: mild cognitive impairment)의 초기 경고 신호를 포착할 수 있는 비디오 게임이 개발됐다.   영국 킹스 칼리지 런던(KCL)의 신경 과학자 에밀리 몰림파키스 박사 연구팀은 특정 비디오 게임을 하면서 나타난 몸의 움직임(movement), 말(speech), 행동(behavior) 등 3가지 특징을 종합, 치매 징후를 판단하는 프로그램 '사이미어'(Thymia)를 개발했다고 일간 텔레그래프 인터넷판이 1일 보도했다.   이 프로그램은 녹화 프로그램인 웹캠(webcam)이 있고 인터넷 연결이 가능한 스마트폰이나 컴퓨터만 있으면 집에서 사용할 수 있다.   이 프로그램에는 간단한 게임들이 들어있다. 스크린에서 움직이는 벌(동영상으로 그려진)을 손가락으로 건드리거나 어떤 그림을 말로 묘사하는 게임 같은 것이다.   이 프로그램은 게임을 하는 사람의 목소리, 눈의 동작 그리고 얼굴의 미세한 움직임(감추어진 감정 표현)을 모니터한다.   그리고 게임을 얼마나 잘하는지, 어떻게 말을 하고 눈과 얼굴을 어떻게 움직이는지를 종합해 게임을 하는 사람이 지닌 인지능력의 세밀한 모습, 이를테면 '개인적인 특징'을 그려내는 것이다.   그 전체적인 모습이 치매의 아주 초기에 나타나는 전형적인 '특징'과 매우 비슷하다면 치매가 올 가능성이 있다고 판단하게 된다.   이를테면, 치매에 앞서 나타나는 경도인지장애가 있다면 스크린에서 움직이는 물체에 주의력을 분산하는 능력이 떨어지기 마련이다.   이와 함께 앞뒤가 서로 연결되지 않는 말을 할 수 있다. 또 눈 맞춤을 지속하지 못하거나 얼굴에 미세한 씰룩거림(facial twitches)이 나타날 수 있다.   이러한 증상들은 사람의 눈에는 뚜렷하게 보이지 않을 수 있지만 소프트웨어 기술은 정상적인 사람과 그렇지 못한 사람의 차이를 잡아낼 수 있다.   즉 움직임, 말, 행동 등 3가지의 특징들을 종합하면 무엇이 잘 못 됐는지가 더욱 확실해 진다는 것이다.   이 프로그램을 시작하기 위해서는 맨 먼저 일반의 또는 전문의로부터 이 프로그램을 한 번 해보라는 요청을 받아야 한다.   비디오 게임 결과는 직접 의사에게 보내진다. 따라서 비디오 게임을 한 당사자는 앱(app)으로부터 나쁜 뉴스를 받지 않고 최종 판단은 의사가 앱의 정보를 바탕으로 내리게 된다.   1차 평가가 내려진 이후 당사자는 원하면 언제든지 이 프로그램을 마음대로 사용할 수 있다. 그때마다 비디오 게임의 결과는 직접 의사에게 전달된다.   '사이미어' 프로그램은 원래 우울증세를 탐지하기 위해 개발된 것이다. 그것이 이젠 인지장애까지 확대된 것이다.   영국 알츠하이머병 학회(Alzheimer's Society)의 캐서린 그레이 박사는 '사이미어' 프로그램에 대해, 행동에 근거한 '지문'(fingerprint)을 분석하면 알츠하이머 치매와 다른 유형의 치매 그리고 다른 정신질환을 구분하기가 쉬워질 것이라고 논평했다.    skhan@yna.co.kr ]",[],https://www.jnilbo.com/view/media/view?code=2022011309245945916,https://n.news.naver.com/mnews/article/001/0012893457?sid=102
2022.01.10.,연합뉴스,,"노년기의 규칙적인 운동, 어떻게 인지 기능 저하 막을까",,,http://yna.kr/AKR20220110120600009?did=1195m,http://www.jnilbo.com
2022.01.12.,매일경제,,"'삼성 인수설' 돌았던 바이오젠, 뉴욕증시서 주가 비틀",,,http://news.mk.co.kr/newsRead.php?no=35156&year=2022,https://www.yna.co.kr/
2022-01-10 16:58:29,대한경제,사회,"휴메딕스, 지투지바이오에 20억 지분투자...약효 지속성 주사제 사업 강화","[ 신체 활동 활발하면 시냅스 정보교환 촉진 단백질 증가운동으로 튼튼해진 시냅스, 알츠하이머 진행 늦추는 효과도미국 UCSF 연구진, 저널 '알츠하이머병과 치매'에 논문    뇌의 독성 단백질을 제거하는 소교세포소교세포의 핵(청색)이 튜브형 돌기(적색)로 연결돼 있다.이런 네트워크는 독성 단백질을 분해하는 분업에 유리하다. [본 대학 미하엘 헤네카 교수. 재판매 및 DB 금지] (서울=연합뉴스) 한기천 기자 = 나이가 들면 독성을 띠는 아밀로이드 단백질과 타우 단백질이 뇌에 쌓여 간다.    이 두 단백질의 뇌 조직 침적은 알츠하이머병 환자의 주요 특징이기도 하다.    먼저 아밀로이드가 침적하고 그 뒤를 이어 타우가 쌓이면 뉴런(신경세포)과 뉴런 연접부(시냅스)가 점차 와해하는 것으로 알려졌다.    알츠하이머병은 노인성 치매의 주원인으로 꼽히지만, 아직 효과적인 치료법은 개발된 게 없다.    그러나 규칙적인 운동 등을 통해 신체 활동을 늘리면 알츠하이머병의 진행을 늦출 수 있다고 과학자들은 말한다.    왕성한 신체 활동이 왜 이런 효과를 가져오는지를, 미국 샌프란시스코 캘리포니아대(UCSF) 과학자들이 밝혀냈다.    신체 활동을 많이 하면 뇌 건강에 이로운 특정 단백질이 증가하는 것으로 나타났다.    이 단백질은 시냅스 연결을 강화하고 인지 기능을 건강하게 유지하는 작용을 했다.    이런 효과는 이미 독성 단백질이 많이 생긴 알츠하이머병 등 신경퇴행질환 환자에게도 나타나 주목된다.     활발한 신체 활동이 고령자의 알츠하이머병 진행을 늦출 수도 있다는 의미다.    관련 논문은 7일(현지 시각) 미국 알츠하이머병 협회 저널인 '알츠하이머병과 치매'(Alzheimer's &amp; Dementia)에 실렸다.    인간의 유도만능줄기세포(iPSCs)에서 유래한 성상교세포 [미국 뉴욕 줄기세포 재단 연구소. 재판매 및 DB 금지]  왕성한 신체 활동이 인지 기능을 건강하게 유지하는 데 이롭다는 건 동물실험에서 거듭 확인됐다.     실제로 신체 활동을 활발히 하면 뇌의 시냅스 생성을 자극하는 것으로 나타났다.    하지만 신체 활동이 인간에게도 유사한 효과를 내는지는 아직 충분히 입증되지 않았다.    이번에 연구팀은 신체 활동과 '시냅스 보전 지표'(synaptic integrity marker) 사이의 연관성을 시험했다.    논문의 제1 저자인 UCSF의 케이틀린 카살레토 신경학 조교수는 ""신체 활동과 연관된 시냅스 단백질 조절이 인지 기능을 좋게 할 수 있다는 걸 인간의 데이터로 처음 입증했다""라고 말했다.    연구의 기본 데이터는, 고령자의 노년기 신체 활동을 장기간 추적한 시카고 소재 러시 대학의 '기억과 노화 프로젝트'(Memory and Aging Project)에서 지원받았다.     여기엔 사후 뇌 기증을 약속한 지원자 404명의 신체 움직임 및 수면 ㆍ각성 판독 결과, 뇌 검시 결과, 뇌 조직의 시냅스 전(前) 단백질(presynaptic protein) 수치 등이 들어 있었다.    연구팀은 시냅스에서 인지가 형성된다는 점에 주목했다.    신체 활동을 통해 신경세포 간 연결을 온전히 유지하면 치매를 막는 데 도움이 될 수 있다는 추론이 가능했다.    예상대로 신체 활동이 활발한 고령자는 뉴런 간의 정보 교환을 촉진하는 시냅스 전 단백질 수치가 높았다.    이는 논문의 수석저자를 맡은 윌리엄 호너 캐나다 브리티시컬럼비아대 정신의학 교수의 이전 연구 결과에 부합하는 것이었다.    이번 연구에서 확인된 것과 동일한 시냅스 전 단백질이 뇌에 많을수록 노년기의 인지 기능 유지 능력이 뛰어나다는 게 요지였다.    놀랍게도 이런 효과는 기억 중추인 해마(hippocampus)를 넘어서 인지 기능과 연관된 뇌의 다른 영역에서도 나타났다.    호너 교수는 ""신체 활동이 뇌 전반에 지속적인 효과를 가져오는 것 같다""라면서 ""이는 시냅스의 신호 전달을 촉진하는 단백질의 기능을 지지하고 자극할 수 있다""라고 말했다.    뇌의 노화 세포를 공격하는 성상교세포 행복 호르몬으로 알려진 도파민 분비 뉴런(적색)을 성상 교세포(녹색)가 공격하고 있다.이처럼 성상교세포는 노화한 뇌세포를 제거하는 기능도 한다.[미국 록펠러대 분자·세포 신경학 랩. 재판매 및 DB 금지] 앞서 카살레토 교수도 환자의 척수액 검사와 뇌 조직 부검을 통해 신경세포 간의 시냅스가 온전하면 아밀로이드 단백질과 타우 단백질, 타우 단백질과 신경 퇴행 사이의 연관 작용이 약해진다는 걸 확인했다.     고령자라 해도 온전한 시냅스 유지에 관여하는 단백질 수치가 높으면 알츠하이머병을 일으키는 연쇄 신경독성 작용이 완화된다는 걸 시사한다.    카살레토 교수는 ""두 건의 연구 결과를 종합하면, 알츠하이머병이 생기지 않게 뇌 조직을 지지하는 데 건강한 시냅스 유지가 매우 중요하다는 걸 알 수 있다""라고 강조했다.    cheon@yna.co.kr ]",['종아리가 제 2의 심장이라네요. 아래로 내려간 피를 다시 올려주는 역할을 한다고 합니다. 우리는 잠시 멈출수는 있으나 그게 지나치게 오래되면 문제가 심각해지겠지요.'],https://www.dnews.co.kr/uhtml/view.jsp?idxno=202201200930186580621,https://n.news.naver.com/mnews/article/001/0012908997?sid=102
20면 TOP,아시아경제언론사 선정,,"'가장 잔인한 이별' 치매, 치료법 없어도 예방법은 있다[과학을읽다]",,,https://view.asiae.co.kr/article/2022010510461353834,http://www.mk.co.kr/
2022-01-12 14:17:01,e의료정보,경제,뇌졸중·치매 타깃한 APC 변이 신약 후보물질 행보 '주목',"[ '알츠하이머 치료제 강자' 바이오젠 美보건당국, 약품사용에 소극적 결정11일 뉴욕증시서 시간 외 8% 급락'아두헬름 가격 인하' 투자 기대감↓     삼성그룹이 지분 인수를 추진 중이라는 소문이 돌았던 미국 바이오업체 바이오젠 주가가 뉴욕증시에서 부진한 모습을 보이고 있다. 11일(현지시간) 본 거래에서 바이오젠 주가는 전날보다 2.64% 올라 1주당 241.52달러에 거래를 마쳤지만 장 마감 후 시간 외 거래에서 7.62% 급락했다. 바이오젠은 알츠하이머병 치료제 아두헬름(성분명 아두카누맙)으로 유명한 제약사다. 알츠하이머와 치매 등 신경계 질환 치료약을 개발해왔다. 주식시장 티커(종목 코드)는 BIIB다.     [사진 출처 = 바이오젠] 이날 바이오젠 주가가 널뛴 배경은 미국 보건복지부(HHA) 산하 메디케어메디케이드서비스센터(CMS)의 아두헬름 치료제 사용 관련 결정이다. 같은 날 CMS의 리 프레이셔 최고의료책임자는 보도 자료를 내고 ""바이오젠의 아두헬름은 적격한 임상시험에 등록된 환자에 한해서 치료제 사용을 지원할 것""이라고 밝히면서 ""해당 치료제가 환자에게 두통과 현기증, 추락, 뇌출혈 등 광범위한 문제를 야기시킬 수 있다는 점을 감안해 이같은 판단을 하게됐다""고 설명했다. CMS의 결정은 이날로부터 30일 동안 공개 토론을 거친 후 오는 4월 11일 최종 결정된다.이날 투자자들은 CMS가 아두헬름 치료제 사용을 광범위하게 지원해 줄 것이라는 기대감을 가지고 발표에 앞서 바이오젠 주식을 사들였다. 다만 일부에 한해 부분 지원한다는 소극적인 결정이 나오자 실망감이 커진 탓에 막판에 바이오젠 주식 매도 주문이 대거 몰리면서 시간 외 주가가 8%가까이 떨어졌다.바이오젠은 지난 해 미국식품의약국(FDA)이 알츠하이머병 치료제 개발 승인 조건을 완화하면서 주가가 뛴 바 있다. 지난 해 6월 7일 FDA가 아두헬름에 대해 알츠하이머병 치료제 조건부 허가를 냈는데 이 영향으로 바이오젠 주가가 치솟으면서 같은 달 10일 1주당 414.71달러로 사상 최고가를 기록한 바 있다. 알츠하이머병 치료제 개발의 1차 목표는 인지기능 개선인데 대부분 치료제가 목표에 못 미치자 FDA가 논란을 거친 끝에 기준을 다소 낮춘 '조건부 허가'에 나섰다. 당장 완전한 승인을 받지 못하더라도 임상4상 단계인 시판후조사(PMS)를 통해 효능을 입증한다면 치료제로서 승인을 해주고 그렇지 못하면 승인을 취소한다는 것이다.바이오젠은 그간 아두헬름 가격이 고가여서 매출 부진을 겪었고 이 때문에 올해부터 약 값을 자발적으로 50% 정도 낮추기로 한 바 있다. 아두헬름은 4주에 한 번 주사를 맞는 식으로 반복 사용해야 하는데 1회당 4312달러(약 513만원)이다 보니 환자 입장에서도 비용 부담이 큰 편이다. 다만 CMS가 소극적으로 나오자 올해 바이오젠 매출이 기대만큼 늘지 못할 것이라는 예상이 투자 매력을 떨어트렸다.       바이오젠은 지난 해 말 한국 증시에서도 주목받았다. 지난 12월 30일 국내 한 언론 매체가 '삼성그룹이 미국 바이오기업 바이오젠 지분 인수를 위한 사전 검토를 마치고 협상을 시작했다'고 보도하면서 부터다. 다만 같은 날 삼성바이오로직스가 '풍문 또는 보도에 대한 해명 공시'를 통해 해당 보도는 사실무근이라고 밝히면서 투자자들의 눈길을 끌었다. 해당 보도가 나온 지난 30일 이후부터 이달 11일까지 8거래일 동안 삼성바이오로직스 주가는 7.75% 떨어졌다. 다만 12일 장중 주가가 일부 반등하는 분위기다. ]",[],http://www.kmedinfo.co.kr/news/articleView.html?idxno=72043,https://n.news.naver.com/mnews/article/009/0004907909?sid=101
2022.01.19.,헤럴드경제,,"메디컬AI 스타트업 피노맥스, 광주와 AI 산업육성 맞손",,,http://news.heraldcorp.com/view.php?ud=20220119000216,http://www.cnews.co.kr
2022.01.14.,이투데이,,올해도 K바이오 20여곳 상장 '노크'…주목할 기업은?,,,https://www.etoday.co.kr/news/view/2094784,https://www.asiae.co.kr/
2022-01-05 10:46:13,동아일보,IT/과학,나이 들면 잠 없어진다? 수면장애 방치하면 치매 더 잘 걸려,"[     자료사진. 기사와 직접 관련이 없음.‘가장 잔인한 이별’, 치매의 또 다른 별칭이다. 사랑하는 사람마저 기억하지 못한 채 점점 두뇌의 모든 기능이 퇴화된다. 소중했던 추억은 다 잊어버린 채 결국은 욕창 등으로 시름시름 앓다가 숨을 거둔다. 고령화 사회를 맞아 더욱 흔해지면서 ‘오랜 병에 효자 없다’는 옛말처럼 개인·가족은 물론 사회 전체적으로 가장 큰 복지 부담이 되고 있기도 하다. 세계 각국 정부들은 치매 치료법 개발을 주요 국가 과제로 선정하고 해결책 마련에 골몰하고 있다.◇치매는 질병이 아니다?각종 질병 등 다양한 원인으로 인해 뇌세포가 죽어가면서 퇴행성 행동을 보이는 증상을 의미한다. 후천적으로 발생하며, 점차 진행돼 결국 일상 생활을 하지 못할 정도로 뇌의 능력이 퇴화되는 것을 ‘치매’라고 한다. 치매는 뇌의 기억력, 공간 지각력, 언어 능력, 계산력, 판단력, 운동 능력 등 모든 기능을 감퇴시킨다. 힌트를 주면 금방 다시 기억하거나 전체적으로는 기억이 나지만 세부사항만 까먹는 등 단순 노화에 따른 건망증과는 구분해야 한다.치매가 계속 진행되면 우울증, 불면증, 불안증에 시달리기 시작하며 배회, 망상, 언어 및 신체적인 공격성 증가, 환청·환시 등 정신과 질환으로 이어진다. 종국엔 운동 능력까지 퇴화돼 침대에 누워 생활하다 폐렴이나 욕창 등 감염증으로 숨을 거두는 경우가 많다. 최근엔 코로나19 감염 사망자 발생의 주요 기저질환으로 꼽히고 있다.최근 인구 고령화와 식습관 변화 등에 따라 급증하는 추세다. 전문가들은 앞으로 매 20년마다 치매 인구가 두 배씩 증가해 2050년엔 300만명에 이를 것으로 보고 있다. 65세 이상 노인인구 10명 중 1명이 치매를 앓고 있으며, 치매의 전 단계인 경도 인지 장애는 10명 중 2~3명에 달한다. 사회적 비용도 크다. 치매 노인 1인당 비용은 1년에 2042만원(2019년 기준)이나 돼 가계에 큰 짐이 되고 있다. 2040년께 국가 차원의 치매 관리 비용은 63조1000억원으로 추산되고 있다.    ◇치매는 어디서 시작되나근본적인 원인과 발병 기전, 치료법은 아직 확실치 않다. 현재까지는 알츠하이머 등 퇴행성 뇌질환, 뇌경색ㆍ뇌졸중 등 혈관성 뇌질환, 루이소체·파킨슨성 치매, 기타 질환 등을 원인으로 보고 있다. 알츠하이머는 전체 환자의 60% 이상을 차지하는 주요 원인 질환이다.그동안 아밀로이드베타·타우 단백질 등 ‘나쁜 단백질’이 비정상적으로 쌓여 뇌세포들을 고사시키는 것으로 알려져 있었다. 최근엔 한국 연구진이 중증 반응성 별세포가 신경세포를 죽이고 치매 병증을 유도한다는 사실을 밝혀내기도 했다. 알츠하이머 치매는 나이 들수록 발병이 많아져 65세 이후 5년마다 환자 수가 두 배씩 늘어난다.70세 이전에 발견되면 진행을 늦추고 증세를 완화시킬 수는 있지만 아직까지 치료약은 개발돼 있지 않다. 파킨슨성 치매도 루이소체라는 물질이 중뇌 부위에 축적돼 뇌 도파민 시스템에 이상이 생겨 운동·인지 장애를 갖게 되는데 현재까지 치료법은 없다. 반면 다른 종류의 치매들은 원인 질환을 없앨 경우 증상 개선 및 치료가 가능하다. 혈관성 질환에 의한 치매는 뇌졸중, 즉 뇌 속 혈관이 막히거나 터져 뇌세포가 죽거나 기능을 하지 못하는 경우에 발생한다. 이에 따라 뇌졸중을 치료하면 개선·치료될 수 있다.이 밖에 2차 치매를 가져 오는 90여개의 질환들이 있다. 알코올 중독, 뇌종양ㆍ뇌수두증, 에이즈나 바이러스성 뇌염, 신경 매독, 비타민 B12 등 영양 부족 때문에도 치매가 발생한다. 현재 알츠하이머 등 치매로 뇌 인지 기능이 저하된 경우 아세틸콜린 분해효소 억제제(아리셉트, 레미닐, 엑셀론), 글루타메이트 수용체 억제제 등 뇌신경전달물질을 보충해주는 약물 치료 기법이 쓰이고 있다. 6개월~1년 정도 효과가 나타난 후 이후 현저히 약효가 떨어지는 것으로 알려져 있다. 우울증, 망상이나 폭력적 성향 등은 정신과 치료 약물을 복용해야 한다.    ◇예방·조기 진단이 최우선전문가들은 치매의 뿌리가 깊은 만큼 40~50대 때부터 건강 관리 및 예방이 중요하다고 조언한다. 치매의 원인 물질이 15~20년 전부터 뇌 속에 축적되기 때문이다. 우선 규칙적인 운동이 첫 손에 꼽힌다. 매일 30분씩 주 3회 걷기만 해도 인지장애 확률이 33% 낮아지고 치매 발병도 31% 감소한다. 사람을 많이 만나는 등 사회 활동도 필수다. 친구 1~2명을 더 사귀면 인지 기능 저하 발병률이 30% 낮아지고, 혼자서만 지내는 사람은 치매 확률이 1.5배 높아진다. 친척, 친구나 이웃을 한 달에 한 번 이상 만나면 15%, 매일 만나면 치매 확률이 43% 줄어든다. 사람들과의 대화와 정보 교환, 감정 교류 등이 뇌 신경 세포 활동을 자극해 상호 연결성을 개선하기 때문이다.독서, 신문 읽기, 글 쓰기 등 적극적인 두뇌 활동도 필요하다. 독서와 글쓰기를 하지 않는 사람은 치매 확률이 4배나 더 높다. TV 시청 같은 수동적인 두뇌 활동은 인지 장애의 확률을 10% 높이는 반면 게임, 오락, 글쓰기 등 창작 활동은 뇌 기능 유지에 도움이 된다. 영양분의 충분한 공급도 필수다. 특정 영양소나 건강식품을 섭취하기보다는 식단에 생선, 채소, 과일을 포함시켜 지속적으로 섭취하는 것이 좋다. 특히 우유는 매일 먹을 경우 알츠하이머 치매 확률이 60% 이상 낮아진다. 고혈압·고혈당·고지혈증 등 이른바 ‘스리(three) 고’ 질환을 가진 사람들은 뇌 기능 장애로 이어지기 쉽기 때문에 꾸준한 약물 복용이나 원인 개선이 필요하다.     ]","['', '게임...게임을 하자', '', '']",https://www.donga.com/news/article/all/20220111/111190807/1,https://n.news.naver.com/mnews/article/277/0005025997?sid=105
2022.01.19.,로이슈,,"피노맥스, 광주광역시와 MOU 체결",,,http://www.lawissue.co.kr/view.php?ud=202201190836533280204ead0791_12,http://www.lawissue.co.kr
C7면 1단,동아일보,,나이 들면 잠 없어진다? 수면장애 방치하면 치매 더 잘 걸려,,,https://www.donga.com/news/article/all/20220111/111190807/1,http://www.donga.com/
