Date,Press,Category,Title,Content,Comment,URL_Origin,URL_Naver
2022.12.31.,연합뉴스언론사 선정,,"'비밀경찰서' 의혹 중식당 대표 ""사망·부상 중국인 귀국 지원""",,,https://www.yna.co.kr/view/AKR20221231034200004?input=1195m,https://www.yna.co.kr/
