Date,Press,Category,Title,Content,Comment,URL_Origin,URL_Naver
2022-12-29 14:32:45,부산일보언론사 선정,사회,언어 장벽에 멀어지는 미래… 사례·연령별 맞춤 지원을 [이방인이 된 아이들...,"[ 배재대·호남대와 인력 양성 협약     광주대학교(총장 김동진)가 다문화사회 전문가 양성에 힘을 쏟고 있다.광주대는 배재대학교·호남대학교와 업무 협약을 체결하고 전문 인력 양성에 힘을 모으기로 했다고 29일 밝혔다.배재대학교에서 열린 이번 협약식에는 김윤희 광주대 다문화 사회전문가 융합전공 교수와 박석준 배재대 국어국문한국어교육과 교수, 강현주 호남대 글로컬 다문화학 융합전공 교수 등이 참석했다.각 대학은 광주·전남지역과 충청 지역의 다문화사회 전문 인력 양성을 위해 다양한 교육과정 및 비교과 프로그램을 공동 진행할 계획이다.또 교육 콘텐츠 공유와 학생·교직원 교류, 다문화 분야 공동 연구 및 학술회의 운영 등을 협력해 나갈 방침이다.이에 앞서 진행된 지역 네트워크 운영위원회에서는 이수진 대전 중구 다문화가족지원센터 팀장, 전현숙 국제과학기술자봉사단 간사 등이 참여한 가운데 대학과 다문화 기관이 협업해 진행되는 비교과 프로그램에 대해 논의하는 시간을 가졌다.김윤희 교수는 “각 대학이 추진하고 있는 다양한 교육 콘텐츠를 공유하는 등 적극적으로 협력해 나갈 방침이다”며 “다문화사회에 필요한 인재를 양성하기 위해 최선을 다하겠다”고 말했다. ]",[],https://www.busan.com/view/busan/view.php?code=2022122918164928191,https://n.news.naver.com/mnews/article/277/0005198629?sid=102
2022.12.30.,뉴스1,,'고창으로 귀농귀촌 오세요'…체류형 농업창업지원센터 입교자 모집,,,https://www.news1.kr/articles/4910395,http://ddaily.co.kr
2022-12-30 09:26:01,아시아경제,IT/과학,"영풍문화재단, 경북도에 이웃돕기 성금 1억원 전달 … 봉화군에도 2억원 기탁","[     [디지털데일리 이상일기자] 카카오뱅크(대표이사 윤호영)는 청소년 예체능 활동 지원을 위해 총 1억원을 기부했다고 30일 밝혔다. 먼저 카카오뱅크는 스포츠 유망주 육성을 위해 '모두의 응원' 프로젝트에 5000만원을 기부했다. '모두의 응원'은 카카오뱅크가 대한체육회와 함께 '2024 강원 동계청소년올림픽' 출전 종목 중 바이애슬론, 봅슬레이, 컬링 등 세 개 종목 선수단을 후원하는 프로젝트다. 이 세 종목은 상대적으로 인프라가 부족해 관심과 지원을 필요로 하는 종목이다.기부금은 국내외전지훈련 지원 및 훈련장 대관, 훈련용품 구입 등 청소년 선수들의 경쟁력 향상을 위해 사용될 예정이다. 또 지난 21일 카카오뱅크는 한국메세나협회를 통해 국제아동청소년연극협회에도 5000만원을 기부했다. 해당 기부금은 '아시테지 국제여름축제'의 운영 및 홍보 활동 등에 사용된다. 올해로 31번째인 '아시테지 국제여름축제'는 국내외의 우수한 청소년 대상 연극을 한 자리에서 만나볼 수 있는 공연예술축제로 청소년 문화예술 향유 증진에 기여하고 있다. 카카오뱅크 관계자는 ""청소년들에게 부족함 없는 교육 및 문화예술 환경을 제공하기 위해 이번 기부 활동을 기획했다""며 ""미래세대의 주역인 청소년들을 대상으로 다양한 지원 활동을 이어나갈 것""이라고 밝혔다.  ]",[],https://view.asiae.co.kr/article/2022123015110052714,https://n.news.naver.com/mnews/article/138/0002139860?sid=105
2022.12.30.,아시아경제,,"영풍문화재단, 경북도에 이웃돕기 성금 1억원 전달 … 봉화군에도 2억원 기탁",,,https://view.asiae.co.kr/article/2022123015110052714,https://www.asiae.co.kr/
2022-12-30 20:37:35,마이데일리,사회,"[ESG] BAT로스만스, 사천시 청년 예술가 지원 사업 성료","[     배상윤 석포제련소장(사진 가운데)이 이철우 경북지사(사진 오른쪽 첫번째)와 전우헌 경북사회복지 공동모금회장에게 이웃돕기 성금 1억원을 전달하고 있다. 영풍문화재단은 30일 경북 안동시 경북도청을 방문해 이웃돕기 성금 1억원을 전달했다.이날 성금 전달식에는 배상윤 영풍 석포제련소장과 이철우 경북도지사, 전우헌 경북사회복지공동모금회장이 참석했다.이번 기부금은 경북 사회복지공동모금회를 통해 코로나19 장기화와 경기 침체 등으로 경제적·사회적 어려움을 겪고 있는 소외계층을 돕는데 사용된다.영풍문화재단은 앞서 지난 21일에도 경북 봉화군에 저소득 취약계층 집수리 성금 1억원, 취약계층 아동 지원 성금 1억원씩 모두 2억원의 성금을 기탁했다.영풍문화재단 관계자는 “작은 정성이지만 나눔의 손길이 필요한 곳에 보탬이 됐으면 한다”며 “취약계층과 복지 사각지대 해소를 위한 사회적 책임을 꾸준히 실천하겠다”고 말했다.영풍은 경북 봉화군에 연 매출 1조3000억원, 상시 고용인원 1300여명, 아연 생산량 세계 3위 규모의 석포제련소를 운영하고 있다.영풍 산하 영풍문화재단은 매년 꾸준히 현금과 현물을 기부하며 지역 취약계층의 난방비, 생계비, 의료비 지원 등 다양한 사회공헌 활동으로 나눔 실천에 앞장서고 있다. ]",[],http://www.mydaily.co.kr/new_yk/html/read.php?newsid=202212301535752445&ext=na&utm_campaign=naver_news&utm_source=naver&utm_medium=related_news,https://n.news.naver.com/mnews/article/277/0005199228?sid=102
2022.12.28.,서울경제,,대산문화재단 창립 30주년…신창재 교보생명 회장의 한국문학 사랑 눈길,,,https://www.sedaily.com/NewsView/26F2TR2AMH,http://www.mydaily.co.kr/
2022-12-30 15:36:03,굿모닝경제,생활/문화,"우리다문화장학재단, 다문화·취약계층 학습용 가구 지원","[     [마이데일리 = 이지혜 기자] BAT로스만스가 2022년 사천시 청년 예술가 지원 사업을 성료했다고 30일 밝혔다. 앞서 BAT로스만스는 지난 2018년부터 사천문화재단과 지역문화예술진흥, 문화예술 저변확대를 위한 상호 협력 협약을 체결하고 지원해오고 있다. 사천은 BAT 생산 공장이 위치한다.올해는 사천문화재단을 통해 만 39세 이하의 청년예술단체를 모집해 최종 선발된 ‘연지골 예술원’과 ‘엘 클래식’을 지원했다. 각각 이달 10일과 29일 콘서트를 개최했다.콘서트는 전 좌석 무료로 지역 시민들에게 청년 예술가 집단의 창작활동을 선보였다. 김은지 BAT로스만스 대표는 “이번 공연으로 사천 지역 청년 예술인의 뜨거운 열정과 잠재성을 확인할 수 있었다”며 “앞으로도 자부심을 가지고 창작 활동을 펼칠 수 있도록 미래 인재 양성에 대한 투자와 관심을 지속적으로 이어 나갈 예정이다”고 말했다. [사진 = BAT로스만스](이지혜 기자 imari@mydaily.co.kr) ]",[],http://www.goodkyung.com/news/articleView.html?idxno=196804,https://n.news.naver.com/mnews/article/117/0003682719?sid=103
2022.12.30.,한국대학신문,,"광주여대, 유학생 새해맞이 문화체험 행사",,,https://news.unn.net/news/articleView.html?idxno=539780,http://www.sedaily.com
2022-12-28 09:37:04,서울경제,경제,"김동연, 안산 원도심 노후시설 개선 등에 100억 지원","[ 신 회장, 한국문학 발전과 세계화 앞장대산문화재단·교보문고·광화문글판 통해 은관문화훈장 수훈도    지난 1일 서울 중구 한국프레스센터에서 열린 '대산문화재단 창립 30주년 기념식 및 제30회 대산문학상 시상식'에서 신창재 교보생명 회장(대산문화재단 이사장)이 인사말을 하고 있다. 사진 제공=교보생명    지난 1일 서울 중구 한국프레스센터에서 열린 '대산문화재단 창립 30주년 기념식 및 제30회 대산문학상 시상식'에서 신창재 교보생명 회장(대산문화재단 이사장)이 인사말을 하고 있다. 사진 제공=교보생명    지난 1일 서울 중구 한국프레스센터에서 열린 '대산문화재단 창립 30주년 기념식 및 제30회 대산문학상 시상식'에서 신창재 교보생명 회장(대산문화재단 이사장)이 인사말을 하고 있다. 사진 제공=교보생명[서울경제] “가장 소중한 문학적 경험을 전하는 문화재단으로 거듭날 것입니다”대산문화재단을 30년째 이끌고 있는 신창재(사진) 교보생명 회장은 재단 창립 30주년(12월 29일)을 맞아 이같이 밝혔다. 신 회장은 “재단의 사명은 ‘모든 사람이 다양한 문학적 경험을 통해 자신과 타인, 그리고 세상을 이해하며 성숙한 세계시민(글로벌 시티즌)으로 성장할 수 있도록 도와드리는 것’으로 새롭게 정했다”고 설명했다.대산문화재단은 지난 1992년 대산 신용호 교보생명 창립자의 뜻에 따라 교보생명의 출연으로 창립된 민간 유일의 문학 지원 재단이다. 신 회장은 교보생명 입사에 앞서 서울대 의대 교수로 재직중이던 1993년 대산문화재단 이사장을 맡았다. ‘경영을 잘하기 위해서는 돈을 잘 버는 것보다 잘 쓰는 법을 먼저 알아야 한다’는 선친의 뜻을 따른 것이었다.대산문화재단은 창작문화 창달, 한국문학 세계화, 청소년 육성 등 다양한 문학 지원사업을 통해 우리 사회의 문화적 역량을 높이고 우리 문학이 세계로 뻗어 나가는 기틀을 마련했다는 평가를 받고 있다. 신 회장은 2017년 한국문학의 세계화와 시문학 발전에 기여한 공로로 한국시인협회로부터 명예시인으로 추대됐으며, 같은 해 한국과 프랑스의 문학과 사상 교류에 힘쓴 공로로 프랑스 정부로부터 ‘레종도뇌르’ 훈장을 수훈했다. 또 2018년에는 대산문화재단, 교보문고, 광화문글판 등을 통해 한국문학 발전과 인문학의 대중화에 기여한 공로로 선친인 신용호 창립자(1996년 금관문화훈장 수훈)에 이어 은관문화훈장을 수훈하는 영예를 안았다.신 회장은 “문학이 사회 구성원, 나아가 인류 전체를 위한 것이라는 믿음을 가지고 대산문화재단을 운영해왔다”며 “문학의 가치는 퇴색되지 않고 사람들에게 점점 더 중요해지고 있다”고 강조했다. 그러면서 “예술과 문화를 지원하는 일은 인내심을 가지고 일관성 있게 시행해야 하기에 그동안 걸어왔던 길을 앞으로도 계속 걸어 나가겠다”고 30주년을 맞는 소회를 밝혔다.대산문화재단이 지난 30년간 문학과 관련된 사업에 투입한 금액은 582억 원에 이른다. 국내 최대 규모의 종합 문학상인 대산문학상을 통해 147명의 작가를 시상했으며, 신진문인 창작 지원 프로그램인 대산창작기금을 통해 작가 310명의 창작 활동을 격려했다. 또 대산대학문학상을 통해 113명의 신인 작가를 발굴하며 문학계에 활력을 불어넣고 있다. ‘두근두근 내 인생’의 소설가 김애란, 2021 영국 대거상 번역추리소설상 수상작가 윤고은을 비롯해 김연덕, 전삼혜, 정한아 등 한국 문단에서 활약하는 걸출한 신인을 배출했다.특히 재단의 한국문학 번역·출판 지원사업은 한국문학을 전세계에 널리 알리는 산파 역할을 했다. 박경리, 황석영, 이승우 등 한국을 대표하는 문인들의 작품을 세계 각국의 언어로 번역하고 해외에서 출판해 한국문학의 지평을 넓혔다. 한강의 ‘채식주의자’가 영국에서 출판될 수 있도록 지원해 세계 3대 문학상인 ‘맨부커상’을 한국인 최초로 수상하는 데 힘을 보탰다. 재단은 대산청소년문학상, 대학생아시아대장정, 서울시립청소년문화교류센터 운영 등 청소년 육성사업을 통해 청소년들이 스스로 성찰하며 미래의 비전을 세울 기회도 제공하고 있다.  ]",[],https://www.sedaily.com/NewsView/26F3B3G1L7,https://n.news.naver.com/mnews/article/011/0004138445?sid=101
2022.12.30.,뉴스1,,"역사문화권 정비법 개정안 통과…전주시, 후백제 문화도시 조성 박차",,,https://www.news1.kr/articles/4910754,http://www.goodkyung.com/
2022.12.30.,컨슈머타임스,,카카오뱅크 '청소년 예체능 활동 지원' 1억원 기부,,,https://www.cstimes.com/news/articleView.html?idxno=525450,http://news.unn.net
2022.12.30.,아시아투데이,,"메르세데스-벤츠, 기부문화 확산 달리기 '기브앤 레이스' 부산시장 표창",,,https://www.asiatoday.co.kr/view.php?key=20221230010015378,http://www.sedaily.com
2022-12-29 16:11:01,뉴스1,사회,"""문화·관광 활성화로 인구 유출 최소화…도시철도 영도선 추진에 사활""","[     [서울경제] 경기도가 공원 시설개선과 문화센터 건립 등 안산 원도심 노후화 문제 해결에 100억5000만원을 지원한다. 이는 지난달 29일 안산시 선부동 선부다목적체육관에서 열린 ‘민생현장 맞손토크’ 주민 건의에 대한 후속 조치다. 당시 김동연 경기도지사는 “오늘 시민 여러분 말씀을 귀담아듣고 바로 즉석에서 해결할 수 있는 것들은 바로 해결하고, 조금 더 검토가 필요한 것들은 검토해서 해결하도록 노력하겠다”고 약속한 바 있다.도는 노후시설 개선 등 18개 사업에 100억5000만원을 지원한다. 세부 사업으로 주민 편의 증진과 안전을 위한 관산체육문화센터 설립(10억 원), (가칭)신길 청소년어울림문화센터 건립(10억 원), 외국인주민지원 시설 환경개선(5억 원), 문화광장과 역사주변 폐쇄회로텔레비전(CCTV) 설치(5억 원) 등 공공시설 건축·리모델링 사업이 있다. 또 어울림공원 환경정비 공사(5억 원), 석수어린이공원 재조성사업(5억 원), 방아머리공원 이용환경 개선사업(3억 원), 성포공원 테마공간 조성(9억 원) 등 노후화된 공원 13개소의 시설개선도 추진한다. 안산은 산단 배후도시로 조성된 초기 계획도시로 350여 개의 다양한 공원이 있으나, 조성된 지 최대 30년 이상 넘어 노후화된 상황으로 공원 정비가 필요한 상황이다. 당시 맞손토크 현장에서 제시됐던 노인일자리 확대, 청년 정책, 공유킥보드 방치문제, 청소년 교통비 지원 등 주민 요구사항에 대한 후속조치도 추진한다.정부의 공익형 노인일자리 축소에 대응해 도는 내년도 도비를 확대 편성하고 저소득 고령층 어르신들을 위한 공익형 노인일자리 1만여 개를 추가 지원할 계획이다. 또 2023년 신규 사업으로 청년 노동자 심리치유 프로그램과 청년활동 지원 프로그램을 추진하며, 지역 기반 특화 일자리 발굴과 지역 청년과의 고용 연계 사업을 지속할 예정이다.최근 이용이 활성화되고 있는 공유킥보드 등 개인형 이동장치(Personal Mobility)의 안전한 이용을 위해서는 민관 합동 협의체를 구성해 종합적인 안전 대책도 마련한다. 전동 킥보드 등 주차시설은 현재 도내 227개소가 설치됐으며, 계속 확대할 계획이다. 아울러 청소년들이 통학 등에 실제로 많이 이용하는 공유자전거 이용료에 대한 청소년 교통비 지원도 제도개선을 통해 추진할 예정이다.  ]",[],https://www.news1.kr/articles/4910866,https://n.news.naver.com/mnews/article/011/0004139106?sid=102
2022.12.31.,뉴스1,,"""문화·관광 활성화로 인구 유출 최소화…도시철도 영도선 추진에 사활""",,,https://www.news1.kr/articles/4910866,http://news1.kr/
2022-12-31 07:00:00,아이뉴스24언론사 선정,사회,"민관 협력 데이터 플랫폼 구축 논의…""빅데이터 활성화 위해 공공 지원 필요""...","[ [인터뷰] 김기재 영도구청장 ""출산 지원금 500만원 지급""[편집자주] 민선 8기가 출범한 지 6개월이 지났다. 뉴스1 부산경남취재본부는 각 지방자치단체 및 지역구의 발전을 위해 달려온 자치단체장과 지역 국회의원, 지역위원장을 만나 2022년을 돌아보고 2023년 새해 설계를 들어봤다.    김기재 영도구청장이 지난 29일 영도구청에서 뉴스1과 인터뷰를 하고 있다.(영도구 제공)(부산=뉴스1) 노경민 기자 = ""인구 감소를 막기 위해선 문화·관광 활성화에 사활을 걸어야 합니다.""초고령화 사회인 부산에서도 노령화 현상이 두드러지는 영도구. 김기재 부산 영도구청장은 문화와 관광 활성화로 돌파구를 찾고 있다.영도는 부산 16개 구·군 중 유일하게 도시철도가 없는 지역이다. 김 구청장은 이러한 오명을 벗기 위해 영도선 건설에 총력을 기울이고 있다.2년 전 경제성 평가에서 기준치에 미달해 사업을 추진하지 못했지만, 그사이 개선된 정주 여건을 살려 2024년에는 도시철도망 구축 계획 대상에 들겠다는 목표를 향해 달려가고 있다.다음은 김 구청장과의 일문일답.―취임 첫해 소감은.▶취임 후 정말 정신없이 하루하루를 보낸 것 같다. 지난 6개월간 구민들의 목소리에 귀를 기울이고 공직자들과 민선 8기 비전을 공유하며 정책을 세밀하게 준비해 왔다. 대통령상, 장관상 수상 등 각종 외부 평가에서 성과를 거둬 변화를 일으키기 위한 시작 단계에 들어섰다.―대표 공약들 현재 추진 상황이 어떤지.▶부산의 16개 구·군 가운데 영도구만 도시철도가 없다. 그만큼 영도선은 외부인 유입뿐만 아니라 지역 주민들의 정주 환경을 위해서라도 꼭 필요한 사업이다. 우선 '2024년 부산도시철도망 구축계획' 수립을 위해 내년 구 자체 예산 2억원을 투입해 타당성 용역을 실시할 예정이다. 2년 전 조사에선 경제성 등 평가에서 아슬아슬하게 탈락했지만, 그사이 해양 신산업, 커피 산업 등 정주 여건이 개선돼 추진 가능성이 커지고 있다. 특히 관광 거점의 특성을 잘 연계한다면 영도선의 잠재 이용객이 늘어날 것으로 기대하고 있다. 이 사업에 사활을 거는 심정으로 최선을 다할 것이다.고령층 인구 비율이 높은 만큼 고독사 문제 해결에도 꾸준히 관심을 두고 있다. 매년 사회적 고립가구 전수조사를 실시하고, 중장년층 1인 가구, 청년 위기가구 등 사각지대에 놓인 대상자를 집중 조사해 관리 대상자로 포함해 복지서비스를 제공하고 있다. 인력 한계를 최소화하기 위해 명예사회복지공무원과 함께 방문 상담도 정기적으로 실시하고 있다.    지난 29일 김기재 영도구청장이 영도구청에서 뉴스1과 인터뷰를 하고 있다.(영도구 제공)―이전 구정과 달라진 점은 무엇인가.▶민선 7기의 태종대 짚와이어 조성 등 여러 사업을 이어받아 추진하고 있다. 그러면서도 민선 8기 구정은 '치적 쌓기' 정책보단 장기 발전 전략에 기조를 두고 있다. 지난 3년간은 코로나19로 구민과의 직접적인 소통이 어려웠지만, 민선 8기 구정은 현장에서 주민들의 목소리를 듣기 위해 열심히 뛰고 있다.―내년 중점 사업은.▶ 내년에도 계속해서 인구 유출을 막는 데 초점을 두려고 한다. 내년 1월1일 이후 출생아에게 출산 지원금 500만원을 지급하고, 지방소멸 대응기금을 활용한 지역 활성화 사업을 내년부터 본격 추진한다. 젊은 사람들의 일자리를 발굴하고 보육·교육 환경을 개선해 나가겠다.또 미래 먹거리인 해양 관광 산업 기반 조성을 위해 해양낚시 복합타운, 레저산업, 해양치유산업 등도 준비하고 있다. 체류형 관광지 활성화를 위해 콘도미니엄 등을 건립해 가족 체류형 시설이 들어설 수 있도록 노력하겠다. 지난 9월 태풍 '힌남노'로 파손된 흰여울문화마을 산책로도 경사지 작업을 통해 정상화하는 데 속도를 내고 있다.―마지막으로 구민들에게 한마디.▶'힘 있는 영도, 새로운 변화'를 만들어 내겠다는 약속을 지키기 위해 새로운 동력이 무엇인지 매일 고민하고 있다. 내년에는 구민들이 영도의 발전과 변화를 체감할 수 있도록 총력을 쏟아붓겠다.   ]",[],http://www.inews24.com/view/1553644,https://n.news.naver.com/mnews/article/421/0006550323?sid=102
2022.12.29.,뉴스핌,,"수원시 청년이 원하는 정책은...""주거 지원, 취·창업 지원""",,,http://www.newspim.com/news/view/20221229000179,http://www.inews24.com/
