Date,Press,Category,Title,Content,Comment,URL_Origin,URL_Naver
2022-12-27 13:55:10,아시아경제,세계,"정부, ‘한해 5만명’ 학교 밖 청소년에게 장학금 지원한다","[ 기사내용 요약우크라내 헝가리계 주민 보호 빌미 삼아독재자 오르반 총리 두드러진 친러 행보러 에너지 도입해 국내 유가 안정 통한헝가리 국민들의 정치적 지지 확보 노려    [서울=뉴시스]헝가리와 접경한 우크라이나 트란스카르파티아지역 무카체베에 있는 팔라노크성. (출처=우크라이나 관광청) 2022.12.27.[서울=뉴시스] 강영진 기자 = 우크라이나와 150㎞ 가량 국경을 접하고 있는 헝가리의 빅토르 오르반 총리가 블라디미르 푸틴 러시아 대통령과 우호적 관계를 유지하면서 유럽연합(EU)이 러시아를 제재하는 것을 방해하고 우크라이나가 휴전 협상에 응하도록 압박해야 한다고 주장해 왔다. 북대서양조약기구(NATO) 회원국인 헝가리는 또 서방 무기를 헝가리를 통해 우크라이나에 지원하는 것을 가로막고 있다. 오르반 총리가 이처럼 우크라이나에 적대적 정책을 유지하는 목적은 내륙국가인 헝가리가 러시아의 값싼 석유와 천연가스에 의존함으로써 에너지 가격을 낮춰 자신에 대한 지지를 유지하기 위한 것이다. 독일외교위원회 연구원 안드라스 락츠는 “지난 2월 이후 오르반은 순전히 국내 정치적 동기에 따라 움직여왔다. 한마디로 러시아를 자극해 헝가리에 재앙이 될 가스와 오일 공급 중단을 초래하지 않겠다는 것”이라고 말했다.이와 관련 미 워싱턴포스트(WP)는 26일(현지시간) 우크라이나와 헝가리 사이의 해묵은 갈등이 헝가리의 반 우크라이나 행보에 빌미가 되고 있다고 보도했다. 오르반 총리와 볼로디미르 젤렌스키 우크라이나 대통령 사이의 관례를 갈수록 냉각돼왔다. 젤렌스키는 공개적으로 오르반이 우크라이나 국민들의 고통에 냉담하다고 비난하고 오르반은 그렇지 않다고 반박한다. 헝가리는 우크라이나 피난민 100만 명을 받아들였고 수백만 달러의 인도적 지원을 했다. 그러나 극우 포퓰리즘 정치인이자 “비자유주의적 기독교 민주주의”의 주창자인 오르반 총리는 영토 확장을 노리는 헝가리 민족주의자를 자처하면서 언제가 우크라이나에 속한 헝가리 영토를 탈환하려 할 것이라는 의심을 받는다. 오르반은 지난달 축구 경기장에서 우크라이나 등 인접국가의 영토 일부가 포함된 옛 헝가리 지도가 그려진 스카프 차림으로 사진을 찍었다. 그러자 우크라이나 정부가 키이우 주재 헝가리 대사를 소환해 설명을 요구했고 오르반 총리의 행동이 “우호 관계 발전에 기여하지 않는다”는 성명을 발표했다. 전쟁 발발 한달 뒤인 지난 3월 양국간 갈등이 표면화하면서 젤렌스키 대통령이 오르반 총리에게 마리우폴을 초토화한 러시아에 대한 제재에 가담하지 않는다고 비난했다. 젤렌스키는 EU 정상들을 대상으로 한 화상 연설에서 “빅토르, 당신은 마리우폴에서 무슨 일이 벌어지는지 아는가? 알면서도 제재를 주저하는가? 러시아와 계속 교역을 하려는가? 주저할 시간이 없다. 진작 결정을 내렸어야 했다”고 질타했다. 지난 4월 총선에서 전쟁 불개입을 공약하면서 압도적으로 승리한 오르반 총리는 젤렌스키와 “브뤼셀의 관료들” “소로스 제국”과 “국제 주류 언론”을 적으로 불렀다. 지난 달 오르반 총리와 같은 당 소속의 카탈린 노박 헝가리 대통령이 키이우를 방문해 지지 의사를 밝혔다. 그러나 헝가리는 이달 들어 EU가 우크라이나에 긴급 차관 1900만 달러를 지원하는 것을 방해했다. EU가 러시아 석유 수입을 금지하는 것도 막았다. 오르반 총리는 자신이 우크라이나를 도우려 하지 않으며 EU 차원이 아니라 개별국들이 우크라이나에 차관을 제공해야 한다는 보도가 “가짜 뉴스”라고 트윗했다. 오르반은 지난주 연말 기자회견에서 “유럽 대부분이” 전쟁에 끌려들어갔으며 우크라이나가 러시아와 협상해야 한다고 다시 한번 강조했다. 우크라이나에 무기를 지원하는 나라들이 “발목이 잡혔다”면서 “막대한 재정지원이 목까지 찼다”고 강조했다. “우리의 전쟁이 아니다”라고 강조하면서다. 헝가리는 1차 대전 중 영토의 3분의 2 가량을 잃었다. 현재 200만 명의 헝가리 민족이 해외에 거주하고 있고 우크라이나에도 13만 명이 있다. 이들은 주로 우크라이나 카르파티아 산맥 서쪽 가난한 지방인 트랜스카르파티아에 있다. 이 지역은 과거 헝가리 영토였으나 지금은 인구가 130만 명에 달해 헝가리 민족이 소수민족이 됐다. 그럼에도 불구하고 이 지역은 우크라이나와 헝가리 사이의 갈등의 원인이 돼 왔다. 이 지역 헝가리 주민을 보호하는 것이 오르반의 권력 유지에 핵심이 되고 있다. 우크라이나 주민들의 약 40% 가량이 헝가리를 “적국”으로 간주한다. 러시아와 벨라루스에 이어 가장 높은 비율이다. 트랜스카르파티아 지역에서 이 같은 불만이 거침없이 표출되고 있다. 지난 10월 헝가리 국경에서 자동차로 30분 거리인 무카체베(헝가리명 문카치)의 당국자들이 헝가리 신화에 나오는 거대 매인 투룰(turul) 동상을 해체했다. 폭이 4.5m에 달하고 무게가 1t 가까운 이 동상은 2008년 과거 헝가리 귀족이 살았던 팔라녹성 위에 세워진 것이다. 트란스카르파티아가 과거 헝가리 땅이었음을 상징하는 동시에 헝가리와 우크라이나의 우호관계를 강조하는 동상이었다. 동상이 있던 자리에는 우크라이나의 상징인 트리줍(tryzub) 삼지창 문장이 세워졌다. 무카체베 당국자들은 해체한 투룰 동상을 트란스카르파티아 역사 박물관에 전시하고 다시는 공개된 장소에 세우지 않을 것이라고 밝힌다. 안드리 발로하 무카체베 시장은 “우크라이나 상징만이 들어설 수 있는 곳이다. 트란스카르파티아는 우크라이나 땅이다. 과거에도 지금도 앞으로도 그럴 것이다. 이 점을 헝가리 정부에 분명히 한다”고 말했다. 페테르 씨야르토 헝가리 외교장관은 “불필요한 도발”이라며 헝가리 주재 우크라이나 대사에게 해명을 요구했다. 우크라이나 정부는 자신들과는 무관하다고 주장하고 있다. 트란스카르파티아 최대 도시 우즈고로드의 우크라이나 헝가리인 민주연합 대표 산도르 슈페닉은 “모든 헝가리인들의 영혼에 침을 뱉은 행위”라고 분개했다. 헝가리 당국이나 극우 단체들이 투랄을 재건하려고 시도할 경우 언제든 갈등이 폭발할 수 있다고 보는 사람들도 있다. 당장은 오르반 총리의 스카프와 마찬가지로 헝가리와 우크라이나 관계가 악화한 것을 보여주는 정도에 머물고 있다. 헝가리 국경에서 15㎞ 가량 떨어진 라티프치 마을 주민 1300명은 대부분 우크라이나어나 러시아를 사용하지 않으며 헝가리 방송을 주로 듣고 있다. 이들에게 전쟁은 먼 나라 일이다. 트란스카르파티아 지역도 정전을 겪고 있지만 러시아의 공습을 받은 적은 거의 없다. 주민들은 우크라이나에 대한 애국심은 없고 마을과 지역, 인종으로 뭉쳐 있다. 현지 주민 모니카는 “우리는 트란스카르파티차에 산다. 전쟁은 우크라이나에서 벌어지는 것”이라고 말했다. 헝가리는 인접국의 헝가리계 주민들에게 막대한 재정지원을 해왔으며 우크라이나 국민들 상당수가 이를 내정 간섭으로 본다. 반면 트란스카르파티아 지역에서 헝가리계 주민들이 가장 많이 거주하는 베레호베의 졸탄 바브작 시장은 헝가리의 재정 지원이 부족한 시의 재정에 큰 도움이 된다고 강조했다. 헝가리는 재정지원을 통해 트란스카르파티아 지역에서 헝가리 문화가 소멸하는 것을 막는데 집중하고 있다. 헝가리인들이 수천 년을 살아온 지역에서 많은 주민들이 일자리를 찾아 외지로 떠나고 있기 때문이다. 헝가리는 또 해외 거주 헝가리계 주민 100만 여명에 여권도 발급했다. 이들은 오르반 총리의 탄탄한 지지 기반이 된다. 그러나 우크라이나는 이중 국적이 불법이다. 2018년 우크라이나는 베레호베에서 여권을 발급한 트란스카르파티아 주재 헝가리 영사를 추방하고 여권을 받은 사람들에 대한 “반역죄” 수사에 나섰다. 헝가리는 우크라이나가 2017년 우크라이나어 사용을 강제하는 법령을 채택한 것을 두고 헝가리 민족의 인권을 탄압하는 동화정책이라고 비판하고 있다. 우크라이나 법은 러시아의 영향력을 축소하는 것이 목표였지만 학교에서 헝가리어를 가르치는 것도 금지한다. 우즈고로드에서 500년 이상 가계를 이어온 야노스 헤데르 헝가리 개혁교회 목사는 “헝가리 주민들이 트란스카르파티아에서 축출되고 있다”고 말했다. 헝가리는 우크라이나와의 언어 갈등을 이유로 지난 달 수도 부카레스트에서 열린 나토 외교장관 회의에 우크라이나가 참석하는 것을 막았다. 씨야르토 외무장관은 당시 페이스북에 “우크라이나가 트란스카르파티아 헝가리 주민들의 권리를 회복하기 전까지” 헝가리 정부가 우크라이나의 회의 참석을 막을 것이라고 썼다. 오르반 총리는 우크라이나에 대한 군사지원에 반대하는 이유 중 하나로 트란스카르파티아 헝가리 주민들 보호를 내세운다. 그는 헝가리 사람 한 사람도 “우크라이나 모루와 러시아 해머 사이에 놓이면 안 된다”고 말했다. 그러나 우크라이나 내 헝가리 주민 다수가 러시아에 맞서는 전쟁을 지지한다. 노박 헝가리 대통령은 헝가리계 주민 500명 이상이 “최전선에서 피를 흘렸다. 목숨을 잃거나 부상했다”고 밝혔다. 트란스카르파티아 지역에서 헝가리어를 말하며 성장해온 크리스티안 슈키르약(30)은 러시아가 침공했을 때 가족과 함께 러시아군이 학살을 자행한 키이우 인근 부차에 살다가 러시아군이 닥치기 2시간 전 간신히 빠져나와 트란스카르파티아로 돌아왔다. 그는 자신이 헝가리인인 동시에 우크라이나인으로 느낀다고 말한다. 그는 “헝가리 전통과 역사를 사랑한다. 헝가리의 모든 것을 사랑하지만 오르반 총리의 헝가리는 좋아하지 않는다”고 말했다. ]","['우크라이나와 헝가리 관계는 문재인때 한일관계보다 더 안좋음... 헝가리가 우크라이나 득되는일 할일 없다..', '', '그럼 자국이 먼저지 타국 지원이 먼저일까. 우크라이나와 엮인 나라들은 모두 박살이 나고 있다. 일년만 지나면 EU의 대다수 국가들이 헝가리와 같은 노선을 타게 될 것이다.']",https://view.asiae.co.kr/article/2022122614062010432,https://n.news.naver.com/mnews/article/003/0011612484?sid=104
2022.12.29.,세계일보,,‘종이책의 종말’ 시대에 첫 책 내는 작가 지원하는 ‘나의 첫 책 프로젝트’,,,http://www.segye.com/content/html/2022/12/28/20221228515606.html?OutUrl=naver,https://www.asiae.co.kr/
2022-12-26 14:06:22,에듀프레스,사회,"단국대 창업지원단- 하나금융재단, 소외계층 창업자 발굴 업무협약","[ 여성가족부, 26일 학교 밖 청소년 지원 대책 발표학습·진로·건강한 성장·생활·보호 안전 지원 청사진    [이미지출처=연합뉴스] 한 해 5만명에 육박하는 학교 밖 청소년의 발달 단계별 맞춤형 지원을 위한 정부의 청사진이 공개됐다.26일 여성가족부는 정부서울청사에서 제18차 청소년정책위원회를 열고, 사회로 먼저 나와 내일을 준비하는 학교 밖 청소년의 건강한 성장을 돕기 위한 ‘학교 밖 청소년 지원 강화 대책’을 발표했다.이번 대책은 △고등학교 학업중단 청소년의 학교밖청소년지원센터 자동 연계를 위한 법률 개정 △고교 미진학 청소년에 대한 정보연계 방안 △온라인 환경 변화에 대응하는 프로그램·콘텐츠 개발 △정신건강 문제 조기 발견 및 심리정서 지원체계 강화 등을 골자로 한다.여성가족부는 학교 밖 청소년을 조기에 발굴하고, 지원 사각지대를 해소하는 한편 변화하는 사회 환경과 새로운 정책 수요를 반영하기 위해 관계부처와 협력해 이번 대책을 마련했다.현재 우리나라는 청소년 인구 감소에도 불구하고 매년 5만여명의 청소년이 학교를 떠나고 있으며, 지난해 기준 학령기 청소년 559만명 중 학교 밖 청소년은 14만6000명(2.6%)으로 추산된다. 더욱이 코로나19로 학업중단 청소년 비율이 일시적으로 감소했으나 최근 다시 증가하고 있다.지난해 학업중단 청소년은 초등학교 1만1612명, 중학교 5976명, 고등학교 1만4439명으로 집계됐다. 특히 심리·정신적인 문제로 학교를 그만두는 비율이 높아지고 있으며, 학교를 그만둔 이후에도 진로를 결정하지 못하는 청소년이 지속적으로 증가하고 있는 것으로 나타났다.이에 건강검진 및 검정고시 지원, 진로탐색 등 기존 지원 내용 외에도 교통비 지원 등 새로운 서비스에 대한 수요가 늘고 있고, 확장가상세계(메타버스) 활성화 등 온라인 환경 변화에 대응한 정책 개발 필요성이 높아지고 있다.신속한 발굴·연계 및 진단?지원 역량 강화여성가족부는 먼저 학교 밖 청소년을 신속하게 발굴하고 연계하는 온?오프라인 체계를 구축한다는 방침이다. 이를 위해 학업 중단 학생 정보의 자동연계 범위를 초·중학생에서 고등학생까지 확대하는 법률 개정을 추진하고, 중학교 졸업 후에 고교를 진학하지 않은 청소년에 대한 정보 연계 방안도 모색하기로 했다.또 교육부의 4세대 나이스(NEIS) 시스템과 학교밖청소년지원센터(이하 꿈드림센터) 정보망 연결을 통해 학업중단 정보가 신속하게 전송되도록 시스템을 구축하고, 전국 교육청과의 업무협약(MOU)으로 학교 안팎 상호 연계 체계를 마련한다.도서 지역이나 대면서비스를 기피하는 청소년이 시공간 제약 없이 쉽게 이용할 수 있도록 확장가상세계(메타버스)상 꿈드림센터를 설치해 학교 밖 청소년을 온·오프라인으로 발굴·연계하는 시스템도 구축한다.꿈드림센터 종사자 한 명이 담당하는 사례 인원을 현재 약 65명에서 2026년까지 55명 이내로 줄여 더 촘촘하게 돌볼 수 있게 한다는 계획도 세웠다.    [이미지출처=연합뉴스]균등한 학습 기회 제공 및 진로지원 강화꿈드림센터를 처음 방문하는 학교 밖 청소년의 욕구와 특성 등을 정확하게 진단해 맞춤형 서비스도 제공한다. 초등?중등 연령별 기초학습, 갈등 해결, 진로탐색을 내용으로 한 온라인 학습 콘텐츠 및 사회성 훈련 프로그램을 개발해 연령별로 지원할 방침이다. 한국교육방송공사(EBS), 인터넷수능방송, 사회복지공동모금회 등 민관기관과 협력해 기초교과학습 및 검정고시 학습을 지원하고, 교육부 산하 국립국제교육원과 연계해 외국어 교육도 지원한다. 온라인 학습관리시스템(Learning Management System)을 구축해 학교 밖 청소년이 다양한 학습 프로그램을 자유롭게 이용할 수 있도록 하고 학습 전 과정에 대해 체계적으로 관리한다.학교 밖 청소년들을 대상으로 한 장학금과 대학 지원 프로그램도 마련됐다. 한국장학재단 학자금 지원 대상에 학교 밖 청소년이 포함되도록 제도를 개선하고, 학교 밖 청소년에게도 대학 진학의 공정한 기회를 보장하기 위해 대입자료로 활용 가능한 꿈드림센터의 활동사항인 ‘청소년 생활기록부’ 적용 대학을 확대한다는 계획이다.사회에 나가 활동할 수 있도록 진로 동기 및 직업 역량 강화도 함께 추진된다. 꿈드림센터에서는 진로를 결정하지 못한 청소년에게 새롭게 진로동기 강화 프로그램을 제공하고, 전국 시?도 꿈드림센터로 ‘직업역량강화 프로그램’을 확대할 예정이다.교육부에서 운영하는 진로체험망 ‘꿈길’을 통해 꿈드림센터와 지역사회가 연계해 체계적인 진로 체험 기회를 제공하고 사회 진출을 지원하는 한편, ‘내일이룸학교’의 진로설계 과정을 끝낸 후 산업체 맞춤형 전문기술인으로 성장하고 싶은 학교 밖 청소년은 폴리텍대학에서 전문기술 교육을 지원받을 수 있게 된다.건강한 성장 기회 보장학교 밖 청소년의 신체적 · 정신적 건강 지원도 강화된다. 눈 질환 등 건강검진 항목을 보완하고, 건강보험이 없거나 경제적 어려움을 겪는 이주배경청소년 등 의료 사각지대에 놓인 취약청소년에게 무료건강검진 및 치료비를 지원한다.또한 꿈드림센터 프로그램에 참여하는 학교 밖 청소년에게 제공하고 있는 무상 급식의 질을 높여 건강한 성장과 발달을 돕고, 우울·불안·과잉행동 등 정신건강 상태를 측정해 위기 정도에 따라 청소년상담복지센터 또는 청소년치료재활센터로 연계한다.아울러 ‘또래상담 사업’을 학교를 다니는 학생 중심에서 꿈드림센터에 참여하는 학교 밖 청소년까지 확대운영하고, 자살·자해 위험이 높은 고위기 학교 밖 청소년을 직접 찾아가 상담하고 맞춤형 사례관리와 지역 자원 연계를 지원하는 청소년동반자 서비스도 확대한다.자유로운 활동 및 생활지원 확대꿈드림센터가 없는 28개 지역에는 청소년 인구 수와 학교 밖 청소년 규모 등을 고려해 신규 설치하고, 학교 밖 청소년이 자유롭게 공부하고 창작과 체험활동을 할 수 있도록 꿈드림센터에 전용공간을 마련한다.해외여행 경험이 없거나 문화를 체험하기 어려운 학교 밖 청소년에게 청소년 국가 간 교류나 문화 예술 활동 프로그램을 제공해 문화접근성을 향상시키고, 사회·경제적으로 위기에 처한 학교 밖 청소년에게 생활비 등 지원을 강화한다.김현숙 여성가족부 장관은 “이번 대책은 청소년 인구 감소와 디지털 환경의 일상화 등 변화하는 사회 환경에 적극 대응하고 학교 밖 청소년의 수요에 부응한 대책을 마련했다는 데 의미가 있다”면서 “학교 밖 청소년이 소외되거나 사각지대에 놓이지 않고, 학업과 진로 탐색은 물론 신체·정신적으로 건강하게 성장해 내일을 준비할 수 있도록 성장 단계에 따라 체계적으로 지원해 나갈 계획”이라고 강조했다. ]",[''],http://www.edupress.kr/news/articleView.html?idxno=9902,https://n.news.naver.com/mnews/article/277/0005196943?sid=102
2면 TOP,부산일보언론사 선정,,나무 아닌 숲을 봤더니… ‘슬세권’ 부산 문화 드러났다 [新 문화지리지-202...,,,https://www.busan.com/view/busan/view.php?code=2022122618262925966,http://www.segye.com
2022-12-29 01:08:07,브릿지경제,생활/문화,"거창군 문화예술계, 2022년 연이은 수상 쾌거","[    ‘종이책의 종말’이라는 말이 심심치 않게 사용되고 있다. 정확히는 스마트폰의 보급 이후 ‘손바닥 안의 세상’에 사람들이 집중하면서 스마트폰을 통해 모든 것을 하기 시작하면서부터다. 스마트폰으로 정보를 얻는 것은 물론이고, 책까지 스마트폰으로 본다. 그러다보니 종이책을 들고 다니는 것 자체가 귀찮음이 됐다.     그럼에도 종이책이 주는 매력은 여전히 있다. 눈으로 보는 동시에 손으로 만져 느껴지는 감성과 분위기, 그리고 책 읽는 행위 자체로 뇌리에 기억되는 모습 등. 이러한 장점 때문에 종이책을 포기하지 않는 사람들이 있다. 그런 사람들을 위해, 그리고 좋은 종이책을 더 많이 보급하기 위해 정부에서도 많은 관심을 쏟고 있다.         ‘나의 첫 책 프로젝트’에서 진행한 관객과 북토크 중인 장편 ‘좀비시대’의 방서현 작가.    ‘문학나눔 도서보급사업’이 대표적이다. 한국문화예술위원회에서 운영하고 있는 문학 활성화 사업으로, 국내에서 발간되는 우수문학도서를 선정·보급하는 프로젝트다. 연 3회 공모를 통해 지정된 기간 내 출판된 단일저자 초판 문학도서를 대상으로 연간 500종의 도서를 선정한다.     특히 이중 작가가 처음으로 발간한 책을 대상을 진행하는 프로젝트가 있는 데, 그건 바로 ‘나의 첫 책 프로젝트’. 즉 ‘종이책의 종말’이라 불리는 시대에 살고 있음에도 종이책에 도전하는 작가들에게 힘과 용기를 주는 일이라고 할 수 있다. 이에 해당 사업을 담당하는 탁선미 한국문화예술위원회 문학지원부 대리를 만나봤다.    -나의 첫 책 프로젝트의 기획 의도는.     “문학 분야에서 첫 책을 발간한 도서를 통해 문학나눔 도서보급사업의 저자-보급처, 독자를 연계해 독자들에게 문학 향유의 기회 확대를 마련하기 위해 프로젝트를 기획했습니다. 첫 책을 발간한 작가들은 상대적으로 자기 작품을 선보이고 이야기할 자리가 부족해 문학나눔 도서보급사업에 선정된 작가 중 첫 책 작가를 조명하고 그들의 이야기를 들어보는 시간을 가지고자 했습니다.”    -책이 가지고 있는 의미는 무엇인가.     “사람들과 대면하는 것도 주저하게 되는 지금, 그 어느 때보다 문학이 필요하다고 생각합니다. 책을 통해 보다 삶을 깊게 들여다볼 수 있고 미처 알지 몰랐던 분야와 타인의 삶 등을 깊게 바라보며 자아를 확장할 수 있다고 생각합니다. 책을 통해 세상을 만날 수 있도록 문화적 다양성을 확보하는 것이 중요합니다.”         ‘나의 첫 책 프로젝트’에서 진행한 관객과 북토크 중인 에세이 ‘뭐든 해 봐요’의 김동현 작가.   -나의 첫 책 프로젝트가 더 많은 작가들에게 도움이 되기 위해 필요한 게 있다면.     “첫 책 작가마다 고유의 특색을 살리며 독자들과 소통할 수 있도록 북 토크 프로그램 기획에 집중할 것이며 적극적으로 홍보할 계획을 하고 있습니다. 다양한 문학프로그램을 제공해 첫 책 작가들의 창작활동을 도와 국민들의 향유 기회를 증진할 수 있도록 문학을 더 가까이에서 홍보할 예정입니다.”    -출판계의 미래와 예술위가 할 역할은 무엇인가.     “종이책을 제외한 전자책, 오디오북 등 출판 형태는 다양화해지고 있습니다. 종이책을 읽는 사람들은 줄어들고 있지만, 그렇다고 해서 전자책과 오디오북을 사용하는 사람들이 대폭 증가하고 있는 현실도 아닙니다. 이렇듯 출판시장의 변화에 대응해 공적자금이 필요한 곳에 적절하게 지원할 수 있도록 노력하는 것이 예술위의 역할이라고 생각합니다. 또한 책을 읽지 않는 사람들에게 책을 더 가까이 다가갈 수 있도록 다양한 독서환경을 마련하는 것이 예술위의 역할이라고 생각됩니다.” ]",[],https://www.viva100.com/main/view.php?key=20221226010008028,https://n.news.naver.com/mnews/article/022/0003768918?sid=103
2022.12.28.,경향신문,,"교육부, 위기학생 지원 통합해 복지 사각지대 없앤다",,,https://www.khan.co.kr/national/education/article/202212281612001,http://www.edupress.kr/
2022.12.28.,경향신문,,"교육부, 위기학생 지원 통합해 복지 사각지대 없앤다",,,https://www.khan.co.kr/national/education/article/202212281612001,http://www.khan.co.kr/
