Date,Press,Category,Title,Content,Comment,URL_Origin,URL_Naver
2021-12-30 10:28:00,연합뉴스,사회,"8대째 전통 옹기 제작 정대희씨, 무형문화재 보유자 됐다","[    제주시는 4분기 시정 홍보를 적극적으로 펼친 8개 우수 부서와 홍보 MVP 3명을 선정해 30일 발표했다.     ▲.ⓒ제주시  시정 홍보 최우수부서는 문화예술과 애월읍 아라동이 선정됐고, 우수부서는 여성가족과 한림읍 노형동이 장려 부서는 주민복지과 연동이 차지했다. 홍보 MVP에는 마을활력과 박태근 팀장 정보화지원과 김영대 주무관 문화예술과 홍관표 주무관이 각각 선정됐다. 이번 지난 10월~12월까지 제주시청 전 부서와 26개 읍면동을 대상으로 보도자료 제공 건수와 언론보도 실적 등을 종합적으로 평가했다. 선정된 부서에는 상장과 최우수 30만 원 우수 20만 원 장려 10만 원씩 탐나는전 상품권이 지급되며 홍보 MVP에게도 상장 및 탐나는전 상품권 10만 원이 지급된다. 제주시 관계자는 “시민들에게 편의를 줄 수 있는 다양한 정책을 지속적으로 발굴해 홍보를 펼칠 예정”이라며 “시정 공유와 소통을 통해 신뢰 받는 소통으로 여는 행복한 제주시를 만들어 나가는 데 최선을 다할 계획”이라고 밝혔다.  ]",[],http://yna.kr/AKR20211229061000053?did=1195m,https://n.news.naver.com/mnews/article/002/0002225412?sid=102
2021.12.31.,서울와이어,,"함평군 청소년문화의집, 청소년수련시설 종합평가 최우수기관 선정",,,http://www.seoulwire.com/news/articleView.html?idxno=458636,https://www.yna.co.kr/
2021-12-29 11:06:03,프라임경제,생활/문화,"ECI 테크 한국지사, 경기도 소외계층 아동 지원","[     상주 옹기장 정대희씨[상주시 제공. 재판매 및 DB 금지]    (상주=연합뉴스) 홍창진 기자 = 경북도 무형문화재인 '상주 옹기장' 정대희(62)씨가 도지정 무형문화재 보유자로 인정됐다.    29일 상주시에 따르면 정씨는 도 문화재 위원 현장 심사를 거쳐 11월 15일부터 30일간 인정 예고를 통해 이해 관계자 의견 수렴 후 최종적으로 무형문화재 제25-다호 보유자가 됐다.    옹기장이란 독과 항아리 등을 만드는 장인을 가리킨다.     정씨는 20대부터 아버지인 고(故) 정학봉(1930-2018) 기능 보유자로부터 옹기 만들기를 익혀 40여 년 이상 옹기업에 종사했다. 아들과 딸, 손자가 가업을 이어받아 8대째 전통 옹기 제작 과정을 재현하고 있다.    그가 만드는 옹기는 상주지역 전통 제작 기법을 충실히 전승할 뿐 아니라 지역적 특징을 잘 지닌 것으로 평가된다.    강영석 시장은 ""어려운 여건 속에서 가업을 계승해 문화유산을 지키는 옹기장 가족들에게 존경을 표한다""며 ""상주의 소중한 전통문화와 무형문화유산을 적극적으로 발굴하고 지원하겠다""고 밝혔다.    realism@yna.co.kr ]",[],http://www.newsprime.co.kr/news/article.html?no=558612,https://n.news.naver.com/mnews/article/001/0012810821?sid=103
2021.12.29.,연합뉴스,,"[골프소식] KLPGA, 16개교에 골프연습장 설치 지원",,,http://yna.kr/AKR20211229135700007?did=1195m,http://www.seoulwire.com
2021.12.31.,톱스타뉴스,,"'인성 재벌' 영탁, 아이돌 차트 최고의 기부 스타로 영탁 선정…""위기가정 아...",,,http://www.topstarnews.net/news/articleView.html?idxno=14660683,http://www.newsprime.co.kr
2021.12.29.,뉴스핌,,민주당 '문화강국 충북위' 출범...예술가 513명 참여,,,http://www.newspim.com/news/view/20211229000977,https://www.yna.co.kr/
None,뉴스1,,"HDC현산, 근로자 중심 안전문화 정착…안전경영실 신설",[],[],https://www.news1.kr/articles/?4538506,https://sports.news.naver.com/news.nhn?oid=001&aid=0012821726
2021.12.30.,대한경제,,"황숙주 순창군수, 건강가정·다문화가족 우수 지자체장 선정",,,https://www.dnews.co.kr/uhtml/view.jsp?idxno=202112301151132840807,http://www.TopStarNews.Net
2021.12.27.,연합뉴스,,"충남·세종교육청, 다문화 가정 지원 도움 자료 펴내",,,http://yna.kr/AKR20211227092500063?did=1195m,http://www.newspim.com
2021.12.31.,뉴스토마토,,"(신년사)권칠승 중기부 장관 ""소상공인 위기 극복과 경쟁력 강화 지원""",,,http://www.newstomato.com/ReadNews.aspx?no=1097349&inflow=N,http://news.etomato.com/
2021.12.30.,헤럴드경제,,항만사용료 6개월·해운업 긴급자금지원 1년 연장…18개 신직업 발굴,,,http://news.heraldcorp.com/view.php?ud=20211230000048,http://www.heraldbiz.com/
2021-12-30 08:37:02,CNB뉴스,경제,"부산시, ‘빅데이터 분석사업 완료 보고회’… 경제·생활·문화 등 활용","[ 여행·관광 등 특별고용지원업종 지정 연장 내년 1분기에 검토내달 직접일자리 60만명이상 조기 채용 추진    홍남기 부총리 겸 기획재정부 장관이 30일 정부서울청사에서 열린 '제51차 비상경제 중앙대책본부회의'를 주재하고 있다. [연합][헤럴드경제=배문숙 기자]정부가 항만사용료와 터미널 임대료 감면 조치를 내년 6월까지 6개월 연장한다. 8000억원 상당의 해운업 긴급경영안정자금 등 금융지원 조치는 내년까지 이어간다.또 다음달 직접 일자리 60만명 이상 조기 채용을 추진하고 메타버스 크리에이터 등 18개의 새로운 직업을 발굴해 국가 자격을 도입키로 했다.정부는 30일 정부서울청사에서 홍남기 부총리 겸 기획재정부 장관 주재로 비상경제 중앙대책본부회의를 열고 이같이 밝혔다.우선, 공공 부문의 소상공인 임대료 감면, 공과금·사회보험료 납부 유예를 연장키로 했다. 내년 3월까지로 설정한 여행·관광·숙박업 등 14개 특별고용지원업종 지정 조치는 1분기 중 연장 여부를 검토한다.홍 부총리는 ""코로나19 상황에서 한시적 지원조치를 점검해 긴급성·효과성이 있는 조치는 존치하고 어느 정도 목표를 달성한 조치는 종료하는 등 질서 있는 정상화를 진행할 것""이라고 말했다.일례로 정부는 특수목적법인(SPV)의 회사채·기업어음(CP) 매입 조치를 예정대로 올해 말에 종료하기로 했다. 향후 시장 상황 악화에 대비한 비상 대응조치만 남겨두기로 했다. 은행의 선물환 포지션 한도 정상화나 외화 LCR 규제비율 하향 조치의 연장 여부는 추후 시장 여건을 봐가며 결정하기로 했다.또 신기술·융합, 교육·의료, 문화·여가, 농림·수산, 환경 등 5개 분야에서 메타버스 크리에이터, 콘텐츠 가치 평가사 등 총 18개의 신직업을 발굴해 국가자격 도입, 전문인력 양성 프로그램 개발·운영 등 시장 안착을 지원할 계획이다. 취약계층 지원강화 측면에서 내년 1월 중 직접 일자리 60만명 이상 조기 채용을 추진하고, 고용촉진장려금 지급 확대도 적극적으로 추진하기로 했다.정부는 내년이 한국판 뉴딜 2.0을 본격 시행하는 첫해이자, 탄소중립 목표 이행을 위한 원년이 되는 매우 중요한 시기란 점에서 10대 중점과제를 미리 선정하고 과제별 세부 실행계획을 논의했다. 뉴딜 2.0의 경우 ▷청년정책 및 돌봄교육 격차 완화 ▷그린에너지 모빌리티 확산 등 6개 과제, 탄소중립의 경우 ▷배출권거래제 개선 ▷기후 대응 기금 등 4개 과제가 선정됐다.특히 정부는 대학생 국가장학금 확대 등 국민 체감도가 높은 사업과 태양광 연구개발(R&amp;D)센터, 노동 전환분석센터 조성 등 기반 사업은 내년 1월부터 속도감 있게 시행할 예정이다.홍 부총리는 ""올해 취업자 수가 당초 전망보다 10만 명 늘어난 전년 대비 35만명 증가하고 코로나19 위기 전 수준을 복구할 것으로 예상된다""라면서도 ""디지털·기술혁신 등으로 인한 노동시장 구조변화에 더 적극 대응할필요가 있다""고 말했다.　 ]",[],https://www.cnbnews.com/news/article.html?no=526452,https://n.news.naver.com/mnews/article/016/0001930973?sid=101
2021.12.29.,연합뉴스,,"고양시, 내년 성평등 기금 지원사업 공모",,,http://yna.kr/AKR20211229026500060?did=1195m,http://www.cnbnews.com
2021.12.28.,연합뉴스,,강원 정선·충남 공주 등 4개 성장촉진지역 개발에 국비지원,,,http://yna.kr/AKR20211227158900003?did=1195m,https://www.yna.co.kr/
2021-12-29 08:51:29,오마이뉴스,사회,"성남시, 노인·치매 통합지원 상담콜센터 운영","[    (고양=연합뉴스) 노승혁 기자 = 경기 고양시는 성평등 사업을 발굴하고 지원하기 위해 2022년 고양시 성평등 기금 지원사업을 공개 모집한다고 29일 밝혔다.    고양시, 성평등 기금 지원사업 공모 [고양시 제공. 재판매 및 DB 금지]    총 지원금액은 9천800만원이며, 사업 규모와 성격에 따라 기관(단체)별로 최대 1천만원까지 지원한다.    공모사업 분야는 ▲ 성평등 문화 확산 ▲ 폭력근절과 인권 보호 ▲ 가족관계 증진 ▲ 여성 경제활동 촉진 ▲ 일·생활 균형 지원 ▲ 여성 참여 활성화 등 6개다.    신청 자격은 공고일 현재 고양시에서 성평등 문화 확산 및 여성 권익 증진을 위해 활동하는 비영리법인 또는 비영리민간단체다.    내년 1월 18∼20일 고양시청 여성가족과(☎031-8075-3343)로 방문해 신청하면 된다.     신청 사업은 사업 적합성, 금액산정의 적정성, 단체 수행 능력 등을 고려해 고양시 성평등위원회가 심사한다.     시는 2월 중 지원 단체를 최종 선정할 예정이다.    nsh@yna.co.kr ]",['윤석렬 승 ! 도둑들을 처단하라!!!'],http://www.ohmynews.com/NWS_Web/View/at_pg.aspx?CNTN_CD=A0002798745&CMPT_CD=P0010&utm_source=naver&utm_medium=newsearch&utm_campaign=naver_news,https://n.news.naver.com/mnews/article/001/0012810177?sid=102
2021.12.29.,티브이데일리,,"안테나, 저소득 가정 아동·청소년 문화 지원에 천만원 기부",,,http://www.tvdaily.co.kr/read.php3?aid=16407361681619149010,https://www.yna.co.kr/
2021-12-28 06:00:01,스타뉴스,경제,"매일-킹스웨이코리아, 소외계층에 분유 지원","[ 국토부 국토정책위, 4개 시·군 지역개발계획 변경안 승인(세종=연합뉴스) 김동규 기자 = 국토교통부는 강원도 등 지자체가 신청한 지역개발계획 변경안을 국토정책위원회 심의를 거쳐 최종 승인했다고 28일 밝혔다.    정부는 국가 균형발전 차원에서 지역의 발전을 지원하기 위해 5년 주기로 인구감소와 재정 여건 등 상황을 평가해 지원이 필요한 지방의 시·군을 성장촉진지역으로 지정하고 있다.    지금까지 총 70곳이 성장촉진지역으로 지정돼 해당 지역개발사업에 국가 예산이 투입되고 있다.    성장촉진지역 지정 현황[국토교통부 제공, 재판매 및 DB 금지]국토부는 이번 심의에서 2018년 9월 성장촉진지역으로 신규 편입된 강원 정선군과 충남 공주시, 경북 안동시, 전남 영암군 등 4곳에서 추진할 지역개발사업 11건을 지원하기로 했다. 한 곳당 예산 150억원을 지원한다.    정선에서는 정선읍 봉양리∼애산리 구간에 아리랑 클러스터 연결 교량을 설치해 관광네트워크를 구축하고, 폐광지역의 숙원사업인 국도 38호선과 군도 7호선 접속도로(467ｍ)를 건설한다.    공주에서는 백제권 문화콘텐츠를 활용한 공주 문화 관광지 조성사업의 시설 건립을 지원한다. 문화복합센터와 백제문화체험관 등의 시설과 스마트주차장 등 기반시설 조성에 지원 예산이 사용될 예정이다.    안동에서는 원도심 공동화에 대응하기 위해 옛 안동역 및 철도용지를 활용한 연결도로와 선형광장 설치 사업을 추진한다.    영암에서는 월출산 관광지에 추진 중인 체험형 레저시설과 연계한 도로·주차장 확장을 추진한다.    국토부 관계자는 ""올해 심의에서는 투자유치 지연 등으로 추진이 불분명한 사업을 대체할 신규 사업을 발굴하는 등 계획의 내실을 기하기 위해 노력했다""며 ""변경된 지역개발계획이 속도감 있게 추진돼 지역 활력 회복에 기여하도록 지원하겠다""고 말했다.    dkkim@yna.co.kr ]",[],http://star.mt.co.kr/stview.php?no=2021122912185843657,https://n.news.naver.com/mnews/article/001/0012807742?sid=101
2021.12.30.,충청뉴스,,"서산시, 책 읽는 문화도시로... 도서관, 문화행사 풍성",,,http://www.ccnnews.co.kr/news/articleView.html?idxno=243496,http://www.ohmynews.com/
2021-12-29 16:36:01,뉴스워커,사회,"함평군 청소년문화의집, 청소년수련시설 종합평가... '최우수기관' 선정","[ 전문 상담원 2명 배치... 노인, 치매 환자, 가족 상담 전담            ▲  경기 성남시가 내년 1월 3일부터 ‘노인·치매 통합지원 상담콜센터 운영에 들어간다.            ⓒ 성남시  경기 성남시가 내년 1월 3일부터 '노인·치매 통합지원 상담콜센터 운영에 들어간다. 29일 시에 따르면 상담콜센터는 시청 노인복지과에 신설되는 노인치매팀에 속해 치매 환자와 가족 상담을 전담한다. 콜센터 대표번호는 정보 취약계층인 노인들이 쉽게 떠올릴 수 있도록 '팔팔하게(88), 구십구세까지(99) 살자'라는 의미를 부여해 만들었다.전문 상담원 2명이 배치돼 문의 전화에 수요자 중심의 맞춤형 상담을 한다. 노인복지, 치매와 관련된 궁금증을 풀어주고, 통합돌봄 정보를 제공한다. 필요하면 외부 자원을 연계해 준다. 상담콜센터 운영 시간은 평일 오전 9시부터 오후 6시까지다.상담콜센터가 속한 시청 노인치매팀은 성남지역 의료·복지·돌봄·문화·안전·보호 분야 9개 기관·단체와 함께 돌봄서비스를 추진한다. 이를 위해 성남시는 앞선 11월 15일 성남시의사회·성남시의료원(의료), 성남시노인종합복지관협회·성남시복지회관연합회(복지), 재가장기요양기관협회·성남시독거노인종합지원센터(돌봄), 성남문화재단(문화), 성남소방서(안전), 성남중원경찰서(보호)와 '노인·치매 통합지원 네트워크 구축'에 관한 업무협약을 했다.12월 현재 성남시의 65세 이상 노인 13만2000명 중에서 약 9%인 1만2000명이 치매 환자다. ]",[],http://www.newsworker.co.kr/news/articleView.html?idxno=142526,https://n.news.naver.com/mnews/article/047/0002337384?sid=102
2021.12.31.,로이슈,,"골프존카운티, 북한이탈주민 캐디 지원 사업으로 통일부 장관 표창 수상",,,http://www.lawissue.co.kr/view.php?ud=202112310902378320204ead0791_12,http://www.lawissue.co.kr
2021.12.31.,영남일보,,"김승수 의원, 뮤지컬 독립장르 규정 '공연법' 등 문화진흥 4법 처리 성과",,,https://www.yeongnam.com/web/view.php?key=20211231010003881,http://www.yeongnam.com
2021.12.31.,한강타임즈,,"용산구, 1일부터 '가정용 음식물 감량기' 구매지원",,,http://www.hg-times.com/news/articleView.html?idxno=236861,http://www.hg-times.com
2021.12.30.,뉴스1,,"대한수영연맹, 2021 어르신 체육활동 지원 사업 성료",,,https://www.news1.kr/articles/?4539423,http://news1.kr/
None,일요시사,,"삼천리ENG 외식사업본부, 소외계층 아동 위해 밀키트 지원 나서",[],[],https://www.ilyosisa.co.kr/news/article.html?no=232808,https://sports.news.naver.com/news.nhn?oid=421&aid=0005814880
2021.12.31.,인천투데이,,인천 '일회용품 없는 장례문화' 조성 민간장례식장 동참,,,http://www.incheontoday.com/news/articleView.html?idxno=214169,http://ilyosisa.co.kr
2021.12.29.,데일리한국,,"대전시교육청, 내년 학생자치활동 지원 확대",,,https://daily.hankooki.com/lpage/society/202112/dh20211229141955148500.htm?s_ref=nv,http://www.incheontoday.com/
2021.12.31.,뷰어스,,"함평군 청소년문화의집, 청소년수련시설 종합평가 최우수기관 선정",,,http://theviewers.co.kr/View.aspx?No=2167552,http://daily.hankooki.com
2021.12.28.,뉴시스언론사 선정,,정선·공주·안동·영암 성장촉진지역 선정…600억 국비 지원,,,http://www.newsis.com/view/?id=NISX20211227_0001703337&cID=10401&pID=10400,http://www.theviewers.co.kr
2021.12.29.,동아일보,,"매일유업, 소외계층에 분유제품 지원…3800만 원 상당",,,https://www.donga.com/news/article/all/20211229/110996557/1,http://www.newsis.com
2021.12.31.,충청뉴스,,"골프존카운티, 북한이탈주민 캐디 지원 사업으로 '통일부 장관 표창'",,,http://www.ccnnews.co.kr/news/articleView.html?idxno=243717,http://www.ccnnews.co.kr/
2021.12.29.,동아일보,,"매일유업, 소외계층에 분유제품 지원…3800만 원 상당",,,https://www.donga.com/news/article/all/20211229/110996557/1,http://www.donga.com/
2021-12-29 10:23:01,뉴스1,경제,민주당 '문화강국 충북위원회' 출범…예술가 513명 참여,"[     매일유업이 소외계층 가정에 3800만 원 상당의 분유제품을 지원한다고 29일 밝혔다.매일유업은 전날 액상분유 8000여개와 조제분유 1300여캔을 킹스웨이코리아 측에 전달했다. 전달된 제품은 국내 이주 노동자가정과 다문화가정, 미혼모가정 등 소외계층의 영유아들에게 전해질 예정이다.매일유업 관계자는 “추운 겨울철 어려운 상황에 처한 소외계층 가정의 사연을 듣고 물품 기부를 하게 됐다”며 “앞으로도 우리 주변의 어려운 이웃들에게 온정의 손길이 이어지길 희망한다”고 말했다.한편 지난해 11월 온누리교회 산하 조직으로 활동을 시작한 킹스웨이코리아는 국내 제약회사 등 기업의 후원을 받아 의료 접근성이 취약해 제대로 된 치료를 받지 못하는 제3세계의 가난한 환자들과 우리 주변의 어려운 이웃에게 무상으로 의료자원과 구호물품을 지원하고 있다. ]",['좋은일 해주셔서 감사합니다! 소수의 아픈 아이들을 위한 분유도 만들어 주고 착한 기업. 매일우유 많이 먹을게요'],https://www.news1.kr/articles/?4538360,https://n.news.naver.com/mnews/article/020/0003402644?sid=101
2021.12.26.,뉴시스언론사 선정,,"광주문화재단, 2022예술인 지원…24억1000 만원",,,http://www.newsis.com/view/?id=NISX20211223_0001699661&cID=10701&pID=10700,http://news1.kr/
2021-12-29 16:04:55,데일리안,사회,도시재생에 '생활밀착' 스마트기술 접목…총 105.6억 지원,"[ ""내년 대선 승리해 문화강국 원년 만들겠다""    '대한민국대전환 선대위 문화강국 충북위원회' 출범식이 29일 오전 더불어민주당 충북도당 대회의실에서 열리고 있다.(더불어민주당 충북도당 제공).2021.12.29/© 뉴스1(청주=뉴스1) 엄기찬 기자 = 더불어민주당 '대한민국대전환 선대위 문화강국 충북위원회'가 출범했다.민주당 충북도당은 29일 도당에서 중앙당 선대위 문화강국위원장인 도종환 국회의원과 김문수·김은숙·김희식 충북위원회 상임위원장 등이 참석한 가운데 출범식을 했다. 이들은 선언문에서 ""2022년은 대한민국 대전환으로 모든 국민이 문화와 예술로 풍요로운 삶을 평등하고 공정하게 누릴 수 있는 문화강국으로 가는 원년이 돼야 한다""고 밝혔다. 그러면서 ""충북위원회는 대한민국이 문화강국으로 가는 뜻깊은 대전환의 시대에 동참해 우리나라가 세계가 부러워하는 문화선진국이 되는 그날을 앞당길 것""이라고 다짐했다.참석자들은 '이재명은 합니다', '문화강국'이 적힌 손피켓 퍼포먼스도 하고 내년 대선에서 승리해 2022년을 민주정부 4기 문화강국 원년으로 만들겠다고 선언하기도 했다. 충북지역 예술가 513명이 참여한 '문화강국 충북위원회'는 고문단, 공동위원장, 지역위원장, 장애인예술위원장, 생활예술위원장, 정책특위, 사무처 등으로 구성됐다.문화기본권 실현을 위한 풍요로운 생활문화 여건 조성, 생활예술인을 위한 예술활동 생태계 마련, 장애인 문화예술 향유 기회 확대, 청년예술가 지원 제도 확대 등에 나설 계획이다.도종환 위원장은 ""이재명 후보가 펼쳐갈 문화예술 정책이 꿈에 그치는 것이 아닌 우리 현실이 될 수 있도록 문화강국충북위원회가 든든한 뒷심이 돼 주길 바란다""고 밝혔다.   ]",[],https://www.dailian.co.kr/news/view/1068246/?sc=Naver,https://n.news.naver.com/mnews/article/421/0005812922?sid=102
2021.12.28.,지디넷코리아언론사 선정,,"효성-서울문화재단, 올해의 작가에 홍세진 작가 선정",,,https://zdnet.co.kr/view/?no=20211228175003,http://www.newsis.com
2021-12-26 11:52:21,에너지플랫폼뉴스,생활/문화,"삼천리ENG 외식사업본부, 소외계층 위한 밀키트 지원","[    [광주=뉴시스]  류형근 기자 = 코로나19 확산으로 어려움을 겪고 있는 지역 예술인들을 위한 지원 예산이 증액됐다. 광주문화재단은 2022년도 문화예술인 지원 예산이 24억1000만원으로 확정돼 지난해 보다 4억원 늘었다고 26일 밝혔다.지역문화예술특성화지원사업 213건에 16억9000만원이며 공연장상주단체육성지원사업 4억원, 야외공연창작지원사업 1억6000만원이다.신규로 광주문화자산콘텐츠화제작에 1억5000만원이 지원된다.지역문화예술특성화지원사업은 가장 먼저 시작되며 문학·미술·음악·연극·무용·전통·다원 등 문화예술 전 분야 예술인이 대상이다. 창작공간프로그램에 1억8000만원, 문화예술교류지원 1억원, 지역문화예술육성지원 11억5000만원, 청년예술인창작지원 2억6000만원이다. 또 내년부터는 지원을 받기 위해 제출하는 실적증빙 자료가 최소화 되며 지원액이 일정하지 않아 예산을 세우지 못한 예술인들을 위해 '정액'이 지원된다.지원사업 심의 전문성과 객관성 강화를 위해 신청자가 예비 심사위원을 직접 추첨하는 무작위 추첨방식도 도입된다. 다만 개인 예술인은 최근 1년, 단체는 4년 연속지원을 받은 경우 내년 공모에 지원할 수 없다. 지원사업 공모 접수는 내년 1월17일~28일까지 이며 오는 27일 오후 2시 빛고을시민문화관 2층 공연장에서 사업 설명회가 진행된다. 광주문화재단 관계자는 ""코로나19 여파로 창작 등의 활동이 어려운 지역 예술인을 위해 지원 규모가 늘었다""며 ""예술인의 의견이 반영됐다""고 밝혔다． ]",[],http://www.e-platform.net/news/articleView.html?idxno=71150,https://n.news.naver.com/mnews/article/003/0010909414?sid=103
2021.12.30.,경남도민신문,,거제도서관 병영 독서문화 활성화 지원,,,http://www.gndomin.com/news/articleView.html?idxno=302022,http://www.dailian.co.kr/
