Date,Press,Category,Title,Content,Comment,URL_Origin,URL_Naver
2019.05.10.,세계일보,,"네이버랩스, '에어카트 오픈키트' 81단체에 무상 지원","[    외식배달시장이 고속성장하면서 업체들 간 경쟁이 치열해지고 있다. 1위인 배달의민족에 2위인 요기요가 도전을 선언한 가운데 쿠팡, 위메프 등 e커머스 업체들이 신규로 시장에 참여하고 있다. 기존 IT 공룡인 네이버와 카카오도 이미 반쯤 발을 담근 상태다. 여기에 배달대행서비스를 제공하는 이륜물류회사들과 대형 프랜차이즈들까지 배달앱 회사들과 활발하게 협업을 하면서 배달시장은 더욱 복잡하게 돌아가고 있다.      배달의민족X세바시 강연회 연사들왼쪽부터 김일도, 조병준, 신선희, 윤태승, 임성환 사장 ▶성장궤도에 오른 배달시장 배달앱 업계 1위 ‘배달의민족(배민)’을 운영하는 우아한형제들(대표 김봉진)은 지난 3월 2018년 재무 실적을 비롯해 배달의민족의 주요 지표를 공개했다. 배달의민족을 통해 이뤄지는 거래금액, 즉 자영업자들의 최종 매출은 5조2000억원을 기록해 전년 대비 73%나 늘어났다. 이를 통해 국내 배달음식 시장 규모는 2017년 약 15조원에서 2018년에는 20조원 이상으로 성장한 것으로 추정했다. 이 중 배달의민족이 전체 거래의 약 4분의 1을 차지하고 있다. 2018년 12월 기준 배민의 월 이용자수(MAU)는 900만 명, 월 주문수도 2800만 건을 넘어서 1년 전에 비해 각각 50% 이상 증가했다. 배달의민족은 1인 가구, 맞벌이 부부, 밀레니얼 세대 등 인구 변화와 고객 트렌드의 변화와 함께 지난해 폭염, 혹한, 미세먼지 등 환경 요인이 배달주문이 늘어나는 데 영향을 미친 것으로 보인다고 분석했다. 특히 기존에 배달을 하지 않던 매장, 혹은 배달만을 전문으로 하는 매장들이 배달에 뛰어든 것이 시장을 키웠다. 배달의민족의 매출도 2017년 1519억원에서 2018년 2722억원으로 79% 성장했다. 배달의민족을 운영하는 우아한형제들의 2018년 전체 매출도 3192억원, 영업이익 586억원을 기록해 우아한형제들의 영업이익률은 18.3%에 달했다. 국내 배달시장의 지배적인 플랫폼으로 확고한 자리를 잡은 것이다. 배달의민족이 공개한 수치는 배달시장이 급성장하고 있다는 것을 확실히 보여준 셈이다. 이처럼 커지는 시장에서 2위인 딜리버리히어로코리아(요기요, 배달통 운영)가 연초부터 대대적으로 배달의민족에 포문을 열었다. 요기요는 지난 2월부터 BBQ와 손잡고 ‘반값치킨’ 이벤트를 벌이고 1만8000원인 BBQ치킨을 9000원에 판매했다. 이중 절반인 4500원을 요기요에서 부담했다. 이 효과로 요기요는 앱 다운로드 수가 1월 대비 150% 증가하는 등 신규고객이 폭발적으로 늘었다. 딜리버리히어로코리아는 올해 순수 마케팅 비용만 1000억원 이상을 쓰겠다면서 실탄을 잔뜩 준비해놨다고 밝혔다.  배달의민족도 맞불작전에 나섰다. 배민은 얼마 전부터 주요 치킨 프랜차이즈 브랜드에서 사용할 수 있는 1만6000원짜리 할인쿠폰을 선착순으로 매일 1만 명에게 배포했다. 배달의민족은 업종을 바꿔서 월말까지 대규모 할인 이벤트를 진행한다. 배달의민족이 반격에 나서자 요기요는 매일 오후 5~9시 모든 치킨 주문에 4000원 할인 이벤트를 여는 등 양측의 마케팅 전쟁이 점차 가열되고 있다.        1,2위 업체가 할인 전쟁에 나서는 동안 알게 모르게 영향력을 확대하고 있는 것은 네이버다. 네이버는 네이버페이와 연동된 ‘간편주문’으로 모바일 화면에서 바로 배달주문을 할 수 있는 시스템을 구축했다. 특히 치킨, 피자, 햄버거, 분식 업종의 경우 대형 프랜차이즈 본사와 손을 잡고 대부분 ‘간편주문’이 가능한 상태다. 현재 네이버로 대형 외식 프랜차이즈를 검색할 경우 등록된 주소 인근에 있는 가맹점에 주문을 하는 것이 가능하다. 이 경우 가맹점의 선택에 따라 간편주문으로 바로 주문하거나, 배달의민족·요기요로 연결하거나, 전화로 주문하는 것이 모두 가능하다.  네이버 ‘간편주문’의 최대 강점은 현재 도입단계라 가맹점에 주문 수수료를 받지 않는다는 것이다. 배달의민족이나 요기요에 비해 확실한 장점이다. 네이버는 간편주문으로 첫 주문을 하는 고객에게는 2000원과 함께 1%를 적립시켜주고 재주문 고객에게는 구매금액의 3%를 적립해주는 등 파격적인 마케팅으로 외식 주문고객들을 네이버페이와 간편주문으로 끌어들이려고 노력중이다.   메신저에서 벗어나 최근 모빌리티 등 다양한 영역으로 진출하고 있는 카카오도 ‘카카오 주문하기’를 통해 배달앱 시장에 진출했다. 다만, 카카오 주문하기는 직접 영업을 하지 않고 배달대행 회사들을 통해 가맹점에 영업을 하고 있어서 실제 주문량은 많지 않은 것으로 알려졌다. 카카오가 네이버처럼 본격적으로 드라이브를 건다면 상황은 달라질 수도 있다.  한편 e커머스업체인 쿠팡과 위메프도 배달앱 시장에 진출을 선언했다. 쿠팡은 4월 15일부터 서울 일부지역에서 배달 서비스 ‘쿠팡이츠’ 시범 운영을 시작했다. 방식은 ‘쿠팡 플렉스’처럼 전문 배송원이 아닌 일반인이 배달하는 방식으로 이뤄진다. 2017년 국내에서 서비스를 시작한 우버이츠와 거의 유사한 방식이다. 위메프는 기존에 운영하던 O2O 서비스 위메프오에 ‘맛집배달’ 서비스를 추가할 예정이다. 현재 위메프오를 통해 픽업주문 서비스를 제공하고 있는데 이를 배달에까지 확대하는 것이다.  그러나 후발업체들이 배달의민족과 요기요를 따라잡기는 쉽지 않을 전망이다. 현재 식당에서는 배달의민족과 요기요를 통해 주문을 받는 것이 보편화되어있는 상황인데 두 업체를 비집고 들어가기가 쉽지 않기 때문이다. 식당들은 많은 주문이 들어오는 서비스를 사용하려고 하기 때문에 주문건수가 많지 않은 신규업체들은 선택되기가 어렵다. 또한 식당들을 가입시키고 POS를 관리하는 업무는 영업력과 촘촘한 네트워크가 필요한데 이는 신규업체들이 갖기 어려운 부분이다.  다만 업계에서는 네이버에 대해서는 위협적으로 보고 있다. 네이버의 경우 검색과 결제가 결합된 모델을 가지고 있기 때문이다. KTB투자증권에 따르면 지난해 4분기 기준 네이버페이 거래대금은 3조4000억원에 달했고 가맹점수도 26만 개에 달했다. 네이버에서 검색 후 바로 쇼핑을 하는 고객수가 그만큼 많다는 것이다. 이런 고객들의 경우 별도로 배달의민족이나 요기요 같은 앱을 열기보다는 검색 후 손쉽게 네이버 간편주문을 하는 것을 선호할 수 있다. 또한 네이버가 배달앱 1위인 배달의민족과 배달대행업체인 메쉬코리아에 투자해 중요 배달관련 업체들과 네트워크를 갖고 있다는 점도 네이버에 유리한 부분이다.  강신봉 딜리버리히어로코리아 대표는 3월에 개최한 기자간담회에서 “배달앱과의 경쟁에서 나아가 쿠팡, 위메프 등 이커머스와의 본격 경쟁을 앞두고 있다”면서 “또 이 시장을 거대 공룡 네이버가 그냥 두지 않을 것이라는 두려움도 있다”고 밝히기도 했다.       강신봉 딜리버리히어로코리아 대표가27일 오전 서울 서초구 딜리버리히어로 코리아 본사에서 열린첫 번째 기자간담회에서 인사말을 하고 있다. ▶합종연횡 나서는 플레이어들 배달시장은 크게 배달앱, 배달대행회사, 매장의 3개 플레이어로 나눠져 있다. 매장의 경우 대부분 자영업자이지만 대형 프랜차이즈일 경우 본사가 중요한 플레이어로 활동하고 있다. 또한 소비자들에게는 잘 드러나지는 않지만 배달대행회사들도 중요한 플레이어로 부상하고 있다. 매장들이 점차 직접 배달원을 고용하기보다 배달대행업체 사용을 선호하기 때문이다. 배달시장이 커지면서 이 플레이어들 간의 합종연횡도 복잡해지고 있다. 가장 흔한 것은 대형 프랜차이즈와 배달앱의 협업이다. 단순히 할인 등 공동 마케팅을 하는 것이 아니라 공동 광고 캠페인을 하거나 독점적인 제휴를 맺기도 한다. 최근 버거킹은 배달의민족과 손을 잡고 ‘버거킹도 우리민족이었어’ 광고 캠페인을 진행했다. 단순히 할인행사만 하는 것이 아니라 함께 TV나 버스 광고를 집행하고 컬래버레이션 팝업북을 내놓는 등 배달의민족을 통해 버거킹 배달주문이 가능하다는 것을 대대적으로 알린 것이다.  토종 패스트푸드인 맘스터치는 지난 4월 요기요와 전략적 업무협약을 체결했다. 요기요를 통해서만 맘스터치 제품을 배달주문할 수 있도록 한 것이다. 그동안 맘스터치 가맹점이 개별적으로 배달을 한 적은 있으나 본사차원에서 한 개 업체와 손을 잡은 것은 처음이다. 요기요는 배민에 비교해 독점적인 콘텐츠를 확보하게된 것이고, 맘스터치는 그동안 취약했던 배달 서비스를 강화할 수 있게 됐다. 배달대행회사와의 협력 사례도 많다. 요기요는 지난해 배달대행회사 바로고에 200억원의 전략적인 투자를 했다. 요기요는 바로고와 손을 잡고 비배달 레스토랑 선점을 위한 전략적 협업 상품인 ‘요고(YOGO)’도 올 상반기에 선보인다. 레스토랑들이 요기요에서 배달 주문 접수 후, 배달대행 접수를 편하고 저렴하게 할 수 있도록 하는 원스톱 딜리버리 솔루션이다. 이디야커피도 배달주문의 경우 바로고와 독점적으로 배달계약을 맺었다. 배민이나 요기요로 주문이 들어올 경우 다른 배달대행이 아닌 바로고 라이더를 통해 배달을 하는 것이다. 배스킨라빈스, 파리바게뜨, 던킨 등 SPC 계열사도 자체 앱인 ‘해피오더’를 통한 주문이 접수되면 바로고를 통해서 배달한다. 배달대행업체인 부릉의 경우 버거킹, 롯데리아 직영점의 주문을 독점적으로 배달한다. 배달시장이 확대되면서 외식 이외로도 배달의 영역이 확대되고 있다. 편의점 CU는 요기요와 손을 잡고 편의점 제품 배달서비스를 시작할 예정이다. 편의점 식품에서 시작해 점차 카테고리를 확장한다는 계획이다. 이 과정에서 이륜물류는 부릉이 맡을 예정이다. 배달의민족의 경우 배민마켓이라는 이름으로 각종 식품과 생활편의용품을 배달해주는 서비스를 시범적으로 운영하고 있다. 현재 송파구에서만 운영 중이나 강남구로도 서비스가 확대될 예정이다. 편의점이나 업체의 물건을 배달만 시켜주는 것이 아니라 배달의민족에서 직접 사입해 재고를 관리한다. 이륜물류는 배달의민족에서 운영하는 ‘배민라이더스’가 맡는다. ▶배달시장 화두로 떠오른 ‘상생’ 지난해 급격한 최저임금인상으로 인건비가 대폭 상승하면서 자영업자와 소상공인이 정치권의 뜨거운 관심사로 떠올랐다. 자연스럽게 자영업자의 다수를 차지하는 외식업 종사자들의 어려움에 대해서도 정치권이 관심을 가지게 됐다. 특히 외식업체들은 배달앱 회사들이 자영업자들로부터 가져가는 수수료가 과도하다는 불만을 쏟아냈다. 결국 지난해 10월에는 김봉진 우아한형제들 대표와 강신봉 딜리버리히어로코리아 대표가 직접 국정감사에 나가게 됐다. 배달앱에 대한 정치권의 압박이 세지면서 배달앱 회사들은 구체적인 ‘상생’ 조치를 내놓고 있다. 배달의민족은 국정감사에서 언급된 ‘슈퍼리스트’를 폐지하고 새로운 개방형 광고 방식을 도입했다. 기존 슈퍼리스트는 경쟁 입찰을 하다 보니 광고료가 높아지고 광고비를 많이 쓸 수 있는 자영업자에게 유리한 제도였다. 하지만 제도가 개편되면서 광고 경쟁은 느슨해졌고 대신 광고를 통해 주문이 들어올 경우 매출의 7%를 수수료 내는 방식으로 바뀌었다. 2015년 8월 폐지했던 중개 수수료를 다시 부활시킨 것이다. 한국외식업중앙회는 이에 대해 환영하는 입장을 밝히기도 했다. 배달의민족은 4월에는 일단위 정산을 도입하고, 자영업자 중소상인을 대상으로 다양한 혜택을 제공하는 ‘제휴 혜택 서비스’를 실시했다. 다른 기업들과 제휴를 통해 세무 관리, 구인 매칭, 소액 대출, 통신, 렌털, 건강 검진, 가전 제품 분야에서 할인 서비스를 제공하는 것이다. 또한 2014년부터 실시해온 자영업자 교육 지원프로그램인 ‘배민아카데미’에 대한 적극적인 홍보에 나섰다. 배달앱에 대한 오해를 해소하고 자신들이 노력하고 있다는 것을 알리기 시작한 것이다. 요기요는 지난해 11월 1만원 이하 주문의 수수료를 없앴다. 배민과 달리 요기요는 매출의 12.5%를 수수료로 받는다. 두 회사는 강원도 산불 피해 지역에 있는 음식점 업주들에게 수수료 및 광고비를 면제하는 등 발 빠른 사회공헌활동을 보여주기도 했다.  이 같은 상생과 사회공헌활동은 이미 과점화된 배달시장에서 중요한 차별화 요소가 될 것으로 보인다. 배민의 경우 2015년 중개 수수료를 폐지하면서 많은 고객들의 지지를 얻어낸 적이 있다. [이덕주 매일경제 유통경제부 기자 ][본 기사는 매경LUXMEN 제104호 (2019년 5월) 기사입니다]▶네이버 메인에서 '매일경제'를 받아보세요▶뉴스레터 '매콤달콤' 구독 ▶무궁무진한 프리미엄 읽을거리[ⓒ 매일경제 &amp; mk.co.kr, 무단전재 및 재배포 금지]   ]","['배민 낚시 이벤트로 배민앱 삭제했다 소비자 우롱 다운받고 결제 했더니 계좌 환불해주네 어이없음..', '배민 사장은 봐라 소비자 우롱 이벤트 하지마라 1만이면 쿠폰 만장만 뿌리지 왜 그이상 뿌려거 결제까지 다 하게하고 결제 취소 하냐 장난하냐', '요기요 어이가없네요 배달할인 3000원 써있어서 배달할인되는줄았았는데 통화해보니 요기요결제시 3000원 할인이라해서 재주문도와드린다해서 그렇게했는데 그래도 배달할인이 안되서 확인해보니 특정메뉴만?3000원 할인이라 하더라구요?기분이 좀 상해서 취소해달라고 말했더니 알겠다하더라구요? 다시 전화와서 주문들어가서 취소안된다고 하더라구요? 배달비까지 주면서 먹고싶지 않아 그냥취소해달라했더니 요기요이제이용못한다는소리나하고 어이가없네요 배민봤더니 무료네요? 어플삭제하고 배민 으로시켜야겠네요 배달비받고 결국배민추가할인해서13000원에 시킴', '라이더에 대한건 없네 콜이 있으면 뭐하나 안잡으면 그만인데', '(참고1) 유통_동향:  ""배달의민족에 요기요·쿠팡·네이버 도전장… 국내 시장 규모만 20조원 판 커지는 배달음식 시장"" / (참고2) ""배달의민족X세바시 강연회 연사들 왼쪽부터 김일도, 조병준, 신선희, 윤태승, 임성환 사장"" &lt;-- (교육) 다운!', '1', '니들땜에 자영업자가 죽는데 뭔소리니?', '1회용기처리비 우아한형제들 너것들이 내야하는거 아니가!?그리고 월관리비 폭탄청구하면서 노트북이나  PC지원안해주나!?세무당국과공정위는 머하노!?', '', '쿠팡은 일반인이 배달한다....수백만명이 배달사원....쿠팡을 이길수없음']",http://www.segye.com/content/html/2019/04/30/20190430509049.html?OutUrl=naver,https://n.news.naver.com/mnews/article/009/0004350341?sid=004
15면 1단,전자신문,,"온라인 광고 분석 툴 '라이브로그', 네이버 클라우드 입정",,,http://www.etnews.com/20190502000364,http://www.newsway.kr
2019-05-13 14:46:02,파이낸셜투데이,,"삼성전자, 스포츠밴드 갤럭시 핏·갤럭시 핏e 출시",,,http://www.ftoday.co.kr/news/articleView.html?idxno=109010,http://www.edaily.co.kr/
2019-05-12 09:56:05,오피니언뉴스,IT/과학,"삼성전자, 31일 스포츠밴드 '갤럭시 핏·갤럭시 핏ⓔ' 출시","[ 日정부 ""비현금 거래 확대""에 소프트뱅크·라쿠텐과 격전후발 '페이페이' 초강력 마케팅에 라인도 공격적 맞대응국내선 '쇼핑' 앞세워 온라인 2위…""오프라인도 강화""    [이데일리 한광범 기자] 네이버(035420)가 한국과 일본에서 간편결제 시장 공략에 총력을 기울이고 있다. 한국에선 쇼핑을 앞세워 ‘네이버페이’ 확장에 나서고 있고, 일본에선 일본 현지 기업과의 출혈경쟁까지 나서며 ‘라인페이’의 시장 선점에 주력하고 있다.네이버는 올해 1분기 영업이익이 전년 동기 대비 19.7%에 감소한 2062억원에 그쳤다. 해외 계열사인 라인과 기타 사업 부문에서 1025억원의 영업손실을 기록한 것이 큰 영향을 미쳤다. 라인은 매출이 전년 동기 대비 17.4% 증가한 5651억원을 달성했지만 영업비용이 6676억원으로 막대한 영업손실을 기록했다. 네이버 다른 주요 사업부문의 경우 영업이익이 3088억원으로 전년 동기 대비 10% 이상 증가했지만 이 같은 라인의 영업손실 급증으로 네이버 전체의 영업이익을 감소시켰다. 더욱이 라인의 영업비용은 매분기 증가하고 있다. 올해 1분기 6676억원은 지난해 1분기 4972억원과 비교해 무려 34.3%가 증가한 수치다. 영업비용의 급증으로 영업손실률도 지난해 1분기 3.3%에서 올해 18.1%까지 치솟았다.이 같은 영업비용의 급증 배경에는 일본에서 더욱 치열해지고 있는 간편결제 시장 상황이 자리잡고 있다. 일본에서 국민 모바일 메신저 ‘라인’을 앞세워 핀테크 사업을 확장 중인 네이버는 2015년 간편결제 서비스 ‘라인페이’를 내놓았다. 충전을 통해 간편결제가 가능한 시스템이다. 하지만 유별한 일본인들의 ‘현금 거래’ 선호에 서비스 초반 사업확장에 별다른 재미를 보지 못했다.◇日, 현금거래 비중 80%…정부 차원 비현금결제 독려일본 경제산업성에 따르면 2015년 일본의 비현금 거래 비율은 18.4%에 불과했다. 결제 10건 중 8건 이상이 여전히 현금을 통해 이뤄지는 구조인 것이다. 여전히 일본에선 현금으로만 결제가 가능한 매장이 상당수다. 세계적인 패스트푸드 업체 맥도날드가 2017년 11월에 처음 신용카드 결제 서비스를 시작했을 정도다.  비현금 결제비율이 90% 수준인 우리나라와 비교하면 그 차이가 더욱 명확하게 알 수 있다. 이 같은 상황에서 일본 정부는 비현금 결제 비율 높이기에 총력을 기울이고 있다. 구체적으로 2025년까지 비현금 결제 비율을 40% 올리겠다는 목표를 갖고 있다. 일본 정부는 과도한 현금결제 비중으로 나타나는 비효율을 줄이는 동시에 유동성을 높이고 거래 투명성 확대를 통해 세수증대 등의 효과를 기대하고 있다.일본 정부는 이를 위해 정부차원에서 비현금 거래를 적극 독려하고 있다. 오는 10월 소비세율이 8%에서 10%로 인상되는 시점에 맞춰 비현금 거래에 한해 인상된 소비세율 해당 금액을 환원해주는 제도를 도입하기로 했다. 이 같이 정부가 직접 나서 비현금 거래를 독려하자 간편결제 시장에 대한 업체들 간의 경쟁도 더욱 치열해지고 있다.     경기도 성남시 네이버 본사 ‘그린팩토리’. (사진=뉴시스)일본 IT 대기업 소프트뱅크·야후재팬이 힘을 합쳤고, 전자상거래 기업 라쿠텐도 시장에 뛰어들었다. 특히 일본 간편결제 시장 후발주자로 소프트뱅크와 야후재팬이 합작해 설립한 ‘페이페이’는 모기업의 막강한 자금력을 바탕으로 지난해 12월 25만엔(약 250만원) 이하 금액에 대해 결제금액의 20%를 돌려주는 파격적인 페이백 이벤트를 시작해 일본에서 돌풍을 일으켰다. 이에 간편결제 시장 경쟁자인 라인과 라쿠텐도 비슷한 이벤트를 실시하며 맞불을 놓고 있다. 일본 간펼결제 시장에 뛰어든 기업들은 시장선점이 가장 중요하다고 보고 공격적 마케팅에 막대한 자금을 쏟아붓는 출혈 경쟁을 계속하고 있다. ◇자금 경쟁력 우려에… 신중호 대표 “규모 경제 아니다”네이버는 쉽게 물러서지 않겠다는 점을 분명히 했다. 한성숙 대표는 지난 25일 실적발표 컨퍼런스콜에서 “라인을 통한 선점이 중요하다고 보고 당초 예정된 것보다 적극적인 투자와 마케팅을 검토 중”이라고 밝혔다. 박상진 최고재무책임자(CFO)도 “라인이 경쟁 중인 해외 핀테크 부분은 경쟁이 심화되고 있다. 특히 올해가 시장 선점의 중요한 시기라고 판단하고 있다”며 “예상보다 큰 규모의 마케팅 투자가 필요할 수도 있는 상황이라 단기적으로 영업이익에 큰 영향을 있을 수도 있다”고 부연했다.막강한 자금력을 가진 경쟁업체들에게 밀릴 수 있다는 우려에 대해 신중호 라인 공동대표는 니혼게이자이신문과의 인터뷰에서 “IT 서비스는 자금력보다는 이용자의 요구에 어떻게 답할지가 더욱 중요하다”며 “규모의 승부가 아니라는 확신이 있다”고 말했다.일본과 달리 한국에선 강력한 네이버 포털을 기반으로 시장 점유율을 높이고 있다. 금융감독원이 지난 17일 공개한 ‘간편결제 서비스 현황’에 따르면 네이버페이는 지난해 온라인 간편결제 금액 기준으로 이베이코리아의 ‘스마일페이’에 이어 2위를 기록했다. 3위는 쿠팡이었다. 네이버는 G마켓·옥션을 보유한 ‘이베이코리아’와 전자상거래업체 ‘쿠팡’과 마찬가지로 플랫폼 내 결제를 통해 점유율을 크게 높였다.네이버는 모바일 화면 개편을 통해 메인화면 왼쪽 영역에 쇼핑과 네이버페이를 배치했다. 입점한 쇼핑몰 상품을 별도 로그인 없이 네이버페이로 간편결제 가능한 시스템을 통해 네이버페이 이용을 유도하고 있다. 아울러 국내에 진출한 세계 최대 여행 플랫폼 트립닷컴에 입점하는 등 각종 온라인 플랫폼 입점에도 열을 올리고 있다.현재 국내 간편결제 시장은 온라인을 중심으로 크게 확대되고 있다. 지난해 간편결제 이용건수는 23억8000만건으로 2016년 8억5000만건에 비해 2.8배 증가했다. 이 기간 거래 금액도 26조8808억원에서 80조1453억원으로 약 3배 증가했다. 결제금액은 온라인이 60조6030억원, 오프라인이 19조5420억원 규모였다.네이버는 일단 올해 온라인 간편결제 시장에 주력한다는 방침이다. 네이버페이 입점 확대와 함께 고객에 대한 혜택도 강화하기로 했다. 아울러 네이버페이를 이용한 다양한 핀테크 서비스에 대해서도 준비하고 있는 것으로 전해졌다. 오프라인 간편결제의 경우도 예약서비스 도입 확대 등으로 시장 점유율을 넓히겠다는 구상이다.한광범 (totoro@edaily.co.kr)인스타 친추하면 연극표 쏩니다! [티켓받기▶]꿀잼가득 [영상보기▶] , 청춘뉘우스~ [스냅타임▶]＜ⓒ종합 경제정보 미디어 이데일리 - 무단전재 &amp; 재배포 금지＞ ]","['', '심판 받아라', '', '중국에 부역하는 네이버']",http://www.opinionnews.co.kr/news/articleView.html?idxno=18032,https://n.news.naver.com/mnews/article/018/0004367292?sid=105
2019-05-03 16:53:03,서울경제,,현대그린푸드 “현대홈쇼핑에서 현대리바트 지분 취득”,,,https://www.sedaily.com/NewsView/1VJ36PWXVG,http://www.polinews.co.kr/
2019-05-01 05:01:01,시민일보,,"온라인침구쇼핑몰 누비지오, '오월엔 오팀장이 쏜다 9550 이벤트' 13일 실시",,,http://www.siminilbo.co.kr/news/articleView.html?idxno=627835,https://www.asiae.co.kr/
