Date,Press,Category,Title,Content,Comment,URL_Origin,URL_Naver
2022.01.31.,코메디닷컴언론사 선정,,피부과 전문의가 권하는 피부관리법 9,,,https://kormedi.com/?p=1379097,https://www.kormedi.com/
2022-01-31 18:32:01,뉴시스언론사 선정,생활/문화,"한제호 인천성모병원 교수 ""부모님 굽은 허리, 노화 현상 아니다""","[     [사진=클립아트코리아]건강하고 아름다운 피부를 유지하고 싶다면 때때로 자신의 피부 관리 루틴을 점검할 필요가 있다. 올바른 방법으로 꾸준히 피부 관리를 하는 것이 피부 노화를 늦추는 길이기 때문이다.  어떤 방법으로 피부 관리에 도움을 줄 수 있을까. 미국 건강미디어 '에브리데이헬스 닷컴'에서 피부과 전문의들이 장기적으로 실천할 것을 권하는 피부관리 습관을 소개했다.  1. 계절에 상관없이 날마다 선크림을 바른다  자외선 차단제가 기본적인 것처럼 보일지 몰라도 가장 효과적 피부 관리 도구이다. 피부과 전문의들은 매일 선크림을 바를 것을 권한다. 워싱턴 DC의 피부과 수술 센터의 설립자이자 회장인 셰릴 버지스는 ""사람들이 노화 방지 크림 1위가 무엇이냐고 물으면 자외선 차단제라고 답한다""고 한다.  또 다른 피부과 전문의 마미나 투레가노는 ""선크림을 꾸준히 사용하는 것이 가속화된 노화와 피부암 예방에 가장 큰 영향을 미치는 것으로 나타났다""면서 ""모든 사람들이 아침 일상의 일부로 매일 자외선 차단제를 바르는 것이 좋다""고 말했다.  겨울은 예외라고 생각하면 안된다. 피부암 재단에 의하면 자동차 안에 있거나 실내에서 일할 때도 창문을 통해 UVA 광선이 피부를 해칠 수도 있다.  2. 화장한채 잠들지 않는다  화장을 지우지 않고 자는 것은 나쁜 습관이다. 피부과 의사 버지스는 ""이런 습관은 모공을 막히게 하고 극심한 입술 건조증을 유발하는 등 수많은 피부 문제를 일으킬 수 있으며 눈에도 심각한 손상을 입힐 위험이 있다""고 말한다.  3. 추운 날씨로부터 피부를 보호한다  뉴욕시 마운트시나이병원 피부과 조슈아 자이크너 교수는 ""겨울은 피부에 가장 힘든 계절일 것""이라고 말한다. 추운 날씨, 낮은 습도, 바람은 피부에 타격을 주기 때문에 겨울에는 추가적 스킨케어 제품을 사용하는 것이 좋다. 글리세린이나 젖산 암모늄 같은 보습제가 함유된 제품이 도움이 된다.  4. 실내 태닝을 하지 않는다  연구에 따르면 실내 태닝은 흑색종 위험을 상당히 증가시킨다.  5. 유통기한이 지났거나 사용하지 않은 제품은 폐기한다  갖고 있는 피부관리 제품 중 상당수는 유통기한이 지났을 지 모른다. 모든 제품의 유통기한을 확인하고 사용기한이 지난 것은 미련없이 버린다. 같은 종류 제품이 2개 이상 있을 경우 성분 비율이 더 높은 제품만 남긴다.  6. 스트레스를 받을 때 피부에 손대지 않는다  스트레스 받을 때 피부를 잡아 뜯는 습관(skin picking)을 가진 사람들이 있다. 이는 감염과 흉터를 유발하는 습관이다. 국제강박증재단에 의하면, 피부를 뜯는 행동은 임상적 충동 조절 장애에 속한다.  7. 피부관리 루틴을 단순하게 일관되게 유지한다  많이 바를수록 피부가 더 좋아지는 것이 아니다. 과도한 각질 제거를 하거나 과도하게 화장품을 바르기 보다 단순하고 효과적 피부 관리 루틴을 지킨다. 피부관리의 핵심은 자외선 차단제, 세정제, 보습제에 있다.  8. 담배를 피우지 않는다  흡연은 피부를 건조하고 칙칙하게 보이게 한다.  9. 레티놀과 비타민 C 크림으로 피부를 강화한다  아침에는 피부 손상을 막기 위해 비타민C 세럼과 자외선 차단제를, 밤에는 피부를 회복하기 위해 레티놀을 바르는 것이 도움이 된다. 버지스는 ""비타민C는 항산화제이므로 환경 스트레스, 노화, 산화 과정에 도움을 준다""고 말한다. 레티놀 양을 늘리는 것도 노화를 막는데 영향을 줄 수 있다.  ]","['웃기지 마라.피부는 유전이다', '일단 타고나는게 크고, 돈질을 꾸준히 해야함', '타고나야함.. 99%임', '나는 유용한 기사라고 생각했는데 댓글들이 왤케 부정적이지.. 특히 유통기한 잘 확인할 필요가 있겠구나, 생각했는데. 피부를 타고 났어도 평상시 관리 잘 못하면 말짱 꽝임.. 피부과도 어느 정도까진 도움 받을 수 있어도 평소 생활습관 나쁘면 관리 받을 때만 괜찮을 걸..', '', '', '아무리 찍어 바르고 처바르고 지지고 긁어내봐야 일단 피부는 타고나야한다', '타고난놈 절대 못이긴다. 관리 안해도 좋더라 그런사람은', '피부가 좋다는건 몸이 깨끗하다는 반증인데 90% 이상이 유전적으로 타고나는겁니다', '', '타고나는거 90%  정기적인 피부과 관리10% 꿀피부 유지', '돈 바르면 됩니다~ 피부과 출근 도장 찍으면 됨. 돈이 읍는게 문제지 ~ㅅ..ba..', '이런거 다 해봐야 피부과 기계 못따라감.', '선크림 바르면 가렵고 피부가 뒤집어 져서 ㅠ', '고현정 담배피는데 칙칙하게안보임~', '피부는 타고나는게 제일 큰 듯..ㅠ', '유전', '', '밑에 말이 맞는말이기는 하지만 타고난 피부는 30대 초반에 그 효력을 잃는다. 타고난 피부라할지라도 기초적인 저런 습관을 들이지 않는다면 30대 중반에가선 바로 팔자주름과 커다란 모공을 막을 길은 의술밖에는 없다. 그렇게 관리 안하던 사람이 의술의 힘을 빌릴까 나 예전엔 피부 좋았는데를 연발하며 후회하겠지 피부는 좋을때 계속해서 관리하는게 노화예방인것이다. 동안 다 필요없다 나이들어서는 피부 좋으면 어려보인다. 게으른 나에게 날리는 독설이다.', '피부는 타고나야해ㅎ', '기승전 레티놀 광고', '타고난게 70프로인듯..그 외에는 얼마나 부지런한지ㅡ성격이지 머', '피부는 잠 일찍 자는게 최고인 것 같다 그거보다 더 좋은 건 없음', '피부과에서 관리받는다', '연예인들 밤샘촬영하고 담배도 피는데 피부 완전꿀... 이건 의학의 힘.', '유전이 답', '피부는 타고 나는게 90인듯. 유전의 힘', '마스크좀 벗자\n힘들다', '피부는 그 무엇보다 유전임.', '가장 중요한 금주가 빠졌네. 수분 빠지는건 술이 최고인데', '피부는 유전이 지배', '그중에 제일은 타고난 피부인듯', '유전적 영향 80,  보습. 자차는 나머지 20', '타고 나는거지 뭐어', '접촉성 알르레기가 있는 사람인데 비타민 제품은 안쓰는게  피부에 더 도움이 됐어요', '', '', '때를 밀지 말아야한다', '', '', '피부는 타고나야 한다 기사내용 대충해도 타고나면\n 주름은 별 차이 없던데 다만 잡티 기미 이런건 관리가 필요함 썬크림은 사계절 필수템 맞다', '식단 운동 물많이 마셔봐라\n피부가 싹 바뀐다', '타고 나야지', '피부는 태어날 때부터 타고난다', '', '', '유전이고\n스트레스 플러스', '좁쌀피지 모공 안면홍조는 체질이자너', '', '피부는 타고나는거다 돈 쳐바르던가', '누구나 아는내용 똑같은 래퍼토리~', '', '마샤지샵  1년 내내간다.', '마스크랑 미세먼지 때문에 피부 뒤집어지니까 중국을 없애면 되는데 걍', '마지막이 관건이자 광고인듯?', '레티놀은 화장품화해서 효능이 떨어지지만 순수비타민a는 전세계 피부과 전문의들이 거의 유일하게 인정하는 주름개선 성분이에요 비타민c와 비타민a는 논문도 엄청나고 과학적 근거가 있는 성분이에요 그외에 비싸게 판매하는 백화점 화장품들은 연구 많이 했다고하지만 과학적인 근거는 없어요 전문의도 아닌 사람들 디렉터땡땡같은 뷰티유튜버 보지 말고 피부과전문의들의 채널을 보시길', '마지막이 광고인가?ㅋ', '문재앙 감빵가면 좋아진다', '자외선 차단제는 진짜 맞는말이다.\n꾸준히 바른 사람과 안 바른 사람은\n50대 넘어가면서 티 난다. \n기초의 마지막 마무리라 생각하고 꼭 바르자.\n진짜 필수!!!☆☆☆', '물많이 마시기,  충분한 수면, 스트레스 받지않기 빠졌다 의사야~ 니가 열거한거 온 국민이 다 안단다.', '맞기는한데 ,,피부과의사들은  저희들끼리  기계를  사서  돌아가면서  기계로  관리한다', '비타민c밤에 바르라더니... 레티놀하고 비타민도 같이 바르지말랫는데', '', '병원갈때 전문의 꼭 확인하고 가시길', '이거 다 필요없고 피부마사지샾 다니면 됩니다.', '샴푸할 때나 설거지 할때 세제 거품이라도 얼굴에 절대 튀지 않게 조심조심 하세요 접촉성 피부염으로 고생할 수 있어요 무심코 넘겼다간 독이 됨 바로바로 깨끗한 물로 빠른 세척 반응 나타나면 피부과 처방요~', '충분한 수면과 균형있는 식단도 함께 해야죠', '피부는  타고 나는듯\n그리고 성형외과랑 친해져야....ㅠㅠ', '타고나느겨.. 그리고 이쁘면 다된다', '관리한다해도 한계가 있음 어렸을때부터 꾸쥰히 한다면 모를까 타고나야함', '', '물이나 많이들 드시요', '세수후엔 바로로션발라줘야 잔주름 안생겨요  그것만해도 덜늙음 ㅜ', '대깨들 피부 극혐', '다 필욥꼬~! 스트레스다! 만병의근원', '일단 수면부족은 절대금물', '얼굴 피부에 가장 안좋은것 흡연, 햇빛, 건조함', '비누\nㅡ\n화장품 \n안 쓰면 됨', '가장중요한건 개개인의 체질에따라 관리해야지\n꼭 어떤게 장답이다라는건 잘못이다!\n1번 체질  2번 지병(피부병등등)에따라\n최상의 방법일수도 반대로 최악의 방법일수도있다.', '저게 가장 기본적이고 중요한 내용들임. 지키는 사람 몇 안될텐데 분명 ""저걸 누가 몰라요~"", ""피부는 타고난 거에요~저런거 필요 없어요"" 이런 댓글 달리겠지', '자외선 차단제는 인정', '피부는 타고나는거\n그기다 돈쳐바르면 최고고', '누구나 다 아는상식', '사촌언니 2시간에 한번씩 썬크림 바른다는데 나이 마흔 넘어도 20대로 보임. 썬크림 진짜 중요함', '자외선을 차단하면 인간은 비타민D를 어디서 흡수하나요? 각종 부작용으로 죽으라는건가', '', '', '피부는 80프로가 유전.관리도 주름생기기전에 25살이전에 해야함.근데 사람들이 주름생기고 관리함.관리는 말그대로 현상태유지란걸 알아야함.주름이 펴지거나 쳐진게 올라붙진 않음(시술도 일시적)물.채소.비타민씨섭취.스트레스 안받게.선크림.꼼꼼한 클렌징 .각질관리.수분관리가 답인데.실천하는자는 10년젊어보임.실천을 안해서 문제', '근데 정말 썬크림 습관적으로 매일 바르는데 이게 젤 효율적인거 같아요', '괜찮아  의느님이 있잖아~', '', '비타민은 밤에 바르리고 하드만 누구말이 맞는거니?', '다 알지 다 알지…. 인간인지라 …. 다 아는데 다 못하는 거지….', '감사합니다', '궁금한거 답변 달아주세여!! 자외선크림요 !! 꼭 비싼거 써야 효과있나요??!! 전 저렴이 로드샵 에띄x 이니x쓰는데 이런것도 효과가 있는가해서요!! 그리고 집안에서도 발라야하는지두요 !!!!', '선크림 바르면 점점 땀구멍 넓어져요.', '', '충분히 물 마시고 일찍 푹 자라.', '기미 주근깨 검버선 이거 피부과 가면 클린해지나요?\n돈좀 들여야겠죠?', '물을 마신다는?', '', '', '', '바다포도크림 어쩌고 바이럴 광고 안나오냐??', '', 'ㅋㅋ', '히히', '세번째 팁 어디감?ㅋㅋㅋㅋㅋ', 'ㆍ', '공갈치지마 \n화장품&lt;&lt;&lt;&lt;&lt;&lt;&lt;&lt;&lt;&lt;...피부시술&lt;&lt;&lt;&lt;&lt;&lt;&lt;&lt;&lt;&lt;&lt;&lt;&lt;&lt;&lt;&lt;&lt;&lt;&lt;&lt;&lt;&lt;&lt;성형이잖아', '', '', 'ㅇㅇ', '냠냠. 냠. .어머나 씨발. 냠냠.냠. 내가 이미 다 하고 있는거넹. 냠냠. 냠.. 근데 자외선 차단제는 걍 바르면 안되고 떡칠해야함. 냠냠. 냠.. spf 지수만큼 차단되려면 얼굴 쌍판떼기당 0.8그람씩 발라야하는데 보통 한쿡 사람들은 0.2그람 바를까 말까함. 냠냠. 냠. 걍 떡칠해줘야 spf 지수만큼 차단됨. 냠냠. 냠. 냠.', '먹는 것, 물 마시는 습관, 운동 같은 건 다 빠져있네?  그런 건 영향 없나?', '', '정보글에 비아냥대는 쓰레기들 대체 왜 클릭함? 다 알고 있으면 그냥 지나가 OOO', '피부는 건강의 표현일뿐이다.. 스트레스 안 받고 영양상태 수면 술담배.. 건강하면 피부는 따라오는거지.. 어찌 피부만 보는거지', '10. 남들도 아는 뻔한 소리는 그만한다', '레티놀 빼고 다 해당. 피부좋음', '피부과 가세요', '힘들겠다 ~ 다 할려면~', '근데   레티놀   바르고   폰 빛에도   노출하면  안되나요?', '음', '이런기사는 뭐지?  모르는사람있다고 이런기사 올리는거냐? 할일 드럽게읍네', '돈을 쓰면 된다~겠지...', '연예인 담배펴도 피부만좋은데,,,? 타고난게 백프로임 나이들면 당연히 관리해도 타고나도 별로되는거고', '세타필 크림 하나만 바르는데 보습 최고!!', '', '원래 여드름 잘 나는 피부였는데 5년 정도 피부과 다니면서 돈ㅈㄹ 했더니 피부 엄청 좋아졌어요 레이저는 피부가 약해서 초기에만하고 지금은 가끔 영양 주는 주사시술이나 관리만 받아요 이렇게 돈을 들여서인지 이제 뭘해도 피부가 안나빠지네요', '', '', 'SK2와 DHC', '남자는 밤일만 잘하면 됩니다^^', '왜 제가 다니는 피부과 선생님은 절대 썬크림을 바르지 말라고 하시는지..정 걱정되면 모자나 마스크로 가리라고 하네요..진짜 어떤게 답인지 헷갈려요..ㅠ.ㅠ', '', '코로나로인해 한국은 오히려 피부과 성형외과 수익이 낮아졌다고하고 ㅋㅋㅋ 미국은 오히려 호황이래 이유는 한국은 마스크쓰니까 마기꾼 넘쳐나서이고 미국은 줌 회의로 자기단점이 자기도 보여서그렇다고하더라고 결국 이것으로 동양과 서양의 차이가 들어나는게 결국 한국인은 남들 보기좋으라고 남한테 싫은소리듣기싫어서 피부관리하고 미국인은 자기자신을위해서 관리한다는 의미로해석이되는데 어케 생각하는지?', '피부 더러운 애들이 암도 잘 걸리더라. 몸속도 더러운가봄', '술담배 겁나 피는데 평소 관리해서 42인데 30초로 봄(객관적)..중요한건 관리임... 술마셔도 잘때 맨날 세안하고 썬크림바르고ㅠ등등...', '비싼화장품은 아니고 일회욕 팩, 운동  , 샾\n    김거니  얼굴에 있는 독은 치명적이고  운명을 바꾼다\n     남편을 쪼그라지게 할 상', '(회개하라. 하나님의 나라가 가깝다.) 그러므로 너희는 하나님의 전신갑옷을 입으라. 이는 너희가 악한 날에 저항할 수 있으며 또 모든 일을 다 이루기까지 서 있게 하기 위함이니라. 그러므로 서서 진리로 너희의 허리띠를 두르고 의의 흉배를 붙이고 화평의 복음을 준비한 것으로 너희 발에 신고 모든 것 위에 믿음의 방패를 가짐으로써 능히 너희가 악한 자의 모든 불붙은 화살을 끌 수 있을 것이라. 또한 구원의 투구와 성령의 칼, 곧 하나님의 말씀을 가지고 (에베소서 6:17)//하나님의 아들, 오직예수', '']",http://www.newsis.com/view/?id=NISX20220129_0001742529&cID=14001&pID=14000,https://n.news.naver.com/mnews/article/296/0000054063?sid=103
2022.01.31.,한겨레언론사 선정,,"나이 들어 시작한 운동, 세포를 회춘시킨다",,,https://www.hani.co.kr/arti/science/science_general/1029348.html,http://www.newsis.com
2022-01-29 11:25:34,파이낸셜뉴스,사회,설날 음식 시금치나물이 지닌 의외의 효능,"[ 기사내용 요약""이번 설엔 부모님 건강 확인하세요""…65세 이상 건강 체크리스트고혈압·골다공증·척추관협착증·퇴행성관절염·고관절 질환 등 주의    가톨릭대학교 인천성모병원 전경. (사진=인천성모병원 제공)[인천=뉴시스] 이루비 기자 = 코로나19 여파로 예전처럼 부모님을 찾아뵙기가 쉽지 않다. 부모님들이 조심해야 할 건강 체크리스트를 소개한다. 아쉽지만 영상통화 등 문명의 이기를 빌려 확인해보는 것도 효도의 한 방법이다.국내 '고혈압' 인구 절반 이상이 65세 이상전체 뇌혈관질환의 50%가 고혈압으로 발생하고, 협심증과 심근경색 등 심장병의 30~35%, 신부전의 10~15% 역시 고혈압이 원인이다. 동맥이 딱딱해지는 '동맥경화증'도 마찬가지다.고혈압은 찬 바람이 불고 일교차가 큰, 요즘 같은 겨울철에 더 주의해야 한다. 기온이 떨어지면 열 손실을 막기 위해 혈관이 수축하기 때문이다. 노인이나 마른 체형에서 특히 주의를 요한다.이동재 가톨릭대학교 인천성모병원 심장혈관내과 교수는 ""국내 고혈압 인구의 절반 이상을 65세 이상 고령층이 차지할 정도로 노인 비중이 높다""면서 ""침묵의 살인자로 불리는 고혈압의 경우 별다른 증상이 나타나지 않아 평소 주기적으로 혈압을 확인하고 위험요인을 예방하는 것이 중요하다""고 말했다.골다공증, 기침 등 작은 충격에도 골절로 이어져골다공증은 '소리 없는 뼈도둑'이라는 별칭에서 알 수 있듯 골절 등 합병증이 동반되지 않는 한 쉽게 알아채기 힘들다. 척추 압박골절로 키가 줄어든다거나, 허리가 점점 휘고, 허리통증으로 병원을 찾는 경우가 많다. 심할 경우 기침 등 작은 충격에도 골절로 이어지기 쉽다. 여성에게 더 빨리, 많이 나타난다.골다공증을 예방하기 위해서는 무엇보다 정기적인 검진을 통해 골밀도 검사를 받는 것이 중요하다. 또 균형 잡힌 식단을 통해 우유나 단백질을 적절히 섭취하고 술, 담배는 멀리해야 한다. 체중 부하가 실리지 않고, 관절에 과도한 무리가 가지 않는 걷기 운동도 좋다.한제호 인천성모병원 내분비내과 교수는 ""부모님들은 골다공증으로 뼈가 약해지고 허리가 굽는 것을 노화에 따른 자연스러운 현상으로 받아들이는 경향이 있다""며 ""골다공증으로 인한 골절은 회복이 불가능한 사례도 있는 만큼 적극적인 진단과 치료가 중요하다""고 강조했다.척추관협착증, 하지 통증으로 보행 시 앉았다 일어섰다 반복나이가 들면 척추나 그 주변의 인대가 심한 퇴행성 변화를 겪게 되면 척추신경이 지나는 척추관이 좁아지면서 '척추관협착증'이 발생한다. 증상은 보행 시 심해지는 다리 통증이다. 이때 허리를 구부리거나 앉으면 통증이 완화되기 때문에 일명 '꼬부랑 할머니병'으로 부르기도 한다.최두용 인천성모병원 뇌병원 척추신경외과 교수는 ""부모님의 허리가 굽고 걸음걸이가 이상하다면 질환 초기 병원을 찾아 적절한 치료를 받는 것이 필요하다""고 했다.무릎 통증·붓기 지속하면 '퇴행성관절염' 의심노화는 무릎 관절 자체를 약하게 만든다. 무릎 관절을 지탱해 주는 근육과 인대의 탄력성이 줄어들고, 관절연골과 반월연골판의 충격 흡수 기능도 떨어진다. 또 관절액의 윤활 작용도 약화된다.퇴행성관절염은 주로 다리가 맞닿는 내측 무릎에 통증을 유발한다. 휴식이나 수면 시 통증이 심해지고, 아주 심할 경우 일상적인 보행에도 지장이 생길 수 있다.노동영 인천성모병원 정형외과 교수는 ""부모님이 계단을 오르내릴 때 갑자기 심한 통증을 느끼거나 일상생활에서 지속해서 무릎 주위가 붓거나 아프다고 호소한다면 퇴행성관절염을 의심하고 전문의의 진료를 받아보는 것이 좋다""고 말했다． ]",[],http://www.fnnews.com/news/202201312256151564,https://n.news.naver.com/mnews/article/003/0010973615?sid=102
2022.01.29.,OSEN,,"퉁퉁부은 박나래, 전현무 한라산 급노화 뛰어넘는 '비주얼 쇼크'(나혼산)",,,http://www.osen.co.kr/article/G1111753408,http://www.hani.co.kr/
