Date,Press,Category,Title,Content,Comment,URL_Origin,URL_Naver
2022-01-11 14:10:04,라포르시안,IT/과학,"겨울철 피부 탄력 저하·건조 해결, 피부 상태 확인 먼저 해야","[ 노화로 감소될 수 있는 황반색소 밀도 유지""눈 건강에 도움을 줄 수 있다는 것 증명해""     (사진=제넨셀 제공) *재판매 및 DB 금지 /사진=뉴시스  [파이낸셜뉴스] 제넨셀은 자체 개발한 천연물 소재 ‘병풀추출분말(CA-HE50)’이 식품의약품안전처로부터 눈 건강 개선에 관한 건강기능식품 기능성 원료 개별인정을 획득했다고 11일 밝혔다.   개별인정형 기능성 원료는 고시나 등록되지 않은 소재를 기업 등이 자체 연구해 건강에 도움이 된다는 것을 실험 등을 통해 증명하고 식약처로부터 인정받는 것을 말한다.   기능성과 안전성을 비롯해 제조방법, 기준 및 규격, 섭취량 등 인정 기준이 까다롭지만 인정을 받게 되면 일정 기간 독점적 제조, 판매 권한을 가질 수 있다.   제넨셀은 인체적용시험 등을 통해 병풀추출분말(기능성분 아시아티코사이드)이 노화로 인해 감소될 수 있는 황반색소 밀도를 유지, 눈 건강에 도움을 줄 수 있음을 증명했다. 이번 인체적용시험은 전문 CRO(임상시험수탁기관)인 리서치멘토에서 수행했다.   제넨셀 관계자는 “기존 눈 건강 소재들의 장기 복용 부작용이 업계에 보고되면서 새로운 원료 연구가 활발한 상황으로, 이번에 인정받은 병풀추출분말이 이를 대체할 수 있을 것으로 기대된다”고 말했다.   한편 제넨셀은 이번 개별인정형 기능성 원료 승인을 기점으로 천연물 소재를 이용한 건강기능식품 개발 및 판매에 본격적으로 나선다는 계획이다. 이를 위해 이달 초 천연물 기반 건강기능식품 및 화장품 전문 자회사 ‘제넨셀바이오’를 설립했다.   제넨셀은 현재 보유하고 있는 자원식물 원천 기술 및 추진 중인 제주도 소재 천연물 의약품 원료 재배단지 활용 범위를 건강기능식품 분야까지 확대한다는 전략이다.   또한 제넨셀은 자체 연구개발 성과를 자회사에서 사업화하고 이를 모기업에 재투자하는 방식의 선순환 구조를 만들면 기업공개(IPO)에도 도움이 될 것으로 기대하고 있다   ]",[],http://www.rapportian.com/news/articleView.html?idxno=143172,https://n.news.naver.com/mnews/article/014/0004770245?sid=105
2022.01.12.,파이낸셜뉴스언론사 선정,,"늘어나는 청소년 탈모, 원인과 대처 방법",,,http://www.fnnews.com/news/202201121021519601,http://www.fnnews.com/
2022-01-12 10:24:04,헬스조선,생활/문화,"팔자주름, 웃으면 더 깊어질까?","[ 스트레스 고위험 청소년일수록 탈모가 나타날 가능성 증가청소년 탈모 증상을 발견한 경우 생활 습관 교정, 탈모 치료를 병행해야     청소년기 과다한 스트레스가 탈모를 유발할 수 있다. 출처 Unsplash [파이낸셜뉴스] 노화나 유전에 의해 나타나는 질환이라 알려졌던 탈모. 탈모는 더이상 어른들의 질환이 아닙니다. 건강보험심사평가원의 정보에 따르면 2019년 기준으로 병원을 찾은 약 23만 명의 탈모 환자 중, 10대 탈모 환자가 1만 8000명에 육박했습니다. 모아시스와 함께 청소년 탈모의 주된 원인은 무엇이며, 어떻게 대처해야 하는지 그 방법에 대해 알아볼까요?     청소년 탈모를 일으키는 주범, 스트레스  청소년 탈모는 유전적 요인보다는 후천적 요인에 의해 나타나기 쉽습니다. 특히 학업 및 교우관계 등으로 스트레스를 받은 청소년일수록 탈모를 경험할 확률이 더욱 높아지죠. 신체는 스트레스에 노출되면 이에 맞서기 위해 코르티솔(Cortisol) 호르몬을 분비하는데요. 코르티솔이 과다하게 분비될 경우, 포도당 대사가 늘어나고 교감 신경이 활성화되어 감각기관이 예민하게 변합니다.   예민해진 신체는 영양과 에너지를 저장하지 못해 면역력이 저하되고 맙니다. 탈모는 면역력이 떨어진 후 나타납니다. 약해진 면역 세포가 모낭 세포를 외부 자극으로 인식해 모낭을 손상시키죠. 모낭 주위에 염증을 일으키기도 합니다. 모낭에서 영양을 제대로 공급받지 못한 모발이 쉽게 빠질 만큼 연약해지거나, 심할 경우 탈모로 이어지기도 합니다.     청소년 탈모, 생활 습관 교정과 병원 치료 병행해야  치열한 경쟁이 계속되는 학습 환경에서 스트레스 지수를 ‘0’으로 만들기는 어렵지만, 올바른 생활 습관을 들임으로써 스트레스를 조절하고, 해소할 수는 있습니다. 특히 숙면은 스트레스를 해소하고 면역력을 키우는 가장 좋은 방법 중 하나이므로, 규칙적인 생활 패턴을 갖춰 일정한 시간 이상 잘 수 있도록 노력해야합니다.   적절한 취미 생활을 즐기는 것 역시 스트레스를 조절해 탈모를 극복하는 데 도움이 될 수 있습니다. 단 잠들기 전 과도하게 운동하면 아드레날린이 분비되어 몸이 다시 각성한 상태가 되니 늦은 밤에는 되도록 격렬한 운동을 피하는 것이 좋습니다.   마지막으로 청소년기는 신체가 아직 성장하는 시기입니다. 탈모 증상을 발견한 경우 최대한 빨리 의학 전문가와의 상담을 거쳐 생활 습관 교정과 치료를 병행한다면 증상을 빠르게 해결할 수 있습니다. #탈모치료 #탈모관리 #탈모원인 #청소년탈모   ]","['내신공부에  교과외활동에  수능대비까지.....탈모가  안 올 수 없음.', '이 ㅁㅊ정부가 백신패스니 뭐니 억압하면서 의식주를 통제하는데 스트레스를 어떻게 안받으란건지', '정치인들이 일을 잘하면 스트레스 없을듯. 탈모공약보다는  세금안쓰고 국민을. 미래를위한 진정성있는 정책이 먼저다.', '백신때문아님?', '라푼젤~~~부럽다', '세재  과다사용  금지   여러번  행궈야   방지', '이래도 탈모를 건강보험 적용하는걸 방관할꺼냐']",https://health.chosun.com/site/data/html_dir/2022/01/06/2022010601725.html,https://n.news.naver.com/mnews/article/014/0004770808?sid=103
2022.01.13.,헬스조선언론사 선정,,관절염만? 어린이·청년층서 잘 생기는 '무릎'의 병은?,,,https://health.chosun.com/site/data/html_dir/2022/01/12/2022011201940.html,http://health.chosun.com/
2022-01-06 14:37:01,머니투데이,생활/문화,"하플사이언스, 골관절염 치료제 'HS-101' 미국·유럽 특허 등록","[     팔자주름은 웃어서 생기는 것이 아니다./사진=클립아트코리아팔자주름을 콤플렉스로 여기는 사람들은 마음껏 웃지도 못한다. 팔자주름이 웃음 때문에 더 깊어질까 걱정되기 때문이다. 팔자주름은 대표적인 표정 주름으로 웃거나 말할 때 입 주위가 팔(八)자 모양으로 움푹 패는 것을 말한다. 그러나 사실 팔자주름은 웃음이 때문이 아니다. 노화 현상이다.깊은 팔자주름의 주범은 노화 현상으로 탄력을 잃고 처진 볼이다. 볼살을 붙잡아주는 유지 인대가 느슨해졌기 때문에 볼살이 늘어져 접히는 것이다. 유지 인대는 피부와 지방을 지탱하는 역할을 한다. 유지 인대가 팽팽할 때는 피부와 지방을 제자리에 붙잡아두지만, 나이가 들면 노화와 중력으로 인해 느슨해지며 피부가 탄력을 잃는다. 이외에도 자외선으로 인한 피부 손상, 수분 부족, 잘못된 수면 자세나 습관이 팔자주름을 짙게 한다.웃음은 오히려 세포 재생력을 높이는 호르몬 엔도르핀의 분비를 촉진해 직접적으로 노화를 방지한다. 간접적으로도 노화를 막는다. 일명 스트레스 호르몬이라 불리는 '코르티솔' 분비를 억제해 노화를 유발하는 정신건강 질환 발병 위험을 줄인다. 바노바기 성형외과 반재상 대표원장은 “많은 사람이 팔자주름의 원인을 웃음이라고 생각하는데 오히려 웃음은 얼굴 근육을 강화해 피부 탄력을 유지하는 데 도움이 된다”며 “팔자주름은 노화로 인한 피부 탄력 저하가 주된 원인”이라고 말했다.그렇다면 팔자주름은 어떻게 없앨까? 한 번 생긴 주름을 되돌리는 것은 쉽지 않기 때문에 주름이 생기기 전 미리 예방해야 한다. ▲자외선 차단제를 꾸준히 발라 자외선으로부터 피부를 보호하고 ▲물을 많이 마시고 ▲수분크림을 바르고 ▲엎드려 자는 자세나 턱을 괴는 습관을 지양해야 한다.이미 팔자주름이 생겼다면 시술을 고려해볼 수 있다. 주름이 깊지 않다면 필러를 주입해 완화할 수 있다. 주름이 깊다면 실리프팅 시술을 시도할 수 있다. 피부 아래 의료용 실을 삽입해 처진 피부를 끌어올리고 피부 탄력을 강화하는 시술이다. 전반적인 피부 탄력이 떨어진 중노년층이라면 안면거상술이 방법이 될 수 있다. 안면거상술은 귀 뒤쪽이나 두피를 절개해 조직을 박리하여 피부와 근육을 당겨 고정하고, 남은 피부 일부를 절제하는 수술이다. 얼굴 전체를 끌어올려 효과가 오래간다. ]",[],http://news.mt.co.kr/mtview.php?no=2022011814430089637,https://n.news.naver.com/mnews/article/346/0000047322?sid=103
2022.01.10.,스포츠동아,,"롯데면세점, 건강기능식품 새해맞이 할인전",,,https://sports.donga.com/article/all/20220110/111169169/2,http://health.chosun.com/
2022-01-13 05:01:01,메디컬투데이,생활/문화,안티에이징 시술 브이로 리프팅이란?,"[     무릎 관절에 문제가 생기면 거동이 자유롭지 못해 기본적인 생활이 불편해지고 나아가 삶의 질까지 떨어뜨리기 때문에 평소 관리와 예방이 매우 중요하다./클립아트코리아 제공자신에게 발생할까봐 걱정하는 이른바 ‘국민 걱정 질환’으로 관절염을 암 다음으로 높게 꼽을 만큼 관절건강에 대한 국민들의 관심과 걱정은 매우 높다. 관절질환은 신체의 노화와 함께 찾아오기도 하지만 비교적 젊은 장년층, 심지어 어린이와 청소년에게서도 생기는 만큼 나이를 떠나 주의를 기울일 필요가 있다.목동힘찬병원 정형외과 남창현 원장은 “관절은 몸의 기둥이라 할 수 있는 뼈와 뼈가 연결되는 부분으로 우리 몸이 움직일 수 있도록 하는 중요한 기능을 담당하고 있다”라며 “특히 무릎 관절에 문제가 생기면 거동이 자유롭지 못해 기본적인 생활이 불편해지고 나아가 삶의 질까지 떨어뜨리기 때문에 평소 관리와 예방이 매우 중요하다”고 말했다.뛰고 놀기 좋아하는 어린이·청소년, '박리성 골연골염' 주의요즘 소아청소년들은 과거에 비해 체육활동이 줄었다고는 하지만 신체 활동이 가장 왕성한 시기는 역시 10대라 할 수 있다. 그런데 뼈가 한창 자라는 성장기에 운동량이 너무 과하면 무릎이나 발목 등에 무리가 갈 수 있는데, 이 때문에 생길 수 있는 대표적인 증상으로 박리성 골연골염을 꼽을 수 있다.실제로 건강보험심사평가원 자료에 따르면 2020년 박리성 골연골염(이단성 골연골염)으로 내원한 환자는 총 7,763명인데, 이중 10대 남자가 1,032명으로 가장 많다. 남녀를 합한 전체 연령대로 봐도 50대 1,533명에 이어 10대가 1,427명으로 두번째를 차지한다. 박리성 골연골염은 관절이 반복적인 자극이나 강한 충격을 받아 연골 아래쪽 뼈가 부분적으로 괴사하면서 연골이 떨어져나가 생기는데, 약 75% 정도가 무릎 관절에서 발생하는 것으로 알려져 있다. 체중이 무릎에 실리면 통증과 함께 붓기도 하고, 삐걱대며 넘어질 듯한 느낌이 들기도 한다. 또 떨어져 나온 연골조각이 관절 내에서 부딪히면 사각사각 소리가 나기도 하고, 무릎 관절 사이에 끼게 되면 무릎을 일정 각도 이상 구부리지 못하는 잠김 증상이 나타날 수도 있다.초기에는 X선에도 잘 나타나지 않아 치료시기를 놓치는 경우가 있어 조금이라도 증상이 느껴지면 진료를 보고, 휴식을 취하는 것이 중요하다. 대개 연골을 제자리에 고정해 환부가 그대로 굳어지도록 유도하는 치료를 하지만 연골의 결손 부위가 크면 환자 나이에 따라 연골성형술 등 관절내시경 등의 수술적 치료를 시행하기도 한다.운동·레저 즐기는 청년층, '반월상 연골판 손상' 조심2020년 국민생활체육조사에 따르면 생활체육 참여율이 가장 높은 연령대는 50대다. 때문에 운동 중 상해로 인해 병원 진료를 받은 경험도 이 연령대에서 높게 나타났는데, 50대 남성이 6.9%로 가장 높고 40대 남성이 6.2%로 뒤를 이었다. 이렇게 운동과 레저활동을 즐기는 청장년층의 경우 반월상 연골판 손상을 주의해야 한다.무릎 속의 반월상 연골판은 충격을 흡수하는 역할을 하는데 노화로 인해 약해져 손상되기도 하지만 운동을 하다가 파열되는 경우가 많다. 비교적 쉽고 편한 운동이라고 여겨 많이 즐기는 등산을 하다가도 내리막길에서 자칫 무릎이 뒤틀리면서 연골판이 손상되기 쉽다. 또 축구와 같이 격렬한 운동의 경우 십자인대 손상과 함께 흔하게 겪는 부상도 반월상 연골판 손상이다. 반월상 연골판이 손상되면 무릎이 전반적으로 안정감을 잃게 되는데, 뻣뻣하거나 삐걱거리는 느낌이 든다. 또 계단 등을 내려올 때 갑자기 힘이 빠져 주저앉는 경우도 있고, 방향을 전환할 때 무릎이 걸리는 느낌이 들기도 한다.반월상 연골판이 손상되면 무릎 관절이 정상때보다 2~3배의 힘을 더 받게 돼 점차 다리 근육이 위축되고 관절염으로까지 악화될 수 있어 조기 치료가 중요하다. 경미할 때는 안정을 취하며 1~2주간 압박붕대, 부목, 소염제 등으로 치료한다. 심할 경우에는 관절내시경을 이용해 손상된 병변을 부분적으로 절제하는 수술을 시행한다. 평소 운동 전후 관절의 유연성과 가동성을 올려주는 동작으로 스트레칭을 해주고, 운동 중에는 무릎에 가해지는 하중을 줄이고 갑작스러운 충격을 당하지 않도록 조심해야 한다.노년층, 꾸준한 운동으로 '퇴행성 관절염' 예방통계청이 발표한 2021년 고령자 통계에 따르면 2019년 기준 우리나라 65세 생존자의 기대여명은 21.3년으로 OECD 평균보다 여자는 1.8년, 남자는 0.8년이 높다. 최근에는 낭랑 108세라는 말이 있을 정도로 건강하고 활기찬 노년에 대한 관심이 높지만, 노년기를 위협하는 대표적인 관절질환인 퇴행성 관절염으로 고생하는 경우가 많다.실제로 나이가 들수록 퇴행성 관절염의 위험은 높아진다. 2020년도 다빈도질병순위를 보면 무릎관절증의 경우 50대는 9위인데 60대는 3위, 70대에서는 2위를 차지하고 있다. 퇴행성 관절염은 통증 자체도 고통스럽지만 이로 인해 생기는 수면장애, 거동과 신체활동의 제약으로 오는 우울증, 만성질환의 악화 등 2차적인 문제도 심각하다. 초기의 경우 약물치료, 주사치료, 운동치료 등으로 증상을 완화할 수 있고, 중기가 되면 관절내시경수술이나 교정절골술 등을 이용한 보존적 치료가 가능하다. 하지만 말기에 이르면 수술적 치료가 불가피해지기 때문에 관절염이 더 이상 진행되지 않도록 평소 잘 관리하는 것이 중요하다.노년기의 퇴행성 관절염 관리를 위해서는 무엇보다도 허벅지 근육을 강화해 무릎으로 가는 부담을 최대한 줄여주는 것이 중요하다. 허벅지 근육이 강하면 연골이 약해져도 무릎을 지지하는 힘이 커져 무릎 관절을 보호하고 통증도 줄일 수 있기 때문. 이미 증상이 있더라도 관절에 무리가 가지 않는 수영, 평지걷기, 실내자전거 등과 같은 운동을 꾸준히 해주는 것이 좋다.인천힘찬종합병원 정형외과 안치훈 과장은 “관절염으로 인한 통증 때문에 운동을 꺼리는 경우도 많은데, 움직임이 줄면 윤활유 역할을 하는 관절액이 감소해 통증이 심해지고, 허벅지 근력이 약해지는 등 관절염의 진행속도를 앞당길 수 있다”며 “관절염이 있더라도 소염진통제를 복용하면서 운동과 스트레칭을 꾸준히 해주면 관절 주변의 근육과 인대를 강화하고, 혈액순환을 도와 통증을 줄일 수 있다”고 말했다. ]","['젊은 사람도 원래 약하거나 아님 다쳐서 후유증으로 무릎 ,다리,허리 등등 아플 수 있어요..\n선천적으로 무릎연골 안좋아서 연골주사도 맞는 1인입니다ㅎㅎ \n많이 걸은 날은 밤에 무릎 시큰거려서 잠도 설쳐요..\n대중교통에서 젊은 사람에게 무조건 양보 바라는 일부 어른들 좀 알아주면 좋겠네요...', '관절질환은 젊은 층, 어린아이들에게도 발생할 수 있군요. 무릎 관절에 이상이 생기면 매우 힘들다고 하니 다치지 않도록 주의하고 예방을 해야겠어요. 무심코 지나갈 수 있었던 정보를 제공해 주셔서 감사합니다.', '조심합시다']",https://mdtoday.co.kr/news/view/1065600855262856,https://n.news.naver.com/mnews/article/346/0000047502?sid=103
2022.01.08.,쿠키뉴스,,"탈모약 건강보험 적용, 넘어야할 산 많다",,,http://www.kukinews.com/newsView/kuk202201070193,http://www.mt.co.kr/
2022-01-18 16:21:27,메디컬투데이,경제,슈링크리프팅 시술 효과와 주의사항은?,"[    업계 최초의 항노화 신약 개발 기업 하플사이언스(대표 최학배 김대경)가 자사 골관절염치료제 'HS-101'의 연골재생 용도 기술로 미국 특허청(USPTO)과 유럽 특허청(EPO)에 특허를 등록했다고 18일 밝혔다. 하플사이언스에 따르면 'HS-101'을 20개월 노화 실험용 쥐에 투여했을 때 연골 특이 전사인자 'SOX9'을 발현하는 세포가 다수 발견됐다. 또 퇴화해 흔적만 확인할 수 있는 성장판에 연골이 형성되는 결과를 확인했다. 골관절염 실험용 쥐에 'HS-101'를 투여한 결과, SOX9뿐 아니라 ACAN, COL2A1의 유전자 발현이 증가했다. 이를 통해 콜라젠 타입 II 발현 세포 및 프로테오글리칸이 다수 축적됐다는 걸 확인했다. 하플사이언스 측은 ""골관절염 치료 관련 특허 2가지를 출원한 바 있다""고 말했다. 이어 ""이번에 미국, 유럽 특허청으로부터 연골재생 특허를 획득한 걸 계기로 20개국에 특허를 등록하는 데 속도를 내겠다""면서 ""미 개척지인 근본적 골관절염 치료제를 개발하는 글로벌 리더로 자리매김해 나가겠다""고 덧붙였다. 한편 하플사이언스는 골관절염 치료제 외에도 국내 특허를 등록한 만성폐쇄성폐질환 치료제 및 피부노화 개선제 등을 개발하고 있다. 회사 측은 ""현재 기술 개발 중인 퇴행성 질환 신약은 근본적 치료제를 개발하기 어려운 미개척지로 여겨지던 분야""라면서 ""하플사이언스는 노인성 질병을 극복할 수 있는 신약 개발 기업으로 평가받고 있다""고 했다.  ]",[],https://mdtoday.co.kr/news/view/1065603031441842,https://n.news.naver.com/mnews/article/008/0004697742?sid=101
2022.01.10.,하이닥,,‘이것’만 잘 관리해도 심뇌혈관질환 위험 낮춘다,,,http://www.hidoc.co.kr/healthstory/news/C0000661056,http://sports.donga.com/
2022-01-10 10:01:01,메디파나뉴스,경제,노화세포 제거 백신 개발,"[     롯데면세점(대표이사 이갑)은 최근 수요가 늘고 있는 건강기능식품을 테마로 다양한 할인 행사를 진행한다.최근 젊은층 사이에 얼리케어 신드롬(Early-Care Syndrome)이 불고 있다. 건강관리 패러다임이 치료에서 예방으로 바뀐다는 의미로 면역증진 및 노화 방지에 도움을 주는 건강기능식품이 각광받고 있다. 지난해 롯데면세점의 홍삼, 비타민 등 건강기능식품 4분기 매출 역시 1분기 대비 약 82.8% 성장했다.이러한 트렌드에 맞춰 롯데면세점은 지난해 6월 론칭한 해외 직소싱 온라인몰 LDF BUY(엘디에프바이)에서 새해맞이 할인전을 진행한다. 1월31일까지 블랙모어스, 지엔씨, 네추럴라이프와 같은 글로벌 브랜드의 오메가3, 비타민, 프로폴리스 치약, 마누카꿀 등 다양한 상품을 최대 55% 할인한다. LDF BUY 상품은 롯데면세점 호주법인이 직접 소싱을 해 출국 과정 없이 평균 7일 이내 받아볼 수 있다.롯데면세점 관계자는 “설 명절을 앞두고 선물을 준비하는 고객들에게 이번 프로모션이 좋은 기회가 되길 바란다”며 “롯데면세점은 고객들이 매력적인 가격으로 다양한 건기식 상품을 만나볼 수 있도록 상품 종류를 지속적으로 확대해나갈 것”이라고 말했다. 김재범 기자oldfield@donga.com ]",[],http://medipana.com/news/news_viewer.asp?NewsNum=290845&MainKind=A&NewsKind=5&vCount=12&vKind=1,https://n.news.naver.com/mnews/article/382/0000955466?sid=101
23면 2단,전자신문,,'장내 유익균' 수명도 늘린다...KAIST·생명연 수명 연장 가능성 확인,,,http://www.etnews.com/20211231000089,http://www.etnews.com
2022-01-02 12:02:08,파이낸셜뉴스,사회,"롯데면세점, 새해맞이 건강기능식품 할인전","[     노화 쥐와 회춘한 쥐 모델 메타게놈 분석장내 유익균이 노화나 수명에도 영향을 줄 수 있다는 연구결과가 나왔다. 동물 모델을 이용, 가능성을 확인했다.한국연구재단(이사장 이광복)은 조병관 한국과학기술원(KAIST) 교수, 이철호·김병찬 한국생명공학연구원 박사팀이 노령 쥐에 장내 유익균을 경구 투여해 건강 수명 연장 가능성을 확인했다고 2일 밝혔다.현재 다양한 질병과 마이크로바이옴(장 속 수십억 마리 미생물 군단) 상관관계 연구가 활발하다. 노화가 진행되면서 장벽 기능 저하와 투과성 증가가 노화 원인 중 하나인 만성염증 원인이 될 수 있다. 노화로 장내 미생물 구성이 변화되며, 이는 건강과 수명에 영향을 미친다.현재까지는 노화과정과 장내 미생물군 유전체 변화는 비교된 바 없으며, 유익한 장내 미생물을 이용해 노령 쥐 건강 수명을 연장한 연구는 없었다.연구팀은 노화 및 회춘 생쥐모델을 구축하고, 장내 미생물 메타게놈 분석을 진행해 유익균으로 알려진 아카먼시아 미생물 및 부티레이트 생합성 경로 관련 유전자들이 회춘에 중요한 역할을 하고 있음을 규명했다.메타게놈 분석은 특정 환경 시료에 존재하는 모든 유전체 집합을 동시에 분석하는 방법이다. 시료 내 존재하는 전체 미생물 군집을 파악할 수 있을 뿐만 아니라 군집 내 어떤 대사회로가 있는지 밝힐 수 있다.연구팀은 나아가 아카먼시아 미생물을 노령 쥐에 경구 투여해 마이크로바이옴 패턴을 변경, 노령 쥐의 장 건강, 근육 기능, 인지능력 면역체계 노화 관련 표현형을 개선했다. 결과적으로 노령 쥐 건강 수명을 연장했다.과학기술정보통신부와 한국연구재단이 추진하는 바이오의료기술 개발사업 등의 지원으로 수행된 이번 연구 성과는 국제학술지 마이크로바이옴(Microbiome) 지난 12월 15일 온라인판에 게재됐다. ]",[''],http://www.fnnews.com/news/202201100834433247,https://n.news.naver.com/mnews/article/030/0002991336?sid=102
2022.01.14.,전민일보,,[칼럼] 동안을 위한 리프팅시 주의사항은?,,,http://www.jeonmin.co.kr/news/articleView.html?idxno=347579,http://www.fnnews.com/
