Date,Press,Category,Title,Content,Comment,URL_Origin,URL_Naver
2022-01-24 10:29:01,파이낸셜뉴스,생활/문화,다크초콜릿 ‘카카오 폴리페놀’ 성분 성인병 예방효과,"[    [스포츠경향]     랜선건강교실 경희대한방병원 침구과 이수지 교수 젊어지는 비법경희의료원은 ‘공무원연금공단-서울시도심권50플러스센터’와 함께 랜선 건강교실을 개최했다고 지난 24일 밝혔다. ‘젊어지는 비법, 한방동안클리닉’을 주제로 경희대한방병원 침구과 이수지 교수의 특강과 질의응답으로 진행됐다. 누구나 젊게 살고 싶어 한다. 하지만 나이가 들면서 얼굴에 피부탄력 저하, 깊은 주름 등의 노화 현상이 발생한다. 흔히 보톡스 주사, 필러주입술, 지방이식 수술 등의 방법을 고려하지만 한방에서는 환자의 피부와 근육 상태의 기능을 끌어올리는 방법을 이용하여 개선한다. 이수지 교수는 특강에서 안면성형침, 매선, 약침 그리고 한약 등의 한방요법을 통한 혈액순환 개선, 근육균형 조절, 부종 감소, 콜라겐 생성 효과를 소개했다. 안면성형침은 일반적인 침 시술보다 더 가늘고 예민한 침을 사용하여 안면 피부 속 표정근 주위 혈자리 들을 침으로 풀어주고 경혈을 자극한다. 안면 근육 비대칭을 교정하고 근육들의 탄력을 높여서 주름을 완화한다. 매선은 PDO 봉합사를 피부 아래에 넣어 피부의 빈 곳을 채워주고 리프팅 및 지지 작용을 통해 주름 및 탄력을 개선시킨다. 매선이 흡수되기 까지는 약 6개월이 소요되며 흡수과정에서 콜라겐 형성에 도움을 줘서 지속적인 탄력 개선 효과를 얻을 수 있다.이 교수는 “경희대한방병원 동안클리닉은 피부와 근육의 기능 회복과 강화로 건강하고 자연스러운 아름다움을 추구한다”며 “시술에 대한 부담과 부작용이 적고 효과가 오래가는 장점이 있다”고 말했다.이번 랜선 건강교실은 경희의료원 유튜브 채널에서 다시보기가 가능하다. 한편, 경희의료원은 공무원연금공단과 건강정보 콘텐츠 지원 업무협약을 체결하고 2020년 11월부터 매월 1회 랜선 건강교실을 진행해오고 있다. 2022년부터는 서울시에서 50대 이상 중장년층의 일과 삶을 지원을 위해 운영하는 서울시도심권50플러스센터도 함께 참여하여 진행한다.강석봉 기자 ksb@kyunghyang.com   ]",[],http://www.fnnews.com/news/202201271709050087,https://n.news.naver.com/mnews/article/144/0000788963?sid=103
2022.01.20.,매일경제언론사 선정,,국내 인구 80%가 평생 한번이상 앓고 있는 통증은?,,,http://news.mk.co.kr/newsRead.php?no=58634&year=2022,http://www.safetimes.co.kr/
2022.01.26.,이뉴스투데이,,"장성군, 겨울철 건강 지킴이 '장성 미나리' 본격 출하",,,http://www.enewstoday.co.kr/news/articleView.html?idxno=1544558,http://www.heraldbiz.com/
2022-01-24 11:15:05,후생신보,경제,"고려대 산학협력단, 세네릭스에 200억 원 기술 이전","[ 트러블슈터·맘-안티에이징 등유행보다 자신의 컨디션 집중나만을 위한 ‘미코노미’가 대세쿠팡은 자체 빅데이터 분석을 통해 올해 뷰티 트렌드 키워드로 ‘R.E.A.L.M.E’를 선정했다고 24일 밝혔다.올해 키워드 ‘R.E.A.L.M.E’는 트러블슈터(R), 맘-안티에이징(E), 스마트한 귀차니스트(A), 보습 일상러(L), 래쉬 그루밍족(M), 무경계쇼퍼(E) 총 6개의 뷰티 트렌드다.최근 유행에 따르기보다는 나에게 집중하고 자신을 위해 소비하는 ‘미코노미(MEconomy)’가 쇼핑 트렌드로 부상하고, 뷰티 업계에서도 자신의 피부 컨디션에 집중하는 고객의 니즈가 반영된데 따른 것이다. 먼저, R(Revolutionary instant repair with Trouble Shooter)의 ‘트러블 슈터’는 즉각적으로 피부 컨디션 완화 효과를 원하는 고객의 니즈가 반영됐다. 세정력을 갖춘 동시에 순한 성분과 마일드한 제형의 클렌징 제품과 살리실산 등의 의약 성분이 함유된 기능성 스킨케어 제품을 찾는 고객이 크게 늘어났다.E(Exceptional obligation to anti-aging) ‘맘-안티에이징’은 안티에이징(노화 방지)에서 더욱 세분화된 키워드로 최근 두각을 드러내고 있다. 특히 새해를 맞아 미백, 기미, 링클 케어 등 중년 여성 및 엄마들의 피부 고민을 담은 키워드 검색량이 전월 대비 큰 폭으로 증가했다.A(Amazing skip-care and midnight ritual for the lazies) ‘스마트한 귀차니스트’는 바쁜 일상 속 시간 활용을 최소로, 피부 컨디션은 최대로 끌어올리고 싶어 하는 고객의 니즈를 반영했다. 스킨패드, 스틱밤, 올인원, 선쿠션 같은 간편한 제품은 물론 수면 시간을 활용할 수 있는 수면 팩, 수면 크림 등의 검색량도 증가했다.L(Lusciously soft around-the-clock moisturizer) ‘보습 일상러’는 N차 보습을 통해 얼굴에 더해 입술, 손 등 촉촉함이 오래 유지되길 원하는 고객의 일상 속 바람이 담긴 키워드다. M(Maximum devotion to volume lashes) ‘래쉬 그루밍족’은 마스크 착용으로 인해 가려지는 부위보다 노출되는 부위인 눈, 특히 속눈썹을 강조하는 메이크업 방식이 인기를 끌면서 부상했다. E(Evolutional shopping without boundaries) ‘무경계 쇼퍼’는 제품과 제품, 고객과 채널 등 관계 속에서 다양한 소비행태를 보이는 고객을 의미한다.이병희 쿠팡 리테일 부사장은 “쿠팡만의 빅데이터 시스템을 통해 브랜드들이 고객 각각의 니즈에 맞는 상품을 제공하고 고객들도 만족스러운 쇼핑을 경험하실 수 있을 것”이라며 “앞으로도 쿠팡은 고객의 라이프 스타일 변화에 맞춘 특별한 쇼핑 경험을 제공하겠다”고 말했다. 오연주 기자 ]",[],http://www.whosaeng.com/133548,https://n.news.naver.com/mnews/article/016/0001941667?sid=101
2022.01.26.,이뉴스투데이,,"장성군, 겨울철 건강 지킴이 '장성 미나리' 본격 출하",,,http://www.enewstoday.co.kr/news/articleView.html?idxno=1544558,http://www.enewstoday.co.kr/
2022.01.25.,글로벌경제,,"뇌졸증 발생 위험 높은 심방세동 환자, 리듬조절 치료로 치매 감소 14% ↓",,,http://www.getnews.co.kr/news/articleView.html?idxno=569944,http://www.getnews.co.kr
2022.01.17.,아시아경제,,[인사]신한은행,,,https://view.asiae.co.kr/article/2022011711214312907,https://www.asiae.co.kr/
