Date,Press,Category,Title,Content,Comment,URL_Origin,URL_Naver
2021-08-23 16:01:08,헬스조선언론사 선정,IT/과학,눈 점막 '이렇게' 변하면… 빈혈 신호,"[ 한인 과학자 포함된 국제연구진 기억력 감퇴 예방법 발견생쥐실험이지만 사람에게도 적용 가능할 것으로 기대알츠하이머 같은 퇴행성 뇌질환 예방, 치료 가능할 듯    나이들어 ‘깜박깜박’하는 일 막아주는 방법 찾았다 - 한인 과학자가 포함된 국제 공동연구팀이 노화로 인한 기억력 감퇴, 인지기능 저하를 막을 수 있는 단초를 찾았다.미국 코네티컷대 제공 몇 년 전 일까지도 생생하게 기억하던 사람들도 나이가 들면서 기억력이 예전같지 않고 자꾸 ‘깜박깜박’하는 경우가 잦아진다. 나이들면서 인지기능이 떨어지는 것을 막기 위해 규칙적인 운동이나 독서가 권장되고 있지만 뇌기능의 퇴화를 예방하거나 막을 확실한 방법은 아직까지 없다.그런데 한국인 과학자가 포함된 영국 케임브리지대, 리즈대, 이탈리아 신경과학연구소, 플로렌스대, 일본 고베약학대, 네덜란드 왕립 신경과학연구소, 싱가포르 국립대병원, 캐나다 웨스턴대, 체코 실험의학연구소 공동연구팀은 생쥐실험을 통해 노화로 인해 발생하는 기억력 감퇴를 줄이고 예방할 수 있는 방법을 찾았다고 23일 밝혔다. 케임브리지대 뇌치료센터의 한인 과학자 양수정 박사가 제1저자 겸 교신저자로 참여해 연구를 주도했다. 이번 연구결과는 신경과학 분야 국제학술지 ‘분자 정신의학’ 최신호에 실렸다.뇌신경가소성은 뇌가 새로운 것을 배우고 적응하며 기억을 유지할 수 있게 돕는 능력인데 나이가 들면서 뇌신경가소성이 서서히 저하된다. 특히 뇌신경가소성이 내외부적 요인으로 인해 급격하게 저하될 경우는 각종 퇴행성 뇌질환을 앓을 가능성이 높아지는 것으로 알려져 있다.이 같은 상황에서 연구팀은 뇌 신경세포인 뉴런을 둘러싸고 있는 ‘뉴런주위망’(PNNs) 속 화학 성분을 변화시키면 신경가소성이 회복되고 노화에 따른 기억력 감퇴를 늦추거나 막을 수 있다는 사실을 생쥐실험으로 밝혀냈다.연구팀은 생후 20개월된 생쥐와 생후 6개월된 생쥐의 기억력과 판단력을 측정한 결과 인간처럼 나이가 들수록 인지기능이 퇴화된다는 것을 확인했다. 연구팀은 20개월 된 생쥐의 PNNs 속 화학 성분을 변화시킨 다음 미로찾기를 비롯한 각종 인지능력 측정을 한 결과 6개월된 생쥐와 비슷한 수준으로 회복된 것을 관찰했다.연구에 참여한 제임스 포셋 케임브리지대 교수는 “이번 연구는 생쥐를 대상으로 진행됐지만 인간의 뇌 속 분자와 구조가 설치류와 비슷한 점이 많다는 점에 주목해야 한다”며 “이번 방법을 이용하면 사람에게서 나타나는 노화로 인한 기억력 감퇴도 예방하는데 도움을 줄 수 있을 것으로 기대한다”라고 말했다.   ]","['', '작년에도 이기사가 있었는데 나오는거 맞냐?  나오고나서 말해라', '치매극복의길열린다  야호!!', '']",https://health.chosun.com/site/data/html_dir/2021/08/30/2021083001953.html,https://n.news.naver.com/mnews/article/081/0003210945?sid=105
2021.08.12.,아시아경제,,"뉴로핏, 알츠하이머협회 국제컨퍼런스 참가…""뇌영상 분석 AI 플랫폼 ‘세그플...",,,https://view.asiae.co.kr/article/2021081208451610500,http://www.dailypop.kr
2021.08.10.,주간조선언론사 선정,,치매 인구 빠르게 증가... 2050년 3배로,,,http://weekly.chosun.com/client/news/viw.asp?nNewsNumb=002670100034&ctcd=C02,http://weekly.chosun.com/
2021.08.10.,주간조선언론사 선정,,치매 인구 빠르게 증가... 2050년 3배로,,,http://weekly.chosun.com/client/news/viw.asp?nNewsNumb=002670100034&ctcd=C02,http://weekly.chosun.com/
2021-08-10 14:07:09,동아일보,사회,"조수미 ‘음악의 원천’, 어머니 별세","[     세계적으로 치매 환자의 수가 빠르게 증가하고 있다. 국제알츠하이머병협회(ADI)에 따르면 2015년 4678만명이던 전 세계 치매 환자 수는 2018년 5000만명으로 3년 새 300만명 가량 증가했다.     그런데 2050년에 이르러 전 세계 치매 환자 수가 현재의 3배 가까이 증가해 1억5200만명을 넘길 것이라는 예측이 나왔다. 미국 워싱턴대학 연구팀이 진행한 이번 연구는 흡연이나 높은 체질량지수 등 치매 위험요인 추이에 대한 정보를 통합‧분석한 것이다. 최근 온라인으로 이뤄진 ‘알츠하이머 협회 국제 컨퍼런스’에서 발표됐다.    워싱턴대 연구팀은 1999~2019년까지의 세계질병부담연구(GBD) 데이터를 분석했다. 그 결과 2019년 전 세계 치매환자 추산치 5740만명에서, 2050년엔 그 수가 1억5280만명으로 늘어날 것으로 전망했다. 세계질병부담연구는 장애로 인한 질병부담을 측정하는 연구로, 세계보건기구(WHO)를 중심으로 전 세계 건강 동향에 대한 종합적인 연구를 진행하는 프로그램이다.     또 치매 유병률 증가률이 가장 높은 곳은 사하라 이남 아프리카 동부, 북아프리카, 중동이 될 것으로 예측했다.     이번 연구에서 발표한 전망치는 2050년까지 전 세계 치매 환자 수를 1억5200명으로 예측한 WHO의 전망과도 일치하는 것이다. WHO는 현재 전 세계 치매 환자 인구는 약 5000만 명이며, 매년 약 1000만명의 새로운 환자가 발생하고 있다고 보고 있다.    이 같은 연구 결과는 향후 치매 유병률이 감소할 것으로 내다본 일부 의학계의 시각과는 상반된 것이다. 지난 몇 년 새 치매 교육에 대한 대중적 접근성이 향상되는 경향을 보이면서 2050년까지 사전 정보 부족으로 인한 치매 유병률이 세계적으로 620만 건 감소할 것으로 예상하는 흐름이 있었다. 알츠하이머병협회 마리아 카릴로 박사는 “교육에 대한 접근성과 심장건강에 대한 관심이 높아지는 등 선진국 및 기타 지역에 사는 성인의 생활방식이 향상되면서 발병률이 감소한 측면이 있다”고 말했다.    하지만 흡연, 높은 체질량지수, 높은 혈당 등 치매 위험요인으로 인한 유병률이 같은 기간 폭발적으로 증가할 것으로 보이며 전체 유병률의 예상 감소치를 넘어서고 있다. 카릴로 박사는 특히 젊은 층에서 비만, 당뇨 유병률과 주로 앉아서 생활하는 방식이 빠르게 증가하고 있다는 점에 우려를 표했다.     이번 연구를 이끈 엠마 니콜스 워싱턴대학교 의과대학 교수는 “이번에 나온 치매 인구 증가추정치를 통해 정책 입안자와 의사결정자는 치매 환자 수 증가에 대응하고 특정 지리적 환경에서 증가의 요인을 더 잘 이해할 수 있을 것”이라고 평가했다. 니콜스 교수는 “치매 발병을 예방하거나 지연시키기 위해 저비용 고효과 치료법을 찾는 것에 초점을 맞춘 연구가 반드시 필요하다”고 덧붙였다.    ※주간조선 온라인 기사입니다. ]","['와중에 이 나라는 출산률 세계 꼴찌에 자살률 세계 1위라 엔딩 뻔하노 ㅋㅋ 틀니강국 가보자 가보자~', '안타깝지만 치매전 안락사를 요구한사람에한해안락사 합법화 합시다..\n환자도 치매로 생을연장해가는것을 원치않을겁니다. 보호자도 힘들고... 간병인은 전부 중국동포들이고..  최저임금인상으로 간병비만오르고', '', '', '백신에 치매 유발 물질이 있음. 접종자는 이미 치매 예약한 거지. 굿럭', '치매인구가 점점 증가해  2050년에는 3배나 증가 힌다고 하니 너무 무섭습니다 치매위험 요인으로 흡연 체질량지수 높은혈당 비만 당뇨 등을 미리 관리해 큰위험을 예방해야 할것입니다 치매 예방법고 관리법들을 미리 알고 대비할수 있어야 하겠습니다', '', '', '이스라엘 최고라며? ㅋㅋㅋ 지금 봐라 조선젭스야', '치매도 유전적인 요인도 상당함', '치매 치료제가 그전에 나오겠지', '국산 치매치료제  임상단계라고 하드니\n  아직도 감감 무소식이네\n  주가도 영  지자리만 맴돌고\n 몇년안에  치료제  나올듯', '', '', '', '586 치매환자가 3배ㅋㅋㅋㅋㅋㅋ 상상만 해도 끔찍하다']",https://www.donga.com/news/article/all/20210809/108451481/1,https://n.news.naver.com/mnews/article/053/0000029476?sid=102
2021.08.02.,이데일리,,"피플바이오, KMI와 알츠하이머 조기검진 서비스 협약",,,http://www.edaily.co.kr/news/newspath.asp?newsid=02925766629143384,http://www.donga.com/
2021-08-09 03:02:13,이데일리,생활/문화,"피플바이오, 알츠하이머병 진단 위한 혈액검사 유용성 확인 논문 발표","[ 10년 전부터 알츠하이머병 투병曺 대학 재학중 伊 유학 권하고 부친 떠날 때도 “해외공연 집중”曺 “어린시절엔 피아노 강훈 원망…커서야 알아, 지금의 날 만드신 분”올 5월 ‘나의 어머니’ 공연 열기도…소속사 “曺, 코로나로 입국 어려워”    조수미 씨(오른쪽)가 요양병원에서 알츠하이머병으로 투병 중이던 어머니 김말순 씨를 찾아가 옛날 기억을 일깨워주고 있다. 정확한 시기는 미상. SMI엔터테인먼트 제공“어린 시절 어머니가 하루 여덟 시간씩 피아노를 연습하라며 문을 걸어 잠그셔서 원망도 많이 했죠. 나중에야 이해하게 되었습니다. 지금의 나를 만들어 주신 분은 바로 어머니라는 걸요.” (조수미, 2019년 음반 ‘마더’ 기자간담회에서) 세계적 소프라노 조수미를 키워낸 어머니 김말순 여사가 8일 오전 별세했다. 향년 85세. 고인은 10여 년 전 알츠하이머병 진단을 받은 뒤 병원에서 생활해 왔다. 조 씨는 2019년 어머니에 대한 감사를 담은 앨범 ‘마더(Mother)’를 냈고 올해 5월 8일 어버이날에는 감사의 마음을 담은 리사이틀 ‘나의 어머니’를 서울 예술의전당 콘서트홀에서 열기도 했다. 2004년 동아일보와의 인터뷰에서 조 씨는 “어린 시절 동네 어른들이 ‘쟤는 뭘 두드려야 오래 산다’고 얘기해서 부모님이 어려운 살림 가운데서도 피아노를 시키셨다”고 회상했다. 어머니 김 씨도 젊은 시절 성악가가 꿈이었기에 조 씨가 성악에 재능을 보인 순간 장래가 결정됐다. 조 씨는 “어머니가 소프라노 마리아 칼라스를 좋아했다. 나는 뭐든지 시키는 대로 열심히 했지만 그중에서도 성악은 어머니와 나에게 특별했다”고 말했다. 서울대 재학 중 어머니와 스승들의 권유에 따라 이탈리아 산타체칠리아 음악원으로 유학을 떠난 조 씨는 1987년 세계적 지휘자 헤르베르트 폰 카라얀의 깜짝 오디션을 받고 잘츠부르크 페스티벌에서 공연할 베르디 ‘가면무도회’의 오스카역으로 캐스팅되면서 세계적 프리마돈나로 떠올랐다. 그런 그에게도 어머니는 가장 무서운 비평가였다. 한 방송에서 조 씨는 “어머니는 한 번도 내게 잘했다는 말을 하지 않으셨다. ‘오늘 저녁 안 먹었니? 어쩐지 고음이 달리더라’는 식이었다. 가장 무서운 비평가였다”고 회상했다.     2019년 조 씨가 요양병원에서 어머니에게 새 앨범 ‘마더’를 보여주는 모습. 조수미 씨 페이스북2003년 정부가 수여하는 ‘예술가의 장한 어머니상’을 수상한 고인은 2006년 조 씨의 부친이 세상을 떠났을 때 “장례식에 오지 말고 (예정된) 프랑스 파리 공연을 잘하라”고 권해 뜻을 관철하기도 했다. 당시 조 씨는 파리 샤틀레 극장에서 열린 콘서트에서 관객에게 아버지의 별세 사실을 알리고 콘서트를 끝까지 마쳤다. 조 씨의 매니지먼트를 맡고 있는 SMI엔터테인먼트 관계자는 “조 씨가 해외에서 활동하는 중에도 ‘음악과 관계된 기억이 가장 오래 간다’는 학설에 따라 알츠하이머병으로 기억을 잃어가는 어머니를 위해 전화로 노래를 들려주곤 했다”고 전했다. SMI엔터테인먼트 측은 “조 씨가 현재 이탈리아 로마에 있으며 신종 코로나바이러스 감염증(코로나19)으로 인한 자가 격리 문제로 한국에 들어와 상을 치를 수 없는 사정이 있다”고 밝혔다. 유족으로는 조수미 외 조영준(SMI엔터테인먼트 대표), 영구 씨(사업)가 있다. 빈소는 삼성서울병원, 발인 10일 오전 7시. 유족 측은 조문객의 건강과 안전을 위해 조문을 정중히 사양한다고 밝혔다. ]","['우리나라의  국격을 높이시는 분들은 이런 분들입니다.\n삼가 고인의 명복을 빕니다.', '삼가 고인의 명복을 빕니다. 영면하소서. .', '훌륭한 어머님 밑에\n훌륭한 자식이 나오네', '삼가 고인의 명복을 빕니다 세계에서 제일 훌융한 성악가로 키워주신데 대하여 감사 드림니다 사랑합니다', '', '', '']",http://www.edaily.co.kr/news/newspath.asp?newsid=03437446629144040,https://n.news.naver.com/mnews/article/020/0003374830?sid=103
2021.08.12.,메디게이트뉴스,,"뉴로핏, 알츠하이머협회 국제컨퍼런스 참가",,,http://www.medigatenews.com/news/1425707383,http://www.edaily.co.kr/
2021-08-02 13:44:04,중앙일보언론사 선정,경제,"""뮌헨의 가장 위대한 전설"" 독일 축구 폭격기 뮐러 별세","[ KMI한국의학연구소와 협약전국 7곳 검진센터서 서비스""조기진단 통해 효과적 대비""오는 9월 정식 서비스[이데일리 권효중 기자] 혈액 기반 신경퇴행성 질환 전문 바이오 기업 피플바이오(304840)가 KMI한국의학연구소와 협력해 전국 7개 검진센터에서 알츠하이머병 조기검진 서비스를 제공한다고 2일 밝혔다. 오는 9월부터 정식 서비스 예정이다.    KMI한국의학연구소는 서울 3개소, 수원, 대구, 부산, 광주 등 전국 5개 지역에 건강검진센터를 운영해 질병의 조기발견과 예방뿐만 아니라 국민건강증진을 위한 활동을 수행중이다. 신경학적 증상의 발현 전 조기진단이 중요한 알츠하이머병 검진 서비스 제공을 통해 이와 같은 활동에 더 큰 도움이 될 전망이다.피플바이오에 따르면 알츠하이머병 검사키트는 미량의 혈액을 바탕으로 분석을 수행해, 뇌척수액 검사 등 기존 방식에 비해 검사자의 고통이 적다. 또한 고비용의 기존 검사에 비해 경제적 부담과 방사선 노출 위험도 낮다.피플바이오의 혈액검사키트를 활용해 체내의 ‘올리고머화 베타-아밀로이드’의 정도를 측정하면 알츠하이머병의 신경학적 증상이 나타나기 10~20년 전에 조기진단이 가능해진다. 알츠하이머병으로 인한 뇌손상 등의 증상이 나타나기 전에 이를 관리하면 인지장애 등을 늦출 수 있다는 것이 최근 과학적으로 증명되고 있는 만큼, 전문가들은 조기진단으로 환자 개인의 삶을 유지하고 사회경제적 부담을 줄이는 데에 기여할 것으로 기대하고 있다. 강성민 피플바이오 대표는 “더욱 많은 사람들이 알츠하이머병을 빠르게 인지하고, 병증의 발현을 지연시킬 수 있도록 하는 데에 이번 협약으로 한 걸음 나아갈 수 있었다” 며 “평균 수명의 증가에 발맞춰 건강 수명을 고려해야 할 때, 피플바이오가 기업의 사회적 역할을 할 수 있어 기쁘게 생각한다”고 밝혔다.한편 피플바이오는 다양한 검사 서비스를 통해 알츠하이머병을 조기진단하고 대응할 수 있도록 전국의 검진센터, 진료협력병원과 연계를 강화하고 있다. 또한 효과적인 진단을 위해 자체 의약품 생산시설(GMP)을 확충하는 등 전사적인 노력을 기울이고 있다. ]",[],https://news.joins.com/article/olink/23723037,https://n.news.naver.com/mnews/article/018/0005000904?sid=101
2021.08.30.,서울경제언론사 선정,,"""전두환 2014년부터 기억력 감퇴···재판 받는 사실도 기억 못해""",,,https://www.sedaily.com/NewsView/22QE2M9W4P,http://www.edaily.co.kr/
2021-08-04 16:05:03,뉴스1,경제,"""코로나 고령환자 60% 인지장애…알츠하이머 증상 빨라져""","[    [이데일리 이광수 기자] 피플바이오(304840)는 알츠하이머병 전문 저널인 ‘알츠하이머 리서치 앤 테라피(Alzheimer’s Research &amp; Therapy)’에 알츠하이머병 진단을 위한 MDS 기술의 최근 연구결과를 담은 논문을 게재했다고 4일 밝혔다. 이번 연구를 통해서 피플바이오의 MDS 플랫폼을 활용해 측정한 혈중 올리고머화 아밀로이드 베타 정도가 뇌 아밀로이드 상태를 파악할 수 있게 하는 유용한 혈액검사임을 확인했다는게 회사 측 설명이다.이번 논문은 유럽 최대의 알츠하이머 관련 코호트 중 하나인 암스트레담 디멘샤 코호트(Amsterdam Dementia Cohort)와 유러피언 메디컬 인포메이션 프레임워크 포 AD(European Medical Information Framework for AD)에서 제공한 399명의 데이터와 혈액 샘플을 사용해 진행됐다.     정상인과 환자, 치매 전 단계 그룹 등으로 구성된 대상자들은 자기공명영상(MRI), 뇌파검사(EEG), 아밀로이드 PET 등 국제적 임상 기준에 따라 알츠하이머병 여부를 진단 받은 이들로 구성됐다.MDS 플랫폼을 통해 분석한 결과가 뇌 아밀로이드 상태의 분별이 가능한지를 측정했다. 또 알츠하이머 유발 유전자로 알려진 ‘ApoEe4’ 유전자형과 연령 등 알츠하이머에 영향을 미치는 것으로 알려진 변수 등을 고려하여 함께 ROC 분석을 수행했다.그 결과 보관 기간이 4년 이하인 혈액에서 AUC가 0.74로 나타났으며 연령과 유전자형 등을 함께 고려했을 때 0.81의 더 높은 정확도로 뇌 아밀로이드 상태를 구분할 수 있다는 것이 밝혀졌다. 특히, 경도인지장애 환자군을 포함한 치매 전단계 그룹(pre-dementia group)에서는 각각 0.77과 0.86의 더 높은 정확도로 구분할 수 있었다.강성민 피플바이오 대표이사는 “피플바이오의 혈액기반 조기검진에 사용되는 MDS 기술의 유용성을 다시 한 번 과학적으로 입증한 연구라고 생각한다”며 “PET 검사나 요추천자와 같은 환자에게 경제적, 신체적 부담을 주는 검사 이전에 활용할 수 있는 검사법이자, 신약 개발 중 투약 환자 선별을 위한 비용을 약 40% 절감할 수 있는 경제적인 방법으로도 사용할 수 있다는 점을 확인한 의미있는 연구였다”고 평가했다.세계적인 알츠하이머 권위자인 암스테르담 대학 병원 알츠하이머 센터장인 필립 쉘튼(Philip Scheltens) 교수는 “이번 연구에서 MDS-OAβ혈액 검사를 사전 스크리닝 검사 (pre-screener)로써의 활용을 통해 PET 검사 비용과 횟수 감소의 가능성을 확인했다”며 “이는 임상 시험 분야에서 있어 대단히 중요한 결과”라고 말했다. ]","['이런거말고 주가관리좀 해주세요', '대단히 중요한 결과!\n피플바이오 강성민 대표 화이팅입니다.']",https://www.news1.kr/articles/?4391565,https://n.news.naver.com/mnews/article/018/0005003062?sid=101
2021.08.24.,머니S,,"[특징주] 아이큐어, 셀트리온과 치매 치료 패치제 국내 독점판매… 7%↑",,,http://moneys.mt.co.kr/news/mwView.php?no=2021082409168056464,http://www.medigatenews.com
2021.08.10.,헬스조선언론사 선정,,'이 음식' 소량만 먹어도 치매 위험 증가,,,https://health.chosun.com/site/data/html_dir/2021/08/10/2021081001369.html,https://www.joongang.co.kr
2021.08.04.,MTN,,"피플바이오 ""알츠하이머병 진단 위한 혈액검사 유용성 확인""",,,https://news.mtn.co.kr/newscenter/news_viewer.mtn?gidx=2021080415440278083,http://mtn.mt.co.kr
2021.08.10.,헬스조선언론사 선정,,'이 음식' 소량만 먹어도 치매 위험 증가,,,https://health.chosun.com/site/data/html_dir/2021/08/10/2021081001369.html,http://health.chosun.com/
