Date,Press,Category,Title,Content,Comment,URL_Origin,URL_Naver
2023-05-13 03:02:03,국민일보,오피니언,노벨상 빼고 다 받았던 ‘미국 현대문학의 전설’,"[ | 김기석 청파교회 목사미국에 머무는 동안 틈 날 때마다 크고 작은 다양한 박물관과 미술관, 기념관을 찾아가 머물렀다. 어디에나 그곳의 역사와 전시된 유물에 대해 상세하게 설명해주는 안내인들이 있었다. 전시된 유물 하나하나는 이야기였고, 그 이야기는 과거와 현재를 이어주는 끈이었다. 역사는 기억하려는 이들을 통해 만들어지는 것임을 새삼 느낄 수 있었다.    김기석 청파교회 목사펜실베이니아주에 있는 게티스버그 미국 전쟁 박물관은 1863년 7월1일부터 3일까지 게티스버그 인근에서 벌어진 참혹했던 전투를 기억하기 위해 세워졌다. 그 짧은 기간 동안 8000명 이상의 사망자가 발생했고, 그 전투에서 승리한 북군은 결정적인 승기를 잡을 수 있었다. 박물관에는 수학여행 온 학생들로 넘쳐났다. 초등학생들은 곳곳에 모여 자원봉사자들의 설명을 들으며 메모를 하고 있었고, 이미 관람을 끝낸 듯한 중·고등학생들은 기념품을 사기 위해 바글거렸다. 노인들은 숙연한 표정으로 전시물을 둘러보며 소감들을 나누기도 했다. 다양한 세대가 다양한 방식으로 그 공간을 점유하고 있었다. 전시물 가운데 노예를 경매한다는 광고문 앞에 한참 머물렀다. 부동산을 사고파는 것처럼 팔리는 사람들의 이름이 거기에 있었다. 이름, 나이, 가격까지 매겨진 광고판을 유심히 바라보며 그들의 존재와 운명에 대해 숙고했다. 나이대에 따라 값이 달랐다. 한 살짜리 아기의 이름을 보는 순간 전율을 느꼈다. ‘인간은 인간에 대해 늑대’라는 외침이 우렁우렁 가슴으로 파고들었다.미국의 남북 전쟁은 면화산업이 발달해 노예 노동에 의존하던 남부와 경제구조가 다른 북부가 노예해방 문제를 두고 벌어졌다. 1852년에 발간된 해리엇 비처 스토의 &lt;톰 아저씨의 오두막&gt;은 아프리카계 미국 노예들의 비참한 실상을 대중들에게 알리는 계기가 되었다고 한다. 링컨 대통령이 노예 해방을 선포하자 남부의 7개 주가 연방에서 탈퇴해 남부 연합을 결성했고, 제퍼슨 데이비스를 새로운 대통령으로 뽑았다. 전쟁을 피하기 어려운 상황이었다. 전시실 벽면에 적힌 제퍼슨의 연설문 한 구절은 인간이 진리를 따르기보다 자기 이익을 진리로 둔갑시킨다는 사실을 여실히 보여주었다. “우리는 우리의 대의가 정당하고 거룩하다고 믿는다. 우리는 인류 앞에 우리가 평화를 원한다는 사실을 천명한다. 우리가 요구하는 것은 제발 우리를 내버려두어 달라는 것이다.”그는 노예 소유를 ‘정당하고 거룩하다’고 말했다. ‘정당하다’는 말은 자기들의 입장을 정당화하기 위한 수사이겠지만 그것을 ‘거룩하다’고 말하는 것은 경우가 다르다. 세계관 혹은 인식의 문제이기 때문이다. 노예를 소유하는 것이 신의 뜻이라는 뜻이 아닌가? 이것은 어쩌면 지금도 인종주의에 물든 이들 속에서 여전히 맥동하고 있지 않는가. 사람들은 자기들의 욕망을 신의 뜻이라는 포장지에 감싸곤 한다. 지배의 욕망, 소유의 욕망을 신의 뜻과 결합시킬 때 의로운 전쟁이라는 프레임이 생성된다. 자기들을 신의 군대로 인식하는 순간 마주 선 이들은 악으로 규정된다.게티스버그 전투가 끝난 몇달 후 링컨 대통령은 전몰자들을 추념하기 위해 모인 군중들 앞에서 게티스버그 연설로 알려진 그 유명한 연설을 한다. 266개 단어에 불과한 연설이었지만 그 속에는 미국이 지향하려 했던 정신이 옹골차게 들어있다. 그는 미국이 자유 속에서 잉태되고 만인이 평등하게 창조되었다는 전제 위에 세워진 나라라고 선언했다. 자기들이 그곳에 모인 것은 그런 대의가 위기에 처했을 때 자유를 지키기 위해 죽어간 이들에게 마지막 안식처를 봉헌하기 위한 것이지만, 그럴 필요도, 그럴 수도 없다고 말한다. 그들이 그 땅을 축성하고 신성하게 만들었기 때문이다. 남은 자들의 과제는 죽어간 이들이 온전히 이루지 못한 과업을 이루기 위해 헌신함으로 그들의 죽음이 헛되지 않았다는 사실을 보여주는 것이다. 과연 그럴 수 있을까?거룩이란 신의 현존 앞에 서는 이들이 느끼는 경외심과 분리될 수 없다. 신의 현존 앞에서의 삶은 타자에 대한 존중과 배려와 사랑이다. 거룩함을 종교인들의 전유물로 여기는 한 오용되기 쉽다. 거룩함은 속된 것과의 구별됨을 의미하지만 그 구별됨이 타자를 배제하고 혐오하는 데 활용된다면 악마의 간계에 불과하다. 사람들을 가르는 분리의 담들이 무너진 자리, 적대감이 스러지고 환대의 정신이 배어드는 장소, 사람들이 만나 축제의 함성을 외칠 수 있는 곳이야말로 신성한 땅이다. 그 땅이 넓어질 때 사회는 건강해진다.   ]","['ㆍ이 좋은 글에 댓글이 없다니 . . ,  삭막하군 .', '']",https://news.kmib.co.kr/article/view.asp?arcid=0924302593&code=13150000&cp=nv,https://n.news.naver.com/mnews/article/032/0003223285?sid=110
2023.05.13.,여성신문언론사 선정,,[주간 책타래] 형사 박미옥 外,,,http://www.womennews.co.kr/news/articleView.html?idxno=235941,http://www.khan.co.kr/
2023-05-18 17:14:01,한국경제언론사 선정,생활/문화,"""마담 예뻐서"" 노시니어존 카페…상황 반전된 기막힌 이유 [이슈+]","[     창극 배우 김준수, 민은경, 유태평양(왼쪽부터) 이 18일 서울 중구 국립극장에서 국립창극단 신작 &lt;베니스의 상인들&gt;에 대해 소개하고 있다. 국립극장 제공윌리엄 셰익스피어의 유명 희극 &lt;베니스의 상인&gt;이 판소리의 옷을 입고 창극 &lt;베니스의 상인들&gt;로 변신했다. 다음달 8일부터 11일까지 서울 중구 국립극장 해오름극장에서 초연한다. 창극계 스타 김준수와 유태평양이 각각 베니스의 대자본가 ‘샤일록’과 소상인 조합의 리더 ‘안토니오’를 맡아 대결을 벌인다. 김준수와 유태평양은 창작진과 함께 18일 국립극장에서 기자들을 만났다.김준수는 무형문화재 판소리 ‘수궁가’ 이수자이다. 2013년 22세로 국립창극단에 최연소 입단했다. 2016년 엠넷 &lt;너의 목소리가 보여 3&gt;에 출연해 붉은 양복 차림으로 ‘어사출두’를 불러 ‘국악 프린스’라는 별명을 얻었다. 2021년 창작 뮤지컬 &lt;곤 투모로우&gt;에 출연하며 뮤지컬 배우로도 데뷔했다. 아이돌 같은 외모로 작품마다 주인공 역할을 도맡았지만 이번에 원작에선 노인인 샤일록을 연기한다.김준수는 “&lt;베니스의 상인들&gt;은 희극이지만 샤일록은 탐욕 때문에 파멸하는 비극적인 인물”이라며 “연령대를 중년으로 낮췄지만 부담스럽고 어렵다”고 말했다. “관객에게 샤일록 캐릭터를 보여줬을 때 이미지가 이질적이지 않도록 해석하려고 해요. 대사와 노래 사이의 간극을 줄이려고 대사의 ‘말맛’을 살리는 부분을 중점적으로 연습하고 있어요.”유태평양은 소리꾼 고(故) 유준열의 아들이다. 뒤늦게 판소리에 빠진 아버지를 따라 명인 조통달에게 소리를 배웠다. 이미 6세에 3시간짜리 ‘흥부가’를 최연소 완창한 판소리 신동이었다. 2012년 동아국악콩쿠르에서 우승했고, 2016년 국립창극단에 입단했다.유태평양은 “창극 배우로선 희극 장르를 만나볼 기회가 많지 않았다”며 “비극적인 작품을 많이 연기하다 보니 몸이 거기에 맞춰진 것 같았는데 새로운 역할을 맡았다”고 말했다. “정의로운 안토니오는 제가 되고 싶은 이상적인 인물이기도 하죠. 언제나 꿈과 희망을 가진 인물, 무게감 있는 존재를 연기하려고 해요. 피, 땀, 눈물 흘리며 준비하고 있죠.”포샤 역의 민은경은 “판소리가 가진 한의 정서랑 잘 어울려 비극에 많이 출연해왔는데 이번에 희극도 잘 어울린다는 걸 알게 됐다”며 “블랙코미디적인 정서를 잘 표현해보려 한다”고 말했다.    국립창극단 신작 창극 &lt;베니스의 상인들&gt; 연습 장면. 국립극장 제공    국립창극단 신작 창극 &lt;베니스의 상인들&gt; 연습 장면. 국립극장 제공&lt;베니스의 상인들&gt;은 주목받는 젊은 극작가 김은성이 처음 창극에 도전한 작품이기도 하다. 김은성은 서양 고전 희곡을 현대 한국에 맞춰 재창작한 작품들로 유명하다. 셰익스피어의 &lt;햄릿&gt;을 &lt;함익&gt;으로, 안톤 체호프의 &lt;바냐 아저씨&gt;를 &lt;순우삼촌&gt;으로 재창작했다. 셰익스피어의 &lt;베니스의 상인&gt;은 기독교가 이자를 금지한 16세기 유럽이 배경으로 유대인 혐오와 인종차별을 합리화한다는 비판을 받는다. 김은성이 캐릭터와 줄거리를 재창작하는 작업에 꼬박 1년이 걸렸다.김은성은 “평소 국립창극단 작품을 보는 것이 큰 즐거움이었는데 같이 공연하고 싶은 욕심에 대본 집필 제안을 덜컥 받아들였다”며 “대극장에 맞게 캐릭터의 사이즈를 키워 대형 무역상사와 소상인 조합의 대결로 바꿨다”고 말했다. “원작을 다시 꼼꼼히 여러 번 읽었는데 학생 시절 읽었을 때하곤 느낌이 많이 다르더라고요. 낭만적으로 사랑 놀음 하는 젊은이들이 어떻게든 열심히 살아보려는 노인을 혼내주는 느낌에 찜찜했죠. 희극적 축제로 마무리해야 했기 때문에 종교·인종적 편견을 덜어내고 연대를 통한 정의 실현을 보여주려 했어요.”연출가 이성열은 2017년 창극 &lt;산불&gt;에 이어 두 번째로 국립창극단 작품 연출을 맡았다. 이성열은 “단순히 즐거운 작품만은 아니고 젊은이의 사랑과 패기, 시민들의 연대로 벽을 뚫는 희망을 전하는 작품”이라고 말했다. “샤일록은 악인이라기보다 철저히 프로페셔널한 자본가죠. 기득권인 법을 활용해서 ‘법대로 하자’는 거예요. 안토니오는 흙수저의 힘을 모아 기득권을 무너뜨리려는 민중이고요. 역경을 겪지만 굴하지 않는 모습에서 용기와 위안을 얻으셨으면 해요.” &lt;베니스의 상인들&gt;은 국립창극단 역대 작품 중에서 가장 노래가 많다. 작창가 한승석은 전통 판소리의 장단과 음계에 충실하게 소리를 짰고, 작곡가 원일은 재즈, 팝, 헤비메탈, 전자음악 등을 조합하면서 함께 62개 곡을 만들었다. 무대 규모 면에서도 이례적인 대작이다. 배우 32명이 옷을 바꿔 입으며 캐릭터 54명을 연기한다. 6m 길이의 거대 범선이 등장하고 약 3만개의 꽃송이가 공중에서 부유하는 장면도 나온다. 외국인 관객을 위한 영어 자막도 제공된다. VIP석 8만원, R석 6만원, S석 4만원, A석 2만원이다.    국립극장 제공 ]","['과연 국립창극단이 국립이라는 단어가 없다면 공연예술 시장에서 경쟁력이 있는 장르일까? 왜 국립극단을 비롯 다른 국립예술단체가 재단화 되고 분리 되었는데 국립창극단은 아직도 재단화를 안시키고 있는지 형평성에 너무 맞지가 않음.', '그들만의 리그, 매번 나오는 사람만 나오고 새로운 인물이 없음. 스타 몇명이 끌고가는 장르.']",https://www.hankyung.com/life/article/2023051056147,https://n.news.naver.com/mnews/article/032/0003224398?sid=103
2023.05.21.,비마이너,,"[읽히는 라디오] 탈시설 예산 48억 원, 부족한가요?",,,https://www.beminor.com/news/articleView.html?idxno=24980,http://www.nocutnews.co.kr
2023-05-09 14:51:01,아이뉴스24언론사 선정,사회,[이슈] 카페에 나타난 '노 시니어존'…왜 나타났나 봤더니,"[ '2022 국가인권위원회 인권상황보고서' 발간    연합뉴스국가인권위원회(인권위)는 지난해 이태원 참사에 대한 정부 대응에 아쉬움이 있었다면서 국가의 책임을 분명히 인정해 희생자와 유족을 존중하는 방식으로 애도해야 한다고 밝혔다.9일 인권위가 이런 내용을 담아 지난해 국내 인권 상황을 평가하고 개선책을 제시하는 '2022 국가인권위원회 인권상황보고서'를 발간한다고 밝혔다.이번 보고서는 지난해를 '재난·참사 상황에서의 인권 문제가 두드러진 해'라고 평가하며 별도의 장으로 다뤘다.인권위는 이태원 참사에 대해서 ""재난·참사의 예방 단계, 발생과 수습 단계, 진상조사와 회복 단계 등 각 단계에서 여러 가지 문제점이 드러났다""며 ""한국 사회의 재난안전관리와 예방 체계, 국민 안전을 대하는 국가 지도층의 책임 의식에 근본적 변화가 없었다는 것이 드러났다""고 지적했다.인권위는 이태원 핼러윈 축제에 많은 인파가 몰릴 것이라 예상됐음에도 재난관리책임기관이 안전 관리 대책을 수립하지 않았고 신고가 접수된 후에도 신속한 조치가 이뤄지지 않는 등 참사 예방이 제대로 이뤄지지 않았다고 평가했다.또 진상조사 과정에서 사고 책임자의 처벌 문제, 사망한 희생자와 유가족을 존중하지 않는 방식의 추모와 애도, 혐오표현과 2차 가해 문제가 제기되고 있다고 짚었다.이어 ""안전한 사회 건설은 시대적 과제이며 정부는 예견된 위험에 적절히 대응하지 못해 국민을 보호하지 못한 국가의 책임을 분명히 인정해 이태원 참사 희생자와 유가족을 존중하는 방식으로 애도하는 것이 필요하다""는 의견을 제시했다.아울러 철저한 진상규명, 책임자에 대한 상응한 조치, 재발 방지 대책 수립 등 필요한 조치가 신속히 이뤄져야 한다고도 했다.이 밖에도 인권위는 지난해 폭우로 신림동 반지하 주택에 살던 일가족이 사망한 사고를 언급하며 주거 취약계층 보호를 위한 정책이 마련돼야 한다고 언급했다.또 보고서는 표현의 자유, 집회·시위의 자유 등 인간의 기본적인 자유와 관련한 문제, 장애인·이주민·아동·여성·노인·군인 등 다양한 사회 구성원이 당면한 인권 문제, 노동 문제와 북한 인권 문제 등을 폭넓게 다뤘다.인권위는 ""보고서가 우리 사회 인권상황을 이해하고 인권 보호와 증진에 관한 논의를 한 걸음 더 나아가게 하는 데 도움이 되기를 바란다""고 밝혔다.※CBS노컷뉴스는 여러분의 제보로 함께 세상을 바꿉니다. 각종 비리와 부당대우, 사건사고와 미담 등 모든 얘깃거리를 알려주세요.이메일 : jebo@cbs.co.kr카카오톡 : @노컷뉴스사이트 : https://url.kr/b71afn ]","['근데 당신들 인권위  강제북송시킨  주민들과 북한에 의해 불탄공무원에 대한 문통 정부에 대해서는  침묵하시는데?', '많고 많은 인권침해 사례는 다 조용하더니~', '선택적 인권에만 의견을 내는 인권위는 해체하라!', '(좌파아닌)정부에 문제잇다 겠지 ㅋㅋㅋㅋ', '인권위 그럼 제천화제로 29명 돌아가신것에대해  문통정부책임  먼저 물어야지?', '당연한것인데 이찍이들과 윤석두일당들은 생까고있다', '인권위도 좌파 잡것들인데 무슨....그나물에 그밥이요 짜고치는 고스톱인데 그걸 국민이 모르겠냐? 돈봉투에 코인까지 아주 다들 골고루 빼먹었더만~ 민주당과 좌파들 니들은 남 욕할 자격조차 없는 잡것들인데 뭔 🐕 소리냐', '인간적으로 걔네들이 놀러 간거든 노는 애들이든 경찰 신고를 아무리 해도 아무도 출동을 안한 거에 대해서 조사는 확실히 해야될거다 촛불 집회 핑계 대는데 집회는 늦어도 6-7시에 다 끝났다 9시부터 미친 듯이 신고 들어갔는데 출동도 안하고 늘 하던대로 바라케이트는 왜 안쳤는지 밝혀야 될거다 후진국에서나 일어나는 일이 한국에서 벌어졌다는 게 엽기적이고 경찰들이 신고를 미친듯이 해도 전혀 출동할 생각이 없었다는 게 너무 이상하다 할로윈 축제 유명하다니깐 코스프레 구경간 젊은 애들이 그냥 노는 애들로 몰아버리는 어른들 참 못됐다', '인권위 압수수색 들어가겠군요.', '문재인과 민주당이 만든 조직', '얘네 좌파 아님?역시나ㅋㅋㅋㅋㅋ', '인권위 물갈이해라..  문재인 알박기들이 문제였지?', '2010년 천안함사건  좌파대통령시절 에 대한 인권위는  정부책임 왜 애기 안하는가?']",http://www.inews24.com/view/1593232,https://n.news.naver.com/mnews/article/079/0003767783?sid=102
2023.05.08.,연합뉴스언론사 선정,,애틀랜타 스파 이어 댈러스 쇼핑몰…美한인 또 총격 참변 '악몽',,,https://www.yna.co.kr/view/AKR20230508115800009?input=1195m,https://www.yna.co.kr/
2023-05-08 16:17:41,오마이뉴스,정치,더 많은 솔로들의 이야기가 필요하다,"[ 2021년 애틀랜타 총기난사로 한인 4명 희생…지난해도 댈러스서 3명 부상아시아계 노린 범죄 증가…""증오범죄로 가중 처벌해야"" 목소리    지난 6일 총기 난사 사건이 발생한 텍사스주 앨런의 아웃렛[AFP=연합뉴스 자료사진. 재판매 및 DB 금지]    (서울=연합뉴스) 이지헌 이도연 기자 = 지난 6일(현지시간) 미국 텍사스주 댈러스 교외 쇼핑몰에서 발생한 총기 난사 사건으로 한인 교포 일가족 3명이 목숨을 잃은 것으로 확인되면서 그간 미국 내에서 증오 범죄 등으로 한인이 희생된 사건들이 다시금 조명되고 있다.     7일 주휴스턴총영사관 댈러스출장소에 따르면 전날 오후 댈러스 교외 '앨런 프리미엄 아웃렛'에서 발생한 총기 난사 현장에서 30대 한국계 부부 조모씨와 강모씨, 이들의 3세 아이가 총격에 맞아 숨졌다.    또 부부의 다른 자녀인 5세 아이는 크게 다쳐 당일 병원으로 옮겨진 뒤 현재까지 치료를 받고 있다. 이들 일가족은 모두 미국 국적으로 확인됐다.    댈러스에 거주하는 이들은 주말을 맞아 쇼핑을 나섰다가 참변을 당한 것으로 전해졌다.     이번 사건의 범인으로 밝혀진 마우리시오 가르시아의 소셜미디어 계정에서 인종주의와 관련된 수백 개의 게시물이 확인되고 그의 옷에 'RWDS'(Right Wing Death Squad, 우익암살단)라는 문구가 있는 것으로 알려지면서 이번 범죄가 백인 우월주의 등에 의한 혐오·증오 범죄일 가능성이 제기되고 있다.     증오범죄는 소수 인종, 동성애자, 장애인이나 노인 등 사회적 약자에게 이유 없는 증오심을 갖고 위해를 가하는 행위를 뜻한다.    과거 한인 또는 아시아인이 희생된 미국 내 총기 난사 사건이 여러 차례 발생했고 증오범죄로 규정됐으나 여전히 이들을 겨냥한 증오범죄가 계속되고 있다는 점에서 근본적 대책이 필요하다는 지적이 나올 수밖에 없다.     2021년 3월 16일에는 조지아주 애틀랜타에서 백인 총격범이 스파 2곳 등에서 총기를 난사해 8명이 숨졌다. 희생자 8명 가운데 6명이 아시아계 여성이었고 이 중 4명이 한인이었다.    범인 로버트 애런 롱은 지난 2021년 7월 조지아 체로키 카운티 법원에서 아시아계 여성 2명과 백인 남녀 2명을 살해한 혐의에 대해 유죄를 인정하고 가석방 없는 종신형을 선고받았다.    재판 직후 롱은 풀턴 카운티로 이송돼 이곳 법원에서 한인 4명 살해 혐의로 별도의 재판을 받고 있다. 이 지역 검사장은 롱에게 증오범죄 혐의를 적용하고 사형을 구형하겠다고 밝혔다.    불과 1년 전에도 이번 총기 난사가 발생한 텍사스주 댈러스 코리아타운 미용실에서 총격 사건이 발생해 한인 3명이 다치는 일이 발생했다.    흑인 남성인 범인 제러미 세런 스미스는 미용실로 들어와 주인과 종업원, 손님 등 한인 여성 3명을 총으로 쏘고 도망쳤으며 피해자들은 팔과 발 등에 총상을 입고 병원으로 이송됐다.    댈러스 검찰은 스미스를 특수폭행 7가지 혐의에 증오범죄 혐의를 가중해 기소했다.    한인 등 아시아계를 겨냥한 증오 범죄는 특히 코로나19 팬데믹 이후 급증했다.    아시안 증오 사건 신고 사이트 아·태계 증오를 중단하라'(STOP AAPI Hate)에 따르면 코로나19 가 본격화한 2020년 3월 19일부터 작년 3월 31일까지 신고 기준으로 아시안 대상 증오 사건은 1만1천467건이 발생해 하루에 15건 이상 발생한 셈이었다.    이 중 한인 대상은 1천835건(16%)으로 중국계(43%)에 이어 두 번째로 많다.     불과 1년 만에 한인이 희생된 총격 사건이 발생한 댈러스는 텍사스주 북부에 있는 주의 중심 도시로 2021년 기준 인구는 128만여명이다.    텍사스주의 주휴스턴 대한민국 총영사관 자료에 따르면 2019년 기준으로 텍사스주에는 한인이 14만6천여명, 댈러스와 그 근교 지역에는 3만7천383명이 살고 있다.    댈러스 지역의 한인 중에는 의사, 에너지 전문가 등 전문직들이 상당수 거주하며 청소업과 건물 임대업 등의 사업으로 성공한 한인들도 다수 있다.    dylee@yna.co.kr ]","['', '아시아인 혐오가 아니라 중국인 혐오다!! 장개들만 골라서 처리해라!! 우리 한인은 떨끗하나 다치게 하지 말거라!!!', '', '', '', '', '', '""사람 죽이는 데 무슨 이유가 있냐?"".. 영화 ""공공의 적"" 중에서..  이렇게 맘대로 사람을 죽인 놈들.. 그냥 이유 묻지 말고 헤드에 총알 심어주면 됨.', '바퀴벌레들 총 맞고 지옥행 들 ㅋㅋㅋ', '조준도 못해서 난사만 해대는 멍청한 백인 벌레들... 털많고 냄새나는거 말고는 우월할거 개뿔도 없는것들이...', '그래도 총질은 안돼', '', '중국인 거리는 놈들은 저기서 총 쏜 애들이랑 거의 도긴개긴이네', '경상도', '내나라에서 살지 머 빤다고 미국가서리..탕..', '국민들이 저렇게 죽어나가는데...... 윤가야~~군용기 보내서 자국민들 데려와야지~~~뭐하냐??? 다 죽고나서 데려올거냐???']",https://www.ohmynews.com/NWS_Web/View/at_pg.aspx?CNTN_CD=A0002927508&CMPT_CD=P0010&utm_source=naver&utm_medium=newsearch&utm_campaign=naver_news,https://n.news.naver.com/mnews/article/001/0013928008?sid=100
2023.05.20.,연합뉴스TV,,'노키즈존'에 '노시니어존'까지…세대갈등 심화 우려,,,http://www.yonhapnewstv.co.kr/MYH20230520002100641/?input=1825m,http://www.ohmynews.com/
