Date,Press,Category,Title,Content,Comment,URL_Origin,URL_Naver
2017-01-23 13:25:02,에너지경제,경제,"농협은행, 설 맞아 독거 노인에 우리농산물 ‘전달’","[           LIG넥스원 신입사원들이 23일 경기도 수원보훈요양원을 찾아 국가유공자 어르신의 '휠체어 적응훈련'을 돕고 있다.    LIG넥스원 신입사원 40여명이 23일 경기도 수원보훈요양원을 찾아 돌봄이 필요한 국가유공자와 유족들을 위한 봉사·나눔 활동을 펼쳤다.  이번 행사는 설을 앞두고 LIG넥스원이 지역사회에 기여하고 방위산업체로서의 사회적 책임을 다하기 위해 진행됐다. 신입사원들은 치매, 중풍 등 노인성 질환으로 요양시설에서 지내고 있는 국가유공자 및 유족 어르신들과 함께 '손, 발 마사지' '휠체어 산책' '식사 보조' 등의 봉사활동을 실시하며 즐거운 시간을 보냈다. LIG넥스원 회사 차원에서는 후원금 300만원을 전달하기도 했다.  봉사활동에 참여한 김선재 연구원은 ""좋아하시는 어르신들을 보니 우리 사회가 더 많은 관심을 가져야겠다는 생각이 든다""며 ""오늘날의 우리가 있도록 희생하신 호국영웅들과 그 가족들이 명예와 긍지를 가지고 건강한 노후를 보내시길 바란다""고 말했다.  한편 LIG넥스원은 '호국보훈'의 가치를 담은 다양한 사회공헌활동을 통해 사회와의 동반성장을 실천하고 있다. 매년초 현충원에서 '애국시무식'을 실시하고 있으며, 1사1병영 부대지원, 서해수호의날 추모행사, 희생장병 어버이날 행사, 군장학재단 후원, 군부대 방문 및 발전기금 전달, 군자녀 기숙사 유지·보수 지원 등을 지속적으로 실시하고 있다.   eco@fnnews.com 안태호 기자   ▶ 세상의 모든 골 때리는 이야기 'fn파스'▶ 속보이는 연예뉴스 fn스타  ※ 저작권자 ⓒ  파이낸셜뉴스. 무단 전재-재배포 금지   ]",[],http://www.ekn.kr/news/article.html?no=264284,https://n.news.naver.com/mnews/article/014/0003766329?sid=101
2017.01.26.,경남도민신문,,합천 대병면 자원봉사회 목욕봉사 행사,,,http://www.gndomin.com/news/articleView.html?idxno=131705,http://www.ekn.kr
2017.01.25.,헤드라인제주,,"공무원연금공단, 어려운 이웃 사랑의 떡국나눔 봉사",,,http://www.headlinejeju.co.kr/?mod=news&act=articleView&idxno=297481,http://www.gndomin.com/
2017.01.25.,미디어펜,,"SPC그룹, 설 맞아 사회봉사활동 진행",,,http://www.mediapen.com/news/view/228996,http://www.headlinejeju.co.kr
2017.01.25.,서울경제,,"[서울경제TV] 저축은행중앙회, 성동노인복지관서 새해 첫 나눔활동",,,http://www.sedaily.com/NewsView/1OAYG6N3WV,http://www.sedaily.com
2017-01-25 17:07:03,뉴스1,경제,여천NCC 드림봉사단 설맞이 어려운 노인에 쌀 후원,"[    저축은행중앙회(회장 이순우)는 설을 맞이해 25일 성동구 마장동에 위치한 성동노인종합복지관을 방문, 설맞이 후원금을 전달하고 배식봉사활동을 펼쳤다.이순우 회장을 비롯한 저축은행중앙회 임직원들은 지난해 봄부터 성동노인종합복지관을 방문해 어르신들에게 점심 배식봉사를 하고 있는데, 올해도 이어서 매월 네 번째 수요일에 배식 봉사활동을 실시할 예정이라고 밝혔다. 이순우 중앙회장은 “중앙회가 올해 선정한 ‘서민은 따뜻하게 지역은 풍요롭게’라는 슬로건처럼 저축은행 임직원들이 다양한 사회공헌활동을 펼쳐 이웃사랑을 몸소 실천하는 등 나눔 문화 확산에 앞장설 계획”이라고 전했다./김성훈기자 bevoice@sedaily.com    [서울경제 바로가기]나와 찰떡 궁합인 대선 후보는? [설문 바로가기]서울경제와 친해지는 가장 확실한 방법 [페이스북]저작권자 ⓒ 서울경제, 무단 전재 및 재배포 금지   ]",[],http://news1.kr/articles/?2889902,https://n.news.naver.com/mnews/article/011/0002964003?sid=101
2017.01.25.,아시아투데이,,"한국야쿠르트, 홀몸노인 초청해 '사랑의 떡국 나누기' 진행",,,http://www.asiatoday.co.kr/view.php?key=20170125010016662,http://news1.kr/
2017-01-19 11:01:00,매일경제,사회,"KT고객센터, 설 맞이 봉사활동 실시","[     여천NCC㈜ 3팀 드림봉사단의 사회공헌 활동.(여천NCC 제공)2017.1.19/뉴스1 © News1 서순규 기자(여수=뉴스1) 서순규 기자 = 여천NCC㈜ 3팀(팀장 장병숙 상무) 임직원으로 구성된 드림봉사단(대표 황채동)은 18일 전남 여수지역 복지사각지대 노인 30세대를 방문, 쌀 600㎏과 롤 화장지 등 150만원 상당의 생필품을 전달했다. 드림봉사단은 지난해 9월 동여수노인복지관과 소외계층 복지증진 업무협약을 체결하고, '오감만족 희망밥차'와 경로식당 설거지 봉사, 주거환경 개선활동 등 다양한 봉사활동을 전개해 오고 있다.  황채동 회장은 ""적은 금액이지만 팀원들이 십시일반 모금해 생필품을 마련했다""며 ""명절인데도 외롭게 보내야 하는 분들께 작은 희망이 되었으면 한다""고 말했다.sk@▶ 놓치면 후회! 최신 무료만화 보기 / 2017년 나의 운세 보기[© 뉴스1코리아(news1.kr), 무단 전재 및 재배포 금지] ]",[],http://news.mk.co.kr/newsRead.php?no=59080&year=2017,https://n.news.naver.com/mnews/article/421/0002517218?sid=102
2017.01.26.,천지일보,,"대구신천지봉사단, 어르신들에 '백세만세 떡국나눔' 봉사",,,http://www.newscj.com/news/articleView.html?idxno=402631,http://www.asiatoday.co.kr
2017.01.19.,서울경제,,"롯데하이마트, 전국 독거노인에 설 음식 배달봉사",,,http://www.sedaily.com/NewsView/1OAVOFIGBD,http://www.mk.co.kr/
2017-01-25 10:03:04,국토일보,경제,"K-water, 전국 113개 봉사동아리별 명절 사랑 나누기 '앞장'","[    KT is의 사회공헌공동체 노사랑은 25일 설 명절을 맞아 서울 동자동 쪽방촌세서 봉사활동을 진행했다고 밝혔다. 2001년 출범한 KT is는 KT그룹의 고객서비스 전문기업이다.이번 '설 맞이 손단장 봉사활동'에서는 KT고객센터 소속 장애인 네일아트사와 컨설턴트 40여명이 쪽방촌 거주 노인들에게 손안마와 네일케어를 해드렸다. 또 삼계탕, 쌀, 약과, 곶감, 식혜 등 푸짐한 설 맞이 음식을 전달했다. 전달한 설 음식은 컨설턴트들이 십시일반으로 모은 기금으로 마련됐다. KT컨설턴트는 지난해부터 네일아트 서비스를 받을 때마다 1000원 가량의 소액을 기부해 왔다. KT고객센터는 감정노동자들의 업무 만족과, 감성 케어를 위해 지난해 7월부터 컨설턴트(상담사)를 대상으로 네일아트 서비스를 제공해 왔다. KT is는 서비스 제공과 소수자 채용 활성화 차원에서 장애인 네일아트사 10명을 채용한 바 있다. [디지털뉴스국 김경택 기자][매일경제 공식 페이스북] [오늘의 인기뉴스] [매경 프리미엄][ⓒ 매일경제 &amp; mk.co.kr, 무단전재 및 재배포 금지]   ]",[],http://www.ikld.kr/news/articleView.html?idxno=68259,https://n.news.naver.com/mnews/article/009/0003878930?sid=101
37면 2단,서울경제,,"LIG넥스원 새내기들, 국가유공자 찾아 요양 봉사",,,http://www.sedaily.com/NewsView/1OAXJ1PCPS,http://www.newscj.com
2017.01.26.,디트뉴스24,,"노인복지관 자원봉사자 조동주 어르신, 사회적 효행 후원금(1,000,000원) 기부",,,http://www.dtnews24.com/news/article.html?no=412414,http://www.sedaily.com
2017-01-19 14:12:02,노컷뉴스,경제,"롯데아울렛 수완점, 설 명절 봉사활동 펼쳐","[     19일 경기 안산 안산시초지종합사회복지관에서 ‘롯데하이마트 샤롯데 봉사단’ 직원들과 송영봉(앞줄 왼쪽 네번째) 롯데하이마트 안산지사장, 이경우(앞줄 왼쪽 다섯번째) 안산시초지종합사회복지관 관장이 기념 촬영을 하고 있다./사진제공=롯데하이마트롯데하이마트는 설을 앞두고 전국 독거노인 대상으로 ‘음식박스’ 배달 봉사를 진행한다고 19일 밝혔다.‘롯데하이마트 샤롯데 봉사단’은 19일부터 23일까지 서울, 경기, 대구, 부산 등 전국 7개 지역의 독거노인 복지기관을 찾아 총 1,000만 원 상당의 음식박스를 전달한다. 독거노인종합지원센터와 연계해 봉사활동을 진행하며, 음식박스에는 떡국과 사골국 등의 간편식을 포함해 총 6가지 음식이 담겼다. 첫 봉사활동은 19일 안산 지역 독거노인 복지기관(안산시초지종합사회복지관)에서 시작됐다. 롯데하이마트 샤롯데 봉사단은 짝을 이뤄 독거 어르신 가정에 직접 음식박스를 배달하고 말벗이 돼 함께 시간을 보냈다.롯데하이마트 샤롯데 봉사단’은 지난해에도 복지관을 두 차례 방문해 지역 독거노인 어르신을 위한 선풍기와 안마기, 난방가전을 기증했다.송영봉 롯데하이마트 안산지사장은 “2017년 새해를 맞아 독거 어르신들이 따뜻한 설을 보내시길 바라는 마음에서 음식배달 봉사활동을 준비했다”며 “앞으로도 도움이 필요한 이웃들을 위해 진심을 담은 나눔 활동을 꾸준히 이어갈 것”이라고 말했다./신희철기자 hcshin@sedaily.com[서울경제 바로가기]나와 찰떡 궁합인 대선 후보는? [설문 바로가기]서울경제와 친해지는 가장 확실한 방법 [페이스북]저작권자 ⓒ 서울경제, 무단 전재 및 재배포 금지   ]",[],http://www.nocutnews.co.kr/news/4724510,https://n.news.naver.com/mnews/article/011/0002960221?sid=101
2017.01.26.,노컷뉴스,,"롯데아울렛 수완점, 설 명절 봉사활동 펼쳐",,,http://www.nocutnews.co.kr/news/4724510,https://www.nocutnews.co.kr
2017-01-26 11:27:03,이데일리,사회,"저축은행중앙회, 새해 첫 배식 봉사활동","[ [광주CBS 이승훈 기자]    (사진=롯데아울렛 수완점 제공)롯데아울렛 수완점(점장 문언배) 샤롯데 봉사단 20여명은 설을 앞둔 지난 25일 북구 오치동에 위치한 우리이웃 장애인자립생활센터를 방문해 독거 장애인과 장애인 가족들에게 전달할 설 명절음식 만들기 봉사활동을 진행했다고 밝혔다.우리이웃장애인자립생활센터는 2000년 8월 창립 후 중증장애인의 자립생활기술훈련과 차별 없는 사회적 환경구축을 위해 다양한 프로그램 진행을 통해 장애인들이 지역사회에서 주최적인 삶을 살 수 있도록 하고 있다.샤롯데 봉사단 임명숙 회장은 ""장애인들과 함께 명절음식을 만들며 친밀해질 수 있는 계기가 돼 마음이 따뜻해졌다""며 ""앞으로도 지역 내 어려운 이웃들을 위해 봉사할 것""이라고 소감을 밝혔다.롯데아울렛 수완점 문언배 점장은 ""주변에 경제적으로 어렵게 사시는 장애인, 독거노인 분들과 소외된 이웃들에게 자원봉사를 통해 더불어 사는 지역사회를 만들기 위해 정기적인 자원봉사를 진행하게 됐으며 앞으로도 지속적인 나눔을 실천할 계획이다""고 밝혔다. yycub@hanmail.net저작권자 © CBS 노컷뉴스(www.nocutnews.co.kr) 무단전재 및 재배포 금지  ]",['설에 쉬나'],http://www.edaily.co.kr/news/newspath.asp?newsid=03047126615801328,https://n.news.naver.com/mnews/article/079/0002923532?sid=102
2017.01.26.,EBN,,"롯데홈쇼핑, 영등포구 소외계층 ‘설 맞이 음식’ 나눔봉사",,,http://www.ebn.co.kr/news/view/873774,http://www.edaily.co.kr/
2017-01-25 11:36:04,한국경제,경제,"한화첨단소재 임직원, 설 온정 나눔 봉사활동나서",[    [이데일리 노희준 기자] 저축은행중앙회는 설날을 맞이해 성동구 마장동에 위치한 성동노인종합복지관을 방문해 설맞이 후원금을 전달하고 배식봉사활동을 했다고 25일 밝혔다. 이순우 회장을 비롯한 저축은행중앙회 임직원들은 작년 봄부터 성동노인종합복지관을 방문해 점심 배식봉사를 펼치고 있다. 올해도 계속해서 매월 네 번째 수요일에 배식 봉사활동을 실시할 예정이다. 이순우 중앙회장은 “중앙회가 올해 선정한 ‘서민은 따뜻하게 지역은 풍요롭게’라는 슬로건처럼 저축은행 임직원들이 다양한 사회공헌활동을 펼쳐 이웃사랑을 몸소 실천하는 등 나눔 문화 확산에 앞장설 계획”이라고 밝혔다.노희준 (gurazip@edaily.co.kr)＜ⓒ종합 경제정보 미디어 이데일리 - 무단전재 &amp; 재배포 금지＞ ],[],http://www.hankyung.com/news/app/newsview.php?aid=201701251697i,https://n.news.naver.com/mnews/article/018/0003735320?sid=101
2017.01.23.,MTN,,"롯데마트 샤롯데 봉사단 ""올해 설에도 독거노인 점심 제공""",,,http://news.mtn.co.kr/newscenter/news_viewer.mtn?gidx=2017012317555538993,http://www.ebn.co.kr
2017.01.26.,헤드라인제주,,"제주우정청, 설맞이 행복나눔 봉사활동 전개",,,http://www.headlinejeju.co.kr/?mod=news&act=articleView&idxno=297663,http://www.hankyung.com/
2017-01-25 14:43:01,경기일보,경제,과천 자원봉사센터 노인대상 설맞이 한마당 행사,"[    한화첨단소재는 임직원 30여명이 지난 24일 세종시 종합사회복지관을 방문해 ‘설 온정 나눔 봉사활동’을 진행했다고 25일 발표했다. 한화첨단소재 임직원들은 인절미와 동태전 호박전 등 설 명절 음식을 만들어 독거노인 가정 및 저소득 가정 등 60가구에 전달했다.이선석 한화첨단소재 대표는 “앞으로도 지속적인 봉사활동을 통해 지역 내 소외된 이웃들에게 온정을 전하겠다”고 말했다. 한화첨단소재는 본사가 있는 세종시를 중심으로 충북 내 사회복지기관들과 결연을 맺고 다양한 사회공헌 프로그램을 진행 중이다.조아란 기자 archo@hankyung.com[한경닷컴 바로가기] [스내커] [모바일한경 구독신청] ⓒ 한국경제 &amp; hankyung.com, 무단전재 및 재배포 금지   ]",[],http://www.kyeonggi.com/?mod=news&act=articleView&idxno=1301818,https://n.news.naver.com/mnews/article/015/0003719473?sid=101
2017.01.25.,천지일보,,"KB국민은행, 설날맞이 '동계인턴행원 봉사활동' 실시",,,http://www.newscj.com/news/articleView.html?idxno=402290,http://mtn.mt.co.kr
2017.01.25.,아시아투데이,,"SPC그룹, 설 맞아 전국 사업장 인근 복지기관서 봉사활동",,,http://www.asiatoday.co.kr/view.php?key=20170125010016631,http://www.headlinejeju.co.kr
2017.01.24.,뉴시스,,"주택금융공사, 부산시노인종합복지관에 500만원 기부",,,http://www.newsis.com/view/?id=NISX20170124_0014661990&cID=10404&pID=10400,http://www.kyeonggi.com/
2017.01.24.,뉴시스,,"주택금융공사, 부산시노인종합복지관에 500만원 기부",,,http://www.newsis.com/view/?id=NISX20170124_0014661990&cID=10404&pID=10400,http://www.newsis.com
2017-01-24 15:37:44,EBN,경제,"롯데마트 샤롯데 봉사단, 설 명절 독거노인 점심 제공","[     【서울=뉴시스】이근홍 기자 = 주택금융공사는 부산시 거제천로에 위치한 부산시노인종합복지관을 방문해 '설맞이 사랑 나눔' 활동을 실시했다고 24일 밝혔다. 이날 행사에는 김재천 주금공 사장과 임직원들로 구성된 보금자리 봉사단이 참여했다.  주금공은 복지관에 기부금 500만원을 기부하고 900여명에게 떡국을 대접했다.  김 사장은 ""앞으로도 노인들의 복지향상에 도움이 될 수 있도록 다양한 노력을 기울이겠다""고 말했다.  lkh2011@newsis.com 뉴시스 뉴스, 네이버 뉴스 스탠드에서도 만나세요뉴시스 SNS [페이스북] [트위터]&lt;저작권자ⓒ 공감언론 뉴시스통신사. 무단전재-재배포 금지.&gt; ]",[],http://www.ebn.co.kr/news/view/873029,https://n.news.naver.com/mnews/article/003/0007733267?sid=101
2017.01.26.,미디어펜,,"롯데홈쇼핑, 영등포구 소외계층에 '설 맞이 음식' 나눔 봉사 진행",,,http://www.mediapen.com/news/view/229326,http://www.ebn.co.kr
2017.01.25.,쿠키뉴스,,"SPC그룹, 설 명절 맞이 사회봉사활동 진행",,,http://www.kukinews.com/news/article.html?no=427162,http://www.mediapen.com
2017.01.30.,국방일보,,독거노인 돕고 孝전화 ‘훈훈한 정’ 나눠,,,http://kookbang.dema.mil.kr/kookbangWeb/view.do?parent_no=42&bbs_id=BBSMSTR_000000000138&ntt_writ_date=20170131,http://www.kukinews.com
2017.01.25.,시사오늘,,"KB국민은행, ´동계 인턴행원 봉사활동´ 실시",,,http://www.sisaon.co.kr/news/articleView.html?idxno=51452,http://kookbang.dema.mil.kr
2017.01.25.,NSP통신,,"김포경찰서, 경찰발전위원회와 노인요양시설 방문 나눔봉사 실천",,,http://www.nspna.com/news/?mode=view&newsid=205297,http://www.sisaon.co.kr/
2017.01.25.,EBN,,"저축은행중앙회, 설맞이 임직원 봉사활동 실시",,,http://www.ebn.co.kr/news/view/873608,http://www.nspna.com/
2017.01.25.,울산매일신문,,"폴리텍대학 울산캠퍼스, 병영노인식당 위문품",,,http://www.iusm.co.kr/news/articleView.html?idxno=713878,http://www.ebn.co.kr
21면 2단,디지털타임스,,"중부발전, 설 맞아 전국 사업소서 `행복나눔 봉사`",,,http://www.dt.co.kr/contents.html?article_no=2017012502109932101003,http://www.iusm.co.kr
2017.01.25.,메트로신문,,"KB국민은행, 설날맞이 '동계 인턴행원 봉사활동'",,,http://www.metroseoul.co.kr/news/newsview?newscd=2017012500091,http://www.metroseoul.co.kr
2017.01.25.,세계일보,,"국립박물관문화재단, 설 앞두고 봉사활동 펼쳐",,,http://www.segye.com/content/html/2017/01/25/20170125003630.html?OutUrl=naver,http://www.segye.com
2017-01-25 18:00:00,머니S,경제,"LIG넥스원, 국가유공자·유족 위한 봉사활동 실시","[    국립박물관문화재단은 설 명절을 앞둔 지난 24일, 서울 마포구에 위치한 용강노인복지관을 찾아 봉사활동을 펼쳤다.용강노인복지관은 하루 200여명의 어르신들이 이용하는 구립 복지시설로, 문화재단 직원들은 이날 복지관 내 꿈사랑식당에서 배식, 서빙, 설거지 등을 하면서 어르신들과 정겨운 시간을 보냈다.류승완 재단 노조위원장은 “앞으로도 박물관 문화나들이, 극장 용 객석나눔, 헌옷 기부와 유니세프 모금함 운영 등 노사가 함께하는 다양한 문화나눔 활동을 진행할 예정“이라고 말했다.김현주 기자ⓒ 세상을 보는 눈, 글로벌 미디어 세계일보 ]",[],http://www.moneyweek.co.kr/news/mwView.php?type=1&no=2017012314458057637&outlink=1,https://n.news.naver.com/mnews/article/022/0003139893?sid=101
2017.01.26.,경남도민일보,,"LH 경남본부, 경남노인지원센터 봉사활동",,,http://www.idomin.com/?mod=news&act=articleView&idxno=529276,https://www.moneys.co.kr/
2017-01-23 14:48:03,충북일보,경제,"충주, 칠금금릉동 지역사회보장협의체 설 맞아 이미용 봉사","[  본문 이미지 영역    LIG넥스원 신입사원들이 지역사회에 기여하고 방위산업체로서의 사회적 책임을 다하기 위해 23일 수원 보훈요양원을 찾아 국가유공자와 유족들을 위한 봉사·나눔 활동을 펼쳤다. /사진=LIG넥스원LIG넥스원 신입사원 40여명이 23일 수원 보훈요양원을 찾아 돌봄이 필요한 국가유공자와 유족들을 위한 봉사·나눔 활동을 펼쳤다.LIG넥스원 측은 설을 앞두고 지역사회에 기여하고 방위산업체로서의 사회적 책임을 다하기 위해 이번 행사를 진행했다고 설명했다.  이날 LIG넥스원 신입사원들은 노인성 질환(치매·중풍 등)으로 요양시설에서 지내고 있는 국가유공자 및 유족 어르신들과 함께 ‘손·발 마사지’, ‘휠체어 산책’, ‘식사 보조’ 등의 봉사활동을 펼치며 즐거운 시간을 보냈다. 봉사활동에 참여한 김선재 기계연구소 연구원은 “좋아하는 어르신들을 보니 우리 사회가 더 많은 관심을 가져야겠다는 생각이 든다“며 “오늘날의 우리가 있도록 희생하신 호국영웅들과 그 가족들이 명예와 긍지를 가지고 건강한 노후를 보내시길 바란다”고 말했다.실시간 재테크 경제뉴스│창업정보의 모든 것 허주열 기자 sense83@mt.co.kr &lt;저작권자 ⓒ '성공을 꿈꾸는 사람들의 경제 뉴스' 머니S, 무단전재 및 재배포 금지&gt;   ]",[],http://www.inews365.com/news/article.html?no=480351,https://n.news.naver.com/mnews/article/417/0000227533?sid=101
2017.01.26.,MTN,,"KIC, 노숙인 위한'설맞이 사랑나눔 급식' 봉사활동",,,http://news.mtn.co.kr/newscenter/news_viewer.mtn?gidx=2017012616280218834,http://www.idomin.com
2017.01.25.,쿠키뉴스,,"[금융 이모저모] 국민은행, 설맞이 떡만둣국 봉사 外",,,http://www.kukinews.com/news/article.html?no=427343,http://www.inews365.com
2017.01.26.,소비자가 만드는 신문,,"롯데홈쇼핑, 영등포구 소외계층에 ‘설 맞이 음식’ 나눔 봉사 진행",,,http://www.consumernews.co.kr/?mod=news&act=articleView&idxno=515643,http://mtn.mt.co.kr
2017.01.25.,뉴스웨이,,"장흥군 누리보듬 봉사단, 설맞이 봉사활동 ‘훈훈’",,,http://www.newsway.co.kr/view.php?tp=1&ud=2017012520554502192,http://www.kukinews.com
2017.01.24.,경기일보,,"남양주 수동면노인회, 설 선물 사랑 나눔 행사 개최",,,http://www.kyeonggi.com/?mod=news&act=articleView&idxno=1303176,http://www.consumernews.co.kr
2017.01.24.,경기일보,,"남양주 수동면노인회, 설 선물 사랑 나눔 행사 개최",,,http://www.kyeonggi.com/?mod=news&act=articleView&idxno=1303176,http://www.kyeonggi.com/
2017.01.24.,서울파이낸스,,호텔신라 '맛있는 제주만들기' 봉사모임 쌀 기부,,,http://www.seoulfn.com/news/articleView.html?idxno=271538,http://www.seoulfn.com/
2017.01.25.,매일경제,,"김혜리·이종수, ‘사랑은 방울방울’ 팀과 ‘사랑의 도시락’ 봉사",,,http://star.mk.co.kr/new/view.php?mc=ST&no=60877&year=2017,http://www.mk.co.kr/
2017-01-25 17:02:00,전자신문,,"롯데하이마트, 전국 독거노인에 설 음식 배달봉사",[],[],http://www.etnews.com/20170119000265,https://n.news.naver.com/mnews/article/009/0003879310?sid=106
2017.01.16.,매일경제,,"신한생명, `설맞이 떡국 나눔` 봉사활동 실시",,,http://news.mk.co.kr/newsRead.php?no=36694&year=2017,http://www.etnews.com
2017-01-19 14:09:04,컨슈머타임스,경제,"롯데홈쇼핑, 영등포구 소외계층 위한 '설 맞이 음식' 나눔 봉사","[    롯데하이마트는 자사 샤롯데 봉사단이 23일까지 서울, 경기, 대구, 부산 등 전국 7개 지역 독거노인 복지기관을 순차 방문해 총 1000만원 상당 `음식박스`를 전달한다고 19일 밝혔다.이번 봉사활동은 독거노인종합지원센터와 연계해 추진한다. 음식박스는 설을 홀로 보내는 독거 어르신을 위해 떡국과 사골국 등 간편식을 포함한 총 6가지 음식을 담았다. 첫 봉사활동은 19일 안산 지역 독거노인 복지기관(안산시초지종합사회복지관)에서 시작했다.송영봉 롯데하이마트 안산지사장은 “새해를 맞아 독거 어르신이 따뜻한 설을 보내시길 바라는 마음에서 음식배달 봉사활동을 준비했다”면서 “앞으로도 도움이 필요한 이웃을 위해 진심을 담은 나눔 활동을 꾸준히 이어갈 것”이라고 말했다.    윤희석 유통 전문기자 pioneer@etnews.com▶ 전자신문 인기 포스트▶ 전자신문 공식 페이스북▶ 전자신문 바로가기 [Copyright ⓒ 전자신문 &amp; 전자신문인터넷, 무단전재 및 재배포 금지] ]",[],http://www.cstimes.com/news/articleView.html?idxno=236990,https://n.news.naver.com/mnews/article/030/0002576171?sid=101
2017.01.23.,경남도민신문,,합천 가회면 노인 목욕봉사 펼쳐,,,http://www.gndomin.com/news/articleView.html?idxno=131260,http://www.mk.co.kr/
2017-01-16 14:12:04,매일일보,경제,"[대한민국이 좋다] SPC그룹, 설 맞아 사회봉사활동 진행","[      신한생명은 지난 14일 서울 봉천동 관악노인종합복지관에서 '떡국 나눔 봉사활동'을 실시했다고 16일 밝혔다. 이번 봉사활동은 관악노인종합복지관에서 생활하고 있는 어르신 500여명을 대상으로 진행됐다. 이날 직원봉사자 20여명은 어르신들을 위해 준비한 떡국과 기장밥, 떡갈비 등을 배식한 후 설거지 및 식당 정리 등의 활동에 참여했다. 또 어르신의 겨울나기에 도움을 드리기 위해 준비한 수면양말을 전달했다. [디지털뉴스국 김진솔 기자][매일경제 공식 페이스북] [오늘의 인기뉴스] [매경 프리미엄][ⓒ 매일경제 &amp; mk.co.kr, 무단전재 및 재배포 금지]   ]",[],http://www.m-i.kr/news/articleView.html?idxno=286005,https://n.news.naver.com/mnews/article/009/0003873827?sid=101
2017.01.23.,불교신문,,구미 문수사사회봉사단 자비나눔 봉사,,,http://www.ibulgyo.com/news/articleView.html?idxno=155147,http://www.cstimes.com
2017.01.26.,아주경제,,"예보, 전통시장 구매 물품 봉사단체 기부",,,http://www.ajunews.com/view/20170126092952867,http://www.gndomin.com/
