Date,Press,Category,Title,Content,Comment,URL_Origin,URL_Naver
2023.09.25.,뉴스1,,"대한항공, 강서노인복지관서 명절음식 봉사",,,https://www.news1.kr/articles/5181830,http://news1.kr/
2023-09-25 08:40:46,노컷뉴스언론사 선정,경제,"임영웅 팬클럽 영웅시대충북, 독거노인 위해 연탄봉사","[     대한항공 제공(서울=뉴스1) 금준혁 기자 = 대한항공(003490)은 25일 사회봉사단원 30명이 기내식을 담당하는 대한항공씨앤디서비스 직원 10명과 강서노인종합복지관에서 '명절 음식 한상 나눔' 봉사를 진행했다고 밝혔다.기내식 조리사가 현장에서 명절 음식을 요리해 어르신 500명에게 대접했고 찹쌀떡과 약과, 식혜 등 간식 선물도 증정했다.   ]",[],https://www.nocutnews.co.kr/news/6017786,https://n.news.naver.com/mnews/article/421/0007071737?sid=101
2023.09.24.,조선비즈,,"KB국민카드, 추석 맞이 취약노인 봉사활동 실시",,,https://biz.chosun.com/stock/finance/2023/09/24/EEPKU2IR5ZAPFMTFY44PUQJSZU/?utm_source=naver&utm_medium=original&utm_campaign=biz,http://www.nocutnews.co.kr
2023-09-24 09:22:03,연합뉴스언론사 선정,생활/문화,"""100세까지 봉사해야 하는데"" 경기 최고령 자원봉사자 신봉섭씨","[     임영웅 팬클럽 영웅시대충북 제공가수 임영웅의 팬들이 도움이 필요한 독거노인들을 위해 따뜻한 나눔을 실천했다. 임영웅 팬클럽 영웅시대충북은 지난 21일 독거노인들을 위하여 연탄 봉사 활동을 했다고 밝혔다. 길이 좁고 옮기기 힘든 지역을 대상으로 회원 25명이 연탄 3400장(289만 원 상당)을 5곳 가정에 직접 전달했다. 영웅시대충북은 ""다가오는 겨울을 따뜻하게 보내길 기원하면서 기쁜 마음으로 봉사 활동을 했다""고 전했다. 이들은 지난 6월 22일에도 초록우산어린이재단 충북지역본부를 방문, 주거 및 생계지원이 필요한 8남매 아동 지원을 위해 700만 원의 후원금을 전달한 바 있다. 영웅시대충북은 ""4년째 행복한 선행을 실천할 수 있어서 기쁘며, 모두가 힘든 시기에 가수 임영웅으로부터 받는 감동과 위로를 어려움을 겪고 있는 지역의 도움이 필요한 독거노인들에게 나눌 수 있게 되어 기쁘게 생각한다""며 ""앞으로도 선하고 건전한 팬덤 문화에 동참하기 위해 꾸준한 나눔을 실천할 예정""이라고 전했다.※CBS노컷뉴스는 여러분의 제보로 함께 세상을 바꿉니다. 각종 비리와 부당대우, 사건사고와 미담 등 모든 얘깃거리를 알려주세요.이메일 : jebo@cbs.co.kr카카오톡 : @노컷뉴스사이트 : https://url.kr/b71afn ]","['선한 영향력의 아이콘 임영웅 팬클럽 영웅시대충북 독거노인 위한 연탄봉사 소식 감동입니다 임영웅 더욱 더 발전하길 응원합니다', '임영웅 영웅시대 선한영향력 늘 감동입니다~~', '임영웅   영웅시대  꾸준한 선한영향력 봉사활동  너무멋져요  응원합니다', '선한영향력의 본이되고 있는 임영웅 영웅시대 사회곳곳에서 기부하고 봉사하는 모습 \n 고맙고 감동입니다', '임영웅 영웅시대 팬덤의 선한영향력 실천 자랑스럽습니다 함께 응원합니다', '임영웅 영웅시대 충북 독거노인 을 위한 연탄기부 열악한 곳을 찾아 아름다운 사랑을 전했네요 올 겨울이 따뜻 할겁니다', '임영웅 팬클럽 독거노인 위해 연탄봉사 아름다운 선행 응원합니다', '요즘 날씨가 선선해지는데 이리 훈훈한 소식이라니 선한영향력의 아이콘 임영웅 팬덤 멋져요', '전 팬도 아니지만 BTS를 뛰어넘는 임영웅과 그의 팬들 대단합니다!  응원합니다~~~!^^', '젊은이가 나라의 정말 귀감이 되는일을 하니  대단하고 훌륭합니다.  임영웅보다 더 나이든 사람들이 더 배워야할듯ᆢ저 또한 베풀며  노력하겠습니다.', '대단한 아티스트와팬이십니다  임영웅  영웅시대   응원합니다', '임영웅 영웅시대 아름다운 선한영향력 응원합니다', '제 여자친구가 열렬한 임영웅 팬  인데요.\n임영웅을 위한 공간이라면 어디든 찾아갑니다.\n여자친구가 엄청 행복해 하는 모습만 봐도 기분좋고\n흐뭇하기 때문이죠//', '임영웅 팬은 아니지만 정말 올바른 가치관의 청년이자 대중 스타인듯', '임영웅 영웅시대 충북 팬님들 넘 아름답습니다 꾸준한 선행에 감동이 가득합니다 사랑합니다 언제나 건행 ~ 😊', '임영웅 팬클럽 영웅시대충북, 독거노인 위해 연탄봉사 고맙습니다 선한영향력을 실천하는 아티스트와 팬덤 화이팅입니다', '임영웅 가수를 사랑하고 신뢰하는 팬들의 훈훈한 선행에 마음이 따뜻해집니다', '임영웅  을 닮은  그의 팬덤  영웅시대의  선한영향력이  세상을 따뜻하게 만드네요.\n대명절 추석을 앞두고 독거노인분들을 위한 충북 영웅시대의  따뜻한 마음에 박수를 보냅니다', '임영웅 충북 영웅시대 연탄 나눔 독거노인 위한 연탄봉사 실천하는 멋진 영웅시대가 언제나 함께합니다', '임영웅 영웅시대 그가수에 그펜 언제나 기분좋게 하루를 열어가네요 함께해요 오래도록 응원합니다', '임영웅 영웅시대 쉼없는 선행행렬 언제나 응원하고칭찬합니다', '임영웅 선한영향력으로 이어진 팬덤의 기부와 봉사 자랑스럽고 응원합니다  언제나 건행하며  꽃길만 걸어가길 응원합니다', '임영웅 팬클럽 영웅시대 끊임없는 기부 봉사 활동\n응원합니다', '항상 좋은소식 전해주는  영웅시대 사랑하고 존경합니다 \n영웅시대 충북 독거노인 위해 연탄봉사 감사합니다 \n우주최강 임영웅  사랑해요', '기부천사 임영웅 선한 영향력으로 영웅시대 충북에서 연탄기부 존경합니다', '선한영향력 임영웅 영웅시대 대단합니다 \n언제나 영웅시대 응원합니다 건행', '선한영향력 대명사 국민가수 임영웅 때문에 대한민국이 따뜻합니다 사랑이 넘치구요 다음 콘서트는 꼭 호남평야 기대합니다 사랑합니다 건행', '임영웅 선한영향력은 끊이질 않네요 흐뭇한소식 \n연탄불  만큼이나 훈훈한 소식이네요 고맙습니다\n응원합니다', '선한영향력 전파하시는 영웅시대 사랑하고 존경합니다 \n우주최강 임영웅 사랑해요', '선한 영향력을  주는 임영웅   영웅시대  핫팅', '가수 임영웅 팬덤 최고입니다 멋져요', '가수와함께 세상을 따뜻하게하는 영웅시대,오래오래 임영웅 응원하며 건행하길 바랍니다', '임영웅 선한영향력 영웅시대 충북 독거노인 위한 연탄봉사 훈훈하고 감동이예요', '임영웅 팬클럽 영웅시대충북, 독거노인 위해 연탄봉사 감동입니다 어디서나 빛이나는 히어로 응원합니다', '임영웅 팬클럽 영웅시대 역시 최고예요. 그 가수에 그 팬덤👍', '임영웅 가수는 목소리가 명품입니다', '임영웅 영웅시대 파이팅!', '임영웅   영웅시대 팬클럽   선한영향력  너무나  자랑스러워요  존경합니다', '임영웅 선한영향력 영웅시대 끊임없는 사랑과봉사 존경합니다. 항상 건행하시길 응원합니다.', '임영웅 선한영향력을 곧대로 이어받은 영웅시대분들 참보기좋으네요..응원합니다', '임영웅 멋진가수 자랑스러워요', '임영웅  영웅시대  선한영향력  최고입니다  사랑합니다  고맙습니다👏👍', '임영웅 영웅시대 선한영향력 칭찬합니다', '충북영웅시대 화이팅 입니다', '임영웅 &amp; 영웅시대 천사들의 모임 선한영향력의 아이콘', '임영웅 영웅시대의 선한 기부문화가 따뜻한 사회를 만들어 줍니다', '임영웅  팬클럽 영웅시대  독고노인 선한영향력에 감사합니다. 항상 좋은일하시는 당신이 천사이네요', '아름다운 나눔과 봉사를 꾸준히 하는\n 임영웅 팬덤에게 아낌없는 박수를 보냅니다', '임영웅 선한영향력 실천하는 팬클럽 영웅시대 존경하고 응원합니다', '임영웅  영웅시대 선한영향력', '임영웅 영웅시대 함께 나누는 아름다운 사랑 선한영향력 실천하심에 감사드리며 응원합니다', '임영웅 팬클럽 영웅시대 대단하네요 세상을 참 따뜻하게 하는 소식입니다', '슈퍼스타의 영향력으로.. 좋은일에 앞장서 주세요...', '임영웅 과 함께 꾸준한 봉사하는 영웅시대 마음이 정말 훈훈합니다', '임영웅 최고의 목소리 사랑합니다', '영웅시대 따뜻한 나눔 감사합니다', '임영웅 X 영웅시대 아름다운 동행 감동입니다. 어쩜 꾸준한기부와 봉사활동 진짜루 징하십니다. 직접 배달까지 감동 그자체입니다. 임영웅 선한영향력은 어디까지일까요? 소중한내가수 언제나 응원합니다', '임영웅 충북 영웅시대 연탄 나눔 독거노인 위한 연탄봉사 실천하는 멋진 영웅시대 찬란한 히어로 영웅시대의 멋진 동행을 응원합니다', '임영웅 팬클럽 영웅시대 충북 독거노인위해 연탄봉사 선한영향력 최고입니다 빛나는 내가수 언제나 사랑하고 응원합니다', '임영웅 팬클럽 영웅시대 독거노인 위해 연탄봉사 선한영향력 실천한 울 영웅시대 존경스럽씀니다 사랑합니다', '임영웅 영웅시대 선한영향력 감동 응원합니다', '임영웅   영웅시대 충북   연탄봉사  응원 합니다', '임영웅 빛나는 내가수 항상응원합니다', '임영웅 영웅시대 선한영향력 연탄봉사 넘 감사해요', '임영웅\n최고 아티스트 사랑하고 응원합니다.', '임영웅 영웅시대가 늘 함께 응원합니다', '임영웅  영웅시대  나눔의  손길  우리이웃 의  따ㄸ한\n마음  응원합니다', '클래스가 다른 팬덤 영웅시대   아티스트 임영웅 최고', '임영웅 팬클럽 선한영향력 아름다운 나눔 실천 감사합니다 응원합니다', '임영웅 선한영향력으로 이 시대를 이끌어가는 감성 아티스트 응원합니다', '임영웅 팬클럽 영웅시대 언제나 좋응일 실천 \n감동입니다', '임영웅 멋지고 세련된 최고의 아티스트 사랑해요 영웅시대 선한영향력 실천 응원합니다', '기부천사 임영웅 &amp; 영웅시대 아름다운 동행 선한영향력 최고입니다👍', '임영웅 최고의 슈퍼스타 영웅시대 선한영향력 감사합니다 임영웅 👍', '임영웅 영웅시대 연탄봉사\n따뜻한소식  넘 존경스럽네요', '임영웅 멋지고 멋진 가요계의가왕 원탑 국민가수 사랑합니다 팬클럽 영웅시대 감사드리고 존경합니다 👍', '임영웅  영웅시대 선한영향력  그가수에 그팬덤 응원합니다', '임영웅   영웅시대 선한영향력  일파만파   세상을 아름답게 만듭니다', '선한영향력에 찬사를 보냅니다  영웅시대. 언제나  사랑합니다', '임영웅 팬클럽 충북 영웅시대 독거노인 위한  연탄 나눔 봉사  실천 하는 선한영향력', '맘씨 따뜻한 영웅시대 응원합니다', '임영웅   영웅시대    따뜻한  나눔사랑  \n입니다   최고입니다', '임영웅 팬클럽 선한영향력 응원합니다', '임영웅 언제나 멋진 글로벌가수 피나는 노력과 연습으로 감동을 주는 가수입니다', '임영웅 영웅시대 아름다운 선행 감동입니다', '임영웅 영웅시대 선한영향력  귀감이 되네요 이시대의 영웅 영웅시대 화이팅!', '임영웅 영웅시대 선한영향력 언제나 머리부터 따뜻함이 느껴집니다', '임영웅 최고의명품가수 국보급감성장인 멋진 영웅시대 선한영향력최고 언제나최고이십니다', '임영웅   눈이부시게 멋진 울영웅님 늘 사랑하고 응원합니다', '임영웅 영웅시대의 선한영향력 최곱니다.', '임영웅 그가수에그팬덤영웅시대 선한영향력 기부와 나눔 응원합니다', '임영웅   영웅시대 사랑합니다', '임영웅 선한 영향력 영웅시대 사랑합니다', '임영웅 팬클럽 영웅시대충북, 독거노인 위해 연탄봉사 고맙습니다 선한영향력을 끼치는 최고의 아티스트 응원합니다', '임영웅 영웅시대충북 독거노인 연탄봉사 너무 감사합니다 ^^ 많이 힘들었을텐데..\n언제나 함께 해요 응원할께요 😊', '임영웅 영웅시대 선한영양력 따뜻한 마음 너무나좋아요', '임영웅 영웅시대 독거노인들을 위한 연탄 봉사 멋집니다', '임영웅 본업존잘 최고의아티스트 영웅시대가 함께 하는 아름다운 동행 응원합니다 \n2023 lM HERO 전국투어 콘서트 성료 응원합니다', '임영웅   선한영향력을  함께 실천하는 팬덤문화가  독보적이고   귀감이 됩니다   응원합니다', '개딸들이 배워야 하는데~~ㅠ', '임영웅  영웅시대 선한영향력 사회 전체 널리 널리 퍼져 나가길 바래요', '임영웅 선한영향력까지 언제어디서나 최고의아티스트 빛나는내일을 함께응원합니다', '임영웅 역시 멋져요. 팬클럽 행보  대단합니다', '임영웅 &amp;영웅시대 선한영향력의 가수와팬덤 감동입니다 언제나 응원합니다', '임영웅 선한영향력 펼치는 아름다운 가수 최고의 인성과배려가 훌륭한 가수입니다', '임영웅 영웅시대 선한영향력 기부천사 따뜻하고 훈훈하네요 \n최고의국민가수 언제나 응원합니다 사랑합니다', '임영웅   팬클럽 영웅시대  넘넘  사랑하고 응원합니다', '임영웅 팬들 봉사 사진 완전 감동', '임영웅 가수 팬들 정말 보기좋아요', '임영웅 언제나 함께하고 응원합니다.', '임영웅 팬클럽 영웅시대충북 독거노인 위해 연탄봉사 4년째 선한 영향력 실천 감사합니다 존경합니다', '임영웅 영웅시대 늘 응원합니다 감사합니다', '임영웅 선한영향력의 아티스트 사랑하고 응원합니다', '임영웅 팬클럽 독거노인 위해 연탄봉사 활동 훈훈한 소식 감동입니다', '임영웅 영웅시대 선한영향력의 아이콘 자랑스러워요 임영웅 천재아티스트 아낌없이 응원해요', '', '임영웅  팬클럽 독거노인 연탄기부 아름다운 마음전해 아름다운. 영웅시대  감사합니다', '임영웅  의팬으로서 자부심을가지고 가수욕먹지않게하려고 행동거지도 바르게살려고신경씁니다\n건행', '몇년 지나면 출마할듯', '임영웅 팬클럽 아름다운 선한영향력 늘 귀감이 됩니다', '임영웅 영웅시대 선한 영향력에 감동입니다  응원해요', '임영웅 영웅시대 팬클럽 선한영향력 존경합니다', '임영웅  영웅시대 꾸준한 선한영향력 감동입니다', '우리모두가  따뜻했으면  좋겠습니다  ^+^', ""감사합니다..역시 I'm hero 팬클럽..근데.."", '응원합니다 화이팅~^^', '', '임영웅 선한영향력 팬클럽 영웅시대의 기부의 실천 \n언제나 감동을 주네요~응원합니다', '개 딸들\n이 기사\n보고있냐', '임영웅 팬들 최고입니다 선행 감사합니다', '콘서트 추첨제로 합시다.', '임영웅 과 팬들 선한 영향력 멋지다', '임영웅 선한영향력 그리고 팬클덥 영웅시대  충북 독거노인 연탄봉사 아름다운 손길 박수를 드립니다 늘 컨행', '임영웅 팬들 훈훈한 선행 소식 좋아요', '임영웅 영웅시대 선한기부 늘 응원합니다', '애쓰지마세요', '임영웅 구속영장 발부해라', '', '도데체 정체가뭔지 트롯인지 발라드인지 노래는 참그저그렇다딱히 감동스럽진않던데  저렇게부르는 가수는 너무많다 임영웅 운이 좋을뻔이지~~', '연탄봉사?? 노인네들 연탄갈기도 힘든데.... 그러지 말고 기름 보일러 놔 드리고 기름 값 후원해 드리면 더 좋을 텐데... 애 꼭 저 불편한 연탄을 주는 지 모르겠네...', '', '', '꼴보기 싫으니 아에  나오지 말거라\n봉사할려면 수입의 10% 기부해라\n돈 안드는 거만', '영웅아.  탄핵집회 나가서 노래나 한자리 해라!\n그럼 갈라치기 구라정권 몰아내고 단합된 대한민국을 \n만들지~', '']",https://www.yna.co.kr/view/AKR20230920138300061?input=1195m,https://n.news.naver.com/mnews/article/079/0003816077?sid=103
2023.09.30.,머니투데이언론사 선정,,"생선, 나물 파는 노인에게만…'컬러복사' 5만원권 내민 20대 커플",,,http://news.mt.co.kr/mtview.php?no=2023093015110338615,http://biz.chosun.com/
2023-09-24 10:12:05,주간조선언론사 선정,경제,"""우유 배달 왔습니다"" 독거노인 찾은 韓 총리","[     KB국민카드가 9월 추석을 맞아 취약노인 봉사활동을 실시했다고 밝혔다. /국민카드 제공        KB국민카드가 9월 추석을 맞아 전국의 28개 독거노인지원센터 소속 어르신들 400여 명에게 반려나무 및 후원물품을 전달했다고 24일 밝혔다.KB국민카드 영업점 직원들의 자발적인 참여로 이루어진 이번 봉사활동은 직원들이 한 달간 직접 양육한 반려나무와 감사 메시지 카드를 쌀, 레토르트 식품 등을 담은 식료품 키트와 함께 돌봄이 필요한 어르신들에게 지역별 독거노인지원센터에 전달했다.KB국민카드 관계자는 “금년도 5월 가정의 달에 이어 취약노인 마음잇기 봉사활동을 통해 9월 명절의 따뜻함이 조금이나마 전달되었기를 기대한다”며 “사회적 취약계층에게 실질적인 도움을 주는 사회공헌활동을 앞으로도 다양하게 선보일 계획”이라고 밝혔다.한편 KB국민카드는 지난 2011년부터 보건복지부 산하 독거노인 종합지원센터와 협력하여 전국 지역사회의 홀로 계신 어르신들을 후원하고 있다. 취약노인 마음잇기 봉사활동을 통해 현재까지 총 5719명의 독거 노인들에게 폭염, 한파, 명절, 어버이날 등 시즌 별로 생필품과 식료품 등을 지원해 오고 있다. ]",[],http://weekly.chosun.com/news/articleView.html?idxno=29209,https://n.news.naver.com/mnews/article/366/0000934789?sid=101
2023.09.25.,파이낸셜뉴스,,"광양제철소, 추석맞이 대규모 연합봉사 실시",,,http://www.fnnews.com/news/202309250857003044,https://www.yna.co.kr/
2023-09-29 08:15:01,이데일리언론사 선정,사회,“명절 연휴 따로 없어요”…오갈 곳 없는 노인 위해 구슬땀 흘리는 사람들,"[ 94세로 안양시 명예의 전당 등재…22년간 3만597시간 기록""나이는 문제 되지 않아…봉사하려는 마음과 정신이 중요"" (안양=연합뉴스) 김인유 기자 = ""100세까지 봉사를 하겠다고 스스로 다짐했는데 건강이 허락하지 않아 이젠 하지 못하게 됐습니다. 이 생각만 하면 밤에 잠이 오지 않아요.""    경기도 최고령 자원봉사자 신봉섭씨[촬영 김인유]    지난 18일 안양시가 시청사에 마련한 '자원봉사자 명예의 전당'에 등재된 신봉섭(94)씨의 소감과 표정에는 진심 어린 아쉬움이 가득했다.     그는 경기도 내 최고령 자원봉사자이자 최다 봉사시간을 보유한 어르신이다.    1998년 1월 자원봉사자로 등록한 뒤 2020년까지 22년간 꾸준히 봉사활동을 이어온 그를 지난 20일 안양시 만안노인복지회관을 찾아가 만났다.    지금까지 자원봉사 시간이 얼마인지 묻는 질문에 신씨는 ""3만597시간""이라고 또렷이 말했다.    90세가 넘는 고령에도 꼿꼿하게 편 허리와 군살을 찾아보기 힘들 정도로 날씬한 몸매를 유지하고 있어 10년은 족히 젊어 보였다.    그는 20년을 넘게 주말을 제외한 평일마다 찾아가 봉사를 한 만안노인복지회관이 고향이자 집처럼 편안하다고 했다.    신씨는 코로나19로 복지회관이 문을 닫기 전까지 주 5일, 하루 8시간 봉사활동을 했다.    집에서 15분가량 걸어서 복지회관에 오전 7시 40분여분께 도착하고 나서 8시부터 복지회관을 찾는 노인들을 위해 안내와 질서유지를 도맡았다.    식사하러 방문하는 노인들을 식당으로 안내하고 목욕탕 입장 시 혼란이 일어나지 않도록 먼저 온 순서대로 정리하는 것도 그의 몫이었다.    경기도 최고령 자원봉사자 신봉섭씨(왼쪽)[안양시 제공. 재판매 및 DB 금지]    그래서 복지회관 이용 노인들은 무슨 일만 터지면 복지회관 직원보다 신씨를 먼저 찾았다.    그가 노인들끼리 다툼이나 말썽이 생겼을 때 원만하게 중재해 문제를 잘 해결해 주기 때문이다. 또 복지회관 업무 처리가 마음에 들지 않는다며 복지관 직원에게 욕을 하는 노인을 달래는 것도 그의 역할이다.    신씨가 이곳에서 오랫동안 봉사를 하게 된 것은 퇴직 후 무릎이 아팠을 때 지인의 권유로 복지회관에 치료받으러 찾아간 것이 계기가 됐다.    그는 ""아침 일찍 복지회관을 찾아온 노인 수백명이 문이 열리자마자 (당시) 2층 진료실에 먼저 가 치료를 받으려고 계단을 뛰어 올라가는 모습을 봤는데 무척 위험해보였다""며 ""복지회관에 대책을 세워달라고 말했으나 상황이 바뀌지 않아서 내가 직접 질서를 세우게 됐다""고 말했다.    그는 복지회관에 먼저 온 노인들의 명단을 진료실에 알려줬고 진료실이 이 순서대로 진료하면서부터 노인들이 아침 일찍 계단을 위험하게 뛰어오르는 '오픈런'은 사라졌다.    신씨 덕분에 복지회관의 질서가 잡혀가면서 이용자들의 칭찬이 이어졌지만, 일부 노인들로부터는 ""네가 뭔데 나서서 그러느냐, 왜 네 마음대로 하느냐""는 폭언도 들었다. 가끔 멱살도 잡히기도 했다.    그러나 그는 그럴 때마다 질서 유지의 원칙과 효과를 설명했고 대부분은 그의 말에 결국은 수긍했다.    신씨는 스스로 자신은 '원칙주의자'라고 말했다.     성격적인 이유도 있지만 학도병으로 6·25전쟁에 참전하고 장교 시험을 통해 소위로 임관한 뒤 대위로 전역하는 등 17년간 군 생활을 하면서 몸에 밴 생활 습관 때문이기도 했다.    안양시 자원봉사자 명예의 전당에 등재된 신봉섭씨[촬영 김인유]    신씨는 오랜 봉사 덕분에 돈을 기부하지 않고도 억대 기부자로 인정받아 2014년 11월 3일 안양시가 마련한 나눔의 날에 감사패를 받기도 했다.    시는 당시 신씨의 자원봉사 누적 시간 2만756시간을 최저임금(5천210원)으로 환산해 1억800만원의 기부를 한 것으로 인정했다.    물론 자원봉사의 공적을 인정받아 2011년 국무총리 표창, 2003년 경기도지사 표창, 2007년 안양시 자원봉사왕, 2011년 경기도 금자봉 등 수많은 표창을 받았다.    그는 ""봉사는 다른 사람뿐 아니라 나 자신을 위해 하는 것""이라며 ""봉사하면서 나의 건강을 유지할 수 있고 나태해지지 않게 된다""고 했다.    지난해 몸을 다쳐 기력이 크게 감소해 봉사하지 못하게 됐다는 그는 그래도 매일 일정한 시간에 복지회관을 찾아와 운동하며 체력을 유지하고 있다.    신씨는 ""주변 노인들에게 봉사하라고 하면 '이 나이에 어떻게?'라는 말을 하는데 나이는 문제가 되지 않는다. 봉사하려는 마음, 정신이 중요하다""며 ""점점 봉사자들이 줄어드는 것 같아 안타깝다""고 말했다.    hedgehog@yna.co.kr ]","['👍 존경합니다', '멋진 분이시네요. 늙기도 전에 좀비처럼 늙은이 흉내내며 미리 늙어가는 사람들이 배워야겠네.', '멋지세요 할아버지!! 건강하게 오래사세요!! :)', '감사합니다~♡']",http://www.edaily.co.kr/news/newspath.asp?newsid=01361206635744712,https://n.news.naver.com/mnews/article/001/0014228315?sid=102
2023.09.26.,연합뉴스,,"대한간호협회, 추석 앞두고 노인 급식소 봉사",,,https://www.yna.co.kr/view/PYH20230926138900013?input=1196m,http://www.mt.co.kr/
