Date,Press,Category,Title,Content,Comment,URL_Origin,URL_Naver
2022.12.25.,신아일보,,"진주시 대평면 지역사회보장협, 12월 맞춤형 봉사활동",,,http://www.shinailbo.co.kr/news/articleView.html?idxno=1640955,http://www.inews365.com
2022.12.22.,뉴스락,,"CJ올리브네트웍스, 소외계층 위한 임직원 대면 봉사활동 진행",,,http://www.newslock.co.kr/news/articleView.html?idxno=70173,http://www.100ssd.co.kr
2022.12.15.,불교공뉴스,,"보은군, 2022 보은군자원봉사자대회 성료",,,http://www.bzeronews.com/news/articleView.html?idxno=539640,http://www.shinailbo.co.kr/
2022.12.23.,팝콘뉴스,,"한미약품, 올 한해 임직원 725명 1889시간 봉사활동 참여",,,http://www.popcornnews.net/news/articleView.html?idxno=35182,http://www.newslock.co.kr
2022.12.22.,세정신문,,"서울세관, 무료급식소에서 배식 봉사활동 펼쳐",,,http://www.taxtimes.co.kr/news/article.html?no=257724,http://www.taxtimes.co.kr/
2022.12.13.,뉴스1,,서울노인복지센터 자원봉사자 송년모임 축사하는 지현 스님,,,https://www.news1.kr/photos/view/?5735947,http://news1.kr/
2022-12-13 15:47:18,뉴스워치,사회,"세븐일레븐, 봉사활동 및 범죄예방 힘써온 점주 등에 시상",[     (서울=뉴스1) 장수영 기자 = 13일 서울 종로구 한국불교역사문화기념관에서 서울노인복지센터 자원봉사자·후원자 송년모임 중 조계사 주지 지현 스님이 축사를 하고 있다. 2022.12.13/뉴스1   ],[],http://www.newswatch.kr/news/articleView.html?idxno=61529,https://n.news.naver.com/mnews/article/421/0006516422?sid=102
2022.12.28.,충남일보,,"부여복지마을, 사랑의 집수리 봉사활동' 실시",,,http://www.chungnamilbo.co.kr/news/articleView.html?idxno=695491,http://www.newswatch.kr/
2022.12.21.,천지일보,,양주 회천노인복지관 ‘제2회 선배시민과 함께하는 별의별 예술제’ 개최,,,http://www.newscj.com/article/20221221580026,http://www.chungnamilbo.co.kr
2022.12.25.,충청일보,,"흥사단 충북지부, '사랑의 연탄나눔, 사랑의 미용봉사'",,,https://www.ccdailynews.com/news/articleView.html?idxno=2176191,http://www.newscj.com
2022.12.22.,글로벌이코노믹,,"JT저축은행, 성남지역 아동들과 독거노인 가구에 방한물품 전달",,,http://www.g-enews.com/ko-kr/news/article/news_all/202212221753599218bbed569d68_1/article.html,http://ccdailynews.com
2022.12.08.,부산일보언론사 선정,,김건희 여사 부산서 MZ세대와 봉사활동,,,https://www.busan.com/view/busan/view.php?code=2022120817024624781,http://www.g-enews.com/
2022.12.23.,중소기업신문,,"한미약품, 올해 임직원 725명이 1889시간 봉사",,,http://www.smedaily.co.kr/news/articleView.html?idxno=245588,http://www.busan.com/
2022-12-08 17:04:01,백세시대,정치,"대한노인회 전남 여수시지회, 수생식물 키우기 프로그램 시행","[ 새마을운동중앙회 초청으로 쪽방촌 등 찾아자립청년 운영하는 금정구 '몽실커피'도 방문    김건희 여사가 8일 부산 부산진구 새마을운동부산진구지회를 방문, 새마을지도자 및 대학생마을 동아리 회원들과 함께 쪽방촌에 전달할 생필품을 포장하며 대화를 나누고 있다. 연합뉴스윤석열 대통령 부인 김건희 여사는 8일 새마을운동중앙회의 초청을 받아 MZ세대들과 함께 부산에서 봉사활동을 했다고 대통령실이 서면 브리핑을 통해 밝혔다.김 여사는 이날 새마을운동중앙회가 새롭게 선보인 노란색 후드티셔츠를 대학생 봉사자들과 함께 입고 생필품을 포장한 뒤 어르신들의 댁을 방문해 전달하는 봉사에 참여했다.김 여사는 ""새마을운동은 대한민국 경제발전의 기적을 만들어낸 운동""이라며 ""이 운동을 MZ세대와 함께 계승, 발전시키고 있는 새마을운동중앙회의 변화에 기대가 크다. 그런 점에서 이번 봉사활동에 기꺼이 참여하게 됐다""고 말했다.김 여사는 독거노인 문제가 심각한 상황에서 쪽방촌에 대한 관심이 줄어드는 데 대해 안타까움을 나타낸 뒤 “열악한 환경에 있는 우리 이웃들이 소외되지 않도록 MZ세대가 새마을지도자들과 함께 나눔과 봉사를 실천하고 있다""며 사의를 표했다고 전했다.김 여사는 또 쪽방촌 봉사에 앞서 부산 금정구에 위치한 '몽실커피'를 방문했다. 이 카페는 아동양육 시설에서 성장한 청년들이 창업한 곳으로, 이 청년들은 다른 자립준비청년들을 돕고 있다.김 여사는 지난 9월 윤석열 대통령이 충남 아산시 자립지원전담기관을 방문해 자립준비청년에 대한 국가의 책임과 지원을 강조했음을 언급한 뒤 ""아직 많은 것이 서툴기 때문에 서로에게 의지하는 것은 너무나 당연하다""며 ""자립준비청년들이 혼자 힘들어하지 않도록 국가와 사회의 지원을 잘 안내해주는 좋은 멘토가 되어 달라""고 당부했다.김 여사는 창업 청년들로부터 ""자립준비청년들이 명절 때면 갈 곳이 없어 카페를 많이 찾는다""는 이야기를 전해 듣고, ""몽실이라는 공간이 단순히 커피를 파는 곳이 아니라 외롭고 지친 마음을 달래는 공간으로 활용되기를 기대한다""고 격려했다. ]","['범죄자는 감옥으로 가야한다…대한민국 헌법은 누구나 법앞에 평등하고 권력자라고 해서 차별을 두지 않는다…', '""나 이렇게 좋은 사람이에요, 그러니까 논문 표절이나 주가조작 같은 거 다 잊어버리세요, 개돼지 국민 여러분."" 사진에서부터 이런 불순한 의도가 너무 노골적이라 거부감부터 든다. 차라리 가만히 있으면 조용히 묻히기라도 하지.', '', '진짜 나내는거 끝판왕이네 아니 지가 내조만하고 조용히 살겠다메? 조작범이라 당신이 뱉은 말도 조작하냐?', '저 인간 제발 좀 나오지마라.\n죄값은 언제 치르냐?\n4년뒤 니는 감방행 100%다.\n니 에미 손잡고..', '주가조작 허위경력 처벌받고 감옥 갔다와서 봉사활동 하면 믿어줄께  그전에 그어떤짓을 해도 위선자 사기꾼으로 밖에 안보인다', '윤정권에서 이번 화물연대 파업에 맞서면서 불법과 타협하지 않겠다고 했다. 근데 윤정권에게 주가조작과 학력위조는 불법이 아닌가보다.', '그냥 아무것도 안하고 있으면 중간이라도 간다. 정말 거짓과 위선으로 밖에 안보인다. 그것도 법사가 시킨거니?', '얘는 왜이렇게 나대니??', '인생을 봉사는 안한걸로 아는데 갑자기 영부인이라는 직책에 오르니 봉사가 하고 싶어진건가?\n아님 사진찍기 위함인가? 이런거 안해도 되니까 대통령뒤에좀 있어라 나대지 말고\n 누가 보면 거니대통령인줄?', '무당이시켰겠지.제발움직이지말길!세금이막샌다', '', '', '나대지마라 좀', '또 또 좌파들 몰려온다 사랑의 열매 행사에 온갖 치렁치렁한 패물 자랑하듯 끼고 나오고 사진찍을때 알반지 재빨리 돌려끼기한 어떤 정신나간 여편네보다 훨씬 진심이 느껴짐', '금융범죄 부동산사기꾼 그 엄마도 사기꾼', '진짜 징하다!\n보기싫다고 해도 꿋꿋하게 나오는 저 뻔뻔스러움!!', '', '우리동네 봉사오면 김치싸데기 날릴텐데', '짱난다 이제 그만 나와', '사회봉사로 니 죄를 덮으려면 8000만년은 해야 될 거다. ㅋㅋㅋㅋㅋㅋㅋㅋ', '쟤는 뭐든 다 인위적인 느낌이 드냐, 얼굴부터 하는 행동 사진까지,', '천공이 자립청년 도우라고 유투브에서 강연하고 나니\n스승님말대로 보호종료아동 도우러 쇼하러 갔네ㅠ\n진짜 정인이묘소봉사쇼도 캄보디아 어린이쇼도 이번도 이뇬은 진짜 약자인 아이들을 델고 지홍보용 도구로 이용하는것같아 진정성을 찿을래야 찿을수가\n없다ㅠ', '진짜 미치겠다.이런연 기사좀 그만내라.\n미쳐서 벌렁벌렁하냐 관종아', '성괴가 구역질 나게ㆍ 많이도 돌아치네 ㆍ교도서나 가서  봉사활동하지~~ ㆍ곧 갈텐데~~', '줄리 주가조작 수사 안하냐? 한동훈이   석열이 철저히 하수 개  노릿감이구나', '또 보여 주기식 언론 플레이..', '', '쑈하지말고 나타나지마라 ㆍ꼴뵈기 싫다', '주가조각 수사부터 받고 나돌아다녀라', '이 여자는 뭘 해도 진정성이 안느껴져~~ 남편이 대통령이 되더라도 조용히 내조만 하겠다고 질질짜며 인터뷰 했던 그 모습을 국민들이 똑똑히 기억하고 있는데... 참 뻔뻔하건 둘이 완전 찰떡궁합인 듯 싶다.', '끄지라. 부산이 범죄용의자가 만만하게 올곳이 아니다.\n착한 이미지세탁하려는데 요즘 국민이 바보가 아님', '힘들고 어려운 봉사는 안하고 사진발 잘나오는 쪽만 찾아서 봉사하네. 수혜복구 했어야지', '이게 내조인가 그땐 내조만 한다했는데 거짓말', '', '알바비얼마씩줬냐 아니면 전광훈이신자들 아니냐?대가리 총맞은 mz아닌이상 거길 왜가냐 기회의평등을 부르짖는 mz아니더냐', '매사건건 MZ눈치 더럽게 보네... 직장에서 밖에서 집안에서 등등', '참 민폐다 민폐 😤😤😤', '전직 노인접대전문녀가 사방에 개처럼 널뛰네 ! ㅡㅡ감방가 있어야 될 짝퉁낯짝 .', '지가 조용히 산다고 떠든 입이 있는데 진짜 사기꾼 은 답이 없나보다. 설정샷 찍는게 그렇게 재미 있냐 ?', '풉. 김건희한테 질투나는 여자가 어딨겠냐 ㅋㅋㅋㅋㅋㅋ저런 인생 0.1초도 싫다. ㅋㅋㅋㅋㅋ', '사진찍고 이동하고 사진찍고 또 이동하는게 봉사냐?ㅋㅋ 걍 화보집을 내라 얼굴 뽀샵가득해서 ㅋㅋ 그런다고 이미지가 달라질거 같어?', '영부인 전에도 봉사활동을 생활화해서 이미지가 좋았다면 백번천번 이해하는데..단 한번도 없네..더군다나 진짜던가짜던 소문이 넘 안좋았어서 그렇다고 거니 지인중에 좋은사람이라고 나서서 대변하는 지인도 없고 도대체 어떤 삶을 살아온거니??', '맨날  인증샷 ㅋ 어찌나  나대는지', '뭘 할때마다 사진을 어찌나 찍어서 뿌리는지.......모델이 꿈이었나.  돋보이고 싶은건 유전자에 각인되어 있나보다.', '녹취록에 국민들은 바보라 언론플레이 하면 금방 잊어버려서 괜찮다더니 그 말이 딱이네ㅋㅋ\n김명신 윤벌구랑 정말 잘어울리는 한쌍이야', 'Mz세대한테 학력위조 경력위조  주가조작 잘 알려주겠네', '마~쫌  그만해라...', '', '그런건 제발 평소에나 좀 해라 사진 찍기 위해서 하는거 말고!!', '쇼걸 ㅋㅋㅋㅋ', '정치 꿈나무 놥셨네 징글징글 하다  이미지 어떻게든 반전 시켜보겠다고 수작수작 잡수작을 다 부리네 진짜 평생살면서 대통령 부인 이전에 봉사에 봉짜도 모르던사람이 ㅋ 웃기네', '순대국밥집 세숫대야는 주로 쳐먹는 데 시간을 할애 하느라 이런 봉사활동에는 별로 모습을 드러내지 않았지', '이 일이 있었기 때문에 대표팀과의 오찬이 만찬으로 바뀌었다고 생각이 드네요. 영부인으로서 나서지 않겠다고 자기가 한 말에 대해서 일절 언급은 없고 슬그머니 나서는 행동들이 이어지니 모든 활동들이 부정적으로 보이는 겁니다. 이번 일도 비공개이다보니 대통령실과의 일정이 꼬여 오찬이 만찬이 되고, 모든 결정이 김여사에게 의한 건 아닌지 의심이 들게 되는거죠. 공개적인 행사마저 이럴진데 비공개적인건 어떨지 정말...', '정상적인 삶을 살았다면 저 사진속 처자만한 딸이 있지 않았을까... 인생이란... 후우...', '징글맞게 덩숙이땨랑 틀리네 ㅎㅎ', '4년 뒤 일상적인 생활 yuji  가능할거 같냐', '돼지는 생각도 못하는 일!!!', '수단방법안가리고  돈밝히는 심성..봉사와는 거리가 있는건  맞 제.', '그렇게 오랄비 칫솔질을 잘한다면서요???????', '조용히 내조만 하세요 제발', '', '돋보이고 싶은 욕심만 있어여~~~ 왜냐구요?? 제가 대통령 이거든요 ㅋㅋ', '주모 설치는거 보다 백배낫다', '대통령이 누구냐?', '마! 쫌 고만 나대고 용산에나 계슈..', '', '', '돼멜다는 절대 할수없는 봉사활동!', '나대는 꼬라지에 소금뿌리고 싶다', '', '', '나라가 미처돌아가는구만..\n윤석열위에 김명신 위에 천공인  나라', '주가조작 공소시효 끝났다고 나 이제 해방이다 검찰들아 고마워~ 룰루랄라 이제 전국 내가 실세로 다 휘젖고 다녀야지.. ㅋㅋ', '모지리 대깨 민주모지리당은 잘하는것도 그저 트집잡기 바쁘네 ㅋㅋ 모지리들아', '쳐받혀 있어  꼴 보기 싫다', '결국 뒷모가지 잡혀 끌려나갈팔자주제에 왜케 나대고 다니는거지. 언제 끌려나갈지몰라서 할수있을때 뭐 하나라도 더 설치고 싶어서 그런가…?', '수사나 받아라. 진짜 얼마나 국민을 우습게 알면 저러고 다니냐고. 진짜 이게 나라냐???', 'MZ세대 누굴 가리키는거지?ㅋㅋ 총선때문에 김건희 각하께서 아주 신경이 많이 쓰이나봐ㅋㅋ 비공개인지 아니면 옥의 티 있으면 욕쳐먹을라 대통령실에서 배포해서 기레기들이 얼싸좋다 하고 받아먹는거지 모르겠네ㅋㅋ 각본에 짜여진 빈곤포르노 답네,,아니지 쪽방촌 포르노다', '범죄자 주제에 꼴값 떤다 니는 감옥이 어울린다', '그만 조용히 계세요', '꼴값을떤다', '정의당인가? 노랑색 ㅋ 검찰에 가서 조사받음서 봉사하지 그러노...', '마!!!쫌!!! 오지마소~!!!', '아무것도 없고 하는것도 없고 할것도 없는 단체를 정부돈으로 지원해가면서 그림 그리고 있네. 정말 세금 아깝다.', '당대표나오려고하나?ㅋ', '', '이번엔 조명 몇개?', '', '신천지 교도들 만나러 갔구먼 마이클잭슨', '', '쇼하고 앉아있네\n오만 나쁘짓은 다해놓고 뻔뻔하게\n무능 무식 뻔뻔 가족사기잡단요\n탄핵가자', '민주당 지지하는 머저리들아 이미지메이킹이니 뭐니 아무리 떠들어봐야 패션쇼나하면서 명품만사러다니는 정숙이에 비하면 제대로된 영부인이다', '언니 왜저래 ㅋㅋㅋㅋㅋㅋ', '봉사는 시파!! 자수해서 광명찾고 깜빵가서 법치주의를 바로 세우는게 국민에 대한 봉사 아이겠나??ㅋㅋ', '나오지말고 주가조작 조사나 받으러 가야지', '두세시간만에 어떻게 저길 다 돌아다니면서 봉사활동을 햇지?', '지가 대통령인줄 알아 진짜 ㅅㅂㅋㅋㅋㅋㅋ 김정숙이 저리가라누', '', '꼴값이나 제대로 해라', '', '여기 키보드워리어 프로불만러들 개많네 ㅋㅋㅋ 면전 앞에서는 한마디도 못하는 쫄보들 ㅋㅋㅋㅋㅋ', '', 'ㅋ 건희야 ㅋ ^^ ㅋ', 'ㅈㄴ 나대네', '', '', '사진만 찍었을듯', '쟤 왜 저러냐??  평생  개판으로 살다가  봉사 몇번하면 퉁쳐줄까봐??   한심한 쥴리일쎄  ㅉㅉㅉ..   저거들  누가  뽑았냐', '부산에도 개딸 쓰레기들이 많이 사네!범죄자 추앙하는 개딸들은 삽으로 퍼서 태종대 바위에서  버려야  대한민국이 깨끗해지는데^^천한 정숙이가 다니는것 보다 훨씬 좋구만!', '미리 오는것을 알았으면 응원이라도 해주러 갔을텐데!', '부산토박이다 ! 캬~~~악 퉤~~! 시  ㅂ 알뇬아~!', '나대지 마라', '봉사는 조용히 하는거예요\n나대지말고 저렇게 사진찍으면서  하는게 \n봉사는  아니죠...~', '', '', '뭐가 됬든 빨갱이 민주당 새키들보다는 훨씬 낫다', '조가조작범의 봉사활동 일지를 착실하게 올려주는 쓰레기같은 언론사 들이란…', '', '사진찍는데 여념이 없네', '', '누가 mz야? 뷰티플', 'ㅋㅋㅋㅋㅋㅋㅋㅋㅋㅋㅋㅋㅋㅋㅋㅋㅋㅋㅋㅋㅋㅋㅋㅋㅋㅋㅋㅋㅋㅋㅋㅋㅋㅋㅋㅋㅋㅋㅋㅋㅋㅋㅋㅋㅋㅋㅋㅋㅋㅋㅋㅋㅋㅋㅋㅋㅋㅋㅋㅋㅋㅋㅋㅋㅋㅋㅋㅋㅋㅋㅋㅋㅋㅋㅋㅋㅋㅋㅋㅋㅋㅋㅋㅋㅋㅋㅋㅋㅋㅋㅋㅋㅋㅋㅋㅋㅋㅋㅋㅋㅋㅋ', '그놈들이 몰려온다 대피해라...', '그러니까 왜', '', '', '', '', '', '이뿌다', '', '그놈의 MZ세대는', '주가조작년  허위학이력    부동산사기꾼 모녀    콜영부인 땜에     개고기    그나마  겨우  올려놓은    지지율  또   내려가겟네', '진짜  누가 대통령인지  헷갈린다.', '미필깡통.. 탄핵은 언제일까요…??;;ㅉ', '명신아 부산 오지말고 니 앵시랑 학교나 가자', '에고 추운데..고생 많으세요...칭찬엔 칭찬을 ..감사합니다.', '연기파야.  아카데미상은 \n않주냐?', '', '', '주가조작한다고 바쁘신 분이 어연 일로?', '사기꾼집단들\n면상꼬라지도보기싫은디\n왜자꾸가식퍼포먼스를우리가보고\n장단까지맞춰줘야되나?\n또한번더말해?ㅋㅋ\n숨쉬는거빼고거짓인것들~!!!!!!!@', '또 화보찍으러 갔냐 콜부인ㅋㅋ 너랑 봉사하는 모습이랑은 어울리지 않아요', '""남편이 대통령이 되는 경우라도 아내의 역할에만 충실하겠습니다 "" 김건희가 대국민 사과 기자회견에서 한말....국민 입벌구', '어울릴 줄 알고 보기 좋습니다~~', '보기좋습니다^^ 아빠미소가 절로나오에요!^-------------^', '', '좋은일 많이 하시는 여사님 보기 좋습니다', '김정숙보다 백배 천배 잘하네 돼지정숙이는 같은편이라서 안씹어돌리나?김건희여사 화이팅입니다 \n참 잘했어요!', '응원합니다...', '', '여사님~~\n훌륭하십니다,,마음에서 우러나온 봉사에 국민은 감동합니다,,,무소의 뿔처럼,,소신있게 하십시오~~**', '김건희 여사 성격 끝나게 좋을것 같다ㅎㅎ', '', '2찍이들이 쟤를 지지하는 이유가 뭐임도대체 ㅋㅋㅋㅋㅋㅋㅋㅋ', '잘하고 있습니다.. 앞으로도 그늘진 곳 돌아보고 어려운 분들  손 잡아 주는 그런 영부인이 되길 바랍니다..', '정숙이년과 너무나 대비되는 김건희여사님', '', '제2의 육영수 김건희여사님 힘내세요 사랑합니다 화이팅', '좋은 일 많이 하시려고 나오는 건 좋아보입니다만,, 정책적 변화가 탄탄허게 뒷받침되었으면 하네요. 그때뿐인 정치말고', '', '', '', '와우 좋아요 국모은 이렇게 어럽고 힘들게 사는 곳을 방문 하여 격려도하고 고충도 듣고하는거지 \n돈싸들고 시장에서  국민의 혈세을 낭비하는 분하고 비교되네요 정말잘하고 있어요 화이팅!', '', '40대이상 아줌마들 김건희한테 질투하는거 진짜웃기다.. ㅋㅋ 본인들이랑 나이도 비슷한데 얼굴도 이쁘장한데다가 대통령 부인으로 잘나가니까 질투하는듯ㅋㅋ 너네랑 애초에 급이다른신분인데 비슷하다 착각하네ㅋㅋ']",http://www.100ssd.co.kr/news/articleView.html?idxno=94282,https://n.news.naver.com/mnews/article/082/0001187731?sid=100
2022.12.21.,대한경제,,"인천시사회서비스원, 인천시 예비노인세대 실태조사 결과 발표",,,https://www.dnews.co.kr/uhtml/view.jsp?idxno=202212211052070910806,http://www.cnews.co.kr
2022.12.16.,뉴데일리,,"포항대 사회복지과, 사랑 나눔 자원봉사활동 전개",,,https://tk.newdaily.co.kr/site/data/html/2022/12/16/2022121600107.html,http://www.newdaily.co.kr/
2022.12.23.,조세일보,,"삼정KPMG, 연탄 봉사활동으로 지역사회 '훈훈'",,,http://www.joseilbo.com/news/news_read.php?uid=474295&class=10&grp=,http://www.joseilbo.com/
2022-12-23 09:35:01,데일리한국,경제,"부산디지털대 봉사활동, 다양한 동아리 참여","[ 삼정KPMG, 에너지 취약계층에 연탄 1만장 기부삼정KPMG DA5 본부 구룡마을에 연탄나눔 봉사 진행사회복지·교육·환경·문화 등 다양한 사회공헌 실천""나눔 통해 지역사회와 동행할 것""     ◆…삼정KPMG Deal Advisory5본부 임직원 100여명이 개포동 구룡마을의 에너지 취약계층에 연탄 1만 9000장을 전달하고 있다.(사진 = 삼정KPMG 제공)삼정KPMG(회장 김교태)가 연말을 맞아 소외계층을 돕기 위해 손을 모았다.   삼정KPMG의 사회복지지원 사단법인인 삼정사랑나눔회는 밥상공동체복지재단 연탄은행을 통해 이달부터 내년 3월까지 서울지역 에너지 취약계층 50가구에 연탄 1만장을 기부한다고 23일 밝혔다.   삼정KPMG는 2005년부터 사내 사회복지위원회를 설치해 사회복지, 교육, 환경, 문화 분야에서 다양한 사회공헌을 실천해왔다. 2011년에는 사단법인 삼정사랑나눔회를 설립하고 본격적으로 소외계층 및 사회복지시설 지원에 나서고 있다.   지난 22일에는 삼정KPMG Deal Advisory(DA)5본부 임직원 100여명이 사랑의 연탄나눔운동과 함께 개포동 구룡마을에 연탄 1만 9000장을 전달했다. 이번 구룡마을 연탄 나눔은 삼정KPMG '최우수본부상'과 'MVP'을 수상한 DA5본부의 상금 1000만원으로 진행됐다.   한편, 삼정KPMG는 사회 소외계층에 대한 학자금, 의료비, 교육비 등을 지속적으로 지원하고 있다. 올 한 해 동안 950명의 임직원들이 기부에 참여했으며, 삼정사랑나눔회 임직원 기부액은 6억 원이 넘는다.   삼정KPMG는 임대아파트 단지 내 저소득 노인 및 장애인 100가구를 대상으로 생필품을 전달하는 사랑의 장바구니 봉사활동과 김장나눔, 주거환경개선, 제과제빵 등 다양한 분야에서 지역사회에 나눔 문화를 실천하고 있다.   삼정KPMG 관계자는 ""연말연시 소외계층을 돌아보고 온정을 나누고자 연탄나눔 봉사활동을 진행하게 됐다""며, ""앞으로도 나눔을 통해 지역사회와 동행하는 삼정KPMG가 될 수 있도록 노력하겠다""고 밝혔다.   ]",[],https://daily.hankooki.com/news/articleView.html?idxno=906320,https://n.news.naver.com/mnews/article/123/0002293537?sid=101
2022.12.14.,이코노미스트,,"한화투자증권, ‘5400만원 기부’ 자원봉사 주간 실시",,,https://economist.co.kr/2022/12/14/stock/stockNormal/20221214165019723.html,http://daily.hankooki.com
2022.12.27.,영남일보,,[동네뉴스] '성탄절의 기적' 재능기부 천사들의 집수리 봉사활동...할머니의 ...,,,https://www.yeongnam.com/web/view.php?key=20221227010003463,https://jmagazine.joins.com/economist?cloc=joongang-home-jmnet
2022-12-14 16:51:01,경남도민신문,경제,창원시 여성회관마산관 자원봉사연합회 활동보고회 개최,"[ 2014년부터 8년간 진행         한화투자증권 타임월드지점 직원들과 홀트아동복지회 충청지역 김지선 지부장(가운데)이 기념촬영을 하고 있다. [사진 한화투자증권]    한화투자증권은 11월부터 12월까지 전국에 있는 소외된 이웃을 위해 ‘자원봉사 주간’을 실시했다고 14일 밝혔다.    자원봉사 주간은 2014년부터 8년 간 진행됐다.한화투자증권 임직원들이 한 해를 마무리하며 소외된 이웃들을 위해 봉사활동과 함께 기부금을 전달하는 사회공헌 활동이다. 임직원들이 도움이 필요한 소외계층을 자율적으로 선정하고 활동 내용도 스스로 기획해 참여했다.     한화투자증권 임직원들은 27개 그룹으로 나눠 전국 38개 기관의 아동, 청소년, 다문화가정, 노인, 장애인 등 다양한 이웃들과 함께 나눔의 시간을 보내며 총 5400만원을 기부했다.    신충섭 한화투자증권 경영지원실 상무는 “자원봉사 주간은 임직원들이 자율적으로 기획해 주변 소외계층을 직접 찾기 때문에 더욱 적극적인 사회공헌 활동을 펼칠 수 있다”며 “앞으로도 다양한 사회공헌 활동을 통해 주변 이웃들과 따뜻한 나눔을 펼치겠다”고 밝혔다.   ]",['ㅈㄹ 자사주매입이나 해라'],http://www.gndomin.com/news/articleView.html?idxno=337270,https://n.news.naver.com/mnews/article/243/0000036322?sid=101
2022.12.21.,이뉴스투데이,,"광양제철소, 재능봉사단 지역 복지시설에 수제 공예품 전달",,,http://www.enewstoday.co.kr/news/articleView.html?idxno=1624694,http://www.yeongnam.com
2022.12.23.,매일일보,,"한미약품, 올해 임직원 725명 봉사활동 참여…총 1889시간 봉사",,,http://www.m-i.kr/news/articleView.html?idxno=974621,http://www.gndomin.com/
2022.12.22.,브릿지경제,,"한전KDN, 전국 사업소 주도...""연말 다양한 기부 봉사활동"" 진행",,,https://www.viva100.com/main/view.php?key=20221222010007198,http://www.enewstoday.co.kr/
2022.12.21.,신아일보,,"청도군, 노인미술지도사 교육과정 수료",,,http://www.shinailbo.co.kr/news/articleView.html?idxno=1639507,http://www.shinailbo.co.kr/
2022.12.21.,포쓰저널,,"LG유플러스, 아동복지시설에 '벽화 그리기' 봉사활동",,,http://www.4th.kr/news/articleView.html?idxno=2030769,http://www.4th.kr
2022.12.08.,CNB저널(문화경제),,"bhc그룹, ‘해바라기 봉사단’ 7기 모집",,,https://weekly.cnbnews.com/news/article.html?no=147221,http://weekly.cnbnews.com/
