Date,Press,Category,Title,Content,Comment,URL_Origin,URL_Naver
2023-09-22 13:38:01,스포츠투데이,경제,"강원FC, 추석맞이 쌀 기부·배식 봉사 진행…윤정환 감독과 선수단도 참여","[     기획재정부 제공추경호 부총리 겸 기획재정부장관(사진)이 추석 명절을 앞두고 22일 서울시 서대문구 소재 독거어르신 가정과 서대문노인종합복지관을 방문해 어르신 삶의 질 향상을 위한 지원 강화를 약속했다.이날 기재부에 따르면 이번 현장방문은 정부의 지원 확대가 실질적인 노인복지 강화로 이어질 수 있도록 정책 수혜자의 목소리를 직접 듣고 이를 향후 정책개선에 반영하기 위해 마련됐다.추 부총리는 먼저 고령의 생계급여 수급자인 독거어르신 가정을 방문해 생활과 관련된 애로사항을 청취하고 노인 맞춤돌봄서비스가 어르신의 상황에 맞춰 제대로 지원되고 있는지를 살펴봤다. 독거노인의 안전을 위해 도입된 응급안전안심ICT 시스템을 점검하고 추석선물을 전달했다.이어 추 부총리는 서대문노인종합복지관을 방문해 어르신들을 위한 취미여가·건강증진 프로그램을 참관하고 복지관을 찾으신 어르신들께 점심 배식 봉사를 하며 추석 선물을 나누는 시간을 가졌다.추 부총리는 내년도 노인 관련 예산을 확대 편성하는 등 노인복지 강화를 위한 노력을 지속해 나갈 것임을 강조했다. 또 추 부총리는 어르신들이 건강하고 안전한 노후를 보낼 수 있도록 더욱 각별히 살필 것이라고 밝히며 앞으로도 노인, 장애인 등 사회적 취약계층을 위한 약자복지를 적극적으로 강화해 나갈 것임을 강조했다. ]",[],http://www.stoo.com/article.php?aid=89310494024,https://n.news.naver.com/mnews/article/082/0001233788?sid=101
2023.09.22.,머니투데이,,"추경호 부총리, 추석 앞두고 노인복지 현장방문 ""어르신 복지 강화""",,,http://news.mt.co.kr/mtview.php?no=2023092211140512797,http://www.mt.co.kr/
2023-09-22 12:00:00,뉴스핌,경제,"한국타이어, 추석맞이 '情 담은 송편 나눔' 봉사활동","[     (서울=뉴스1) 임세영 기자 = 추경호 경제부총리 겸 기획재정부 장관이 21일 오전 서울 여의도 국회에서 열린 2030 부산세계박람회 유치지원 특별위원회 전체회의에서 발언을 하고 있다. 2023.9.21/뉴스1  Copyright (C) 뉴스1. All rights reserved. 무단 전재 및 재배포,  AI학습 이용 금지.추경호 부총리 겸 기획재정부 장관이 추석 명절을 앞두고 독거어르신 가정과 노인복지관을 현장 방문해 어르신들이 건강하고 안전한 노후를 보낼 수 있도록 약자복지를 강화해 나가겠다고 밝혔다.추 부총리는 22일 오전 서울 서대문구에 위치한 한 독거어르신 가정을 방문했다.그는 이 자리에서 생활과 관련한 애로사항을 청취하고 노인 맞춤돌봄서비스가 제대로 지원되고 있는지 살펴봤다. 또 독거노인 안전을 위해 도입된 응급안전안심ICT 시스템을 점검하고 추석 선물도 전달했다.추 부총리는 이어 서대문노인종합복지관을 찾았다. 어르신들을 위한 취미여가 및 건강증진 프로그램을 참관한 뒤 복지관을 찾은 어르신들께 점심 배식 봉사를 하며 추석 선물을 나누는 시간도 가졌다.추 부총리는 어려운 재정여건에서도 내년도 노인 관련 예산을 25조6000억원으로 올해보다 10.3% 확대 편성했다며 노인복지 강화를 위한 노력을 지속해 나갈 것이라고 강조했다. △기초연금 지속 인상(내년 예산안 기준 33만4000원) △노인 일자리 역대 최대 규모 확대(2024년 예산안 기준 103만명) △6년 만에 일자리 수당 인상 등 정부 정책을 소개하며 노후소득 보장성을 더욱 강화해 나가겠다고 했다.또 일상생활에서 어르신들 삶의 질과 안전을 높이기 위해 돌봄시간을 확대(2024년 예산안 기준 월 16시간→월 20시간, 중점관리군)하고 응급안전안심ICT 시스템도 지속 확충하는 등 노인 맞춤 돌봄서비스도 강화해 나가겠다고 약속했다.아울러 기초생활보장제도 생계급여액을 13.2% 인상해 지난 5년간(2017~2022년) 총 인상액(19만6000원)보다 많은 21만3000원 인상(162만원→183만4000원, 4인 기준)하는 등 생계급여 수급자 지원을 대폭 확대해 나가겠다고도 했다.추 부총리는 ""우리나라를 위해 희생하고 헌신하신 어르신들이 건강하고 안전한 노후를 보낼 수 있도록 더욱 각별히 살피겠다""며 ""앞으로도 노인, 장애인 등 사회적 취약계층을 위한 약자복지를 적극적으로 강화해 나갈 것""이라고 밝혔다. ]","['', '어르신 복지...?? 싸지~ 청년 복지는 삭감하고..', '그리고 청년지원은 ~~삭감하고있구나?내일채움,산단교통비지원,청년전세대출지원 와~~노인들한테 표 많이 얻어라...', '잘하고 계시네요 인상분이 얼마 안돼지만 요긴하게 쓰시겠지요 그런데 일본의 오몀 생선 발기위해 일본앞잡이 노릇은 그만좀 하시길 ㅠ']",http://www.newspim.com/news/view/20230922000249,https://n.news.naver.com/mnews/article/008/0004941777?sid=101
2023.09.22.,브레이크뉴스,,"LGU+, 추석 맞아 청파노인복지관에 수해지역 농산물 기부",,,http://www.breaknews.com/989138,http://www.newspim.com
2023.09.26.,백세시대,,"동양생명, 추석맞이 돌봄 어르신 봉사활동 전개",,,http://www.100ssd.co.kr/news/articleView.html?idxno=102808,http://www.breaknews.com
2023.09.24.,새전북신문,,"LX전북본부, 제빵봉사...지역사회와의 따뜻한 동행 실천",,,http://sjbnews.com/news/news.php?number=793589,http://www.100ssd.co.kr
2023.09.18.,더퍼스트,,"가천대 길병원 가천지역사회상생봉사단, 남동구 노인 세대에 추석 명절 선물 ...",,,http://www.thefirstmedia.net/news/articleView.html?idxno=127398,http://www.sjbnews.com/
2023.09.24.,고양신문,,"일산주민 모니터링봉사단, 지역사회 문제해결 욕구 조사",,,http://www.mygoyang.com/news/articleView.html?idxno=75349,http://www.thefirstmedia.net
2023.09.19.,뉴스핌,,"카카오게임즈, 독거노인 100가구에 '한가위 마음상자' 전달",,,http://www.newspim.com/news/view/20230919000737,http://www.mygoyang.com
2023.09.26.,핀포인트뉴스,,"신한펀드파트너스, 사랑의 제빵 봉사활동 실시",,,https://www.pinpointnews.co.kr/news/articleView.html?idxno=218692,http://www.newspim.com
2023.09.24.,충청매일,,"한국생활개선 충남 태안군연합회, 추석 앞두고 독거노인에 생필품 전달",,,https://www.ccdn.co.kr/news/articleView.html?idxno=937692,http://www.pinpointnews.co.kr
2023.09.24.,충청매일,,"한국생활개선 충남 태안군연합회, 추석 앞두고 독거노인에 생필품 전달",,,https://www.ccdn.co.kr/news/articleView.html?idxno=937692,http://www.ccdn.co.kr
2023.09.25.,조세일보,,"IBK기업은행, ‘제2회 찾아가는 재능나눔 이미용 봉사’ 실시",,,http://www.joseilbo.com/news/news_read.php?uid=498625&class=51&grp=,http://www.joseilbo.com/
2023-09-25 17:16:01,텐아시아,경제,임영웅 팬클럽 부산영웅시대 '스터디하우스'에서 정기 후원 및 봉사 실시,"[ 헤어디자이너들 참여해 장애인 대상으로 봉사활동 수행     ◆…IBK기업은행은 지난 20일 사단법인 벤처한림회, 잡드림 등과 서울 서대문 장애인복지센터에서 지난 8월에 이어 '제2회 찾아가는 재능나눔 이미용 봉사'를 실시했다. 사진=IBK기업은행 제공IBK기업은행은 지난 20일 사단법인 벤처한림회, 잡드림 등과 서울 서대문 장애인복지센터에서 지난 8월에 이어 '제2회 찾아가는 재능나눔 이미용 봉사'를 실시했다고 25일 밝혔다.   이번 봉사활동은 ESG 경영 차원에서 실시한 사회공헌활동으로 미용 전문기업 헤어디자이너들이 참여해 지체장애인 50여명에게 2시간 30분 동안 이미용 서비스를 제공했다.   봉사활동은 기업은행이 후원금을 지원해 사단법인 벤처한림회, 서울시지체장애인협회, 사회복지공동모금회, 잡드림 주최로 진행됐다.   또한 장애인 채용 컨설팅 선도기업인 잡드림 주관으로 미용 전문기업 제오헤어 헤어디자이너들의 자발적인 자원봉사로 이뤄졌다.   기업은행 관계자는 ""거동이 어려운 장애인 및 노인분들께 찾아가는 이미용 서비스를 제공해 드리고자 주기적인 봉사활동을 하고 있다""며 ""앞으로도 사회공헌활동을 통해 국책은행으로서의 사회적 책임을 다하며 따뜻한 나눔을 실천하겠다""고 말했다.   ]",[],https://tenasia.hankyung.com/music/article/2023092689154,https://n.news.naver.com/mnews/article/123/0002316684?sid=101
2023.09.26.,뉴스1,,"대한간호협회, 추석 앞두고 무료급식소 봉사",,,https://www.news1.kr/photos/view/?6236716,http://tenasia.co.kr/
2023-09-26 10:00:00,빅데이터뉴스,,"대한항공, 추석 맞이 '명절 음식 한상 나눔' 봉사활동 전개",[],[],http://www.thebigdata.co.kr/view.php?ud=2023092509110994623e9bb86c69_23,https://n.news.naver.com/mnews/article/312/0000630412?sid=106
2023.09.25.,인천일보,,"건보 인천중부지사 '건이강이 봉사단', 인천중구노인복지관에 추석 명절 맞아...",,,https://www.incheonilbo.com/news/articleView.html?idxno=1213440,http://news1.kr/
2023-09-26 12:46:22,경남도민신문,사회,"창원시, 추석 맞이 이·미용 봉사·사랑의 간식 나눔 활동 펼쳐",[     (서울=뉴스1) 구윤성 기자 = 대한간호협회 회원들이 26일 오후 서울 종로구 탑골공원 원각사 노인 무료급식소에서 추석을 앞두고 급식 봉사를 하고 있다. 2023.9.26/뉴스1   ],[],http://www.gndomin.com/news/articleView.html?idxno=367337,https://n.news.naver.com/mnews/article/421/0007075718?sid=102
2023.09.22.,동양일보,,"사진기사/ 직·공장새마을운동 제천시협의회, 독거노인가구 집수리 봉사",,,http://www.dynews.co.kr/news/articleView.html?idxno=722070,http://www.thebigdata.co.kr/
2023.09.19.,어패럴뉴스,,"NHN, 사내봉사단 ‘리틀스카우트’ 출범",,,http://www.apparelnews.co.kr/news/news_view/?idx=207777,http://news.itimes.co.kr
2023.09.22.,대한경제,,"한국타이어, 추석맞이 송편 나눔 봉사활동",,,https://www.dnews.co.kr/uhtml/view.jsp?idxno=202309221117151750050,http://www.gndomin.com/
21면 1단,강원일보,,"강원특별자치도자원봉사센터, 이달(9월)의 으뜸봉사상 선정",,,https://www.kwnews.co.kr/page/view/2023092014540745739,http://www.kwnews.co.kr/
2023-09-20 15:47:01,백세시대,사회,"대한노인회 제주연합회, 2023년 노인자원봉사 단장 교육","[    (사)강원특별자치도자원봉사센터는 20일 이달(9월)의 으뜸봉사자에 김명순(65·인제) 봉사자를, 으뜸봉사단체에 홍천읍여성의용소방대를, 으뜸봉사가족에 삼척시에 거주하고 있는 김명복 가족을 각각 선정했다.    ◇김명순 봉사자김명순 봉사자는 지난 2006년 2월부터 현재까지 신남적십자봉사회에 소속 돼 노인회관 점심봉사, 홀몸 어르신을 위한 반찬 만들기 활동을 지속적으로 이어나가고 있으며 태풍 카눈으로 인한 피해지역을 찾아 복구활동에 참여하는 등 주변 어려운 이웃에게 관심을 갖고 나눔을 실천하고 있다.    ◇홍천읍여성의용소방대홍천읍여성의용소방대는 2008년에 설립된 단체로, 홍천군자원봉사센터와 업무협약을 체결하고 지역사회 행사지원과 캠페인, 위험지역 예찰, 안전약자 소방안전 돌봄 등 홍천군 자원봉사 활성화에 기여하고 있다.    ◇김명복 가족김명복 가족은 비둘기가족봉사단 소속으로 경로당 프로그램 활동, 통학로 교통지도와 교통캠페인, 알뜰장터, 환경정화 등 삼척시자원봉사센터에서 주관하는 프로그램에 적극적으로 참여하고 있다. 또, 지속적으로 취약계층 돌봄 활동을 이어오며 지역 내 이웃 사랑을 실천하고 있다. ]",[],http://www.100ssd.co.kr/news/articleView.html?idxno=102467,https://n.news.naver.com/mnews/article/087/0000996528?sid=102
2023.09.26.,스타뉴스,,"임영웅 팬클럽 부산영웅시대 '스터디하우스', 정기 후원·봉사..선한 영향력 ...",,,https://www.starnewskorea.com/stview.php?no=2023092605231352251,http://www.100ssd.co.kr
2023.09.22.,브릿지경제,,"한국타이어, 추석맞이 송편 나눔 봉사활동",,,https://www.viva100.com/main/view.php?key=20230922010006705,http://star.moneytoday.co.kr
2023-09-26 07:00:00,한국일보,,"BNK경남은행, 울산·경남서 동시다발 ‘한가위맞이 자원봉사 대축제’",[],[],https://www.hankookilbo.com/News/Read/A2023092408510003202?did=NA,https://n.news.naver.com/mnews/article/108/0003184045?sid=106
2023.09.20.,신아일보,,"'대진국제자원봉사단, 여주시에 소외계층 위한 추석맞이 소고기 후원",,,http://www.shinailbo.co.kr/news/articleView.html?idxno=1762864,http://www.viva100.com
2023.09.24.,강원일보,,[포토뉴스]대한노인회 인제군지회 행사보조 봉사활동,,,https://www.kwnews.co.kr/page/view/2023092322123167000,http://www.hankookilbo.com/
2023-09-24 09:59:03,아이뉴스24,사회,"청주시, 노인일자리·사회활동 지원사업 '최우수'","[ 임직원 500여명 참여… 지역 전통시장, 복지시설, 산·하천 등에서 봉사활동과 수산물 소비 활성화 캠페인 동시 진행    BNK경남은행은 지난 23일 추석을 앞두고 울산과 경남에서 '한가위 맞이 자원봉사 대축제'를 동시 다발적으로 진행했다. BNK경남은행 제공BNK경남은행은  민족 최대 명절 추석을 앞두고 지난 23일 예경탁 은행장을 비롯한 임직원 500여명이 경남과 울산에서 ‘한가위맞이 자원봉사 대축제’를 실시했다고 밝혔다.이날 한가위맞이 자원봉사 대축제는 지역민과 지역사회로부터 받은 사랑과 성원에 보답하기 위해 임직원들이 자발적으로 참여하는 봉사활동과 함께 지역 전통시장과 수산업을 응원하기 위해 마산 어시장과 등 전통시장과 복지시설, 산·하천 등 곳곳에서  동시에 진행됐다. 예경탁 은행장과 임직원 100여명은 추석  대목을 맞은 마산어시장 공영주차장을 청소하고, 합포수변공원에서부터창동ㆍ오동동 일대를 걸으며  오물과 쓰레기를 수거하며 구슬땀을 흘렸다.환경정화 및 봉사활동을 마친 임직원들은 전통시장온누리상품권으로  수산물을 구입하고  어시장 내 횟집에서 상인들과 함께 식사를 했다. 또  본부 부서 임직원 100여명은 창원 팔용산 등산로에서 환경정화활동을 했으며 경남노인통합지원센터, 마산애육원, 창원성심양로원을 나눠 방문해 시설 내외부 청소, 도우미 역할 등 돌봄활동을 벌였다. 이와 함께 △창원 정병산ㆍ봉곡시장, 창원천ㆍ반송시장, 창원중앙동ㆍ용지동 상가지역 △울산 태화강국가정원ㆍ신정시장 △김해 해반천ㆍ내외동시장, 율하천ㆍ장유전통시장 △진주 비봉산ㆍ자유시장 △수도권 안산자락길ㆍ영천시장에서 진행된 한가위맞이 자원봉사 대축제에는 각 영업본부별 임직원 300여명이 참여해 환경정화활동을 펼쳤다. 예경탁 은행장은 “임직원 500여명이 참여한 한가위맞이 자원봉사 대축제를 통해 지역사회에 희망의 메세지가 전달되기를 기원한다. 특히 전통시장 환경정화활동과 수산물 소비 활성화 캠페인이 시장 상인들과 수산업 종사자들에게 응원이 됐으면 한다. 임직원들이 흘린 땀이 다시 찾는 깨끗한 전통시장과 어시장을 만드는데 도움이 되기를 바란다”고 말했다. 이어 “최근 불미스러운 일로 BNK경남은행을 아끼고 사랑해 주시는 지역민들께 심려를 끼쳐드려 송구스러운 마음이다. 사고 수습에 총력을 다하여 BNK경남은행을 믿고 기다려주시는 지역민들의 기대에 부응할 수 있는 새로운 모습으로 거듭날 것이며 지역을 위한 역할 수행에도 최선을 다하겠다”고 덧붙였다. 한편 BNK경남은행은 한가위맞이 자원봉사 대축제와 별도로 추석 전까지 경남도 시ㆍ군과 울산지역 소외계층 총 8,320세대에 4억1,600만원 상당의 전통시장 상품권과 지역사랑 상품권을 전달하는 ‘추석맞이 사랑나눔사업’을 벌이고 있다.  ]",[],http://www.inews24.com/view/1635820,https://n.news.naver.com/mnews/article/469/0000762171?sid=102
2023.09.17.,경남도민신문,,합천군노인회 자원봉사단 일해공원 환경정화 활동펼쳐,,,http://www.gndomin.com/news/articleView.html?idxno=366348,http://www.shinailbo.co.kr/
2023.09.28.,스타뉴스,,"강원FC, 독거노인 위해 쌀 1000kg 전달... 윤정환 감독 및 선수들도 배식 봉사",,,https://www.starnewskorea.com/stview.php?no=2023092800114924316,http://www.kwnews.co.kr/
2023.09.28.,스타뉴스,,"강원FC, 독거노인 위해 쌀 1000kg 전달... 윤정환 감독 및 선수들도 배식 봉사",,,https://www.starnewskorea.com/stview.php?no=2023092800114924316,http://star.moneytoday.co.kr
None,전국매일신문,,"송파구시설관리공단, 독거노인 가정에 추석선물",[],[],https://www.jeonmae.co.kr/news/articleView.html?idxno=984373,https://sports.news.naver.com/news.nhn?oid=108&aid=0003184464
2023.09.22.,디지털투데이,,"LGU+, 추석 맞아 청파노인복지관에 수해지역 농산물 기부",,,http://www.digitaltoday.co.kr/news/articleView.html?idxno=488954,http://www.jeonmae.co.kr/
2023.09.25.,경기신문,,"한국건강관리협회, SK청솔노인복지관에서 배식 봉사활동",,,https://www.kgnews.co.kr/news/article.html?no=764284,http://www.digitaltoday.co.kr/
2023.09.22.,이투데이,,"추경호 ""내년 노인 관련 예산 23조로 확대…노인복지 강화 지속""",,,https://www.etoday.co.kr/news/view/2286943,http://www.kgnews.co.kr/
2023.09.24.,경남신문,,BNK경남은행 “한가위 맞이 자원봉사 대축제”,,,http://www.knnews.co.kr/news/articleView.php?idxno=1414678,http://www.etoday.co.kr
2023.09.22.,뉴시스,,"'독거노인 빨래해드려요'…무주군, 행복나눔 이동빨래방차 2호 운영",,,http://www.newsis.com/view/?id=NISX20230922_0002461008&cID=10899&pID=10800,http://www.knnews.co.kr
2023.09.18.,경북신문,,"영천시 화산면 지사협, 독거노인 집 청소 봉사",,,http://www.kbsm.net/news/view.php?idx=405968,http://www.newsis.com
2023-09-22 14:24:07,뉴데일리,사회,"DGB데이터시스템, 노인복지관 무료급식 실시","[     [무주=뉴시스] 최정규 기자 = 전북 무주군은 22일 무주군 적상면 여원마을회관 앞에서 행복나눔 이동빨래방차 2호 제막행사를 진행했다. (무주군 제공) 2023.09.22. *재판매 및 DB 금지[무주=뉴시스]최정규 기자 = 전북 무주군은 22일 적상면 여원마을회관 앞에서 행복나눔 이동빨래방차 2호 제막 행사가 진행됐다고 밝혔다.이동빨래방차는 무주농협과 구천동농협이 사회복지공동모금회에 지정 기탁, 무주군 자원봉사센터에서 운영을 한다.거동 불편 장애인과 독거노인의 위생문제를 해결한다는 취지에서 마을을 순회하며 옷과 이불 등을 세탁하는 데 쓰일 예정이다. 행사에는 황인홍 무주군수와 농협중앙회 김범석 지부장, 무주농협 곽동열 조합장, 구천동농협 김성곤 조합장, 무주군자원봉사센터 이강우 센터장과 마을 주민 등 100여명이 참석해 의미를 더했다. 황인홍 무주군수는 “고령화되고 혼자 거주하시는 어르신들이 점점 많아지고 있는 현실에서 이동빨래방차가 효자노릇을 톡톡히 한다”며 “이동빨래방차가 다니는 마을 곳곳이 깨끗하고 보송보송해지기를 바라는 마음”이라고 전했다. 한편 이날 주민들에게 첫선을 보인 이동빨래방차는 1.2t 트럭을 개조한 것으로, 운영을 맡은 무주군 자원봉사센터에서는 이 차를 비롯해 총 2대를 맡아 운행 중이다. 이들은 동절기(11월~2월)를 제외하고 지속적으로 6개 읍면을 순회하며 빨래 봉사활동을 펼친다. ]",[],https://tk.newdaily.co.kr/site/data/html/2023/09/25/2023092500319.html,https://n.news.naver.com/mnews/article/003/0012107332?sid=102
2023.09.26.,뉴스1,,"대한간호협회, 추석 앞두고 무료급식소 봉사활동",,,https://www.news1.kr/photos/view/?6236712,http://www.kbsm.net
2023.09.22.,EBN,,"LGU+, 추석 맞아 청파노인복지관에 수해지역 농산물 기부",,,https://www.ebn.co.kr/news/view/1593481/?sc=Naver,http://www.ebn.co.kr
2023.09.19.,대경일보,,"경산 남산여성의용소방대, 노인요양시설 찾아 봉사활동",,,https://www.dkilbo.com/news/articleView.html?idxno=414460,http://www.dkilbo.com
2023.09.19.,에너지경제,,"NHN, 사내봉사단 ‘리틀스카우트’ 출범",,,https://www.ekn.kr/web/view.php?key=20230919010005215,http://www.ekn.kr
2023.09.21.,백세시대,,"대한노인회 강원 양구군지회, 2023년 노인자원봉사단 단장 교육",,,http://www.100ssd.co.kr/news/articleView.html?idxno=102566,http://www.100ssd.co.kr
2023.09.25.,FETV,,"신한라이프, 추석 맞아 독거노인에 식품·전기매트 전달",,,https://www.fetv.co.kr/news/article.html?no=148526,http://www.foodtvnews.com
2023.09.24.,아시아투데이,,"BNK경남은행, '한가위맞이 자원봉사 대축제' 실시",,,https://www.asiatoday.co.kr/view.php?key=20230924010014407,http://www.asiatoday.co.kr
2023.09.18.,농수축산신문,,"울산 농소농협 '따사모봉사단', 재가노인복지센터 쌀 전달식 가져",,,http://www.aflnews.co.kr/news/articleView.html?idxno=255278,http://www.aflnews.co.kr
2023.09.25.,백세시대,,"대한노인회 전북연합회 소속 오네시모봉사단 ""국가 예산 미치지 못하는 공공시...",,,http://www.100ssd.co.kr/news/articleView.html?idxno=102786,http://www.100ssd.co.kr
2023.09.22.,아시아투데이,,"추경호, 노인복지 현장 찾아 지원 강화 약속",,,https://www.asiatoday.co.kr/view.php?key=20230922010013865,http://www.asiatoday.co.kr
2023.09.25.,포인트데일리,,"대한항공, 어르신 모시고 '명절 음식 한상 나눔' 봉사활동",,,https://www.thekpm.com/news/articleView.html?idxno=174742,http://www.thekpm.com/
2023.09.22.,아시아투데이,,"추경호, 노인복지 현장 찾아 지원 강화 약속",,,https://www.asiatoday.co.kr/view.php?key=20230922010013865,http://www.asiatoday.co.kr
2023.09.25.,포인트데일리,,"대한항공, 어르신 모시고 '명절 음식 한상 나눔' 봉사활동",,,https://www.thekpm.com/news/articleView.html?idxno=174742,http://www.thekpm.com/
2023.09.30.,크리스천투데이,,"월드뷰티핸즈, 쪽방촌 독거노인 위한 추석 선물 전달",,,https://www.christiantoday.co.kr/news/357220,http://www.chtoday.co.kr/
2023.09.22.,서울경제TV,,"LG U+, 추석 맞아 청파노인복지관에 수해지역 농산물 기부",,,http://www.sentv.co.kr/news/view/669247,http://www.sentv.co.kr
2023.09.25.,뉴시스,,"[대구소식]중구, 복지부 노인 일자리 분야 최우수 지자체 선정 등",,,http://www.newsis.com/view/?id=NISX20230925_0002463821&cID=10810&pID=10800,http://www.newsis.com
2023-09-25 16:34:29,뉴스1언론사 선정,사회,'고물가 시대' 노숙인·독거노인 무료급식 고기반찬도 3분의 2 줄었다,"[     [대구=뉴시스] 이상제 기자 = 대구시 중구는 '2023 노인 일자리 및 사회활동지원사업 시·군·구 평가'에서 최우수 지자체로 선정됐다고 25일 밝혔다.평가는 2022년도 노인 일자리 사업 실적에 대해 이뤄졌으며 보건복지부와 한국노인인력개발원이 실시했다.중구는 사업 운영 이행률, 참여자 관리 등의 평가지표에서 높은 평가를 받아 노인일자리 지자체 부문 총 3개 상을 수상했다.구청은 다양한 일자리를 운영해 노인들의 소득 창출과 사회참여 기회를 확대하고 건강하고 활기찬 노후생활을 보장하기 위한 노인일자리 사업을 적극 지원하고 있다.    ◇달서구, 2023 달서 청·청 봉사활동 개최대구시 달서구는 지역 노인과 청소년을 대상으로 '2023 달서 청(淸)·청(靑) 봉사활동'을 개최했다고 25일 밝혔다.봉사활동은 세대 간 교류와 소통의 기회가 줄어들며 생긴 세대 단절 문제를 해결하기 위해 마련됐다.젊은 세대의 문화를 배우고자 하는 60세 이상 50명, 노인과 소통하며 도움이 되고자 하는 청소년 50명이 함께 참여했다. 행사는 청소년이 노인의 보조강사 역할을 맡아 스마트폰으로 사진을 찍고 전송하는 방법 등 실생활에 유용한 스마트폰 활용법을 익힐 수 있도록 도움을 주는 순으로 진행했다. ]",[],https://www.news1.kr/articles/5173303,https://n.news.naver.com/mnews/article/003/0012112550?sid=102
