Date,Press,Category,Title,Content,Comment,URL_Origin,URL_Naver
2017-01-01 09:05:28,충남일보,IT/과학,"온양6동, 설명절 나눔봉사 '솔선수범'","[     [아시아경제 박소연 기자] LG유플러스가 봉사활동으로 2017년 새해 첫 업무를 시작한다.LG유플러스는 2일 오후 권영수 부회장과 직원 등 30여명이 서울 용산구 서계동에 있는 청파노인복지센터를 찾아 봉사활동을 펼칠 예정이라고 1일 밝혔다.권 부회장을 비롯한 LG유플러스 임직원들은 지난 2009년 개관해 하루 평균 200명의 어르신들이 찾는 청파노인복지센터를 새롭게 단장하는 데 함께 힘을 보탤 예정이다.LG유플러스 임직원들은 우선 벽화 그리기를 통해 노후화하고 딱딱한 건물 분위기를 밝고 따뜻하게 바꾸며, 옥상 울타리에도 색을 칠하는 등 노인복지센터 외부를 변화시킬 계획이다.복지센터 내부도 한층 밝아지고 건강을 생각하는 공간으로 탈바꿈된다. 지하 2층부터 지상 3층까지 각 층 계단을 음식과 스트레칭 등에 대한 정보를 담은 ‘건강계단’으로 꾸민다. 실내 프로그램실 벽면도 자작나무 그림으로 형상화하는 등 편안한 자연공간으로 조성한다.임직원들과 함께 직접 벽화를 그릴 권 부회장은 이어 노인복지센터에 차량 1대를 기부할 예정이다. 관내 저소득 어르신들을 위해 가정방문과 도시락 등을 자주 배달해야 하는 복지센터 직원들의 업무 특성을 감안해 좁은 골목길에서도 운행이 쉬운 경차를 선물하는 것이다.권영수 LG유플러스 부회장은 “경영진과 직원들이 함께 솔선수범해 나눔을 실천하는 봉사활동을 펼치며 의미 있는 새해를 맞이하게 됐다”면서 “부족하지만 어르신들이 조금 더 나은 환경에서 앞으로도 건강하게 잘 지내셨으면 좋겠다”고 말했다.박소연 기자 muse@asiae.co.kr▶ 최강의 재미 [아시아경제 카드뉴스]▶ 맛있는 레시피 ▶ 양낙규의 [군사이야기]&lt;ⓒ세계를 보는 창 경제를 보는 눈, 아시아경제 무단전재 배포금지&gt; ]",[],http://www.chungnamilbo.com/news/articleView.html?idxno=389526,https://n.news.naver.com/mnews/article/277/0003903641?sid=105
2017.01.19.,굿모닝충청,,새누리당 대전시당 동구노인종합복지관 떡국 봉사,,,http://www.goodmorningcc.com/news/articleView.html?idxno=55144,http://www.chungnamilbo.co.kr
2017.01.16.,대한경제,,"한전, 26일까지 ‘설명절 맞이 봉사주간’ 시행",,,http://www.cnews.co.kr/uhtml/read.jsp?idxno=201701161111059650757,http://www.goodmorningcc.com
2017.01.11.,매일경제,,"대우건설 신입사원, 서울 성북서 연탄배달 봉사활동",,,http://news.mk.co.kr/newsRead.php?no=24425&year=2017,http://www.cnews.co.kr
2017.01.11.,경인일보,,시각장애 혜광학교 노인시설서 봉사,,,http://www.kyeongin.com/main/view.php?key=20170111010003767,http://www.mk.co.kr/
2017-01-11 10:06:04,스포츠조선,경제,"SPC그룹, 설 맞아 사회봉사활동","[      대우건설은 지난 10일 신입사원 70명이 참여한 가운데 서울시 성북구 보문국로 29길 일대에서 '사랑의 연탄나눔' 봉사활동을 진행했다고 11일 밝혔다.이날 대우건설은 연탄 5000장을 밥상공동체복지재단 서울연탄은행을 통해 기부했고, 신입사원들이 직접 영세독거노인 등 저소득층 50개 가구에  배달했다.대우건설은 2011년부터 매년 서울연탄은행을 통해 연탄을 기부하고 서울시 중계동 104마을 등에서 연탄배달 봉사활동을 진행하고 있다.대우건설 관계자는 ""매년 릴레이 봉사활동을 통해 전직원의 3분의 1이 직접 봉사활동에 참여하고 있다""며 ""올해도 노후 복지시설 인프라 개보수, 임직원 월급동전 모으기, 신생아 모자뜨기 등 손길이 필요한 곳에서 다양한 봉사활동을 진행할 예정""이라고 전했다.[디지털뉴스국 이미연 기자][매일경제 공식 페이스북] [오늘의 인기뉴스] [매경 프리미엄][ⓒ 매일경제 &amp; mk.co.kr, 무단전재 및 재배포 금지]   ]",['왼쪽에 계신분 정말 열심히 하는것 같네요!'],http://sports.chosun.com/news/ntype.htm?id=201701290100216380015231&servicedate=20170129,https://n.news.naver.com/mnews/article/009/0003871138?sid=101
2017.01.13.,연합뉴스,,"외교부 직원들, 독거노인 등에 연탄 배달",,,http://app.yonhapnews.co.kr/YNA/Basic/SNS/r.aspx?c=AKR20170113157600014&did=1195m,http://www.kyeongin.com
A28면 1단,세계일보,,폐광지역 독거노인 집 찾아 연탄 나르는 청소년 봉사단,,,http://www.segye.com/content/html/2017/01/11/20170111003691.html?OutUrl=naver,http://sports.chosun.com
2017.01.27.,영남일보,,"수자원공사 구미단지건설단, 독거노인가정에 ‘떡국떡’",,,http://www.yeongnam.com/mnews/newsview.do?mode=newsView&newskey=20170127.010210754530001,http://www.yeongnam.com
2017.01.15.,한국일보,,"KEB하나은행, 어려운 이웃에 ‘사랑의 연탄 나눔’ 봉사활동 펼쳐",,,http://www.hankookilbo.com/v/46db03549a134d75b7e5cddea31321ef,http://www.hankookilbo.com/
2017-01-15 14:39:02,불교신문,경제,"광진노인복지, 노인일자리 참여자 모집","[     KEB하나은행 임직원 등 150여명은 지난 14일 서울 노원구의 독거노인과 조손가정 등 저소득층에게 1만1,111장의 연탄과 생필품이 담긴 행복상자를 전달했다. 함영주(가운데) 하나은행장은 “이웃과 내가 함께 행복해지는 지역사회 봉사활동에 지속적으로 참여할 것”이라고 밝혔다. 하나은행 제공▶한국일보 [페이스북] [카카오 친구맺기]▶자동차의 모든 것! [모클][ⓒ 한국일보(hankookilbo.com), 무단 전재 및 재배포 금지]   ]",[],http://www.ibulgyo.com/news/articleView.html?idxno=155170,https://n.news.naver.com/mnews/article/469/0000183369?sid=101
2017.01.18.,뉴시스,,"롯데백화점 전주점, 설맞이 떡국나눔 봉사활동",,,http://www.newsis.com/view/?id=NISI20170118_0012598213,http://www.ibulgyo.com
2017.01.25.,BTN불교TV,,"불광사 경북불교대학, 노인대학 개설해 신노인문화 주도",,,http://www.btnnews.tv/news/articleView.html?idxno=40665,http://www.newsis.com
2017-01-18 17:40:37,세계일보,사회,"대우건설 신입사원, 연탄배달 봉사활동 실시","[     【전주=뉴시스】윤난슬 기자 = 롯데백화점 전주점 '샤롯데 봉사단'은  18일 2017년 설날을 앞두고 전북 전주인보노인 복지센터를 방문해 지역 내 저소득층과 독거노인을 위한 사랑의 떡국 봉사활동을 진행하고 기념사진을 찍고 있다. 2017.01.18.(사진=롯데백화점 전주점 제공) photo@newsis.com[사진 영상 제보받습니다] 공감언론 뉴시스가 독자 여러분의 소중한 제보를 기다립니다. 뉴스 가치나 화제성이 있다고 판단되는 사진 또는 영상을 뉴시스 사진영상부(n-photo@newsis.com, 02-721-7470)로 보내주시면 적극 반영하겠습니다.&lt;저작권자ⓒ 공감언론 뉴시스통신사. 무단전재-재배포 금지.&gt; ]",[],http://www.segye.com/content/html/2017/01/11/20170111003498.html?OutUrl=naver,https://n.news.naver.com/mnews/article/003/0007721057?sid=102
2017.01.19.,강원일보,,[포토뉴스]춘천지법 화천군 노인회관서 급식봉사,,,http://www.kwnews.co.kr/view.asp?aid=217011800150&s=201,http://btnnews.tv
2017.01.23.,장애인신문,,"사단법인 일광사, 중랑구 저소득층 위한 나눔·봉사",,,http://www.welfarenews.net/news/articleView.html?idxno=60084,http://www.segye.com
2017-01-11 16:57:42,전북일보,경제,"부안군 독거노인생활관리사 모임, 떡 나눔 봉사","[     지난 10일 대우건설 신입사원들이 서울시 성북구 보문국로 29길 일대 저소득층 가구에 기부한 연탄을 배달하고 있다, 사진=대우건설대우건설은 지난 10일 서울시 성북구 보문국로 29길 일대에서 신입사원 70여명이 참여한 가운데 '사랑의 연탄나눔' 봉사활동을 진행했다고 11일 밝혔다.이날 대우건설은 연탄 5000장을 밥상공동체복지재단 서울연탄은행을 통해 기부하고 영세 독거노인 등 저소득층 50개 가구에 직접 배달했다.대우건설 관계자는 ""매년 릴레이 봉사활동을 통해 전 직원의 3분의 1이 직접 봉사활동에 참여하고 있다""며 ""올해에도 노후 복지시설 인프라 개보수, 임직원 월급동전 모으기, 신생아 모자뜨기 등 손길이 필요한 곳에서 다양한 봉사활동을 진행할 예정""이라고 말했다.이상현 기자 ishsy@segye.comⓒ 세상을 보는 눈, 글로벌 미디어 세계일보 ]",['봉사하는 모습 보기좋네요 ㅎㅎ'],http://www.jjan.kr/news/articleView.html?idxno=1118946,https://n.news.naver.com/mnews/article/022/0003135114?sid=101
2017.01.20.,글로벌이코노믹,,"미래에셋생명 임직원 봉사단, 마포구 찾아 설맞이 봉사 활동 진행",,,http://www.g-enews.com/ko-kr/news/article/news_all/201701201502028089639_1/article.html,http://www.kwnews.co.kr/
21면 1단,국민일보,,"삼성그룹, 10억원 상당 선물세트 노인복지관 등 어려운 이웃에 전달",,,http://news.kmib.co.kr/article/view.asp?arcid=0923676607&code=11151400&cp=nv,http://www.kmib.co.kr/
2017-01-11 21:04:03,파이낸셜뉴스,경제,"롯데글로벌로지스, 사랑의 제빵·부식 봉사활동 펼쳐","[      11일 서울 노원구 대한적십자사 중랑노원희망나눔봉사센터에서 윤주화 삼성사회봉사단 사장(오른쪽)이 밀가루, 된장 등이 담긴 선물세트를 주민에게 전달하고 있다. 삼성그룹 제공 삼성그룹은 11일 설을 맞아 서울 중랑구 대한적십자사 중랑노원희망나눔센터에서 10억원 상당의 선물세트를 어려운 이웃에게 전달했다고 밝혔다. 선물세트는 밀가루, 된장, 식용유 등 11종으로 구성됐다. 삼성은 대한적십자사와 함께 11일부터 2주간 노인복지관, 지역아동센터 등 전국 1600개 사회복지시설과 소외계층 3만5000가구를 방문해 부식품을 전달하고 봉사활동을 펼칠 예정이다. 이날 전달식에는 윤주화 삼성사회봉사단 사장과 김성주 대한적십자사 총재를 비롯한 삼성 임직원, 대한적십자사 봉사자들이 참여했다. 이들은 노원지역 독거노인들을 방문해 선물을 전달하고 떡국을 대접하기도 했다. 삼성은 2008년부터 10년간 매년 설과 추석마다 ‘희망나눔 봉사활동’을 해 왔으며 현재까지 총 175억원을 지원했다.허경구 기자 nine@kmib.co.kr[국민일보 홈페이지] [페이스북] [트위터][국민일보 꿀잼영상 바로가기]GoodNews paper ⓒ 국민일보(www.kmib.co.kr), 무단전재 및 재배포금지[뉴스 미란다 원칙] 취재원과 독자에게는 국민일보에 자유로이 접근할 권리와 반론·정정·추후 보도를 청구할 권리가 있습니다. 고충처리인(gochung@kmib.co.kr)/전화:02-781-9711 ]",[],http://www.fnnews.com/news/201701161150506148,https://n.news.naver.com/mnews/article/005/0000965000?sid=101
2017.01.19.,투데이에너지,,"S-OIL, 사랑의 떡국나누기 봉사활동 펼쳐",,,http://www.todayenergy.kr/news/articleView.html?idxno=120948,http://www.fnnews.com/
2017-01-16 11:56:03,부산일보,경제,[독자의 눈] 설 맞아 독거노인에 관심 가져야,"[           롯데글로벌로지스 직원들이 서울 남산동 대한적십자사 희망나눔봉사센터에서 빵과 국수를 만든 후 기념촬영을 하고 있다.     설날을 맞아 주변 어려운 이웃에게 따뜻한 마음 나누기에 나선 기업들이 늘고 있다.   롯데글로벌로지스는 대한적십자와 함께 '사랑의 제빵 및 봉사활동'을 실시했다고 16일 밝혔다. 대한적십자사 종로중구 희망나눔봉사센터에서 진행된 이번 봉사활동은 이재복 대표이사와 롯데글로벌로지스 봉사회원 60명이 참여했다. 롯데글로벌로지스는 봉사관에서 만든 빵과 국수 및 부식세트를 종로구 창신동 소재 독거노인 등 저소득 취약 계층 300여 세대에 전달했다.   현재 롯데글로벌로지스는 대한적십자사와 함께 부식 및 도시락 배달, 차량지원 등 다양한 봉사활동을 전개하고 있다.   이재복 롯데글로벌로지스 대표는 ""앞으로 사회공헌활동을 확대하여 지역사회와 상생하는 따뜻한 기업이 되겠다""고 말했다.    true@fnnews.com 김아름 기자   ▶ 세상의 모든 골 때리는 이야기 'fn파스'▶ 속보이는 연예뉴스 fn스타  ※ 저작권자 ⓒ   파이낸셜뉴스. 무단 전재-재배포 금지    ]",[],http://news20.busan.com/controller/newsController.jsp?newsId=20170120000213,https://n.news.naver.com/mnews/article/014/0003763138?sid=101
2017.01.16.,이투데이,,"한전 노사, 설 명절 앞두고 2만여명 봉사활동 전개",,,http://www.etoday.co.kr/news/section/newsview.php?idxno=1442152,http://todayenergy.kr/
2017.01.10.,뉴시스,,"한국관광공사, 신입사원-노사 '사랑의 연탄 나눔'봉사",,,http://www.newsis.com/view/?id=NISI20170110_0012569654,http://www.busan.com/
2017-01-22 19:12:06,미디어펜,사회,"KEB하나은행, '사랑의 연탄나눔' 봉사활동","[              부산지역 만 65세 이상 독거노인은 총 13만 2000명인데 71세 이상 고령이 8만 6000여 명이다. 그중 기초생활수급자가 3만 1000명이다. 부산시는 전국 특별시와 광역시 중 가장 먼저 '고령사회'에 접어들었는데 급격한 고령화로 인한 빈곤, 질병, 고독 등 노인 문제가 심각하다.OECD 국가 중 한국의 70세 이상 노인 평균 자살률은 다른 나라 노인 자살률 평균보다 20배 정도 높은 수준이다. OECD 국가 중 65세 이상 노인 빈곤율도 가장 높다.설 명절을 앞두고 찾아온 한파는 저소득층 독거노인에게 더 혹독하다. 따라서 명절을 맞아 우리 주변의 독거노인들을 다시 한번 살펴보았으면 한다.우선 주택이 노후화돼 물이 새거나 찬 바람이 들어오는지 등 청결 상태를 둘러보자. 경로당, 복지관, 종교시설 등에 자주 다니며 사회활동을 하는지, 가족·이웃·친지와 연락 및 왕래 빈도는 어떤지도 살펴보자.마지막으로 경제적 어려움을 확인해야 한다. 공과금을 기한 내 납부 못 한 적이 있는지, 난방을 제대로 하고 있는지, 돈이 없어 병원을 자주 이용 못 하는지 등을 알아보자.탄핵정국으로 기업과 가계의 경제 심리가 꽁꽁 얼어붙고 있지만, 이번 명절을 맞아 독거노인을 주변에서 보듬어 주었으면 한다. 기관, 단체, 기업체 등에서 자매결연을 하거나 이·미용업계의 자원봉사도 펼쳐졌으면 한다.통계청 자료에 의하면 현재 65세 이상 1인 가구 비율이 꾸준히 늘고 있다. 우리 사회와 정부도 재가노인시설 서비스 확대 등 독거노인 복지정책에 많은 관심을 기울였으면 한다. 김영락·부산시청 사회복지과         ]",[],http://www.mediapen.com/news/view/225197,https://n.news.naver.com/mnews/article/082/0000671451?sid=102
2017.01.18.,대전일보,,"괴산군, 어려운 이웃을 위한 '사랑의 나눔 봉사'줄이어",,,http://www.daejonilbo.com/news/newsitem.asp?pk_no=1248351,http://www.etoday.co.kr
2017.01.18.,폴리뉴스,,"한화건설, 24일까지 설맞이 릴레이 봉사활동 실시",,,http://www.polinews.co.kr/news/article.html?no=301126,http://www.newsis.com
2017-01-10 15:34:10,프레시안,사회,"순천휴게소, 나눔과 배려 실천한 봉사활동","[     【원주=뉴시스】권순명 기자 = 10일 한국관광공사는 강원 원주시 원동에서 노사 공동으로 '사랑의 연탄 나눔'봉사활동을 펼쳤다.  이번 행사에는 정창수 사장, 박종선 노조위원장을 비롯한 임직원 총 50여명이 참가해 사회복지법인 밥상공동체 연탄은행과 공동으로 원동 추월대마을 독거노인 등 총 20여 가구에 연탄 5000장을 전달했다.2017.01.10.(사진=한국관광공사 제공) photo@newsis.com[사진 영상 제보받습니다] 공감언론 뉴시스가 독자 여러분의 소중한 제보를 기다립니다. 뉴스 가치나 화제성이 있다고 판단되는 사진 또는 영상을 뉴시스 사진영상부(n-photo@newsis.com, 02-721-7470)로 보내주시면 적극 반영하겠습니다.&lt;저작권자ⓒ 공감언론 뉴시스통신사. 무단전재-재배포 금지.&gt; ]",[],http://www.pressian.com/news/article.html?no=149069&ref=nav_search,https://n.news.naver.com/mnews/article/003/0007702820?sid=102
2017.01.20.,프레시안,,"순천휴게소, 나눔과 배려 실천한 봉사활동",,,http://www.pressian.com/news/article.html?no=149069&ref=nav_search,http://www.pressian.com/
2017-01-20 16:01:01,티브이데일리,사회,"‘맨투맨’ 박해진·정만식, 소외계층에 연탄기부+배달 봉사활동 ‘훈훈’",[  [위종선 기자] 한국도로공사 순천휴게소(소장 김강식)가 나눔과 배려를 실천하기 위한 봉사활동을 펼쳐 눈길을 끌었다.순천휴게소는 지난 15일 김강식 소장을 비롯해 직원 5명은 나눔과 배려의 정신을 실천하기 위해 인근 장애우 시설을 방문해 휴게소에서 취급하는 호두과자 경주빵 등 먹거리와 생필품을 전달했다.    ▲순천휴게소가 장애우 시설과 노인요양병원을 방문해 봉사활동 펼쳐 ⓒ순천휴게소특히 장애우 시설 봉사활동을 마친 후 인근에 있는 노인요양병원으로 자리를 옮겨 목욕봉사와 함께 할아버지 할머니들의 휠체어를 밀어주며 구슬땀을 흘렸다. 한편 위즈코프(주)에서 운영하고 있는 주암 양방향 휴게소와 순천휴게소는 분기에 1~2회 요양시설 및 장애우 시설을 찾아 봉사활동을 펼치고 있어 사회적 귀감이 되고 있다.위종선 기자 (wjs8852@hanmail.net)▶독자가 프레시안을 지킵니다 [프레시안 조합원 가입하기][프레시안 페이스북][프레시안 모바일 웹]Copyrightsⓒ PRESSian.com 무단전재 및 재배포금지   ],[],http://tvdaily.co.kr/read.php3?aid=14845543161202493002,https://n.news.naver.com/mnews/article/002/0002024115?sid=102
2017.01.19.,브릿지경제,,"에쓰오일, 영등포 쪽방촌서 ‘떡국 나누기’ 봉사활동",,,http://www.viva100.com/main/view.php?key=20170119010006614,http://www.tvdaily.co.kr
2017.01.15.,이뉴스투데이,,"KEB하나은행, 사랑의 연탄 나눔 봉사활동 펼쳐",,,http://www.enewstoday.co.kr/news/articleView.html?idxno=678575,http://www.viva100.com
2017.01.20.,경남도민신문,,"고성 ""노인일자리·사회활동지원사업 참여하세요""",,,http://www.gndomin.com/news/articleView.html?idxno=131186,http://www.enewstoday.co.kr/
2017.01.11.,이데일리,,"대우건설 신입사원, '사랑의 연탄나눔' 봉사활동",,,http://www.edaily.co.kr/news/newspath.asp?newsid=02292726615796736,http://www.gndomin.com/
2017.01.28.,울산매일신문,,이웃들이 홀몸노인에게 전달한 차례상 음식,,,http://www.iusm.co.kr/news/articleView.html?idxno=714301,http://www.edaily.co.kr/
2017-01-11 09:58:03,금강일보,경제,"한전, 독거노인에 온정","[    [이데일리 이진철 기자] 대우건설(047040)은 지난 10일 신입사원 70명이 참여한 가운데 서울시 성북구 보문국로 29길 일대에서 ‘사랑의 연탄나눔’ 봉사활동을 진행했다.대우건설은 연탄 5000장을 밥상공동체복지재단 서울연탄은행을 통해 기부하고 영세독거노인 등 저소득층 50가구에 신입사원들이 직접 배달에 나섰다.대우건설은 2011년부터 매년 서울연탄은행을 통해 연탄을 기부하고 서울시 중계동 104마을 등에서 연탄배달 봉사활동을 진행하고 있다.대우건설 관계자는 “매년 릴레이 봉사활동을 통해 전직원의 3분의 1이 직접 봉사활동에 참여하고 있다”며 “올해에도 노후 복지시설 인프라 개보수, 임직원 월급동전 모으기, 신생아 모자뜨기 등 손길이 필요한 곳에서 다양한 봉사활동을 진행할 예정”이라고 전했다.    대우건설 신입사원 70명이 10일 서울시 성북구 보문국로 29길 일대 저소득층 가구에 연탄 5000장을 기부하는 ‘사랑의 연탄나눔’ 봉사활동에서 기념촬영하고 있다. 대우건설 제공이진철 (cheol@edaily.co.kr)＜ⓒ종합 경제정보 미디어 이데일리 - 무단전재 &amp; 재배포 금지＞ ]",[],http://www.ggilbo.com/news/articleView.html?idxno=342723,https://n.news.naver.com/mnews/article/018/0003723492?sid=101
2017.01.25.,디지털타임스,,"소리대장간, `디피그래머`를 활용하여 청력검사 봉사활동",,,http://www.dt.co.kr/contents.html?article_no=2017012502109923811001,http://www.iusm.co.kr
2017.01.02.,뉴시스,,"권영수 LG유플러스 대표, 봉사활동으로 새해 업무 시작",,,http://www.newsis.com/ar_detail/view.html?ar_id=NISX20170102_0014614948&cID=10406&pID=13000,http://www.ggilbo.com
2017.01.16.,시민일보,,"한전, 설 명절 노사합동 사랑나눔 봉사활동 펼쳐",,,http://www.siminilbo.co.kr/news/articleView.html?idxno=495161,http://www.siminilbo.co.kr
2017.01.18.,국제뉴스,,"지역난방공사, 설 명절 맞아 독거노인 사랑나눔",,,http://www.gukjenews.com/news/articleView.html?idxno=634488,http://www.gukjenews.com/
2017.01.01.,데일리안,,"권영수 LGU+ 부회장, 봉사활동으로 새해 첫 업무",,,http://www.dailian.co.kr/news/view/604130/?sc=naver,http://www.dailian.co.kr/
2017-01-01 09:02:57,신아일보,,"KEB하나은행, 독거노인에 연탄 1만1111장 전달","[     권영수 LG유플러스 부회장. ⓒ LGU+LG유플러스는 2일 오후 권영수 부회장과 직원 등 30여명이 서울 용산구 서계동에 있는 청파노인복지센터를 찾아 봉사활동을 펼친다고 1일 밝혔다. 권 부회장을 비롯한 LG유플러스 임직원들은 지난 2009년 개관해 하루 평균 200명의 어르신들이 찾는 청파노인복지센터를 새롭게 단장하는 데 함께 힘을 보탤 예정이다. LG유플러스 임직원들은 우선 벽화 그리기를 통해 노후화하고 딱딱한 건물 분위기를 밝고 따뜻하게 바꾸며, 옥상 울타리에도 색을 칠하는 등 노인복지센터 외부를 변화시킬 계획이다. 복지센터 내부도 한층 밝아지고 건강을 생각하는 공간으로 탈바꿈된다. 지하 2층부터 지상 3층까지 각 층 계단을 음식과 스트레칭 등에 대한 정보를 담은 ‘건강계단’으로 꾸민다. 실내 프로그램실 벽면도 자작나무 그림으로 형상화하는 등 편안한 자연공간으로 조성한다. 임직원들과 함께 직접 벽화를 그릴 권 부회장은 이어 노인복지센터에 차량 1대를 기부할 예정이다. 관내 저소득 어르신들을 위해 가정방문과 도시락 등을 자주 배달해야 하는 복지센터 직원들의 업무 특성을 감안해 좁은 골목길에서도 운행이 쉬운 경차를 선물하는 것이다. 권영수 LG유플러스 부회장은 “경영진과 직원들이 함께 솔선수범해 나눔을 실천하는 봉사활동을 펼치며 의미 있는 새해를 맞이하게 됐다”며 “부족하지만 어르신들이 조금 더 나은 환경에서 앞으로도 건강하게 잘 지내셨으면 좋겠다”고 말했다.데일리안 이호연 기자ⓒ (주)데일리안 - 무단전재, 변형, 무단배포 금지   ]",[],http://www.shinailbo.co.kr/news/articleView.html?idxno=551330,https://n.news.naver.com/mnews/article/119/0002160504?sid=004
2017.01.23.,건설타임즈,,"한전KPS, 나주 노인복지관에 후원금 전달",,,http://www.constimes.co.kr/news/articleView.html?idxno=108313,http://www.shinailbo.co.kr/
2017.01.24.,중부일보,,"정인순 고양 거창금속 대표 ""수 많은 도움… 빚 갚는 마음으로 봉사하죠""",,,http://www.joongboo.com/?mod=news&act=articleView&idxno=1139028,http://www.constimes.co.kr
2017.01.20.,쿠키뉴스,,"BNK경남은행, ‘설 맞이 사랑의 떡국 나눔 행사’…노인·장애인 300여명 제공",,,http://www.kukinews.com/news/article.html?no=425966,http://www.joongboo.com
2017.01.17.,국제뉴스,,홍문표 의원-대한노인회장 'JP' 방문,,,http://www.gukjenews.com/news/articleView.html?idxno=633435,http://www.kukinews.com
2017.01.23.,브레이크뉴스,,"장성우체국, 설 맞아 사랑의 집수리 봉사활동 펼쳐",,,http://www.breaknews.com/sub_read.html?uid=487577§ion=sc2,http://www.gukjenews.com/
21면 2단,국민일보,,"한화해피프렌즈 청소년봉사단, 100만 번째 연탄 배달",,,http://news.kmib.co.kr/article/view.asp?arcid=0923676570&code=11151400&cp=nv,http://www.breaknews.com
2017.01.08.,뉴스핌,,"조현상 효성 사장, 신입사원과 독거노인 방문봉사",,,http://www.newspim.com/news/view/20170108000023,http://www.newspim.com
2017.01.10.,뉴시스,,"한국관광공사, 신입사원-노사 '사랑의 연탄 나눔'봉사활동",,,http://www.newsis.com/view/?id=NISI20170110_0012569651,http://www.newsis.com
