Date,Press,Category,Title,Content,Comment,URL_Origin,URL_Naver
2023-09-17 15:28:12,아시아타임즈,사회,"[보험 현미경] 신한라이프, 독거노인 후원물품 제작 봉사활동 진행","[ 신봉섭 옹 등 10명 헌액…누적 봉사 1만5000 시간 이상    안양시 자원봉사자 명예의 전당.[안양=뉴시스] 박석희 기자 = “보이지 않는 곳에서 묵묵히 헌신하신 봉사자께 깊이 감사드리며, 따뜻하고, 거룩한 마음이 많은 시민들의 기억에 오래도록 자리하도록 그 이름을 새겨 고귀한 뜻을 기리고자 한다”.경기 안양시 자원봉사센터(이사장 최대호)가 그간 보이지 않는 곳에서 묵묵히 이웃을 돌봐온 자원봉사자들의 수고와 희생을 기리기 위해 시청 민원실에서 2층 대강당을 올라가는 계단 벽에 '자원봉사자 명예의 전당'을 마련했다.현판에는 ‘나눔과 봉사로 따뜻한 안양을 위해 애써주신 자원봉사들님의 공로에 깊이 감사드리며, 존경과 감사의 마음을 담아 이 자리에 소중한 이름을 새깁니다’라는 설립 취지를 새겼다.아울러 오는 18일 그간의 수고와 희생을 기리기 위해 등재식을 연다. 전당에는 10명의 봉사자를 헌액(獻額)한다. 이들은 365 포털 등록 기준 1997년 1월1일부터 2022년 12월31일까지로 누적 봉사 1만5000 시간 이상을 기록했다.특히 이들은 지역사회에서 취약계층 밑반찬 지원, 청소, 이·미용, 집수리, 수해 지원 등 다양한 봉사활동과 함께 이웃을 보살펴 왔다. 자원봉사센터는 매년 누적 봉사 1만5000 시간 이상을 기록한 봉사자에 대해 추가로 올릴 계획이다.전당에 이름을 올리는 봉사자 중 1명인 93세의 신봉섭 어르신은 1998년 1월부터 만안노인복지회관에서 안내 봉사, 체력단련실 관리, 식당 및 목욕 봉사활동을 꾸준히 해오신 분이다. 경기도 내에서 최고령 봉사자이다.신봉섭 어르신은 “이웃을 위한 작은 손길에서 시작한 봉사활동이었는데, 이제는 삶의 일부가 됐다”며 “명예의 전당에 이름이 올라 매우 고무적이며, 무척 기쁘다”라며 “힘이 닿는 데까지 봉사하겠다”라고 소감을 밝혔다.또 고 김순옥(87세) 님을 비롯해 송재숙(75세), 이승복(67세), 김경숙(65세), 고양명(63세), 이남심(61세), 권태운(60세), 김윤주(51세), 양동성(50세) 님 등이  영광스러운 공간에 이름을 올린다.최대호 이사장은 “오랜 시간 안양 지역을 위해 봉사와 나눔을 실천해 오신 많은 봉사자에게 진심으로 감사의 말을 전한다""라며 ""한분 한분의 이름을 기억할 수 있게 돼 매우 기쁘다”라고 인사했다.이어 “이를 계기로 봉사에 나서는 분들이 더욱더 늘어나기를 기대한다”라며 “여러분과 함께 시 승격 50주년을 맞은 안양시가 지속해서 성장할 수 있도록 다양한 역량을 집중하겠다”라고 강조했다.한편 안양시청 별관 1층에서 열리는 등재식에는 최 이사장을 비롯해 유관기관, 단체장, 자원봉사 수요처 관계자 500여 명이 참석하며, 자원봉사 단체의 축하공연이 펼쳐진다. 칼림바, 클래식 기타, 성악으로 분위기를 고조시킨다. ]",[],https://www.asiatime.co.kr/article/20230925500372,https://n.news.naver.com/mnews/article/003/0012094642?sid=102
2023.09.18.,에너지경제,,안양시 자원봉사자 명예의전당에 10명등재,,,https://www.ekn.kr/web/view.php?key=20230918010005056,http://www.asiatime.co.kr/
2023.09.25.,컨슈머타임스,,"KB국민카드, '취약 노인 마음 잇기' 봉사활동 실시",,,https://www.cstimes.com/news/articleView.html?idxno=561793,http://www.ekn.kr
2023.09.22.,메디파나뉴스,,"유영제약, 9월 저소득층 독거노인 무료급식 봉사활동 실시",,,https://www.medipana.com/article/view.php?news_idx=317067&sch_cate=D,http://www.cstimes.com
2023.09.26.,경남일보,,"산청군자원봉사협의회, 명절음식 나누기 행사",,,http://www.gnnews.co.kr/news/articleView.html?idxno=535639,http://www.medipana.com
2023.09.26.,SBS,,"법무부, 추석 소외계층 지원에 사회봉사명령자 투입",,,https://news.sbs.co.kr/news/endPage.do?news_id=N1007361975&plink=ORI&cooper=NAVER,http://gnnews.co.kr
2023.09.25.,파이낸스투데이,,"광양제철소, 추석맞이 대규모 연합봉사 실시...재능봉사단· 시청 등 400여명...",,,http://www.fntoday.co.kr/news/articleView.html?idxno=302306,http://news.sbs.co.kr/
2023-09-26 09:40:17,백세시대,사회,"대한노인회 경기 파주시지회, 2023년 노인자원봉사단 단장 교육","[     법무부는 추석을 맞아 지역사회 취약계층 지원활동에 사회봉사명령 대상자를 적극 투입하겠다고 밝혔습니다.사회봉사명령은 무보수 노동을 통해 지역사회가 받은 범죄 피해를 복구하도록 하는 형사 처분입니다.법무부는 7∼8월 집중호우와 태풍으로 침수, 낙과 등 피해가 집중된 농촌 지역을 중심으로 사회봉사명령 대상자를 배치할 계획입니다.또, 노인, 장애인 등 소외계층을 위로할 수 있도록 요양원 등 복지시설 지원도 강화할 방침입니다.(사진=법무부 웹사이트 캡처, 연합뉴스)   ]",[],http://www.100ssd.co.kr/news/articleView.html?idxno=102761,https://n.news.naver.com/mnews/article/055/0001092786?sid=102
2023.09.22.,이데일리,,"한국타이어, 추석맞이 송편 나눔 봉사활동",,,http://www.edaily.co.kr/news/newspath.asp?newsid=02086086635742744,http://www.fntoday.co.kr
2023.09.25.,파이낸셜뉴스,,"기업은행, 제2회 찾아가는 재능나눔 이미용 봉사 실시",,,http://www.fnnews.com/news/202309251759029410,http://www.fnnews.com/
2023-09-25 18:04:04,1코노미뉴스,경제,제27회 노인의날…노인 정책 뭐가 있나,"[ 헤어디자이너들 참여해 장애인 대상으로 봉사활동 수행     지난 20일 서울 서대문 장애인복지센터에서 ‘제2회 찾아가는 재능나눔 이미용 봉사’를 마치고 자원봉사자들이 기념촬영을 하고 있다. IBK기업은행 제공 [파이낸셜뉴스] IBK기업은행은 지난 20일 ‘제2회 찾아가는 재능나눔 이미용 봉사’를 실시했다고 25일 밝혔다.   서울 서대문 장애인복지센터에서 진행한 이번 봉사활동은 ESG 경영 차원에서 실시한 사회공헌활동이다.   미용 전문기업 헤어디자이너들이 참여해 지체장애인 50여명에게 2시간 30분 동안 이미용 서비스를 제공했다.   봉사활동은 기업은행이 후원금을 지원해 사단법인 벤처한림회, 서울시지체장애인협회, 사회복지공동모금회, 잡드림 주최로 진행됐다.   또한 장애인 채용 컨설팅 선도기업인 잡드림 주관으로 미용 전문기업 제오헤어 헤어디자이너들의 자발적인 자원봉사로 이뤄졌다.   기업은행 관계자는 “거동이 어려운 장애인 및 노인분들께 찾아가는 이미용 서비스를 제공해 드리고자 주기적인 봉사활동을 하고 있다”며 “앞으로도 사회공헌활동을 통해 국책은행으로서의 사회적 책임을 다하며 따뜻한 나눔을 실천하겠다”고 밝혔다.   ]",[],http://www.1conomynews.co.kr/news/articleView.html?idxno=25147,https://n.news.naver.com/mnews/article/014/0005078274?sid=101
2023.09.26.,경남도민신문,,산청군자원봉사협의회 명절음식 나누기 행사,,,http://www.gndomin.com/news/articleView.html?idxno=367655,http://www.1conomynews.co.kr/
2023.09.18.,뉴스웍스,,안양시 자원봉사자 명예의 전당에 10명 명패 등재,,,http://www.newsworks.co.kr/news/articleView.html?idxno=727776,http://www.gndomin.com/
2023.09.24.,싱글리스트,,"KB국민카드, 추석맞이 취약노인 마음잇기 봉사활동",,,http://www.slist.kr/news/articleView.html?idxno=485180,http://www.newsworks.co.kr/
2023.09.25.,알티케이뉴스,,"KB국민카드, 추석 맞이 취약노인 마음잇기 봉사 활동 실시",,,http://www.rightknow.co.kr/news/articleView.html?idxno=27546,http://slist.kr
2023.09.22.,물류신문,,"팬오션, 노인복지센터서 봉사활동 나서",,,http://www.klnews.co.kr/news/articleView.html?idxno=309609,http://www.rightknow.co.kr/
2023.09.27.,백세시대,,"대한노인회 전남 여수시지회, 노인자원 봉사 활성화 지원사업 교육",,,http://www.100ssd.co.kr/news/articleView.html?idxno=102708,http://www.klnews.co.kr
2023.09.21.,인천일보,,"안산시 자원봉사센터, 단원구 노인복지관과 함께 송편·전 나눔 행사",,,https://www.incheonilbo.com/news/articleView.html?idxno=1212963,http://www.100ssd.co.kr
2023.09.28.,대한경제,,대한노인회 동구지회 우필순 사무국장 대통령표창 수상,,,https://www.dnews.co.kr/uhtml/view.jsp?idxno=202309281006030870666,http://news.itimes.co.kr
2023.09.24.,비즈트리뷴,,"[2023 한가위] KB국민카드, '취약노인 마음잇기' 봉사 활동 실시",,,http://www.biztribune.co.kr/news/articleView.html?idxno=292645,http://www.biztribune.co.kr/
2023.09.28.,대한경제,,대한노인회 동구지회 우필순 사무국장 대통령표창 수상,,,https://www.dnews.co.kr/uhtml/view.jsp?idxno=202309281006030870666,http://www.cnews.co.kr
2023.09.21.,대학저널,,"건양사이버대, 새로운 자원봉사 패러다임 설계",,,https://dhnews.co.kr/news/view/1065578912994693,http://www.dhnews.co.kr/
2023.09.23.,천지일보,,창원특례시 추석 봉사활동,,,https://www.newscj.com/news/articleView.html?idxno=3066218,http://www.newscj.com
2023.09.25.,뉴스워커,,"장성군, 지역봉사지도원 위촉 및 '나라꽃 무궁화 그리기대회' 개최",,,http://www.newsworker.co.kr/news/articleView.html?idxno=222543,http://www.newsworker.co.kr
2023.09.26.,뉴스핌,,"동양생명, 추석 맞이 돌봄 어르신 봉사활동",,,http://www.newspim.com/news/view/20230926000202,http://www.newspim.com
2023.09.17.,충청일보,,"가스안전公, 증평군 노인복지관서 무료급식 봉사",,,https://www.ccdailynews.com/news/articleView.html?idxno=2228715,http://ccdailynews.com
2023.09.26.,대구일보,,"군위군 소보면 후원회, 독거노인가정 청소 봉사활동",,,http://www.idaegu.com/newsView/idg202309260085,http://www.idaegu.com
31면 1단,국민일보,,"대한항공, 노인복지관 찾아 추석 맞이 음식 나눔 봉사",,,https://news.kmib.co.kr/article/view.asp?arcid=0924322913&code=11151400&cp=nv,http://www.kmib.co.kr/
2023-09-26 04:04:22,베리타스알파,경제,동명대 사회복지학과-부산시서부노인보호전문기관 관련 노인 학대 예방/봉사단...,"[     대한항공은 서울 강서구 강서노인종합복지관에서 ‘명절 음식 한상 나눔’ 봉사활동을 진행했다고 25일 밝혔다. 추석을 맞아 진행된 이번 봉사활동에는 대한항공 사회봉사단원 등 직원 30명과 대한항공씨앤디서비스 소속 직원 10명이 참석했다. 이들은 현장에서 불고기와 삼색전, 소고기 잡채 등을 요리해 어르신 50명에게 대접했다. 식사를 마친 뒤에는 찹쌀떡과 약과 식혜 등 간식 선물을 증정했다. 대한항공은 매년 추석과 설을 앞두고 이웃들이 따뜻한 명절을 보낼 수 있도록 지원하고 있다.   ]",[],http://www.veritas-a.com/news/articleView.html?idxno=475086,https://n.news.naver.com/mnews/article/005/0001640791?sid=101
2023.09.26.,뉴시스,,"[거창소식] 농협 거창군지부, 삶의 쉼터 무료급식 봉사·기부금 전달 등",,,http://www.newsis.com/view/?id=NISX20230926_0002465278&cID=10812&pID=10800,http://www.newsis.com
2023-09-26 14:51:04,뉴스1,사회,"한국타이어, 금산·대전공장서 ‘정 담은 송편 나눔’ 봉사활동","[     [거창=뉴시스] 거창군지부 *재판매 및 DB 금지 *재판매 및 DB 금지[거창=뉴시스]서희원 기자 = 농협 경남 거창군지부(지부장 이태용)는 26일 노인·여성·장애인 통합복지관 거창군 삶의 쉼터에서 지역사회 나눔활동을 위한 기부금 전달과 무료급식 봉사활동 펼쳤다.   거창군지부는 추석명절을 앞두고 무료급식 봉사활동을 통해 이웃들에게 나눔과 사랑을 실천하는 등 지역사회에 꾸준히 관심을 가지고 다양한 나눔활동을 이어나가고 있다.◇ 용목 ㈜바우1 대표, 거창군에 고향사랑기부 최고액 동참    [거창=뉴시스] 거창군청 *재판매 및 DB 금지 *재판매 및 DB 금지경남 거창군은 지난 25일 군수실에서 우용목 ㈜바우1 대표가 고향사랑기부제 기부 최고 금액인 500만원을 기부하고, 답례품으로 제공받은 거창하데이쌀(150만원 상당)을 가조면에 재기부해 훈훈함을 더했다고 26일 밝혔다.우용목 대표는 가조면에 에제르 아파트를 건설 후 현재 분양 중에 있으며, ‘평소 편안하고 살기좋은 집’이라는 주거 공간의 본질에 대한 메시지로 브랜드 신뢰감을 구축하고 있는 주택건설 분야의 내실 있는 사업체를 운영하는 사업가다.또 평소 ‘가치2(같이 together, 새로운 가치 value)를 만들자’라는 소신으로 기업에서 얻은 이익을 사회에 환원하고 있으며, 지역사회와 나눔을 실천하고 기업의 사회적 책임을 다하겠다는 신념으로 사회공헌 활동도 활발히 펼치고 있다. ]",[],https://www.news1.kr/articles/5180188,https://n.news.naver.com/mnews/article/003/0012115102?sid=102
2023.09.25.,전라일보,,"장수군노인장애인복지관, '우수 노인자원봉사단' 문화탐방 실시",,,http://www.jeollailbo.com/news/articleView.html?idxno=706345,http://news1.kr/
2023-09-22 11:35:49,기호일보,사회,"안양시 가정방문봉사단, 저소득 노인에 백미 500포 기탁","[ 행정복지센터 통해 독거노인 등 소외계층에 전달    추석맞이 ‘정(情) 담은 송편 나눔’ 봉사활동에 참가한 한국타이어 임직원들이 단체사진을 찍고 있다. (한국타이어 제공) /뉴스1(대전=뉴스1) 송원섭 기자 = 한국타이어앤테크놀로지(한국타이어)가 지난 20~21일 충남 금산공장과 대전공장에서 ‘정(情) 담은 송편 나눔’ 봉사활동을 벌였다.한국타이어 임직원들은 정성스럽게 빚은 송편을 각 공장이 위치한 지역의 행정복지센터에 맡겼고, 독거노인 등 소외계층 가정에 전달됐다.정성호 한국타이어 안전생산기술본부장은 “민족 최대 명절인 추석이 지역의 독거노인 등 소외계층에게도 풍성하고 즐거운 시간이 되길 바란다”며 “앞으로도 지역사회에 실질적인 도움을 주고 동반성장을 할 수 있는 다양한 활동을 펴나가겠다”고 말했다.한편 한국타이어는 사회복지시설 일손돕기, 자연재해 피해지역 복구, 벽화 그리기, 소외계층 주거환경 개선을 위한 도배 및 장판․LED 전등 교체 등 다양한 참여형 사회공헌 프로그램을 진행하고 있다.   ]",[],http://www.kihoilbo.co.kr/news/articleView.html?idxno=1050483,https://n.news.naver.com/mnews/article/421/0007067848?sid=102
2023.09.25.,한국정경신문,,"""지역사회 전폭적 지원 계속""..광양제철소, 추석맞이 대규모 연합봉사",,,http://kpenews.com/View.aspx?No=2956445,http://www.jeollailbo.com
2023.09.24.,한국경제,,"BNK경남은행, 대규모 지역사회 봉사활동으로 '심기일전'",,,https://www.hankyung.com/article/202309242922h,http://www.kihoilbo.co.kr/
2023.09.26.,글로벌경제,,"인천국제공항보안, 해송노인요양원 찾아 봉사활동 진행",,,http://www.getnews.co.kr/news/articleView.html?idxno=642975,http://www.kpenews.com
2023.09.19.,전북일보,,"한전 남전주지사, 추석 맞이 사랑 나눔 선샤인 봉사",,,https://www.jjan.kr/article/20230919580235,http://www.hankyung.com/
2023-09-24 09:10:01,동양일보,사회,"생극면 지역사회보장협의체, 독거노인 위한 청소 봉사","[     BNK경남은행은 23일 추석을 앞두고 '한가위맞이 자원봉사 활동'을 전개했다.거액의 횡령 사고로 어수선한 BNK경남은행이 임직원 봉사활동으로 지역사회에 송구한 마음을 전했다.BNK경남은행은 23일 추석을 앞두고 ‘한가위맞이 자원봉사’를 진행했다. 봉사활동과 수산물 소비 활성화 캠페인을 동시에 진행한 것으로 임직원 500여명 참여해 지역 전통시장과 복지시설, 산·하천 등 지역 곳곳에서 구슬땀을 흘렸다.이번 봉사활동은 지역민과 지역사회로부터 받은 사랑과 성원에 보답하기 위해 임직원들이 자발적으로 참여하는 봉사활동과 함께 지역 전통시장과 수산업을 응원하기 위한 캠페인으로 진행됐다.마산 어시장을 포함한 지역 전통시장과 복지시설 그리고 산·하천 등 지역 곳곳에서 전개된 한가위맞이 자원봉사 대축제에는 예경탁 은행장과 임직원 총 500여명이 참여했다.임직원 100여명은 합포수변공원에서부터 마산어시장·창동·오동동 일원을 나눠 걸으며 거리에 떨어진 오물과 쓰레기를 수거했다. 특히 지역민들이 많이 찾는 마산 어시장 공영주차장 전 층을 청소하며 구슬땀을 흘렸다. 이후 전통시장온누리상품권을 이용해 수산물을 구입한 임직원들은 시장 상인들에게 응원의 메시지를 전하고 어시장 내 횟집에서 함께 식사를 했다.본부 부서 임직원 100여명은 팔용산 등산로에서 환경정화 활동을 했다. 경남노인통합지원센터, 마산애육원, 창원성심양로원을 나눠 방문해 시설 내외부 청소, 도우미 역할 등 돌봄활동도 전개했다.또 ▲창원 정병산·봉곡시장, 창원천·반송시장, 창원중앙동·용지동 상가지역 ▲울산 태화강국가정원·신정시장 ▲김해 해반천·내외동시장, 율하천·장유전통시장 ▲진주 비봉산·자유시장 ▲수도권 안산자락길·영천시장에서 각 영업본부별 임직원 300여명이 참여해 환경정화활동을 펼쳤다. 이번 전방위 봉사활동은 추석을 앞두고 해마다 진행해 온 사회공헌활동에 더해 다른 의미도 담았다. 대규모 횡령사고 이후 고객과 지역민에 대해 송구한 마음을 전하고, 급격하게 위축돼 있는 직원들과 다시 심기일전하자는 분위기 쇄신의 메시지도 공유했다.예경탁 은행장은 “최근 불미스러운 일로 BNK경남은행을 아끼고 사랑해 주시는 지역민들께 심려를 끼쳐드려 송구스러운 마음”이라며 “사고 수습에 총력을 다해 BNK경남은행을 믿고 기다려주시는 지역민들의 기대에 부응해 새로운 모습으로 거듭날 것이며, 지역을 위한 역할 수행에도 최선을 다하겠다”고 말했다. BNK경남은행은 한가위맞이 자원봉사활동과 별도로 추석 전까지 경상남도 시·군과 울산지역 소외계층 총 8320가구에 4억1600만원 상당의 전통시장 상품권과 지역사랑 상품권을 전달하는 ‘추석맞이 사랑나눔사업’도 전개하고 있다. 창원=김해연 기자   ]",[],http://www.dynews.co.kr/news/articleView.html?idxno=722617,https://n.news.naver.com/mnews/article/015/0004895509?sid=102
2023.09.25.,부산일보,,"기업은행, ‘찾아가는 재능나눔’ 이·미용 봉사 실시",,,https://www.busan.com/view/busan/view.php?code=2023092516423576071,http://www.getnews.co.kr
2023.09.25.,대한경제,,"대한항공, 추석 맞아 어르신들께 명절 음식 나눔 봉사",,,https://www.dnews.co.kr/uhtml/view.jsp?idxno=202309251016178770541,http://www.cnews.co.kr
2023.09.25.,중부일보,,"대한적십자 이천 하나로봉사회, 창전동 독거노인가구 집수리 봉사",,,http://www.joongboo.com/news/articleView.html?idxno=363613039,http://www.joongboo.com
2023.09.25.,CNB뉴스,,대한노인회 인제군지회 늘푸른봉사단 봉사활동,,,https://www.cnbnews.com/news/article.html?no=621496,http://www.cnbnews.com
2023.09.27.,세계일보,,"정미정 도계노인복지관 관장, 삼척시민상 대상 수상",,,http://www.segye.com/newsView/20230927506684?OutUrl=naver,http://www.segye.com
2023-09-27 09:29:01,새전북신문,사회,"장수군노인장애인복지관, 개관 10주년 기념 문화탐방","[    삼척시는 제29회 삼척시민상 대상에 정미정 삼척시도계노인복지관 관장을 선정했다고 27일 밝혔다.     정 관장은 지난 2007년 도계읍에 거주하는 여성으로 구성된 봉사 모임 ‘해피맘’을 결성하고 694시간 봉사활동을 통해 나눔 문화 확산에 기여한 공을 인정받았다. 또 자신이 보유한 공예 기술을 바탕으로 180회에 걸쳐 재능기부 봉사에 나선 점을 높게 평가받았다.            정미정 삼척시도계노인복지관장. 삼척시 제공    정 관장은 삼척시 수어통역센터 한국수어통역사로 근무하면서 지역 내 870여 청각·언어 장애인의 소통권 보장을 위해 연간 2330회에 걸쳐 수어 통역과 상담을 성실히 수행하기도 했다.     지난해 12월에는 노인들의 영양 균형과 정서적 안정을 목적으로 ‘장수 밥차’를 도입해 매달 식사 지원을 하고 있으며, 도계노인복지관 관장으로서 복지증진 협력 네트워크 구축에 노력한 점도 공적으로 인정받았다.     시상식은 오는 10월 13일 열리는 제29회 삼척시민의 날 행사에서 진행될 예정이다. ]",[],http://sjbnews.com/news/news.php?number=793676,https://n.news.naver.com/mnews/article/022/0003859700?sid=102
2023.09.27.,한국정경신문,,"미래에셋생명, 마포종합노인복지관서 추석맞이 봉사활동 진행",,,http://kpenews.com/View.aspx?No=2959953,http://www.sjbnews.com/
23면 3단,전자신문,,"LG유플러스, 청파노인복지관에 수해지역 농산물 기부",,,https://www.etnews.com/20230922000185,http://www.kpenews.com
2023.09.16.,KBS,,범인 검거부터 노인 돌봄까지…동네 지키는 자전거순찰대,,,https://news.kbs.co.kr/news/view.do?ncd=7775316&ref=A,http://www.etnews.com
2023-09-22 14:41:01,더페어,IT/과학,"KB국민카드,추석맞아 취약노인층에 '마음잇기 봉사활동' 실시","[     (왼쪽부터) 이홍렬 LG유플러스 ESG추진실 실장, 김갑록 청파노인복지관 관장, 이경직 용산복지재단 사무국장이 '수해지역 농산물 전달식'을 진행하는 모습.LG유플러스가 다가오는 추석을 맞이해 서울 용산구 소재 청파노인복지관에 수해지역 농산물을 기부했다고 22일 밝혔다.LG유플러스는 용산복지재단과 수해지역의 농산물 소비 촉진에 적극 동참하기 위해 이번 기부를 추진했다. 용산복지재단은 LG유플러스 기부금을 활용해 수해지역인 충남·충북·경북 농협에서 농산물을 구매한 후, 청파노인복지관에 전달했다.청파노인복지관은 용산구로부터 위탁 받아 운영하고 있는 지역밀착형 노인복지관으로, 경로식당에서 무료 급식을 지원하고 있다.LG유플러스가 전달한 수해지역 농산물은 쌀, 현미찹쌀, 일반현미 14포대와 복숭아 35박스이며, 추가적으로 200kg 상당의 한우 국거리, 한우불고기, 돼지고기도 전달했다.한편, LG유플러스는 청파노인복지관을 비롯 8월부터 용산구 관내에서 무료급식 봉사를 실시 중인 사회복지시설 9곳에 수해지역 농산물을 기부했다. ]",[],https://www.thefairnews.co.kr/news/articleView.html?idxno=15108,https://n.news.naver.com/mnews/article/030/0003139036?sid=105
2023.09.28.,CEO스코어데일리,,"신한·KB국민·우리카드, 추석 맞이 봉사활동 전개",,,https://www.ceoscoredaily.com/page/view/2023092618203776686,http://news.kbs.co.kr/
2023.09.24.,더페어,,"KB국민카드,추석맞아 취약노인층에 '마음잇기 봉사활동' 실시",,,https://www.thefairnews.co.kr/news/articleView.html?idxno=15108,http://www.thefairnews.co.kr/
2023.09.28.,CEO스코어데일리,,"신한·KB국민·우리카드, 추석 맞이 봉사활동 전개",,,https://www.ceoscoredaily.com/page/view/2023092618203776686,http://www.ceoscoredaily.com
2023.09.25.,세정신문,,"국세동우회 자원봉사단, '생활 속 세금교실'…""택스검진 받자""",,,http://www.taxtimes.co.kr/news/article.html?no=261344,http://www.taxtimes.co.kr/
2023.09.20.,한국일보언론사 선정,,바닥 냉골에 쥐 들끓는 방에서 방치된 치매 독거노인,,,https://www.hankookilbo.com/News/Read/A2023091516220004047?did=NA,http://www.hankookilbo.com/
