Date,Press,Category,Title,Content,Comment,URL_Origin,URL_Naver
2023-03-05 12:46:01,뉴시스,사회,"나주시, 홀몸노인 따뜻한 겨울나기…난방비 2차 지원","[ 15년 함께 산 동거인 숨지고 주거불안 시달려관리비 9개월 체납했지만 기관에 전달 안 돼중앙위기 발굴대상 명단 등에도 이름 없어“‘명예 사복사’ 민관 협력시스템 고려해야”[이데일리 이재은 기자] 서울 마포구 한 오피스텔에서 분신해 전신에 2도 화상을 입고 치료 중이던 80대 노인이 결국 숨졌다.     (사진=마포소방서)5일 경찰과 소방당국에 따르면 지난달 28일 서울 마포구 도화동의 한 오피스텔에서 분신한 김모(83)씨는 지난 2일 숨졌다. 이 오피스텔은 김씨와 15년간 동거했던 B씨 가족의 소유였으며 김씨는 지난해 4월 B씨가 사망한 뒤 주거 불안과 생활고에 시달린 것으로 전해졌다. 실제로 김씨는 지난해 7월부터 9개월 동안 오피스텔 관리비를 체납한 것으로 파악됐다. 그러나 정부와 지방자치단체는 김씨의 열악한 상황을 인지하지 못한 것으로 드러났다. 주민센터 관계자는 “어르신께서 기초생활수급을 신청하지 않았고 보건복지부에서 내려보내는 사각지대 취약계층 명단에도 포함되지 않아 주민센터에서도 상황을 알지 못했다”고 말했다. 정부는 복지 사각지대를 살피기 위해 단전·단수, 건강보험료 체납(3개월 이상), 기초생활수급 탈락·중지, 공동주택 관리비 체납 등 39종의 위기 정보를 수집한다. 그러나 김씨가 거주했던 오피스텔과 같은 주거 형태는 아파트, 빌라 등의 공동주택에 포함되지 않아 체납 사실이 관련 기관에 전달되지 않았다. 김씨는 고위험 취약계층에 해당하는 ‘중앙위기 발굴대상’ 명단은 물론 위기 정보가 하나라도 해당하면 등록되는 ‘전체 위기정보 입수자 명단’에도 포함되지 않았다. 그는 지난해 9월 주민센터에 전입신고를 하고 기초생활수급 신청 안내를 받는 등 노력도 했지만 복지 사각지대에서 벗어나지 못했다. 이에 대해 정익중 이화여대 사화복지학과 교수는 “위험정보는 공공에서 감당할 수 있는 수준에서 정한 것으로 그 정보가 전부는 아니다”라며 “더 많은 위험신호를 가진 사람이 있다는 것을 잊으면 안 된다”고 말했다.그러면서 “수집하는 개인정보를 무한정 늘릴 수 없고 공무원 인력 확충에도 한계가 있는 만큼 ‘명예 사회복지사’ 제도 등을 활용해 민간도 취약계층을 발굴할 수 있는 민관 협력시스템을 고려해야 한다”고 주장했다. ]","['', '복지사각 지대가 너무많다!  복지과  분들 일 안하세요?', '우리가 지금 남의 나라 신경 쓸 때냐? 아프리카 애들은 원래도 없이 살았어 걔들 도와줄 때가 아니라 저런 분들 도와줘야 할 때야', '은행원 퇴직금 6억이 부럽다.그럼 나는 뭐냐.  유공자 연금 평생 타먹고 사는 사람도 있다.그럼 나는 뭐냐.\n우리사회는 상대적 박탈감 때문에 힘들어하고 가혹하게 느낀 사람많다.불평등이 해소 되어야 시집장가도 가고 애도 낳는다.', '여태껏 하고있는 내용을 교수가 모를리만무한데 원론적인 말만하네요\n답은 한가지임 본인스스로가 찾아가서 도와달라고해야 함 자존심다 접고', '그린피스,유니세프,긋네이버스 이딴데 쓸데없이 돈보내지마라 우리국인이나 도와라', '아프리카 아동 돕기 모금을 비싼 tv광고까지 \n하지말고 독거노인 돌아봐라', '복지패밀리가 복지금을 쥐락펴락하면서 진짜 어려운 사람들은 복지에서 멀어지고 세금도둑들만 판친다 가짜장애인 가짜수급자가득실거리고 법을 모르는 저소득 계층은 복지사각 지대로 밀려난다 움직이지 않고 찾아오는 사람들에게만 혜택이 돌아간다면 이런 일은 계속 늘어날 것이다 부정수급을 줄이기 위해서는현장 조사를 늘려야한다', '자리에만 앉아서 기다리지말고 관심가지고 관할지역 돌아다니세요 동마다 주민센터가 있어서 자기 관할만 \n 조금만이라도 관심좀 가지면 얼마나 좋을까요? 못오시는 분들은 잘 모르기도 할겁니다. 그리고 찾아가도 거부당해서 자살한사람들도 있던데 뭐가 그리도 복잡한지... 나이할거없이 환경때문에 이런 행정절차 진짜 모르는분들 많으세요 매번 같은기사 나오는데 안타깝네요', '수급자 거리는 시스템 인건비가 더 든다. 그냥 일괄 지급해라. 자식들이 돌보지 않는 노인이 더 많다.', '수급자  걸러낸다고 조잡한   선택적 시스템   하지말고  그  시스템 공무원 인력낭비  다  나라세긍이다,그냥 보편적지급해라.\n머리가 얼마나 나쁝ㄱ.\n   저것들 띵 치는것들이   돈  안줄라고 머리 쓰는것봄 징글하다,윗대가리들', '안락사가 필요한 이유', '', '', '동거인 소유 오피스텔\n실제 배우자?\n뭔가 복잡한 사연이 있네', '', '', '안타깝다   욕은 하는게 아니고  분신했어  이프게 왜죽냐  수면제  먹고    자다가  조옹히  가면 되는데  암튼 이런일  없쓰면 좋겠다', '', '', '주둥이로 민생 떠들던 민주당은 뭐했나?', '83살리면서  무슨 분신을 하냐 살날도 그냥 잇어도 얼마 안 남앗는데 그냥 살지', '독거노인 죽어가는데 여가부 못하냐?  아직도 대통령 공약 여가부 폐지도 않하고 있냐.  그러니 이런 독거 고독사 사태가 계속 발생 되는것임', '이찍이의 삶 ~~   인생무상', '', '돌쇠를 죽으면서까지 대통 만들어 줫는데ᆢ 제일 먼저 한일이라고는 노령연금 삭갑하고 노인일자리 줄이고 참 잘하는  짓이다 ㅡㅡ 2번 찍은 인간들아 니들이 이렇게 만들었다고 생각은 안하니', '', '윤재앙']",http://www.newsis.com/view/?id=NISX20230306_0002215230&cID=10809&pID=10800,https://n.news.naver.com/mnews/article/018/0005436349?sid=102
2023.03.16.,미디어펜,,"부산시, 노인 등 '부산형 통합돌봄' 16개 구·군 확대 추진",,,http://www.mediapen.com/news/view/801380,http://www.newsis.com
2023-03-06 11:33:49,시사포커스,사회,"완도군, 맞춤형 노인 복지 실현 돋보여...총 41억 원 투입","[ 기사내용 요약저소득층 홀몸 노인 2100명 대상…4억2000만원 투입지난 1월 이어 가구당 20만원씩 긴급지원    나주시청   *재판매 및 DB 금지[나주=뉴시스] 이창우 기자 = 전남 나주시는 저소득층 홀몸 노인의 따뜻한 겨울나기를 위해 지난 1월에 이어 난방비 4억2000만원을 추가로 지원한다고 6일 밝혔다. 이번 2차 난방비 긴급 지원은 고유가로 난방에 어려움을 겪고 있는 취약계층의 생활 안정에 보탬이 될 것으로 기대된다. 만65세 이상 홀몸 노인 중 기초생활수급자·차상위계층에 속한 2100명에게 가구당 20만원을 지원한다. 나주시는 앞서 지난 1월 겨울철 한파에 대비해 노인맞춤돌봄대상자 2205가구, 저소득 한부모가족 491가구에 가구당 20만원씩 총 5억3900만원의 난방비를 긴급 지원했다. 2차 난방비 지원 신청은 오는 16일까지이며, 대상자 본인과 가족(보호자)이 주민등록상 거주지 읍·면·동 행정복지센터에 접수하면 된다. 윤병태 나주시장은 ""2차 난방비 지원이 늦겨울 추위로 생활에 어려움을 겪는 저소득층의 생계 부담을 덜어줄 수 있길 바란다""며 ""앞으로도 복지사각지대 발굴과 적기 지원을 통해 모두가 더 안전하고 행복한 복지공동체 도시를 구현하는데 최선을 다하겠다""고 말했다. ]",[''],http://www.sisafocus.co.kr/news/articleView.html?idxno=293691,https://n.news.naver.com/mnews/article/003/0011724548?sid=102
2023.03.14.,열린뉴스통신,,"충북도, 노인학대 예방·신고 활성화 위한 홍보 나선다",,,https://www.onews.tv/news/articleView.html?idxno=157843,http://www.mediapen.com
2023.03.21.,재외동포신문,,"대한노인회 캄보디아지회, 장학사업 시작",,,http://www.dongponews.net/news/articleView.html?idxno=47289,http://www.sisafocus.co.kr
2023.03.23.,포인트데일리,,"완도군, 노인 맞춤 돌봄 서비스 사업 추진",,,https://www.thekpm.com/news/articleView.html?idxno=150119,http://www.onews.tv
2023.03.07.,시민일보,,"장흥군, 치매전담 노인요양시설 착공",,,https://www.siminilbo.co.kr/news/newsview.php?ncode=1160289653985956,http://www.dongponews.net/
2023.03.23.,로봇신문,,"세콤-DeNA, 노인들을 위한 로봇 커뮤니케이션 서비스 '아노네' 개발",,,http://www.irobotnews.com/news/articleView.html?idxno=31146,http://www.thekpm.com/
2023.03.04.,MBN언론사 선정,,새벽 고속도로 7㎞ 역주행 70대 운전자 가족 품으로,,,http://mbn.mk.co.kr/pages/news/newsView.php?category=mbn00009&news_seq_no=4909059,http://www.siminilbo.co.kr
2023.03.14.,불교공뉴스,,"충북도, 노인학대 예방 홍보를 위한 업무협약 실시",,,http://www.bzeronews.com/news/articleView.html?idxno=549373,http://www.bzeronews.com
2023.03.23.,로봇신문,,"세콤-DeNA, 노인들을 위한 로봇 커뮤니케이션 서비스 '아노네' 개발",,,http://www.irobotnews.com/news/articleView.html?idxno=31146,http://www.irobotnews.com
2023.03.04.,MBN언론사 선정,,새벽 고속도로 7㎞ 역주행 70대 운전자 가족 품으로,,,http://mbn.mk.co.kr/pages/news/newsView.php?category=mbn00009&news_seq_no=4909059,http://www.mbn.co.kr
2023-03-04 14:26:09,여성경제신문,사회,[NO老케어] ② 노인 학대 오명 쓴 요양원···노노케어의 그늘,"[ 경부고속도로 부산 방향서 갑자기 유턴한 뒤 역주행다행히 사고 없어 부상자 발생 안 해    역주행하고 있는 차량의 모습. 맞은편에서 화물차가 달려오고 있다. / 사진 = 경북경찰청 교통과 고속도로순찰대 제공새벽 고속도로에서 역주행하던 70대 치매 노인이 경찰 조치로 무사히 가족에게 보내졌습니다.3일 경북경찰청 고속도로순찰대에 따르면, 이날 오전 2시 5분쯤 경부고속도로 부산 방향 140㎞ 지점에서 차량 한 대가 역주행하고 있다는 신고가 접수됐습니다.이 차량은 남구미IC를 통해 경부고속도로에 진입해 부산 방향으로 이동하던 중 북대구 IC 인근에서 갑자기 유턴했습니다. 그리고 7㎞가량 북쪽을 향해 역주행 했습니다.공개된 폐쇄회로(CC)TV 영상에는 문제의 차량이 비상등을 켠 채 1차로를 거꾸로 달리고 있고, 차량 맞은편으로 화물 트럭 등이 달려오는 아찔한 모습이 담겼습니다. 신고를 받고 출동한 경찰은 지그재그로 운행하며 뒤따르는 자동차의 속도를 줄이는 이른바 '트래픽 브레이크' 기법을 통해 역주행 차량을 갓길로 유도했습니다.조사 결과, 운전자는 70대였으며 조수석에는 70대 부인도 함께 타고 있었습니다.경찰 관계자는 ""이들 부부가 치매 증상을 보여 (현장)조사가 불가능했다""면서 ""왜 유턴을 해서 역주행 했는지 정확한 사건 경위를 조사하고 있다""고 전했습니다. ]","['면허뺏고 보험도 말고시켜라 아직도 치매노인이 운전대잡고잇너', '면허반납하세요! 어제 죽을꺼 10년 더 산다생각하시고...', '치매환자가  운전??', '침해 환자는 등급 구분없이  의무적으로  면허증 말소 해야함  당장해  국회 말싸움질이나  하지들말고', '말조심하자 우리 어머니 아버지 일수도...곧 그런 상황이 닥칠수 있다...머지 않아 현실이 된다...무사하셔서들 다행입니다 운전은 하지 마시길 바랍니다', '치매환자가 운전대 잡는건 칼들고 사람들사이로 뛰어드는거랑 똑같은거아닌가 혼자죽으면모를까 대형참사일어날수도있는건데', '', '아마도 부부가  순간적으로 극단적 선택을 한 것 같은데 다른 사람 피해는 생각 해서라도 안됩니다', '65세 이상 되면 매년 검사해라 저거 다 살인 미수지 뭐냐', '진짜 무책임하다', '면허증반납하고 편히 사셔요 어르신들', 'ㅋㅋㅋ 운좋았노', '가족품으로?', '']",https://www.womaneconomy.co.kr/news/articleView.html?idxno=215969,https://n.news.naver.com/mnews/article/057/0001726434?sid=102
2023.03.21.,불교공뉴스,,"횡성군, 노인일자리 및 사회활동지원사업 참여자 교육 실시",,,http://www.bzeronews.com/news/articleView.html?idxno=550218,http://www.womaneconomy.co.kr/
A12면 1단,경향신문,,"인천시, 연이은 독거노인 사망에 “하루 한 번 AI 돌봄 전화”",,,https://www.khan.co.kr/local/Incheon/article/202303142127005,http://www.bzeronews.com
2023.03.22.,오늘경제,,"광주 동구, 광주재가노인복지협회 등 9개 서비스 제공기관과 협약",,,http://www.startuptoday.co.kr/news/articleView.html?idxno=125586,http://www.khan.co.kr/
2023-03-14 21:30:01,충청매일,사회,"충북 충주시노인복지관, '우당탕탕 해방육아' 참여자 모집","[ 고독사 위험군 3만여명 추정케어콜 등 복지 서비스 확대최근 인천 남동구에서 홀로 사는 취약계층이 잇따라 숨지자 인천시가 고독사 예방을 위한 돌봄 관리를 강화하기로 했다.인천시는 지역 내 고독사가 2017년 180명, 2019년 206명, 2021년 256명 등 매년 증가하고 있다고 14일 밝혔다. ‘고독사’는 가족·사회와 단절된 채 홀로 사는 사람이 자살·병사 등으로 숨진 뒤 일정 시간(3일)이 흐른 뒤 발견되는 죽음을 말한다. 인천시는 은둔형 외톨이들의 고독사가 늘어나는 것은 1인 가구가 증가하고 있기 때문이라고 밝혔다. 2021년 인천지역 118만3610가구 중 1인 가구는 30%인 35만5657가구이다.인천시는 지난해 12월 제정된 ‘고독사 예방 및 관리에 관한 조례’에 따라 말벗과 재가 돌봄서비스, 안부 확인, 밑반찬 지원 등 다양한 사업을 펼치고 있다. 고독사 위험군 2000가구에 돌봄 플러그를 설치, 전열기기 작동 여부로 이상징후를 알아본 뒤 이상이 있으면 방문해 안부를 확인하고 있다. 또 인공지능(AI)과 사물인터넷(loT) 등을 활용해 65세 이상 5000가구에 AI가 전화를 거는 ‘AI케어콜 돌봄서비스’도 시행하고 있다.인천시는 올해부터 AI케어콜 돌봄서비스를 50~60대 중장년층까지 늘리고, 안부 전화를 주 1회에서 주 7회로 늘릴 예정이다. 또한 지역사회보장협의체를 활용해 대상자를 추가 발굴하고, 돌봄 활동가들이 이웃의 어려움과 홀로 사는 사람들을 찾아가는 이웃지기 사업 등도 펼칠 예정이다. 특히 이달 말쯤 보건복지부의 실태조사와 세부 추진사항이 발표되면 이에 맞춰 고독사 예방 정책과 사업 발굴에 나설 계획이다.   ]",[],http://www.ccdn.co.kr/news/articleView.html?idxno=905013,https://n.news.naver.com/mnews/article/032/0003210860?sid=102
2023.03.20.,신아일보,,"경주시치매안심센터, 노인종합복지관 이용 치매 조기검진 홍보 캠페인",,,http://www.shinailbo.co.kr/news/articleView.html?idxno=1676464,http://www.startuptoday.co.kr/
2023.03.14.,디트뉴스24,,"대전 서구 월평2동, 봄맞이 독거노인 가구 주거환경정비",,,http://www.dtnews24.com/news/articleView.html?idxno=741919,http://www.ccdn.co.kr
2023.03.09.,아이뉴스24언론사 선정,,'경찰서 찾아갔지만'…보이스피싱으로 수천만원 날린 노인,,,http://www.inews24.com/view/1574204,http://www.inews24.com/
2023-03-09 21:04:01,MTN,사회,"속초시, 여성가족부와 여성친화도시 조성 협약 체결","[ 경찰 ""적절한 대처했다""경찰의 미흡한 대처로 인해 60대 노인이 2천만원이 넘는 보이스피싱을 당했다는 주장이 제기됐다. 하지만 경찰 측은 적절한 대처를 했다는 입장이다.9일 경찰에 따르면, 60대의 김모씨는 지난 7일 오후 2시께 자신을 A투자회사 직원으로 소개한 B씨로부터 전화를 받았다. 당시 B씨는 김씨에게 A사로부터 주식 종목을 추천받아 투자했다가 손해를 보지 않았느냐며 손실분을 보상해주기 위해 연락했다고 말한 것으로 전해졌다.    60대 노인이 보이스피싱으로 수천만원을 날리는 사건이 발생했다. [사진=pixabay]B씨는 김씨에 현금 보상은 불가하니 가상화폐로 보상금을 주겠다면서 김씨의 통장과 신분증을 요구했다. 김씨는 실제로 A사에서 추천한 주식을 샀다가 손해를 봐 B씨의 제안을 의심하지 않았던 것으로 알려졌다.이후 김씨의 통장에 2천700만원이 입금됐지만, B씨는 비트코인으로 보상금을 줘야 하는데 현금으로 잘못줬다며 받은 현금을 다시 돌려달라고 요구했다. 그러면서 가족 등 주위 사람에게는 절대 이 사실을 말하지 말라고 주의를 준 것으로 전해졌다.하지만 이를 이상하게 여긴 김씨는 돈을 이체하기 전 인근 강서경찰서를 찾아 경찰관에게 문의하고 도움을 청했다. 김씨 측은 경찰이 '오히려 돈을 받았는데 무슨 걱정이냐. 알아서 하시라'는 취지로 말하고 김씨를 돌려보냈다고 전했다.이후 김씨는 은행으로 가 B씨에게 2천700만원을 송금했다. 하지만 이 돈은 B씨가 김씨의 통장과 신분증으로 제2금융권에서 대출받은 돈이었다. 이 돈은 무려 연 18.8%의 이자율의 대출금이다. 김씨는 본인 명의로 실행된 대출금을 보이스피싱 일당에게 고스란히 넘겨준 셈이다.이 사실을 알게 된 김씨와 가족은 그날 저녁 다시 경찰서를 찾아 정식으로 사건을 신고했다. 김씨 가족은 경찰이 좀 더 적극적으로 잘 대처했다면 김씨가 보이스피싱 피해를 막을 수 있었다고 주장했다.반면 경찰은 김씨에게 적절한 안내를 해줬다는 입장인 것으로 알려졌다.경찰 측은 김씨가 처음 방문했을 당시 경황이 없어서 조리 있게 설명을 잘 못 한 것 같다며 당시 김씨를 응대한 경찰관이 ""보이스피싱이 의심되면 통장에서 돈을 인출하면 안 된다""고 안내했다고 해명했다. 또한 정식 사건으로 접수된 만큼 수사 후 범인 검거와 피해 회복에 최선을 다할 것이란 입장을 전했다. ]","['진짜 답답하다. 절대 주변에 알리지 말라며 이체하라는거 보면 모르냐? 당하고 경찰탓하면 뭐하냐? 우리나라 국민은 뭐만 잘못되면 무조건 정부탓 나라탓으로 몰고가려는 아주 못된 습성이 있음. 자신의 무지를 탓해야지', '작정하고 덤비면 다 당합니다 당하고나면 어이없는거죠ᆢ\n의사도 교수도 다 당하더군요\nㅠ  ㅠ 저런 나쁜놈들은 사지가 찢겨죽어야해요', '경찰이 그래서 이체하라 그랬냐? 돈 들어왔는데 뭐가 문제라고 나도 그러겠다.ㅋㅋㅋㅋㅋ 아니 돈 돌려주겠다해서 돈 돌려준거고 그걸 어떻게하든 돈 받은 사람 판단이지. 경찰이 그 돈 다시 보내라고 했냐고?? 노인네가 쳐멍청한거까지 경찰이 처음부터 끝까지 케어할 순 없는거다.', '', '', '요즘 누가 누굴 믿겠냐? 걷는놈 위에 뛰는 놈이 있고 뛰는 놈위에 나는놈이 있고 나는 놈위에 초음속으로 사라지는 놈들 뿐인 세상이다. 의사가 수십억 보이스 피싱으로 날려먹는데.... 하여튼 내가 믿을껀 나뿐이다. 누가 누굴 믿겠나? 그냥 무시하는게 상책이다!', '경찰이 무슨 잘못인가 속은 사람이 문제지', '', '누굴 탓하랴 ㅋ 자신이 철저히 속은건데 ㅋ', '이 나라는 모든게 경찰탓 ㅋ', '묭츙묭츙', '', '강서경찰서 저것들 문제다 강서경찰서']",https://news.mtn.co.kr/news-detail/2023031614184775337,https://n.news.naver.com/mnews/article/031/0000733353?sid=102
2023.03.05.,디지털타임스언론사 선정,,"8개월 관리비 체납 독거노인, 분신 후 결국 사망…`구멍`난 복지망",,,http://www.dt.co.kr/contents.html?article_no=2023030502109919002001&ref=naver,http://mtn.mt.co.kr
2023.03.22.,시민일보,,평택시여성단체협의회 『다양한 가족 건강을 위한 우리집 전통장 담그기』 행...,,,https://www.siminilbo.co.kr/news/newsview.php?ncode=1160289104268895,http://www.dt.co.kr/
