Date,Press,Category,Title,Content,Comment,URL_Origin,URL_Naver
2023-03-26 08:32:01,스포츠투데이,사회,"'동백' 신준영, 파워리더대상 '신인감독상' 수상…여순사건 유족 위로","[ 24년 전 암 투병 주민 위해 개설, 이름 대 이어주변 정류장은 버스 뜸하고 승강장 시설 없어    강원도 태백시 삼수동에 있는 ‘권춘섭 집앞 정류장’에  있는 권춘섭씨. 이 정류장은 원래 그의 아버지인 권상철씨의 이름을 딴 ‘권상철 집앞 정류장’이었다. 권상철씨가 별세한 이후 아들인 권춘섭씨가 정류장 이름을 이어받았다.  송윤경 기자[주간경향] 강원도에는 우리나라에서 유일하게 주민의 이름을 딴 정류장이 있다. 태백시 삼수동의 ‘권춘섭 집앞 정류장’이 그것이다. 이 정류장이 생긴 배경엔 한국의 열악한 대중교통 사정과 가족 사랑이 담긴 사연이 있다.너른 들판 너머로 백두대간이 병풍처럼 펼쳐져 있는 태백시 삼수동의 외딴곳에 권상철·김복녀 부부가 배추, 감자, 옥수수 농사를 지으며 살고 있었다. 도보로 20분 거리에 초등학교와 식당이 있지만, 이웃은 찾기 힘든 곳이었다. 부부는 시내에 볼일이 있으면 버스를 타고 다녔지만, 제대로 된 버스정류장이 없었다. 버스가 지나가면 ‘태워달라’ 부탁해서 타고 다니는 형편이었다.부부는 열악한 사정 속에서도 2남1녀를 열심히 키웠다. 그러다 1999년 아내 김복녀씨가 자궁경부암 진단을 받았다. 그 무렵, 엎친 데 덮친 격으로 무릎 관절이 아파 오래 서 있기도 힘들어졌다. 대도시 종합병원에 다니기 위해선 태백시청 부근 터미널을 이용해야 했는데, 그러자면 매번 터미널까지 버스를 타야 했다. 몸이 아픈 김씨는 더는 예전처럼 도로에 서서 하염없이 버스를 기다릴 수 없었다.남편인 권상철씨는 아픈 아내를 위해 태백시청에 ‘정식 정류장’을 만들어달라는 민원을 꾸준히 제기했다. 이를 받아들인 시청이 운수업체를 설득해 정류장을 만들기로 했다. 인근에 별다른 시설이 없어 시청 측은 고민 끝에 ‘권상철 집앞 정류장’이라는 이름을 지었다. 지금으로부터 24년 전의 일이다.“정류장 생겼을 때 어머니가 너무 좋아하셨죠. 살아 계셨으면 올해 아흔세 살이셨을 겁니다. 암 투병을 하다 2010년에 돌아가셨어요. 아버지는 치매로 고생하다가 2007년에 돌아가셨고요.”지난 3월 17일 만난 권춘섭씨(71)가 정류장을 돌아보며 말했다. 권상철씨가 작고한 뒤 이 정류장은 그의 아들 이름을 따 ‘권춘섭 집앞 정류장’이 됐다. 어린 시절을 이곳에서 보내다 강릉에 나가 살던 권춘섭씨는 40대에 이곳으로 다시 돌아왔다고 한다. 함께 살던 아내는 당뇨합병증으로 투병하다가 얼마 전 세상을 떠났다. 지금은 홀로 배추농사를 짓는다.권씨는 자신의 자녀들도 “연어가 돌아오듯이” 이곳으로 돌아와 살길 바란다고 했다. “아들이 60세가 되면 들어올 거예요. 죽을 때 되면 고향 찾아와야 하잖아. 내가 죽으면 아들이 정류장 이름 이어받겠지. 가보야 가보.”‘권춘섭 집앞 정류장’은 한국의 이색 정류장으로 종종 방송을 탄다. 미디어에서 다뤄지는 ‘권춘섭 집앞 정류장’은 오지에 버스가 잘 다니지 않던 ‘옛날이야기’쯤 된다. 하지만 이 마을에서 교통 불편은 과거의 일이 아니다. 여전히 버스가 뜸한 까닭이다. 상사미마을로도 불리는 이 지역 사람들에게선 “시장 나갔다가 버스 시간이 안 맞으면 1~2시간을 기다릴 때도 많다. 버스가 부족해 답답하다”(정옥분씨·71)는 하소연이 나온다.    강원도 태백시 삼수동에 있는 ‘권춘섭 집앞 정류장’의 주인공 권춘섭씨와 동네 주민들이 마을회관에서 대화를 하고 있다.옛날이야기가 아니다 “우리 집 쪽이 마을 복판인데 승강장이 없어. 내가 (시청에) 얘기하면 건방지다고 할까봐…. 얘기 좀 해줘요.”“거기 맞은편에 공터 있으니까 시청이 사서 지으면 될 텐데….”“시내버스정류장은 아주 온실처럼 해놓고 촌은 등한시하는 거라고.”이날 마을회관에 들른 권춘섭씨에게 김순란씨(83)가 버스정류장이 없어 겪는 불편을 털어놨다. 옆에 있던 다른 노인들이 김씨의 얘기에 공감하며 말을 보탰다. 김씨가 말하는 장소엔 ‘상사미 창마을 승강장’이라는 표지판만 세워져 있을 뿐 승강장 시설이 없다. 무릎이 아픈 노인들에게는 이곳에서 버스를 기다리는 일이 고역이라고 했다. “비가 오나, 눈이 오나 지붕도 없는 곳에서 서 있으려면 정말 힘들어. 가끔 비바람이라도 세게 불면 우산까지 날아가.”(김씨)마을회관에 모인 6명의 노인 중 남성은 모두 운전자였고 여성은 모두 비운전자였다. 부부가 함께 농사를 짓더라도, 농기계를 몰고 관청 사무를 보는 일은 대개 남성이 맡았던 탓에 성별에 따라 운전 여부가 갈렸다.운전을 배워 여행이라도 떠나고 싶은 적은 없었는지 묻자, 정옥분씨(71)가 말했다. “어른 모시고, 자식 키우고, 일만 하느라 시간 다 보냈지. 좀 억울해.”산악지대인 강원에선 열악한 대중교통망에 발이 묶여 있는 여성 노인들의 현실이 더욱 고달프다. 강원도여성가족연구원의 최근 조사에 따르면 강원도에서 홀로 사는 여성 노인 5명 중 1명은 교통불편 때문에 1년간 병원진료를 미뤘다고 한다.(2022년 강원도 여성노인 1인가구의 생활실태조사). 암진단을 받은 여성이 버스 타기가 쉽지 않아 정식 정류장이 만들어졌다는 사연을 ‘그때 그 시절 이야기’로만 볼 수 없는 이유다.    강원도 태백시 삼수동에 있는 승강장. 표지판만 세워져 있을 뿐 앉아 있을 곳이 없다. 몸이 불편한 마을 노인들은 이곳에서 오래도록 서서 버스를 기다려야 한다. 송윤경 기자버스에 발목 잡힌 일상 이날 마을회관을 나온 권춘섭씨는 승용차를 타고 김씨가 말한 ‘상사미 창마을 승강장’에 들렀다. 휑한 대로변에 표지판만 세워져 있는 이곳 주변을 둘러보면서 승강장 시설을 설치할 만한 공터가 있는지 살폈다.사실 권씨는 승용차를 타고 다니기 때문에 버스 때문에 겪는 불편은 그리 크지 않은 편이다. 하지만 버스에 주로 의존할 수밖에 없는 동년배 여성 노인들의 호소가 남 일 같지 않다. 20여년 전 부모님이 겪었던 일이기 때문이다. 그는 ‘권춘섭 집앞 정류장’으로 돌아오면서 씁쓸한 듯 말했다. “자가용 끌고 다니는 사람들은 여그 노인들 사정을 몰라.”권춘섭 집앞 정류장이 그의 자녀, 손자·손녀에게 계승되는 훗날에는 버스 때문에 고달팠던 일상이 진짜 ‘옛날 얘기’가 될 수 있을까.   ]","['승강장 만들어주세요 어르신들 고생 덜하게!', '시골에 통나무 자르고 남은 것으로 1인용 둥근 의자와  나무자재로 벤치라도 만들어 노인들 앉아서 기다릴수 있도록 우선조치와 함께 승강장 마련해달라고 민원을 계속 제기해서 빨리 세워지기 바랍니다.', '의자라도 놓아주세요 비,햇볕 피하게 지붕 있으면 좋간 한데, 비용이 많이 들면 우선 의자라도 놓아줬음 합니다', '세금이  올바르게  쓰여진 예', '', '강원도까지 갈것도 없이 경기도 외곽만 가도 있더라 저런동네..', '', '한명이라도 불편함을 겪지 않도록 알게된이상 조치를\n취해야겠네요\n신기하네요 ""권춘섭씨네집앞""이 승강장이름인게~^^\n사연은 짠해요ㅜㅜ', '지방공무원이 서울거들보다 훨 낫다', '오래토록 보존하길...', '', '오렌만에  시골풍경 생각이나네요  농사지으신것  판매도 하시는지요?', '', '열악한 대중교통?\n저정도 촌에 집한채있는데  노선정하는 나라 있겠나?\n한국이 열악하면 전세계 99%는 원시시대겠네?', '']",http://www.stoo.com/article.php?aid=86301071196,https://n.news.naver.com/mnews/article/032/0003213109?sid=102
2023.03.28.,의학신문,,"신신제약, 세종시 소정면에 의약품 등 기부",,,http://www.bosa.co.kr/news/articleView.html?idxno=2193817,http://www.bosa.co.kr
2023.03.29.,의학신문,,대한요양병원협회 남충희 신임 회장 취임,,,http://www.bosa.co.kr/news/articleView.html?idxno=2193949,http://www.bosa.co.kr
2023.03.27.,아시아경제,,"고흥군, 대한결핵협회 기관 표창 수상",,,https://view.asiae.co.kr/article/2023032713461844383,https://www.asiae.co.kr/
2023-03-27 13:46:19,뉴시스언론사 선정,사회,"""우크라 전차부대 서방 전차 지원 학수고대""","[ 의료기관에 전담간호사 배치, 결핵 예방관리전남 고흥군(군수 공영민)이 지난 24일 제13회 결핵예방의 날을 맞아 전남도립도서관 강당에서 열린 기념식에서 전남 22개 보건소 중 우수기관으로 선정돼 대한결핵협회로부터 기관 표창을 수상했다고 밝혔다.보건소는 65세 이상 노인 결핵 검진을 위해 적극적인 환자 발견 및 결핵예방 등 다양한 사업을 진행해 결핵관리에 크게 기여한 공로를 인정받아 이번 기관 표창을 수상하게 됐다.    ［사진제공=고흥군］보건소에서는 결핵 환자 경감을 위해 65세 이상 노인 일자리사업 참여 어르신들과 관내 요양시설 10개소를 대상으로 X-선 검진 및 객담 검사를 진행 중이며, 올해 신규 사업으로 생애전환기 잠복결핵 검진도 추진하고 있다.또한, 결핵예방 사업을 위해 민간?공공협력사업 참여 의료기관과 협조체계를 구축하고, 결핵관리 전담간호사를 의료기관에 배치했다.결핵관리 전담간호사는 결핵환자 등록부터 완치까지 치료일정 안내 및 결핵관련 교육, 투약 및 부작용 확인, 가족 등 밀접접촉자 검진과 비순응시 조치 등 결핵환자 최소화 및 지역 내 전파 차단을 위해 철저한 환자 관리에 힘쓰고 있다.보건소 관계자는 “앞으로도 결핵 없는 청정 고흥을 만들기 위해 결핵 예방사업을 더욱 체계적으로 운영해 나가겠다”고 말했다.고흥=아시아경제 호남취재본부 심정우 기자 hss79@asiae.co.kr   ]",[],http://www.newsis.com/view/?id=NISX20230324_0002239638&cID=10101&pID=10100,https://n.news.naver.com/mnews/article/277/0005236579?sid=102
2023.03.08.,경북신문,,"김천시치매안심센터, 지역사회협의체 회의 개최",,,http://www.kbsm.net/news/view.php?idx=383680,http://www.newsis.com
2023-03-24 11:33:23,KBS,세계,‘화재취약가구’ 화재경보기 무상 보급 확대,"[ 기사내용 요약NYT, 동부 바흐무트에서 싸우는 전차중대 르포50대 중대장·부중대장 ""러군 궤멸시킬 것"" 자신    [바흐무트=AP/뉴시스] 6일(현지시간) 우크라이나 도네츠크주 바흐무트에서 우크라이나군 전차가 전선으로 향하고 있다. 2023.03.07.[서울=뉴시스] 강영진 기자 = 가장 치열한 전투가 벌어지는 우크라이나 동부 바흐무트에서 우크라이나군 전차부대가 서방의 전차가 지원되길 학수고대하고 있다고 미 뉴욕타임스(NYT)가 23일(현지시간) 보도했다. 다음은 기사 요약,함박눈이 펑펑 내리는 숲에서 진흙길을 따라 구 소련제 낡은 전차가 굉음을 내며 이동하고 있다. 겨울이 끝나가는 즈음의 이른 새벽이었다. 전차를 모는 우크라이나군 장교 2명이 눈 속에서 적을 찾느라 온통 신경을 곤두세웠다. 전차 중대장 폴토바는 러시아 정찰 드론이 자주 나타난다면서 “눈 때문에 우리가 안 보일 것”이라며 “발각되지만 않으면 적을 보내버릴 수 있을 것”이라고 했다.폴토바는 51살이며 부중대장 챈슬러는 57살이다. 30년도 더 전에 하르키우 탱크연구소에서 구소련제 탱크 훈련을 받은 사람들이다. 러시아가 침공한 직후 자원해 전차중대를 이끌며 전투를 벌여왔다. 두 사람이 받은 훈련 덕분에 부대가 지금까지 몇 달 째 생존할 수 있었다. 포탄 공급이 부족한 상태에서 하르키우에서 노획한 러시아군의 T-72 전차의 포탄을 써가며 버텨왔다. 그들은 서방 전차가 보급되면 러시아군을 궤멸시킬 수 있을 것으로 기대한다. 챈슬러가 “서방 전차가 있으면 야간 작전도 할 수 있다. 통신과 광학 장비도 훨씬 좋다. 소련 전차는 너무 낡았다”고 했다.  챈슬러는 1988년에, 폴토바는 1992년에 전차학교를 졸업했다. 동유럽 공산국가들과 소련이 붕괴하는 혼란기였다.폴토바는 젊은 장교 시절 러시아군 용병으로 조지아에 파견됐을 때가 충격을 받았다고 했다. 압하지아 지역을 합병하려 파견된 러시아 군 소속 장교인 자신에게 조지아의 한 노인이 꾸짖었다고 했다. 노인이 정색을 하고 “어느 나라에서 왔냐”고 물어 우크라이나 출신이라고 답했더니 여기는 조지아라면서 얼굴에 침을 뱉었다는 것이다. 그때 정신이 번쩍 들었다고 했다. 그는 러시아가 체첸을 침공할 당시 발진 기지였던 북오세티아 코카서스 공화국의 모즈독에 배치되면서 속았다는 생각이 들어 승진시켜준다는 제안을 거부하고 우크라이나로 돌아왔다고 했다.러시아군과 전투를 하면서 소련 군사대학에서 배운 것들 가운데 많은 것들이 거짓임을 깨달았다고 했다. 예컨대 소련제 전차가 미제 에이브럼스 전차보다 우수하다는 내용이다. 그는 “미국과 북대서양조약기구(NATO)가 우리의 적이라고 교육을 받았지만 정반대였다. 우리의 친구라고 배운 러시아가 등에 칼을 꽂았다”고 했다. 반면 챈슬러는 소련의 선전을 믿은 적이 없다고 했다. 스탈린 시대 부모 모두가 박해를 받았고 1939년 할아버지가 처형됐으며 어머니 일가족이 1945년 폴란드에서 납치됐다고 했다. 우크라이나 동부 루한스크에서 살아온 부모가 2014년 러시아군 지원을 받는 반군들에게 집을 빼앗겼다고도 했다. 그는 “러시아가 우리 가족을 또 파괴하려 한다”고 했다. 러시아가 침공했을 때 독일로 피난해 자녀 넷을 안전하게 도피시킨 뒤 군에 자원했다고 했다. 자신과 함께 있는 병사들 대부분이 사연이 비슷하다고도 했다. 두 사람은 서방이 지원하기로 약속한 최신 전차가 있으면 숫적으로 압도적인 러시아군을 이길 수 있을 것으로 확신한다. 챈슬러는 “아침에 눈뜰 때마다 전장에 있다는 걸 깨닫고 에이브럼즈를 주지 않을 거면 날 빼달라고 생각한다”고 했다. 며칠 전 두 사람의 부대가 포격을 당했다. 폴토바는 간신히 부상을 면했다고 했다. “탱크 바로 뒤에서 폭탄이 터져 강아지 마냥 두 시간 반 동안 굴속에 처박혀 있었다”고 했다. 챈슬러는 우크라이나는 서방이 지원하지 않더라도 싸울 수밖에 없다고 했다. “돌맹이로라도 맞서서 싸우겠다. 오래 걸릴 것이다. 몽둥이로라도 때려잡을 것”이라고 했다.폴토바는 “여긴 우리 땅이다. 누구도 무장한테 오도록 초청한 적이 없다”고 했다. 몇날며칠을 싸운 탓에 찌들은 모습인 중대원들이 불을 피웠다. 전차에서 내려 담배를 피우면서 웃고 떠들었다. 폴토바 중대장은 “전투를 벌이면서 말소리를 내며 웃는 놈들이다. 사기가 충천해 있다. 모두 지쳤지만 유머 감각을 잃지 않고 있다”고 했다. 전차 부대는 대부분 숨어서 기다렸다가 러시아 군대를 기습하는 전투를 벌인다. 이를 두고 전차장인 스뱌토샤(38)가 씩 웃으며 “사냥꾼을 사냥하는 거지요”라고 했다. “먹여주고 입혀주고 비싼 탱크도 주고 연료도 주고 탄약도 주면서 돈은 받지 않는다”며 “비할 데 없는 정말 좋은 일자리”라고 농담했다． ]",['인터뷰를 했다는데 그 흔한 인터뷰 사진 조차 없네. 조작기사로 봄.'],https://news.kbs.co.kr/news/view.do?ncd=7617099&ref=A,https://n.news.naver.com/mnews/article/003/0011761451?sid=104
2023.03.30.,아시아타임즈,,[30일 인천 계양구 소식] 민원실서 '로비음악회' 개최 등,,,https://www.asiatime.co.kr/article/20230330500165,http://www.kbsm.net
2023.03.29.,열린뉴스통신,,"한울본부, 회사 창립기념 지역지원 및 사회공헌활동 펼쳐",,,https://www.onews.tv/news/articleView.html?idxno=159781,http://news.kbs.co.kr/
2023-03-02 12:01:23,중앙일보,사회,[김경록의 은퇴와 투자] 인구 줄면 소득도 줄어든다,"[     정부의 화재경보기 무상 보급 대상자가 확대됩니다. 소방청은 기존 기초수급자에게 무상 보급되던 화재경보기를 장애인과 홀몸노인, 다문화 가족 구성원에게 확대 제공한다고 오늘(2일) 밝혔습니다.청각장애인에게는 시각표시기능이 담긴 화재감지기가 제공되며, 지적장애인에게는 불빛 유도 화재감지기가 보급될 예정입니다.화재경보기 무상 보급은 화재 안전 취약자에게 우선 보급됩니다. ]",[],https://www.joongang.co.kr/article/25151230,https://n.news.naver.com/mnews/article/056/0011437882?sid=102
2023.03.27.,아주경제,,"[진주소식]진주시, '진주남강음악분수대' 29일부터 운영 外",,,https://www.ajunews.com/view/20230327143430248,http://www.asiatime.co.kr/
2023.03.27.,아주경제,,"[진주소식]진주시, '진주남강음악분수대' 29일부터 운영 外",,,https://www.ajunews.com/view/20230327143430248,http://www.ajunews.com
2023.03.25.,오마이뉴스언론사 선정,,"""애들 왔다갔다 하긴 하는데..."" 강화도 이 학교의 꿈",,,https://www.ohmynews.com/NWS_Web/View/at_pg.aspx?CNTN_CD=A0002911692&CMPT_CD=P0010&utm_source=naver&utm_medium=newsearch&utm_campaign=naver_news,http://www.ohmynews.com/
