Date,Press,Category,Title,Content,Comment,URL_Origin,URL_Naver
2023.03.31.,뉴시스,,"광주시, 어린이·노인 대상 찾아가는 재난안전교실 운영",,,http://www.newsis.com/view/?id=NISX20230331_0002248755&cID=10809&pID=10800,http://www.newsis.com
2023-03-31 10:30:39,중앙일보언론사 선정,사회,서울도 제친 '6만불 도시'…노인·학벌 안따지고 직원 모시기 왜,"[ 기사내용 요약생활안전·보건안전 등 6대 안전분야 중심 이론·체험교육    [광주=뉴시스] 광주시청 전경. (사진 = 광주시 제공) *재판매 및 DB 금지[광주=뉴시스] 구용희 기자 = 광주시는 4월부터 어린이·노인·장애인·다문화가족 등 위험 노출 빈도가 높고 안전사고에 취약한 계층을 대상으로 찾아가는 재난안전교실을 운영한다고 31일 밝혔다.찾아가는 재난안전교실은 각 기관 별 특성이나 시간 제약 등으로 인해 빛고을국민안전체험관 등 안전체험시설을 이용할 수 없는 안전취약계층의 안전의식을 고취하고, 안전 지식 습득을 지원하기 위해 마련된 맞춤형 안전교육 프로그램이다.광주시는 안전교육지도사·재난안전지도사 등 안전교육 전문자격을 갖춘 강사 72명이 신청기관을 방문해 생활안전·교통안전·자연재난·사회기반체계·범죄안전·보건안전 6개 분야에 대한 이론과 체험 교육을 하도록 하고 있다.지난해 이태원 압사사고 이후 체험교육 수요가 증가함에 따라 심폐소생술 등 일상에서 활용할 수 있는 교육을 강화할 계획이다. 어린이집 등 참여기관 현황을 분석해 참여하지 않은 기관에 별도의 안내를 통해 체험교육을 받을 수 있도록 할 방침이다.박남주 광주시 시민안전실장은 ""안전취약계층은 조그마한 재난안전 사고에도 큰 손상을 입을 수 있다""며 ""찾아가는 재난안전교실이 재난·안전사고 대응 능력을 키우는 계기가 되길 바란다""고 말했다. ]",[],https://www.joongang.co.kr/article/25151664,https://n.news.naver.com/mnews/article/003/0011775500?sid=102
2023.03.31.,동아일보언론사 선정,,"“칠곡할매글꼴, 노인을 ‘어르신’으로 바라보는 기회 되길” [따만사]",,,https://www.donga.com/news/Society/article/all/20230320/118424924/2,https://www.joongang.co.kr
2023-03-31 16:00:00,SBS,사회,"""94세 노인이 코인 거래""…가상자산 거래소 위법 '여전'","[       울산 동구청·울산조선업도약센터, HD현대중공업·미포조선이 함께 마련한 첫번째 조선업 현장 취업설명회 모습. 부산·대구, 경북·경남 등 전국에서 모인 구직자들이 복지 등 근로여건을 듣고, 조선소 생산 기술교육 과정 등을 소개받았다. 사진 울산 동구       31일 오후 울산시 동구 현대미포조선. 45인승 버스 2대에서 37명의 남녀가 차례로 내렸다. 20대와 30대뿐 아니라, 50대 2명도 눈에 띄었다. 이들은 동구청·울산조선업도약센터, HD현대중공업·미포조선이 함께 마련한 첫 번째 조선업 현장 취업설명회에 참석한 구직자들이다. 부산·대구, 경남·경북 등 전국에서 조선소 근무 여건을 직접 보고 경험하기 위해 울산을 찾았다.      회사 측의 안내를 받은 구직자들은 선박 건조 현장을 견학하고, 복지 등 근로여건을 들었다. 조선소 생산 기술교육 과정도 소개받았다. 점심을 먹으면서 울산지역 조선소의 직원 식사 수준도 직접 확인했다. 권경현 동구청 일자리정책과장은 “오는 8월까지 한 달에 한 번씩 조선업 현장 취업설명회를 연다”면서 “전국 어디서 누구든, 이메일로 신청하면 세심하게 현장을 보여주고, 실제 취업으로 이어지도록 적극적으로 안내하겠다”고 말했다.      ━   노 스펙 현장 견학 '직원 모시기'       국내 1등 조선소가 모인 울산에서 지자체와 조선업체가 나이·학벌·성별 등을 묻거나 따지지 않는 ‘노(No) 스펙’ 현장 견학 취업 설명회를 여는 등 ‘조선소 직원 모시기’에 힘을 쓰고 있다. 동구청 측은 “배 수주가 많아 지역에 인력이 많이 필요한 상황”이라며 “최근 외국인 근로자 1000여명을 채용했지만, 현재도 미포조선 등에 3000여명의 일자리가 남아있는 것으로 파악됐다”고 밝혔다.       울산 동구에는 HD현대중공업·미포조선, 협력업체 등 조선업체들이 모여 있다. 이에 조선업체들과 동구청은 취업설명회를 열면서 이달 초부터는 지역 시니어클럽과 노인 일자리 사업을 연계, 조선소에서 일할 노년층 인력까지 찾고 있다. HD현대중공업 관계자는 “일당 14~24만원, 학자금 연 575만원, 주택자금대출이자 연 150만원, 식사 무료 제공 등 협력업체(160여개) 근로자 지원책도 마련해 직원을 모집 중이다”고 분위기를 전했다.          구직자들이 복지 등 조선업 현황 등에 대해 설명을 듣고 있다. 사진 울산 동구       울산은 2021년 기준 1인당 지역총소득 5935만원, 지역내총생산 6913만원으로, 각각 5421만원·4965만원인 서울을 제친 국내 유일 ‘6만불 도시’다. 이 넉넉한 도시 경제를 견인하는 산업 중 하나가 조선업이다. 울산이 조선소 직원 부족 현상에 더 예민한 이유다. 울산의 조선소 인력난은 단순히 “조선소 일이 고되기 때문에 안 온다”라고만 진단할 수 없다. 조선소가 모여 있는 울산 동구의 지방소멸 현상과 맞닿아 있어서다.       산업연구원은 지난해 11월 국내 228개 시·군·구 인구 변화를 조사, 울산 동구를 소멸 우려 지역으로 분류했다. 광역시에 속한 도심 지자체, 그것도 이른바 ‘돈이 잘 도는 경기 좋은 곳’의 소멸 우려는 이례적이었다. 동구의 지방소멸 그림자는 2016년부터 예견됐다. 2015년 18만1207명이던 동구 인구는 2017년 17만3096명으로 줄었고, 최근엔 15만1711명으로 감소했다. 인구 감소는 지역 경제 기반인 조선업 불황이 주원인이었다.       동구청에 따르면 전체 지역 주민 30~40% 정도는 조선업 종사자 또는 그 가족으로 추산된다. 즉 조선업 불황에 따른 인구 이탈 현상이 ‘소멸 우려’를 만들었다는 의미다. 이를 보여주듯 조선업 호황기인 2014년 HD현대중공업 근로자는 협력업체 직원을 포함해 6만2000여 명에 달했다. 이후 조선업 불황 등을 거치면서 2017년 2만9700여명, 올해 들어 2만5400여명으로 감소했다.          현대미포조선이 2021년 건조해 선주사에 인도한 5만톤급 PC선의 모습.사진 HD현대=연합뉴스       ━   불황에서 호황, 인력난 그대로       HD현대중공업이 LNG선 7척을 2조원에 수주하면서 지난해 중순부터 조선업은 불황에서 호황으로 바뀌었다. 그렇지만 앞서 불황에 동구를 떠난 조선업 근로자들은 다시 돌아오지 않고 있다. 이경우 울산연구원 경제산업연구실장은 “조선업은 실외에서 일해야 하고, 여기에 임금도 그리 높지 않다 보니 떠나간 근로자들이 돌아오지 않는 것”이라며 “인력난은 2016년 조선업계의 구조조정이 한창일 때 이미 예견됐던 일로, 다시 인력을 축적하기 위해선 4~5년의 세월이 더 걸릴 것 같다”고 말했다.   ]","['415 중국개입 부정선거', '조선소 하청서 3년 근무하다 불황와서 그만두고 플렌트 현장 왔는데 일도 훨씬 수월하고 안전하고 급여도 나쁘지 않고....과연 다시 조선소로 돌아갈 사람들이 있을까?', '과실은 정규직이 따먹고  헙력사는  개고생 하다 일감줄어들면 팽 당하는데  누가 가냐  임시직은 일당이라도 정규직 보다 많아야 하는데', '죽어라 뽑아놓아도 조금있으면 민노총에 가입해 헐크로 돌변할것이다', '근로기준법 뜯어고쳐 실업급여 1달로 줄여야한다. 적당히 주는데 누가 취업해? 나라가 타성에 젖어 개판 공산화를 노린 민주당의 역사적 과오', '급여가 짜구만..그러니 안가지', '', '조선소 입사 신체검사가 해군사관학교처럼 통과하기 힘듬  혈압 120. 콜레스트롤  수치도 좋아야 허고 요추 경추 .엑스레이 ㄷ깐깐하게 다 본  왜 냐고? 그만큼 현장이 막장급임. 소음에 분진에 용접에 여름에 철판은 달구어져 선내는 상상을 초월하는 더위. 방진마스크 착용  보안경착용. 귀마개   안전화에 안전모 그리고 안전밸트 착용하고 선살서 작엊하면 생지옥이 따로 없음', '깡패노조들 월급은 중국보다 20배 더 많고 생산은 중국 보다  10배 더 떨어진 경쟁력으로 국제사업은 이미 말아 먹었는데', '저가 에  수주 했으니  계약 따냈지~ 다른나란  기술이 없더냐~싼값에 맞추려면 싼일꾼들  부려먹여야 하는데 누가 요새 싼 임금에 힘든일 하냐~ 중국도  이렇겐 안한다~  제값 에  수주  받아와라~', '참나.기사 쓰는 기자나 댓글 다는 부대나\n조선소가 어떤 곳인지 내용이나 알고 글쓰는지?\n조선소 경기 좋을때 주변에 달세 여관잡기도 힘들었다\n근데 지금은 일할사람 모신다. ...\n그 이유가 뭘까?스스로 생각해봐 뇌가있음', '현대중공업은 나쁜회사다.. 양심도 없는 양아치 회사라서 지금 업보를 겪는것이다.. 조선 불황일때는 사람을 매몰차게 내몰아 냈다.. 사람을 짐짝 취급하고, 구조조정으로 직원들이 피눈물을 흘리면서 떠나갔다.. 회사는 성장할는지는 모르지만 떠나간 직원들은 한숨과 자포자기와 타직종으로 옮겨갔다.\n  이제와서 사람 귀한줄 아는가?? 곧 회사 어려우면 또다시 가차없이 사람 내몰 회사 아닌가? 양심이 있으면 구조조정으로 내쫒은 옛 직원들에게 사과를 먼저하라', '정규직들이 비정규직 멸시하고 구박한 업보. 기술자들을 싼 노동력으로 대체하려던 기업의 업보. 이제 조선을 넘어 자동차로 곧 그 불길이 옮겨갈듯.', '놀고 있는 6, 70대도 채용해라', '나이 안 따지면 60대도 받아 줄란가??바로 뛰어갈낀데~', '복지를 없애야 저기 일자리가 금방 찬다', '', '조공단가 18만원에 40공수씩해봐라 물밀듯이 몰려든다', '', 'HD현대 판교에 신사옥 입주해서 돈벌고, 점심도 잘쳐먹으면서,  4개월이 지났는데도 협력업체 공사비는 아직도 체불이냐?  더러운 좀비기업=  HD현대', '권뭐시기 회장 왈...\n그렇게 잘났으면  다른 회사 가라고 하던데...\n해외현장에 와서 직원들에게 그러고 가던데...ㅋㅋㅋ', '팩트 울산은 원래 서울보다 평균연봉이 높습니다 ㅋㅋㅋ 20년전 교과서에서도 봄ㅋㅋㅋ', '울산이면 강성노조의 빨간 도시?', '자업자득이다. 좀 어렵다고 자르고 급여 줄이니 실력있는 사람 누가 붙어있겠냐?  있을때 잘해라.', '죽어 나가는 게 내가 될 수도 있는 현장을???', '현대차 생산직 어떤지 못봤냐? 혜택 빠방하고 공평하게 일한 값 잘쳐주면 얼마든지 출근할 사람들 널렸다. 오래된 생각이다', '예전부터 중공업 일은 험하기로 유명했지.. 사람도 주기적으로 죽어나가고..', '', '좋은 시도로 생각됩니다.\n\n경력자를 우대하면 더 좋을텐데요. 하청에 맡기는 것보다 3년 재계약 무호봉 무정년으로 본사에서 고용을 하면 더 좋을 것 같습니다.', '', '육지하고 임금 차이 별 차이 없어서....메리트 없음.', '임금을 많이 줘봐라 서로 갈려고 할텐데..ㅋㅋㅋ', '사람 필요하면 현대 니들이 직접 뽑아 혈력사 끼지말고.', 'ㅠㅠ', '불쌍한 사람들...ㅉㅉㅉ', '', '저기서 일할빠에 평택고덕이나 이천하이닉스 가겟다', '', '울산이 이렇게 잘사는 도시인데.. 결혼률, 출산률은 높지 못한 이유는??', '최저 시급 주면서 일시키는데 누가 갈려고… 돈을 더 줘야 사람들이 가지', '', '네? 6만불요?  정규직 얘기죠. 하청은 최저시급에 개처럼 부려먹어서 온갖 똥남아들 수입중인 조선소요? 애국 애국 나불거리는 우리 수꼴연놈분들 죄다  잡아다 저기로 보냈으면..ㅠ', '자동화로 전환 못하면 한국 제조업은 다 죽음', '', 'ㅋㅋㅋ조선소 잡부 = 인생에 더 이상 취직할 곳이 없을 때 가는곳 ㄹㅇㅍㅌ', '그래도 서울외 지역은 시골ㅋㅋ', '지역소득 6만불 참 개소리하고 있네, 인도가 국가총소득 세계 8위의 부자 나라거든, 그래서 인도인이 다 부자로 사냐? 인구의 팔할이 구걸로 살아간다. 맹목적 경제성장은 의미가 없는거야 그 부의 혜택이 모든 국민에게 골고루 돌아가지 않는 한 그냥  미개한 인도에 불과한거야 알겠니 기레기야?']",https://news.sbs.co.kr/news/endPage.do?news_id=N1007135579&plink=ORI&cooper=NAVER,https://n.news.naver.com/mnews/article/025/0003269996?sid=102
2023.03.29.,연합뉴스,,음료 판매원 눈썰미로 무사히 발견된 실종 치매 노인,,,https://www.yna.co.kr/view/AKR20230329079200063?input=1195m,http://www.donga.com/
