Date,Press,Category,Title,Content,Comment,URL_Origin,URL_Naver
2021-07-25 11:30:37,파이낸셜뉴스언론사 선정,사회,"이재명표 기본소득 연 100만원, 청년에 100만원 더 준다","[ 장애인·아동·노인 시민단체'일률적 격리' 인권위 진정·직권조사 요청종교계는 '대면예배' 허용 요구법원 조건부 인용민주노총, 집회금지 반발인권위 진정 제기    코로나19 방역을 이유로 요양병원·아동복지시설·장애인거주시설에서 이뤄진 시설 격리조치에 대해 장애인·노인·아동 관련 시민단체 9곳이 국가인권위원회에 진정을 제기하고 있다.코로나19 4차 대유행을 맞아 강력한 사회적 거리두기 조치가 시행되면서 '방역'과 '인권'을 사이에 두고 재차 논란이 커지고 있다. 방역당국의 집회금지·대면예배 금지·일률적 시설 격리 조치 등에 대해 국가인권위원회에 진정을 제기하는 등 반발이 이어지고 있다.먼저 이달 21일 코로나19 방역을 이유로 요양병원·아동복지시설·장애인거주시설에서 이뤄진 시설 격리조치에 대해 장애인·노인·아동 관련 시민단체 9곳이 함께 ‘기본권 침해’를 주장하며 인권위에 진정을 제기하고, 직권조사 요청서를 제출했다. 이들은 입장문에서 ""요양시설, 장애인시설, 아동시설에는 이송체계와 의료 설비가 갖춰지기도 전에 사회로부터의 격리조치가 먼저 시행됐다""며 ""환자, 노인, 장애인, 아동 등은 가족들을 볼 수 없었고 일상을 송두리째 포기해야 했다""고 호소했다. 이들은 또 이 같은 조치가 ‘지침’ 또는 ‘행정명령’ 형태로 이뤄져 근거법령이 명시되지도 않았을 뿐만 아니라, 근본적으로 시민의 기본권을 제한할 수 있는 방식이 아니라고 지적했다. 이들은 그러면서 ""방역은 시민을 장기말로 바이러스와의 전쟁을 치르는 것이 아니다. 방역은 결국 사람을 위한 것이어야 한다""며 ""더 이상의 반복을 막기 위해 함께 진정을 제기하고 직권조사를 촉구한다""고 말했다.    18일 오전 서울 중랑구 송곡고등학교 운동장에서 서울씨티교회 신자들이 신종 코로나바이러스 감염증(코로나19) 확산 방지를 위해 차량에 탑승한 채 예배를 보고 있다. [이미지출처=연합뉴스]사회적 거리두기 4단계에서 일률적으로 대면예배를 금지했던 규정도 종교계의 문제제기로 인해 다소 완화됐다. 이달 16일 서울행정법원은 서울 7개 교회와 목사들이 '대면 예배 금지 처분의 효력을 정지해달라'며 서울시를 상대로 낸 집행정비 신청 중 일부를 받아들였다. 종교 행사를 금지하는 것으로 기본권 침해가 생길 우려가 있다고 판단한 것이다.재판부는 당시 ▲수용 인원의 10%만 참석 ▲10%가 19명 이상일 경우 19명까지만 참석 ▲좌석 앞뒤 칸 띄우기 ▲출입자 증상 확인, 명부 작성 등 조건을 지키면 대면예배를 허용해야 한다고 봤다. 방역당국은 이 같은 법원 판결을 받아들여 대면예배를 교회 수용인원의 10%, 최대 19명 이내로 허용하는 것으로 방침을 수정했다.집회 전면 금지에 대한 노동계의 목소리도 커지고 있다. 앞서 22일 민주노총 산하 공공운수노조는 강원 원주시장을 피진정인으로 하는 진정서를 인권위에 제출했다. 공공운수노조 건강보험고객센터지부가 국민건강보험공단 앞 결의대회를 예고하자 원주시가 집회를 전면 금지해 헌법상 집회·결사의 자유 등 기본권을 침해했다는 이유에서다.노조는 특히 원주시가 다중이용시설 인원 제한 등 모든 영역에선 사회적 거리두기 3단계 기준을 적용하면서 집회에만 4단계를 적용해 평등권 침해라고 주장하고 있다. 사회적 거리두기 4단계에선 1인시위만 가능하다.    전국민주노동조합총연맹(민주노총)이 원주 집회를 계획한 23일 집회 장소인 강원 원주시 국민건강보험공단의 출입이 막히자 집회 참가자로 추정되는 사람들이 인근 언덕을 넘고 있다. [이미지출처=연합뉴스]민주노총 또한 이달 3일 전국노동자대회 개최 전 서울시와 경찰이 집회 금지를 통보하자 지난달 29일 인권위에 진정을 제기했다. 민주노총은 결국 집회 장소를 기습적으로 변경해 서울 종로에서 8000명(주최 측 추산)이 참여한 상태에서 전국노동자대회를 강행했다.코로나19 방역 조치와 인권 사이의 문제는 지난해 '이태원 클럽발 감염' 사태 때 한 차례 적나라하게 드러난 바 있다. 확진자 동선 공개 등을 놓고도 논란이 일자 접촉자가 확인되지 않는 경우에만 공개하도록 지침을 개정하는 등 그간 방역과 인권의 균형을 맞추려는 노력은 계속돼왔다.최영애 인권위원장은 지난해 성명을 통해 “코로나19 위기는 우리사회의 인권 역량을 확인하는 시험대”라고 밝힌 바 있다. 코로나19의 장기화는 불가피한 상황이다. 이번 진정사건들에 대한 인권위의 판단은 향후 방역조치와 인권 사이의 논란에 하나의 이정표가 되는 만큼 그 결과가 주목된다.  ]","['', '인간으로써 권리를 원한다면 인간으로써 의무를 지켜라', 'K방역이 할 수 있는 건 가둬두기 뿐... 가뒀다, 풀었다. 다 죽을 때 까지 무한 반복 하려는 듯...', '인권 개 뻑다귀 같은 소리', ""인권? 당연히 중요하다. 말그대로 인간의 기본권리니까.. 그러나 '긴 병에 효자없다'.. 라는 말이있다. 사태초기엔 방역보다 인권을 우선시 할수있었지만, 이렇게까지 장기화가되면.. 이젠 인권보단 방역이 먼저가 되야한다. 어차피 방역이 무너지면 사회질서도 무너진다. 그렇게되면 더이상 지켜줄.. 지켜질 인권도없다~~~ㅋ"", '놀고들있네... 대다수 국민들의 기본권을 니들이 침해하는건 생각못하지...', '', '청원 같은건 없나요ㅜㅜ 기본인권 주장전에 지금 모든 국민들이 함께노력중인데..', '방역이 우선이라고 본다 그러나 강력한 방역 체계가 없다 방역을 할 정부의지가 없다  국민또한 당장먹고사는냐 문재에 급급하다  그러니 평생 코로나와 함게 살아야 할것이다  정부는 선택하라  강력한 방역으로 코로나을 종식시킬것인가  평생 함게 코로나와 살것인가을 선택해야 할것이다  계엄령을 선포해서라도 잡아라', '그래 다 풀어라...치료고 뭐고...그냥 다 풀고  죽을 사람은 죽고 살사람은 살면 되겠네....인권도 나라가 있어야 하는 거고 나라도  국민이 있어야 하는 거다.', '인권을 들먹일 때가 아니다.멍충망충', '살아야 투쟁도하지 뒤진담에,,암소용업다', '특정 인권보다 방역을 위해 희생하는 불특정 다수의 공익이 중요함 코로나 라는 특수한 상황을 고려해야지 무조건 자기들 이익만 운운하네 인권이 소수에게 더 불공평함.', '요양원 우리어머니 ㆍ\n손한번못잡고 있너\n 포옹하고싶다 ᆢ\n언제나  이산가족 면할까ᆢ', '', '문재인 정권은 방역과.인권 두마리.토끼를 모두 잡았음... 보수 지지자들한텐 방역을 우선시하고 민노총 같은 민주당.지지자들한텐 인권을 우선시하지... ㅋㅋㅋㅋ', '인권땜에 민노총집회도 인정해줄거면 문재인탄핵집회해도 된다는거네.  탄핵집회 막는것도 인권침해잖아!', '애초에 조금잠잠해질만하면 뭐 뿌린다그러고 사람들 바람들게 유도하고 확진자급증했다그러고.. 작년부터 흘러가는게 비슷하다.. 변이 판친다는데 작년부터 해외입국 막은척이라도 한적있나?? K방역은 확진자가 일정이상유지되도록 관리하는건가?', '인권위가 법위에 상전인듯..', '인제 진절머리난다 너거맘대로해라 난 내방식대로살란다', '태극기 부대야 니들도 집회해라 문씨 탄핵으로 - 또 다시 일어날거다 국민들이 - 그리고 대깨문은 살인마라 짖어데겠지 - 볼만하겠네', '', '당연히 방역이 먼저지', '이제와서?', 'K감옥이나 K격리나 K집합금지 K영업제한으로 바꿔라ㅋㅋ', '이나라는 강약약강이냐?\n강자에겐 약하고 약자에겐 강하고..\n언제까지 그럴셈이냐?\n누구를 위한격리이었을까?요야뭔.장애인 사회약자를 위한 격리였다면 백신구했을때 제일먼저 접종시키고 보호해야되지 않았을까?', '', '기본적인것도 못지키면서 요구는 엄청 많네~~  아주 사소한것도 못지키는데 무슨 인권?  그마큼 자제좀 해달라고하는데 그것조차도 안키는 사람들이 많은데~~  어떻하냐~~  제발 뭘 바라기이전에  기본적인걸하고 바래야지~~  나도 장사하지만 진상들 말도 드럽게도 안들음~~  욕이나할줄알지 기본이 전혀 안되어있는 아주 몰상식의 끝판들이지 자영업자를 죽이는건 말안듣는 시민들이지~~  착한 시민들만 바보만들지~~  이기주의자들이 얼마나 많은줄 알긴아니?']",http://www.fnnews.com/news/202107221035009721,https://n.news.naver.com/mnews/article/277/0004942906?sid=102
2021.07.29.,프레시안,,방역이 돌보지 않은 빈곤의 그늘,,,https://www.pressian.com/pages/articles/2021072814593866595?utm_source=naver&utm_medium=search,http://www.dynews.co.kr
2021.07.22.,파이낸셜뉴스언론사 선정,,"이재명표 기본소득 연 100만원, 청년에 100만원 더 준다",,,http://www.fnnews.com/news/202107221035009721,http://www.fnnews.com/
2021-07-22 10:39:03,충남일보,정치,"공주시의회 이종운 의장, 취임 1주년 맞다","[ 2023년 청년엔 연 100만원 먼저 지급그외 전국민에겐 연 25만원 1회 지급소멸성 지역화폐로 지급 계획임기 내 4회 늘려 전국민 연 100만원 목표""기본소득 최종목표는 월 50만원 이나..""차차기 정부로 최종 목표 넘겨     이재명 경기도지사. 사진=김범석 기자 [파이낸셜뉴스] 더불어민주당 유력 대권주자인 이재명 경기도지사가 22일 임기 내 전국민에 연 100만원 기본소득을 소멸성 지역화폐로 지급한다는 계획을 발표했다.   전국민 연 100만원 기본소득 외 19~29세 연령대 청년들에겐 연 100만원 기본소득을 추가로 더해 청년 기본소득은 연 200만원으로 지급한다는 목표다.   다만 재원 마련 구조상, 집권 2년차인 2023년에는 청년들에겐 연 100만원 기본소득을 지급하되 그외 전국민 기본소득은 25만원을 연 1회 지급하겠다는 계획이다.   이 지사는 이날 국회 소통관에서 가진 기본소득 정책 발표를 통해 ""장기적으로 기본소득의 최종 목표금액은 기초생활수급자 생계비 수준인 월 50만원으로 판단한다""며 ""재원 형편상 차기 정부 임기 내에 최종목표에 도달할 수 없으나, 임기 내 청년에겐 연 100만원, 그 외 전 국민에게 1인당 연 100만원(4인가구 400만원)을 지급하겠다""고 말했다.   집권시 2년차가 되는 2023년부터 19세부터 29세까지의 청년, 약 700만명에게 보편 기본소득 외 연 100만원을 지급하겠다고 밝힌 이 지사는 보편기본소득과 청년기본소득으로 11년간 총 2200만원의 기본소득을 받게 될 것으로 추산했다.   청년기본소득 대상자를 제외한 모든 국민에겐 연 100만원 이상을 소멸성 지역화폐로 지급한다는 계획이나, 2023년에는 1인당 25만원씩(4인가구 100만원) 연 1회 지급한다는 방침이다.   이 지사는 ""임기 내에 최소 4회 이상으로 늘려나가겠다""며 ""회당 지급금액은 작년 1차 재난지원금의 4인 가구 100만원(1인당 25만원)을 기준으로 설계했다""고 설명했다.   청년 기본소득과 보편 기본소득을 밝힌 이 지사는 농민·노인·아동청소년·장애인·문화예술인 등을 비롯해 지방 위기지역 등 다른 분야의 부분 기본소득은 추후 발표할 예정이다.   이 지사는 ""소멸성 지역화폐와 결합한 기본소득은 공정성장 전략의 핵심""이라며 ""이 시대 최대 과제인 소득양극화 완화정책인 동시에 소비 확대, 소상공인 지원, 매출양극화 완화로 지역경제와 골목상권을 살리는 경제정책""이라고 설명했다.   이어 ""40여 년 전 매월 7000원만 있었다면 제가 학원비를 벌려고 공장을 다니다 팔에 장애를 입고 군대를 못 가는 불행은 없었을 것""이라며 ""기본소득제도로 송파 세 모녀에게 월 30만원만 있었으면 가족들의 극단적 선택도 없었을 것""이라고 강조했다.   이 지사는 ""40여 년 전 박정희 정권 당시 불완전하게 만들어진 의료보험이 지금은 세계에 자랑하는 최고의 복지체계로 발전했다""며 ""전국민 기본소득 도입으로 대전환의 시대에 양극화 완화와 지속가능 성장이란 새역사를 만들겠다""고 다짐했다.   ]","['니돈으로 주세요', '', '나라빚이 2천조다. 이넘아. 나라를 얼마나 더 거덜내야 네 욕심이 채워지냐?', '또 시작이네 포퓰리즘대명사  줄돈 있으면 니돈으로 주거라  나라가 빚 투성이다 알것냐?', '', '제가 대통령이 되면 이재명이는 산채로 곱게 포장해서 북쪽 똥돼지 김정은이에게 상납하겠습니다.', '', '세금을 지돈인 줄 아네!   ㄴㅃㄴ', '', '', '', '좋게 봤는데 자꾸 돈준다는게 수상하네요.\n\n얼마나 젊은 사람들을 바보로 만들 생각이신가요.\n\n일할수있게 해줘야지 젊은 사람들 돈을 주고 라면만 먹게 할 생각인가?', '공산주의보다 자유 시장경제가 좋다는것은 수십년전에 이미 검증된 사실인데~~~국민을 가축으로 알고 당근주며 사육 하려는가?', '국민들아 이번엔 제발 넘어가지 말자.. 저거 결국 니들 세금이야', '물고기를 주지말고 낚시하는 법을 가르쳐주기 바랍니다!!\n세금으로 생색은 그만. 어차피 국민들의 피땀인것을...', 'ㅋㅋㅋ니 호주머니에서 꺼내서 주면 인정할게 뭔 세금으로 생색낼 생각만 하루종일하냐? 어차피 우리 빚이잖아 ㅋㅋ', '근데 도대체 왜 청년들한테는 더 주는거임??\n청년 일자리지원금다 뭐다 왜 그러는거임??\n일자리가 널리고 널렸어요~~~\n청년만 국민이고 이 나라 희망인건가??', '', 'ㅁ ㅣ 친', '', '사지멀쩡한 청년들한테 왜주는건가요', '참 어이가 없다 그돈 나중에 누가 갚아야 하냐? 그돈 받은 청년들과 그후배들 세대다 나라 곳간을 자기 주머니인양 선심성 정책 누가 못하냐? 민주당 한번 더 집권하면 정말 아르헨티나 꼴 나겠다', '이재명씨 뭘 착각 하고 있는것 같은데 나라돈이 당신 것 아냐  세금을 네 마음대로 쓸려고 하냐 네 사비로 한다면 괜찮지만 세금 축내지마', '이런 경우를 사기꾼으로 보는게 합리적이다. 모두 국민 돈을 걷어서 자기 돈 주는 것 처럼 하는 행위가 바로 국민 기만행위이고, 결국 우리 자식들이 이 모든 부담을 지게 된다. 국민들이 돈 나눠주는 것 당장은 좋아할 지 모르나, 현명한 국민은 이 부담을 자식들에게 전가하기를 원하지 않는다. 이 도둑놈아', '', '아니 기본소득말고, 소득세를 줄이는 혜택을 주라니깐... 왜 쳐노는애들한테 돈을 줘야되는데?????', '내돈을 지가 주는것처럼 얘기 하네~~', '', '미쳤나보다. 일자리를 만들어. 연 200받는 실업자 만들지말고. 이재명이가 대통령되면 우리나라는 완전 사회주의되는거임. 제발 국민여러분들 깨어나시길... ㅠ', '', '국민세금으로 그렇게 퍼주지 말고 세금이나 줄여라  그  지   새  끼   야   그것이 정말 옳은 일이다  세금에 허리가 휜다', '한 인간의 권력 욕심때문에 망국으로 가나...', '또 표팔이 정치~~~  역겹다', '', '나라를 통째로 거덜낼 놈 이재명🤬🤬🤬', '야이 정신병자야 일자리 창출하고 청년들에게 미래를 열어주는 정책을펴야지 표때문에 100만원드립치냐.. 국가부채는 니돈으로낼래?? 선진국아직멀엇다', '니돈 이니? 얼척이 없다!', '부지런하고 성실한 국민들을 몇푼 안되는 돈으로 거지처럼 빌어먹고 살라고 하네, 그런 돈 있으면 어려운 생활보호 대상자를 확대하던지 지원금액을 늘려라 죄파들 머리속엔 20세기에 망한 공산주의가 지상과제 인듯', '주려면 똑같이 주던가\n왜 내세금 걷어서 청년들한테 퍼주는거지?\n이게무슨 전국민기본소득이니', '', '', '나라 말아먹을라고작정했네', '니돈이가  소금좀 뿌리라  정상이 아니구나', '공산주의 국가에서도 하지 않는 돈 배급을 한다는거네... 1년안에 베네수엘라꼴 나겠군,,', '진짜 빨갱이 맞다 제발 사회주의 빨갱이들이 좋으면 북한가서 살아라 나라 망하게 하지말고 안그래도 문재앙때매 힘든데', '청년이 뭐라고 2배나 주나요', '박그네가 기초연금들고나와서 돈뿌리기시작하면서 이제는 돈선거네  니도끄지고 무임승차없애고 기초연금없다는공약들고 나오면뽑자', '', '', '나라에서 돈을 풀면 물가가 올라간다 돈을푼만큼 세금도 더걷어야하고 악순환이다 결국 하향 평준화  바보들 노력해서 돈벌생각하자 니들이 뽑아놓은 정치인들이 지금 부동산이고 경제를 어떻게 망쳐놓았는지 보라 지금이 살기좋나 평생 흙수저로살게끔 만들어줘도 좋단다 에이그', '화폐 가치가 그러면 더 떨어질껀데 더 집값 폭등 하길 바라는건가', '지돈아니라고 펑펑', '예전엔 고무신 나눠주면 투표해달라고 했었는데, 그 고무신은 개인돈으로나 마련했었지. 근데 이재명은 전생에 봉이 김선달이었는지 지 돈도 아니고 세금으로 돈 주겠다고 하고 표를 달라네... 이걸로 재미좀 봤지 성남시장에 경기지사에... 근데 전국민 재난 지원금 그 얼마 안되는걸 나눠주고 세금 인상하는거 생각해보면 이재명 표주면 또 세금을 또 얼마나 올릴지 답이 없다.', '본인이 대통령되고 권력잡기위해서 나라돈 지다 퍼주겠다는 포퓰리즘', '', '', '그냥\n무조건 국민들 아파트 한채씩 꽁짜로\n주는정책 고민해보시죠\n당선입니다', '차베스=이재명', '100만원은 명분이고 이걸 저달하겠다는 방벚이 핵심이죠', '100만원을 받았는데 라면 한그릇 값이 10만원이 되는 상상했습니다. 웃고갑니다 훠훠훠', '어느나라', '지역화폐는 좋은제도 맞음 근데 뭘 자꾸준데?', '', '전과4범 양아치식히야. 할라면 1억 해야지. 월8만원 받으면 살림살이 나아지냐? ㅋㅋㅋ', '', '세금가지고 인심쓰듯 펑펑 쓰는구나\n날 대통령시켜주라\n그런건 나도할줄안다', '', '지사님 주는건 좋습니다. 청년 100 만원 더 주는건... 큰 그림 이신가요?? 다자녀 가구에 더 주는게 맞지 않나 싶은데요?', '', '제발 부탁인데 저런걸로 선심 쓰지마 나중에 뒷감당 어떻게 할라고 그래? 여가부 폐지 하고 그 예산으로 편성 하면 인정 ㅋ', '뭐가 문제 있는데요', '', '치가 떨린다 \n\n니 돈으로 줘', '', '생쏘를하네 선거철 다가오니 선거 끝나고 공약해라\n선거법위반아니냐 선심성 표얻기위한 공약', '', '', '월2만원을 거창하게 연 25만원으로 표현하는 사기꾼놈', '청년한테 주는 이유를 설명해봐?', '', '아주 그냥 집을 한채씩 줘 그냥 ....돈주니 좋다고 젊은애들 표 찍을텐데....큰일이다 증말', '형수 쌍욕 덮으려고, 무리하게 기본소득으로 현혹하고있다. 세금으로하는 매표 공약이다!', '', '', '', '무섭다 빨갱이나라..', '여기서 세금 더 뜯기겠노. 차라리 일안하고 돈받는게 낫겠수다.', '돈주면 좋지만 이건아니다.\n\n무한퍼주기..미래는뻔하다  \n\n노무현정권이후에  좌파장악공영방송,\n좌익언론서 특집방속으로 칭찬자자하던\n베네수엘라,\n떵떵거리고 살던  베네수엘라사람들  \n차베스극좌파  정권 처럼  마구무한퍼주기..미래는뻔하다  목표 베네수엘라나\n아르헨티나  짝나게,\n\n차베스극좌파  정권  마구  퍼주고  ,쿠바등에 석유 헐값팔고,  호기롭게   반미 하면서 미국에원조한다고 큰소리치면서\n 미국에  도전하다가      망해서,  이웃나라가서  저임노동자로 구걸하며,   몸판다한다.\n\n포퓰리쥼해서  성공한 나라없다.', '지금 태어나는 신생아가 60~80년대 30% 수준인데 세금은 누가 내냐? 대통령 5년 할려고 미래 50년을 망칠 작정이냐?', '정상 아닌자식', '어려운이웃 돕기도 바쁜데 전국민에 청년과 차별은 몹니까?\n터널 화재 예방을 위해 급히 써야될 예산도 없어서 아직도 안하고 있다는데... 살기좋은 나라를 만들어야지 구걸하는 나라를 만들겠다고 떠들고  국민 편가르기하는 저런사람들은 추방합시다.', '', '허경영이보다도 더한 또라이 새      끼네!', '청년...\n실업급여 받아서 개꿀이라는 지인\n제 실수령액이랑 크게 차이가 안 나더라구요.\n현타가 씨게 오네요', '', '좌우를 가리지말고 \n==&gt;\n진실(Truth)와 사실(Fact) 기반에서만 바라봅시다.\n●필로퐁포함 \n마약전과3범 김부선 \n몽땅 허언 입증 영상===&gt;\n■ https://youtu.be/fNn1RUuRF7g\n&lt;&lt;&lt;쥴리랑 윤석렬의 비밀&gt;&gt;&gt;                                  ■https://youtu.be/DD850JNwbMM                ■https://youtu.be/bT5uvCHnll0', '멍멍멍 꿀꿀꿀꿀 크엉크엉', '지겹다 본인 호주머니돈도 아닌데.', '어차피 계속 기본 소득이라고 우기실거면 금액이라도 좀 소득다와 보이게 차라리 1인당 100년에  1억준다고 하세요.', '베네수엘라행 급행열차', '이재명 화이팅..대한민국을 업그레이드해 주세요..', '']",http://www.chungnamilbo.co.kr/news/articleView.html?idxno=612649,https://n.news.naver.com/mnews/article/014/0004679428?sid=100
2021.07.29.,프레시안,,방역이 돌보지 않은 빈곤의 그늘,,,https://www.pressian.com/pages/articles/2021072814593866595?utm_source=naver&utm_medium=search,http://www.chungnamilbo.co.kr
2021.07.22.,아시아경제언론사 선정,,"[전문]이재명 “임기 내 청년기본소득 연 200만원, 전국민 100만원 지급”",,,https://view.asiae.co.kr/article/2021072210181621483,http://www.pressian.com/
