Date,Press,Category,Title,Content,Comment,URL_Origin,URL_Naver
2021.07.31.,데일리안,,"‘현대의료기’ 경기도 광주 독거노인 180가구 돌침대, 흙침대 지원 실시",,,https://www.dailian.co.kr/news/view/1017295/?sc=Naver,http://www.dailian.co.kr/
2021-07-31 09:06:07,더팩트언론사 선정,경제,"양주시, 노인장기요양기관 총량제 시행","[     ⓒ사진제공 = 현대의료기[데일리안 = 이현남 기자] 옥침대 전문 ‘현대의료기’가 지난해 기부 활동에 이어, 2021년 3분기 경기도 광주 독거노인 180가구를 대상으로 돌침대, 흙침대를 지원했다고 밝혔다.현대의료기는 기부한 제품에 대해 사용 시 불편함이 없도록 무상설치 및 평생 무상AS를 지원하기로 약속했다.이동학 대표는 “이번 해에도 어려운 이웃들을 위한 뜻 깊은 기부를 하게 되어 기쁘다. 기부를 통해 주변의 어려운 이웃들이 조금이나마 힘이 되었으면 하는 것이 저희 현대의료기 직원 모두의 마음이다.”라고 전했다.지난해에는 광주시노인복지관과 노인복지증진 및 노년기 건강지원·안정보장을 위한 돌침대 지원 사업 업무협약을 맺은 바 있다. 해당 업무협약은 10년 장기 프로젝트로 돌침대, 흙침대 2000대(30억 상당)를 어려운 독거노인들 위해 무상으로 지원한다는 내용이다.이러한 공로를 인정받아 경기도 광주시장상 표창을 수여받은 바 있다.현대의료기는 이전부터 저소득층, 불우이웃 등 어려운 이들을 위한 기부활동 지원 사업을 진행하면서 사회적 기업으로 자리 잡아 나가고 있다.한편, 전국 34개 매장을 운영 중인 현대의료기의 제품들은 전자파를 차단하는 실리콘 테프론 무자계 열선을 사용해 KC마크, 품질보증Q마크, 삼성생명 PL보험 등을 획득했다. 국내 안전 인증 뿐만 아니라 전 세계 전기 안전 인증을 취득해 국제적으로 안전이 검증된 제품들이다.   ]",[],http://news.tf.co.kr/read/national/1877703.htm,https://n.news.naver.com/mnews/article/119/0002516378?sid=101
2021.07.28.,뉴시스,,"HDC현산 참여 '서울아산병원 컨소', 청라의료타운 우선협상자 선정",,,http://www.newsis.com/view/?id=NISX20210728_0001530021&cID=10401&pID=10400,http://www.tf.co.kr/
2021-07-26 15:44:18,경기신문,사회,"'경영 위기' 용인시 보육시설, 노인요양시설 업종 전환 모색","[     경기 양주시는 26일 노인장기요양기관 지정 총량제를 지정.고시했다. /양주시 제공노인요양시설, 노인요양공동생활가정 등 노인의료복지시설 신규지정 제한 경기 양주시는 26일 지역 내 장기요양기관의 과잉 공급을 방지하고 시설급여 등급자에게 양질의 요양서비스를 제공하기 위해 노인장기요양기관 지정 총량제를 지정·고시했다.이번 총량제는 노인장기요양보험법과 보건복지부 지침 개정을 근거로 현재 과잉 공급된 관내 노인의료복지시설 지정을 제한하고 공급률이 110% 미만일 경우 신규 지정이 가능하도록 하는 내용이 주요 골자다.이에 따라 노유자시설 신·증축, 용도변경 등으로 인한 지정, 기존 재가노인복지시설에서 노인의료복지시설로 변경, 노인요양공동생활가정 용도 중 단독·공동주택 지정 등은 제한된다.시행일 이전 접수된 노인의료복지시설과 그 외 재가노인복지설, 국·공립 장기요양기관의 경우는 설치가 가능하다.노인장기요양제도가 시행된 2008년부터 양주시 관내 노인의료복지시설은 연평균 7.4개 기관이 지정돼왔다.현재 운영 중인 총 104개 기관 중 2018년부터 2020년 3년간 46개 기관이 설치되는 등 시설 수가 최근 몇 년 사이 큰 폭으로 증가했다.시설 수가 증가하는 만큼 지자체에서 부담하는 기초생활수급자 시설급여 예산 규모도 꾸준히 늘어 2017년 46억원에서 2021년 173억원으로 매해 평균 32억씩 늘어 총 127억이 증가했다.최근 인구 증가와 함께 시설급여를 제공받는 기초생활수급자 전입자가 늘어 최근 5년간 총 526억원의 시설급여 예산을 지출하는 등 시의 재정 악화마저 우려되고 있는 실정이다.특히 서울과의 접근성이 우수한 백석읍과 장흥면은 다른 지역에 비해 요양단지 개발, 모텔 리모델링으로 전체 시설의 54%가 밀집해 있는 상황이다.경기도 내 노인인구 수 대비 정원비율 평균은 3.72%이지만 양주시는 평균치의 3.2배인 12.1%로 도내 가장 높은 수준이다.경기도 내 시설 정원대비 현원비율(입소율) 평균은 82.84%이나 양주시는 75.04%에 그쳐 공실률 또한 높은 편이다.양주시는 이번 총량제 실시로 영리목적의 개인시설 중심으로 설치된 장기요양기관의 난립과 과열경쟁에 따른 노인요양서비스 질적 저하를 방지하고 시설 지정 강화를 통한 재정전건성 확보에도 기여할 것으로 내다보고 있다.양주시 관계자는 ""서울시와 인접한 경기도 지자체 중에서도 양주시는 노인인구 대비 월등하게 많은 노인의료복지시설이 자리잡고 있어 진입 장벽을 높이는 총량제를 시행한다""며 ""1년 주기로 시설 공급률을 파악해 신규 지정 여부를 판단할 예정""이라고 말했다. ]",[],https://www.kgnews.co.kr/news/article.html?no=659271,https://n.news.naver.com/mnews/article/629/0000097152?sid=102
2021.07.30.,뉴스프리존,,"청양군보건의료원, 8월 2일부터 CT 장비 활용 진료에 들어간다",,,http://www.newsfreezone.co.kr/news/articleView.html?idxno=328675,http://www.newsis.com
2021-07-28 17:39:24,제민일보,경제,"노인성 안질환, 조기발견 위해 정기적인 검진으로 관리해야","[ ""의료복합도시 시너지 창출""    [서울=뉴시스] 홍세희 기자 = HDC현대산업개발이 참여한 서울아산병원 컨소시엄이 인천 경제자유구역에 들어서는 청라의료복합타운 우선협상 대상자로 최종 선정됐다.28일 HDC현대산업개발에 따르면 청라의료복합타운은 인천 서구 청라국제도시 내 8만4802평 부지에 800병상의 종합병원과 의료바이오 관련 산·학·연, 오피스텔, 노인복지주택, 상업시설 등을 조성하는 사업이다.총사업비 2조4000억원의 대규모 프로젝트로, 인천이 최첨단 의료복합도시의 기능을 갖추는데 상당한 시너지가 예상된다.서울아산병원 컨소시엄은 국내 최고의 병원으로 손꼽히는 서울아산병원을 비롯해 하나은행, 카이스트, KT&amp;G 및 HDC현대산업개발, 우미건설, 도우씨앤디, 액트너랩 등이 참여했다.서울아산병원 컨소시엄은 청라국제도시에 글로벌 최고 수준의 중증 해외 환자 치료 및 해외 의료진 교육 인프라를 조성하고, 의료바이오 분야 국가 국제 경쟁력 강화를 위해 서울아산병원의 진료·교육·연구·상생 비법을 그대로 이식한 본원 수준의 '서울아산병원청라' 설립을 추진해 나갈 예정이다.한편 서울아산병원 컨소시엄은 오는 11월까지 주무관청인 인천경제자유구역청과 사업협약을 체결하고, 토지매매계약 및 인허가 절차를 거쳐 2023년 9월 착공을 목표로 하고 있다. ]","['청라 날아가는 소리 들리네요', '축하드립니다', '디자인 구리다. 참 현대스럽다.']",http://www.jemin.com/news/articleView.html?idxno=721896,https://n.news.naver.com/mnews/article/003/0010634431?sid=101
27면 TOP,부산일보,,고신대. 보건·복지·의료에 특화… 체계적 실습 인프라로 ‘실무형 인재’ 육...,,,http://www.busan.com/view/busan/view.php?code=2021072913585549899,http://www.kgnews.co.kr/
2021.07.28.,경기일보,,양주시 노인의료복지시설 총량제 시행으로 시설 난립 막는다,,,http://www.kyeonggi.com/news/articleView.html?idxno=2374112,http://www.newsfreezone.co.kr/
2021.07.29.,뉴스경남,,의료기관 없어졌는데 부속기관 장례식장 영업?,,,http://www.newsgn.com/310191,http://www.jemin.com
2021.07.30.,이뉴스투데이,,"남해군, 취약계층 어르신 대상 무료 노인건강진단",,,http://www.enewstoday.co.kr/news/articleView.html?idxno=1500484,http://www.busan.com/
2021.07.28.,경기일보,,양주시 노인의료복지시설 총량제 시행으로 시설 난립 막는다,,,http://www.kyeonggi.com/news/articleView.html?idxno=2374112,http://www.kyeonggi.com/
2021.07.29.,뉴스경남,,의료기관 없어졌는데 부속기관 장례식장 영업?,,,http://www.newsgn.com/310191,http://www.newsgn.com
2021.07.27.,헤럴드경제,,"양주시, 노인장기요양기관 지정제 강화(총량제) 지정 고시",,,http://news.heraldcorp.com/view.php?ud=20210727000036,http://www.heraldbiz.com/
2021-07-27 07:23:02,이뉴스투데이,정치,"남해군, 취약계층 어르신 대상 무료 노인건강진단","[ 노인의료복지시설 신규지정 제한…시설 공급률 110% 미만으로    양주시[헤럴드경제(양주)=박준환 기자]양주시(시장 이성호)는 지역 내 장기요양기관의 과잉 공급을 방지하고 시설급여 등급자에게 양질의 요양서비스를 제공하기 위해 노인장기요양기관 지정제 강화(총량제)를 지난 26일 지정 고시했다.이번 총량제는 노인장기요양보험법과 보건복지부 지침 개정을 근거로 현재 과잉 공급(공급률 123%)된 관내 노인의료복지시설 지정을 제한하고 공급률이 110% 미만일 경우 신규 지정이 가능하다는 것을 골자로 한다.이에 따라 시행일 이전 접수된 노인의료복지시설과 그 외 재가노인복지설, 국·공립 장기요양기관의 경우 설치가 가능하지만 ▷노유자시설 신·증축, 용도변경 등으로 인한 지정 ▷기존 재가노인복지시설에서 노인의료복지시설로 변경 ▷노인요양공동생활가정 용도 중 단독·공동주택 지정 등은 제한된다.노인장기요양제도가 시행된 2008년부터 관내 노인의료복지시설은 연평균 7.4개 기관이 지정돼왔으며 현재 운영 중인 총 104개 기관 중 2018년부터 2020년 3년간 46개 기관이 설치되는 등 시설 수가 큰 폭으로 증가했다.특히 서울과의 접근성이 우수한 백석읍과 장흥면은 다른 지역에 비해 요양단지 개발, 모텔 리모델링으로 전체 시설의 54%가 밀집해 있는 상황이다.경기도 내 노인인구 수 대비 정원비율 평균은 3.72%이지만 양주시는 평균치의 3.2배인 12.1%로 도내 가장 높은 수준이며 경기도 내 시설 정원대비 현원비율(입소율) 평균은 82.84%이나 양주시는 75.04%에 그쳐 공실률 또한 높은 편이다.또한 시설 수 증가에 비례해 지자체에서 부담하는 기초생활수급자 시설급여 예산 규모는 꾸준히 증가해 2017년 46억원에서 2021년 173억원으로 매해 평균 32억씩 늘어 총 127억이 증가했으며 최근 인구 증가와 함께 시설급여를 제공받는 기초생활수급자 전입자가 늘어 최근 5년간 총 526억원의 시설급여 예산을 지출하는 등 재정 악화 우려가 제기되고 있다.양주시는 이번 총량제 실시로 영리목적의 개인시설 중심으로 설치된 장기요양기관의 난립과 과열경쟁에 따른 노인요양서비스 질적 저하를 방지하고 시설 지정 강화를 통해 재정전건성 확보와 예산누수 방지에 기여할 것으로 내다보고 있다.市 관계자는 “서울시와 인접한 경기도 지자체 중에서도 양주시는 노인인구 대비 월등하게 많은 노인의료복지시설이 자리잡고 있어 시설의 건전한 운영과 서비스 품질 저하를 막을 수 있도록 진입 장벽을 높이는 총량제를 시행한다”며 “1년 주기로 시설 공급률을 파악해 신규 지정 여부를 판단할 예정”이라고 했다. ]",[],http://www.enewstoday.co.kr/news/articleView.html?idxno=1500484,https://n.news.naver.com/mnews/article/016/0001866656?sid=100
2021.07.31.,CTS,,"이스라엘, 노인들을 위한 3차 COVID 백신 승인한 첫번째 국가",,,https://www.cts.tv/mission300/detail_mission/246/5443,http://www.enewstoday.co.kr/
2021.07.30.,글로벌이코노믹,,"건설사 ""새 수익원 '의료복합단지' 잡아라""",,,http://www.g-enews.com/ko-kr/news/article/news_all/202107291829333496891d26c649_1/article.html,http://news.cts.tv
2021.07.30.,메디컬투데이,,‘서울아산병원 컨소시엄’ 청라의료복합타운 우선협상대상자 선정,,,http://www.mdtoday.co.kr/mdtoday/index.html?no=426216,http://www.g-enews.com/
2021.07.26.,데일리한국,,"전남 장성군, 폭염 취약 노인 보호 나섰다",,,https://daily.hankooki.com/lpage/society/202107/dh20210726145747148510.htm?s_ref=nv,http://www.mdtoday.co.kr
2021.07.27.,경상일보,,울산-광주 공공의료원 설립 공조,,,http://www.ksilbo.co.kr/news/articleView.html?idxno=908162,http://daily.hankooki.com
2021.07.27.,뉴스1,,"경희대의료원-한화건설, 하남시에 종합병원 건립 추진",,,https://www.news1.kr/articles/?4385396,http://ksilbo.co.kr
2021.07.26.,뉴시스,,"""노인·장애인, 옆에 두고 보세요""…산청군, 여름철 질환예방 소책자 배부",,,http://www.newsis.com/view/?id=NISX20210726_0001526056&cID=10812&pID=10800,http://www.newsis.com
2021-07-26 11:09:42,일요신문,사회,"[부산시] 부산의 노인복지 방향, 전문가에게 직접 듣는다 外","[     [산청=뉴시스] 산청군 의료급여 대상자 건강관리 소책자. *재판매 및 DB 금지[산청=뉴시스] 정경규 기자 = 경남 산청군은 여름철 각종 질환에 노출되기 쉬운 저소득 의료급여 대상자들의 건강관리를 돕기 위해 소책자를 제작·배부한다고 26일 밝혔다.소책자에는 만성질환인 당뇨병, 고혈압, 심장병, 관절염부터 일상적으로 자주 걸리는 피부질환, 위장질환, 안과질환, 치주질환까지 총12개의 질환에 대한 원인과 증상, 대응방법이 보기 쉽게 정리돼 있다.신규 의료급여 수급자 및 만성질환자 등 의료급여대상자 가정방문시 전달할 예정이며 일부는 읍면사무소, 민원과에 비치할 계획이다. 의료급여 제도는 생활유지능력이 없거나 생활이 어려운 저소득 주민의 의료문제를 국가가 보장하는 제도다. 건강보험료 부담 없이 의료기관 이용에 따른 본인부담금을 전액 또는 일부 지원해준다. 신청은 주소지 읍면사무소를 방문하면 된다.군 관계자는 “여름철 폭염과 코로나19 감염병에 취약한 저소득 의료급여 대상자들이 평상시 다양한 질환에 스스로 대응할 수 있도록 소책자를 제작했다”며 “특히 온라인 정보를 취득하기 어려운 노인·장애인들이 일상적으로 옆에 두고 볼 수 있을 것으로 기대된다”고 설명했다.이어 “앞으로도 과도하게 의료기관을 찾지 않고 스스로 질환 관리를 할 수 있도록 맞춤형 의료급여 사업을 적극 추진하겠다”고 말했다. ]",[],https://ilyo.co.kr/?ac=article_view&entry_id=407752,https://n.news.naver.com/mnews/article/003/0010628284?sid=102
2021.07.30.,의학신문,,"원격의료‧택배배송, '논의 내부'에서 목소리 더 내야",,,http://www.bosa.co.kr/news/articleView.html?idxno=2155761,http://www.ilyo.co.kr
2021.07.26.,울산매일신문,,"울산-광주, 지방의료원 설립 '예비타당성 면제' 공동 대응",,,http://www.iusm.co.kr/news/articleView.html?idxno=918212,http://www.bosa.co.kr
2021.07.24.,뉴시스,,"복지부, 추경 1조8578억 확정…의료기관 손실보상",,,http://www.newsis.com/view/?id=NISX20210724_0001524878&cID=10201&pID=10200,http://www.iusm.co.kr
2021.07.27.,EBN,,"악사손보, 용산구·중구 선별진료소 의료진에 아이스조끼 전달",,,https://www.ebn.co.kr/news/view/1493627/?sc=Naver,http://www.newsis.com
2021-07-24 13:41:25,CNB뉴스,사회,"서울아산병원 컨소시엄, 청라의료복합타운 우선협상대상자 선정","[ 국내 코로나19 백신 개발 지원 등    [서울=뉴시스] 전신 기자 = 김부겸 국무총리를 비롯한 국무위원들이 24일 새벽 서울 여의도 국회에서 열린 제389회 국회(임시회) 제3차 본회의에서 2021년도 제2회 추가경정예산안 의결 상황을 지켜보고 있다. 2021.07.24. photo1006@newsis.com[서울=뉴시스] 김남희 기자 = 보건복지부가 24일 국회 본회의를 통과한 추가경정예산(추경)으로 1조8578억원을 확보했다. 국회 심의과정에서 최근 코로나19 확진자 급증 상황 등을 고려해 정부안(1조5502억원) 대비 3076억원 증액됐다.추가 확보한 예산은 코로나19 피해지원 및 민생안정, 방역·백신 보강 중심으로 구성된다. 사업별로 ▲의료기관 등 손실보상 2000억원 ▲생활치료센터 운영지원 510억원 ▲코로나19 대응 의료인력 지원 240억원 ▲코로나19 결식아동급식비 한시지원 300억원 ▲감염병 트라우마 심리지원 30억원 등이 증액됐다. 노인일자리 및 사회활동 지원에는 4억원이 감액됐다.기초생활수급자, 법정차상위, 한부모가족 양육비 지원을 받고 있는 한부모가족에게 1인당 10만원 소비지원금을 지급하는 '저소득층 소비플러스 자금'에 2960억원의 예산이 반영됐다. 296만명이 추가 지원을 받는다. 부양의무자 기준 전면 폐지의 조기시행에 따른 예산 476억원도 확보했다. 내년 10월부터 수급자 본인의 소득·재산이 기준을 충족하는 경우 부양의무자 유무에 관계없이 생계급여를 지급한다.코로나19로 갑작스런 위기상황에 처한 저소득 가구 지원을 위해 긴급복지 한시완화기준 적용기간을 올해 6월30일까지에서 9월30일까지로 연장하는 데 소요되는 예산 915억원도 추가됐다. 코로나19로 구직이 힘든 저소득층의 자활근로 참여가 증가함에 따라 참여정원 확대(3000명) 및 기존 자활근로 1만2000명분 지속 지원 예산 155억원도 확보했다.코로나19 방역과 백신 보강 예산도 확대된다. 코로나19 대응에 따른 의료기관과 약국 등의 비용 및 손실에 대한 보상금으로 1조1211억원을 확보했다. 생활치료센터 운영비 지원에 510억원, 코로나19 대응 의료인력의 사기진작 및 감염관리 노력 지원에는 240억원, 보건소 대응인력 지원에 147억원의 예산이 추가됐다.글로벌 백신허브 구축을 위한 백신 및 원부자재 생산역량 확충을 위해 ▲백신 및 원부자재 생산시설·장비 지원 180억원 ▲국내 백신 전문인력 양성 28억원을 확보했다. 코로나19 백신개발 기업에 임상 3상 비용을 지원하는 예산에 980억원이 추가 편성됐다. ]",[],http://www.cnbnews.com/news/article.html?no=504195,https://n.news.naver.com/mnews/article/003/0010625930?sid=102
2021.07.26.,브레이크뉴스,,"양주시, 노인장기요양기관 총량제 지정 고시",,,http://www.breaknews.com/823050,http://www.ebn.co.kr
2021.07.27.,데일리한국,,"광양노인복지관, ‘어르신 자아통합프로그램’ 마무리",,,https://daily.hankooki.com/lpage/society/202107/dh20210727145429148510.htm?s_ref=nv,http://www.cnbnews.com
2021.07.28.,브릿지경제,,"장성군, 폭염 취약 노인 보호대책 추진",,,http://www.viva100.com/main/view.php?key=20210728010006940,http://www.breaknews.com
2021.07.26.,백세시대,,"대한노인회 강원 동해시지회, 한방의료봉사단 방문",,,http://www.100ssd.co.kr/news/articleView.html?idxno=79200,http://www.100ssd.co.kr
2021.07.28.,중앙일보,,태국서 코로나 ‘고려장’…확진 판정 80세 노인 절에 버려져,,,https://news.joins.com/article/olink/23710436,https://www.joongang.co.kr
2021-07-28 11:58:05,뉴시스,세계,노인 환자 대피시키는 중 정저우 구조대,"[       보건 관계자들이 쓰러져있는 80세 노인을 돕고 있다. 방콕포스트 캡처. 연합뉴스           태국에서 신종 코로나바이러스 감염증(코로나19) 확진 판정을 받은 80세 노인이 절에 버려진 채 발견됐다.      27일(현지시간) 방콕포스트 및 타이거(Thaiger) 등 현지 매체에 따르면 태국 나콘랏차시마주(州) 소재 한 병원 직원이 소셜네트워크서비스(SNS)에 글을 올려 이런 사연을 알렸다.      노인이 발견된 인근의 한 사찰 승려는 지난 25일 한 여성과 그의 남편이 노인을 ‘아버지’라 부르며 사찰로 데려왔다고 전했다. 이들은 콘깬주(州)에 살 때 아버지가 이 승려를 알았고, “아버지가 사찰에서 함께 지내고 싶어한다”고 말하며 노인과 옷가지가 담긴 가방을 내버려 둔 채 차를 타고 황급히 떠났다.      노인은 절에 온 지 이틀 뒤 사찰 주변을 헤매다가 인근 산책로에 쓰러져 비를 맞고 있는 채 발견됐다. 신고를 받고 출동한 의료진이 그를 옮겨 코로나19 검사를 진행했고, 결과는 양성이었다.      이후 노인은 그의 출신지를 고려해 콘깬주의 한 병원으로 옮겨졌다. 노인이 코로나19 양성 판정을 받음에 따라 사찰의 승려 및 의료진 등은 밀접접촉자로 분류돼 격리 조치됐다.      마을 촌장은 현지 매체에 “딸이 아버지를 이런 식으로 다뤄서는 안 된다”며 “마을 사람들 또한 코로나19에 감염될 위험에 처했다”고 밝혔다.   ]",[],http://www.newsis.com/view/?id=NISI20210723_0000793921,https://n.news.naver.com/mnews/article/025/0003122303?sid=104
2021.07.27.,인천일보,,"안산의료복지사회적협동조합, 4년 연속 고용노동부 강소기업 선정",,,http://www.incheonilbo.com/news/articleView.html?idxno=1106730,http://www.newsis.com
2021-07-23 12:09:34,전북일보,세계,"무주군민들, 서울대병원 의료서비스 제공 받는다","[     [정저우=신화/뉴시스] 22일(현지시간) 중국 허난성 정저우 중무 현에 있는 푸와이 중국 중앙 심혈관병원에서 구조대가 노인 환자를 이송하고 있다. 최근 내린 기록적인 폭우로 홍수가 발생하면서 주변 도로와 병원 로비가 침수돼 병원에 고립됐던 환자, 환자 가족과 의료진이 이날부터 구조대의 도움으로 이 병원에서 대피하기 시작해 지금까지 약 5000명이 대피한 것으로 전해졌다. 2021.07.23.[사진 영상 제보받습니다] 공감언론 뉴시스가 독자 여러분의 소중한 제보를 기다립니다. 뉴스 가치나 화제성이 있다고 판단되는 사진 또는 영상을 뉴시스 사진영상부(n-photo@newsis.com)로 보내주시면 적극 반영하겠습니다. ]",[],http://www.jjan.kr/news/articleView.html?idxno=2113479,https://n.news.naver.com/mnews/article/003/0010624351?sid=104
2021.07.30.,백세시대,,"이명식 대한노인회 충북연합회장 ""자연환경 뛰어난 충주에 노인전문교육원 설...",,,http://www.100ssd.co.kr/news/articleView.html?idxno=79515,http://news.itimes.co.kr
2021.07.29.,LG헬로비전,,[기획보도]집에서 치료 받는다!…'찾아가는 의료서비스',,,http://news.lghellovision.net/news/newsView.do?soCode=SCC0000000&idx=315672,http://www.jjan.kr
2021.07.15.,뉴시스,,"전남자치경찰, 노인성폭력 예방 탄력순찰 강화",,,http://www.newsis.com/view/?id=NISX20210715_0001514039&cID=10809&pID=10800,http://www.100ssd.co.kr
2021.07.29.,이뉴스투데이,,"바르게살기운동 밀양시협의회, 의료진에 코로나19 극복 간식 응원",,,http://www.enewstoday.co.kr/news/articleView.html?idxno=1500339,http://news.lghellovision.net/
27면 TOP,헤럴드경제,,헬스케어·약 배달·노인돌봄...보험의 진화,,,http://news.heraldcorp.com/view.php?ud=20210726000474,http://www.newsis.com
2021.07.29.,경상일보,,[특별기고]공공의료원 건립은 지역균형발전의 또 다른 이름,,,http://www.ksilbo.co.kr/news/articleView.html?idxno=908389,http://ksilbo.co.kr
2021.07.23.,한국경제,,"은수미 성남시장, 의료진과 자원봉사자에 'K-방역의 자부심' 격려",,,https://www.hankyung.com/society/article/202107233515h,http://www.hankyung.com/
