Date,Press,Category,Title,Content,Comment,URL_Origin,URL_Naver
2021-07-30 14:31:00,디지털타임스,사회,"보험업계, 한국의 솜포홀딩스 나온다...""요양서비스 투자 이어질 것""","[     30일 정상혁 보은군수가 사회복무연수센터에 격려품을 전달하고 있다. (보은군 제공)© 뉴스1(보은=뉴스1) 장인수 기자 = 보은군은 아덴만 파병 근무 중 코로나19에 감염돼 치료를 위해 장안면 사회복무연수센터에 입소한 청해부대 장병들과 합동지원단에 격려품을 전달했다고 30일 밝혔다. 정상혁 보은군수는 이날 격려품을 전달하면서 ""나라를 위해 파병됐던 장병들이 코로나19에 감염돼 안타깝다""며 ""빠른 쾌유를 기원한다""고 했다. 현재 사회복무연수센터에는 청해부대 장병과 인근 시·군에서 발생한 무증상·경증환자들이 수용돼 있다. 의료진 70여명과 행정인력이 상주해 환자들을 돌보고 있다.[옥천군자원봉사센터, 새 운영위원회 출범]  옥천군자원봉사센터는 신임운영위원 10명과 연임운영위원 9명을 위촉했다고 30일 밝혔다.  신임 위원장은 강정옥 새마을문고중앙회 충북도지부회장이 선출됐다. 부위원장은 권영건 옥천군산림조합장, 사무국장은 김태원 대청호수난구조대 대장이 뽑혔다.  위원 19명은 오는 2023년 6월 30일까지 2년간 자원봉사센터 운영, 예산 및 결산, 자원봉사단체 지원 육성에 관한 사항을 결정하는 역할을 맡는다.  군에 등록된 자원봉사단체는 320여개, 활동 인원은 1만2191명이다.[옥천보건소 극단적 선택 예방 생명배달사업 추진]옥천군보건소는 노인의 극단 선택 예방을 위한 '생명배달사업'을 한다고 30일 밝혔다.  생명배달 분야는 자살을 암시하는 언어·행동·상황 신호를 생생하게 보고 듣기와 자살생각 및 계획을 명확하게 묻기, 경청과 공감으로 배려 깊게 반응하기, 전문가와 연계해 달라지도록 돕기 4단계로 나뉜다.  군 보건소는 4차례 교육과 간담회를 거쳐 생명지킴이 25명을 위촉했다.  생명지킴이는 8월부터 11월까지 관내 119명의 고위험 홀몸 노인 가정을 방문해 안부를 묻고, 건강 상태를 꼼꼼히 확인한다.   ]",[],http://www.dt.co.kr/contents.html?article_no=2021072502109963074001&ref=naver,https://n.news.naver.com/mnews/article/421/0005512749?sid=102
2021.07.26.,뉴스투데이,,초고령사회 되면 KB손해보험과 삼성화재 간의 새로운 승부처는?,,,https://www.news2day.co.kr/article/20210726500201,http://www.dt.co.kr/
2021-07-25 19:07:05,JTBC언론사 선정,경제,"[영상] 젊은 여성 내세운 호주 '백신 광고', 논란된 이유는?","[ 금융당국 ""보험사 요양 서비스 사업 진출 방안 마련할 것""KB손보, 보험사 중 유일하게 요양 서비스 사업 진출    KB손해보험의 두번째 도심형 요양시설 'KB골든라이프케어 서초빌리지' 연합뉴스    금융당국이 보험사의 요양 서비스 사업 진출을 위한 제도 개선 방안을 마련하겠다고 밝히면서 보험업계에서는 '한국의 솜포홀딩스' 탄생에 기대가 모아지고 있다. 일본의 대형 손해보험사인 솜포홀딩스는 지난 2015년 요양 서비스 사업에 진출해 현재 일본 내 시설 요양사업 업계 1위, 순매출 2위의 보험사로 성장했다.25일 보험연구원 및 국민건강보험공단 등에 따르면 국내 65세 이상 고령자 수는 2030년 1296만명으로 증가할 전망이다.장기요양 인정자 수도 2008년부터 지속적으로 증가하고 있고, 지난해 기준 65세 이상 장기요양 인정자는 85만7000명으로 65세 이상 노인인구 수의 약 10%를 차지하고 있다. 금융위원회는 향후 65세 이상 인구 증가 및 수면연장에 따른 후기고령자(75세 이상 고령자) 증가 등으로 잠재적으로 용양서비스 대상자가 꾸준히 증가할 것으로 보인다. 이에 금융위는 지난 15일 보험연구원, 보험업계 관계자 등과 간담회를 열고 보험사의 요양 서비스 사업 진출과 관련한 제도 개선 방안을 지속해서 검토하겠다고 밝혔다. 요양 서비스는 고령·노인성 질병으로 일상생활을 혼자 수행하기 힘든 노인에게 신체·가사활동을 지원하는 서비스다.금융당국의 제도 개선을 통해 향후 보험사의 요양 서비스 산업 진출이 가능해진 것이다. 국내와 달리 이미 일본은 2000년 '공공 노인장기요양(개호)보험' 도입과 함께 민간 사업자의 요양업 진출을 허가했고, 보험사는 물론 파나소닉, 세콤, 츠쿠이 등 대기업들이 기존 소규모 요양기업을 인수하며 요양산업에 진입했다.특히, 일본의 대형 손해보험사인 솜포홀딩스는 요양서비스 부문에서 독보적인 모습을 보이고 있다. 솜포홀딩스는 2015년 메시지, 재팬케어 등 4개 요양기업을 인수하며 노인요양산업에 진출해 2018년 '솜포케어'를 설립하고 자회사들을 합병했다.현재 솜포케어는 재가(사업소 수) 686개, 시설(침실 수) 2만5500개를 보유하고 있다. 이는 시설 요양사업 분야에서는 업계 1위 규모이고, 지난해 순매출액은 1318억엔(1조4000억원)으로 업계 2위사로 성장했다. 솜포케어는 현재 수억엔을 투자해 요양서비스의 디지털화에 나서고 있다. 이를 통해 시설 입주자들의 건강상태는 물론, 수면, 식사, 배면 등을 데이터화해 더 폭넓은 서비스로 확대해 나갈 계획이다.  국내 보험사 중에서는 유일하게 KB손해보험이 요양서비스 사업에 진출했다. KB손보는 지난 2016년 'KB골든라이프케어'를 설립해 현재 거주형 노인의료복지시설인 2곳과, 출퇴근식 돌봄서비스인 재가노인복지시설 2곳을 운영하고 있다.   위례빌리지는 정원 128명의 10배 이상이 입소를 위해 대기하고 있고, 서초빌리지 대기자도 정원에 3배 수준에 달할 정도로 인기가 높다. 초기 투자금이 워낙 높아 KB골든라이프케어는  적자를 벗어나지 못하고 있지만, 제도개선과 함께 요양사업이 활성화되면 빠른 성장세를 보일 것으로 보인다. KB손보에 이어 삼성화재도 요양서비스 사업에 진출을 노리고 있다. 삼성화재는 지난 23일 간병인 매칭 플랫폼 '케어네이션'을 운영하는 ㈜HMC네트웍스에 전략적 투자자로 참여하기로 했다. 삼성화재는 HMC네트웍스와 간병 서비스 플랫폼 성장에 협력하고, 중·장기로 '시니어 생태계'에 적합한 헬스케어 서비스를 공동 개발할 계획이다.보험업계 관계자는 ""제도 개선을 통해 앞으로 금융사들의 요양서비스 산업 진출이 더 활발해 질 전망""이라며 ""특히 보험사들은 헬스케어와 함께 요양서비스 사업을 새로운 신성장 동력 분야로 보고 시니어 사업에 대한 투자가 이어질 것으로 보인다""고 말했다.     ]",[],https://news.jtbc.joins.com/article/article.aspx?news_id=NB12015970,https://n.news.naver.com/mnews/article/029/0002688875?sid=101
2021.07.15.,MBN언론사 선정,,"김두관, 윤석열 직격…""중학생도 세금 왜 걷는지 안다""",,,http://mbn.mk.co.kr/pages/news/newsView.php?category=mbn00006&news_seq_no=4551839,http://www.news2day.co.kr
2021.07.24.,한국경제,,영탁·장민호·김희재 확진…TV조선 백신 새치기 시도 '선 넘었다' [이슈+],,,https://www.hankyung.com/entertainment/article/202107234053H,https://news.jtbc.co.kr
2021.07.24.,한국경제,,영탁·장민호·김희재 확진…TV조선 백신 새치기 시도 '선 넘었다' [이슈+],,,https://www.hankyung.com/entertainment/article/202107234053H,http://www.hankyung.com/
2021-07-24 05:51:00,뉴스토마토,,"일본 사회적 과제에 ICT·AI 기술 접목…""제조·물류 인력난 해결""",[],[],http://www.newstomato.com/ReadNews.aspx?no=1062474&inflow=N,https://n.news.naver.com/mnews/article/015/0004582763?sid=106
2021.07.20.,뉴시스,,"""군립요양병원 짓고 싶어요"" 무주군, 특별교부세 요청",,,http://www.newsis.com/view/?id=NISX20210720_0001519857&cID=10899&pID=10800,http://news.etomato.com/
2021.07.30.,코메디닷컴,,불규칙한 심장박동으로 젊은 층 사망 급증,,,http://kormedi.com/?p=1348192,http://www.newsis.com
2021-07-20 16:20:16,부산일보,사회,낙후 대명사 김해 동부 3개면 생활편의 대폭 향상,"[     [무주=뉴시스] 한훈 기자 =전북 무주군은 20일 세종시에 위치한 행정안전부의 교부세과를 찾아 지역 현안사업의 필요성을 설명하고, 특별교부세 반영을 요청했다.(사진=무주군 제공).2021.07.20.  photo@newsis.com *재판매 및 DB 금지[무주=뉴시스] 한훈 기자 = 전북 무주군이 군립요양병원 건립 등 대표적인 현안사업을 풀 특별교부세 확보를 위해 중앙정부 문을 두드렸다. 무주군은 20일 세종시에 위치한 행정안전부의 교부세과를 찾아 지역 현안사업의 필요성을 설명하고, 특별교부세 반영을 요청했다. 이날 김희옥 부군수는 행정안전부의 교부세과를 찾아 '무주군립요양병원 건립사업'에 대한 설명과 지원을 요청했다. 총 142억원이 필요한 이 사업은 고령의 노인과 치매 환자 수 증가 등 높아지는 보건의료 수요에 대응해 구상됐다. 이곳에서는 만성질환과 외과적 수술 또는 상해 후 회복이 필요한 환자, 노인성 질환자 등에게 안정적 의료서비스를 제공한다. 군은 연면적 3500㎡ 규모에 진료실과 병실(치매병동 포함), 재활·물리치료실, 프로그램 운영실 등을 갖출 것을 희망한다.군은 군비 부족분 35억원 중 15억원을 특별교부세로 반영시켜 달라고 정부에 요청했다. 김희옥 부군수는 ""열악한 보건의료 환경을 극복하고 지역성장 동력을 만들기 위해 최선을 다하고 있다""면서 ""군립요양병원 등 현안사업이 ‘무주다운 무주, 행복한 군민’실현이라는 알찬 결실로 맺힐 수 있도록 주력할 것""이라고 밝혔다. ]","['당연히 필요는 하지만 자체 재원으로 해야되는게 아닐런지, 다른 지역에서도  해달라 요구하면 나라 정책을 운용하는데 예산이 부족할 수 있을텐데.. 좋은 묘수를 생각해봅시나.']",http://www.busan.com/view/busan/view.php?code=2021073010281045616,https://n.news.naver.com/mnews/article/003/0010618279?sid=102
2021.07.26.,교수신문,,[동국대] 데이터·네트워크·인공지능 특성화…AI융합학부 인문․자연 선발,,,http://www.kyosu.net/news/articleView.html?idxno=72608,https://www.kormedi.com/
2021-07-30 14:31:09,KBS,생활/문화,“더 어려운 이웃에게 쓰이길”…자활기업 ‘작은 기부’ 실천,"[     [사진=게티이미지뱅크]심장이 불규칙하게 뛰는 심방세동과 관련된 사망이 30대 후반 등 젊은 층에서 특히 큰 폭으로 증가하고 있다는 새로운 연구 결과가 나왔다.  미국 노스웨스턴대 연구 결과에 따르면 심방세동 관련 사망자 가운데 35~64세의 연간 증가율이 약 7.4%로 65~84세(약 3.0%)의 약 2.5배나 되는 것으로 나타났다. 이 연구 결과는 29일(현지 시각) 미국심장협회 저널(Journal of the American Heart Association)에 발표됐다.  심방세동(Atrial fibrillation)은 심장박동이 불규칙한 부정맥 질환으로 뇌졸중·심부전 및 혈전, 기타 심혈관계 합병증 등의 주요 원인으로 꼽힌다. 60세 이후에 가장 많이 나타나는 것으로 알려져 있다. 연구팀은 심방세동 환자가 2030년 미국에서만도 1,210만 명 발생할 것으로 내다봤다.  연구팀은 미국 질병통제예방센터(CDC)의 데이터를 이용해, 심방세동과 관련된 심혈관 질환으로 2011~2018년 숨진 35~84세 사망자 27만 6천여 명을 정밀 분석했다.  그 결과, 2018년 심방세동 관련 사망자가 2011년에 비해 인구 10만명 당 약 4명꼴 늘어난 것으로 나타났다. 특히 30대 후반 등 젊은 층의 심방세동 관련 사망자가 상대적으로 크게 늘어난 것으로 분석됐다. 또 흑인 남녀의 심방세동에 의한 사망이 백인 남녀보다 훨씬 더 빠른 속도로 증가하고 있는 것으로 밝혀졌다.  연구의 제1저자인 다나카 야스히로 박사(연구원)는 ""젊은 층과 취약계층의 예방 및 치료가 매우 중요하다""고 말했다. 그는 심방세동의 진단 시기, 발병 기간, 치료 여부에 대한 데이터 부족 및 사망 원인 분류의 오류 가능성 등으로 이번 연구가 제한적이라고 밝혔다. 연구팀은 스마트워치 및 기타 웨어러블 기기가 심방세동의 조기 발견을 개선하고 사망률을 낮출 수 있는지 확인하는 연구를 검토 중이다.  미국 캔자스시티 심장리듬연구소 심장 전문의 라케시 고피나타나이르(Rakesh Gopinathannair)박사는 ""심방세동은 불과 10년 전만해도 주로 노인들의 질병이었으나, 이제는 30대 환자를 예전보다 훨씬 더 많이 보고 있다""고 말했다.  그는 이번 연구 결과가 심방세동의 조기 발견 및 4대 관리지침의 중요성을 보여준다고 평가했다. 심방세동의 4대 관리지침이란 혈전 예방을 위한 항응고제 복용, 심박수 조절, 약물 또는 의료 시술을 통한 심장율동 조절, 위험 요인을 조절하는 생활방식의 개선 등이다. 권장되는 생활방식 개선에는 정상 혈압 및 콜레스테롤 수치의 유지, 금연, 규칙적인 운동, 건강에 좋은 음식 섭취, 적당한 음주 및 정상 체중 유지 등이 포함된다.  고피나타나이르 박사는 이 연구가 30대 후반의 환자들에게도 건강해지는 방법을 자문해 볼 것을 촉구하는 셈이라고 강조했다. 그는 ""조금만 신경 쓰면 심방세동에는 물론 당뇨·심장병의 전반적인 발병 위험 감소에도 도움이 되는 일석이조의 효과를 기대할 수 있다""고 말했다.  ]","['', '']",https://news.kbs.co.kr/news/view.do?ncd=5245817&ref=A,https://n.news.naver.com/mnews/article/296/0000051083?sid=103
2021.07.25.,전라일보,,전북지역 불볕더위 지속...온열질환 속출,,,http://www.jeollailbo.com/news/articleView.html?idxno=633248,http://www.busan.com/
2021-07-30 10:49:08,뉴스1,사회,"""우리 모두의 것인 공유지가 약탈당하고 있다…대안은?""","[ 2025년까지 생활SOC복합단지화 365생활권 실현    김해시에서 사실상 가장 낙후된 동부권 3개 면이 2025년이면 시내권 부럽지 않은 기초생활서비스를 누릴 수 있게 된다.농림축산식품부의 농촌협약 시범사업에 시가 선정되면서 올해부터 5년 간 국비 340억원을 포함해 611억원을 투입해 생림·상동·대동면 각 면 소재지를 중심으로 배후마을을 연계한 생활SOC복합단지가 조성되기 때문이다.동부생활권인 생림·상동·대동면은 개발이 어려운 산악 지형에다 김해 19개 읍·면·동 가운데 인구수에 있어서도 가장 적은 곳들로 5월 기준 상동면이 3134명, 생림면 3799명, 대동면 5913명 순이다.그러나 이제 달라진다. 3개 지역의 중심에 있는 상동면은 역사·문화산업 중심의 행복거점으로, 북측 생림면은 관광·여가·복지 중심의 동행거점, 남측 대동면은 교육·보육·체육·보건의료 중심의 나눔거점으로 개발된다.이렇게 되면 차량 이용을 기준으로 각 거점 내 서비스 이용은 5분 이내, 거점 간 연계된 한 차원 높은 서비스는 30분 이내, 그리고 시내권 서비스는 60분 이내 이용할 수 있게 돼 동지역 부럽지 않은 365생활권이 형성된다.365생활권이란 30분 내 보건·보육 등 기초생활서비스를, 60분 내 문화와 여가‧교육을, 5분 내 응급서비스를 누리는 생활을 뜻한다.또 도심으로 가지 않고도 면 소재지 등에서 기초생활서비스를 제공받을 수 있게 돼 지역 내 소비가 이뤄지면서 농촌경제 활성화에도 큰 도움이 될 것으로 기대된다.역사·문화산업 거점인 상동면에는 2023년까지 행정·복지·역사문화·산업 기능의 행복누림센터가 조성돼 주민교육, 컨설팅에서부터 지역공동체 양성, 문화·체육·의료·교육, 공영주차장 서비스를 제공한다. 또 산딸기 주산지 특성을 살려 2025년까지 산딸기 농촌융복합산업지구를 조성한다.교육·보육·체육·보건의료 거점인 대동면은 2025년까지 교육·체육·보건의료 기능의 온누리센터와 다목적주차장, 풋살장을 조성하고 찾아가는 의료서비스를 제공한다. 이와 함께 2025년까지 대동스포츠센터를 건립하고 농산물 전시판매장과 휴게쉼터를 조성해 생활체육과 테마형 서비스를 누릴 수 있게 한다.관광·여가·복지 거점인 생림면은 행정·복지·보육·체육 기능의 동행센터와 복지·여가·건강 기능의 생활문화센터를 조성해 생활체육교실, 노인건강교실과 다양한 문화강좌를 제공한다.허성곤 시장은 “농림축산식품부와 정책적 협력 거버넌스를 구축하고 지자체가 수립한 농촌생활권 발전방향에 맞춘 투자협약을 체결했으며 농촌지역의 보건, 복지, 의료, 교육 등 기초생활서비스 접근성을 대폭 향상시켜 365생활권을 실현하겠다”고 밝혔다.한편 이번 김해동부권 농촌지역 개발사업을 위해 최근 허성곤 시장과 김현수 농식품부 장관은 업무협약을 체결했으며 이번 사업은 문화·복지·행정·보건·보육 분야 14개 세부 사업으로 구성돼 있다. ]",[],https://www.news1.kr/articles/?4379545,https://n.news.naver.com/mnews/article/082/0001110461?sid=102
2021.07.31.,일요신문,,"고신대병원·이드웨어, 치매 예방 서비스 확산 위한 업무협약",,,https://ilyo.co.kr/?ac=article_view&entry_id=408238,http://www.kyosu.net
2021.07.23.,컨슈머타임스,,"인천시, 전국최초 '치매환자 인간존중 돌봄기법' 도입",,,http://www.cstimes.com/news/articleView.html?idxno=468743,http://www.cstimes.com
2021.07.30.,뉴스1,,14년째 방치 '노른자 땅' 수원 영통 병원 부지에 뭐가 들어설까,,,https://www.news1.kr/articles/?4389127,http://news1.kr/
2021-07-30 16:54:24,충청타임즈,사회,"18~49세, 8월26일부터 화이자·모더나…9일부터 10부제 예약","[ 공원·교육시설·복합문화공간 등 의견다양·…일부는 병원설립 희망 사업시행자 지구단위계획 먼저 제안…시 ""시민이 원하는 대로 조성""    경기 수원시 영통구 영통동 961-11 모습.© 뉴스1 유재규 기자(수원=뉴스1) 유재규 기자 = ""지역주민을 위한 필요시설이 들어섰으면 좋겠습니다.""경기 수원시 영통구 영통동의 14년 째 방치 중인 종합의료시설 부지 일대에 거주하는 주민들은 30일 취재진에게 이같이 말했다. 종합의료시설 부지 3만1376㎡ 규모의 영통구 영통동 961-11은 대형종합병원을 건립하기 위해 을지학원재단이 지난 2007년 10월에 매입한 곳이다. 해당 부지 주변으로 공공주택 단지가 대규모로 조성돼 있으며 학교·대형마트·금융기관 등 편의시설 구축은 물론, 수인분당선(영통역)까지 교통도 편리한 그야말로 '노른자 땅'이다.하지만 을지재단 측에서 병원수요 부족 등 병원을 건립할 만한 여러 조건이 들어맞지 않아 이곳을 매입하고도 14년 째 나대지(裸垈地)로 방치해뒀다. 그러던 중, 지난 6월 한 사업시행자가 공동주택용지 72.7%, 업무시설용지 23,4%, 도로 3.9% 등으로 개발하겠다는 '도시관리계획(지구단위계획) 결정(변경)안'을 시에 제출했다. 시 관계자는 ""현재 해당 부지에 어떤 건축물이 들어설지에 대해서는 아무것도 결정된 것이 없다""며 ""인근에 거주하는 시민들의 의견을 우선 수렴 후, 진행하도록 할 것""이라고 말했다.실제로 취재진이 해당 부지와 바로 인접하고 1600세대가 거주하는 공공주택 거주민을 만나본 결과, 의견은 다양했다. 시민 A씨는 ""분수대와 정원으로 꾸려진 공원이 들어섰으면 좋겠다""며 ""인근 근린공원으로 가려면 너무 멀어 갈 수가 없다""고 말했다. 시민 B씨도 ""풋살장, 배드민턴장, 농구장 등 체육시설이 포함된 공원이 있으면 더할 나위 없겠다""며 ""야산이 인접한 만큼 산책로와 약간의 트래킹 코스도 바란다""고 전했다. 시민 C씨는 ""해당 부지 바로 옆에 지역난방공사 건물이 있고 인근에 쓰레기 소각장도 있는데 녹지환경의 주거지역으로 될 수 있도록 조성돼야 한다""며 ""많은 꽃들과 나무가 심어져 있으면서 식당과 카페를 이용할 수 있기를 바란다""고 소망했다. 시민 D씨는 ""복합문화공간으로 조성됐으면 좋겠다""며 ""요즘같이 더운 날씨에는 서울의 코엑스나 광교(수원)의 아브뉴프랑 등 복합문화공간에 가는 것이 훨씬 좋다. 그곳에 즐길거리와 먹거리가 다 갖춰져 있기 때문이다""고 설명했다. 시민 E씨는 ""이곳은 영덕고교, 영통초교, 태장중학교, 영일초교 등 학군이 우수한 지역인 만큼 아이들을 위한 교육시설이 구축 됐으면 좋겠다""고 바랐다.     경기 수원시 영통구 영통동 961-11 지구단위계획 구성안.(수원시 제공)© 뉴스1병원 유치를 그대로 희망하는 주민들도 있었다. 시민 F씨는 ""노인들은 이렇게 더운 날, 병원을 가기도 힘든데 여기서 제일 가까운 3차 병원인 아주대병원으로 가려면 대중교통을 기준으로 약 40분이다""며 ""너무 멀기 때문에 대형 의료시설이 마련됐으면 좋겠다""고 말했다. 시민 G씨는 ""이곳 주변은 개인병원이나 한의원 등 1차 병원이 전부다""며 ""긴급한 경우에 젊은 사람들은 행동이 빨라 병원을 신속히 갈 수 있지만 노인들은 그럴 수 없다""고 설명했다. 이에 시는 영통 1·2·3동에 거주하는 지역주민을 대상으로 8월19일까지 의견제출을 받기로 했다. 이후 주민들의 의견을 취합하면서 동시에 해당 부지에 어떤 용도가 들어서면 좋을지에 대한 전문가 자문도 구할 예정이다.절차에 따라 취합한 각종 결과물을 시는 사전협상대상인 사업시행자에게 전달한다. 토지면적 2/3 이상에 해당하는 지구단위계획에 대한 토지소유자(을지재단)의 동의를 받으면 사업시행자는 '국토의 계획 및 이용에 관한 법률'에 따라 지자체에 계획안을 제출할 수 있다고 시는 설명했다.따라서 사업시행자가 주민들의 의견을 받아들이지 않으면 사전협상은 결렬되고 반대로 이를 승인하면 개발방향을 설정한 후 도시건축공동위원회의 심의를 거치게 된다.시 관계자는 ""변경된 지구단위계획 내 약 70%가 넘는 주택용지가 있어 해당 부지에 아파트가 들어설 것이라는 소문은 있다""면서 ""하지만 해당 부지에 어떠한 건축물이 들어설지에 대한 결정된 것이 현재 없다. 무엇보다도 시의 입장은 '주민의견을 우선시한다'로 사업을 진행할 것""이라고 말했다.    경기 수원시가 영통동 일대 공공주택 게시판에 게시한 공고문. © 뉴스1 유재규 기자 ]","['ㅎㅎㅎ 토지주는 따로 있는데, 공원이 개발하면 좋겠다고?  개념부족.', '수원시청이 오면 좋겠습니다', '을지재단 땅값 잘라게 올랐습니다,,,, 부동산은 타이밍 이여', '젖소 키우면 좋겠네', '집이나 좀 올려줘.... 수원 집값 어쩔 ㅜ']",http://www.cctimes.kr/news/articleView.html?idxno=667489,https://n.news.naver.com/mnews/article/421/0005513205?sid=102
10면 1단,서울신문,,열돔 무더위 여름 무서워,,,https://www.seoul.co.kr/news/newsView.php?id=20210721010020&wlog_tag3=naver,http://www.cctimes.kr
2021.07.29.,이데일리,,"순천향대, 고교생 진로탐색 교육과정 운영",,,http://www.edaily.co.kr/news/newspath.asp?newsid=02935606629119440,https://www.seoul.co.kr
