Date,Press,Category,Title,Content,Comment,URL_Origin,URL_Naver
2023.02.06.,매경헬스,,"콩에 풍부한 '트립토판', 노인 우울증 예방에 도움 [헬스키친]",,,http://www.mkhealth.co.kr/news/articleView.html?idxno=62343,http://www.mkhealth.co.kr/
2023.02.05.,뉴시스언론사 선정,,"우울증 온 만성질환 노인…""극단선택 생각"" 9배 더 한다",,,http://www.newsis.com/view/?id=NISX20230203_0002179944&cID=10201&pID=10200,http://www.newsis.com
2023-02-05 08:00:00,전국매일신문,사회,[의학칼럼] 혹시 치매일까? '노년 우울증',"[ 기사내용 요약중앙대 손연정 교수팀, 복합 만성질환 노인 2만여명 분석2개 이상 만성질환 노인 7명 중 1명 최근 1년새 '자살생각' 수면시간 6시간 미만 또는 9시간 이상이면 자살위험 증가    [서울=뉴시스]﻿﻿2개 이상의 만성 질환을 앓는 노인 7명 중 1명이 최근 1년 새 자살을 생각해 본 것으로 나타났다. 또 복합 만성 질환을 앓고 있는 노인이 우울증이 동반되면 자살을 생각할 위험이 그렇지 않은 노인보다 9배 이상 높았다. (사진= 자생한방병원 제공) 2022.10.04[서울=뉴시스] 백영미 기자 = 2개 이상의 만성 질환을 앓는 노인은 극단선택을 더 자주 생각하며 특히, 복합 만성 질환을 앓고 있는 노인이 우울증까지 동반되면 자살을 생각할 위험이 그렇지 않은 노인보다 9배 이상 높다는 조사결과가 나왔다. 5일 한국식품커뮤니케이션포럼(KOFRUM)에 따르면 중앙대 간호학과 손연정 교수팀은 질병관리청의 2017년 지역사회건강조사에 참여한 복합 만성 질환을 앓는 만 65세 이상 노인 2만533명을 분석한 결과 이 같은 사실을 파악했다. 손 교수팀은 노인이 고혈압·당뇨병·관절염 중 2개 이상을 앓고 있으면 복합 만성 질환을 앓는 것으로 분류했다. 지난 1년간 ‘자살 생각을 한 적이 있다’고 응답한 노인은 전체의 13.6%(2790명)였다.만 65세 이상 복합 만성 질환을 앓는 노인 중 여성이 남성보다 자살을 생각할 가능성이 1.2배 더 높았다. 또 노인의 가구 월 소득이 100만 원 미만이면 100만 원 이상인 노인보다 자살 생각 가능성이 1.4배 높았다. 신체활동이 적은 노인이 자살을 생각할 가능성은 신체활동이 활발한 노인의 1.4배였다.손 교수는 “복합 만성 질환을 앓는 노인은 통증이 심해지고 거동이 어려워지면서 보행 속도와 신체활동이 급격히 떨어진다”며 “신체활동이 줄면 자살 생각으로 이어질 수 있어 신체 활동량을 늘리는 것이 중요하다”고 말했다. 매일 앉아서 생활하는 시간이 4시간 이상인 복합 만성질환 노인이 자살을 생각할 가능성은 이보다 짧은 노인보다 1.2배 높았다. 손 교수는 “복합 만성 질환을 앓는 노인은 통증이나 피로감, 거동의 어려움이나 기능의 제한으로 앉아있는 시간이 일반 노인이나 한 가지 질환을 앓는 노인보다 길어져 자살을 생각할 위험이 더 커진다""고 말했다. 앉아있는 시간이 4시간 이상 되면 당뇨병이나 심혈관 질환 등 만성질환이 급격히 늘거나 악화되고 생존기간이 짧아져 사망률이 높아진다는 연구 결과도 있다. 수면시간이 6시간 미만이거나 9시간 이상인 복합 만성질환 노인의 경우 6∼8시간 자는 노인에 비해 자살을 생각할 가능성이 각각 1.48배, 1.75배 높았다. 미국수면재단이 권고한 65세 이상 노인의 적정한 수면시간은 7~8시간이다. 2007년부터 2015년까지 실시된 국민건강영양조사 결과 한국 노인의 평균 수면시간은 약 6.5시간으로 나타났다. 또 수면시간이 6시간 미만이거나 9시간 이상일 때 만성 질환 보유 개수가 증가한다는 연구 결과들이 보고됐다.우울증은 복합 만성 질환을 앓는 노인의 자살 위험을 높이는 가장 강력한 위험인자였다. 우울증이 있는 노인이 자살을 생각할 가능성은 그렇지 않는 노인의 9.3배에 달했다.    이번 연구 결과는 대한임상건강증진학회지 최근호에 실렸다． ]","['늙고병드는건\n태어나면 겪을수 밖에없는과정이다\n아무도 비켜갈수없는 과정이다', '안락사도입 시급하다.', '십수년 전부터 기회될 때마다 부르짖었다. 철저한 감시 조사아래 안락사, 존엄사 허용헤라. 그 시기 놓치면 죽고싶다는 말도 못하고 식물되는데... 내가 정신은 있는데 아무 의사표현  못한다면 그보다 지옥이 있나? 지금은 겨우 연명치료 거부 서류만 미리 할수 있는데, 그것과 댜르다. 식물되면 가족들과 인사하고 보내주라. 제발....', '나이 들수록 건강 더 챙겨야 한다  건강 잃어면  진짜 비참하고 고통이다  그냥 살아도 우울감 생기는데 ㄴ이들면 그기에다 돈 없고  건강까지 안좋어면  당연히 죽고 싶지...그냥 잠자듯  그냥 안아프게 조용히 가는게 꿈이다...', '노인만그런거아닙니다. 저도 당뇨에합병증으로고생하는50대인데 일자리도없고몸은몸대로아프고의료지원받으려고갔더니원리원칙만따지는통에.', '그럼에도 불구하고 노인 상대로 \n행정심판위원들일 법과 증거가 명백함에도 재결서를 허위로 작성하여 기각한다', 'gr한다ㅋㅋㅋㅋ 사지 멀쩡하면 하늘에 감사하고 1보1배하면서 살아라 우울증은ㄴㅁ가 우울증이여', '나이들어가며  낡아서 고통받게되는 육신으로 정서적 고통도 커진다..해결책이  필요함', '지옥 탈출']",https://www.jeonmae.co.kr/news/articleView.html?idxno=940785,https://n.news.naver.com/mnews/article/003/0011675137?sid=102
2023.02.14.,더퍼스트,,[MD칼럼] 혹시 치매일까? 노년 우울증 살펴봐야,,,http://www.thefirstmedia.net/news/articleView.html?idxno=111433,http://www.jeonmae.co.kr/
2023.02.12.,뉴스퀘스트,,"'노년기 우울증', 대기오염 노출과 밀접 연관...평균 노출 증가 위험도 증가",,,https://www.newsquest.co.kr/news/articleView.html?idxno=203732,http://www.thefirstmedia.net
10면 -1단,한겨레언론사 선정,,손익만 따질 수 없는 ‘대중교통 노인 무임승차’ 핵심 쟁점은?,,,https://www.hani.co.kr/arti/area/capital/1079722.html,http://www.newsquest.co.kr
2023.02.03.,세계일보,,“‘만성질환 2개 이상’ 노인 7명 중 1명 1년 내 ‘극단적 선택 생각’”,,,http://www.segye.com/content/html/2023/02/03/20230203505144.html?OutUrl=naver,http://www.hani.co.kr/
