Date,Press,Category,Title,Content,Comment,URL_Origin,URL_Naver
2021.10.31.,동아일보언론사 선정,,자식에게 기대던 시대에서 셀프 부양의 시대로[서영아의 100세 카페],,,https://www.donga.com/news/article/all/20211030/109993451/1,http://www.donga.com/
