Date,Press,Category,Title,Content,Comment,URL_Origin,URL_Naver
2021.04.27.,데일리벳,,동물 살처분 용어 대신 `안락사 처분`으로？,,,http://www.dailyvet.co.kr/news/policy/146437,http://www.dailyvet.co.kr
17면 TOP,국민일보,,"안락사 직전, 들개 호두에게 기적이 찾아왔다 [개st하우스]",,,http://news.kmib.co.kr/article/view.asp?arcid=0924187938&code=14190000&cp=nv,http://www.kmib.co.kr/
2021-04-24 04:03:02,연합뉴스,생활/문화,"뉴질랜드 안락사법 11월 발효…""희망자 1년에 1천 명 넘을 듯""","[     안락사 직전에 구조된 들개 호두가 새끼들에게 젖을 주고 있다. 윤성희씨 제공재개발지역에는 주민들이 떠나면서 버린 유기견들이 있습니다. 배고픈 유기견들이 하나둘 모여 사람의 손길을 거부하는 들개 무리가 됩니다. 사람들이 신고하면 민간 포획업자들에게 잡혀 ‘마리당 50만원’에 팔리는 운명이 됩니다. 한때 누군가의 반려견이었던 들개들은 그렇게 안락사를 당하지요. 죽음의 문턱에서 구조돼 무사히 새끼를 낳은 2살 어미개가 있습니다. 어미개 호두와 다섯 남매를 소개합니다.    인천의 들개 포획 현장. 사냥용 엽총과 포획틀이 보인다. 인천시 제공호두가 포획된 곳은 들개 문제로 떠들썩한 인천입니다. 인천은 2019년부터 대대적인 들개 포획이 진행 중이죠. 재개발지역 중심으로 버려진 개들이 3~4마리에서 10마리까지 몰려다니며 먹을 것을 찾아 헤맵니다.호두는 지난해 11월 인천 서구를 떠돌던 들개 4인방 중 한 마리였어요. 8㎏의 작은 체구에 귀밑머리가 우아한 호두는 하얀 여우를 닮은 귀여운 외모와 달리 사람에 대한 경계심이 무척 심했답니다. 동물구조단체 행유세(행복한유기견세상) 활동가 윤성희(32)씨는 “시보호소 측이 ‘얘는 너무 사납다’ ‘구조 포기를 권한다’며 사실상 포기했던 들개”라고 소개했지요.    호두와 함께 구조된 들개들. 세 마리는 사회성을 회복해 입양됐지만, 오른쪽 아래 검은 개는 안락사 됐다. 포인핸드 제공그대로 두면 호두는 안락사를 당할 운명이었죠. 윤씨는 “네가 물면 나는 아프겠지. 하지만 네가 죽는 것보다는 그게 낫다”는 심정으로 호두를 품에 안았습니다. 야성이 강한 유기견 여럿을 사회화한 경험이 있었던 그는 모두가 포기한 호두를 돌볼 자신이 있었거든요. 윤씨의 도움으로 안락사 1순위였던 호두는 지난해 12월 6일 행유세에 구조돼 안락사 걱정 없는 쉼터로 이동했습니다.호두의 경계심은 갈수록 심해졌어요. 사람을 물진 않았지만 시선이 닿지 않는 어둑한 곳으로 자꾸만 숨어들었답니다. 봉사자 이슬(32)씨는 “호두가 벽만 바라봐 안타까웠지만 무리해서 사회화하면 안 되기에 다들 조심스럽게 대했다”고 설명했어요.호두가 사나웠던 이유는 나중에 밝혀졌습니다. 어느 날 아침 출근한 보호소 직원들은 전날 밤과 완전히 달라진 호두를 만나게 됩니다. 호두는 임신 상태였습니다. 배 속의 새끼들을 지키기 위해 방어적이었던 거죠. 쉼터에 도착한 지 2주 뒤, 호두는 직원들이 모두 퇴근한 새벽에 자신을 쏙 닮은 5남매를 출산합니다. 출산 직후 빠르게 상냥해진 호두를 보며 보호소 직원들은 안도의 한숨을 쉬었지요.꼬물거리는 다섯 남매를 보며 흐뭇해하는 봉사자들과 달리, 보호소 직원들은 걱정이 태산 같았어요. 형편이 넉넉지 않은 보호소 처지에 늘어난 식구를 감당해야 하니까요. 직원들은 급히 5평 작은 방에 푹신한 이불을 깔고, 호두와 다섯 남매의 육아방을 만들었습니다.호두 가족은 지금 어떻게 지내고 있을까요. 석 달간 뒷바라지를 한 활동가 윤씨의 설명을 들어봤어요.“처음에는 벽에 붙어 벌벌 떨면서 경계심이 완전 최고조였어요. 이제는 얼굴을 알아보고 냄새를 맡고 쓰다듬으면 좋아해요. 들개였던 과거와 비교해보면 마음을 열어주는 게 보여서 직원들도 무척 뿌듯해하고 있죠.”    거리를 떠도는 들개들 모습. 이들도 한때는 반려견이었다. 인천시 제공들개의 포획과 사회화 문제는 논란이 많은 주제입니다. 들개를 야생동물로 여기는 시민들은 ‘왜 야생동물을 억지로 포획하느냐’ ‘성격도 사나운데 안락사하지 왜 굳이 사회화를 시도하느냐’며 반발하지요.  그런데 곱씹어야 할 지점이 있답니다. 타고난 들개는 없다는 사실이에요. 들개 문제를 담당한 익명의 공무원은 “들개들도 원래는 누군가의 반려견이었다. 버림받고 헤매면서 야성을 기른 것”이라며 “포획, 사살보다 동물유기 문제를 해결하는 게 근본적인 해법”이라고 말했습니다.지난 14일, 국민일보는 인천 간석동의 유기견 쉼터에서 호두와 5남매를 만났습니다. 생후 3개월 된 강아지들은 따뜻한 혓바닥으로 날름날름 취재진을 환영해줬어요. 귀여운 외모에 사람을 반기는 성격 덕분에 5남매 중 3마리는 벌써 입양을 떠났습니다.어미개 호두의 사회화도 순조롭게 진행 중이에요. 시간이 더 필요하지만 보호소 직원의 따뜻한 돌봄이 있기에 머지않아 사랑스러운 반려견으로 거듭날 겁니다. 그때가 되면 호두도 입양 가족을 찾을 계획입니다.한 마리의 유기동물을 입양하는 것은 두 마리를 살리는 일이라고 합니다. 안락사의 위기에서 한 생명을 구하고, 입양 간 동물의 빈자리에 또 다른 유기동물 한 마리가 구조될 수 있기 때문이지요.    *안락사 D-1 구조된 어미개, 호두가 품은 5남매의 가족을 기다립니다.첫째: 3개월/ 암컷/ 사람 좋아하고 애교 많은 성격/ 예방접종 5차 완료막내: 3개월/ 수컷/ 차분한 성격, 사람과 어울림/ 예방접종 5차 완료입양을 희망하는 분은 아래의 신청서를 작성해주세요.-http://naver.me/5eGYOeWA이성훈 기자, 김채연 인턴기자 tellme@kmib.co.kr▶ 네이버에서 국민일보를 구독하세요(클릭)▶ 국민일보 홈페이지 바로가기GoodNews paper ⓒ 국민일보(www.kmib.co.kr), 무단전재 및 수집, 재배포금지   ]","['입양간 강아지들은 남은생 행복하길 바라고\n안락사된 강아지는 높은곳에서는 평안하길 바라고\n생명을 하찮게 여기는 사람들은 꼭 그죄 받길바래', '들개다 어쩌다 하기 전에 그 아이들이 왜 들개가 될 수 밖에 없었을까 이기적인 인간이 유기한거지 유기하는 그 자체부터 근절시키고 법 강화해라 그게 답이야', '사람들때문에상처받은거니 당연히 사람들이 책임 져야죠', '이세상  모든 생명들이  행복하길...', '수고 하셨습니다.', '', '들개도 관심갖고 보살펴주면 주인을 잘따르죠. 세상 순둥이가 없을꺼예요. 저  아이들의 모슾이 들개처럼보이질않네요. \n애초에 사람들에서 키워져 이사간다고 버리고 \n 돈들고 귀찮아서 버려지고 ....오갈곳없는 아이들의 무리가 들개로 변했을지도...', '들개,유기견, 실습견 다 사람이 붙이는 이름 ..동물들이 제발 행복하게 살 수 있는 세상이 되면 좋겠다', '개로 태어나고싶어 태어난게 아닐텐데 ..유기되고 학대당하고 더한일도 당하고..알락사만이 답일까요?..저도 반려견키우는 입장에 이런 불쌍한 아이들보면 참 마음아파요..저또한 반성하고요..지금 함께하고있는 아이들 떠나고나면 입양소알아보고 입양하려고 합니다..', '', '마지막에 안락사 된 검정 강아지가 너무 안타깝네요 ㅠㅠ\n하지만 호두가 다섯 남매를 낳았다는 소식에 저절로 미소가 띄어집니다ㅎㅎ\n호두와 다섯남매도 좋은 주인만나서 행복하게 산다니 정말 다행입니다', '저도 학교에서 유기 동물들을 위해 아나바다 행사를 하고 있습니다. 안락사 될 위험에 처한 동물들이 다시 새 가족을 만나 행복하게 살았으면 좋겠습니다. 호두도 다행히 안락사 당할 위험에서 벗어났으니 좋은 가족을 만나 행복하게 지내면 좋겠습니다.', '검은강아지도눈이 너무슬퍼보여요 두려움에떨고있구나 지켜주지못해서미안하다 검은강아지로태어나서 인종차별하고모가다르나  슬프다', '버리지 맙시다 제발', '마지막 검은개 입양못가고 안락사 됬다니 너무 불쌍하다\n사진보니까 표정도 너무슬퍼보인다.가여워라.ㅠㅠ', '지킬것도 없어 보이는 집에 1m도 안되는  목줄에 묶어 놨다가 지들 이사가면 버리고가지. 너들같은 사람땜에 잘 반려하는 사람들 욕먹는다. 반려 못할거 같음 첨부터 키우지 마라!', '', '동물구조단체에서 활동해 주시는 분들께 감사합니다. 누군가의 반려견이었던 개들이 들개로 바뀌어 사납게 변화되는 환경에 처해지는게 안티깝네요. 두마리의 개를 살리는 방법이라는 유기견을 입양이 반려견을 키우고자 하는 사람들한테 더 활성화되면 좋겠습니다.', '제발 동물도 생명인거 인지좀 하고 삽시다ㅠㅠ', '', '닉값과 다르게 왕생당 안가서 다행...', '이런 거 보면 참 강아지들이 안쓰럽고 다행이라는 생각이 들어요. 구조해주신 분들 정말 멋지다고도 생각이 듭니다. 유기견들이 더 이상 많아지지 않았으면 좋겠고 여기 나온 강아지들이 좋은 환경에서 좋은 사랑을 받고 자랐으면 좋겠어요!', '유기견들 생각하면 항상 마음이 아픕니다. 안락사 1순위였던 호두에게 기적이 찾아오게 해 주신 분 정말 천사이십니다! 한 생명을 구하셨습니다. 호두가 앞으로는 걱정없이 건강하고 행복하게 살 수 있기를 기도할게요. 더 이상은 주인에게 버려지는 반려동물이 없기를 바랍니다.', '', '미안하다 얘들아', '아프지말고 건강하게 오래오래 살아라', '인간이 죄가많다 저렇게  따뜻한몇분 빼고는  다들  인정머리없고  끔찍한 인간들이다', '', '개나 사람이나 쪽수가 문재다....', '입양해서 또 그넘이 7ㅡ8마리 새끼치고..그 새끼들이 6.7개월후 또 7ㅡ8마리 새끼치고..그넘들이 또 7ㅡ8마리 새끼들 치고..7×8=56×7=392×7= 니들이계산해라! 한 마리가 1년에 불어날 숫자다! 그거 누가 다 키울거야? 사랑한다면 생각들좀 하고 살아라..위선자들아...', '들개는 누군가의 버려진 반려견이었다  포획 사살 보다 유기견 버리는것 강하게 처벌하는게 해법~~~*', '', '기사 거리라고는']",http://yna.kr/AKR20210422079400009?did=1195m,https://n.news.naver.com/mnews/article/005/0001433554?sid=103
2021.04.19.,노트펫,,"안락사 위기 처했던 육견농장 도사 50여마리, 해외에서 새삶",,,http://www.notepet.co.kr/news/article/article_view/?idx=22103&groupCode=AB110AD110,https://www.yna.co.kr/
2021-04-22 11:42:20,더나은미래,사회,개농장 폐쇄 명령에 농장주 잠적... 동물보호단체들 안락사 위기 식용견 50마...,"[    (오클랜드=연합뉴스) 고한성 통신원 = 뉴질랜드 보건부는 오는 11월 초 안락사법이 발효되면 1년에 1천여 명의 환자들이 안락사를 신청할 것으로 예상한다고 보건부 당국자가 22일 밝혔다.    뉴질랜드 언론에 따르면 보건부 의료 서비스 책임자 앤드루 코널리는 1년에 1천100명 정도가 안락사를 신청할 것으로 예상한다며 하지만 인력 등 제한적인 여건 때문에 이 가운데 3분의 1 정도만이 실제로 안락사 서비스를 받게 될 것으로 보인다고 밝혔다.    뉴질랜드에서 '생명 종식 선택 법'이라고 불리는 안락사법안은 지난해 10월 국민투표에서 통과됐으나 투표 결과가 발표되고 나서 1년 뒤 발효한다는 조항에 따라 오는 11월 7일 법률로 효력을 갖게 된다.    코널리는 '조력자살'이라고도 불리는 안락사 수요가 많지만, 안락사 의료 서비스 참여에 반대하는 의사들이 워낙 많고 자원 부족으로 어려움을 겪고 있는 의료제도의 여건 때문에 수요에 제대로 부응할 수 없을 것으로 보인다고 밝혔다.    뉴질랜드 국회의사당 [신화=연합뉴스 자료사진]     최근 보건부가 전국 2천여 명의 의사들을 대상으로 시행한 조사에 따르면 조사 대상자의 단 10%만이 안락사 서비스에 '틀림없이 참여할 것'이라고 밝혔고 20%는 '참여할 가능성이 있다'고 응답한 것으로 나타났다.    이에 따라 안락사 시행 의료진 부족으로 안락사 참여 의사를 가진 의사들이 다른 지역으로까지 서비스를 나가지 않으면 안 되는 상황이 올 수 있다는 게 보건부의 시각이라고 코널리는 밝혔다.     코널리는 안락사에 참여할 뜻이 있고 나름대로 준비된 의료진을 갖추어 놓는 게 가장 큰 문제라고 말했다.    지방 도시 개업의인 케린 파월은 자신은 안락사에 반대한다며 자신의 대다수 동료 의사들도 그런데 개입하기를 꺼리고 있다고 밝혔다.    그러나 생명 종식 선택협회 메리 팬코 회장은 의료진의 참여 의사를 보고 안락사를 지지하는 회원들이 크게 고무돼 있다고 밝혔다.    그는 ""시작은 느리지만 사람들이 이런 문제에 익숙해져 가면 점차 속도가 붙게 될 것으로 생각하고 있다""며 ""이 문제는 더는 이상한 생각이 아니라 삶과 죽음을 스스로 통제하는 하나의 방식""이라고 말했다.    뉴질랜드의 안락사 법은 18세 이상의 뉴질랜드 시민이나 영주권자 중 생명이 6개월밖에 남지 않고 고통이 참을 수 없을 만큼 심한 말기 질환자들이 의료진의 도움을 받아 죽음에 이를 수 있도록 허용하고 있다.    보건부는 안락사 의료 서비스도 아직 확정되지는 않았지만 정부 예산을 투입해 무료로 제공한다는 계획을 세워놓고 있다고 밝혔다.    koh@yna.co.kr(계속)▶네이버에서도 뉴스는 연합뉴스[구독 클릭]▶[팩트체크] 남녀 징병국가 현실은?▶제보하기&lt;저작권자(c) 연합뉴스(https://www.yna.co.kr/), 무단 전재-재배포 금지&gt;   ]",[],https://futurechosun.com/?p=55464,https://n.news.naver.com/mnews/article/001/0012346594?sid=102
2021.04.18.,경기일보,,"[집중취재, 그후] 경기도, '살처분 →안락사' 축산용어 바꾼다",,,http://www.kyeonggi.com/news/articleView.html?idxno=2358723,http://www.notepet.co.kr
2021.04.17.,국민일보언론사 선정,,"안락사 D-1, 어미 들개에게 찾아온 기적 [개st하우스]",,,https://news.kmib.co.kr/article/view.asp?arcid=0015751967&code=61171811&cp=nv,http://futurechosun.com
2021.04.15.,허프포스트코리아,,14년 간 함께한 사랑하는 고양이를 안락사 시킨 후 삶의 마지막 순간에 대해 ...,,,https://www.huffingtonpost.kr/entry/cat-euthanasia-at-home-vet_kr_6077cd79e4b089e3a2c6d391?utm_id=naver,http://www.kyeonggi.com/
2021.04.14.,아시아경제언론사 선정,,한 해 유기동물 13만마리…'과포화' 보호소 안락사 논란,,,https://view.asiae.co.kr/article/2021041315110767421,http://www.kmib.co.kr/
