Date,Press,Category,Title,Content,Comment,URL_Origin,URL_Naver
2021.04.08.,헬스조선언론사 선정,,아내 호흡기 뗀 남편 징역형… 연명의료 기준 살펴보니,,,https://health.chosun.com/site/data/html_dir/2021/04/08/2021040802827.html,https://www.joongang.co.kr
2021-04-09 09:00:02,가톨릭프레스,생활/문화,"‘사제독신제’ 비판한 ‘반항하는 신학자’ 한스 큉, 93세로 별세","[  ━   [더,오래]백만기의 은퇴생활백서(83)      말기 환자를 대하는 시각에는 두 부류의 견해가 있다. 하나는 병원의 의료 장비를 이용하여 가능하면 환자의 생명을 최대한 연장하려는 견해. 히포크라테스 선서에도 있듯 환자의 생명을 우선으로 생각하는 의사다. 다른 하나는 환자에게 고통만 주는 치료를 지속하기보다 환자가 삶의 마무리를 잘할 수 있도록 돌봄에 집중하려는 견해. 대부분 호스피스 완화의료 의사가 그러하며 임상에서도 이런 자세를 견지하는 의사도 있다.      환자도 두 부류의 견해가 있다. 하나는 신약을 이용해서라도 어떻게 해서든지 자신의 생명을 연장해주었으면 하는 환자. 이들은 생명만 연장할 수 있으면 기꺼이 고통을 감수한다. 가족들 역시 아무런 노력도 하지 않은 채 이대로 그냥 보낼 수 없다는 죄의식과 의무감에 환자의 의견에 동조하기도 한다. 다른 하나는 생명을 연장하기 위해 고통스러운 치료를 감수하기보다 편안한 죽음을 맞이하고 싶다는 환자. 스위스에서는 이런 사람을 위하여 안락사를 용인하고 있다.      환자에게 고통을 주는 치료에 집착하기보다 돌봄에 치중하는 의사와 이제는 치료를 중단하고 편안한 죽음을 맞이하려는 환자가 만난다면 좋은 매칭이라 할 수 있다. 한편 환자의 생명을 어떻게 해서든지 연장하려는 의사와 신약을 써서라도 그러하기를 바라는 환자가 만난다면 치료결과와 죽음의 질은 어떨지 모르지만 그런 관계도 둘 다 원하는 매칭이라 할 수 있다.          환자의 생명을 최대한 연장하려는 의사와 편안한 죽음을 맞이하려는 환자의 관계, 또는 그 반대의 경우에는 과연 누구의 의사를 존중해야 할까? [사진 unsplash]       문제는 의사와 환자가 원하는 바가 다른 경우다. 즉 환자의 생명을 최대한 연장하려는 의사와 편안한 죽음을 맞이하려는 환자의 관계, 또는 그 반대의 경우다. 이럴 때는 과연 누구의 의사를 존중해야 할까? 어떠한 경우라도 당연히 환자가 중심이 되어야 한다. 그러나 실제로는 그렇지 못한 경우가 적지 않다. 병원에 입원하면 환자의 소원보다는 의사의 권위가 우선하기 때문이다. 그래서 어느 일본 의사는 집안의 어르신이 노환으로 운신하기 어려울 때 앰뷸런스를 부를 것인가 말 것인가를 잘 판단해야 한다고 조언했다.      지인이 들려준 얘기다. 일전에 무릎 수술을 받았던 80대의 어머니가 화장실에서 쓰러졌다는 연락을 받았을 때 그는 지방 출장 중이었다. 이웃에게 부탁해 어머니를 급히 병원 응급실로 이송했다. 병원에서 여러 가지 검사를 하던 중 그의 어머니가 말기 암을 지니고 있다는 사실이 밝혀졌다. 노인은 항암치료에 집중하다가 퇴원하지 못하고 두 달 후 중환자실에서 운명했다. 지인은 당시 어머니를 병원으로 모시지 않았으면 어떠했을까, 같은 기간을 살았더라도 고통은 덜 받지 않았을까 하는 뒤늦은 회한에 젖어있다.      예전에는 노인이 병원에서 치료를 받다가 비가역적인 상황에 들어서면 의사가 가족에게 퇴원을 권했다. 병사도 객사로 인정해 될 수 있으면 집에서 가족들과 임종을 맞이했으면 하는 배려에서다. 그러나 요즘은 암 환자의 경우 90% 이상이 병원에서 생을 마감한다. 당사자인 환자는 집에서 마지막 시간을 보내고 싶은데 왜 병원에서 숨져야 할까? 병원에서는 말기 환자를 치료함으로 얻는 수입이 전체 수입의 20%에 달할 정도로 크다. 게다가 의사는 환자의 생명을 연장해야 한다는 사명감이 그의 심적 갈등을 덜어준다. 아파트 문화의 보급으로 가족이 핵가족화해 환자를 돌보기 어려운 면도 있다. 그 와중에 고통을 겪는 것은 오로지 환자가 감당해야 할 일이다.      설사 환자나 가족이 재택 임종을 원해도 현행제도로는 집에서 숨지는 것도 녹록하지 않다. 집에서 사망할 경우 의사의 사망진단서가 없으면 경찰이 개입하기 쉽다. 더구나 생명보험에 가입이 되어 있을 때는 의혹의 시선을 보내기도 한다. 혹시 타살의 개연성은 없는지 가족을 상대로 심문하기도 하고 사인을 밝히기 위해 시신을 부검할 때도 있다. 가족으로서는 참으로 어처구니가 없는 일이다. 부모의 죽음으로 슬픈 가운데 범죄자 취급을 받아야 한다면 누가 재택 임종을 선호할 것인가. 환자는 집에서 임종을 맞이하고 싶어도 가족이 걱정되어 그 마음을 감추고 병원에서 사망하는 사람도 있다.      생활 속에서 미리 대처하는 법은 없을까. 아직 시행 초기이지만 있긴 있다. 의사를 집으로 초빙하는 왕진 제도를 이용하는 것이다. 예전에는 동네 의사가 환자를 찾아가는 왕진이 흔히 있었다. 그러나 의료 장비가 현대화되고 의료보험이 도입되면서 왕진제도는 슬그머니 사라졌다. 물론 의사도 가정을 방문해 환자를 진료하고 싶으나 왕진 보수가 너무 낮아 그러하기가 어려웠다. 다행히 2019년 정부에서 건강보험법 시행규칙에 ‘질병·부상·출산 등으로 거동이 불편해 방문요양급여가 필요한 경우’라는 근거 조항을 담아 왕진 보수를 현실화했다.      왕진 의료기관은 동네 의원으로 한정한다. 환자의 나이나 질환에 제한이 없다. 의사가 거동이 불편해 왕진이 필요하다고 판단한 환자가 대상이다. 환자 1명을 왕진하는 데 보통 1~2시간 걸린다. 왕진하는 동네 의사에게는 건강보험공단이 환자 진찰료, 왕진에 따른 이동 시간과 기회비용 등을 고려해 왕진 1회당 8만~11만 5000원의 수가를 산정해 지급한다. 환자는 왕진료의 30%만 부담하면 된다.      환자가 진료 중 사망하면 왕진 의사가 사망진단서를 발급할 수 있다. 다만 현행 의료법 제17조에는 진료 중인 환자가 최종 진료 시점부터 48시간 이내에 사망한 경우에 다시 진료하지 아니하더라도 진단서나 증명서를 내줄 수 있다고 되어 있다. 이론적으로는 이틀에 한 번씩 의사의 왕진 진료를 받아야 한다는 의미다. 임종이 가까웠을 때는 그럴 수도 있겠으나 노인의 임종을 짐작하기란 사실상 일반인은 어렵다. 그러므로 노인환자는 시간으로 제한할 것이 아니라 한 달에 몇 번으로 횟수를 적용하는 것도 검토할 만하다.          의사도 생활인이라 무조건 희생만 강요할 수는 없다. 어느 정도 수입과 명분만 살려줄 수 있다면 병원 수익을 올리기 위한 진료보다 환자의 소리에 더 귀를 기울이는 진료를 선호하지 않을까. [사진 pixabay]       현재 왕진 시범사업에 참여한 동네 의원은 전국에 348개가 있다. 수요에 비하면 턱없이 적은 숫자다. 보건복지부는 최근 ‘일차의료 왕진수가 청구현황’을 공개했다. 왕진 시범사업을 시작한 2019년 12월 27일부터 지난해 10월 31일까지 약 10개월간 시범사업 대상기관 가운데 실제 청구가 이뤄진 기관은 104곳에 불과했다. 건강보험 수가 청구 환자도 1163명으로 기관당 11.2명에 그쳤다. 원인을 찾는다면 정부의 홍보가 부족했고 의원의 소극적인 자세도 있다.      의사 단체는 정부에서 책정한 왕진 수가가 너무 낮다며 수가를 현실화시켜 달라고 요구하고 있다. 반면 개인적인 신념에 따라 왕진을 나가는 의사도 있다. 지난해 숨진 상계동 은명의원 김경희 원장은 노환으로 병원문을 닫기까지 홀몸 노인을 위해 20년 가까이 무료 왕진을 다녔다. 노원구 중계동의 파티마 의원 장현재 원장도 한 달에 두세 차례 왕진 가방을 들고 환자를 찾아간다. 그는 수가와 무관하게 환자를 돌본다.      지역민과 더불어 비영리 의료협동조합을 결성한 의사도 있다. 2012년 은평구에 살림의원을 설립해 운영하는 추혜인 원장이다. 설립 초기에는 조합원 348명으로 시작했으나 현재는 3200명이 넘는 조합으로 성장했다. 그는 매주 수요일 왕진 진료만 다닌다. 이렇게 할 수 있는 것은 추 원장을 포함해 가정의학과 전문의 2명, 산부인과 전문의 1명, 정신과 전문의 1명이 진료팀을 이루고 있기 때문이다.      의사는 이웃이 건강하기를 원할까, 아프기를 원할까. 당연히 건강하기를 원할 것이다. 그러나 현실은 그렇지 않다. 이웃이 모두 건강하다면 의사도 생활인인데 병원을 운영하기가 어려울 것이다. 그래서 많은 병원과 의원이 하지 않아도 될 치료와 검사를 권하기도 한다. 그러나 의료협동조합은 환자 수에 상관없이 고정적인 월급을 받을 수 있으므로 환자의 건강에 더 초점을 맞춰 진료행위를 할 수 있다. 의사나 환자나 모두 만족도가 높은 것은 물론이다.      얼마 전 동네 의원을 진료차 방문한 적이 있다. 진료를 마치고 의사에게 왕진 시범사업이 활성화하기 위하여 어떤 전제가 필요할 것인가를 물었다. 그는 의료 단체에서 주장하듯 수가를 조정하는 것도 필요하지만 왕진 사업에 참여할 여건을 만들어 주는 것도 중요하다고 강조했다. 의사도 생활인이라 무조건 희생만 강요할 수는 없다. 어느 정도 수입과 명분만 살려줄 수 있다면 병원 수익을 올리기 위한 진료보다 환자의 소리에 더 귀를 기울이는 진료를 선호하지 않을까.      보건복지부는 2019년에 이어 지난달 30일부터 4월 12일까지 왕진 수가 시범사업 2차 공모에 참여할 의료기관을 모집하고 있다. 이를 계기로 점차 왕진 수가 시범사업이 활성화하면 서울 시내 5개 대형 병원으로 쏠리는 환자편중 현상도 해소할 수 있고 사망진단서를 받기 위해 병원에 입원해야 하는 임종 환자의 마음의 짐도 어느 정도 덜어 줄 수 있을 것 같다.      아름다운 인생학교 교장 theore_creator@joongang.co.kr                       ▶ 소름돋게 잘 맞는 초간단 정치성향테스트▶ 넌 뉴스를 찾아봐? 난 뉴스가 찾아와!▶ 당신이 궁금한 코로나, 여기 다 있습니다ⓒ중앙일보(https://joongang.co.kr), 무단 전재 및 재배포 금지   ]",['도대체 어디서 신청하는건가요..? 보건복지부홈페이지에도 안나오는것 같은데.. 도와주세요..!'],http://catholicpress.kr/news/view.php?idx=7005,https://n.news.naver.com/mnews/article/025/0003092148?sid=103
2021.04.08.,오피니언뉴스,,"[차현진 칼럼] 지표금리 개발, 세상은 넓고 할 일은 많다",,,http://www.opinionnews.co.kr/news/articleView.html?idxno=48644,http://news1.kr/
2021.04.08.,크리스천투데이,,동성애·낙태 반대하면 퇴출·정지… 빅테크의 기독교인 검열 우려,,,https://www.christiantoday.co.kr/news/339246,http://www.chtoday.co.kr/
2021.04.08.,중도일보,,"천안지역 반려견, 유기견 등으로 인한 피해 속출",,,http://www.joongdo.co.kr/web/view.php?key=20210408010003283,http://www.joongdo.co.kr
2021.04.08.,한국일보언론사 선정,,[유기동물 구조기] 이사 간다고 줄에 묶여 버려진 백구 '버들이',,,https://hankookilbo.com/News/Read/A2021040516000001695?did=NA,http://www.hankookilbo.com/
2021-04-08 10:36:28,금강일보,생활/문화,"애견카페 맹견, 대체 어떤 일? ""개는 안락사시켰다""","[ 동네 사람이 키우던 개인데 모른 척할 수가 없더라고. 내가 워낙 개를 좋아하기도 하고. 매일 가서 밥을 챙겨줬는데, 더 이상 하기가 어려워서 딸하고 사위한테 좀 도와달라 했지.버들이 제보자 박금순 할머니    이시간다고 줄에 묶인 채 버려진 버들이. 팅커벨프로젝트 제공    이사 간다고 버려졌지만 사람을 매우 좋아하는 버들이. 팅커벨프로젝트 제공동물보호단체 팅커벨프로젝트는 1월 경기 양평군에서 혼자 살던 한 남성이 이사  가면서 1년 6개월 동안 길러온 개를 버리고 갔다는 제보를 받았다. 동물유기는 2월부터 300만 원 이하 벌금형(기존 300만 원 이하 과태료 대상)으로 처벌이 강화됐다. 황동열 팅커벨프로젝트 대표는 원래 보호자를 찾아 경찰에 신고하는 대신 개를 구조하기로 했다. 전 보호자가 또다시 개를 유기하거나 다른 곳으로 팔아버릴 가능성이 높다고 봤기 때문이다.이사 간다고 버려진 개, 외면 못한 이웃 할머니    1년 6개월 넘게 짧은 목줄에 묶여 살던 버들이가 처음 만난 황동열 팅커벨프로젝트 대표를 꼬리치며 반기고 있다. 버들이는 이사 간다는 이유로 전 보호자에게 버려졌다. 팅커벨프로젝트 제공경기 양평군에 사는 박금순(84) 할머니는 지난해 10월 중순부터 매일 걸어서 5분 거리에 있는 이웃집을 찾았다. 그 집에 살던 남성이 이사하면서 짧은 줄에 묶어 놓고 가버린 개의 밥을 챙겨주기 위해서다. 할머니는 평소에도 산책 한번 시키지 않고  묶어 기르는 개가 안쓰러웠는데, 뭐가 그리 좋은지  꼬리를 치며 반기는 개를 외면할 수 없었다. 할머니는 개에게 버들이라는 이름을 지어주고, 비가 오나 눈이 오나  개가 버텨내길 바라며 하루에 한 번씩 밥을 챙겼다.거동이 힘든 할머니가 언제까지 버들이의 밥을 챙겨줄 수는 없는 노릇. 동네 이웃들은  할머니에게 ""버들이를 유기견 보호소로 보내라""고 권했다. 하지만 믹스견인 버들이가 지자체가 운영하는 보호소에 들어가면 안락사당할 가능성이 높다는 얘길 듣고 차마 그렇게 할 수 없었다. 대신 딸에게 사정을 전하며 버들이를 도울 방법을 고민하기로 했다. 순한 버들이, 1분도 안 돼 구조 끝    버들이는 처음 본 황 대표를 보고 꼬리를 흔들며 반겼다. 팅커벨프로젝트 제공박 할머니 딸 부부는 다리가 부러진 개를 포함해 두 마리를 입양해 기르고 있어 버들이를 추가로 입양하기는 힘들었다. 이들은 대신 회원으로 활동하고 있는 팅커벨프로젝트에 도움을 요청했고, 황 대표는 회원들의 동의를 받아 버들이를 구조하기로 했다. 팅커벨프로젝트는 개인 구조요청의 경우 일정 기간 이상 활동하며 정기후원하는 정회원 50명 이상의 동의가 있을 때 구조에 나선다. 모든 구조 요청을  다 받아들이기 힘들어 회원들이 구조 취지에 동의하는 경우에만 나선다는 게 이들의 원칙이다.1월 22일 오전 10시 시작된 버들이 구조는 다른 유기동물과 비교해 눈 깜짝할 사이에 끝났다. 워낙 사람을 좋아하고 순한 개라 처음 보는 황 대표에게도 꼬리를 흔들며 반겼기 때문. 황 대표가 줄을 풀자마자 버들이는 기다렸다는 듯 그의 품에 안겼다. 태어난 이후 처음으로 짧은 줄에서 해방된 날이었다. 황 대표는 ""구조라고 할 것도 없었다""며 ""(버들이가) 이동장 안으로도 스스로 들어가 구조하는 데 1분도 안 걸렸다""고 말했다.버들이 구조를 위해 뭉친 제보자와 회원들     버들이가 구조 후 팅커벨프로젝트 협력 동물병원에서 검진받고 있다. 할머니가 챙겨준다고 했지만 오랜 바깥 생활 탓에 비쩍 마른 몸에 심장사상충에 감염된 상태였다. 팅커벨프로젝트 제공황 대표는 버들이를 구조하자마자 협력 동물병원으로 데려갔다. 파보바이러스, 홍역 등 감염 여부를 검사하기 위해서였다. 검사 결과 오래도록 밖에서 관리받지 못해 비쩍 마른 버들이는 심장사상충에 감염돼 있었다. 실외에서 키우면서 예방약을 먹이지 않은 개들의 절반 이상은 심장사상충에 감염되는데 제때 치료하지 못하면 결국 죽음에 이른다. 버들이는 심장사상충 초기 단계였는데 2개월 넘도록 치료를 받고서야 이달 초 완치됐다.    위탁시설에서 지내고 있는 버들이가 환하게 웃고 있다. 팅커벨프로젝트 제공    치료를 마치고 평생 가족을 찾고 있는 버들이. 팅커벨프로젝트 제공팅커벨프로젝트는 위탁시설에서 지내는 버들이의 심장사상충 치료가 끝난 만큼 이제부터 입양처를 본격적으로 찾아줄 예정이다. 황 대표는 ""버들이처럼 남겨진 개들이 결국 떠돌이개가 되고, 이는 유기동물 증가로 이어진다""며 ""남겨진 개를 외면하지 않은 할머니, 또 사연을 들은 딸 부부의 적극적인 활동에 회원들의 도움으로 개를 구조할 수 있었다""고 말했다.5년간 지자체 보호소 부동의 1위는 믹스견    간식을 주니 회복장 안으로 곧바로 들어가는 버들이. 버들이는 심장사상충 감염으로 2개월 넘게 치료를 받아 최근 완쾌했다. 팅커벨프로젝트 제공2016년부터 2020년까지 5년간 전국 지방자치단체 보호소에 들어온 유실∙유기동물 가운데 부동의 1위는 믹스(Mix)견이다. 지난해 기준 보호소에 들어온 믹스견은 7만1,798마리로 품종견 2만2,695마리보다 3배 많았다. 특히 어린 개체가 많고, 도농복합지역에서의 증가 추세가 두드러진 점을 감안하면 중성화시키지 않고 줄에 묶어 키우거나 방치하는 개들이 유기동물 증가의 주원인임을 알 수 있다. 재개발지역 등을 떠나면서, 이사하면서 기르던 개를 버리고 가는 경우도 허다하다. 황 대표는 ""기르던 개를 버리는 행위 자체가 범죄라는 인식이 확산돼야 한다""며 ""지자체가 마당개를 보살피는 법에 대한 반려인 교육 강화, 마당개와 떠돌이개의 중성화 지원 등에 나서야 유기동물 문제를 해결할 수 있다""고 강조했다.고은경 애니로그랩장 scoopkoh@hankookilbo.com▶[엄마] 학대받은 아이들 품은 13년 ""모두 내 새끼""▶[트랜스젠더] 아들이 딸이 되기까지, 험난한 여정▶한국일보닷컴 바로가기 ]","['', '정말 화 난다.키울 능력도 안되면서 키우고 일단 키웠으면 끝까지 책임 져야지 묶어 놓고 이사가면 굶어 죽을꺼 뻔히 알면서 본인이 키우던 개를 잔인하게 묶어 놓고 가버린 주인을 기다린 버들이 한테 인간으로써 미안한 마음이 듭니다.정말 좋는 주인 만나서 행복해 졌으면 좋겠습니다.', '내가 개 구조협회 뭐 이런데다가는 돈을 쓰지만 인간들 후원하는데 한 푼도 안쓴다. 인간들 중에 악마들이 너무나도 많아.', '이구, 할머니 때문에 감동받고 감니다, 오래오래 건강하세요~', '진짜 사람 좋아하는구나 저런 개를 어떻게 버리고가지..', '그냥 봐도 넘 착해 보인다... 버린 사람은 나중에 누군가에게 버려지길...', '이렇게 예쁘고 순한 아이를 이사간다는 이유만으로 버린다는건 너무하네요 늘 반려동물을 데려오기 전에 한번씩 생각하고 데려오셨으면 합니다 버들이는 앞으로 행복한 일만 남았으면 합니다 버들이의 앞으로의 인생을 응원합니다', '이사간다고 버리면\n니자식도 버려라', '애완견을 키운다는건 한가족이 된다는 마음으로 처음부터 끝까지 해야한다는 책임감이 따라야한다고 봅니다\n짧은 목줄에 묶여서 버려진 버들이가 노할머니의  관심과 도움으로 보호시설에서 밝게웃는 모습이 마음을 따뜻하게 만드네요. 버들이 처럼 버려지는 생명에게 할머니처럼작은  관심을 가지게 된다면  강아지나 길고양이 들과 함께 밝게 더불어사는 사회가 되지 않을까요', '키울 자격없는 사람들이 키우니까 저런거다. 반려견이라 하지 않는가? 가족처럼 키울 자신없으면 키우지마라. 고층아파트에서 떨어뜨리는 놈이나, 차에 매달고 가는 놈이나, 쓰레기봉지에 싸서 버리는 놈이나..  제발 좀 그러지마라. 쓸데없는 법 만들지 말고, 그런 놈들 똑같이 처벌받게 만드는 법 만들면 어떨까싶다.', '인간을 너무 좋아하고 따르도록 진화해서 더 속상한 존재. 인간은 그럴만 한 가치가 없어.', '', '좋은 부모가 기다리고 있을 거 같아요. \n부디~~ 평생 함께 할 가족이 나타나길!', '사람이 버렸지만 사람을 좋아하는 버들이가 안쓰럽기도 하고 기특하기도 하네요. 성격이 너무 좋은 버들이여서 누구에게 입양되든지 행복하게 잘 살 것 같습니다. 버들이처럼 밝고 착한 주인 만나길 바랍니다.', '이 귀여운 아이 같은 믹스견들은 왜 다른 품종보다 많이 버려지는지 이해가 안되네요.\n하루빨리 밥 잘 챙겨주고 예뻐해주는 좋은 가족 찾기 바랍니다.', '', '제가 구조한 아이도 좀 도와주시지..\n혼자 외진곳에서 노인들이 방치견으로\n아사 직전에 제가 지나가다 \n상태가 너무 심각해서 앞뒤 생각 못하고 구조했는데..\n그 뒤 막막하고 어떻게 해야될지\n몰라 여기저기 구조요청하다 안되 마지막\n팅커벨 알게되서 도움청했는데..\n개인구조자라서..대형견이라서..\n더군다나 팅커벨에서 직접 구조하지 않는 아이가\n아니니 안된다고..\n그렇게 사정하고 부탁하고..또 부탁했는데..\n그냥 알아서 하시라고..\n입원시키고 치료하고 잘 먹이고 회복시키니\n틱 장애가 있는 아이였는데..\n결국 다시 있는곳으로 돌려보냈네요..ㅜ', '참!  어르신 고맙습니다 \n제발 인간  다운 모습 들 좀 보자ᆢ\n이케 아지도 이렇게 구조해 키우는데 어떻게 애기들을 죽이고 때리구 학대하고  이개만도 못한것들 천벌을받어야지ᆢ 저도한놈될구왔어요 이민 가면서 버리구가ᆢ혼자 굶고 말라 ㆍ뼈만남았더군요  지금은 곱베기 로 쪘어요', '생명을 저리 대한 죄 전 주인!!! 천벌받아라!', '버들이를 봐도 사람들에게 동정을 유발하는 방식은 이제 우주밖으로 날려 보내야할 때인듯 보인다. 언제까지 사람들의 눈물샘을 자극하는 것으로 문제를 해결할 셈인가? 애완동물의 가장 큰 문제점은 바로 유기에 있다. 어릴때는 이쁘다고 키우다가 크면 버리는 양심에 펑크가 난 인간들이 넘쳐나는 세상이 아닌가? 애완견을 유기하는 사람들에게 강력한 징벌을 하는 법을 만들고 집행하게 하면 유기되는 것은 현저히 줄어들 것이다. 눈물 샘을 자극하는 것은 한계가 있다.', '끝까지 책임을 질수 없다면.\n제발 키우게 할 자격을 주지 않았으면.\n좋겠네요. 생명을 너무 가볍게.\n생각하지 않길. 사람이 아닌..\n동물이라 할지라도.', '무거운 시멘트에 줄을 묶어놨네..\n다른 곳으로 가기도 힘들게..\n못됐다..\n빨리 구조되서.. 다행이네요.', '너무 착하고 이쁘다 꼭 좋은 반려인만날수 있기를 기도해요', '참 귀엽네', '', '', '예쁘게 행복하게 잘살아라 흰둥아 ♡', '기사 잘 읽었습니다. 동물도 소중한 생명인데 사람들이 너무 쉽게만 생각하는 것 같습니다. 그래도 안전하게 구조되서 정말 다행입니다. 하루빨리 좋은 주인 만났으면 좋겠네요', '너무 귀엽다', '아이고~~~~ 예뻐라....ㅎㅎ', '키우고싶다..귀엽다..이미 한 마리 키우고 있어서ㅜ\n힘들듯..ㅠ', '🐶🐕🦮🐕\u200d🦺']",http://www.ggilbo.com/news/articleView.html?idxno=839630,https://n.news.naver.com/mnews/article/469/0000595240?sid=103
2021.04.07.,법률저널,,김태형의 공무원 영어 신세계 - 7회,,,http://www.lec.co.kr/news/articleView.html?idxno=726672,http://www.ggilbo.com
16면 1단,부산일보,,[펫! 톡톡] 지배 대상 아닌 특별한 존재… 인간과 반려동물의 관계,,,http://www.busan.com/view/busan/view.php?code=2021040718593876616,http://news.lec.co.kr
14면 1단,서울신문,,유기견 ‘새 주인 찾개’… 중랑의 ‘다시사랑받개’,,,https://www.seoul.co.kr/news/newsView.php?id=20210407014023&wlog_tag3=naver,http://www.busan.com/
