Date,Press,Category,Title,Content,Comment,URL_Origin,URL_Naver
2023-08-26 16:45:01,SBS,생활/문화,"용인시, 유기 동물 입양률 '전국 최고'…비결은?","[ 단맛 쓴맛엔 둔해도 참치에 특화한 감칠맛에 반응하도록 진화    고양이가 좋아하는 최적의 감칠맛이 참치에서 발현되고 있다는 연구 결과가 나왔다. [사진=게티이미지뱅크]고양이가 참치라면 환장하는 이유가 어디에 있을까? 고양이는 단맛, 신맛, 짠맛, 쓴맛과 더불어 인간이 느끼는 5대 미각 중 하나인 감칠맛 감각수용체가 발달했는데 특히 참치에 함유된 감칠맛에 잘 반응하도록 진화했기 때문이라는 연구결과가 나왔다. 최근 《화학 감각(Chemical Senses)》에 발표된 영국 연구진의 연구결과를 토대로 과학전문지 《사이언스》가 25일(현지시간) 보도한 내용이다.  야생에서 잡히는 참치의 6% 이상이 고양이 사료로 사용된다. 1만 년 전 중동의 사막에서 진화한 고양이가 왜 참치를 그렇게 좋아하는 걸까? 영국의 반려동물 사료 제조업체 '마르스 펫케어(Mars Petcare)' 산하 '월섬 펫케어 과학 연구소(Waltham Petcare Science Institute‧WPSI)' 연구진은 그 수수께끼 풀기에 나섰다.  기존 연구에 따르면 고양이는 독특한 미각을 가지고 있다. 고양이는 설탕을 감지하는 핵심 단백질이 부족하기 때문에 인간이나 개와 달리 단맛을 못 느낀다. 연구를 이끈 WPSI의 스콧 맥그랜 감각연구팀장은 육류에 설탕이 없기 때문에 진화론의 용불용설에 따라 단맛을 느끼는 감각이 둔화됐을 것으로 추정했다. 고양이는 또한 대부분의 초식동물처럼 쓴맛 수용체가 적기에 인간보다 쓴맛에 둔감하다.  그렇지만 고양이도 맛을 볼 줄 안다. 그렇다면 고소한 고기맛에 반응하기 위해 감칠맛에 대한 감각이 발달했을 것이라고 맥그랜 팀장은 추론했다. 인간과 다른 많은 동물의 경우 감칠맛을 감지하도록 미뢰에 작용하는 2개의 유전자가 있다. Tas1r1과 Tas1r3이다. 고양이의 경우 이중에서 Tas1r3 유전자가 미뢰에서 발현한다는 종전 연구가 있었다.  맥그랜의 연구진은 그 외에도 다른 요소가 작용할 것이라고 추론했다. 그래서 건강상의 이유로 6살 나이에 안락사한 수컷 고양이의 혀 부위를 떼어내 조직검사를 실시했다. 유전자 염기서열 분석 결과, 고양이의 미뢰에는 Tas1r1과 Tas1r3 유전자가 모두 발현돼 있다는 사실을 확인했다 고양이가 감칠맛을 감지하는 데 필요한 모든 분자 메커니즘을 가지고 있다는 사실을 처음으로 밝혀낸 것이다.  그러나 해당 유전자를 암호화는 단백질 서열에서 인간과 고양이 사이에 차이가 있다는 점도 밝혀졌다. 고양이의 경우 감칠맛을 활성화하는 주요 아미노산인 글루탐산과 아스파르트산과 결합하는 수용체의 2개 부위에서 인간과 다른 돌연변이가 발생했음이 발견됐다.  연구진은 그 차이를 확인하기 위해 세포 표면에 고양이 감칠맛 수용체를 생성하도록 세포를 조작한 다음 다양한 아미노산과 뉴클레오티드에 노출시켰다. 그 결과 고양이 감칠맛 수용체가 인간의 그것과 다른 방식으로 감칠맛에 반응한다는 사실이 발견됐다. 사람은 아미노산이 먼저 결합하고 뉴클레오티드가 반응을 증폭시킨다. 반면 고양이는 뉴클레오티드가 먼저 수용체를 활성화하고 아미노산이 이를 강화했다. 맥그랜 팀장은 ""사람의 경우와 반대로 작용한다고 보면 된다""고 설명했다.  연구진은 실험의 마지막 단계로 고양이 25마리를 대상으로 미각 테스트를 실시했다. 다양한 아미노산과 뉴클레오티드가 조합된 물과 그냥 물만 담긴 2개의 물그릇을 고양이들에게 제공했을 때 감칠맛을 느끼게 하는 분자가 포함된 그릇에 대한 강한 선호가 관찰됐다. 감칠맛이 고양이에게 가장 중요한 맛임을 시사하는 결과였다.  고양이가 좋아하는 감칠맛은 일반적 감칠맛과 달랐다. 고양이들은 참치에 특히 많이 함유된 히스티딘(아미노산의 일종)과 일인산이노신(뉴클레오티드의 일종)이 들어있는 물그릇을 특히 선호했다. 고양이가 좋아하는 최적의 감칠맛이 참치에서 발현되고 있었던 것이다.  논문을 검토한 일본 메이지대의 토다 야스카 교수(분자생물학)는 ""반려동물의 선호도를 더 잘 이해하게 해주는 연구로 특히 고양이를 위한 더 건강한 식단과 약 개발에 도움이 될 것""으로 평가했다. 감칠맛에 대한 포유류와 조류의 진화를 연구해온 그는 개의 경우는 사람처럼 단맛과 감칠맛을 모두 느낄 수 있는 반면 고양이는 감칠맛에만 반응하기에 입맛이 더 까다롭다는 통념이 형성됐을 수 있다고 설명했다.  이는 수의학과 학생시절 토다 교수의 개인적 체험과도 일맥상통했다. 식욕이 없는 고양이에게 사료를 줄 때 감칠맛 조미료로 참치와 비슷한 맛을 내는 가다랑어포 가루를 뿌려주자 바로 식욕을 되찾았다고 그는 회상했다.  그럼 1만 년 전 사막에서 진화한 고양이가 왜 생선을 좋아하게 된 것일까? 미국 세인트루이스워싱턴대(WUSTL)의 피오나 마샬 교수(동물고고고학)는 인간과 함꼐 살면서 생긴 변화일 수 있다고 밝혔다. 기원전 1500년경 그려진 고대 이집트 벽화에는 고양이가 생선을 먹는 모습이 묘사돼 있다. 아마도 어부들이 남긴 생선을 먹기 시작한 고양이들이 생존경쟁에서 더 유리해지면서 감칠맛에 대한 독특한 진화가 이뤄졌을 수 있다는 설명이다.  해당 논문은 다음 링크(https://academic.oup.com/chemse/advance-article/doi/10.1093/chemse/bjad026/7238703?login=false)에서 확인할 수 있다.  ]","['냥이 긔여워..', '이것 참 코메디구만', '내밥부터 잘챙기자', '고양이 ㅡ ""입에 착 감긴다옹!"" 닭 ㅡ ""입에 착 감긴닭!"" 그렇다면 소의 경우는? 이거 만만찮은데... ㅋ', '사람도 참치주면 잘 먹는데...ㅠㅠ']",https://news.sbs.co.kr/news/endPage.do?news_id=N1007322062&plink=ORI&cooper=NAVER,https://n.news.naver.com/mnews/article/296/0000069095?sid=103
2023.08.23.,주간경향언론사 선정,,지리학자의 열대 인문여행 外[신간],,,https://weekly.khan.co.kr/khnm.html?mode=view&code=116&artid=202308181047281,http://www.khan.co.kr/
A12면 1단,세계일보언론사 선정,,동물 학대 방지 넘어 ‘생애주기별 복지’ 꼼꼼히 챙긴다 [농어촌이 미래다-그...,,,http://www.segye.com/newsView/20230824514756?OutUrl=naver,http://www.segye.com
2023-08-25 06:09:01,데일리팝,경제,'댕댕이도 소중하게'..반려동물 복지 앞장서는 지자체들,"[ 정부, 보호시스템 강화동물보호법→복지법 체계로 개편건강·영양은 기본… 습성까지 신경학대자 재범 예방교육 등 도입도공분 샀던 구미 반려견 폭행 사건신고~후속 조치 ‘구조 효과’ 톡톡2022년 학대신고 6590여건 달해“근절 위해선 적극적 신고가 중요”최근 경북 구미에서 반려견을 무자비하게 폭행하는 견주의 모습이 사회관계망서비스(SNS)를 통해 공개돼 공분을 샀다. 비영리단체인 반려동물구조협회에 의해 알려진 이 사건의 영상을 보면 한 중년 남성이 길거리에서 벨트처럼 보이는 굵은 줄을 이용해 개(백구)의 머리를 내리치는 모습이 고스란히 담겨 있다.  영상에서 드러난 당시 상황은 끔찍했다. 백구는 견주에 의해 여러 차례 폭행당하는 동안 꼼짝도 하지 못한 채 바닥에 쓰러져 있었다. 폭행 영상을 제보받은 협회는 사건이 발생한 지 2시간 만에 경찰, 지방자치단체 담당자와 함께 현장을 찾아 구조에 나섰다. 구미시는 백구를 폭행한 A씨로부터 백구의 소유권을 포기받아 현재 동물보호센터에서 보호 중이다. 이후 시민을 대상으로 한 공고를 통해 입양 절차를 밟는다는 방침이다.        이 끔찍한 반려견 폭행 사건에서 그나마 위안을 찾을 수 있는 것은 사건 신고부터 처리, 후속 조치까지 제대로 된 ‘구조’가 이뤄졌다는 점이다. 동물 학대에 분노하는 국민적 관심과 지자체·경찰의 적극적인 대응, 여기에 동물을 보호하는 수준을 넘어 복지의 대상으로 확대하고 있는 정부의 노력이 함께 이뤄진 결과라는 평가다.  ◆“동물 보호를 넘어 복지로”  24일 농림축산식품부 등에 따르면 정부는 동물복지 강화를 위한 다양한 방안을 시행 중이다. 지난해 12월 동물복지 강화 방안을 발표한 이후 학대 방지를 넘어 출생부터 죽음까지 생애 주기 관점에서 동물의 건강·영양·안정 및 습성 존중 등 복지 요소가 강화되고 있다. 특히 지난 4월 동물보호법 시행령·시행규칙 개정안이 시행되면서 동물 학대에 관한 처벌 규정과 재발 방지를 위한 조치가 강화됐다는 평가다.  우선 동물 학대 행위자에게 형벌과 함께 재범 예방을 위한 수강명령 또는 치료프로그램 이수명령 제도가 도입됐다. 학대 행위자에게 최대 200시간 범위에서 동물 학대 행동의 진단·상담, 반려동물 소유자로서의 기본소양 교육 등을 이수해야 한다.        학대동물 구조·보호 등 적극적인 현장 대응 체계도 확립됐다. 학대받은 동물의 적절한 치료 및 학대 재발 방지를 위해 지자체가 피학대동물 구조 후 소유자로부터 격리해야 하는 보호조치 기간도 최소 3일에서 5일로 늘어났다.  학대 행위자에 대한 적정한 수준의 처벌을 유도하기 위한 노력도 병행되고 있다. 정부는 대법원 양형위원회 측에 ‘동물학대범죄 양형 기준’ 마련 협의를 완료한 상태다. 또 ‘동물학대 대응 매뉴얼’을 마련해 지자체 등 일선 현장에 배포한다는 계획이다. 매뉴얼에는 동물 학대 행위에 대한 설명, 단계별 대응 요령(신고-현장대응-사후관리) 등을 수록한다. 동물 학대 개념도 ‘상해, 질병’에서 ‘고통’을 주는지 여부로 확대할 방침이다.        ◆해마다 10만마리 구조… “누구나 신고”  정부의 이 같은 노력은 학대로 인한 동물 구조 조치 강화는 물론 사건 예방까지 이어지기 위해서다. 농식품부에 따르면 2016년부터 2021년까지 동물보호법 위반으로 검찰 처분을 받은 인원은 4408명에 달한다. 이 가운데 기소된 인원은 1585명으로, 기소율은 36% 수준이다. 동물 학대 1123 신고건수도 지난해에만 6594건이 접수됐다. 이는 1년 전보다 1097건(20%가량) 증가한 수치다.  지난해 동물보호센터가 구조한 동물은 11만3440마리로, 최근 5년간 해마다 10만마리 이상의 동물이 구조되는 상황이다. 지난해 기준 구조 동물 27.5%는 입양됐고, 자연사(26.9%), 인도적 처리(안락사·16.8%), 소유주 반환(12.4%) 등으로 처리됐다.        동물보호법상 누구든지 학대를 받는 동물을 발견하면 관할 지자체 또는 동물보호센터 등에 신고할 수 있다. 신고 접수 시 지자체장은 동물이 있는 장소에 대한 출입·검사와 필요 시 학대 중지를 위한 시정명령 등이 가능하다. 이를 통해 학대 행위의 중지, 동물에 대한 위해 방지 조치 이행, 질병에 걸리거나 상처를 입은 동물의 치료 등을 이행해야 한다. 시정명령 미이행 시 100만원 이하 과태료가 부과된다.  동물 학대에 관한 국민적 관심도 높아지고 있다. ‘2022년 동물보호 국민의식조사’에 따르면 ‘동물을 좁은 공간에 감금 사육하는 행위’(80.7%), ‘채광이 차단된 어두운 공간에 감금해 사육하는 행위’(85.2%) 등도 동물 학대로 인식한다는 의견이 많았다. 또 동물 학대를 목격할 때 행동에 대해서도 ‘경찰이나 지자체 등 국가기관에 신고한다’(54.3%)나 ‘동물보호단체 등에 도움을 요청한다’(45.6%)는 응답이 ‘별다른 조치를 취하지 않는다’(13.1%)보다 높게 나타났다.         최근 경북 구미에서 견주에게 폭행당하다 구조된 백구가 동물보호센터에서 지내는 모습.    이재식 농식품부 동물복지환경정책관은 “동물 학대 근절을 위해 중요한 것은 동물 학대 문제에 대한 사회적 관심”이라며 “동물 학대 행위에 대한 적극적인 신고가 중요하다”고 강조했다. 이어 “동물 학대 근절을 위한 제도적 장치를 지속적으로 개선할 방침”이라고 덧붙였다. ]","['우리나라도 선진국처럼 동물보호,복지 인식개선 , 법 강화 등 바뀌어야 합니다. 적극 응원합니다.', '왜 태어났니… 가정교육 처 못받아서 무식해서 생명을 때리는 애들은 손 모가지를 잘라야한다', '', '등따시고 배부르면  주변을 돌아봐라 하루한끼 먹기도 힘든 이들이 수억명이다.', '동물학대범에게서 구조후 격리기간을 3일에서 5일로 늘린다? 아예  소유강제박탈후 영구히 못키우게 해야죠. 불법개농장은 불법이니 당연히 강제철거하고 개소유권 강제박탈. 불법도박장 도박판돈들 압수하는것처럼. 유기 방임도 소유권강제박탈. 마이크로칩의무화. 개인과 동물단체에서 죽어라 구조해도 처벌이 솜방망이면 끝나지않습니다.반성했다고 초범이라고..제발 법대로라도 처벌하길.', '', '동물이 행복해야 사람도 행복한 세상이 된답니다.', '동물보호법 강화 잘못 없이 순간 기분에 따라 고의적 학대 등\n관련 일반 상식에서 벗어나 생명체로서 고통으로 간주되는\n상황 행위관련 처벌수위는 강해져야 한다고 봅니다.\n\n일정 좁은공간 관리는 교육관리 관련 아이 안정감 따라\n상황에 따라 달라져야 된다고 봅니다.\n\n설정맹견, 일반맹견등 불시 갑자기 나타나 산책, 산책 반려견 방어목적 공격하는 사나운 아이 상황 상 정당 범위 내 위력 시 또한 상황 상 하는 법도 있는게 좋다고 봅니다\n산책 중 상대한테 위협견 관련 보호자도 상황에 따라서\n놓치거나  상대반려견 죽게 등\n기본 예의 에티겟 필요', '동물학대방지, 복지 이런 거보다 우선 견주 처벌방안이 먼저 이루어져야 한다 생각합니다. 난 솔직히 동물 싫어하는 사람인데 그렇다고 학대에도 찬성하지는 않습니다. 그런데 견주들이 더 싫습니다. 개도 싫어하는 상태에서 똥도 안치우고 목줄도 입마개도 채우지 않고 엘리베이터 좁은 공간에서 안고 타지도 않고 배변봉지도 안가지고 나오는 등 개를 싫어하는 사람들에대해 제대로 배려하지 않는 견주들의 처벌을 강화해야 합니다. 요즘 조용히 할고 싶는데 이런 몰상식한 견주들과 다툼이 자주 있습니다. 견주들의 의무 강화와 사람공격 견은 무조건 안락사', '', '', '별 개 털바퀴 이딴거에 세금을 써']",http://www.dailypop.kr/news/articleView.html?idxno=71500,https://n.news.naver.com/mnews/article/022/0003848628?sid=101
2023.08.13.,뉴시스언론사 선정,,"반려견, 작년에 29.9만 마리 신규 등록…누적 300만 돌파",,,http://www.newsis.com/view/?id=NISX20230811_0002411515&cID=10401&pID=10400,http://www.dailypop.kr
2023.08.27.,뉴스엔,,"신동엽 “반려견 크림이와 언젠가 이별, 생각만 해도 슬퍼” (동물농장)",,,https://www.newsen.com/news_view.php?uid=202308270940361110,http://www.newsis.com
2023-08-13 11:01:10,코메디닷컴언론사 선정,경제,미래 유토피아의 핵심이 '병원'인 이유?,"[ 농축산검역본부, 2022년 반려동물 보호 및 복지 실태조사작년 길고양이 10만4434마리 대상으로 중성화 수술 실시    [서울=뉴시스] 반려견 유기나 유실 방지를 위한 내장형 동물등록 사업. (사진=노원구 제공) 2020.10.14. photo@newsis.com[세종=뉴시스] 오종택 기자 = 지난해 반려견 29만 마리가 새롭게 등록돼 누적 등록 300만 마리를 넘어섰다. 반려동물 11만3000여마리가 동물보호센터를 통해 구조됐으며, 길고양이 10만4000여마리를 대상으로 중성화 수술이 이뤄진 것으로 나타났다.13일 농림축산검역본부가 발표한 '2022년 반려동물 보호 및 복지 실태조사 결과'에 따르면 반려견 신규 등록은 29만958마리로 누적 등록 마리 수는 302만5859마리로 조사됐다. 신규 등록 반려견은 전년(5만321마리)보다 41.8% 감소했지만 수명을 다 한 개체를 제외하면 총 등록 반려견은 전년보다 9.4% 증가했다.  주요 등록 형태로 무선식별장치를 체내에 삽입하는 내장형이 150만6650마리(49.8%), 외장형이 116만305마리(38.3%)를 차지해 등록된 반려견 10마리 중 9마리가 무선식별장치로 관리가 가능하다.  2021년부터 무선식별장치가 아닌 단순 인식표로는 신규 등록이 불가해 앞으로 해당 비중이 더 늘어날 전망이다.동물의 구조 및 보호조치 등을 담당하는 동물보호센터는 시설기준 총 239개소가 운영 중이다. 시·군·구가 직접 설치해 운영하는 곳(직영)이 68개소, 지자체에서 동물병원 등 민간 기관을 지정해 업무를 위탁한 곳이 171개소로 파악됐다. 2022년말 기준 동물보호센터 운영인력은 총 893명이며, 운영비용은 294억8000만원이다. 작년 한해 동물보호센터가 구조한 동물은 11만3440마리로 개 8만393마리, 고양이 3만1525, 토끼 등 기타 동물 1522마리다. 구조 동물의 평균 보호기간은 26일이다. 구조 동물 중 1만4031마리(12.4%) 정도만이 보호자에게 돌아갔다. 3만1182마리(27.5%)는 입양됐으며, 3만490마리(26.9%)는 자연사했다. 1만9043마리(16.8%)는 안락사 등 인도적으로 처리했다.     [서울=뉴시스] 백동현 기자 = 길고양이 중성화 수술. 2022.03.20. livertrent@newsis.com길고양이 중성화사업으로 지난해 길고양이 10만4434마리 대상으로 중성화 수술을 실시했다. 중성화 수술은 경기 2만6311마리(25.2%), 서울 1만3696마리(13.1%)로 많았다.반려동물 영업장 중 동물판매업과 전시업체 수는 다소 줄었으나 미용업, 운송업 등이 증가하면서 2021년 대비 6.7% 늘어난 2만2076개소로 집계됐다. 영업장 종사자수도 4.9% 증가한 2만6093명으로 나타났다.동물 학대 방지 등 동물 보호에 관한 사무를 담당하는 공무원인 지자체 동물보호관은 812명이다. 동물보호법 위반 처분 실적은 1181건으로 2021년 대비 각각 7%, 10% 증가했다. 주요 위반 사항은 목줄, 인식표 미착용 등 돌봄 의무 위반(60.8%), 반려견 미등록(16%), 미등록·무허가 영업(4.1%) 등 순이다.이번 실태조사는 지방자치단체를 통해 파악된 2022년 말 기준 전국 동물등록, 유실·유기동물 구조 및 보호, 반려동물 영업 현황 등의 정보를 바탕으로 했다.이명헌 검역본부 동물질병관리부장은 ""정기적 실태조사 공표 외에도 동물보호·복지 관련 정보 및 통계가 실시간으로 표출될 수 있도록 시스템을 개선해 구조 동물의 관리를 강화하고 필요한 정보를 효과적으로 제공할 계획""이라고 말했다． ]","['', '길고양이 떠돌이개들 포획해서 중성화 수술 시키고 돌봐줄 시설이나 입양 불가한 동물들이 굶주림이나 질병 학대로 고통 받을 때는 안락사 시켜줘라. 데리고 키우지도 않을 인간들이 찢어지고 태워지고 굶주려 죽는 고통에는 입다물고 있다가 인간이 베풀수 있는 안락사를 불쌍하다고 난리치는거 보면 어이가 없다. 동물 학대범 감옥 보내거나 벌금 쎄게 때리고주민센터에서 놀고 있는 공무원, 기상청에서 세금만 먹는 공무원 줄이고 동물 관리 인력 숫자 늘려라. 인간과 공존하기엔 아직 길고양이 떠돌이 개 숫자가 너무 많다.', '', '']",https://kormedi.com/?p=1615223,https://n.news.naver.com/mnews/article/003/0012028503?sid=101
2023.08.19.,주간조선언론사 선정,,늙은 사자·아픈 반달가슴곰… 위기의 동물들이 이곳으로 모이는 까닭,,,http://weekly.chosun.com/news/articleView.html?idxno=28399,http://www.newsen.com
2023-08-27 09:57:00,크리스천투데이,,"“청년들, 큰 교회에서 회복돼 모교회로 돌아가도록…”",[],[],https://www.christiantoday.co.kr/news/356148,https://n.news.naver.com/mnews/article/609/0000764171?sid=106
A12면 1단,세계일보언론사 선정,,“가족이라면서” 휴가철 반려동물 유기 여전,,,http://www.segye.com/content/html/2023/08/15/20230815509305.html?OutUrl=naver,https://www.kormedi.com/
2023-08-21 09:20:01,뉴시스,생활/문화,[신간] 법은 얼마나 정의로운가,"[ [김영훈의 참의사 찐병원] 스마트 병원의 존재가치    [사진=게티이미지뱅크]도시의 역사를 살펴보면, 원래 허허벌판이었던 곳에 기차역이 생기면서 도시로 성장하기도 하고, 관공서들이 들어서면서 도시가 생기기도 하고, 댐 하나를 짓는 바람에 거대 도시가 만들어지기도 한다. 학교가 중심이 되는 도시도 있다.  미래에는 대형 스마트 병원을 중심으로 하나의 주거 단지가 만들어질 것이다. 병원이 중심이 되어 문화 시설, 교육 시설, 작은 박물관과 도서관, 쇼핑 센터 등이 구성돼 그곳을 중심으로 사람들이 살아가는 것이다.  미국 각지에 있는 워터마크(The Watermark)가 실 사례 중 한 곳이다. 일종의 공동체 마을이다. 그곳 사람들은 일상적 삶을 꾸려 가면서 질병의 예방과 치료는 물론, 노후의 요양, 죽음과 장례까지 한 곳에서 처리한다. 현대판 유토피아라 할 수 있다.  당연히 비용은 많이 든다. 그러나 번잡한 도시에서 살아도 그만큼의 비용은 내야 한다. 같은 비용이라면 병원 옆에서 살기를 바라는 것이다.  1516년 영국의 토마스 모어가 펴낸 《유토피아》에서 가상의 공간, 유토피아에 사는 사람들은 '행복'에 큰 관심을 가진다. 그곳에도 환자는 있지만, 그들은 전문 의료진의 극진한 간호를 받는다.  그러나 불치병에 걸리면 사제(司祭)와 공무원이 방문해 '더 이상 그런 고통을 당하지 말라'고 권유한다. '안락사'라는 단어가 명확히 표기돼 있지는 않지만 죽음을 택하라고 권유하는 셈이다. 그것이 신성하고 경건한 행위라고 주장한다. 죽음이 경건하게 마무리되어야 행복한 삶을 살았다는 증거가 된다. 모어는 500년 전에 오늘날의 '연명 의료 제도'를 간파한 것이다.  유토피아 사람들이 삶의 행복을 추구하는 것은 '인생을 즐기는 것,' 곧 올바른 쾌락에 있다. 쾌락은 육체의 조화로운 상태, 즉 건강한 몸이 바탕이 된다. 그 때문에 사람들은 최선을 다해 자기 몸을 보살핀다.  미래에 그 목표를 이루어지게 해주는 곳이 바로 스마트 병원일 것이다. 그러므로 스마트 시티에서 행복의 거점 역할을 하는 곳은 스마트 병원이다.  인류가 꿈꾸어 온 스마트 시티에서는 일상생활, 쇼핑, 기업 활동, 이동, 문화 생활, 교육 등 대부분이 원격으로 이루어지고, 에너지 소비가 줄어들며, 각종 사고나 범죄도 줄어들 것이다. 그에 맞춘 다양한 도시 기반 시설이 갖춰져야 편리하고 쾌적한 삶을 영위할 수 있다.  이 모든 활동은 심신의 건강과 떼어내 생각할 수 없다. 의학은 생로병사와 함께 가고, 모든 인체 활동과 관계 있기 때문에 행복과 쾌락의 바탕이 될 수밖에 없다. 그래서 과학 발전이 수렴하는 스마트병원이 미래 유토피아, 스마트 시티의 고갱이를 차지하는 것이 당연할 것이다.       ]","['토머스모어가 병원이 아니라 은행에 대해서 아프면 돈 받아서 가는 곳으로, 다시는 아프지말라고 아픈만큼 돈을 준는 곳으로 등장시켰다면 사람들이 우스워하면서 밥 잘먹고 청소하면서 이렇게 속시끄러운 세상이 되지 않았을텐데 짜증난다.']",http://www.newsis.com/view/?id=NISX20230817_0002416836&cID=10701&pID=10700,https://n.news.naver.com/mnews/article/296/0000068911?sid=103
2023.08.22.,교수신문,,나 같은 기계들,,,http://www.kyosu.net/news/articleView.html?idxno=108608,http://weekly.chosun.com/
2023.08.13.,연합뉴스,,동물보호센터 구조 동물 작년 11만여마리…전년대비 4.1%↓,,,https://www.yna.co.kr/view/AKR20230811154900003?input=1195m,https://www.yna.co.kr/
