Date,Press,Category,Title,Content,Comment,URL_Origin,URL_Naver
2023.08.31.,르몽드 디플로마티크,,"내가 구조한, 내 삶을 구조한 개들",,,http://www.ilemonde.com/news/articleView.html?idxno=17597,http://www.ilemonde.com/
22면 1단,한겨레,,"20세기 최악의 인물, 폴란드 침공과 장애인 안락사를 지시하다",,,https://www.hani.co.kr/arti/opinion/column/1106634.html,http://www.hani.co.kr/
2023-08-31 18:33:03,이데일리언론사 선정,오피니언,차에 치인 고양이 ‘망치’로 안락사한 호주 공무원,"[     [나는 역사다] 아돌프 히틀러 (1889~1945)1939년 독일 경제는 위기가 코앞이었다. 히틀러의 승부수는 폴란드 침공. 영국이 어떻게 나올지가 문제였다. 그해 3월31일 영국은 폴란드와 상호방위조약을 맺었다. 히틀러는 영국이 참전하지 않기를 바랐다. 또 하나의 변수는 소련. 폴란드 땅에서 소련과 독일이 전쟁하게 될지 몰랐다. 그런데 그해 3월부터 소련의 독재자 스탈린은 독일과 관계를 개선할 뜻을 넌지시 비추었다. 그해 여름, 독일과 소련은 세상 몰래 물밑 협상을 한다.6~8월 히틀러는 베를린 집무실에 나타나지 않았다. 독일 곳곳으로 음악회를 찾아다녔다. 장관들도 잘 안 만났다. “전운이 감돌던 상황에 베를린을 비운 것은 나치 체제가 제대로 된 정부와는 거리가 멀다는 의미다.” 역사가 이언 커쇼는 지적했다. 이러면서도 히틀러는 여론 조작은 꼼꼼하게 챙겼다. 나치 간부 알베르트 포르스터를 여러 번 만나, 폴란드 땅에 사는 독일 사람들이 박해받고 있다는 가짜뉴스를 퍼뜨리게 했다.8월24일 독일과 소련은 불가침조약을 맺었다. 이때부터 히틀러는 갈팡질팡한다. “공격 명령을 내려놓고도 영국이 참전하고 이탈리아가 참전하지 않겠다니까 8월25일 저녁 명령을 뒤집었다. 8월31일에는 상황이 달라지지 않았는데도 공격 명령을 한다. 그러다가 9월3일 영국과 프랑스가 선전포고하니 드디어 난감해한다.” 외교관이던 에른스트 폰 바이츠제커는 회고했다. 독일은 9월1일 폴란드를 침공한다. 2차 세계대전의 시작이다. 이틀 뒤 영국의 선전포고에 히틀러는 성을 냈다고 한다. “이제 어떻게 하지?”전쟁이 터진 뒤 경찰과 나치 친위대가 폴란드 땅에 들어가 민간인을 함부로 죽였다. 독일 장군들은 관련자를 군사재판에 세웠다. 그런데 10월4일에 히틀러는 이들을 사면했다. ‘인종청소’를 하라는 비밀 지시를 장군들 몰래 내렸던 것이다.10월 어느 날 히틀러는, 독일의 정신질환자와 장애인을 사람들 몰래 안락사시키라는 문서에 서명한다. 비밀 명령서 날짜가 전쟁을 시작한 9월1일로 돼 있는 것은 섬뜩한 일이다.김태권 만화가   ]","['한국에도 있지 , , , 윤석렬이라는 꼴통이 히틀러 못지않다, , ,', '히틀러가 사람들 살해한 것은 안락사가 아니니, 다음부터는 안락사라고 하지말고 그냥 학살 또는 살처분으로 부르시기 바랍니다.']",http://www.edaily.co.kr/news/newspath.asp?newsid=02955286635711912,https://n.news.naver.com/mnews/article/028/0002654670?sid=110
2023.08.29.,YTN,,사고당한 고양이를 망치로 안락사? 호주 공무원의 빗나간 동정심,,,https://www.ytn.co.kr/_ln/0104_202308290940045809,http://www.edaily.co.kr/
2023-08-28 16:00:09,머니투데이언론사 선정,세계,젊은 남자만 보면…'뚜뚜'는 걷다가 멈춘다,"[    [이데일리 김혜선 기자] 호주 한 지역 의회 공무원이 차에 치인 고양이를 ‘망치’로 안락사해 갑론을박이 일고 있다.    위 사진은 기사 내용과 관련이 없음. (사진=게티이미지)지난 23일(현지시간) 호주 사우스오스트레일리아주에 위치한 마운트 갬비어 시의회는 공식 홈페이지에 다친 고양이에 대한 사건 조사를 완료했다고 밝혔다. 앞서 이달 초 마운트 갬비어 시의회 한 공무원은 차에 치인 고양이를 발견하고 망치로 ‘안락사’를 시켰는데, 이와 관련해 의회가 조사를 벌인 것이다.호주 ABC방송의  27일(현지시간) 보도에 따르면, 이 공무원은 한 초등학교 인근 거리에서 얼룩 고양이가 차에 치여 크게 다친 것을 보고 자신의 망치로 때려서 안락사했다. 이 직원은 처음에는 고양이가 죽은 줄 알았다가 아직 살아 있다는 것을 꺠달았고, 당시 가지고 있는 물건이 ‘망치’밖에 없어 고양이를 안락사시키기로 결정한 것으로 알려졌다. 고양이는 심각한 부상을 입어 고통스럽고 어려운 상황이었다고 ABC방송은 전했다.하지만 동물단체인 RSPCA 사우스 오스트레일리아는 고양이를 죽이는 것이 아니라 수의사에 데려다 줘야 했다며 의회에 경고 서한을 보냈다. 그러면서도 캐롤린 존스 RSPCA는 “이 직원이 동물의 최선의 이익이라고 생각하는 행동을 했다고 인정한다”며 “우리는 동물을 수의사에 데려가는 게 더 나은 조치라고 말하지만, 그는 동물에 악의적으로 행동한 것이 아니다”라고 말했다.이어 “(고양이에 대한) 동정심과 우려로 가능한 한 빨리 비참한 상황에서 벗어나게 한 행동”이라고 덧붙였다.반면 고양이 안락사 장면을 목격한 시민 숀 켐브리는 ABC방송에 “그것은 매우 끔찍했다”며 “도로 한복판, 특히 학교 앞에서 그런 일(안락사)를 하는 것보다 수의사에 데려가는 게 더 좋고 인도적인 방법”이라고 비판했다.한편, 마운트 갬비어 의회는 동물단체 RSPCA의 의견을 반영해 부상을 당한 동물을 어떻게 취급할지 절차를 개선할 방침이다. ]","['안락사를 망치로 한단 소리는 태어나서 첨 들어봤다.', '안락사 뜻도 모르냐 망치로 때려죽일...', '저 집 가족도 교통사고 나면 깔끔하게 망치로 안락사 예약해놓으면 될 듯', '망치로 숨이 붙어있는 생명체를 내리칠 수 있다는 거 자체가 사이코 패스 기질이 있어보임', '약물로 조용히 잠자듯이 죽여야지...망치로 때려죽여', '', '안락사가 아니라 때려죽인거 아닌가요?', '참.. 소 도축할 때, 기계화된 정으로 머리 내리꽂는 그런 개념이란 것인가? 그 또한 고통을 줄이는 방법이긴 하나, 그걸 두고 안락사라곤 표현 안 했는데.. 도구라곤 망치밖에 없었다면, 논란의 여지 없게 처음부터 수의사한테 데려가지 그랬었냐?', 'ㅋㅋ똑같이 망치로 안락사 시켜주면 될둣', 'ㅜㅜ', '애초에 호주는 고양이가 생태계교란종으로 지정된 곳이라 총으로도 쏴죽이고 학교인가? 무슨 대회 열어서 고양이 사냥 같은것도 하더만', '싸이코패스네; 쟤도 나중에 망치 안락사 시켜야할듯', '공부 다시 해라ㅡ ㅡ', '망치가 안락사야?? 와... 소름 돋네.', '싸패 공무원이네..', '와 그게 최선이라고 생각하다니 대단한 사람이다 ㅋㅋㅋㅋ 망치 들었을 때 근처에 가면 안되겠다', '호주도 제정신이 아닌사람이 많군아. 니가 뭔데 안락사를 더 잔인하게 시키냐. 우선 수의사에게 데려가는게 먼저지  별 거지같은 발상은 어디에서 나온건지', '안락사가 아니고 걍 처형 아닌가 ㅋㅋㅋ', '안락사고 아니고 학대사', '미쳤다 얼마나 고통스러웠을까 ㅜㅜ 병원으로 데려가는게 당연하지..', '', '일본놈이 의병가족 학살을 하는 것 같네..망치라니', '', '먼저 수의사에게 보여주고 가망없다 판단되면  주사약으로 안락사 시켰으면 좋았으련만~ 그렇게 여유가 없었나싶다.', '휴  말못하는  동물이라고 ㅠ', '한방에 주님 곁으로도 아니고...', '흔히 덤프 기사들이 얘기하는 어설프게 사람 치게되면 장애 생기면 피곤해지니 그냥 밟고 지나가는거 낫다고하는거랑 결이 같은건가', '살인자새끼야\n 꼭차에치여죽어라', '', '몾된 것\n죄값을 꼭치루어지는것', '양심만 있고 현실을 진지하게 생각하지 못하면 저런 갈등이 있을 수 있겠군요.', '인간 아니다...잔인하다', '', '세계엔 잠재적 살인마들이 우글거리네 한국도 그렇고~윤리와 종교가 쇠퇴 해서 그렇다', '야이씨  안락사를 누구맘대로 그런식으로시키냐,..!', '', '생각하기나름이지 닭다리잘뜯는것들아']",http://news.mt.co.kr/mtview.php?no=2023082815493359453,https://n.news.naver.com/mnews/article/018/0005561259?sid=104
4면 1단,강원일보,,"멸종위기종 가장 많은 강원, 관리시설은 태부족",,,https://www.kwnews.co.kr/page/view/2023083016252289675,http://www.ytn.co.kr/
2023-08-29 09:40:04,충북일보,세계,미끄러운 경사길을 위한 변론,"[     기사와 직접 관련 없는 사진 (사진출처 = 게티이미지뱅크)호주의 한 공무원이 교통사고를 당해 심각한 상처를 입은 고양이를 망치로 죽였다. 이 공무원은 망치를 사용해 죽인 이유로 ""안락사를 시켜준 것""이라고 주장했다.호주 사우스오스트레일리아주(SA) 마운트 갬비어 시의회는 공식 홈페이지에 ""다친 고양이 사건에 대한 조사를 마쳤다. 의회는 동물단체 RSPCA SA에 이 문제를 자체 보고했다. RSPCA SA는 곧 의회에 동물 취급 절차에 포함될 피드백을 제공했다""며 사건 종결을 알렸다.이는 이달 초 한 초등학교 인근 거리에서 소속 공무원이 교통사고를 당한 고양이를 발견한 후 망치로 죽인 일이 공론화되면서 조사에 나선 결과를 알린 것이다.27일(현지 시각) 호주 ABC 방송에 따르면 이번에 죽은 고양이는 얼룩무늬의 고양이로 공무원이 처음 발견했을 때는 간신히 숨만 붙은 채로 심각한 상처를 입은 상태였다.이에 공무원은 고양이를 안락사시킬 마음으로 본인이 가진 물건 중 망치를 이용해 고양이를 죽음에 이르게 했다.그러나 이 소식을 들은 동물단체 RSPCA SA는 의회에 ""고양이를 죽이는 것이 아닌 수의사에게 데려다줘야 했다""고 경고 서한을 보냈다. 다만, 공무원의 행동에 대해서는 악의가 아닌 최선의 행동이었음을 인정했다.한편 해당 공무원의 조치를 목격한 한 시민은 ABC 방송과의 인터뷰에서 ""매우 끔찍했다. 학교 앞에서 그렇게 하기보다 수의사에게 데려다주는 것이 인도적인 방법이었을 것""이라고 지적했다.   ]",[],https://www.inews365.com/news/article.html?no=778999,https://n.news.naver.com/mnews/article/052/0001928738?sid=104
2023.08.29.,서울신문,,"에필로그: 금기된 죽음, 안락사를 취재하며[금기된 죽음, 안락사⑦]",,,https://www.seoul.co.kr/news/newsView.php?id=20230829500028&wlog_tag3=naver,http://www.mt.co.kr/
