Date,Press,Category,Title,Content,Comment,URL_Origin,URL_Naver
2021.06.24.,조선비즈언론사 선정,,[들개의 습격]④ 무차별 포획? 안락사?… 예방도 조치도 어려운 제도의 허점,,,https://biz.chosun.com/topics/topics_social/2021/06/24/SBUWKW6HOJHPJI4KC3Q2AQRXKE/?utm_source=naver&utm_medium=original&utm_campaign=biz,http://biz.chosun.com/
2021-06-24 12:00:08,서울신문언론사 선정,사회,“교화시키겠다”vs“안락사 불가피”…남양주 ‘살인견’ 다시 경찰 손에,"[            들개로 인한 인명과 재산 피해가 잇따르고 있지만, 관련 법 규정에 구멍이 많아 제대로 된 후속 조치나 사고 예방이 어렵다는 지적이 많다. 일각에서는 주인 없이 거리를 배회하는 개들을 안락사해야 한다는 주장도 나오지만, 전문가들은 공격성 여부 등을 정밀 측정하고 유기견 개체 수를 줄이는 것이 근본적 해법이라고 말한다.    들개떼가 거리를 활보하고 있는 모습. /인천 계양구 제공  동물보호법은 ‘반려견법’?… 들개 사고 막을 법 없어 지자체 자구책만        현행 동물보호법은 개물림 사고를 방지하기 위해 생후 3개월 이상인 맹견은 외출 시 목줄과 입마개 등 안전장치를 하거나 탈출을 방지할 수 있는 이동장치를 하도록 규정하고 있다. 이 개들은 어린이집·유치원·초등학교·특수학교 등에는 출입할 수 없으며 견주들은 정기적으로 교육을 받아야 한다. 위 조항들을 어기거나 맹견을 유기할 시 300만원 이하의 과태료가 부과된다.그러나 이 규정들은 보호자가 있는 반려견에 대한 관리 의무일 뿐이라 동물보호법에 따라 들개 사고를 예방하는 데는 별다른 실효성이 없다.설령 동물보호법에 ‘주인 없는 맹견’에 대한 규제와 처분 조항을 추가한다고 해도 무용지물이다. 대부분의 들개 사고는 토종 잡종견 등에 의해 발생하고 있지만, 동물보호법은 로트와일러, 도사견, 아메리칸 핏불테리어, 아메리칸 스태퍼드셔 테리어, 스태퍼드셔 불테리어 등 다섯 종, 그리고 이들과의 잡종견만 ‘맹견’으로 구분하고 있기 때문이다.    제주시의 한 목장 앞에 들개 세 마리가 있다. /제주시 제공        들개 사고가 잇따라 도마에 오르자 자구책을 강구하던 지방자치단체들은 들개 사고를 막겠다며 대대적인 ‘들개 포획 작업’에 나섰다. 남양주시를 비롯해 파주, 전북 전주시, 인천시 등은 들개 포획단을 꾸리거나, 들개를 잡아오는 시민에게 수십만원의 포상금을 주는 등 대책을 내놨다.그러나 실제 예방 효과를 거둘 수 있을지는 미지수다. 남양주시는 지난달 사고 이후 들개 출목지역에 포획틀을 설치했지만 일주일 동안 잡힌 들개는 강아지 2~3마리가 전부인 것으로 전해졌다. 한 지자체 동물보호센터 관계자는 “이같은 방법의 들개 포획이 사고 예방에 얼마나 큰 효과가 있을지 모르겠다”며 “오히려 포상금제를 실시할 경우 유실견을 잡아가거나 자신의 반려견마저 데려가 포상금을 타는 등 부작용이 생길까 우려된다”고 말했다. 사고견 안락사가 답?… 아무도 책임지지 않는 들개 사고        이미 발생한 들개 사고를 어떻게 처리할 지에 대해서도 현행 법에서는 허점이 많다. 사고견이 보호자가 있다면 견주에 대해 민·형사상 책임을 물을 수 있지만, 견주가 없는 경우 ‘야생동물에 의한 단순 사고’로 간주되기 때문이다. 현행법에도 사고견 처분에 대한 조항은 명시돼있지 않다. 이 때문에 사고의 책임소재는 물론 사고견을 어떻게 처리할 지마저도 논의하기 어려운 상황이다.    경기북부경찰청 제공        지난달 경기 남양주에서는 주인 없는 개가 사람을 물어 숨지게 한 사고가 발생했지만, 아직까지 사고견의 견주를 찾지 못한 탓에 이러지도 저러지도 못하는 상황이다. 사고견은 한 달가량 시 유기동물보호소에 머무르다 최근 다시 경찰에 인계돼 증거물로 관리받고 있다. 사고견은 건강한 상태로 애견호텔에 머물고 있는 것으로 알려졌다.이에 일각에서는 “사람을 문 개는 반드시 안락사해야 한다”는 주장이 나온다. 강형욱 동물훈련사는 지난달 남양주 개물림 사고에 대해 “훈련사로서는 ‘훈련으로 교화될 수 있다’고 이야기해야 된다고 생각한다”면서도 “제가 책임이 있는 직책에 있는 사람이라면 안락사 시킬 거라고 강하게 표현할 것 같다”고 말했다.그러나 동물보호단체들은 “안락사는 함부로 결정할 일이 아니다”라며 ‘기질평가제’를 도입해야 한다고 주장하고 있다. 물림 사고가 사고견의 태생적인 공격기질에서 비롯한 것인지, 자기 방어 차원이었는지를 먼저 평가하자는 것이다.    소방구조대가 들개를 포획하고 있다. /제주소방본부 제공        조희경 동물자유연대 대표는 “들개라고 해서 다 사람을 공격하지는 않는다. 사고견의 공격성이 기질에서 비롯한 건지 당시 특수한 상황이 있었던 것인지를 점검하는 게 우선이라고 본다”며 “사고견이라고 해도 공격성을 반복적으로 보이지 않는다면 안락사할 이유가 없다”고 말했다.동물보호단체들에 따르면 미국과 독일, 영국 등 국가에서는 개가 사람을 물어 다치거나 숨지게 할 경우, 기질평가를 거친 뒤 안락사 여부를 결정하는 것으로 알려졌다. 농림축산식품부는 용역연구 결과를 토대로 사고견 등을 대상으로 공격성을 평가하도록 하는 등의 제도 개선을 추진하고 있다.전문가들은 들개 피해를 줄이기 위해선 근본적으로 유기·유실견을 줄여나가는 것이 해법이라고 입을 모았다. 조 대표는 “들개 사고는 결국 사람이 개를 버리거나 방치한 결과”라며 “중장기적인 안목으로 봤을 때 반려견을 방치하지 않도록 하는 등 반려동물 양육 기준을 강력하게 권고하도록 법을 정비해야 한다”고 말했다.그러면서 “이미 방치된 개라면 적어도 무분별한 번식만은 막아야 한다”며 “마당개, 떠돌이개 등에 대한 정부와 지자체의 중성화 수술 지원을 정책화 하는 것이 중요하다”고 했다. ]","['자기부모가 저런개한테 물려서 사고나도\n저런애기 할까?', '조희경님은 본인 가족이 들개한테 당한 다음에도 같은 말 하는지 봅시다. 동물은 언제 어떻게 돌별할 줄 모른다. 한번 입질한 개는 또 다시 입질하게 되어 있다. 동물연대 니들이 전국에 있는 들개들 잡아다가 키울거 아니면... 아닥하고 있어라.', '포획보다 인간들부터  정신세계를 고쳐야지 ㅠㅠ', '저 개들을 버린 주인도 개들을버리기전까진 애견인이였는데...', '이런것들이  얼마나 행정력 낭비입니까?', '동물보호단체놈들 안방에 풀어라...아님 보신탕집에서 도살 허용하던가', '들개들은 전부 안락사가 답이다. 그 전에 유기견 방지를 위해 반려견 가격을 지금에 10배로 올리고, 등록제와 법을 강화해야 함.', '동물자유연대 가족들이 물려서 유명을 달리해도 저리 말할까?', '키울라면 끝까지 키우지 못된 인간들..  들개로 만들어 버렸구나.. ㅜㅜ', '인간들이 개를 못키우게 하자. 허가받은 사람만 키울 수 있게 해야한다. 동물농장만 보고 심심풀이로 아무 생각없이 키우다 버리니.. 방송에서 동물에 대한 환상같은 모습은 그만 내보내고 함부로 못키우게 해야한다', '들개욕하지마라 사람들이 버려서 저렇게된거다 인간들이 정말 나쁘다 평생책임못질꺼면 키우지마 제발', '사람이 물려죽는데 대처를한게 당연하지 인간들아~~동물이 먼저냐~!!!', '', '바로 이런 들개들을 잡아다 허가해서보신탕을 만들어 먹으면 들개들의  개체수도 줄고 보신탕 먹고싶은 사람들도 편하게 먹을수 있고 일거양득이 될수있다. 들개들 잡아서 보신탕 해먹자', '동물단체가 제일 문제여', '사람을 문개는 당연히 안락사시키고  주인없는 들개역시 안락사가 답이다  만약 그걸 반대하는 사람들이 있다면 그들한테 한마리씩 분양해라', '', '올레길 걷다가 들개한테 물려 죽을뻔', '포획 해야 한다.북한산 주변 들개들 보면 갑론 을박 할 시간이 없다.사람들을 전혀 무서워 하지 않는다.', '잉? 잘 하는거 있자나요  ㅋㅋ 편가르기! 국민들 남, 녀, 노, 소 편가르고 싸우게 해서 힘빼고 나라 망치는거에 관심 못 가지게 하는 것 처럼  개들끼리 싸움을 붙이는거지!ㅋㅋㅋ', '문재인의ㅈ애견정책이  빚은 결과물..', '들개는    맛도  좋다.  무조건  보신탕 집에  넘겨라 .   씨가 마를 것이다.', '반려견이라  키우시는분들 사람하고 똑같이 세금도내고 족보에도 올려야하는거 아닌가', '걍 안락사 시켜라 혹여나 내자식 물릴까무섭다', '', '', '동물자유연대 쳐돌앗네 사람이 물려죽었는데 전후사정 따져보래 ㅋㅋ 웃음도아깝네 저런단체에 기부하는사람 정상맞지?', '', '동물연대 사기친 그 여자 아직도 사기 치고 다니나요?', '개 불쌍ㅠ', '버리는 새키들 잡아넣는 법도 만들고 대책 강구해야지 밑빠진 독에 물 부어봐야 참?', '가스총으로 비비탄 쏘는 동호인들한테 들개 사냥을 허락 하면 국비 안 들이고 1년 안에 전국에 있는 들개가 전멸 한다 ㅋㅋ', '', '그냥 개고기 합법화 하면 개장수들이 알아서 다 잡아갈건데...', '', '개빠, 캣맘충 들은 좀 정신이상자같음', '들개들 다 잡아다 동물 보호단체에 보내라 지들이 키우게 들개에게 사랑이 물리면 치료비도 내고', '사람을 물어 다치거나 숨지게했을때 기질평가를 해서 안락사를 결정한다...짐승한테도 그러한데 앞으로는 사람간의 폭행이나 살인도 피해결과등은 고려하지않고 가해자의 기질평가를하여 유무죄를 구형하는게 사리에 맞는듯.', '', '', '아이는 낙태는 합법이고 안락사는 불법인 이상한나라', '공무원들 내놓은 방법이 잡아오면 포상금이라니...원인을 파악하고 대책을 세워야지......', '개들을 사랑하고 가족같다는걸 안다. 하지만 그만큼 가족같다 생각하면 끝까지 책임져라', '한쿡도 동남아 다 됐어. 동남아 가면 맨날 개물림 사고 조심하라고 문자 오는데;;', '동물보호단체를 지지합니다. 생명은 소중하니 들개는 전자칩을 심어서 보호단체로 위임하고 문제가 생기는 건 보호단체가 책임지도록 하면 되니까요. 동물이 한건 소유주가 한 것으로 간주하는 법도 제정하고 말이죠. 논란을 잠재울 수 있는 방법들은 많답니다.', '', '개시장을 활성화 시키면 저런것들 단숨에 없어질텐데', '요즘 개장수아재들이 사라져서 들개들이 난립하는듯 ㅉㅉ', '', '보신탕을 합법화 해라. 체계적으로 위생관리되는 식재료로 인정한다면 들개들이 남아나겠냐. 아마 싹 쓸어갈거다', '다 잡아다가 보호단체사무실에 풀어라', '', '', '고양이도 안락사 시켜라', '', '', '']",https://www.seoul.co.kr/news/newsView.php?id=20210622500137&wlog_tag3=naver,https://n.news.naver.com/mnews/article/366/0000737909?sid=102
2021.06.17.,오마이뉴스,,안락사 직전까지 갔던 강아지가 저를 살렸습니다,,,http://www.ohmynews.com/NWS_Web/View/at_pg.aspx?CNTN_CD=A0002752187&CMPT_CD=P0010&utm_source=naver&utm_medium=newsearch&utm_campaign=naver_news,https://www.seoul.co.kr
2021-06-22 17:41:04,한국일보,사회,"佛서 안락사 합법화 요구해온 불치병 환자, 결국 스위스서 영면","[     경기 남양주에서 50대 여성이 대형견에 물려 숨진 사고와 관련해 경찰이 지난 23일 오전 개를 마취한 뒤 조사하고 있다. 연합뉴스경찰 증거물로 관리…보호장소 비공개지난달 경기 남양주시 진건읍 야산 입구에서 50대 여성을 물어 숨지게 한 대형견이 남양주시 유기동물보호소를 떠났다.22일 경찰과 남양주시 등에 따르면 경찰은 지난 14일 남양주시 유기동물보호소에 머물고 있는 사고견을 다시 인수해달라는 남양주시의 요청을 받고 사고견을 넘겨받은 것으로 전해졌다.시는 사고견이 분실이나 입양 등을 위한 임시보호 상태가 아니어서 지속적인 보호가 어려운데다, 동물보호단체의 민원이 계속되고 있어 더 이상 정상적인 보호 조치가 어렵다고 판단한 것으로 알려졌다.남양주시에 따르면 대형견이 포획된 이후 각종 동물보호단체를 중심으로 안락사에 반대하는 민원이 이어지고 있다.일부 동물단체는 “개를 맡겨주면 교화하겠다”는 제안을 한 것으로 알려졌다. 반면 사고의 위험성이 크다며 반드시 안락사해야 한다는 민원도 빗발치고 있다.피해자의 유족은 안락사에 반대하는 일부 동물단체의 의견에 반발하며 안락사를 원하는 것으로 알려졌다.해당 사고견은 견주 확인 등 관련 수사가 종결돼 지자체에 인계되기 전까지는 경찰의 증거물로 관리를 받는다.일단 경찰은 사고견을 애견호텔에 머물도록 조치했으며, 관련 민원 발생을 우려해 보호장소는 공개하지 않는다는 방침이다.경찰 관계자는 “사고견은 건강한 상태로 호텔에 머물고 있다”며 “사고 수사와 관련해서는 다양한 방법을 시도해보고 있으나, 크게 달라진 것은 없다”고 밝혔다.    경찰이 50대 여성을 물어 숨지게 한 ‘살인견’ 주인을 찾기 위해 유인물 배포했다. 남양주북부경찰서 제공‘견주’ 찾을 때까지 안락사시키지는 않을 방침남양주시와 경찰은 ‘견주’를 찾을 때까지 이 개를 안락사시키지는 않을 방침이다. 유족도 ‘견주’를 찾아달라고 호소하는 것으로 전해졌다.향후 개 주인을 찾는 등 수사가 마무리되면 이 개의 처분 방식이 본격적으로 논의될 예정이다.앞서 지난 5월22일 오후 3시 25분쯤 남양주시 진건읍 사능리 야산 입구에서 피를 흘린 채 쓰러져 있는 A씨(59·여)를 행인이 발견해 119에 신고했다.목 등을 개에 물린 A씨는 심폐 소생술을 받으며 병원으로 옮겨졌지만 결국 숨졌다. A씨는 이날 지인을 만나러 이 지역을 방문했다가 혼자 있는 도중 변을 당한 것으로 파악됐다.부검 결과 A씨의 사인은 과다출혈로 인한 쇼크로 파악됐다.119대원들은 A씨를 공격한 것으로 보이는 대형견을 인근에서 발견해 마취총을 쏴 포획했다.경찰은 사고 현장 인근 폐쇄회로(CC)TV 조사를 통해 대형견이 A씨를 공격하는 장면을 포착했다.한편 해당 개는 몸길이 150㎝, 무게 30㎏ 정도이며, 사모예드와 풍산개의 잡종견이라는 전문가의 소견이 나왔다.김채현 기자 chkim@seoul.co.kr▶ 우리가 몰랐던 군사, 술, 우주이야기 클릭!   ▶ 네이버에서 서울신문 구독하세요  ▶ [나우뉴스] 세상에 이런 일이ⓒ 서울신문(www.seoul.co.kr), 무단전재 및 재배포금지   ]","['보호단체 민원인들 목한번 물리고 넘기는건 어때', '', '나도 애견인이지만 안락사 시켜야 합니다  돌아가신 피해자와 유족을 생각해서라도 그게 맞는 선택일겁니다', '동물단체 인간들아. 너희 엄마 물어 죽인 개 교화해서 키우고 싶겠냐', '사람을죽인 개를 살리는 이유가 개가 사람보다 가치 있다는건가? 사고 견은  안락사 시켜야지', '참내 너그  부모 자식이 물려 죽엇어도 교화시킨다 할래? 이런개는 안락사도  아깝고 보시탕집으로 넘겨야헌다~~~', '', '미국 같으면 주인바로 앞에서 사살이다 아무리 주인이 애원해도 인명피해주는 동물은 예외없이 현장사살을 기본법으로 바꾸는게 맞다', '사람이 물려 죽었는데 뭐가 어째? 안락사 반대, 교화하겠다? 동물보호단체인지 생각이 동물 수준이로구나!', '나라가 어떻게 돌아가는건지...\n그자리에서 사살했어도 모자를판에..\n인간의 생명보다 소중한건 없습니다', '아니 아직 안락사안시킴?', '인도 아프리카에서도 야생 호랑이 사자가 한번 인명피해를 내면 끝까지 찾아가서 살처분 시킨다. 한 번 사람 습격하는 맛을 들였으면 결국 언제 또 사람을 만만하게 보고 죽이려들지 모르거든? 개라고 다를까?', '이러다 동물 피고인으로 앉혀놓고 재판하겄수. 피고인 마지막으로 할말 없으십니까? 멍! 헥헥헥', '귀여운 동물만 보호하는 단체의 감성팔이에 극혐. \n민원넣고 일부러 시끄럽게하는 중이군요..\n그러면서 정작 사람에게 피해도 안주고 죽임을 당하는  착한 소 돼지 닭은 지들 키우는 개 입에 쳐넣으면서 아무렇지도 않고 개랑 고양이만 지들 꼴리는대로 귀여우니까 살려내라~~', '강아지하고 개는 틀리다\n\n같이 생각하면 안 됩니다\n\n사람이 죽었는데', '', '많이 야위었다면..아이를 많이 학대한것 같은데요ㅠㅠ\n주인을 사형시키시는건 어떨까요?', '견주가 나타나겠냐', '사람이나 개나 잘 안고쳐짐.\n\n강형욱프로에나오는  모습.\n여러번해서 한번된 모습.극적교화처럼 내보내는경우가  다반사일것이라고 봄.\n내가 강아지보면 잘 안고져짐.', '', '사람 무는 개는 된장 발라야지.', '된장으로 몸보신이 최고인듯?', '', '', '사람을 죽인 동물인데 교화~?, 너희들 가족을 죽인 동물을 먼저 교화시켜라~. 세상 사는데 넘지 말아야 할 선이란게 있지 않은가 ?, 교화한다고 생명존중하는거 아니라고 본다. 너희들 자식 죽인 동물도 교화하고, 동물에 대한 교화가 뭔지 묻고 싶다.', '인간에게 이빨 들이 민 4족 동물은 오장육부를 꺼대 다 식량으로 써야하는거야 애완동물은 사람에게 꼬리를 내릴경우나 애완동물이고  이빨을 들이밀면 죽여야지', '사람을 문 개는 반드시 또 물게 되어 있습니다. 안락사 시키는게 답입니다. 피해자를 위해서, 그리고 또다른 피해자를 발생시키지 않기 위해서입니다.', '설마 내가 낸 세금이 저딴 곳에 들어가나? 개 키우는 사람들 한테 동물복지세 따로 거둬들여라.', '사람 교화시키기도 어려운데 말안통하는 개를 어떻게 교화시킨담.', '애견호텔 ㅋㅋㅋㅋㅋ 세금참뭣같이 쓰네', '저 개도 어찌보면 불쌍타. 유기 한 인간을 찾아내서 안락사 시켜야 함.', '', '반드시 목을 메달아서 된장을 발라라', '견주가 나타날까요?\n자기들 가족중 누군가에게 개물림 사망사고가 발생해도 교화 된다고... 교화시켜야 한다고 말할 수 있습니까?', '동물보호소 풀어줬다고? 참나 동물살인소같아요 ㅡㅡ', '저개의 주인이 있다 해도... 나오겟냐  이런시점에서?', '에스비에스 신동엽엠씨  일요일 오전에하는 동물농장에서 심도있게 다루어주면 좋겠습니다.  개주인찾아주는거 잘 하잔아요.', '사람이죽었는데 진짜 개빠들 정신나갔나보네\n동물이그렇게 좋으면 동물하고살아라\n본인어머니가 처참하게 물려죽어도 이런소리가 나올지', '', '', '개충이 새끼들! 다 개에 물려 뒈졌으면 좋겠네.', '니들이 데려다 키우라 주딩이나분거리지 말고', '사람 목숨보다 개아기 목숨이 중요하다고 생각하는 좌빨 민간단체들..', '', '교화시티겠다는놈 개 대신 두손 두발 죄갚 내놔라 그리고 교화시키던 말던해라 \n유가족에게 다시는 이따위말 하지마라', '', '', '미쳐돌아가는구나 살인한 개를 보호하자고', '', '동물권이 중요해서 저 개를 살려주면 죽은 사람 억울함은 어떡할건데?? 미친게이들아', '동물단체여  조두순이도 교화시키세요', '사람까지 죽였는데 당연히 안락사 하는게 맞지!!유가족은 얼마나 힘들까...', '감정으로 다가서면 죽어야하고', '뭐가 됐든 사람 죽인 개는 안락사 시켜야지 ㅡㅡ', '무조건 안락사 시켜라', '사람도 사람죽이면 감빵가는데 ㅋㅋㅋㅋㅋ 개가 천룡인이냐 ㅋㅋㅋ', '', '개 끌고 다녀봐라 개가 지집 알잔아 글구서 안락사시켜라 동물단체 지들이 물려 디져봐야아냐', '', '보호단체  인간들과 개를 한 우리에 가두어라\n말종들', '', '', '', '안락사 시켜라  동물단체 생명소중하지  그개가 살인개야  안락사 시켜야지', '보호단체에 맡기세요 조항을 넣어야죠  사고발생시 동물단체 해산하기로.', '안락사는 무슨  몽둥이로  패죽여야지', '그래 저 개는 살려주고 니들 부모를 안락사 시키자 동물 보호충들아', '고양이가 주인의 사체을 먹은 사건에서도 굶주린 고양이를 안타까워하는 인간들 많더라...에효~', '강아지도 생명체다\n안락사 시킬거면 인간말종 범죄자들 세금으로 밥쳐먹이지말고 사형제도부터 진행해라', '그럼 살인범들은 왜 안락사 안시킴?', '', '', '개가 주인 없을때 사람 물면 이미 통제 불능이라는 뜻이다. 경비견도 아니고...', '', '개가 무슨 죄냐 ㅜ솔직히..돌아가신분은 안됐지만..저 개  죽인다고 살아돌아오시는것도 아니고. 내가 유족이라면 저 개죽이는게 더 살면서 후회될것 같다 차라리 견주처벌을 법으로 만들어서 개 버리는 짓을 못하도록 하면 좋겠다..']",https://hankookilbo.com/News/Read/A2021061608560002407?did=NA,https://n.news.naver.com/mnews/article/081/0003196051?sid=102
2021.06.12.,인사이트,,'비인두암' 걸려 괴로워 하는 반려견 위해 안락사 결정한 주인이 준비한 '마지...,,,https://www.insight.co.kr/news/343170,http://www.ohmynews.com/
