Date,Press,Category,Title,Content,Comment,URL_Origin,URL_Naver
2022.05.04.,이데일리,,"이케아 코리아, 아동 쉼터 주거 환경 개선 돕는다",,,http://www.edaily.co.kr/news/newspath.asp?newsid=03011046632325640,http://www.sportsseoul.com/
2022.05.11.,국제뉴스,,"경주시, 환경미화원 6명 공개 채용",,,https://www.gukjenews.com/news/articleView.html?idxno=2465832,http://www.gukjenews.com/
2022.05.04.,이데일리,,"이케아 코리아, 아동 쉼터 주거 환경 개선 돕는다",,,http://www.edaily.co.kr/news/newspath.asp?newsid=03011046632325640,http://www.edaily.co.kr/
2022-05-04 15:43:01,남도일보,경제,"[김동환 전남도교육감 후보]""무너진 전남 교육 환경 확 바꾸겠다""","[ NGO 세이브더칠드런에 2억 6500만원 기부전국 50개 아동 쉼터 홈퍼니싱 솔루션·제품 지원[이데일리 함지현 기자] 이케아 코리아는 학대 피해 및 보호 대상 아동들에게 더 안전하고 편안한 공간을 제공하기 위해 아동 쉼터 주거 환경 개선을 지원한다고 4일 밝혔다.    (사진=이케아 코리아)이케아 코리아에 따르면 아동 쉼터 주거 환경 개선 사업은 코로나19 이후 학대, 빈곤, 보호자 부재 등으로 공동생활시설에 머무는 아동이 증가함에 따라 우리의 미래인 아이들이 더 나은 환경에서 심신의 안정을 찾고 건강하게 성장할 수 있도록 돕기 위해 마련됐다.이를 위해 이케아 코리아는 국제아동권리 NGO 세이브더칠드런과 ‘쉼터 주거 환경 개선 사업을 위한 업무 협약’을 체결하고 2억 6500만원을 기부했다. 뿐만 아니라 총 50개 아동 쉼터 공간 개선을 위한 홈퍼니싱 솔루션과 제품을 지원한다. 학대피해아동쉼터, 여성아동청소년그룹홈 등 시설에 거주하는 아이들이 더욱 쾌적한 공간에서 지낼 수 있도록 학습 공간, 심리 치료 공간, 휴게 공간 등의 노후화된 가구를 교체할 계획이다.이케아 코리아는 아이들이 행복하게 성장할 수 있도록 다양한 노력을 기울이고 있다. 지난 2017년부터 한국여성재단과 함께 양육미혼모의 정서적··회적 자립 및 건강하고 지속가능한 자녀 양육 환경 조성을 위한 ‘맘업 프로젝트(Mom-Up Project)’를 진행하고 있다. 지난 2018년부터는 놀이를 통한 아이들의 성장 및 발달 기회 제공을 위해 세이브더칠드런의 놀 권리 보장을 위한 캠페인 ‘놀이터를 지켜라’를 후원하고 놀이 공간 개선에 힘써왔다.프레드릭 요한손 이케아 코리아 대표는 “이번 사업을 통해 코로나19 이후 힘든 시간을 보내고 있는 아이들이 마음 편히 집이라 부를 수 있는 공간에서 일상을 회복하고 성장해 나가기를 바란다”며 “이케아는 앞으로도 많은 사람들의 건강하고 지속가능한 집에서의 생활을 적극적으로 지원하고 지역 사회에 긍정적인 영향력을 전파할 수 있도록 노력하겠다”고 말했다. ]",[],http://www.namdonews.com/news/articleView.html?idxno=682543,https://n.news.naver.com/mnews/article/018/0005207804?sid=101
2022.05.10.,위키트리,,"고양시, 함께 배우며 성장하는 평생교육환경 마련",,,https://www.wikitree.co.kr/articles/754596,http://www.namdonews.com
2022.05.17.,충청매일,,"천안시, 지속가능한 농업 환경조성을 위한 '농민수당 접수'",,,http://www.ccdn.co.kr/news/articleView.html?idxno=760187,http://www.wikitree.co.kr
2022.05.16.,중부일보,,"고양시, 도시재생 뉴딜사업지역 거주 취약계층 대상 집수리 지원 사업 추진",,,http://www.joongboo.com/news/articleView.html?idxno=363541266,http://www.ccdn.co.kr
2022.05.19.,기호일보,,"양주경찰서-서울우유-자원봉사센터, 치안강화·범죄환경 개선 사업공동추진 '...",,,http://www.kihoilbo.co.kr/news/articleView.html?idxno=980135,http://www.joongboo.com
2022.05.07.,고양신문,,"고양동, 취약계층에 쾌적한 환경 제공",,,http://www.mygoyang.com/news/articleView.html?idxno=67917,http://www.kihoilbo.co.kr/
2022.05.20.,여성소비자신문,,윤석열 정부 복지정책 발표...'맞춤형 복지 및 상생 근로환경' 목표,,,http://www.wsobi.com/news/articleView.html?idxno=162737,http://www.mygoyang.com
2022.05.18.,농수축산신문,,'지속가능한 농어업 환경조성'…농어민수당 신청하세요,,,http://www.aflnews.co.kr/news/articleView.html?idxno=226638,http://www.wsobi.com
2022.05.18.,농수축산신문,,'지속가능한 농어업 환경조성'…농어민수당 신청하세요,,,http://www.aflnews.co.kr/news/articleView.html?idxno=226638,http://www.aflnews.co.kr
2022.05.19.,스마트에프엔,,"영산강유역환경청, 찾아가는 토지매수 현장민원실 운영",,,http://www.smartfn.co.kr/view.php?ud=20220519100740576002c37af707_46,http://www.smartfn.co.kr
2022.05.05.,아주경제,,"""소규모 재건축, 실거주 조합원 지위 양도 가능""...국토부, 13건 규제 혁신",,,https://www.ajunews.com/view/20220505110803891,http://www.ajunews.com
2022.05.13.,내일신문,,노인 지역거주 위한 방문형 의료 확충,,,http://www.naeil.com/news_view/?id_art=423164,http://www.naeil.com
2022.05.19.,투데이신문,,"경실련 ""전국서 고시원 등 '주택 외 거주' 노인·청년 증가…개선 시급""",,,http://www.ntoday.co.kr/news/articleView.html?idxno=92088,http://www.ntoday.co.kr
2022.05.06.,매일경제,,"""소규모 정비사업 조합원 지위 양도 가능""…5년 소유 3년 거주 조건 충족해야",,,http://news.mk.co.kr/newsRead.php?no=401212&year=2022,http://www.mk.co.kr/
2022-05-06 11:05:01,이데일리,경제,"제주도 비싼 택배비 낮아지나…권익위, 제도 개선 권고","[     서울 성북구 정릉동 다세대 밀집지역 [김호영 기자] 앞으로 소유 5년, 실거주 3년 요건을 충족하면 소규모 주택 정비사업 조합원 지위를 양도할 수 있게 된다.6일 국토교통부에 따르면, 1만㎡ 미만 규모로 추진되는 소규모 주택 정비사업에서 실거주자의 조합원 지위 양도가 허용된다. 소규모 주택 정비사업은 '빈집 및 소규모주택 정비에 관한 특례법'에서 정한 절차에 따라 노후·불량건축물의 밀집 등 일정한 요건에 해당하는 지역 또는 가로구역에서 시행하는 사업을 말한다. 단독주택 및 다세대주택 및 연립주택을 스스로 개량·건설하기 위한 사업인 자율주택정비사업과 가로구역에서 종전의 가로를 유지하면서 소규모로 주거환경을 개선하기 위한 가로주택정비사업, 정비기반시설이 양호한 지역에서 소규모로 공동주택을 재건축하기 위한 소규모재건축사업이 있다.올해 초 개정된 소규모주택정비특례법은 투기 방지를 위해 소규모 주택 정비사업 과정에서 조합원 지위를 양도할 수 없도록 금지하고 예외 조항을 관련법 시행령에 위임했다. 대규모 재건축·재개발 사업에 관해 규정한 도시정비법은 조합원 지위를 양도 요건을 '소유 10년·실거주 5년'으로 규정하고 있다.하지만, 규제혁신심의회 및 적극행정위원회는 10년 이상이 걸리는 대규모 정비사업과 달리 사업 기간이 5년 내외에 불과한 소규모 주택 정비사업에서는 투기 방지를 위해 '소유 5년·실거주 3년'이면 충분하다고 보고 시행령에 이를 반영키로 했다.도시재생혁신지구 내 저수익 공익시설을 '공간지원리츠'에 우선 공급할 수 있도록 관련 규제도 완화했다. 공간지원리츠는 도시재생 지역에서 민간사업자가 건설·개량한 시설을 매입해 저렴하게 공급하기 위한 리츠(REITs·부동산투자회사)다.앞서 정부는 재작년에 저수익 공익시설 공급 활성화를 위해 공간지원리츠를 도입했지만, 현행 법규에는 공간지원리츠에 시설을 우선 공급하는 요건이 없어 현장에서는 계획적인 공급·매입이 불가능하다는 목소리가 높았다.아울러 역세권 개발사업 시 앞으로 실시계획 승인 단계에서만 이 절차를 밟으면 되도록 중복 절차가 개선된다. 현행은 개발구역 지정 단계와 실시계획승인 단계에서 각각 지구단위계획 수립과 지방의회 의견청취절차를 거쳐야 한다. ]",['소유 5년+실거주3년 조건은  누가? 매도자? 매수자?'],http://www.edaily.co.kr/news/newspath.asp?newsid=02433766632334496,https://n.news.naver.com/mnews/article/009/0004960037?sid=101
2022.05.18.,아시아엔,,"광동제약 제주 환경정화 프로젝트 ‘주스멍, 도르멍’ 참가자 모집",,,http://kor.theasian.asia/archives/315165,http://www.edaily.co.kr/
2022-05-31 11:43:01,디스커버리뉴스,정치,"인천글로벌캠퍼스, 지구환경지킴이로 발돋움","[ 섬 지역 택배비, 내륙 지역보다 5배 높아깜깜이 정보 탓에 택배사 자의적으로 요금 매겨가격투명성 높이고 관리체제 대선해 가격 하락 유도    이미지투데이[이데일리 정다슬 기자] 앞으로 섬 지역에 과다한 택배비가 부과되지 않도록 가격 투명성이 강화된다. 섬 지역 택배 요금에 대해 정부가 정기적으로 조사에 나서는 한편, 명확한 운임이 산정될 수 있도록 노무·요금 내역을 구체화하는 규정을 마련하도록 했다. 국민권익위원회는 31일 이같은 내용이 담긴 ‘섬 지역 택배비 경감 방안’을 마련해 행정안전부, 국토교통부, 해양수산부, 공정거래위원회 등에 권고했다고 밝혔다. 관할 부처는 권익위의 권고사항을 받아들여 제도 개선에 나설 전망이다.    섬 지역 관리·지원 체계 분절화…통합적인 실태조사 없어현재 대한민국에는 465개 섬에서 70만 8000가구, 150만 9000명의 주민이 거주하고 있다. 최근 코로나19 등으로 섬 지역의 택배 이용이 지속적으로 증가하고 있으나 열악한 생활물류로 내륙지역보다 평균 5배 이상의 추가 배송비가 부과되고 있어 주민들의 불편과 부담이 커지는 상황이다.2021년 제주녹색소비자연대의 실태조사에 따르면 제주권의 경우 추가 배송비는 2091원으로 내륙권 443원에 비해 평균 5배 이상을 부담했다. 권익위는 지난해부터 섬 주민 및 이해관계자 의견청취, 전문가 간담회, 현장 실태조사 등을 실시한 결과 섬 지역의 비싼 택배비에 대한 구조적 문제과 불합리한 관행을 확인했다고 밝혔다. 특히 현재 섬 지역에 대한 관리·지원 체계가 용도 지역과 인구 수에 따라 국토부, 행안부, 해수부 등으로 나뉘어 관리 사각지대가 있었고 거주환경 실태조사 등 체계적인 통계·관리 장치가 없었다고 지적했다. 그 결과 연륙교 연결 여부, 여객선 운항정보, 우체국 배송망 이용 등이 정보가 부재해 택배사, 온라인쇼핑몰사업자 등이 자체 구축한 불명확한 정보를 근거로 섬 지역에 과다한 택배비가 부과됐다는 지적이다.이에 권익위는 섬발전촉진법 등을 개정, 섬 지역에 대한 정기적인 실태조사를 실시해 그 결과를 국가통계로 관리하고 통계정보를 공개하도록 행안부에 권고했다. 이런 통계적 근거를 바탕으로 향후 국토부가 물류취약지역을 지정, 섬 거주민에 생활 물류비용이나 시설비를 지원하는 정책으로 이어질 수 있다는 판단이다.또 국토부에는 섬 지역 택배요금 부과 및 부담 실태에 대한 생활물류서비스 평가항목과 기준을 마련하도록 했다. 이를 통해 소비자의 알권리를 제고, 택배사 간 자율 경쟁을 통해 택배 비용을 낮출 수 있도록 한다.자동화물비 폐지 등 권고…다리 있는 섬에도 도선비 요구 깜깜이 정보는 불합리한 요금 부과로 이어진다.권익위는 대표적인 것으로 자동화물비를 지적했다. 자동화물비는 선박에 차량을 싣고 내리는 하역서비스 제공 대가이다. 그러나 과거 차도선이 없었을 때는 항운노조의 인력으로 선박에 개별 화물을 싣고 내렸으나 현재는 택배차량에 다량의 화물을 실어 산적한다. 때문에 이런 서비스가 더이상 필요치 않은 데도 관행적으로 선박운항업자들이 관행적으로 부과하고 있다는 설명이다.권익위는 자동화물비 부과를 폐지하거나 자동화물비를 지불한 고객이 하역서비스를 가시적으로 체감할 수 있도록 해야 한다고 지적했다. 또 항만하역요금이 공정하고 투명한 절차에 따라 결정·인가될 수 있도록 섬 지역 주민 등 이용자 단체에 대한 의견수렴 절차를 마련하고 노무·요금 내역을 공개하라고 권고했다. 택배사들이 다리가 생겨 육지와 연결된 섬 지역에도 선박 이용에 준하는 택배비를 책정·부과하고 있는 현실도 지적됐다. 권익위는 국토부에 내륙과 교량으로 연결된 섬 지역의 추가 배송비 책정·부과 등에 대한 택배사업자 서비스 평가를 정기적으로 실시하고 평가결과를 공표하라고 지적했다. 이 밖에도 권익위는 △바우처 제도 등을 도입해 섬 주민의 생활물류 해상운송비용 지원 △전국적인 실태조사를 통해 물류취약지역을 지정하고 해당 지역의 택배 추가 배송비를 일부 지원 △ 낙도지역에서 택배사업자와 지방자치단체 간 공동 택배 업무를 수행하기 위한 협의체 구성·지원 등을 관계기관에 정책제안 했다. ]",[],http://www.discoverynews.kr/news/articleView.html?idxno=796266,https://n.news.naver.com/mnews/article/018/0005230076?sid=100
2022.05.08.,파이낸셜뉴스,,"부산환경공단, 나홀로 어르신에 어버이날 선물",,,http://www.fnnews.com/news/202205081856025013,http://kor.theasian.asia
2022.05.18.,CNB뉴스,,"광동제약, 제주 환경정화 프로젝트 ‘주스멍 도르멍’ 참가자 모집",,,https://www.cnbnews.com/news/article.html?no=546452,http://www.cnbnews.com
2022.05.08.,파이낸셜뉴스,,"부산환경공단, 나홀로 어르신에 어버이날 선물",,,http://www.fnnews.com/news/202205081856025013,http://www.fnnews.com/
2022-05-08 18:57:02,브레이크뉴스,사회,"성남시 거주 가습기살균제 피해신고자 171명, 사망자 42명","[     안종일 이사장을 비롯한 부산환경공단 임직원들이 어버이날을 앞두고 독거어르신들을 위해 준비한 반찬조리와 선물상자를 전달하면서 기념촬영을 하고 있다. 부산환경공단 제공 부산시 산하 공기업인 부산환경공단(이사장 안종일)은 어버이날을 맞아 홀로 거주하시는 어르신 100가구에 800만원 상당의 선물상자와 직접 조리한 반찬을 전달했다고 8일 밝혔다.   부산환경공단 강변사업소 구내식당에서 안 이사장을 비롯한 임직원 35여명이 어버이날 독거어르신들에게 전달할 반찬을 직접 조리하고 선물상자를 포장했다. 소불고기, 모둠전(오미산적, 동태전, 해물 동그랑땡, 부추전 등), 오징어젓갈 등 정성껏 준비한 반찬과 햇반, 김, 미역국, 참치캔 등 15종의 물품을 넣은 선물상자를 몰운대종합사회복지관과 함께 각 가구로 배달했다.   이번 나눔은 가정의 달을 맞아 외롭게 살아가시는 어르신들에 희망과 응원의 메시지를 전하기 위해 추진됐다.   나눔에 필요한 선물은 지역 전통시장에서 구매해 코로나19로 침체된 소상공인을 도왔다. 물품구매를 위한 금액은 임직원의 기부를 통해 마련했다.   이번 반찬·선물상자 나눔 외에도 공단의 여러 사업소에서 관내 소외계층에 성품을 전달하고 지역 아동을 초청한 환경교육 행사를 추진하는 등 ESG경영활동을 이어갔다.   안 이사장은 ""가정의 달인 5월을 맞아 혼자 사시는 어르신 분들의 쓸쓸함을 따뜻함으로 조금이나마 채워드리기 위해 소박하지만 정성을 담아 준비했다""며 ""앞으로도 어려운 이웃들에게 실질적인 도움을 전해드릴 수 있도록 최선을 다하겠다""고 전했다.   ]",[],http://www.breaknews.com/893993,https://n.news.naver.com/mnews/article/014/0004832554?sid=102
2022.05.31.,파이낸셜뉴스,,"생활치료센터·임시선별검사소, 내일부터 운영 중단",,,http://www.fnnews.com/news/202205311400275699,http://www.breaknews.com
2022.05.17.,기호일보,,"구리시 교문2동, 홀몸노인 가구 방충망 설치 등 주거환경 개선사업",,,http://www.kihoilbo.co.kr/news/articleView.html?idxno=979775,http://www.fnnews.com/
2022-05-31 14:20:05,경향신문,사회,"권익위, 육지보다 5배 비싼 섬 지역 택배비 경감 방안 권고","[ 해외 입국자용 센터 1곳만 제외하고 전국 모든 생활치료센터 폐쇄     전국의 코로나19 생활치료센터 운영 중단을 하루 앞둔 31일 오후 서울의 한 생활치료센터가 철거 중에 있다. 뉴시스 제공 [파이낸셜뉴스]오는 6월 1일부터 코로나19 생활치료센터와 임시선별검사소의 운영이 중단된다.   5월 31일 보건복지부 중앙사고수습본부(중수본)에 따르면 코로나19 경증 확진자의 격리치료를 담당했던 전국 지방자치단체 지정 12개 권역별 생활치료센터가 이날까지만 운영된다.   이에 따라 생활치료센터는 해외에서 입국한 외국인을 위한 중수본 지정 센터 1곳만 제외하고 모두 문을 닫게 된다.   앞서 정부는 재택치료체계가 자리를 잡은 데다 동네 병·의원에서 검사·처방을 담당하게 되자 생활치료센터의 운영을 단계적으로 축소해왔다.   생활치료센터는 코로나19 초기였던 지난 2020년 3월 2일 대구에서 병상 부족 사태를 해결하기 위해 무증상·경증 환자용으로 처음 도입됐다. 독거노인과 고시원 거주자, 셰어하우스 거주자 등 감염병 치료에 취약한 주거 환경에 거주하는 이들이 해당 시설의 주요 이용자였다.   생활치료센터 운영 종료에 따라 발생할 주거취약계층의 의료공백에 대해 방역당국은 긴급돌봄서비스와 별도 시설 내 격리실 운영, 빠른 병상 배정 등의 대책으로 대응한다는 계획이다.   지난 30일 오전 박향 중수본 방역총괄반장은 보건복지부 출입기자단을 대상으로 진행한 백브리핑에서 ""생활치료센터 운영을 종료하더라도 주거 취약계층에 대한 보완책은 지자체별로 마련하도록 했다""고 밝힌 바 있다.   또한 방역당국은 전국의 임시선별검사소도 이날까지만 운영한다. 임시선별검사소도 확진자 수 감소에 따라 단계적으로 줄어 현재 78곳만 남아있다. 이에 6월 1일부터 임시선별검사소는 보건소 선별진료소와 통합 운영된다.  코로나19 확진자가 줄면서 내일(1일)부터 코로나19 생활치료센터와 임시선별검사소 운영이 중단됩니다.   보건복지부에 따르면 전국 12개 권역별 생활치료센터 중 해외에서 입국한 외국인을 위한 센터 1곳만을 남기고 모두 문을 닫게 됩니다.   전국의 임시선별검사소도 오늘(31일)까지 운영하며, 내일부터는 보건소 선별진료소와 통합됩니다. #코로나19 #생활치료센터운영중단 #임시선별검사소운영중단   ]",[],https://www.khan.co.kr/politics/politics-general/article/202205311502001,https://n.news.naver.com/mnews/article/014/0004844873?sid=102
2022.05.18.,경상매일신문,,"상주 계림동 새마을회, 취약계층 주거환경 개선 봉사",,,http://www.ksmnews.co.kr/default/index_view_page.php?idx=379430&part_idx=286,http://www.kihoilbo.co.kr/
2022.05.04.,아주경제,,"이케아, 아동쉼터 주거환경 개선 지원 나선다",,,https://www.ajunews.com/view/20220504081157229,http://www.khan.co.kr/
2022-05-31 15:03:01,연합뉴스,정치,"미, '환경정의' 당국 신설…""취약층 집중되는 환경오염 막는다""","[     서울 여의도 국회 의원회관 로비에 택배상자가 수북이 쌓여 있다. ｜국회사진기자단·경향신문제주도를 비롯한 섬 지역의 택배비 추가 요금 부담이 완화될 것으로 보인다. 국민권익위원회는 31일 육지보다 비싼 섬 지역 택배비의 주요 원인인 추가배송비·자동화물비에 대한 합리적 부과기준 등을 담은 ‘섬 지역 택배비 부담 경감 방안’을 마련해 행정안전부, 국토교통부, 해양수산부, 공정거래위원회 등에 권고했다고 밝혔다.코로나19 사태로 섬 지역의 택배 이용은 지속적으로 증가하고 있지만 육지보다 평균 5배 이상의 추가 배송비가 부과돼왔다. 이에 권익위는 지난해부터 섬 주민 및 이해관계자 의견청취, 전문가 간담회 등을 통해 섬 지역의 높은 택배비에 대한 구조적 문제점과 불합리한 관행을 조사했다. 조사 결과, 지역에 대한 관리·지원체계가 용도지역과 인구수 등에 따라 국토교통부, 행정안전부, 해양수산부로 나뉘어져 있어 관리의 사각지대가 있었고 거주환경 실태조사 등 체계적인 통계·관리 장치가 없었다고 전했다. 또 섬 지역 주민들의 추가 배송비 부담에 대한 면밀한 실태조사가 없어 주민들에게 과다한 택배비가 부과되고 있었다. 선박에 차량을 싣고 내리는 하역서비스 제공 대가인 자동화물비도 법적 근거와 원가산정 기준 없이 하역사업자에 의해 관행적으로 책정·부과돼 섬 주민에게 과도한 물류비용을 청구하는 원인이 됐다. 이에 권익위는 법령상 요금부과 근거가 불분명한 자동화물비 부과를 폐지하거나 하역서비스 제공, 노무·요금내역을 구체화하는 규정을 마련하도록 해양수산부에 권고했다. 또 섬 지역에 대한 정기적인 실태조사를 실시해 그 결과를 국가통계로 관리하고 통계정보를 공개하도록 행정안전부에 권고했다. 국토교통부에는 섬 지역의 택배요금 합리화를 위해 요금부과 및 부담 실태에 대한 정기조사를 실시하고 생활물류서비스 평가항목 및 기준을 마련하라고 권고했다.또 바우처 제도 등을 도입해 섬 주민의 생활물류 해상운송비용 지원, 전국 실태조사를 통한 물류취약지역 지정과 해당지역의 택배 추가 배송비 일부 지원, 낙도지역에서 택배사업자와 지방자치단체 간 공동 택배 업무를 수행하기 위한 협의체 구성·지원 등을 관계기관에 제안했다.이정희 권익위 부위원장은 “이번 제도개선으로 과다한 배송비용을 부담하고 있는 섬 주민들의 택배비 부담이 경감될 것으로 기대한다”고 말했다.   ]",[],https://www.yna.co.kr/view/AKR20220506101200009?input=1195m,https://n.news.naver.com/mnews/article/032/0003150379?sid=100
2022.05.05.,일요신문,,"용인시, 처인구 고림1구역 주거환경개선사업 시작",,,https://ilyo.co.kr/?ac=article_view&entry_id=427910,http://www.ksmnews.co.kr
2022.05.11.,경북신문,,"경주시, 환경미화원 6명 공개 채용",,,http://www.kbsm.net/news/view.php?idx=349323,http://www.kbsm.net
2022.05.09.,여수넷통뉴스,,"농어촌 빈집, 귀농․귀어․귀촌인 거주공간 탈바꿈",,,http://www.netongs.com/news/articleView.html?idxno=308123,http://www.netongs.com/
2022.05.16.,경북일보,,"초록우산 경북아동옹호센터-14개 기관, 기후·해양환경 협력 업무협약 체결",,,http://www.kyongbuk.co.kr/news/articleView.html?idxno=2102082,http://www.kyongbuk.co.kr
2022.05.08.,파이낸셜뉴스,,"부산환경공단, 독거어르신 100가구에 반찬, 선물상자 전달",,,http://www.fnnews.com/news/202205080941351642,http://www.fnnews.com/
